Sheet: Sheet1
A1: id | B1: cityNameCh | C1: AQI | D1: Quality | E1: CO | F1: SO2 | G1: NO2 | H1: O3 | I1: PM10 | J1: PM2p5 | K1: primary_pollutant | L1: time_point | M1: co | N1: so2 | O1: no2 | P1: o3 | Q1: pm10 | R1: pm2.5 | T1: co* | U1: so2* | V1: no2* | W1: o3* | X1: pm10* | Y1: co*2 | Z1: so2*2 | AA1: no2*2 | AB1: o3*2 | AC1: pm10*2 | AD1: pm2.5*2 | AE1: Co（co） | AF1: Co（so2） | AG1: Co（no2） | AH1: Co（o3） | AI1: Co（pm10）
A2: 1514 | B2: 北京 | C2: 99 | D2: 良 | E2: 0.56000000000000005 | F2: 9 | G2: 53 | H2: 45 | I2: 85 | J2: 36 | L2: 2013-05-23T00:00:00.000 | M2: =RC[-8]-R[24]C[-8] -> -0.59499999999999997 | N2: =RC[-8]-R[24]C[-8] -> -18.541666666666668 | O2: =RC[-8]-R[24]C[-8] -> -5.3333333333333357 | P2: =RC[-8]-R[24]C[-8] -> -45.75 | Q2: =RC[-8]-R[24]C[-8] -> -43.541666666666657 | R2: =RC[-8]-R[24]C[-8] -> -29.541666666666671 | T2: =RC[-7]*RC[-2] -> 17.577291666666667 | U2: =RC[-7]*RC[-3] -> 547.7517361111112 | V2: =RC[-7]*RC[-4] -> 157.55555555555566 | W2: =RC[-7]*RC[-5] -> 1351.5312500000002 | X2: =RC[-7]*RC[-6] -> 1286.2934027777776 | Y2: =RC[-12]*RC[-12] -> 0.35402499999999998 | Z2: =RC[-12]*RC[-12] -> 343.79340277777783 | AA2: =RC[-12]*RC[-12] -> 28.444444444444471 | AB2: =RC[-12]*RC[-12] -> 2093.0625 | AC2: =RC[-12]*RC[-12] -> 1895.8767361111102 | AD2: =RC[-12]*RC[-12] -> 872.71006944444468
A3: 1590 | B3: 北京 | C3: 97 | D3: 良 | E3: 0.55000000000000004 | F3: 9 | G3: 54 | H3: 42 | I3: 70 | J3: 34 | L3: 2013-05-23T01:00:00.000 | M3: =RC[-8]-R[23]C[-8] -> -0.60499999999999998 | N3: =RC[-8]-R[23]C[-8] -> -18.541666666666668 | O3: =RC[-8]-R[23]C[-8] -> -4.3333333333333357 | P3: =RC[-8]-R[23]C[-8] -> -48.75 | Q3: =RC[-8]-R[23]C[-8] -> -58.541666666666657 | R3: =RC[-8]-R[23]C[-8] -> -31.541666666666671 | T3: =RC[-7]*RC[-2] -> 19.082708333333336 | U3: =RC[-7]*RC[-3] -> 584.83506944444457 | V3: =RC[-7]*RC[-4] -> 136.68055555555566 | W3: =RC[-7]*RC[-5] -> 1537.6562500000002 | X3: =RC[-7]*RC[-6] -> 1846.5017361111111 | Y3: =RC[-12]*RC[-12] -> 0.36602499999999999 | Z3: =RC[-12]*RC[-12] -> 343.79340277777783 | AA3: =RC[-12]*RC[-12] -> 18.7777777777778 | AB3: =RC[-12]*RC[-12] -> 2376.5625 | AC3: =RC[-12]*RC[-12] -> 3427.1267361111099 | AD3: =RC[-12]*RC[-12] -> 994.87673611111143
A4: 1666 | B4: 北京 | C4: 94 | D4: 良 | E4: 0.54 | F4: 9 | G4: 47 | H4: 43 | I4: 63 | J4: 34 | L4: 2013-05-23T02:00:00.000 | M4: =RC[-8]-R[22]C[-8] -> -0.61499999999999999 | N4: =RC[-8]-R[22]C[-8] -> -18.541666666666668 | O4: =RC[-8]-R[22]C[-8] -> -11.333333333333336 | P4: =RC[-8]-R[22]C[-8] -> -47.75 | Q4: =RC[-8]-R[22]C[-8] -> -65.541666666666657 | R4: =RC[-8]-R[22]C[-8] -> -31.541666666666671 | T4: =RC[-7]*RC[-2] -> 19.398125000000004 | U4: =RC[-7]*RC[-3] -> 584.83506944444457 | V4: =RC[-7]*RC[-4] -> 357.47222222222234 | W4: =RC[-7]*RC[-5] -> 1506.1145833333335 | X4: =RC[-7]*RC[-6] -> 2067.2934027777778 | Y4: =RC[-12]*RC[-12] -> 0.37822499999999998 | Z4: =RC[-12]*RC[-12] -> 343.79340277777783 | AA4: =RC[-12]*RC[-12] -> 128.44444444444449 | AB4: =RC[-12]*RC[-12] -> 2280.0625 | AC4: =RC[-12]*RC[-12] -> 4295.7100694444434 | AD4: =RC[-12]*RC[-12] -> 994.87673611111143
A5: 1742 | B5: 北京 | C5: 92 | D5: 良 | E5: 0.61 | F5: 8 | G5: 44 | H5: 43 | I5: 58 | J5: 32 | L5: 2013-05-23T03:00:00.000 | M5: =RC[-8]-R[21]C[-8] -> -0.54500000000000004 | N5: =RC[-8]-R[21]C[-8] -> -19.541666666666668 | O5: =RC[-8]-R[21]C[-8] -> -14.333333333333336 | P5: =RC[-8]-R[21]C[-8] -> -47.75 | Q5: =RC[-8]-R[21]C[-8] -> -70.541666666666657 | R5: =RC[-8]-R[21]C[-8] -> -33.541666666666671 | T5: =RC[-7]*RC[-2] -> 18.280208333333338 | U5: =RC[-7]*RC[-3] -> 655.46006944444457 | V5: =RC[-7]*RC[-4] -> 480.76388888888903 | W5: =RC[-7]*RC[-5] -> 1601.6145833333335 | X5: =RC[-7]*RC[-6] -> 2366.0850694444443 | Y5: =RC[-12]*RC[-12] -> 0.29702500000000004 | Z5: =RC[-12]*RC[-12] -> 381.87673611111114 | AA5: =RC[-12]*RC[-12] -> 205.44444444444451 | AB5: =RC[-12]*RC[-12] -> 2280.0625 | AC5: =RC[-12]*RC[-12] -> 4976.1267361111095 | AD5: =RC[-12]*RC[-12] -> 1125.0434027777781
A6: 1818 | B6: 北京 | C6: 90 | D6: 良 | E6: 0.52 | F6: 7 | G6: 44 | H6: 41 | I6: 52 | J6: 28 | L6: 2013-05-23T04:00:00.000 | M6: =RC[-8]-R[20]C[-8] -> -0.63500000000000001 | N6: =RC[-8]-R[20]C[-8] -> -20.541666666666668 | O6: =RC[-8]-R[20]C[-8] -> -14.333333333333336 | P6: =RC[-8]-R[20]C[-8] -> -49.75 | Q6: =RC[-8]-R[20]C[-8] -> -76.541666666666657 | R6: =RC[-8]-R[20]C[-8] -> -37.541666666666671 | T6: =RC[-7]*RC[-2] -> 23.838958333333338 | U6: =RC[-7]*RC[-3] -> 771.16840277777794 | V6: =RC[-7]*RC[-4] -> 538.0972222222224 | W6: =RC[-7]*RC[-5] -> 1867.697916666667 | X6: =RC[-7]*RC[-6] -> 2873.5017361111113 | Y6: =RC[-12]*RC[-12] -> 0.403225 | Z6: =RC[-12]*RC[-12] -> 421.96006944444451 | AA6: =RC[-12]*RC[-12] -> 205.44444444444451 | AB6: =RC[-12]*RC[-12] -> 2475.0625 | AC6: =RC[-12]*RC[-12] -> 5858.6267361111095 | AD6: =RC[-12]*RC[-12] -> 1409.3767361111115
A7: 1894 | B7: 北京 | C7: 89 | D7: 良 | E7: 0.56000000000000005 | F7: 8 | G7: 48 | H7: 40 | I7: 50 | J7: 27 | L7: 2013-05-23T05:00:00.000 | M7: =RC[-8]-R[19]C[-8] -> -0.59499999999999997 | N7: =RC[-8]-R[19]C[-8] -> -19.541666666666668 | O7: =RC[-8]-R[19]C[-8] -> -10.333333333333336 | P7: =RC[-8]-R[19]C[-8] -> -50.75 | Q7: =RC[-8]-R[19]C[-8] -> -78.541666666666657 | R7: =RC[-8]-R[19]C[-8] -> -38.541666666666671 | T7: =RC[-7]*RC[-2] -> 22.932291666666668 | U7: =RC[-7]*RC[-3] -> 753.16840277777794 | V7: =RC[-7]*RC[-4] -> 398.26388888888903 | W7: =RC[-7]*RC[-5] -> 1955.9895833333335 | X7: =RC[-7]*RC[-6] -> 3027.1267361111113 | Y7: =RC[-12]*RC[-12] -> 0.35402499999999998 | Z7: =RC[-12]*RC[-12] -> 381.87673611111114 | AA7: =RC[-12]*RC[-12] -> 106.77777777777783 | AB7: =RC[-12]*RC[-12] -> 2575.5625 | AC7: =RC[-12]*RC[-12] -> 6168.7934027777765 | AD7: =RC[-12]*RC[-12] -> 1485.4600694444448
A8: 1970 | B8: 北京 | C8: 88 | D8: 良 | E8: 0.56000000000000005 | F8: 14 | G8: 48 | H8: 39 | I8: 96 | J8: 41 | L8: 2013-05-23T06:00:00.000 | M8: =RC[-8]-R[18]C[-8] -> -0.59499999999999997 | N8: =RC[-8]-R[18]C[-8] -> -13.541666666666668 | O8: =RC[-8]-R[18]C[-8] -> -10.333333333333336 | P8: =RC[-8]-R[18]C[-8] -> -51.75 | Q8: =RC[-8]-R[18]C[-8] -> -32.541666666666657 | R8: =RC[-8]-R[18]C[-8] -> -24.541666666666671 | T8: =RC[-7]*RC[-2] -> 14.60229166666667 | U8: =RC[-7]*RC[-3] -> 332.33506944444451 | V8: =RC[-7]*RC[-4] -> 253.59722222222234 | W8: =RC[-7]*RC[-5] -> 1270.0312500000002 | X8: =RC[-7]*RC[-6] -> 798.62673611111109 | Y8: =RC[-12]*RC[-12] -> 0.35402499999999998 | Z8: =RC[-12]*RC[-12] -> 183.37673611111114 | AA8: =RC[-12]*RC[-12] -> 106.77777777777783 | AB8: =RC[-12]*RC[-12] -> 2678.0625 | AC8: =RC[-12]*RC[-12] -> 1058.9600694444439 | AD8: =RC[-12]*RC[-12] -> 602.29340277777806
A9: 2046 | B9: 北京 | C9: 88 | D9: 良 | E9: 0.64 | F9: 12 | G9: 59 | H9: 26 | I9: 102 | J9: 35 | L9: 2013-05-23T07:00:00.000 | M9: =RC[-8]-R[17]C[-8] -> -0.51500000000000001 | N9: =RC[-8]-R[17]C[-8] -> -15.541666666666668 | O9: =RC[-8]-R[17]C[-8] -> 0.6666666666666643 | P9: =RC[-8]-R[17]C[-8] -> -64.75 | Q9: =RC[-8]-R[17]C[-8] -> -26.541666666666657 | R9: =RC[-8]-R[17]C[-8] -> -30.541666666666671 | T9: =RC[-7]*RC[-2] -> 15.728958333333336 | U9: =RC[-7]*RC[-3] -> 474.66840277777789 | V9: =RC[-7]*RC[-4] -> -20.361111111111043 | W9: =RC[-7]*RC[-5] -> 1977.572916666667 | X9: =RC[-7]*RC[-6] -> 810.62673611111097 | Y9: =RC[-12]*RC[-12] -> 0.26522499999999999 | Z9: =RC[-12]*RC[-12] -> 241.54340277777783 | AA9: =RC[-12]*RC[-12] -> 0.44444444444444131 | AB9: =RC[-12]*RC[-12] -> 4192.5625 | AC9: =RC[-12]*RC[-12] -> 704.46006944444389 | AD9: =RC[-12]*RC[-12] -> 932.79340277777806
A10: 2122 | B10: 北京 | C10: 88 | D10: 良 | E10: 0.7 | F10: 12 | G10: 65 | H10: 19 | I10: 113 | J10: 40 | L10: 2013-05-23T08:00:00.000 | M10: =RC[-8]-R[16]C[-8] -> -0.45500000000000007 | N10: =RC[-8]-R[16]C[-8] -> -15.541666666666668 | O10: =RC[-8]-R[16]C[-8] -> 6.6666666666666643 | P10: =RC[-8]-R[16]C[-8] -> -71.75 | Q10: =RC[-8]-R[16]C[-8] -> -15.541666666666657 | R10: =RC[-8]-R[16]C[-8] -> -25.541666666666671 | T10: =RC[-7]*RC[-2] -> 11.621458333333337 | U10: =RC[-7]*RC[-3] -> 396.96006944444457 | V10: =RC[-7]*RC[-4] -> -170.27777777777774 | W10: =RC[-7]*RC[-5] -> 1832.6145833333337 | X10: =RC[-7]*RC[-6] -> 396.96006944444429 | Y10: =RC[-12]*RC[-12] -> 0.20702500000000007 | Z10: =RC[-12]*RC[-12] -> 241.54340277777783 | AA10: =RC[-12]*RC[-12] -> 44.444444444444414 | AB10: =RC[-12]*RC[-12] -> 5148.0625 | AC10: =RC[-12]*RC[-12] -> 241.54340277777749 | AD10: =RC[-12]*RC[-12] -> 652.37673611111131
A11: 2198 | B11: 北京 | C11: 86 | D11: 良 | E11: 0.64 | F11: 11 | G11: 53 | H11: 37 | I11: 100 | J11: 41 | L11: 2013-05-23T09:00:00.000 | M11: =RC[-8]-R[15]C[-8] -> -0.51500000000000001 | N11: =RC[-8]-R[15]C[-8] -> -16.541666666666668 | O11: =RC[-8]-R[15]C[-8] -> -5.3333333333333357 | P11: =RC[-8]-R[15]C[-8] -> -53.75 | Q11: =RC[-8]-R[15]C[-8] -> -28.541666666666657 | R11: =RC[-8]-R[15]C[-8] -> -24.541666666666671 | T11: =RC[-7]*RC[-2] -> 12.638958333333337 | U11: =RC[-7]*RC[-3] -> 405.96006944444457 | V11: =RC[-7]*RC[-4] -> 130.88888888888897 | W11: =RC[-7]*RC[-5] -> 1319.1145833333335 | X11: =RC[-7]*RC[-6] -> 700.46006944444434 | Y11: =RC[-12]*RC[-12] -> 0.26522499999999999 | Z11: =RC[-12]*RC[-12] -> 273.62673611111114 | AA11: =RC[-12]*RC[-12] -> 28.444444444444471 | AB11: =RC[-12]*RC[-12] -> 2889.0625 | AC11: =RC[-12]*RC[-12] -> 814.62673611111052 | AD11: =RC[-12]*RC[-12] -> 602.29340277777806
A12: 2274 | B12: 北京 | C12: 84 | D12: 良 | E12: 0.64 | F12: 15 | G12: 59 | H12: 52 | I12: 76 | J12: 41 | L12: 2013-05-23T10:00:00.000 | M12: =RC[-8]-R[14]C[-8] -> -0.51500000000000001 | N12: =RC[-8]-R[14]C[-8] -> -12.541666666666668 | O12: =RC[-8]-R[14]C[-8] -> 0.6666666666666643 | P12: =RC[-8]-R[14]C[-8] -> -38.75 | Q12: =RC[-8]-R[14]C[-8] -> -52.541666666666657 | R12: =RC[-8]-R[14]C[-8] -> -24.541666666666671 | T12: =RC[-7]*RC[-2] -> 12.638958333333337 | U12: =RC[-7]*RC[-3] -> 307.79340277777789 | V12: =RC[-7]*RC[-4] -> -16.361111111111057 | W12: =RC[-7]*RC[-5] -> 950.98958333333348 | X12: =RC[-7]*RC[-6] -> 1289.4600694444446 | Y12: =RC[-12]*RC[-12] -> 0.26522499999999999 | Z12: =RC[-12]*RC[-12] -> 157.2934027777778 | AA12: =RC[-12]*RC[-12] -> 0.44444444444444131 | AB12: =RC[-12]*RC[-12] -> 1501.5625 | AC12: =RC[-12]*RC[-12] -> 2760.6267361111099 | AD12: =RC[-12]*RC[-12] -> 602.29340277777806
A13: 2350 | B13: 北京 | C13: 81 | D13: 良 | E13: 0.72 | F13: 20 | G13: 54 | H13: 69 | I13: 82 | J13: 43 | L13: 2013-05-23T11:00:00.000 | M13: =RC[-8]-R[13]C[-8] -> -0.43500000000000005 | N13: =RC[-8]-R[13]C[-8] -> -7.5416666666666679 | O13: =RC[-8]-R[13]C[-8] -> -4.3333333333333357 | P13: =RC[-8]-R[13]C[-8] -> -21.75 | Q13: =RC[-8]-R[13]C[-8] -> -46.541666666666657 | R13: =RC[-8]-R[13]C[-8] -> -22.541666666666671 | T13: =RC[-7]*RC[-2] -> 9.8056250000000027 | U13: =RC[-7]*RC[-3] -> 170.00173611111117 | V13: =RC[-7]*RC[-4] -> 97.680555555555628 | W13: =RC[-7]*RC[-5] -> 490.28125000000011 | X13: =RC[-7]*RC[-6] -> 1049.1267361111111 | Y13: =RC[-12]*RC[-12] -> 0.18922500000000006 | Z13: =RC[-12]*RC[-12] -> 56.876736111111128 | AA13: =RC[-12]*RC[-12] -> 18.7777777777778 | AB13: =RC[-12]*RC[-12] -> 473.0625 | AC13: =RC[-12]*RC[-12] -> 2166.1267361111104 | AD13: =RC[-12]*RC[-12] -> 508.12673611111131
A14: 2426 | B14: 北京 | C14: 79 | D14: 良 | E14: 0.93 | F14: 26 | G14: 51 | H14: 71 | I14: 91 | J14: 51 | L14: 2013-05-23T12:00:00.000 | M14: =RC[-8]-R[12]C[-8] -> -0.22499999999999998 | N14: =RC[-8]-R[12]C[-8] -> -1.5416666666666679 | O14: =RC[-8]-R[12]C[-8] -> -7.3333333333333357 | P14: =RC[-8]-R[12]C[-8] -> -19.75 | Q14: =RC[-8]-R[12]C[-8] -> -37.541666666666657 | R14: =RC[-8]-R[12]C[-8] -> -14.541666666666671 | T14: =RC[-7]*RC[-2] -> 3.2718750000000005 | U14: =RC[-7]*RC[-3] -> 22.418402777777803 | V14: =RC[-7]*RC[-4] -> 106.63888888888896 | W14: =RC[-7]*RC[-5] -> 287.19791666666674 | X14: =RC[-7]*RC[-6] -> 545.91840277777783 | Y14: =RC[-12]*RC[-12] -> 5.0624999999999989E-2 | Z14: =RC[-12]*RC[-12] -> 2.3767361111111147 | AA14: =RC[-12]*RC[-12] -> 53.777777777777814 | AB14: =RC[-12]*RC[-12] -> 390.0625 | AC14: =RC[-12]*RC[-12] -> 1409.3767361111104 | AD14: =RC[-12]*RC[-12] -> 211.46006944444457
A15: 2502 | B15: 北京 | C15: 77 | D15: 良 | E15: 1.06 | F15: 37 | G15: 50 | H15: 99 | I15: 113 | J15: 68 | L15: 2013-05-23T13:00:00.000 | M15: =RC[-8]-R[11]C[-8] -> -9.4999999999999973E-2 | N15: =RC[-8]-R[11]C[-8] -> 9.4583333333333321 | O15: =RC[-8]-R[11]C[-8] -> -8.3333333333333357 | P15: =RC[-8]-R[11]C[-8] -> 8.25 | Q15: =RC[-8]-R[11]C[-8] -> -15.541666666666657 | R15: =RC[-8]-R[11]C[-8] -> 2.4583333333333286 | T15: =RC[-7]*RC[-2] -> -0.23354166666666615 | U15: =RC[-7]*RC[-3] -> 23.251736111111065 | V15: =RC[-7]*RC[-4] -> -20.486111111111079 | W15: =RC[-7]*RC[-5] -> 20.281249999999961 | X15: =RC[-7]*RC[-6] -> -38.206597222222122 | Y15: =RC[-12]*RC[-12] -> 9.0249999999999948E-3 | Z15: =RC[-12]*RC[-12] -> 89.460069444444429 | AA15: =RC[-12]*RC[-12] -> 69.444444444444485 | AB15: =RC[-12]*RC[-12] -> 68.0625 | AC15: =RC[-12]*RC[-12] -> 241.54340277777749 | AD15: =RC[-12]*RC[-12] -> 6.0434027777777546
A16: 2578 | B16: 北京 | C16: 76 | D16: 良 | E16: 1.1200000000000001 | F16: 38 | G16: 47 | H16: 120 | I16: 141 | J16: 57 | L16: 2013-05-23T14:00:00.000 | M16: =RC[-8]-R[10]C[-8] -> -3.499999999999992E-2 | N16: =RC[-8]-R[10]C[-8] -> 10.458333333333332 | O16: =RC[-8]-R[10]C[-8] -> -11.333333333333336 | P16: =RC[-8]-R[10]C[-8] -> 29.25 | Q16: =RC[-8]-R[10]C[-8] -> 12.458333333333343 | R16: =RC[-8]-R[10]C[-8] -> -8.5416666666666714 | T16: =RC[-7]*RC[-2] -> 0.29895833333333283 | U16: =RC[-7]*RC[-3] -> -89.331597222222257 | V16: =RC[-7]*RC[-4] -> 96.805555555555628 | W16: =RC[-7]*RC[-5] -> -249.84375000000014 | X16: =RC[-7]*RC[-6] -> -106.4149305555557 | Y16: =RC[-12]*RC[-12] -> 1.2249999999999943E-3 | Z16: =RC[-12]*RC[-12] -> 109.37673611111109 | AA16: =RC[-12]*RC[-12] -> 128.44444444444449 | AB16: =RC[-12]*RC[-12] -> 855.5625 | AC16: =RC[-12]*RC[-12] -> 155.21006944444468 | AD16: =RC[-12]*RC[-12] -> 72.960069444444528
A17: 2654 | B17: 北京 | C17: 103 | D17: 轻度污染 | E17: 1.62 | F17: 57 | G17: 71 | H17: 142 | I17: 178 | J17: 88 | L17: 2013-05-23T15:00:00.000 | M17: =RC[-8]-R[9]C[-8] -> 0.46500000000000008 | N17: =RC[-8]-R[9]C[-8] -> 29.458333333333332 | O17: =RC[-8]-R[9]C[-8] -> 12.666666666666664 | P17: =RC[-8]-R[9]C[-8] -> 51.25 | Q17: =RC[-8]-R[9]C[-8] -> 49.458333333333343 | R17: =RC[-8]-R[9]C[-8] -> 22.458333333333329 | T17: =RC[-7]*RC[-2] -> 10.443125 | U17: =RC[-7]*RC[-3] -> 661.58506944444423 | V17: =RC[-7]*RC[-4] -> 284.47222222222211 | W17: =RC[-7]*RC[-5] -> 1150.989583333333 | X17: =RC[-7]*RC[-6] -> 1110.7517361111111 | Y17: =RC[-12]*RC[-12] -> 0.21622500000000008 | Z17: =RC[-12]*RC[-12] -> 867.79340277777771 | AA17: =RC[-12]*RC[-12] -> 160.44444444444437 | AB17: =RC[-12]*RC[-12] -> 2626.5625 | AC17: =RC[-12]*RC[-12] -> 2446.1267361111122 | AD17: =RC[-12]*RC[-12] -> 504.37673611111092
A18: 2730 | B18: 北京 | C18: 110 | D18: 轻度污染 | E18: 1.93 | F18: 66 | G18: 63 | H18: 178 | I18: 183 | J18: 106 | L18: 2013-05-23T16:00:00.000 | M18: =RC[-8]-R[8]C[-8] -> 0.77499999999999991 | N18: =RC[-8]-R[8]C[-8] -> 38.458333333333329 | O18: =RC[-8]-R[8]C[-8] -> 4.6666666666666643 | P18: =RC[-8]-R[8]C[-8] -> 87.25 | Q18: =RC[-8]-R[8]C[-8] -> 54.458333333333343 | R18: =RC[-8]-R[8]C[-8] -> 40.458333333333329 | T18: =RC[-7]*RC[-2] -> 31.355208333333326 | U18: =RC[-7]*RC[-3] -> 1555.9600694444441 | V18: =RC[-7]*RC[-4] -> 188.80555555555543 | W18: =RC[-7]*RC[-5] -> 3529.989583333333 | X18: =RC[-7]*RC[-6] -> 2203.2934027777778 | Y18: =RC[-12]*RC[-12] -> 0.60062499999999985 | Z18: =RC[-12]*RC[-12] -> 1479.0434027777774 | AA18: =RC[-12]*RC[-12] -> 21.777777777777757 | AB18: =RC[-12]*RC[-12] -> 7612.5625 | AC18: =RC[-12]*RC[-12] -> 2965.7100694444453 | AD18: =RC[-12]*RC[-12] -> 1636.8767361111106
A19: 2806 | B19: 北京 | C19: 117 | D19: 轻度污染 | E19: 1.99 | F19: 63 | G19: 60 | H19: 199 | I19: 191 | J19: 110 | L19: 2013-05-23T17:00:00.000 | M19: =RC[-8]-R[7]C[-8] -> 0.83499999999999996 | N19: =RC[-8]-R[7]C[-8] -> 35.458333333333329 | O19: =RC[-8]-R[7]C[-8] -> 1.6666666666666643 | P19: =RC[-8]-R[7]C[-8] -> 108.25 | Q19: =RC[-8]-R[7]C[-8] -> 62.458333333333343 | R19: =RC[-8]-R[7]C[-8] -> 44.458333333333329 | T19: =RC[-7]*RC[-2] -> 37.122708333333328 | U19: =RC[-7]*RC[-3] -> 1576.4184027777774 | V19: =RC[-7]*RC[-4] -> 74.097222222222115 | W19: =RC[-7]*RC[-5] -> 4812.614583333333 | X19: =RC[-7]*RC[-6] -> 2776.7934027777778 | Y19: =RC[-12]*RC[-12] -> 0.69722499999999998 | Z19: =RC[-12]*RC[-12] -> 1257.2934027777774 | AA19: =RC[-12]*RC[-12] -> 2.7777777777777697 | AB19: =RC[-12]*RC[-12] -> 11718.0625 | AC19: =RC[-12]*RC[-12] -> 3901.0434027777787 | AD19: =RC[-12]*RC[-12] -> 1976.5434027777774
A20: 2882 | B20: 北京 | C20: 119 | D20: 轻度污染 | E20: 1.75 | F20: 52 | G20: 59 | H20: 202 | I20: 191 | J20: 101 | L20: 2013-05-23T18:00:00.000 | M20: =RC[-8]-R[6]C[-8] -> 0.59499999999999997 | N20: =RC[-8]-R[6]C[-8] -> 24.458333333333332 | O20: =RC[-8]-R[6]C[-8] -> 0.6666666666666643 | P20: =RC[-8]-R[6]C[-8] -> 111.25 | Q20: =RC[-8]-R[6]C[-8] -> 62.458333333333343 | R20: =RC[-8]-R[6]C[-8] -> 35.458333333333329 | T20: =RC[-7]*RC[-2] -> 21.09770833333333 | U20: =RC[-7]*RC[-3] -> 867.25173611111097 | V20: =RC[-7]*RC[-4] -> 23.6388888888888 | W20: =RC[-7]*RC[-5] -> 3944.739583333333 | X20: =RC[-7]*RC[-6] -> 2214.6684027777778 | Y20: =RC[-12]*RC[-12] -> 0.35402499999999998 | Z20: =RC[-12]*RC[-12] -> 598.21006944444434 | AA20: =RC[-12]*RC[-12] -> 0.44444444444444131 | AB20: =RC[-12]*RC[-12] -> 12376.5625 | AC20: =RC[-12]*RC[-12] -> 3901.0434027777787 | AD20: =RC[-12]*RC[-12] -> 1257.2934027777774
A21: 2958 | B21: 北京 | C21: 121 | D21: 轻度污染 | E21: 1.78 | F21: 46 | G21: 57 | H21: 202 | I21: 201 | J21: 106 | L21: 2013-05-23T19:00:00.000 | M21: =RC[-8]-R[5]C[-8] -> 0.625 | N21: =RC[-8]-R[5]C[-8] -> 18.458333333333332 | O21: =RC[-8]-R[5]C[-8] -> -1.3333333333333357 | P21: =RC[-8]-R[5]C[-8] -> 111.25 | Q21: =RC[-8]-R[5]C[-8] -> 72.458333333333343 | R21: =RC[-8]-R[5]C[-8] -> 40.458333333333329 | T21: =RC[-7]*RC[-2] -> 25.286458333333329 | U21: =RC[-7]*RC[-3] -> 746.7934027777776 | V21: =RC[-7]*RC[-4] -> -53.944444444444535 | W21: =RC[-7]*RC[-5] -> 4500.989583333333 | X21: =RC[-7]*RC[-6] -> 2931.5434027777778 | Y21: =RC[-12]*RC[-12] -> 0.390625 | Z21: =RC[-12]*RC[-12] -> 340.7100694444444 | AA21: =RC[-12]*RC[-12] -> 1.7777777777777841 | AB21: =RC[-12]*RC[-12] -> 12376.5625 | AC21: =RC[-12]*RC[-12] -> 5250.2100694444462 | AD21: =RC[-12]*RC[-12] -> 1636.8767361111106
A22: 3034 | B22: 北京 | C22: 121 | D22: 轻度污染 | E22: 2.02 | F22: 42 | G22: 63 | H22: 173 | I22: 197 | J22: 104 | L22: 2013-05-23T20:00:00.000 | M22: =RC[-8]-R[4]C[-8] -> 0.86499999999999999 | N22: =RC[-8]-R[4]C[-8] -> 14.458333333333332 | O22: =RC[-8]-R[4]C[-8] -> 4.6666666666666643 | P22: =RC[-8]-R[4]C[-8] -> 82.25 | Q22: =RC[-8]-R[4]C[-8] -> 68.458333333333343 | R22: =RC[-8]-R[4]C[-8] -> 38.458333333333329 | T22: =RC[-7]*RC[-2] -> 33.266458333333325 | U22: =RC[-7]*RC[-3] -> 556.04340277777771 | V22: =RC[-7]*RC[-4] -> 179.47222222222211 | W22: =RC[-7]*RC[-5] -> 3163.1979166666661 | X22: =RC[-7]*RC[-6] -> 2632.7934027777778 | Y22: =RC[-12]*RC[-12] -> 0.74822500000000003 | Z22: =RC[-12]*RC[-12] -> 209.04340277777774 | AA22: =RC[-12]*RC[-12] -> 21.777777777777757 | AB22: =RC[-12]*RC[-12] -> 6765.0625 | AC22: =RC[-12]*RC[-12] -> 4686.5434027777792 | AD22: =RC[-12]*RC[-12] -> 1479.0434027777774
A23: 3110 | B23: 北京 | C23: 120 | D23: 轻度污染 | E23: 2.09 | F23: 39 | G23: 75 | H23: 136 | I23: 218 | J23: 114 | L23: 2013-05-23T21:00:00.000 | M23: =RC[-8]-R[3]C[-8] -> 0.93499999999999983 | N23: =RC[-8]-R[3]C[-8] -> 11.458333333333332 | O23: =RC[-8]-R[3]C[-8] -> 16.666666666666664 | P23: =RC[-8]-R[3]C[-8] -> 45.25 | Q23: =RC[-8]-R[3]C[-8] -> 89.458333333333343 | R23: =RC[-8]-R[3]C[-8] -> 48.458333333333329 | T23: =RC[-7]*RC[-2] -> 45.308541666666656 | U23: =RC[-7]*RC[-3] -> 555.25173611111097 | V23: =RC[-7]*RC[-4] -> 807.63888888888869 | W23: =RC[-7]*RC[-5] -> 2192.739583333333 | X23: =RC[-7]*RC[-6] -> 4335.0017361111113 | Y23: =RC[-12]*RC[-12] -> 0.8742249999999997 | Z23: =RC[-12]*RC[-12] -> 131.29340277777774 | AA23: =RC[-12]*RC[-12] -> 277.77777777777771 | AB23: =RC[-12]*RC[-12] -> 2047.5625 | AC23: =RC[-12]*RC[-12] -> 8002.7934027777792 | AD23: =RC[-12]*RC[-12] -> 2348.2100694444439
A24: 3186 | B24: 北京 | C24: 120 | D24: 轻度污染 | E24: 2.1 | F24: 32 | G24: 81 | H24: 94 | I24: 219 | J24: 117 | L24: 2013-05-23T22:00:00.000 | M24: =RC[-8]-R[2]C[-8] -> 0.94500000000000006 | N24: =RC[-8]-R[2]C[-8] -> 4.4583333333333321 | O24: =RC[-8]-R[2]C[-8] -> 22.666666666666664 | P24: =RC[-8]-R[2]C[-8] -> 3.25 | Q24: =RC[-8]-R[2]C[-8] -> 90.458333333333343 | R24: =RC[-8]-R[2]C[-8] -> 51.458333333333329 | T24: =RC[-7]*RC[-2] -> 48.628124999999997 | U24: =RC[-7]*RC[-3] -> 229.41840277777769 | V24: =RC[-7]*RC[-4] -> 1166.3888888888887 | W24: =RC[-7]*RC[-5] -> 167.23958333333331 | X24: =RC[-7]*RC[-6] -> 4654.8350694444443 | Y24: =RC[-12]*RC[-12] -> 0.89302500000000007 | Z24: =RC[-12]*RC[-12] -> 19.8767361111111 | AA24: =RC[-12]*RC[-12] -> 513.77777777777771 | AB24: =RC[-12]*RC[-12] -> 10.5625 | AC24: =RC[-12]*RC[-12] -> 8182.7100694444462 | AD24: =RC[-12]*RC[-12] -> 2647.9600694444439
A25: 3262 | B25: 北京 | C25: 119 | D25: 轻度污染 | E25: 2.09 | F25: 29 | G25: 95 | H25: 66 | I25: 215 | J25: 119 | L25: 2013-05-23T23:00:00.000 | M25: =RC[-8]-R[1]C[-8] -> 0.93499999999999983 | N25: =RC[-8]-R[1]C[-8] -> 1.4583333333333321 | O25: =RC[-8]-R[1]C[-8] -> 36.666666666666664 | P25: =RC[-8]-R[1]C[-8] -> -24.75 | Q25: =RC[-8]-R[1]C[-8] -> 86.458333333333343 | R25: =RC[-8]-R[1]C[-8] -> 53.458333333333329 | T25: =RC[-7]*RC[-2] -> 49.983541666666653 | U25: =RC[-7]*RC[-3] -> 77.960069444444372 | V25: =RC[-7]*RC[-4] -> 1960.1388888888887 | W25: =RC[-7]*RC[-5] -> -1323.0937499999998 | X25: =RC[-7]*RC[-6] -> 4621.9184027777783 | Y25: =RC[-12]*RC[-12] -> 0.8742249999999997 | Z25: =RC[-12]*RC[-12] -> 2.1267361111111076 | AA25: =RC[-12]*RC[-12] -> 1344.4444444444443 | AB25: =RC[-12]*RC[-12] -> 612.5625 | AC25: =RC[-12]*RC[-12] -> 7475.0434027777792 | AD25: =RC[-12]*RC[-12] -> 2857.7934027777774
E26: =AVERAGE(R[-24]C:R[-1]C) -> 1.155 | F26: =AVERAGE(R[-24]C:R[-1]C) -> 27.541666666666668 | G26: =AVERAGE(R[-24]C:R[-1]C) -> 58.333333333333336 | H26: =AVERAGE(R[-24]C:R[-1]C) -> 90.75 | I26: =AVERAGE(R[-24]C:R[-1]C) -> 128.54166666666666 | J26: =AVERAGE(R[-24]C:R[-1]C) -> 65.541666666666671 | M26: =RC[-8]-RC[-8] -> 0 | N26: =RC[-8]-RC[-8] -> 0 | O26: =RC[-8]-RC[-8] -> 0 | P26: =RC[-8]-RC[-8] -> 0 | Q26: =RC[-8]-RC[-8] -> 0 | R26: =RC[-8]-RC[-8] -> 0 | T26: =SUM(R[-24]C:R[-1]C) -> 503.97500000000002 | U26: =SUM(R[-24]C:R[-1]C) -> 12767.958333333334 | V26: =SUM(R[-24]C:R[-1]C) -> 7157.6666666666679 | W26: =SUM(R[-24]C:R[-1]C) -> 39858.25 | X26: =SUM(R[-24]C:R[-1]C) -> 46394.958333333336 | Y26: =SUM(R[-24]C:R[-1]C) -> 9.4077999999999999 | Z26: =SUM(R[-24]C:R[-1]C) -> 8477.9583333333339 | AA26: =SUM(R[-24]C:R[-1]C) -> 3489.3333333333339 | AB26: =SUM(R[-24]C:R[-1]C) -> 88422.5 | AC26: =SUM(R[-24]C:R[-1]C) -> 82985.958333333343 | AD26: =SUM(R[-24]C:R[-1]C) -> 27417.958333333336 | AE26: =RC[-11]/SQRT(RC[-6]*RC[-1]) -> 0.99231007175629571 | AF26: =RC[-11]/SQRT(RC[-6]*RC[-2]) -> 0.83744879458338473 | AG26: =RC[-11]/SQRT(RC[-6]*RC[-3]) -> 0.73178361924225055 | AH26: =RC[-11]/SQRT(RC[-6]*RC[-4]) -> 0.80950451603939111 | AI26: =RC[-11]/SQRT(RC[-6]*RC[-5]) -> 0.97263731274284004
A27: 3338 | B27: 北京 | C27: 121 | D27: 轻度污染 | E27: 2.2000000000000002 | F27: 26 | G27: 97 | H27: 52 | I27: 198 | J27: 129 | L27: 2013-05-24T00:00:00.000 | M27: =RC[-8]-R[24]C[-8] -> 0.76208333333333322 | N27: =RC[-8]-R[24]C[-8] -> 5.4583333333333321 | O27: =RC[-8]-R[24]C[-8] -> 38.041666666666664 | P27: =RC[-8]-R[24]C[-8] -> -21.083333333333329 | Q27: =RC[-8]-R[24]C[-8] -> 60.541666666666657 | R27: =RC[-8]-R[24]C[-8] -> 35.416666666666671 | T27: =RC[-7]*RC[-2] -> 26.990451388888889 | U27: =RC[-7]*RC[-3] -> 193.3159722222222 | V27: =RC[-7]*RC[-4] -> 1347.3090277777778 | W27: =RC[-7]*RC[-5] -> -746.7013888888888 | X27: =RC[-7]*RC[-6] -> 2144.1840277777778 | Y27: =RC[-12]*RC[-12] -> 0.58077100694444428 | Z27: =RC[-12]*RC[-12] -> 29.793402777777764 | AA27: =RC[-12]*RC[-12] -> 1447.1684027777776 | AB27: =RC[-12]*RC[-12] -> 444.50694444444423 | AC27: =RC[-12]*RC[-12] -> 3665.2934027777765 | AD27: =RC[-12]*RC[-12] -> 1254.3402777777781 | AE27: =RC[-11]/SQRT(RC[-6]*RC[-1]) -> 1 | AF27: =RC[-11]/SQRT(RC[-6]*RC[-2]) -> 1 | AG27: =RC[-11]/SQRT(RC[-6]*RC[-3]) -> 1 | AH27: =RC[-11]/SQRT(RC[-6]*RC[-4]) -> -1 | AI27: =RC[-11]/SQRT(RC[-6]*RC[-5]) -> 1.0000000000000002
A28: 3414 | B28: 北京 | C28: 126 | D28: 轻度污染 | E28: 2.35 | F28: 25 | G28: 104 | H28: 42 | I28: 243 | J28: 142 | L28: 2013-05-24T01:00:00.000 | M28: =RC[-8]-R[23]C[-8] -> 0.91208333333333313 | N28: =RC[-8]-R[23]C[-8] -> 4.4583333333333321 | O28: =RC[-8]-R[23]C[-8] -> 45.041666666666664 | P28: =RC[-8]-R[23]C[-8] -> -31.083333333333329 | Q28: =RC[-8]-R[23]C[-8] -> 105.54166666666666 | R28: =RC[-8]-R[23]C[-8] -> 48.416666666666671 | T28: =RC[-7]*RC[-2] -> 44.160034722222214 | U28: =RC[-7]*RC[-3] -> 215.85763888888886 | V28: =RC[-7]*RC[-4] -> 2180.7673611111113 | W28: =RC[-7]*RC[-5] -> -1504.9513888888889 | X28: =RC[-7]*RC[-6] -> 5109.9756944444443 | Y28: =RC[-12]*RC[-12] -> 0.8318960069444441 | Z28: =RC[-12]*RC[-12] -> 19.8767361111111 | AA28: =RC[-12]*RC[-12] -> 2028.7517361111109 | AB28: =RC[-12]*RC[-12] -> 966.17361111111086 | AC28: =RC[-12]*RC[-12] -> 11139.043402777776 | AD28: =RC[-12]*RC[-12] -> 2344.1736111111118 | AE28: =RC[-11]/SQRT(RC[-6]*RC[-1]) -> 0.99999999999999989 | AF28: =RC[-11]/SQRT(RC[-6]*RC[-2]) -> 1 | AG28: =RC[-11]/SQRT(RC[-6]*RC[-3]) -> 1 | AH28: =RC[-11]/SQRT(RC[-6]*RC[-4]) -> -1 | AI28: =RC[-11]/SQRT(RC[-6]*RC[-5]) -> 1
A29: 3490 | B29: 北京 | C29: 132 | D29: 轻度污染 | E29: 2.23 | F29: 23 | G29: 95 | H29: 38 | I29: 231 | J29: 159 | L29: 2013-05-24T02:00:00.000 | M29: =RC[-8]-R[22]C[-8] -> 0.79208333333333303 | N29: =RC[-8]-R[22]C[-8] -> 2.4583333333333321 | O29: =RC[-8]-R[22]C[-8] -> 36.041666666666664 | P29: =RC[-8]-R[22]C[-8] -> -35.083333333333329 | Q29: =RC[-8]-R[22]C[-8] -> 93.541666666666657 | R29: =RC[-8]-R[22]C[-8] -> 65.416666666666671 | T29: =RC[-7]*RC[-2] -> 51.815451388888874 | U29: =RC[-7]*RC[-3] -> 160.81597222222214 | V29: =RC[-7]*RC[-4] -> 2357.7256944444443 | W29: =RC[-7]*RC[-5] -> -2295.0347222222222 | X29: =RC[-7]*RC[-6] -> 6119.1840277777774 | Y29: =RC[-12]*RC[-12] -> 0.62739600694444397 | Z29: =RC[-12]*RC[-12] -> 6.0434027777777724 | AA29: =RC[-12]*RC[-12] -> 1299.0017361111109 | AB29: =RC[-12]*RC[-12] -> 1230.8402777777774 | AC29: =RC[-12]*RC[-12] -> 8750.0434027777756 | AD29: =RC[-12]*RC[-12] -> 4279.3402777777783 | AE29: =RC[-11]/SQRT(RC[-6]*RC[-1]) -> 1 | AF29: =RC[-11]/SQRT(RC[-6]*RC[-2]) -> 1 | AG29: =RC[-11]/SQRT(RC[-6]*RC[-3]) -> 1 | AH29: =RC[-11]/SQRT(RC[-6]*RC[-4]) -> -1 | AI29: =RC[-11]/SQRT(RC[-6]*RC[-5]) -> 1
A30: 3566 | B30: 北京 | C30: 139 | D30: 轻度污染 | E30: 2.48 | F30: 23 | G30: 87 | H30: 47 | I30: 235 | J30: 166 | L30: 2013-05-24T03:00:00.000 | M30: =RC[-8]-R[21]C[-8] -> 1.042083333333333 | N30: =RC[-8]-R[21]C[-8] -> 2.4583333333333321 | O30: =RC[-8]-R[21]C[-8] -> 28.041666666666664 | P30: =RC[-8]-R[21]C[-8] -> -26.083333333333329 | Q30: =RC[-8]-R[21]C[-8] -> 97.541666666666657 | R30: =RC[-8]-R[21]C[-8] -> 72.416666666666671 | T30: =RC[-7]*RC[-2] -> 75.464201388888867 | U30: =RC[-7]*RC[-3] -> 178.02430555555549 | V30: =RC[-7]*RC[-4] -> 2030.6840277777778 | W30: =RC[-7]*RC[-5] -> -1888.8680555555554 | X30: =RC[-7]*RC[-6] -> 7063.6423611111113 | Y30: =RC[-12]*RC[-12] -> 1.0859376736111104 | Z30: =RC[-12]*RC[-12] -> 6.0434027777777724 | AA30: =RC[-12]*RC[-12] -> 786.33506944444434 | AB30: =RC[-12]*RC[-12] -> 680.34027777777749 | AC30: =RC[-12]*RC[-12] -> 9514.3767361111095 | AD30: =RC[-12]*RC[-12] -> 5244.1736111111122 | AE30: =RC[-11]/SQRT(RC[-6]*RC[-1]) -> 1 | AF30: =RC[-11]/SQRT(RC[-6]*RC[-2]) -> 1 | AG30: =RC[-11]/SQRT(RC[-6]*RC[-3]) -> 1 | AH30: =RC[-11]/SQRT(RC[-6]*RC[-4]) -> -1.0000000000000002 | AI30: =RC[-11]/SQRT(RC[-6]*RC[-5]) -> 1
A31: 3642 | B31: 北京 | C31: 144 | D31: 轻度污染 | E31: 2.19 | F31: 21 | G31: 103 | H31: 34 | I31: 242 | J31: 165 | L31: 2013-05-24T04:00:00.000 | M31: =RC[-8]-R[20]C[-8] -> 0.75208333333333299 | N31: =RC[-8]-R[20]C[-8] -> 0.45833333333333215 | O31: =RC[-8]-R[20]C[-8] -> 44.041666666666664 | P31: =RC[-8]-R[20]C[-8] -> -39.083333333333329 | Q31: =RC[-8]-R[20]C[-8] -> 104.54166666666666 | R31: =RC[-8]-R[20]C[-8] -> 71.416666666666671 | T31: =RC[-7]*RC[-2] -> 53.711284722222203 | U31: =RC[-7]*RC[-3] -> 32.732638888888808 | V31: =RC[-7]*RC[-4] -> 3145.3090277777778 | W31: =RC[-7]*RC[-5] -> -2791.2013888888887 | X31: =RC[-7]*RC[-6] -> 7466.0173611111113 | Y31: =RC[-12]*RC[-12] -> 0.56562934027777723 | Z31: =RC[-12]*RC[-12] -> 0.21006944444444337 | AA31: =RC[-12]*RC[-12] -> 1939.6684027777776 | AB31: =RC[-12]*RC[-12] -> 1527.5069444444441 | AC31: =RC[-12]*RC[-12] -> 10928.960069444442 | AD31: =RC[-12]*RC[-12] -> 5100.3402777777783 | AE31: =RC[-11]/SQRT(RC[-6]*RC[-1]) -> 1 | AF31: =RC[-11]/SQRT(RC[-6]*RC[-2]) -> 1 | AG31: =RC[-11]/SQRT(RC[-6]*RC[-3]) -> 1 | AH31: =RC[-11]/SQRT(RC[-6]*RC[-4]) -> -1 | AI31: =RC[-11]/SQRT(RC[-6]*RC[-5]) -> 1.0000000000000002
A32: 3718 | B32: 北京 | C32: 149 | D32: 轻度污染 | E32: 2.4300000000000002 | F32: 20 | G32: 98 | H32: 27 | I32: 241 | J32: 162 | L32: 2013-05-24T05:00:00.000 | M32: =RC[-8]-R[19]C[-8] -> 0.99208333333333321 | N32: =RC[-8]-R[19]C[-8] -> -0.54166666666666785 | O32: =RC[-8]-R[19]C[-8] -> 39.041666666666664 | P32: =RC[-8]-R[19]C[-8] -> -46.083333333333329 | Q32: =RC[-8]-R[19]C[-8] -> 103.54166666666666 | R32: =RC[-8]-R[19]C[-8] -> 68.416666666666671 | T32: =RC[-7]*RC[-2] -> 67.875034722222225 | U32: =RC[-7]*RC[-3] -> -37.059027777777864 | V32: =RC[-7]*RC[-4] -> 2671.1006944444443 | W32: =RC[-7]*RC[-5] -> -3152.8680555555557 | X32: =RC[-7]*RC[-6] -> 7083.9756944444443 | Y32: =RC[-12]*RC[-12] -> 0.98422934027777753 | Z32: =RC[-12]*RC[-12] -> 0.29340277777777907 | AA32: =RC[-12]*RC[-12] -> 1524.2517361111109 | AB32: =RC[-12]*RC[-12] -> 2123.6736111111109 | AC32: =RC[-12]*RC[-12] -> 10720.876736111109 | AD32: =RC[-12]*RC[-12] -> 4680.8402777777783 | AE32: =RC[-11]/SQRT(RC[-6]*RC[-1]) -> 1.0000000000000002 | AF32: =RC[-11]/SQRT(RC[-6]*RC[-2]) -> -1 | AG32: =RC[-11]/SQRT(RC[-6]*RC[-3]) -> 1 | AH32: =RC[-11]/SQRT(RC[-6]*RC[-4]) -> -1 | AI32: =RC[-11]/SQRT(RC[-6]*RC[-5]) -> 1
A33: 3794 | B33: 北京 | C33: 156 | D33: 中度污染 | E33: 2.29 | F33: 21 | G33: 92 | H33: 26 | I33: 241 | J33: 170 | L33: 2013-05-24T06:00:00.000 | M33: =RC[-8]-R[18]C[-8] -> 0.85208333333333308 | N33: =RC[-8]-R[18]C[-8] -> 0.45833333333333215 | O33: =RC[-8]-R[18]C[-8] -> 33.041666666666664 | P33: =RC[-8]-R[18]C[-8] -> -47.083333333333329 | Q33: =RC[-8]-R[18]C[-8] -> 103.54166666666666 | R33: =RC[-8]-R[18]C[-8] -> 76.416666666666671 | T33: =RC[-7]*RC[-2] -> 65.11336805555554 | U33: =RC[-7]*RC[-3] -> 35.024305555555465 | V33: =RC[-7]*RC[-4] -> 2524.9340277777778 | W33: =RC[-7]*RC[-5] -> -3597.9513888888887 | X33: =RC[-7]*RC[-6] -> 7912.3090277777774 | Y33: =RC[-12]*RC[-12] -> 0.72604600694444399 | Z33: =RC[-12]*RC[-12] -> 0.21006944444444337 | AA33: =RC[-12]*RC[-12] -> 1091.7517361111109 | AB33: =RC[-12]*RC[-12] -> 2216.8402777777774 | AC33: =RC[-12]*RC[-12] -> 10720.876736111109 | AD33: =RC[-12]*RC[-12] -> 5839.5069444444453 | AE33: =RC[-11]/SQRT(RC[-6]*RC[-1]) -> 1 | AF33: =RC[-11]/SQRT(RC[-6]*RC[-2]) -> 0.99999999999999978 | AG33: =RC[-11]/SQRT(RC[-6]*RC[-3]) -> 1 | AH33: =RC[-11]/SQRT(RC[-6]*RC[-4]) -> -1 | AI33: =RC[-11]/SQRT(RC[-6]*RC[-5]) -> 1
A34: 3870 | B34: 北京 | C34: 163 | D34: 中度污染 | E34: 2.33 | F34: 28 | G34: 86 | H34: 30 | I34: 261 | J34: 183 | L34: 2013-05-24T07:00:00.000 | M34: =RC[-8]-R[17]C[-8] -> 0.89208333333333312 | N34: =RC[-8]-R[17]C[-8] -> 7.4583333333333321 | O34: =RC[-8]-R[17]C[-8] -> 27.041666666666664 | P34: =RC[-8]-R[17]C[-8] -> -43.083333333333329 | Q34: =RC[-8]-R[17]C[-8] -> 123.54166666666666 | R34: =RC[-8]-R[17]C[-8] -> 89.416666666666671 | T34: =RC[-7]*RC[-2] -> 79.767118055555542 | U34: =RC[-7]*RC[-3] -> 666.89930555555543 | V34: =RC[-7]*RC[-4] -> 2417.9756944444443 | W34: =RC[-7]*RC[-5] -> -3852.3680555555552 | X34: =RC[-7]*RC[-6] -> 11046.684027777777 | Y34: =RC[-12]*RC[-12] -> 0.79581267361111074 | Z34: =RC[-12]*RC[-12] -> 55.626736111111093 | AA34: =RC[-12]*RC[-12] -> 731.25173611111097 | AB34: =RC[-12]*RC[-12] -> 1856.1736111111106 | AC34: =RC[-12]*RC[-12] -> 15262.543402777776 | AD34: =RC[-12]*RC[-12] -> 7995.3402777777783 | AE34: =RC[-11]/SQRT(RC[-6]*RC[-1]) -> 1 | AF34: =RC[-11]/SQRT(RC[-6]*RC[-2]) -> 1 | AG34: =RC[-11]/SQRT(RC[-6]*RC[-3]) -> 1 | AH34: =RC[-11]/SQRT(RC[-6]*RC[-4]) -> -1 | AI34: =RC[-11]/SQRT(RC[-6]*RC[-5]) -> 1
A35: 3946 | B35: 北京 | C35: 168 | D35: 中度污染 | E35: 2.4900000000000002 | F35: 39 | G35: 91 | H35: 49 | I35: 249 | J35: 178 | L35: 2013-05-24T08:00:00.000 | M35: =RC[-8]-R[16]C[-8] -> 1.0520833333333333 | N35: =RC[-8]-R[16]C[-8] -> 18.458333333333332 | O35: =RC[-8]-R[16]C[-8] -> 32.041666666666664 | P35: =RC[-8]-R[16]C[-8] -> -24.083333333333329 | Q35: =RC[-8]-R[16]C[-8] -> 111.54166666666666 | R35: =RC[-8]-R[16]C[-8] -> 84.416666666666671 | T35: =RC[-7]*RC[-2] -> 88.813368055555557 | U35: =RC[-7]*RC[-3] -> 1558.1909722222222 | V35: =RC[-7]*RC[-4] -> 2704.8506944444443 | W35: =RC[-7]*RC[-5] -> -2033.0347222222219 | X35: =RC[-7]*RC[-6] -> 9415.9756944444434 | Y35: =RC[-12]*RC[-12] -> 1.1068793402777777 | Z35: =RC[-12]*RC[-12] -> 340.7100694444444 | AA35: =RC[-12]*RC[-12] -> 1026.6684027777776 | AB35: =RC[-12]*RC[-12] -> 580.00694444444423 | AC35: =RC[-12]*RC[-12] -> 12441.543402777776 | AD35: =RC[-12]*RC[-12] -> 7126.1736111111122 | AE35: =RC[-11]/SQRT(RC[-6]*RC[-1]) -> 1 | AF35: =RC[-11]/SQRT(RC[-6]*RC[-2]) -> 1 | AG35: =RC[-11]/SQRT(RC[-6]*RC[-3]) -> 1 | AH35: =RC[-11]/SQRT(RC[-6]*RC[-4]) -> -1 | AI35: =RC[-11]/SQRT(RC[-6]*RC[-5]) -> 1
A36: 4022 | B36: 北京 | C36: 170 | D36: 中度污染 | E36: 1.84 | F36: 33 | G36: 67 | H36: 72 | I36: 141 | J36: 122 | L36: 2013-05-24T09:00:00.000 | M36: =RC[-8]-R[15]C[-8] -> 0.40208333333333313 | N36: =RC[-8]-R[15]C[-8] -> 12.458333333333332 | O36: =RC[-8]-R[15]C[-8] -> 8.0416666666666643 | P36: =RC[-8]-R[15]C[-8] -> -1.0833333333333286 | Q36: =RC[-8]-R[15]C[-8] -> 3.5416666666666572 | R36: =RC[-8]-R[15]C[-8] -> 28.416666666666671 | T36: =RC[-7]*RC[-2] -> 11.425868055555551 | U36: =RC[-7]*RC[-3] -> 354.0243055555556 | V36: =RC[-7]*RC[-4] -> 228.51736111111109 | W36: =RC[-7]*RC[-5] -> -30.784722222222094 | X36: =RC[-7]*RC[-6] -> 100.64236111111086 | Y36: =RC[-12]*RC[-12] -> 0.16167100694444428 | Z36: =RC[-12]*RC[-12] -> 155.21006944444443 | AA36: =RC[-12]*RC[-12] -> 64.668402777777743 | AB36: =RC[-12]*RC[-12] -> 1.1736111111111009 | AC36: =RC[-12]*RC[-12] -> 12.543402777777711 | AD36: =RC[-12]*RC[-12] -> 807.50694444444468 | AE36: =RC[-11]/SQRT(RC[-6]*RC[-1]) -> 1 | AF36: =RC[-11]/SQRT(RC[-6]*RC[-2]) -> 1 | AG36: =RC[-11]/SQRT(RC[-6]*RC[-3]) -> 1 | AH36: =RC[-11]/SQRT(RC[-6]*RC[-4]) -> -1 | AI36: =RC[-11]/SQRT(RC[-6]*RC[-5]) -> 1
A37: 4098 | B37: 北京 | C37: 168 | D37: 中度污染 | E37: 1.05 | F37: 22 | G37: 42 | H37: 78 | I37: 85 | J37: 68 | L37: 2013-05-24T10:00:00.000 | M37: =RC[-8]-R[14]C[-8] -> -0.38791666666666691 | N37: =RC[-8]-R[14]C[-8] -> 1.4583333333333321 | O37: =RC[-8]-R[14]C[-8] -> -16.958333333333336 | P37: =RC[-8]-R[14]C[-8] -> 4.9166666666666714 | Q37: =RC[-8]-R[14]C[-8] -> -52.458333333333343 | R37: =RC[-8]-R[14]C[-8] -> -25.583333333333329 | T37: =RC[-7]*RC[-2] -> 9.9242013888888927 | U37: =RC[-7]*RC[-3] -> -37.309027777777743 | V37: =RC[-7]*RC[-4] -> 433.8506944444444 | W37: =RC[-7]*RC[-5] -> -125.78472222222231 | X37: =RC[-7]*RC[-6] -> 1342.0590277777778 | Y37: =RC[-12]*RC[-12] -> 0.15047934027777796 | Z37: =RC[-12]*RC[-12] -> 2.1267361111111076 | AA37: =RC[-12]*RC[-12] -> 287.58506944444451 | AB37: =RC[-12]*RC[-12] -> 24.173611111111157 | AC37: =RC[-12]*RC[-12] -> 2751.8767361111122 | AD37: =RC[-12]*RC[-12] -> 654.50694444444423 | AE37: =RC[-11]/SQRT(RC[-6]*RC[-1]) -> 1 | AF37: =RC[-11]/SQRT(RC[-6]*RC[-2]) -> -1 | AG37: =RC[-11]/SQRT(RC[-6]*RC[-3]) -> 0.99999999999999989 | AH37: =RC[-11]/SQRT(RC[-6]*RC[-4]) -> -0.99999999999999989 | AI37: =RC[-11]/SQRT(RC[-6]*RC[-5]) -> 1
A38: 4174 | B38: 北京 | C38: 165 | D38: 中度污染 | E38: 0.71 | F38: 15 | G38: 27 | H38: 95 | I38: 49 | J38: 51 | L38: 2013-05-24T11:00:00.000 | M38: =RC[-8]-R[13]C[-8] -> -0.72791666666666699 | N38: =RC[-8]-R[13]C[-8] -> -5.5416666666666679 | O38: =RC[-8]-R[13]C[-8] -> -31.958333333333336 | P38: =RC[-8]-R[13]C[-8] -> 21.916666666666671 | Q38: =RC[-8]-R[13]C[-8] -> -88.458333333333343 | R38: =RC[-8]-R[13]C[-8] -> -42.583333333333329 | T38: =RC[-7]*RC[-2] -> 30.997118055555564 | U38: =RC[-7]*RC[-3] -> 235.98263888888891 | V38: =RC[-7]*RC[-4] -> 1360.8923611111111 | W38: =RC[-7]*RC[-5] -> -933.28472222222229 | X38: =RC[-7]*RC[-6] -> 3766.8506944444443 | Y38: =RC[-12]*RC[-12] -> 0.52986267361111161 | Z38: =RC[-12]*RC[-12] -> 30.710069444444457 | AA38: =RC[-12]*RC[-12] -> 1021.3350694444446 | AB38: =RC[-12]*RC[-12] -> 480.340277777778 | AC38: =RC[-12]*RC[-12] -> 7824.8767361111131 | AD38: =RC[-12]*RC[-12] -> 1813.3402777777774 | AE38: =RC[-11]/SQRT(RC[-6]*RC[-1]) -> 0.99999999999999989 | AF38: =RC[-11]/SQRT(RC[-6]*RC[-2]) -> 1 | AG38: =RC[-11]/SQRT(RC[-6]*RC[-3]) -> 1 | AH38: =RC[-11]/SQRT(RC[-6]*RC[-4]) -> -1 | AI38: =RC[-11]/SQRT(RC[-6]*RC[-5]) -> 1
A39: 4250 | B39: 北京 | C39: 161 | D39: 中度污染 | E39: 0.55000000000000004 | F39: 11 | G39: 19 | H39: 115 | I39: 80 | J39: 42 | L39: 2013-05-24T12:00:00.000 | M39: =RC[-8]-R[12]C[-8] -> -0.88791666666666691 | N39: =RC[-8]-R[12]C[-8] -> -9.5416666666666679 | O39: =RC[-8]-R[12]C[-8] -> -39.958333333333336 | P39: =RC[-8]-R[12]C[-8] -> 41.916666666666671 | Q39: =RC[-8]-R[12]C[-8] -> -57.458333333333343 | R39: =RC[-8]-R[12]C[-8] -> -51.583333333333329 | T39: =RC[-7]*RC[-2] -> 45.801701388888894 | U39: =RC[-7]*RC[-3] -> 492.19097222222223 | V39: =RC[-7]*RC[-4] -> 2061.1840277777778 | W39: =RC[-7]*RC[-5] -> -2162.2013888888891 | X39: =RC[-7]*RC[-6] -> 2963.8923611111113 | Y39: =RC[-12]*RC[-12] -> 0.78839600694444489 | Z39: =RC[-12]*RC[-12] -> 91.0434027777778 | AA39: =RC[-12]*RC[-12] -> 1596.6684027777781 | AB39: =RC[-12]*RC[-12] -> 1757.0069444444448 | AC39: =RC[-12]*RC[-12] -> 3301.4600694444457 | AD39: =RC[-12]*RC[-12] -> 2660.8402777777774 | AE39: =RC[-11]/SQRT(RC[-6]*RC[-1]) -> 0.99999999999999989 | AF39: =RC[-11]/SQRT(RC[-6]*RC[-2]) -> 1 | AG39: =RC[-11]/SQRT(RC[-6]*RC[-3]) -> 1 | AH39: =RC[-11]/SQRT(RC[-6]*RC[-4]) -> -1.0000000000000002 | AI39: =RC[-11]/SQRT(RC[-6]*RC[-5]) -> 1
A40: 4326 | B40: 北京 | C40: 158 | D40: 中度污染 | E40: 0.52 | F40: 12 | G40: 17 | H40: 132 | I40: 80 | J40: 44 | L40: 2013-05-24T13:00:00.000 | M40: =RC[-8]-R[11]C[-8] -> -0.91791666666666694 | N40: =RC[-8]-R[11]C[-8] -> -8.5416666666666679 | O40: =RC[-8]-R[11]C[-8] -> -41.958333333333336 | P40: =RC[-8]-R[11]C[-8] -> 58.916666666666671 | Q40: =RC[-8]-R[11]C[-8] -> -57.458333333333343 | R40: =RC[-8]-R[11]C[-8] -> -49.583333333333329 | T40: =RC[-7]*RC[-2] -> 45.513368055555567 | U40: =RC[-7]*RC[-3] -> 423.5243055555556 | V40: =RC[-7]*RC[-4] -> 2080.4340277777778 | W40: =RC[-7]*RC[-5] -> -2921.2847222222222 | X40: =RC[-7]*RC[-6] -> 2848.9756944444448 | Y40: =RC[-12]*RC[-12] -> 0.84257100694444498 | Z40: =RC[-12]*RC[-12] -> 72.960069444444471 | AA40: =RC[-12]*RC[-12] -> 1760.5017361111113 | AB40: =RC[-12]*RC[-12] -> 3471.1736111111118 | AC40: =RC[-12]*RC[-12] -> 3301.4600694444457 | AD40: =RC[-12]*RC[-12] -> 2458.5069444444439 | AE40: =RC[-11]/SQRT(RC[-6]*RC[-1]) -> 1 | AF40: =RC[-11]/SQRT(RC[-6]*RC[-2]) -> 1 | AG40: =RC[-11]/SQRT(RC[-6]*RC[-3]) -> 1 | AH40: =RC[-11]/SQRT(RC[-6]*RC[-4]) -> -1 | AI40: =RC[-11]/SQRT(RC[-6]*RC[-5]) -> 1
A41: 4402 | B41: 北京 | C41: 154 | D41: 中度污染 | E41: 0.59 | F41: 13 | G41: 19 | H41: 147 | I41: 83 | J41: 46 | L41: 2013-05-24T14:00:00.000 | M41: =RC[-8]-R[10]C[-8] -> -0.84791666666666698 | N41: =RC[-8]-R[10]C[-8] -> -7.5416666666666679 | O41: =RC[-8]-R[10]C[-8] -> -39.958333333333336 | P41: =RC[-8]-R[10]C[-8] -> 73.916666666666671 | Q41: =RC[-8]-R[10]C[-8] -> -54.458333333333343 | R41: =RC[-8]-R[10]C[-8] -> -47.583333333333329 | T41: =RC[-7]*RC[-2] -> 40.346701388888903 | U41: =RC[-7]*RC[-3] -> 358.85763888888891 | V41: =RC[-7]*RC[-4] -> 1901.3506944444443 | W41: =RC[-7]*RC[-5] -> -3517.2013888888887 | X41: =RC[-7]*RC[-6] -> 2591.3090277777778 | Y41: =RC[-12]*RC[-12] -> 0.71896267361111166 | Z41: =RC[-12]*RC[-12] -> 56.876736111111128 | AA41: =RC[-12]*RC[-12] -> 1596.6684027777781 | AB41: =RC[-12]*RC[-12] -> 5463.6736111111122 | AC41: =RC[-12]*RC[-12] -> 2965.7100694444453 | AD41: =RC[-12]*RC[-12] -> 2264.1736111111109 | AE41: =RC[-11]/SQRT(RC[-6]*RC[-1]) -> 1 | AF41: =RC[-11]/SQRT(RC[-6]*RC[-2]) -> 1 | AG41: =RC[-11]/SQRT(RC[-6]*RC[-3]) -> 0.99999999999999989 | AH41: =RC[-11]/SQRT(RC[-6]*RC[-4]) -> -0.99999999999999989 | AI41: =RC[-11]/SQRT(RC[-6]*RC[-5]) -> 1
A42: 4478 | B42: 北京 | C42: 153 | D42: 中度污染 | E42: 1.21 | F42: 22 | G42: 28 | H42: 134 | I42: 160 | J42: 58 | L42: 2013-05-24T15:00:00.000 | M42: =RC[-8]-R[9]C[-8] -> -0.22791666666666699 | N42: =RC[-8]-R[9]C[-8] -> 1.4583333333333321 | O42: =RC[-8]-R[9]C[-8] -> -30.958333333333336 | P42: =RC[-8]-R[9]C[-8] -> 60.916666666666671 | Q42: =RC[-8]-R[9]C[-8] -> 22.541666666666657 | R42: =RC[-8]-R[9]C[-8] -> -35.583333333333329 | T42: =RC[-7]*RC[-2] -> 8.1100347222222329 | U42: =RC[-7]*RC[-3] -> -51.892361111111065 | V42: =RC[-7]*RC[-4] -> 1101.6006944444443 | W42: =RC[-7]*RC[-5] -> -2167.6180555555557 | X42: =RC[-7]*RC[-6] -> -802.10763888888846 | Y42: =RC[-12]*RC[-12] -> 5.1946006944444595E-2 | Z42: =RC[-12]*RC[-12] -> 2.1267361111111076 | AA42: =RC[-12]*RC[-12] -> 958.41840277777794 | AB42: =RC[-12]*RC[-12] -> 3710.8402777777783 | AC42: =RC[-12]*RC[-12] -> 508.12673611111069 | AD42: =RC[-12]*RC[-12] -> 1266.1736111111109 | AE42: =RC[-11]/SQRT(RC[-6]*RC[-1]) -> 1 | AF42: =RC[-11]/SQRT(RC[-6]*RC[-2]) -> -1 | AG42: =RC[-11]/SQRT(RC[-6]*RC[-3]) -> 1 | AH42: =RC[-11]/SQRT(RC[-6]*RC[-4]) -> -1.0000000000000002 | AI42: =RC[-11]/SQRT(RC[-6]*RC[-5]) -> -1
A43: 4554 | B43: 北京 | C43: 152 | D43: 中度污染 | E43: 1.96 | F43: 45 | G43: 40 | H43: 125 | I43: 157 | J43: 102 | L43: 2013-05-24T16:00:00.000 | M43: =RC[-8]-R[8]C[-8] -> 0.52208333333333301 | N43: =RC[-8]-R[8]C[-8] -> 24.458333333333332 | O43: =RC[-8]-R[8]C[-8] -> -18.958333333333336 | P43: =RC[-8]-R[8]C[-8] -> 51.916666666666671 | Q43: =RC[-8]-R[8]C[-8] -> 19.541666666666657 | R43: =RC[-8]-R[8]C[-8] -> 8.4166666666666714 | T43: =RC[-7]*RC[-2] -> 4.3942013888888889 | U43: =RC[-7]*RC[-3] -> 205.857638888889 | V43: =RC[-7]*RC[-4] -> -159.56597222222234 | W43: =RC[-7]*RC[-5] -> 436.96527777777806 | X43: =RC[-7]*RC[-6] -> 164.47569444444446 | Y43: =RC[-12]*RC[-12] -> 0.27257100694444408 | Z43: =RC[-12]*RC[-12] -> 598.21006944444434 | AA43: =RC[-12]*RC[-12] -> 359.41840277777789 | AB43: =RC[-12]*RC[-12] -> 2695.3402777777783 | AC43: =RC[-12]*RC[-12] -> 381.87673611111074 | AD43: =RC[-12]*RC[-12] -> 70.840277777777857 | AE43: =RC[-11]/SQRT(RC[-6]*RC[-1]) -> 1.0000000000000002 | AF43: =RC[-11]/SQRT(RC[-6]*RC[-2]) -> 1.0000000000000002 | AG43: =RC[-11]/SQRT(RC[-6]*RC[-3]) -> -1 | AH43: =RC[-11]/SQRT(RC[-6]*RC[-4]) -> 1 | AI43: =RC[-11]/SQRT(RC[-6]*RC[-5]) -> 1
A44: 4630 | B44: 北京 | C44: 150 | D44: 轻度污染 | E44: 1.1399999999999999 | F44: 24 | G44: 37 | H44: 113 | I44: 71 | J44: 68 | L44: 2013-05-24T17:00:00.000 | M44: =RC[-8]-R[7]C[-8] -> -0.29791666666666705 | N44: =RC[-8]-R[7]C[-8] -> 3.4583333333333321 | O44: =RC[-8]-R[7]C[-8] -> -21.958333333333336 | P44: =RC[-8]-R[7]C[-8] -> 39.916666666666671 | Q44: =RC[-8]-R[7]C[-8] -> -66.458333333333343 | R44: =RC[-8]-R[7]C[-8] -> -25.583333333333329 | T44: =RC[-7]*RC[-2] -> 7.6217013888888969 | U44: =RC[-7]*RC[-3] -> -88.4756944444444 | V44: =RC[-7]*RC[-4] -> 561.76736111111109 | W44: =RC[-7]*RC[-5] -> -1021.2013888888888 | X44: =RC[-7]*RC[-6] -> 1700.2256944444443 | Y44: =RC[-12]*RC[-12] -> 8.875434027777801E-2 | Z44: =RC[-12]*RC[-12] -> 11.960069444444436 | AA44: =RC[-12]*RC[-12] -> 482.16840277777789 | AB44: =RC[-12]*RC[-12] -> 1593.3402777777781 | AC44: =RC[-12]*RC[-12] -> 4416.7100694444453 | AD44: =RC[-12]*RC[-12] -> 654.50694444444423 | AE44: =RC[-11]/SQRT(RC[-6]*RC[-1]) -> 0.99999999999999989 | AF44: =RC[-11]/SQRT(RC[-6]*RC[-2]) -> -1 | AG44: =RC[-11]/SQRT(RC[-6]*RC[-3]) -> 1 | AH44: =RC[-11]/SQRT(RC[-6]*RC[-4]) -> -1 | AI44: =RC[-11]/SQRT(RC[-6]*RC[-5]) -> 1
A45: 4706 | B45: 北京 | C45: 146 | D45: 轻度污染 | E45: 0.81 | F45: 16 | G45: 38 | H45: 96 | I45: 43 | J45: 43 | L45: 2013-05-24T18:00:00.000 | M45: =RC[-8]-R[6]C[-8] -> -0.6279166666666669 | N45: =RC[-8]-R[6]C[-8] -> -4.5416666666666679 | O45: =RC[-8]-R[6]C[-8] -> -20.958333333333336 | P45: =RC[-8]-R[6]C[-8] -> 22.916666666666671 | Q45: =RC[-8]-R[6]C[-8] -> -94.458333333333343 | R45: =RC[-8]-R[6]C[-8] -> -50.583333333333329 | T45: =RC[-7]*RC[-2] -> 31.762118055555565 | U45: =RC[-7]*RC[-3] -> 229.73263888888891 | V45: =RC[-7]*RC[-4] -> 1060.1423611111111 | W45: =RC[-7]*RC[-5] -> -1159.2013888888889 | X45: =RC[-7]*RC[-6] -> 4778.0173611111113 | Y45: =RC[-12]*RC[-12] -> 0.39427934027777806 | Z45: =RC[-12]*RC[-12] -> 20.626736111111121 | AA45: =RC[-12]*RC[-12] -> 439.2517361111112 | AB45: =RC[-12]*RC[-12] -> 525.17361111111131 | AC45: =RC[-12]*RC[-12] -> 8922.3767361111131 | AD45: =RC[-12]*RC[-12] -> 2558.6736111111109 | AE45: =RC[-11]/SQRT(RC[-6]*RC[-1]) -> 1 | AF45: =RC[-11]/SQRT(RC[-6]*RC[-2]) -> 1 | AG45: =RC[-11]/SQRT(RC[-6]*RC[-3]) -> 1 | AH45: =RC[-11]/SQRT(RC[-6]*RC[-4]) -> -0.99999999999999978 | AI45: =RC[-11]/SQRT(RC[-6]*RC[-5]) -> 1
A46: 4782 | B46: 北京 | C46: 142 | D46: 轻度污染 | E46: 0.8 | F46: 14 | G46: 43 | H46: 83 | I46: 47 | J46: 39 | L46: 2013-05-24T19:00:00.000 | M46: =RC[-8]-R[5]C[-8] -> -0.63791666666666691 | N46: =RC[-8]-R[5]C[-8] -> -6.5416666666666679 | O46: =RC[-8]-R[5]C[-8] -> -15.958333333333336 | P46: =RC[-8]-R[5]C[-8] -> 9.9166666666666714 | Q46: =RC[-8]-R[5]C[-8] -> -90.458333333333343 | R46: =RC[-8]-R[5]C[-8] -> -54.583333333333329 | T46: =RC[-7]*RC[-2] -> 34.819618055555566 | U46: =RC[-7]*RC[-3] -> 357.06597222222223 | V46: =RC[-7]*RC[-4] -> 871.05902777777783 | W46: =RC[-7]*RC[-5] -> -541.2847222222224 | X46: =RC[-7]*RC[-6] -> 4937.5173611111113 | Y46: =RC[-12]*RC[-12] -> 0.40693767361111144 | Z46: =RC[-12]*RC[-12] -> 42.793402777777793 | AA46: =RC[-12]*RC[-12] -> 254.66840277777786 | AB46: =RC[-12]*RC[-12] -> 98.340277777777871 | AC46: =RC[-12]*RC[-12] -> 8182.7100694444462 | AD46: =RC[-12]*RC[-12] -> 2979.3402777777774 | AE46: =RC[-11]/SQRT(RC[-6]*RC[-1]) -> 1 | AF46: =RC[-11]/SQRT(RC[-6]*RC[-2]) -> 0.99999999999999989 | AG46: =RC[-11]/SQRT(RC[-6]*RC[-3]) -> 1 | AH46: =RC[-11]/SQRT(RC[-6]*RC[-4]) -> -1 | AI46: =RC[-11]/SQRT(RC[-6]*RC[-5]) -> 1
A47: 4858 | B47: 北京 | C47: 139 | D47: 轻度污染 | E47: 0.74 | F47: 12 | G47: 45 | H47: 71 | I47: 47 | J47: 35 | L47: 2013-05-24T20:00:00.000 | M47: =RC[-8]-R[4]C[-8] -> -0.69791666666666696 | N47: =RC[-8]-R[4]C[-8] -> -8.5416666666666679 | O47: =RC[-8]-R[4]C[-8] -> -13.958333333333336 | P47: =RC[-8]-R[4]C[-8] -> -2.0833333333333286 | Q47: =RC[-8]-R[4]C[-8] -> -90.458333333333343 | R47: =RC[-8]-R[4]C[-8] -> -58.583333333333329 | T47: =RC[-7]*RC[-2] -> 40.886284722222236 | U47: =RC[-7]*RC[-3] -> 500.3993055555556 | V47: =RC[-7]*RC[-4] -> 817.72569444444457 | W47: =RC[-7]*RC[-5] -> 122.04861111111083 | X47: =RC[-7]*RC[-6] -> 5299.3506944444443 | Y47: =RC[-12]*RC[-12] -> 0.48708767361111155 | Z47: =RC[-12]*RC[-12] -> 72.960069444444471 | AA47: =RC[-12]*RC[-12] -> 194.83506944444451 | AB47: =RC[-12]*RC[-12] -> 4.3402777777777581 | AC47: =RC[-12]*RC[-12] -> 8182.7100694444462 | AD47: =RC[-12]*RC[-12] -> 3432.0069444444439 | AE47: =RC[-11]/SQRT(RC[-6]*RC[-1]) -> 1 | AF47: =RC[-11]/SQRT(RC[-6]*RC[-2]) -> 1 | AG47: =RC[-11]/SQRT(RC[-6]*RC[-3]) -> 1.0000000000000002 | AH47: =RC[-11]/SQRT(RC[-6]*RC[-4]) -> 1 | AI47: =RC[-11]/SQRT(RC[-6]*RC[-5]) -> 1
A48: 4934 | B48: 北京 | C48: 134 | D48: 轻度污染 | E48: 0.6 | F48: 11 | G48: 46 | H48: 58 | I48: 37 | J48: 29 | L48: 2013-05-24T21:00:00.000 | M48: =RC[-8]-R[3]C[-8] -> -0.83791666666666698 | N48: =RC[-8]-R[3]C[-8] -> -9.5416666666666679 | O48: =RC[-8]-R[3]C[-8] -> -12.958333333333336 | P48: =RC[-8]-R[3]C[-8] -> -15.083333333333329 | Q48: =RC[-8]-R[3]C[-8] -> -100.45833333333334 | R48: =RC[-8]-R[3]C[-8] -> -64.583333333333329 | T48: =RC[-7]*RC[-2] -> 54.115451388888907 | U48: =RC[-7]*RC[-3] -> 616.23263888888891 | V48: =RC[-7]*RC[-4] -> 836.8923611111112 | W48: =RC[-7]*RC[-5] -> 974.13194444444412 | X48: =RC[-7]*RC[-6] -> 6487.9340277777783 | Y48: =RC[-12]*RC[-12] -> 0.70210434027777835 | Z48: =RC[-12]*RC[-12] -> 91.0434027777778 | AA48: =RC[-12]*RC[-12] -> 167.91840277777783 | AB48: =RC[-12]*RC[-12] -> 227.50694444444431 | AC48: =RC[-12]*RC[-12] -> 10091.876736111113 | AD48: =RC[-12]*RC[-12] -> 4171.0069444444434 | AE48: =RC[-11]/SQRT(RC[-6]*RC[-1]) -> 1.0000000000000002 | AF48: =RC[-11]/SQRT(RC[-6]*RC[-2]) -> 1 | AG48: =RC[-11]/SQRT(RC[-6]*RC[-3]) -> 1 | AH48: =RC[-11]/SQRT(RC[-6]*RC[-4]) -> 1 | AI48: =RC[-11]/SQRT(RC[-6]*RC[-5]) -> 1.0000000000000002
A49: 5010 | B49: 北京 | C49: 129 | D49: 轻度污染 | E49: 0.5 | F49: 9 | G49: 45 | H49: 50 | I49: 38 | J49: 25 | L49: 2013-05-24T22:00:00.000 | M49: =RC[-8]-R[2]C[-8] -> -0.93791666666666695 | N49: =RC[-8]-R[2]C[-8] -> -11.541666666666668 | O49: =RC[-8]-R[2]C[-8] -> -13.958333333333336 | P49: =RC[-8]-R[2]C[-8] -> -23.083333333333329 | Q49: =RC[-8]-R[2]C[-8] -> -99.458333333333343 | R49: =RC[-8]-R[2]C[-8] -> -68.583333333333329 | T49: =RC[-7]*RC[-2] -> 64.325451388888908 | U49: =RC[-7]*RC[-3] -> 791.56597222222229 | V49: =RC[-7]*RC[-4] -> 957.30902777777783 | W49: =RC[-7]*RC[-5] -> 1583.1319444444441 | X49: =RC[-7]*RC[-6] -> 6821.1840277777783 | Y49: =RC[-12]*RC[-12] -> 0.87968767361111166 | Z49: =RC[-12]*RC[-12] -> 133.21006944444449 | AA49: =RC[-12]*RC[-12] -> 194.83506944444451 | AB49: =RC[-12]*RC[-12] -> 532.8402777777776 | AC49: =RC[-12]*RC[-12] -> 9891.9600694444471 | AD49: =RC[-12]*RC[-12] -> 4703.6736111111104 | AE49: =RC[-11]/SQRT(RC[-6]*RC[-1]) -> 1 | AF49: =RC[-11]/SQRT(RC[-6]*RC[-2]) -> 1 | AG49: =RC[-11]/SQRT(RC[-6]*RC[-3]) -> 1 | AH49: =RC[-11]/SQRT(RC[-6]*RC[-4]) -> 1 | AI49: =RC[-11]/SQRT(RC[-6]*RC[-5]) -> 1
A50: 5086 | B50: 北京 | C50: 123 | D50: 轻度污染 | E50: 0.5 | F50: 8 | G50: 49 | H50: 40 | I50: 40 | J50: 20 | L50: 2013-05-24T23:00:00.000 | M50: =RC[-8]-R[1]C[-8] -> -0.93791666666666695 | N50: =RC[-8]-R[1]C[-8] -> -12.541666666666668 | O50: =RC[-8]-R[1]C[-8] -> -9.9583333333333357 | P50: =RC[-8]-R[1]C[-8] -> -33.083333333333329 | Q50: =RC[-8]-R[1]C[-8] -> -97.458333333333343 | R50: =RC[-8]-R[1]C[-8] -> -73.583333333333329 | T50: =RC[-7]*RC[-2] -> 69.015034722222239 | U50: =RC[-7]*RC[-3] -> 922.85763888888891 | V50: =RC[-7]*RC[-4] -> 732.7673611111112 | W50: =RC[-7]*RC[-5] -> 2434.3819444444439 | X50: =RC[-7]*RC[-6] -> 7171.3090277777783 | Y50: =RC[-12]*RC[-12] -> 0.87968767361111166 | Z50: =RC[-12]*RC[-12] -> 157.2934027777778 | AA50: =RC[-12]*RC[-12] -> 99.168402777777828 | AB50: =RC[-12]*RC[-12] -> 1094.5069444444441 | AC50: =RC[-12]*RC[-12] -> 9498.1267361111131 | AD50: =RC[-12]*RC[-12] -> 5414.5069444444434 | AE50: =RC[-11]/SQRT(RC[-6]*RC[-1]) -> 1 | AF50: =RC[-11]/SQRT(RC[-6]*RC[-2]) -> 1 | AG50: =RC[-11]/SQRT(RC[-6]*RC[-3]) -> 1 | AH50: =RC[-11]/SQRT(RC[-6]*RC[-4]) -> 1 | AI50: =RC[-11]/SQRT(RC[-6]*RC[-5]) -> 1.0000000000000002
E51: =AVERAGE(R[-24]C:R[-1]C) -> 1.437916666666667 | F51: =AVERAGE(R[-24]C:R[-1]C) -> 20.541666666666668 | G51: =AVERAGE(R[-24]C:R[-1]C) -> 58.958333333333336 | H51: =AVERAGE(R[-24]C:R[-1]C) -> 73.083333333333329 | I51: =AVERAGE(R[-24]C:R[-1]C) -> 137.45833333333334 | J51: =AVERAGE(R[-24]C:R[-1]C) -> 93.583333333333329 | M51: =RC[-8]-RC[-8] -> 0 | N51: =RC[-8]-RC[-8] -> 0 | O51: =RC[-8]-RC[-8] -> 0 | P51: =RC[-8]-RC[-8] -> 0 | Q51: =RC[-8]-RC[-8] -> 0 | R51: =RC[-8]-RC[-8] -> 0 | T51: =SUM(R[-24]C:R[-1]C) -> 1052.7691666666669 | U51: =SUM(R[-24]C:R[-1]C) -> 8314.4166666666661 | V51: =SUM(R[-24]C:R[-1]C) -> 36226.583333333328 | W51: =SUM(R[-24]C:R[-1]C) -> -30892.166666666664 | X51: =SUM(R[-24]C:R[-1]C) -> 113533.58333333331 | Y51: =SUM(R[-24]C:R[-1]C) -> 14.659595833333334 | Z51: =SUM(R[-24]C:R[-1]C) -> 1997.9583333333333 | AA51: =SUM(R[-24]C:R[-1]C) -> 21352.958333333332 | AB51: =SUM(R[-24]C:R[-1]C) -> 33305.833333333328 | AC51: =SUM(R[-24]C:R[-1]C) -> 173377.95833333334 | AD51: =SUM(R[-24]C:R[-1]C) -> 79773.833333333343 | AE51: =RC[-11]/SQRT(RC[-6]*RC[-1]) -> 0.97351338637853024 | AF51: =RC[-11]/SQRT(RC[-6]*RC[-2]) -> 0.65857970106034858 | AG51: =RC[-11]/SQRT(RC[-6]*RC[-3]) -> 0.8777445042879638 | AH51: =RC[-11]/SQRT(RC[-6]*RC[-4]) -> -0.59931891728939568 | AI51: =RC[-11]/SQRT(RC[-6]*RC[-5]) -> 0.96537749936218498
A52: 5162 | B52: 北京 | C52: 118 | D52: 轻度污染 | E52: 0.52 | F52: 7 | G52: 59 | H52: 27 | I52: 57 | J52: 27 | L52: 2013-05-25T00:00:00.000 | M52: =RC[-8]-R[24]C[-8] -> -0.46249999999999991 | N52: =RC[-8]-R[24]C[-8] -> -17.541666666666668 | O52: =RC[-8]-R[24]C[-8] -> 6.7083333333333357 | P52: =RC[-8]-R[24]C[-8] -> -74.916666666666671 | Q52: =RC[-8]-R[24]C[-8] -> -52.125 | R52: =RC[-8]-R[24]C[-8] -> -32.125 | T52: =RC[-7]*RC[-2] -> 14.857812499999998 | U52: =RC[-7]*RC[-3] -> 563.52604166666674 | V52: =RC[-7]*RC[-4] -> -215.5052083333334 | W52: =RC[-7]*RC[-5] -> 2406.697916666667 | X52: =RC[-7]*RC[-6] -> 1674.515625 | Y52: =RC[-12]*RC[-12] -> 0.21390624999999991 | Z52: =RC[-12]*RC[-12] -> 307.71006944444451 | AA52: =RC[-12]*RC[-12] -> 45.001736111111143 | AB52: =RC[-12]*RC[-12] -> 5612.5069444444453 | AC52: =RC[-12]*RC[-12] -> 2717.015625 | AD52: =RC[-12]*RC[-12] -> 1032.015625 | AE52: =RC[-11]/SQRT(RC[-6]*RC[-1]) -> 1.0000000000000002 | AF52: =RC[-11]/SQRT(RC[-6]*RC[-2]) -> 1 | AG52: =RC[-11]/SQRT(RC[-6]*RC[-3]) -> -1 | AH52: =RC[-11]/SQRT(RC[-6]*RC[-4]) -> 1 | AI52: =RC[-11]/SQRT(RC[-6]*RC[-5]) -> 1
A53: 5238 | B53: 北京 | C53: 113 | D53: 轻度污染 | E53: 0.59 | F53: 8 | G53: 60 | H53: 22 | I53: 70 | J53: 32 | L53: 2013-05-25T01:00:00.000 | M53: =RC[-8]-R[23]C[-8] -> -0.39249999999999996 | N53: =RC[-8]-R[23]C[-8] -> -16.541666666666668 | O53: =RC[-8]-R[23]C[-8] -> 7.7083333333333357 | P53: =RC[-8]-R[23]C[-8] -> -79.916666666666671 | Q53: =RC[-8]-R[23]C[-8] -> -39.125 | R53: =RC[-8]-R[23]C[-8] -> -27.125 | T53: =RC[-7]*RC[-2] -> 10.646562499999998 | U53: =RC[-7]*RC[-3] -> 448.69270833333337 | V53: =RC[-7]*RC[-4] -> -209.08854166666674 | W53: =RC[-7]*RC[-5] -> 2167.7395833333335 | X53: =RC[-7]*RC[-6] -> 1061.265625 | Y53: =RC[-12]*RC[-12] -> 0.15405624999999998 | Z53: =RC[-12]*RC[-12] -> 273.62673611111114 | AA53: =RC[-12]*RC[-12] -> 59.418402777777814 | AB53: =RC[-12]*RC[-12] -> 6386.6736111111122 | AC53: =RC[-12]*RC[-12] -> 1530.765625 | AD53: =RC[-12]*RC[-12] -> 735.765625 | AE53: =RC[-11]/SQRT(RC[-6]*RC[-1]) -> 0.99999999999999978 | AF53: =RC[-11]/SQRT(RC[-6]*RC[-2]) -> 1 | AG53: =RC[-11]/SQRT(RC[-6]*RC[-3]) -> -1.0000000000000002 | AH53: =RC[-11]/SQRT(RC[-6]*RC[-4]) -> 1 | AI53: =RC[-11]/SQRT(RC[-6]*RC[-5]) -> 1
A54: 5314 | B54: 北京 | C54: 107 | D54: 轻度污染 | E54: 0.56999999999999995 | F54: 8 | G54: 60 | H54: 19 | I54: 66 | J54: 34 | L54: 2013-05-25T02:00:00.000 | M54: =RC[-8]-R[22]C[-8] -> -0.41249999999999998 | N54: =RC[-8]-R[22]C[-8] -> -16.541666666666668 | O54: =RC[-8]-R[22]C[-8] -> 7.7083333333333357 | P54: =RC[-8]-R[22]C[-8] -> -82.916666666666671 | Q54: =RC[-8]-R[22]C[-8] -> -43.125 | R54: =RC[-8]-R[22]C[-8] -> -25.125 | T54: =RC[-7]*RC[-2] -> 10.364062499999999 | U54: =RC[-7]*RC[-3] -> 415.60937500000006 | V54: =RC[-7]*RC[-4] -> -193.67187500000006 | W54: =RC[-7]*RC[-5] -> 2083.28125 | X54: =RC[-7]*RC[-6] -> 1083.515625 | Y54: =RC[-12]*RC[-12] -> 0.17015624999999998 | Z54: =RC[-12]*RC[-12] -> 273.62673611111114 | AA54: =RC[-12]*RC[-12] -> 59.418402777777814 | AB54: =RC[-12]*RC[-12] -> 6875.1736111111122 | AC54: =RC[-12]*RC[-12] -> 1859.765625 | AD54: =RC[-12]*RC[-12] -> 631.265625 | AE54: =RC[-11]/SQRT(RC[-6]*RC[-1]) -> 1 | AF54: =RC[-11]/SQRT(RC[-6]*RC[-2]) -> 1 | AG54: =RC[-11]/SQRT(RC[-6]*RC[-3]) -> -1 | AH54: =RC[-11]/SQRT(RC[-6]*RC[-4]) -> 1 | AI54: =RC[-11]/SQRT(RC[-6]*RC[-5]) -> 1
A55: 5390 | B55: 北京 | C55: 100 | D55: 良 | E55: 0.63 | F55: 8 | G55: 65 | H55: 13 | I55: 78 | J55: 36 | L55: 2013-05-25T03:00:00.000 | M55: =RC[-8]-R[21]C[-8] -> -0.35249999999999992 | N55: =RC[-8]-R[21]C[-8] -> -16.541666666666668 | O55: =RC[-8]-R[21]C[-8] -> 12.708333333333336 | P55: =RC[-8]-R[21]C[-8] -> -88.916666666666671 | Q55: =RC[-8]-R[21]C[-8] -> -31.125 | R55: =RC[-8]-R[21]C[-8] -> -23.125 | T55: =RC[-7]*RC[-2] -> 8.1515624999999989 | U55: =RC[-7]*RC[-3] -> 382.52604166666669 | V55: =RC[-7]*RC[-4] -> -293.88020833333337 | W55: =RC[-7]*RC[-5] -> 2056.197916666667 | X55: =RC[-7]*RC[-6] -> 719.765625 | Y55: =RC[-12]*RC[-12] -> 0.12425624999999994 | Z55: =RC[-12]*RC[-12] -> 273.62673611111114 | AA55: =RC[-12]*RC[-12] -> 161.50173611111117 | AB55: =RC[-12]*RC[-12] -> 7906.1736111111122 | AC55: =RC[-12]*RC[-12] -> 968.765625 | AD55: =RC[-12]*RC[-12] -> 534.765625 | AE55: =RC[-11]/SQRT(RC[-6]*RC[-1]) -> 1 | AF55: =RC[-11]/SQRT(RC[-6]*RC[-2]) -> 1 | AG55: =RC[-11]/SQRT(RC[-6]*RC[-3]) -> -1 | AH55: =RC[-11]/SQRT(RC[-6]*RC[-4]) -> 1.0000000000000002 | AI55: =RC[-11]/SQRT(RC[-6]*RC[-5]) -> 1
A56: 5466 | B56: 北京 | C56: 94 | D56: 良 | E56: 0.68 | F56: 7 | G56: 66 | H56: 11 | I56: 73 | J56: 39 | L56: 2013-05-25T04:00:00.000 | M56: =RC[-8]-R[20]C[-8] -> -0.30249999999999988 | N56: =RC[-8]-R[20]C[-8] -> -17.541666666666668 | O56: =RC[-8]-R[20]C[-8] -> 13.708333333333336 | P56: =RC[-8]-R[20]C[-8] -> -90.916666666666671 | Q56: =RC[-8]-R[20]C[-8] -> -36.125 | R56: =RC[-8]-R[20]C[-8] -> -20.125 | T56: =RC[-7]*RC[-2] -> 6.0878124999999974 | U56: =RC[-7]*RC[-3] -> 353.02604166666669 | V56: =RC[-7]*RC[-4] -> -275.88020833333337 | W56: =RC[-7]*RC[-5] -> 1829.6979166666667 | X56: =RC[-7]*RC[-6] -> 727.015625 | Y56: =RC[-12]*RC[-12] -> 9.1506249999999928E-2 | Z56: =RC[-12]*RC[-12] -> 307.71006944444451 | AA56: =RC[-12]*RC[-12] -> 187.91840277777786 | AB56: =RC[-12]*RC[-12] -> 8265.8402777777792 | AC56: =RC[-12]*RC[-12] -> 1305.015625 | AD56: =RC[-12]*RC[-12] -> 405.015625 | AE56: =RC[-11]/SQRT(RC[-6]*RC[-1]) -> 1 | AF56: =RC[-11]/SQRT(RC[-6]*RC[-2]) -> 1 | AG56: =RC[-11]/SQRT(RC[-6]*RC[-3]) -> -1 | AH56: =RC[-11]/SQRT(RC[-6]*RC[-4]) -> 1 | AI56: =RC[-11]/SQRT(RC[-6]*RC[-5]) -> 1
A57: 5542 | B57: 北京 | C57: 89 | D57: 良 | E57: 0.73 | F57: 7 | G57: 65 | H57: 12 | I57: 81 | J57: 38 | L57: 2013-05-25T05:00:00.000 | M57: =RC[-8]-R[19]C[-8] -> -0.25249999999999995 | N57: =RC[-8]-R[19]C[-8] -> -17.541666666666668 | O57: =RC[-8]-R[19]C[-8] -> 12.708333333333336 | P57: =RC[-8]-R[19]C[-8] -> -89.916666666666671 | Q57: =RC[-8]-R[19]C[-8] -> -28.125 | R57: =RC[-8]-R[19]C[-8] -> -21.125 | T57: =RC[-7]*RC[-2] -> 5.334062499999999 | U57: =RC[-7]*RC[-3] -> 370.56770833333337 | V57: =RC[-7]*RC[-4] -> -268.46354166666674 | W57: =RC[-7]*RC[-5] -> 1899.4895833333335 | X57: =RC[-7]*RC[-6] -> 594.140625 | Y57: =RC[-12]*RC[-12] -> 6.3756249999999973E-2 | Z57: =RC[-12]*RC[-12] -> 307.71006944444451 | AA57: =RC[-12]*RC[-12] -> 161.50173611111117 | AB57: =RC[-12]*RC[-12] -> 8085.0069444444453 | AC57: =RC[-12]*RC[-12] -> 791.015625 | AD57: =RC[-12]*RC[-12] -> 446.265625 | AE57: =RC[-11]/SQRT(RC[-6]*RC[-1]) -> 1 | AF57: =RC[-11]/SQRT(RC[-6]*RC[-2]) -> 1 | AG57: =RC[-11]/SQRT(RC[-6]*RC[-3]) -> -1.0000000000000002 | AH57: =RC[-11]/SQRT(RC[-6]*RC[-4]) -> 1 | AI57: =RC[-11]/SQRT(RC[-6]*RC[-5]) -> 1
A58: 5618 | B58: 北京 | C58: 82 | D58: 良 | E58: 0.7 | F58: 8 | G58: 60 | H58: 12 | I58: 74 | J58: 37 | L58: 2013-05-25T06:00:00.000 | M58: =RC[-8]-R[18]C[-8] -> -0.28249999999999997 | N58: =RC[-8]-R[18]C[-8] -> -16.541666666666668 | O58: =RC[-8]-R[18]C[-8] -> 7.7083333333333357 | P58: =RC[-8]-R[18]C[-8] -> -89.916666666666671 | Q58: =RC[-8]-R[18]C[-8] -> -35.125 | R58: =RC[-8]-R[18]C[-8] -> -22.125 | T58: =RC[-7]*RC[-2] -> 6.2503124999999997 | U58: =RC[-7]*RC[-3] -> 365.984375 | V58: =RC[-7]*RC[-4] -> -170.54687500000006 | W58: =RC[-7]*RC[-5] -> 1989.40625 | X58: =RC[-7]*RC[-6] -> 777.140625 | Y58: =RC[-12]*RC[-12] -> 7.9806249999999981E-2 | Z58: =RC[-12]*RC[-12] -> 273.62673611111114 | AA58: =RC[-12]*RC[-12] -> 59.418402777777814 | AB58: =RC[-12]*RC[-12] -> 8085.0069444444453 | AC58: =RC[-12]*RC[-12] -> 1233.765625 | AD58: =RC[-12]*RC[-12] -> 489.515625 | AE58: =RC[-11]/SQRT(RC[-6]*RC[-1]) -> 1.0000000000000002 | AF58: =RC[-11]/SQRT(RC[-6]*RC[-2]) -> 0.99999999999999989 | AG58: =RC[-11]/SQRT(RC[-6]*RC[-3]) -> -1 | AH58: =RC[-11]/SQRT(RC[-6]*RC[-4]) -> 0.99999999999999989 | AI58: =RC[-11]/SQRT(RC[-6]*RC[-5]) -> 1
A59: 5694 | B59: 北京 | C59: 75 | D59: 良 | E59: 0.62 | F59: 10 | G59: 53 | H59: 17 | I59: 70 | J59: 33 | L59: 2013-05-25T07:00:00.000 | M59: =RC[-8]-R[17]C[-8] -> -0.36249999999999993 | N59: =RC[-8]-R[17]C[-8] -> -14.541666666666668 | O59: =RC[-8]-R[17]C[-8] -> 0.7083333333333357 | P59: =RC[-8]-R[17]C[-8] -> -84.916666666666671 | Q59: =RC[-8]-R[17]C[-8] -> -39.125 | R59: =RC[-8]-R[17]C[-8] -> -26.125 | T59: =RC[-7]*RC[-2] -> 9.4703124999999986 | U59: =RC[-7]*RC[-3] -> 379.90104166666669 | V59: =RC[-7]*RC[-4] -> -18.505208333333396 | W59: =RC[-7]*RC[-5] -> 2218.447916666667 | X59: =RC[-7]*RC[-6] -> 1022.140625 | Y59: =RC[-12]*RC[-12] -> 0.13140624999999995 | Z59: =RC[-12]*RC[-12] -> 211.46006944444449 | AA59: =RC[-12]*RC[-12] -> 0.50173611111111449 | AB59: =RC[-12]*RC[-12] -> 7210.8402777777783 | AC59: =RC[-12]*RC[-12] -> 1530.765625 | AD59: =RC[-12]*RC[-12] -> 682.515625 | AE59: =RC[-11]/SQRT(RC[-6]*RC[-1]) -> 1 | AF59: =RC[-11]/SQRT(RC[-6]*RC[-2]) -> 1 | AG59: =RC[-11]/SQRT(RC[-6]*RC[-3]) -> -1 | AH59: =RC[-11]/SQRT(RC[-6]*RC[-4]) -> 1.0000000000000002 | AI59: =RC[-11]/SQRT(RC[-6]*RC[-5]) -> 1
A60: 5770 | B60: 北京 | C60: 68 | D60: 良 | E60: 0.55000000000000004 | F60: 13 | G60: 47 | H60: 30 | I60: 58 | J60: 29 | L60: 2013-05-25T08:00:00.000 | M60: =RC[-8]-R[16]C[-8] -> -0.43249999999999988 | N60: =RC[-8]-R[16]C[-8] -> -11.541666666666668 | O60: =RC[-8]-R[16]C[-8] -> -5.2916666666666643 | P60: =RC[-8]-R[16]C[-8] -> -71.916666666666671 | Q60: =RC[-8]-R[16]C[-8] -> -51.125 | R60: =RC[-8]-R[16]C[-8] -> -30.125 | T60: =RC[-7]*RC[-2] -> 13.029062499999997 | U60: =RC[-7]*RC[-3] -> 347.69270833333337 | V60: =RC[-7]*RC[-4] -> 159.41145833333326 | W60: =RC[-7]*RC[-5] -> 2166.4895833333335 | X60: =RC[-7]*RC[-6] -> 1540.140625 | Y60: =RC[-12]*RC[-12] -> 0.1870562499999999 | Z60: =RC[-12]*RC[-12] -> 133.21006944444449 | AA60: =RC[-12]*RC[-12] -> 28.001736111111086 | AB60: =RC[-12]*RC[-12] -> 5172.0069444444453 | AC60: =RC[-12]*RC[-12] -> 2613.765625 | AD60: =RC[-12]*RC[-12] -> 907.515625 | AE60: =RC[-11]/SQRT(RC[-6]*RC[-1]) -> 1 | AF60: =RC[-11]/SQRT(RC[-6]*RC[-2]) -> 1 | AG60: =RC[-11]/SQRT(RC[-6]*RC[-3]) -> 1 | AH60: =RC[-11]/SQRT(RC[-6]*RC[-4]) -> 1 | AI60: =RC[-11]/SQRT(RC[-6]*RC[-5]) -> 1
A61: 5846 | B61: 北京 | C61: 65 | D61: 良 | E61: 0.6 | F61: 15 | G61: 48 | H61: 44 | I61: 62 | J61: 33 | L61: 2013-05-25T09:00:00.000 | M61: =RC[-8]-R[15]C[-8] -> -0.38249999999999995 | N61: =RC[-8]-R[15]C[-8] -> -9.5416666666666679 | O61: =RC[-8]-R[15]C[-8] -> -4.2916666666666643 | P61: =RC[-8]-R[15]C[-8] -> -57.916666666666671 | Q61: =RC[-8]-R[15]C[-8] -> -47.125 | R61: =RC[-8]-R[15]C[-8] -> -26.125 | T61: =RC[-7]*RC[-2] -> 9.9928124999999994 | U61: =RC[-7]*RC[-3] -> 249.27604166666669 | V61: =RC[-7]*RC[-4] -> 112.1197916666666 | W61: =RC[-7]*RC[-5] -> 1513.0729166666667 | X61: =RC[-7]*RC[-6] -> 1231.140625 | Y61: =RC[-12]*RC[-12] -> 0.14630624999999997 | Z61: =RC[-12]*RC[-12] -> 91.0434027777778 | AA61: =RC[-12]*RC[-12] -> 18.418402777777757 | AB61: =RC[-12]*RC[-12] -> 3354.3402777777783 | AC61: =RC[-12]*RC[-12] -> 2220.765625 | AD61: =RC[-12]*RC[-12] -> 682.515625 | AE61: =RC[-11]/SQRT(RC[-6]*RC[-1]) -> 1 | AF61: =RC[-11]/SQRT(RC[-6]*RC[-2]) -> 1 | AG61: =RC[-11]/SQRT(RC[-6]*RC[-3]) -> 1 | AH61: =RC[-11]/SQRT(RC[-6]*RC[-4]) -> 1 | AI61: =RC[-11]/SQRT(RC[-6]*RC[-5]) -> 1
A62: 5922 | B62: 北京 | C62: 64 | D62: 良 | E62: 0.68 | F62: 16 | G62: 52 | H62: 69 | I62: 62 | J62: 44 | L62: 2013-05-25T10:00:00.000 | M62: =RC[-8]-R[14]C[-8] -> -0.30249999999999988 | N62: =RC[-8]-R[14]C[-8] -> -8.5416666666666679 | O62: =RC[-8]-R[14]C[-8] -> -0.2916666666666643 | P62: =RC[-8]-R[14]C[-8] -> -32.916666666666671 | Q62: =RC[-8]-R[14]C[-8] -> -47.125 | R62: =RC[-8]-R[14]C[-8] -> -15.125 | T62: =RC[-7]*RC[-2] -> 4.5753124999999981 | U62: =RC[-7]*RC[-3] -> 129.19270833333334 | V62: =RC[-7]*RC[-4] -> 4.4114583333332975 | W62: =RC[-7]*RC[-5] -> 497.86458333333343 | X62: =RC[-7]*RC[-6] -> 712.765625 | Y62: =RC[-12]*RC[-12] -> 9.1506249999999928E-2 | Z62: =RC[-12]*RC[-12] -> 72.960069444444471 | AA62: =RC[-12]*RC[-12] -> 8.506944444444306E-2 | AB62: =RC[-12]*RC[-12] -> 1083.5069444444448 | AC62: =RC[-12]*RC[-12] -> 2220.765625 | AD62: =RC[-12]*RC[-12] -> 228.765625 | AE62: =RC[-11]/SQRT(RC[-6]*RC[-1]) -> 1 | AF62: =RC[-11]/SQRT(RC[-6]*RC[-2]) -> 1 | AG62: =RC[-11]/SQRT(RC[-6]*RC[-3]) -> 1 | AH62: =RC[-11]/SQRT(RC[-6]*RC[-4]) -> 1 | AI62: =RC[-11]/SQRT(RC[-6]*RC[-5]) -> 1
A63: 5998 | B63: 北京 | C63: 64 | D63: 良 | E63: 0.77 | F63: 21 | G63: 54 | H63: 96 | I63: 80 | J63: 51 | L63: 2013-05-25T11:00:00.000 | M63: =RC[-8]-R[13]C[-8] -> -0.21249999999999991 | N63: =RC[-8]-R[13]C[-8] -> -3.5416666666666679 | O63: =RC[-8]-R[13]C[-8] -> 1.7083333333333357 | P63: =RC[-8]-R[13]C[-8] -> -5.9166666666666714 | Q63: =RC[-8]-R[13]C[-8] -> -29.125 | R63: =RC[-8]-R[13]C[-8] -> -8.125 | T63: =RC[-7]*RC[-2] -> 1.7265624999999993 | U63: =RC[-7]*RC[-3] -> 28.776041666666675 | V63: =RC[-7]*RC[-4] -> -13.880208333333353 | W63: =RC[-7]*RC[-5] -> 48.072916666666707 | X63: =RC[-7]*RC[-6] -> 236.640625 | Y63: =RC[-12]*RC[-12] -> 4.515624999999996E-2 | Z63: =RC[-12]*RC[-12] -> 12.543402777777786 | AA63: =RC[-12]*RC[-12] -> 2.9184027777777857 | AB63: =RC[-12]*RC[-12] -> 35.0069444444445 | AC63: =RC[-12]*RC[-12] -> 848.265625 | AD63: =RC[-12]*RC[-12] -> 66.015625 | AE63: =RC[-11]/SQRT(RC[-6]*RC[-1]) -> 1 | AF63: =RC[-11]/SQRT(RC[-6]*RC[-2]) -> 1 | AG63: =RC[-11]/SQRT(RC[-6]*RC[-3]) -> -1.0000000000000002 | AH63: =RC[-11]/SQRT(RC[-6]*RC[-4]) -> 1 | AI63: =RC[-11]/SQRT(RC[-6]*RC[-5]) -> 1
A64: 6074 | B64: 北京 | C64: 65 | D64: 良 | E64: 1.0900000000000001 | F64: 38 | G64: 46 | H64: 129 | I64: 94 | J64: 56 | L64: 2013-05-25T12:00:00.000 | M64: =RC[-8]-R[12]C[-8] -> 0.10750000000000015 | N64: =RC[-8]-R[12]C[-8] -> 13.458333333333332 | O64: =RC[-8]-R[12]C[-8] -> -6.2916666666666643 | P64: =RC[-8]-R[12]C[-8] -> 27.083333333333329 | Q64: =RC[-8]-R[12]C[-8] -> -15.125 | R64: =RC[-8]-R[12]C[-8] -> -3.125 | T64: =RC[-7]*RC[-2] -> -0.33593750000000044 | U64: =RC[-7]*RC[-3] -> -42.057291666666664 | V64: =RC[-7]*RC[-4] -> 19.661458333333325 | W64: =RC[-7]*RC[-5] -> -84.635416666666657 | X64: =RC[-7]*RC[-6] -> 47.265625 | Y64: =RC[-12]*RC[-12] -> 1.1556250000000032E-2 | Z64: =RC[-12]*RC[-12] -> 181.12673611111109 | AA64: =RC[-12]*RC[-12] -> 39.585069444444414 | AB64: =RC[-12]*RC[-12] -> 733.50694444444423 | AC64: =RC[-12]*RC[-12] -> 228.765625 | AD64: =RC[-12]*RC[-12] -> 9.765625 | AE64: =RC[-11]/SQRT(RC[-6]*RC[-1]) -> -1 | AF64: =RC[-11]/SQRT(RC[-6]*RC[-2]) -> -1 | AG64: =RC[-11]/SQRT(RC[-6]*RC[-3]) -> 1 | AH64: =RC[-11]/SQRT(RC[-6]*RC[-4]) -> -1 | AI64: =RC[-11]/SQRT(RC[-6]*RC[-5]) -> 1
A65: 6150 | B65: 北京 | C65: 70 | D65: 良 | E65: 1.34 | F65: 49 | G65: 40 | H65: 162 | I65: 126 | J65: 64 | L65: 2013-05-25T13:00:00.000 | M65: =RC[-8]-R[11]C[-8] -> 0.35750000000000015 | N65: =RC[-8]-R[11]C[-8] -> 24.458333333333332 | O65: =RC[-8]-R[11]C[-8] -> -12.291666666666664 | P65: =RC[-8]-R[11]C[-8] -> 60.083333333333329 | Q65: =RC[-8]-R[11]C[-8] -> 16.875 | R65: =RC[-8]-R[11]C[-8] -> 4.875 | T65: =RC[-7]*RC[-2] -> 1.7428125000000008 | U65: =RC[-7]*RC[-3] -> 119.234375 | V65: =RC[-7]*RC[-4] -> -59.921874999999986 | W65: =RC[-7]*RC[-5] -> 292.90625 | X65: =RC[-7]*RC[-6] -> 82.265625 | Y65: =RC[-12]*RC[-12] -> 0.12780625000000012 | Z65: =RC[-12]*RC[-12] -> 598.21006944444434 | AA65: =RC[-12]*RC[-12] -> 151.0850694444444 | AB65: =RC[-12]*RC[-12] -> 3610.0069444444439 | AC65: =RC[-12]*RC[-12] -> 284.765625 | AD65: =RC[-12]*RC[-12] -> 23.765625 | AE65: =RC[-11]/SQRT(RC[-6]*RC[-1]) -> 1 | AF65: =RC[-11]/SQRT(RC[-6]*RC[-2]) -> 1.0000000000000002 | AG65: =RC[-11]/SQRT(RC[-6]*RC[-3]) -> -0.99999999999999989 | AH65: =RC[-11]/SQRT(RC[-6]*RC[-4]) -> 1 | AI65: =RC[-11]/SQRT(RC[-6]*RC[-5]) -> 1
A66: 6226 | B66: 北京 | C66: 91 | D66: 良 | E66: 1.39 | F66: 46 | G66: 40 | H66: 193 | I66: 134 | J66: 80 | L66: 2013-05-25T14:00:00.000 | M66: =RC[-8]-R[10]C[-8] -> 0.40749999999999997 | N66: =RC[-8]-R[10]C[-8] -> 21.458333333333332 | O66: =RC[-8]-R[10]C[-8] -> -12.291666666666664 | P66: =RC[-8]-R[10]C[-8] -> 91.083333333333329 | Q66: =RC[-8]-R[10]C[-8] -> 24.875 | R66: =RC[-8]-R[10]C[-8] -> 20.875 | T66: =RC[-7]*RC[-2] -> 8.5065624999999994 | U66: =RC[-7]*RC[-3] -> 447.94270833333331 | V66: =RC[-7]*RC[-4] -> -256.58854166666663 | W66: =RC[-7]*RC[-5] -> 1901.3645833333333 | X66: =RC[-7]*RC[-6] -> 519.265625 | Y66: =RC[-12]*RC[-12] -> 0.16605624999999999 | Z66: =RC[-12]*RC[-12] -> 460.4600694444444 | AA66: =RC[-12]*RC[-12] -> 151.0850694444444 | AB66: =RC[-12]*RC[-12] -> 8296.1736111111095 | AC66: =RC[-12]*RC[-12] -> 618.765625 | AD66: =RC[-12]*RC[-12] -> 435.765625 | AE66: =RC[-11]/SQRT(RC[-6]*RC[-1]) -> 1 | AF66: =RC[-11]/SQRT(RC[-6]*RC[-2]) -> 1 | AG66: =RC[-11]/SQRT(RC[-6]*RC[-3]) -> -1 | AH66: =RC[-11]/SQRT(RC[-6]*RC[-4]) -> 1.0000000000000002 | AI66: =RC[-11]/SQRT(RC[-6]*RC[-5]) -> 1
A67: 6302 | B67: 北京 | C67: 111 | D67: 轻度污染 | E67: 1.57 | F67: 52 | G67: 40 | H67: 222 | I67: 141 | J67: 93 | L67: 2013-05-25T15:00:00.000 | M67: =RC[-8]-R[9]C[-8] -> 0.58750000000000013 | N67: =RC[-8]-R[9]C[-8] -> 27.458333333333332 | O67: =RC[-8]-R[9]C[-8] -> -12.291666666666664 | P67: =RC[-8]-R[9]C[-8] -> 120.08333333333333 | Q67: =RC[-8]-R[9]C[-8] -> 31.875 | R67: =RC[-8]-R[9]C[-8] -> 33.875 | T67: =RC[-7]*RC[-2] -> 19.901562500000004 | U67: =RC[-7]*RC[-3] -> 930.15104166666663 | V67: =RC[-7]*RC[-4] -> -416.38020833333326 | W67: =RC[-7]*RC[-5] -> 4067.8229166666665 | X67: =RC[-7]*RC[-6] -> 1079.765625 | Y67: =RC[-12]*RC[-12] -> 0.34515625000000016 | Z67: =RC[-12]*RC[-12] -> 753.96006944444434 | AA67: =RC[-12]*RC[-12] -> 151.0850694444444 | AB67: =RC[-12]*RC[-12] -> 14420.006944444443 | AC67: =RC[-12]*RC[-12] -> 1016.015625 | AD67: =RC[-12]*RC[-12] -> 1147.515625 | AE67: =RC[-11]/SQRT(RC[-6]*RC[-1]) -> 1 | AF67: =RC[-11]/SQRT(RC[-6]*RC[-2]) -> 1 | AG67: =RC[-11]/SQRT(RC[-6]*RC[-3]) -> -1 | AH67: =RC[-11]/SQRT(RC[-6]*RC[-4]) -> 1 | AI67: =RC[-11]/SQRT(RC[-6]*RC[-5]) -> 1
A68: 6378 | B68: 北京 | C68: 123 | D68: 轻度污染 | E68: 1.67 | F68: 54 | G68: 40 | H68: 245 | I68: 166 | J68: 99 | L68: 2013-05-25T16:00:00.000 | M68: =RC[-8]-R[8]C[-8] -> 0.6875 | N68: =RC[-8]-R[8]C[-8] -> 29.458333333333332 | O68: =RC[-8]-R[8]C[-8] -> -12.291666666666664 | P68: =RC[-8]-R[8]C[-8] -> 143.08333333333331 | Q68: =RC[-8]-R[8]C[-8] -> 56.875 | R68: =RC[-8]-R[8]C[-8] -> 39.875 | T68: =RC[-7]*RC[-2] -> 27.4140625 | U68: =RC[-7]*RC[-3] -> 1174.6510416666665 | V68: =RC[-7]*RC[-4] -> -490.13020833333326 | W68: =RC[-7]*RC[-5] -> 5705.4479166666661 | X68: =RC[-7]*RC[-6] -> 2267.890625 | Y68: =RC[-12]*RC[-12] -> 0.47265625 | Z68: =RC[-12]*RC[-12] -> 867.79340277777771 | AA68: =RC[-12]*RC[-12] -> 151.0850694444444 | AB68: =RC[-12]*RC[-12] -> 20472.840277777774 | AC68: =RC[-12]*RC[-12] -> 3234.765625 | AD68: =RC[-12]*RC[-12] -> 1590.015625 | AE68: =RC[-11]/SQRT(RC[-6]*RC[-1]) -> 1 | AF68: =RC[-11]/SQRT(RC[-6]*RC[-2]) -> 1 | AG68: =RC[-11]/SQRT(RC[-6]*RC[-3]) -> -1 | AH68: =RC[-11]/SQRT(RC[-6]*RC[-4]) -> 1 | AI68: =RC[-11]/SQRT(RC[-6]*RC[-5]) -> 1
A69: 6454 | B69: 北京 | C69: 126 | D69: 轻度污染 | E69: 1.63 | F69: 48 | G69: 41 | H69: 252 | I69: 157 | J69: 96 | L69: 2013-05-25T17:00:00.000 | M69: =RC[-8]-R[7]C[-8] -> 0.64749999999999996 | N69: =RC[-8]-R[7]C[-8] -> 23.458333333333332 | O69: =RC[-8]-R[7]C[-8] -> -11.291666666666664 | P69: =RC[-8]-R[7]C[-8] -> 150.08333333333331 | Q69: =RC[-8]-R[7]C[-8] -> 47.875 | R69: =RC[-8]-R[7]C[-8] -> 36.875 | T69: =RC[-7]*RC[-2] -> 23.876562499999999 | U69: =RC[-7]*RC[-3] -> 865.02604166666663 | V69: =RC[-7]*RC[-4] -> -416.38020833333326 | W69: =RC[-7]*RC[-5] -> 5534.3229166666661 | X69: =RC[-7]*RC[-6] -> 1765.390625 | Y69: =RC[-12]*RC[-12] -> 0.41925624999999994 | Z69: =RC[-12]*RC[-12] -> 550.29340277777771 | AA69: =RC[-12]*RC[-12] -> 127.50173611111106 | AB69: =RC[-12]*RC[-12] -> 22525.006944444438 | AC69: =RC[-12]*RC[-12] -> 2292.015625 | AD69: =RC[-12]*RC[-12] -> 1359.765625 | AE69: =RC[-11]/SQRT(RC[-6]*RC[-1]) -> 1 | AF69: =RC[-11]/SQRT(RC[-6]*RC[-2]) -> 1 | AG69: =RC[-11]/SQRT(RC[-6]*RC[-3]) -> -1 | AH69: =RC[-11]/SQRT(RC[-6]*RC[-4]) -> 1 | AI69: =RC[-11]/SQRT(RC[-6]*RC[-5]) -> 1
A70: 6530 | B70: 北京 | C70: 129 | D70: 轻度污染 | E70: 1.47 | F70: 42 | G70: 41 | H70: 237 | I70: 151 | J70: 89 | L70: 2013-05-25T18:00:00.000 | M70: =RC[-8]-R[6]C[-8] -> 0.48750000000000004 | N70: =RC[-8]-R[6]C[-8] -> 17.458333333333332 | O70: =RC[-8]-R[6]C[-8] -> -11.291666666666664 | P70: =RC[-8]-R[6]C[-8] -> 135.08333333333331 | Q70: =RC[-8]-R[6]C[-8] -> 41.875 | R70: =RC[-8]-R[6]C[-8] -> 29.875 | T70: =RC[-7]*RC[-2] -> 14.564062500000002 | U70: =RC[-7]*RC[-3] -> 521.56770833333326 | V70: =RC[-7]*RC[-4] -> -337.33854166666657 | W70: =RC[-7]*RC[-5] -> 4035.6145833333326 | X70: =RC[-7]*RC[-6] -> 1251.015625 | Y70: =RC[-12]*RC[-12] -> 0.23765625000000004 | Z70: =RC[-12]*RC[-12] -> 304.79340277777771 | AA70: =RC[-12]*RC[-12] -> 127.50173611111106 | AB70: =RC[-12]*RC[-12] -> 18247.506944444438 | AC70: =RC[-12]*RC[-12] -> 1753.515625 | AD70: =RC[-12]*RC[-12] -> 892.515625 | AE70: =RC[-11]/SQRT(RC[-6]*RC[-1]) -> 1 | AF70: =RC[-11]/SQRT(RC[-6]*RC[-2]) -> 1 | AG70: =RC[-11]/SQRT(RC[-6]*RC[-3]) -> -1 | AH70: =RC[-11]/SQRT(RC[-6]*RC[-4]) -> 1 | AI70: =RC[-11]/SQRT(RC[-6]*RC[-5]) -> 1
A71: 6606 | B71: 北京 | C71: 143 | D71: 轻度污染 | E71: 1.42 | F71: 38 | G71: 44 | H71: 217 | I71: 147 | J71: 87 | L71: 2013-05-25T19:00:00.000 | M71: =RC[-8]-R[5]C[-8] -> 0.4375 | N71: =RC[-8]-R[5]C[-8] -> 13.458333333333332 | O71: =RC[-8]-R[5]C[-8] -> -8.2916666666666643 | P71: =RC[-8]-R[5]C[-8] -> 115.08333333333333 | Q71: =RC[-8]-R[5]C[-8] -> 37.875 | R71: =RC[-8]-R[5]C[-8] -> 27.875 | T71: =RC[-7]*RC[-2] -> 12.1953125 | U71: =RC[-7]*RC[-3] -> 375.15104166666663 | V71: =RC[-7]*RC[-4] -> -231.13020833333326 | W71: =RC[-7]*RC[-5] -> 3207.9479166666665 | X71: =RC[-7]*RC[-6] -> 1055.765625 | Y71: =RC[-12]*RC[-12] -> 0.19140625 | Z71: =RC[-12]*RC[-12] -> 181.12673611111109 | AA71: =RC[-12]*RC[-12] -> 68.751736111111072 | AB71: =RC[-12]*RC[-12] -> 13244.173611111109 | AC71: =RC[-12]*RC[-12] -> 1434.515625 | AD71: =RC[-12]*RC[-12] -> 777.015625 | AE71: =RC[-11]/SQRT(RC[-6]*RC[-1]) -> 1 | AF71: =RC[-11]/SQRT(RC[-6]*RC[-2]) -> 0.99999999999999989 | AG71: =RC[-11]/SQRT(RC[-6]*RC[-3]) -> -0.99999999999999989 | AH71: =RC[-11]/SQRT(RC[-6]*RC[-4]) -> 1 | AI71: =RC[-11]/SQRT(RC[-6]*RC[-5]) -> 1
A72: 6682 | B72: 北京 | C72: 149 | D72: 轻度污染 | E72: 1.43 | F72: 35 | G72: 56 | H72: 176 | I72: 165 | J72: 84 | L72: 2013-05-25T20:00:00.000 | M72: =RC[-8]-R[4]C[-8] -> 0.44750000000000001 | N72: =RC[-8]-R[4]C[-8] -> 10.458333333333332 | O72: =RC[-8]-R[4]C[-8] -> 3.7083333333333357 | P72: =RC[-8]-R[4]C[-8] -> 74.083333333333329 | Q72: =RC[-8]-R[4]C[-8] -> 55.875 | R72: =RC[-8]-R[4]C[-8] -> 24.875 | T72: =RC[-7]*RC[-2] -> 11.131562499999999 | U72: =RC[-7]*RC[-3] -> 260.15104166666663 | V72: =RC[-7]*RC[-4] -> 92.244791666666728 | W72: =RC[-7]*RC[-5] -> 1842.8229166666665 | X72: =RC[-7]*RC[-6] -> 1389.890625 | Y72: =RC[-12]*RC[-12] -> 0.20025625 | Z72: =RC[-12]*RC[-12] -> 109.37673611111109 | AA72: =RC[-12]*RC[-12] -> 13.751736111111128 | AB72: =RC[-12]*RC[-12] -> 5488.3402777777774 | AC72: =RC[-12]*RC[-12] -> 3122.015625 | AD72: =RC[-12]*RC[-12] -> 618.765625 | AE72: =RC[-11]/SQRT(RC[-6]*RC[-1]) -> 1 | AF72: =RC[-11]/SQRT(RC[-6]*RC[-2]) -> 1 | AG72: =RC[-11]/SQRT(RC[-6]*RC[-3]) -> 1 | AH72: =RC[-11]/SQRT(RC[-6]*RC[-4]) -> 1 | AI72: =RC[-11]/SQRT(RC[-6]*RC[-5]) -> 1
A73: 6758 | B73: 北京 | C73: 145 | D73: 轻度污染 | E73: 1.1299999999999999 | F73: 26 | G73: 57 | H73: 124 | I73: 211 | J73: 80 | L73: 2013-05-25T21:00:00.000 | M73: =RC[-8]-R[3]C[-8] -> 0.14749999999999996 | N73: =RC[-8]-R[3]C[-8] -> 1.4583333333333321 | O73: =RC[-8]-R[3]C[-8] -> 4.7083333333333357 | P73: =RC[-8]-R[3]C[-8] -> 22.083333333333329 | Q73: =RC[-8]-R[3]C[-8] -> 101.875 | R73: =RC[-8]-R[3]C[-8] -> 20.875 | T73: =RC[-7]*RC[-2] -> 3.0790624999999991 | U73: =RC[-7]*RC[-3] -> 30.442708333333307 | V73: =RC[-7]*RC[-4] -> 98.286458333333385 | W73: =RC[-7]*RC[-5] -> 460.98958333333326 | X73: =RC[-7]*RC[-6] -> 2126.640625 | Y73: =RC[-12]*RC[-12] -> 2.1756249999999991E-2 | Z73: =RC[-12]*RC[-12] -> 2.1267361111111076 | AA73: =RC[-12]*RC[-12] -> 22.1684027777778 | AB73: =RC[-12]*RC[-12] -> 487.67361111111092 | AC73: =RC[-12]*RC[-12] -> 10378.515625 | AD73: =RC[-12]*RC[-12] -> 435.765625 | AE73: =RC[-11]/SQRT(RC[-6]*RC[-1]) -> 1 | AF73: =RC[-11]/SQRT(RC[-6]*RC[-2]) -> 1 | AG73: =RC[-11]/SQRT(RC[-6]*RC[-3]) -> 1 | AH73: =RC[-11]/SQRT(RC[-6]*RC[-4]) -> 1 | AI73: =RC[-11]/SQRT(RC[-6]*RC[-5]) -> 1
A74: 6834 | B74: 北京 | C74: 131 | D74: 轻度污染 | E74: 0.91 | F74: 17 | G74: 58 | H74: 74 | I74: 162 | J74: 79 | L74: 2013-05-25T22:00:00.000 | M74: =RC[-8]-R[2]C[-8] -> -7.2499999999999898E-2 | N74: =RC[-8]-R[2]C[-8] -> -7.5416666666666679 | O74: =RC[-8]-R[2]C[-8] -> 5.7083333333333357 | P74: =RC[-8]-R[2]C[-8] -> -27.916666666666671 | Q74: =RC[-8]-R[2]C[-8] -> 52.875 | R74: =RC[-8]-R[2]C[-8] -> 19.875 | T74: =RC[-7]*RC[-2] -> -1.440937499999998 | U74: =RC[-7]*RC[-3] -> -149.89062500000003 | V74: =RC[-7]*RC[-4] -> 113.45312500000004 | W74: =RC[-7]*RC[-5] -> -554.84375000000011 | X74: =RC[-7]*RC[-6] -> 1050.890625 | Y74: =RC[-12]*RC[-12] -> 5.2562499999999849E-3 | Z74: =RC[-12]*RC[-12] -> 56.876736111111128 | AA74: =RC[-12]*RC[-12] -> 32.585069444444471 | AB74: =RC[-12]*RC[-12] -> 779.34027777777806 | AC74: =RC[-12]*RC[-12] -> 2795.765625 | AD74: =RC[-12]*RC[-12] -> 395.015625 | AE74: =RC[-11]/SQRT(RC[-6]*RC[-1]) -> -1 | AF74: =RC[-11]/SQRT(RC[-6]*RC[-2]) -> -1 | AG74: =RC[-11]/SQRT(RC[-6]*RC[-3]) -> 1 | AH74: =RC[-11]/SQRT(RC[-6]*RC[-4]) -> -1 | AI74: =RC[-11]/SQRT(RC[-6]*RC[-5]) -> 1
A75: 6910 | B75: 北京 | C75: 111 | D75: 轻度污染 | E75: 0.89 | F75: 16 | G75: 63 | H75: 43 | I75: 134 | J75: 79 | L75: 2013-05-25T23:00:00.000 | M75: =RC[-8]-R[1]C[-8] -> -9.2499999999999916E-2 | N75: =RC[-8]-R[1]C[-8] -> -8.5416666666666679 | O75: =RC[-8]-R[1]C[-8] -> 10.708333333333336 | P75: =RC[-8]-R[1]C[-8] -> -58.916666666666671 | Q75: =RC[-8]-R[1]C[-8] -> 24.875 | R75: =RC[-8]-R[1]C[-8] -> 19.875 | T75: =RC[-7]*RC[-2] -> -1.8384374999999984 | U75: =RC[-7]*RC[-3] -> -169.76562500000003 | V75: =RC[-7]*RC[-4] -> 212.82812500000006 | W75: =RC[-7]*RC[-5] -> -1170.96875 | X75: =RC[-7]*RC[-6] -> 494.390625 | Y75: =RC[-12]*RC[-12] -> 8.556249999999984E-3 | Z75: =RC[-12]*RC[-12] -> 72.960069444444471 | AA75: =RC[-12]*RC[-12] -> 114.66840277777783 | AB75: =RC[-12]*RC[-12] -> 3471.1736111111118 | AC75: =RC[-12]*RC[-12] -> 618.765625 | AD75: =RC[-12]*RC[-12] -> 395.015625 | AE75: =RC[-11]/SQRT(RC[-6]*RC[-1]) -> -1.0000000000000002 | AF75: =RC[-11]/SQRT(RC[-6]*RC[-2]) -> -1 | AG75: =RC[-11]/SQRT(RC[-6]*RC[-3]) -> 1 | AH75: =RC[-11]/SQRT(RC[-6]*RC[-4]) -> -1 | AI75: =RC[-11]/SQRT(RC[-6]*RC[-5]) -> 1
E76: =AVERAGE(R[-24]C:R[-1]C) -> 0.98249999999999993 | F76: =AVERAGE(R[-24]C:R[-1]C) -> 24.541666666666668 | G76: =AVERAGE(R[-24]C:R[-1]C) -> 52.291666666666664 | H76: =AVERAGE(R[-24]C:R[-1]C) -> 101.91666666666667 | I76: =AVERAGE(R[-24]C:R[-1]C) -> 109.125 | J76: =AVERAGE(R[-24]C:R[-1]C) -> 59.125 | M76: =RC[-8]-RC[-8] -> 0 | N76: =RC[-8]-RC[-8] -> 0 | O76: =RC[-8]-RC[-8] -> 0 | P76: =RC[-8]-RC[-8] -> 0 | Q76: =RC[-8]-RC[-8] -> 0 | R76: =RC[-8]-RC[-8] -> 0 | T76: =SUM(R[-24]C:R[-1]C) -> 219.2825 | U76: =SUM(R[-24]C:R[-1]C) -> 8397.375 | V76: =SUM(R[-24]C:R[-1]C) -> -3054.875 | W76: =SUM(R[-24]C:R[-1]C) -> 46115.25 | X76: =SUM(R[-24]C:R[-1]C) -> 24510.625 | Y76: =SUM(R[-24]C:R[-1]C) -> 3.7062499999999998 | Z76: =SUM(R[-24]C:R[-1]C) -> 6677.958333333333 | AA76: =SUM(R[-24]C:R[-1]C) -> 1934.9583333333335 | AB76: =SUM(R[-24]C:R[-1]C) -> 179847.83333333331 | AC76: =SUM(R[-24]C:R[-1]C) -> 47618.625 | AD76: =SUM(R[-24]C:R[-1]C) -> 14922.625 | AE76: =RC[-11]/SQRT(RC[-6]*RC[-1]) -> 0.93242520731466272 | AF76: =RC[-11]/SQRT(RC[-6]*RC[-2]) -> 0.84119964862329322 | AG76: =RC[-11]/SQRT(RC[-6]*RC[-3]) -> -0.56850596114275731 | AH76: =RC[-11]/SQRT(RC[-6]*RC[-4]) -> 0.89016261237398708 | AI76: =RC[-11]/SQRT(RC[-6]*RC[-5]) -> 0.91948224464478445
A77: 6986 | B77: 北京 | C77: 97 | D77: 良 | E77: 0.93 | F77: 16 | G77: 67 | H77: 26 | I77: 112 | J77: 79 | L77: 2013-05-26T00:00:00.000 | M77: =RC[-8]-R[24]C[-8] -> -0.50124999999999964 | N77: =RC[-8]-R[24]C[-8] -> -13.291666666666668 | O77: =RC[-8]-R[24]C[-8] -> 19.083333333333336 | P77: =RC[-8]-R[24]C[-8] -> -16.75 | Q77: =RC[-8]-R[24]C[-8] -> -4.1666666666666714 | R77: =RC[-8]-R[24]C[-8] -> -18.625 | T77: =RC[-7]*RC[-2] -> 9.335781249999993 | U77: =RC[-7]*RC[-3] -> 247.55729166666669 | V77: =RC[-7]*RC[-4] -> -355.42708333333337 | W77: =RC[-7]*RC[-5] -> 311.96875 | X77: =RC[-7]*RC[-6] -> 77.604166666666757 | Y77: =RC[-12]*RC[-12] -> 0.25125156249999964 | Z77: =RC[-12]*RC[-12] -> 176.6684027777778 | AA77: =RC[-12]*RC[-12] -> 364.1736111111112 | AB77: =RC[-12]*RC[-12] -> 280.5625 | AC77: =RC[-12]*RC[-12] -> 17.36111111111115 | AD77: =RC[-12]*RC[-12] -> 346.890625 | AE77: =RC[-11]/SQRT(RC[-6]*RC[-1]) -> 1 | AF77: =RC[-11]/SQRT(RC[-6]*RC[-2]) -> 1 | AG77: =RC[-11]/SQRT(RC[-6]*RC[-3]) -> -1 | AH77: =RC[-11]/SQRT(RC[-6]*RC[-4]) -> 1 | AI77: =RC[-11]/SQRT(RC[-6]*RC[-5]) -> 1
A78: 7062 | B78: 北京 | C78: 92 | D78: 良 | E78: 0.91 | F78: 17 | G78: 61 | H78: 23 | I78: 114 | J78: 87 | L78: 2013-05-26T01:00:00.000 | M78: =RC[-8]-R[23]C[-8] -> -0.52124999999999966 | N78: =RC[-8]-R[23]C[-8] -> -12.291666666666668 | O78: =RC[-8]-R[23]C[-8] -> 13.083333333333336 | P78: =RC[-8]-R[23]C[-8] -> -19.75 | Q78: =RC[-8]-R[23]C[-8] -> -2.1666666666666714 | R78: =RC[-8]-R[23]C[-8] -> -10.625 | T78: =RC[-7]*RC[-2] -> 5.5382812499999963 | U78: =RC[-7]*RC[-3] -> 130.59895833333334 | V78: =RC[-7]*RC[-4] -> -139.01041666666669 | W78: =RC[-7]*RC[-5] -> 209.84375 | X78: =RC[-7]*RC[-6] -> 23.020833333333385 | Y78: =RC[-12]*RC[-12] -> 0.27170156249999966 | Z78: =RC[-12]*RC[-12] -> 151.08506944444449 | AA78: =RC[-12]*RC[-12] -> 171.17361111111117 | AB78: =RC[-12]*RC[-12] -> 390.0625 | AC78: =RC[-12]*RC[-12] -> 4.6944444444444651 | AD78: =RC[-12]*RC[-12] -> 112.890625 | AE78: =RC[-11]/SQRT(RC[-6]*RC[-1]) -> 1 | AF78: =RC[-11]/SQRT(RC[-6]*RC[-2]) -> 1 | AG78: =RC[-11]/SQRT(RC[-6]*RC[-3]) -> -1 | AH78: =RC[-11]/SQRT(RC[-6]*RC[-4]) -> 1 | AI78: =RC[-11]/SQRT(RC[-6]*RC[-5]) -> 1
A79: 7138 | B79: 北京 | C79: 90 | D79: 良 | E79: 0.82 | F79: 19 | G79: 55 | H79: 28 | I79: 106 | J79: 91 | L79: 2013-05-26T02:00:00.000 | M79: =RC[-8]-R[22]C[-8] -> -0.61124999999999974 | N79: =RC[-8]-R[22]C[-8] -> -10.291666666666668 | O79: =RC[-8]-R[22]C[-8] -> 7.0833333333333357 | P79: =RC[-8]-R[22]C[-8] -> -14.75 | Q79: =RC[-8]-R[22]C[-8] -> -10.166666666666671 | R79: =RC[-8]-R[22]C[-8] -> -6.625 | T79: =RC[-7]*RC[-2] -> 4.0495312499999985 | U79: =RC[-7]*RC[-3] -> 68.182291666666671 | V79: =RC[-7]*RC[-4] -> -46.92708333333335 | W79: =RC[-7]*RC[-5] -> 97.71875 | X79: =RC[-7]*RC[-6] -> 67.3541666666667 | Y79: =RC[-12]*RC[-12] -> 0.3736265624999997 | Z79: =RC[-12]*RC[-12] -> 105.9184027777778 | AA79: =RC[-12]*RC[-12] -> 50.173611111111143 | AB79: =RC[-12]*RC[-12] -> 217.5625 | AC79: =RC[-12]*RC[-12] -> 103.36111111111121 | AD79: =RC[-12]*RC[-12] -> 43.890625 | AE79: =RC[-11]/SQRT(RC[-6]*RC[-1]) -> 1 | AF79: =RC[-11]/SQRT(RC[-6]*RC[-2]) -> 1 | AG79: =RC[-11]/SQRT(RC[-6]*RC[-3]) -> -1 | AH79: =RC[-11]/SQRT(RC[-6]*RC[-4]) -> 1 | AI79: =RC[-11]/SQRT(RC[-6]*RC[-5]) -> 1
A80: 7214 | B80: 北京 | C80: 92 | D80: 良 | E80: 0.78 | F80: 20 | G80: 46 | H80: 41 | I80: 101 | J80: 91 | L80: 2013-05-26T03:00:00.000 | M80: =RC[-8]-R[21]C[-8] -> -0.65124999999999966 | N80: =RC[-8]-R[21]C[-8] -> -9.2916666666666679 | O80: =RC[-8]-R[21]C[-8] -> -1.9166666666666643 | P80: =RC[-8]-R[21]C[-8] -> -1.75 | Q80: =RC[-8]-R[21]C[-8] -> -15.166666666666671 | R80: =RC[-8]-R[21]C[-8] -> -6.625 | T80: =RC[-7]*RC[-2] -> 4.3145312499999982 | U80: =RC[-7]*RC[-3] -> 61.557291666666671 | V80: =RC[-7]*RC[-4] -> 12.69791666666665 | W80: =RC[-7]*RC[-5] -> 11.59375 | X80: =RC[-7]*RC[-6] -> 100.4791666666667 | Y80: =RC[-12]*RC[-12] -> 0.42412656249999958 | Z80: =RC[-12]*RC[-12] -> 86.335069444444471 | AA80: =RC[-12]*RC[-12] -> 3.6736111111111018 | AB80: =RC[-12]*RC[-12] -> 3.0625 | AC80: =RC[-12]*RC[-12] -> 230.02777777777791 | AD80: =RC[-12]*RC[-12] -> 43.890625 | AE80: =RC[-11]/SQRT(RC[-6]*RC[-1]) -> 1 | AF80: =RC[-11]/SQRT(RC[-6]*RC[-2]) -> 0.99999999999999989 | AG80: =RC[-11]/SQRT(RC[-6]*RC[-3]) -> 0.99999999999999989 | AH80: =RC[-11]/SQRT(RC[-6]*RC[-4]) -> 1 | AI80: =RC[-11]/SQRT(RC[-6]*RC[-5]) -> 1.0000000000000002
A81: 7290 | B81: 北京 | C81: 95 | D81: 良 | E81: 0.85 | F81: 24 | G81: 40 | H81: 39 | I81: 105 | J81: 99 | L81: 2013-05-26T04:00:00.000 | M81: =RC[-8]-R[20]C[-8] -> -0.58124999999999971 | N81: =RC[-8]-R[20]C[-8] -> -5.2916666666666679 | O81: =RC[-8]-R[20]C[-8] -> -7.9166666666666643 | P81: =RC[-8]-R[20]C[-8] -> -3.75 | Q81: =RC[-8]-R[20]C[-8] -> -11.166666666666671 | R81: =RC[-8]-R[20]C[-8] -> 1.375 | T81: =RC[-7]*RC[-2] -> -0.79921874999999964 | U81: =RC[-7]*RC[-3] -> -7.2760416666666679 | V81: =RC[-7]*RC[-4] -> -10.885416666666664 | W81: =RC[-7]*RC[-5] -> -5.15625 | X81: =RC[-7]*RC[-6] -> -15.354166666666673 | Y81: =RC[-12]*RC[-12] -> 0.33785156249999965 | Z81: =RC[-12]*RC[-12] -> 28.001736111111125 | AA81: =RC[-12]*RC[-12] -> 62.673611111111072 | AB81: =RC[-12]*RC[-12] -> 14.0625 | AC81: =RC[-12]*RC[-12] -> 124.69444444444456 | AD81: =RC[-12]*RC[-12] -> 1.890625 | AE81: =RC[-11]/SQRT(RC[-6]*RC[-1]) -> -1 | AF81: =RC[-11]/SQRT(RC[-6]*RC[-2]) -> -0.99999999999999989 | AG81: =RC[-11]/SQRT(RC[-6]*RC[-3]) -> -1.0000000000000002 | AH81: =RC[-11]/SQRT(RC[-6]*RC[-4]) -> -1 | AI81: =RC[-11]/SQRT(RC[-6]*RC[-5]) -> -1
A82: 7366 | B82: 北京 | C82: 98 | D82: 良 | E82: 1.1000000000000001 | F82: 30 | G82: 41 | H82: 35 | I82: 111 | J82: 100 | L82: 2013-05-26T05:00:00.000 | M82: =RC[-8]-R[19]C[-8] -> -0.3312499999999996 | N82: =RC[-8]-R[19]C[-8] -> 0.70833333333333215 | O82: =RC[-8]-R[19]C[-8] -> -6.9166666666666643 | P82: =RC[-8]-R[19]C[-8] -> -7.75 | Q82: =RC[-8]-R[19]C[-8] -> -5.1666666666666714 | R82: =RC[-8]-R[19]C[-8] -> 2.375 | T82: =RC[-7]*RC[-2] -> -0.78671874999999902 | U82: =RC[-7]*RC[-3] -> 1.6822916666666639 | V82: =RC[-7]*RC[-4] -> -16.427083333333329 | W82: =RC[-7]*RC[-5] -> -18.40625 | X82: =RC[-7]*RC[-6] -> -12.270833333333345 | Y82: =RC[-12]*RC[-12] -> 0.10972656249999974 | Z82: =RC[-12]*RC[-12] -> 0.50173611111110938 | AA82: =RC[-12]*RC[-12] -> 47.840277777777743 | AB82: =RC[-12]*RC[-12] -> 60.0625 | AC82: =RC[-12]*RC[-12] -> 26.694444444444493 | AD82: =RC[-12]*RC[-12] -> 5.640625 | AE82: =RC[-11]/SQRT(RC[-6]*RC[-1]) -> -1 | AF82: =RC[-11]/SQRT(RC[-6]*RC[-2]) -> 1 | AG82: =RC[-11]/SQRT(RC[-6]*RC[-3]) -> -1 | AH82: =RC[-11]/SQRT(RC[-6]*RC[-4]) -> -1 | AI82: =RC[-11]/SQRT(RC[-6]*RC[-5]) -> -1
A83: 7442 | B83: 北京 | C83: 102 | D83: 轻度污染 | E83: 1.42 | F83: 42 | G83: 48 | H83: 29 | I83: 131 | J83: 113 | L83: 2013-05-26T06:00:00.000 | M83: =RC[-8]-R[18]C[-8] -> -1.124999999999976E-2 | N83: =RC[-8]-R[18]C[-8] -> 12.708333333333332 | O83: =RC[-8]-R[18]C[-8] -> 8.3333333333335702E-2 | P83: =RC[-8]-R[18]C[-8] -> -13.75 | Q83: =RC[-8]-R[18]C[-8] -> 14.833333333333329 | R83: =RC[-8]-R[18]C[-8] -> 15.375 | T83: =RC[-7]*RC[-2] -> -0.17296874999999631 | U83: =RC[-7]*RC[-3] -> 195.39062499999997 | V83: =RC[-7]*RC[-4] -> 1.2812500000000364 | W83: =RC[-7]*RC[-5] -> -211.40625 | X83: =RC[-7]*RC[-6] -> 228.06249999999991 | Y83: =RC[-12]*RC[-12] -> 1.265624999999946E-4 | Z83: =RC[-12]*RC[-12] -> 161.50173611111109 | AA83: =RC[-12]*RC[-12] -> 6.9444444444448396E-3 | AB83: =RC[-12]*RC[-12] -> 189.0625 | AC83: =RC[-12]*RC[-12] -> 220.02777777777763 | AD83: =RC[-12]*RC[-12] -> 236.390625 | AE83: =RC[-11]/SQRT(RC[-6]*RC[-1]) -> -1 | AF83: =RC[-11]/SQRT(RC[-6]*RC[-2]) -> 1 | AG83: =RC[-11]/SQRT(RC[-6]*RC[-3]) -> 1 | AH83: =RC[-11]/SQRT(RC[-6]*RC[-4]) -> -1 | AI83: =RC[-11]/SQRT(RC[-6]*RC[-5]) -> 1
A84: 7518 | B84: 北京 | C84: 107 | D84: 轻度污染 | E84: 1.52 | F84: 51 | G84: 51 | H84: 26 | I84: 141 | J84: 108 | L84: 2013-05-26T07:00:00.000 | M84: =RC[-8]-R[17]C[-8] -> 8.8750000000000329E-2 | N84: =RC[-8]-R[17]C[-8] -> 21.708333333333332 | O84: =RC[-8]-R[17]C[-8] -> 3.0833333333333357 | P84: =RC[-8]-R[17]C[-8] -> -16.75 | Q84: =RC[-8]-R[17]C[-8] -> 24.833333333333329 | R84: =RC[-8]-R[17]C[-8] -> 10.375 | T84: =RC[-7]*RC[-2] -> 0.92078125000000344 | U84: =RC[-7]*RC[-3] -> 225.22395833333331 | V84: =RC[-7]*RC[-4] -> 31.989583333333357 | W84: =RC[-7]*RC[-5] -> -173.78125 | X84: =RC[-7]*RC[-6] -> 257.64583333333326 | Y84: =RC[-12]*RC[-12] -> 7.8765625000000589E-3 | Z84: =RC[-12]*RC[-12] -> 471.25173611111109 | AA84: =RC[-12]*RC[-12] -> 9.5069444444444589 | AB84: =RC[-12]*RC[-12] -> 280.5625 | AC84: =RC[-12]*RC[-12] -> 616.69444444444423 | AD84: =RC[-12]*RC[-12] -> 107.640625 | AE84: =RC[-11]/SQRT(RC[-6]*RC[-1]) -> 1 | AF84: =RC[-11]/SQRT(RC[-6]*RC[-2]) -> 0.99999999999999989 | AG84: =RC[-11]/SQRT(RC[-6]*RC[-3]) -> 1 | AH84: =RC[-11]/SQRT(RC[-6]*RC[-4]) -> -1 | AI84: =RC[-11]/SQRT(RC[-6]*RC[-5]) -> 1
A85: 7594 | B85: 北京 | C85: 110 | D85: 轻度污染 | E85: 1.49 | F85: 49 | G85: 51 | H85: 28 | I85: 131 | J85: 103 | L85: 2013-05-26T08:00:00.000 | M85: =RC[-8]-R[16]C[-8] -> 5.8750000000000302E-2 | N85: =RC[-8]-R[16]C[-8] -> 19.708333333333332 | O85: =RC[-8]-R[16]C[-8] -> 3.0833333333333357 | P85: =RC[-8]-R[16]C[-8] -> -14.75 | Q85: =RC[-8]-R[16]C[-8] -> 14.833333333333329 | R85: =RC[-8]-R[16]C[-8] -> 5.375 | T85: =RC[-7]*RC[-2] -> 0.31578125000000162 | U85: =RC[-7]*RC[-3] -> 105.93229166666666 | V85: =RC[-7]*RC[-4] -> 16.572916666666679 | W85: =RC[-7]*RC[-5] -> -79.28125 | X85: =RC[-7]*RC[-6] -> 79.729166666666643 | Y85: =RC[-12]*RC[-12] -> 3.4515625000000353E-3 | Z85: =RC[-12]*RC[-12] -> 388.41840277777771 | AA85: =RC[-12]*RC[-12] -> 9.5069444444444589 | AB85: =RC[-12]*RC[-12] -> 217.5625 | AC85: =RC[-12]*RC[-12] -> 220.02777777777763 | AD85: =RC[-12]*RC[-12] -> 28.890625 | AE85: =RC[-11]/SQRT(RC[-6]*RC[-1]) -> 1 | AF85: =RC[-11]/SQRT(RC[-6]*RC[-2]) -> 1 | AG85: =RC[-11]/SQRT(RC[-6]*RC[-3]) -> 1 | AH85: =RC[-11]/SQRT(RC[-6]*RC[-4]) -> -1 | AI85: =RC[-11]/SQRT(RC[-6]*RC[-5]) -> 1
A86: 7670 | B86: 北京 | C86: 114 | D86: 轻度污染 | E86: 1.44 | F86: 44 | G86: 53 | H86: 34 | I86: 124 | J86: 102 | L86: 2013-05-26T09:00:00.000 | M86: =RC[-8]-R[15]C[-8] -> 8.7500000000002576E-3 | N86: =RC[-8]-R[15]C[-8] -> 14.708333333333332 | O86: =RC[-8]-R[15]C[-8] -> 5.0833333333333357 | P86: =RC[-8]-R[15]C[-8] -> -8.75 | Q86: =RC[-8]-R[15]C[-8] -> 7.8333333333333286 | R86: =RC[-8]-R[15]C[-8] -> 4.375 | T86: =RC[-7]*RC[-2] -> 3.8281250000001127E-2 | U86: =RC[-7]*RC[-3] -> 64.348958333333329 | V86: =RC[-7]*RC[-4] -> 22.239583333333343 | W86: =RC[-7]*RC[-5] -> -38.28125 | X86: =RC[-7]*RC[-6] -> 34.270833333333314 | Y86: =RC[-12]*RC[-12] -> 7.6562500000004511E-5 | Z86: =RC[-12]*RC[-12] -> 216.3350694444444 | AA86: =RC[-12]*RC[-12] -> 25.840277777777803 | AB86: =RC[-12]*RC[-12] -> 76.5625 | AC86: =RC[-12]*RC[-12] -> 61.361111111111036 | AD86: =RC[-12]*RC[-12] -> 19.140625 | AE86: =RC[-11]/SQRT(RC[-6]*RC[-1]) -> 1 | AF86: =RC[-11]/SQRT(RC[-6]*RC[-2]) -> 1 | AG86: =RC[-11]/SQRT(RC[-6]*RC[-3]) -> 0.99999999999999989 | AH86: =RC[-11]/SQRT(RC[-6]*RC[-4]) -> -1 | AI86: =RC[-11]/SQRT(RC[-6]*RC[-5]) -> 1
A87: 7746 | B87: 北京 | C87: 117 | D87: 轻度污染 | E87: 1.57 | F87: 39 | G87: 56 | H87: 36 | I87: 126 | J87: 102 | L87: 2013-05-26T10:00:00.000 | M87: =RC[-8]-R[14]C[-8] -> 0.13875000000000037 | N87: =RC[-8]-R[14]C[-8] -> 9.7083333333333321 | O87: =RC[-8]-R[14]C[-8] -> 8.0833333333333357 | P87: =RC[-8]-R[14]C[-8] -> -6.75 | Q87: =RC[-8]-R[14]C[-8] -> 9.8333333333333286 | R87: =RC[-8]-R[14]C[-8] -> 4.375 | T87: =RC[-7]*RC[-2] -> 0.60703125000000169 | U87: =RC[-7]*RC[-3] -> 42.473958333333329 | V87: =RC[-7]*RC[-4] -> 35.364583333333343 | W87: =RC[-7]*RC[-5] -> -29.53125 | X87: =RC[-7]*RC[-6] -> 43.020833333333314 | Y87: =RC[-12]*RC[-12] -> 1.9251562500000104E-2 | Z87: =RC[-12]*RC[-12] -> 94.251736111111086 | AA87: =RC[-12]*RC[-12] -> 65.340277777777814 | AB87: =RC[-12]*RC[-12] -> 45.5625 | AC87: =RC[-12]*RC[-12] -> 96.694444444444358 | AD87: =RC[-12]*RC[-12] -> 19.140625 | AE87: =RC[-11]/SQRT(RC[-6]*RC[-1]) -> 1 | AF87: =RC[-11]/SQRT(RC[-6]*RC[-2]) -> 1 | AG87: =RC[-11]/SQRT(RC[-6]*RC[-3]) -> 1 | AH87: =RC[-11]/SQRT(RC[-6]*RC[-4]) -> -1 | AI87: =RC[-11]/SQRT(RC[-6]*RC[-5]) -> 1
A88: 7822 | B88: 北京 | C88: 120 | D88: 轻度污染 | E88: 1.76 | F88: 40 | G88: 59 | H88: 40 | I88: 132 | J88: 103 | L88: 2013-05-26T11:00:00.000 | M88: =RC[-8]-R[13]C[-8] -> 0.32875000000000032 | N88: =RC[-8]-R[13]C[-8] -> 10.708333333333332 | O88: =RC[-8]-R[13]C[-8] -> 11.083333333333336 | P88: =RC[-8]-R[13]C[-8] -> -2.75 | Q88: =RC[-8]-R[13]C[-8] -> 15.833333333333329 | R88: =RC[-8]-R[13]C[-8] -> 5.375 | T88: =RC[-7]*RC[-2] -> 1.7670312500000018 | U88: =RC[-7]*RC[-3] -> 57.557291666666657 | V88: =RC[-7]*RC[-4] -> 59.572916666666679 | W88: =RC[-7]*RC[-5] -> -14.78125 | X88: =RC[-7]*RC[-6] -> 85.104166666666643 | Y88: =RC[-12]*RC[-12] -> 0.10807656250000021 | Z88: =RC[-12]*RC[-12] -> 114.66840277777776 | AA88: =RC[-12]*RC[-12] -> 122.84027777777783 | AB88: =RC[-12]*RC[-12] -> 7.5625 | AC88: =RC[-12]*RC[-12] -> 250.69444444444429 | AD88: =RC[-12]*RC[-12] -> 28.890625 | AE88: =RC[-11]/SQRT(RC[-6]*RC[-1]) -> 1.0000000000000002 | AF88: =RC[-11]/SQRT(RC[-6]*RC[-2]) -> 1 | AG88: =RC[-11]/SQRT(RC[-6]*RC[-3]) -> 1 | AH88: =RC[-11]/SQRT(RC[-6]*RC[-4]) -> -1 | AI88: =RC[-11]/SQRT(RC[-6]*RC[-5]) -> 1
A89: 7898 | B89: 北京 | C89: 122 | D89: 轻度污染 | E89: 2.09 | F89: 39 | G89: 59 | H89: 47 | I89: 144 | J89: 108 | L89: 2013-05-26T12:00:00.000 | M89: =RC[-8]-R[12]C[-8] -> 0.65875000000000017 | N89: =RC[-8]-R[12]C[-8] -> 9.7083333333333321 | O89: =RC[-8]-R[12]C[-8] -> 11.083333333333336 | P89: =RC[-8]-R[12]C[-8] -> 4.25 | Q89: =RC[-8]-R[12]C[-8] -> 27.833333333333329 | R89: =RC[-8]-R[12]C[-8] -> 10.375 | T89: =RC[-7]*RC[-2] -> 6.8345312500000022 | U89: =RC[-7]*RC[-3] -> 100.72395833333331 | V89: =RC[-7]*RC[-4] -> 114.98958333333336 | W89: =RC[-7]*RC[-5] -> 44.09375 | X89: =RC[-7]*RC[-6] -> 288.77083333333326 | Y89: =RC[-12]*RC[-12] -> 0.43395156250000022 | Z89: =RC[-12]*RC[-12] -> 94.251736111111086 | AA89: =RC[-12]*RC[-12] -> 122.84027777777783 | AB89: =RC[-12]*RC[-12] -> 18.0625 | AC89: =RC[-12]*RC[-12] -> 774.69444444444423 | AD89: =RC[-12]*RC[-12] -> 107.640625 | AE89: =RC[-11]/SQRT(RC[-6]*RC[-1]) -> 1.0000000000000002 | AF89: =RC[-11]/SQRT(RC[-6]*RC[-2]) -> 1 | AG89: =RC[-11]/SQRT(RC[-6]*RC[-3]) -> 1 | AH89: =RC[-11]/SQRT(RC[-6]*RC[-4]) -> 1 | AI89: =RC[-11]/SQRT(RC[-6]*RC[-5]) -> 0.99999999999999978
A90: 7974 | B90: 北京 | C90: 125 | D90: 轻度污染 | E90: 2.4700000000000002 | F90: 36 | G90: 60 | H90: 50 | I90: 153 | J90: 117 | L90: 2013-05-26T13:00:00.000 | M90: =RC[-8]-R[11]C[-8] -> 1.0387500000000005 | N90: =RC[-8]-R[11]C[-8] -> 6.7083333333333321 | O90: =RC[-8]-R[11]C[-8] -> 12.083333333333336 | P90: =RC[-8]-R[11]C[-8] -> 7.25 | Q90: =RC[-8]-R[11]C[-8] -> 36.833333333333329 | R90: =RC[-8]-R[11]C[-8] -> 19.375 | T90: =RC[-7]*RC[-2] -> 20.12578125000001 | U90: =RC[-7]*RC[-3] -> 129.97395833333331 | V90: =RC[-7]*RC[-4] -> 234.11458333333337 | W90: =RC[-7]*RC[-5] -> 140.46875 | X90: =RC[-7]*RC[-6] -> 713.64583333333326 | Y90: =RC[-12]*RC[-12] -> 1.0790015625000011 | Z90: =RC[-12]*RC[-12] -> 45.001736111111093 | AA90: =RC[-12]*RC[-12] -> 146.00694444444451 | AB90: =RC[-12]*RC[-12] -> 52.5625 | AC90: =RC[-12]*RC[-12] -> 1356.6944444444441 | AD90: =RC[-12]*RC[-12] -> 375.390625 | AE90: =RC[-11]/SQRT(RC[-6]*RC[-1]) -> 1 | AF90: =RC[-11]/SQRT(RC[-6]*RC[-2]) -> 1 | AG90: =RC[-11]/SQRT(RC[-6]*RC[-3]) -> 0.99999999999999989 | AH90: =RC[-11]/SQRT(RC[-6]*RC[-4]) -> 1 | AI90: =RC[-11]/SQRT(RC[-6]*RC[-5]) -> 1
A91: 8050 | B91: 北京 | C91: 128 | D91: 轻度污染 | E91: 2.54 | F91: 38 | G91: 57 | H91: 58 | I91: 157 | J91: 131 | L91: 2013-05-26T14:00:00.000 | M91: =RC[-8]-R[10]C[-8] -> 1.1087500000000003 | N91: =RC[-8]-R[10]C[-8] -> 8.7083333333333321 | O91: =RC[-8]-R[10]C[-8] -> 9.0833333333333357 | P91: =RC[-8]-R[10]C[-8] -> 15.25 | Q91: =RC[-8]-R[10]C[-8] -> 40.833333333333329 | R91: =RC[-8]-R[10]C[-8] -> 33.375 | T91: =RC[-7]*RC[-2] -> 37.004531250000014 | U91: =RC[-7]*RC[-3] -> 290.64062499999994 | V91: =RC[-7]*RC[-4] -> 303.15625000000006 | W91: =RC[-7]*RC[-5] -> 508.96875 | X91: =RC[-7]*RC[-6] -> 1362.8124999999998 | Y91: =RC[-12]*RC[-12] -> 1.2293265625000007 | Z91: =RC[-12]*RC[-12] -> 75.835069444444429 | AA91: =RC[-12]*RC[-12] -> 82.506944444444485 | AB91: =RC[-12]*RC[-12] -> 232.5625 | AC91: =RC[-12]*RC[-12] -> 1667.3611111111106 | AD91: =RC[-12]*RC[-12] -> 1113.890625 | AE91: =RC[-11]/SQRT(RC[-6]*RC[-1]) -> 1.0000000000000002 | AF91: =RC[-11]/SQRT(RC[-6]*RC[-2]) -> 0.99999999999999978 | AG91: =RC[-11]/SQRT(RC[-6]*RC[-3]) -> 1 | AH91: =RC[-11]/SQRT(RC[-6]*RC[-4]) -> 1 | AI91: =RC[-11]/SQRT(RC[-6]*RC[-5]) -> 1
A92: 8126 | B92: 北京 | C92: 130 | D92: 轻度污染 | E92: 2.7 | F92: 48 | G92: 60 | H92: 62 | I92: 168 | J92: 137 | L92: 2013-05-26T15:00:00.000 | M92: =RC[-8]-R[9]C[-8] -> 1.2687500000000005 | N92: =RC[-8]-R[9]C[-8] -> 18.708333333333332 | O92: =RC[-8]-R[9]C[-8] -> 12.083333333333336 | P92: =RC[-8]-R[9]C[-8] -> 19.25 | Q92: =RC[-8]-R[9]C[-8] -> 51.833333333333329 | R92: =RC[-8]-R[9]C[-8] -> 39.375 | T92: =RC[-7]*RC[-2] -> 49.957031250000021 | U92: =RC[-7]*RC[-3] -> 736.640625 | V92: =RC[-7]*RC[-4] -> 475.78125000000011 | W92: =RC[-7]*RC[-5] -> 757.96875 | X92: =RC[-7]*RC[-6] -> 2040.9374999999998 | Y92: =RC[-12]*RC[-12] -> 1.6097265625000012 | Z92: =RC[-12]*RC[-12] -> 350.00173611111109 | AA92: =RC[-12]*RC[-12] -> 146.00694444444451 | AB92: =RC[-12]*RC[-12] -> 370.5625 | AC92: =RC[-12]*RC[-12] -> 2686.6944444444439 | AD92: =RC[-12]*RC[-12] -> 1550.390625 | AE92: =RC[-11]/SQRT(RC[-6]*RC[-1]) -> 1 | AF92: =RC[-11]/SQRT(RC[-6]*RC[-2]) -> 1 | AG92: =RC[-11]/SQRT(RC[-6]*RC[-3]) -> 1 | AH92: =RC[-11]/SQRT(RC[-6]*RC[-4]) -> 1 | AI92: =RC[-11]/SQRT(RC[-6]*RC[-5]) -> 1
A93: 8202 | B93: 北京 | C93: 132 | D93: 轻度污染 | E93: 2.25 | F93: 48 | G93: 51 | H93: 65 | I93: 143 | J93: 133 | L93: 2013-05-26T16:00:00.000 | M93: =RC[-8]-R[8]C[-8] -> 0.81875000000000031 | N93: =RC[-8]-R[8]C[-8] -> 18.708333333333332 | O93: =RC[-8]-R[8]C[-8] -> 3.0833333333333357 | P93: =RC[-8]-R[8]C[-8] -> 22.25 | Q93: =RC[-8]-R[8]C[-8] -> 26.833333333333329 | R93: =RC[-8]-R[8]C[-8] -> 35.375 | T93: =RC[-7]*RC[-2] -> 28.963281250000012 | U93: =RC[-7]*RC[-3] -> 661.80729166666663 | V93: =RC[-7]*RC[-4] -> 109.07291666666676 | W93: =RC[-7]*RC[-5] -> 787.09375 | X93: =RC[-7]*RC[-6] -> 949.22916666666652 | Y93: =RC[-12]*RC[-12] -> 0.6703515625000005 | Z93: =RC[-12]*RC[-12] -> 350.00173611111109 | AA93: =RC[-12]*RC[-12] -> 9.5069444444444589 | AB93: =RC[-12]*RC[-12] -> 495.0625 | AC93: =RC[-12]*RC[-12] -> 720.02777777777749 | AD93: =RC[-12]*RC[-12] -> 1251.390625 | AE93: =RC[-11]/SQRT(RC[-6]*RC[-1]) -> 1 | AF93: =RC[-11]/SQRT(RC[-6]*RC[-2]) -> 1 | AG93: =RC[-11]/SQRT(RC[-6]*RC[-3]) -> 1 | AH93: =RC[-11]/SQRT(RC[-6]*RC[-4]) -> 1 | AI93: =RC[-11]/SQRT(RC[-6]*RC[-5]) -> 1.0000000000000002
A94: 8278 | B94: 北京 | C94: 134 | D94: 轻度污染 | E94: 1.8 | F94: 38 | G94: 42 | H94: 64 | I94: 137 | J94: 117 | L94: 2013-05-26T17:00:00.000 | M94: =RC[-8]-R[7]C[-8] -> 0.36875000000000036 | N94: =RC[-8]-R[7]C[-8] -> 8.7083333333333321 | O94: =RC[-8]-R[7]C[-8] -> -5.9166666666666643 | P94: =RC[-8]-R[7]C[-8] -> 21.25 | Q94: =RC[-8]-R[7]C[-8] -> 20.833333333333329 | R94: =RC[-8]-R[7]C[-8] -> 19.375 | T94: =RC[-7]*RC[-2] -> 7.1445312500000071 | U94: =RC[-7]*RC[-3] -> 168.72395833333331 | V94: =RC[-7]*RC[-4] -> -114.63541666666661 | W94: =RC[-7]*RC[-5] -> 411.71875 | X94: =RC[-7]*RC[-6] -> 403.64583333333326 | Y94: =RC[-12]*RC[-12] -> 0.13597656250000026 | Z94: =RC[-12]*RC[-12] -> 75.835069444444429 | AA94: =RC[-12]*RC[-12] -> 35.006944444444414 | AB94: =RC[-12]*RC[-12] -> 451.5625 | AC94: =RC[-12]*RC[-12] -> 434.0277777777776 | AD94: =RC[-12]*RC[-12] -> 375.390625 | AE94: =RC[-11]/SQRT(RC[-6]*RC[-1]) -> 1 | AF94: =RC[-11]/SQRT(RC[-6]*RC[-2]) -> 1 | AG94: =RC[-11]/SQRT(RC[-6]*RC[-3]) -> -1 | AH94: =RC[-11]/SQRT(RC[-6]*RC[-4]) -> 1 | AI94: =RC[-11]/SQRT(RC[-6]*RC[-5]) -> 1
A95: 8354 | B95: 北京 | C95: 134 | D95: 轻度污染 | E95: 1.48 | F95: 27 | G95: 36 | H95: 61 | I95: 138 | J95: 104 | L95: 2013-05-26T18:00:00.000 | M95: =RC[-8]-R[6]C[-8] -> 4.8750000000000293E-2 | N95: =RC[-8]-R[6]C[-8] -> -2.2916666666666679 | O95: =RC[-8]-R[6]C[-8] -> -11.916666666666664 | P95: =RC[-8]-R[6]C[-8] -> 18.25 | Q95: =RC[-8]-R[6]C[-8] -> 21.833333333333329 | R95: =RC[-8]-R[6]C[-8] -> 6.375 | T95: =RC[-7]*RC[-2] -> 0.3107812500000019 | U95: =RC[-7]*RC[-3] -> -14.609375000000007 | V95: =RC[-7]*RC[-4] -> -75.968749999999986 | W95: =RC[-7]*RC[-5] -> 116.34375 | X95: =RC[-7]*RC[-6] -> 139.18749999999997 | Y95: =RC[-12]*RC[-12] -> 2.3765625000000284E-3 | Z95: =RC[-12]*RC[-12] -> 5.2517361111111169 | AA95: =RC[-12]*RC[-12] -> 142.0069444444444 | AB95: =RC[-12]*RC[-12] -> 333.0625 | AC95: =RC[-12]*RC[-12] -> 476.69444444444423 | AD95: =RC[-12]*RC[-12] -> 40.640625 | AE95: =RC[-11]/SQRT(RC[-6]*RC[-1]) -> 1.0000000000000002 | AF95: =RC[-11]/SQRT(RC[-6]*RC[-2]) -> -1 | AG95: =RC[-11]/SQRT(RC[-6]*RC[-3]) -> -1 | AH95: =RC[-11]/SQRT(RC[-6]*RC[-4]) -> 1 | AI95: =RC[-11]/SQRT(RC[-6]*RC[-5]) -> 1
A96: 8430 | B96: 北京 | C96: 134 | D96: 轻度污染 | E96: 1.2 | F96: 15 | G96: 33 | H96: 50 | I96: 96 | J96: 81 | L96: 2013-05-26T19:00:00.000 | M96: =RC[-8]-R[5]C[-8] -> -0.23124999999999973 | N96: =RC[-8]-R[5]C[-8] -> -14.291666666666668 | O96: =RC[-8]-R[5]C[-8] -> -14.916666666666664 | P96: =RC[-8]-R[5]C[-8] -> 7.25 | Q96: =RC[-8]-R[5]C[-8] -> -20.166666666666671 | R96: =RC[-8]-R[5]C[-8] -> -16.625 | T96: =RC[-7]*RC[-2] -> 3.8445312499999957 | U96: =RC[-7]*RC[-3] -> 237.59895833333334 | V96: =RC[-7]*RC[-4] -> 247.98958333333329 | W96: =RC[-7]*RC[-5] -> -120.53125 | X96: =RC[-7]*RC[-6] -> 335.27083333333343 | Y96: =RC[-12]*RC[-12] -> 5.347656249999988E-2 | Z96: =RC[-12]*RC[-12] -> 204.25173611111114 | AA96: =RC[-12]*RC[-12] -> 222.50694444444437 | AB96: =RC[-12]*RC[-12] -> 52.5625 | AC96: =RC[-12]*RC[-12] -> 406.69444444444463 | AD96: =RC[-12]*RC[-12] -> 276.390625 | AE96: =RC[-11]/SQRT(RC[-6]*RC[-1]) -> 1 | AF96: =RC[-11]/SQRT(RC[-6]*RC[-2]) -> 1 | AG96: =RC[-11]/SQRT(RC[-6]*RC[-3]) -> 1 | AH96: =RC[-11]/SQRT(RC[-6]*RC[-4]) -> -1 | AI96: =RC[-11]/SQRT(RC[-6]*RC[-5]) -> 1
A97: 8506 | B97: 北京 | C97: 134 | D97: 轻度污染 | E97: 1.18 | F97: 8 | G97: 37 | H97: 33 | I97: 80 | J97: 72 | L97: 2013-05-26T20:00:00.000 | M97: =RC[-8]-R[4]C[-8] -> -0.25124999999999975 | N97: =RC[-8]-R[4]C[-8] -> -21.291666666666668 | O97: =RC[-8]-R[4]C[-8] -> -10.916666666666664 | P97: =RC[-8]-R[4]C[-8] -> -9.75 | Q97: =RC[-8]-R[4]C[-8] -> -36.166666666666671 | R97: =RC[-8]-R[4]C[-8] -> -25.625 | T97: =RC[-7]*RC[-2] -> 6.438281249999994 | U97: =RC[-7]*RC[-3] -> 545.59895833333337 | V97: =RC[-7]*RC[-4] -> 279.73958333333326 | W97: =RC[-7]*RC[-5] -> 249.84375 | X97: =RC[-7]*RC[-6] -> 926.77083333333348 | Y97: =RC[-12]*RC[-12] -> 6.3126562499999872E-2 | Z97: =RC[-12]*RC[-12] -> 453.33506944444451 | AA97: =RC[-12]*RC[-12] -> 119.17361111111106 | AB97: =RC[-12]*RC[-12] -> 95.0625 | AC97: =RC[-12]*RC[-12] -> 1308.0277777777781 | AD97: =RC[-12]*RC[-12] -> 656.640625 | AE97: =RC[-11]/SQRT(RC[-6]*RC[-1]) -> 1 | AF97: =RC[-11]/SQRT(RC[-6]*RC[-2]) -> 1 | AG97: =RC[-11]/SQRT(RC[-6]*RC[-3]) -> 1 | AH97: =RC[-11]/SQRT(RC[-6]*RC[-4]) -> 1 | AI97: =RC[-11]/SQRT(RC[-6]*RC[-5]) -> 1.0000000000000002
A98: 8582 | B98: 北京 | C98: 132 | D98: 轻度污染 | E98: 0.92 | F98: 6 | G98: 36 | H98: 41 | I98: 58 | J98: 62 | L98: 2013-05-26T21:00:00.000 | M98: =RC[-8]-R[3]C[-8] -> -0.51124999999999965 | N98: =RC[-8]-R[3]C[-8] -> -23.291666666666668 | O98: =RC[-8]-R[3]C[-8] -> -11.916666666666664 | P98: =RC[-8]-R[3]C[-8] -> -1.75 | Q98: =RC[-8]-R[3]C[-8] -> -58.166666666666671 | R98: =RC[-8]-R[3]C[-8] -> -35.625 | T98: =RC[-7]*RC[-2] -> 18.213281249999987 | U98: =RC[-7]*RC[-3] -> 829.765625 | V98: =RC[-7]*RC[-4] -> 424.53124999999994 | W98: =RC[-7]*RC[-5] -> 62.34375 | X98: =RC[-7]*RC[-6] -> 2072.1875 | Y98: =RC[-12]*RC[-12] -> 0.26137656249999963 | Z98: =RC[-12]*RC[-12] -> 542.5017361111112 | AA98: =RC[-12]*RC[-12] -> 142.0069444444444 | AB98: =RC[-12]*RC[-12] -> 3.0625 | AC98: =RC[-12]*RC[-12] -> 3383.3611111111118 | AD98: =RC[-12]*RC[-12] -> 1269.140625 | AE98: =RC[-11]/SQRT(RC[-6]*RC[-1]) -> 1 | AF98: =RC[-11]/SQRT(RC[-6]*RC[-2]) -> 0.99999999999999989 | AG98: =RC[-11]/SQRT(RC[-6]*RC[-3]) -> 1 | AH98: =RC[-11]/SQRT(RC[-6]*RC[-4]) -> 1 | AI98: =RC[-11]/SQRT(RC[-6]*RC[-5]) -> 1
A99: 8658 | B99: 北京 | C99: 131 | D99: 轻度污染 | E99: 0.65 | F99: 5 | G99: 29 | H99: 49 | I99: 46 | J99: 57 | L99: 2013-05-26T22:00:00.000 | M99: =RC[-8]-R[2]C[-8] -> -0.78124999999999967 | N99: =RC[-8]-R[2]C[-8] -> -24.291666666666668 | O99: =RC[-8]-R[2]C[-8] -> -18.916666666666664 | P99: =RC[-8]-R[2]C[-8] -> 6.25 | Q99: =RC[-8]-R[2]C[-8] -> -70.166666666666671 | R99: =RC[-8]-R[2]C[-8] -> -40.625 | T99: =RC[-7]*RC[-2] -> 31.738281249999986 | U99: =RC[-7]*RC[-3] -> 986.84895833333337 | V99: =RC[-7]*RC[-4] -> 768.48958333333326 | W99: =RC[-7]*RC[-5] -> -253.90625 | X99: =RC[-7]*RC[-6] -> 2850.5208333333335 | Y99: =RC[-12]*RC[-12] -> 0.61035156249999944 | Z99: =RC[-12]*RC[-12] -> 590.08506944444446 | AA99: =RC[-12]*RC[-12] -> 357.84027777777771 | AB99: =RC[-12]*RC[-12] -> 39.0625 | AC99: =RC[-12]*RC[-12] -> 4923.3611111111122 | AD99: =RC[-12]*RC[-12] -> 1650.390625 | AE99: =RC[-11]/SQRT(RC[-6]*RC[-1]) -> 1 | AF99: =RC[-11]/SQRT(RC[-6]*RC[-2]) -> 1 | AG99: =RC[-11]/SQRT(RC[-6]*RC[-3]) -> 1 | AH99: =RC[-11]/SQRT(RC[-6]*RC[-4]) -> -1 | AI99: =RC[-11]/SQRT(RC[-6]*RC[-5]) -> 1
A100: 8734 | B100: 北京 | C100: 129 | D100: 轻度污染 | E100: 0.48 | F100: 4 | G100: 22 | H100: 61 | I100: 34 | J100: 46 | L100: 2013-05-26T23:00:00.000 | M100: =RC[-8]-R[1]C[-8] -> -0.95124999999999971 | N100: =RC[-8]-R[1]C[-8] -> -25.291666666666668 | O100: =RC[-8]-R[1]C[-8] -> -25.916666666666664 | P100: =RC[-8]-R[1]C[-8] -> 18.25 | Q100: =RC[-8]-R[1]C[-8] -> -82.166666666666671 | R100: =RC[-8]-R[1]C[-8] -> -51.625 | T100: =RC[-7]*RC[-2] -> 49.108281249999983 | U100: =RC[-7]*RC[-3] -> 1305.6822916666667 | V100: =RC[-7]*RC[-4] -> 1337.9479166666665 | W100: =RC[-7]*RC[-5] -> -942.15625 | X100: =RC[-7]*RC[-6] -> 4241.854166666667 | Y100: =RC[-12]*RC[-12] -> 0.90487656249999948 | Z100: =RC[-12]*RC[-12] -> 639.66840277777783 | AA100: =RC[-12]*RC[-12] -> 671.67361111111097 | AB100: =RC[-12]*RC[-12] -> 333.0625 | AC100: =RC[-12]*RC[-12] -> 6751.3611111111122 | AD100: =RC[-12]*RC[-12] -> 2665.140625 | AE100: =RC[-11]/SQRT(RC[-6]*RC[-1]) -> 1 | AF100: =RC[-11]/SQRT(RC[-6]*RC[-2]) -> 1 | AG100: =RC[-11]/SQRT(RC[-6]*RC[-3]) -> 1 | AH100: =RC[-11]/SQRT(RC[-6]*RC[-4]) -> -1 | AI100: =RC[-11]/SQRT(RC[-6]*RC[-5]) -> 1
E101: =AVERAGE(R[-24]C:R[-1]C) -> 1.4312499999999997 | F101: =AVERAGE(R[-24]C:R[-1]C) -> 29.291666666666668 | G101: =AVERAGE(R[-24]C:R[-1]C) -> 47.916666666666664 | H101: =AVERAGE(R[-24]C:R[-1]C) -> 42.75 | I101: =AVERAGE(R[-24]C:R[-1]C) -> 116.16666666666667 | J101: =AVERAGE(R[-24]C:R[-1]C) -> 97.625 | M101: =RC[-8]-RC[-8] -> 0 | N101: =RC[-8]-RC[-8] -> 0 | O101: =RC[-8]-RC[-8] -> 0 | P101: =RC[-8]-RC[-8] -> 0 | Q101: =RC[-8]-RC[-8] -> 0 | R101: =RC[-8]-RC[-8] -> 0 | T101: =SUM(R[-24]C:R[-1]C) -> 284.81125000000003 | U101: =SUM(R[-24]C:R[-1]C) -> 7172.625 | V101: =SUM(R[-24]C:R[-1]C) -> 3716.25 | W101: =SUM(R[-24]C:R[-1]C) -> 1822.75 | X101: =SUM(R[-24]C:R[-1]C) -> 17293.5 | Y101: =SUM(R[-24]C:R[-1]C) -> 8.9610625000000024 | Z101: =SUM(R[-24]C:R[-1]C) -> 5420.9583333333339 | AA101: =SUM(R[-24]C:R[-1]C) -> 3129.8333333333335 | AB101: =SUM(R[-24]C:R[-1]C) -> 4258.5 | AC101: =SUM(R[-24]C:R[-1]C) -> 26861.333333333332 | AD101: =SUM(R[-24]C:R[-1]C) -> 12327.625 | AE101: =RC[-11]/SQRT(RC[-6]*RC[-1]) -> 0.85691487009242195 | AF101: =RC[-11]/SQRT(RC[-6]*RC[-2]) -> 0.87740556282475557 | AG101: =RC[-11]/SQRT(RC[-6]*RC[-3]) -> 0.59828017082349205 | AH101: =RC[-11]/SQRT(RC[-6]*RC[-4]) -> 0.25157012969847853 | AI101: =RC[-11]/SQRT(RC[-6]*RC[-5]) -> 0.95034087198934036
A102: 8810 | B102: 北京 | C102: 127 | D102: 轻度污染 | E102: 0.4 | F102: 4 | G102: 19 | H102: 66 | I102: 23 | J102: 39 | L102: 2013-05-27T00:00:00.000 | M102: =RC[-8]-R[24]C[-8] -> -0.47791666666666677 | N102: =RC[-8]-R[24]C[-8] -> -17.886424731182796 | O102: =RC[-8]-R[24]C[-8] -> -31.79435483870968 | P102: =RC[-8]-R[24]C[-8] -> -6.7379032258064484 | Q102: =RC[-8]-R[24]C[-8] -> -88.276545698924721 | R102: =RC[-8]-R[24]C[-8] -> -36.168346774193552 | T102: =RC[-7]*RC[-2] -> 17.285455729166671 | U102: =RC[-7]*RC[-3] -> 646.92241222793109 | V102: =RC[-7]*RC[-4] -> 1149.9492512682104 | W102: =RC[-7]*RC[-5] -> 243.69882040192499 | X102: =RC[-7]*RC[-6] -> 3192.8167168666537 | Y102: =RC[-12]*RC[-12] -> 0.22840434027777787 | Z102: =RC[-12]*RC[-12] -> 319.92418966426754 | AA102: =RC[-12]*RC[-12] -> 1010.8809996097816 | AB102: =RC[-12]*RC[-12] -> 45.399339880332946 | AC102: =RC[-12]*RC[-12] -> 7792.7485205343446 | AD102: =RC[-12]*RC[-12] -> 1308.1493083783171 | AE102: =RC[-11]/SQRT(RC[-6]*RC[-1]) -> 1 | AF102: =RC[-11]/SQRT(RC[-6]*RC[-2]) -> 1 | AG102: =RC[-11]/SQRT(RC[-6]*RC[-3]) -> 1 | AH102: =RC[-11]/SQRT(RC[-6]*RC[-4]) -> 1 | AI102: =RC[-11]/SQRT(RC[-6]*RC[-5]) -> 1.0000000000000002
A103: 8886 | B103: 北京 | C103: 124 | D103: 轻度污染 | E103: 0.43 | F103: 4 | G103: 18 | H103: 64 | I103: 32 | J103: 42 | L103: 2013-05-27T01:00:00.000 | M103: =RC[-8]-R[23]C[-8] -> -0.4479166666666668 | N103: =RC[-8]-R[23]C[-8] -> -17.886424731182796 | O103: =RC[-8]-R[23]C[-8] -> -32.79435483870968 | P103: =RC[-8]-R[23]C[-8] -> -8.7379032258064484 | Q103: =RC[-8]-R[23]C[-8] -> -79.276545698924721 | R103: =RC[-8]-R[23]C[-8] -> -33.168346774193552 | T103: =RC[-7]*RC[-2] -> 14.856655325940865 | U103: =RC[-7]*RC[-3] -> 593.26313803438268 | V103: =RC[-7]*RC[-4] -> 1087.7345335262748 | W103: =RC[-7]*RC[-5] -> 289.82180427289273 | X103: =RC[-7]*RC[-6] -> 2629.4719588021376 | Y103: =RC[-12]*RC[-12] -> 0.2006293402777779 | Z103: =RC[-12]*RC[-12] -> 319.92418966426754 | AA103: =RC[-12]*RC[-12] -> 1075.4697092872009 | AB103: =RC[-12]*RC[-12] -> 76.350952783558739 | AC103: =RC[-12]*RC[-12] -> 6284.7706979536997 | AD103: =RC[-12]*RC[-12] -> 1100.1392277331558 | AE103: =RC[-11]/SQRT(RC[-6]*RC[-1]) -> 0.99999999999999989 | AF103: =RC[-11]/SQRT(RC[-6]*RC[-2]) -> 1 | AG103: =RC[-11]/SQRT(RC[-6]*RC[-3]) -> 1 | AH103: =RC[-11]/SQRT(RC[-6]*RC[-4]) -> 1 | AI103: =RC[-11]/SQRT(RC[-6]*RC[-5]) -> 1
A104: 8962 | B104: 北京 | C104: 124 | D104: 轻度污染 | E104: 0.51 | F104: 4 | G104: 18 | H104: 69 | I104: 34 | J104: 42 | L104: 2013-05-27T02:00:00.000 | M104: =RC[-8]-R[22]C[-8] -> -0.36791666666666678 | N104: =RC[-8]-R[22]C[-8] -> -17.886424731182796 | O104: =RC[-8]-R[22]C[-8] -> -32.79435483870968 | P104: =RC[-8]-R[22]C[-8] -> -3.7379032258064484 | Q104: =RC[-8]-R[22]C[-8] -> -77.276545698924721 | R104: =RC[-8]-R[22]C[-8] -> -33.168346774193552 | T104: =RC[-7]*RC[-2] -> 12.203187584005381 | U104: =RC[-7]*RC[-3] -> 593.26313803438268 | V104: =RC[-7]*RC[-4] -> 1087.7345335262748 | W104: =RC[-7]*RC[-5] -> 123.98007040192499 | X104: =RC[-7]*RC[-6] -> 2563.1352652537503 | Y104: =RC[-12]*RC[-12] -> 0.13536267361111121 | Z104: =RC[-12]*RC[-12] -> 319.92418966426754 | AA104: =RC[-12]*RC[-12] -> 1075.4697092872009 | AB104: =RC[-12]*RC[-12] -> 13.971920525494253 | AC104: =RC[-12]*RC[-12] -> 5971.6645151580005 | AD104: =RC[-12]*RC[-12] -> 1100.1392277331558 | AE104: =RC[-11]/SQRT(RC[-6]*RC[-1]) -> 0.99999999999999989 | AF104: =RC[-11]/SQRT(RC[-6]*RC[-2]) -> 1 | AG104: =RC[-11]/SQRT(RC[-6]*RC[-3]) -> 1 | AH104: =RC[-11]/SQRT(RC[-6]*RC[-4]) -> 1 | AI104: =RC[-11]/SQRT(RC[-6]*RC[-5]) -> 1
A105: 9038 | B105: 北京 | C105: 122 | D105: 轻度污染 | E105: 0.59 | F105: 4 | G105: 18 | H105: 54 | I105: 36 | J105: 42 | L105: 2013-05-27T03:00:00.000 | M105: =RC[-8]-R[21]C[-8] -> -0.28791666666666682 | N105: =RC[-8]-R[21]C[-8] -> -17.886424731182796 | O105: =RC[-8]-R[21]C[-8] -> -32.79435483870968 | P105: =RC[-8]-R[21]C[-8] -> -18.737903225806448 | Q105: =RC[-8]-R[21]C[-8] -> -75.276545698924721 | R105: =RC[-8]-R[21]C[-8] -> -33.168346774193552 | T105: =RC[-7]*RC[-2] -> 9.5497198420698979 | U105: =RC[-7]*RC[-3] -> 593.26313803438268 | V105: =RC[-7]*RC[-4] -> 1087.7345335262748 | W105: =RC[-7]*RC[-5] -> 621.50527201482828 | X105: =RC[-7]*RC[-6] -> 2496.7985717053634 | Y105: =RC[-12]*RC[-12] -> 8.2896006944444531E-2 | Z105: =RC[-12]*RC[-12] -> 319.92418966426754 | AA105: =RC[-12]*RC[-12] -> 1075.4697092872009 | AB105: =RC[-12]*RC[-12] -> 351.10901729968771 | AC105: =RC[-12]*RC[-12] -> 5666.5583323623023 | AD105: =RC[-12]*RC[-12] -> 1100.1392277331558 | AE105: =RC[-11]/SQRT(RC[-6]*RC[-1]) -> 1 | AF105: =RC[-11]/SQRT(RC[-6]*RC[-2]) -> 1 | AG105: =RC[-11]/SQRT(RC[-6]*RC[-3]) -> 1 | AH105: =RC[-11]/SQRT(RC[-6]*RC[-4]) -> 1 | AI105: =RC[-11]/SQRT(RC[-6]*RC[-5]) -> 1
A106: 9114 | B106: 北京 | C106: 119 | D106: 轻度污染 | E106: 0.65 | F106: 4 | G106: 17 | H106: 52 | I106: 35 | J106: 47 | L106: 2013-05-27T04:00:00.000 | M106: =RC[-8]-R[20]C[-8] -> -0.22791666666666677 | N106: =RC[-8]-R[20]C[-8] -> -17.886424731182796 | O106: =RC[-8]-R[20]C[-8] -> -33.79435483870968 | P106: =RC[-8]-R[20]C[-8] -> -20.737903225806448 | Q106: =RC[-8]-R[20]C[-8] -> -76.276545698924721 | R106: =RC[-8]-R[20]C[-8] -> -28.168346774193552 | T106: =RC[-7]*RC[-2] -> 6.4200357022849497 | U106: =RC[-7]*RC[-3] -> 503.83101437846869 | V106: =RC[-7]*RC[-4] -> 951.93110610692008 | W106: =RC[-7]*RC[-5] -> 584.15244943418315 | X106: =RC[-7]*RC[-6] -> 2148.5841899849333 | Y106: =RC[-12]*RC[-12] -> 5.1946006944444491E-2 | Z106: =RC[-12]*RC[-12] -> 319.92418966426754 | AA106: =RC[-12]*RC[-12] -> 1142.0584189646204 | AB106: =RC[-12]*RC[-12] -> 430.0606302029135 | AC106: =RC[-12]*RC[-12] -> 5818.1114237601514 | AD106: =RC[-12]*RC[-12] -> 793.45575999122025 | AE106: =RC[-11]/SQRT(RC[-6]*RC[-1]) -> 1 | AF106: =RC[-11]/SQRT(RC[-6]*RC[-2]) -> 1.0000000000000002 | AG106: =RC[-11]/SQRT(RC[-6]*RC[-3]) -> 1 | AH106: =RC[-11]/SQRT(RC[-6]*RC[-4]) -> 1 | AI106: =RC[-11]/SQRT(RC[-6]*RC[-5]) -> 1.0000000000000002
A107: 9190 | B107: 北京 | C107: 116 | D107: 轻度污染 | E107: 0.69 | F107: 4 | G107: 20 | H107: 49 | I107: 40 | J107: 51 | L107: 2013-05-27T05:00:00.000 | M107: =RC[-8]-R[19]C[-8] -> -0.18791666666666684 | N107: =RC[-8]-R[19]C[-8] -> -17.886424731182796 | O107: =RC[-8]-R[19]C[-8] -> -30.79435483870968 | P107: =RC[-8]-R[19]C[-8] -> -23.737903225806448 | Q107: =RC[-8]-R[19]C[-8] -> -71.276545698924721 | R107: =RC[-8]-R[19]C[-8] -> -24.168346774193552 | T107: =RC[-7]*RC[-2] -> 4.5416351646505424 | U107: =RC[-7]*RC[-3] -> 432.2853154537375 | V107: =RC[-7]*RC[-4] -> 744.2486464295007 | W107: =RC[-7]*RC[-5] -> 573.70587685353803 | X107: =RC[-7]*RC[-6] -> 1722.6362733182666 | Y107: =RC[-12]*RC[-12] -> 3.5312673611111178E-2 | Z107: =RC[-12]*RC[-12] -> 319.92418966426754 | AA107: =RC[-12]*RC[-12] -> 948.29228993236222 | AB107: =RC[-12]*RC[-12] -> 563.48804955775222 | AC107: =RC[-12]*RC[-12] -> 5080.3459667709039 | AD107: =RC[-12]*RC[-12] -> 584.10898579767183 | AE107: =RC[-11]/SQRT(RC[-6]*RC[-1]) -> 1 | AF107: =RC[-11]/SQRT(RC[-6]*RC[-2]) -> 1 | AG107: =RC[-11]/SQRT(RC[-6]*RC[-3]) -> 1 | AH107: =RC[-11]/SQRT(RC[-6]*RC[-4]) -> 1 | AI107: =RC[-11]/SQRT(RC[-6]*RC[-5]) -> 1.0000000000000002
A108: 9266 | B108: 北京 | C108: 113 | D108: 轻度污染 | E108: 0.63 | F108: 4 | G108: 22 | H108: 43 | I108: 43 | J108: 50 | L108: 2013-05-27T06:00:00.000 | M108: =RC[-8]-R[18]C[-8] -> -0.24791666666666679 | N108: =RC[-8]-R[18]C[-8] -> -17.886424731182796 | O108: =RC[-8]-R[18]C[-8] -> -28.79435483870968 | P108: =RC[-8]-R[18]C[-8] -> -29.737903225806448 | Q108: =RC[-8]-R[18]C[-8] -> -68.276545698924721 | R108: =RC[-8]-R[18]C[-8] -> -25.168346774193552 | T108: =RC[-7]*RC[-2] -> 6.2396526377688213 | U108: =RC[-7]*RC[-3] -> 450.17174018492028 | V108: =RC[-7]*RC[-4] -> 724.70630771982326 | W108: =RC[-7]*RC[-5] -> 748.45386072450572 | X108: =RC[-7]*RC[-6] -> 1718.4077786946107 | Y108: =RC[-12]*RC[-12] -> 6.1462673611111171E-2 | Z108: =RC[-12]*RC[-12] -> 319.92418966426754 | AA108: =RC[-12]*RC[-12] -> 829.11487057752356 | AB108: =RC[-12]*RC[-12] -> 884.34288826742954 | AC108: =RC[-12]*RC[-12] -> 4661.6866925773556 | AD108: =RC[-12]*RC[-12] -> 633.44567934605891 | AE108: =RC[-11]/SQRT(RC[-6]*RC[-1]) -> 1 | AF108: =RC[-11]/SQRT(RC[-6]*RC[-2]) -> 1 | AG108: =RC[-11]/SQRT(RC[-6]*RC[-3]) -> 1.0000000000000002 | AH108: =RC[-11]/SQRT(RC[-6]*RC[-4]) -> 1 | AI108: =RC[-11]/SQRT(RC[-6]*RC[-5]) -> 1.0000000000000002
A109: 9342 | B109: 北京 | C109: 110 | D109: 轻度污染 | E109: 0.65 | F109: 4 | G109: 28 | H109: 38 | I109: 35 | J109: 51 | L109: 2013-05-27T07:00:00.000 | M109: =RC[-8]-R[17]C[-8] -> -0.22791666666666677 | N109: =RC[-8]-R[17]C[-8] -> -17.886424731182796 | O109: =RC[-8]-R[17]C[-8] -> -22.79435483870968 | P109: =RC[-8]-R[17]C[-8] -> -34.737903225806448 | Q109: =RC[-8]-R[17]C[-8] -> -76.276545698924721 | R109: =RC[-8]-R[17]C[-8] -> -24.168346774193552 | T109: =RC[-7]*RC[-2] -> 5.5083690356182826 | U109: =RC[-7]*RC[-3] -> 432.2853154537375 | V109: =RC[-7]*RC[-4] -> 550.90187223595228 | W109: =RC[-7]*RC[-5] -> 839.55769136966705 | X109: =RC[-7]*RC[-6] -> 1843.4780071892344 | Y109: =RC[-12]*RC[-12] -> 5.1946006944444491E-2 | Z109: =RC[-12]*RC[-12] -> 319.92418966426754 | AA109: =RC[-12]*RC[-12] -> 519.58261251300735 | AB109: =RC[-12]*RC[-12] -> 1206.7219205254939 | AC109: =RC[-12]*RC[-12] -> 5818.1114237601514 | AD109: =RC[-12]*RC[-12] -> 584.10898579767183 | AE109: =RC[-11]/SQRT(RC[-6]*RC[-1]) -> 1 | AF109: =RC[-11]/SQRT(RC[-6]*RC[-2]) -> 1 | AG109: =RC[-11]/SQRT(RC[-6]*RC[-3]) -> 1 | AH109: =RC[-11]/SQRT(RC[-6]*RC[-4]) -> 1 | AI109: =RC[-11]/SQRT(RC[-6]*RC[-5]) -> 1.0000000000000002
A110: 9418 | B110: 北京 | C110: 107 | D110: 轻度污染 | E110: 0.71 | F110: 4 | G110: 33 | H110: 38 | I110: 48 | J110: 47 | L110: 2013-05-27T08:00:00.000 | M110: =RC[-8]-R[16]C[-8] -> -0.16791666666666683 | N110: =RC[-8]-R[16]C[-8] -> -17.886424731182796 | O110: =RC[-8]-R[16]C[-8] -> -17.79435483870968 | P110: =RC[-8]-R[16]C[-8] -> -34.737903225806448 | Q110: =RC[-8]-R[16]C[-8] -> -63.276545698924721 | R110: =RC[-8]-R[16]C[-8] -> -28.168346774193552 | T110: =RC[-7]*RC[-2] -> 4.7299348958333383 | U110: =RC[-7]*RC[-3] -> 503.83101437846869 | V110: =RC[-7]*RC[-4] -> 501.2375577198232 | W110: =RC[-7]*RC[-5] -> 978.50930427289279 | X110: =RC[-7]*RC[-6] -> 1782.395681920417 | Y110: =RC[-12]*RC[-12] -> 2.8196006944444497E-2 | Z110: =RC[-12]*RC[-12] -> 319.92418966426754 | AA110: =RC[-12]*RC[-12] -> 316.63906412591058 | AB110: =RC[-12]*RC[-12] -> 1206.7219205254939 | AC110: =RC[-12]*RC[-12] -> 4003.9212355881086 | AD110: =RC[-12]*RC[-12] -> 793.45575999122025 | AE110: =RC[-11]/SQRT(RC[-6]*RC[-1]) -> 1 | AF110: =RC[-11]/SQRT(RC[-6]*RC[-2]) -> 1.0000000000000002 | AG110: =RC[-11]/SQRT(RC[-6]*RC[-3]) -> 1 | AH110: =RC[-11]/SQRT(RC[-6]*RC[-4]) -> 1 | AI110: =RC[-11]/SQRT(RC[-6]*RC[-5]) -> 1
A111: 9494 | B111: 北京 | C111: 104 | D111: 轻度污染 | E111: 0.76 | F111: 5 | G111: 37 | H111: 39 | I111: 44 | J111: 48 | L111: 2013-05-27T09:00:00.000 | M111: =RC[-8]-R[15]C[-8] -> -0.11791666666666678 | N111: =RC[-8]-R[15]C[-8] -> -16.886424731182796 | O111: =RC[-8]-R[15]C[-8] -> -13.79435483870968 | P111: =RC[-8]-R[15]C[-8] -> -33.737903225806448 | Q111: =RC[-8]-R[15]C[-8] -> -67.276545698924721 | R111: =RC[-8]-R[15]C[-8] -> -27.168346774193552 | T111: =RC[-7]*RC[-2] -> 3.2036008904569928 | U111: =RC[-7]*RC[-3] -> 458.77624287309231 | V111: =RC[-7]*RC[-4] -> 374.76981578433936 | W111: =RC[-7]*RC[-5] -> 916.60305427289279 | X111: =RC[-7]*RC[-6] -> 1827.7925233182666 | Y111: =RC[-12]*RC[-12] -> 1.3904340277777805E-2 | Z111: =RC[-12]*RC[-12] -> 285.15134020190197 | AA111: =RC[-12]*RC[-12] -> 190.28422541623314 | AB111: =RC[-12]*RC[-12] -> 1138.2461140738812 | AC111: =RC[-12]*RC[-12] -> 4526.1336011795065 | AD111: =RC[-12]*RC[-12] -> 738.11906644283317 | AE111: =RC[-11]/SQRT(RC[-6]*RC[-1]) -> 1 | AF111: =RC[-11]/SQRT(RC[-6]*RC[-2]) -> 1 | AG111: =RC[-11]/SQRT(RC[-6]*RC[-3]) -> 1 | AH111: =RC[-11]/SQRT(RC[-6]*RC[-4]) -> 0.99999999999999989 | AI111: =RC[-11]/SQRT(RC[-6]*RC[-5]) -> 1
A112: 9570 | B112: 北京 | C112: 101 | D112: 良 | E112: 0.84 | F112: 7 | G112: 35 | H112: 49 | I112: 37 | J112: 48 | L112: 2013-05-27T10:00:00.000 | M112: =RC[-8]-R[14]C[-8] -> -3.7916666666666821E-2 | N112: =RC[-8]-R[14]C[-8] -> -14.886424731182796 | O112: =RC[-8]-R[14]C[-8] -> -15.79435483870968 | P112: =RC[-8]-R[14]C[-8] -> -23.737903225806448 | Q112: =RC[-8]-R[14]C[-8] -> -74.276545698924721 | R112: =RC[-8]-R[14]C[-8] -> -27.168346774193552 | T112: =RC[-7]*RC[-2] -> 1.0301331485215097 | U112: =RC[-7]*RC[-3] -> 404.43954932470524 | V112: =RC[-7]*RC[-4] -> 429.10650933272643 | W112: =RC[-7]*RC[-5] -> 644.9195865309573 | X112: =RC[-7]*RC[-6] -> 2017.9709507376215 | Y112: =RC[-12]*RC[-12] -> 1.4376736111111228E-3 | Z112: =RC[-12]*RC[-12] -> 221.60564127717078 | AA112: =RC[-12]*RC[-12] -> 249.46164477107186 | AB112: =RC[-12]*RC[-12] -> 563.48804955775222 | AC112: =RC[-12]*RC[-12] -> 5517.0052409644522 | AD112: =RC[-12]*RC[-12] -> 738.11906644283317 | AE112: =RC[-11]/SQRT(RC[-6]*RC[-1]) -> 1 | AF112: =RC[-11]/SQRT(RC[-6]*RC[-2]) -> 1.0000000000000002 | AG112: =RC[-11]/SQRT(RC[-6]*RC[-3]) -> 1 | AH112: =RC[-11]/SQRT(RC[-6]*RC[-4]) -> 1 | AI112: =RC[-11]/SQRT(RC[-6]*RC[-5]) -> 1.0000000000000002
A113: 9646 | B113: 北京 | C113: 98 | D113: 良 | E113: 0.92 | F113: 10 | G113: 33 | H113: 60 | I113: 51 | J113: 49 | L113: 2013-05-27T11:00:00.000 | M113: =RC[-8]-R[13]C[-8] -> 4.208333333333325E-2 | N113: =RC[-8]-R[13]C[-8] -> -11.886424731182796 | O113: =RC[-8]-R[13]C[-8] -> -17.79435483870968 | P113: =RC[-8]-R[13]C[-8] -> -12.737903225806448 | Q113: =RC[-8]-R[13]C[-8] -> -60.276545698924721 | R113: =RC[-8]-R[13]C[-8] -> -26.168346774193552 | T113: =RC[-7]*RC[-2] -> -1.1012512600806432 | U113: =RC[-7]*RC[-3] -> 311.04808427094179 | V113: =RC[-7]*RC[-4] -> 465.64884804240387 | W113: =RC[-7]*RC[-5] -> 333.32986878902182 | X113: =RC[-7]*RC[-6] -> 1577.3375501999869 | Y113: =RC[-12]*RC[-12] -> 1.7710069444444375E-3 | Z113: =RC[-12]*RC[-12] -> 141.28709289007401 | AA113: =RC[-12]*RC[-12] -> 316.63906412591058 | AB113: =RC[-12]*RC[-12] -> 162.25417859001033 | AC113: =RC[-12]*RC[-12] -> 3633.2619613945603 | AD113: =RC[-12]*RC[-12] -> 684.7823728944461 | AE113: =RC[-11]/SQRT(RC[-6]*RC[-1]) -> -1 | AF113: =RC[-11]/SQRT(RC[-6]*RC[-2]) -> 1 | AG113: =RC[-11]/SQRT(RC[-6]*RC[-3]) -> 1 | AH113: =RC[-11]/SQRT(RC[-6]*RC[-4]) -> 1 | AI113: =RC[-11]/SQRT(RC[-6]*RC[-5]) -> 1
A114: 9722 | B114: 北京 | C114: 96 | D114: 良 | E114: 1.05 | F114: 12 | G114: 34 | H114: 63 | I114: 63 | J114: 58 | L114: 2013-05-27T12:00:00.000 | M114: =RC[-8]-R[12]C[-8] -> 0.17208333333333325 | N114: =RC[-8]-R[12]C[-8] -> -9.886424731182796 | O114: =RC[-8]-R[12]C[-8] -> -16.79435483870968 | P114: =RC[-8]-R[12]C[-8] -> -9.7379032258064484 | Q114: =RC[-8]-R[12]C[-8] -> -48.276545698924721 | R114: =RC[-8]-R[12]C[-8] -> -17.168346774193552 | T114: =RC[-7]*RC[-2] -> -2.9543863407258057 | U114: =RC[-7]*RC[-3] -> 169.7335681419095 | V114: =RC[-7]*RC[-4] -> 288.3313077198232 | W114: =RC[-7]*RC[-5] -> 167.18369943418313 | X114: =RC[-7]*RC[-6] -> 828.82847761934181 | Y114: =RC[-12]*RC[-12] -> 2.9612673611111084E-2 | Z114: =RC[-12]*RC[-12] -> 97.741393965342823 | AA114: =RC[-12]*RC[-12] -> 282.05035444849125 | AB114: =RC[-12]*RC[-12] -> 94.826759235171636 | AC114: =RC[-12]*RC[-12] -> 2330.6248646203671 | AD114: =RC[-12]*RC[-12] -> 294.75213095896214 | AE114: =RC[-11]/SQRT(RC[-6]*RC[-1]) -> -1 | AF114: =RC[-11]/SQRT(RC[-6]*RC[-2]) -> 1 | AG114: =RC[-11]/SQRT(RC[-6]*RC[-3]) -> 1 | AH114: =RC[-11]/SQRT(RC[-6]*RC[-4]) -> 1 | AI114: =RC[-11]/SQRT(RC[-6]*RC[-5]) -> 1
A115: 9798 | B115: 北京 | C115: 93 | D115: 良 | E115: 1.07 | F115: 13 | G115: 34 | H115: 67 | I115: 69 | J115: 61 | L115: 2013-05-27T13:00:00.000 | M115: =RC[-8]-R[11]C[-8] -> 0.19208333333333327 | N115: =RC[-8]-R[11]C[-8] -> -8.886424731182796 | O115: =RC[-8]-R[11]C[-8] -> -16.79435483870968 | P115: =RC[-8]-R[11]C[-8] -> -5.7379032258064484 | Q115: =RC[-8]-R[11]C[-8] -> -42.276545698924721 | R115: =RC[-8]-R[11]C[-8] -> -14.168346774193552 | T115: =RC[-7]*RC[-2] -> -2.7215032762096771 | U115: =RC[-7]*RC[-3] -> 125.90594717416757 | V115: =RC[-7]*RC[-4] -> 237.94824320369415 | W115: =RC[-7]*RC[-5] -> 81.296602659989574 | X115: =RC[-7]*RC[-6] -> 598.98875987740632 | Y115: =RC[-12]*RC[-12] -> 3.6896006944444421E-2 | Z115: =RC[-12]*RC[-12] -> 78.968544502977224 | AA115: =RC[-12]*RC[-12] -> 282.05035444849125 | AB115: =RC[-12]*RC[-12] -> 32.923533428720049 | AC115: =RC[-12]*RC[-12] -> 1787.3063162332703 | AD115: =RC[-12]*RC[-12] -> 200.74205031380083 | AE115: =RC[-11]/SQRT(RC[-6]*RC[-1]) -> -1 | AF115: =RC[-11]/SQRT(RC[-6]*RC[-2]) -> 1 | AG115: =RC[-11]/SQRT(RC[-6]*RC[-3]) -> 0.99999999999999989 | AH115: =RC[-11]/SQRT(RC[-6]*RC[-4]) -> 1 | AI115: =RC[-11]/SQRT(RC[-6]*RC[-5]) -> 1
A116: 9874 | B116: 北京 | C116: 89 | D116: 良 | E116: 1.07 | F116: 13 | G116: 36 | H116: 69 | I116: 75 | J116: 64 | L116: 2013-05-27T14:00:00.000 | M116: =RC[-8]-R[10]C[-8] -> 0.19208333333333327 | N116: =RC[-8]-R[10]C[-8] -> -8.886424731182796 | O116: =RC[-8]-R[10]C[-8] -> -14.79435483870968 | P116: =RC[-8]-R[10]C[-8] -> -3.7379032258064484 | Q116: =RC[-8]-R[10]C[-8] -> -36.276545698924721 | R116: =RC[-8]-R[10]C[-8] -> -11.168346774193552 | T116: =RC[-7]*RC[-2] -> -2.1452532762096772 | U116: =RC[-7]*RC[-3] -> 99.246672980619181 | V116: =RC[-7]*RC[-4] -> 165.22848513917802 | W116: =RC[-7]*RC[-5] -> 41.746199434183119 | X116: =RC[-7]*RC[-6] -> 405.14904213547089 | Y116: =RC[-12]*RC[-12] -> 3.6896006944444421E-2 | Z116: =RC[-12]*RC[-12] -> 78.968544502977224 | AA116: =RC[-12]*RC[-12] -> 218.8729350936525 | AB116: =RC[-12]*RC[-12] -> 13.971920525494253 | AC116: =RC[-12]*RC[-12] -> 1315.9877678461737 | AD116: =RC[-12]*RC[-12] -> 124.73196966863951 | AE116: =RC[-11]/SQRT(RC[-6]*RC[-1]) -> -1 | AF116: =RC[-11]/SQRT(RC[-6]*RC[-2]) -> 1 | AG116: =RC[-11]/SQRT(RC[-6]*RC[-3]) -> 1.0000000000000002 | AH116: =RC[-11]/SQRT(RC[-6]*RC[-4]) -> 1 | AI116: =RC[-11]/SQRT(RC[-6]*RC[-5]) -> 1
A117: 9950 | B117: 北京 | C117: 86 | D117: 良 | E117: 1.05 | F117: 12 | G117: 41 | H117: 68 | I117: 79 | J117: 63 | L117: 2013-05-27T15:00:00.000 | M117: =RC[-8]-R[9]C[-8] -> 0.17208333333333325 | N117: =RC[-8]-R[9]C[-8] -> -9.886424731182796 | O117: =RC[-8]-R[9]C[-8] -> -9.7943548387096797 | P117: =RC[-8]-R[9]C[-8] -> -4.7379032258064484 | Q117: =RC[-8]-R[9]C[-8] -> -32.276545698924721 | R117: =RC[-8]-R[9]C[-8] -> -12.168346774193552 | T117: =RC[-7]*RC[-2] -> -2.0939696740591396 | U117: =RC[-7]*RC[-3] -> 120.30144448599553 | V117: =RC[-7]*RC[-4] -> 119.18110610691994 | W117: =RC[-7]*RC[-5] -> 57.652449434183119 | X117: =RC[-7]*RC[-6] -> 392.75220073762137 | Y117: =RC[-12]*RC[-12] -> 2.9612673611111084E-2 | Z117: =RC[-12]*RC[-12] -> 97.741393965342823 | AA117: =RC[-12]*RC[-12] -> 95.929386706555718 | AB117: =RC[-12]*RC[-12] -> 22.447726977107148 | AC117: =RC[-12]*RC[-12] -> 1041.7754022547758 | AD117: =RC[-12]*RC[-12] -> 148.06866321702663 | AE117: =RC[-11]/SQRT(RC[-6]*RC[-1]) -> -1 | AF117: =RC[-11]/SQRT(RC[-6]*RC[-2]) -> 1 | AG117: =RC[-11]/SQRT(RC[-6]*RC[-3]) -> 1 | AH117: =RC[-11]/SQRT(RC[-6]*RC[-4]) -> 1 | AI117: =RC[-11]/SQRT(RC[-6]*RC[-5]) -> 0.99999999999999989
A118: 10026 | B118: 北京 | C118: 83 | D118: 良 | E118: 1.04 | F118: 12 | G118: 49 | H118: 68 | I118: 82 | J118: 72 | L118: 2013-05-27T16:00:00.000 | M118: =RC[-8]-R[8]C[-8] -> 0.16208333333333325 | N118: =RC[-8]-R[8]C[-8] -> -9.886424731182796 | O118: =RC[-8]-R[8]C[-8] -> -1.7943548387096797 | P118: =RC[-8]-R[8]C[-8] -> -4.7379032258064484 | Q118: =RC[-8]-R[8]C[-8] -> -29.276545698924721 | R118: =RC[-8]-R[8]C[-8] -> -3.1683467741935516 | T118: =RC[-7]*RC[-2] -> -0.51353620631720454 | U118: =RC[-7]*RC[-3] -> 31.323621905350361 | V118: =RC[-7]*RC[-4] -> 5.6851383649844038 | W118: =RC[-7]*RC[-5] -> 15.011320401925083 | X118: =RC[-7]*RC[-6] -> 92.758249124718233 | Y118: =RC[-12]*RC[-12] -> 2.6271006944444415E-2 | Z118: =RC[-12]*RC[-12] -> 97.741393965342823 | AA118: =RC[-12]*RC[-12] -> 3.2197092872008408 | AB118: =RC[-12]*RC[-12] -> 22.447726977107148 | AC118: =RC[-12]*RC[-12] -> 857.11612806122764 | AD118: =RC[-12]*RC[-12] -> 10.038421281542684 | AE118: =RC[-11]/SQRT(RC[-6]*RC[-1]) -> -1 | AF118: =RC[-11]/SQRT(RC[-6]*RC[-2]) -> 1 | AG118: =RC[-11]/SQRT(RC[-6]*RC[-3]) -> 0.99999999999999989 | AH118: =RC[-11]/SQRT(RC[-6]*RC[-4]) -> 1 | AI118: =RC[-11]/SQRT(RC[-6]*RC[-5]) -> 1
A119: 10102 | B119: 北京 | C119: 80 | D119: 良 | E119: 1.1000000000000001 | F119: 10 | G119: 44 | H119: 76 | I119: 83 | J119: 67 | L119: 2013-05-27T17:00:00.000 | M119: =RC[-8]-R[7]C[-8] -> 0.2220833333333333 | N119: =RC[-8]-R[7]C[-8] -> -11.886424731182796 | O119: =RC[-8]-R[7]C[-8] -> -6.7943548387096797 | P119: =RC[-8]-R[7]C[-8] -> 3.2620967741935516 | Q119: =RC[-8]-R[7]C[-8] -> -28.276545698924721 | R119: =RC[-8]-R[7]C[-8] -> -8.1683467741935516 | T119: =RC[-7]*RC[-2] -> -1.8140536794354842 | U119: =RC[-7]*RC[-3] -> 97.092439109651451 | V119: =RC[-7]*RC[-4] -> 55.49864642950056 | W119: =RC[-7]*RC[-5] -> -26.645937662591088 | X119: =RC[-7]*RC[-6] -> 230.9726308451483 | Y119: =RC[-12]*RC[-12] -> 4.9321006944444426E-2 | Z119: =RC[-12]*RC[-12] -> 141.28709289007401 | AA119: =RC[-12]*RC[-12] -> 46.16325767429764 | AB119: =RC[-12]*RC[-12] -> 10.641275364203976 | AC119: =RC[-12]*RC[-12] -> 799.56303666337817 | AD119: =RC[-12]*RC[-12] -> 66.721889023478198 | AE119: =RC[-11]/SQRT(RC[-6]*RC[-1]) -> -1 | AF119: =RC[-11]/SQRT(RC[-6]*RC[-2]) -> 1 | AG119: =RC[-11]/SQRT(RC[-6]*RC[-3]) -> 1 | AH119: =RC[-11]/SQRT(RC[-6]*RC[-4]) -> -1 | AI119: =RC[-11]/SQRT(RC[-6]*RC[-5]) -> 1.0000000000000002
A120: 10178 | B120: 北京 | C120: 78 | D120: 良 | E120: 1.05 | F120: 7 | G120: 44 | H120: 75 | I120: 85 | J120: 72 | L120: 2013-05-27T18:00:00.000 | M120: =RC[-8]-R[6]C[-8] -> 0.17208333333333325 | N120: =RC[-8]-R[6]C[-8] -> -14.886424731182796 | O120: =RC[-8]-R[6]C[-8] -> -6.7943548387096797 | P120: =RC[-8]-R[6]C[-8] -> 2.2620967741935516 | Q120: =RC[-8]-R[6]C[-8] -> -26.276545698924721 | R120: =RC[-8]-R[6]C[-8] -> -3.1683467741935516 | T120: =RC[-7]*RC[-2] -> -0.54521967405914007 | U120: =RC[-7]*RC[-3] -> 47.165355776318123 | V120: =RC[-7]*RC[-4] -> 21.526872235952162 | W120: =RC[-7]*RC[-5] -> -7.1671070174297782 | X120: =RC[-7]*RC[-6] -> 83.253208802137578 | Y120: =RC[-12]*RC[-12] -> 2.9612673611111084E-2 | Z120: =RC[-12]*RC[-12] -> 221.60564127717078 | AA120: =RC[-12]*RC[-12] -> 46.16325767429764 | AB120: =RC[-12]*RC[-12] -> 5.1170818158168716 | AC120: =RC[-12]*RC[-12] -> 690.45685386767923 | AD120: =RC[-12]*RC[-12] -> 10.038421281542684 | AE120: =RC[-11]/SQRT(RC[-6]*RC[-1]) -> -1 | AF120: =RC[-11]/SQRT(RC[-6]*RC[-2]) -> 1.0000000000000002 | AG120: =RC[-11]/SQRT(RC[-6]*RC[-3]) -> 1 | AH120: =RC[-11]/SQRT(RC[-6]*RC[-4]) -> -1 | AI120: =RC[-11]/SQRT(RC[-6]*RC[-5]) -> 1
A121: 10254 | B121: 北京 | C121: 78 | D121: 良 | E121: 1.07 | F121: 6 | G121: 48 | H121: 67 | I121: 82 | J121: 75 | L121: 2013-05-27T19:00:00.000 | M121: =RC[-8]-R[5]C[-8] -> 0.19208333333333327 | N121: =RC[-8]-R[5]C[-8] -> -15.886424731182796 | O121: =RC[-8]-R[5]C[-8] -> -2.7943548387096797 | P121: =RC[-8]-R[5]C[-8] -> -5.7379032258064484 | Q121: =RC[-8]-R[5]C[-8] -> -29.276545698924721 | R121: =RC[-8]-R[5]C[-8] -> -0.1683467741935516 | T121: =RC[-7]*RC[-2] -> -3.233660954301136E-2 | U121: =RC[-7]*RC[-3] -> 2.6744283569632836 | V121: =RC[-7]*RC[-4] -> 0.47042062304891674 | W121: =RC[-7]*RC[-5] -> 0.96595749869928949 | X121: =RC[-7]*RC[-6] -> 4.9286120279440739 | Y121: =RC[-12]*RC[-12] -> 3.6896006944444421E-2 | Z121: =RC[-12]*RC[-12] -> 252.37849073953637 | AA121: =RC[-12]*RC[-12] -> 7.8084189646202002 | AB121: =RC[-12]*RC[-12] -> 32.923533428720049 | AC121: =RC[-12]*RC[-12] -> 857.11612806122764 | AD121: =RC[-12]*RC[-12] -> 2.834063638137465E-2 | AE121: =RC[-11]/SQRT(RC[-6]*RC[-1]) -> -1 | AF121: =RC[-11]/SQRT(RC[-6]*RC[-2]) -> 1 | AG121: =RC[-11]/SQRT(RC[-6]*RC[-3]) -> 1 | AH121: =RC[-11]/SQRT(RC[-6]*RC[-4]) -> 1 | AI121: =RC[-11]/SQRT(RC[-6]*RC[-5]) -> 1
A122: 10330 | B122: 北京 | C122: 78 | D122: 良 | E122: 1.1000000000000001 | F122: 6 | G122: 59 | H122: 50 | I122: 90 | J122: 75 | L122: 2013-05-27T20:00:00.000 | M122: =RC[-8]-R[4]C[-8] -> 0.2220833333333333 | N122: =RC[-8]-R[4]C[-8] -> -15.886424731182796 | O122: =RC[-8]-R[4]C[-8] -> 8.2056451612903203 | P122: =RC[-8]-R[4]C[-8] -> -22.737903225806448 | Q122: =RC[-8]-R[4]C[-8] -> -21.276545698924721 | R122: =RC[-8]-R[4]C[-8] -> -0.1683467741935516 | T122: =RC[-7]*RC[-2] -> -3.7387012768817909E-2 | U122: =RC[-7]*RC[-3] -> 2.6744283569632836 | V122: =RC[-7]*RC[-4] -> -1.3813938930801508 | W122: =RC[-7]*RC[-5] -> 3.8278526599896665 | X122: =RC[-7]*RC[-6] -> 3.5818378343956616 | Y122: =RC[-12]*RC[-12] -> 4.9321006944444426E-2 | Z122: =RC[-12]*RC[-12] -> 252.37849073953637 | AA122: =RC[-12]*RC[-12] -> 67.332612513007248 | AB122: =RC[-12]*RC[-12] -> 517.01224310613929 | AC122: =RC[-12]*RC[-12] -> 452.69139687843204 | AD122: =RC[-12]*RC[-12] -> 2.834063638137465E-2 | AE122: =RC[-11]/SQRT(RC[-6]*RC[-1]) -> -1 | AF122: =RC[-11]/SQRT(RC[-6]*RC[-2]) -> 1 | AG122: =RC[-11]/SQRT(RC[-6]*RC[-3]) -> -1 | AH122: =RC[-11]/SQRT(RC[-6]*RC[-4]) -> 1 | AI122: =RC[-11]/SQRT(RC[-6]*RC[-5]) -> 1
A123: 10406 | B123: 北京 | C123: 79 | D123: 良 | E123: 1.1200000000000001 | F123: 5 | G123: 62 | H123: 37 | I123: 109 | J123: 84 | L123: 2013-05-27T21:00:00.000 | M123: =RC[-8]-R[3]C[-8] -> 0.24208333333333332 | N123: =RC[-8]-R[3]C[-8] -> -16.886424731182796 | O123: =RC[-8]-R[3]C[-8] -> 11.20564516129032 | P123: =RC[-8]-R[3]C[-8] -> -35.737903225806448 | Q123: =RC[-8]-R[3]C[-8] -> -2.2765456989247213 | R123: =RC[-8]-R[3]C[-8] -> 8.8316532258064484 | T123: =RC[-7]*RC[-2] -> 2.1379960517473111 | U123: =RC[-7]*RC[-3] -> -149.13504744948833 | V123: =RC[-7]*RC[-4] -> 98.964372235952084 | W123: =RC[-7]*RC[-5] -> -315.62476830775222 | X123: =RC[-7]*RC[-6] -> -20.105662165604311 | Y123: =RC[-12]*RC[-12] -> 5.8604340277777771E-2 | Z123: =RC[-12]*RC[-12] -> 285.15134020190197 | AA123: =RC[-12]*RC[-12] -> 125.56648348074917 | AB123: =RC[-12]*RC[-12] -> 1277.1977269771069 | AC123: =RC[-12]*RC[-12] -> 5.1826603192926477 | AD123: =RC[-12]*RC[-12] -> 77.998098700897444 | AE123: =RC[-11]/SQRT(RC[-6]*RC[-1]) -> 1 | AF123: =RC[-11]/SQRT(RC[-6]*RC[-2]) -> -1 | AG123: =RC[-11]/SQRT(RC[-6]*RC[-3]) -> 1 | AH123: =RC[-11]/SQRT(RC[-6]*RC[-4]) -> -1.0000000000000002 | AI123: =RC[-11]/SQRT(RC[-6]*RC[-5]) -> -1
A124: 10482 | B124: 北京 | C124: 80 | D124: 良 | E124: 1.27 | F124: 6 | G124: 57 | H124: 24 | I124: 132 | J124: 90 | L124: 2013-05-27T22:00:00.000 | M124: =RC[-8]-R[2]C[-8] -> 0.39208333333333323 | N124: =RC[-8]-R[2]C[-8] -> -15.886424731182796 | O124: =RC[-8]-R[2]C[-8] -> 6.2056451612903203 | P124: =RC[-8]-R[2]C[-8] -> -48.737903225806448 | Q124: =RC[-8]-R[2]C[-8] -> 20.723454301075279 | R124: =RC[-8]-R[2]C[-8] -> 14.831653225806448 | T124: =RC[-7]*RC[-2] -> 5.8152440356182771 | U124: =RC[-7]*RC[-3] -> -235.62194261077866 | V124: =RC[-7]*RC[-4] -> 92.039977074661763 | W124: =RC[-7]*RC[-5] -> -722.86367959807467 | X124: =RC[-7]*RC[-6] -> 307.36308783439569 | Y124: =RC[-12]*RC[-12] -> 0.15372934027777768 | Z124: =RC[-12]*RC[-12] -> 252.37849073953637 | AA124: =RC[-12]*RC[-12] -> 38.510031867845967 | AB124: =RC[-12]*RC[-12] -> 2375.3832108480747 | AC124: =RC[-12]*RC[-12] -> 429.46155816875546 | AD124: =RC[-12]*RC[-12] -> 219.97793741057484 | AE124: =RC[-11]/SQRT(RC[-6]*RC[-1]) -> 1 | AF124: =RC[-11]/SQRT(RC[-6]*RC[-2]) -> -1 | AG124: =RC[-11]/SQRT(RC[-6]*RC[-3]) -> 1 | AH124: =RC[-11]/SQRT(RC[-6]*RC[-4]) -> -0.99999999999999989 | AI124: =RC[-11]/SQRT(RC[-6]*RC[-5]) -> 1
A125: 10558 | B125: 北京 | C125: 82 | D125: 良 | E125: 1.3 | F125: 6 | G125: 55 | H125: 22 | I125: 109 | J125: 87 | L125: 2013-05-27T23:00:00.000 | M125: =RC[-8]-R[1]C[-8] -> 0.42208333333333325 | N125: =RC[-8]-R[1]C[-8] -> -15.886424731182796 | O125: =RC[-8]-R[1]C[-8] -> 4.2056451612903203 | P125: =RC[-8]-R[1]C[-8] -> -50.737903225806448 | Q125: =RC[-8]-R[1]C[-8] -> -2.2765456989247213 | R125: =RC[-8]-R[1]C[-8] -> 11.831653225806448 | T125: =RC[-7]*RC[-2] -> 4.9939436323924706 | U125: =RC[-7]*RC[-3] -> -187.96266841723028 | V125: =RC[-7]*RC[-4] -> 49.759735139177899 | W125: =RC[-7]*RC[-5] -> -600.31327637226832 | X125: =RC[-7]*RC[-6] -> -26.935299262378475 | Y125: =RC[-12]*RC[-12] -> 0.17815434027777771 | Z125: =RC[-12]*RC[-12] -> 252.37849073953637 | AA125: =RC[-12]*RC[-12] -> 17.687451222684683 | AB125: =RC[-12]*RC[-12] -> 2574.3348237513005 | AC125: =RC[-12]*RC[-12] -> 5.1826603192926477 | AD125: =RC[-12]*RC[-12] -> 139.98801805573615 | AE125: =RC[-11]/SQRT(RC[-6]*RC[-1]) -> 1 | AF125: =RC[-11]/SQRT(RC[-6]*RC[-2]) -> -1 | AG125: =RC[-11]/SQRT(RC[-6]*RC[-3]) -> 1 | AH125: =RC[-11]/SQRT(RC[-6]*RC[-4]) -> -1 | AI125: =RC[-11]/SQRT(RC[-6]*RC[-5]) -> -1
E126: =AVERAGE(R[-24]C:R[-1]C) -> 0.87791666666666679 | F126: =AVERAGE(R[-124]C:R[-1]C) -> 21.886424731182796 | G126: =AVERAGE(R[-124]C:R[-1]C) -> 50.79435483870968 | H126: =AVERAGE(R[-124]C:R[-1]C) -> 72.737903225806448 | I126: =AVERAGE(R[-124]C:R[-1]C) -> 111.27654569892472 | J126: =AVERAGE(R[-124]C:R[-1]C) -> 75.168346774193552 | M126: =RC[-8]-RC[-8] -> 0 | N126: =RC[-8]-RC[-8] -> 0 | O126: =RC[-8]-RC[-8] -> 0 | P126: =RC[-8]-RC[-8] -> 0 | Q126: =RC[-8]-RC[-8] -> 0 | R126: =RC[-8]-RC[-8] -> 0 | T126: =SUM(R[-24]C:R[-1]C) -> 84.556666666666729 | U126: =SUM(R[-24]C:R[-1]C) -> 6046.7783504595927 | V126: =SUM(R[-24]C:R[-1]C) -> 10288.956425598341 | W126: =SUM(R[-24]C:R[-1]C) -> 5593.3069719042687 | X126: =SUM(R[-24]C:R[-1]C) -> 28422.360613401845 | Y126: =SUM(R[-24]C:R[-1]C) -> 1.6081958333333339 | Z126: =SUM(R[-24]C:R[-1]C) -> 5636.08108957683 | AA126: =SUM(R[-24]C:R[-1]C) -> 9980.716571279916 | AB126: =SUM(R[-24]C:R[-1]C) -> 13621.382544224763 | AC126: =SUM(R[-24]C:R[-1]C) -> 75346.784385297418 | AD126: =SUM(R[-24]C:R[-1]C) -> 11451.276949466703 | AE126: =RC[-11]/SQRT(RC[-6]*RC[-1]) -> 0.62309092896874629 | AF126: =RC[-11]/SQRT(RC[-6]*RC[-2]) -> 0.75267670306134316 | AG126: =RC[-11]/SQRT(RC[-6]*RC[-3]) -> 0.96241749134109 | AH126: =RC[-11]/SQRT(RC[-6]*RC[-4]) -> 0.44784847621870089 | AI126: =RC[-11]/SQRT(RC[-6]*RC[-5]) -> 0.96761106269132147
A127: 10634 | B127: 北京 | C127: 84 | D127: 良 | E127: 1.27 | F127: 5 | G127: 49 | H127: 20 | I127: 108 | J127: 80 | L127: 2013-05-28T00:00:00.000 | M127: =RC[-8]-R[24]C[-8] -> 0.27666666666666673 | N127: =RC[-8]-R[24]C[-8] -> -0.5 | O127: =RC[-8]-R[24]C[-8] -> -4.1666666666666643 | P127: =RC[-8]-R[24]C[-8] -> 0.95833333333333215 | Q127: =RC[-8]-R[24]C[-8] -> 16.833333333333329 | R127: =RC[-8]-R[24]C[-8] -> 6.4166666666666714 | T127: =RC[-7]*RC[-2] -> 1.7752777777777795 | U127: =RC[-7]*RC[-3] -> -3.2083333333333357 | V127: =RC[-7]*RC[-4] -> -26.736111111111114 | W127: =RC[-7]*RC[-5] -> 6.1493055555555527 | X127: =RC[-7]*RC[-6] -> 108.01388888888894 | Y127: =RC[-12]*RC[-12] -> 7.6544444444444484E-2 | Z127: =RC[-12]*RC[-12] -> 0.25 | AA127: =RC[-12]*RC[-12] -> 17.361111111111093 | AB127: =RC[-12]*RC[-12] -> 0.91840277777777546 | AC127: =RC[-12]*RC[-12] -> 283.36111111111097 | AD127: =RC[-12]*RC[-12] -> 41.173611111111171 | AE127: =RC[-11]/SQRT(RC[-6]*RC[-1]) -> 1 | AF127: =RC[-11]/SQRT(RC[-6]*RC[-2]) -> -1 | AG127: =RC[-11]/SQRT(RC[-6]*RC[-3]) -> -0.99999999999999989 | AH127: =RC[-11]/SQRT(RC[-6]*RC[-4]) -> 1 | AI127: =RC[-11]/SQRT(RC[-6]*RC[-5]) -> 1
A128: 10710 | B128: 北京 | C128: 86 | D128: 良 | E128: 1.36 | F128: 5 | G128: 45 | H128: 20 | I128: 92 | J128: 79 | L128: 2013-05-28T01:00:00.000 | M128: =RC[-8]-R[23]C[-8] -> 0.36666666666666681 | N128: =RC[-8]-R[23]C[-8] -> -0.5 | O128: =RC[-8]-R[23]C[-8] -> -8.1666666666666643 | P128: =RC[-8]-R[23]C[-8] -> 0.95833333333333215 | Q128: =RC[-8]-R[23]C[-8] -> 0.8333333333333286 | R128: =RC[-8]-R[23]C[-8] -> 5.4166666666666714 | T128: =RC[-7]*RC[-2] -> 1.9861111111111136 | U128: =RC[-7]*RC[-3] -> -2.7083333333333357 | V128: =RC[-7]*RC[-4] -> -44.236111111111136 | W128: =RC[-7]*RC[-5] -> 5.1909722222222205 | X128: =RC[-7]*RC[-6] -> 4.5138888888888671 | Y128: =RC[-12]*RC[-12] -> 0.13444444444444456 | Z128: =RC[-12]*RC[-12] -> 0.25 | AA128: =RC[-12]*RC[-12] -> 66.6944444444444 | AB128: =RC[-12]*RC[-12] -> 0.91840277777777546 | AC128: =RC[-12]*RC[-12] -> 0.69444444444443654 | AD128: =RC[-12]*RC[-12] -> 29.340277777777828 | AE128: =RC[-11]/SQRT(RC[-6]*RC[-1]) -> 1 | AF128: =RC[-11]/SQRT(RC[-6]*RC[-2]) -> -1 | AG128: =RC[-11]/SQRT(RC[-6]*RC[-3]) -> -1 | AH128: =RC[-11]/SQRT(RC[-6]*RC[-4]) -> 1.0000000000000002 | AI128: =RC[-11]/SQRT(RC[-6]*RC[-5]) -> 1
A129: 10786 | B129: 北京 | C129: 87 | D129: 良 | E129: 1.23 | F129: 6 | G129: 39 | H129: 15 | I129: 77 | J129: 74 | L129: 2013-05-28T02:00:00.000 | M129: =RC[-8]-R[22]C[-8] -> 0.23666666666666669 | N129: =RC[-8]-R[22]C[-8] -> 0.5 | O129: =RC[-8]-R[22]C[-8] -> -14.166666666666664 | P129: =RC[-8]-R[22]C[-8] -> -4.0416666666666679 | Q129: =RC[-8]-R[22]C[-8] -> -14.166666666666671 | R129: =RC[-8]-R[22]C[-8] -> 0.4166666666666714 | T129: =RC[-7]*RC[-2] -> 9.8611111111112246E-2 | U129: =RC[-7]*RC[-3] -> 0.2083333333333357 | V129: =RC[-7]*RC[-4] -> -5.9027777777778443 | W129: =RC[-7]*RC[-5] -> -1.6840277777777974 | X129: =RC[-7]*RC[-6] -> -5.902777777777847 | Y129: =RC[-12]*RC[-12] -> 5.6011111111111123E-2 | Z129: =RC[-12]*RC[-12] -> 0.25 | AA129: =RC[-12]*RC[-12] -> 200.69444444444437 | AB129: =RC[-12]*RC[-12] -> 16.335069444444454 | AC129: =RC[-12]*RC[-12] -> 200.69444444444457 | AD129: =RC[-12]*RC[-12] -> 0.17361111111111505 | AE129: =RC[-11]/SQRT(RC[-6]*RC[-1]) -> 1 | AF129: =RC[-11]/SQRT(RC[-6]*RC[-2]) -> 1 | AG129: =RC[-11]/SQRT(RC[-6]*RC[-3]) -> -1.0000000000000002 | AH129: =RC[-11]/SQRT(RC[-6]*RC[-4]) -> -1.0000000000000002 | AI129: =RC[-11]/SQRT(RC[-6]*RC[-5]) -> -1
A130: 10862 | B130: 北京 | C130: 88 | D130: 良 | E130: 0.95 | F130: 5 | G130: 36 | H130: 22 | I130: 75 | J130: 75 | L130: 2013-05-28T03:00:00.000 | M130: =RC[-8]-R[21]C[-8] -> -4.3333333333333335E-2 | N130: =RC[-8]-R[21]C[-8] -> -0.5 | O130: =RC[-8]-R[21]C[-8] -> -17.166666666666664 | P130: =RC[-8]-R[21]C[-8] -> 2.9583333333333321 | Q130: =RC[-8]-R[21]C[-8] -> -16.166666666666671 | R130: =RC[-8]-R[21]C[-8] -> 1.4166666666666714 | T130: =RC[-7]*RC[-2] -> -6.1388888888889097E-2 | U130: =RC[-7]*RC[-3] -> -0.7083333333333357 | V130: =RC[-7]*RC[-4] -> -24.319444444444521 | W130: =RC[-7]*RC[-5] -> 4.1909722222222348 | X130: =RC[-7]*RC[-6] -> -22.90277777777786 | Y130: =RC[-12]*RC[-12] -> 1.8777777777777779E-3 | Z130: =RC[-12]*RC[-12] -> 0.25 | AA130: =RC[-12]*RC[-12] -> 294.69444444444434 | AB130: =RC[-12]*RC[-12] -> 8.7517361111111036 | AC130: =RC[-12]*RC[-12] -> 261.36111111111126 | AD130: =RC[-12]*RC[-12] -> 2.006944444444458 | AE130: =RC[-11]/SQRT(RC[-6]*RC[-1]) -> -1 | AF130: =RC[-11]/SQRT(RC[-6]*RC[-2]) -> -1 | AG130: =RC[-11]/SQRT(RC[-6]*RC[-3]) -> -1 | AH130: =RC[-11]/SQRT(RC[-6]*RC[-4]) -> 1 | AI130: =RC[-11]/SQRT(RC[-6]*RC[-5]) -> -1
A131: 10938 | B131: 北京 | C131: 90 | D131: 良 | E131: 0.84 | F131: 4 | G131: 40 | H131: 13 | I131: 92 | J131: 84 | L131: 2013-05-28T04:00:00.000 | M131: =RC[-8]-R[20]C[-8] -> -0.15333333333333332 | N131: =RC[-8]-R[20]C[-8] -> -1.5 | O131: =RC[-8]-R[20]C[-8] -> -13.166666666666664 | P131: =RC[-8]-R[20]C[-8] -> -6.0416666666666679 | Q131: =RC[-8]-R[20]C[-8] -> 0.8333333333333286 | R131: =RC[-8]-R[20]C[-8] -> 10.416666666666671 | T131: =RC[-7]*RC[-2] -> -1.5972222222222228 | U131: =RC[-7]*RC[-3] -> -15.625000000000007 | V131: =RC[-7]*RC[-4] -> -137.15277777777783 | W131: =RC[-7]*RC[-5] -> -62.934027777777821 | X131: =RC[-7]*RC[-6] -> 8.6805555555555109 | Y131: =RC[-12]*RC[-12] -> 2.3511111111111108E-2 | Z131: =RC[-12]*RC[-12] -> 2.25 | AA131: =RC[-12]*RC[-12] -> 173.36111111111106 | AB131: =RC[-12]*RC[-12] -> 36.501736111111128 | AC131: =RC[-12]*RC[-12] -> 0.69444444444443654 | AD131: =RC[-12]*RC[-12] -> 108.50694444444454 | AE131: =RC[-11]/SQRT(RC[-6]*RC[-1]) -> -1 | AF131: =RC[-11]/SQRT(RC[-6]*RC[-2]) -> -1 | AG131: =RC[-11]/SQRT(RC[-6]*RC[-3]) -> -1 | AH131: =RC[-11]/SQRT(RC[-6]*RC[-4]) -> -1 | AI131: =RC[-11]/SQRT(RC[-6]*RC[-5]) -> 1
A132: 11014 | B132: 北京 | C132: 92 | D132: 良 | E132: 0.97 | F132: 5 | G132: 50 | H132: 7 | I132: 86 | J132: 82 | L132: 2013-05-28T05:00:00.000 | M132: =RC[-8]-R[19]C[-8] -> -2.3333333333333317E-2 | N132: =RC[-8]-R[19]C[-8] -> -0.5 | O132: =RC[-8]-R[19]C[-8] -> -3.1666666666666643 | P132: =RC[-8]-R[19]C[-8] -> -12.041666666666668 | Q132: =RC[-8]-R[19]C[-8] -> -5.1666666666666714 | R132: =RC[-8]-R[19]C[-8] -> 8.4166666666666714 | T132: =RC[-7]*RC[-2] -> -0.19638888888888886 | U132: =RC[-7]*RC[-3] -> -4.2083333333333357 | V132: =RC[-7]*RC[-4] -> -26.652777777777771 | W132: =RC[-7]*RC[-5] -> -101.35069444444451 | X132: =RC[-7]*RC[-6] -> -43.486111111111178 | Y132: =RC[-12]*RC[-12] -> 5.4444444444444364E-4 | Z132: =RC[-12]*RC[-12] -> 0.25 | AA132: =RC[-12]*RC[-12] -> 10.027777777777763 | AB132: =RC[-12]*RC[-12] -> 145.00173611111114 | AC132: =RC[-12]*RC[-12] -> 26.694444444444493 | AD132: =RC[-12]*RC[-12] -> 70.840277777777857 | AE132: =RC[-11]/SQRT(RC[-6]*RC[-1]) -> -1.0000000000000002 | AF132: =RC[-11]/SQRT(RC[-6]*RC[-2]) -> -1 | AG132: =RC[-11]/SQRT(RC[-6]*RC[-3]) -> -1 | AH132: =RC[-11]/SQRT(RC[-6]*RC[-4]) -> -1 | AI132: =RC[-11]/SQRT(RC[-6]*RC[-5]) -> -1
A133: 11090 | B133: 北京 | C133: 94 | D133: 良 | E133: 1.05 | F133: 5 | G133: 49 | H133: 5 | I133: 91 | J133: 81 | L133: 2013-05-28T06:00:00.000 | M133: =RC[-8]-R[18]C[-8] -> 5.6666666666666754E-2 | N133: =RC[-8]-R[18]C[-8] -> -0.5 | O133: =RC[-8]-R[18]C[-8] -> -4.1666666666666643 | P133: =RC[-8]-R[18]C[-8] -> -14.041666666666668 | Q133: =RC[-8]-R[18]C[-8] -> -0.1666666666666714 | R133: =RC[-8]-R[18]C[-8] -> 7.4166666666666714 | T133: =RC[-7]*RC[-2] -> 0.42027777777777869 | U133: =RC[-7]*RC[-3] -> -3.7083333333333357 | V133: =RC[-7]*RC[-4] -> -30.902777777777779 | W133: =RC[-7]*RC[-5] -> -104.14236111111119 | X133: =RC[-7]*RC[-6] -> -1.2361111111111471 | Y133: =RC[-12]*RC[-12] -> 3.2111111111111212E-3 | Z133: =RC[-12]*RC[-12] -> 0.25 | AA133: =RC[-12]*RC[-12] -> 17.361111111111093 | AB133: =RC[-12]*RC[-12] -> 197.1684027777778 | AC133: =RC[-12]*RC[-12] -> 2.7777777777779358E-2 | AD133: =RC[-12]*RC[-12] -> 55.006944444444514 | AE133: =RC[-11]/SQRT(RC[-6]*RC[-1]) -> 1 | AF133: =RC[-11]/SQRT(RC[-6]*RC[-2]) -> -1 | AG133: =RC[-11]/SQRT(RC[-6]*RC[-3]) -> -0.99999999999999989 | AH133: =RC[-11]/SQRT(RC[-6]*RC[-4]) -> -1 | AI133: =RC[-11]/SQRT(RC[-6]*RC[-5]) -> -1
A134: 11166 | B134: 北京 | C134: 95 | D134: 良 | E134: 1.1000000000000001 | F134: 5 | G134: 48 | H134: 3 | I134: 92 | J134: 84 | L134: 2013-05-28T07:00:00.000 | M134: =RC[-8]-R[17]C[-8] -> 0.1066666666666668 | N134: =RC[-8]-R[17]C[-8] -> -0.5 | O134: =RC[-8]-R[17]C[-8] -> -5.1666666666666643 | P134: =RC[-8]-R[17]C[-8] -> -16.041666666666668 | Q134: =RC[-8]-R[17]C[-8] -> 0.8333333333333286 | R134: =RC[-8]-R[17]C[-8] -> 10.416666666666671 | T134: =RC[-7]*RC[-2] -> 1.1111111111111129 | U134: =RC[-7]*RC[-3] -> -5.2083333333333357 | V134: =RC[-7]*RC[-4] -> -53.819444444444443 | W134: =RC[-7]*RC[-5] -> -167.10069444444454 | X134: =RC[-7]*RC[-6] -> 8.6805555555555109 | Y134: =RC[-12]*RC[-12] -> 1.1377777777777806E-2 | Z134: =RC[-12]*RC[-12] -> 0.25 | AA134: =RC[-12]*RC[-12] -> 26.694444444444422 | AB134: =RC[-12]*RC[-12] -> 257.33506944444446 | AC134: =RC[-12]*RC[-12] -> 0.69444444444443654 | AD134: =RC[-12]*RC[-12] -> 108.50694444444454 | AE134: =RC[-11]/SQRT(RC[-6]*RC[-1]) -> 1 | AF134: =RC[-11]/SQRT(RC[-6]*RC[-2]) -> -1 | AG134: =RC[-11]/SQRT(RC[-6]*RC[-3]) -> -1 | AH134: =RC[-11]/SQRT(RC[-6]*RC[-4]) -> -1.0000000000000002 | AI134: =RC[-11]/SQRT(RC[-6]*RC[-5]) -> 1
A135: 11242 | B135: 北京 | C135: 97 | D135: 良 | E135: 1.19 | F135: 5 | G135: 50 | H135: 4 | I135: 87 | J135: 88 | L135: 2013-05-28T08:00:00.000 | M135: =RC[-8]-R[16]C[-8] -> 0.19666666666666666 | N135: =RC[-8]-R[16]C[-8] -> -0.5 | O135: =RC[-8]-R[16]C[-8] -> -3.1666666666666643 | P135: =RC[-8]-R[16]C[-8] -> -15.041666666666668 | Q135: =RC[-8]-R[16]C[-8] -> -4.1666666666666714 | R135: =RC[-8]-R[16]C[-8] -> 14.416666666666671 | T135: =RC[-7]*RC[-2] -> 2.8352777777777787 | U135: =RC[-7]*RC[-3] -> -7.2083333333333357 | V135: =RC[-7]*RC[-4] -> -45.652777777777757 | W135: =RC[-7]*RC[-5] -> -216.85069444444454 | X135: =RC[-7]*RC[-6] -> -60.069444444444535 | Y135: =RC[-12]*RC[-12] -> 3.8677777777777776E-2 | Z135: =RC[-12]*RC[-12] -> 0.25 | AA135: =RC[-12]*RC[-12] -> 10.027777777777763 | AB135: =RC[-12]*RC[-12] -> 226.25173611111114 | AC135: =RC[-12]*RC[-12] -> 17.36111111111115 | AD135: =RC[-12]*RC[-12] -> 207.84027777777791 | AE135: =RC[-11]/SQRT(RC[-6]*RC[-1]) -> 1 | AF135: =RC[-11]/SQRT(RC[-6]*RC[-2]) -> -1 | AG135: =RC[-11]/SQRT(RC[-6]*RC[-3]) -> -1 | AH135: =RC[-11]/SQRT(RC[-6]*RC[-4]) -> -1 | AI135: =RC[-11]/SQRT(RC[-6]*RC[-5]) -> -1
A136: 11318 | B136: 北京 | C136: 100 | D136: 良 | E136: 1.3 | F136: 5 | G136: 55 | H136: 4 | I136: 109 | J136: 98 | L136: 2013-05-28T09:00:00.000 | M136: =RC[-8]-R[15]C[-8] -> 0.30666666666666675 | N136: =RC[-8]-R[15]C[-8] -> -0.5 | O136: =RC[-8]-R[15]C[-8] -> 1.8333333333333357 | P136: =RC[-8]-R[15]C[-8] -> -15.041666666666668 | Q136: =RC[-8]-R[15]C[-8] -> 17.833333333333329 | R136: =RC[-8]-R[15]C[-8] -> 24.416666666666671 | T136: =RC[-7]*RC[-2] -> 7.4877777777777812 | U136: =RC[-7]*RC[-3] -> -12.208333333333336 | V136: =RC[-7]*RC[-4] -> 44.763888888888957 | W136: =RC[-7]*RC[-5] -> -367.2673611111112 | X136: =RC[-7]*RC[-6] -> 435.43055555555554 | Y136: =RC[-12]*RC[-12] -> 9.40444444444445E-2 | Z136: =RC[-12]*RC[-12] -> 0.25 | AA136: =RC[-12]*RC[-12] -> 3.3611111111111196 | AB136: =RC[-12]*RC[-12] -> 226.25173611111114 | AC136: =RC[-12]*RC[-12] -> 318.0277777777776 | AD136: =RC[-12]*RC[-12] -> 596.17361111111131 | AE136: =RC[-11]/SQRT(RC[-6]*RC[-1]) -> 1 | AF136: =RC[-11]/SQRT(RC[-6]*RC[-2]) -> -1 | AG136: =RC[-11]/SQRT(RC[-6]*RC[-3]) -> 1.0000000000000002 | AH136: =RC[-11]/SQRT(RC[-6]*RC[-4]) -> -1 | AI136: =RC[-11]/SQRT(RC[-6]*RC[-5]) -> 1
A137: 11394 | B137: 北京 | C137: 103 | D137: 轻度污染 | E137: 1.29 | F137: 5 | G137: 57 | H137: 6 | I137: 108 | J137: 99 | L137: 2013-05-28T10:00:00.000 | M137: =RC[-8]-R[14]C[-8] -> 0.29666666666666675 | N137: =RC[-8]-R[14]C[-8] -> -0.5 | O137: =RC[-8]-R[14]C[-8] -> 3.8333333333333357 | P137: =RC[-8]-R[14]C[-8] -> -13.041666666666668 | Q137: =RC[-8]-R[14]C[-8] -> 16.833333333333329 | R137: =RC[-8]-R[14]C[-8] -> 25.416666666666671 | T137: =RC[-7]*RC[-2] -> 7.5402777777777814 | U137: =RC[-7]*RC[-3] -> -12.708333333333336 | V137: =RC[-7]*RC[-4] -> 97.430555555555628 | W137: =RC[-7]*RC[-5] -> -331.47569444444451 | X137: =RC[-7]*RC[-6] -> 427.84722222222217 | Y137: =RC[-12]*RC[-12] -> 8.8011111111111151E-2 | Z137: =RC[-12]*RC[-12] -> 0.25 | AA137: =RC[-12]*RC[-12] -> 14.694444444444462 | AB137: =RC[-12]*RC[-12] -> 170.08506944444449 | AC137: =RC[-12]*RC[-12] -> 283.36111111111097 | AD137: =RC[-12]*RC[-12] -> 646.00694444444468 | AE137: =RC[-11]/SQRT(RC[-6]*RC[-1]) -> 1 | AF137: =RC[-11]/SQRT(RC[-6]*RC[-2]) -> -1 | AG137: =RC[-11]/SQRT(RC[-6]*RC[-3]) -> 1 | AH137: =RC[-11]/SQRT(RC[-6]*RC[-4]) -> -1 | AI137: =RC[-11]/SQRT(RC[-6]*RC[-5]) -> 1
A138: 11470 | B138: 北京 | C138: 104 | D138: 轻度污染 | E138: 1.22 | F138: 5 | G138: 62 | H138: 9 | I138: 101 | J138: 76 | L138: 2013-05-28T11:00:00.000 | M138: =RC[-8]-R[13]C[-8] -> 0.22666666666666668 | N138: =RC[-8]-R[13]C[-8] -> -0.5 | O138: =RC[-8]-R[13]C[-8] -> 8.8333333333333357 | P138: =RC[-8]-R[13]C[-8] -> -10.041666666666668 | Q138: =RC[-8]-R[13]C[-8] -> 9.8333333333333286 | R138: =RC[-8]-R[13]C[-8] -> 2.4166666666666714 | T138: =RC[-7]*RC[-2] -> 0.54777777777777892 | U138: =RC[-7]*RC[-3] -> -1.2083333333333357 | V138: =RC[-7]*RC[-4] -> 21.347222222222271 | W138: =RC[-7]*RC[-5] -> -24.26736111111116 | X138: =RC[-7]*RC[-6] -> 23.763888888888925 | Y138: =RC[-12]*RC[-12] -> 5.1377777777777786E-2 | Z138: =RC[-12]*RC[-12] -> 0.25 | AA138: =RC[-12]*RC[-12] -> 78.027777777777814 | AB138: =RC[-12]*RC[-12] -> 100.83506944444447 | AC138: =RC[-12]*RC[-12] -> 96.694444444444358 | AD138: =RC[-12]*RC[-12] -> 5.8402777777778008 | AE138: =RC[-11]/SQRT(RC[-6]*RC[-1]) -> 1 | AF138: =RC[-11]/SQRT(RC[-6]*RC[-2]) -> -1 | AG138: =RC[-11]/SQRT(RC[-6]*RC[-3]) -> 1.0000000000000002 | AH138: =RC[-11]/SQRT(RC[-6]*RC[-4]) -> -0.99999999999999989 | AI138: =RC[-11]/SQRT(RC[-6]*RC[-5]) -> 1
A139: 11546 | B139: 北京 | C139: 104 | D139: 轻度污染 | E139: 1.0900000000000001 | F139: 6 | G139: 62 | H139: 16 | I139: 69 | J139: 57 | L139: 2013-05-28T12:00:00.000 | M139: =RC[-8]-R[12]C[-8] -> 9.666666666666679E-2 | N139: =RC[-8]-R[12]C[-8] -> 0.5 | O139: =RC[-8]-R[12]C[-8] -> 8.8333333333333357 | P139: =RC[-8]-R[12]C[-8] -> -3.0416666666666679 | Q139: =RC[-8]-R[12]C[-8] -> -22.166666666666671 | R139: =RC[-8]-R[12]C[-8] -> -16.583333333333329 | T139: =RC[-7]*RC[-2] -> -1.6030555555555572 | U139: =RC[-7]*RC[-3] -> -8.2916666666666643 | V139: =RC[-7]*RC[-4] -> -146.48611111111111 | W139: =RC[-7]*RC[-5] -> 50.440972222222229 | X139: =RC[-7]*RC[-6] -> 367.59722222222217 | Y139: =RC[-12]*RC[-12] -> 9.3444444444444677E-3 | Z139: =RC[-12]*RC[-12] -> 0.25 | AA139: =RC[-12]*RC[-12] -> 78.027777777777814 | AB139: =RC[-12]*RC[-12] -> 9.2517361111111178 | AC139: =RC[-12]*RC[-12] -> 491.36111111111131 | AD139: =RC[-12]*RC[-12] -> 275.00694444444429 | AE139: =RC[-11]/SQRT(RC[-6]*RC[-1]) -> -1.0000000000000002 | AF139: =RC[-11]/SQRT(RC[-6]*RC[-2]) -> -1 | AG139: =RC[-11]/SQRT(RC[-6]*RC[-3]) -> -1 | AH139: =RC[-11]/SQRT(RC[-6]*RC[-4]) -> 1 | AI139: =RC[-11]/SQRT(RC[-6]*RC[-5]) -> 1
A140: 11622 | B140: 北京 | C140: 104 | D140: 轻度污染 | E140: 0.99 | F140: 8 | G140: 60 | H140: 22 | I140: 69 | J140: 52 | L140: 2013-05-28T13:00:00.000 | M140: =RC[-8]-R[11]C[-8] -> -3.3333333333332993E-3 | N140: =RC[-8]-R[11]C[-8] -> 2.5 | O140: =RC[-8]-R[11]C[-8] -> 6.8333333333333357 | P140: =RC[-8]-R[11]C[-8] -> 2.9583333333333321 | Q140: =RC[-8]-R[11]C[-8] -> -22.166666666666671 | R140: =RC[-8]-R[11]C[-8] -> -21.583333333333329 | T140: =RC[-7]*RC[-2] -> 7.19444444444437E-2 | U140: =RC[-7]*RC[-3] -> -53.958333333333321 | V140: =RC[-7]*RC[-4] -> -147.48611111111114 | W140: =RC[-7]*RC[-5] -> -63.850694444444407 | X140: =RC[-7]*RC[-6] -> 478.43055555555554 | Y140: =RC[-12]*RC[-12] -> 1.1111111111110885E-5 | Z140: =RC[-12]*RC[-12] -> 6.25 | AA140: =RC[-12]*RC[-12] -> 46.694444444444478 | AB140: =RC[-12]*RC[-12] -> 8.7517361111111036 | AC140: =RC[-12]*RC[-12] -> 491.36111111111131 | AD140: =RC[-12]*RC[-12] -> 465.8402777777776 | AE140: =RC[-11]/SQRT(RC[-6]*RC[-1]) -> 1 | AF140: =RC[-11]/SQRT(RC[-6]*RC[-2]) -> -1 | AG140: =RC[-11]/SQRT(RC[-6]*RC[-3]) -> -1 | AH140: =RC[-11]/SQRT(RC[-6]*RC[-4]) -> -1 | AI140: =RC[-11]/SQRT(RC[-6]*RC[-5]) -> 1
A141: 11690 | B141: 北京 | C141: 104 | D141: 轻度污染 | E141: 0.99 | F141: 6 | G141: 69 | H141: 19 | I141: 81 | J141: 67 | L141: 2013-05-28T14:00:00.000 | M141: =RC[-8]-R[10]C[-8] -> -3.3333333333332993E-3 | N141: =RC[-8]-R[10]C[-8] -> 0.5 | O141: =RC[-8]-R[10]C[-8] -> 15.833333333333336 | P141: =RC[-8]-R[10]C[-8] -> -4.1666666666667851E-2 | Q141: =RC[-8]-R[10]C[-8] -> -10.166666666666671 | R141: =RC[-8]-R[10]C[-8] -> -6.5833333333333286 | T141: =RC[-7]*RC[-2] -> 2.1944444444444204E-2 | U141: =RC[-7]*RC[-3] -> -3.2916666666666643 | V141: =RC[-7]*RC[-4] -> -104.23611111111106 | W141: =RC[-7]*RC[-5] -> 0.27430555555556313 | X141: =RC[-7]*RC[-6] -> 66.930555555555543 | Y141: =RC[-12]*RC[-12] -> 1.1111111111110885E-5 | Z141: =RC[-12]*RC[-12] -> 0.25 | AA141: =RC[-12]*RC[-12] -> 250.69444444444451 | AB141: =RC[-12]*RC[-12] -> 1.7361111111112099E-3 | AC141: =RC[-12]*RC[-12] -> 103.36111111111121 | AD141: =RC[-12]*RC[-12] -> 43.340277777777715 | AE141: =RC[-11]/SQRT(RC[-6]*RC[-1]) -> 1 | AF141: =RC[-11]/SQRT(RC[-6]*RC[-2]) -> -1 | AG141: =RC[-11]/SQRT(RC[-6]*RC[-3]) -> -1.0000000000000002 | AH141: =RC[-11]/SQRT(RC[-6]*RC[-4]) -> 0.99999999999999978 | AI141: =RC[-11]/SQRT(RC[-6]*RC[-5]) -> 1
A142: 11766 | B142: 北京 | C142: 104 | D142: 轻度污染 | E142: 0.95 | F142: 6 | G142: 69 | H142: 24 | I142: 92 | J142: 70 | L142: 2013-05-28T15:00:00.000 | M142: =RC[-8]-R[9]C[-8] -> -4.3333333333333335E-2 | N142: =RC[-8]-R[9]C[-8] -> 0.5 | O142: =RC[-8]-R[9]C[-8] -> 15.833333333333336 | P142: =RC[-8]-R[9]C[-8] -> 4.9583333333333321 | Q142: =RC[-8]-R[9]C[-8] -> 0.8333333333333286 | R142: =RC[-8]-R[9]C[-8] -> -3.5833333333333286 | T142: =RC[-7]*RC[-2] -> 0.15527777777777757 | U142: =RC[-7]*RC[-3] -> -1.7916666666666643 | V142: =RC[-7]*RC[-4] -> -56.736111111111043 | W142: =RC[-7]*RC[-5] -> -17.767361111111082 | X142: =RC[-7]*RC[-6] -> -2.9861111111110903 | Y142: =RC[-12]*RC[-12] -> 1.8777777777777779E-3 | Z142: =RC[-12]*RC[-12] -> 0.25 | AA142: =RC[-12]*RC[-12] -> 250.69444444444451 | AB142: =RC[-12]*RC[-12] -> 24.585069444444432 | AC142: =RC[-12]*RC[-12] -> 0.69444444444443654 | AD142: =RC[-12]*RC[-12] -> 12.840277777777743 | AE142: =RC[-11]/SQRT(RC[-6]*RC[-1]) -> 1 | AF142: =RC[-11]/SQRT(RC[-6]*RC[-2]) -> -1 | AG142: =RC[-11]/SQRT(RC[-6]*RC[-3]) -> -1 | AH142: =RC[-11]/SQRT(RC[-6]*RC[-4]) -> -1 | AI142: =RC[-11]/SQRT(RC[-6]*RC[-5]) -> -1
A143: 11842 | B143: 北京 | C143: 104 | D143: 轻度污染 | E143: 0.77 | F143: 7 | G143: 51 | H143: 31 | I143: 80 | J143: 66 | L143: 2013-05-28T16:00:00.000 | M143: =RC[-8]-R[8]C[-8] -> -0.22333333333333327 | N143: =RC[-8]-R[8]C[-8] -> 1.5 | O143: =RC[-8]-R[8]C[-8] -> -2.1666666666666643 | P143: =RC[-8]-R[8]C[-8] -> 11.958333333333332 | Q143: =RC[-8]-R[8]C[-8] -> -11.166666666666671 | R143: =RC[-8]-R[8]C[-8] -> -7.5833333333333286 | T143: =RC[-7]*RC[-2] -> 1.6936111111111096 | U143: =RC[-7]*RC[-3] -> -11.374999999999993 | V143: =RC[-7]*RC[-4] -> 16.430555555555529 | W143: =RC[-7]*RC[-5] -> -90.684027777777715 | X143: =RC[-7]*RC[-6] -> 84.680555555555543 | Y143: =RC[-12]*RC[-12] -> 4.987777777777775E-2 | Z143: =RC[-12]*RC[-12] -> 2.25 | AA143: =RC[-12]*RC[-12] -> 4.694444444444434 | AB143: =RC[-12]*RC[-12] -> 143.00173611111109 | AC143: =RC[-12]*RC[-12] -> 124.69444444444456 | AD143: =RC[-12]*RC[-12] -> 57.506944444444372 | AE143: =RC[-11]/SQRT(RC[-6]*RC[-1]) -> 1 | AF143: =RC[-11]/SQRT(RC[-6]*RC[-2]) -> -1 | AG143: =RC[-11]/SQRT(RC[-6]*RC[-3]) -> 1 | AH143: =RC[-11]/SQRT(RC[-6]*RC[-4]) -> -1 | AI143: =RC[-11]/SQRT(RC[-6]*RC[-5]) -> 1
A144: 11918 | B144: 北京 | C144: 104 | D144: 轻度污染 | E144: 0.75 | F144: 8 | G144: 48 | H144: 39 | I144: 88 | J144: 62 | L144: 2013-05-28T17:00:00.000 | M144: =RC[-8]-R[7]C[-8] -> -0.24333333333333329 | N144: =RC[-8]-R[7]C[-8] -> 2.5 | O144: =RC[-8]-R[7]C[-8] -> -5.1666666666666643 | P144: =RC[-8]-R[7]C[-8] -> 19.958333333333332 | Q144: =RC[-8]-R[7]C[-8] -> -3.1666666666666714 | R144: =RC[-8]-R[7]C[-8] -> -11.583333333333329 | T144: =RC[-7]*RC[-2] -> 2.8186111111111094 | U144: =RC[-7]*RC[-3] -> -28.958333333333321 | V144: =RC[-7]*RC[-4] -> 59.847222222222172 | W144: =RC[-7]*RC[-5] -> -231.18402777777766 | X144: =RC[-7]*RC[-6] -> 36.680555555555593 | Y144: =RC[-12]*RC[-12] -> 5.9211111111111089E-2 | Z144: =RC[-12]*RC[-12] -> 6.25 | AA144: =RC[-12]*RC[-12] -> 26.694444444444422 | AB144: =RC[-12]*RC[-12] -> 398.3350694444444 | AC144: =RC[-12]*RC[-12] -> 10.027777777777807 | AD144: =RC[-12]*RC[-12] -> 134.173611111111 | AE144: =RC[-11]/SQRT(RC[-6]*RC[-1]) -> 1 | AF144: =RC[-11]/SQRT(RC[-6]*RC[-2]) -> -1 | AG144: =RC[-11]/SQRT(RC[-6]*RC[-3]) -> 1 | AH144: =RC[-11]/SQRT(RC[-6]*RC[-4]) -> -1 | AI144: =RC[-11]/SQRT(RC[-6]*RC[-5]) -> 1
A145: 11994 | B145: 北京 | C145: 103 | D145: 轻度污染 | E145: 0.68 | F145: 7 | G145: 47 | H145: 54 | I145: 85 | J145: 56 | L145: 2013-05-28T18:00:00.000 | M145: =RC[-8]-R[6]C[-8] -> -0.31333333333333324 | N145: =RC[-8]-R[6]C[-8] -> 1.5 | O145: =RC[-8]-R[6]C[-8] -> -6.1666666666666643 | P145: =RC[-8]-R[6]C[-8] -> 34.958333333333329 | Q145: =RC[-8]-R[6]C[-8] -> -6.1666666666666714 | R145: =RC[-8]-R[6]C[-8] -> -17.583333333333329 | T145: =RC[-7]*RC[-2] -> 5.5094444444444415 | U145: =RC[-7]*RC[-3] -> -26.374999999999993 | V145: =RC[-7]*RC[-4] -> 108.43055555555549 | W145: =RC[-7]*RC[-5] -> -614.68402777777749 | X145: =RC[-7]*RC[-6] -> 108.43055555555561 | Y145: =RC[-12]*RC[-12] -> 9.8177777777777725E-2 | Z145: =RC[-12]*RC[-12] -> 2.25 | AA145: =RC[-12]*RC[-12] -> 38.02777777777775 | AB145: =RC[-12]*RC[-12] -> 1222.0850694444441 | AC145: =RC[-12]*RC[-12] -> 38.027777777777835 | AD145: =RC[-12]*RC[-12] -> 309.17361111111097 | AE145: =RC[-11]/SQRT(RC[-6]*RC[-1]) -> 1 | AF145: =RC[-11]/SQRT(RC[-6]*RC[-2]) -> -1 | AG145: =RC[-11]/SQRT(RC[-6]*RC[-3]) -> 1 | AH145: =RC[-11]/SQRT(RC[-6]*RC[-4]) -> -1 | AI145: =RC[-11]/SQRT(RC[-6]*RC[-5]) -> 1
A146: 12070 | B146: 北京 | C146: 102 | D146: 轻度污染 | E146: 0.66 | F146: 6 | G146: 51 | H146: 48 | I146: 70 | J146: 49 | L146: 2013-05-28T19:00:00.000 | M146: =RC[-8]-R[5]C[-8] -> -0.33333333333333326 | N146: =RC[-8]-R[5]C[-8] -> 0.5 | O146: =RC[-8]-R[5]C[-8] -> -2.1666666666666643 | P146: =RC[-8]-R[5]C[-8] -> 28.958333333333332 | Q146: =RC[-8]-R[5]C[-8] -> -21.166666666666671 | R146: =RC[-8]-R[5]C[-8] -> -24.583333333333329 | T146: =RC[-7]*RC[-2] -> 8.1944444444444411 | U146: =RC[-7]*RC[-3] -> -12.291666666666664 | V146: =RC[-7]*RC[-4] -> 53.263888888888822 | W146: =RC[-7]*RC[-5] -> -711.89236111111097 | X146: =RC[-7]*RC[-6] -> 520.34722222222229 | Y146: =RC[-12]*RC[-12] -> 0.11111111111111106 | Z146: =RC[-12]*RC[-12] -> 0.25 | AA146: =RC[-12]*RC[-12] -> 4.694444444444434 | AB146: =RC[-12]*RC[-12] -> 838.58506944444434 | AC146: =RC[-12]*RC[-12] -> 448.027777777778 | AD146: =RC[-12]*RC[-12] -> 604.3402777777776 | AE146: =RC[-11]/SQRT(RC[-6]*RC[-1]) -> 1 | AF146: =RC[-11]/SQRT(RC[-6]*RC[-2]) -> -1 | AG146: =RC[-11]/SQRT(RC[-6]*RC[-3]) -> 1 | AH146: =RC[-11]/SQRT(RC[-6]*RC[-4]) -> -1 | AI146: =RC[-11]/SQRT(RC[-6]*RC[-5]) -> 1
A147: 12146 | B147: 北京 | C147: 101 | D147: 良 | E147: 0.75 | F147: 5 | G147: 60 | H147: 29 | I147: 92 | J147: 62 | L147: 2013-05-28T20:00:00.000 | M147: =RC[-8]-R[4]C[-8] -> -0.24333333333333329 | N147: =RC[-8]-R[4]C[-8] -> -0.5 | O147: =RC[-8]-R[4]C[-8] -> 6.8333333333333357 | P147: =RC[-8]-R[4]C[-8] -> 9.9583333333333321 | Q147: =RC[-8]-R[4]C[-8] -> 0.8333333333333286 | R147: =RC[-8]-R[4]C[-8] -> -11.583333333333329 | T147: =RC[-7]*RC[-2] -> 2.8186111111111094 | U147: =RC[-7]*RC[-3] -> 5.7916666666666643 | V147: =RC[-7]*RC[-4] -> -79.152777777777771 | W147: =RC[-7]*RC[-5] -> -115.35069444444439 | X147: =RC[-7]*RC[-6] -> -9.6527777777777182 | Y147: =RC[-12]*RC[-12] -> 5.9211111111111089E-2 | Z147: =RC[-12]*RC[-12] -> 0.25 | AA147: =RC[-12]*RC[-12] -> 46.694444444444478 | AB147: =RC[-12]*RC[-12] -> 99.168402777777757 | AC147: =RC[-12]*RC[-12] -> 0.69444444444443654 | AD147: =RC[-12]*RC[-12] -> 134.173611111111 | AE147: =RC[-11]/SQRT(RC[-6]*RC[-1]) -> 1 | AF147: =RC[-11]/SQRT(RC[-6]*RC[-2]) -> 1 | AG147: =RC[-11]/SQRT(RC[-6]*RC[-3]) -> -1 | AH147: =RC[-11]/SQRT(RC[-6]*RC[-4]) -> -1 | AI147: =RC[-11]/SQRT(RC[-6]*RC[-5]) -> -1
A148: 12222 | B148: 北京 | C148: 100 | D148: 良 | E148: 0.84 | F148: 5 | G148: 63 | H148: 16 | I148: 115 | J148: 77 | L148: 2013-05-28T21:00:00.000 | M148: =RC[-8]-R[3]C[-8] -> -0.15333333333333332 | N148: =RC[-8]-R[3]C[-8] -> -0.5 | O148: =RC[-8]-R[3]C[-8] -> 9.8333333333333357 | P148: =RC[-8]-R[3]C[-8] -> -3.0416666666666679 | Q148: =RC[-8]-R[3]C[-8] -> 23.833333333333329 | R148: =RC[-8]-R[3]C[-8] -> 3.4166666666666714 | T148: =RC[-7]*RC[-2] -> -0.52388888888888963 | U148: =RC[-7]*RC[-3] -> -1.7083333333333357 | V148: =RC[-7]*RC[-4] -> 33.597222222222278 | W148: =RC[-7]*RC[-5] -> -10.39236111111113 | X148: =RC[-7]*RC[-6] -> 81.430555555555657 | Y148: =RC[-12]*RC[-12] -> 2.3511111111111108E-2 | Z148: =RC[-12]*RC[-12] -> 0.25 | AA148: =RC[-12]*RC[-12] -> 96.694444444444485 | AB148: =RC[-12]*RC[-12] -> 9.2517361111111178 | AC148: =RC[-12]*RC[-12] -> 568.0277777777776 | AD148: =RC[-12]*RC[-12] -> 11.673611111111143 | AE148: =RC[-11]/SQRT(RC[-6]*RC[-1]) -> -1.0000000000000002 | AF148: =RC[-11]/SQRT(RC[-6]*RC[-2]) -> -1 | AG148: =RC[-11]/SQRT(RC[-6]*RC[-3]) -> 1 | AH148: =RC[-11]/SQRT(RC[-6]*RC[-4]) -> -1.0000000000000002 | AI148: =RC[-11]/SQRT(RC[-6]*RC[-5]) -> 1
A149: 12298 | B149: 北京 | C149: 100 | D149: 良 | E149: 0.89 | F149: 4 | G149: 62 | H149: 10 | I149: 96 | J149: 77 | L149: 2013-05-28T22:00:00.000 | M149: =RC[-8]-R[2]C[-8] -> -0.10333333333333328 | N149: =RC[-8]-R[2]C[-8] -> -1.5 | O149: =RC[-8]-R[2]C[-8] -> 8.8333333333333357 | P149: =RC[-8]-R[2]C[-8] -> -9.0416666666666679 | Q149: =RC[-8]-R[2]C[-8] -> 4.8333333333333286 | R149: =RC[-8]-R[2]C[-8] -> 3.4166666666666714 | T149: =RC[-7]*RC[-2] -> -0.35305555555555584 | U149: =RC[-7]*RC[-3] -> -5.1250000000000071 | V149: =RC[-7]*RC[-4] -> 30.180555555555607 | W149: =RC[-7]*RC[-5] -> -30.892361111111157 | X149: =RC[-7]*RC[-6] -> 16.513888888888896 | Y149: =RC[-12]*RC[-12] -> 1.0677777777777767E-2 | Z149: =RC[-12]*RC[-12] -> 2.25 | AA149: =RC[-12]*RC[-12] -> 78.027777777777814 | AB149: =RC[-12]*RC[-12] -> 81.751736111111128 | AC149: =RC[-12]*RC[-12] -> 23.361111111111065 | AD149: =RC[-12]*RC[-12] -> 11.673611111111143 | AE149: =RC[-11]/SQRT(RC[-6]*RC[-1]) -> -1 | AF149: =RC[-11]/SQRT(RC[-6]*RC[-2]) -> -1 | AG149: =RC[-11]/SQRT(RC[-6]*RC[-3]) -> 1.0000000000000002 | AH149: =RC[-11]/SQRT(RC[-6]*RC[-4]) -> -1 | AI149: =RC[-11]/SQRT(RC[-6]*RC[-5]) -> 1.0000000000000002
A150: 12374 | B150: 北京 | C150: 99 | D150: 良 | E150: 0.71 | F150: 4 | G150: 54 | H150: 21 | I150: 133 | J150: 71 | L150: 2013-05-28T23:00:00.000 | M150: =RC[-8]-R[1]C[-8] -> -0.28333333333333333 | N150: =RC[-8]-R[1]C[-8] -> -1.5 | O150: =RC[-8]-R[1]C[-8] -> 0.8333333333333357 | P150: =RC[-8]-R[1]C[-8] -> 1.9583333333333321 | Q150: =RC[-8]-R[1]C[-8] -> 41.833333333333329 | R150: =RC[-8]-R[1]C[-8] -> -2.5833333333333286 | T150: =RC[-7]*RC[-2] -> 0.73194444444444307 | U150: =RC[-7]*RC[-3] -> 3.8749999999999929 | V150: =RC[-7]*RC[-4] -> -2.1527777777777799 | W150: =RC[-7]*RC[-5] -> -5.0590277777777652 | X150: =RC[-7]*RC[-6] -> -108.06944444444423 | Y150: =RC[-12]*RC[-12] -> 8.0277777777777767E-2 | Z150: =RC[-12]*RC[-12] -> 2.25 | AA150: =RC[-12]*RC[-12] -> 0.69444444444444842 | AB150: =RC[-12]*RC[-12] -> 3.8350694444444398 | AC150: =RC[-12]*RC[-12] -> 1750.0277777777774 | AD150: =RC[-12]*RC[-12] -> 6.6736111111110867 | AE150: =RC[-11]/SQRT(RC[-6]*RC[-1]) -> 1 | AF150: =RC[-11]/SQRT(RC[-6]*RC[-2]) -> 1 | AG150: =RC[-11]/SQRT(RC[-6]*RC[-3]) -> -1 | AH150: =RC[-11]/SQRT(RC[-6]*RC[-4]) -> -1 | AI150: =RC[-11]/SQRT(RC[-6]*RC[-5]) -> -1
E151: =AVERAGE(R[-24]C:R[-1]C) -> 0.99333333333333329 | F151: =AVERAGE(R[-24]C:R[-1]C) -> 5.5 | G151: =AVERAGE(R[-24]C:R[-1]C) -> 53.166666666666664 | H151: =AVERAGE(R[-24]C:R[-1]C) -> 19.041666666666668 | I151: =AVERAGE(R[-24]C:R[-1]C) -> 91.166666666666671 | J151: =AVERAGE(R[-24]C:R[-1]C) -> 73.583333333333329 | M151: =RC[-8]-RC[-8] -> 0 | N151: =RC[-8]-RC[-8] -> 0 | O151: =RC[-8]-RC[-8] -> 0 | P151: =RC[-8]-RC[-8] -> 0 | Q151: =RC[-8]-RC[-8] -> 0 | R151: =RC[-8]-RC[-8] -> 0 | T151: =SUM(R[-24]C:R[-1]C) -> 41.483333333333334 | U151: =SUM(R[-24]C:R[-1]C) -> -211.99999999999997 | V151: =SUM(R[-24]C:R[-1]C) -> -466.33333333333348 | W151: =SUM(R[-24]C:R[-1]C) -> -3202.5833333333335 | X151: =SUM(R[-24]C:R[-1]C) -> 2523.6666666666665 | Y151: =SUM(R[-24]C:R[-1]C) -> 1.0829333333333333 | Z151: =SUM(R[-24]C:R[-1]C) -> 28 | AA151: =SUM(R[-24]C:R[-1]C) -> 1835.3333333333333 | AB151: =SUM(R[-24]C:R[-1]C) -> 4224.958333333333 | AC151: =SUM(R[-24]C:R[-1]C) -> 5539.3333333333321 | AD151: =SUM(R[-24]C:R[-1]C) -> 3937.8333333333335 | AE151: =RC[-11]/SQRT(RC[-6]*RC[-1]) -> 0.63524918989714341 | AF151: =RC[-11]/SQRT(RC[-6]*RC[-2]) -> -0.63845189420616288 | AG151: =RC[-11]/SQRT(RC[-6]*RC[-3]) -> -0.17346438397732761 | AH151: =RC[-11]/SQRT(RC[-6]*RC[-4]) -> -0.78516432495566324 | AI151: =RC[-11]/SQRT(RC[-6]*RC[-5]) -> 0.54034927867215865
A152: 12450 | B152: 北京 | C152: 98 | D152: 良 | E152: 0.41 | F152: 5 | G152: 39 | H152: 35 | I152: 192 | J152: 58 | L152: 2013-05-29T00:00:00.000 | M152: =RC[-8]-R[24]C[-8] -> 0.13083333333333336 | N152: =RC[-8]-R[24]C[-8] -> -0.5 | O152: =RC[-8]-R[24]C[-8] -> 16.166666666666668 | P152: =RC[-8]-R[24]C[-8] -> -34.875 | Q152: =RC[-8]-R[24]C[-8] -> 139.875 | R152: =RC[-8]-R[24]C[-8] -> 42.25 | T152: =RC[-7]*RC[-2] -> 5.5277083333333348 | U152: =RC[-7]*RC[-3] -> -21.125 | V152: =RC[-7]*RC[-4] -> 683.04166666666674 | W152: =RC[-7]*RC[-5] -> -1473.46875 | X152: =RC[-7]*RC[-6] -> 5909.71875 | Y152: =RC[-12]*RC[-12] -> 1.7117361111111118E-2 | Z152: =RC[-12]*RC[-12] -> 0.25 | AA152: =RC[-12]*RC[-12] -> 261.36111111111114 | AB152: =RC[-12]*RC[-12] -> 1216.265625 | AC152: =RC[-12]*RC[-12] -> 19565.015625 | AD152: =RC[-12]*RC[-12] -> 1785.0625 | AE152: =RC[-11]/SQRT(RC[-6]*RC[-1]) -> 1 | AF152: =RC[-11]/SQRT(RC[-6]*RC[-2]) -> -1 | AG152: =RC[-11]/SQRT(RC[-6]*RC[-3]) -> 1 | AH152: =RC[-11]/SQRT(RC[-6]*RC[-4]) -> -1 | AI152: =RC[-11]/SQRT(RC[-6]*RC[-5]) -> 1
A153: 12526 | B153: 北京 | C153: 95 | D153: 良 | E153: 0.22 | F153: 4 | G153: 16 | H153: 52 | I153: 110 | J153: 34 | L153: 2013-05-29T01:00:00.000 | M153: =RC[-8]-R[23]C[-8] -> -5.9166666666666617E-2 | N153: =RC[-8]-R[23]C[-8] -> -1.5 | O153: =RC[-8]-R[23]C[-8] -> -6.8333333333333321 | P153: =RC[-8]-R[23]C[-8] -> -17.875 | Q153: =RC[-8]-R[23]C[-8] -> 57.875 | R153: =RC[-8]-R[23]C[-8] -> 18.25 | T153: =RC[-7]*RC[-2] -> -1.0797916666666658 | U153: =RC[-7]*RC[-3] -> -27.375 | V153: =RC[-7]*RC[-4] -> -124.70833333333331 | W153: =RC[-7]*RC[-5] -> -326.21875 | X153: =RC[-7]*RC[-6] -> 1056.21875 | Y153: =RC[-12]*RC[-12] -> 3.5006944444444387E-3 | Z153: =RC[-12]*RC[-12] -> 2.25 | AA153: =RC[-12]*RC[-12] -> 46.694444444444429 | AB153: =RC[-12]*RC[-12] -> 319.515625 | AC153: =RC[-12]*RC[-12] -> 3349.515625 | AD153: =RC[-12]*RC[-12] -> 333.0625 | AE153: =RC[-11]/SQRT(RC[-6]*RC[-1]) -> -1 | AF153: =RC[-11]/SQRT(RC[-6]*RC[-2]) -> -1 | AG153: =RC[-11]/SQRT(RC[-6]*RC[-3]) -> -1 | AH153: =RC[-11]/SQRT(RC[-6]*RC[-4]) -> -1 | AI153: =RC[-11]/SQRT(RC[-6]*RC[-5]) -> 1
A154: 12602 | B154: 北京 | C154: 92 | D154: 良 | E154: 0.2 | F154: 3 | G154: 14 | H154: 56 | I154: 76 | J154: 12 | L154: 2013-05-29T02:00:00.000 | M154: =RC[-8]-R[22]C[-8] -> -7.9166666666666607E-2 | N154: =RC[-8]-R[22]C[-8] -> -2.5 | O154: =RC[-8]-R[22]C[-8] -> -8.8333333333333321 | P154: =RC[-8]-R[22]C[-8] -> -13.875 | Q154: =RC[-8]-R[22]C[-8] -> 23.875 | R154: =RC[-8]-R[22]C[-8] -> -3.75 | T154: =RC[-7]*RC[-2] -> 0.29687499999999978 | U154: =RC[-7]*RC[-3] -> 9.375 | V154: =RC[-7]*RC[-4] -> 33.124999999999993 | W154: =RC[-7]*RC[-5] -> 52.03125 | X154: =RC[-7]*RC[-6] -> -89.53125 | Y154: =RC[-12]*RC[-12] -> 6.267361111111102E-3 | Z154: =RC[-12]*RC[-12] -> 6.25 | AA154: =RC[-12]*RC[-12] -> 78.027777777777757 | AB154: =RC[-12]*RC[-12] -> 192.515625 | AC154: =RC[-12]*RC[-12] -> 570.015625 | AD154: =RC[-12]*RC[-12] -> 14.0625 | AE154: =RC[-11]/SQRT(RC[-6]*RC[-1]) -> 1 | AF154: =RC[-11]/SQRT(RC[-6]*RC[-2]) -> 1 | AG154: =RC[-11]/SQRT(RC[-6]*RC[-3]) -> 0.99999999999999978 | AH154: =RC[-11]/SQRT(RC[-6]*RC[-4]) -> 1 | AI154: =RC[-11]/SQRT(RC[-6]*RC[-5]) -> -1
A155: 12678 | B155: 北京 | C155: 89 | D155: 良 | E155: 0.22 | F155: 4 | G155: 14 | H155: 55 | I155: 46 | J155: 7 | L155: 2013-05-29T03:00:00.000 | M155: =RC[-8]-R[21]C[-8] -> -5.9166666666666617E-2 | N155: =RC[-8]-R[21]C[-8] -> -1.5 | O155: =RC[-8]-R[21]C[-8] -> -8.8333333333333321 | P155: =RC[-8]-R[21]C[-8] -> -14.875 | Q155: =RC[-8]-R[21]C[-8] -> -6.125 | R155: =RC[-8]-R[21]C[-8] -> -8.75 | T155: =RC[-7]*RC[-2] -> 0.51770833333333288 | U155: =RC[-7]*RC[-3] -> 13.125 | V155: =RC[-7]*RC[-4] -> 77.291666666666657 | W155: =RC[-7]*RC[-5] -> 130.15625 | X155: =RC[-7]*RC[-6] -> 53.59375 | Y155: =RC[-12]*RC[-12] -> 3.5006944444444387E-3 | Z155: =RC[-12]*RC[-12] -> 2.25 | AA155: =RC[-12]*RC[-12] -> 78.027777777777757 | AB155: =RC[-12]*RC[-12] -> 221.265625 | AC155: =RC[-12]*RC[-12] -> 37.515625 | AD155: =RC[-12]*RC[-12] -> 76.5625 | AE155: =RC[-11]/SQRT(RC[-6]*RC[-1]) -> 1 | AF155: =RC[-11]/SQRT(RC[-6]*RC[-2]) -> 1 | AG155: =RC[-11]/SQRT(RC[-6]*RC[-3]) -> 1 | AH155: =RC[-11]/SQRT(RC[-6]*RC[-4]) -> 1 | AI155: =RC[-11]/SQRT(RC[-6]*RC[-5]) -> 1
A156: 12754 | B156: 北京 | C156: 84 | D156: 良 | E156: 0.2 | F156: 5 | G156: 13 | H156: 49 | I156: 27 | J156: 6 | L156: 2013-05-29T04:00:00.000 | M156: =RC[-8]-R[20]C[-8] -> -7.9166666666666607E-2 | N156: =RC[-8]-R[20]C[-8] -> -0.5 | O156: =RC[-8]-R[20]C[-8] -> -9.8333333333333321 | P156: =RC[-8]-R[20]C[-8] -> -20.875 | Q156: =RC[-8]-R[20]C[-8] -> -25.125 | R156: =RC[-8]-R[20]C[-8] -> -9.75 | T156: =RC[-7]*RC[-2] -> 0.77187499999999942 | U156: =RC[-7]*RC[-3] -> 4.875 | V156: =RC[-7]*RC[-4] -> 95.874999999999986 | W156: =RC[-7]*RC[-5] -> 203.53125 | X156: =RC[-7]*RC[-6] -> 244.96875 | Y156: =RC[-12]*RC[-12] -> 6.267361111111102E-3 | Z156: =RC[-12]*RC[-12] -> 0.25 | AA156: =RC[-12]*RC[-12] -> 96.694444444444414 | AB156: =RC[-12]*RC[-12] -> 435.765625 | AC156: =RC[-12]*RC[-12] -> 631.265625 | AD156: =RC[-12]*RC[-12] -> 95.0625 | AE156: =RC[-11]/SQRT(RC[-6]*RC[-1]) -> 1 | AF156: =RC[-11]/SQRT(RC[-6]*RC[-2]) -> 1 | AG156: =RC[-11]/SQRT(RC[-6]*RC[-3]) -> 1 | AH156: =RC[-11]/SQRT(RC[-6]*RC[-4]) -> 1 | AI156: =RC[-11]/SQRT(RC[-6]*RC[-5]) -> 1
A157: 12830 | B157: 北京 | C157: 81 | D157: 良 | E157: 0.23 | F157: 5 | G157: 15 | H157: 47 | I157: 19 | J157: 5 | L157: 2013-05-29T05:00:00.000 | M157: =RC[-8]-R[19]C[-8] -> -4.9166666666666609E-2 | N157: =RC[-8]-R[19]C[-8] -> -0.5 | O157: =RC[-8]-R[19]C[-8] -> -7.8333333333333321 | P157: =RC[-8]-R[19]C[-8] -> -22.875 | Q157: =RC[-8]-R[19]C[-8] -> -33.125 | R157: =RC[-8]-R[19]C[-8] -> -10.75 | T157: =RC[-7]*RC[-2] -> 0.52854166666666602 | U157: =RC[-7]*RC[-3] -> 5.375 | V157: =RC[-7]*RC[-4] -> 84.208333333333314 | W157: =RC[-7]*RC[-5] -> 245.90625 | X157: =RC[-7]*RC[-6] -> 356.09375 | Y157: =RC[-12]*RC[-12] -> 2.4173611111111054E-3 | Z157: =RC[-12]*RC[-12] -> 0.25 | AA157: =RC[-12]*RC[-12] -> 61.361111111111093 | AB157: =RC[-12]*RC[-12] -> 523.265625 | AC157: =RC[-12]*RC[-12] -> 1097.265625 | AD157: =RC[-12]*RC[-12] -> 115.5625 | AE157: =RC[-11]/SQRT(RC[-6]*RC[-1]) -> 1 | AF157: =RC[-11]/SQRT(RC[-6]*RC[-2]) -> 1 | AG157: =RC[-11]/SQRT(RC[-6]*RC[-3]) -> 1 | AH157: =RC[-11]/SQRT(RC[-6]*RC[-4]) -> 1 | AI157: =RC[-11]/SQRT(RC[-6]*RC[-5]) -> 1
A158: 12906 | B158: 北京 | C158: 77 | D158: 良 | E158: 0.24 | F158: 5 | G158: 16 | H158: 46 | I158: 22 | J158: 5 | L158: 2013-05-29T06:00:00.000 | M158: =RC[-8]-R[18]C[-8] -> -3.9166666666666627E-2 | N158: =RC[-8]-R[18]C[-8] -> -0.5 | O158: =RC[-8]-R[18]C[-8] -> -6.8333333333333321 | P158: =RC[-8]-R[18]C[-8] -> -23.875 | Q158: =RC[-8]-R[18]C[-8] -> -30.125 | R158: =RC[-8]-R[18]C[-8] -> -10.75 | T158: =RC[-7]*RC[-2] -> 0.42104166666666626 | U158: =RC[-7]*RC[-3] -> 5.375 | V158: =RC[-7]*RC[-4] -> 73.458333333333314 | W158: =RC[-7]*RC[-5] -> 256.65625 | X158: =RC[-7]*RC[-6] -> 323.84375 | Y158: =RC[-12]*RC[-12] -> 1.5340277777777748E-3 | Z158: =RC[-12]*RC[-12] -> 0.25 | AA158: =RC[-12]*RC[-12] -> 46.694444444444429 | AB158: =RC[-12]*RC[-12] -> 570.015625 | AC158: =RC[-12]*RC[-12] -> 907.515625 | AD158: =RC[-12]*RC[-12] -> 115.5625 | AE158: =RC[-11]/SQRT(RC[-6]*RC[-1]) -> 1 | AF158: =RC[-11]/SQRT(RC[-6]*RC[-2]) -> 1 | AG158: =RC[-11]/SQRT(RC[-6]*RC[-3]) -> 0.99999999999999978 | AH158: =RC[-11]/SQRT(RC[-6]*RC[-4]) -> 1 | AI158: =RC[-11]/SQRT(RC[-6]*RC[-5]) -> 1
A159: 12982 | B159: 北京 | C159: 73 | D159: 良 | E159: 0.27 | F159: 5 | G159: 24 | H159: 37 | I159: 32 | J159: 8 | L159: 2013-05-29T07:00:00.000 | M159: =RC[-8]-R[17]C[-8] -> -9.1666666666666008E-3 | N159: =RC[-8]-R[17]C[-8] -> -0.5 | O159: =RC[-8]-R[17]C[-8] -> 1.1666666666666679 | P159: =RC[-8]-R[17]C[-8] -> -32.875 | Q159: =RC[-8]-R[17]C[-8] -> -20.125 | R159: =RC[-8]-R[17]C[-8] -> -7.75 | T159: =RC[-7]*RC[-2] -> 7.1041666666666156E-2 | U159: =RC[-7]*RC[-3] -> 3.875 | V159: =RC[-7]*RC[-4] -> -9.041666666666675 | W159: =RC[-7]*RC[-5] -> 254.78125 | X159: =RC[-7]*RC[-6] -> 155.96875 | Y159: =RC[-12]*RC[-12] -> 8.4027777777776565E-5 | Z159: =RC[-12]*RC[-12] -> 0.25 | AA159: =RC[-12]*RC[-12] -> 1.3611111111111138 | AB159: =RC[-12]*RC[-12] -> 1080.765625 | AC159: =RC[-12]*RC[-12] -> 405.015625 | AD159: =RC[-12]*RC[-12] -> 60.0625 | AE159: =RC[-11]/SQRT(RC[-6]*RC[-1]) -> 1 | AF159: =RC[-11]/SQRT(RC[-6]*RC[-2]) -> 1 | AG159: =RC[-11]/SQRT(RC[-6]*RC[-3]) -> -1 | AH159: =RC[-11]/SQRT(RC[-6]*RC[-4]) -> 1 | AI159: =RC[-11]/SQRT(RC[-6]*RC[-5]) -> 1
A160: 13058 | B160: 北京 | C160: 69 | D160: 良 | E160: 0.31 | F160: 5 | G160: 21 | H160: 43 | I160: 23 | J160: 7 | L160: 2013-05-29T08:00:00.000 | M160: =RC[-8]-R[16]C[-8] -> 3.0833333333333379E-2 | N160: =RC[-8]-R[16]C[-8] -> -0.5 | O160: =RC[-8]-R[16]C[-8] -> -1.8333333333333321 | P160: =RC[-8]-R[16]C[-8] -> -26.875 | Q160: =RC[-8]-R[16]C[-8] -> -29.125 | R160: =RC[-8]-R[16]C[-8] -> -8.75 | T160: =RC[-7]*RC[-2] -> -0.2697916666666671 | U160: =RC[-7]*RC[-3] -> 4.375 | V160: =RC[-7]*RC[-4] -> 16.041666666666657 | W160: =RC[-7]*RC[-5] -> 235.15625 | X160: =RC[-7]*RC[-6] -> 254.84375 | Y160: =RC[-12]*RC[-12] -> 9.5069444444444726E-4 | Z160: =RC[-12]*RC[-12] -> 0.25 | AA160: =RC[-12]*RC[-12] -> 3.3611111111111067 | AB160: =RC[-12]*RC[-12] -> 722.265625 | AC160: =RC[-12]*RC[-12] -> 848.265625 | AD160: =RC[-12]*RC[-12] -> 76.5625 | AE160: =RC[-11]/SQRT(RC[-6]*RC[-1]) -> -1.0000000000000002 | AF160: =RC[-11]/SQRT(RC[-6]*RC[-2]) -> 1 | AG160: =RC[-11]/SQRT(RC[-6]*RC[-3]) -> 1 | AH160: =RC[-11]/SQRT(RC[-6]*RC[-4]) -> 1 | AI160: =RC[-11]/SQRT(RC[-6]*RC[-5]) -> 1
A161: 13134 | B161: 北京 | C161: 65 | D161: 良 | E161: 0.28999999999999998 | F161: 5 | G161: 15 | H161: 55 | I161: 16 | J161: 8 | L161: 2013-05-29T09:00:00.000 | M161: =RC[-8]-R[15]C[-8] -> 1.0833333333333361E-2 | N161: =RC[-8]-R[15]C[-8] -> -0.5 | O161: =RC[-8]-R[15]C[-8] -> -7.8333333333333321 | P161: =RC[-8]-R[15]C[-8] -> -14.875 | Q161: =RC[-8]-R[15]C[-8] -> -36.125 | R161: =RC[-8]-R[15]C[-8] -> -7.75 | T161: =RC[-7]*RC[-2] -> -8.3958333333333551E-2 | U161: =RC[-7]*RC[-3] -> 3.875 | V161: =RC[-7]*RC[-4] -> 60.708333333333321 | W161: =RC[-7]*RC[-5] -> 115.28125 | X161: =RC[-7]*RC[-6] -> 279.96875 | Y161: =RC[-12]*RC[-12] -> 1.1736111111111172E-4 | Z161: =RC[-12]*RC[-12] -> 0.25 | AA161: =RC[-12]*RC[-12] -> 61.361111111111093 | AB161: =RC[-12]*RC[-12] -> 221.265625 | AC161: =RC[-12]*RC[-12] -> 1305.015625 | AD161: =RC[-12]*RC[-12] -> 60.0625 | AE161: =RC[-11]/SQRT(RC[-6]*RC[-1]) -> -1 | AF161: =RC[-11]/SQRT(RC[-6]*RC[-2]) -> 1 | AG161: =RC[-11]/SQRT(RC[-6]*RC[-3]) -> 1 | AH161: =RC[-11]/SQRT(RC[-6]*RC[-4]) -> 1 | AI161: =RC[-11]/SQRT(RC[-6]*RC[-5]) -> 1
A162: 13210 | B162: 北京 | C162: 61 | D162: 良 | E162: 0.3 | F162: 5 | G162: 14 | H162: 64 | I162: 15 | J162: 6 | L162: 2013-05-29T10:00:00.000 | M162: =RC[-8]-R[14]C[-8] -> 2.083333333333337E-2 | N162: =RC[-8]-R[14]C[-8] -> -0.5 | O162: =RC[-8]-R[14]C[-8] -> -8.8333333333333321 | P162: =RC[-8]-R[14]C[-8] -> -5.875 | Q162: =RC[-8]-R[14]C[-8] -> -37.125 | R162: =RC[-8]-R[14]C[-8] -> -9.75 | T162: =RC[-7]*RC[-2] -> -0.20312500000000036 | U162: =RC[-7]*RC[-3] -> 4.875 | V162: =RC[-7]*RC[-4] -> 86.124999999999986 | W162: =RC[-7]*RC[-5] -> 57.28125 | X162: =RC[-7]*RC[-6] -> 361.96875 | Y162: =RC[-12]*RC[-12] -> 4.3402777777777933E-4 | Z162: =RC[-12]*RC[-12] -> 0.25 | AA162: =RC[-12]*RC[-12] -> 78.027777777777757 | AB162: =RC[-12]*RC[-12] -> 34.515625 | AC162: =RC[-12]*RC[-12] -> 1378.265625 | AD162: =RC[-12]*RC[-12] -> 95.0625 | AE162: =RC[-11]/SQRT(RC[-6]*RC[-1]) -> -1 | AF162: =RC[-11]/SQRT(RC[-6]*RC[-2]) -> 1 | AG162: =RC[-11]/SQRT(RC[-6]*RC[-3]) -> 1 | AH162: =RC[-11]/SQRT(RC[-6]*RC[-4]) -> 1 | AI162: =RC[-11]/SQRT(RC[-6]*RC[-5]) -> 1
A163: 13286 | B163: 北京 | C163: 59 | D163: 良 | E163: 0.25 | F163: 5 | G163: 13 | H163: 72 | I163: 14 | J163: 10 | L163: 2013-05-29T11:00:00.000 | M163: =RC[-8]-R[13]C[-8] -> -2.9166666666666619E-2 | N163: =RC[-8]-R[13]C[-8] -> -0.5 | O163: =RC[-8]-R[13]C[-8] -> -9.8333333333333321 | P163: =RC[-8]-R[13]C[-8] -> 2.125 | Q163: =RC[-8]-R[13]C[-8] -> -38.125 | R163: =RC[-8]-R[13]C[-8] -> -5.75 | T163: =RC[-7]*RC[-2] -> 0.16770833333333307 | U163: =RC[-7]*RC[-3] -> 2.875 | V163: =RC[-7]*RC[-4] -> 56.541666666666657 | W163: =RC[-7]*RC[-5] -> -12.21875 | X163: =RC[-7]*RC[-6] -> 219.21875 | Y163: =RC[-12]*RC[-12] -> 8.5069444444444168E-4 | Z163: =RC[-12]*RC[-12] -> 0.25 | AA163: =RC[-12]*RC[-12] -> 96.694444444444414 | AB163: =RC[-12]*RC[-12] -> 4.515625 | AC163: =RC[-12]*RC[-12] -> 1453.515625 | AD163: =RC[-12]*RC[-12] -> 33.0625 | AE163: =RC[-11]/SQRT(RC[-6]*RC[-1]) -> 1.0000000000000002 | AF163: =RC[-11]/SQRT(RC[-6]*RC[-2]) -> 1 | AG163: =RC[-11]/SQRT(RC[-6]*RC[-3]) -> 1 | AH163: =RC[-11]/SQRT(RC[-6]*RC[-4]) -> -1 | AI163: =RC[-11]/SQRT(RC[-6]*RC[-5]) -> 1
A164: 13362 | B164: 北京 | C164: 57 | D164: 良 | E164: 0.21 | F164: 4 | G164: 12 | H164: 83 | I164: 10 | J164: 10 | L164: 2013-05-29T12:00:00.000 | M164: =RC[-8]-R[12]C[-8] -> -6.9166666666666626E-2 | N164: =RC[-8]-R[12]C[-8] -> -1.5 | O164: =RC[-8]-R[12]C[-8] -> -10.833333333333332 | P164: =RC[-8]-R[12]C[-8] -> 13.125 | Q164: =RC[-8]-R[12]C[-8] -> -42.125 | R164: =RC[-8]-R[12]C[-8] -> -5.75 | T164: =RC[-7]*RC[-2] -> 0.39770833333333311 | U164: =RC[-7]*RC[-3] -> 8.625 | V164: =RC[-7]*RC[-4] -> 62.291666666666657 | W164: =RC[-7]*RC[-5] -> -75.46875 | X164: =RC[-7]*RC[-6] -> 242.21875 | Y164: =RC[-12]*RC[-12] -> 4.7840277777777725E-3 | Z164: =RC[-12]*RC[-12] -> 2.25 | AA164: =RC[-12]*RC[-12] -> 117.36111111111109 | AB164: =RC[-12]*RC[-12] -> 172.265625 | AC164: =RC[-12]*RC[-12] -> 1774.515625 | AD164: =RC[-12]*RC[-12] -> 33.0625 | AE164: =RC[-11]/SQRT(RC[-6]*RC[-1]) -> 1 | AF164: =RC[-11]/SQRT(RC[-6]*RC[-2]) -> 1 | AG164: =RC[-11]/SQRT(RC[-6]*RC[-3]) -> 0.99999999999999989 | AH164: =RC[-11]/SQRT(RC[-6]*RC[-4]) -> -1 | AI164: =RC[-11]/SQRT(RC[-6]*RC[-5]) -> 1
A165: 13438 | B165: 北京 | C165: 56 | D165: 良 | E165: 0.18 | F165: 4 | G165: 11 | H165: 93 | I165: 19 | J165: 11 | L165: 2013-05-29T13:00:00.000 | M165: =RC[-8]-R[11]C[-8] -> -9.9166666666666625E-2 | N165: =RC[-8]-R[11]C[-8] -> -1.5 | O165: =RC[-8]-R[11]C[-8] -> -11.833333333333332 | P165: =RC[-8]-R[11]C[-8] -> 23.125 | Q165: =RC[-8]-R[11]C[-8] -> -33.125 | R165: =RC[-8]-R[11]C[-8] -> -4.75 | T165: =RC[-7]*RC[-2] -> 0.47104166666666647 | U165: =RC[-7]*RC[-3] -> 7.125 | V165: =RC[-7]*RC[-4] -> 56.208333333333329 | W165: =RC[-7]*RC[-5] -> -109.84375 | X165: =RC[-7]*RC[-6] -> 157.34375 | Y165: =RC[-12]*RC[-12] -> 9.8340277777777697E-3 | Z165: =RC[-12]*RC[-12] -> 2.25 | AA165: =RC[-12]*RC[-12] -> 140.02777777777774 | AB165: =RC[-12]*RC[-12] -> 534.765625 | AC165: =RC[-12]*RC[-12] -> 1097.265625 | AD165: =RC[-12]*RC[-12] -> 22.5625 | AE165: =RC[-11]/SQRT(RC[-6]*RC[-1]) -> 1 | AF165: =RC[-11]/SQRT(RC[-6]*RC[-2]) -> 1 | AG165: =RC[-11]/SQRT(RC[-6]*RC[-3]) -> 1 | AH165: =RC[-11]/SQRT(RC[-6]*RC[-4]) -> -1 | AI165: =RC[-11]/SQRT(RC[-6]*RC[-5]) -> 1
A166: 13514 | B166: 北京 | C166: 55 | D166: 良 | E166: 0.2 | F166: 4 | G166: 13 | H166: 99 | I166: 23 | J166: 9 | L166: 2013-05-29T14:00:00.000 | M166: =RC[-8]-R[10]C[-8] -> -7.9166666666666607E-2 | N166: =RC[-8]-R[10]C[-8] -> -1.5 | O166: =RC[-8]-R[10]C[-8] -> -9.8333333333333321 | P166: =RC[-8]-R[10]C[-8] -> 29.125 | Q166: =RC[-8]-R[10]C[-8] -> -29.125 | R166: =RC[-8]-R[10]C[-8] -> -6.75 | T166: =RC[-7]*RC[-2] -> 0.5343749999999996 | U166: =RC[-7]*RC[-3] -> 10.125 | V166: =RC[-7]*RC[-4] -> 66.374999999999986 | W166: =RC[-7]*RC[-5] -> -196.59375 | X166: =RC[-7]*RC[-6] -> 196.59375 | Y166: =RC[-12]*RC[-12] -> 6.267361111111102E-3 | Z166: =RC[-12]*RC[-12] -> 2.25 | AA166: =RC[-12]*RC[-12] -> 96.694444444444414 | AB166: =RC[-12]*RC[-12] -> 848.265625 | AC166: =RC[-12]*RC[-12] -> 848.265625 | AD166: =RC[-12]*RC[-12] -> 45.5625 | AE166: =RC[-11]/SQRT(RC[-6]*RC[-1]) -> 1 | AF166: =RC[-11]/SQRT(RC[-6]*RC[-2]) -> 1 | AG166: =RC[-11]/SQRT(RC[-6]*RC[-3]) -> 1 | AH166: =RC[-11]/SQRT(RC[-6]*RC[-4]) -> -1 | AI166: =RC[-11]/SQRT(RC[-6]*RC[-5]) -> 1
A167: 13590 | B167: 北京 | C167: 52 | D167: 良 | E167: 0.21 | F167: 4 | G167: 14 | H167: 101 | I167: 31 | J167: 10 | L167: 2013-05-29T15:00:00.000 | M167: =RC[-8]-R[9]C[-8] -> -6.9166666666666626E-2 | N167: =RC[-8]-R[9]C[-8] -> -1.5 | O167: =RC[-8]-R[9]C[-8] -> -8.8333333333333321 | P167: =RC[-8]-R[9]C[-8] -> 31.125 | Q167: =RC[-8]-R[9]C[-8] -> -21.125 | R167: =RC[-8]-R[9]C[-8] -> -5.75 | T167: =RC[-7]*RC[-2] -> 0.39770833333333311 | U167: =RC[-7]*RC[-3] -> 8.625 | V167: =RC[-7]*RC[-4] -> 50.791666666666657 | W167: =RC[-7]*RC[-5] -> -178.96875 | X167: =RC[-7]*RC[-6] -> 121.46875 | Y167: =RC[-12]*RC[-12] -> 4.7840277777777725E-3 | Z167: =RC[-12]*RC[-12] -> 2.25 | AA167: =RC[-12]*RC[-12] -> 78.027777777777757 | AB167: =RC[-12]*RC[-12] -> 968.765625 | AC167: =RC[-12]*RC[-12] -> 446.265625 | AD167: =RC[-12]*RC[-12] -> 33.0625 | AE167: =RC[-11]/SQRT(RC[-6]*RC[-1]) -> 1 | AF167: =RC[-11]/SQRT(RC[-6]*RC[-2]) -> 1 | AG167: =RC[-11]/SQRT(RC[-6]*RC[-3]) -> 1 | AH167: =RC[-11]/SQRT(RC[-6]*RC[-4]) -> -1 | AI167: =RC[-11]/SQRT(RC[-6]*RC[-5]) -> 1
A168: 13666 | B168: 北京 | C168: 52 | D168: 良 | E168: 0.22 | F168: 4 | G168: 16 | H168: 100 | I168: 29 | J168: 11 | L168: 2013-05-29T16:00:00.000 | M168: =RC[-8]-R[8]C[-8] -> -5.9166666666666617E-2 | N168: =RC[-8]-R[8]C[-8] -> -1.5 | O168: =RC[-8]-R[8]C[-8] -> -6.8333333333333321 | P168: =RC[-8]-R[8]C[-8] -> 30.125 | Q168: =RC[-8]-R[8]C[-8] -> -23.125 | R168: =RC[-8]-R[8]C[-8] -> -4.75 | T168: =RC[-7]*RC[-2] -> 0.28104166666666641 | U168: =RC[-7]*RC[-3] -> 7.125 | V168: =RC[-7]*RC[-4] -> 32.458333333333329 | W168: =RC[-7]*RC[-5] -> -143.09375 | X168: =RC[-7]*RC[-6] -> 109.84375 | Y168: =RC[-12]*RC[-12] -> 3.5006944444444387E-3 | Z168: =RC[-12]*RC[-12] -> 2.25 | AA168: =RC[-12]*RC[-12] -> 46.694444444444429 | AB168: =RC[-12]*RC[-12] -> 907.515625 | AC168: =RC[-12]*RC[-12] -> 534.765625 | AD168: =RC[-12]*RC[-12] -> 22.5625 | AE168: =RC[-11]/SQRT(RC[-6]*RC[-1]) -> 1 | AF168: =RC[-11]/SQRT(RC[-6]*RC[-2]) -> 1 | AG168: =RC[-11]/SQRT(RC[-6]*RC[-3]) -> 1 | AH168: =RC[-11]/SQRT(RC[-6]*RC[-4]) -> -1 | AI168: =RC[-11]/SQRT(RC[-6]*RC[-5]) -> 1
A169: 13742 | B169: 北京 | C169: 52 | D169: 良 | E169: 0.22 | F169: 4 | G169: 20 | H169: 103 | I169: 37 | J169: 10 | L169: 2013-05-29T17:00:00.000 | M169: =RC[-8]-R[7]C[-8] -> -5.9166666666666617E-2 | N169: =RC[-8]-R[7]C[-8] -> -1.5 | O169: =RC[-8]-R[7]C[-8] -> -2.8333333333333321 | P169: =RC[-8]-R[7]C[-8] -> 33.125 | Q169: =RC[-8]-R[7]C[-8] -> -15.125 | R169: =RC[-8]-R[7]C[-8] -> -5.75 | T169: =RC[-7]*RC[-2] -> 0.34020833333333306 | U169: =RC[-7]*RC[-3] -> 8.625 | V169: =RC[-7]*RC[-4] -> 16.291666666666661 | W169: =RC[-7]*RC[-5] -> -190.46875 | X169: =RC[-7]*RC[-6] -> 86.96875 | Y169: =RC[-12]*RC[-12] -> 3.5006944444444387E-3 | Z169: =RC[-12]*RC[-12] -> 2.25 | AA169: =RC[-12]*RC[-12] -> 8.0277777777777715 | AB169: =RC[-12]*RC[-12] -> 1097.265625 | AC169: =RC[-12]*RC[-12] -> 228.765625 | AD169: =RC[-12]*RC[-12] -> 33.0625 | AE169: =RC[-11]/SQRT(RC[-6]*RC[-1]) -> 1 | AF169: =RC[-11]/SQRT(RC[-6]*RC[-2]) -> 1 | AG169: =RC[-11]/SQRT(RC[-6]*RC[-3]) -> 1 | AH169: =RC[-11]/SQRT(RC[-6]*RC[-4]) -> -1 | AI169: =RC[-11]/SQRT(RC[-6]*RC[-5]) -> 1
A170: 13818 | B170: 北京 | C170: 52 | D170: 良 | E170: 0.27 | F170: 4 | G170: 24 | H170: 107 | I170: 42 | J170: 14 | L170: 2013-05-29T18:00:00.000 | M170: =RC[-8]-R[6]C[-8] -> -9.1666666666666008E-3 | N170: =RC[-8]-R[6]C[-8] -> -1.5 | O170: =RC[-8]-R[6]C[-8] -> 1.1666666666666679 | P170: =RC[-8]-R[6]C[-8] -> 37.125 | Q170: =RC[-8]-R[6]C[-8] -> -10.125 | R170: =RC[-8]-R[6]C[-8] -> -1.75 | T170: =RC[-7]*RC[-2] -> 1.6041666666666551E-2 | U170: =RC[-7]*RC[-3] -> 2.625 | V170: =RC[-7]*RC[-4] -> -2.0416666666666687 | W170: =RC[-7]*RC[-5] -> -64.96875 | X170: =RC[-7]*RC[-6] -> 17.71875 | Y170: =RC[-12]*RC[-12] -> 8.4027777777776565E-5 | Z170: =RC[-12]*RC[-12] -> 2.25 | AA170: =RC[-12]*RC[-12] -> 1.3611111111111138 | AB170: =RC[-12]*RC[-12] -> 1378.265625 | AC170: =RC[-12]*RC[-12] -> 102.515625 | AD170: =RC[-12]*RC[-12] -> 3.0625 | AE170: =RC[-11]/SQRT(RC[-6]*RC[-1]) -> 1 | AF170: =RC[-11]/SQRT(RC[-6]*RC[-2]) -> 1 | AG170: =RC[-11]/SQRT(RC[-6]*RC[-3]) -> -1 | AH170: =RC[-11]/SQRT(RC[-6]*RC[-4]) -> -1 | AI170: =RC[-11]/SQRT(RC[-6]*RC[-5]) -> 1
A171: 13894 | B171: 北京 | C171: 53 | D171: 良 | E171: 0.31 | F171: 4 | G171: 34 | H171: 102 | I171: 82 | J171: 15 | L171: 2013-05-29T19:00:00.000 | M171: =RC[-8]-R[5]C[-8] -> 3.0833333333333379E-2 | N171: =RC[-8]-R[5]C[-8] -> -1.5 | O171: =RC[-8]-R[5]C[-8] -> 11.166666666666668 | P171: =RC[-8]-R[5]C[-8] -> 32.125 | Q171: =RC[-8]-R[5]C[-8] -> 29.875 | R171: =RC[-8]-R[5]C[-8] -> -0.75 | T171: =RC[-7]*RC[-2] -> -2.3125000000000034E-2 | U171: =RC[-7]*RC[-3] -> 1.125 | V171: =RC[-7]*RC[-4] -> -8.375 | W171: =RC[-7]*RC[-5] -> -24.09375 | X171: =RC[-7]*RC[-6] -> -22.40625 | Y171: =RC[-12]*RC[-12] -> 9.5069444444444726E-4 | Z171: =RC[-12]*RC[-12] -> 2.25 | AA171: =RC[-12]*RC[-12] -> 124.69444444444447 | AB171: =RC[-12]*RC[-12] -> 1032.015625 | AC171: =RC[-12]*RC[-12] -> 892.515625 | AD171: =RC[-12]*RC[-12] -> 0.5625 | AE171: =RC[-11]/SQRT(RC[-6]*RC[-1]) -> -1 | AF171: =RC[-11]/SQRT(RC[-6]*RC[-2]) -> 1 | AG171: =RC[-11]/SQRT(RC[-6]*RC[-3]) -> -1 | AH171: =RC[-11]/SQRT(RC[-6]*RC[-4]) -> -1 | AI171: =RC[-11]/SQRT(RC[-6]*RC[-5]) -> -1
A172: 13970 | B172: 北京 | C172: 54 | D172: 良 | E172: 0.35 | F172: 5 | G172: 36 | H172: 92 | I172: 95 | J172: 21 | L172: 2013-05-29T20:00:00.000 | M172: =RC[-8]-R[4]C[-8] -> 7.0833333333333359E-2 | N172: =RC[-8]-R[4]C[-8] -> -0.5 | O172: =RC[-8]-R[4]C[-8] -> 13.166666666666668 | P172: =RC[-8]-R[4]C[-8] -> 22.125 | Q172: =RC[-8]-R[4]C[-8] -> 42.875 | R172: =RC[-8]-R[4]C[-8] -> 5.25 | T172: =RC[-7]*RC[-2] -> 0.37187500000000012 | U172: =RC[-7]*RC[-3] -> -2.625 | V172: =RC[-7]*RC[-4] -> 69.125 | W172: =RC[-7]*RC[-5] -> 116.15625 | X172: =RC[-7]*RC[-6] -> 225.09375 | Y172: =RC[-12]*RC[-12] -> 5.0173611111111148E-3 | Z172: =RC[-12]*RC[-12] -> 0.25 | AA172: =RC[-12]*RC[-12] -> 173.36111111111114 | AB172: =RC[-12]*RC[-12] -> 489.515625 | AC172: =RC[-12]*RC[-12] -> 1838.265625 | AD172: =RC[-12]*RC[-12] -> 27.5625 | AE172: =RC[-11]/SQRT(RC[-6]*RC[-1]) -> 1 | AF172: =RC[-11]/SQRT(RC[-6]*RC[-2]) -> -1 | AG172: =RC[-11]/SQRT(RC[-6]*RC[-3]) -> 1 | AH172: =RC[-11]/SQRT(RC[-6]*RC[-4]) -> 1 | AI172: =RC[-11]/SQRT(RC[-6]*RC[-5]) -> 1
A173: 14046 | B173: 北京 | C173: 54 | D173: 良 | E173: 0.42 | F173: 12 | G173: 44 | H173: 80 | I173: 105 | J173: 31 | L173: 2013-05-29T21:00:00.000 | M173: =RC[-8]-R[3]C[-8] -> 0.14083333333333337 | N173: =RC[-8]-R[3]C[-8] -> 6.5 | O173: =RC[-8]-R[3]C[-8] -> 21.166666666666668 | P173: =RC[-8]-R[3]C[-8] -> 10.125 | Q173: =RC[-8]-R[3]C[-8] -> 52.875 | R173: =RC[-8]-R[3]C[-8] -> 15.25 | T173: =RC[-7]*RC[-2] -> 2.147708333333334 | U173: =RC[-7]*RC[-3] -> 99.125 | V173: =RC[-7]*RC[-4] -> 322.79166666666669 | W173: =RC[-7]*RC[-5] -> 154.40625 | X173: =RC[-7]*RC[-6] -> 806.34375 | Y173: =RC[-12]*RC[-12] -> 1.9834027777777787E-2 | Z173: =RC[-12]*RC[-12] -> 42.25 | AA173: =RC[-12]*RC[-12] -> 448.02777777777783 | AB173: =RC[-12]*RC[-12] -> 102.515625 | AC173: =RC[-12]*RC[-12] -> 2795.765625 | AD173: =RC[-12]*RC[-12] -> 232.5625 | AE173: =RC[-11]/SQRT(RC[-6]*RC[-1]) -> 1.0000000000000002 | AF173: =RC[-11]/SQRT(RC[-6]*RC[-2]) -> 1 | AG173: =RC[-11]/SQRT(RC[-6]*RC[-3]) -> 1 | AH173: =RC[-11]/SQRT(RC[-6]*RC[-4]) -> 1 | AI173: =RC[-11]/SQRT(RC[-6]*RC[-5]) -> 1
A174: 14122 | B174: 北京 | C174: 53 | D174: 良 | E174: 0.5 | F174: 14 | G174: 54 | H174: 60 | I174: 104 | J174: 35 | L174: 2013-05-29T22:00:00.000 | M174: =RC[-8]-R[2]C[-8] -> 0.22083333333333338 | N174: =RC[-8]-R[2]C[-8] -> 8.5 | O174: =RC[-8]-R[2]C[-8] -> 31.166666666666668 | P174: =RC[-8]-R[2]C[-8] -> -9.875 | Q174: =RC[-8]-R[2]C[-8] -> 51.875 | R174: =RC[-8]-R[2]C[-8] -> 19.25 | T174: =RC[-7]*RC[-2] -> 4.2510416666666675 | U174: =RC[-7]*RC[-3] -> 163.625 | V174: =RC[-7]*RC[-4] -> 599.95833333333337 | W174: =RC[-7]*RC[-5] -> -190.09375 | X174: =RC[-7]*RC[-6] -> 998.59375 | Y174: =RC[-12]*RC[-12] -> 4.8767361111111129E-2 | Z174: =RC[-12]*RC[-12] -> 72.25 | AA174: =RC[-12]*RC[-12] -> 971.3611111111112 | AB174: =RC[-12]*RC[-12] -> 97.515625 | AC174: =RC[-12]*RC[-12] -> 2691.015625 | AD174: =RC[-12]*RC[-12] -> 370.5625 | AE174: =RC[-11]/SQRT(RC[-6]*RC[-1]) -> 1 | AF174: =RC[-11]/SQRT(RC[-6]*RC[-2]) -> 1 | AG174: =RC[-11]/SQRT(RC[-6]*RC[-3]) -> 1 | AH174: =RC[-11]/SQRT(RC[-6]*RC[-4]) -> -1 | AI174: =RC[-11]/SQRT(RC[-6]*RC[-5]) -> 1
A175: 14198 | B175: 北京 | C175: 51 | D175: 良 | E175: 0.47 | F175: 13 | G175: 56 | H175: 46 | I175: 82 | J175: 35 | L175: 2013-05-29T23:00:00.000 | M175: =RC[-8]-R[1]C[-8] -> 0.19083333333333335 | N175: =RC[-8]-R[1]C[-8] -> 7.5 | O175: =RC[-8]-R[1]C[-8] -> 33.166666666666671 | P175: =RC[-8]-R[1]C[-8] -> -23.875 | Q175: =RC[-8]-R[1]C[-8] -> 29.875 | R175: =RC[-8]-R[1]C[-8] -> 19.25 | T175: =RC[-7]*RC[-2] -> 3.6735416666666669 | U175: =RC[-7]*RC[-3] -> 144.375 | V175: =RC[-7]*RC[-4] -> 638.45833333333337 | W175: =RC[-7]*RC[-5] -> -459.59375 | X175: =RC[-7]*RC[-6] -> 575.09375 | Y175: =RC[-12]*RC[-12] -> 3.6417361111111123E-2 | Z175: =RC[-12]*RC[-12] -> 56.25 | AA175: =RC[-12]*RC[-12] -> 1100.0277777777781 | AB175: =RC[-12]*RC[-12] -> 570.015625 | AC175: =RC[-12]*RC[-12] -> 892.515625 | AD175: =RC[-12]*RC[-12] -> 370.5625 | AE175: =RC[-11]/SQRT(RC[-6]*RC[-1]) -> 0.99999999999999989 | AF175: =RC[-11]/SQRT(RC[-6]*RC[-2]) -> 1 | AG175: =RC[-11]/SQRT(RC[-6]*RC[-3]) -> 1 | AH175: =RC[-11]/SQRT(RC[-6]*RC[-4]) -> -1 | AI175: =RC[-11]/SQRT(RC[-6]*RC[-5]) -> 1
E176: =AVERAGE(R[-24]C:R[-1]C) -> 0.27916666666666662 | F176: =AVERAGE(R[-24]C:R[-1]C) -> 5.5 | G176: =AVERAGE(R[-24]C:R[-1]C) -> 22.833333333333332 | H176: =AVERAGE(R[-24]C:R[-1]C) -> 69.875 | I176: =AVERAGE(R[-24]C:R[-1]C) -> 52.125 | J176: =AVERAGE(R[-24]C:R[-1]C) -> 15.75 | M176: =RC[-8]-RC[-8] -> 0 | N176: =RC[-8]-RC[-8] -> 0 | O176: =RC[-8]-RC[-8] -> 0 | P176: =RC[-8]-RC[-8] -> 0 | Q176: =RC[-8]-RC[-8] -> 0 | R176: =RC[-8]-RC[-8] -> 0 | T176: =SUM(R[-24]C:R[-1]C) -> 19.524999999999999 | U176: =SUM(R[-24]C:R[-1]C) -> 468 | V176: =SUM(R[-24]C:R[-1]C) -> 3037.0000000000005 | W176: =SUM(R[-24]C:R[-1]C) -> -1623.75 | X176: =SUM(R[-24]C:R[-1]C) -> 12641.75 | Y176: =SUM(R[-24]C:R[-1]C) -> 0.1867833333333333 | Z176: =SUM(R[-24]C:R[-1]C) -> 202 | AA176: =SUM(R[-24]C:R[-1]C) -> 4215.3333333333339 | AB176: =SUM(R[-24]C:R[-1]C) -> 13740.625 | AC176: =SUM(R[-24]C:R[-1]C) -> 45690.625 | AD176: =SUM(R[-24]C:R[-1]C) -> 4054.5 | AE176: =RC[-11]/SQRT(RC[-6]*RC[-1]) -> 0.70950151868040723 | AF176: =RC[-11]/SQRT(RC[-6]*RC[-2]) -> 0.51713212304531531 | AG176: =RC[-11]/SQRT(RC[-6]*RC[-3]) -> 0.73461565337235379 | AH176: =RC[-11]/SQRT(RC[-6]*RC[-4]) -> -0.21754407933187034 | AI176: =RC[-11]/SQRT(RC[-6]*RC[-5]) -> 0.92880596485444678
A177: 14274 | B177: 北京 | C177: 49 | D177: 优 | E177: 0.51 | F177: 11 | G177: 64 | H177: 30 | I177: 88 | J177: 31 | L177: 2013-05-30T00:00:00.000 | M177: =RC[-8]-R[24]C[-8] -> -0.18041666666666656 | N177: =RC[-8]-R[24]C[-8] -> -5.6666666666666679 | O177: =RC[-8]-R[24]C[-8] -> 4.3333333333333357 | P177: =RC[-8]-R[24]C[-8] -> -65.041666666666671 | Q177: =RC[-8]-R[24]C[-8] -> -29.875 | R177: =RC[-8]-R[24]C[-8] -> -21.666666666666664 | T177: =RC[-7]*RC[-2] -> 3.9090277777777751 | U177: =RC[-7]*RC[-3] -> 122.77777777777779 | V177: =RC[-7]*RC[-4] -> -93.888888888888928 | W177: =RC[-7]*RC[-5] -> 1409.2361111111111 | X177: =RC[-7]*RC[-6] -> 647.29166666666663 | Y177: =RC[-12]*RC[-12] -> 3.2550173611111073E-2 | Z177: =RC[-12]*RC[-12] -> 32.111111111111121 | AA177: =RC[-12]*RC[-12] -> 18.7777777777778 | AB177: =RC[-12]*RC[-12] -> 4230.4184027777783 | AC177: =RC[-12]*RC[-12] -> 892.515625 | AD177: =RC[-12]*RC[-12] -> 469.44444444444434 | AE177: =RC[-11]/SQRT(RC[-6]*RC[-1]) -> 1 | AF177: =RC[-11]/SQRT(RC[-6]*RC[-2]) -> 1 | AG177: =RC[-11]/SQRT(RC[-6]*RC[-3]) -> -1 | AH177: =RC[-11]/SQRT(RC[-6]*RC[-4]) -> 1 | AI177: =RC[-11]/SQRT(RC[-6]*RC[-5]) -> 1
A178: 14350 | B178: 北京 | C178: 49 | D178: 优 | E178: 0.52 | F178: 11 | G178: 72 | H178: 21 | I178: 99 | J178: 37 | L178: 2013-05-30T01:00:00.000 | M178: =RC[-8]-R[23]C[-8] -> -0.17041666666666655 | N178: =RC[-8]-R[23]C[-8] -> -5.6666666666666679 | O178: =RC[-8]-R[23]C[-8] -> 12.333333333333336 | P178: =RC[-8]-R[23]C[-8] -> -74.041666666666671 | Q178: =RC[-8]-R[23]C[-8] -> -18.875 | R178: =RC[-8]-R[23]C[-8] -> -15.666666666666664 | T178: =RC[-7]*RC[-2] -> 2.6698611111111088 | U178: =RC[-7]*RC[-3] -> 88.777777777777786 | V178: =RC[-7]*RC[-4] -> -193.22222222222223 | W178: =RC[-7]*RC[-5] -> 1159.9861111111111 | X178: =RC[-7]*RC[-6] -> 295.70833333333331 | Y178: =RC[-12]*RC[-12] -> 2.9041840277777738E-2 | Z178: =RC[-12]*RC[-12] -> 32.111111111111121 | AA178: =RC[-12]*RC[-12] -> 152.11111111111117 | AB178: =RC[-12]*RC[-12] -> 5482.1684027777783 | AC178: =RC[-12]*RC[-12] -> 356.265625 | AD178: =RC[-12]*RC[-12] -> 245.44444444444437 | AE178: =RC[-11]/SQRT(RC[-6]*RC[-1]) -> 1 | AF178: =RC[-11]/SQRT(RC[-6]*RC[-2]) -> 1 | AG178: =RC[-11]/SQRT(RC[-6]*RC[-3]) -> -1 | AH178: =RC[-11]/SQRT(RC[-6]*RC[-4]) -> 1.0000000000000002 | AI178: =RC[-11]/SQRT(RC[-6]*RC[-5]) -> 1
A179: 14426 | B179: 北京 | C179: 49 | D179: 优 | E179: 0.52 | F179: 10 | G179: 74 | H179: 15 | I179: 84 | J179: 39 | L179: 2013-05-30T02:00:00.000 | M179: =RC[-8]-R[22]C[-8] -> -0.17041666666666655 | N179: =RC[-8]-R[22]C[-8] -> -6.6666666666666679 | O179: =RC[-8]-R[22]C[-8] -> 14.333333333333336 | P179: =RC[-8]-R[22]C[-8] -> -80.041666666666671 | Q179: =RC[-8]-R[22]C[-8] -> -33.875 | R179: =RC[-8]-R[22]C[-8] -> -13.666666666666664 | T179: =RC[-7]*RC[-2] -> 2.3290277777777759 | U179: =RC[-7]*RC[-3] -> 91.111111111111114 | V179: =RC[-7]*RC[-4] -> -195.88888888888889 | W179: =RC[-7]*RC[-5] -> 1093.9027777777776 | X179: =RC[-7]*RC[-6] -> 462.95833333333326 | Y179: =RC[-12]*RC[-12] -> 2.9041840277777738E-2 | Z179: =RC[-12]*RC[-12] -> 44.444444444444457 | AA179: =RC[-12]*RC[-12] -> 205.44444444444451 | AB179: =RC[-12]*RC[-12] -> 6406.6684027777783 | AC179: =RC[-12]*RC[-12] -> 1147.515625 | AD179: =RC[-12]*RC[-12] -> 186.77777777777771 | AE179: =RC[-11]/SQRT(RC[-6]*RC[-1]) -> 1 | AF179: =RC[-11]/SQRT(RC[-6]*RC[-2]) -> 1 | AG179: =RC[-11]/SQRT(RC[-6]*RC[-3]) -> -1 | AH179: =RC[-11]/SQRT(RC[-6]*RC[-4]) -> 1 | AI179: =RC[-11]/SQRT(RC[-6]*RC[-5]) -> 1
A180: 14502 | B180: 北京 | C180: 49 | D180: 优 | E180: 0.63 | F180: 8 | G180: 70 | H180: 10 | I180: 93 | J180: 37 | L180: 2013-05-30T03:00:00.000 | M180: =RC[-8]-R[21]C[-8] -> -6.0416666666666563E-2 | N180: =RC[-8]-R[21]C[-8] -> -8.6666666666666679 | O180: =RC[-8]-R[21]C[-8] -> 10.333333333333336 | P180: =RC[-8]-R[21]C[-8] -> -85.041666666666671 | Q180: =RC[-8]-R[21]C[-8] -> -24.875 | R180: =RC[-8]-R[21]C[-8] -> -15.666666666666664 | T180: =RC[-7]*RC[-2] -> 0.94652777777777597 | U180: =RC[-7]*RC[-3] -> 135.77777777777777 | V180: =RC[-7]*RC[-4] -> -161.88888888888891 | W180: =RC[-7]*RC[-5] -> 1332.3194444444443 | X180: =RC[-7]*RC[-6] -> 389.70833333333326 | Y180: =RC[-12]*RC[-12] -> 3.6501736111110984E-3 | Z180: =RC[-12]*RC[-12] -> 75.111111111111128 | AA180: =RC[-12]*RC[-12] -> 106.77777777777783 | AB180: =RC[-12]*RC[-12] -> 7232.0850694444453 | AC180: =RC[-12]*RC[-12] -> 618.765625 | AD180: =RC[-12]*RC[-12] -> 245.44444444444437 | AE180: =RC[-11]/SQRT(RC[-6]*RC[-1]) -> 1 | AF180: =RC[-11]/SQRT(RC[-6]*RC[-2]) -> 1 | AG180: =RC[-11]/SQRT(RC[-6]*RC[-3]) -> -1 | AH180: =RC[-11]/SQRT(RC[-6]*RC[-4]) -> 1 | AI180: =RC[-11]/SQRT(RC[-6]*RC[-5]) -> 0.99999999999999989
A181: 14578 | B181: 北京 | C181: 51 | D181: 优 | E181: 0.64 | F181: 8 | G181: 67 | H181: 11 | I181: 96 | J181: 40 | L181: 2013-05-30T04:00:00.000 | M181: =RC[-8]-R[20]C[-8] -> -5.0416666666666554E-2 | N181: =RC[-8]-R[20]C[-8] -> -8.6666666666666679 | O181: =RC[-8]-R[20]C[-8] -> 7.3333333333333357 | P181: =RC[-8]-R[20]C[-8] -> -84.041666666666671 | Q181: =RC[-8]-R[20]C[-8] -> -21.875 | R181: =RC[-8]-R[20]C[-8] -> -12.666666666666664 | T181: =RC[-7]*RC[-2] -> 0.63861111111110958 | U181: =RC[-7]*RC[-3] -> 109.77777777777777 | V181: =RC[-7]*RC[-4] -> -92.8888888888889 | W181: =RC[-7]*RC[-5] -> 1064.5277777777776 | X181: =RC[-7]*RC[-6] -> 277.08333333333326 | Y181: =RC[-12]*RC[-12] -> 2.5418402777777666E-3 | Z181: =RC[-12]*RC[-12] -> 75.111111111111128 | AA181: =RC[-12]*RC[-12] -> 53.777777777777814 | AB181: =RC[-12]*RC[-12] -> 7063.0017361111122 | AC181: =RC[-12]*RC[-12] -> 478.515625 | AD181: =RC[-12]*RC[-12] -> 160.44444444444437 | AE181: =RC[-11]/SQRT(RC[-6]*RC[-1]) -> 1 | AF181: =RC[-11]/SQRT(RC[-6]*RC[-2]) -> 1 | AG181: =RC[-11]/SQRT(RC[-6]*RC[-3]) -> -1 | AH181: =RC[-11]/SQRT(RC[-6]*RC[-4]) -> 1 | AI181: =RC[-11]/SQRT(RC[-6]*RC[-5]) -> 1
A182: 14654 | B182: 北京 | C182: 52 | D182: 良 | E182: 0.65 | F182: 9 | G182: 63 | H182: 10 | I182: 76 | J182: 40 | L182: 2013-05-30T05:00:00.000 | M182: =RC[-8]-R[19]C[-8] -> -4.0416666666666545E-2 | N182: =RC[-8]-R[19]C[-8] -> -7.6666666666666679 | O182: =RC[-8]-R[19]C[-8] -> 3.3333333333333357 | P182: =RC[-8]-R[19]C[-8] -> -85.041666666666671 | Q182: =RC[-8]-R[19]C[-8] -> -41.875 | R182: =RC[-8]-R[19]C[-8] -> -12.666666666666664 | T182: =RC[-7]*RC[-2] -> 0.51194444444444276 | U182: =RC[-7]*RC[-3] -> 97.111111111111114 | V182: =RC[-7]*RC[-4] -> -42.222222222222243 | W182: =RC[-7]*RC[-5] -> 1077.1944444444443 | X182: =RC[-7]*RC[-6] -> 530.41666666666652 | Y182: =RC[-12]*RC[-12] -> 1.6335069444444346E-3 | Z182: =RC[-12]*RC[-12] -> 58.777777777777793 | AA182: =RC[-12]*RC[-12] -> 11.111111111111127 | AB182: =RC[-12]*RC[-12] -> 7232.0850694444453 | AC182: =RC[-12]*RC[-12] -> 1753.515625 | AD182: =RC[-12]*RC[-12] -> 160.44444444444437 | AE182: =RC[-11]/SQRT(RC[-6]*RC[-1]) -> 1 | AF182: =RC[-11]/SQRT(RC[-6]*RC[-2]) -> 1.0000000000000002 | AG182: =RC[-11]/SQRT(RC[-6]*RC[-3]) -> -1 | AH182: =RC[-11]/SQRT(RC[-6]*RC[-4]) -> 1.0000000000000002 | AI182: =RC[-11]/SQRT(RC[-6]*RC[-5]) -> 1
A183: 14730 | B183: 北京 | C183: 54 | D183: 良 | E183: 0.63 | F183: 10 | G183: 61 | H183: 12 | I183: 77 | J183: 38 | L183: 2013-05-30T06:00:00.000 | M183: =RC[-8]-R[18]C[-8] -> -6.0416666666666563E-2 | N183: =RC[-8]-R[18]C[-8] -> -6.6666666666666679 | O183: =RC[-8]-R[18]C[-8] -> 1.3333333333333357 | P183: =RC[-8]-R[18]C[-8] -> -83.041666666666671 | Q183: =RC[-8]-R[18]C[-8] -> -40.875 | R183: =RC[-8]-R[18]C[-8] -> -14.666666666666664 | T183: =RC[-7]*RC[-2] -> 0.88611111111110941 | U183: =RC[-7]*RC[-3] -> 97.777777777777786 | V183: =RC[-7]*RC[-4] -> -19.555555555555586 | W183: =RC[-7]*RC[-5] -> 1217.9444444444443 | X183: =RC[-7]*RC[-6] -> 599.49999999999989 | Y183: =RC[-12]*RC[-12] -> 3.6501736111110984E-3 | Z183: =RC[-12]*RC[-12] -> 44.444444444444457 | AA183: =RC[-12]*RC[-12] -> 1.7777777777777841 | AB183: =RC[-12]*RC[-12] -> 6895.9184027777783 | AC183: =RC[-12]*RC[-12] -> 1670.765625 | AD183: =RC[-12]*RC[-12] -> 215.11111111111103 | AE183: =RC[-11]/SQRT(RC[-6]*RC[-1]) -> 1 | AF183: =RC[-11]/SQRT(RC[-6]*RC[-2]) -> 1.0000000000000002 | AG183: =RC[-11]/SQRT(RC[-6]*RC[-3]) -> -0.99999999999999978 | AH183: =RC[-11]/SQRT(RC[-6]*RC[-4]) -> 1 | AI183: =RC[-11]/SQRT(RC[-6]*RC[-5]) -> 1
A184: 14806 | B184: 北京 | C184: 55 | D184: 良 | E184: 0.62 | F184: 13 | G184: 59 | H184: 16 | I184: 88 | J184: 37 | L184: 2013-05-30T07:00:00.000 | M184: =RC[-8]-R[17]C[-8] -> -7.0416666666666572E-2 | N184: =RC[-8]-R[17]C[-8] -> -3.6666666666666679 | O184: =RC[-8]-R[17]C[-8] -> -0.6666666666666643 | P184: =RC[-8]-R[17]C[-8] -> -79.041666666666671 | Q184: =RC[-8]-R[17]C[-8] -> -29.875 | R184: =RC[-8]-R[17]C[-8] -> -15.666666666666664 | T184: =RC[-7]*RC[-2] -> 1.1031944444444428 | U184: =RC[-7]*RC[-3] -> 57.444444444444457 | V184: =RC[-7]*RC[-4] -> 10.444444444444406 | W184: =RC[-7]*RC[-5] -> 1238.3194444444443 | X184: =RC[-7]*RC[-6] -> 468.04166666666657 | Y184: =RC[-12]*RC[-12] -> 4.9585069444444312E-3 | Z184: =RC[-12]*RC[-12] -> 13.444444444444454 | AA184: =RC[-12]*RC[-12] -> 0.44444444444444131 | AB184: =RC[-12]*RC[-12] -> 6247.5850694444453 | AC184: =RC[-12]*RC[-12] -> 892.515625 | AD184: =RC[-12]*RC[-12] -> 245.44444444444437 | AE184: =RC[-11]/SQRT(RC[-6]*RC[-1]) -> 1 | AF184: =RC[-11]/SQRT(RC[-6]*RC[-2]) -> 1 | AG184: =RC[-11]/SQRT(RC[-6]*RC[-3]) -> 1 | AH184: =RC[-11]/SQRT(RC[-6]*RC[-4]) -> 1 | AI184: =RC[-11]/SQRT(RC[-6]*RC[-5]) -> 1
A185: 14882 | B185: 北京 | C185: 57 | D185: 良 | E185: 0.65 | F185: 17 | G185: 59 | H185: 26 | I185: 103 | J185: 40 | L185: 2013-05-30T08:00:00.000 | M185: =RC[-8]-R[16]C[-8] -> -4.0416666666666545E-2 | N185: =RC[-8]-R[16]C[-8] -> 0.33333333333333215 | O185: =RC[-8]-R[16]C[-8] -> -0.6666666666666643 | P185: =RC[-8]-R[16]C[-8] -> -69.041666666666671 | Q185: =RC[-8]-R[16]C[-8] -> -14.875 | R185: =RC[-8]-R[16]C[-8] -> -12.666666666666664 | T185: =RC[-7]*RC[-2] -> 0.51194444444444276 | U185: =RC[-7]*RC[-3] -> -4.2222222222222063 | V185: =RC[-7]*RC[-4] -> 8.4444444444444127 | W185: =RC[-7]*RC[-5] -> 874.52777777777771 | X185: =RC[-7]*RC[-6] -> 188.41666666666663 | Y185: =RC[-12]*RC[-12] -> 1.6335069444444346E-3 | Z185: =RC[-12]*RC[-12] -> 0.11111111111111033 | AA185: =RC[-12]*RC[-12] -> 0.44444444444444131 | AB185: =RC[-12]*RC[-12] -> 4766.7517361111113 | AC185: =RC[-12]*RC[-12] -> 221.265625 | AD185: =RC[-12]*RC[-12] -> 160.44444444444437 | AE185: =RC[-11]/SQRT(RC[-6]*RC[-1]) -> 1 | AF185: =RC[-11]/SQRT(RC[-6]*RC[-2]) -> -1 | AG185: =RC[-11]/SQRT(RC[-6]*RC[-3]) -> 1 | AH185: =RC[-11]/SQRT(RC[-6]*RC[-4]) -> 1.0000000000000002 | AI185: =RC[-11]/SQRT(RC[-6]*RC[-5]) -> 1
A186: 14958 | B186: 北京 | C186: 59 | D186: 良 | E186: 0.71 | F186: 19 | G186: 74 | H186: 34 | I186: 119 | J186: 46 | L186: 2013-05-30T09:00:00.000 | M186: =RC[-8]-R[15]C[-8] -> 1.9583333333333397E-2 | N186: =RC[-8]-R[15]C[-8] -> 2.3333333333333321 | O186: =RC[-8]-R[15]C[-8] -> 14.333333333333336 | P186: =RC[-8]-R[15]C[-8] -> -61.041666666666671 | Q186: =RC[-8]-R[15]C[-8] -> 1.125 | R186: =RC[-8]-R[15]C[-8] -> -6.6666666666666643 | T186: =RC[-7]*RC[-2] -> -0.13055555555555592 | U186: =RC[-7]*RC[-3] -> -15.555555555555543 | V186: =RC[-7]*RC[-4] -> -95.555555555555543 | W186: =RC[-7]*RC[-5] -> 406.94444444444434 | X186: =RC[-7]*RC[-6] -> -7.4999999999999973 | Y186: =RC[-12]*RC[-12] -> 3.8350694444444695E-4 | Z186: =RC[-12]*RC[-12] -> 5.4444444444444393 | AA186: =RC[-12]*RC[-12] -> 205.44444444444451 | AB186: =RC[-12]*RC[-12] -> 3726.0850694444448 | AC186: =RC[-12]*RC[-12] -> 1.265625 | AD186: =RC[-12]*RC[-12] -> 44.444444444444414 | AE186: =RC[-11]/SQRT(RC[-6]*RC[-1]) -> -0.99999999999999978 | AF186: =RC[-11]/SQRT(RC[-6]*RC[-2]) -> -1 | AG186: =RC[-11]/SQRT(RC[-6]*RC[-3]) -> -1 | AH186: =RC[-11]/SQRT(RC[-6]*RC[-4]) -> 1 | AI186: =RC[-11]/SQRT(RC[-6]*RC[-5]) -> -1
A187: 15034 | B187: 北京 | C187: 62 | D187: 良 | E187: 0.78 | F187: 19 | G187: 80 | H187: 51 | I187: 112 | J187: 53 | L187: 2013-05-30T10:00:00.000 | M187: =RC[-8]-R[14]C[-8] -> 8.9583333333333459E-2 | N187: =RC[-8]-R[14]C[-8] -> 2.3333333333333321 | O187: =RC[-8]-R[14]C[-8] -> 20.333333333333336 | P187: =RC[-8]-R[14]C[-8] -> -44.041666666666671 | Q187: =RC[-8]-R[14]C[-8] -> -5.875 | R187: =RC[-8]-R[14]C[-8] -> 0.3333333333333357 | T187: =RC[-7]*RC[-2] -> 2.9861111111111366E-2 | U187: =RC[-7]*RC[-3] -> 0.7777777777777829 | V187: =RC[-7]*RC[-4] -> 6.7777777777778265 | W187: =RC[-7]*RC[-5] -> -14.680555555555662 | X187: =RC[-7]*RC[-6] -> -1.9583333333333472 | Y187: =RC[-12]*RC[-12] -> 8.0251736111111339E-3 | Z187: =RC[-12]*RC[-12] -> 5.4444444444444393 | AA187: =RC[-12]*RC[-12] -> 413.44444444444451 | AB187: =RC[-12]*RC[-12] -> 1939.6684027777783 | AC187: =RC[-12]*RC[-12] -> 34.515625 | AD187: =RC[-12]*RC[-12] -> 0.11111111111111269 | AE187: =RC[-11]/SQRT(RC[-6]*RC[-1]) -> 1 | AF187: =RC[-11]/SQRT(RC[-6]*RC[-2]) -> 1 | AG187: =RC[-11]/SQRT(RC[-6]*RC[-3]) -> 1 | AH187: =RC[-11]/SQRT(RC[-6]*RC[-4]) -> -1 | AI187: =RC[-11]/SQRT(RC[-6]*RC[-5]) -> -1
A188: 15110 | B188: 北京 | C188: 64 | D188: 良 | E188: 0.86 | F188: 18 | G188: 89 | H188: 70 | I188: 119 | J188: 61 | L188: 2013-05-30T11:00:00.000 | M188: =RC[-8]-R[13]C[-8] -> 0.16958333333333342 | N188: =RC[-8]-R[13]C[-8] -> 1.3333333333333321 | O188: =RC[-8]-R[13]C[-8] -> 29.333333333333336 | P188: =RC[-8]-R[13]C[-8] -> -25.041666666666671 | Q188: =RC[-8]-R[13]C[-8] -> 1.125 | R188: =RC[-8]-R[13]C[-8] -> 8.3333333333333357 | T188: =RC[-7]*RC[-2] -> 1.4131944444444455 | U188: =RC[-7]*RC[-3] -> 11.111111111111104 | V188: =RC[-7]*RC[-4] -> 244.44444444444454 | W188: =RC[-7]*RC[-5] -> -208.68055555555566 | X188: =RC[-7]*RC[-6] -> 9.3750000000000036 | Y188: =RC[-12]*RC[-12] -> 2.8758506944444474E-2 | Z188: =RC[-12]*RC[-12] -> 1.7777777777777746 | AA188: =RC[-12]*RC[-12] -> 860.44444444444457 | AB188: =RC[-12]*RC[-12] -> 627.08506944444468 | AC188: =RC[-12]*RC[-12] -> 1.265625 | AD188: =RC[-12]*RC[-12] -> 69.444444444444485 | AE188: =RC[-11]/SQRT(RC[-6]*RC[-1]) -> 1 | AF188: =RC[-11]/SQRT(RC[-6]*RC[-2]) -> 1 | AG188: =RC[-11]/SQRT(RC[-6]*RC[-3]) -> 1 | AH188: =RC[-11]/SQRT(RC[-6]*RC[-4]) -> -1 | AI188: =RC[-11]/SQRT(RC[-6]*RC[-5]) -> 1
A189: 15186 | B189: 北京 | C189: 66 | D189: 良 | E189: 0.87 | F189: 19 | G189: 102 | H189: 102 | I189: 148 | J189: 79 | L189: 2013-05-30T12:00:00.000 | M189: =RC[-8]-R[12]C[-8] -> 0.17958333333333343 | N189: =RC[-8]-R[12]C[-8] -> 2.3333333333333321 | O189: =RC[-8]-R[12]C[-8] -> 42.333333333333336 | P189: =RC[-8]-R[12]C[-8] -> 6.9583333333333286 | Q189: =RC[-8]-R[12]C[-8] -> 30.125 | R189: =RC[-8]-R[12]C[-8] -> 26.333333333333336 | T189: =RC[-7]*RC[-2] -> 4.7290277777777803 | U189: =RC[-7]*RC[-3] -> 61.444444444444422 | V189: =RC[-7]*RC[-4] -> 1114.7777777777778 | W189: =RC[-7]*RC[-5] -> 183.236111111111 | X189: =RC[-7]*RC[-6] -> 793.29166666666674 | Y189: =RC[-12]*RC[-12] -> 3.2250173611111148E-2 | Z189: =RC[-12]*RC[-12] -> 5.4444444444444393 | AA189: =RC[-12]*RC[-12] -> 1792.1111111111113 | AB189: =RC[-12]*RC[-12] -> 48.418402777777715 | AC189: =RC[-12]*RC[-12] -> 907.515625 | AD189: =RC[-12]*RC[-12] -> 693.44444444444457 | AE189: =RC[-11]/SQRT(RC[-6]*RC[-1]) -> 0.99999999999999978 | AF189: =RC[-11]/SQRT(RC[-6]*RC[-2]) -> 1 | AG189: =RC[-11]/SQRT(RC[-6]*RC[-3]) -> 0.99999999999999978 | AH189: =RC[-11]/SQRT(RC[-6]*RC[-4]) -> 1 | AI189: =RC[-11]/SQRT(RC[-6]*RC[-5]) -> 1
A190: 15262 | B190: 北京 | C190: 69 | D190: 良 | E190: 0.77 | F190: 19 | G190: 81 | H190: 151 | I190: 140 | J190: 86 | L190: 2013-05-30T13:00:00.000 | M190: =RC[-8]-R[11]C[-8] -> 7.958333333333345E-2 | N190: =RC[-8]-R[11]C[-8] -> 2.3333333333333321 | O190: =RC[-8]-R[11]C[-8] -> 21.333333333333336 | P190: =RC[-8]-R[11]C[-8] -> 55.958333333333329 | Q190: =RC[-8]-R[11]C[-8] -> 22.125 | R190: =RC[-8]-R[11]C[-8] -> 33.333333333333336 | T190: =RC[-7]*RC[-2] -> 2.6527777777777817 | U190: =RC[-7]*RC[-3] -> 77.777777777777743 | V190: =RC[-7]*RC[-4] -> 711.1111111111112 | W190: =RC[-7]*RC[-5] -> 1865.2777777777778 | X190: =RC[-7]*RC[-6] -> 737.5 | Y190: =RC[-12]*RC[-12] -> 6.3335069444444628E-3 | Z190: =RC[-12]*RC[-12] -> 5.4444444444444393 | AA190: =RC[-12]*RC[-12] -> 455.1111111111112 | AB190: =RC[-12]*RC[-12] -> 3131.3350694444439 | AC190: =RC[-12]*RC[-12] -> 489.515625 | AD190: =RC[-12]*RC[-12] -> 1111.1111111111113 | AE190: =RC[-11]/SQRT(RC[-6]*RC[-1]) -> 1 | AF190: =RC[-11]/SQRT(RC[-6]*RC[-2]) -> 1 | AG190: =RC[-11]/SQRT(RC[-6]*RC[-3]) -> 0.99999999999999989 | AH190: =RC[-11]/SQRT(RC[-6]*RC[-4]) -> 1 | AI190: =RC[-11]/SQRT(RC[-6]*RC[-5]) -> 0.99999999999999989
A191: 15338 | B191: 北京 | C191: 86 | D191: 良 | E191: 0.57999999999999996 | F191: 14 | G191: 44 | H191: 191 | I191: 98 | J191: 61 | L191: 2013-05-30T14:00:00.000 | M191: =RC[-8]-R[10]C[-8] -> -0.11041666666666661 | N191: =RC[-8]-R[10]C[-8] -> -2.6666666666666679 | O191: =RC[-8]-R[10]C[-8] -> -15.666666666666664 | P191: =RC[-8]-R[10]C[-8] -> 95.958333333333329 | Q191: =RC[-8]-R[10]C[-8] -> -19.875 | R191: =RC[-8]-R[10]C[-8] -> 8.3333333333333357 | T191: =RC[-7]*RC[-2] -> -0.92013888888888862 | U191: =RC[-7]*RC[-3] -> -22.222222222222239 | V191: =RC[-7]*RC[-4] -> -130.55555555555557 | W191: =RC[-7]*RC[-5] -> 799.65277777777794 | X191: =RC[-7]*RC[-6] -> -165.62500000000006 | Y191: =RC[-12]*RC[-12] -> 1.2191840277777765E-2 | Z191: =RC[-12]*RC[-12] -> 7.1111111111111178 | AA191: =RC[-12]*RC[-12] -> 245.44444444444437 | AB191: =RC[-12]*RC[-12] -> 9208.0017361111095 | AC191: =RC[-12]*RC[-12] -> 395.015625 | AD191: =RC[-12]*RC[-12] -> 69.444444444444485 | AE191: =RC[-11]/SQRT(RC[-6]*RC[-1]) -> -0.99999999999999989 | AF191: =RC[-11]/SQRT(RC[-6]*RC[-2]) -> -1 | AG191: =RC[-11]/SQRT(RC[-6]*RC[-3]) -> -1 | AH191: =RC[-11]/SQRT(RC[-6]*RC[-4]) -> 1 | AI191: =RC[-11]/SQRT(RC[-6]*RC[-5]) -> -1
A192: 15414 | B192: 北京 | C192: 72 | D192: 良 | E192: 0.54 | F192: 13 | G192: 37 | H192: 193 | I192: 98 | J192: 57 | L192: 2013-05-30T15:00:00.000 | M192: =RC[-8]-R[9]C[-8] -> -0.15041666666666653 | N192: =RC[-8]-R[9]C[-8] -> -3.6666666666666679 | O192: =RC[-8]-R[9]C[-8] -> -22.666666666666664 | P192: =RC[-8]-R[9]C[-8] -> 97.958333333333329 | Q192: =RC[-8]-R[9]C[-8] -> -19.875 | R192: =RC[-8]-R[9]C[-8] -> 4.3333333333333357 | T192: =RC[-7]*RC[-2] -> -0.6518055555555553 | U192: =RC[-7]*RC[-3] -> -15.888888888888903 | V192: =RC[-7]*RC[-4] -> -98.222222222222271 | W192: =RC[-7]*RC[-5] -> 424.48611111111131 | X192: =RC[-7]*RC[-6] -> -86.125000000000043 | Y192: =RC[-12]*RC[-12] -> 2.262517361111107E-2 | Z192: =RC[-12]*RC[-12] -> 13.444444444444454 | AA192: =RC[-12]*RC[-12] -> 513.77777777777771 | AB192: =RC[-12]*RC[-12] -> 9595.8350694444434 | AC192: =RC[-12]*RC[-12] -> 395.015625 | AD192: =RC[-12]*RC[-12] -> 18.7777777777778 | AE192: =RC[-11]/SQRT(RC[-6]*RC[-1]) -> -1 | AF192: =RC[-11]/SQRT(RC[-6]*RC[-2]) -> -1 | AG192: =RC[-11]/SQRT(RC[-6]*RC[-3]) -> -1 | AH192: =RC[-11]/SQRT(RC[-6]*RC[-4]) -> 1 | AI192: =RC[-11]/SQRT(RC[-6]*RC[-5]) -> -0.99999999999999989
A193: 15490 | B193: 北京 | C193: 89 | D193: 良 | E193: 0.5 | F193: 12 | G193: 31 | H193: 194 | I193: 99 | J193: 53 | L193: 2013-05-30T16:00:00.000 | M193: =RC[-8]-R[8]C[-8] -> -0.19041666666666657 | N193: =RC[-8]-R[8]C[-8] -> -4.6666666666666679 | O193: =RC[-8]-R[8]C[-8] -> -28.666666666666664 | P193: =RC[-8]-R[8]C[-8] -> 98.958333333333329 | Q193: =RC[-8]-R[8]C[-8] -> -18.875 | R193: =RC[-8]-R[8]C[-8] -> 0.3333333333333357 | T193: =RC[-7]*RC[-2] -> -6.3472222222222638E-2 | U193: =RC[-7]*RC[-3] -> -1.5555555555555669 | V193: =RC[-7]*RC[-4] -> -9.5555555555556229 | W193: =RC[-7]*RC[-5] -> 32.986111111111342 | X193: =RC[-7]*RC[-6] -> -6.2916666666667114 | Y193: =RC[-12]*RC[-12] -> 3.6258506944444407E-2 | Z193: =RC[-12]*RC[-12] -> 21.777777777777789 | AA193: =RC[-12]*RC[-12] -> 821.7777777777776 | AB193: =RC[-12]*RC[-12] -> 9792.7517361111095 | AC193: =RC[-12]*RC[-12] -> 356.265625 | AD193: =RC[-12]*RC[-12] -> 0.11111111111111269 | AE193: =RC[-11]/SQRT(RC[-6]*RC[-1]) -> -1 | AF193: =RC[-11]/SQRT(RC[-6]*RC[-2]) -> -1 | AG193: =RC[-11]/SQRT(RC[-6]*RC[-3]) -> -1.0000000000000002 | AH193: =RC[-11]/SQRT(RC[-6]*RC[-4]) -> 1 | AI193: =RC[-11]/SQRT(RC[-6]*RC[-5]) -> -1
A194: 15566 | B194: 北京 | C194: 94 | D194: 良 | E194: 0.57999999999999996 | F194: 13 | G194: 33 | H194: 191 | I194: 124 | J194: 48 | L194: 2013-05-30T17:00:00.000 | M194: =RC[-8]-R[7]C[-8] -> -0.11041666666666661 | N194: =RC[-8]-R[7]C[-8] -> -3.6666666666666679 | O194: =RC[-8]-R[7]C[-8] -> -26.666666666666664 | P194: =RC[-8]-R[7]C[-8] -> 95.958333333333329 | Q194: =RC[-8]-R[7]C[-8] -> 6.125 | R194: =RC[-8]-R[7]C[-8] -> -4.6666666666666643 | T194: =RC[-7]*RC[-2] -> 0.51527777777777728 | U194: =RC[-7]*RC[-3] -> 17.111111111111107 | V194: =RC[-7]*RC[-4] -> 124.44444444444437 | W194: =RC[-7]*RC[-5] -> -447.80555555555532 | X194: =RC[-7]*RC[-6] -> -28.583333333333318 | Y194: =RC[-12]*RC[-12] -> 1.2191840277777765E-2 | Z194: =RC[-12]*RC[-12] -> 13.444444444444454 | AA194: =RC[-12]*RC[-12] -> 711.11111111111097 | AB194: =RC[-12]*RC[-12] -> 9208.0017361111095 | AC194: =RC[-12]*RC[-12] -> 37.515625 | AD194: =RC[-12]*RC[-12] -> 21.777777777777757 | AE194: =RC[-11]/SQRT(RC[-6]*RC[-1]) -> 1 | AF194: =RC[-11]/SQRT(RC[-6]*RC[-2]) -> 0.99999999999999978 | AG194: =RC[-11]/SQRT(RC[-6]*RC[-3]) -> 1 | AH194: =RC[-11]/SQRT(RC[-6]*RC[-4]) -> -1 | AI194: =RC[-11]/SQRT(RC[-6]*RC[-5]) -> -1
A195: 15642 | B195: 北京 | C195: 102 | D195: 轻度污染 | E195: 0.6 | F195: 18 | G195: 40 | H195: 189 | I195: 155 | J195: 51 | L195: 2013-05-30T18:00:00.000 | M195: =RC[-8]-R[6]C[-8] -> -9.041666666666659E-2 | N195: =RC[-8]-R[6]C[-8] -> 1.3333333333333321 | O195: =RC[-8]-R[6]C[-8] -> -19.666666666666664 | P195: =RC[-8]-R[6]C[-8] -> 93.958333333333329 | Q195: =RC[-8]-R[6]C[-8] -> 37.125 | R195: =RC[-8]-R[6]C[-8] -> -1.6666666666666643 | T195: =RC[-7]*RC[-2] -> 0.1506944444444441 | U195: =RC[-7]*RC[-3] -> -2.222222222222217 | V195: =RC[-7]*RC[-4] -> 32.777777777777729 | W195: =RC[-7]*RC[-5] -> -156.597222222222 | X195: =RC[-7]*RC[-6] -> -61.874999999999915 | Y195: =RC[-12]*RC[-12] -> 8.1751736111110966E-3 | Z195: =RC[-12]*RC[-12] -> 1.7777777777777746 | AA195: =RC[-12]*RC[-12] -> 386.77777777777766 | AB195: =RC[-12]*RC[-12] -> 8828.1684027777774 | AC195: =RC[-12]*RC[-12] -> 1378.265625 | AD195: =RC[-12]*RC[-12] -> 2.7777777777777697 | AE195: =RC[-11]/SQRT(RC[-6]*RC[-1]) -> 1.0000000000000002 | AF195: =RC[-11]/SQRT(RC[-6]*RC[-2]) -> -1 | AG195: =RC[-11]/SQRT(RC[-6]*RC[-3]) -> 1.0000000000000002 | AH195: =RC[-11]/SQRT(RC[-6]*RC[-4]) -> -1 | AI195: =RC[-11]/SQRT(RC[-6]*RC[-5]) -> -1.0000000000000002
A196: 15718 | B196: 北京 | C196: 113 | D196: 轻度污染 | E196: 0.67 | F196: 25 | G196: 44 | H196: 189 | I196: 188 | J196: 64 | L196: 2013-05-30T19:00:00.000 | M196: =RC[-8]-R[5]C[-8] -> -2.0416666666666528E-2 | N196: =RC[-8]-R[5]C[-8] -> 8.3333333333333321 | O196: =RC[-8]-R[5]C[-8] -> -15.666666666666664 | P196: =RC[-8]-R[5]C[-8] -> 93.958333333333329 | Q196: =RC[-8]-R[5]C[-8] -> 70.125 | R196: =RC[-8]-R[5]C[-8] -> 11.333333333333336 | T196: =RC[-7]*RC[-2] -> -0.23138888888888737 | U196: =RC[-7]*RC[-3] -> 94.444444444444457 | V196: =RC[-7]*RC[-4] -> -177.55555555555557 | W196: =RC[-7]*RC[-5] -> 1064.8611111111113 | X196: =RC[-7]*RC[-6] -> 794.75000000000011 | Y196: =RC[-12]*RC[-12] -> 4.1684027777777211E-4 | Z196: =RC[-12]*RC[-12] -> 69.444444444444429 | AA196: =RC[-12]*RC[-12] -> 245.44444444444437 | AB196: =RC[-12]*RC[-12] -> 8828.1684027777774 | AC196: =RC[-12]*RC[-12] -> 4917.515625 | AD196: =RC[-12]*RC[-12] -> 128.44444444444449 | AE196: =RC[-11]/SQRT(RC[-6]*RC[-1]) -> -1.0000000000000002 | AF196: =RC[-11]/SQRT(RC[-6]*RC[-2]) -> 1 | AG196: =RC[-11]/SQRT(RC[-6]*RC[-3]) -> -1 | AH196: =RC[-11]/SQRT(RC[-6]*RC[-4]) -> 1 | AI196: =RC[-11]/SQRT(RC[-6]*RC[-5]) -> 1
A197: 15794 | B197: 北京 | C197: 122 | D197: 轻度污染 | E197: 0.94 | F197: 29 | G197: 46 | H197: 179 | I197: 200 | J197: 68 | L197: 2013-05-30T20:00:00.000 | M197: =RC[-8]-R[4]C[-8] -> 0.24958333333333338 | N197: =RC[-8]-R[4]C[-8] -> 12.333333333333332 | O197: =RC[-8]-R[4]C[-8] -> -13.666666666666664 | P197: =RC[-8]-R[4]C[-8] -> 83.958333333333329 | Q197: =RC[-8]-R[4]C[-8] -> 82.125 | R197: =RC[-8]-R[4]C[-8] -> 15.333333333333336 | T197: =RC[-7]*RC[-2] -> 3.8269444444444458 | U197: =RC[-7]*RC[-3] -> 189.11111111111111 | V197: =RC[-7]*RC[-4] -> -209.55555555555554 | W197: =RC[-7]*RC[-5] -> 1287.3611111111113 | X197: =RC[-7]*RC[-6] -> 1259.2500000000002 | Y197: =RC[-12]*RC[-12] -> 6.2291840277777802E-2 | Z197: =RC[-12]*RC[-12] -> 152.11111111111109 | AA197: =RC[-12]*RC[-12] -> 186.77777777777771 | AB197: =RC[-12]*RC[-12] -> 7049.0017361111104 | AC197: =RC[-12]*RC[-12] -> 6744.515625 | AD197: =RC[-12]*RC[-12] -> 235.11111111111117 | AE197: =RC[-11]/SQRT(RC[-6]*RC[-1]) -> 1 | AF197: =RC[-11]/SQRT(RC[-6]*RC[-2]) -> 1 | AG197: =RC[-11]/SQRT(RC[-6]*RC[-3]) -> -1 | AH197: =RC[-11]/SQRT(RC[-6]*RC[-4]) -> 1 | AI197: =RC[-11]/SQRT(RC[-6]*RC[-5]) -> 1
A198: 15870 | B198: 北京 | C198: 122 | D198: 轻度污染 | E198: 1.02 | F198: 29 | G198: 47 | H198: 150 | I198: 153 | J198: 67 | L198: 2013-05-30T21:00:00.000 | M198: =RC[-8]-R[3]C[-8] -> 0.32958333333333345 | N198: =RC[-8]-R[3]C[-8] -> 12.333333333333332 | O198: =RC[-8]-R[3]C[-8] -> -12.666666666666664 | P198: =RC[-8]-R[3]C[-8] -> 54.958333333333329 | Q198: =RC[-8]-R[3]C[-8] -> 35.125 | R198: =RC[-8]-R[3]C[-8] -> 14.333333333333336 | T198: =RC[-7]*RC[-2] -> 4.7240277777777804 | U198: =RC[-7]*RC[-3] -> 176.7777777777778 | V198: =RC[-7]*RC[-4] -> -181.55555555555554 | W198: =RC[-7]*RC[-5] -> 787.7361111111112 | X198: =RC[-7]*RC[-6] -> 503.45833333333343 | Y198: =RC[-12]*RC[-12] -> 0.10862517361111119 | Z198: =RC[-12]*RC[-12] -> 152.11111111111109 | AA198: =RC[-12]*RC[-12] -> 160.44444444444437 | AB198: =RC[-12]*RC[-12] -> 3020.4184027777774 | AC198: =RC[-12]*RC[-12] -> 1233.765625 | AD198: =RC[-12]*RC[-12] -> 205.44444444444451 | AE198: =RC[-11]/SQRT(RC[-6]*RC[-1]) -> 1 | AF198: =RC[-11]/SQRT(RC[-6]*RC[-2]) -> 1 | AG198: =RC[-11]/SQRT(RC[-6]*RC[-3]) -> -1 | AH198: =RC[-11]/SQRT(RC[-6]*RC[-4]) -> 1 | AI198: =RC[-11]/SQRT(RC[-6]*RC[-5]) -> 1
A199: 15946 | B199: 北京 | C199: 114 | D199: 轻度污染 | E199: 0.95 | F199: 30 | G199: 48 | H199: 129 | I199: 142 | J199: 68 | L199: 2013-05-30T22:00:00.000 | M199: =RC[-8]-R[2]C[-8] -> 0.25958333333333339 | N199: =RC[-8]-R[2]C[-8] -> 13.333333333333332 | O199: =RC[-8]-R[2]C[-8] -> -11.666666666666664 | P199: =RC[-8]-R[2]C[-8] -> 33.958333333333329 | Q199: =RC[-8]-R[2]C[-8] -> 24.125 | R199: =RC[-8]-R[2]C[-8] -> 15.333333333333336 | T199: =RC[-7]*RC[-2] -> 3.9802777777777791 | U199: =RC[-7]*RC[-3] -> 204.44444444444446 | V199: =RC[-7]*RC[-4] -> -178.88888888888889 | W199: =RC[-7]*RC[-5] -> 520.69444444444446 | X199: =RC[-7]*RC[-6] -> 369.91666666666674 | Y199: =RC[-12]*RC[-12] -> 6.7383506944444477E-2 | Z199: =RC[-12]*RC[-12] -> 177.77777777777774 | AA199: =RC[-12]*RC[-12] -> 136.11111111111106 | AB199: =RC[-12]*RC[-12] -> 1153.1684027777774 | AC199: =RC[-12]*RC[-12] -> 582.015625 | AD199: =RC[-12]*RC[-12] -> 235.11111111111117 | AE199: =RC[-11]/SQRT(RC[-6]*RC[-1]) -> 1 | AF199: =RC[-11]/SQRT(RC[-6]*RC[-2]) -> 1 | AG199: =RC[-11]/SQRT(RC[-6]*RC[-3]) -> -1 | AH199: =RC[-11]/SQRT(RC[-6]*RC[-4]) -> 1.0000000000000002 | AI199: =RC[-11]/SQRT(RC[-6]*RC[-5]) -> 1.0000000000000002
A200: 16022 | B200: 北京 | C200: 107 | D200: 轻度污染 | E200: 0.83 | F200: 26 | G200: 47 | H200: 117 | I200: 130 | J200: 63 | L200: 2013-05-30T23:00:00.000 | M200: =RC[-8]-R[1]C[-8] -> 0.13958333333333339 | N200: =RC[-8]-R[1]C[-8] -> 9.3333333333333321 | O200: =RC[-8]-R[1]C[-8] -> -12.666666666666664 | P200: =RC[-8]-R[1]C[-8] -> 21.958333333333329 | Q200: =RC[-8]-R[1]C[-8] -> 12.125 | R200: =RC[-8]-R[1]C[-8] -> 10.333333333333336 | T200: =RC[-7]*RC[-2] -> 1.4423611111111121 | U200: =RC[-7]*RC[-3] -> 96.444444444444457 | V200: =RC[-7]*RC[-4] -> -130.88888888888889 | W200: =RC[-7]*RC[-5] -> 226.90277777777777 | X200: =RC[-7]*RC[-6] -> 125.2916666666667 | Y200: =RC[-12]*RC[-12] -> 1.9483506944444461E-2 | Z200: =RC[-12]*RC[-12] -> 87.111111111111086 | AA200: =RC[-12]*RC[-12] -> 160.44444444444437 | AB200: =RC[-12]*RC[-12] -> 482.16840277777754 | AC200: =RC[-12]*RC[-12] -> 147.015625 | AD200: =RC[-12]*RC[-12] -> 106.77777777777783 | AE200: =RC[-11]/SQRT(RC[-6]*RC[-1]) -> 1 | AF200: =RC[-11]/SQRT(RC[-6]*RC[-2]) -> 1 | AG200: =RC[-11]/SQRT(RC[-6]*RC[-3]) -> -1 | AH200: =RC[-11]/SQRT(RC[-6]*RC[-4]) -> 1 | AI200: =RC[-11]/SQRT(RC[-6]*RC[-5]) -> 1
E201: =AVERAGE(R[-24]C:R[-1]C) -> 0.69041666666666657 | F201: =AVERAGE(R[-24]C:R[-1]C) -> 16.666666666666668 | G201: =AVERAGE(R[-24]C:R[-1]C) -> 59.666666666666664 | H201: =AVERAGE(R[-24]C:R[-1]C) -> 95.041666666666671 | I201: =AVERAGE(R[-24]C:R[-1]C) -> 117.875 | J201: =AVERAGE(R[-24]C:R[-1]C) -> 52.666666666666664 | M201: =RC[-8]-RC[-8] -> 0 | N201: =RC[-8]-RC[-8] -> 0 | O201: =RC[-8]-RC[-8] -> 0 | P201: =RC[-3] -> 0 | Q201: =RC[-8]-RC[-8] -> 0 | R201: =RC[-8]-RC[-8] -> 0 | T201: =SUM(R[-24]C:R[-1]C) -> 34.973333333333329 | U201: =SUM(R[-24]C:R[-1]C) -> 1668.3333333333335 | V201: =SUM(R[-24]C:R[-1]C) -> 241.3333333333334 | W201: =SUM(R[-24]C:R[-1]C) -> 17240.333333333332 | X201: =SUM(R[-24]C:R[-1]C) -> 8094 | Y201: =SUM(R[-24]C:R[-1]C) -> 0.53409583333333321 | Z201: =SUM(R[-24]C:R[-1]C) -> 1095.3333333333335 | AA201: =SUM(R[-24]C:R[-1]C) -> 7845.333333333333 | AB201: =SUM(R[-24]C:R[-1]C) -> 132194.95833333334 | AC201: =SUM(R[-24]C:R[-1]C) -> 25652.625 | AD201: =SUM(R[-24]C:R[-1]C) -> 5031.3333333333339 | AE201: =RC[-11]/SQRT(RC[-6]*RC[-1]) -> 0.67466143664486178 | AF201: =RC[-11]/SQRT(RC[-6]*RC[-2]) -> 0.71067024018681457 | AG201: =RC[-11]/SQRT(RC[-6]*RC[-3]) -> 3.841227820948636E-2 | AH201: =RC[-11]/SQRT(RC[-6]*RC[-4]) -> 0.66849269651511078 | AI201: =RC[-11]/SQRT(RC[-6]*RC[-5]) -> 0.71245222699097965
A202: 16098 | B202: 北京 | C202: 92 | D202: 良 | E202: 0.62 | F202: 21 | G202: 40 | H202: 100 | I202: 115 | J202: 54 | L202: 2013-05-31T01:00:00.000 | M202: =RC[-8]-R[23]C[-8] -> -0.29695652173913023 | N202: =RC[-8]-R[23]C[-8] -> -13 | O202: =RC[-8]-R[23]C[-8] -> -1.608695652173914 | P202: =RC[-8]-R[23]C[-8] -> -29.695652173913032 | Q202: =RC[-8]-R[23]C[-8] -> -41.521739130434781 | R202: =RC[-8]-R[23]C[-8] -> -43.391304347826093 | T202: =RC[-7]*RC[-2] -> 12.885330812854436 | U202: =RC[-7]*RC[-3] -> 564.08695652173924 | V202: =RC[-7]*RC[-4] -> 69.803402646502889 | W202: =RC[-7]*RC[-5] -> 1288.533081285444 | X202: =RC[-7]*RC[-6] -> 1801.6824196597356 | Y202: =RC[-12]*RC[-12] -> 8.8183175803402528E-2 | Z202: =RC[-12]*RC[-12] -> 169 | AA202: =RC[-12]*RC[-12] -> 2.5879017013232546 | AB202: =RC[-12]*RC[-12] -> 881.83175803402582 | AC202: =RC[-12]*RC[-12] -> 1724.054820415879 | AD202: =RC[-12]*RC[-12] -> 1882.8052930056715 | AE202: =RC[-11]/SQRT(RC[-6]*RC[-1]) -> 1 | AF202: =RC[-11]/SQRT(RC[-6]*RC[-2]) -> 1.0000000000000002 | AG202: =RC[-11]/SQRT(RC[-6]*RC[-3]) -> 1 | AH202: =RC[-11]/SQRT(RC[-6]*RC[-4]) -> 1 | AI202: =RC[-11]/SQRT(RC[-6]*RC[-5]) -> 1
A203: 16174 | B203: 北京 | C203: 88 | D203: 良 | E203: 0.62 | F203: 18 | G203: 38 | H203: 92 | I203: 116 | J203: 50 | L203: 2013-05-31T02:00:00.000 | M203: =RC[-8]-R[22]C[-8] -> -0.29695652173913023 | N203: =RC[-8]-R[22]C[-8] -> -16 | O203: =RC[-8]-R[22]C[-8] -> -3.608695652173914 | P203: =RC[-8]-R[22]C[-8] -> -37.695652173913032 | Q203: =RC[-8]-R[22]C[-8] -> -40.521739130434781 | R203: =RC[-8]-R[22]C[-8] -> -47.391304347826093 | T203: =RC[-7]*RC[-2] -> 14.073156899810956 | U203: =RC[-7]*RC[-3] -> 758.26086956521749 | V203: =RC[-7]*RC[-4] -> 171.02079395085073 | W203: =RC[-7]*RC[-5] -> 1786.4461247637048 | X203: =RC[-7]*RC[-6] -> 1920.3780718336486 | Y203: =RC[-12]*RC[-12] -> 8.8183175803402528E-2 | Z203: =RC[-12]*RC[-12] -> 256 | AA203: =RC[-12]*RC[-12] -> 13.02268431001891 | AB203: =RC[-12]*RC[-12] -> 1420.9621928166343 | AC203: =RC[-12]*RC[-12] -> 1642.0113421550093 | AD203: =RC[-12]*RC[-12] -> 2245.9357277882805 | AE203: =RC[-11]/SQRT(RC[-6]*RC[-1]) -> 0.99999999999999989 | AF203: =RC[-11]/SQRT(RC[-6]*RC[-2]) -> 1 | AG203: =RC[-11]/SQRT(RC[-6]*RC[-3]) -> 1 | AH203: =RC[-11]/SQRT(RC[-6]*RC[-4]) -> 0.99999999999999989 | AI203: =RC[-11]/SQRT(RC[-6]*RC[-5]) -> 1
A204: 16250 | B204: 北京 | C204: 88 | D204: 良 | E204: 0.63 | F204: 17 | G204: 37 | H204: 86 | I204: 123 | J204: 50 | L204: 2013-05-31T03:00:00.000 | M204: =RC[-8]-R[21]C[-8] -> -0.28695652173913022 | N204: =RC[-8]-R[21]C[-8] -> -17 | O204: =RC[-8]-R[21]C[-8] -> -4.608695652173914 | P204: =RC[-8]-R[21]C[-8] -> -43.695652173913032 | Q204: =RC[-8]-R[21]C[-8] -> -33.521739130434781 | R204: =RC[-8]-R[21]C[-8] -> -47.391304347826093 | T204: =RC[-7]*RC[-2] -> 13.599243856332695 | U204: =RC[-7]*RC[-3] -> 805.65217391304361 | V204: =RC[-7]*RC[-4] -> 218.41209829867682 | W204: =RC[-7]*RC[-5] -> 2070.7939508506615 | X204: =RC[-7]*RC[-6] -> 1588.6389413988659 | Y204: =RC[-12]*RC[-12] -> 8.2344045368619917E-2 | Z204: =RC[-12]*RC[-12] -> 289 | AA204: =RC[-12]*RC[-12] -> 21.240075614366738 | AB204: =RC[-12]*RC[-12] -> 1909.3100189035906 | AC204: =RC[-12]*RC[-12] -> 1123.7069943289225 | AD204: =RC[-12]*RC[-12] -> 2245.9357277882805 | AE204: =RC[-11]/SQRT(RC[-6]*RC[-1]) -> 1 | AF204: =RC[-11]/SQRT(RC[-6]*RC[-2]) -> 1 | AG204: =RC[-11]/SQRT(RC[-6]*RC[-3]) -> 1 | AH204: =RC[-11]/SQRT(RC[-6]*RC[-4]) -> 1 | AI204: =RC[-11]/SQRT(RC[-6]*RC[-5]) -> 0.99999999999999989
A205: 16326 | B205: 北京 | C205: 89 | D205: 良 | E205: 0.6 | F205: 17 | G205: 40 | H205: 76 | I205: 128 | J205: 54 | L205: 2013-05-31T04:00:00.000 | M205: =RC[-8]-R[20]C[-8] -> -0.31695652173913025 | N205: =RC[-8]-R[20]C[-8] -> -17 | O205: =RC[-8]-R[20]C[-8] -> -1.608695652173914 | P205: =RC[-8]-R[20]C[-8] -> -53.695652173913032 | Q205: =RC[-8]-R[20]C[-8] -> -28.521739130434781 | R205: =RC[-8]-R[20]C[-8] -> -43.391304347826093 | T205: =RC[-7]*RC[-2] -> 13.753156899810959 | U205: =RC[-7]*RC[-3] -> 737.65217391304361 | V205: =RC[-7]*RC[-4] -> 69.803402646502889 | W205: =RC[-7]*RC[-5] -> 2329.92438563327 | X205: =RC[-7]*RC[-6] -> 1237.5954631379964 | Y205: =RC[-12]*RC[-12] -> 0.10046143667296775 | Z205: =RC[-12]*RC[-12] -> 289 | AA205: =RC[-12]*RC[-12] -> 2.5879017013232546 | AB205: =RC[-12]*RC[-12] -> 2883.2230623818514 | AC205: =RC[-12]*RC[-12] -> 813.48960302457465 | AD205: =RC[-12]*RC[-12] -> 1882.8052930056715 | AE205: =RC[-11]/SQRT(RC[-6]*RC[-1]) -> 1.0000000000000002 | AF205: =RC[-11]/SQRT(RC[-6]*RC[-2]) -> 1 | AG205: =RC[-11]/SQRT(RC[-6]*RC[-3]) -> 1 | AH205: =RC[-11]/SQRT(RC[-6]*RC[-4]) -> 1 | AI205: =RC[-11]/SQRT(RC[-6]*RC[-5]) -> 1
A206: 16402 | B206: 北京 | C206: 90 | D206: 良 | E206: 0.67 | F206: 16 | G206: 40 | H206: 65 | I206: 129 | J206: 61 | L206: 2013-05-31T05:00:00.000 | M206: =RC[-8]-R[2089]C[-8] -> 0.67 | N206: =RC[-8]-R[2089]C[-8] -> 16 | O206: =RC[-8]-R[2089]C[-8] -> 40 | P206: =RC[-8]-R[2089]C[-8] -> 65 | Q206: =RC[-8]-R[2089]C[-8] -> 129 | R206: =RC[-8]-R[2089]C[-8] -> 61 | T206: =RC[-7]*RC[-2] -> 40.870000000000005 | U206: =RC[-7]*RC[-3] -> 976 | V206: =RC[-7]*RC[-4] -> 2440 | W206: =RC[-7]*RC[-5] -> 3965 | X206: =RC[-7]*RC[-6] -> 7869 | Y206: =RC[-12]*RC[-12] -> 0.44890000000000008 | Z206: =RC[-12]*RC[-12] -> 256 | AA206: =RC[-12]*RC[-12] -> 1600 | AB206: =RC[-12]*RC[-12] -> 4225 | AC206: =RC[-12]*RC[-12] -> 16641 | AD206: =RC[-12]*RC[-12] -> 3721 | AE206: =RC[-11]/SQRT(RC[-6]*RC[-1]) -> 1 | AF206: =RC[-11]/SQRT(RC[-6]*RC[-2]) -> 1 | AG206: =RC[-11]/SQRT(RC[-6]*RC[-3]) -> 1 | AH206: =RC[-11]/SQRT(RC[-6]*RC[-4]) -> 1 | AI206: =RC[-11]/SQRT(RC[-6]*RC[-5]) -> 1
A207: 16478 | B207: 北京 | C207: 91 | D207: 良 | E207: 0.77 | F207: 18 | G207: 41 | H207: 60 | I207: 140 | J207: 73 | L207: 2013-05-31T06:00:00.000 | M207: =RC[-8]-R[18]C[-8] -> -0.14695652173913021 | N207: =RC[-8]-R[18]C[-8] -> -16 | O207: =RC[-8]-R[18]C[-8] -> -0.60869565217391397 | P207: =RC[-8]-R[18]C[-8] -> -69.695652173913032 | Q207: =RC[-8]-R[18]C[-8] -> -16.521739130434781 | R207: =RC[-8]-R[18]C[-8] -> -24.391304347826093 | T207: =RC[-7]*RC[-2] -> 3.5844612476370465 | U207: =RC[-7]*RC[-3] -> 390.26086956521749 | V207: =RC[-7]*RC[-4] -> 14.846880907372427 | W207: =RC[-7]*RC[-5] -> 1699.96786389414 | X207: =RC[-7]*RC[-6] -> 402.98676748582238 | Y207: =RC[-12]*RC[-12] -> 2.1596219281663449E-2 | Z207: =RC[-12]*RC[-12] -> 256 | AA207: =RC[-12]*RC[-12] -> 0.37051039697542648 | AB207: =RC[-12]*RC[-12] -> 4857.4839319470684 | AC207: =RC[-12]*RC[-12] -> 272.96786389413984 | AD207: =RC[-12]*RC[-12] -> 594.93572778828002 | AE207: =RC[-11]/SQRT(RC[-6]*RC[-1]) -> 1.0000000000000002 | AF207: =RC[-11]/SQRT(RC[-6]*RC[-2]) -> 1 | AG207: =RC[-11]/SQRT(RC[-6]*RC[-3]) -> 1 | AH207: =RC[-11]/SQRT(RC[-6]*RC[-4]) -> 1 | AI207: =RC[-11]/SQRT(RC[-6]*RC[-5]) -> 1.0000000000000002
A208: 16554 | B208: 北京 | C208: 93 | D208: 良 | E208: 0.85 | F208: 23 | G208: 49 | H208: 50 | I208: 147 | J208: 83 | L208: 2013-05-31T07:00:00.000 | M208: =RC[-8]-R[17]C[-8] -> -6.6956521739130248E-2 | N208: =RC[-8]-R[17]C[-8] -> -11 | O208: =RC[-8]-R[17]C[-8] -> 7.391304347826086 | P208: =RC[-8]-R[17]C[-8] -> -79.695652173913032 | Q208: =RC[-8]-R[17]C[-8] -> -9.5217391304347814 | R208: =RC[-8]-R[17]C[-8] -> -14.391304347826093 | T208: =RC[-7]*RC[-2] -> 0.96359168241965742 | U208: =RC[-7]*RC[-3] -> 158.30434782608702 | V208: =RC[-7]*RC[-4] -> -106.37051039697546 | W208: =RC[-7]*RC[-5] -> 1146.9243856332707 | X208: =RC[-7]*RC[-6] -> 137.03024574669192 | Y208: =RC[-12]*RC[-12] -> 4.4831758034026212E-3 | Z208: =RC[-12]*RC[-12] -> 121 | AA208: =RC[-12]*RC[-12] -> 54.631379962192803 | AB208: =RC[-12]*RC[-12] -> 6351.3969754253294 | AC208: =RC[-12]*RC[-12] -> 90.6635160680529 | AD208: =RC[-12]*RC[-12] -> 207.10964083175821 | AE208: =RC[-11]/SQRT(RC[-6]*RC[-1]) -> 1 | AF208: =RC[-11]/SQRT(RC[-6]*RC[-2]) -> 1 | AG208: =RC[-11]/SQRT(RC[-6]*RC[-3]) -> -1 | AH208: =RC[-11]/SQRT(RC[-6]*RC[-4]) -> 1 | AI208: =RC[-11]/SQRT(RC[-6]*RC[-5]) -> 1.0000000000000002
A209: 16630 | B209: 北京 | C209: 95 | D209: 良 | E209: 0.9 | F209: 31 | G209: 50 | H209: 56 | I209: 151 | J209: 89 | L209: 2013-05-31T08:00:00.000 | M209: =RC[-8]-R[16]C[-8] -> -1.6956521739130204E-2 | N209: =RC[-8]-R[16]C[-8] -> -3 | O209: =RC[-8]-R[16]C[-8] -> 8.391304347826086 | P209: =RC[-8]-R[16]C[-8] -> -73.695652173913032 | Q209: =RC[-8]-R[16]C[-8] -> -5.5217391304347814 | R209: =RC[-8]-R[16]C[-8] -> -8.3913043478260931 | T209: =RC[-7]*RC[-2] -> 0.14228733459357096 | U209: =RC[-7]*RC[-3] -> 25.173913043478279 | V209: =RC[-7]*RC[-4] -> -70.413988657845039 | W209: =RC[-7]*RC[-5] -> 618.40264650283586 | X209: =RC[-7]*RC[-6] -> 46.33459357277885 | Y209: =RC[-12]*RC[-12] -> 2.8752362948959519E-4 | Z209: =RC[-12]*RC[-12] -> 9 | AA209: =RC[-12]*RC[-12] -> 70.413988657844982 | AB209: =RC[-12]*RC[-12] -> 5431.0491493383724 | AC209: =RC[-12]*RC[-12] -> 30.489603024574656 | AD209: =RC[-12]*RC[-12] -> 70.413988657845096 | AE209: =RC[-11]/SQRT(RC[-6]*RC[-1]) -> 1 | AF209: =RC[-11]/SQRT(RC[-6]*RC[-2]) -> 1 | AG209: =RC[-11]/SQRT(RC[-6]*RC[-3]) -> -1 | AH209: =RC[-11]/SQRT(RC[-6]*RC[-4]) -> 1 | AI209: =RC[-11]/SQRT(RC[-6]*RC[-5]) -> 0.99999999999999989
A210: 16706 | B210: 北京 | C210: 96 | D210: 良 | E210: 0.9 | F210: 37 | G210: 50 | H210: 69 | I210: 153 | J210: 93 | L210: 2013-05-31T09:00:00.000 | M210: =RC[-8]-R[15]C[-8] -> -1.6956521739130204E-2 | N210: =RC[-8]-R[15]C[-8] -> 3 | O210: =RC[-8]-R[15]C[-8] -> 8.391304347826086 | P210: =RC[-8]-R[15]C[-8] -> -60.695652173913032 | Q210: =RC[-8]-R[15]C[-8] -> -3.5217391304347814 | R210: =RC[-8]-R[15]C[-8] -> -4.3913043478260931 | T210: =RC[-7]*RC[-2] -> 7.4461247637050129E-2 | U210: =RC[-7]*RC[-3] -> -13.173913043478279 | V210: =RC[-7]*RC[-4] -> -36.848771266540687 | W210: =RC[-7]*RC[-5] -> 266.53308128544455 | X210: =RC[-7]*RC[-6] -> 15.46502835538754 | Y210: =RC[-12]*RC[-12] -> 2.8752362948959519E-4 | Z210: =RC[-12]*RC[-12] -> 9 | AA210: =RC[-12]*RC[-12] -> 70.413988657844982 | AB210: =RC[-12]*RC[-12] -> 3683.9621928166339 | AC210: =RC[-12]*RC[-12] -> 12.40264650283553 | AD210: =RC[-12]*RC[-12] -> 19.28355387523635 | AE210: =RC[-11]/SQRT(RC[-6]*RC[-1]) -> 1 | AF210: =RC[-11]/SQRT(RC[-6]*RC[-2]) -> -1 | AG210: =RC[-11]/SQRT(RC[-6]*RC[-3]) -> -0.99999999999999978 | AH210: =RC[-11]/SQRT(RC[-6]*RC[-4]) -> 1 | AI210: =RC[-11]/SQRT(RC[-6]*RC[-5]) -> 1
A211: 16782 | B211: 北京 | C211: 97 | D211: 良 | E211: 0.92 | F211: 39 | G211: 50 | H211: 89 | I211: 156 | J211: 103 | L211: 2013-05-31T10:00:00.000 | M211: =RC[-8]-R[14]C[-8] -> 3.0434782608698141E-3 | N211: =RC[-8]-R[14]C[-8] -> 5 | O211: =RC[-8]-R[14]C[-8] -> 8.391304347826086 | P211: =RC[-8]-R[14]C[-8] -> -40.695652173913032 | Q211: =RC[-8]-R[14]C[-8] -> -0.52173913043478137 | R211: =RC[-8]-R[14]C[-8] -> 5.6086956521739069 | T211: =RC[-7]*RC[-2] -> 1.7069943289226331E-2 | U211: =RC[-7]*RC[-3] -> 28.043478260869534 | V211: =RC[-7]*RC[-4] -> 47.064272211720173 | W211: =RC[-7]*RC[-5] -> -228.24952741020763 | X211: =RC[-7]*RC[-6] -> -2.9262759924385531 | Y211: =RC[-12]*RC[-12] -> 9.2627599243871486E-6 | Z211: =RC[-12]*RC[-12] -> 25 | AA211: =RC[-12]*RC[-12] -> 70.413988657844982 | AB211: =RC[-12]*RC[-12] -> 1656.1361058601126 | AC211: =RC[-12]*RC[-12] -> 0.27221172022684181 | AD211: =RC[-12]*RC[-12] -> 31.457466918714488 | AE211: =RC[-11]/SQRT(RC[-6]*RC[-1]) -> 1 | AF211: =RC[-11]/SQRT(RC[-6]*RC[-2]) -> 1 | AG211: =RC[-11]/SQRT(RC[-6]*RC[-3]) -> 1 | AH211: =RC[-11]/SQRT(RC[-6]*RC[-4]) -> -1 | AI211: =RC[-11]/SQRT(RC[-6]*RC[-5]) -> -1
A212: 16858 | B212: 北京 | C212: 99 | D212: 良 | E212: 0.95 | F212: 39 | G212: 49 | H212: 106 | I212: 165 | J212: 107 | L212: 2013-05-31T11:00:00.000 | M212: =RC[-8]-R[13]C[-8] -> 3.304347826086973E-2 | N212: =RC[-8]-R[13]C[-8] -> 5 | O212: =RC[-8]-R[13]C[-8] -> 7.391304347826086 | P212: =RC[-8]-R[13]C[-8] -> -23.695652173913032 | Q212: =RC[-8]-R[13]C[-8] -> 8.4782608695652186 | R212: =RC[-8]-R[13]C[-8] -> 9.6086956521739069 | T212: =RC[-7]*RC[-2] -> 0.317504725897922 | U212: =RC[-7]*RC[-3] -> 48.043478260869534 | V212: =RC[-7]*RC[-4] -> 71.020793950850603 | W212: =RC[-7]*RC[-5] -> -227.68431001890335 | X212: =RC[-7]*RC[-6] -> 81.465028355387489 | Y212: =RC[-12]*RC[-12] -> 1.0918714555765705E-3 | Z212: =RC[-12]*RC[-12] -> 25 | AA212: =RC[-12]*RC[-12] -> 54.631379962192803 | AB212: =RC[-12]*RC[-12] -> 561.48393194706944 | AC212: =RC[-12]*RC[-12] -> 71.88090737240077 | AD212: =RC[-12]*RC[-12] -> 92.327032136105743 | AE212: =RC[-11]/SQRT(RC[-6]*RC[-1]) -> 1 | AF212: =RC[-11]/SQRT(RC[-6]*RC[-2]) -> 1 | AG212: =RC[-11]/SQRT(RC[-6]*RC[-3]) -> 1 | AH212: =RC[-11]/SQRT(RC[-6]*RC[-4]) -> -1 | AI212: =RC[-11]/SQRT(RC[-6]*RC[-5]) -> 1.0000000000000002
A213: 16934 | B213: 北京 | C213: 100 | D213: 良 | E213: 0.95 | F213: 40 | G213: 42 | H213: 144 | I213: 176 | J213: 114 | L213: 2013-05-31T12:00:00.000 | M213: =RC[-8]-R[12]C[-8] -> 3.304347826086973E-2 | N213: =RC[-8]-R[12]C[-8] -> 6 | O213: =RC[-8]-R[12]C[-8] -> 0.39130434782608603 | P213: =RC[-8]-R[12]C[-8] -> 14.304347826086968 | Q213: =RC[-8]-R[12]C[-8] -> 19.478260869565219 | R213: =RC[-8]-R[12]C[-8] -> 16.608695652173907 | T213: =RC[-7]*RC[-2] -> 0.54880907372401011 | U213: =RC[-7]*RC[-3] -> 99.652173913043441 | V213: =RC[-7]*RC[-4] -> 6.4990548204158616 | W213: =RC[-7]*RC[-5] -> 237.57655954631389 | X213: =RC[-7]*RC[-6] -> 323.50850661625697 | Y213: =RC[-12]*RC[-12] -> 1.0918714555765705E-3 | Z213: =RC[-12]*RC[-12] -> 36 | AA213: =RC[-12]*RC[-12] -> 0.15311909262759851 | AB213: =RC[-12]*RC[-12] -> 204.61436672967895 | AC213: =RC[-12]*RC[-12] -> 379.40264650283558 | AD213: =RC[-12]*RC[-12] -> 275.84877126654044 | AE213: =RC[-11]/SQRT(RC[-6]*RC[-1]) -> 1 | AF213: =RC[-11]/SQRT(RC[-6]*RC[-2]) -> 1 | AG213: =RC[-11]/SQRT(RC[-6]*RC[-3]) -> 1 | AH213: =RC[-11]/SQRT(RC[-6]*RC[-4]) -> 1 | AI213: =RC[-11]/SQRT(RC[-6]*RC[-5]) -> 1
A214: 17010 | B214: 北京 | C214: 102 | D214: 轻度污染 | E214: 1.06 | F214: 44 | G214: 37 | H214: 175 | I214: 174 | J214: 116 | L214: 2013-05-31T13:00:00.000 | M214: =RC[-8]-R[11]C[-8] -> 0.14304347826086983 | N214: =RC[-8]-R[11]C[-8] -> 10 | O214: =RC[-8]-R[11]C[-8] -> -4.608695652173914 | P214: =RC[-8]-R[11]C[-8] -> 45.304347826086968 | Q214: =RC[-8]-R[11]C[-8] -> 17.478260869565219 | R214: =RC[-8]-R[11]C[-8] -> 18.608695652173907 | T214: =RC[-7]*RC[-2] -> 2.661852551984881 | U214: =RC[-7]*RC[-3] -> 186.08695652173907 | V214: =RC[-7]*RC[-4] -> -85.761814744801498 | W214: =RC[-7]*RC[-5] -> 843.05482041587891 | X214: =RC[-7]*RC[-6] -> 325.24763705103959 | Y214: =RC[-12]*RC[-12] -> 2.0461436672967938E-2 | Z214: =RC[-12]*RC[-12] -> 100 | AA214: =RC[-12]*RC[-12] -> 21.240075614366738 | AB214: =RC[-12]*RC[-12] -> 2052.4839319470711 | AC214: =RC[-12]*RC[-12] -> 305.48960302457471 | AD214: =RC[-12]*RC[-12] -> 346.28355387523607 | AE214: =RC[-11]/SQRT(RC[-6]*RC[-1]) -> 1 | AF214: =RC[-11]/SQRT(RC[-6]*RC[-2]) -> 1 | AG214: =RC[-11]/SQRT(RC[-6]*RC[-3]) -> -1 | AH214: =RC[-11]/SQRT(RC[-6]*RC[-4]) -> 0.99999999999999989 | AI214: =RC[-11]/SQRT(RC[-6]*RC[-5]) -> 1
A215: 17086 | B215: 北京 | C215: 108 | D215: 轻度污染 | E215: 1.2 | F215: 54 | G215: 37 | H215: 199 | I215: 159 | J215: 119 | L215: 2013-05-31T14:00:00.000 | M215: =RC[-8]-R[10]C[-8] -> 0.28304347826086973 | N215: =RC[-8]-R[10]C[-8] -> 20 | O215: =RC[-8]-R[10]C[-8] -> -4.608695652173914 | P215: =RC[-8]-R[10]C[-8] -> 69.304347826086968 | Q215: =RC[-8]-R[10]C[-8] -> 2.4782608695652186 | R215: =RC[-8]-R[10]C[-8] -> 21.608695652173907 | T215: =RC[-7]*RC[-2] -> 6.1162003780718353 | U215: =RC[-7]*RC[-3] -> 432.17391304347814 | V215: =RC[-7]*RC[-4] -> -99.587901701323247 | W215: =RC[-7]*RC[-5] -> 1497.5765595463135 | X215: =RC[-7]*RC[-6] -> 53.551984877126664 | Y215: =RC[-12]*RC[-12] -> 8.0113610586011436E-2 | Z215: =RC[-12]*RC[-12] -> 400 | AA215: =RC[-12]*RC[-12] -> 21.240075614366738 | AB215: =RC[-12]*RC[-12] -> 4803.0926275992451 | AC215: =RC[-12]*RC[-12] -> 6.1417769376181539 | AD215: =RC[-12]*RC[-12] -> 466.93572778827951 | AE215: =RC[-11]/SQRT(RC[-6]*RC[-1]) -> 1 | AF215: =RC[-11]/SQRT(RC[-6]*RC[-2]) -> 1 | AG215: =RC[-11]/SQRT(RC[-6]*RC[-3]) -> -1 | AH215: =RC[-11]/SQRT(RC[-6]*RC[-4]) -> 1 | AI215: =RC[-11]/SQRT(RC[-6]*RC[-5]) -> 1
A216: 17162 | B216: 北京 | C216: 118 | D216: 轻度污染 | E216: 1.2 | F216: 60 | G216: 36 | H216: 224 | I216: 164 | J216: 119 | L216: 2013-05-31T15:00:00.000 | M216: =RC[-8]-R[9]C[-8] -> 0.28304347826086973 | N216: =RC[-8]-R[9]C[-8] -> 26 | O216: =RC[-8]-R[9]C[-8] -> -5.608695652173914 | P216: =RC[-8]-R[9]C[-8] -> 94.304347826086968 | Q216: =RC[-8]-R[9]C[-8] -> 7.4782608695652186 | R216: =RC[-8]-R[9]C[-8] -> 21.608695652173907 | T216: =RC[-7]*RC[-2] -> 6.1162003780718353 | U216: =RC[-7]*RC[-3] -> 561.82608695652152 | V216: =RC[-7]*RC[-4] -> -121.19659735349715 | W216: =RC[-7]*RC[-5] -> 2037.7939508506613 | X216: =RC[-7]*RC[-6] -> 161.59546313799621 | Y216: =RC[-12]*RC[-12] -> 8.0113610586011436E-2 | Z216: =RC[-12]*RC[-12] -> 676 | AA216: =RC[-12]*RC[-12] -> 31.457466918714566 | AB216: =RC[-12]*RC[-12] -> 8893.310018903594 | AC216: =RC[-12]*RC[-12] -> 55.92438563327034 | AD216: =RC[-12]*RC[-12] -> 466.93572778827951 | AE216: =RC[-11]/SQRT(RC[-6]*RC[-1]) -> 1 | AF216: =RC[-11]/SQRT(RC[-6]*RC[-2]) -> 1 | AG216: =RC[-11]/SQRT(RC[-6]*RC[-3]) -> -1 | AH216: =RC[-11]/SQRT(RC[-6]*RC[-4]) -> 1 | AI216: =RC[-11]/SQRT(RC[-6]*RC[-5]) -> 1
A217: 17238 | B217: 北京 | C217: 121 | D217: 轻度污染 | E217: 1.1399999999999999 | F217: 59 | G217: 36 | H217: 228 | I217: 161 | J217: 114 | L217: 2013-05-31T16:00:00.000 | M217: =RC[-8]-R[8]C[-8] -> 0.22304347826086968 | N217: =RC[-8]-R[8]C[-8] -> 25 | O217: =RC[-8]-R[8]C[-8] -> -5.608695652173914 | P217: =RC[-8]-R[8]C[-8] -> 98.304347826086968 | Q217: =RC[-8]-R[8]C[-8] -> 4.4782608695652186 | R217: =RC[-8]-R[8]C[-8] -> 16.608695652173907 | T217: =RC[-7]*RC[-2] -> 3.7044612476370515 | U217: =RC[-7]*RC[-3] -> 415.21739130434764 | V217: =RC[-7]*RC[-4] -> -93.153119092627577 | W217: =RC[-7]*RC[-5] -> 1632.7069943289221 | X217: =RC[-7]*RC[-6] -> 74.378071833648391 | Y217: =RC[-12]*RC[-12] -> 4.9748393194707044E-2 | Z217: =RC[-12]*RC[-12] -> 625 | AA217: =RC[-12]*RC[-12] -> 31.457466918714566 | AB217: =RC[-12]*RC[-12] -> 9663.74480151229 | AC217: =RC[-12]*RC[-12] -> 20.054820415879028 | AD217: =RC[-12]*RC[-12] -> 275.84877126654044 | AE217: =RC[-11]/SQRT(RC[-6]*RC[-1]) -> 1 | AF217: =RC[-11]/SQRT(RC[-6]*RC[-2]) -> 1 | AG217: =RC[-11]/SQRT(RC[-6]*RC[-3]) -> -1 | AH217: =RC[-11]/SQRT(RC[-6]*RC[-4]) -> 1 | AI217: =RC[-11]/SQRT(RC[-6]*RC[-5]) -> 1
A218: 17314 | B218: 北京 | C218: 124 | D218: 轻度污染 | E218: 1.19 | F218: 54 | G218: 36 | H218: 225 | I218: 191 | J218: 118 | L218: 2013-05-31T17:00:00.000 | M218: =RC[-8]-R[7]C[-8] -> 0.27304347826086972 | N218: =RC[-8]-R[7]C[-8] -> 20 | O218: =RC[-8]-R[7]C[-8] -> -5.608695652173914 | P218: =RC[-8]-R[7]C[-8] -> 95.304347826086968 | Q218: =RC[-8]-R[7]C[-8] -> 34.478260869565219 | R218: =RC[-8]-R[7]C[-8] -> 20.608695652173907 | T218: =RC[-7]*RC[-2] -> 5.6270699432892268 | U218: =RC[-7]*RC[-3] -> 412.17391304347814 | V218: =RC[-7]*RC[-4] -> -115.58790170132323 | W218: =RC[-7]*RC[-5] -> 1964.0982986767483 | X218: =RC[-7]*RC[-6] -> 710.55198487712642 | Y218: =RC[-12]*RC[-12] -> 7.4552741020794039E-2 | Z218: =RC[-12]*RC[-12] -> 400 | AA218: =RC[-12]*RC[-12] -> 31.457466918714566 | AB218: =RC[-12]*RC[-12] -> 9082.918714555768 | AC218: =RC[-12]*RC[-12] -> 1188.7504725897923 | AD218: =RC[-12]*RC[-12] -> 424.71833648393169 | AE218: =RC[-11]/SQRT(RC[-6]*RC[-1]) -> 1 | AF218: =RC[-11]/SQRT(RC[-6]*RC[-2]) -> 1 | AG218: =RC[-11]/SQRT(RC[-6]*RC[-3]) -> -1 | AH218: =RC[-11]/SQRT(RC[-6]*RC[-4]) -> 1 | AI218: =RC[-11]/SQRT(RC[-6]*RC[-5]) -> 0.99999999999999989
A219: 17390 | B219: 北京 | C219: 135 | D219: 轻度污染 | E219: 1.17 | F219: 49 | G219: 40 | H219: 212 | I219: 185 | J219: 120 | L219: 2013-05-31T18:00:00.000 | M219: =RC[-8]-R[6]C[-8] -> 0.2530434782608697 | N219: =RC[-8]-R[6]C[-8] -> 15 | O219: =RC[-8]-R[6]C[-8] -> -1.608695652173914 | P219: =RC[-8]-R[6]C[-8] -> 82.304347826086968 | Q219: =RC[-8]-R[6]C[-8] -> 28.478260869565219 | R219: =RC[-8]-R[6]C[-8] -> 22.608695652173907 | T219: =RC[-7]*RC[-2] -> 5.7209829867674875 | U219: =RC[-7]*RC[-3] -> 339.13043478260863 | V219: =RC[-7]*RC[-4] -> -36.370510396975433 | W219: =RC[-7]*RC[-5] -> 1860.7939508506613 | X219: =RC[-7]*RC[-6] -> 643.85633270321341 | Y219: =RC[-12]*RC[-12] -> 6.4031001890359235E-2 | Z219: =RC[-12]*RC[-12] -> 225 | AA219: =RC[-12]*RC[-12] -> 2.5879017013232546 | AB219: =RC[-12]*RC[-12] -> 6774.0056710775061 | AC219: =RC[-12]*RC[-12] -> 811.01134215500952 | AD219: =RC[-12]*RC[-12] -> 511.15311909262732 | AE219: =RC[-11]/SQRT(RC[-6]*RC[-1]) -> 1.0000000000000002 | AF219: =RC[-11]/SQRT(RC[-6]*RC[-2]) -> 1.0000000000000002 | AG219: =RC[-11]/SQRT(RC[-6]*RC[-3]) -> -0.99999999999999978 | AH219: =RC[-11]/SQRT(RC[-6]*RC[-4]) -> 1 | AI219: =RC[-11]/SQRT(RC[-6]*RC[-5]) -> 1
A220: 17466 | B220: 北京 | C220: 142 | D220: 轻度污染 | E220: 1.05 | F220: 37 | G220: 41 | H220: 195 | I220: 190 | J220: 116 | L220: 2013-05-31T19:00:00.000 | M220: =RC[-8]-R[5]C[-8] -> 0.13304347826086982 | N220: =RC[-8]-R[5]C[-8] -> 3 | O220: =RC[-8]-R[5]C[-8] -> -0.60869565217391397 | P220: =RC[-8]-R[5]C[-8] -> 65.304347826086968 | Q220: =RC[-8]-R[5]C[-8] -> 33.478260869565219 | R220: =RC[-8]-R[5]C[-8] -> 18.608695652173907 | T220: =RC[-7]*RC[-2] -> 2.4757655954631419 | U220: =RC[-7]*RC[-3] -> 55.826086956521721 | V220: =RC[-7]*RC[-4] -> -11.327032136105874 | W220: =RC[-7]*RC[-5] -> 1215.228733459357 | X220: =RC[-7]*RC[-6] -> 622.98676748582216 | Y220: =RC[-12]*RC[-12] -> 1.7700567107750542E-2 | Z220: =RC[-12]*RC[-12] -> 9 | AA220: =RC[-12]*RC[-12] -> 0.37051039697542648 | AB220: =RC[-12]*RC[-12] -> 4264.6578449905501 | AC220: =RC[-12]*RC[-12] -> 1120.7939508506618 | AD220: =RC[-12]*RC[-12] -> 346.28355387523607 | AE220: =RC[-11]/SQRT(RC[-6]*RC[-1]) -> 1 | AF220: =RC[-11]/SQRT(RC[-6]*RC[-2]) -> 1 | AG220: =RC[-11]/SQRT(RC[-6]*RC[-3]) -> -1 | AH220: =RC[-11]/SQRT(RC[-6]*RC[-4]) -> 1 | AI220: =RC[-11]/SQRT(RC[-6]*RC[-5]) -> 1
A221: 17542 | B221: 北京 | C221: 146 | D221: 轻度污染 | E221: 1.02 | F221: 32 | G221: 41 | H221: 173 | I221: 193 | J221: 124 | L221: 2013-05-31T20:00:00.000 | M221: =RC[-8]-R[4]C[-8] -> 0.10304347826086979 | N221: =RC[-8]-R[4]C[-8] -> -2 | O221: =RC[-8]-R[4]C[-8] -> -0.60869565217391397 | P221: =RC[-8]-R[4]C[-8] -> 43.304347826086968 | Q221: =RC[-8]-R[4]C[-8] -> 36.478260869565219 | R221: =RC[-8]-R[4]C[-8] -> 26.608695652173907 | T221: =RC[-7]*RC[-2] -> 2.7418525519848824 | U221: =RC[-7]*RC[-3] -> -53.217391304347814 | V221: =RC[-7]*RC[-4] -> -16.196597353497186 | W221: =RC[-7]*RC[-5] -> 1152.2722117202268 | X221: =RC[-7]*RC[-6] -> 970.63894139886554 | Y221: =RC[-12]*RC[-12] -> 1.0617958412098345E-2 | Z221: =RC[-12]*RC[-12] -> 4 | AA221: =RC[-12]*RC[-12] -> 0.37051039697542648 | AB221: =RC[-12]*RC[-12] -> 1875.2665406427232 | AC221: =RC[-12]*RC[-12] -> 1330.663516068053 | AD221: =RC[-12]*RC[-12] -> 708.02268431001858 | AE221: =RC[-11]/SQRT(RC[-6]*RC[-1]) -> 1 | AF221: =RC[-11]/SQRT(RC[-6]*RC[-2]) -> -1 | AG221: =RC[-11]/SQRT(RC[-6]*RC[-3]) -> -1 | AH221: =RC[-11]/SQRT(RC[-6]*RC[-4]) -> 0.99999999999999978 | AI221: =RC[-11]/SQRT(RC[-6]*RC[-5]) -> 0.99999999999999989
A222: 17618 | B222: 北京 | C222: 144 | D222: 轻度污染 | E222: 0.9 | F222: 26 | G222: 40 | H222: 144 | I222: 176 | J222: 120 | L222: 2013-05-31T21:00:00.000 | M222: =RC[-8]-R[3]C[-8] -> -1.6956521739130204E-2 | N222: =RC[-8]-R[3]C[-8] -> -8 | O222: =RC[-8]-R[3]C[-8] -> -1.608695652173914 | P222: =RC[-8]-R[3]C[-8] -> 14.304347826086968 | Q222: =RC[-8]-R[3]C[-8] -> 19.478260869565219 | R222: =RC[-8]-R[3]C[-8] -> 22.608695652173907 | T222: =RC[-7]*RC[-2] -> -0.38336483931946536 | U222: =RC[-7]*RC[-3] -> -180.86956521739125 | V222: =RC[-7]*RC[-4] -> -36.370510396975433 | W222: =RC[-7]*RC[-5] -> 323.40264650283569 | X222: =RC[-7]*RC[-6] -> 440.37807183364828 | Y222: =RC[-12]*RC[-12] -> 2.8752362948959519E-4 | Z222: =RC[-12]*RC[-12] -> 64 | AA222: =RC[-12]*RC[-12] -> 2.5879017013232546 | AB222: =RC[-12]*RC[-12] -> 204.61436672967895 | AC222: =RC[-12]*RC[-12] -> 379.40264650283558 | AD222: =RC[-12]*RC[-12] -> 511.15311909262732 | AE222: =RC[-11]/SQRT(RC[-6]*RC[-1]) -> -1 | AF222: =RC[-11]/SQRT(RC[-6]*RC[-2]) -> -1 | AG222: =RC[-11]/SQRT(RC[-6]*RC[-3]) -> -0.99999999999999978 | AH222: =RC[-11]/SQRT(RC[-6]*RC[-4]) -> 1 | AI222: =RC[-11]/SQRT(RC[-6]*RC[-5]) -> 1
A223: 17694 | B223: 北京 | C223: 138 | D223: 轻度污染 | E223: 0.89 | F223: 26 | G223: 42 | H223: 118 | I223: 154 | J223: 120 | L223: 2013-05-31T22:00:00.000 | M223: =RC[-8]-R[2]C[-8] -> -2.6956521739130213E-2 | N223: =RC[-8]-R[2]C[-8] -> -8 | O223: =RC[-8]-R[2]C[-8] -> 0.39130434782608603 | P223: =RC[-8]-R[2]C[-8] -> -11.695652173913032 | Q223: =RC[-8]-R[2]C[-8] -> -2.5217391304347814 | R223: =RC[-8]-R[2]C[-8] -> 22.608695652173907 | T223: =RC[-7]*RC[-2] -> -0.60945179584120468 | U223: =RC[-7]*RC[-3] -> -180.86956521739125 | V223: =RC[-7]*RC[-4] -> 8.8468809073723769 | W223: =RC[-7]*RC[-5] -> -264.42344045368588 | X223: =RC[-7]*RC[-6] -> -57.013232514177652 | Y223: =RC[-12]*RC[-12] -> 7.2665406427219973E-4 | Z223: =RC[-12]*RC[-12] -> 64 | AA223: =RC[-12]*RC[-12] -> 0.15311909262759851 | AB223: =RC[-12]*RC[-12] -> 136.78827977315663 | AC223: =RC[-12]*RC[-12] -> 6.3591682419659676 | AD223: =RC[-12]*RC[-12] -> 511.15311909262732 | AE223: =RC[-11]/SQRT(RC[-6]*RC[-1]) -> -1 | AF223: =RC[-11]/SQRT(RC[-6]*RC[-2]) -> -1 | AG223: =RC[-11]/SQRT(RC[-6]*RC[-3]) -> 1 | AH223: =RC[-11]/SQRT(RC[-6]*RC[-4]) -> -1 | AI223: =RC[-11]/SQRT(RC[-6]*RC[-5]) -> -1
A224: 17770 | B224: 北京 | C224: 131 | D224: 轻度污染 | E224: 0.89 | F224: 25 | G224: 45 | H224: 97 | I224: 154 | J224: 123 | L224: 2013-05-31T23:00:00.000 | M224: =RC[-8]-R[1]C[-8] -> -2.6956521739130213E-2 | N224: =RC[-8]-R[1]C[-8] -> -9 | O224: =RC[-8]-R[1]C[-8] -> 3.391304347826086 | P224: =RC[-8]-R[1]C[-8] -> -32.695652173913032 | Q224: =RC[-8]-R[1]C[-8] -> -2.5217391304347814 | R224: =RC[-8]-R[1]C[-8] -> 25.608695652173907 | T224: =RC[-7]*RC[-2] -> -0.69032136105859532 | U224: =RC[-7]*RC[-3] -> -230.47826086956516 | V224: =RC[-7]*RC[-4] -> 86.846880907372352 | W224: =RC[-7]*RC[-5] -> -837.29300567107703 | X224: =RC[-7]*RC[-6] -> -64.578449905481989 | Y224: =RC[-12]*RC[-12] -> 7.2665406427219973E-4 | Z224: =RC[-12]*RC[-12] -> 81 | AA224: =RC[-12]*RC[-12] -> 11.500945179584114 | AB224: =RC[-12]*RC[-12] -> 1069.0056710775041 | AC224: =RC[-12]*RC[-12] -> 6.3591682419659676 | AD224: =RC[-12]*RC[-12] -> 655.80529300567071 | AE224: =RC[-11]/SQRT(RC[-6]*RC[-1]) -> -1.0000000000000002 | AF224: =RC[-11]/SQRT(RC[-6]*RC[-2]) -> -1 | AG224: =RC[-11]/SQRT(RC[-6]*RC[-3]) -> 1 | AH224: =RC[-11]/SQRT(RC[-6]*RC[-4]) -> -1 | AI224: =RC[-11]/SQRT(RC[-6]*RC[-5]) -> -1
E225: =AVERAGE(R[-23]C:R[-1]C) -> 0.91695652173913023 | F225: =AVERAGE(R[-23]C:R[-1]C) -> 34 | G225: =AVERAGE(R[-23]C:R[-1]C) -> 41.608695652173914 | H225: =AVERAGE(R[-23]C:R[-1]C) -> 129.69565217391303 | I225: =AVERAGE(R[-23]C:R[-1]C) -> 156.52173913043478 | J225: =AVERAGE(R[-23]C:R[-1]C) -> 97.391304347826093 | M225: =RC[-8]-RC[-8] -> 0 | N225: =RC[-8]-RC[-8] -> 0 | O225: =RC[-8]-RC[-8] -> 0 | P225: =RC[-8]-RC[-8] -> 0 | Q225: =RC[-8]-RC[-8] -> 0 | R225: =RC[-8]-RC[-8] -> 0 | T225: =SUM(R[-23]C:R[-1]C) -> 134.31032136105864 | U225: =SUM(R[-23]C:R[-1]C) -> 6334.9565217391319 | V225: =SUM(R[-23]C:R[-1]C) -> 2374.9792060491495 | W225: =SUM(R[-23]C:R[-1]C) -> 26379.379962192816 | X225: =SUM(R[-23]C:R[-1]C) -> 19302.752362948955 | Y225: =SUM(R[-23]C:R[-1]C) -> 1.2359994328922499 | Z225: =SUM(R[-23]C:R[-1]C) -> 4388 | AA225: =SUM(R[-23]C:R[-1]C) -> 2114.890359168242 | AB225: =SUM(R[-23]C:R[-1]C) -> 82886.342155009479 | AC225: =SUM(R[-23]C:R[-1]C) -> 28033.293005671079 | AD225: =SUM(R[-23]C:R[-1]C) -> 18494.151228733463 | AE225: =RC[-11]/SQRT(RC[-6]*RC[-1]) -> 0.88834783896114877 | AF225: =RC[-11]/SQRT(RC[-6]*RC[-2]) -> 0.70322309756112444 | AG225: =RC[-11]/SQRT(RC[-6]*RC[-3]) -> 0.37975078520906053 | AH225: =RC[-11]/SQRT(RC[-6]*RC[-4]) -> 0.67376103926389685 | AI225: =RC[-11]/SQRT(RC[-6]*RC[-5]) -> 0.84774449572483324
A226: 17846 | B226: 北京 | C226: 131 | D226: 轻度污染 | E226: 0.91 | F226: 21 | G226: 53 | H226: 75 | I226: 149 | J226: 126 | L226: 2013-06-01T00:00:00.000 | M226: =RC[-8]-R[24]C[-8] -> 0.24583333333333335 | N226: =RC[-8]-R[24]C[-8] -> 10.041666666666666 | O226: =RC[-8]-R[24]C[-8] -> 10.583333333333336 | P226: =RC[-8]-R[24]C[-8] -> -9.4166666666666714 | Q226: =RC[-8]-R[24]C[-8] -> 43 | R226: =RC[-8]-R[24]C[-8] -> 56.291666666666671 | T226: =RC[-7]*RC[-2] -> 13.838368055555557 | U226: =RC[-7]*RC[-3] -> 565.26215277777783 | V226: =RC[-7]*RC[-4] -> 595.7534722222224 | W226: =RC[-7]*RC[-5] -> -530.07986111111143 | X226: =RC[-7]*RC[-6] -> 2420.541666666667 | Y226: =RC[-12]*RC[-12] -> 6.0434027777777788E-2 | Z226: =RC[-12]*RC[-12] -> 100.83506944444443 | AA226: =RC[-12]*RC[-12] -> 112.0069444444445 | AB226: =RC[-12]*RC[-12] -> 88.6736111111112 | AC226: =RC[-12]*RC[-12] -> 1849 | AD226: =RC[-12]*RC[-12] -> 3168.7517361111118 | AE226: =RC[-11]/SQRT(RC[-6]*RC[-1]) -> 1 | AF226: =RC[-11]/SQRT(RC[-6]*RC[-2]) -> 1 | AG226: =RC[-11]/SQRT(RC[-6]*RC[-3]) -> 1 | AH226: =RC[-11]/SQRT(RC[-6]*RC[-4]) -> -1 | AI226: =RC[-11]/SQRT(RC[-6]*RC[-5]) -> 1
A227: 17922 | B227: 北京 | C227: 134 | D227: 轻度污染 | E227: 0.93 | F227: 17 | G227: 54 | H227: 62 | I227: 154 | J227: 125 | L227: 2013-06-01T01:00:00.000 | M227: =RC[-8]-R[23]C[-8] -> 0.26583333333333337 | N227: =RC[-8]-R[23]C[-8] -> 6.0416666666666661 | O227: =RC[-8]-R[23]C[-8] -> 11.583333333333336 | P227: =RC[-8]-R[23]C[-8] -> -22.416666666666671 | Q227: =RC[-8]-R[23]C[-8] -> 48 | R227: =RC[-8]-R[23]C[-8] -> 55.291666666666671 | T227: =RC[-7]*RC[-2] -> 14.698368055555559 | U227: =RC[-7]*RC[-3] -> 334.05381944444446 | V227: =RC[-7]*RC[-4] -> 640.46180555555577 | W227: =RC[-7]*RC[-5] -> -1239.4548611111115 | X227: =RC[-7]*RC[-6] -> 2654 | Y227: =RC[-12]*RC[-12] -> 7.0667361111111132E-2 | Z227: =RC[-12]*RC[-12] -> 36.501736111111107 | AA227: =RC[-12]*RC[-12] -> 134.17361111111117 | AB227: =RC[-12]*RC[-12] -> 502.50694444444468 | AC227: =RC[-12]*RC[-12] -> 2304 | AD227: =RC[-12]*RC[-12] -> 3057.1684027777783 | AE227: =RC[-11]/SQRT(RC[-6]*RC[-1]) -> 1 | AF227: =RC[-11]/SQRT(RC[-6]*RC[-2]) -> 1 | AG227: =RC[-11]/SQRT(RC[-6]*RC[-3]) -> 1 | AH227: =RC[-11]/SQRT(RC[-6]*RC[-4]) -> -1 | AI227: =RC[-11]/SQRT(RC[-6]*RC[-5]) -> 1
A228: 17998 | B228: 北京 | C228: 139 | D228: 轻度污染 | E228: 0.96 | F228: 12 | G228: 58 | H228: 41 | I228: 164 | J228: 131 | L228: 2013-06-01T02:00:00.000 | M228: =RC[-8]-R[22]C[-8] -> 0.29583333333333328 | N228: =RC[-8]-R[22]C[-8] -> 1.0416666666666661 | O228: =RC[-8]-R[22]C[-8] -> 15.583333333333336 | P228: =RC[-8]-R[22]C[-8] -> -43.416666666666671 | Q228: =RC[-8]-R[22]C[-8] -> 58 | R228: =RC[-8]-R[22]C[-8] -> 61.291666666666671 | T228: =RC[-7]*RC[-2] -> 18.132118055555555 | U228: =RC[-7]*RC[-3] -> 63.845486111111079 | V228: =RC[-7]*RC[-4] -> 955.1284722222224 | W228: =RC[-7]*RC[-5] -> -2661.0798611111118 | X228: =RC[-7]*RC[-6] -> 3554.916666666667 | Y228: =RC[-12]*RC[-12] -> 8.7517361111111081E-2 | Z228: =RC[-12]*RC[-12] -> 1.0850694444444433 | AA228: =RC[-12]*RC[-12] -> 242.84027777777786 | AB228: =RC[-12]*RC[-12] -> 1885.0069444444448 | AC228: =RC[-12]*RC[-12] -> 3364 | AD228: =RC[-12]*RC[-12] -> 3756.6684027777783 | AE228: =RC[-11]/SQRT(RC[-6]*RC[-1]) -> 1 | AF228: =RC[-11]/SQRT(RC[-6]*RC[-2]) -> 0.99999999999999989 | AG228: =RC[-11]/SQRT(RC[-6]*RC[-3]) -> 0.99999999999999989 | AH228: =RC[-11]/SQRT(RC[-6]*RC[-4]) -> -1.0000000000000002 | AI228: =RC[-11]/SQRT(RC[-6]*RC[-5]) -> 1
A229: 18074 | B229: 北京 | C229: 143 | D229: 轻度污染 | E229: 1.06 | F229: 10 | G229: 68 | H229: 33 | I229: 161 | J229: 132 | L229: 2013-06-01T03:00:00.000 | M229: =RC[-8]-R[21]C[-8] -> 0.39583333333333337 | N229: =RC[-8]-R[21]C[-8] -> -0.95833333333333393 | O229: =RC[-8]-R[21]C[-8] -> 25.583333333333336 | P229: =RC[-8]-R[21]C[-8] -> -51.416666666666671 | Q229: =RC[-8]-R[21]C[-8] -> 55 | R229: =RC[-8]-R[21]C[-8] -> 62.291666666666671 | T229: =RC[-7]*RC[-2] -> 24.657118055555561 | U229: =RC[-7]*RC[-3] -> -59.6961805555556 | V229: =RC[-7]*RC[-4] -> 1593.6284722222224 | W229: =RC[-7]*RC[-5] -> -3202.8298611111118 | X229: =RC[-7]*RC[-6] -> 3426.041666666667 | Y229: =RC[-12]*RC[-12] -> 0.15668402777777782 | Z229: =RC[-12]*RC[-12] -> 0.9184027777777789 | AA229: =RC[-12]*RC[-12] -> 654.50694444444457 | AB229: =RC[-12]*RC[-12] -> 2643.6736111111118 | AC229: =RC[-12]*RC[-12] -> 3025 | AD229: =RC[-12]*RC[-12] -> 3880.2517361111118 | AE229: =RC[-11]/SQRT(RC[-6]*RC[-1]) -> 1 | AF229: =RC[-11]/SQRT(RC[-6]*RC[-2]) -> -1 | AG229: =RC[-11]/SQRT(RC[-6]*RC[-3]) -> 1 | AH229: =RC[-11]/SQRT(RC[-6]*RC[-4]) -> -1 | AI229: =RC[-11]/SQRT(RC[-6]*RC[-5]) -> 1
A230: 18150 | B230: 北京 | C230: 147 | D230: 轻度污染 | E230: 1 | F230: 9 | G230: 71 | H230: 28 | I230: 161 | J230: 128 | L230: 2013-06-01T04:00:00.000 | M230: =RC[-8]-R[20]C[-8] -> 0.33583333333333332 | N230: =RC[-8]-R[20]C[-8] -> -1.9583333333333339 | O230: =RC[-8]-R[20]C[-8] -> 28.583333333333336 | P230: =RC[-8]-R[20]C[-8] -> -56.416666666666671 | Q230: =RC[-8]-R[20]C[-8] -> 55 | R230: =RC[-8]-R[20]C[-8] -> 58.291666666666671 | T230: =RC[-7]*RC[-2] -> 19.576284722222223 | U230: =RC[-7]*RC[-3] -> -114.15451388888893 | V230: =RC[-7]*RC[-4] -> 1666.1701388888891 | W230: =RC[-7]*RC[-5] -> -3288.6215277777783 | X230: =RC[-7]*RC[-6] -> 3206.041666666667 | Y230: =RC[-12]*RC[-12] -> 0.11278402777777777 | Z230: =RC[-12]*RC[-12] -> 3.8350694444444469 | AA230: =RC[-12]*RC[-12] -> 817.00694444444457 | AB230: =RC[-12]*RC[-12] -> 3182.8402777777783 | AC230: =RC[-12]*RC[-12] -> 3025 | AD230: =RC[-12]*RC[-12] -> 3397.9184027777783 | AE230: =RC[-11]/SQRT(RC[-6]*RC[-1]) -> 1 | AF230: =RC[-11]/SQRT(RC[-6]*RC[-2]) -> -1 | AG230: =RC[-11]/SQRT(RC[-6]*RC[-3]) -> 1 | AH230: =RC[-11]/SQRT(RC[-6]*RC[-4]) -> -1 | AI230: =RC[-11]/SQRT(RC[-6]*RC[-5]) -> 1
A231: 18226 | B231: 北京 | C231: 151 | D231: 轻度污染 | E231: 1.17 | F231: 9 | G231: 76 | H231: 23 | I231: 181 | J231: 134 | L231: 2013-06-01T05:00:00.000 | M231: =RC[-8]-R[19]C[-8] -> 0.50583333333333325 | N231: =RC[-8]-R[19]C[-8] -> -1.9583333333333339 | O231: =RC[-8]-R[19]C[-8] -> 33.583333333333336 | P231: =RC[-8]-R[19]C[-8] -> -61.416666666666671 | Q231: =RC[-8]-R[19]C[-8] -> 75 | R231: =RC[-8]-R[19]C[-8] -> 64.291666666666671 | T231: =RC[-7]*RC[-2] -> 32.520868055555553 | U231: =RC[-7]*RC[-3] -> -125.90451388888894 | V231: =RC[-7]*RC[-4] -> 2159.1284722222226 | W231: =RC[-7]*RC[-5] -> -3948.5798611111118 | X231: =RC[-7]*RC[-6] -> 4821.875 | Y231: =RC[-12]*RC[-12] -> 0.25586736111111102 | Z231: =RC[-12]*RC[-12] -> 3.8350694444444469 | AA231: =RC[-12]*RC[-12] -> 1127.8402777777778 | AB231: =RC[-12]*RC[-12] -> 3772.0069444444453 | AC231: =RC[-12]*RC[-12] -> 5625 | AD231: =RC[-12]*RC[-12] -> 4133.4184027777783 | AE231: =RC[-11]/SQRT(RC[-6]*RC[-1]) -> 1 | AF231: =RC[-11]/SQRT(RC[-6]*RC[-2]) -> -1.0000000000000002 | AG231: =RC[-11]/SQRT(RC[-6]*RC[-3]) -> 1.0000000000000002 | AH231: =RC[-11]/SQRT(RC[-6]*RC[-4]) -> -1 | AI231: =RC[-11]/SQRT(RC[-6]*RC[-5]) -> 1
A232: 18302 | B232: 北京 | C232: 153 | D232: 中度污染 | E232: 1.1100000000000001 | F232: 10 | G232: 58 | H232: 26 | I232: 167 | J232: 122 | L232: 2013-06-01T06:00:00.000 | M232: =RC[-8]-R[18]C[-8] -> 0.44583333333333341 | N232: =RC[-8]-R[18]C[-8] -> -0.95833333333333393 | O232: =RC[-8]-R[18]C[-8] -> 15.583333333333336 | P232: =RC[-8]-R[18]C[-8] -> -58.416666666666671 | Q232: =RC[-8]-R[18]C[-8] -> 61 | R232: =RC[-8]-R[18]C[-8] -> 52.291666666666671 | T232: =RC[-7]*RC[-2] -> 23.313368055555561 | U232: =RC[-7]*RC[-3] -> -50.112847222222257 | V232: =RC[-7]*RC[-4] -> 814.8784722222224 | W232: =RC[-7]*RC[-5] -> -3054.7048611111118 | X232: =RC[-7]*RC[-6] -> 3189.791666666667 | Y232: =RC[-12]*RC[-12] -> 0.19876736111111118 | Z232: =RC[-12]*RC[-12] -> 0.9184027777777789 | AA232: =RC[-12]*RC[-12] -> 242.84027777777786 | AB232: =RC[-12]*RC[-12] -> 3412.5069444444448 | AC232: =RC[-12]*RC[-12] -> 3721 | AD232: =RC[-12]*RC[-12] -> 2734.4184027777783 | AE232: =RC[-11]/SQRT(RC[-6]*RC[-1]) -> 1 | AF232: =RC[-11]/SQRT(RC[-6]*RC[-2]) -> -1 | AG232: =RC[-11]/SQRT(RC[-6]*RC[-3]) -> 1 | AH232: =RC[-11]/SQRT(RC[-6]*RC[-4]) -> -1 | AI232: =RC[-11]/SQRT(RC[-6]*RC[-5]) -> 1
A233: 18378 | B233: 北京 | C233: 156 | D233: 中度污染 | E233: 1.1200000000000001 | F233: 16 | G233: 72 | H233: 29 | I233: 175 | J233: 124 | L233: 2013-06-01T07:00:00.000 | M233: =RC[-8]-R[17]C[-8] -> 0.45583333333333342 | N233: =RC[-8]-R[17]C[-8] -> 5.0416666666666661 | O233: =RC[-8]-R[17]C[-8] -> 29.583333333333336 | P233: =RC[-8]-R[17]C[-8] -> -55.416666666666671 | Q233: =RC[-8]-R[17]C[-8] -> 69 | R233: =RC[-8]-R[17]C[-8] -> 54.291666666666671 | T233: =RC[-7]*RC[-2] -> 24.747951388888897 | U233: =RC[-7]*RC[-3] -> 273.72048611111109 | V233: =RC[-7]*RC[-4] -> 1606.1284722222224 | W233: =RC[-7]*RC[-5] -> -3008.6631944444448 | X233: =RC[-7]*RC[-6] -> 3746.1250000000005 | Y233: =RC[-12]*RC[-12] -> 0.20778402777777785 | Z233: =RC[-12]*RC[-12] -> 25.418402777777771 | AA233: =RC[-12]*RC[-12] -> 875.1736111111112 | AB233: =RC[-12]*RC[-12] -> 3071.0069444444448 | AC233: =RC[-12]*RC[-12] -> 4761 | AD233: =RC[-12]*RC[-12] -> 2947.5850694444448 | AE233: =RC[-11]/SQRT(RC[-6]*RC[-1]) -> 1.0000000000000002 | AF233: =RC[-11]/SQRT(RC[-6]*RC[-2]) -> 1 | AG233: =RC[-11]/SQRT(RC[-6]*RC[-3]) -> 1 | AH233: =RC[-11]/SQRT(RC[-6]*RC[-4]) -> -1 | AI233: =RC[-11]/SQRT(RC[-6]*RC[-5]) -> 1
A234: 18454 | B234: 北京 | C234: 157 | D234: 中度污染 | E234: 0.99 | F234: 26 | G234: 65 | H234: 52 | I234: 168 | J234: 119 | L234: 2013-06-01T08:00:00.000 | M234: =RC[-8]-R[16]C[-8] -> 0.32583333333333331 | N234: =RC[-8]-R[16]C[-8] -> 15.041666666666666 | O234: =RC[-8]-R[16]C[-8] -> 22.583333333333336 | P234: =RC[-8]-R[16]C[-8] -> -32.416666666666671 | Q234: =RC[-8]-R[16]C[-8] -> 62 | R234: =RC[-8]-R[16]C[-8] -> 49.291666666666671 | T234: =RC[-7]*RC[-2] -> 16.060868055555556 | U234: =RC[-7]*RC[-3] -> 741.42881944444446 | V234: =RC[-7]*RC[-4] -> 1113.1701388888891 | W234: =RC[-7]*RC[-5] -> -1597.8715277777781 | X234: =RC[-7]*RC[-6] -> 3056.0833333333335 | Y234: =RC[-12]*RC[-12] -> 0.10616736111111109 | Z234: =RC[-12]*RC[-12] -> 226.25173611111109 | AA234: =RC[-12]*RC[-12] -> 510.00694444444457 | AB234: =RC[-12]*RC[-12] -> 1050.8402777777781 | AC234: =RC[-12]*RC[-12] -> 3844 | AD234: =RC[-12]*RC[-12] -> 2429.6684027777783 | AE234: =RC[-11]/SQRT(RC[-6]*RC[-1]) -> 1 | AF234: =RC[-11]/SQRT(RC[-6]*RC[-2]) -> 1 | AG234: =RC[-11]/SQRT(RC[-6]*RC[-3]) -> 1 | AH234: =RC[-11]/SQRT(RC[-6]*RC[-4]) -> -1 | AI234: =RC[-11]/SQRT(RC[-6]*RC[-5]) -> 1
A235: 18530 | B235: 北京 | C235: 157 | D235: 中度污染 | E235: 0.72 | F235: 23 | G235: 43 | H235: 82 | I235: 149 | J235: 88 | L235: 2013-06-01T09:00:00.000 | M235: =RC[-8]-R[15]C[-8] -> 5.583333333333329E-2 | N235: =RC[-8]-R[15]C[-8] -> 12.041666666666666 | O235: =RC[-8]-R[15]C[-8] -> 0.5833333333333357 | P235: =RC[-8]-R[15]C[-8] -> -2.4166666666666714 | Q235: =RC[-8]-R[15]C[-8] -> 43 | R235: =RC[-8]-R[15]C[-8] -> 18.291666666666671 | T235: =RC[-7]*RC[-2] -> 1.0212847222222217 | U235: =RC[-7]*RC[-3] -> 220.26215277777783 | V235: =RC[-7]*RC[-4] -> 10.670138888888935 | W235: =RC[-7]*RC[-5] -> -44.204861111111207 | X235: =RC[-7]*RC[-6] -> 786.54166666666686 | Y235: =RC[-12]*RC[-12] -> 3.1173611111111063E-3 | Z235: =RC[-12]*RC[-12] -> 145.00173611111109 | AA235: =RC[-12]*RC[-12] -> 0.34027777777778057 | AB235: =RC[-12]*RC[-12] -> 5.8402777777778008 | AC235: =RC[-12]*RC[-12] -> 1849 | AD235: =RC[-12]*RC[-12] -> 334.58506944444463 | AE235: =RC[-11]/SQRT(RC[-6]*RC[-1]) -> 1 | AF235: =RC[-11]/SQRT(RC[-6]*RC[-2]) -> 1 | AG235: =RC[-11]/SQRT(RC[-6]*RC[-3]) -> 1 | AH235: =RC[-11]/SQRT(RC[-6]*RC[-4]) -> -1 | AI235: =RC[-11]/SQRT(RC[-6]*RC[-5]) -> 1
A236: 18606 | B236: 北京 | C236: 154 | D236: 中度污染 | E236: 0.56000000000000005 | F236: 12 | G236: 28 | H236: 97 | I236: 12 | J236: 48 | L236: 2013-06-01T10:00:00.000 | M236: =RC[-8]-R[14]C[-8] -> -0.10416666666666663 | N236: =RC[-8]-R[14]C[-8] -> 1.0416666666666661 | O236: =RC[-8]-R[14]C[-8] -> -14.416666666666664 | P236: =RC[-8]-R[14]C[-8] -> 12.583333333333329 | Q236: =RC[-8]-R[14]C[-8] -> -94 | R236: =RC[-8]-R[14]C[-8] -> -21.708333333333329 | T236: =RC[-7]*RC[-2] -> 2.261284722222221 | U236: =RC[-7]*RC[-3] -> -22.612847222222204 | V236: =RC[-7]*RC[-4] -> 312.96180555555543 | W236: =RC[-7]*RC[-5] -> -273.16319444444429 | X236: =RC[-7]*RC[-6] -> 2040.5833333333328 | Y236: =RC[-12]*RC[-12] -> 1.0850694444444437E-2 | Z236: =RC[-12]*RC[-12] -> 1.0850694444444433 | AA236: =RC[-12]*RC[-12] -> 207.84027777777771 | AB236: =RC[-12]*RC[-12] -> 158.34027777777766 | AC236: =RC[-12]*RC[-12] -> 8836 | AD236: =RC[-12]*RC[-12] -> 471.25173611111092 | AE236: =RC[-11]/SQRT(RC[-6]*RC[-1]) -> 1 | AF236: =RC[-11]/SQRT(RC[-6]*RC[-2]) -> -0.99999999999999989 | AG236: =RC[-11]/SQRT(RC[-6]*RC[-3]) -> 1 | AH236: =RC[-11]/SQRT(RC[-6]*RC[-4]) -> -1 | AI236: =RC[-11]/SQRT(RC[-6]*RC[-5]) -> 0.99999999999999989
A237: 18682 | B237: 北京 | C237: 150 | D237: 轻度污染 | E237: 0.38 | F237: 6 | G237: 18 | H237: 108 | I237: 44 | J237: 32 | L237: 2013-06-01T11:00:00.000 | M237: =RC[-8]-R[13]C[-8] -> -0.28416666666666668 | N237: =RC[-8]-R[13]C[-8] -> -4.9583333333333339 | O237: =RC[-8]-R[13]C[-8] -> -24.416666666666664 | P237: =RC[-8]-R[13]C[-8] -> 23.583333333333329 | Q237: =RC[-8]-R[13]C[-8] -> -62 | R237: =RC[-8]-R[13]C[-8] -> -37.708333333333329 | T237: =RC[-7]*RC[-2] -> 10.715451388888887 | U237: =RC[-7]*RC[-3] -> 186.97048611111111 | V237: =RC[-7]*RC[-4] -> 920.71180555555532 | W237: =RC[-7]*RC[-5] -> -889.28819444444412 | X237: =RC[-7]*RC[-6] -> 2337.9166666666665 | Y237: =RC[-12]*RC[-12] -> 8.0750694444444451E-2 | Z237: =RC[-12]*RC[-12] -> 24.58506944444445 | AA237: =RC[-12]*RC[-12] -> 596.17361111111097 | AB237: =RC[-12]*RC[-12] -> 556.17361111111086 | AC237: =RC[-12]*RC[-12] -> 3844 | AD237: =RC[-12]*RC[-12] -> 1421.9184027777774 | AE237: =RC[-11]/SQRT(RC[-6]*RC[-1]) -> 1 | AF237: =RC[-11]/SQRT(RC[-6]*RC[-2]) -> 1 | AG237: =RC[-11]/SQRT(RC[-6]*RC[-3]) -> 1 | AH237: =RC[-11]/SQRT(RC[-6]*RC[-4]) -> -1 | AI237: =RC[-11]/SQRT(RC[-6]*RC[-5]) -> 1
A238: 18758 | B238: 北京 | C238: 145 | D238: 轻度污染 | E238: 0.31 | F238: 4 | G238: 16 | H238: 116 | I238: 19 | J238: 25 | L238: 2013-06-01T12:00:00.000 | M238: =RC[-8]-R[12]C[-8] -> -0.35416666666666669 | N238: =RC[-8]-R[12]C[-8] -> -6.9583333333333339 | O238: =RC[-8]-R[12]C[-8] -> -26.416666666666664 | P238: =RC[-8]-R[12]C[-8] -> 31.583333333333329 | Q238: =RC[-8]-R[12]C[-8] -> -87 | R238: =RC[-8]-R[12]C[-8] -> -44.708333333333329 | T238: =RC[-7]*RC[-2] -> 15.834201388888888 | U238: =RC[-7]*RC[-3] -> 311.09548611111109 | V238: =RC[-7]*RC[-4] -> 1181.0451388888887 | W238: =RC[-7]*RC[-5] -> -1412.0381944444441 | X238: =RC[-7]*RC[-6] -> 3889.6249999999995 | Y238: =RC[-12]*RC[-12] -> 0.12543402777777779 | Z238: =RC[-12]*RC[-12] -> 48.418402777777786 | AA238: =RC[-12]*RC[-12] -> 697.8402777777776 | AB238: =RC[-12]*RC[-12] -> 997.50694444444412 | AC238: =RC[-12]*RC[-12] -> 7569 | AD238: =RC[-12]*RC[-12] -> 1998.8350694444441 | AE238: =RC[-11]/SQRT(RC[-6]*RC[-1]) -> 0.99999999999999989 | AF238: =RC[-11]/SQRT(RC[-6]*RC[-2]) -> 0.99999999999999978 | AG238: =RC[-11]/SQRT(RC[-6]*RC[-3]) -> 1 | AH238: =RC[-11]/SQRT(RC[-6]*RC[-4]) -> -1 | AI238: =RC[-11]/SQRT(RC[-6]*RC[-5]) -> 1
A239: 18834 | B239: 北京 | C239: 140 | D239: 轻度污染 | E239: 0.3 | F239: 4 | G239: 18 | H239: 129 | I239: 36 | J239: 18 | L239: 2013-06-01T13:00:00.000 | M239: =RC[-8]-R[11]C[-8] -> -0.36416666666666669 | N239: =RC[-8]-R[11]C[-8] -> -6.9583333333333339 | O239: =RC[-8]-R[11]C[-8] -> -24.416666666666664 | P239: =RC[-8]-R[11]C[-8] -> 44.583333333333329 | Q239: =RC[-8]-R[11]C[-8] -> -70 | R239: =RC[-8]-R[11]C[-8] -> -51.708333333333329 | T239: =RC[-7]*RC[-2] -> 18.830451388888889 | U239: =RC[-7]*RC[-3] -> 359.80381944444446 | V239: =RC[-7]*RC[-4] -> 1262.5451388888887 | W239: =RC[-7]*RC[-5] -> -2305.3298611111109 | X239: =RC[-7]*RC[-6] -> 3619.583333333333 | Y239: =RC[-12]*RC[-12] -> 0.13261736111111114 | Z239: =RC[-12]*RC[-12] -> 48.418402777777786 | AA239: =RC[-12]*RC[-12] -> 596.17361111111097 | AB239: =RC[-12]*RC[-12] -> 1987.6736111111106 | AC239: =RC[-12]*RC[-12] -> 4900 | AD239: =RC[-12]*RC[-12] -> 2673.7517361111104 | AE239: =RC[-11]/SQRT(RC[-6]*RC[-1]) -> 1 | AF239: =RC[-11]/SQRT(RC[-6]*RC[-2]) -> 1 | AG239: =RC[-11]/SQRT(RC[-6]*RC[-3]) -> 1.0000000000000002 | AH239: =RC[-11]/SQRT(RC[-6]*RC[-4]) -> -1.0000000000000002 | AI239: =RC[-11]/SQRT(RC[-6]*RC[-5]) -> 1.0000000000000002
A240: 18910 | B240: 北京 | C240: 134 | D240: 轻度污染 | E240: 0.28000000000000003 | F240: 4 | G240: 21 | H240: 141 | I240: 39 | J240: 18 | L240: 2013-06-01T14:00:00.000 | M240: =RC[-8]-R[10]C[-8] -> -0.38416666666666666 | N240: =RC[-8]-R[10]C[-8] -> -6.9583333333333339 | O240: =RC[-8]-R[10]C[-8] -> -21.416666666666664 | P240: =RC[-8]-R[10]C[-8] -> 56.583333333333329 | Q240: =RC[-8]-R[10]C[-8] -> -67 | R240: =RC[-8]-R[10]C[-8] -> -51.708333333333329 | T240: =RC[-7]*RC[-2] -> 19.864618055555553 | U240: =RC[-7]*RC[-3] -> 359.80381944444446 | V240: =RC[-7]*RC[-4] -> 1107.4201388888887 | W240: =RC[-7]*RC[-5] -> -2925.8298611111104 | X240: =RC[-7]*RC[-6] -> 3464.458333333333 | Y240: =RC[-12]*RC[-12] -> 0.14758402777777777 | Z240: =RC[-12]*RC[-12] -> 48.418402777777786 | AA240: =RC[-12]*RC[-12] -> 458.67361111111103 | AB240: =RC[-12]*RC[-12] -> 3201.6736111111104 | AC240: =RC[-12]*RC[-12] -> 4489 | AD240: =RC[-12]*RC[-12] -> 2673.7517361111104 | AE240: =RC[-11]/SQRT(RC[-6]*RC[-1]) -> 1 | AF240: =RC[-11]/SQRT(RC[-6]*RC[-2]) -> 1 | AG240: =RC[-11]/SQRT(RC[-6]*RC[-3]) -> 1 | AH240: =RC[-11]/SQRT(RC[-6]*RC[-4]) -> -1 | AI240: =RC[-11]/SQRT(RC[-6]*RC[-5]) -> 1
A241: 18986 | B241: 北京 | C241: 129 | D241: 轻度污染 | E241: 0.28000000000000003 | F241: 4 | G241: 24 | H241: 141 | I241: 50 | J241: 26 | L241: 2013-06-01T15:00:00.000 | M241: =RC[-8]-R[9]C[-8] -> -0.38416666666666666 | N241: =RC[-8]-R[9]C[-8] -> -6.9583333333333339 | O241: =RC[-8]-R[9]C[-8] -> -18.416666666666664 | P241: =RC[-8]-R[9]C[-8] -> 56.583333333333329 | Q241: =RC[-8]-R[9]C[-8] -> -56 | R241: =RC[-8]-R[9]C[-8] -> -43.708333333333329 | T241: =RC[-7]*RC[-2] -> 16.791284722222219 | U241: =RC[-7]*RC[-3] -> 304.13715277777777 | V241: =RC[-7]*RC[-4] -> 804.96180555555532 | W241: =RC[-7]*RC[-5] -> -2473.1631944444439 | X241: =RC[-7]*RC[-6] -> 2447.6666666666665 | Y241: =RC[-12]*RC[-12] -> 0.14758402777777777 | Z241: =RC[-12]*RC[-12] -> 48.418402777777786 | AA241: =RC[-12]*RC[-12] -> 339.17361111111103 | AB241: =RC[-12]*RC[-12] -> 3201.6736111111104 | AC241: =RC[-12]*RC[-12] -> 3136 | AD241: =RC[-12]*RC[-12] -> 1910.4184027777774 | AE241: =RC[-11]/SQRT(RC[-6]*RC[-1]) -> 1 | AF241: =RC[-11]/SQRT(RC[-6]*RC[-2]) -> 1 | AG241: =RC[-11]/SQRT(RC[-6]*RC[-3]) -> 1 | AH241: =RC[-11]/SQRT(RC[-6]*RC[-4]) -> -1 | AI241: =RC[-11]/SQRT(RC[-6]*RC[-5]) -> 1
A242: 19062 | B242: 北京 | C242: 125 | D242: 轻度污染 | E242: 0.26 | F242: 4 | G242: 27 | H242: 137 | I242: 59 | J242: 24 | L242: 2013-06-01T16:00:00.000 | M242: =RC[-8]-R[8]C[-8] -> -0.40416666666666667 | N242: =RC[-8]-R[8]C[-8] -> -6.9583333333333339 | O242: =RC[-8]-R[8]C[-8] -> -15.416666666666664 | P242: =RC[-8]-R[8]C[-8] -> 52.583333333333329 | Q242: =RC[-8]-R[8]C[-8] -> -47 | R242: =RC[-8]-R[8]C[-8] -> -45.708333333333329 | T242: =RC[-7]*RC[-2] -> 18.47378472222222 | U242: =RC[-7]*RC[-3] -> 318.05381944444446 | V242: =RC[-7]*RC[-4] -> 704.67013888888869 | W242: =RC[-7]*RC[-5] -> -2403.4965277777774 | X242: =RC[-7]*RC[-6] -> 2148.2916666666665 | Y242: =RC[-12]*RC[-12] -> 0.16335069444444444 | Z242: =RC[-12]*RC[-12] -> 48.418402777777786 | AA242: =RC[-12]*RC[-12] -> 237.67361111111103 | AB242: =RC[-12]*RC[-12] -> 2765.0069444444439 | AC242: =RC[-12]*RC[-12] -> 2209 | AD242: =RC[-12]*RC[-12] -> 2089.2517361111109 | AE242: =RC[-11]/SQRT(RC[-6]*RC[-1]) -> 1 | AF242: =RC[-11]/SQRT(RC[-6]*RC[-2]) -> 1 | AG242: =RC[-11]/SQRT(RC[-6]*RC[-3]) -> 1 | AH242: =RC[-11]/SQRT(RC[-6]*RC[-4]) -> -1 | AI242: =RC[-11]/SQRT(RC[-6]*RC[-5]) -> 1
A243: 19138 | B243: 北京 | C243: 119 | D243: 轻度污染 | E243: 0.27 | F243: 4 | G243: 22 | H243: 121 | I243: 49 | J243: 16 | L243: 2013-06-01T17:00:00.000 | M243: =RC[-8]-R[7]C[-8] -> -0.39416666666666667 | N243: =RC[-8]-R[7]C[-8] -> -6.9583333333333339 | O243: =RC[-8]-R[7]C[-8] -> -20.416666666666664 | P243: =RC[-8]-R[7]C[-8] -> 36.583333333333329 | Q243: =RC[-8]-R[7]C[-8] -> -57 | R243: =RC[-8]-R[7]C[-8] -> -53.708333333333329 | T243: =RC[-7]*RC[-2] -> 21.170034722222219 | U243: =RC[-7]*RC[-3] -> 373.72048611111109 | V243: =RC[-7]*RC[-4] -> 1096.5451388888887 | W243: =RC[-7]*RC[-5] -> -1964.8298611111106 | X243: =RC[-7]*RC[-6] -> 3061.3749999999995 | Y243: =RC[-12]*RC[-12] -> 0.1553673611111111 | Z243: =RC[-12]*RC[-12] -> 48.418402777777786 | AA243: =RC[-12]*RC[-12] -> 416.84027777777766 | AB243: =RC[-12]*RC[-12] -> 1338.3402777777774 | AC243: =RC[-12]*RC[-12] -> 3249 | AD243: =RC[-12]*RC[-12] -> 2884.5850694444439 | AE243: =RC[-11]/SQRT(RC[-6]*RC[-1]) -> 1 | AF243: =RC[-11]/SQRT(RC[-6]*RC[-2]) -> 1 | AG243: =RC[-11]/SQRT(RC[-6]*RC[-3]) -> 1 | AH243: =RC[-11]/SQRT(RC[-6]*RC[-4]) -> -1 | AI243: =RC[-11]/SQRT(RC[-6]*RC[-5]) -> 1
A244: 19214 | B244: 北京 | C244: 114 | D244: 轻度污染 | E244: 0.31 | F244: 4 | G244: 23 | H244: 110 | I244: 108 | J244: 18 | L244: 2013-06-01T18:00:00.000 | M244: =RC[-8]-R[6]C[-8] -> -0.35416666666666669 | N244: =RC[-8]-R[6]C[-8] -> -6.9583333333333339 | O244: =RC[-8]-R[6]C[-8] -> -19.416666666666664 | P244: =RC[-8]-R[6]C[-8] -> 25.583333333333329 | Q244: =RC[-8]-R[6]C[-8] -> 2 | R244: =RC[-8]-R[6]C[-8] -> -51.708333333333329 | T244: =RC[-7]*RC[-2] -> 18.313368055555554 | U244: =RC[-7]*RC[-3] -> 359.80381944444446 | V244: =RC[-7]*RC[-4] -> 1004.0034722222221 | W244: =RC[-7]*RC[-5] -> -1322.8715277777774 | X244: =RC[-7]*RC[-6] -> -103.41666666666666 | Y244: =RC[-12]*RC[-12] -> 0.12543402777777779 | Z244: =RC[-12]*RC[-12] -> 48.418402777777786 | AA244: =RC[-12]*RC[-12] -> 377.00694444444434 | AB244: =RC[-12]*RC[-12] -> 654.50694444444423 | AC244: =RC[-12]*RC[-12] -> 4 | AD244: =RC[-12]*RC[-12] -> 2673.7517361111104 | AE244: =RC[-11]/SQRT(RC[-6]*RC[-1]) -> 1 | AF244: =RC[-11]/SQRT(RC[-6]*RC[-2]) -> 1 | AG244: =RC[-11]/SQRT(RC[-6]*RC[-3]) -> 1.0000000000000002 | AH244: =RC[-11]/SQRT(RC[-6]*RC[-4]) -> -1 | AI244: =RC[-11]/SQRT(RC[-6]*RC[-5]) -> -1
A245: 19290 | B245: 北京 | C245: 110 | D245: 轻度污染 | E245: 0.57999999999999996 | F245: 9 | G245: 33 | H245: 114 | I245: 81 | J245: 35 | L245: 2013-06-01T19:00:00.000 | M245: =RC[-8]-R[5]C[-8] -> -8.4166666666666723E-2 | N245: =RC[-8]-R[5]C[-8] -> -1.9583333333333339 | O245: =RC[-8]-R[5]C[-8] -> -9.4166666666666643 | P245: =RC[-8]-R[5]C[-8] -> 29.583333333333329 | Q245: =RC[-8]-R[5]C[-8] -> -25 | R245: =RC[-8]-R[5]C[-8] -> -34.708333333333329 | T245: =RC[-7]*RC[-2] -> 2.9212847222222238 | U245: =RC[-7]*RC[-3] -> 67.970486111111128 | V245: =RC[-7]*RC[-4] -> 326.83680555555543 | W245: =RC[-7]*RC[-5] -> -1026.7881944444441 | X245: =RC[-7]*RC[-6] -> 867.70833333333326 | Y245: =RC[-12]*RC[-12] -> 7.0840277777777872E-3 | Z245: =RC[-12]*RC[-12] -> 3.8350694444444469 | AA245: =RC[-12]*RC[-12] -> 88.673611111111072 | AB245: =RC[-12]*RC[-12] -> 875.17361111111086 | AC245: =RC[-12]*RC[-12] -> 625 | AD245: =RC[-12]*RC[-12] -> 1204.6684027777774 | AE245: =RC[-11]/SQRT(RC[-6]*RC[-1]) -> 1.0000000000000002 | AF245: =RC[-11]/SQRT(RC[-6]*RC[-2]) -> 1.0000000000000002 | AG245: =RC[-11]/SQRT(RC[-6]*RC[-3]) -> 1 | AH245: =RC[-11]/SQRT(RC[-6]*RC[-4]) -> -1 | AI245: =RC[-11]/SQRT(RC[-6]*RC[-5]) -> 1
A246: 19366 | B246: 北京 | C246: 105 | D246: 轻度污染 | E246: 0.56000000000000005 | F246: 9 | G246: 39 | H246: 99 | I246: 83 | J246: 35 | L246: 2013-06-01T20:00:00.000 | M246: =RC[-8]-R[4]C[-8] -> -0.10416666666666663 | N246: =RC[-8]-R[4]C[-8] -> -1.9583333333333339 | O246: =RC[-8]-R[4]C[-8] -> -3.4166666666666643 | P246: =RC[-8]-R[4]C[-8] -> 14.583333333333329 | Q246: =RC[-8]-R[4]C[-8] -> -23 | R246: =RC[-8]-R[4]C[-8] -> -34.708333333333329 | T246: =RC[-7]*RC[-2] -> 3.6154513888888871 | U246: =RC[-7]*RC[-3] -> 67.970486111111128 | V246: =RC[-7]*RC[-4] -> 118.58680555555546 | W246: =RC[-7]*RC[-5] -> -506.16319444444423 | X246: =RC[-7]*RC[-6] -> 798.29166666666652 | Y246: =RC[-12]*RC[-12] -> 1.0850694444444437E-2 | Z246: =RC[-12]*RC[-12] -> 3.8350694444444469 | AA246: =RC[-12]*RC[-12] -> 11.673611111111095 | AB246: =RC[-12]*RC[-12] -> 212.67361111111097 | AC246: =RC[-12]*RC[-12] -> 529 | AD246: =RC[-12]*RC[-12] -> 1204.6684027777774 | AE246: =RC[-11]/SQRT(RC[-6]*RC[-1]) -> 1 | AF246: =RC[-11]/SQRT(RC[-6]*RC[-2]) -> 1.0000000000000002 | AG246: =RC[-11]/SQRT(RC[-6]*RC[-3]) -> 1 | AH246: =RC[-11]/SQRT(RC[-6]*RC[-4]) -> -1 | AI246: =RC[-11]/SQRT(RC[-6]*RC[-5]) -> 1
A247: 19442 | B247: 北京 | C247: 102 | D247: 轻度污染 | E247: 0.69 | F247: 12 | G247: 39 | H247: 86 | I247: 92 | J247: 56 | L247: 2013-06-01T21:00:00.000 | M247: =RC[-8]-R[3]C[-8] -> 2.5833333333333264E-2 | N247: =RC[-8]-R[3]C[-8] -> 1.0416666666666661 | O247: =RC[-8]-R[3]C[-8] -> -3.4166666666666643 | P247: =RC[-8]-R[3]C[-8] -> 1.5833333333333286 | Q247: =RC[-8]-R[3]C[-8] -> -14 | R247: =RC[-8]-R[3]C[-8] -> -13.708333333333329 | T247: =RC[-7]*RC[-2] -> -0.35413194444444335 | U247: =RC[-7]*RC[-3] -> -14.279513888888875 | V247: =RC[-7]*RC[-4] -> 46.836805555555507 | W247: =RC[-7]*RC[-5] -> -21.70486111111104 | X247: =RC[-7]*RC[-6] -> 191.9166666666666 | Y247: =RC[-12]*RC[-12] -> 6.6736111111110751E-4 | Z247: =RC[-12]*RC[-12] -> 1.0850694444444433 | AA247: =RC[-12]*RC[-12] -> 11.673611111111095 | AB247: =RC[-12]*RC[-12] -> 2.5069444444444295 | AC247: =RC[-12]*RC[-12] -> 196 | AD247: =RC[-12]*RC[-12] -> 187.91840277777766 | AE247: =RC[-11]/SQRT(RC[-6]*RC[-1]) -> -0.99999999999999989 | AF247: =RC[-11]/SQRT(RC[-6]*RC[-2]) -> -0.99999999999999989 | AG247: =RC[-11]/SQRT(RC[-6]*RC[-3]) -> 1 | AH247: =RC[-11]/SQRT(RC[-6]*RC[-4]) -> -1 | AI247: =RC[-11]/SQRT(RC[-6]*RC[-5]) -> 1
A248: 19518 | B248: 北京 | C248: 97 | D248: 良 | E248: 0.59 | F248: 16 | G248: 46 | H248: 87 | I248: 114 | J248: 44 | L248: 2013-06-01T22:00:00.000 | M248: =RC[-8]-R[2]C[-8] -> -7.4166666666666714E-2 | N248: =RC[-8]-R[2]C[-8] -> 5.0416666666666661 | O248: =RC[-8]-R[2]C[-8] -> 3.5833333333333357 | P248: =RC[-8]-R[2]C[-8] -> 2.5833333333333286 | Q248: =RC[-8]-R[2]C[-8] -> 8 | R248: =RC[-8]-R[2]C[-8] -> -25.708333333333329 | T248: =RC[-7]*RC[-2] -> 1.9067013888888897 | U248: =RC[-7]*RC[-3] -> -129.61284722222217 | V248: =RC[-7]*RC[-4] -> -92.121527777777828 | W248: =RC[-7]*RC[-5] -> -66.413194444444315 | X248: =RC[-7]*RC[-6] -> -205.66666666666663 | Y248: =RC[-12]*RC[-12] -> 5.5006944444444513E-3 | Z248: =RC[-12]*RC[-12] -> 25.418402777777771 | AA248: =RC[-12]*RC[-12] -> 12.840277777777795 | AB248: =RC[-12]*RC[-12] -> 6.6736111111110867 | AC248: =RC[-12]*RC[-12] -> 64 | AD248: =RC[-12]*RC[-12] -> 660.91840277777749 | AE248: =RC[-11]/SQRT(RC[-6]*RC[-1]) -> 1 | AF248: =RC[-11]/SQRT(RC[-6]*RC[-2]) -> -1 | AG248: =RC[-11]/SQRT(RC[-6]*RC[-3]) -> -1.0000000000000002 | AH248: =RC[-11]/SQRT(RC[-6]*RC[-4]) -> -1.0000000000000002 | AI248: =RC[-11]/SQRT(RC[-6]*RC[-5]) -> -1
A249: 19594 | B249: 北京 | C249: 94 | D249: 良 | E249: 0.6 | F249: 18 | G249: 46 | H249: 89 | I249: 129 | J249: 49 | L249: 2013-06-01T23:00:00.000 | M249: =RC[-8]-R[1]C[-8] -> -6.4166666666666705E-2 | N249: =RC[-8]-R[1]C[-8] -> 7.0416666666666661 | O249: =RC[-8]-R[1]C[-8] -> 3.5833333333333357 | P249: =RC[-8]-R[1]C[-8] -> 4.5833333333333286 | Q249: =RC[-8]-R[1]C[-8] -> 23 | R249: =RC[-8]-R[1]C[-8] -> -20.708333333333329 | T249: =RC[-7]*RC[-2] -> 1.3287847222222227 | U249: =RC[-7]*RC[-3] -> -145.82118055555551 | V249: =RC[-7]*RC[-4] -> -74.204861111111143 | W249: =RC[-7]*RC[-5] -> -94.913194444444329 | X249: =RC[-7]*RC[-6] -> -476.29166666666657 | Y249: =RC[-12]*RC[-12] -> 4.1173611111111159E-3 | Z249: =RC[-12]*RC[-12] -> 49.585069444444436 | AA249: =RC[-12]*RC[-12] -> 12.840277777777795 | AB249: =RC[-12]*RC[-12] -> 21.0069444444444 | AC249: =RC[-12]*RC[-12] -> 529 | AD249: =RC[-12]*RC[-12] -> 428.83506944444423 | AE249: =RC[-11]/SQRT(RC[-6]*RC[-1]) -> 1 | AF249: =RC[-11]/SQRT(RC[-6]*RC[-2]) -> -1 | AG249: =RC[-11]/SQRT(RC[-6]*RC[-3]) -> -1 | AH249: =RC[-11]/SQRT(RC[-6]*RC[-4]) -> -1 | AI249: =RC[-11]/SQRT(RC[-6]*RC[-5]) -> -1
E250: =AVERAGE(R[-24]C:R[-1]C) -> 0.66416666666666668 | F250: =AVERAGE(R[-24]C:R[-1]C) -> 10.958333333333334 | G250: =AVERAGE(R[-24]C:R[-1]C) -> 42.416666666666664 | H250: =AVERAGE(R[-24]C:R[-1]C) -> 84.416666666666671 | I250: =AVERAGE(R[-24]C:R[-1]C) -> 106 | J250: =AVERAGE(R[-24]C:R[-1]C) -> 69.708333333333329 | M250: =RC[-8]-RC[-8] -> 0 | N250: =RC[-8]-RC[-8] -> 0 | O250: =RC[-8]-RC[-8] -> 0 | P250: =RC[-8]-RC[-8] -> 0 | Q250: =RC[-8]-RC[-8] -> 0 | R250: =RC[-8]-RC[-8] -> 0 | T250: =SUM(R[-24]C:R[-1]C) -> 340.23916666666668 | U250: =SUM(R[-24]C:R[-1]C) -> 4245.708333333333 | V250: =SUM(R[-24]C:R[-1]C) -> 19875.916666666672 | W250: =SUM(R[-24]C:R[-1]C) -> -40262.083333333343 | X250: =SUM(R[-24]C:R[-1]C) -> 54944.000000000007 | Y250: =SUM(R[-24]C:R[-1]C) -> 2.3769833333333334 | Z250: =SUM(R[-24]C:R[-1]C) -> 992.9583333333336 | AA250: =SUM(R[-24]C:R[-1]C) -> 8781.8333333333339 | AB250: =SUM(R[-24]C:R[-1]C) -> 35593.833333333328 | AC250: =SUM(R[-24]C:R[-1]C) -> 73546 | AD250: =SUM(R[-24]C:R[-1]C) -> 52324.958333333336 | AE250: =RC[-11]/SQRT(RC[-6]*RC[-1]) -> 0.96475445367622958 | AF250: =RC[-11]/SQRT(RC[-6]*RC[-2]) -> 0.58902021261210447 | AG250: =RC[-11]/SQRT(RC[-6]*RC[-3]) -> 0.92721431157244405 | AH250: =RC[-11]/SQRT(RC[-6]*RC[-4]) -> -0.93294150929475195 | AI250: =RC[-11]/SQRT(RC[-6]*RC[-5]) -> 0.88569929539955849
A251: 19670 | B251: 北京 | C251: 90 | D251: 良 | E251: 0.71 | F251: 20 | G251: 51 | H251: 77 | I251: 104 | J251: 59 | L251: 2013-06-02T00:00:00.000 | M251: =RC[-8]-R[24]C[-8] -> -1.1645833333333335 | N251: =RC[-8]-R[24]C[-8] -> -18.166666666666664 | O251: =RC[-8]-R[24]C[-8] -> -1.7083333333333357 | P251: =RC[-8]-R[24]C[-8] -> -1.5 | Q251: =RC[-8]-R[24]C[-8] -> -94.333333333333343 | R251: =RC[-8]-R[24]C[-8] -> -100.95833333333334 | T251: =RC[-7]*RC[-2] -> 117.57439236111114 | U251: =RC[-7]*RC[-3] -> 1834.0763888888889 | V251: =RC[-7]*RC[-4] -> 172.47048611111137 | W251: =RC[-7]*RC[-5] -> 151.4375 | X251: =RC[-7]*RC[-6] -> 9523.7361111111131 | Y251: =RC[-12]*RC[-12] -> 1.3562543402777782 | Z251: =RC[-12]*RC[-12] -> 330.02777777777771 | AA251: =RC[-12]*RC[-12] -> 2.9184027777777857 | AB251: =RC[-12]*RC[-12] -> 2.25 | AC251: =RC[-12]*RC[-12] -> 8898.7777777777792 | AD251: =RC[-12]*RC[-12] -> 10192.585069444447 | AE251: =RC[-11]/SQRT(RC[-6]*RC[-1]) -> 1 | AF251: =RC[-11]/SQRT(RC[-6]*RC[-2]) -> 1 | AG251: =RC[-11]/SQRT(RC[-6]*RC[-3]) -> 1 | AH251: =RC[-11]/SQRT(RC[-6]*RC[-4]) -> 0.99999999999999978 | AI251: =RC[-11]/SQRT(RC[-6]*RC[-5]) -> 1
A252: 19746 | B252: 北京 | C252: 87 | D252: 良 | E252: 0.75 | F252: 22 | G252: 48 | H252: 66 | I252: 109 | J252: 63 | L252: 2013-06-02T01:00:00.000 | M252: =RC[-8]-R[23]C[-8] -> -1.1245833333333335 | N252: =RC[-8]-R[23]C[-8] -> -16.166666666666664 | O252: =RC[-8]-R[23]C[-8] -> -4.7083333333333357 | P252: =RC[-8]-R[23]C[-8] -> -12.5 | Q252: =RC[-8]-R[23]C[-8] -> -89.333333333333343 | R252: =RC[-8]-R[23]C[-8] -> -96.958333333333343 | T252: =RC[-7]*RC[-2] -> 109.03772569444448 | U252: =RC[-7]*RC[-3] -> 1567.4930555555554 | V252: =RC[-7]*RC[-4] -> 456.51215277777806 | W252: =RC[-7]*RC[-5] -> 1211.9791666666667 | X252: =RC[-7]*RC[-6] -> 8661.6111111111131 | Y252: =RC[-12]*RC[-12] -> 1.2646876736111115 | Z252: =RC[-12]*RC[-12] -> 261.36111111111103 | AA252: =RC[-12]*RC[-12] -> 22.1684027777778 | AB252: =RC[-12]*RC[-12] -> 156.25 | AC252: =RC[-12]*RC[-12] -> 7980.4444444444462 | AD252: =RC[-12]*RC[-12] -> 9400.9184027777792 | AE252: =RC[-11]/SQRT(RC[-6]*RC[-1]) -> 1.0000000000000002 | AF252: =RC[-11]/SQRT(RC[-6]*RC[-2]) -> 1 | AG252: =RC[-11]/SQRT(RC[-6]*RC[-3]) -> 1 | AH252: =RC[-11]/SQRT(RC[-6]*RC[-4]) -> 1 | AI252: =RC[-11]/SQRT(RC[-6]*RC[-5]) -> 1
A253: 19822 | B253: 北京 | C253: 84 | D253: 良 | E253: 0.79 | F253: 26 | G253: 50 | H253: 52 | I253: 100 | J253: 66 | L253: 2013-06-02T02:00:00.000 | M253: =RC[-8]-R[22]C[-8] -> -1.0845833333333335 | N253: =RC[-8]-R[22]C[-8] -> -12.166666666666664 | O253: =RC[-8]-R[22]C[-8] -> -2.7083333333333357 | P253: =RC[-8]-R[22]C[-8] -> -26.5 | Q253: =RC[-8]-R[22]C[-8] -> -98.333333333333343 | R253: =RC[-8]-R[22]C[-8] -> -93.958333333333343 | T253: =RC[-7]*RC[-2] -> 101.90564236111113 | U253: =RC[-7]*RC[-3] -> 1143.1597222222222 | V253: =RC[-7]*RC[-4] -> 254.47048611111137 | W253: =RC[-7]*RC[-5] -> 2489.8958333333335 | X253: =RC[-7]*RC[-6] -> 9239.2361111111131 | Y253: =RC[-12]*RC[-12] -> 1.1763210069444447 | Z253: =RC[-12]*RC[-12] -> 148.02777777777771 | AA253: =RC[-12]*RC[-12] -> 7.3350694444444571 | AB253: =RC[-12]*RC[-12] -> 702.25 | AC253: =RC[-12]*RC[-12] -> 9669.4444444444471 | AD253: =RC[-12]*RC[-12] -> 8828.1684027777792 | AE253: =RC[-11]/SQRT(RC[-6]*RC[-1]) -> 1 | AF253: =RC[-11]/SQRT(RC[-6]*RC[-2]) -> 1 | AG253: =RC[-11]/SQRT(RC[-6]*RC[-3]) -> 1.0000000000000002 | AH253: =RC[-11]/SQRT(RC[-6]*RC[-4]) -> 1 | AI253: =RC[-11]/SQRT(RC[-6]*RC[-5]) -> 1
A254: 19898 | B254: 北京 | C254: 82 | D254: 良 | E254: 0.94 | F254: 22 | G254: 50 | H254: 45 | I254: 90 | J254: 66 | L254: 2013-06-02T03:00:00.000 | M254: =RC[-8]-R[21]C[-8] -> -0.93458333333333354 | N254: =RC[-8]-R[21]C[-8] -> -16.166666666666664 | O254: =RC[-8]-R[21]C[-8] -> -2.7083333333333357 | P254: =RC[-8]-R[21]C[-8] -> -33.5 | Q254: =RC[-8]-R[21]C[-8] -> -108.33333333333334 | R254: =RC[-8]-R[21]C[-8] -> -93.958333333333343 | T254: =RC[-7]*RC[-2] -> 87.811892361111134 | U254: =RC[-7]*RC[-3] -> 1518.9930555555554 | V254: =RC[-7]*RC[-4] -> 254.47048611111137 | W254: =RC[-7]*RC[-5] -> 3147.604166666667 | X254: =RC[-7]*RC[-6] -> 10178.819444444447 | Y254: =RC[-12]*RC[-12] -> 0.87344600694444485 | Z254: =RC[-12]*RC[-12] -> 261.36111111111103 | AA254: =RC[-12]*RC[-12] -> 7.3350694444444571 | AB254: =RC[-12]*RC[-12] -> 1122.25 | AC254: =RC[-12]*RC[-12] -> 11736.111111111113 | AD254: =RC[-12]*RC[-12] -> 8828.1684027777792 | AE254: =RC[-11]/SQRT(RC[-6]*RC[-1]) -> 1 | AF254: =RC[-11]/SQRT(RC[-6]*RC[-2]) -> 1 | AG254: =RC[-11]/SQRT(RC[-6]*RC[-3]) -> 1.0000000000000002 | AH254: =RC[-11]/SQRT(RC[-6]*RC[-4]) -> 1 | AI254: =RC[-11]/SQRT(RC[-6]*RC[-5]) -> 1.0000000000000002
A255: 19974 | B255: 北京 | C255: 80 | D255: 良 | E255: 1.0900000000000001 | F255: 22 | G255: 56 | H255: 35 | I255: 111 | J255: 68 | L255: 2013-06-02T04:00:00.000 | M255: =RC[-8]-R[20]C[-8] -> -0.78458333333333341 | N255: =RC[-8]-R[20]C[-8] -> -16.166666666666664 | O255: =RC[-8]-R[20]C[-8] -> 3.2916666666666643 | P255: =RC[-8]-R[20]C[-8] -> -43.5 | Q255: =RC[-8]-R[20]C[-8] -> -87.333333333333343 | R255: =RC[-8]-R[20]C[-8] -> -91.958333333333343 | T255: =RC[-7]*RC[-2] -> 72.148975694444459 | U255: =RC[-7]*RC[-3] -> 1486.6597222222222 | V255: =RC[-7]*RC[-4] -> -302.69618055555537 | W255: =RC[-7]*RC[-5] -> 4000.1875000000005 | X255: =RC[-7]*RC[-6] -> 8031.0277777777792 | Y255: =RC[-12]*RC[-12] -> 0.61557100694444455 | Z255: =RC[-12]*RC[-12] -> 261.36111111111103 | AA255: =RC[-12]*RC[-12] -> 10.835069444444429 | AB255: =RC[-12]*RC[-12] -> 1892.25 | AC255: =RC[-12]*RC[-12] -> 7627.1111111111131 | AD255: =RC[-12]*RC[-12] -> 8456.3350694444471 | AE255: =RC[-11]/SQRT(RC[-6]*RC[-1]) -> 1 | AF255: =RC[-11]/SQRT(RC[-6]*RC[-2]) -> 1 | AG255: =RC[-11]/SQRT(RC[-6]*RC[-3]) -> -1 | AH255: =RC[-11]/SQRT(RC[-6]*RC[-4]) -> 0.99999999999999989 | AI255: =RC[-11]/SQRT(RC[-6]*RC[-5]) -> 0.99999999999999989
A256: 20050 | B256: 北京 | C256: 80 | D256: 良 | E256: 1.45 | F256: 23 | G256: 60 | H256: 31 | I256: 172 | J256: 90 | L256: 2013-06-02T05:00:00.000 | M256: =RC[-8]-R[19]C[-8] -> -0.42458333333333353 | N256: =RC[-8]-R[19]C[-8] -> -15.166666666666664 | O256: =RC[-8]-R[19]C[-8] -> 7.2916666666666643 | P256: =RC[-8]-R[19]C[-8] -> -47.5 | Q256: =RC[-8]-R[19]C[-8] -> -26.333333333333343 | R256: =RC[-8]-R[19]C[-8] -> -69.958333333333343 | T256: =RC[-7]*RC[-2] -> 29.70314236111113 | U256: =RC[-7]*RC[-3] -> 1061.0347222222222 | V256: =RC[-7]*RC[-4] -> -510.11284722222211 | W256: =RC[-7]*RC[-5] -> 3323.0208333333339 | X256: =RC[-7]*RC[-6] -> 1842.236111111112 | Y256: =RC[-12]*RC[-12] -> 0.18027100694444462 | Z256: =RC[-12]*RC[-12] -> 230.02777777777771 | AA256: =RC[-12]*RC[-12] -> 53.168402777777743 | AB256: =RC[-12]*RC[-12] -> 2256.25 | AC256: =RC[-12]*RC[-12] -> 693.44444444444491 | AD256: =RC[-12]*RC[-12] -> 4894.1684027777792 | AE256: =RC[-11]/SQRT(RC[-6]*RC[-1]) -> 1 | AF256: =RC[-11]/SQRT(RC[-6]*RC[-2]) -> 1 | AG256: =RC[-11]/SQRT(RC[-6]*RC[-3]) -> -1 | AH256: =RC[-11]/SQRT(RC[-6]*RC[-4]) -> 1 | AI256: =RC[-11]/SQRT(RC[-6]*RC[-5]) -> 1
A257: 20126 | B257: 北京 | C257: 81 | D257: 良 | E257: 1.74 | F257: 27 | G257: 56 | H257: 32 | I257: 216 | J257: 128 | L257: 2013-06-02T06:00:00.000 | M257: =RC[-8]-R[18]C[-8] -> -0.1345833333333335 | N257: =RC[-8]-R[18]C[-8] -> -11.166666666666664 | O257: =RC[-8]-R[18]C[-8] -> 3.2916666666666643 | P257: =RC[-8]-R[18]C[-8] -> -46.5 | Q257: =RC[-8]-R[18]C[-8] -> 17.666666666666657 | R257: =RC[-8]-R[18]C[-8] -> -31.958333333333343 | T257: =RC[-7]*RC[-2] -> 4.301059027777784 | U257: =RC[-7]*RC[-3] -> 356.8680555555556 | V257: =RC[-7]*RC[-4] -> -105.19618055555551 | W257: =RC[-7]*RC[-5] -> 1486.0625000000005 | X257: =RC[-7]*RC[-6] -> -564.59722222222206 | Y257: =RC[-12]*RC[-12] -> 1.8112673611111154E-2 | Z257: =RC[-12]*RC[-12] -> 124.69444444444439 | AA257: =RC[-12]*RC[-12] -> 10.835069444444429 | AB257: =RC[-12]*RC[-12] -> 2162.25 | AC257: =RC[-12]*RC[-12] -> 312.1111111111108 | AD257: =RC[-12]*RC[-12] -> 1021.335069444445 | AE257: =RC[-11]/SQRT(RC[-6]*RC[-1]) -> 1 | AF257: =RC[-11]/SQRT(RC[-6]*RC[-2]) -> 1 | AG257: =RC[-11]/SQRT(RC[-6]*RC[-3]) -> -1.0000000000000002 | AH257: =RC[-11]/SQRT(RC[-6]*RC[-4]) -> 1 | AI257: =RC[-11]/SQRT(RC[-6]*RC[-5]) -> -0.99999999999999978
A258: 20202 | B258: 北京 | C258: 82 | D258: 良 | E258: 1.85 | F258: 32 | G258: 57 | H258: 37 | I258: 205 | J258: 148 | L258: 2013-06-02T07:00:00.000 | M258: =RC[-8]-R[17]C[-8] -> -2.4583333333333401E-2 | N258: =RC[-8]-R[17]C[-8] -> -6.1666666666666643 | O258: =RC[-8]-R[17]C[-8] -> 4.2916666666666643 | P258: =RC[-8]-R[17]C[-8] -> -41.5 | Q258: =RC[-8]-R[17]C[-8] -> 6.6666666666666572 | R258: =RC[-8]-R[17]C[-8] -> -11.958333333333343 | T258: =RC[-7]*RC[-2] -> 0.29397569444444549 | U258: =RC[-7]*RC[-3] -> 73.743055555555586 | V258: =RC[-7]*RC[-4] -> -51.321180555555571 | W258: =RC[-7]*RC[-5] -> 496.27083333333371 | X258: =RC[-7]*RC[-6] -> -79.722222222222172 | Y258: =RC[-12]*RC[-12] -> 6.0434027777778111E-4 | Z258: =RC[-12]*RC[-12] -> 38.02777777777775 | AA258: =RC[-12]*RC[-12] -> 18.418402777777757 | AB258: =RC[-12]*RC[-12] -> 1722.25 | AC258: =RC[-12]*RC[-12] -> 44.444444444444315 | AD258: =RC[-12]*RC[-12] -> 143.00173611111134 | AE258: =RC[-11]/SQRT(RC[-6]*RC[-1]) -> 1 | AF258: =RC[-11]/SQRT(RC[-6]*RC[-2]) -> 1 | AG258: =RC[-11]/SQRT(RC[-6]*RC[-3]) -> -1 | AH258: =RC[-11]/SQRT(RC[-6]*RC[-4]) -> 1 | AI258: =RC[-11]/SQRT(RC[-6]*RC[-5]) -> -1
A259: 20278 | B259: 北京 | C259: 84 | D259: 良 | E259: 2.0699999999999998 | F259: 43 | G259: 56 | H259: 47 | I259: 221 | J259: 180 | L259: 2013-06-02T08:00:00.000 | M259: =RC[-8]-R[16]C[-8] -> 0.19541666666666635 | N259: =RC[-8]-R[16]C[-8] -> 4.8333333333333357 | O259: =RC[-8]-R[16]C[-8] -> 3.2916666666666643 | P259: =RC[-8]-R[16]C[-8] -> -31.5 | Q259: =RC[-8]-R[16]C[-8] -> 22.666666666666657 | R259: =RC[-8]-R[16]C[-8] -> 20.041666666666657 | T259: =RC[-7]*RC[-2] -> 3.9164756944444363 | U259: =RC[-7]*RC[-3] -> 96.868055555555557 | V259: =RC[-7]*RC[-4] -> 65.970486111111029 | W259: =RC[-7]*RC[-5] -> -631.31249999999966 | X259: =RC[-7]*RC[-6] -> 454.27777777777737 | Y259: =RC[-12]*RC[-12] -> 3.8187673611110987E-2 | Z259: =RC[-12]*RC[-12] -> 23.361111111111136 | AA259: =RC[-12]*RC[-12] -> 10.835069444444429 | AB259: =RC[-12]*RC[-12] -> 992.25 | AC259: =RC[-12]*RC[-12] -> 513.77777777777737 | AD259: =RC[-12]*RC[-12] -> 401.66840277777737 | AE259: =RC[-11]/SQRT(RC[-6]*RC[-1]) -> 1.0000000000000002 | AF259: =RC[-11]/SQRT(RC[-6]*RC[-2]) -> 1 | AG259: =RC[-11]/SQRT(RC[-6]*RC[-3]) -> 1 | AH259: =RC[-11]/SQRT(RC[-6]*RC[-4]) -> -1 | AI259: =RC[-11]/SQRT(RC[-6]*RC[-5]) -> 1
A260: 20354 | B260: 北京 | C260: 88 | D260: 良 | E260: 2.4 | F260: 56 | G260: 53 | H260: 60 | I260: 259 | J260: 209 | L260: 2013-06-02T09:00:00.000 | M260: =RC[-8]-R[15]C[-8] -> 0.52541666666666642 | N260: =RC[-8]-R[15]C[-8] -> 17.833333333333336 | O260: =RC[-8]-R[15]C[-8] -> 0.2916666666666643 | P260: =RC[-8]-R[15]C[-8] -> -18.5 | Q260: =RC[-8]-R[15]C[-8] -> 60.666666666666657 | R260: =RC[-8]-R[15]C[-8] -> 49.041666666666657 | T260: =RC[-7]*RC[-2] -> 25.76730902777776 | U260: =RC[-7]*RC[-3] -> 874.5763888888888 | V260: =RC[-7]*RC[-4] -> 14.303819444444326 | W260: =RC[-7]*RC[-5] -> -907.27083333333314 | X260: =RC[-7]*RC[-6] -> 2975.1944444444434 | Y260: =RC[-12]*RC[-12] -> 0.27606267361111086 | Z260: =RC[-12]*RC[-12] -> 318.02777777777789 | AA260: =RC[-12]*RC[-12] -> 8.506944444444306E-2 | AB260: =RC[-12]*RC[-12] -> 342.25 | AC260: =RC[-12]*RC[-12] -> 3680.4444444444434 | AD260: =RC[-12]*RC[-12] -> 2405.0850694444434 | AE260: =RC[-11]/SQRT(RC[-6]*RC[-1]) -> 1 | AF260: =RC[-11]/SQRT(RC[-6]*RC[-2]) -> 0.99999999999999989 | AG260: =RC[-11]/SQRT(RC[-6]*RC[-3]) -> 1 | AH260: =RC[-11]/SQRT(RC[-6]*RC[-4]) -> -1 | AI260: =RC[-11]/SQRT(RC[-6]*RC[-5]) -> 1
A261: 20430 | B261: 北京 | C261: 96 | D261: 良 | E261: 2.58 | F261: 52 | G261: 60 | H261: 58 | I261: 264 | J261: 220 | L261: 2013-06-02T10:00:00.000 | M261: =RC[-8]-R[14]C[-8] -> 0.70541666666666658 | N261: =RC[-8]-R[14]C[-8] -> 13.833333333333336 | O261: =RC[-8]-R[14]C[-8] -> 7.2916666666666643 | P261: =RC[-8]-R[14]C[-8] -> -20.5 | Q261: =RC[-8]-R[14]C[-8] -> 65.666666666666657 | R261: =RC[-8]-R[14]C[-8] -> 60.041666666666657 | T261: =RC[-7]*RC[-2] -> 42.354392361111103 | U261: =RC[-7]*RC[-3] -> 830.57638888888891 | V261: =RC[-7]*RC[-4] -> 437.80381944444423 | W261: =RC[-7]*RC[-5] -> -1230.8541666666665 | X261: =RC[-7]*RC[-6] -> 3942.7361111111099 | Y261: =RC[-12]*RC[-12] -> 0.497612673611111 | Z261: =RC[-12]*RC[-12] -> 191.36111111111117 | AA261: =RC[-12]*RC[-12] -> 53.168402777777743 | AB261: =RC[-12]*RC[-12] -> 420.25 | AC261: =RC[-12]*RC[-12] -> 4312.1111111111095 | AD261: =RC[-12]*RC[-12] -> 3605.0017361111099 | AE261: =RC[-11]/SQRT(RC[-6]*RC[-1]) -> 1 | AF261: =RC[-11]/SQRT(RC[-6]*RC[-2]) -> 1 | AG261: =RC[-11]/SQRT(RC[-6]*RC[-3]) -> 1 | AH261: =RC[-11]/SQRT(RC[-6]*RC[-4]) -> -1 | AI261: =RC[-11]/SQRT(RC[-6]*RC[-5]) -> 1
A262: 20506 | B262: 北京 | C262: 107 | D262: 轻度污染 | E262: 2.78 | F262: 53 | G262: 62 | H262: 59 | I262: 279 | J262: 242 | L262: 2013-06-02T11:00:00.000 | M262: =RC[-8]-R[13]C[-8] -> 0.90541666666666631 | N262: =RC[-8]-R[13]C[-8] -> 14.833333333333336 | O262: =RC[-8]-R[13]C[-8] -> 9.2916666666666643 | P262: =RC[-8]-R[13]C[-8] -> -19.5 | Q262: =RC[-8]-R[13]C[-8] -> 80.666666666666657 | R262: =RC[-8]-R[13]C[-8] -> 82.041666666666657 | T262: =RC[-7]*RC[-2] -> 74.281892361111076 | U262: =RC[-7]*RC[-3] -> 1216.9513888888889 | V262: =RC[-7]*RC[-4] -> 762.30381944444412 | W262: =RC[-7]*RC[-5] -> -1599.8124999999998 | X262: =RC[-7]*RC[-6] -> 6618.0277777777765 | Y262: =RC[-12]*RC[-12] -> 0.8197793402777771 | Z262: =RC[-12]*RC[-12] -> 220.02777777777786 | AA262: =RC[-12]*RC[-12] -> 86.3350694444444 | AB262: =RC[-12]*RC[-12] -> 380.25 | AC262: =RC[-12]*RC[-12] -> 6507.1111111111095 | AD262: =RC[-12]*RC[-12] -> 6730.8350694444425 | AE262: =RC[-11]/SQRT(RC[-6]*RC[-1]) -> 1 | AF262: =RC[-11]/SQRT(RC[-6]*RC[-2]) -> 1 | AG262: =RC[-11]/SQRT(RC[-6]*RC[-3]) -> 1 | AH262: =RC[-11]/SQRT(RC[-6]*RC[-4]) -> -1 | AI262: =RC[-11]/SQRT(RC[-6]*RC[-5]) -> 1.0000000000000002
A263: 20582 | B263: 北京 | C263: 119 | D263: 轻度污染 | E263: 2.87 | F263: 54 | G263: 60 | H263: 69 | I263: 279 | J263: 246 | L263: 2013-06-02T12:00:00.000 | M263: =RC[-8]-R[12]C[-8] -> 0.99541666666666662 | N263: =RC[-8]-R[12]C[-8] -> 15.833333333333336 | O263: =RC[-8]-R[12]C[-8] -> 7.2916666666666643 | P263: =RC[-8]-R[12]C[-8] -> -9.5 | Q263: =RC[-8]-R[12]C[-8] -> 80.666666666666657 | R263: =RC[-8]-R[12]C[-8] -> 86.041666666666657 | T263: =RC[-7]*RC[-2] -> 85.647309027777766 | U263: =RC[-7]*RC[-3] -> 1362.3263888888889 | V263: =RC[-7]*RC[-4] -> 627.38715277777749 | W263: =RC[-7]*RC[-5] -> -817.39583333333326 | X263: =RC[-7]*RC[-6] -> 6940.6944444444425 | Y263: =RC[-12]*RC[-12] -> 0.99085434027777763 | Z263: =RC[-12]*RC[-12] -> 250.69444444444451 | AA263: =RC[-12]*RC[-12] -> 53.168402777777743 | AB263: =RC[-12]*RC[-12] -> 90.25 | AC263: =RC[-12]*RC[-12] -> 6507.1111111111095 | AD263: =RC[-12]*RC[-12] -> 7403.1684027777765 | AE263: =RC[-11]/SQRT(RC[-6]*RC[-1]) -> 1 | AF263: =RC[-11]/SQRT(RC[-6]*RC[-2]) -> 1 | AG263: =RC[-11]/SQRT(RC[-6]*RC[-3]) -> 1 | AH263: =RC[-11]/SQRT(RC[-6]*RC[-4]) -> -1 | AI263: =RC[-11]/SQRT(RC[-6]*RC[-5]) -> 0.99999999999999989
A264: 20658 | B264: 北京 | C264: 131 | D264: 轻度污染 | E264: 2.87 | F264: 43 | G264: 57 | H264: 84 | I264: 289 | J264: 248 | L264: 2013-06-02T13:00:00.000 | M264: =RC[-8]-R[11]C[-8] -> 0.99541666666666662 | N264: =RC[-8]-R[11]C[-8] -> 4.8333333333333357 | O264: =RC[-8]-R[11]C[-8] -> 4.2916666666666643 | P264: =RC[-8]-R[11]C[-8] -> 5.5 | Q264: =RC[-8]-R[11]C[-8] -> 90.666666666666657 | R264: =RC[-8]-R[11]C[-8] -> 88.041666666666657 | T264: =RC[-7]*RC[-2] -> 87.638142361111093 | U264: =RC[-7]*RC[-3] -> 425.5347222222224 | V264: =RC[-7]*RC[-4] -> 377.84548611111086 | W264: =RC[-7]*RC[-5] -> 484.22916666666663 | X264: =RC[-7]*RC[-6] -> 7982.4444444444425 | Y264: =RC[-12]*RC[-12] -> 0.99085434027777763 | Z264: =RC[-12]*RC[-12] -> 23.361111111111136 | AA264: =RC[-12]*RC[-12] -> 18.418402777777757 | AB264: =RC[-12]*RC[-12] -> 30.25 | AC264: =RC[-12]*RC[-12] -> 8220.4444444444434 | AD264: =RC[-12]*RC[-12] -> 7751.3350694444425 | AE264: =RC[-11]/SQRT(RC[-6]*RC[-1]) -> 1 | AF264: =RC[-11]/SQRT(RC[-6]*RC[-2]) -> 1 | AG264: =RC[-11]/SQRT(RC[-6]*RC[-3]) -> 1 | AH264: =RC[-11]/SQRT(RC[-6]*RC[-4]) -> 1.0000000000000002 | AI264: =RC[-11]/SQRT(RC[-6]*RC[-5]) -> 0.99999999999999989
A265: 20734 | B265: 北京 | C265: 143 | D265: 轻度污染 | E265: 2.82 | F265: 54 | G265: 52 | H265: 106 | I265: 285 | J265: 250 | L265: 2013-06-02T14:00:00.000 | M265: =RC[-8]-R[10]C[-8] -> 0.94541666666666635 | N265: =RC[-8]-R[10]C[-8] -> 15.833333333333336 | O265: =RC[-8]-R[10]C[-8] -> -0.7083333333333357 | P265: =RC[-8]-R[10]C[-8] -> 27.5 | Q265: =RC[-8]-R[10]C[-8] -> 86.666666666666657 | R265: =RC[-8]-R[10]C[-8] -> 90.041666666666657 | T265: =RC[-7]*RC[-2] -> 85.126892361111075 | U265: =RC[-7]*RC[-3] -> 1425.6597222222224 | V265: =RC[-7]*RC[-4] -> -63.779513888889099 | W265: =RC[-7]*RC[-5] -> 2476.145833333333 | X265: =RC[-7]*RC[-6] -> 7803.6111111111095 | Y265: =RC[-12]*RC[-12] -> 0.8938126736111105 | Z265: =RC[-12]*RC[-12] -> 250.69444444444451 | AA265: =RC[-12]*RC[-12] -> 0.50173611111111449 | AB265: =RC[-12]*RC[-12] -> 756.25 | AC265: =RC[-12]*RC[-12] -> 7511.1111111111095 | AD265: =RC[-12]*RC[-12] -> 8107.5017361111095 | AE265: =RC[-11]/SQRT(RC[-6]*RC[-1]) -> 1 | AF265: =RC[-11]/SQRT(RC[-6]*RC[-2]) -> 1.0000000000000002 | AG265: =RC[-11]/SQRT(RC[-6]*RC[-3]) -> -1 | AH265: =RC[-11]/SQRT(RC[-6]*RC[-4]) -> 1 | AI265: =RC[-11]/SQRT(RC[-6]*RC[-5]) -> 1
A266: 20810 | B266: 北京 | C266: 154 | D266: 中度污染 | E266: 2.54 | F266: 47 | G266: 48 | H266: 122 | I266: 285 | J266: 238 | L266: 2013-06-02T15:00:00.000 | M266: =RC[-8]-R[9]C[-8] -> 0.66541666666666655 | N266: =RC[-8]-R[9]C[-8] -> 8.8333333333333357 | O266: =RC[-8]-R[9]C[-8] -> -4.7083333333333357 | P266: =RC[-8]-R[9]C[-8] -> 43.5 | Q266: =RC[-8]-R[9]C[-8] -> 86.666666666666657 | R266: =RC[-8]-R[9]C[-8] -> 78.041666666666657 | T266: =RC[-7]*RC[-2] -> 51.930225694444431 | U266: =RC[-7]*RC[-3] -> 689.36805555555566 | V266: =RC[-7]*RC[-4] -> -367.44618055555571 | W266: =RC[-7]*RC[-5] -> 3394.8124999999995 | X266: =RC[-7]*RC[-6] -> 6763.6111111111095 | Y266: =RC[-12]*RC[-12] -> 0.4427793402777776 | Z266: =RC[-12]*RC[-12] -> 78.027777777777814 | AA266: =RC[-12]*RC[-12] -> 22.1684027777778 | AB266: =RC[-12]*RC[-12] -> 1892.25 | AC266: =RC[-12]*RC[-12] -> 7511.1111111111095 | AD266: =RC[-12]*RC[-12] -> 6090.5017361111095 | AE266: =RC[-11]/SQRT(RC[-6]*RC[-1]) -> 1.0000000000000002 | AF266: =RC[-11]/SQRT(RC[-6]*RC[-2]) -> 1 | AG266: =RC[-11]/SQRT(RC[-6]*RC[-3]) -> -1.0000000000000002 | AH266: =RC[-11]/SQRT(RC[-6]*RC[-4]) -> 1 | AI266: =RC[-11]/SQRT(RC[-6]*RC[-5]) -> 1
A267: 20886 | B267: 北京 | C267: 165 | D267: 中度污染 | E267: 2.2200000000000002 | F267: 43 | G267: 47 | H267: 126 | I267: 258 | J267: 212 | L267: 2013-06-02T16:00:00.000 | M267: =RC[-8]-R[8]C[-8] -> 0.34541666666666671 | N267: =RC[-8]-R[8]C[-8] -> 4.8333333333333357 | O267: =RC[-8]-R[8]C[-8] -> -5.7083333333333357 | P267: =RC[-8]-R[8]C[-8] -> 47.5 | Q267: =RC[-8]-R[8]C[-8] -> 59.666666666666657 | R267: =RC[-8]-R[8]C[-8] -> 52.041666666666657 | T267: =RC[-7]*RC[-2] -> 17.976059027777776 | U267: =RC[-7]*RC[-3] -> 251.53472222222231 | V267: =RC[-7]*RC[-4] -> -297.0711805555556 | W267: =RC[-7]*RC[-5] -> 2471.9791666666661 | X267: =RC[-7]*RC[-6] -> 3105.1527777777769 | Y267: =RC[-12]*RC[-12] -> 0.11931267361111114 | Z267: =RC[-12]*RC[-12] -> 23.361111111111136 | AA267: =RC[-12]*RC[-12] -> 32.585069444444471 | AB267: =RC[-12]*RC[-12] -> 2256.25 | AC267: =RC[-12]*RC[-12] -> 3560.1111111111099 | AD267: =RC[-12]*RC[-12] -> 2708.3350694444434 | AE267: =RC[-11]/SQRT(RC[-6]*RC[-1]) -> 1 | AF267: =RC[-11]/SQRT(RC[-6]*RC[-2]) -> 1 | AG267: =RC[-11]/SQRT(RC[-6]*RC[-3]) -> -1 | AH267: =RC[-11]/SQRT(RC[-6]*RC[-4]) -> 1 | AI267: =RC[-11]/SQRT(RC[-6]*RC[-5]) -> 1
A268: 20962 | B268: 北京 | C268: 175 | D268: 中度污染 | E268: 1.98 | F268: 42 | G268: 48 | H268: 128 | I268: 246 | J268: 180 | L268: 2013-06-02T17:00:00.000 | M268: =RC[-8]-R[7]C[-8] -> 0.10541666666666649 | N268: =RC[-8]-R[7]C[-8] -> 3.8333333333333357 | O268: =RC[-8]-R[7]C[-8] -> -4.7083333333333357 | P268: =RC[-8]-R[7]C[-8] -> 49.5 | Q268: =RC[-8]-R[7]C[-8] -> 47.666666666666657 | R268: =RC[-8]-R[7]C[-8] -> 20.041666666666657 | T268: =RC[-7]*RC[-2] -> 2.1127256944444399 | U268: =RC[-7]*RC[-3] -> 76.8263888888889 | V268: =RC[-7]*RC[-4] -> -94.362847222222229 | W268: =RC[-7]*RC[-5] -> 992.06249999999955 | X268: =RC[-7]*RC[-6] -> 955.31944444444377 | Y268: =RC[-12]*RC[-12] -> 1.1112673611111075E-2 | Z268: =RC[-12]*RC[-12] -> 14.694444444444462 | AA268: =RC[-12]*RC[-12] -> 22.1684027777778 | AB268: =RC[-12]*RC[-12] -> 2450.25 | AC268: =RC[-12]*RC[-12] -> 2272.1111111111104 | AD268: =RC[-12]*RC[-12] -> 401.66840277777737 | AE268: =RC[-11]/SQRT(RC[-6]*RC[-1]) -> 1 | AF268: =RC[-11]/SQRT(RC[-6]*RC[-2]) -> 1 | AG268: =RC[-11]/SQRT(RC[-6]*RC[-3]) -> -1 | AH268: =RC[-11]/SQRT(RC[-6]*RC[-4]) -> 1.0000000000000002 | AI268: =RC[-11]/SQRT(RC[-6]*RC[-5]) -> 1
A269: 21038 | B269: 北京 | C269: 184 | D269: 中度污染 | E269: 1.76 | F269: 48 | G269: 48 | H269: 140 | I269: 196 | J269: 168 | L269: 2013-06-02T18:00:00.000 | M269: =RC[-8]-R[6]C[-8] -> -0.11458333333333348 | N269: =RC[-8]-R[6]C[-8] -> 9.8333333333333357 | O269: =RC[-8]-R[6]C[-8] -> -4.7083333333333357 | P269: =RC[-8]-R[6]C[-8] -> 61.5 | Q269: =RC[-8]-R[6]C[-8] -> -2.3333333333333428 | R269: =RC[-8]-R[6]C[-8] -> 8.0416666666666572 | T269: =RC[-7]*RC[-2] -> -0.92144097222222232 | U269: =RC[-7]*RC[-3] -> 79.076388888888815 | V269: =RC[-7]*RC[-4] -> -37.8628472222222 | W269: =RC[-7]*RC[-5] -> 494.56249999999943 | X269: =RC[-7]*RC[-6] -> -18.763888888888943 | Y269: =RC[-12]*RC[-12] -> 1.3129340277777811E-2 | Z269: =RC[-12]*RC[-12] -> 96.694444444444485 | AA269: =RC[-12]*RC[-12] -> 22.1684027777778 | AB269: =RC[-12]*RC[-12] -> 3782.25 | AC269: =RC[-12]*RC[-12] -> 5.4444444444444891 | AD269: =RC[-12]*RC[-12] -> 64.668402777777629 | AE269: =RC[-11]/SQRT(RC[-6]*RC[-1]) -> -1 | AF269: =RC[-11]/SQRT(RC[-6]*RC[-2]) -> 1 | AG269: =RC[-11]/SQRT(RC[-6]*RC[-3]) -> -1 | AH269: =RC[-11]/SQRT(RC[-6]*RC[-4]) -> 1 | AI269: =RC[-11]/SQRT(RC[-6]*RC[-5]) -> -0.99999999999999978
A270: 21114 | B270: 北京 | C270: 190 | D270: 中度污染 | E270: 1.74 | F270: 45 | G270: 50 | H270: 131 | I270: 174 | J270: 156 | L270: 2013-06-02T19:00:00.000 | M270: =RC[-8]-R[5]C[-8] -> -0.1345833333333335 | N270: =RC[-8]-R[5]C[-8] -> 6.8333333333333357 | O270: =RC[-8]-R[5]C[-8] -> -2.7083333333333357 | P270: =RC[-8]-R[5]C[-8] -> 52.5 | Q270: =RC[-8]-R[5]C[-8] -> -24.333333333333343 | R270: =RC[-8]-R[5]C[-8] -> -3.9583333333333428 | T270: =RC[-7]*RC[-2] -> 0.5327256944444464 | U270: =RC[-7]*RC[-3] -> -27.048611111111185 | V270: =RC[-7]*RC[-4] -> 10.720486111111146 | W270: =RC[-7]*RC[-5] -> -207.81250000000051 | X270: =RC[-7]*RC[-6] -> 96.319444444444713 | Y270: =RC[-12]*RC[-12] -> 1.8112673611111154E-2 | Z270: =RC[-12]*RC[-12] -> 46.694444444444478 | AA270: =RC[-12]*RC[-12] -> 7.3350694444444571 | AB270: =RC[-12]*RC[-12] -> 2756.25 | AC270: =RC[-12]*RC[-12] -> 592.11111111111154 | AD270: =RC[-12]*RC[-12] -> 15.668402777777853 | AE270: =RC[-11]/SQRT(RC[-6]*RC[-1]) -> 1.0000000000000002 | AF270: =RC[-11]/SQRT(RC[-6]*RC[-2]) -> -1 | AG270: =RC[-11]/SQRT(RC[-6]*RC[-3]) -> 1 | AH270: =RC[-11]/SQRT(RC[-6]*RC[-4]) -> -1 | AI270: =RC[-11]/SQRT(RC[-6]*RC[-5]) -> 1
A271: 21190 | B271: 北京 | C271: 196 | D271: 中度污染 | E271: 1.81 | F271: 40 | G271: 51 | H271: 116 | I271: 178 | J271: 152 | L271: 2013-06-02T20:00:00.000 | M271: =RC[-8]-R[4]C[-8] -> -6.4583333333333437E-2 | N271: =RC[-8]-R[4]C[-8] -> 1.8333333333333357 | O271: =RC[-8]-R[4]C[-8] -> -1.7083333333333357 | P271: =RC[-8]-R[4]C[-8] -> 37.5 | Q271: =RC[-8]-R[4]C[-8] -> -20.333333333333343 | R271: =RC[-8]-R[4]C[-8] -> -7.9583333333333428 | T271: =RC[-7]*RC[-2] -> 0.51397569444444591 | U271: =RC[-7]*RC[-3] -> -14.590277777777814 | V271: =RC[-7]*RC[-4] -> 13.595486111111146 | W271: =RC[-7]*RC[-5] -> -298.43750000000034 | X271: =RC[-7]*RC[-6] -> 161.81944444444471 | Y271: =RC[-12]*RC[-12] -> 4.1710069444444581E-3 | Z271: =RC[-12]*RC[-12] -> 3.3611111111111196 | AA271: =RC[-12]*RC[-12] -> 2.9184027777777857 | AB271: =RC[-12]*RC[-12] -> 1406.25 | AC271: =RC[-12]*RC[-12] -> 413.44444444444485 | AD271: =RC[-12]*RC[-12] -> 63.335069444444592 | AE271: =RC[-11]/SQRT(RC[-6]*RC[-1]) -> 1 | AF271: =RC[-11]/SQRT(RC[-6]*RC[-2]) -> -1.0000000000000002 | AG271: =RC[-11]/SQRT(RC[-6]*RC[-3]) -> 1 | AH271: =RC[-11]/SQRT(RC[-6]*RC[-4]) -> -1 | AI271: =RC[-11]/SQRT(RC[-6]*RC[-5]) -> 1
A272: 21266 | B272: 北京 | C272: 201 | D272: 重度污染 | E272: 1.8 | F272: 38 | G272: 51 | H272: 100 | I272: 168 | J272: 151 | L272: 2013-06-02T21:00:00.000 | M272: =RC[-8]-R[3]C[-8] -> -7.4583333333333446E-2 | N272: =RC[-8]-R[3]C[-8] -> -0.1666666666666643 | O272: =RC[-8]-R[3]C[-8] -> -1.7083333333333357 | P272: =RC[-8]-R[3]C[-8] -> 21.5 | Q272: =RC[-8]-R[3]C[-8] -> -30.333333333333343 | R272: =RC[-8]-R[3]C[-8] -> -8.9583333333333428 | T272: =RC[-7]*RC[-2] -> 0.6681423611111128 | U272: =RC[-7]*RC[-3] -> 1.4930555555555358 | V272: =RC[-7]*RC[-4] -> 15.303819444444482 | W272: =RC[-7]*RC[-5] -> -192.60416666666686 | X272: =RC[-7]*RC[-6] -> 271.73611111111148 | Y272: =RC[-12]*RC[-12] -> 5.5626736111111276E-3 | Z272: =RC[-12]*RC[-12] -> 2.7777777777776989E-2 | AA272: =RC[-12]*RC[-12] -> 2.9184027777777857 | AB272: =RC[-12]*RC[-12] -> 462.25 | AC272: =RC[-12]*RC[-12] -> 920.11111111111165 | AD272: =RC[-12]*RC[-12] -> 80.251736111111285 | AE272: =RC[-11]/SQRT(RC[-6]*RC[-1]) -> 1 | AF272: =RC[-11]/SQRT(RC[-6]*RC[-2]) -> 0.99999999999999989 | AG272: =RC[-11]/SQRT(RC[-6]*RC[-3]) -> 1 | AH272: =RC[-11]/SQRT(RC[-6]*RC[-4]) -> -1 | AI272: =RC[-11]/SQRT(RC[-6]*RC[-5]) -> 1
A273: 21342 | B273: 北京 | C273: 207 | D273: 重度污染 | E273: 1.69 | F273: 34 | G273: 48 | H273: 87 | I273: 133 | J273: 153 | L273: 2013-06-02T22:00:00.000 | M273: =RC[-8]-R[2]C[-8] -> -0.18458333333333354 | N273: =RC[-8]-R[2]C[-8] -> -4.1666666666666643 | O273: =RC[-8]-R[2]C[-8] -> -4.7083333333333357 | P273: =RC[-8]-R[2]C[-8] -> 8.5 | Q273: =RC[-8]-R[2]C[-8] -> -65.333333333333343 | R273: =RC[-8]-R[2]C[-8] -> -6.9583333333333428 | T273: =RC[-7]*RC[-2] -> 1.2843923611111143 | U273: =RC[-7]*RC[-3] -> 28.993055555555578 | V273: =RC[-7]*RC[-4] -> 32.762152777777835 | W273: =RC[-7]*RC[-5] -> -59.145833333333414 | X273: =RC[-7]*RC[-6] -> 454.61111111111177 | Y273: =RC[-12]*RC[-12] -> 3.4071006944444523E-2 | Z273: =RC[-12]*RC[-12] -> 17.361111111111093 | AA273: =RC[-12]*RC[-12] -> 22.1684027777778 | AB273: =RC[-12]*RC[-12] -> 72.25 | AC273: =RC[-12]*RC[-12] -> 4268.4444444444453 | AD273: =RC[-12]*RC[-12] -> 48.418402777777906 | AE273: =RC[-11]/SQRT(RC[-6]*RC[-1]) -> 1 | AF273: =RC[-11]/SQRT(RC[-6]*RC[-2]) -> 1 | AG273: =RC[-11]/SQRT(RC[-6]*RC[-3]) -> 1 | AH273: =RC[-11]/SQRT(RC[-6]*RC[-4]) -> -1 | AI273: =RC[-11]/SQRT(RC[-6]*RC[-5]) -> 1
A274: 21418 | B274: 北京 | C274: 211 | D274: 重度污染 | E274: 1.74 | F274: 30 | G274: 46 | H274: 76 | I274: 139 | J274: 146 | L274: 2013-06-02T23:00:00.000 | M274: =RC[-8]-R[1]C[-8] -> -0.1345833333333335 | N274: =RC[-8]-R[1]C[-8] -> -8.1666666666666643 | O274: =RC[-8]-R[1]C[-8] -> -6.7083333333333357 | P274: =RC[-8]-R[1]C[-8] -> -2.5 | Q274: =RC[-8]-R[1]C[-8] -> -59.333333333333343 | R274: =RC[-8]-R[1]C[-8] -> -13.958333333333343 | T274: =RC[-7]*RC[-2] -> 1.8785590277777813 | U274: =RC[-7]*RC[-3] -> 113.9930555555556 | V274: =RC[-7]*RC[-4] -> 93.637152777777871 | W274: =RC[-7]*RC[-5] -> 34.895833333333357 | X274: =RC[-7]*RC[-6] -> 828.19444444444514 | Y274: =RC[-12]*RC[-12] -> 1.8112673611111154E-2 | Z274: =RC[-12]*RC[-12] -> 66.6944444444444 | AA274: =RC[-12]*RC[-12] -> 45.001736111111143 | AB274: =RC[-12]*RC[-12] -> 6.25 | AC274: =RC[-12]*RC[-12] -> 3520.4444444444457 | AD274: =RC[-12]*RC[-12] -> 194.83506944444471 | AE274: =RC[-11]/SQRT(RC[-6]*RC[-1]) -> 1 | AF274: =RC[-11]/SQRT(RC[-6]*RC[-2]) -> 1 | AG274: =RC[-11]/SQRT(RC[-6]*RC[-3]) -> 0.99999999999999989 | AH274: =RC[-11]/SQRT(RC[-6]*RC[-4]) -> 1 | AI274: =RC[-11]/SQRT(RC[-6]*RC[-5]) -> 1
E275: =AVERAGE(R[-24]C:R[-1]C) -> 1.8745833333333335 | F275: =AVERAGE(R[-24]C:R[-1]C) -> 38.166666666666664 | G275: =AVERAGE(R[-24]C:R[-1]C) -> 52.708333333333336 | H275: =AVERAGE(R[-24]C:R[-1]C) -> 78.5 | I275: =AVERAGE(R[-24]C:R[-1]C) -> 198.33333333333334 | J275: =AVERAGE(R[-24]C:R[-1]C) -> 159.95833333333334 | M275: =RC[-8]-RC[-8] -> 0 | N275: =RC[-8]-RC[-8] -> 0 | O275: =RC[-8]-RC[-8] -> 0 | P275: =RC[-8]-RC[-8] -> 0 | Q275: =RC[-8]-RC[-8] -> 0 | R275: =RC[-8]-RC[-8] -> 0 | T275: =SUM(R[-24]C:R[-2]C) -> 1001.6060243055556 | U275: =SUM(R[-24]C:R[-2]C) -> 16360.173611111108 | V275: =SUM(R[-24]C:R[-2]C) -> 1666.071180555555 | W275: =SUM(R[-24]C:R[-2]C) -> 20675.604166666664 | X275: =SUM(R[-24]C:R[-2]C) -> 95339.138888888861 | Y275: =SUM(R[-24]C:R[-2]C) -> 10.640683159722219 | Z275: =SUM(R[-24]C:R[-2]C) -> 3212.6388888888887 | AA275: =SUM(R[-24]C:R[-2]C) -> 489.95659722222229 | AB275: =SUM(R[-24]C:R[-2]C) -> 28105.75 | AC275: =SUM(R[-24]C:R[-2]C) -> 103756.88888888885 | AD275: =SUM(R[-24]C:R[-2]C) -> 97642.123263888891 | AE275: =RC[-11]/SQRT(RC[-6]*RC[-1]) -> 0.9826380223495127 | AF275: =RC[-11]/SQRT(RC[-6]*RC[-2]) -> 0.92371574115741362 | AG275: =RC[-11]/SQRT(RC[-6]*RC[-3]) -> 0.24087744715492024 | AH275: =RC[-11]/SQRT(RC[-6]*RC[-4]) -> 0.39467717612552022 | AI275: =RC[-11]/SQRT(RC[-6]*RC[-5]) -> 0.94720536031806257
A276: 21494 | B276: 北京 | C276: 215 | D276: 重度污染 | E276: 1.65 | F276: 24 | G276: 44 | H276: 70 | I276: 138 | J276: 145 | L276: 2013-06-03T00:00:00.000 | M276: =RC[-8]-R[24]C[-8] -> 0.25874999999999981 | N276: =RC[-8]-R[24]C[-8] -> 4.75 | O276: =RC[-8]-R[24]C[-8] -> -3.3333333333333357 | P276: =RC[-8]-R[24]C[-8] -> -52.083333333333329 | Q276: =RC[-8]-R[24]C[-8] -> -6.5833333333333428 | R276: =RC[-8]-R[24]C[-8] -> 19.583333333333329 | T276: =RC[-7]*RC[-2] -> 5.0671874999999948 | U276: =RC[-7]*RC[-3] -> 93.020833333333314 | V276: =RC[-7]*RC[-4] -> -65.277777777777814 | W276: =RC[-7]*RC[-5] -> -1019.9652777777775 | X276: =RC[-7]*RC[-6] -> -128.92361111111126 | Y276: =RC[-12]*RC[-12] -> 6.6951562499999909E-2 | Z276: =RC[-12]*RC[-12] -> 22.5625 | AA276: =RC[-12]*RC[-12] -> 11.111111111111127 | AB276: =RC[-12]*RC[-12] -> 2712.6736111111104 | AC276: =RC[-12]*RC[-12] -> 43.340277777777899 | AD276: =RC[-12]*RC[-12] -> 383.50694444444429 | AE276: =RC[-11]/SQRT(RC[-6]*RC[-1]) -> 0.99999999999999978 | AF276: =RC[-11]/SQRT(RC[-6]*RC[-2]) -> 1 | AG276: =RC[-11]/SQRT(RC[-6]*RC[-3]) -> -1 | AH276: =RC[-11]/SQRT(RC[-6]*RC[-4]) -> -1.0000000000000002 | AI276: =RC[-11]/SQRT(RC[-6]*RC[-5]) -> -1
A277: 21570 | B277: 北京 | C277: 219 | D277: 重度污染 | E277: 1.61 | F277: 20 | G277: 46 | H277: 61 | I277: 154 | J277: 159 | L277: 2013-06-03T01:00:00.000 | M277: =RC[-8]-R[23]C[-8] -> 0.21875 | N277: =RC[-8]-R[23]C[-8] -> 0.75 | O277: =RC[-8]-R[23]C[-8] -> -1.3333333333333357 | P277: =RC[-8]-R[23]C[-8] -> -61.083333333333329 | Q277: =RC[-8]-R[23]C[-8] -> 9.4166666666666572 | R277: =RC[-8]-R[23]C[-8] -> 33.583333333333329 | T277: =RC[-7]*RC[-2] -> 7.3463541666666661 | U277: =RC[-7]*RC[-3] -> 25.187499999999996 | V277: =RC[-7]*RC[-4] -> -44.77777777777785 | W277: =RC[-7]*RC[-5] -> -2051.3819444444439 | X277: =RC[-7]*RC[-6] -> 316.2430555555552 | Y277: =RC[-12]*RC[-12] -> 4.78515625E-2 | Z277: =RC[-12]*RC[-12] -> 0.5625 | AA277: =RC[-12]*RC[-12] -> 1.7777777777777841 | AB277: =RC[-12]*RC[-12] -> 3731.1736111111104 | AC277: =RC[-12]*RC[-12] -> 88.67361111111093 | AD277: =RC[-12]*RC[-12] -> 1127.8402777777774 | AE277: =RC[-11]/SQRT(RC[-6]*RC[-1]) -> 1.0000000000000002 | AF277: =RC[-11]/SQRT(RC[-6]*RC[-2]) -> 1 | AG277: =RC[-11]/SQRT(RC[-6]*RC[-3]) -> -1 | AH277: =RC[-11]/SQRT(RC[-6]*RC[-4]) -> -1 | AI277: =RC[-11]/SQRT(RC[-6]*RC[-5]) -> 1.0000000000000002
A278: 21646 | B278: 北京 | C278: 223 | D278: 重度污染 | E278: 1.66 | F278: 20 | G278: 43 | H278: 57 | I278: 147 | J278: 160 | L278: 2013-06-03T02:00:00.000 | M278: =RC[-8]-R[22]C[-8] -> 0.26874999999999982 | N278: =RC[-8]-R[22]C[-8] -> 0.75 | O278: =RC[-8]-R[22]C[-8] -> -4.3333333333333357 | P278: =RC[-8]-R[22]C[-8] -> -65.083333333333329 | Q278: =RC[-8]-R[22]C[-8] -> 2.4166666666666572 | R278: =RC[-8]-R[22]C[-8] -> 34.583333333333329 | T278: =RC[-7]*RC[-2] -> 9.294270833333325 | U278: =RC[-7]*RC[-3] -> 25.937499999999996 | V278: =RC[-7]*RC[-4] -> -149.86111111111117 | W278: =RC[-7]*RC[-5] -> -2250.7986111111109 | X278: =RC[-7]*RC[-6] -> 83.576388888888545 | Y278: =RC[-12]*RC[-12] -> 7.2226562499999911E-2 | Z278: =RC[-12]*RC[-12] -> 0.5625 | AA278: =RC[-12]*RC[-12] -> 18.7777777777778 | AB278: =RC[-12]*RC[-12] -> 4235.8402777777774 | AC278: =RC[-12]*RC[-12] -> 5.8402777777777324 | AD278: =RC[-12]*RC[-12] -> 1196.0069444444441 | AE278: =RC[-11]/SQRT(RC[-6]*RC[-1]) -> 0.99999999999999978 | AF278: =RC[-11]/SQRT(RC[-6]*RC[-2]) -> 1 | AG278: =RC[-11]/SQRT(RC[-6]*RC[-3]) -> -1 | AH278: =RC[-11]/SQRT(RC[-6]*RC[-4]) -> -1 | AI278: =RC[-11]/SQRT(RC[-6]*RC[-5]) -> 0.99999999999999978
A279: 21722 | B279: 北京 | C279: 227 | D279: 重度污染 | E279: 1.75 | F279: 16 | G279: 53 | H279: 37 | I279: 166 | J279: 166 | L279: 2013-06-03T03:00:00.000 | M279: =RC[-8]-R[21]C[-8] -> 0.3587499999999999 | N279: =RC[-8]-R[21]C[-8] -> -3.25 | O279: =RC[-8]-R[21]C[-8] -> 5.6666666666666643 | P279: =RC[-8]-R[21]C[-8] -> -85.083333333333329 | Q279: =RC[-8]-R[21]C[-8] -> 21.416666666666657 | R279: =RC[-8]-R[21]C[-8] -> 40.583333333333329 | T279: =RC[-7]*RC[-2] -> 14.559270833333327 | U279: =RC[-7]*RC[-3] -> -131.89583333333331 | V279: =RC[-7]*RC[-4] -> 229.97222222222209 | W279: =RC[-7]*RC[-5] -> -3452.9652777777774 | X279: =RC[-7]*RC[-6] -> 869.15972222222172 | Y279: =RC[-12]*RC[-12] -> 0.12870156249999992 | Z279: =RC[-12]*RC[-12] -> 10.5625 | AA279: =RC[-12]*RC[-12] -> 32.111111111111086 | AB279: =RC[-12]*RC[-12] -> 7239.1736111111104 | AC279: =RC[-12]*RC[-12] -> 458.67361111111069 | AD279: =RC[-12]*RC[-12] -> 1647.0069444444441 | AE279: =RC[-11]/SQRT(RC[-6]*RC[-1]) -> 1 | AF279: =RC[-11]/SQRT(RC[-6]*RC[-2]) -> -1 | AG279: =RC[-11]/SQRT(RC[-6]*RC[-3]) -> 0.99999999999999989 | AH279: =RC[-11]/SQRT(RC[-6]*RC[-4]) -> -1 | AI279: =RC[-11]/SQRT(RC[-6]*RC[-5]) -> 1
A280: 21798 | B280: 北京 | C280: 231 | D280: 重度污染 | E280: 1.74 | F280: 14 | G280: 55 | H280: 29 | I280: 181 | J280: 170 | L280: 2013-06-03T04:00:00.000 | M280: =RC[-8]-R[20]C[-8] -> 0.34874999999999989 | N280: =RC[-8]-R[20]C[-8] -> -5.25 | O280: =RC[-8]-R[20]C[-8] -> 7.6666666666666643 | P280: =RC[-8]-R[20]C[-8] -> -93.083333333333329 | Q280: =RC[-8]-R[20]C[-8] -> 36.416666666666657 | R280: =RC[-8]-R[20]C[-8] -> 44.583333333333329 | T280: =RC[-7]*RC[-2] -> 15.548437499999993 | U280: =RC[-7]*RC[-3] -> -234.06249999999997 | V280: =RC[-7]*RC[-4] -> 341.80555555555543 | W280: =RC[-7]*RC[-5] -> -4149.9652777777774 | X280: =RC[-7]*RC[-6] -> 1623.5763888888882 | Y280: =RC[-12]*RC[-12] -> 0.12162656249999992 | Z280: =RC[-12]*RC[-12] -> 27.5625 | AA280: =RC[-12]*RC[-12] -> 58.777777777777743 | AB280: =RC[-12]*RC[-12] -> 8664.5069444444434 | AC280: =RC[-12]*RC[-12] -> 1326.1736111111104 | AD280: =RC[-12]*RC[-12] -> 1987.6736111111106 | AE280: =RC[-11]/SQRT(RC[-6]*RC[-1]) -> 1 | AF280: =RC[-11]/SQRT(RC[-6]*RC[-2]) -> -1 | AG280: =RC[-11]/SQRT(RC[-6]*RC[-3]) -> 1 | AH280: =RC[-11]/SQRT(RC[-6]*RC[-4]) -> -1 | AI280: =RC[-11]/SQRT(RC[-6]*RC[-5]) -> 1
A281: 21874 | B281: 北京 | C281: 234 | D281: 重度污染 | E281: 1.74 | F281: 12 | G281: 53 | H281: 24 | I281: 157 | J281: 158 | L281: 2013-06-03T05:00:00.000 | M281: =RC[-8]-R[19]C[-8] -> 0.34874999999999989 | N281: =RC[-8]-R[19]C[-8] -> -7.25 | O281: =RC[-8]-R[19]C[-8] -> 5.6666666666666643 | P281: =RC[-8]-R[19]C[-8] -> -98.083333333333329 | Q281: =RC[-8]-R[19]C[-8] -> 12.416666666666657 | R281: =RC[-8]-R[19]C[-8] -> 32.583333333333329 | T281: =RC[-7]*RC[-2] -> 11.363437499999995 | U281: =RC[-7]*RC[-3] -> -236.22916666666663 | V281: =RC[-7]*RC[-4] -> 184.63888888888877 | W281: =RC[-7]*RC[-5] -> -3195.8819444444439 | X281: =RC[-7]*RC[-6] -> 404.57638888888852 | Y281: =RC[-12]*RC[-12] -> 0.12162656249999992 | Z281: =RC[-12]*RC[-12] -> 52.5625 | AA281: =RC[-12]*RC[-12] -> 32.111111111111086 | AB281: =RC[-12]*RC[-12] -> 9620.3402777777774 | AC281: =RC[-12]*RC[-12] -> 154.17361111111089 | AD281: =RC[-12]*RC[-12] -> 1061.6736111111109 | AE281: =RC[-11]/SQRT(RC[-6]*RC[-1]) -> 1 | AF281: =RC[-11]/SQRT(RC[-6]*RC[-2]) -> -1 | AG281: =RC[-11]/SQRT(RC[-6]*RC[-3]) -> 1 | AH281: =RC[-11]/SQRT(RC[-6]*RC[-4]) -> -1 | AI281: =RC[-11]/SQRT(RC[-6]*RC[-5]) -> 0.99999999999999989
A282: 21950 | B282: 北京 | C282: 235 | D282: 重度污染 | E282: 1.84 | F282: 11 | G282: 53 | H282: 28 | I282: 169 | J282: 164 | L282: 2013-06-03T06:00:00.000 | M282: =RC[-8]-R[18]C[-8] -> 0.44874999999999998 | N282: =RC[-8]-R[18]C[-8] -> -8.25 | O282: =RC[-8]-R[18]C[-8] -> 5.6666666666666643 | P282: =RC[-8]-R[18]C[-8] -> -94.083333333333329 | Q282: =RC[-8]-R[18]C[-8] -> 24.416666666666657 | R282: =RC[-8]-R[18]C[-8] -> 38.583333333333329 | T282: =RC[-7]*RC[-2] -> 17.314270833333332 | U282: =RC[-7]*RC[-3] -> -318.31249999999994 | V282: =RC[-7]*RC[-4] -> 218.63888888888877 | W282: =RC[-7]*RC[-5] -> -3630.0486111111104 | X282: =RC[-7]*RC[-6] -> 942.07638888888846 | Y282: =RC[-12]*RC[-12] -> 0.20137656249999999 | Z282: =RC[-12]*RC[-12] -> 68.0625 | AA282: =RC[-12]*RC[-12] -> 32.111111111111086 | AB282: =RC[-12]*RC[-12] -> 8851.6736111111095 | AC282: =RC[-12]*RC[-12] -> 596.17361111111063 | AD282: =RC[-12]*RC[-12] -> 1488.6736111111109 | AE282: =RC[-11]/SQRT(RC[-6]*RC[-1]) -> 1 | AF282: =RC[-11]/SQRT(RC[-6]*RC[-2]) -> -0.99999999999999978 | AG282: =RC[-11]/SQRT(RC[-6]*RC[-3]) -> 0.99999999999999989 | AH282: =RC[-11]/SQRT(RC[-6]*RC[-4]) -> -1 | AI282: =RC[-11]/SQRT(RC[-6]*RC[-5]) -> 1
A283: 22026 | B283: 北京 | C283: 236 | D283: 重度污染 | E283: 1.89 | F283: 17 | G283: 61 | H283: 31 | I283: 180 | J283: 171 | L283: 2013-06-03T07:00:00.000 | M283: =RC[-8]-R[17]C[-8] -> 0.4987499999999998 | N283: =RC[-8]-R[17]C[-8] -> -2.25 | O283: =RC[-8]-R[17]C[-8] -> 13.666666666666664 | P283: =RC[-8]-R[17]C[-8] -> -91.083333333333329 | Q283: =RC[-8]-R[17]C[-8] -> 35.416666666666657 | R283: =RC[-8]-R[17]C[-8] -> 45.583333333333329 | T283: =RC[-7]*RC[-2] -> 22.734687499999989 | U283: =RC[-7]*RC[-3] -> -102.56249999999999 | V283: =RC[-7]*RC[-4] -> 622.97222222222206 | W283: =RC[-7]*RC[-5] -> -4151.8819444444434 | X283: =RC[-7]*RC[-6] -> 1614.4097222222217 | Y283: =RC[-12]*RC[-12] -> 0.2487515624999998 | Z283: =RC[-12]*RC[-12] -> 5.0625 | AA283: =RC[-12]*RC[-12] -> 186.77777777777771 | AB283: =RC[-12]*RC[-12] -> 8296.1736111111095 | AC283: =RC[-12]*RC[-12] -> 1254.3402777777771 | AD283: =RC[-12]*RC[-12] -> 2077.8402777777774 | AE283: =RC[-11]/SQRT(RC[-6]*RC[-1]) -> 1 | AF283: =RC[-11]/SQRT(RC[-6]*RC[-2]) -> -1 | AG283: =RC[-11]/SQRT(RC[-6]*RC[-3]) -> 1 | AH283: =RC[-11]/SQRT(RC[-6]*RC[-4]) -> -1 | AI283: =RC[-11]/SQRT(RC[-6]*RC[-5]) -> 1
A284: 22102 | B284: 北京 | C284: 236 | D284: 重度污染 | E284: 1.94 | F284: 30 | G284: 66 | H284: 45 | I284: 214 | J284: 184 | L284: 2013-06-03T08:00:00.000 | M284: =RC[-8]-R[16]C[-8] -> 0.54874999999999985 | N284: =RC[-8]-R[16]C[-8] -> 10.75 | O284: =RC[-8]-R[16]C[-8] -> 18.666666666666664 | P284: =RC[-8]-R[16]C[-8] -> -77.083333333333329 | Q284: =RC[-8]-R[16]C[-8] -> 69.416666666666657 | R284: =RC[-8]-R[16]C[-8] -> 58.583333333333329 | T284: =RC[-7]*RC[-2] -> 32.147604166666653 | U284: =RC[-7]*RC[-3] -> 629.77083333333326 | V284: =RC[-7]*RC[-4] -> 1093.5555555555554 | W284: =RC[-7]*RC[-5] -> -4515.7986111111104 | X284: =RC[-7]*RC[-6] -> 4066.6597222222213 | Y284: =RC[-12]*RC[-12] -> 0.30112656249999986 | Z284: =RC[-12]*RC[-12] -> 115.5625 | AA284: =RC[-12]*RC[-12] -> 348.44444444444434 | AB284: =RC[-12]*RC[-12] -> 5941.8402777777774 | AC284: =RC[-12]*RC[-12] -> 4818.6736111111095 | AD284: =RC[-12]*RC[-12] -> 3432.0069444444439 | AE284: =RC[-11]/SQRT(RC[-6]*RC[-1]) -> 1 | AF284: =RC[-11]/SQRT(RC[-6]*RC[-2]) -> 1 | AG284: =RC[-11]/SQRT(RC[-6]*RC[-3]) -> 1 | AH284: =RC[-11]/SQRT(RC[-6]*RC[-4]) -> -1 | AI284: =RC[-11]/SQRT(RC[-6]*RC[-5]) -> 1
A285: 22178 | B285: 北京 | C285: 235 | D285: 重度污染 | E285: 1.8 | F285: 36 | G285: 52 | H285: 85 | I285: 189 | J285: 180 | L285: 2013-06-03T09:00:00.000 | M285: =RC[-8]-R[15]C[-8] -> 0.40874999999999995 | N285: =RC[-8]-R[15]C[-8] -> 16.75 | O285: =RC[-8]-R[15]C[-8] -> 4.6666666666666643 | P285: =RC[-8]-R[15]C[-8] -> -37.083333333333329 | Q285: =RC[-8]-R[15]C[-8] -> 44.416666666666657 | R285: =RC[-8]-R[15]C[-8] -> 54.583333333333329 | T285: =RC[-7]*RC[-2] -> 22.310937499999994 | U285: =RC[-7]*RC[-3] -> 914.27083333333326 | V285: =RC[-7]*RC[-4] -> 254.72222222222206 | W285: =RC[-7]*RC[-5] -> -2024.1319444444441 | X285: =RC[-7]*RC[-6] -> 2424.4097222222217 | Y285: =RC[-12]*RC[-12] -> 0.16707656249999997 | Z285: =RC[-12]*RC[-12] -> 280.5625 | AA285: =RC[-12]*RC[-12] -> 21.777777777777757 | AB285: =RC[-12]*RC[-12] -> 1375.1736111111109 | AC285: =RC[-12]*RC[-12] -> 1972.8402777777769 | AD285: =RC[-12]*RC[-12] -> 2979.3402777777774 | AE285: =RC[-11]/SQRT(RC[-6]*RC[-1]) -> 0.99999999999999989 | AF285: =RC[-11]/SQRT(RC[-6]*RC[-2]) -> 1 | AG285: =RC[-11]/SQRT(RC[-6]*RC[-3]) -> 0.99999999999999989 | AH285: =RC[-11]/SQRT(RC[-6]*RC[-4]) -> -1 | AI285: =RC[-11]/SQRT(RC[-6]*RC[-5]) -> 1
A286: 22254 | B286: 北京 | C286: 233 | D286: 重度污染 | E286: 1.6 | F286: 35 | G286: 43 | H286: 122 | I286: 167 | J286: 165 | L286: 2013-06-03T10:00:00.000 | M286: =RC[-8]-R[14]C[-8] -> 0.20874999999999999 | N286: =RC[-8]-R[14]C[-8] -> 15.75 | O286: =RC[-8]-R[14]C[-8] -> -4.3333333333333357 | P286: =RC[-8]-R[14]C[-8] -> -8.3333333333328596E-2 | Q286: =RC[-8]-R[14]C[-8] -> 22.416666666666657 | R286: =RC[-8]-R[14]C[-8] -> 39.583333333333329 | T286: =RC[-7]*RC[-2] -> 8.2630208333333321 | U286: =RC[-7]*RC[-3] -> 623.43749999999989 | V286: =RC[-7]*RC[-4] -> -171.52777777777786 | W286: =RC[-7]*RC[-5] -> -3.2986111111109233 | X286: =RC[-7]*RC[-6] -> 887.32638888888846 | Y286: =RC[-12]*RC[-12] -> 4.3576562499999999E-2 | Z286: =RC[-12]*RC[-12] -> 248.0625 | AA286: =RC[-12]*RC[-12] -> 18.7777777777778 | AB286: =RC[-12]*RC[-12] -> 6.9444444444436548E-3 | AC286: =RC[-12]*RC[-12] -> 502.506944444444 | AD286: =RC[-12]*RC[-12] -> 1566.8402777777774 | AE286: =RC[-11]/SQRT(RC[-6]*RC[-1]) -> 1 | AF286: =RC[-11]/SQRT(RC[-6]*RC[-2]) -> 1 | AG286: =RC[-11]/SQRT(RC[-6]*RC[-3]) -> -1 | AH286: =RC[-11]/SQRT(RC[-6]*RC[-4]) -> -1 | AI286: =RC[-11]/SQRT(RC[-6]*RC[-5]) -> 1.0000000000000002
A287: 22330 | B287: 北京 | C287: 229 | D287: 重度污染 | E287: 1.39 | F287: 30 | G287: 35 | H287: 151 | I287: 65 | J287: 144 | L287: 2013-06-03T11:00:00.000 | M287: =RC[-8]-R[13]C[-8] -> -1.2500000000001954E-3 | N287: =RC[-8]-R[13]C[-8] -> 10.75 | O287: =RC[-8]-R[13]C[-8] -> -12.333333333333336 | P287: =RC[-8]-R[13]C[-8] -> 28.916666666666671 | Q287: =RC[-8]-R[13]C[-8] -> -79.583333333333343 | R287: =RC[-8]-R[13]C[-8] -> 18.583333333333329 | T287: =RC[-7]*RC[-2] -> -2.3229166666670291E-2 | U287: =RC[-7]*RC[-3] -> 199.77083333333329 | V287: =RC[-7]*RC[-4] -> -229.19444444444443 | W287: =RC[-7]*RC[-5] -> 537.36805555555554 | X287: =RC[-7]*RC[-6] -> -1478.9236111111109 | Y287: =RC[-12]*RC[-12] -> 1.5625000000004886E-6 | Z287: =RC[-12]*RC[-12] -> 115.5625 | AA287: =RC[-12]*RC[-12] -> 152.11111111111117 | AB287: =RC[-12]*RC[-12] -> 836.17361111111143 | AC287: =RC[-12]*RC[-12] -> 6333.5069444444462 | AD287: =RC[-12]*RC[-12] -> 345.3402777777776 | AE287: =RC[-11]/SQRT(RC[-6]*RC[-1]) -> -1 | AF287: =RC[-11]/SQRT(RC[-6]*RC[-2]) -> 1 | AG287: =RC[-11]/SQRT(RC[-6]*RC[-3]) -> -1 | AH287: =RC[-11]/SQRT(RC[-6]*RC[-4]) -> 1 | AI287: =RC[-11]/SQRT(RC[-6]*RC[-5]) -> -0.99999999999999989
A288: 22406 | B288: 北京 | C288: 222 | D288: 重度污染 | E288: 1.1100000000000001 | F288: 24 | G288: 27 | H288: 176 | I288: 143 | J288: 103 | L288: 2013-06-03T12:00:00.000 | M288: =RC[-8]-R[12]C[-8] -> -0.28125 | N288: =RC[-8]-R[12]C[-8] -> 4.75 | O288: =RC[-8]-R[12]C[-8] -> -20.333333333333336 | P288: =RC[-8]-R[12]C[-8] -> 53.916666666666671 | Q288: =RC[-8]-R[12]C[-8] -> -1.5833333333333428 | R288: =RC[-8]-R[12]C[-8] -> -22.416666666666671 | T288: =RC[-7]*RC[-2] -> 6.3046875000000018 | U288: =RC[-7]*RC[-3] -> -106.47916666666669 | V288: =RC[-7]*RC[-4] -> 455.80555555555571 | W288: =RC[-7]*RC[-5] -> -1208.6319444444448 | X288: =RC[-7]*RC[-6] -> 35.493055555555777 | Y288: =RC[-12]*RC[-12] -> 7.91015625E-2 | Z288: =RC[-12]*RC[-12] -> 22.5625 | AA288: =RC[-12]*RC[-12] -> 413.44444444444451 | AB288: =RC[-12]*RC[-12] -> 2907.0069444444448 | AC288: =RC[-12]*RC[-12] -> 2.5069444444444744 | AD288: =RC[-12]*RC[-12] -> 502.50694444444468 | AE288: =RC[-11]/SQRT(RC[-6]*RC[-1]) -> 1 | AF288: =RC[-11]/SQRT(RC[-6]*RC[-2]) -> -1 | AG288: =RC[-11]/SQRT(RC[-6]*RC[-3]) -> 1 | AH288: =RC[-11]/SQRT(RC[-6]*RC[-4]) -> -1 | AI288: =RC[-11]/SQRT(RC[-6]*RC[-5]) -> 1
A289: 22482 | B289: 北京 | C289: 215 | D289: 重度污染 | E289: 0.81 | F289: 16 | G289: 19 | H289: 181 | I289: 26 | J289: 64 | L289: 2013-06-03T13:00:00.000 | M289: =RC[-8]-R[11]C[-8] -> -0.58125000000000004 | N289: =RC[-8]-R[11]C[-8] -> -3.25 | O289: =RC[-8]-R[11]C[-8] -> -28.333333333333336 | P289: =RC[-8]-R[11]C[-8] -> 58.916666666666671 | Q289: =RC[-8]-R[11]C[-8] -> -118.58333333333334 | R289: =RC[-8]-R[11]C[-8] -> -61.416666666666671 | T289: =RC[-7]*RC[-2] -> 35.698437500000004 | U289: =RC[-7]*RC[-3] -> 199.60416666666669 | V289: =RC[-7]*RC[-4] -> 1740.1388888888891 | W289: =RC[-7]*RC[-5] -> -3618.4652777777783 | X289: =RC[-7]*RC[-6] -> 7282.9930555555566 | Y289: =RC[-12]*RC[-12] -> 0.33785156250000004 | Z289: =RC[-12]*RC[-12] -> 10.5625 | AA289: =RC[-12]*RC[-12] -> 802.77777777777794 | AB289: =RC[-12]*RC[-12] -> 3471.1736111111118 | AC289: =RC[-12]*RC[-12] -> 14062.006944444447 | AD289: =RC[-12]*RC[-12] -> 3772.0069444444453 | AE289: =RC[-11]/SQRT(RC[-6]*RC[-1]) -> 1 | AF289: =RC[-11]/SQRT(RC[-6]*RC[-2]) -> 1 | AG289: =RC[-11]/SQRT(RC[-6]*RC[-3]) -> 1 | AH289: =RC[-11]/SQRT(RC[-6]*RC[-4]) -> -0.99999999999999989 | AI289: =RC[-11]/SQRT(RC[-6]*RC[-5]) -> 1
A290: 22558 | B290: 北京 | C290: 205 | D290: 重度污染 | E290: 0.71 | F290: 13 | G290: 22 | H290: 191 | I290: 61 | J290: 52 | L290: 2013-06-03T14:00:00.000 | M290: =RC[-8]-R[10]C[-8] -> -0.68125000000000013 | N290: =RC[-8]-R[10]C[-8] -> -6.25 | O290: =RC[-8]-R[10]C[-8] -> -25.333333333333336 | P290: =RC[-8]-R[10]C[-8] -> 68.916666666666671 | Q290: =RC[-8]-R[10]C[-8] -> -83.583333333333343 | R290: =RC[-8]-R[10]C[-8] -> -73.416666666666671 | T290: =RC[-7]*RC[-2] -> 50.015104166666681 | U290: =RC[-7]*RC[-3] -> 458.85416666666669 | V290: =RC[-7]*RC[-4] -> 1859.8888888888891 | W290: =RC[-7]*RC[-5] -> -5059.6319444444453 | X290: =RC[-7]*RC[-6] -> 6136.4097222222235 | Y290: =RC[-12]*RC[-12] -> 0.46410156250000018 | Z290: =RC[-12]*RC[-12] -> 39.0625 | AA290: =RC[-12]*RC[-12] -> 641.77777777777794 | AB290: =RC[-12]*RC[-12] -> 4749.5069444444453 | AC290: =RC[-12]*RC[-12] -> 6986.1736111111131 | AD290: =RC[-12]*RC[-12] -> 5390.0069444444453 | AE290: =RC[-11]/SQRT(RC[-6]*RC[-1]) -> 1 | AF290: =RC[-11]/SQRT(RC[-6]*RC[-2]) -> 1 | AG290: =RC[-11]/SQRT(RC[-6]*RC[-3]) -> 1 | AH290: =RC[-11]/SQRT(RC[-6]*RC[-4]) -> -1 | AI290: =RC[-11]/SQRT(RC[-6]*RC[-5]) -> 1
A291: 22634 | B291: 北京 | C291: 195 | D291: 中度污染 | E291: 0.66 | F291: 11 | G291: 25 | H291: 204 | I291: 90 | J291: 53 | L291: 2013-06-03T15:00:00.000 | M291: =RC[-8]-R[9]C[-8] -> -0.73125000000000007 | N291: =RC[-8]-R[9]C[-8] -> -8.25 | O291: =RC[-8]-R[9]C[-8] -> -22.333333333333336 | P291: =RC[-8]-R[9]C[-8] -> 81.916666666666671 | Q291: =RC[-8]-R[9]C[-8] -> -54.583333333333343 | R291: =RC[-8]-R[9]C[-8] -> -72.416666666666671 | T291: =RC[-7]*RC[-2] -> 52.954687500000006 | U291: =RC[-7]*RC[-3] -> 597.4375 | V291: =RC[-7]*RC[-4] -> 1617.3055555555559 | W291: =RC[-7]*RC[-5] -> -5932.1319444444453 | X291: =RC[-7]*RC[-6] -> 3952.7430555555566 | Y291: =RC[-12]*RC[-12] -> 0.53472656250000006 | Z291: =RC[-12]*RC[-12] -> 68.0625 | AA291: =RC[-12]*RC[-12] -> 498.77777777777789 | AB291: =RC[-12]*RC[-12] -> 6710.3402777777783 | AC291: =RC[-12]*RC[-12] -> 2979.3402777777787 | AD291: =RC[-12]*RC[-12] -> 5244.1736111111122 | AE291: =RC[-11]/SQRT(RC[-6]*RC[-1]) -> 0.99999999999999989 | AF291: =RC[-11]/SQRT(RC[-6]*RC[-2]) -> 1 | AG291: =RC[-11]/SQRT(RC[-6]*RC[-3]) -> 1 | AH291: =RC[-11]/SQRT(RC[-6]*RC[-4]) -> -1 | AI291: =RC[-11]/SQRT(RC[-6]*RC[-5]) -> 1
A292: 22710 | B292: 北京 | C292: 187 | D292: 中度污染 | E292: 0.78 | F292: 12 | G292: 25 | H292: 226 | I292: 99 | J292: 57 | L292: 2013-06-03T16:00:00.000 | M292: =RC[-8]-R[8]C[-8] -> -0.61125000000000007 | N292: =RC[-8]-R[8]C[-8] -> -7.25 | O292: =RC[-8]-R[8]C[-8] -> -22.333333333333336 | P292: =RC[-8]-R[8]C[-8] -> 103.91666666666667 | Q292: =RC[-8]-R[8]C[-8] -> -45.583333333333343 | R292: =RC[-8]-R[8]C[-8] -> -68.416666666666671 | T292: =RC[-7]*RC[-2] -> 41.819687500000008 | U292: =RC[-7]*RC[-3] -> 496.02083333333337 | V292: =RC[-7]*RC[-4] -> 1527.9722222222224 | W292: =RC[-7]*RC[-5] -> -7109.6319444444453 | X292: =RC[-7]*RC[-6] -> 3118.6597222222231 | Y292: =RC[-12]*RC[-12] -> 0.37362656250000009 | Z292: =RC[-12]*RC[-12] -> 52.5625 | AA292: =RC[-12]*RC[-12] -> 498.77777777777789 | AB292: =RC[-12]*RC[-12] -> 10798.673611111111 | AC292: =RC[-12]*RC[-12] -> 2077.8402777777787 | AD292: =RC[-12]*RC[-12] -> 4680.8402777777783 | AE292: =RC[-11]/SQRT(RC[-6]*RC[-1]) -> 1 | AF292: =RC[-11]/SQRT(RC[-6]*RC[-2]) -> 1 | AG292: =RC[-11]/SQRT(RC[-6]*RC[-3]) -> 1 | AH292: =RC[-11]/SQRT(RC[-6]*RC[-4]) -> -1 | AI292: =RC[-11]/SQRT(RC[-6]*RC[-5]) -> 1
A293: 22786 | B293: 北京 | C293: 181 | D293: 中度污染 | E293: 0.88 | F293: 17 | G293: 31 | H293: 261 | I293: 194 | J293: 81 | L293: 2013-06-03T17:00:00.000 | M293: =RC[-8]-R[7]C[-8] -> -0.51125000000000009 | N293: =RC[-8]-R[7]C[-8] -> -2.25 | O293: =RC[-8]-R[7]C[-8] -> -16.333333333333336 | P293: =RC[-8]-R[7]C[-8] -> 138.91666666666669 | Q293: =RC[-8]-R[7]C[-8] -> 49.416666666666657 | R293: =RC[-8]-R[7]C[-8] -> -44.416666666666671 | T293: =RC[-7]*RC[-2] -> 22.70802083333334 | U293: =RC[-7]*RC[-3] -> 99.937500000000014 | V293: =RC[-7]*RC[-4] -> 725.4722222222224 | W293: =RC[-7]*RC[-5] -> -6170.2152777777792 | X293: =RC[-7]*RC[-6] -> -2194.9236111111109 | Y293: =RC[-12]*RC[-12] -> 0.26137656250000008 | Z293: =RC[-12]*RC[-12] -> 5.0625 | AA293: =RC[-12]*RC[-12] -> 266.77777777777783 | AB293: =RC[-12]*RC[-12] -> 19297.840277777785 | AC293: =RC[-12]*RC[-12] -> 2442.0069444444434 | AD293: =RC[-12]*RC[-12] -> 1972.8402777777783 | AE293: =RC[-11]/SQRT(RC[-6]*RC[-1]) -> 1 | AF293: =RC[-11]/SQRT(RC[-6]*RC[-2]) -> 1 | AG293: =RC[-11]/SQRT(RC[-6]*RC[-3]) -> 1 | AH293: =RC[-11]/SQRT(RC[-6]*RC[-4]) -> -0.99999999999999989 | AI293: =RC[-11]/SQRT(RC[-6]*RC[-5]) -> -1
A294: 22862 | B294: 北京 | C294: 177 | D294: 中度污染 | E294: 1.0900000000000001 | F294: 20 | G294: 35 | H294: 265 | I294: 145 | J294: 100 | L294: 2013-06-03T18:00:00.000 | M294: =RC[-8]-R[6]C[-8] -> -0.30125000000000002 | N294: =RC[-8]-R[6]C[-8] -> 0.75 | O294: =RC[-8]-R[6]C[-8] -> -12.333333333333336 | P294: =RC[-8]-R[6]C[-8] -> 142.91666666666669 | Q294: =RC[-8]-R[6]C[-8] -> 0.41666666666665719 | R294: =RC[-8]-R[6]C[-8] -> -25.416666666666671 | T294: =RC[-7]*RC[-2] -> 7.6567708333333355 | U294: =RC[-7]*RC[-3] -> -19.062500000000004 | V294: =RC[-7]*RC[-4] -> 313.47222222222234 | W294: =RC[-7]*RC[-5] -> -3632.4652777777787 | X294: =RC[-7]*RC[-6] -> -10.590277777777539 | Y294: =RC[-12]*RC[-12] -> 9.0751562500000008E-2 | Z294: =RC[-12]*RC[-12] -> 0.5625 | AA294: =RC[-12]*RC[-12] -> 152.11111111111117 | AB294: =RC[-12]*RC[-12] -> 20425.173611111117 | AC294: =RC[-12]*RC[-12] -> 0.17361111111110322 | AD294: =RC[-12]*RC[-12] -> 646.00694444444468 | AE294: =RC[-11]/SQRT(RC[-6]*RC[-1]) -> 1.0000000000000002 | AF294: =RC[-11]/SQRT(RC[-6]*RC[-2]) -> -1 | AG294: =RC[-11]/SQRT(RC[-6]*RC[-3]) -> 1 | AH294: =RC[-11]/SQRT(RC[-6]*RC[-4]) -> -0.99999999999999989 | AI294: =RC[-11]/SQRT(RC[-6]*RC[-5]) -> -1
A295: 22938 | B295: 北京 | C295: 174 | D295: 中度污染 | E295: 1.1000000000000001 | F295: 20 | G295: 42 | H295: 233 | I295: 108 | J295: 84 | L295: 2013-06-03T19:00:00.000 | M295: =RC[-8]-R[5]C[-8] -> -0.29125000000000001 | N295: =RC[-8]-R[5]C[-8] -> 0.75 | O295: =RC[-8]-R[5]C[-8] -> -5.3333333333333357 | P295: =RC[-8]-R[5]C[-8] -> 110.91666666666667 | Q295: =RC[-8]-R[5]C[-8] -> -36.583333333333343 | R295: =RC[-8]-R[5]C[-8] -> -41.416666666666671 | T295: =RC[-7]*RC[-2] -> 12.062604166666668 | U295: =RC[-7]*RC[-3] -> -31.062500000000004 | V295: =RC[-7]*RC[-4] -> 220.888888888889 | W295: =RC[-7]*RC[-5] -> -4593.7986111111122 | X295: =RC[-7]*RC[-6] -> 1515.1597222222229 | Y295: =RC[-12]*RC[-12] -> 8.4826562500000008E-2 | Z295: =RC[-12]*RC[-12] -> 0.5625 | AA295: =RC[-12]*RC[-12] -> 28.444444444444471 | AB295: =RC[-12]*RC[-12] -> 12302.506944444445 | AC295: =RC[-12]*RC[-12] -> 1338.3402777777785 | AD295: =RC[-12]*RC[-12] -> 1715.3402777777783 | AE295: =RC[-11]/SQRT(RC[-6]*RC[-1]) -> 1 | AF295: =RC[-11]/SQRT(RC[-6]*RC[-2]) -> -1 | AG295: =RC[-11]/SQRT(RC[-6]*RC[-3]) -> 0.99999999999999989 | AH295: =RC[-11]/SQRT(RC[-6]*RC[-4]) -> -1 | AI295: =RC[-11]/SQRT(RC[-6]*RC[-5]) -> 1
A296: 23014 | B296: 北京 | C296: 171 | D296: 中度污染 | E296: 1.1200000000000001 | F296: 17 | G296: 53 | H296: 191 | I296: 148 | J296: 101 | L296: 2013-06-03T20:00:00.000 | M296: =RC[-8]-R[4]C[-8] -> -0.27124999999999999 | N296: =RC[-8]-R[4]C[-8] -> -2.25 | O296: =RC[-8]-R[4]C[-8] -> 5.6666666666666643 | P296: =RC[-8]-R[4]C[-8] -> 68.916666666666671 | Q296: =RC[-8]-R[4]C[-8] -> 3.4166666666666572 | R296: =RC[-8]-R[4]C[-8] -> -24.416666666666671 | T296: =RC[-7]*RC[-2] -> 6.6230208333333342 | U296: =RC[-7]*RC[-3] -> 54.937500000000014 | V296: =RC[-7]*RC[-4] -> -138.36111111111109 | W296: =RC[-7]*RC[-5] -> -1682.7152777777783 | X296: =RC[-7]*RC[-6] -> -83.423611111110901 | Y296: =RC[-12]*RC[-12] -> 7.3576562499999998E-2 | Z296: =RC[-12]*RC[-12] -> 5.0625 | AA296: =RC[-12]*RC[-12] -> 32.111111111111086 | AB296: =RC[-12]*RC[-12] -> 4749.5069444444453 | AC296: =RC[-12]*RC[-12] -> 11.673611111111047 | AD296: =RC[-12]*RC[-12] -> 596.17361111111131 | AE296: =RC[-11]/SQRT(RC[-6]*RC[-1]) -> 1 | AF296: =RC[-11]/SQRT(RC[-6]*RC[-2]) -> 1.0000000000000002 | AG296: =RC[-11]/SQRT(RC[-6]*RC[-3]) -> -1 | AH296: =RC[-11]/SQRT(RC[-6]*RC[-4]) -> -1 | AI296: =RC[-11]/SQRT(RC[-6]*RC[-5]) -> -1
A297: 23090 | B297: 北京 | C297: 169 | D297: 中度污染 | E297: 1.32 | F297: 16 | G297: 71 | H297: 122 | I297: 169 | J297: 110 | L297: 2013-06-03T21:00:00.000 | M297: =RC[-8]-R[3]C[-8] -> -7.1250000000000036E-2 | N297: =RC[-8]-R[3]C[-8] -> -3.25 | O297: =RC[-8]-R[3]C[-8] -> 23.666666666666664 | P297: =RC[-8]-R[3]C[-8] -> -8.3333333333328596E-2 | Q297: =RC[-8]-R[3]C[-8] -> 24.416666666666657 | R297: =RC[-8]-R[3]C[-8] -> -15.416666666666671 | T297: =RC[-7]*RC[-2] -> 1.0984375000000008 | U297: =RC[-7]*RC[-3] -> 50.104166666666686 | V297: =RC[-7]*RC[-4] -> -364.8611111111112 | W297: =RC[-7]*RC[-5] -> 1.2847222222221495 | X297: =RC[-7]*RC[-6] -> -376.42361111111109 | Y297: =RC[-12]*RC[-12] -> 5.0765625000000047E-3 | Z297: =RC[-12]*RC[-12] -> 10.5625 | AA297: =RC[-12]*RC[-12] -> 560.11111111111097 | AB297: =RC[-12]*RC[-12] -> 6.9444444444436548E-3 | AC297: =RC[-12]*RC[-12] -> 596.17361111111063 | AD297: =RC[-12]*RC[-12] -> 237.67361111111126 | AE297: =RC[-11]/SQRT(RC[-6]*RC[-1]) -> 1 | AF297: =RC[-11]/SQRT(RC[-6]*RC[-2]) -> 1 | AG297: =RC[-11]/SQRT(RC[-6]*RC[-3]) -> -1.0000000000000002 | AH297: =RC[-11]/SQRT(RC[-6]*RC[-4]) -> 1 | AI297: =RC[-11]/SQRT(RC[-6]*RC[-5]) -> -1
A298: 23166 | B298: 北京 | C298: 167 | D298: 中度污染 | E298: 1.54 | F298: 16 | G298: 86 | H298: 78 | I298: 175 | J298: 118 | L298: 2013-06-03T22:00:00.000 | M298: =RC[-8]-R[2]C[-8] -> 0.14874999999999994 | N298: =RC[-8]-R[2]C[-8] -> -3.25 | O298: =RC[-8]-R[2]C[-8] -> 38.666666666666664 | P298: =RC[-8]-R[2]C[-8] -> -44.083333333333329 | Q298: =RC[-8]-R[2]C[-8] -> 30.416666666666657 | R298: =RC[-8]-R[2]C[-8] -> -7.4166666666666714 | T298: =RC[-7]*RC[-2] -> -1.1032291666666669 | U298: =RC[-7]*RC[-3] -> 24.104166666666682 | V298: =RC[-7]*RC[-4] -> -286.77777777777794 | W298: =RC[-7]*RC[-5] -> 326.95138888888908 | X298: =RC[-7]*RC[-6] -> -225.59027777777786 | Y298: =RC[-12]*RC[-12] -> 2.2126562499999981E-2 | Z298: =RC[-12]*RC[-12] -> 10.5625 | AA298: =RC[-12]*RC[-12] -> 1495.1111111111109 | AB298: =RC[-12]*RC[-12] -> 1943.3402777777774 | AC298: =RC[-12]*RC[-12] -> 925.17361111111052 | AD298: =RC[-12]*RC[-12] -> 55.006944444444514 | AE298: =RC[-11]/SQRT(RC[-6]*RC[-1]) -> -1 | AF298: =RC[-11]/SQRT(RC[-6]*RC[-2]) -> 1 | AG298: =RC[-11]/SQRT(RC[-6]*RC[-3]) -> -1 | AH298: =RC[-11]/SQRT(RC[-6]*RC[-4]) -> 1 | AI298: =RC[-11]/SQRT(RC[-6]*RC[-5]) -> -1
A299: 23242 | B299: 北京 | C299: 166 | D299: 中度污染 | E299: 1.66 | F299: 15 | G299: 96 | H299: 62 | I299: 185 | J299: 121 | L299: 2013-06-03T23:00:00.000 | M299: =RC[-8]-R[1]C[-8] -> 0.26874999999999982 | N299: =RC[-8]-R[1]C[-8] -> -4.25 | O299: =RC[-8]-R[1]C[-8] -> 48.666666666666664 | P299: =RC[-8]-R[1]C[-8] -> -60.083333333333329 | Q299: =RC[-8]-R[1]C[-8] -> 40.416666666666657 | R299: =RC[-8]-R[1]C[-8] -> -4.4166666666666714 | T299: =RC[-7]*RC[-2] -> -1.1869791666666671 | U299: =RC[-7]*RC[-3] -> 18.770833333333353 | V299: =RC[-7]*RC[-4] -> -214.94444444444466 | W299: =RC[-7]*RC[-5] -> 265.36805555555583 | X299: =RC[-7]*RC[-6] -> -178.5069444444446 | Y299: =RC[-12]*RC[-12] -> 7.2226562499999911E-2 | Z299: =RC[-12]*RC[-12] -> 18.0625 | AA299: =RC[-12]*RC[-12] -> 2368.4444444444443 | AB299: =RC[-12]*RC[-12] -> 3610.0069444444439 | AC299: =RC[-12]*RC[-12] -> 1633.5069444444437 | AD299: =RC[-12]*RC[-12] -> 19.506944444444485 | AE299: =RC[-11]/SQRT(RC[-6]*RC[-1]) -> -1 | AF299: =RC[-11]/SQRT(RC[-6]*RC[-2]) -> 1 | AG299: =RC[-11]/SQRT(RC[-6]*RC[-3]) -> -1 | AH299: =RC[-11]/SQRT(RC[-6]*RC[-4]) -> 1 | AI299: =RC[-11]/SQRT(RC[-6]*RC[-5]) -> -1
E300: =AVERAGE(R[-24]C:R[-1]C) -> 1.3912500000000001 | F300: =AVERAGE(R[-24]C:R[-1]C) -> 19.25 | G300: =AVERAGE(R[-24]C:R[-1]C) -> 47.333333333333336 | H300: =AVERAGE(R[-24]C:R[-1]C) -> 122.08333333333333 | I300: =AVERAGE(R[-24]C:R[-1]C) -> 144.58333333333334 | J300: =AVERAGE(R[-24]C:R[-1]C) -> 125.41666666666667 | M300: =RC[-8]-RC[-8] -> 0 | N300: =RC[-8]-RC[-8] -> 0 | O300: =RC[-8]-RC[-8] -> 0 | P300: =RC[-8]-RC[-8] -> 0 | Q300: =RC[-8]-RC[-8] -> 0 | R300: =RC[-8]-RC[-8] -> 0 | T300: =SUM(R[-24]C:R[-1]C) -> 400.57749999999993 | U300: =SUM(R[-24]C:R[-1]C) -> 3331.5 | V300: =SUM(R[-24]C:R[-1]C) -> 9741.6666666666661 | W300: =SUM(R[-24]C:R[-1]C) -> -68322.833333333343 | X300: =SUM(R[-24]C:R[-1]C) -> 30596.166666666672 | Y300: =SUM(R[-24]C:R[-1]C) -> 3.9202624999999998 | Z300: =SUM(R[-24]C:R[-1]C) -> 1190.5 | AA300: =SUM(R[-24]C:R[-1]C) -> 8673.3333333333321 | AB300: =SUM(R[-24]C:R[-1]C) -> 152469.83333333331 | AC300: =SUM(R[-24]C:R[-1]C) -> 50609.833333333343 | AD300: =SUM(R[-24]C:R[-1]C) -> 44125.833333333343 | AE300: =RC[-11]/SQRT(RC[-6]*RC[-1]) -> 0.96312469275204304 | AF300: =RC[-11]/SQRT(RC[-6]*RC[-2]) -> 0.45965147447326171 | AG300: =RC[-11]/SQRT(RC[-6]*RC[-3]) -> 0.49795922942853649 | AH300: =RC[-11]/SQRT(RC[-6]*RC[-4]) -> -0.83296632698725281 | AI300: =RC[-11]/SQRT(RC[-6]*RC[-5]) -> 0.64744533242492441
A301: 23318 | B301: 北京 | C301: 165 | D301: 中度污染 | E301: 1.8 | F301: 16 | G301: 132 | H301: 42 | I301: 169 | J301: 131 | L301: 2013-06-04T00:00:00.000 | M301: =RC[-8]-R[24]C[-8] -> -6.8750000000000089E-2 | N301: =RC[-8]-R[24]C[-8] -> -10.291666666666668 | O301: =RC[-8]-R[24]C[-8] -> 75.208333333333343 | P301: =RC[-8]-R[24]C[-8] -> -29.583333333333329 | Q301: =RC[-8]-R[24]C[-8] -> 14.416666666666657 | R301: =RC[-8]-R[24]C[-8] -> 3.9166666666666714 | T301: =RC[-7]*RC[-2] -> -0.26927083333333401 | U301: =RC[-7]*RC[-3] -> -40.309027777777828 | V301: =RC[-7]*RC[-4] -> 294.56597222222263 | W301: =RC[-7]*RC[-5] -> -115.86805555555567 | X301: =RC[-7]*RC[-6] -> 56.465277777777807 | Y301: =RC[-12]*RC[-12] -> 4.726562500000012E-3 | Z301: =RC[-12]*RC[-12] -> 105.9184027777778 | AA301: =RC[-12]*RC[-12] -> 5656.2934027777792 | AB301: =RC[-12]*RC[-12] -> 875.17361111111086 | AC301: =RC[-12]*RC[-12] -> 207.84027777777752 | AD301: =RC[-12]*RC[-12] -> 15.340277777777814 | AE301: =RC[-11]/SQRT(RC[-6]*RC[-1]) -> -1 | AF301: =RC[-11]/SQRT(RC[-6]*RC[-2]) -> -1 | AG301: =RC[-11]/SQRT(RC[-6]*RC[-3]) -> 1 | AH301: =RC[-11]/SQRT(RC[-6]*RC[-4]) -> -1 | AI301: =RC[-11]/SQRT(RC[-6]*RC[-5]) -> 1
A302: 23394 | B302: 北京 | C302: 163 | D302: 中度污染 | E302: 1.6 | F302: 17 | G302: 111 | H302: 60 | I302: 180 | J302: 132 | L302: 2013-06-04T01:00:00.000 | M302: =RC[-8]-R[23]C[-8] -> -0.26875000000000004 | N302: =RC[-8]-R[23]C[-8] -> -9.2916666666666679 | O302: =RC[-8]-R[23]C[-8] -> 54.208333333333336 | P302: =RC[-8]-R[23]C[-8] -> -11.583333333333329 | Q302: =RC[-8]-R[23]C[-8] -> 25.416666666666657 | R302: =RC[-8]-R[23]C[-8] -> 4.9166666666666714 | T302: =RC[-7]*RC[-2] -> -1.3213541666666682 | U302: =RC[-7]*RC[-3] -> -45.684027777777828 | V302: =RC[-7]*RC[-4] -> 266.52430555555583 | W302: =RC[-7]*RC[-5] -> -56.951388888888921 | X302: =RC[-7]*RC[-6] -> 124.96527777777786 | Y302: =RC[-12]*RC[-12] -> 7.2226562500000022E-2 | Z302: =RC[-12]*RC[-12] -> 86.335069444444471 | AA302: =RC[-12]*RC[-12] -> 2938.5434027777778 | AB302: =RC[-12]*RC[-12] -> 134.173611111111 | AC302: =RC[-12]*RC[-12] -> 646.006944444444 | AD302: =RC[-12]*RC[-12] -> 24.173611111111157 | AE302: =RC[-11]/SQRT(RC[-6]*RC[-1]) -> -1 | AF302: =RC[-11]/SQRT(RC[-6]*RC[-2]) -> -1 | AG302: =RC[-11]/SQRT(RC[-6]*RC[-3]) -> 1 | AH302: =RC[-11]/SQRT(RC[-6]*RC[-4]) -> -1 | AI302: =RC[-11]/SQRT(RC[-6]*RC[-5]) -> 1
A303: 23470 | B303: 北京 | C303: 161 | D303: 中度污染 | E303: 1.44 | F303: 19 | G303: 94 | H303: 58 | I303: 171 | J303: 126 | L303: 2013-06-04T02:00:00.000 | M303: =RC[-8]-R[22]C[-8] -> -0.42875000000000019 | N303: =RC[-8]-R[22]C[-8] -> -7.2916666666666679 | O303: =RC[-8]-R[22]C[-8] -> 37.208333333333336 | P303: =RC[-8]-R[22]C[-8] -> -13.583333333333329 | Q303: =RC[-8]-R[22]C[-8] -> 16.416666666666657 | R303: =RC[-8]-R[22]C[-8] -> -1.0833333333333286 | T303: =RC[-7]*RC[-2] -> 0.46447916666666483 | U303: =RC[-7]*RC[-3] -> 7.8993055555555225 | V303: =RC[-7]*RC[-4] -> -40.309027777777601 | W303: =RC[-7]*RC[-5] -> 14.715277777777708 | X303: =RC[-7]*RC[-6] -> -17.784722222222133 | Y303: =RC[-12]*RC[-12] -> 0.18382656250000015 | Z303: =RC[-12]*RC[-12] -> 53.168402777777793 | AA303: =RC[-12]*RC[-12] -> 1384.4600694444446 | AB303: =RC[-12]*RC[-12] -> 184.50694444444431 | AC303: =RC[-12]*RC[-12] -> 269.50694444444412 | AD303: =RC[-12]*RC[-12] -> 1.1736111111111009 | AE303: =RC[-11]/SQRT(RC[-6]*RC[-1]) -> 1 | AF303: =RC[-11]/SQRT(RC[-6]*RC[-2]) -> 1 | AG303: =RC[-11]/SQRT(RC[-6]*RC[-3]) -> -0.99999999999999978 | AH303: =RC[-11]/SQRT(RC[-6]*RC[-4]) -> 0.99999999999999989 | AI303: =RC[-11]/SQRT(RC[-6]*RC[-5]) -> -0.99999999999999978
A304: 23546 | B304: 北京 | C304: 159 | D304: 中度污染 | E304: 1.44 | F304: 19 | G304: 83 | H304: 49 | I304: 191 | J304: 125 | L304: 2013-06-04T03:00:00.000 | M304: =RC[-8]-R[21]C[-8] -> -0.42875000000000019 | N304: =RC[-8]-R[21]C[-8] -> -7.2916666666666679 | O304: =RC[-8]-R[21]C[-8] -> 26.208333333333336 | P304: =RC[-8]-R[21]C[-8] -> -22.583333333333329 | Q304: =RC[-8]-R[21]C[-8] -> 36.416666666666657 | R304: =RC[-8]-R[21]C[-8] -> -2.0833333333333286 | T304: =RC[-7]*RC[-2] -> 0.89322916666666508 | U304: =RC[-7]*RC[-3] -> 15.190972222222189 | V304: =RC[-7]*RC[-4] -> -54.600694444444322 | W304: =RC[-7]*RC[-5] -> 47.048611111110993 | X304: =RC[-7]*RC[-6] -> -75.868055555555358 | Y304: =RC[-12]*RC[-12] -> 0.18382656250000015 | Z304: =RC[-12]*RC[-12] -> 53.168402777777793 | AA304: =RC[-12]*RC[-12] -> 686.8767361111112 | AB304: =RC[-12]*RC[-12] -> 510.00694444444423 | AC304: =RC[-12]*RC[-12] -> 1326.1736111111104 | AD304: =RC[-12]*RC[-12] -> 4.3402777777777581 | AE304: =RC[-11]/SQRT(RC[-6]*RC[-1]) -> 1.0000000000000002 | AF304: =RC[-11]/SQRT(RC[-6]*RC[-2]) -> 1 | AG304: =RC[-11]/SQRT(RC[-6]*RC[-3]) -> -1 | AH304: =RC[-11]/SQRT(RC[-6]*RC[-4]) -> 1 | AI304: =RC[-11]/SQRT(RC[-6]*RC[-5]) -> -1
A305: 23622 | B305: 北京 | C305: 157 | D305: 中度污染 | E305: 1.61 | F305: 24 | G305: 77 | H305: 49 | I305: 215 | J305: 145 | L305: 2013-06-04T04:00:00.000 | M305: =RC[-8]-R[20]C[-8] -> -0.25875000000000004 | N305: =RC[-8]-R[20]C[-8] -> -2.2916666666666679 | O305: =RC[-8]-R[20]C[-8] -> 20.208333333333336 | P305: =RC[-8]-R[20]C[-8] -> -22.583333333333329 | Q305: =RC[-8]-R[20]C[-8] -> 60.416666666666657 | R305: =RC[-8]-R[20]C[-8] -> 17.916666666666671 | T305: =RC[-7]*RC[-2] -> -4.6359375000000016 | U305: =RC[-7]*RC[-3] -> -41.059027777777807 | V305: =RC[-7]*RC[-4] -> 362.06597222222234 | W305: =RC[-7]*RC[-5] -> -404.6180555555556 | X305: =RC[-7]*RC[-6] -> 1082.4652777777778 | Y305: =RC[-12]*RC[-12] -> 6.695156250000002E-2 | Z305: =RC[-12]*RC[-12] -> 5.2517361111111169 | AA305: =RC[-12]*RC[-12] -> 408.3767361111112 | AB305: =RC[-12]*RC[-12] -> 510.00694444444423 | AC305: =RC[-12]*RC[-12] -> 3650.1736111111099 | AD305: =RC[-12]*RC[-12] -> 321.00694444444463 | AE305: =RC[-11]/SQRT(RC[-6]*RC[-1]) -> -1 | AF305: =RC[-11]/SQRT(RC[-6]*RC[-2]) -> -0.99999999999999978 | AG305: =RC[-11]/SQRT(RC[-6]*RC[-3]) -> 1 | AH305: =RC[-11]/SQRT(RC[-6]*RC[-4]) -> -1.0000000000000002 | AI305: =RC[-11]/SQRT(RC[-6]*RC[-5]) -> 1
A306: 23698 | B306: 北京 | C306: 159 | D306: 中度污染 | E306: 1.77 | F306: 24 | G306: 38 | H306: 89 | I306: 247 | J306: 177 | L306: 2013-06-04T05:00:00.000 | M306: =RC[-8]-R[19]C[-8] -> -9.8750000000000115E-2 | N306: =RC[-8]-R[19]C[-8] -> -2.2916666666666679 | O306: =RC[-8]-R[19]C[-8] -> -18.791666666666664 | P306: =RC[-8]-R[19]C[-8] -> 17.416666666666671 | Q306: =RC[-8]-R[19]C[-8] -> 92.416666666666657 | R306: =RC[-8]-R[19]C[-8] -> 49.916666666666671 | T306: =RC[-7]*RC[-2] -> -4.9292708333333399 | U306: =RC[-7]*RC[-3] -> -114.39236111111119 | V306: =RC[-7]*RC[-4] -> -938.01736111111109 | W306: =RC[-7]*RC[-5] -> 869.3819444444448 | X306: =RC[-7]*RC[-6] -> 4613.1319444444443 | Y306: =RC[-12]*RC[-12] -> 9.7515625000000224E-3 | Z306: =RC[-12]*RC[-12] -> 5.2517361111111169 | AA306: =RC[-12]*RC[-12] -> 353.12673611111103 | AB306: =RC[-12]*RC[-12] -> 303.34027777777794 | AC306: =RC[-12]*RC[-12] -> 8540.8402777777756 | AD306: =RC[-12]*RC[-12] -> 2491.6736111111118 | AE306: =RC[-11]/SQRT(RC[-6]*RC[-1]) -> -1 | AF306: =RC[-11]/SQRT(RC[-6]*RC[-2]) -> -1 | AG306: =RC[-11]/SQRT(RC[-6]*RC[-3]) -> -1 | AH306: =RC[-11]/SQRT(RC[-6]*RC[-4]) -> 1 | AI306: =RC[-11]/SQRT(RC[-6]*RC[-5]) -> 1
A307: 23774 | B307: 北京 | C307: 159 | D307: 中度污染 | E307: 2.0099999999999998 | F307: 32 | G307: 40 | H307: 118 | I307: 232 | J307: 179 | L307: 2013-06-04T06:00:00.000 | M307: =RC[-8]-R[18]C[-8] -> 0.14124999999999965 | N307: =RC[-8]-R[18]C[-8] -> 5.7083333333333321 | O307: =RC[-8]-R[18]C[-8] -> -16.791666666666664 | P307: =RC[-8]-R[18]C[-8] -> 46.416666666666671 | Q307: =RC[-8]-R[18]C[-8] -> 77.416666666666657 | R307: =RC[-8]-R[18]C[-8] -> 51.916666666666671 | T307: =RC[-7]*RC[-2] -> 7.3332291666666496 | U307: =RC[-7]*RC[-3] -> 296.35763888888886 | V307: =RC[-7]*RC[-4] -> -871.76736111111109 | W307: =RC[-7]*RC[-5] -> 2409.7986111111118 | X307: =RC[-7]*RC[-6] -> 4019.2152777777778 | Y307: =RC[-12]*RC[-12] -> 1.9951562499999902E-2 | Z307: =RC[-12]*RC[-12] -> 32.585069444444429 | AA307: =RC[-12]*RC[-12] -> 281.96006944444434 | AB307: =RC[-12]*RC[-12] -> 2154.5069444444448 | AC307: =RC[-12]*RC[-12] -> 5993.3402777777765 | AD307: =RC[-12]*RC[-12] -> 2695.3402777777783 | AE307: =RC[-11]/SQRT(RC[-6]*RC[-1]) -> 1 | AF307: =RC[-11]/SQRT(RC[-6]*RC[-2]) -> 1 | AG307: =RC[-11]/SQRT(RC[-6]*RC[-3]) -> -1.0000000000000002 | AH307: =RC[-11]/SQRT(RC[-6]*RC[-4]) -> 1.0000000000000002 | AI307: =RC[-11]/SQRT(RC[-6]*RC[-5]) -> 1
A308: 23850 | B308: 北京 | C308: 160 | D308: 中度污染 | E308: 2.38 | F308: 45 | G308: 41 | H308: 123 | I308: 215 | J308: 181 | L308: 2013-06-04T07:00:00.000 | M308: =RC[-8]-R[17]C[-8] -> 0.51124999999999976 | N308: =RC[-8]-R[17]C[-8] -> 18.708333333333332 | O308: =RC[-8]-R[17]C[-8] -> -15.791666666666664 | P308: =RC[-8]-R[17]C[-8] -> 51.416666666666671 | Q308: =RC[-8]-R[17]C[-8] -> 60.416666666666657 | R308: =RC[-8]-R[17]C[-8] -> 53.916666666666671 | T308: =RC[-7]*RC[-2] -> 27.564895833333324 | U308: =RC[-7]*RC[-3] -> 1008.6909722222223 | V308: =RC[-7]*RC[-4] -> -851.43402777777771 | W308: =RC[-7]*RC[-5] -> 2772.2152777777783 | X308: =RC[-7]*RC[-6] -> 3257.4652777777774 | Y308: =RC[-12]*RC[-12] -> 0.26137656249999974 | Z308: =RC[-12]*RC[-12] -> 350.00173611111109 | AA308: =RC[-12]*RC[-12] -> 249.37673611111103 | AB308: =RC[-12]*RC[-12] -> 2643.6736111111118 | AC308: =RC[-12]*RC[-12] -> 3650.1736111111099 | AD308: =RC[-12]*RC[-12] -> 2907.0069444444448 | AE308: =RC[-11]/SQRT(RC[-6]*RC[-1]) -> 1.0000000000000002 | AF308: =RC[-11]/SQRT(RC[-6]*RC[-2]) -> 1 | AG308: =RC[-11]/SQRT(RC[-6]*RC[-3]) -> -1 | AH308: =RC[-11]/SQRT(RC[-6]*RC[-4]) -> 1 | AI308: =RC[-11]/SQRT(RC[-6]*RC[-5]) -> 1
A309: 23926 | B309: 北京 | C309: 160 | D309: 中度污染 | E309: 2.4500000000000002 | F309: 51 | G309: 46 | H309: 116 | I309: 201 | J309: 181 | L309: 2013-06-04T08:00:00.000 | M309: =RC[-8]-R[16]C[-8] -> 0.58125000000000004 | N309: =RC[-8]-R[16]C[-8] -> 24.708333333333332 | O309: =RC[-8]-R[16]C[-8] -> -10.791666666666664 | P309: =RC[-8]-R[16]C[-8] -> 44.416666666666671 | Q309: =RC[-8]-R[16]C[-8] -> 46.416666666666657 | R309: =RC[-8]-R[16]C[-8] -> 53.916666666666671 | T309: =RC[-7]*RC[-2] -> 31.339062500000004 | U309: =RC[-7]*RC[-3] -> 1332.1909722222222 | V309: =RC[-7]*RC[-4] -> -581.85069444444434 | W309: =RC[-7]*RC[-5] -> 2394.7986111111118 | X309: =RC[-7]*RC[-6] -> 2502.6319444444443 | Y309: =RC[-12]*RC[-12] -> 0.33785156250000004 | Z309: =RC[-12]*RC[-12] -> 610.50173611111109 | AA309: =RC[-12]*RC[-12] -> 116.4600694444444 | AB309: =RC[-12]*RC[-12] -> 1972.8402777777783 | AC309: =RC[-12]*RC[-12] -> 2154.5069444444434 | AD309: =RC[-12]*RC[-12] -> 2907.0069444444448 | AE309: =RC[-11]/SQRT(RC[-6]*RC[-1]) -> 1 | AF309: =RC[-11]/SQRT(RC[-6]*RC[-2]) -> 1 | AG309: =RC[-11]/SQRT(RC[-6]*RC[-3]) -> -1 | AH309: =RC[-11]/SQRT(RC[-6]*RC[-4]) -> 1 | AI309: =RC[-11]/SQRT(RC[-6]*RC[-5]) -> 1.0000000000000002
A310: 24002 | B310: 北京 | C310: 160 | D310: 中度污染 | E310: 2.33 | F310: 49 | G310: 46 | H310: 112 | I310: 174 | J310: 168 | L310: 2013-06-04T09:00:00.000 | M310: =RC[-8]-R[15]C[-8] -> 0.46124999999999994 | N310: =RC[-8]-R[15]C[-8] -> 22.708333333333332 | O310: =RC[-8]-R[15]C[-8] -> -10.791666666666664 | P310: =RC[-8]-R[15]C[-8] -> 40.416666666666671 | Q310: =RC[-8]-R[15]C[-8] -> 19.416666666666657 | R310: =RC[-8]-R[15]C[-8] -> 40.916666666666671 | T310: =RC[-7]*RC[-2] -> 18.872812499999998 | U310: =RC[-7]*RC[-3] -> 929.14930555555566 | V310: =RC[-7]*RC[-4] -> -441.55902777777771 | W310: =RC[-7]*RC[-5] -> 1653.7152777777781 | X310: =RC[-7]*RC[-6] -> 794.46527777777749 | Y310: =RC[-12]*RC[-12] -> 0.21275156249999994 | Z310: =RC[-12]*RC[-12] -> 515.66840277777771 | AA310: =RC[-12]*RC[-12] -> 116.4600694444444 | AB310: =RC[-12]*RC[-12] -> 1633.5069444444448 | AC310: =RC[-12]*RC[-12] -> 377.00694444444406 | AD310: =RC[-12]*RC[-12] -> 1674.1736111111115 | AE310: =RC[-11]/SQRT(RC[-6]*RC[-1]) -> 1 | AF310: =RC[-11]/SQRT(RC[-6]*RC[-2]) -> 1 | AG310: =RC[-11]/SQRT(RC[-6]*RC[-3]) -> -1 | AH310: =RC[-11]/SQRT(RC[-6]*RC[-4]) -> 1 | AI310: =RC[-11]/SQRT(RC[-6]*RC[-5]) -> 1
A311: 24078 | B311: 北京 | C311: 159 | D311: 中度污染 | E311: 2.4 | F311: 47 | G311: 49 | H311: 100 | I311: 169 | J311: 161 | L311: 2013-06-04T10:00:00.000 | M311: =RC[-8]-R[14]C[-8] -> 0.53124999999999978 | N311: =RC[-8]-R[14]C[-8] -> 20.708333333333332 | O311: =RC[-8]-R[14]C[-8] -> -7.7916666666666643 | P311: =RC[-8]-R[14]C[-8] -> 28.416666666666671 | Q311: =RC[-8]-R[14]C[-8] -> 14.416666666666657 | R311: =RC[-8]-R[14]C[-8] -> 33.916666666666671 | T311: =RC[-7]*RC[-2] -> 18.018229166666661 | U311: =RC[-7]*RC[-3] -> 702.35763888888891 | V311: =RC[-7]*RC[-4] -> -264.26736111111109 | W311: =RC[-7]*RC[-5] -> 963.79861111111143 | X311: =RC[-7]*RC[-6] -> 488.96527777777754 | Y311: =RC[-12]*RC[-12] -> 0.28222656249999978 | Z311: =RC[-12]*RC[-12] -> 428.8350694444444 | AA311: =RC[-12]*RC[-12] -> 60.710069444444407 | AB311: =RC[-12]*RC[-12] -> 807.50694444444468 | AC311: =RC[-12]*RC[-12] -> 207.84027777777752 | AD311: =RC[-12]*RC[-12] -> 1150.3402777777781 | AE311: =RC[-11]/SQRT(RC[-6]*RC[-1]) -> 1 | AF311: =RC[-11]/SQRT(RC[-6]*RC[-2]) -> 1 | AG311: =RC[-11]/SQRT(RC[-6]*RC[-3]) -> -1 | AH311: =RC[-11]/SQRT(RC[-6]*RC[-4]) -> 1 | AI311: =RC[-11]/SQRT(RC[-6]*RC[-5]) -> 1
A312: 24154 | B312: 北京 | C312: 159 | D312: 中度污染 | E312: 2.4700000000000002 | F312: 45 | G312: 49 | H312: 89 | I312: 165 | J312: 155 | L312: 2013-06-04T11:00:00.000 | M312: =RC[-8]-R[13]C[-8] -> 0.60125000000000006 | N312: =RC[-8]-R[13]C[-8] -> 18.708333333333332 | O312: =RC[-8]-R[13]C[-8] -> -7.7916666666666643 | P312: =RC[-8]-R[13]C[-8] -> 17.416666666666671 | Q312: =RC[-8]-R[13]C[-8] -> 10.416666666666657 | R312: =RC[-8]-R[13]C[-8] -> 27.916666666666671 | T312: =RC[-7]*RC[-2] -> 16.784895833333337 | U312: =RC[-7]*RC[-3] -> 522.27430555555566 | V312: =RC[-7]*RC[-4] -> -217.51736111111109 | W312: =RC[-7]*RC[-5] -> 486.215277777778 | X312: =RC[-7]*RC[-6] -> 290.79861111111092 | Y312: =RC[-12]*RC[-12] -> 0.3615015625000001 | Z312: =RC[-12]*RC[-12] -> 350.00173611111109 | AA312: =RC[-12]*RC[-12] -> 60.710069444444407 | AB312: =RC[-12]*RC[-12] -> 303.34027777777794 | AC312: =RC[-12]*RC[-12] -> 108.50694444444424 | AD312: =RC[-12]*RC[-12] -> 779.34027777777806 | AE312: =RC[-11]/SQRT(RC[-6]*RC[-1]) -> 0.99999999999999978 | AF312: =RC[-11]/SQRT(RC[-6]*RC[-2]) -> 1 | AG312: =RC[-11]/SQRT(RC[-6]*RC[-3]) -> -1 | AH312: =RC[-11]/SQRT(RC[-6]*RC[-4]) -> 1 | AI312: =RC[-11]/SQRT(RC[-6]*RC[-5]) -> 1
A313: 24230 | B313: 北京 | C313: 162 | D313: 中度污染 | E313: 2.41 | F313: 44 | G313: 52 | H313: 76 | I313: 173 | J313: 150 | L313: 2013-06-04T12:00:00.000 | M313: =RC[-8]-R[12]C[-8] -> 0.54125000000000001 | N313: =RC[-8]-R[12]C[-8] -> 17.708333333333332 | O313: =RC[-8]-R[12]C[-8] -> -4.7916666666666643 | P313: =RC[-8]-R[12]C[-8] -> 4.4166666666666714 | Q313: =RC[-8]-R[12]C[-8] -> 18.416666666666657 | R313: =RC[-8]-R[12]C[-8] -> 22.916666666666671 | T313: =RC[-7]*RC[-2] -> 12.403645833333336 | U313: =RC[-7]*RC[-3] -> 405.81597222222229 | V313: =RC[-7]*RC[-4] -> -109.80902777777774 | W313: =RC[-7]*RC[-5] -> 101.21527777777791 | X313: =RC[-7]*RC[-6] -> 422.04861111111097 | Y313: =RC[-12]*RC[-12] -> 0.29295156249999998 | Z313: =RC[-12]*RC[-12] -> 313.5850694444444 | AA313: =RC[-12]*RC[-12] -> 22.960069444444422 | AB313: =RC[-12]*RC[-12] -> 19.506944444444485 | AC313: =RC[-12]*RC[-12] -> 339.17361111111074 | AD313: =RC[-12]*RC[-12] -> 525.17361111111131 | AE313: =RC[-11]/SQRT(RC[-6]*RC[-1]) -> 1 | AF313: =RC[-11]/SQRT(RC[-6]*RC[-2]) -> 1 | AG313: =RC[-11]/SQRT(RC[-6]*RC[-3]) -> -1 | AH313: =RC[-11]/SQRT(RC[-6]*RC[-4]) -> 1.0000000000000002 | AI313: =RC[-11]/SQRT(RC[-6]*RC[-5]) -> 1
A314: 24306 | B314: 北京 | C314: 165 | D314: 中度污染 | E314: 2.37 | F314: 44 | G314: 51 | H314: 68 | I314: 153 | J314: 119 | L314: 2013-06-04T13:00:00.000 | M314: =RC[-8]-R[11]C[-8] -> 0.50124999999999997 | N314: =RC[-8]-R[11]C[-8] -> 17.708333333333332 | O314: =RC[-8]-R[11]C[-8] -> -5.7916666666666643 | P314: =RC[-8]-R[11]C[-8] -> -3.5833333333333286 | Q314: =RC[-8]-R[11]C[-8] -> -1.5833333333333428 | R314: =RC[-8]-R[11]C[-8] -> -8.0833333333333286 | T314: =RC[-7]*RC[-2] -> -4.0517708333333307 | U314: =RC[-7]*RC[-3] -> -143.14236111111103 | V314: =RC[-7]*RC[-4] -> 46.815972222222179 | W314: =RC[-7]*RC[-5] -> 28.965277777777722 | X314: =RC[-7]*RC[-6] -> 12.79861111111118 | Y314: =RC[-12]*RC[-12] -> 0.25125156249999997 | Z314: =RC[-12]*RC[-12] -> 313.5850694444444 | AA314: =RC[-12]*RC[-12] -> 33.54340277777775 | AB314: =RC[-12]*RC[-12] -> 12.840277777777743 | AC314: =RC[-12]*RC[-12] -> 2.5069444444444744 | AD314: =RC[-12]*RC[-12] -> 65.3402777777777 | AE314: =RC[-11]/SQRT(RC[-6]*RC[-1]) -> -1 | AF314: =RC[-11]/SQRT(RC[-6]*RC[-2]) -> -1.0000000000000002 | AG314: =RC[-11]/SQRT(RC[-6]*RC[-3]) -> 1 | AH314: =RC[-11]/SQRT(RC[-6]*RC[-4]) -> 1 | AI314: =RC[-11]/SQRT(RC[-6]*RC[-5]) -> 1
A315: 24382 | B315: 北京 | C315: 169 | D315: 中度污染 | E315: 2.2000000000000002 | F315: 32 | G315: 48 | H315: 60 | I315: 160 | J315: 116 | L315: 2013-06-04T14:00:00.000 | M315: =RC[-8]-R[10]C[-8] -> 0.33125000000000004 | N315: =RC[-8]-R[10]C[-8] -> 5.7083333333333321 | O315: =RC[-8]-R[10]C[-8] -> -8.7916666666666643 | P315: =RC[-8]-R[10]C[-8] -> -11.583333333333329 | Q315: =RC[-8]-R[10]C[-8] -> 5.4166666666666572 | R315: =RC[-8]-R[10]C[-8] -> -11.083333333333329 | T315: =RC[-7]*RC[-2] -> -3.6713541666666658 | U315: =RC[-7]*RC[-3] -> -63.267361111111072 | V315: =RC[-7]*RC[-4] -> 97.440972222222157 | W315: =RC[-7]*RC[-5] -> 128.38194444444434 | X315: =RC[-7]*RC[-6] -> -60.034722222222094 | Y315: =RC[-12]*RC[-12] -> 0.10972656250000003 | Z315: =RC[-12]*RC[-12] -> 32.585069444444429 | AA315: =RC[-12]*RC[-12] -> 77.293402777777743 | AB315: =RC[-12]*RC[-12] -> 134.173611111111 | AC315: =RC[-12]*RC[-12] -> 29.340277777777676 | AD315: =RC[-12]*RC[-12] -> 122.84027777777767 | AE315: =RC[-11]/SQRT(RC[-6]*RC[-1]) -> -1.0000000000000002 | AF315: =RC[-11]/SQRT(RC[-6]*RC[-2]) -> -1 | AG315: =RC[-11]/SQRT(RC[-6]*RC[-3]) -> 1 | AH315: =RC[-11]/SQRT(RC[-6]*RC[-4]) -> 1 | AI315: =RC[-11]/SQRT(RC[-6]*RC[-5]) -> -1
A316: 24458 | B316: 北京 | C316: 171 | D316: 中度污染 | E316: 2.0699999999999998 | F316: 21 | G316: 48 | H316: 55 | I316: 159 | J316: 98 | L316: 2013-06-04T15:00:00.000 | M316: =RC[-8]-R[9]C[-8] -> 0.20124999999999971 | N316: =RC[-8]-R[9]C[-8] -> -5.2916666666666679 | O316: =RC[-8]-R[9]C[-8] -> -8.7916666666666643 | P316: =RC[-8]-R[9]C[-8] -> -16.583333333333329 | Q316: =RC[-8]-R[9]C[-8] -> 4.4166666666666572 | R316: =RC[-8]-R[9]C[-8] -> -29.083333333333329 | T316: =RC[-7]*RC[-2] -> -5.853020833333324 | U316: =RC[-7]*RC[-3] -> 153.89930555555557 | V316: =RC[-7]*RC[-4] -> 255.69097222222211 | W316: =RC[-7]*RC[-5] -> 482.29861111111092 | X316: =RC[-7]*RC[-6] -> -128.4513888888886 | Y316: =RC[-12]*RC[-12] -> 4.050156249999988E-2 | Z316: =RC[-12]*RC[-12] -> 28.001736111111125 | AA316: =RC[-12]*RC[-12] -> 77.293402777777743 | AB316: =RC[-12]*RC[-12] -> 275.00694444444429 | AC316: =RC[-12]*RC[-12] -> 19.506944444444361 | AD316: =RC[-12]*RC[-12] -> 845.84027777777749 | AE316: =RC[-11]/SQRT(RC[-6]*RC[-1]) -> -1.0000000000000002 | AF316: =RC[-11]/SQRT(RC[-6]*RC[-2]) -> 1 | AG316: =RC[-11]/SQRT(RC[-6]*RC[-3]) -> 1 | AH316: =RC[-11]/SQRT(RC[-6]*RC[-4]) -> 1.0000000000000002 | AI316: =RC[-11]/SQRT(RC[-6]*RC[-5]) -> -1
A317: 24534 | B317: 北京 | C317: 174 | D317: 中度污染 | E317: 1.7 | F317: 17 | G317: 39 | H317: 65 | I317: 85 | J317: 92 | L317: 2013-06-04T16:00:00.000 | M317: =RC[-8]-R[8]C[-8] -> -0.16875000000000018 | N317: =RC[-8]-R[8]C[-8] -> -9.2916666666666679 | O317: =RC[-8]-R[8]C[-8] -> -17.791666666666664 | P317: =RC[-8]-R[8]C[-8] -> -6.5833333333333286 | Q317: =RC[-8]-R[8]C[-8] -> -69.583333333333343 | R317: =RC[-8]-R[8]C[-8] -> -35.083333333333329 | T317: =RC[-7]*RC[-2] -> 5.9203125000000059 | U317: =RC[-7]*RC[-3] -> 325.98263888888891 | V317: =RC[-7]*RC[-4] -> 624.19097222222206 | W317: =RC[-7]*RC[-5] -> 230.96527777777757 | X317: =RC[-7]*RC[-6] -> 2441.2152777777778 | Y317: =RC[-12]*RC[-12] -> 2.8476562500000059E-2 | Z317: =RC[-12]*RC[-12] -> 86.335069444444471 | AA317: =RC[-12]*RC[-12] -> 316.54340277777771 | AB317: =RC[-12]*RC[-12] -> 43.340277777777715 | AC317: =RC[-12]*RC[-12] -> 4841.8402777777792 | AD317: =RC[-12]*RC[-12] -> 1230.8402777777774 | AE317: =RC[-11]/SQRT(RC[-6]*RC[-1]) -> 1.0000000000000002 | AF317: =RC[-11]/SQRT(RC[-6]*RC[-2]) -> 1 | AG317: =RC[-11]/SQRT(RC[-6]*RC[-3]) -> 1 | AH317: =RC[-11]/SQRT(RC[-6]*RC[-4]) -> 1 | AI317: =RC[-11]/SQRT(RC[-6]*RC[-5]) -> 1
A318: 24610 | B318: 北京 | C318: 174 | D318: 中度污染 | E318: 1.53 | F318: 17 | G318: 39 | H318: 71 | I318: 97 | J318: 90 | L318: 2013-06-04T17:00:00.000 | M318: =RC[-8]-R[7]C[-8] -> -0.33875000000000011 | N318: =RC[-8]-R[7]C[-8] -> -9.2916666666666679 | O318: =RC[-8]-R[7]C[-8] -> -17.791666666666664 | P318: =RC[-8]-R[7]C[-8] -> -0.5833333333333286 | Q318: =RC[-8]-R[7]C[-8] -> -57.583333333333343 | R318: =RC[-8]-R[7]C[-8] -> -37.083333333333329 | T318: =RC[-7]*RC[-2] -> 12.561979166666669 | U318: =RC[-7]*RC[-3] -> 344.56597222222223 | V318: =RC[-7]*RC[-4] -> 659.77430555555543 | W318: =RC[-7]*RC[-5] -> 21.631944444444265 | X318: =RC[-7]*RC[-6] -> 2135.3819444444443 | Y318: =RC[-12]*RC[-12] -> 0.11475156250000007 | Z318: =RC[-12]*RC[-12] -> 86.335069444444471 | AA318: =RC[-12]*RC[-12] -> 316.54340277777771 | AB318: =RC[-12]*RC[-12] -> 0.34027777777777224 | AC318: =RC[-12]*RC[-12] -> 3315.8402777777787 | AD318: =RC[-12]*RC[-12] -> 1375.1736111111109 | AE318: =RC[-11]/SQRT(RC[-6]*RC[-1]) -> 1 | AF318: =RC[-11]/SQRT(RC[-6]*RC[-2]) -> 1 | AG318: =RC[-11]/SQRT(RC[-6]*RC[-3]) -> 1 | AH318: =RC[-11]/SQRT(RC[-6]*RC[-4]) -> 1 | AI318: =RC[-11]/SQRT(RC[-6]*RC[-5]) -> 1
A319: 24686 | B319: 北京 | C319: 173 | D319: 中度污染 | E319: 1.48 | F319: 15 | G319: 46 | H319: 65 | I319: 78 | J319: 85 | L319: 2013-06-04T18:00:00.000 | M319: =RC[-8]-R[6]C[-8] -> -0.38875000000000015 | N319: =RC[-8]-R[6]C[-8] -> -11.291666666666668 | O319: =RC[-8]-R[6]C[-8] -> -10.791666666666664 | P319: =RC[-8]-R[6]C[-8] -> -6.5833333333333286 | Q319: =RC[-8]-R[6]C[-8] -> -76.583333333333343 | R319: =RC[-8]-R[6]C[-8] -> -42.083333333333329 | T319: =RC[-7]*RC[-2] -> 16.359895833333336 | U319: =RC[-7]*RC[-3] -> 475.19097222222223 | V319: =RC[-7]*RC[-4] -> 454.14930555555543 | W319: =RC[-7]*RC[-5] -> 277.04861111111086 | X319: =RC[-7]*RC[-6] -> 3222.8819444444443 | Y319: =RC[-12]*RC[-12] -> 0.15112656250000012 | Z319: =RC[-12]*RC[-12] -> 127.50173611111114 | AA319: =RC[-12]*RC[-12] -> 116.4600694444444 | AB319: =RC[-12]*RC[-12] -> 43.340277777777715 | AC319: =RC[-12]*RC[-12] -> 5865.0069444444462 | AD319: =RC[-12]*RC[-12] -> 1771.0069444444441 | AE319: =RC[-11]/SQRT(RC[-6]*RC[-1]) -> 1 | AF319: =RC[-11]/SQRT(RC[-6]*RC[-2]) -> 1 | AG319: =RC[-11]/SQRT(RC[-6]*RC[-3]) -> 1 | AH319: =RC[-11]/SQRT(RC[-6]*RC[-4]) -> 0.99999999999999978 | AI319: =RC[-11]/SQRT(RC[-6]*RC[-5]) -> 1
A320: 24762 | B320: 北京 | C320: 173 | D320: 中度污染 | E320: 1.52 | F320: 14 | G320: 49 | H320: 61 | I320: 82 | J320: 85 | L320: 2013-06-04T19:00:00.000 | M320: =RC[-8]-R[5]C[-8] -> -0.34875000000000012 | N320: =RC[-8]-R[5]C[-8] -> -12.291666666666668 | O320: =RC[-8]-R[5]C[-8] -> -7.7916666666666643 | P320: =RC[-8]-R[5]C[-8] -> -10.583333333333329 | Q320: =RC[-8]-R[5]C[-8] -> -72.583333333333343 | R320: =RC[-8]-R[5]C[-8] -> -42.083333333333329 | T320: =RC[-7]*RC[-2] -> 14.676562500000003 | U320: =RC[-7]*RC[-3] -> 517.27430555555554 | V320: =RC[-7]*RC[-4] -> 327.89930555555543 | W320: =RC[-7]*RC[-5] -> 445.38194444444417 | X320: =RC[-7]*RC[-6] -> 3054.5486111111113 | Y320: =RC[-12]*RC[-12] -> 0.12162656250000008 | Z320: =RC[-12]*RC[-12] -> 151.08506944444449 | AA320: =RC[-12]*RC[-12] -> 60.710069444444407 | AB320: =RC[-12]*RC[-12] -> 112.00694444444434 | AC320: =RC[-12]*RC[-12] -> 5268.3402777777792 | AD320: =RC[-12]*RC[-12] -> 1771.0069444444441 | AE320: =RC[-11]/SQRT(RC[-6]*RC[-1]) -> 1 | AF320: =RC[-11]/SQRT(RC[-6]*RC[-2]) -> 1 | AG320: =RC[-11]/SQRT(RC[-6]*RC[-3]) -> 1 | AH320: =RC[-11]/SQRT(RC[-6]*RC[-4]) -> 0.99999999999999989 | AI320: =RC[-11]/SQRT(RC[-6]*RC[-5]) -> 1
A321: 24838 | B321: 北京 | C321: 172 | D321: 中度污染 | E321: 1.56 | F321: 13 | G321: 51 | H321: 53 | I321: 95 | J321: 86 | L321: 2013-06-04T20:00:00.000 | M321: =RC[-8]-R[4]C[-8] -> -0.30875000000000008 | N321: =RC[-8]-R[4]C[-8] -> -13.291666666666668 | O321: =RC[-8]-R[4]C[-8] -> -5.7916666666666643 | P321: =RC[-8]-R[4]C[-8] -> -18.583333333333329 | Q321: =RC[-8]-R[4]C[-8] -> -59.583333333333343 | R321: =RC[-8]-R[4]C[-8] -> -41.083333333333329 | T321: =RC[-7]*RC[-2] -> 12.684479166666668 | U321: =RC[-7]*RC[-3] -> 546.06597222222217 | V321: =RC[-7]*RC[-4] -> 237.94097222222209 | W321: =RC[-7]*RC[-5] -> 763.46527777777749 | X321: =RC[-7]*RC[-6] -> 2447.8819444444443 | Y321: =RC[-12]*RC[-12] -> 9.5326562500000045E-2 | Z321: =RC[-12]*RC[-12] -> 176.6684027777778 | AA321: =RC[-12]*RC[-12] -> 33.54340277777775 | AB321: =RC[-12]*RC[-12] -> 345.3402777777776 | AC321: =RC[-12]*RC[-12] -> 3550.1736111111122 | AD321: =RC[-12]*RC[-12] -> 1687.8402777777774 | AE321: =RC[-11]/SQRT(RC[-6]*RC[-1]) -> 1 | AF321: =RC[-11]/SQRT(RC[-6]*RC[-2]) -> 1 | AG321: =RC[-11]/SQRT(RC[-6]*RC[-3]) -> 1 | AH321: =RC[-11]/SQRT(RC[-6]*RC[-4]) -> 1 | AI321: =RC[-11]/SQRT(RC[-6]*RC[-5]) -> 1
A322: 24914 | B322: 北京 | C322: 171 | D322: 中度污染 | E322: 1.54 | F322: 11 | G322: 50 | H322: 47 | I322: 108 | J322: 96 | L322: 2013-06-04T21:00:00.000 | M322: =RC[-8]-R[3]C[-8] -> -0.3287500000000001 | N322: =RC[-8]-R[3]C[-8] -> -15.291666666666668 | O322: =RC[-8]-R[3]C[-8] -> -6.7916666666666643 | P322: =RC[-8]-R[3]C[-8] -> -24.583333333333329 | Q322: =RC[-8]-R[3]C[-8] -> -46.583333333333343 | R322: =RC[-8]-R[3]C[-8] -> -31.083333333333329 | T322: =RC[-7]*RC[-2] -> 10.218645833333335 | U322: =RC[-7]*RC[-3] -> 475.31597222222217 | V322: =RC[-7]*RC[-4] -> 211.10763888888877 | W322: =RC[-7]*RC[-5] -> 764.13194444444423 | X322: =RC[-7]*RC[-6] -> 1447.9652777777778 | Y322: =RC[-12]*RC[-12] -> 0.10807656250000007 | Z322: =RC[-12]*RC[-12] -> 233.83506944444449 | AA322: =RC[-12]*RC[-12] -> 46.126736111111079 | AB322: =RC[-12]*RC[-12] -> 604.3402777777776 | AC322: =RC[-12]*RC[-12] -> 2170.0069444444453 | AD322: =RC[-12]*RC[-12] -> 966.17361111111086 | AE322: =RC[-11]/SQRT(RC[-6]*RC[-1]) -> 1 | AF322: =RC[-11]/SQRT(RC[-6]*RC[-2]) -> 0.99999999999999989 | AG322: =RC[-11]/SQRT(RC[-6]*RC[-3]) -> 1 | AH322: =RC[-11]/SQRT(RC[-6]*RC[-4]) -> 1 | AI322: =RC[-11]/SQRT(RC[-6]*RC[-5]) -> 1
A323: 24990 | B323: 北京 | C323: 170 | D323: 中度污染 | E323: 1.43 | F323: 9 | G323: 42 | H323: 51 | I323: 90 | J323: 88 | L323: 2013-06-04T22:00:00.000 | M323: =RC[-8]-R[2]C[-8] -> -0.4387500000000002 | N323: =RC[-8]-R[2]C[-8] -> -17.291666666666668 | O323: =RC[-8]-R[2]C[-8] -> -14.791666666666664 | P323: =RC[-8]-R[2]C[-8] -> -20.583333333333329 | Q323: =RC[-8]-R[2]C[-8] -> -64.583333333333343 | R323: =RC[-8]-R[2]C[-8] -> -39.083333333333329 | T323: =RC[-7]*RC[-2] -> 17.147812500000004 | U323: =RC[-7]*RC[-3] -> 675.81597222222217 | V323: =RC[-7]*RC[-4] -> 578.10763888888869 | W323: =RC[-7]*RC[-5] -> 804.46527777777749 | X323: =RC[-7]*RC[-6] -> 2524.1319444444443 | Y323: =RC[-12]*RC[-12] -> 0.19250156250000017 | Z323: =RC[-12]*RC[-12] -> 299.00173611111114 | AA323: =RC[-12]*RC[-12] -> 218.79340277777771 | AB323: =RC[-12]*RC[-12] -> 423.67361111111092 | AC323: =RC[-12]*RC[-12] -> 4171.0069444444453 | AD323: =RC[-12]*RC[-12] -> 1527.5069444444441 | AE323: =RC[-11]/SQRT(RC[-6]*RC[-1]) -> 1 | AF323: =RC[-11]/SQRT(RC[-6]*RC[-2]) -> 1 | AG323: =RC[-11]/SQRT(RC[-6]*RC[-3]) -> 0.99999999999999978 | AH323: =RC[-11]/SQRT(RC[-6]*RC[-4]) -> 1 | AI323: =RC[-11]/SQRT(RC[-6]*RC[-5]) -> 1
A324: 25066 | B324: 北京 | C324: 167 | D324: 中度污染 | E324: 1.34 | F324: 6 | G324: 42 | H324: 41 | I324: 101 | J324: 84 | L324: 2013-06-04T23:00:00.000 | M324: =RC[-8]-R[1]C[-8] -> -0.52875000000000005 | N324: =RC[-8]-R[1]C[-8] -> -20.291666666666668 | O324: =RC[-8]-R[1]C[-8] -> -14.791666666666664 | P324: =RC[-8]-R[1]C[-8] -> -30.583333333333329 | Q324: =RC[-8]-R[1]C[-8] -> -53.583333333333343 | R324: =RC[-8]-R[1]C[-8] -> -43.083333333333329 | T324: =RC[-7]*RC[-2] -> 22.780312500000001 | U324: =RC[-7]*RC[-3] -> 874.2326388888888 | V324: =RC[-7]*RC[-4] -> 637.27430555555543 | W324: =RC[-7]*RC[-5] -> 1317.6319444444441 | X324: =RC[-7]*RC[-6] -> 2308.5486111111113 | Y324: =RC[-12]*RC[-12] -> 0.27957656250000007 | Z324: =RC[-12]*RC[-12] -> 411.75173611111114 | AA324: =RC[-12]*RC[-12] -> 218.79340277777771 | AB324: =RC[-12]*RC[-12] -> 935.34027777777749 | AC324: =RC[-12]*RC[-12] -> 2871.1736111111122 | AD324: =RC[-12]*RC[-12] -> 1856.1736111111106 | AE324: =RC[-11]/SQRT(RC[-6]*RC[-1]) -> 1 | AF324: =RC[-11]/SQRT(RC[-6]*RC[-2]) -> 1 | AG324: =RC[-11]/SQRT(RC[-6]*RC[-3]) -> 1 | AH324: =RC[-11]/SQRT(RC[-6]*RC[-4]) -> 1 | AI324: =RC[-11]/SQRT(RC[-6]*RC[-5]) -> 1
E325: =AVERAGE(R[-24]C:R[-1]C) -> 1.8687500000000001 | F325: =AVERAGE(R[-24]C:R[-1]C) -> 26.291666666666668 | G325: =AVERAGE(R[-24]C:R[-1]C) -> 56.791666666666664 | H325: =AVERAGE(R[-24]C:R[-1]C) -> 71.583333333333329 | I325: =AVERAGE(R[-24]C:R[-1]C) -> 154.58333333333334 | J325: =AVERAGE(R[-24]C:R[-1]C) -> 127.08333333333333 | M325: =RC[-8]-RC[-8] -> 0 | N325: =RC[-8]-RC[-8] -> 0 | O325: =RC[-8]-RC[-8] -> 0 | P325: =RC[-8]-RC[-8] -> 0 | Q325: =RC[-8]-RC[-8] -> 0 | R325: =RC[-8]-RC[-8] -> 0 | T325: =SUM(R[-24]C:R[-1]C) -> 221.29250000000005 | U325: =SUM(R[-24]C:R[-1]C) -> 9160.4166666666679 | V325: =SUM(R[-24]C:R[-1]C) -> 682.41666666666697 | W325: =SUM(R[-24]C:R[-1]C) -> 16399.833333333328 | X325: =SUM(R[-24]C:R[-1]C) -> 36965.833333333328 | Y325: =SUM(R[-24]C:R[-1]C) -> 3.7828624999999994 | Z325: =SUM(R[-24]C:R[-1]C) -> 4856.9583333333339 | AA325: =SUM(R[-24]C:R[-1]C) -> 13851.958333333339 | AB325: =SUM(R[-24]C:R[-1]C) -> 14981.833333333334 | AC325: =SUM(R[-24]C:R[-1]C) -> 59575.833333333336 | AD325: =SUM(R[-24]C:R[-1]C) -> 28715.833333333332 | AE325: =RC[-11]/SQRT(RC[-6]*RC[-1]) -> 0.67142221318512141 | AF325: =RC[-11]/SQRT(RC[-6]*RC[-2]) -> 0.7756616635856447 | AG325: =RC[-11]/SQRT(RC[-6]*RC[-3]) -> 3.4216322039712137E-2 | AH325: =RC[-11]/SQRT(RC[-6]*RC[-4]) -> 0.79067178572947217 | AI325: =RC[-11]/SQRT(RC[-6]*RC[-5]) -> 0.89372668664042321
A326: 25142 | B326: 北京 | C326: 165 | D326: 中度污染 | E326: 1.32 | F326: 6 | G326: 44 | H326: 38 | I326: 75 | J326: 83 | L326: 2013-06-05T00:00:00.000 | M326: =RC[-8]-R[24]C[-8] -> -0.34791666666666643 | N326: =RC[-8]-R[24]C[-8] -> -0.41666666666666696 | O326: =RC[-8]-R[24]C[-8] -> 1.7916666666666643 | P326: =RC[-8]-R[24]C[-8] -> 11.958333333333332 | Q326: =RC[-8]-R[24]C[-8] -> -41.583333333333329 | R326: =RC[-8]-R[24]C[-8] -> -41.625 | T326: =RC[-7]*RC[-2] -> 14.48203124999999 | U326: =RC[-7]*RC[-3] -> 17.343750000000011 | V326: =RC[-7]*RC[-4] -> -74.578124999999901 | W326: =RC[-7]*RC[-5] -> -497.76562499999994 | X326: =RC[-7]*RC[-6] -> 1730.9062499999998 | Y326: =RC[-12]*RC[-12] -> 0.12104600694444428 | Z326: =RC[-12]*RC[-12] -> 0.17361111111111135 | AA326: =RC[-12]*RC[-12] -> 3.2100694444444358 | AB326: =RC[-12]*RC[-12] -> 143.00173611111109 | AC326: =RC[-12]*RC[-12] -> 1729.1736111111106 | AD326: =RC[-12]*RC[-12] -> 1732.640625 | AE326: =RC[-11]/SQRT(RC[-6]*RC[-1]) -> 1 | AF326: =RC[-11]/SQRT(RC[-6]*RC[-2]) -> 1 | AG326: =RC[-11]/SQRT(RC[-6]*RC[-3]) -> -1 | AH326: =RC[-11]/SQRT(RC[-6]*RC[-4]) -> -1 | AI326: =RC[-11]/SQRT(RC[-6]*RC[-5]) -> 1
A327: 25218 | B327: 北京 | C327: 162 | D327: 中度污染 | E327: 1.17 | F327: 6 | G327: 33 | H327: 45 | I327: 27 | J327: 81 | L327: 2013-06-05T01:00:00.000 | M327: =RC[-8]-R[23]C[-8] -> -0.49791666666666656 | N327: =RC[-8]-R[23]C[-8] -> -0.41666666666666696 | O327: =RC[-8]-R[23]C[-8] -> -9.2083333333333357 | P327: =RC[-8]-R[23]C[-8] -> 18.958333333333332 | Q327: =RC[-8]-R[23]C[-8] -> -89.583333333333329 | R327: =RC[-8]-R[23]C[-8] -> -43.625 | T327: =RC[-7]*RC[-2] -> 21.721614583333327 | U327: =RC[-7]*RC[-3] -> 18.177083333333346 | V327: =RC[-7]*RC[-4] -> 401.71354166666674 | W327: =RC[-7]*RC[-5] -> -827.05729166666663 | X327: =RC[-7]*RC[-6] -> 3908.0729166666665 | Y327: =RC[-12]*RC[-12] -> 0.24792100694444433 | Z327: =RC[-12]*RC[-12] -> 0.17361111111111135 | AA327: =RC[-12]*RC[-12] -> 84.793402777777828 | AB327: =RC[-12]*RC[-12] -> 359.41840277777771 | AC327: =RC[-12]*RC[-12] -> 8025.1736111111104 | AD327: =RC[-12]*RC[-12] -> 1903.140625 | AE327: =RC[-11]/SQRT(RC[-6]*RC[-1]) -> 1 | AF327: =RC[-11]/SQRT(RC[-6]*RC[-2]) -> 1 | AG327: =RC[-11]/SQRT(RC[-6]*RC[-3]) -> 0.99999999999999989 | AH327: =RC[-11]/SQRT(RC[-6]*RC[-4]) -> -1 | AI327: =RC[-11]/SQRT(RC[-6]*RC[-5]) -> 1
A328: 25294 | B328: 北京 | C328: 159 | D328: 中度污染 | E328: 1.1200000000000001 | F328: 5 | G328: 31 | H328: 36 | I328: 40 | J328: 73 | L328: 2013-06-05T02:00:00.000 | M328: =RC[-8]-R[22]C[-8] -> -0.54791666666666639 | N328: =RC[-8]-R[22]C[-8] -> -1.416666666666667 | O328: =RC[-8]-R[22]C[-8] -> -11.208333333333336 | P328: =RC[-8]-R[22]C[-8] -> 9.9583333333333321 | Q328: =RC[-8]-R[22]C[-8] -> -76.583333333333329 | R328: =RC[-8]-R[22]C[-8] -> -51.625 | T328: =RC[-7]*RC[-2] -> 28.286197916666652 | U328: =RC[-7]*RC[-3] -> 73.135416666666686 | V328: =RC[-7]*RC[-4] -> 578.63020833333348 | W328: =RC[-7]*RC[-5] -> -514.09895833333326 | X328: =RC[-7]*RC[-6] -> 3953.614583333333 | Y328: =RC[-12]*RC[-12] -> 0.30021267361111081 | Z328: =RC[-12]*RC[-12] -> 2.0069444444444451 | AA328: =RC[-12]*RC[-12] -> 125.62673611111117 | AB328: =RC[-12]*RC[-12] -> 99.168402777777757 | AC328: =RC[-12]*RC[-12] -> 5865.0069444444434 | AD328: =RC[-12]*RC[-12] -> 2665.140625 | AE328: =RC[-11]/SQRT(RC[-6]*RC[-1]) -> 1 | AF328: =RC[-11]/SQRT(RC[-6]*RC[-2]) -> 1.0000000000000002 | AG328: =RC[-11]/SQRT(RC[-6]*RC[-3]) -> 1 | AH328: =RC[-11]/SQRT(RC[-6]*RC[-4]) -> -1 | AI328: =RC[-11]/SQRT(RC[-6]*RC[-5]) -> 1
A329: 25370 | B329: 北京 | C329: 156 | D329: 中度污染 | E329: 1.1100000000000001 | F329: 4 | G329: 30 | H329: 32 | I329: 35 | J329: 70 | L329: 2013-06-05T03:00:00.000 | M329: =RC[-8]-R[21]C[-8] -> -0.55791666666666639 | N329: =RC[-8]-R[21]C[-8] -> -2.416666666666667 | O329: =RC[-8]-R[21]C[-8] -> -12.208333333333336 | P329: =RC[-8]-R[21]C[-8] -> 5.9583333333333321 | Q329: =RC[-8]-R[21]C[-8] -> -81.583333333333329 | R329: =RC[-8]-R[21]C[-8] -> -54.625 | T329: =RC[-7]*RC[-2] -> 30.476197916666653 | U329: =RC[-7]*RC[-3] -> 132.01041666666669 | V329: =RC[-7]*RC[-4] -> 666.88020833333348 | W329: =RC[-7]*RC[-5] -> -325.47395833333326 | X329: =RC[-7]*RC[-6] -> 4456.489583333333 | Y329: =RC[-12]*RC[-12] -> 0.31127100694444415 | Z329: =RC[-12]*RC[-12] -> 5.8402777777777795 | AA329: =RC[-12]*RC[-12] -> 149.04340277777783 | AB329: =RC[-12]*RC[-12] -> 35.5017361111111 | AC329: =RC[-12]*RC[-12] -> 6655.8402777777774 | AD329: =RC[-12]*RC[-12] -> 2983.890625 | AE329: =RC[-11]/SQRT(RC[-6]*RC[-1]) -> 1 | AF329: =RC[-11]/SQRT(RC[-6]*RC[-2]) -> 1 | AG329: =RC[-11]/SQRT(RC[-6]*RC[-3]) -> 1 | AH329: =RC[-11]/SQRT(RC[-6]*RC[-4]) -> -0.99999999999999978 | AI329: =RC[-11]/SQRT(RC[-6]*RC[-5]) -> 1
A330: 25446 | B330: 北京 | C330: 153 | D330: 中度污染 | E330: 0.87 | F330: 4 | G330: 36 | H330: 30 | I330: 29 | J330: 70 | L330: 2013-06-05T04:00:00.000 | M330: =RC[-8]-R[20]C[-8] -> -0.7979166666666665 | N330: =RC[-8]-R[20]C[-8] -> -2.416666666666667 | O330: =RC[-8]-R[20]C[-8] -> -6.2083333333333357 | P330: =RC[-8]-R[20]C[-8] -> 3.9583333333333321 | Q330: =RC[-8]-R[20]C[-8] -> -87.583333333333329 | R330: =RC[-8]-R[20]C[-8] -> -54.625 | T330: =RC[-7]*RC[-2] -> 43.586197916666656 | U330: =RC[-7]*RC[-3] -> 132.01041666666669 | V330: =RC[-7]*RC[-4] -> 339.13020833333348 | W330: =RC[-7]*RC[-5] -> -216.22395833333326 | X330: =RC[-7]*RC[-6] -> 4784.239583333333 | Y330: =RC[-12]*RC[-12] -> 0.63667100694444412 | Z330: =RC[-12]*RC[-12] -> 5.8402777777777795 | AA330: =RC[-12]*RC[-12] -> 38.543402777777807 | AB330: =RC[-12]*RC[-12] -> 15.668402777777768 | AC330: =RC[-12]*RC[-12] -> 7670.8402777777774 | AD330: =RC[-12]*RC[-12] -> 2983.890625 | AE330: =RC[-11]/SQRT(RC[-6]*RC[-1]) -> 1 | AF330: =RC[-11]/SQRT(RC[-6]*RC[-2]) -> 1 | AG330: =RC[-11]/SQRT(RC[-6]*RC[-3]) -> 1.0000000000000002 | AH330: =RC[-11]/SQRT(RC[-6]*RC[-4]) -> -1 | AI330: =RC[-11]/SQRT(RC[-6]*RC[-5]) -> 1
A331: 25522 | B331: 北京 | C331: 147 | D331: 轻度污染 | E331: 0.91 | F331: 4 | G331: 37 | H331: 35 | I331: 24 | J331: 72 | L331: 2013-06-05T05:00:00.000 | M331: =RC[-8]-R[19]C[-8] -> -0.75791666666666646 | N331: =RC[-8]-R[19]C[-8] -> -2.416666666666667 | O331: =RC[-8]-R[19]C[-8] -> -5.2083333333333357 | P331: =RC[-8]-R[19]C[-8] -> 8.9583333333333321 | Q331: =RC[-8]-R[19]C[-8] -> -92.583333333333329 | R331: =RC[-8]-R[19]C[-8] -> -52.625 | T331: =RC[-7]*RC[-2] -> 39.88536458333332 | U331: =RC[-7]*RC[-3] -> 127.17708333333334 | V331: =RC[-7]*RC[-4] -> 274.0885416666668 | W331: =RC[-7]*RC[-5] -> -471.43229166666663 | X331: =RC[-7]*RC[-6] -> 4872.1979166666661 | Y331: =RC[-12]*RC[-12] -> 0.57443767361111076 | Z331: =RC[-12]*RC[-12] -> 5.8402777777777795 | AA331: =RC[-12]*RC[-12] -> 27.126736111111136 | AB331: =RC[-12]*RC[-12] -> 80.251736111111086 | AC331: =RC[-12]*RC[-12] -> 8571.6736111111095 | AD331: =RC[-12]*RC[-12] -> 2769.390625 | AE331: =RC[-11]/SQRT(RC[-6]*RC[-1]) -> 1 | AF331: =RC[-11]/SQRT(RC[-6]*RC[-2]) -> 1 | AG331: =RC[-11]/SQRT(RC[-6]*RC[-3]) -> 1 | AH331: =RC[-11]/SQRT(RC[-6]*RC[-4]) -> -1.0000000000000002 | AI331: =RC[-11]/SQRT(RC[-6]*RC[-5]) -> 1
A332: 25598 | B332: 北京 | C332: 141 | D332: 轻度污染 | E332: 1.0900000000000001 | F332: 4 | G332: 31 | H332: 42 | I332: 54 | J332: 74 | L332: 2013-06-05T06:00:00.000 | M332: =RC[-8]-R[18]C[-8] -> -0.57791666666666641 | N332: =RC[-8]-R[18]C[-8] -> -2.416666666666667 | O332: =RC[-8]-R[18]C[-8] -> -11.208333333333336 | P332: =RC[-8]-R[18]C[-8] -> 15.958333333333332 | Q332: =RC[-8]-R[18]C[-8] -> -62.583333333333329 | R332: =RC[-8]-R[18]C[-8] -> -50.625 | T332: =RC[-7]*RC[-2] -> 29.257031249999986 | U332: =RC[-7]*RC[-3] -> 122.34375000000001 | V332: =RC[-7]*RC[-4] -> 567.42187500000011 | W332: =RC[-7]*RC[-5] -> -807.89062499999989 | X332: =RC[-7]*RC[-6] -> 3168.2812499999995 | Y332: =RC[-12]*RC[-12] -> 0.33398767361111081 | Z332: =RC[-12]*RC[-12] -> 5.8402777777777795 | AA332: =RC[-12]*RC[-12] -> 125.62673611111117 | AB332: =RC[-12]*RC[-12] -> 254.66840277777774 | AC332: =RC[-12]*RC[-12] -> 3916.6736111111104 | AD332: =RC[-12]*RC[-12] -> 2562.890625 | AE332: =RC[-11]/SQRT(RC[-6]*RC[-1]) -> 1 | AF332: =RC[-11]/SQRT(RC[-6]*RC[-2]) -> 1 | AG332: =RC[-11]/SQRT(RC[-6]*RC[-3]) -> 1 | AH332: =RC[-11]/SQRT(RC[-6]*RC[-4]) -> -1 | AI332: =RC[-11]/SQRT(RC[-6]*RC[-5]) -> 1
A333: 25674 | B333: 北京 | C333: 135 | D333: 轻度污染 | E333: 1.25 | F333: 5 | G333: 37 | H333: 41 | I333: 69 | J333: 83 | L333: 2013-06-05T07:00:00.000 | M333: =RC[-8]-R[17]C[-8] -> -0.41791666666666649 | N333: =RC[-8]-R[17]C[-8] -> -1.416666666666667 | O333: =RC[-8]-R[17]C[-8] -> -5.2083333333333357 | P333: =RC[-8]-R[17]C[-8] -> 14.958333333333332 | Q333: =RC[-8]-R[17]C[-8] -> -47.583333333333329 | R333: =RC[-8]-R[17]C[-8] -> -41.625 | T333: =RC[-7]*RC[-2] -> 17.395781249999992 | U333: =RC[-7]*RC[-3] -> 58.968750000000014 | V333: =RC[-7]*RC[-4] -> 216.79687500000009 | W333: =RC[-7]*RC[-5] -> -622.640625 | X333: =RC[-7]*RC[-6] -> 1980.6562499999998 | Y333: =RC[-12]*RC[-12] -> 0.17465434027777763 | Z333: =RC[-12]*RC[-12] -> 2.0069444444444451 | AA333: =RC[-12]*RC[-12] -> 27.126736111111136 | AB333: =RC[-12]*RC[-12] -> 223.75173611111109 | AC333: =RC[-12]*RC[-12] -> 2264.1736111111109 | AD333: =RC[-12]*RC[-12] -> 1732.640625 | AE333: =RC[-11]/SQRT(RC[-6]*RC[-1]) -> 1 | AF333: =RC[-11]/SQRT(RC[-6]*RC[-2]) -> 1.0000000000000002 | AG333: =RC[-11]/SQRT(RC[-6]*RC[-3]) -> 0.99999999999999989 | AH333: =RC[-11]/SQRT(RC[-6]*RC[-4]) -> -1 | AI333: =RC[-11]/SQRT(RC[-6]*RC[-5]) -> 1
A334: 25750 | B334: 北京 | C334: 130 | D334: 轻度污染 | E334: 1.55 | F334: 5 | G334: 37 | H334: 38 | I334: 83 | J334: 83 | L334: 2013-06-05T08:00:00.000 | M334: =RC[-8]-R[16]C[-8] -> -0.11791666666666645 | N334: =RC[-8]-R[16]C[-8] -> -1.416666666666667 | O334: =RC[-8]-R[16]C[-8] -> -5.2083333333333357 | P334: =RC[-8]-R[16]C[-8] -> 11.958333333333332 | Q334: =RC[-8]-R[16]C[-8] -> -33.583333333333329 | R334: =RC[-8]-R[16]C[-8] -> -41.625 | T334: =RC[-7]*RC[-2] -> 4.908281249999991 | U334: =RC[-7]*RC[-3] -> 58.968750000000014 | V334: =RC[-7]*RC[-4] -> 216.79687500000009 | W334: =RC[-7]*RC[-5] -> -497.76562499999994 | X334: =RC[-7]*RC[-6] -> 1397.9062499999998 | Y334: =RC[-12]*RC[-12] -> 1.3904340277777726E-2 | Z334: =RC[-12]*RC[-12] -> 2.0069444444444451 | AA334: =RC[-12]*RC[-12] -> 27.126736111111136 | AB334: =RC[-12]*RC[-12] -> 143.00173611111109 | AC334: =RC[-12]*RC[-12] -> 1127.8402777777774 | AD334: =RC[-12]*RC[-12] -> 1732.640625 | AE334: =RC[-11]/SQRT(RC[-6]*RC[-1]) -> 1 | AF334: =RC[-11]/SQRT(RC[-6]*RC[-2]) -> 1.0000000000000002 | AG334: =RC[-11]/SQRT(RC[-6]*RC[-3]) -> 0.99999999999999989 | AH334: =RC[-11]/SQRT(RC[-6]*RC[-4]) -> -1 | AI334: =RC[-11]/SQRT(RC[-6]*RC[-5]) -> 1
A335: 25826 | B335: 北京 | C335: 126 | D335: 轻度污染 | E335: 1.78 | F335: 5 | G335: 37 | H335: 33 | I335: 110 | J335: 96 | L335: 2013-06-05T09:00:00.000 | M335: =RC[-8]-R[15]C[-8] -> 0.11208333333333353 | N335: =RC[-8]-R[15]C[-8] -> -1.416666666666667 | O335: =RC[-8]-R[15]C[-8] -> -5.2083333333333357 | P335: =RC[-8]-R[15]C[-8] -> 6.9583333333333321 | Q335: =RC[-8]-R[15]C[-8] -> -6.5833333333333286 | R335: =RC[-8]-R[15]C[-8] -> -28.625 | T335: =RC[-7]*RC[-2] -> -3.2083854166666725 | U335: =RC[-7]*RC[-3] -> 40.552083333333343 | V335: =RC[-7]*RC[-4] -> 149.08854166666674 | W335: =RC[-7]*RC[-5] -> -199.18229166666663 | X335: =RC[-7]*RC[-6] -> 188.44791666666654 | Y335: =RC[-12]*RC[-12] -> 1.2562673611111156E-2 | Z335: =RC[-12]*RC[-12] -> 2.0069444444444451 | AA335: =RC[-12]*RC[-12] -> 27.126736111111136 | AB335: =RC[-12]*RC[-12] -> 48.418402777777764 | AC335: =RC[-12]*RC[-12] -> 43.340277777777715 | AD335: =RC[-12]*RC[-12] -> 819.390625 | AE335: =RC[-11]/SQRT(RC[-6]*RC[-1]) -> -1 | AF335: =RC[-11]/SQRT(RC[-6]*RC[-2]) -> 1.0000000000000002 | AG335: =RC[-11]/SQRT(RC[-6]*RC[-3]) -> 1 | AH335: =RC[-11]/SQRT(RC[-6]*RC[-4]) -> -1 | AI335: =RC[-11]/SQRT(RC[-6]*RC[-5]) -> 1
A336: 25902 | B336: 北京 | C336: 124 | D336: 轻度污染 | E336: 1.89 | F336: 5 | G336: 41 | H336: 28 | I336: 104 | J336: 104 | L336: 2013-06-05T10:00:00.000 | M336: =RC[-8]-R[14]C[-8] -> 0.22208333333333341 | N336: =RC[-8]-R[14]C[-8] -> -1.416666666666667 | O336: =RC[-8]-R[14]C[-8] -> -1.2083333333333357 | P336: =RC[-8]-R[14]C[-8] -> 1.9583333333333321 | Q336: =RC[-8]-R[14]C[-8] -> -12.583333333333329 | R336: =RC[-8]-R[14]C[-8] -> -20.625 | T336: =RC[-7]*RC[-2] -> -4.5804687500000014 | U336: =RC[-7]*RC[-3] -> 29.218750000000007 | V336: =RC[-7]*RC[-4] -> 24.92187500000005 | W336: =RC[-7]*RC[-5] -> -40.390624999999979 | X336: =RC[-7]*RC[-6] -> 259.53124999999989 | Y336: =RC[-12]*RC[-12] -> 4.9321006944444482E-2 | Z336: =RC[-12]*RC[-12] -> 2.0069444444444451 | AA336: =RC[-12]*RC[-12] -> 1.4600694444444502 | AB336: =RC[-12]*RC[-12] -> 3.8350694444444398 | AC336: =RC[-12]*RC[-12] -> 158.34027777777766 | AD336: =RC[-12]*RC[-12] -> 425.390625 | AE336: =RC[-11]/SQRT(RC[-6]*RC[-1]) -> -1 | AF336: =RC[-11]/SQRT(RC[-6]*RC[-2]) -> 1.0000000000000002 | AG336: =RC[-11]/SQRT(RC[-6]*RC[-3]) -> 1 | AH336: =RC[-11]/SQRT(RC[-6]*RC[-4]) -> -1.0000000000000002 | AI336: =RC[-11]/SQRT(RC[-6]*RC[-5]) -> 1
A337: 25978 | B337: 北京 | C337: 121 | D337: 轻度污染 | E337: 1.9 | F337: 6 | G337: 40 | H337: 28 | I337: 93 | J337: 113 | L337: 2013-06-05T11:00:00.000 | M337: =RC[-8]-R[13]C[-8] -> 0.23208333333333342 | N337: =RC[-8]-R[13]C[-8] -> -0.41666666666666696 | O337: =RC[-8]-R[13]C[-8] -> -2.2083333333333357 | P337: =RC[-8]-R[13]C[-8] -> 1.9583333333333321 | Q337: =RC[-8]-R[13]C[-8] -> -23.583333333333329 | R337: =RC[-8]-R[13]C[-8] -> -11.625 | T337: =RC[-7]*RC[-2] -> -2.6979687500000011 | U337: =RC[-7]*RC[-3] -> 4.8437500000000036 | V337: =RC[-7]*RC[-4] -> 25.671875000000028 | W337: =RC[-7]*RC[-5] -> -22.765624999999986 | X337: =RC[-7]*RC[-6] -> 274.15624999999994 | Y337: =RC[-12]*RC[-12] -> 5.3862673611111148E-2 | Z337: =RC[-12]*RC[-12] -> 0.17361111111111135 | AA337: =RC[-12]*RC[-12] -> 4.8767361111111214 | AB337: =RC[-12]*RC[-12] -> 3.8350694444444398 | AC337: =RC[-12]*RC[-12] -> 556.17361111111086 | AD337: =RC[-12]*RC[-12] -> 135.140625 | AE337: =RC[-11]/SQRT(RC[-6]*RC[-1]) -> -1 | AF337: =RC[-11]/SQRT(RC[-6]*RC[-2]) -> 1 | AG337: =RC[-11]/SQRT(RC[-6]*RC[-3]) -> 1.0000000000000002 | AH337: =RC[-11]/SQRT(RC[-6]*RC[-4]) -> -1 | AI337: =RC[-11]/SQRT(RC[-6]*RC[-5]) -> 1
A338: 26054 | B338: 北京 | C338: 119 | D338: 轻度污染 | E338: 2 | F338: 7 | G338: 42 | H338: 28 | I338: 124 | J338: 127 | L338: 2013-06-05T12:00:00.000 | M338: =RC[-8]-R[12]C[-8] -> 0.33208333333333351 | N338: =RC[-8]-R[12]C[-8] -> 0.58333333333333304 | O338: =RC[-8]-R[12]C[-8] -> -0.2083333333333357 | P338: =RC[-8]-R[12]C[-8] -> 1.9583333333333321 | Q338: =RC[-8]-R[12]C[-8] -> 7.4166666666666714 | R338: =RC[-8]-R[12]C[-8] -> 2.375 | T338: =RC[-7]*RC[-2] -> 0.78869791666666711 | U338: =RC[-7]*RC[-3] -> 1.3854166666666661 | V338: =RC[-7]*RC[-4] -> -0.49479166666667229 | W338: =RC[-7]*RC[-5] -> 4.6510416666666643 | X338: =RC[-7]*RC[-6] -> 17.614583333333343 | Y338: =RC[-12]*RC[-12] -> 0.11027934027777789 | Z338: =RC[-12]*RC[-12] -> 0.34027777777777746 | AA338: =RC[-12]*RC[-12] -> 4.3402777777778762E-2 | AB338: =RC[-12]*RC[-12] -> 3.8350694444444398 | AC338: =RC[-12]*RC[-12] -> 55.006944444444514 | AD338: =RC[-12]*RC[-12] -> 5.640625 | AE338: =RC[-11]/SQRT(RC[-6]*RC[-1]) -> 1 | AF338: =RC[-11]/SQRT(RC[-6]*RC[-2]) -> 1 | AG338: =RC[-11]/SQRT(RC[-6]*RC[-3]) -> -1.0000000000000002 | AH338: =RC[-11]/SQRT(RC[-6]*RC[-4]) -> 1.0000000000000002 | AI338: =RC[-11]/SQRT(RC[-6]*RC[-5]) -> 0.99999999999999978
A339: 26130 | B339: 北京 | C339: 121 | D339: 轻度污染 | E339: 2.04 | F339: 7 | G339: 40 | H339: 30 | I339: 155 | J339: 149 | L339: 2013-06-05T13:00:00.000 | M339: =RC[-8]-R[11]C[-8] -> 0.37208333333333354 | N339: =RC[-8]-R[11]C[-8] -> 0.58333333333333304 | O339: =RC[-8]-R[11]C[-8] -> -2.2083333333333357 | P339: =RC[-8]-R[11]C[-8] -> 3.9583333333333321 | Q339: =RC[-8]-R[11]C[-8] -> 38.416666666666671 | R339: =RC[-8]-R[11]C[-8] -> 24.375 | T339: =RC[-7]*RC[-2] -> 9.0695312500000043 | U339: =RC[-7]*RC[-3] -> 14.218749999999993 | V339: =RC[-7]*RC[-4] -> -53.828125000000057 | W339: =RC[-7]*RC[-5] -> 96.484374999999972 | X339: =RC[-7]*RC[-6] -> 936.40625000000011 | Y339: =RC[-12]*RC[-12] -> 0.13844600694444459 | Z339: =RC[-12]*RC[-12] -> 0.34027777777777746 | AA339: =RC[-12]*RC[-12] -> 4.8767361111111214 | AB339: =RC[-12]*RC[-12] -> 15.668402777777768 | AC339: =RC[-12]*RC[-12] -> 1475.8402777777781 | AD339: =RC[-12]*RC[-12] -> 594.140625 | AE339: =RC[-11]/SQRT(RC[-6]*RC[-1]) -> 1 | AF339: =RC[-11]/SQRT(RC[-6]*RC[-2]) -> 1 | AG339: =RC[-11]/SQRT(RC[-6]*RC[-3]) -> -1 | AH339: =RC[-11]/SQRT(RC[-6]*RC[-4]) -> 1 | AI339: =RC[-11]/SQRT(RC[-6]*RC[-5]) -> 1
A340: 26206 | B340: 北京 | C340: 123 | D340: 轻度污染 | E340: 1.95 | F340: 7 | G340: 40 | H340: 29 | I340: 167 | J340: 163 | L340: 2013-06-05T14:00:00.000 | M340: =RC[-8]-R[10]C[-8] -> 0.28208333333333346 | N340: =RC[-8]-R[10]C[-8] -> 0.58333333333333304 | O340: =RC[-8]-R[10]C[-8] -> -2.2083333333333357 | P340: =RC[-8]-R[10]C[-8] -> 2.9583333333333321 | Q340: =RC[-8]-R[10]C[-8] -> 50.416666666666671 | R340: =RC[-8]-R[10]C[-8] -> 38.375 | T340: =RC[-7]*RC[-2] -> 10.824947916666671 | U340: =RC[-7]*RC[-3] -> 22.385416666666654 | V340: =RC[-7]*RC[-4] -> -84.744791666666757 | W340: =RC[-7]*RC[-5] -> 113.52604166666661 | X340: =RC[-7]*RC[-6] -> 1934.7395833333335 | Y340: =RC[-12]*RC[-12] -> 7.9571006944444522E-2 | Z340: =RC[-12]*RC[-12] -> 0.34027777777777746 | AA340: =RC[-12]*RC[-12] -> 4.8767361111111214 | AB340: =RC[-12]*RC[-12] -> 8.7517361111111036 | AC340: =RC[-12]*RC[-12] -> 2541.8402777777783 | AD340: =RC[-12]*RC[-12] -> 1472.640625 | AE340: =RC[-11]/SQRT(RC[-6]*RC[-1]) -> 1 | AF340: =RC[-11]/SQRT(RC[-6]*RC[-2]) -> 0.99999999999999989 | AG340: =RC[-11]/SQRT(RC[-6]*RC[-3]) -> -1 | AH340: =RC[-11]/SQRT(RC[-6]*RC[-4]) -> 1 | AI340: =RC[-11]/SQRT(RC[-6]*RC[-5]) -> 1
A341: 26282 | B341: 北京 | C341: 126 | D341: 轻度污染 | E341: 1.81 | F341: 7 | G341: 43 | H341: 26 | I341: 168 | J341: 166 | L341: 2013-06-05T15:00:00.000 | M341: =RC[-8]-R[9]C[-8] -> 0.14208333333333356 | N341: =RC[-8]-R[9]C[-8] -> 0.58333333333333304 | O341: =RC[-8]-R[9]C[-8] -> 0.7916666666666643 | P341: =RC[-8]-R[9]C[-8] -> -4.1666666666667851E-2 | Q341: =RC[-8]-R[9]C[-8] -> 51.416666666666671 | R341: =RC[-8]-R[9]C[-8] -> 41.375 | T341: =RC[-7]*RC[-2] -> 5.8786979166666757 | U341: =RC[-7]*RC[-3] -> 24.135416666666654 | V341: =RC[-7]*RC[-4] -> 32.755208333333236 | W341: =RC[-7]*RC[-5] -> -1.7239583333333823 | X341: =RC[-7]*RC[-6] -> 2127.3645833333335 | Y341: =RC[-12]*RC[-12] -> 2.0187673611111175E-2 | Z341: =RC[-12]*RC[-12] -> 0.34027777777777746 | AA341: =RC[-12]*RC[-12] -> 0.62673611111110739 | AB341: =RC[-12]*RC[-12] -> 1.7361111111112099E-3 | AC341: =RC[-12]*RC[-12] -> 2643.6736111111118 | AD341: =RC[-12]*RC[-12] -> 1711.890625 | AE341: =RC[-11]/SQRT(RC[-6]*RC[-1]) -> 1 | AF341: =RC[-11]/SQRT(RC[-6]*RC[-2]) -> 1 | AG341: =RC[-11]/SQRT(RC[-6]*RC[-3]) -> 1 | AH341: =RC[-11]/SQRT(RC[-6]*RC[-4]) -> -1 | AI341: =RC[-11]/SQRT(RC[-6]*RC[-5]) -> 1
A342: 26358 | B342: 北京 | C342: 129 | D342: 轻度污染 | E342: 1.69 | F342: 6 | G342: 45 | H342: 21 | I342: 163 | J342: 169 | L342: 2013-06-05T16:00:00.000 | M342: =RC[-8]-R[8]C[-8] -> 2.2083333333333455E-2 | N342: =RC[-8]-R[8]C[-8] -> -0.41666666666666696 | O342: =RC[-8]-R[8]C[-8] -> 2.7916666666666643 | P342: =RC[-8]-R[8]C[-8] -> -5.0416666666666679 | Q342: =RC[-8]-R[8]C[-8] -> 46.416666666666671 | R342: =RC[-8]-R[8]C[-8] -> 44.375 | T342: =RC[-7]*RC[-2] -> 0.97994791666667203 | U342: =RC[-7]*RC[-3] -> -18.489583333333346 | V342: =RC[-7]*RC[-4] -> 123.88020833333323 | W342: =RC[-7]*RC[-5] -> -223.7239583333334 | X342: =RC[-7]*RC[-6] -> 2059.7395833333335 | Y342: =RC[-12]*RC[-12] -> 4.8767361111111645E-4 | Z342: =RC[-12]*RC[-12] -> 0.17361111111111135 | AA342: =RC[-12]*RC[-12] -> 7.7934027777777644 | AB342: =RC[-12]*RC[-12] -> 25.418402777777789 | AC342: =RC[-12]*RC[-12] -> 2154.5069444444448 | AD342: =RC[-12]*RC[-12] -> 1969.140625 | AE342: =RC[-11]/SQRT(RC[-6]*RC[-1]) -> 1 | AF342: =RC[-11]/SQRT(RC[-6]*RC[-2]) -> -1 | AG342: =RC[-11]/SQRT(RC[-6]*RC[-3]) -> 1 | AH342: =RC[-11]/SQRT(RC[-6]*RC[-4]) -> -1.0000000000000002 | AI342: =RC[-11]/SQRT(RC[-6]*RC[-5]) -> 1
A343: 26434 | B343: 北京 | C343: 133 | D343: 轻度污染 | E343: 1.73 | F343: 6 | G343: 48 | H343: 15 | I343: 157 | J343: 161 | L343: 2013-06-05T17:00:00.000 | M343: =RC[-8]-R[7]C[-8] -> 6.208333333333349E-2 | N343: =RC[-8]-R[7]C[-8] -> -0.41666666666666696 | O343: =RC[-8]-R[7]C[-8] -> 5.7916666666666643 | P343: =RC[-8]-R[7]C[-8] -> -11.041666666666668 | Q343: =RC[-8]-R[7]C[-8] -> 40.416666666666671 | R343: =RC[-8]-R[7]C[-8] -> 36.375 | T343: =RC[-7]*RC[-2] -> 2.2582812500000058 | U343: =RC[-7]*RC[-3] -> -15.156250000000011 | V343: =RC[-7]*RC[-4] -> 210.67187499999991 | W343: =RC[-7]*RC[-5] -> -401.64062500000006 | X343: =RC[-7]*RC[-6] -> 1470.1562500000002 | Y343: =RC[-12]*RC[-12] -> 3.8543402777777972E-3 | Z343: =RC[-12]*RC[-12] -> 0.17361111111111135 | AA343: =RC[-12]*RC[-12] -> 33.54340277777775 | AB343: =RC[-12]*RC[-12] -> 121.9184027777778 | AC343: =RC[-12]*RC[-12] -> 1633.5069444444448 | AD343: =RC[-12]*RC[-12] -> 1323.140625 | AE343: =RC[-11]/SQRT(RC[-6]*RC[-1]) -> 1 | AF343: =RC[-11]/SQRT(RC[-6]*RC[-2]) -> -1 | AG343: =RC[-11]/SQRT(RC[-6]*RC[-3]) -> 1 | AH343: =RC[-11]/SQRT(RC[-6]*RC[-4]) -> -1 | AI343: =RC[-11]/SQRT(RC[-6]*RC[-5]) -> 1
A344: 26510 | B344: 北京 | C344: 137 | D344: 轻度污染 | E344: 1.97 | F344: 7 | G344: 54 | H344: 9 | I344: 174 | J344: 168 | L344: 2013-06-05T18:00:00.000 | M344: =RC[-8]-R[6]C[-8] -> 0.30208333333333348 | N344: =RC[-8]-R[6]C[-8] -> 0.58333333333333304 | O344: =RC[-8]-R[6]C[-8] -> 11.791666666666664 | P344: =RC[-8]-R[6]C[-8] -> -17.041666666666668 | Q344: =RC[-8]-R[6]C[-8] -> 57.416666666666671 | R344: =RC[-8]-R[6]C[-8] -> 43.375 | T344: =RC[-7]*RC[-2] -> 13.102864583333339 | U344: =RC[-7]*RC[-3] -> 25.302083333333321 | V344: =RC[-7]*RC[-4] -> 511.46354166666657 | W344: =RC[-7]*RC[-5] -> -739.18229166666674 | X344: =RC[-7]*RC[-6] -> 2490.447916666667 | Y344: =RC[-12]*RC[-12] -> 9.1254340277777873E-2 | Z344: =RC[-12]*RC[-12] -> 0.34027777777777746 | AA344: =RC[-12]*RC[-12] -> 139.04340277777771 | AB344: =RC[-12]*RC[-12] -> 290.41840277777783 | AC344: =RC[-12]*RC[-12] -> 3296.6736111111118 | AD344: =RC[-12]*RC[-12] -> 1881.390625 | AE344: =RC[-11]/SQRT(RC[-6]*RC[-1]) -> 0.99999999999999989 | AF344: =RC[-11]/SQRT(RC[-6]*RC[-2]) -> 1 | AG344: =RC[-11]/SQRT(RC[-6]*RC[-3]) -> 1 | AH344: =RC[-11]/SQRT(RC[-6]*RC[-4]) -> -1 | AI344: =RC[-11]/SQRT(RC[-6]*RC[-5]) -> 1
A345: 26586 | B345: 北京 | C345: 142 | D345: 轻度污染 | E345: 2.2799999999999998 | F345: 9 | G345: 59 | H345: 6 | I345: 196 | J345: 181 | L345: 2013-06-05T19:00:00.000 | M345: =RC[-8]-R[5]C[-8] -> 0.61208333333333331 | N345: =RC[-8]-R[5]C[-8] -> 2.583333333333333 | O345: =RC[-8]-R[5]C[-8] -> 16.791666666666664 | P345: =RC[-8]-R[5]C[-8] -> -20.041666666666668 | Q345: =RC[-8]-R[5]C[-8] -> 79.416666666666671 | R345: =RC[-8]-R[5]C[-8] -> 56.375 | T345: =RC[-7]*RC[-2] -> 34.506197916666665 | U345: =RC[-7]*RC[-3] -> 145.63541666666666 | V345: =RC[-7]*RC[-4] -> 946.63020833333314 | W345: =RC[-7]*RC[-5] -> -1129.8489583333335 | X345: =RC[-7]*RC[-6] -> 4477.1145833333339 | Y345: =RC[-12]*RC[-12] -> 0.37464600694444444 | Z345: =RC[-12]*RC[-12] -> 6.6736111111111098 | AA345: =RC[-12]*RC[-12] -> 281.96006944444434 | AB345: =RC[-12]*RC[-12] -> 401.66840277777783 | AC345: =RC[-12]*RC[-12] -> 6307.0069444444453 | AD345: =RC[-12]*RC[-12] -> 3178.140625 | AE345: =RC[-11]/SQRT(RC[-6]*RC[-1]) -> 1 | AF345: =RC[-11]/SQRT(RC[-6]*RC[-2]) -> 1 | AG345: =RC[-11]/SQRT(RC[-6]*RC[-3]) -> 1 | AH345: =RC[-11]/SQRT(RC[-6]*RC[-4]) -> -1 | AI345: =RC[-11]/SQRT(RC[-6]*RC[-5]) -> 1
A346: 26662 | B346: 北京 | C346: 147 | D346: 轻度污染 | E346: 2.3199999999999998 | F346: 10 | G346: 59 | H346: 6 | I346: 222 | J346: 191 | L346: 2013-06-05T20:00:00.000 | M346: =RC[-8]-R[4]C[-8] -> 0.65208333333333335 | N346: =RC[-8]-R[4]C[-8] -> 3.583333333333333 | O346: =RC[-8]-R[4]C[-8] -> 16.791666666666664 | P346: =RC[-8]-R[4]C[-8] -> -20.041666666666668 | Q346: =RC[-8]-R[4]C[-8] -> 105.41666666666667 | R346: =RC[-8]-R[4]C[-8] -> 66.375 | T346: =RC[-7]*RC[-2] -> 43.282031250000003 | U346: =RC[-7]*RC[-3] -> 237.84374999999997 | V346: =RC[-7]*RC[-4] -> 1114.5468749999998 | W346: =RC[-7]*RC[-5] -> -1330.265625 | X346: =RC[-7]*RC[-6] -> 6997.03125 | Y346: =RC[-12]*RC[-12] -> 0.42521267361111115 | Z346: =RC[-12]*RC[-12] -> 12.840277777777775 | AA346: =RC[-12]*RC[-12] -> 281.96006944444434 | AB346: =RC[-12]*RC[-12] -> 401.66840277777783 | AC346: =RC[-12]*RC[-12] -> 11112.673611111111 | AD346: =RC[-12]*RC[-12] -> 4405.640625 | AE346: =RC[-11]/SQRT(RC[-6]*RC[-1]) -> 1 | AF346: =RC[-11]/SQRT(RC[-6]*RC[-2]) -> 1 | AG346: =RC[-11]/SQRT(RC[-6]*RC[-3]) -> 1 | AH346: =RC[-11]/SQRT(RC[-6]*RC[-4]) -> -1 | AI346: =RC[-11]/SQRT(RC[-6]*RC[-5]) -> 1
A347: 26738 | B347: 北京 | C347: 152 | D347: 中度污染 | E347: 2.15 | F347: 9 | G347: 53 | H347: 8 | I347: 197 | J347: 180 | L347: 2013-06-05T21:00:00.000 | M347: =RC[-8]-R[3]C[-8] -> 0.48208333333333342 | N347: =RC[-8]-R[3]C[-8] -> 2.583333333333333 | O347: =RC[-8]-R[3]C[-8] -> 10.791666666666664 | P347: =RC[-8]-R[3]C[-8] -> -18.041666666666668 | Q347: =RC[-8]-R[3]C[-8] -> 80.416666666666671 | R347: =RC[-8]-R[3]C[-8] -> 55.375 | T347: =RC[-7]*RC[-2] -> 26.695364583333337 | U347: =RC[-7]*RC[-3] -> 143.05208333333331 | V347: =RC[-7]*RC[-4] -> 597.58854166666652 | W347: =RC[-7]*RC[-5] -> -999.05729166666674 | X347: =RC[-7]*RC[-6] -> 4453.072916666667 | Y347: =RC[-12]*RC[-12] -> 0.23240434027777787 | Z347: =RC[-12]*RC[-12] -> 6.6736111111111098 | AA347: =RC[-12]*RC[-12] -> 116.4600694444444 | AB347: =RC[-12]*RC[-12] -> 325.50173611111114 | AC347: =RC[-12]*RC[-12] -> 6466.8402777777783 | AD347: =RC[-12]*RC[-12] -> 3066.390625 | AE347: =RC[-11]/SQRT(RC[-6]*RC[-1]) -> 1 | AF347: =RC[-11]/SQRT(RC[-6]*RC[-2]) -> 1 | AG347: =RC[-11]/SQRT(RC[-6]*RC[-3]) -> 1 | AH347: =RC[-11]/SQRT(RC[-6]*RC[-4]) -> -1 | AI347: =RC[-11]/SQRT(RC[-6]*RC[-5]) -> 1
A348: 26814 | B348: 北京 | C348: 155 | D348: 中度污染 | E348: 2.08 | F348: 10 | G348: 50 | H348: 10 | I348: 178 | J348: 166 | L348: 2013-06-05T22:00:00.000 | M348: =RC[-8]-R[2]C[-8] -> 0.41208333333333358 | N348: =RC[-8]-R[2]C[-8] -> 3.583333333333333 | O348: =RC[-8]-R[2]C[-8] -> 7.7916666666666643 | P348: =RC[-8]-R[2]C[-8] -> -16.041666666666668 | Q348: =RC[-8]-R[2]C[-8] -> 61.416666666666671 | R348: =RC[-8]-R[2]C[-8] -> 41.375 | T348: =RC[-7]*RC[-2] -> 17.049947916666678 | U348: =RC[-7]*RC[-3] -> 148.26041666666666 | V348: =RC[-7]*RC[-4] -> 322.38020833333326 | W348: =RC[-7]*RC[-5] -> -663.72395833333337 | X348: =RC[-7]*RC[-6] -> 2541.1145833333335 | Y348: =RC[-12]*RC[-12] -> 0.16981267361111133 | Z348: =RC[-12]*RC[-12] -> 12.840277777777775 | AA348: =RC[-12]*RC[-12] -> 60.710069444444407 | AB348: =RC[-12]*RC[-12] -> 257.33506944444446 | AC348: =RC[-12]*RC[-12] -> 3772.0069444444453 | AD348: =RC[-12]*RC[-12] -> 1711.890625 | AE348: =RC[-11]/SQRT(RC[-6]*RC[-1]) -> 1 | AF348: =RC[-11]/SQRT(RC[-6]*RC[-2]) -> 1 | AG348: =RC[-11]/SQRT(RC[-6]*RC[-3]) -> 1.0000000000000002 | AH348: =RC[-11]/SQRT(RC[-6]*RC[-4]) -> -1 | AI348: =RC[-11]/SQRT(RC[-6]*RC[-5]) -> 1
A349: 26890 | B349: 北京 | C349: 157 | D349: 中度污染 | E349: 2.0499999999999998 | F349: 10 | G349: 46 | H349: 11 | I349: 154 | J349: 168 | L349: 2013-06-05T23:00:00.000 | M349: =RC[-8]-R[1]C[-8] -> 0.38208333333333333 | N349: =RC[-8]-R[1]C[-8] -> 3.583333333333333 | O349: =RC[-8]-R[1]C[-8] -> 3.7916666666666643 | P349: =RC[-8]-R[1]C[-8] -> -15.041666666666668 | Q349: =RC[-8]-R[1]C[-8] -> 37.416666666666671 | R349: =RC[-8]-R[1]C[-8] -> 43.375 | T349: =RC[-7]*RC[-2] -> 16.572864583333335 | U349: =RC[-7]*RC[-3] -> 155.42708333333331 | V349: =RC[-7]*RC[-4] -> 164.46354166666657 | W349: =RC[-7]*RC[-5] -> -652.43229166666674 | X349: =RC[-7]*RC[-6] -> 1622.947916666667 | Y349: =RC[-12]*RC[-12] -> 0.14598767361111112 | Z349: =RC[-12]*RC[-12] -> 12.840277777777775 | AA349: =RC[-12]*RC[-12] -> 14.376736111111093 | AB349: =RC[-12]*RC[-12] -> 226.25173611111114 | AC349: =RC[-12]*RC[-12] -> 1400.0069444444448 | AD349: =RC[-12]*RC[-12] -> 1881.390625 | AE349: =RC[-11]/SQRT(RC[-6]*RC[-1]) -> 1 | AF349: =RC[-11]/SQRT(RC[-6]*RC[-2]) -> 1 | AG349: =RC[-11]/SQRT(RC[-6]*RC[-3]) -> 1 | AH349: =RC[-11]/SQRT(RC[-6]*RC[-4]) -> -1 | AI349: =RC[-11]/SQRT(RC[-6]*RC[-5]) -> 1
E350: =AVERAGE(R[-24]C:R[-1]C) -> 1.6679166666666665 | F350: =AVERAGE(R[-24]C:R[-1]C) -> 6.416666666666667 | G350: =AVERAGE(R[-24]C:R[-1]C) -> 42.208333333333336 | H350: =AVERAGE(R[-24]C:R[-1]C) -> 26.041666666666668 | I350: =AVERAGE(R[-24]C:R[-1]C) -> 116.58333333333333 | J350: =AVERAGE(R[-24]C:R[-1]C) -> 124.625 | M350: =RC[-8]-RC[-8] -> 0 | N350: =RC[-8]-RC[-8] -> 0 | O350: =RC[-8]-RC[-8] -> 0 | P350: =RC[-8]-RC[-8] -> 0 | Q350: =RC[-8]-RC[-8] -> 0 | R350: =RC[-8]-RC[-8] -> 0 | T350: =SUM(R[-24]C:R[-1]C) -> 400.52125000000001 | U350: =SUM(R[-24]C:R[-1]C) -> 1698.7499999999998 | V350: =SUM(R[-24]C:R[-1]C) -> 7271.875 | W350: =SUM(R[-24]C:R[-1]C) -> -10969.624999999998 | X350: =SUM(R[-24]C:R[-1]C) -> 62102.25 | Y350: =SUM(R[-24]C:R[-1]C) -> 4.6219958333333322 | Z350: =SUM(R[-24]C:R[-1]C) -> 87.833333333333343 | AA350: =SUM(R[-24]C:R[-1]C) -> 1587.9583333333328 | AB350: =SUM(R[-24]C:R[-1]C) -> 3488.9583333333335 | AC350: =SUM(R[-24]C:R[-1]C) -> 89443.833333333343 | AD350: =SUM(R[-24]C:R[-1]C) -> 45647.625 | AE350: =RC[-11]/SQRT(RC[-6]*RC[-1]) -> 0.87197030408892995 | AF350: =RC[-11]/SQRT(RC[-6]*RC[-2]) -> 0.84838053191131535 | AG350: =RC[-11]/SQRT(RC[-6]*RC[-3]) -> 0.85411777556508006 | AH350: =RC[-11]/SQRT(RC[-6]*RC[-4]) -> -0.86923017962129312 | AI350: =RC[-11]/SQRT(RC[-6]*RC[-5]) -> 0.97190326273122762
A351: 26966 | B351: 北京 | C351: 161 | D351: 中度污染 | E351: 1.97 | F351: 10 | G351: 42 | H351: 14 | I351: 163 | J351: 165 | L351: 2013-06-06T00:00:00.000 | M351: =RC[-8]-R[24]C[-8] -> -0.17708333333333326 | N351: =RC[-8]-R[24]C[-8] -> 0.45833333333333393 | O351: =RC[-8]-R[24]C[-8] -> -8.7916666666666643 | P351: =RC[-8]-R[24]C[-8] -> 5.7083333333333339 | Q351: =RC[-8]-R[24]C[-8] -> 32.375 | R351: =RC[-8]-R[24]C[-8] -> 36.291666666666657 | T351: =RC[-7]*RC[-2] -> -6.4266493055555509 | U351: =RC[-7]*RC[-3] -> 16.633680555555571 | V351: =RC[-7]*RC[-4] -> -319.06423611111092 | W351: =RC[-7]*RC[-5] -> 207.16493055555551 | X351: =RC[-7]*RC[-6] -> 1174.942708333333 | Y351: =RC[-12]*RC[-12] -> 3.135850694444442E-2 | Z351: =RC[-12]*RC[-12] -> 0.21006944444444497 | AA351: =RC[-12]*RC[-12] -> 77.293402777777743 | AB351: =RC[-12]*RC[-12] -> 32.58506944444445 | AC351: =RC[-12]*RC[-12] -> 1048.140625 | AD351: =RC[-12]*RC[-12] -> 1317.0850694444437 | AE351: =RC[-11]/SQRT(RC[-6]*RC[-1]) -> -1 | AF351: =RC[-11]/SQRT(RC[-6]*RC[-2]) -> 1 | AG351: =RC[-11]/SQRT(RC[-6]*RC[-3]) -> -0.99999999999999978 | AH351: =RC[-11]/SQRT(RC[-6]*RC[-4]) -> 1 | AI351: =RC[-11]/SQRT(RC[-6]*RC[-5]) -> 1
A352: 27042 | B352: 北京 | C352: 166 | D352: 中度污染 | E352: 1.86 | F352: 10 | G352: 45 | H352: 16 | I352: 163 | J352: 159 | L352: 2013-06-06T01:00:00.000 | M352: =RC[-8]-R[23]C[-8] -> -0.28708333333333313 | N352: =RC[-8]-R[23]C[-8] -> 0.45833333333333393 | O352: =RC[-8]-R[23]C[-8] -> -5.7916666666666643 | P352: =RC[-8]-R[23]C[-8] -> 7.7083333333333339 | Q352: =RC[-8]-R[23]C[-8] -> 32.375 | R352: =RC[-8]-R[23]C[-8] -> 30.291666666666657 | T352: =RC[-7]*RC[-2] -> -8.6962326388888798 | U352: =RC[-7]*RC[-3] -> 13.88368055555557 | V352: =RC[-7]*RC[-4] -> -175.43923611111097 | W352: =RC[-7]*RC[-5] -> 233.49826388888883 | X352: =RC[-7]*RC[-6] -> 980.69270833333303 | Y352: =RC[-12]*RC[-12] -> 8.2416840277777667E-2 | Z352: =RC[-12]*RC[-12] -> 0.21006944444444497 | AA352: =RC[-12]*RC[-12] -> 33.54340277777775 | AB352: =RC[-12]*RC[-12] -> 59.418402777777786 | AC352: =RC[-12]*RC[-12] -> 1048.140625 | AD352: =RC[-12]*RC[-12] -> 917.58506944444389 | AE352: =RC[-11]/SQRT(RC[-6]*RC[-1]) -> -1 | AF352: =RC[-11]/SQRT(RC[-6]*RC[-2]) -> 1 | AG352: =RC[-11]/SQRT(RC[-6]*RC[-3]) -> -0.99999999999999989 | AH352: =RC[-11]/SQRT(RC[-6]*RC[-4]) -> 1 | AI352: =RC[-11]/SQRT(RC[-6]*RC[-5]) -> 1
A353: 27118 | B353: 北京 | C353: 169 | D353: 中度污染 | E353: 1.62 | F353: 8 | G353: 38 | H353: 15 | I353: 148 | J353: 155 | L353: 2013-06-06T02:00:00.000 | M353: =RC[-8]-R[22]C[-8] -> -0.52708333333333313 | N353: =RC[-8]-R[22]C[-8] -> -1.5416666666666661 | O353: =RC[-8]-R[22]C[-8] -> -12.791666666666664 | P353: =RC[-8]-R[22]C[-8] -> 6.7083333333333339 | Q353: =RC[-8]-R[22]C[-8] -> 17.375 | R353: =RC[-8]-R[22]C[-8] -> 26.291666666666657 | T353: =RC[-7]*RC[-2] -> -13.857899305555545 | U353: =RC[-7]*RC[-3] -> -40.532986111111079 | V353: =RC[-7]*RC[-4] -> -336.31423611111092 | W353: =RC[-7]*RC[-5] -> 176.37326388888883 | X353: =RC[-7]*RC[-6] -> 456.81770833333314 | Y353: =RC[-12]*RC[-12] -> 0.27781684027777753 | Z353: =RC[-12]*RC[-12] -> 2.3767361111111094 | AA353: =RC[-12]*RC[-12] -> 163.62673611111106 | AB353: =RC[-12]*RC[-12] -> 45.001736111111121 | AC353: =RC[-12]*RC[-12] -> 301.890625 | AD353: =RC[-12]*RC[-12] -> 691.25173611111063 | AE353: =RC[-11]/SQRT(RC[-6]*RC[-1]) -> -1 | AF353: =RC[-11]/SQRT(RC[-6]*RC[-2]) -> -1 | AG353: =RC[-11]/SQRT(RC[-6]*RC[-3]) -> -1 | AH353: =RC[-11]/SQRT(RC[-6]*RC[-4]) -> 0.99999999999999989 | AI353: =RC[-11]/SQRT(RC[-6]*RC[-5]) -> 0.99999999999999989
A354: 27194 | B354: 北京 | C354: 174 | D354: 中度污染 | E354: 1.52 | F354: 9 | G354: 38 | H354: 14 | I354: 157 | J354: 151 | L354: 2013-06-06T03:00:00.000 | M354: =RC[-8]-R[21]C[-8] -> -0.62708333333333321 | N354: =RC[-8]-R[21]C[-8] -> -0.54166666666666607 | O354: =RC[-8]-R[21]C[-8] -> -12.791666666666664 | P354: =RC[-8]-R[21]C[-8] -> 5.7083333333333339 | Q354: =RC[-8]-R[21]C[-8] -> 26.375 | R354: =RC[-8]-R[21]C[-8] -> 22.291666666666657 | T354: =RC[-7]*RC[-2] -> -13.97873263888888 | U354: =RC[-7]*RC[-3] -> -12.074652777777759 | V354: =RC[-7]*RC[-4] -> -285.14756944444429 | W354: =RC[-7]*RC[-5] -> 127.24826388888884 | X354: =RC[-7]*RC[-6] -> 587.94270833333303 | Y354: =RC[-12]*RC[-12] -> 0.39323350694444431 | Z354: =RC[-12]*RC[-12] -> 0.29340277777777712 | AA354: =RC[-12]*RC[-12] -> 163.62673611111106 | AB354: =RC[-12]*RC[-12] -> 32.58506944444445 | AC354: =RC[-12]*RC[-12] -> 695.640625 | AD354: =RC[-12]*RC[-12] -> 496.91840277777737 | AE354: =RC[-11]/SQRT(RC[-6]*RC[-1]) -> -1 | AF354: =RC[-11]/SQRT(RC[-6]*RC[-2]) -> -1 | AG354: =RC[-11]/SQRT(RC[-6]*RC[-3]) -> -1 | AH354: =RC[-11]/SQRT(RC[-6]*RC[-4]) -> 1 | AI354: =RC[-11]/SQRT(RC[-6]*RC[-5]) -> 1
A355: 27270 | B355: 北京 | C355: 178 | D355: 中度污染 | E355: 1.57 | F355: 10 | G355: 41 | H355: 19 | I355: 165 | J355: 163 | L355: 2013-06-06T04:00:00.000 | M355: =RC[-8]-R[20]C[-8] -> -0.57708333333333317 | N355: =RC[-8]-R[20]C[-8] -> 0.45833333333333393 | O355: =RC[-8]-R[20]C[-8] -> -9.7916666666666643 | P355: =RC[-8]-R[20]C[-8] -> 10.708333333333334 | Q355: =RC[-8]-R[20]C[-8] -> 34.375 | R355: =RC[-8]-R[20]C[-8] -> 34.291666666666657 | T355: =RC[-7]*RC[-2] -> -19.789149305555544 | U355: =RC[-7]*RC[-3] -> 15.717013888888905 | V355: =RC[-7]*RC[-4] -> -335.77256944444429 | W355: =RC[-7]*RC[-5] -> 367.20659722222211 | X355: =RC[-7]*RC[-6] -> 1178.7760416666663 | Y355: =RC[-12]*RC[-12] -> 0.33302517361111095 | Z355: =RC[-12]*RC[-12] -> 0.21006944444444497 | AA355: =RC[-12]*RC[-12] -> 95.876736111111072 | AB355: =RC[-12]*RC[-12] -> 114.66840277777779 | AC355: =RC[-12]*RC[-12] -> 1181.640625 | AD355: =RC[-12]*RC[-12] -> 1175.9184027777771 | AE355: =RC[-11]/SQRT(RC[-6]*RC[-1]) -> -1 | AF355: =RC[-11]/SQRT(RC[-6]*RC[-2]) -> 1 | AG355: =RC[-11]/SQRT(RC[-6]*RC[-3]) -> -1 | AH355: =RC[-11]/SQRT(RC[-6]*RC[-4]) -> 0.99999999999999989 | AI355: =RC[-11]/SQRT(RC[-6]*RC[-5]) -> 1
A356: 27346 | B356: 北京 | C356: 183 | D356: 中度污染 | E356: 1.51 | F356: 10 | G356: 38 | H356: 18 | I356: 155 | J356: 159 | L356: 2013-06-06T05:00:00.000 | M356: =RC[-8]-R[19]C[-8] -> -0.63708333333333322 | N356: =RC[-8]-R[19]C[-8] -> 0.45833333333333393 | O356: =RC[-8]-R[19]C[-8] -> -12.791666666666664 | P356: =RC[-8]-R[19]C[-8] -> 9.7083333333333339 | Q356: =RC[-8]-R[19]C[-8] -> 24.375 | R356: =RC[-8]-R[19]C[-8] -> 30.291666666666657 | T356: =RC[-7]*RC[-2] -> -19.298315972222213 | U356: =RC[-7]*RC[-3] -> 13.88368055555557 | V356: =RC[-7]*RC[-4] -> -387.4809027777776 | W356: =RC[-7]*RC[-5] -> 294.08159722222217 | X356: =RC[-7]*RC[-6] -> 738.35937499999977 | Y356: =RC[-12]*RC[-12] -> 0.40587517361111097 | Z356: =RC[-12]*RC[-12] -> 0.21006944444444497 | AA356: =RC[-12]*RC[-12] -> 163.62673611111106 | AB356: =RC[-12]*RC[-12] -> 94.251736111111128 | AC356: =RC[-12]*RC[-12] -> 594.140625 | AD356: =RC[-12]*RC[-12] -> 917.58506944444389 | AE356: =RC[-11]/SQRT(RC[-6]*RC[-1]) -> -1 | AF356: =RC[-11]/SQRT(RC[-6]*RC[-2]) -> 1 | AG356: =RC[-11]/SQRT(RC[-6]*RC[-3]) -> -1 | AH356: =RC[-11]/SQRT(RC[-6]*RC[-4]) -> 1 | AI356: =RC[-11]/SQRT(RC[-6]*RC[-5]) -> 1
A357: 27422 | B357: 北京 | C357: 186 | D357: 中度污染 | E357: 1.55 | F357: 9 | G357: 38 | H357: 14 | I357: 139 | J357: 141 | L357: 2013-06-06T06:00:00.000 | M357: =RC[-8]-R[18]C[-8] -> -0.59708333333333319 | N357: =RC[-8]-R[18]C[-8] -> -0.54166666666666607 | O357: =RC[-8]-R[18]C[-8] -> -12.791666666666664 | P357: =RC[-8]-R[18]C[-8] -> 5.7083333333333339 | Q357: =RC[-8]-R[18]C[-8] -> 8.375 | R357: =RC[-8]-R[18]C[-8] -> 12.291666666666657 | T357: =RC[-7]*RC[-2] -> -7.3391493055555479 | U357: =RC[-7]*RC[-3] -> -6.6579861111110983 | V357: =RC[-7]*RC[-4] -> -157.23090277777763 | W357: =RC[-7]*RC[-5] -> 70.164930555555515 | X357: =RC[-7]*RC[-6] -> 102.94270833333326 | Y357: =RC[-12]*RC[-12] -> 0.35650850694444425 | Z357: =RC[-12]*RC[-12] -> 0.29340277777777712 | AA357: =RC[-12]*RC[-12] -> 163.62673611111106 | AB357: =RC[-12]*RC[-12] -> 32.58506944444445 | AC357: =RC[-12]*RC[-12] -> 70.140625 | AD357: =RC[-12]*RC[-12] -> 151.0850694444442 | AE357: =RC[-11]/SQRT(RC[-6]*RC[-1]) -> -1.0000000000000002 | AF357: =RC[-11]/SQRT(RC[-6]*RC[-2]) -> -1 | AG357: =RC[-11]/SQRT(RC[-6]*RC[-3]) -> -1 | AH357: =RC[-11]/SQRT(RC[-6]*RC[-4]) -> 1.0000000000000002 | AI357: =RC[-11]/SQRT(RC[-6]*RC[-5]) -> 1
A358: 27498 | B358: 北京 | C358: 188 | D358: 中度污染 | E358: 1.68 | F358: 9 | G358: 41 | H358: 9 | I358: 104 | J358: 120 | L358: 2013-06-06T07:00:00.000 | M358: =RC[-8]-R[17]C[-8] -> -0.46708333333333329 | N358: =RC[-8]-R[17]C[-8] -> -0.54166666666666607 | O358: =RC[-8]-R[17]C[-8] -> -9.7916666666666643 | P358: =RC[-8]-R[17]C[-8] -> 0.70833333333333393 | Q358: =RC[-8]-R[17]C[-8] -> -26.625 | R358: =RC[-8]-R[17]C[-8] -> -8.7083333333333428 | T358: =RC[-7]*RC[-2] -> 4.0675173611111148 | U358: =RC[-7]*RC[-3] -> 4.7170138888888893 | V358: =RC[-7]*RC[-4] -> 85.2690972222223 | W358: =RC[-7]*RC[-5] -> -6.1684027777777892 | X358: =RC[-7]*RC[-6] -> 231.85937500000026 | Y358: =RC[-12]*RC[-12] -> 0.21816684027777775 | Z358: =RC[-12]*RC[-12] -> 0.29340277777777712 | AA358: =RC[-12]*RC[-12] -> 95.876736111111072 | AB358: =RC[-12]*RC[-12] -> 0.50173611111111194 | AC358: =RC[-12]*RC[-12] -> 708.890625 | AD358: =RC[-12]*RC[-12] -> 75.835069444444613 | AE358: =RC[-11]/SQRT(RC[-6]*RC[-1]) -> 0.99999999999999978 | AF358: =RC[-11]/SQRT(RC[-6]*RC[-2]) -> 1 | AG358: =RC[-11]/SQRT(RC[-6]*RC[-3]) -> 1 | AH358: =RC[-11]/SQRT(RC[-6]*RC[-4]) -> -1 | AI358: =RC[-11]/SQRT(RC[-6]*RC[-5]) -> 1
A359: 27574 | B359: 北京 | C359: 188 | D359: 中度污染 | E359: 1.83 | F359: 9 | G359: 44 | H359: 5 | I359: 60 | J359: 102 | L359: 2013-06-06T08:00:00.000 | M359: =RC[-8]-R[16]C[-8] -> -0.31708333333333316 | N359: =RC[-8]-R[16]C[-8] -> -0.54166666666666607 | O359: =RC[-8]-R[16]C[-8] -> -6.7916666666666643 | P359: =RC[-8]-R[16]C[-8] -> -3.2916666666666661 | Q359: =RC[-8]-R[16]C[-8] -> -70.625 | R359: =RC[-8]-R[16]C[-8] -> -26.708333333333343 | T359: =RC[-7]*RC[-2] -> 8.4687673611111087 | U359: =RC[-7]*RC[-3] -> 14.467013888888879 | V359: =RC[-7]*RC[-4] -> 181.39409722222223 | W359: =RC[-7]*RC[-5] -> 87.914930555555571 | X359: =RC[-7]*RC[-6] -> 1886.2760416666674 | Y359: =RC[-12]*RC[-12] -> 0.10054184027777767 | Z359: =RC[-12]*RC[-12] -> 0.29340277777777712 | AA359: =RC[-12]*RC[-12] -> 46.126736111111079 | AB359: =RC[-12]*RC[-12] -> 10.835069444444441 | AC359: =RC[-12]*RC[-12] -> 4987.890625 | AD359: =RC[-12]*RC[-12] -> 713.33506944444491 | AE359: =RC[-11]/SQRT(RC[-6]*RC[-1]) -> 0.99999999999999978 | AF359: =RC[-11]/SQRT(RC[-6]*RC[-2]) -> 1.0000000000000002 | AG359: =RC[-11]/SQRT(RC[-6]*RC[-3]) -> 1 | AH359: =RC[-11]/SQRT(RC[-6]*RC[-4]) -> 1 | AI359: =RC[-11]/SQRT(RC[-6]*RC[-5]) -> 1
A360: 27650 | B360: 北京 | C360: 188 | D360: 中度污染 | E360: 1.98 | F360: 10 | G360: 47 | H360: 4 | I360: 55 | J360: 90 | L360: 2013-06-06T09:00:00.000 | M360: =RC[-8]-R[15]C[-8] -> -0.16708333333333325 | N360: =RC[-8]-R[15]C[-8] -> 0.45833333333333393 | O360: =RC[-8]-R[15]C[-8] -> -3.7916666666666643 | P360: =RC[-8]-R[15]C[-8] -> -4.2916666666666661 | Q360: =RC[-8]-R[15]C[-8] -> -75.625 | R360: =RC[-8]-R[15]C[-8] -> -38.708333333333343 | T360: =RC[-7]*RC[-2] -> 6.4675173611111099 | U360: =RC[-7]*RC[-3] -> -17.741319444444471 | V360: =RC[-7]*RC[-4] -> 146.76909722222217 | W360: =RC[-7]*RC[-5] -> 166.12326388888891 | X360: =RC[-7]*RC[-6] -> 2927.3177083333339 | Y360: =RC[-12]*RC[-12] -> 2.7916840277777751E-2 | Z360: =RC[-12]*RC[-12] -> 0.21006944444444497 | AA360: =RC[-12]*RC[-12] -> 14.376736111111093 | AB360: =RC[-12]*RC[-12] -> 18.418402777777771 | AC360: =RC[-12]*RC[-12] -> 5719.140625 | AD360: =RC[-12]*RC[-12] -> 1498.3350694444453 | AE360: =RC[-11]/SQRT(RC[-6]*RC[-1]) -> 1 | AF360: =RC[-11]/SQRT(RC[-6]*RC[-2]) -> -1 | AG360: =RC[-11]/SQRT(RC[-6]*RC[-3]) -> 1 | AH360: =RC[-11]/SQRT(RC[-6]*RC[-4]) -> 1 | AI360: =RC[-11]/SQRT(RC[-6]*RC[-5]) -> 1
A361: 27726 | B361: 北京 | C361: 187 | D361: 中度污染 | E361: 2.19 | F361: 12 | G361: 49 | H361: 4 | I361: 48 | J361: 90 | L361: 2013-06-06T10:00:00.000 | M361: =RC[-8]-R[14]C[-8] -> 4.2916666666666714E-2 | N361: =RC[-8]-R[14]C[-8] -> 2.4583333333333339 | O361: =RC[-8]-R[14]C[-8] -> -1.7916666666666643 | P361: =RC[-8]-R[14]C[-8] -> -4.2916666666666661 | Q361: =RC[-8]-R[14]C[-8] -> -82.625 | R361: =RC[-8]-R[14]C[-8] -> -38.708333333333343 | T361: =RC[-7]*RC[-2] -> -1.6612326388888912 | U361: =RC[-7]*RC[-3] -> -95.157986111111157 | V361: =RC[-7]*RC[-4] -> 69.352430555555486 | W361: =RC[-7]*RC[-5] -> 166.12326388888891 | X361: =RC[-7]*RC[-6] -> 3198.2760416666674 | Y361: =RC[-12]*RC[-12] -> 1.8418402777777819E-3 | Z361: =RC[-12]*RC[-12] -> 6.0434027777777803 | AA361: =RC[-12]*RC[-12] -> 3.2100694444444358 | AB361: =RC[-12]*RC[-12] -> 18.418402777777771 | AC361: =RC[-12]*RC[-12] -> 6826.890625 | AD361: =RC[-12]*RC[-12] -> 1498.3350694444453 | AE361: =RC[-11]/SQRT(RC[-6]*RC[-1]) -> -1 | AF361: =RC[-11]/SQRT(RC[-6]*RC[-2]) -> -1 | AG361: =RC[-11]/SQRT(RC[-6]*RC[-3]) -> 1 | AH361: =RC[-11]/SQRT(RC[-6]*RC[-4]) -> 1 | AI361: =RC[-11]/SQRT(RC[-6]*RC[-5]) -> 0.99999999999999989
A362: 27802 | B362: 北京 | C362: 186 | D362: 中度污染 | E362: 2.35 | F362: 13 | G362: 52 | H362: 5 | I362: 84 | J362: 92 | L362: 2013-06-06T11:00:00.000 | M362: =RC[-8]-R[13]C[-8] -> 0.20291666666666686 | N362: =RC[-8]-R[13]C[-8] -> 3.4583333333333339 | O362: =RC[-8]-R[13]C[-8] -> 1.2083333333333357 | P362: =RC[-8]-R[13]C[-8] -> -3.2916666666666661 | Q362: =RC[-8]-R[13]C[-8] -> -46.625 | R362: =RC[-8]-R[13]C[-8] -> -36.708333333333343 | T362: =RC[-7]*RC[-2] -> -7.4487326388888979 | U362: =RC[-7]*RC[-3] -> -126.94965277777783 | V362: =RC[-7]*RC[-4] -> -44.355902777777878 | W362: =RC[-7]*RC[-5] -> 120.83159722222223 | X362: =RC[-7]*RC[-6] -> 1711.5260416666672 | Y362: =RC[-12]*RC[-12] -> 4.1175173611111185E-2 | Z362: =RC[-12]*RC[-12] -> 11.960069444444448 | AA362: =RC[-12]*RC[-12] -> 1.4600694444444502 | AB362: =RC[-12]*RC[-12] -> 10.835069444444441 | AC362: =RC[-12]*RC[-12] -> 2173.890625 | AD362: =RC[-12]*RC[-12] -> 1347.5017361111118 | AE362: =RC[-11]/SQRT(RC[-6]*RC[-1]) -> -1.0000000000000002 | AF362: =RC[-11]/SQRT(RC[-6]*RC[-2]) -> -1 | AG362: =RC[-11]/SQRT(RC[-6]*RC[-3]) -> -1 | AH362: =RC[-11]/SQRT(RC[-6]*RC[-4]) -> 1 | AI362: =RC[-11]/SQRT(RC[-6]*RC[-5]) -> 1
A363: 27878 | B363: 北京 | C363: 184 | D363: 中度污染 | E363: 2.38 | F363: 14 | G363: 55 | H363: 5 | I363: 100 | J363: 92 | L363: 2013-06-06T12:00:00.000 | M363: =RC[-8]-R[12]C[-8] -> 0.23291666666666666 | N363: =RC[-8]-R[12]C[-8] -> 4.4583333333333339 | O363: =RC[-8]-R[12]C[-8] -> 4.2083333333333357 | P363: =RC[-8]-R[12]C[-8] -> -3.2916666666666661 | Q363: =RC[-8]-R[12]C[-8] -> -30.625 | R363: =RC[-8]-R[12]C[-8] -> -36.708333333333343 | T363: =RC[-7]*RC[-2] -> -8.5499826388888902 | U363: =RC[-7]*RC[-3] -> -163.65798611111117 | V363: =RC[-7]*RC[-4] -> -154.48090277777791 | W363: =RC[-7]*RC[-5] -> 120.83159722222223 | X363: =RC[-7]*RC[-6] -> 1124.1927083333337 | Y363: =RC[-12]*RC[-12] -> 5.4250173611111105E-2 | Z363: =RC[-12]*RC[-12] -> 19.876736111111118 | AA363: =RC[-12]*RC[-12] -> 17.710069444444464 | AB363: =RC[-12]*RC[-12] -> 10.835069444444441 | AC363: =RC[-12]*RC[-12] -> 937.890625 | AD363: =RC[-12]*RC[-12] -> 1347.5017361111118 | AE363: =RC[-11]/SQRT(RC[-6]*RC[-1]) -> -1 | AF363: =RC[-11]/SQRT(RC[-6]*RC[-2]) -> -1 | AG363: =RC[-11]/SQRT(RC[-6]*RC[-3]) -> -1 | AH363: =RC[-11]/SQRT(RC[-6]*RC[-4]) -> 1 | AI363: =RC[-11]/SQRT(RC[-6]*RC[-5]) -> 1.0000000000000002
A364: 27954 | B364: 北京 | C364: 182 | D364: 中度污染 | E364: 2.39 | F364: 14 | G364: 57 | H364: 6 | I364: 122 | J364: 104 | L364: 2013-06-06T13:00:00.000 | M364: =RC[-8]-R[11]C[-8] -> 0.24291666666666689 | N364: =RC[-8]-R[11]C[-8] -> 4.4583333333333339 | O364: =RC[-8]-R[11]C[-8] -> 6.2083333333333357 | P364: =RC[-8]-R[11]C[-8] -> -2.2916666666666661 | Q364: =RC[-8]-R[11]C[-8] -> -8.625 | R364: =RC[-8]-R[11]C[-8] -> -24.708333333333343 | T364: =RC[-7]*RC[-2] -> -6.0020659722222298 | U364: =RC[-7]*RC[-3] -> -110.15798611111117 | V364: =RC[-7]*RC[-4] -> -153.39756944444457 | W364: =RC[-7]*RC[-5] -> 56.623263888888893 | X364: =RC[-7]*RC[-6] -> 213.10937500000009 | Y364: =RC[-12]*RC[-12] -> 5.9008506944444553E-2 | Z364: =RC[-12]*RC[-12] -> 19.876736111111118 | AA364: =RC[-12]*RC[-12] -> 38.543402777777807 | AB364: =RC[-12]*RC[-12] -> 5.2517361111111081 | AC364: =RC[-12]*RC[-12] -> 74.390625 | AD364: =RC[-12]*RC[-12] -> 610.50173611111154 | AE364: =RC[-11]/SQRT(RC[-6]*RC[-1]) -> -1 | AF364: =RC[-11]/SQRT(RC[-6]*RC[-2]) -> -1 | AG364: =RC[-11]/SQRT(RC[-6]*RC[-3]) -> -1.0000000000000002 | AH364: =RC[-11]/SQRT(RC[-6]*RC[-4]) -> 1 | AI364: =RC[-11]/SQRT(RC[-6]*RC[-5]) -> 1.0000000000000002
A365: 28030 | B365: 北京 | C365: 180 | D365: 中度污染 | E365: 2.41 | F365: 14 | G365: 58 | H365: 7 | I365: 142 | J365: 110 | L365: 2013-06-06T14:00:00.000 | M365: =RC[-8]-R[10]C[-8] -> 0.26291666666666691 | N365: =RC[-8]-R[10]C[-8] -> 4.4583333333333339 | O365: =RC[-8]-R[10]C[-8] -> 7.2083333333333357 | P365: =RC[-8]-R[10]C[-8] -> -1.2916666666666661 | Q365: =RC[-8]-R[10]C[-8] -> 11.375 | R365: =RC[-8]-R[10]C[-8] -> -18.708333333333343 | T365: =RC[-7]*RC[-2] -> -4.9187326388888959 | U365: =RC[-7]*RC[-3] -> -83.407986111111171 | V365: =RC[-7]*RC[-4] -> -134.85590277777789 | W365: =RC[-7]*RC[-5] -> 24.164930555555557 | X365: =RC[-7]*RC[-6] -> -212.80729166666677 | Y365: =RC[-12]*RC[-12] -> 6.9125173611111243E-2 | Z365: =RC[-12]*RC[-12] -> 19.876736111111118 | AA365: =RC[-12]*RC[-12] -> 51.960069444444478 | AB365: =RC[-12]*RC[-12] -> 1.6684027777777763 | AC365: =RC[-12]*RC[-12] -> 129.390625 | AD365: =RC[-12]*RC[-12] -> 350.00173611111148 | AE365: =RC[-11]/SQRT(RC[-6]*RC[-1]) -> -1 | AF365: =RC[-11]/SQRT(RC[-6]*RC[-2]) -> -1 | AG365: =RC[-11]/SQRT(RC[-6]*RC[-3]) -> -0.99999999999999978 | AH365: =RC[-11]/SQRT(RC[-6]*RC[-4]) -> 1 | AI365: =RC[-11]/SQRT(RC[-6]*RC[-5]) -> -1
A366: 28106 | B366: 北京 | C366: 176 | D366: 中度污染 | E366: 2.44 | F366: 13 | G366: 60 | H366: 7 | I366: 126 | J366: 108 | L366: 2013-06-06T15:00:00.000 | M366: =RC[-8]-R[9]C[-8] -> 0.29291666666666671 | N366: =RC[-8]-R[9]C[-8] -> 3.4583333333333339 | O366: =RC[-8]-R[9]C[-8] -> 9.2083333333333357 | P366: =RC[-8]-R[9]C[-8] -> -1.2916666666666661 | Q366: =RC[-8]-R[9]C[-8] -> -4.625 | R366: =RC[-8]-R[9]C[-8] -> -20.708333333333343 | T366: =RC[-7]*RC[-2] -> -6.065815972222226 | U366: =RC[-7]*RC[-3] -> -71.616319444444485 | V366: =RC[-7]*RC[-4] -> -190.68923611111126 | W366: =RC[-7]*RC[-5] -> 26.748263888888889 | X366: =RC[-7]*RC[-6] -> 95.776041666666714 | Y366: =RC[-12]*RC[-12] -> 8.5800173611111141E-2 | Z366: =RC[-12]*RC[-12] -> 11.960069444444448 | AA366: =RC[-12]*RC[-12] -> 84.793402777777828 | AB366: =RC[-12]*RC[-12] -> 1.6684027777777763 | AC366: =RC[-12]*RC[-12] -> 21.390625 | AD366: =RC[-12]*RC[-12] -> 428.83506944444485 | AE366: =RC[-11]/SQRT(RC[-6]*RC[-1]) -> -1 | AF366: =RC[-11]/SQRT(RC[-6]*RC[-2]) -> -1 | AG366: =RC[-11]/SQRT(RC[-6]*RC[-3]) -> -1 | AH366: =RC[-11]/SQRT(RC[-6]*RC[-4]) -> 0.99999999999999989 | AI366: =RC[-11]/SQRT(RC[-6]*RC[-5]) -> 1
A367: 28182 | B367: 北京 | C367: 174 | D367: 中度污染 | E367: 2.48 | F367: 9 | G367: 57 | H367: 7 | I367: 126 | J367: 122 | L367: 2013-06-06T16:00:00.000 | M367: =RC[-8]-R[8]C[-8] -> 0.33291666666666675 | N367: =RC[-8]-R[8]C[-8] -> -0.54166666666666607 | O367: =RC[-8]-R[8]C[-8] -> 6.2083333333333357 | P367: =RC[-8]-R[8]C[-8] -> -1.2916666666666661 | Q367: =RC[-8]-R[8]C[-8] -> -4.625 | R367: =RC[-8]-R[8]C[-8] -> -6.7083333333333428 | T367: =RC[-7]*RC[-2] -> -2.233315972222226 | U367: =RC[-7]*RC[-3] -> 3.6336805555555567 | V367: =RC[-7]*RC[-4] -> -41.647569444444521 | W367: =RC[-7]*RC[-5] -> 8.6649305555555642 | X367: =RC[-7]*RC[-6] -> 31.02604166666671 | Y367: =RC[-12]*RC[-12] -> 0.11083350694444449 | Z367: =RC[-12]*RC[-12] -> 0.29340277777777712 | AA367: =RC[-12]*RC[-12] -> 38.543402777777807 | AB367: =RC[-12]*RC[-12] -> 1.6684027777777763 | AC367: =RC[-12]*RC[-12] -> 21.390625 | AD367: =RC[-12]*RC[-12] -> 45.001736111111235 | AE367: =RC[-11]/SQRT(RC[-6]*RC[-1]) -> -1 | AF367: =RC[-11]/SQRT(RC[-6]*RC[-2]) -> 1.0000000000000002 | AG367: =RC[-11]/SQRT(RC[-6]*RC[-3]) -> -1.0000000000000002 | AH367: =RC[-11]/SQRT(RC[-6]*RC[-4]) -> 1 | AI367: =RC[-11]/SQRT(RC[-6]*RC[-5]) -> 1
A368: 28258 | B368: 北京 | C368: 172 | D368: 中度污染 | E368: 2.63 | F368: 8 | G368: 59 | H368: 6 | I368: 129 | J368: 122 | L368: 2013-06-06T17:00:00.000 | M368: =RC[-8]-R[7]C[-8] -> 0.48291666666666666 | N368: =RC[-8]-R[7]C[-8] -> -1.5416666666666661 | O368: =RC[-8]-R[7]C[-8] -> 8.2083333333333357 | P368: =RC[-8]-R[7]C[-8] -> -2.2916666666666661 | Q368: =RC[-8]-R[7]C[-8] -> -1.625 | R368: =RC[-8]-R[7]C[-8] -> -6.7083333333333428 | T368: =RC[-7]*RC[-2] -> -3.239565972222227 | U368: =RC[-7]*RC[-3] -> 10.3420138888889 | V368: =RC[-7]*RC[-4] -> -55.064236111111207 | W368: =RC[-7]*RC[-5] -> 15.373263888888907 | X368: =RC[-7]*RC[-6] -> 10.901041666666682 | Y368: =RC[-12]*RC[-12] -> 0.23320850694444445 | Z368: =RC[-12]*RC[-12] -> 2.3767361111111094 | AA368: =RC[-12]*RC[-12] -> 67.376736111111157 | AB368: =RC[-12]*RC[-12] -> 5.2517361111111081 | AC368: =RC[-12]*RC[-12] -> 2.640625 | AD368: =RC[-12]*RC[-12] -> 45.001736111111235 | AE368: =RC[-11]/SQRT(RC[-6]*RC[-1]) -> -1.0000000000000002 | AF368: =RC[-11]/SQRT(RC[-6]*RC[-2]) -> 1 | AG368: =RC[-11]/SQRT(RC[-6]*RC[-3]) -> -1 | AH368: =RC[-11]/SQRT(RC[-6]*RC[-4]) -> 1.0000000000000002 | AI368: =RC[-11]/SQRT(RC[-6]*RC[-5]) -> 1
A369: 28334 | B369: 北京 | C369: 171 | D369: 中度污染 | E369: 2.72 | F369: 7 | G369: 63 | H369: 4 | I369: 159 | J369: 145 | L369: 2013-06-06T18:00:00.000 | M369: =RC[-8]-R[6]C[-8] -> 0.57291666666666696 | N369: =RC[-8]-R[6]C[-8] -> -2.5416666666666661 | O369: =RC[-8]-R[6]C[-8] -> 12.208333333333336 | P369: =RC[-8]-R[6]C[-8] -> -4.2916666666666661 | Q369: =RC[-8]-R[6]C[-8] -> 28.375 | R369: =RC[-8]-R[6]C[-8] -> 16.291666666666657 | T369: =RC[-7]*RC[-2] -> 9.3337673611111107 | U369: =RC[-7]*RC[-3] -> -41.407986111111079 | V369: =RC[-7]*RC[-4] -> 198.89409722222214 | W369: =RC[-7]*RC[-5] -> -69.918402777777729 | X369: =RC[-7]*RC[-6] -> 462.2760416666664 | Y369: =RC[-12]*RC[-12] -> 0.32823350694444481 | Z369: =RC[-12]*RC[-12] -> 6.4600694444444411 | AA369: =RC[-12]*RC[-12] -> 149.04340277777783 | AB369: =RC[-12]*RC[-12] -> 18.418402777777771 | AC369: =RC[-12]*RC[-12] -> 805.140625 | AD369: =RC[-12]*RC[-12] -> 265.41840277777749 | AE369: =RC[-11]/SQRT(RC[-6]*RC[-1]) -> 1 | AF369: =RC[-11]/SQRT(RC[-6]*RC[-2]) -> -1 | AG369: =RC[-11]/SQRT(RC[-6]*RC[-3]) -> 1 | AH369: =RC[-11]/SQRT(RC[-6]*RC[-4]) -> -1 | AI369: =RC[-11]/SQRT(RC[-6]*RC[-5]) -> 1
A370: 28410 | B370: 北京 | C370: 180 | D370: 中度污染 | E370: 2.69 | F370: 7 | G370: 65 | H370: 3 | I370: 181 | J370: 150 | L370: 2013-06-06T19:00:00.000 | M370: =RC[-8]-R[5]C[-8] -> 0.54291666666666671 | N370: =RC[-8]-R[5]C[-8] -> -2.5416666666666661 | O370: =RC[-8]-R[5]C[-8] -> 14.208333333333336 | P370: =RC[-8]-R[5]C[-8] -> -5.2916666666666661 | Q370: =RC[-8]-R[5]C[-8] -> 50.375 | R370: =RC[-8]-R[5]C[-8] -> 21.291666666666657 | T370: =RC[-7]*RC[-2] -> 11.559600694444441 | U370: =RC[-7]*RC[-3] -> -54.116319444444407 | V370: =RC[-7]*RC[-4] -> 302.51909722222211 | W370: =RC[-7]*RC[-5] -> -112.66840277777771 | X370: =RC[-7]*RC[-6] -> 1072.5677083333328 | Y370: =RC[-12]*RC[-12] -> 0.2947585069444445 | Z370: =RC[-12]*RC[-12] -> 6.4600694444444411 | AA370: =RC[-12]*RC[-12] -> 201.87673611111117 | AB370: =RC[-12]*RC[-12] -> 28.001736111111104 | AC370: =RC[-12]*RC[-12] -> 2537.640625 | AD370: =RC[-12]*RC[-12] -> 453.33506944444406 | AE370: =RC[-11]/SQRT(RC[-6]*RC[-1]) -> 1 | AF370: =RC[-11]/SQRT(RC[-6]*RC[-2]) -> -1 | AG370: =RC[-11]/SQRT(RC[-6]*RC[-3]) -> 1 | AH370: =RC[-11]/SQRT(RC[-6]*RC[-4]) -> -1 | AI370: =RC[-11]/SQRT(RC[-6]*RC[-5]) -> 1
A371: 28486 | B371: 北京 | C371: 178 | D371: 中度污染 | E371: 2.57 | F371: 6 | G371: 61 | H371: 2 | I371: 174 | J371: 144 | L371: 2013-06-06T20:00:00.000 | M371: =RC[-8]-R[4]C[-8] -> 0.42291666666666661 | N371: =RC[-8]-R[4]C[-8] -> -3.5416666666666661 | O371: =RC[-8]-R[4]C[-8] -> 10.208333333333336 | P371: =RC[-8]-R[4]C[-8] -> -6.2916666666666661 | Q371: =RC[-8]-R[4]C[-8] -> 43.375 | R371: =RC[-8]-R[4]C[-8] -> 15.291666666666657 | T371: =RC[-7]*RC[-2] -> 6.4671006944444391 | U371: =RC[-7]*RC[-3] -> -54.157986111111072 | V371: =RC[-7]*RC[-4] -> 156.10243055555549 | W371: =RC[-7]*RC[-5] -> -96.210069444444372 | X371: =RC[-7]*RC[-6] -> 663.27604166666629 | Y371: =RC[-12]*RC[-12] -> 0.17885850694444438 | Z371: =RC[-12]*RC[-12] -> 12.543402777777773 | AA371: =RC[-12]*RC[-12] -> 104.2100694444445 | AB371: =RC[-12]*RC[-12] -> 39.585069444444436 | AC371: =RC[-12]*RC[-12] -> 1881.390625 | AD371: =RC[-12]*RC[-12] -> 233.83506944444414 | AE371: =RC[-11]/SQRT(RC[-6]*RC[-1]) -> 1 | AF371: =RC[-11]/SQRT(RC[-6]*RC[-2]) -> -1.0000000000000002 | AG371: =RC[-11]/SQRT(RC[-6]*RC[-3]) -> 1 | AH371: =RC[-11]/SQRT(RC[-6]*RC[-4]) -> -1 | AI371: =RC[-11]/SQRT(RC[-6]*RC[-5]) -> 1
A372: 28562 | B372: 北京 | C372: 175 | D372: 中度污染 | E372: 2.44 | F372: 6 | G372: 58 | H372: 4 | I372: 157 | J372: 134 | L372: 2013-06-06T21:00:00.000 | M372: =RC[-8]-R[3]C[-8] -> 0.29291666666666671 | N372: =RC[-8]-R[3]C[-8] -> -3.5416666666666661 | O372: =RC[-8]-R[3]C[-8] -> 7.2083333333333357 | P372: =RC[-8]-R[3]C[-8] -> -4.2916666666666661 | Q372: =RC[-8]-R[3]C[-8] -> 26.375 | R372: =RC[-8]-R[3]C[-8] -> 5.2916666666666572 | T372: =RC[-7]*RC[-2] -> 1.5500173611111085 | U372: =RC[-7]*RC[-3] -> -18.741319444444407 | V372: =RC[-7]*RC[-4] -> 38.144097222222165 | W372: =RC[-7]*RC[-5] -> -22.7100694444444 | X372: =RC[-7]*RC[-6] -> 139.56770833333309 | Y372: =RC[-12]*RC[-12] -> 8.5800173611111141E-2 | Z372: =RC[-12]*RC[-12] -> 12.543402777777773 | AA372: =RC[-12]*RC[-12] -> 51.960069444444478 | AB372: =RC[-12]*RC[-12] -> 18.418402777777771 | AC372: =RC[-12]*RC[-12] -> 695.640625 | AD372: =RC[-12]*RC[-12] -> 28.001736111111011 | AE372: =RC[-11]/SQRT(RC[-6]*RC[-1]) -> 1 | AF372: =RC[-11]/SQRT(RC[-6]*RC[-2]) -> -1 | AG372: =RC[-11]/SQRT(RC[-6]*RC[-3]) -> 1 | AH372: =RC[-11]/SQRT(RC[-6]*RC[-4]) -> -1 | AI372: =RC[-11]/SQRT(RC[-6]*RC[-5]) -> 1
A373: 28638 | B373: 北京 | C373: 173 | D373: 中度污染 | E373: 2.4 | F373: 6 | G373: 57 | H373: 4 | I373: 142 | J373: 132 | L373: 2013-06-06T22:00:00.000 | M373: =RC[-8]-R[2]C[-8] -> 0.25291666666666668 | N373: =RC[-8]-R[2]C[-8] -> -3.5416666666666661 | O373: =RC[-8]-R[2]C[-8] -> 6.2083333333333357 | P373: =RC[-8]-R[2]C[-8] -> -4.2916666666666661 | Q373: =RC[-8]-R[2]C[-8] -> 11.375 | R373: =RC[-8]-R[2]C[-8] -> 3.2916666666666572 | T373: =RC[-7]*RC[-2] -> 0.83251736111110874 | U373: =RC[-7]*RC[-3] -> -11.657986111111075 | V373: =RC[-7]*RC[-4] -> 20.43576388888884 | W373: =RC[-7]*RC[-5] -> -14.126736111111068 | X373: =RC[-7]*RC[-6] -> 37.442708333333229 | Y373: =RC[-12]*RC[-12] -> 6.3966840277777784E-2 | Z373: =RC[-12]*RC[-12] -> 12.543402777777773 | AA373: =RC[-12]*RC[-12] -> 38.543402777777807 | AB373: =RC[-12]*RC[-12] -> 18.418402777777771 | AC373: =RC[-12]*RC[-12] -> 129.390625 | AD373: =RC[-12]*RC[-12] -> 10.835069444444382 | AE373: =RC[-11]/SQRT(RC[-6]*RC[-1]) -> 1 | AF373: =RC[-11]/SQRT(RC[-6]*RC[-2]) -> -1 | AG373: =RC[-11]/SQRT(RC[-6]*RC[-3]) -> 1.0000000000000002 | AH373: =RC[-11]/SQRT(RC[-6]*RC[-4]) -> -1 | AI373: =RC[-11]/SQRT(RC[-6]*RC[-5]) -> 1
A374: 28714 | B374: 北京 | C374: 172 | D374: 中度污染 | E374: 2.35 | F374: 6 | G374: 56 | H374: 7 | I374: 136 | J374: 139 | L374: 2013-06-06T23:00:00.000 | M374: =RC[-8]-R[1]C[-8] -> 0.20291666666666686 | N374: =RC[-8]-R[1]C[-8] -> -3.5416666666666661 | O374: =RC[-8]-R[1]C[-8] -> 5.2083333333333357 | P374: =RC[-8]-R[1]C[-8] -> -1.2916666666666661 | Q374: =RC[-8]-R[1]C[-8] -> 5.375 | R374: =RC[-8]-R[1]C[-8] -> 10.291666666666657 | T374: =RC[-7]*RC[-2] -> 2.0883506944444443 | U374: =RC[-7]*RC[-3] -> -36.449652777777736 | V374: =RC[-7]*RC[-4] -> 53.602430555555529 | W374: =RC[-7]*RC[-5] -> -13.293402777777759 | X374: =RC[-7]*RC[-6] -> 55.317708333333286 | Y374: =RC[-12]*RC[-12] -> 4.1175173611111185E-2 | Z374: =RC[-12]*RC[-12] -> 12.543402777777773 | AA374: =RC[-12]*RC[-12] -> 27.126736111111136 | AB374: =RC[-12]*RC[-12] -> 1.6684027777777763 | AC374: =RC[-12]*RC[-12] -> 28.890625 | AD374: =RC[-12]*RC[-12] -> 105.91840277777759 | AE374: =RC[-11]/SQRT(RC[-6]*RC[-1]) -> 1 | AF374: =RC[-11]/SQRT(RC[-6]*RC[-2]) -> -1 | AG374: =RC[-11]/SQRT(RC[-6]*RC[-3]) -> 0.99999999999999989 | AH374: =RC[-11]/SQRT(RC[-6]*RC[-4]) -> -0.99999999999999989 | AI374: =RC[-11]/SQRT(RC[-6]*RC[-5]) -> 1.0000000000000002
E375: =AVERAGE(R[-24]C:R[-1]C) -> 2.1470833333333332 | F375: =AVERAGE(R[-24]C:R[-1]C) -> 9.5416666666666661 | G375: =AVERAGE(R[-24]C:R[-1]C) -> 50.791666666666664 | H375: =AVERAGE(R[-24]C:R[-1]C) -> 8.2916666666666661 | I375: =AVERAGE(R[-24]C:R[-1]C) -> 130.625 | J375: =AVERAGE(R[-24]C:R[-1]C) -> 128.70833333333334 | M375: =RC[-8]-RC[-8] -> 0 | N375: =RC[-8]-RC[-8] -> 0 | O375: =RC[-8]-RC[-8] -> 0 | P375: =RC[-8]-RC[-8] -> 0 | Q375: =RC[-8]-RC[-8] -> 0 | R375: =RC[-8]-RC[-8] -> 0 | T375: =SUM(R[-24]C:R[-1]C) -> -78.670416666666668 | U375: =SUM(R[-24]C:R[-1]C) -> -851.20833333333348 | V375: =SUM(R[-24]C:R[-1]C) -> -1518.4583333333333 | W375: =SUM(R[-24]C:R[-1]C) -> 1934.0416666666658 | X375: =SUM(R[-24]C:R[-1]C) -> 18868.375000000004 | Y375: =SUM(R[-24]C:R[-1]C) -> 3.8748958333333334 | Z375: =SUM(R[-24]C:R[-1]C) -> 159.95833333333331 | AA375: =SUM(R[-24]C:R[-1]C) -> 1893.9583333333337 | AB375: =SUM(R[-24]C:R[-1]C) -> 620.95833333333348 | AC375: =SUM(R[-24]C:R[-1]C) -> 32621.625 | AD375: =SUM(R[-24]C:R[-1]C) -> 14724.958333333332 | AE375: =RC[-11]/SQRT(RC[-6]*RC[-1]) -> -0.32934751961389819 | AF375: =RC[-11]/SQRT(RC[-6]*RC[-2]) -> -0.55463260183432739 | AG375: =RC[-11]/SQRT(RC[-6]*RC[-3]) -> -0.2875349439996075 | AH375: =RC[-11]/SQRT(RC[-6]*RC[-4]) -> 0.63959868042190904 | AI375: =RC[-11]/SQRT(RC[-6]*RC[-5]) -> 0.86090388225097558
A376: 28790 | B376: 北京 | C376: 170 | D376: 中度污染 | E376: 2.29 | F376: 6 | G376: 53 | H376: 7 | I376: 133 | J376: 146 | L376: 2013-06-07T00:00:00.000 | M376: =RC[-8]-R[24]C[-8] -> 5.3333333333333677E-2 | N376: =RC[-8]-R[24]C[-8] -> -3.9583333333333339 | O376: =RC[-8]-R[24]C[-8] -> 8.3333333333335702E-2 | P376: =RC[-8]-R[24]C[-8] -> 3.1666666666666665 | Q376: =RC[-8]-R[24]C[-8] -> 4.5416666666666572 | R376: =RC[-8]-R[24]C[-8] -> 19.208333333333329 | T376: =RC[-7]*RC[-2] -> 1.0244444444444507 | U376: =RC[-7]*RC[-3] -> -76.0329861111111 | V376: =RC[-7]*RC[-4] -> 1.6006944444444895 | W376: =RC[-7]*RC[-5] -> 60.826388888888872 | X376: =RC[-7]*RC[-6] -> 87.237847222222015 | Y376: =RC[-12]*RC[-12] -> 2.844444444444481E-3 | Z376: =RC[-12]*RC[-12] -> 15.668402777777782 | AA376: =RC[-12]*RC[-12] -> 6.9444444444448396E-3 | AB376: =RC[-12]*RC[-12] -> 10.027777777777777 | AC376: =RC[-12]*RC[-12] -> 20.626736111111025 | AD376: =RC[-12]*RC[-12] -> 368.96006944444429 | AE376: =RC[-11]/SQRT(RC[-6]*RC[-1]) -> 0.99999999999999978 | AF376: =RC[-11]/SQRT(RC[-6]*RC[-2]) -> -1 | AG376: =RC[-11]/SQRT(RC[-6]*RC[-3]) -> 0.99999999999999989 | AH376: =RC[-11]/SQRT(RC[-6]*RC[-4]) -> 1 | AI376: =RC[-11]/SQRT(RC[-6]*RC[-5]) -> 0.99999999999999989
A377: 28866 | B377: 北京 | C377: 170 | D377: 中度污染 | E377: 2.25 | F377: 6 | G377: 50 | H377: 8 | I377: 131 | J377: 146 | L377: 2013-06-07T01:00:00.000 | M377: =RC[-8]-R[23]C[-8] -> 1.3333333333333641E-2 | N377: =RC[-8]-R[23]C[-8] -> -3.9583333333333339 | O377: =RC[-8]-R[23]C[-8] -> -2.9166666666666643 | P377: =RC[-8]-R[23]C[-8] -> 4.1666666666666661 | Q377: =RC[-8]-R[23]C[-8] -> 2.5416666666666572 | R377: =RC[-8]-R[23]C[-8] -> 19.208333333333329 | T377: =RC[-7]*RC[-2] -> 0.25611111111111695 | U377: =RC[-7]*RC[-3] -> -76.0329861111111 | V377: =RC[-7]*RC[-4] -> -56.024305555555493 | W377: =RC[-7]*RC[-5] -> 80.034722222222186 | X377: =RC[-7]*RC[-6] -> 48.821180555555358 | Y377: =RC[-12]*RC[-12] -> 1.77777777777786E-4 | Z377: =RC[-12]*RC[-12] -> 15.668402777777782 | AA377: =RC[-12]*RC[-12] -> 8.5069444444444304 | AB377: =RC[-12]*RC[-12] -> 17.361111111111107 | AC377: =RC[-12]*RC[-12] -> 6.4600694444443967 | AD377: =RC[-12]*RC[-12] -> 368.96006944444429 | AE377: =RC[-11]/SQRT(RC[-6]*RC[-1]) -> 0.99999999999999978 | AF377: =RC[-11]/SQRT(RC[-6]*RC[-2]) -> -1 | AG377: =RC[-11]/SQRT(RC[-6]*RC[-3]) -> -0.99999999999999989 | AH377: =RC[-11]/SQRT(RC[-6]*RC[-4]) -> 0.99999999999999978 | AI377: =RC[-11]/SQRT(RC[-6]*RC[-5]) -> 0.99999999999999989
A378: 28942 | B378: 北京 | C378: 170 | D378: 中度污染 | E378: 2.23 | F378: 7 | G378: 52 | H378: 7 | I378: 137 | J378: 144 | L378: 2013-06-07T02:00:00.000 | M378: =RC[-8]-R[22]C[-8] -> -6.6666666666663765E-3 | N378: =RC[-8]-R[22]C[-8] -> -2.9583333333333339 | O378: =RC[-8]-R[22]C[-8] -> -0.9166666666666643 | P378: =RC[-8]-R[22]C[-8] -> 3.1666666666666665 | Q378: =RC[-8]-R[22]C[-8] -> 8.5416666666666572 | R378: =RC[-8]-R[22]C[-8] -> 17.208333333333329 | T378: =RC[-7]*RC[-2] -> -0.1147222222222172 | U378: =RC[-7]*RC[-3] -> -50.907986111111107 | V378: =RC[-7]*RC[-4] -> -15.774305555555511 | W378: =RC[-7]*RC[-5] -> 54.493055555555536 | X378: =RC[-7]*RC[-6] -> 146.98784722222203 | Y378: =RC[-12]*RC[-12] -> 4.4444444444440577E-5 | Z378: =RC[-12]*RC[-12] -> 8.7517361111111143 | AA378: =RC[-12]*RC[-12] -> 0.84027777777777346 | AB378: =RC[-12]*RC[-12] -> 10.027777777777777 | AC378: =RC[-12]*RC[-12] -> 72.960069444444287 | AD378: =RC[-12]*RC[-12] -> 296.12673611111097 | AE378: =RC[-11]/SQRT(RC[-6]*RC[-1]) -> -1 | AF378: =RC[-11]/SQRT(RC[-6]*RC[-2]) -> -1 | AG378: =RC[-11]/SQRT(RC[-6]*RC[-3]) -> -1 | AH378: =RC[-11]/SQRT(RC[-6]*RC[-4]) -> 1 | AI378: =RC[-11]/SQRT(RC[-6]*RC[-5]) -> 1
A379: 29018 | B379: 北京 | C379: 170 | D379: 中度污染 | E379: 2.19 | F379: 7 | G379: 52 | H379: 2 | I379: 142 | J379: 150 | L379: 2013-06-07T03:00:00.000 | M379: =RC[-8]-R[21]C[-8] -> -4.6666666666666412E-2 | N379: =RC[-8]-R[21]C[-8] -> -2.9583333333333339 | O379: =RC[-8]-R[21]C[-8] -> -0.9166666666666643 | P379: =RC[-8]-R[21]C[-8] -> -1.8333333333333335 | Q379: =RC[-8]-R[21]C[-8] -> 13.541666666666657 | R379: =RC[-8]-R[21]C[-8] -> 23.208333333333329 | T379: =RC[-7]*RC[-2] -> -1.0830555555555494 | U379: =RC[-7]*RC[-3] -> -68.657986111111114 | V379: =RC[-7]*RC[-4] -> -21.274305555555497 | W379: =RC[-7]*RC[-5] -> -42.548611111111107 | X379: =RC[-7]*RC[-6] -> 314.27951388888863 | Y379: =RC[-12]*RC[-12] -> 2.1777777777777542E-3 | Z379: =RC[-12]*RC[-12] -> 8.7517361111111143 | AA379: =RC[-12]*RC[-12] -> 0.84027777777777346 | AB379: =RC[-12]*RC[-12] -> 3.3611111111111116 | AC379: =RC[-12]*RC[-12] -> 183.37673611111086 | AD379: =RC[-12]*RC[-12] -> 538.62673611111086 | AE379: =RC[-11]/SQRT(RC[-6]*RC[-1]) -> -1 | AF379: =RC[-11]/SQRT(RC[-6]*RC[-2]) -> -1 | AG379: =RC[-11]/SQRT(RC[-6]*RC[-3]) -> -1 | AH379: =RC[-11]/SQRT(RC[-6]*RC[-4]) -> -1.0000000000000002 | AI379: =RC[-11]/SQRT(RC[-6]*RC[-5]) -> 1
A380: 29094 | B380: 北京 | C380: 168 | D380: 中度污染 | E380: 2.09 | F380: 10 | G380: 52 | H380: 4 | I380: 135 | J380: 144 | L380: 2013-06-07T04:00:00.000 | M380: =RC[-8]-R[20]C[-8] -> -0.1466666666666665 | N380: =RC[-8]-R[20]C[-8] -> 4.1666666666666075E-2 | O380: =RC[-8]-R[20]C[-8] -> -0.9166666666666643 | P380: =RC[-8]-R[20]C[-8] -> 0.16666666666666652 | Q380: =RC[-8]-R[20]C[-8] -> 6.5416666666666572 | R380: =RC[-8]-R[20]C[-8] -> 17.208333333333329 | T380: =RC[-7]*RC[-2] -> -2.5238888888888855 | U380: =RC[-7]*RC[-3] -> 0.71701388888887851 | V380: =RC[-7]*RC[-4] -> -15.774305555555511 | W380: =RC[-7]*RC[-5] -> 2.8680555555555522 | X380: =RC[-7]*RC[-6] -> 112.57118055555536 | Y380: =RC[-12]*RC[-12] -> 2.1511111111111061E-2 | Z380: =RC[-12]*RC[-12] -> 1.7361111111110618E-3 | AA380: =RC[-12]*RC[-12] -> 0.84027777777777346 | AB380: =RC[-12]*RC[-12] -> 2.7777777777777728E-2 | AC380: =RC[-12]*RC[-12] -> 42.793402777777651 | AD380: =RC[-12]*RC[-12] -> 296.12673611111097 | AE380: =RC[-11]/SQRT(RC[-6]*RC[-1]) -> -1 | AF380: =RC[-11]/SQRT(RC[-6]*RC[-2]) -> 1 | AG380: =RC[-11]/SQRT(RC[-6]*RC[-3]) -> -1 | AH380: =RC[-11]/SQRT(RC[-6]*RC[-4]) -> 1 | AI380: =RC[-11]/SQRT(RC[-6]*RC[-5]) -> 1
A381: 29170 | B381: 北京 | C381: 167 | D381: 中度污染 | E381: 1.99 | F381: 11 | G381: 49 | H381: 3 | I381: 134 | J381: 137 | L381: 2013-06-07T05:00:00.000 | M381: =RC[-8]-R[19]C[-8] -> -0.24666666666666637 | N381: =RC[-8]-R[19]C[-8] -> 1.0416666666666661 | O381: =RC[-8]-R[19]C[-8] -> -3.9166666666666643 | P381: =RC[-8]-R[19]C[-8] -> -0.83333333333333348 | Q381: =RC[-8]-R[19]C[-8] -> 5.5416666666666572 | R381: =RC[-8]-R[19]C[-8] -> 10.208333333333329 | T381: =RC[-7]*RC[-2] -> -2.5180555555555513 | U381: =RC[-7]*RC[-3] -> 10.633680555555545 | V381: =RC[-7]*RC[-4] -> -39.982638888888843 | W381: =RC[-7]*RC[-5] -> -8.5069444444444429 | X381: =RC[-7]*RC[-6] -> 56.571180555555429 | Y381: =RC[-12]*RC[-12] -> 6.0844444444444298E-2 | Z381: =RC[-12]*RC[-12] -> 1.0850694444444433 | AA381: =RC[-12]*RC[-12] -> 15.340277777777759 | AB381: =RC[-12]*RC[-12] -> 0.69444444444444464 | AC381: =RC[-12]*RC[-12] -> 30.71006944444434 | AD381: =RC[-12]*RC[-12] -> 104.21006944444434 | AE381: =RC[-11]/SQRT(RC[-6]*RC[-1]) -> -1 | AF381: =RC[-11]/SQRT(RC[-6]*RC[-2]) -> 1 | AG381: =RC[-11]/SQRT(RC[-6]*RC[-3]) -> -1 | AH381: =RC[-11]/SQRT(RC[-6]*RC[-4]) -> -1.0000000000000002 | AI381: =RC[-11]/SQRT(RC[-6]*RC[-5]) -> 1
A382: 29246 | B382: 北京 | C382: 166 | D382: 中度污染 | E382: 1.89 | F382: 12 | G382: 44 | H382: 4 | I382: 118 | J382: 129 | L382: 2013-06-07T06:00:00.000 | M382: =RC[-8]-R[18]C[-8] -> -0.34666666666666646 | N382: =RC[-8]-R[18]C[-8] -> 2.0416666666666661 | O382: =RC[-8]-R[18]C[-8] -> -8.9166666666666643 | P382: =RC[-8]-R[18]C[-8] -> 0.16666666666666652 | Q382: =RC[-8]-R[18]C[-8] -> -10.458333333333343 | R382: =RC[-8]-R[18]C[-8] -> 2.2083333333333286 | T382: =RC[-7]*RC[-2] -> -0.76555555555555344 | U382: =RC[-7]*RC[-3] -> 4.5086805555555447 | V382: =RC[-7]*RC[-4] -> -19.690972222222175 | W382: =RC[-7]*RC[-5] -> 0.36805555555555441 | X382: =RC[-7]*RC[-6] -> -23.095486111111082 | Y382: =RC[-12]*RC[-12] -> 0.12017777777777763 | Z382: =RC[-12]*RC[-12] -> 4.168402777777775 | AA382: =RC[-12]*RC[-12] -> 79.5069444444444 | AB382: =RC[-12]*RC[-12] -> 2.7777777777777728E-2 | AC382: =RC[-12]*RC[-12] -> 109.37673611111131 | AD382: =RC[-12]*RC[-12] -> 4.8767361111110903 | AE382: =RC[-11]/SQRT(RC[-6]*RC[-1]) -> -1 | AF382: =RC[-11]/SQRT(RC[-6]*RC[-2]) -> 1 | AG382: =RC[-11]/SQRT(RC[-6]*RC[-3]) -> -1 | AH382: =RC[-11]/SQRT(RC[-6]*RC[-4]) -> 1 | AI382: =RC[-11]/SQRT(RC[-6]*RC[-5]) -> -1
A383: 29322 | B383: 北京 | C383: 166 | D383: 中度污染 | E383: 1.91 | F383: 13 | G383: 43 | H383: 3 | I383: 116 | J383: 121 | L383: 2013-06-07T07:00:00.000 | M383: =RC[-8]-R[17]C[-8] -> -0.32666666666666644 | N383: =RC[-8]-R[17]C[-8] -> 3.0416666666666661 | O383: =RC[-8]-R[17]C[-8] -> -9.9166666666666643 | P383: =RC[-8]-R[17]C[-8] -> -0.83333333333333348 | Q383: =RC[-8]-R[17]C[-8] -> -12.458333333333343 | R383: =RC[-8]-R[17]C[-8] -> -5.7916666666666714 | T383: =RC[-7]*RC[-2] -> 1.8919444444444447 | U383: =RC[-7]*RC[-3] -> -17.616319444444457 | V383: =RC[-7]*RC[-4] -> 57.434027777777814 | W383: =RC[-7]*RC[-5] -> 4.8263888888888937 | X383: =RC[-7]*RC[-6] -> 72.154513888888999 | Y383: =RC[-12]*RC[-12] -> 0.10671111111111097 | Z383: =RC[-12]*RC[-12] -> 9.2517361111111072 | AA383: =RC[-12]*RC[-12] -> 98.340277777777729 | AB383: =RC[-12]*RC[-12] -> 0.69444444444444464 | AC383: =RC[-12]*RC[-12] -> 155.21006944444468 | AD383: =RC[-12]*RC[-12] -> 33.543402777777835 | AE383: =RC[-11]/SQRT(RC[-6]*RC[-1]) -> 1 | AF383: =RC[-11]/SQRT(RC[-6]*RC[-2]) -> -1 | AG383: =RC[-11]/SQRT(RC[-6]*RC[-3]) -> 1 | AH383: =RC[-11]/SQRT(RC[-6]*RC[-4]) -> 1 | AI383: =RC[-11]/SQRT(RC[-6]*RC[-5]) -> 1
A384: 29398 | B384: 北京 | C384: 167 | D384: 中度污染 | E384: 2.0499999999999998 | F384: 15 | G384: 45 | H384: 2 | I384: 128 | J384: 119 | L384: 2013-06-07T08:00:00.000 | M384: =RC[-8]-R[16]C[-8] -> -0.18666666666666654 | N384: =RC[-8]-R[16]C[-8] -> 5.0416666666666661 | O384: =RC[-8]-R[16]C[-8] -> -7.9166666666666643 | P384: =RC[-8]-R[16]C[-8] -> -1.8333333333333335 | Q384: =RC[-8]-R[16]C[-8] -> -0.45833333333334281 | R384: =RC[-8]-R[16]C[-8] -> -7.7916666666666714 | T384: =RC[-7]*RC[-2] -> 1.4544444444444442 | U384: =RC[-7]*RC[-3] -> -39.282986111111128 | V384: =RC[-7]*RC[-4] -> 61.6840277777778 | W384: =RC[-7]*RC[-5] -> 14.284722222222232 | X384: =RC[-7]*RC[-6] -> 3.5711805555556317 | Y384: =RC[-12]*RC[-12] -> 3.4844444444444393E-2 | Z384: =RC[-12]*RC[-12] -> 25.418402777777771 | AA384: =RC[-12]*RC[-12] -> 62.673611111111072 | AB384: =RC[-12]*RC[-12] -> 3.3611111111111116 | AC384: =RC[-12]*RC[-12] -> 0.21006944444445314 | AD384: =RC[-12]*RC[-12] -> 60.710069444444521 | AE384: =RC[-11]/SQRT(RC[-6]*RC[-1]) -> 1 | AF384: =RC[-11]/SQRT(RC[-6]*RC[-2]) -> -1 | AG384: =RC[-11]/SQRT(RC[-6]*RC[-3]) -> 1 | AH384: =RC[-11]/SQRT(RC[-6]*RC[-4]) -> 1 | AI384: =RC[-11]/SQRT(RC[-6]*RC[-5]) -> 1
A385: 29474 | B385: 北京 | C385: 168 | D385: 中度污染 | E385: 2.21 | F385: 15 | G385: 44 | H385: 2 | I385: 122 | J385: 107 | L385: 2013-06-07T09:00:00.000 | M385: =RC[-8]-R[15]C[-8] -> -2.6666666666666394E-2 | N385: =RC[-8]-R[15]C[-8] -> 5.0416666666666661 | O385: =RC[-8]-R[15]C[-8] -> -8.9166666666666643 | P385: =RC[-8]-R[15]C[-8] -> -1.8333333333333335 | Q385: =RC[-8]-R[15]C[-8] -> -6.4583333333333428 | R385: =RC[-8]-R[15]C[-8] -> -19.791666666666671 | T385: =RC[-7]*RC[-2] -> 0.52777777777777246 | U385: =RC[-7]*RC[-3] -> -99.782986111111128 | V385: =RC[-7]*RC[-4] -> 176.47569444444443 | W385: =RC[-7]*RC[-5] -> 36.284722222222236 | X385: =RC[-7]*RC[-6] -> 127.82118055555577 | Y385: =RC[-12]*RC[-12] -> 7.1111111111109662E-4 | Z385: =RC[-12]*RC[-12] -> 25.418402777777771 | AA385: =RC[-12]*RC[-12] -> 79.5069444444444 | AB385: =RC[-12]*RC[-12] -> 3.3611111111111116 | AC385: =RC[-12]*RC[-12] -> 41.710069444444564 | AD385: =RC[-12]*RC[-12] -> 391.71006944444463 | AE385: =RC[-11]/SQRT(RC[-6]*RC[-1]) -> 0.99999999999999978 | AF385: =RC[-11]/SQRT(RC[-6]*RC[-2]) -> -1.0000000000000002 | AG385: =RC[-11]/SQRT(RC[-6]*RC[-3]) -> 1 | AH385: =RC[-11]/SQRT(RC[-6]*RC[-4]) -> 1 | AI385: =RC[-11]/SQRT(RC[-6]*RC[-5]) -> 1
A386: 29550 | B386: 北京 | C386: 168 | D386: 中度污染 | E386: 2.54 | F386: 10 | G386: 47 | H386: 2 | I386: 110 | J386: 106 | L386: 2013-06-07T10:00:00.000 | M386: =RC[-8]-R[14]C[-8] -> 0.30333333333333368 | N386: =RC[-8]-R[14]C[-8] -> 4.1666666666666075E-2 | O386: =RC[-8]-R[14]C[-8] -> -5.9166666666666643 | P386: =RC[-8]-R[14]C[-8] -> -1.8333333333333335 | Q386: =RC[-8]-R[14]C[-8] -> -18.458333333333343 | R386: =RC[-8]-R[14]C[-8] -> -20.791666666666671 | T386: =RC[-7]*RC[-2] -> -6.306805555555564 | U386: =RC[-7]*RC[-3] -> -0.86631944444443232 | V386: =RC[-7]*RC[-4] -> 123.01736111111109 | W386: =RC[-7]*RC[-5] -> 38.118055555555564 | X386: =RC[-7]*RC[-6] -> 383.7795138888892 | Y386: =RC[-12]*RC[-12] -> 9.2011111111111321E-2 | Z386: =RC[-12]*RC[-12] -> 1.7361111111110618E-3 | AA386: =RC[-12]*RC[-12] -> 35.006944444444414 | AB386: =RC[-12]*RC[-12] -> 3.3611111111111116 | AC386: =RC[-12]*RC[-12] -> 340.7100694444448 | AD386: =RC[-12]*RC[-12] -> 432.293402777778 | AE386: =RC[-11]/SQRT(RC[-6]*RC[-1]) -> -0.99999999999999989 | AF386: =RC[-11]/SQRT(RC[-6]*RC[-2]) -> -0.99999999999999989 | AG386: =RC[-11]/SQRT(RC[-6]*RC[-3]) -> 0.99999999999999989 | AH386: =RC[-11]/SQRT(RC[-6]*RC[-4]) -> 0.99999999999999978 | AI386: =RC[-11]/SQRT(RC[-6]*RC[-5]) -> 1
A387: 29626 | B387: 北京 | C387: 168 | D387: 中度污染 | E387: 2.59 | F387: 8 | G387: 47 | H387: 3 | I387: 98 | J387: 89 | L387: 2013-06-07T11:00:00.000 | M387: =RC[-8]-R[13]C[-8] -> 0.3533333333333335 | N387: =RC[-8]-R[13]C[-8] -> -1.9583333333333339 | O387: =RC[-8]-R[13]C[-8] -> -5.9166666666666643 | P387: =RC[-8]-R[13]C[-8] -> -0.83333333333333348 | Q387: =RC[-8]-R[13]C[-8] -> -30.458333333333343 | R387: =RC[-8]-R[13]C[-8] -> -37.791666666666671 | T387: =RC[-7]*RC[-2] -> -13.353055555555564 | U387: =RC[-7]*RC[-3] -> 74.008680555555586 | V387: =RC[-7]*RC[-4] -> 223.60069444444437 | W387: =RC[-7]*RC[-5] -> 31.493055555555564 | X387: =RC[-7]*RC[-6] -> 1151.0711805555561 | Y387: =RC[-12]*RC[-12] -> 0.12484444444444456 | Z387: =RC[-12]*RC[-12] -> 3.8350694444444469 | AA387: =RC[-12]*RC[-12] -> 35.006944444444414 | AB387: =RC[-12]*RC[-12] -> 0.69444444444444464 | AC387: =RC[-12]*RC[-12] -> 927.71006944444503 | AD387: =RC[-12]*RC[-12] -> 1428.2100694444448 | AE387: =RC[-11]/SQRT(RC[-6]*RC[-1]) -> -1 | AF387: =RC[-11]/SQRT(RC[-6]*RC[-2]) -> 1 | AG387: =RC[-11]/SQRT(RC[-6]*RC[-3]) -> 1 | AH387: =RC[-11]/SQRT(RC[-6]*RC[-4]) -> 1 | AI387: =RC[-11]/SQRT(RC[-6]*RC[-5]) -> 1
A388: 29702 | B388: 北京 | C388: 169 | D388: 中度污染 | E388: 2.41 | F388: 9 | G388: 48 | H388: 4 | I388: 103 | J388: 104 | L388: 2013-06-07T12:00:00.000 | M388: =RC[-8]-R[12]C[-8] -> 0.17333333333333378 | N388: =RC[-8]-R[12]C[-8] -> -0.95833333333333393 | O388: =RC[-8]-R[12]C[-8] -> -4.9166666666666643 | P388: =RC[-8]-R[12]C[-8] -> 0.16666666666666652 | Q388: =RC[-8]-R[12]C[-8] -> -25.458333333333343 | R388: =RC[-8]-R[12]C[-8] -> -22.791666666666671 | T388: =RC[-7]*RC[-2] -> -3.9505555555555665 | U388: =RC[-7]*RC[-3] -> 21.842013888888907 | V388: =RC[-7]*RC[-4] -> 112.05902777777774 | W388: =RC[-7]*RC[-5] -> -3.7986111111111085 | X388: =RC[-7]*RC[-6] -> 580.23784722222251 | Y388: =RC[-12]*RC[-12] -> 3.0044444444444599E-2 | Z388: =RC[-12]*RC[-12] -> 0.9184027777777789 | AA388: =RC[-12]*RC[-12] -> 24.173611111111089 | AB388: =RC[-12]*RC[-12] -> 2.7777777777777728E-2 | AC388: =RC[-12]*RC[-12] -> 648.12673611111154 | AD388: =RC[-12]*RC[-12] -> 519.46006944444468 | AE388: =RC[-11]/SQRT(RC[-6]*RC[-1]) -> -0.99999999999999989 | AF388: =RC[-11]/SQRT(RC[-6]*RC[-2]) -> 1 | AG388: =RC[-11]/SQRT(RC[-6]*RC[-3]) -> 1 | AH388: =RC[-11]/SQRT(RC[-6]*RC[-4]) -> -1 | AI388: =RC[-11]/SQRT(RC[-6]*RC[-5]) -> 1
A389: 29778 | B389: 北京 | C389: 170 | D389: 中度污染 | E389: 2.31 | F389: 10 | G389: 49 | H389: 4 | I389: 106 | J389: 114 | L389: 2013-06-07T13:00:00.000 | M389: =RC[-8]-R[11]C[-8] -> 7.3333333333333695E-2 | N389: =RC[-8]-R[11]C[-8] -> 4.1666666666666075E-2 | O389: =RC[-8]-R[11]C[-8] -> -3.9166666666666643 | P389: =RC[-8]-R[11]C[-8] -> 0.16666666666666652 | Q389: =RC[-8]-R[11]C[-8] -> -22.458333333333343 | R389: =RC[-8]-R[11]C[-8] -> -12.791666666666671 | T389: =RC[-7]*RC[-2] -> -0.93805555555556053 | U389: =RC[-7]*RC[-3] -> -0.53298611111110372 | V389: =RC[-7]*RC[-4] -> 50.100694444444436 | W389: =RC[-7]*RC[-5] -> -2.1319444444444433 | X389: =RC[-7]*RC[-6] -> 287.27951388888914 | Y389: =RC[-12]*RC[-12] -> 5.3777777777778311E-3 | Z389: =RC[-12]*RC[-12] -> 1.7361111111110618E-3 | AA389: =RC[-12]*RC[-12] -> 15.340277777777759 | AB389: =RC[-12]*RC[-12] -> 2.7777777777777728E-2 | AC389: =RC[-12]*RC[-12] -> 504.37673611111154 | AD389: =RC[-12]*RC[-12] -> 163.62673611111123 | AE389: =RC[-11]/SQRT(RC[-6]*RC[-1]) -> -1 | AF389: =RC[-11]/SQRT(RC[-6]*RC[-2]) -> -1 | AG389: =RC[-11]/SQRT(RC[-6]*RC[-3]) -> 1.0000000000000002 | AH389: =RC[-11]/SQRT(RC[-6]*RC[-4]) -> -1 | AI389: =RC[-11]/SQRT(RC[-6]*RC[-5]) -> 1.0000000000000002
A390: 29854 | B390: 北京 | C390: 170 | D390: 中度污染 | E390: 2.29 | F390: 11 | G390: 51 | H390: 4 | I390: 118 | J390: 123 | L390: 2013-06-07T14:00:00.000 | M390: =RC[-8]-R[10]C[-8] -> 5.3333333333333677E-2 | N390: =RC[-8]-R[10]C[-8] -> 1.0416666666666661 | O390: =RC[-8]-R[10]C[-8] -> -1.9166666666666643 | P390: =RC[-8]-R[10]C[-8] -> 0.16666666666666652 | Q390: =RC[-8]-R[10]C[-8] -> -10.458333333333343 | R390: =RC[-8]-R[10]C[-8] -> -3.7916666666666714 | T390: =RC[-7]*RC[-2] -> -0.20222222222222377 | U390: =RC[-7]*RC[-3] -> -3.9496527777777803 | V390: =RC[-7]*RC[-4] -> 7.2673611111111116 | W390: =RC[-7]*RC[-5] -> -0.63194444444444464 | X390: =RC[-7]*RC[-6] -> 39.654513888888971 | Y390: =RC[-12]*RC[-12] -> 2.844444444444481E-3 | Z390: =RC[-12]*RC[-12] -> 1.0850694444444433 | AA390: =RC[-12]*RC[-12] -> 3.6736111111111018 | AB390: =RC[-12]*RC[-12] -> 2.7777777777777728E-2 | AC390: =RC[-12]*RC[-12] -> 109.37673611111131 | AD390: =RC[-12]*RC[-12] -> 14.376736111111146 | AE390: =RC[-11]/SQRT(RC[-6]*RC[-1]) -> -1 | AF390: =RC[-11]/SQRT(RC[-6]*RC[-2]) -> -0.99999999999999989 | AG390: =RC[-11]/SQRT(RC[-6]*RC[-3]) -> 1.0000000000000002 | AH390: =RC[-11]/SQRT(RC[-6]*RC[-4]) -> -1 | AI390: =RC[-11]/SQRT(RC[-6]*RC[-5]) -> 0.99999999999999978
A391: 29930 | B391: 北京 | C391: 171 | D391: 中度污染 | E391: 2.2999999999999998 | F391: 12 | G391: 54 | H391: 5 | I391: 116 | J391: 123 | L391: 2013-06-07T15:00:00.000 | M391: =RC[-8]-R[9]C[-8] -> 6.3333333333333464E-2 | N391: =RC[-8]-R[9]C[-8] -> 2.0416666666666661 | O391: =RC[-8]-R[9]C[-8] -> 1.0833333333333357 | P391: =RC[-8]-R[9]C[-8] -> 1.1666666666666665 | Q391: =RC[-8]-R[9]C[-8] -> -12.458333333333343 | R391: =RC[-8]-R[9]C[-8] -> -3.7916666666666714 | T391: =RC[-7]*RC[-2] -> -0.24013888888888968 | U391: =RC[-7]*RC[-3] -> -7.7413194444444517 | V391: =RC[-7]*RC[-4] -> -4.1076388888889026 | W391: =RC[-7]*RC[-5] -> -4.423611111111116 | X391: =RC[-7]*RC[-6] -> 47.237847222222314 | Y391: =RC[-12]*RC[-12] -> 4.0111111111111276E-3 | Z391: =RC[-12]*RC[-12] -> 4.168402777777775 | AA391: =RC[-12]*RC[-12] -> 1.1736111111111163 | AB391: =RC[-12]*RC[-12] -> 1.3611111111111107 | AC391: =RC[-12]*RC[-12] -> 155.21006944444468 | AD391: =RC[-12]*RC[-12] -> 14.376736111111146 | AE391: =RC[-11]/SQRT(RC[-6]*RC[-1]) -> -1 | AF391: =RC[-11]/SQRT(RC[-6]*RC[-2]) -> -1.0000000000000002 | AG391: =RC[-11]/SQRT(RC[-6]*RC[-3]) -> -0.99999999999999978 | AH391: =RC[-11]/SQRT(RC[-6]*RC[-4]) -> -1 | AI391: =RC[-11]/SQRT(RC[-6]*RC[-5]) -> 1
A392: 30006 | B392: 北京 | C392: 172 | D392: 中度污染 | E392: 2.2999999999999998 | F392: 12 | G392: 57 | H392: 5 | I392: 138 | J392: 126 | L392: 2013-06-07T16:00:00.000 | M392: =RC[-8]-R[8]C[-8] -> 6.3333333333333464E-2 | N392: =RC[-8]-R[8]C[-8] -> 2.0416666666666661 | O392: =RC[-8]-R[8]C[-8] -> 4.0833333333333357 | P392: =RC[-8]-R[8]C[-8] -> 1.1666666666666665 | Q392: =RC[-8]-R[8]C[-8] -> 9.5416666666666572 | R392: =RC[-8]-R[8]C[-8] -> -0.7916666666666714 | T392: =RC[-7]*RC[-2] -> -5.0138888888889295E-2 | U392: =RC[-7]*RC[-3] -> -1.6163194444444537 | V392: =RC[-7]*RC[-4] -> -3.2326388888889102 | W392: =RC[-7]*RC[-5] -> -0.92361111111111649 | X392: =RC[-7]*RC[-6] -> -7.5538194444444819 | Y392: =RC[-12]*RC[-12] -> 4.0111111111111276E-3 | Z392: =RC[-12]*RC[-12] -> 4.168402777777775 | AA392: =RC[-12]*RC[-12] -> 16.673611111111132 | AB392: =RC[-12]*RC[-12] -> 1.3611111111111107 | AC392: =RC[-12]*RC[-12] -> 91.043402777777601 | AD392: =RC[-12]*RC[-12] -> 0.6267361111111186 | AE392: =RC[-11]/SQRT(RC[-6]*RC[-1]) -> -1 | AF392: =RC[-11]/SQRT(RC[-6]*RC[-2]) -> -1.0000000000000002 | AG392: =RC[-11]/SQRT(RC[-6]*RC[-3]) -> -1 | AH392: =RC[-11]/SQRT(RC[-6]*RC[-4]) -> -1 | AI392: =RC[-11]/SQRT(RC[-6]*RC[-5]) -> -1
A393: 30082 | B393: 北京 | C393: 173 | D393: 中度污染 | E393: 2.34 | F393: 12 | G393: 61 | H393: 5 | I393: 140 | J393: 135 | L393: 2013-06-07T17:00:00.000 | M393: =RC[-8]-R[7]C[-8] -> 0.1033333333333335 | N393: =RC[-8]-R[7]C[-8] -> 2.0416666666666661 | O393: =RC[-8]-R[7]C[-8] -> 8.0833333333333357 | P393: =RC[-8]-R[7]C[-8] -> 1.1666666666666665 | Q393: =RC[-8]-R[7]C[-8] -> 11.541666666666657 | R393: =RC[-8]-R[7]C[-8] -> 8.2083333333333286 | T393: =RC[-7]*RC[-2] -> 0.84819444444444536 | U393: =RC[-7]*RC[-3] -> 16.758680555555539 | V393: =RC[-7]*RC[-4] -> 66.350694444444429 | W393: =RC[-7]*RC[-5] -> 9.5763888888888822 | X393: =RC[-7]*RC[-6] -> 94.737847222222086 | Y393: =RC[-12]*RC[-12] -> 1.0677777777777812E-2 | Z393: =RC[-12]*RC[-12] -> 4.168402777777775 | AA393: =RC[-12]*RC[-12] -> 65.340277777777814 | AB393: =RC[-12]*RC[-12] -> 1.3611111111111107 | AC393: =RC[-12]*RC[-12] -> 133.21006944444423 | AD393: =RC[-12]*RC[-12] -> 67.376736111111029 | AE393: =RC[-11]/SQRT(RC[-6]*RC[-1]) -> 1.0000000000000002 | AF393: =RC[-11]/SQRT(RC[-6]*RC[-2]) -> 1 | AG393: =RC[-11]/SQRT(RC[-6]*RC[-3]) -> 1 | AH393: =RC[-11]/SQRT(RC[-6]*RC[-4]) -> 1 | AI393: =RC[-11]/SQRT(RC[-6]*RC[-5]) -> 1
A394: 30158 | B394: 北京 | C394: 173 | D394: 中度污染 | E394: 2.36 | F394: 11 | G394: 63 | H394: 4 | I394: 152 | J394: 142 | L394: 2013-06-07T18:00:00.000 | M394: =RC[-8]-R[6]C[-8] -> 0.12333333333333352 | N394: =RC[-8]-R[6]C[-8] -> 1.0416666666666661 | O394: =RC[-8]-R[6]C[-8] -> 10.083333333333336 | P394: =RC[-8]-R[6]C[-8] -> 0.16666666666666652 | Q394: =RC[-8]-R[6]C[-8] -> 23.541666666666657 | R394: =RC[-8]-R[6]C[-8] -> 15.208333333333329 | T394: =RC[-7]*RC[-2] -> 1.8756944444444466 | U394: =RC[-7]*RC[-3] -> 15.842013888888875 | V394: =RC[-7]*RC[-4] -> 153.35069444444443 | W394: =RC[-7]*RC[-5] -> 2.5347222222222192 | X394: =RC[-7]*RC[-6] -> 358.02951388888863 | Y394: =RC[-12]*RC[-12] -> 1.5211111111111156E-2 | Z394: =RC[-12]*RC[-12] -> 1.0850694444444433 | AA394: =RC[-12]*RC[-12] -> 101.67361111111116 | AB394: =RC[-12]*RC[-12] -> 2.7777777777777728E-2 | AC394: =RC[-12]*RC[-12] -> 554.210069444444 | AD394: =RC[-12]*RC[-12] -> 231.29340277777763 | AE394: =RC[-11]/SQRT(RC[-6]*RC[-1]) -> 1 | AF394: =RC[-11]/SQRT(RC[-6]*RC[-2]) -> 1 | AG394: =RC[-11]/SQRT(RC[-6]*RC[-3]) -> 1 | AH394: =RC[-11]/SQRT(RC[-6]*RC[-4]) -> 1 | AI394: =RC[-11]/SQRT(RC[-6]*RC[-5]) -> 1
A395: 30234 | B395: 北京 | C395: 172 | D395: 中度污染 | E395: 2.34 | F395: 10 | G395: 65 | H395: 3 | I395: 153 | J395: 139 | L395: 2013-06-07T19:00:00.000 | M395: =RC[-8]-R[5]C[-8] -> 0.1033333333333335 | N395: =RC[-8]-R[5]C[-8] -> 4.1666666666666075E-2 | O395: =RC[-8]-R[5]C[-8] -> 12.083333333333336 | P395: =RC[-8]-R[5]C[-8] -> -0.83333333333333348 | Q395: =RC[-8]-R[5]C[-8] -> 24.541666666666657 | R395: =RC[-8]-R[5]C[-8] -> 12.208333333333329 | T395: =RC[-7]*RC[-2] -> 1.2615277777777794 | U395: =RC[-7]*RC[-3] -> 0.50868055555554814 | V395: =RC[-7]*RC[-4] -> 147.51736111111109 | W395: =RC[-7]*RC[-5] -> -10.173611111111109 | X395: =RC[-7]*RC[-6] -> 299.612847222222 | Y395: =RC[-12]*RC[-12] -> 1.0677777777777812E-2 | Z395: =RC[-12]*RC[-12] -> 1.7361111111110618E-3 | AA395: =RC[-12]*RC[-12] -> 146.00694444444451 | AB395: =RC[-12]*RC[-12] -> 0.69444444444444464 | AC395: =RC[-12]*RC[-12] -> 602.29340277777726 | AD395: =RC[-12]*RC[-12] -> 149.04340277777766 | AE395: =RC[-11]/SQRT(RC[-6]*RC[-1]) -> 1 | AF395: =RC[-11]/SQRT(RC[-6]*RC[-2]) -> 1 | AG395: =RC[-11]/SQRT(RC[-6]*RC[-3]) -> 1 | AH395: =RC[-11]/SQRT(RC[-6]*RC[-4]) -> -1 | AI395: =RC[-11]/SQRT(RC[-6]*RC[-5]) -> 1.0000000000000002
A396: 30310 | B396: 北京 | C396: 172 | D396: 中度污染 | E396: 2.29 | F396: 9 | G396: 63 | H396: 3 | I396: 140 | J396: 127 | L396: 2013-06-07T20:00:00.000 | M396: =RC[-8]-R[4]C[-8] -> 5.3333333333333677E-2 | N396: =RC[-8]-R[4]C[-8] -> -0.95833333333333393 | O396: =RC[-8]-R[4]C[-8] -> 10.083333333333336 | P396: =RC[-8]-R[4]C[-8] -> -0.83333333333333348 | Q396: =RC[-8]-R[4]C[-8] -> 11.541666666666657 | R396: =RC[-8]-R[4]C[-8] -> 0.2083333333333286 | T396: =RC[-7]*RC[-2] -> 1.1111111111110929E-2 | U396: =RC[-7]*RC[-3] -> -0.19965277777777335 | V396: =RC[-7]*RC[-4] -> 2.1006944444443971 | W396: =RC[-7]*RC[-5] -> -0.17361111111110719 | X396: =RC[-7]*RC[-6] -> 2.4045138888888324 | Y396: =RC[-12]*RC[-12] -> 2.844444444444481E-3 | Z396: =RC[-12]*RC[-12] -> 0.9184027777777789 | AA396: =RC[-12]*RC[-12] -> 101.67361111111116 | AB396: =RC[-12]*RC[-12] -> 0.69444444444444464 | AC396: =RC[-12]*RC[-12] -> 133.21006944444423 | AD396: =RC[-12]*RC[-12] -> 4.3402777777775806E-2 | AE396: =RC[-11]/SQRT(RC[-6]*RC[-1]) -> 1 | AF396: =RC[-11]/SQRT(RC[-6]*RC[-2]) -> -1 | AG396: =RC[-11]/SQRT(RC[-6]*RC[-3]) -> 1 | AH396: =RC[-11]/SQRT(RC[-6]*RC[-4]) -> -1 | AI396: =RC[-11]/SQRT(RC[-6]*RC[-5]) -> 1
A397: 30386 | B397: 北京 | C397: 172 | D397: 中度污染 | E397: 2.25 | F397: 8 | G397: 61 | H397: 3 | I397: 144 | J397: 126 | L397: 2013-06-07T21:00:00.000 | M397: =RC[-8]-R[3]C[-8] -> 1.3333333333333641E-2 | N397: =RC[-8]-R[3]C[-8] -> -1.9583333333333339 | O397: =RC[-8]-R[3]C[-8] -> 8.0833333333333357 | P397: =RC[-8]-R[3]C[-8] -> -0.83333333333333348 | Q397: =RC[-8]-R[3]C[-8] -> 15.541666666666657 | R397: =RC[-8]-R[3]C[-8] -> -0.7916666666666714 | T397: =RC[-7]*RC[-2] -> -1.0555555555555863E-2 | U397: =RC[-7]*RC[-3] -> 1.5503472222222319 | V397: =RC[-7]*RC[-4] -> -6.3993055555555953 | W397: =RC[-7]*RC[-5] -> 0.65972222222222632 | X397: =RC[-7]*RC[-6] -> -12.30381944444451 | Y397: =RC[-12]*RC[-12] -> 1.77777777777786E-4 | Z397: =RC[-12]*RC[-12] -> 3.8350694444444469 | AA397: =RC[-12]*RC[-12] -> 65.340277777777814 | AB397: =RC[-12]*RC[-12] -> 0.69444444444444464 | AC397: =RC[-12]*RC[-12] -> 241.54340277777749 | AD397: =RC[-12]*RC[-12] -> 0.6267361111111186 | AE397: =RC[-11]/SQRT(RC[-6]*RC[-1]) -> -1 | AF397: =RC[-11]/SQRT(RC[-6]*RC[-2]) -> 0.99999999999999989 | AG397: =RC[-11]/SQRT(RC[-6]*RC[-3]) -> -1 | AH397: =RC[-11]/SQRT(RC[-6]*RC[-4]) -> 1.0000000000000002 | AI397: =RC[-11]/SQRT(RC[-6]*RC[-5]) -> -1
A398: 30462 | B398: 北京 | C398: 172 | D398: 中度污染 | E398: 2.15 | F398: 8 | G398: 61 | H398: 3 | I398: 135 | J398: 125 | L398: 2013-06-07T22:00:00.000 | M398: =RC[-8]-R[2]C[-8] -> -8.6666666666666448E-2 | N398: =RC[-8]-R[2]C[-8] -> -1.9583333333333339 | O398: =RC[-8]-R[2]C[-8] -> 8.0833333333333357 | P398: =RC[-8]-R[2]C[-8] -> -0.83333333333333348 | Q398: =RC[-8]-R[2]C[-8] -> 6.5416666666666572 | R398: =RC[-8]-R[2]C[-8] -> -1.7916666666666714 | T398: =RC[-7]*RC[-2] -> 0.15527777777777779 | U398: =RC[-7]*RC[-3] -> 3.508680555555566 | V398: =RC[-7]*RC[-4] -> -14.482638888888932 | W398: =RC[-7]*RC[-5] -> 1.4930555555555598 | X398: =RC[-7]*RC[-6] -> -11.720486111111125 | Y398: =RC[-12]*RC[-12] -> 7.5111111111110735E-3 | Z398: =RC[-12]*RC[-12] -> 3.8350694444444469 | AA398: =RC[-12]*RC[-12] -> 65.340277777777814 | AB398: =RC[-12]*RC[-12] -> 0.69444444444444464 | AC398: =RC[-12]*RC[-12] -> 42.793402777777651 | AD398: =RC[-12]*RC[-12] -> 3.2100694444444615 | AE398: =RC[-11]/SQRT(RC[-6]*RC[-1]) -> 1 | AF398: =RC[-11]/SQRT(RC[-6]*RC[-2]) -> 1 | AG398: =RC[-11]/SQRT(RC[-6]*RC[-3]) -> -1 | AH398: =RC[-11]/SQRT(RC[-6]*RC[-4]) -> 1.0000000000000002 | AI398: =RC[-11]/SQRT(RC[-6]*RC[-5]) -> -1
A399: 30538 | B399: 北京 | C399: 172 | D399: 中度污染 | E399: 2.11 | F399: 7 | G399: 59 | H399: 2 | I399: 134 | J399: 121 | L399: 2013-06-07T23:00:00.000 | M399: =RC[-8]-R[1]C[-8] -> -0.12666666666666648 | N399: =RC[-8]-R[1]C[-8] -> -2.9583333333333339 | O399: =RC[-8]-R[1]C[-8] -> 6.0833333333333357 | P399: =RC[-8]-R[1]C[-8] -> -1.8333333333333335 | Q399: =RC[-8]-R[1]C[-8] -> 5.5416666666666572 | R399: =RC[-8]-R[1]C[-8] -> -5.7916666666666714 | T399: =RC[-7]*RC[-2] -> 0.73361111111111066 | U399: =RC[-7]*RC[-3] -> 17.133680555555571 | V399: =RC[-7]*RC[-4] -> -35.232638888888928 | W399: =RC[-7]*RC[-5] -> 10.618055555555564 | X399: =RC[-7]*RC[-6] -> -32.095486111111086 | Y399: =RC[-12]*RC[-12] -> 1.6044444444444399E-2 | Z399: =RC[-12]*RC[-12] -> 8.7517361111111143 | AA399: =RC[-12]*RC[-12] -> 37.006944444444471 | AB399: =RC[-12]*RC[-12] -> 3.3611111111111116 | AC399: =RC[-12]*RC[-12] -> 30.71006944444434 | AD399: =RC[-12]*RC[-12] -> 33.543402777777835 | AE399: =RC[-11]/SQRT(RC[-6]*RC[-1]) -> 1 | AF399: =RC[-11]/SQRT(RC[-6]*RC[-2]) -> 0.99999999999999978 | AG399: =RC[-11]/SQRT(RC[-6]*RC[-3]) -> -1 | AH399: =RC[-11]/SQRT(RC[-6]*RC[-4]) -> 0.99999999999999978 | AI399: =RC[-11]/SQRT(RC[-6]*RC[-5]) -> -1
E400: =AVERAGE(R[-24]C:R[-1]C) -> 2.2366666666666664 | F400: =AVERAGE(R[-24]C:R[-1]C) -> 9.9583333333333339 | G400: =AVERAGE(R[-24]C:R[-1]C) -> 52.916666666666664 | H400: =AVERAGE(R[-24]C:R[-1]C) -> 3.8333333333333335 | I400: =AVERAGE(R[-24]C:R[-1]C) -> 128.45833333333334 | J400: =AVERAGE(R[-24]C:R[-1]C) -> 126.79166666666667 | M400: =RC[-8]-RC[-8] -> 0 | N400: =RC[-8]-RC[-8] -> 0 | O400: =RC[-8]-RC[-8] -> 0 | P400: =RC[-8]-RC[-8] -> 0 | Q400: =RC[-8]-RC[-8] -> 0 | R400: =RC[-8]-RC[-8] -> 0 | T400: =SUM(R[-24]C:R[-1]C) -> -22.01666666666668 | U400: =SUM(R[-24]C:R[-1]C) -> -276.20833333333348 | V400: =SUM(R[-24]C:R[-1]C) -> 950.58333333333337 | W400: =SUM(R[-24]C:R[-1]C) -> 275.16666666666652 | X400: =SUM(R[-24]C:R[-1]C) -> 4127.291666666667 | Y400: =SUM(R[-24]C:R[-1]C) -> 0.67633333333333334 | Z400: =SUM(R[-24]C:R[-1]C) -> 150.95833333333337 | AA400: =SUM(R[-24]C:R[-1]C) -> 1059.8333333333335 | AB400: =SUM(R[-24]C:R[-1]C) -> 63.33333333333335 | AC400: =SUM(R[-24]C:R[-1]C) -> 5177.9583333333339 | AD400: =SUM(R[-24]C:R[-1]C) -> 5521.958333333333 | AE400: =RC[-11]/SQRT(RC[-6]*RC[-1]) -> -0.3602671039490723 | AF400: =RC[-11]/SQRT(RC[-6]*RC[-2]) -> -0.30252527786169314 | AG400: =RC[-11]/SQRT(RC[-6]*RC[-3]) -> 0.39293873760414666 | AH400: =RC[-11]/SQRT(RC[-6]*RC[-4]) -> 0.46530003705381329 | AI400: =RC[-11]/SQRT(RC[-6]*RC[-5]) -> 0.77186139896913097
A401: 30614 | B401: 北京 | C401: 171 | D401: 中度污染 | E401: 2.0699999999999998 | F401: 6 | G401: 56 | H401: 3 | I401: 133 | J401: 126 | L401: 2013-06-08T00:00:00.000 | M401: =RC[-8]-R[24]C[-8] -> -0.41083333333333361 | N401: =RC[-8]-R[24]C[-8] -> -2.375 | O401: =RC[-8]-R[24]C[-8] -> 0.625 | P401: =RC[-8]-R[24]C[-8] -> -0.875 | Q401: =RC[-8]-R[24]C[-8] -> -39.125 | R401: =RC[-8]-R[24]C[-8] -> -29.375 | T401: =RC[-7]*RC[-2] -> 12.068229166666674 | U401: =RC[-7]*RC[-3] -> 69.765625 | V401: =RC[-7]*RC[-4] -> -18.359375 | W401: =RC[-7]*RC[-5] -> 25.703125 | X401: =RC[-7]*RC[-6] -> 1149.296875 | Y401: =RC[-12]*RC[-12] -> 0.16878402777777801 | Z401: =RC[-12]*RC[-12] -> 5.640625 | AA401: =RC[-12]*RC[-12] -> 0.390625 | AB401: =RC[-12]*RC[-12] -> 0.765625 | AC401: =RC[-12]*RC[-12] -> 1530.765625 | AD401: =RC[-12]*RC[-12] -> 862.890625 | AE401: =RC[-11]/SQRT(RC[-6]*RC[-1]) -> 1 | AF401: =RC[-11]/SQRT(RC[-6]*RC[-2]) -> 1 | AG401: =RC[-11]/SQRT(RC[-6]*RC[-3]) -> -1 | AH401: =RC[-11]/SQRT(RC[-6]*RC[-4]) -> 1 | AI401: =RC[-11]/SQRT(RC[-6]*RC[-5]) -> 1
A402: 30690 | B402: 北京 | C402: 170 | D402: 中度污染 | E402: 2.0299999999999998 | F402: 6 | G402: 53 | H402: 3 | I402: 131 | J402: 121 | L402: 2013-06-08T01:00:00.000 | M402: =RC[-8]-R[23]C[-8] -> -0.45083333333333364 | N402: =RC[-8]-R[23]C[-8] -> -2.375 | O402: =RC[-8]-R[23]C[-8] -> -2.375 | P402: =RC[-8]-R[23]C[-8] -> -0.875 | Q402: =RC[-8]-R[23]C[-8] -> -41.125 | R402: =RC[-8]-R[23]C[-8] -> -34.375 | T402: =RC[-7]*RC[-2] -> 15.497395833333345 | U402: =RC[-7]*RC[-3] -> 81.640625 | V402: =RC[-7]*RC[-4] -> 81.640625 | W402: =RC[-7]*RC[-5] -> 30.078125 | X402: =RC[-7]*RC[-6] -> 1413.671875 | Y402: =RC[-12]*RC[-12] -> 0.20325069444444471 | Z402: =RC[-12]*RC[-12] -> 5.640625 | AA402: =RC[-12]*RC[-12] -> 5.640625 | AB402: =RC[-12]*RC[-12] -> 0.765625 | AC402: =RC[-12]*RC[-12] -> 1691.265625 | AD402: =RC[-12]*RC[-12] -> 1181.640625 | AE402: =RC[-11]/SQRT(RC[-6]*RC[-1]) -> 1.0000000000000002 | AF402: =RC[-11]/SQRT(RC[-6]*RC[-2]) -> 1 | AG402: =RC[-11]/SQRT(RC[-6]*RC[-3]) -> 1 | AH402: =RC[-11]/SQRT(RC[-6]*RC[-4]) -> 1 | AI402: =RC[-11]/SQRT(RC[-6]*RC[-5]) -> 1
A403: 30766 | B403: 北京 | C403: 169 | D403: 中度污染 | E403: 2 | F403: 5 | G403: 52 | H403: 3 | I403: 124 | J403: 122 | L403: 2013-06-08T02:00:00.000 | M403: =RC[-8]-R[22]C[-8] -> -0.48083333333333345 | N403: =RC[-8]-R[22]C[-8] -> -3.375 | O403: =RC[-8]-R[22]C[-8] -> -3.375 | P403: =RC[-8]-R[22]C[-8] -> -0.875 | Q403: =RC[-8]-R[22]C[-8] -> -48.125 | R403: =RC[-8]-R[22]C[-8] -> -33.375 | T403: =RC[-7]*RC[-2] -> 16.047812500000003 | U403: =RC[-7]*RC[-3] -> 112.640625 | V403: =RC[-7]*RC[-4] -> 112.640625 | W403: =RC[-7]*RC[-5] -> 29.203125 | X403: =RC[-7]*RC[-6] -> 1606.171875 | Y403: =RC[-12]*RC[-12] -> 0.23120069444444455 | Z403: =RC[-12]*RC[-12] -> 11.390625 | AA403: =RC[-12]*RC[-12] -> 11.390625 | AB403: =RC[-12]*RC[-12] -> 0.765625 | AC403: =RC[-12]*RC[-12] -> 2316.015625 | AD403: =RC[-12]*RC[-12] -> 1113.890625 | AE403: =RC[-11]/SQRT(RC[-6]*RC[-1]) -> 1 | AF403: =RC[-11]/SQRT(RC[-6]*RC[-2]) -> 1 | AG403: =RC[-11]/SQRT(RC[-6]*RC[-3]) -> 1 | AH403: =RC[-11]/SQRT(RC[-6]*RC[-4]) -> 1 | AI403: =RC[-11]/SQRT(RC[-6]*RC[-5]) -> 1
A404: 30842 | B404: 北京 | C404: 167 | D404: 中度污染 | E404: 1.96 | F404: 5 | G404: 43 | H404: 5 | I404: 100 | J404: 121 | L404: 2013-06-08T03:00:00.000 | M404: =RC[-8]-R[21]C[-8] -> -0.52083333333333348 | N404: =RC[-8]-R[21]C[-8] -> -3.375 | O404: =RC[-8]-R[21]C[-8] -> -12.375 | P404: =RC[-8]-R[21]C[-8] -> 1.125 | Q404: =RC[-8]-R[21]C[-8] -> -72.125 | R404: =RC[-8]-R[21]C[-8] -> -34.375 | T404: =RC[-7]*RC[-2] -> 17.903645833333339 | U404: =RC[-7]*RC[-3] -> 116.015625 | V404: =RC[-7]*RC[-4] -> 425.390625 | W404: =RC[-7]*RC[-5] -> -38.671875 | X404: =RC[-7]*RC[-6] -> 2479.296875 | Y404: =RC[-12]*RC[-12] -> 0.27126736111111127 | Z404: =RC[-12]*RC[-12] -> 11.390625 | AA404: =RC[-12]*RC[-12] -> 153.140625 | AB404: =RC[-12]*RC[-12] -> 1.265625 | AC404: =RC[-12]*RC[-12] -> 5202.015625 | AD404: =RC[-12]*RC[-12] -> 1181.640625 | AE404: =RC[-11]/SQRT(RC[-6]*RC[-1]) -> 1 | AF404: =RC[-11]/SQRT(RC[-6]*RC[-2]) -> 1 | AG404: =RC[-11]/SQRT(RC[-6]*RC[-3]) -> 1 | AH404: =RC[-11]/SQRT(RC[-6]*RC[-4]) -> -1 | AI404: =RC[-11]/SQRT(RC[-6]*RC[-5]) -> 1
A405: 30918 | B405: 北京 | C405: 165 | D405: 中度污染 | E405: 1.98 | F405: 5 | G405: 42 | H405: 4 | I405: 86 | J405: 115 | L405: 2013-06-08T04:00:00.000 | M405: =RC[-8]-R[20]C[-8] -> -0.50083333333333346 | N405: =RC[-8]-R[20]C[-8] -> -3.375 | O405: =RC[-8]-R[20]C[-8] -> -13.375 | P405: =RC[-8]-R[20]C[-8] -> 0.125 | Q405: =RC[-8]-R[20]C[-8] -> -86.125 | R405: =RC[-8]-R[20]C[-8] -> -40.375 | T405: =RC[-7]*RC[-2] -> 20.221145833333338 | U405: =RC[-7]*RC[-3] -> 136.265625 | V405: =RC[-7]*RC[-4] -> 540.015625 | W405: =RC[-7]*RC[-5] -> -5.046875 | X405: =RC[-7]*RC[-6] -> 3477.296875 | Y405: =RC[-12]*RC[-12] -> 0.25083402777777791 | Z405: =RC[-12]*RC[-12] -> 11.390625 | AA405: =RC[-12]*RC[-12] -> 178.890625 | AB405: =RC[-12]*RC[-12] -> 1.5625E-2 | AC405: =RC[-12]*RC[-12] -> 7417.515625 | AD405: =RC[-12]*RC[-12] -> 1630.140625 | AE405: =RC[-11]/SQRT(RC[-6]*RC[-1]) -> 1 | AF405: =RC[-11]/SQRT(RC[-6]*RC[-2]) -> 1 | AG405: =RC[-11]/SQRT(RC[-6]*RC[-3]) -> 1 | AH405: =RC[-11]/SQRT(RC[-6]*RC[-4]) -> -1 | AI405: =RC[-11]/SQRT(RC[-6]*RC[-5]) -> 1
A406: 30994 | B406: 北京 | C406: 164 | D406: 中度污染 | E406: 2.0099999999999998 | F406: 4 | G406: 41 | H406: 4 | I406: 48 | J406: 114 | L406: 2013-06-08T05:00:00.000 | M406: =RC[-8]-R[19]C[-8] -> -0.47083333333333366 | N406: =RC[-8]-R[19]C[-8] -> -4.375 | O406: =RC[-8]-R[19]C[-8] -> -14.375 | P406: =RC[-8]-R[19]C[-8] -> 0.125 | Q406: =RC[-8]-R[19]C[-8] -> -124.125 | R406: =RC[-8]-R[19]C[-8] -> -41.375 | T406: =RC[-7]*RC[-2] -> 19.480729166666681 | U406: =RC[-7]*RC[-3] -> 181.015625 | V406: =RC[-7]*RC[-4] -> 594.765625 | W406: =RC[-7]*RC[-5] -> -5.171875 | X406: =RC[-7]*RC[-6] -> 5135.671875 | Y406: =RC[-12]*RC[-12] -> 0.2216840277777781 | Z406: =RC[-12]*RC[-12] -> 19.140625 | AA406: =RC[-12]*RC[-12] -> 206.640625 | AB406: =RC[-12]*RC[-12] -> 1.5625E-2 | AC406: =RC[-12]*RC[-12] -> 15407.015625 | AD406: =RC[-12]*RC[-12] -> 1711.890625 | AE406: =RC[-11]/SQRT(RC[-6]*RC[-1]) -> 1 | AF406: =RC[-11]/SQRT(RC[-6]*RC[-2]) -> 1 | AG406: =RC[-11]/SQRT(RC[-6]*RC[-3]) -> 1 | AH406: =RC[-11]/SQRT(RC[-6]*RC[-4]) -> -1 | AI406: =RC[-11]/SQRT(RC[-6]*RC[-5]) -> 1
A407: 31070 | B407: 北京 | C407: 161 | D407: 中度污染 | E407: 2.02 | F407: 4 | G407: 40 | H407: 4 | I407: 86 | J407: 108 | L407: 2013-06-08T06:00:00.000 | M407: =RC[-8]-R[18]C[-8] -> -0.46083333333333343 | N407: =RC[-8]-R[18]C[-8] -> -4.375 | O407: =RC[-8]-R[18]C[-8] -> -15.375 | P407: =RC[-8]-R[18]C[-8] -> 0.125 | Q407: =RC[-8]-R[18]C[-8] -> -86.125 | R407: =RC[-8]-R[18]C[-8] -> -47.375 | T407: =RC[-7]*RC[-2] -> 21.83197916666667 | U407: =RC[-7]*RC[-3] -> 207.265625 | V407: =RC[-7]*RC[-4] -> 728.390625 | W407: =RC[-7]*RC[-5] -> -5.921875 | X407: =RC[-7]*RC[-6] -> 4080.171875 | Y407: =RC[-12]*RC[-12] -> 0.21236736111111121 | Z407: =RC[-12]*RC[-12] -> 19.140625 | AA407: =RC[-12]*RC[-12] -> 236.390625 | AB407: =RC[-12]*RC[-12] -> 1.5625E-2 | AC407: =RC[-12]*RC[-12] -> 7417.515625 | AD407: =RC[-12]*RC[-12] -> 2244.390625 | AE407: =RC[-11]/SQRT(RC[-6]*RC[-1]) -> 1 | AF407: =RC[-11]/SQRT(RC[-6]*RC[-2]) -> 1 | AG407: =RC[-11]/SQRT(RC[-6]*RC[-3]) -> 1 | AH407: =RC[-11]/SQRT(RC[-6]*RC[-4]) -> -1 | AI407: =RC[-11]/SQRT(RC[-6]*RC[-5]) -> 1
A408: 31146 | B408: 北京 | C408: 160 | D408: 中度污染 | E408: 2.36 | F408: 8 | G408: 54 | H408: 3 | I408: 102 | J408: 115 | L408: 2013-06-08T07:00:00.000 | M408: =RC[-8]-R[17]C[-8] -> -0.12083333333333357 | N408: =RC[-8]-R[17]C[-8] -> -0.375 | O408: =RC[-8]-R[17]C[-8] -> -1.375 | P408: =RC[-8]-R[17]C[-8] -> -0.875 | Q408: =RC[-8]-R[17]C[-8] -> -70.125 | R408: =RC[-8]-R[17]C[-8] -> -40.375 | T408: =RC[-7]*RC[-2] -> 4.8786458333333425 | U408: =RC[-7]*RC[-3] -> 15.140625 | V408: =RC[-7]*RC[-4] -> 55.515625 | W408: =RC[-7]*RC[-5] -> 35.328125 | X408: =RC[-7]*RC[-6] -> 2831.296875 | Y408: =RC[-12]*RC[-12] -> 1.4600694444444501E-2 | Z408: =RC[-12]*RC[-12] -> 0.140625 | AA408: =RC[-12]*RC[-12] -> 1.890625 | AB408: =RC[-12]*RC[-12] -> 0.765625 | AC408: =RC[-12]*RC[-12] -> 4917.515625 | AD408: =RC[-12]*RC[-12] -> 1630.140625 | AE408: =RC[-11]/SQRT(RC[-6]*RC[-1]) -> 1 | AF408: =RC[-11]/SQRT(RC[-6]*RC[-2]) -> 1 | AG408: =RC[-11]/SQRT(RC[-6]*RC[-3]) -> 1 | AH408: =RC[-11]/SQRT(RC[-6]*RC[-4]) -> 1 | AI408: =RC[-11]/SQRT(RC[-6]*RC[-5]) -> 1
A409: 31222 | B409: 北京 | C409: 158 | D409: 中度污染 | E409: 2.69 | F409: 12 | G409: 56 | H409: 5 | I409: 124 | J409: 129 | L409: 2013-06-08T08:00:00.000 | M409: =RC[-8]-R[16]C[-8] -> 0.2091666666666665 | N409: =RC[-8]-R[16]C[-8] -> 3.625 | O409: =RC[-8]-R[16]C[-8] -> 0.625 | P409: =RC[-8]-R[16]C[-8] -> 1.125 | Q409: =RC[-8]-R[16]C[-8] -> -48.125 | R409: =RC[-8]-R[16]C[-8] -> -26.375 | T409: =RC[-7]*RC[-2] -> -5.5167708333333287 | U409: =RC[-7]*RC[-3] -> -95.609375 | V409: =RC[-7]*RC[-4] -> -16.484375 | W409: =RC[-7]*RC[-5] -> -29.671875 | X409: =RC[-7]*RC[-6] -> 1269.296875 | Y409: =RC[-12]*RC[-12] -> 4.3750694444444377E-2 | Z409: =RC[-12]*RC[-12] -> 13.140625 | AA409: =RC[-12]*RC[-12] -> 0.390625 | AB409: =RC[-12]*RC[-12] -> 1.265625 | AC409: =RC[-12]*RC[-12] -> 2316.015625 | AD409: =RC[-12]*RC[-12] -> 695.640625 | AE409: =RC[-11]/SQRT(RC[-6]*RC[-1]) -> -1 | AF409: =RC[-11]/SQRT(RC[-6]*RC[-2]) -> -1 | AG409: =RC[-11]/SQRT(RC[-6]*RC[-3]) -> -1 | AH409: =RC[-11]/SQRT(RC[-6]*RC[-4]) -> -1 | AI409: =RC[-11]/SQRT(RC[-6]*RC[-5]) -> 1
A410: 31298 | B410: 北京 | C410: 162 | D410: 中度污染 | E410: 2.77 | F410: 15 | G410: 59 | H410: 4 | I410: 142 | J410: 134 | L410: 2013-06-08T09:00:00.000 | M410: =RC[-8]-R[15]C[-8] -> 0.28916666666666657 | N410: =RC[-8]-R[15]C[-8] -> 6.625 | O410: =RC[-8]-R[15]C[-8] -> 3.625 | P410: =RC[-8]-R[15]C[-8] -> 0.125 | Q410: =RC[-8]-R[15]C[-8] -> -30.125 | R410: =RC[-8]-R[15]C[-8] -> -21.375 | T410: =RC[-7]*RC[-2] -> -6.180937499999998 | U410: =RC[-7]*RC[-3] -> -141.609375 | V410: =RC[-7]*RC[-4] -> -77.484375 | W410: =RC[-7]*RC[-5] -> -2.671875 | X410: =RC[-7]*RC[-6] -> 643.921875 | Y410: =RC[-12]*RC[-12] -> 8.3617361111111052E-2 | Z410: =RC[-12]*RC[-12] -> 43.890625 | AA410: =RC[-12]*RC[-12] -> 13.140625 | AB410: =RC[-12]*RC[-12] -> 1.5625E-2 | AC410: =RC[-12]*RC[-12] -> 907.515625 | AD410: =RC[-12]*RC[-12] -> 456.890625 | AE410: =RC[-11]/SQRT(RC[-6]*RC[-1]) -> -1 | AF410: =RC[-11]/SQRT(RC[-6]*RC[-2]) -> -1 | AG410: =RC[-11]/SQRT(RC[-6]*RC[-3]) -> -1 | AH410: =RC[-11]/SQRT(RC[-6]*RC[-4]) -> -1 | AI410: =RC[-11]/SQRT(RC[-6]*RC[-5]) -> 1
A411: 31374 | B411: 北京 | C411: 157 | D411: 中度污染 | E411: 2.94 | F411: 16 | G411: 61 | H411: 4 | I411: 175 | J411: 160 | L411: 2013-06-08T10:00:00.000 | M411: =RC[-8]-R[14]C[-8] -> 0.4591666666666665 | N411: =RC[-8]-R[14]C[-8] -> 7.625 | O411: =RC[-8]-R[14]C[-8] -> 5.625 | P411: =RC[-8]-R[14]C[-8] -> 0.125 | Q411: =RC[-8]-R[14]C[-8] -> 2.875 | R411: =RC[-8]-R[14]C[-8] -> 4.625 | T411: =RC[-7]*RC[-2] -> 2.1236458333333328 | U411: =RC[-7]*RC[-3] -> 35.265625 | V411: =RC[-7]*RC[-4] -> 26.015625 | W411: =RC[-7]*RC[-5] -> 0.578125 | X411: =RC[-7]*RC[-6] -> 13.296875 | Y411: =RC[-12]*RC[-12] -> 0.21083402777777763 | Z411: =RC[-12]*RC[-12] -> 58.140625 | AA411: =RC[-12]*RC[-12] -> 31.640625 | AB411: =RC[-12]*RC[-12] -> 1.5625E-2 | AC411: =RC[-12]*RC[-12] -> 8.265625 | AD411: =RC[-12]*RC[-12] -> 21.390625 | AE411: =RC[-11]/SQRT(RC[-6]*RC[-1]) -> 1 | AF411: =RC[-11]/SQRT(RC[-6]*RC[-2]) -> 1 | AG411: =RC[-11]/SQRT(RC[-6]*RC[-3]) -> 1 | AH411: =RC[-11]/SQRT(RC[-6]*RC[-4]) -> 1 | AI411: =RC[-11]/SQRT(RC[-6]*RC[-5]) -> 1
A412: 31450 | B412: 北京 | C412: 162 | D412: 中度污染 | E412: 2.99 | F412: 15 | G412: 62 | H412: 4 | I412: 198 | J412: 190 | L412: 2013-06-08T11:00:00.000 | M412: =RC[-8]-R[13]C[-8] -> 0.50916666666666677 | N412: =RC[-8]-R[13]C[-8] -> 6.625 | O412: =RC[-8]-R[13]C[-8] -> 6.625 | P412: =RC[-8]-R[13]C[-8] -> 0.125 | Q412: =RC[-8]-R[13]C[-8] -> 25.875 | R412: =RC[-8]-R[13]C[-8] -> 34.625 | T412: =RC[-7]*RC[-2] -> 17.629895833333336 | U412: =RC[-7]*RC[-3] -> 229.390625 | V412: =RC[-7]*RC[-4] -> 229.390625 | W412: =RC[-7]*RC[-5] -> 4.328125 | X412: =RC[-7]*RC[-6] -> 895.921875 | Y412: =RC[-12]*RC[-12] -> 0.25925069444444454 | Z412: =RC[-12]*RC[-12] -> 43.890625 | AA412: =RC[-12]*RC[-12] -> 43.890625 | AB412: =RC[-12]*RC[-12] -> 1.5625E-2 | AC412: =RC[-12]*RC[-12] -> 669.515625 | AD412: =RC[-12]*RC[-12] -> 1198.890625 | AE412: =RC[-11]/SQRT(RC[-6]*RC[-1]) -> 1 | AF412: =RC[-11]/SQRT(RC[-6]*RC[-2]) -> 1 | AG412: =RC[-11]/SQRT(RC[-6]*RC[-3]) -> 1 | AH412: =RC[-11]/SQRT(RC[-6]*RC[-4]) -> 1 | AI412: =RC[-11]/SQRT(RC[-6]*RC[-5]) -> 1
A413: 31526 | B413: 北京 | C413: 167 | D413: 中度污染 | E413: 2.88 | F413: 14 | G413: 61 | H413: 4 | I413: 229 | J413: 199 | L413: 2013-06-08T12:00:00.000 | M413: =RC[-8]-R[12]C[-8] -> 0.39916666666666645 | N413: =RC[-8]-R[12]C[-8] -> 5.625 | O413: =RC[-8]-R[12]C[-8] -> 5.625 | P413: =RC[-8]-R[12]C[-8] -> 0.125 | Q413: =RC[-8]-R[12]C[-8] -> 56.875 | R413: =RC[-8]-R[12]C[-8] -> 43.625 | T413: =RC[-7]*RC[-2] -> 17.413645833333323 | U413: =RC[-7]*RC[-3] -> 245.390625 | V413: =RC[-7]*RC[-4] -> 245.390625 | W413: =RC[-7]*RC[-5] -> 5.453125 | X413: =RC[-7]*RC[-6] -> 2481.171875 | Y413: =RC[-12]*RC[-12] -> 0.15933402777777761 | Z413: =RC[-12]*RC[-12] -> 31.640625 | AA413: =RC[-12]*RC[-12] -> 31.640625 | AB413: =RC[-12]*RC[-12] -> 1.5625E-2 | AC413: =RC[-12]*RC[-12] -> 3234.765625 | AD413: =RC[-12]*RC[-12] -> 1903.140625 | AE413: =RC[-11]/SQRT(RC[-6]*RC[-1]) -> 1 | AF413: =RC[-11]/SQRT(RC[-6]*RC[-2]) -> 1 | AG413: =RC[-11]/SQRT(RC[-6]*RC[-3]) -> 1 | AH413: =RC[-11]/SQRT(RC[-6]*RC[-4]) -> 1 | AI413: =RC[-11]/SQRT(RC[-6]*RC[-5]) -> 1
A414: 31602 | B414: 北京 | C414: 172 | D414: 中度污染 | E414: 2.79 | F414: 11 | G414: 61 | H414: 4 | I414: 245 | J414: 218 | L414: 2013-06-08T13:00:00.000 | M414: =RC[-8]-R[11]C[-8] -> 0.30916666666666659 | N414: =RC[-8]-R[11]C[-8] -> 2.625 | O414: =RC[-8]-R[11]C[-8] -> 5.625 | P414: =RC[-8]-R[11]C[-8] -> 0.125 | Q414: =RC[-8]-R[11]C[-8] -> 72.875 | R414: =RC[-8]-R[11]C[-8] -> 62.625 | T414: =RC[-7]*RC[-2] -> 19.361562499999994 | U414: =RC[-7]*RC[-3] -> 164.390625 | V414: =RC[-7]*RC[-4] -> 352.265625 | W414: =RC[-7]*RC[-5] -> 7.828125 | X414: =RC[-7]*RC[-6] -> 4563.796875 | Y414: =RC[-12]*RC[-12] -> 9.5584027777777733E-2 | Z414: =RC[-12]*RC[-12] -> 6.890625 | AA414: =RC[-12]*RC[-12] -> 31.640625 | AB414: =RC[-12]*RC[-12] -> 1.5625E-2 | AC414: =RC[-12]*RC[-12] -> 5310.765625 | AD414: =RC[-12]*RC[-12] -> 3921.890625 | AE414: =RC[-11]/SQRT(RC[-6]*RC[-1]) -> 1 | AF414: =RC[-11]/SQRT(RC[-6]*RC[-2]) -> 1 | AG414: =RC[-11]/SQRT(RC[-6]*RC[-3]) -> 1 | AH414: =RC[-11]/SQRT(RC[-6]*RC[-4]) -> 1 | AI414: =RC[-11]/SQRT(RC[-6]*RC[-5]) -> 1
A415: 31678 | B415: 北京 | C415: 178 | D415: 中度污染 | E415: 2.66 | F415: 11 | G415: 59 | H415: 4 | I415: 226 | J415: 207 | L415: 2013-06-08T14:00:00.000 | M415: =RC[-8]-R[10]C[-8] -> 0.1791666666666667 | N415: =RC[-8]-R[10]C[-8] -> 2.625 | O415: =RC[-8]-R[10]C[-8] -> 3.625 | P415: =RC[-8]-R[10]C[-8] -> 0.125 | Q415: =RC[-8]-R[10]C[-8] -> 53.875 | R415: =RC[-8]-R[10]C[-8] -> 51.625 | T415: =RC[-7]*RC[-2] -> 9.2494791666666689 | U415: =RC[-7]*RC[-3] -> 135.515625 | V415: =RC[-7]*RC[-4] -> 187.140625 | W415: =RC[-7]*RC[-5] -> 6.453125 | X415: =RC[-7]*RC[-6] -> 2781.296875 | Y415: =RC[-12]*RC[-12] -> 3.2100694444444453E-2 | Z415: =RC[-12]*RC[-12] -> 6.890625 | AA415: =RC[-12]*RC[-12] -> 13.140625 | AB415: =RC[-12]*RC[-12] -> 1.5625E-2 | AC415: =RC[-12]*RC[-12] -> 2902.515625 | AD415: =RC[-12]*RC[-12] -> 2665.140625 | AE415: =RC[-11]/SQRT(RC[-6]*RC[-1]) -> 1.0000000000000002 | AF415: =RC[-11]/SQRT(RC[-6]*RC[-2]) -> 1 | AG415: =RC[-11]/SQRT(RC[-6]*RC[-3]) -> 1 | AH415: =RC[-11]/SQRT(RC[-6]*RC[-4]) -> 1 | AI415: =RC[-11]/SQRT(RC[-6]*RC[-5]) -> 1
A416: 31754 | B416: 北京 | C416: 181 | D416: 中度污染 | E416: 2.5499999999999998 | F416: 9 | G416: 61 | H416: 5 | I416: 219 | J416: 202 | L416: 2013-06-08T15:00:00.000 | M416: =RC[-8]-R[9]C[-8] -> 6.9166666666666377E-2 | N416: =RC[-8]-R[9]C[-8] -> 0.625 | O416: =RC[-8]-R[9]C[-8] -> 5.625 | P416: =RC[-8]-R[9]C[-8] -> 1.125 | Q416: =RC[-8]-R[9]C[-8] -> 46.875 | R416: =RC[-8]-R[9]C[-8] -> 46.625 | T416: =RC[-7]*RC[-2] -> 3.2248958333333198 | U416: =RC[-7]*RC[-3] -> 29.140625 | V416: =RC[-7]*RC[-4] -> 262.265625 | W416: =RC[-7]*RC[-5] -> 52.453125 | X416: =RC[-7]*RC[-6] -> 2185.546875 | Y416: =RC[-12]*RC[-12] -> 4.7840277777777378E-3 | Z416: =RC[-12]*RC[-12] -> 0.390625 | AA416: =RC[-12]*RC[-12] -> 31.640625 | AB416: =RC[-12]*RC[-12] -> 1.265625 | AC416: =RC[-12]*RC[-12] -> 2197.265625 | AD416: =RC[-12]*RC[-12] -> 2173.890625 | AE416: =RC[-11]/SQRT(RC[-6]*RC[-1]) -> 1 | AF416: =RC[-11]/SQRT(RC[-6]*RC[-2]) -> 1 | AG416: =RC[-11]/SQRT(RC[-6]*RC[-3]) -> 1 | AH416: =RC[-11]/SQRT(RC[-6]*RC[-4]) -> 1 | AI416: =RC[-11]/SQRT(RC[-6]*RC[-5]) -> 1
A417: 31830 | B417: 北京 | C417: 182 | D417: 中度污染 | E417: 2.41 | F417: 8 | G417: 59 | H417: 5 | I417: 218 | J417: 186 | L417: 2013-06-08T16:00:00.000 | M417: =RC[-8]-R[8]C[-8] -> -7.0833333333333304E-2 | N417: =RC[-8]-R[8]C[-8] -> -0.375 | O417: =RC[-8]-R[8]C[-8] -> 3.625 | P417: =RC[-8]-R[8]C[-8] -> 1.125 | Q417: =RC[-8]-R[8]C[-8] -> 45.875 | R417: =RC[-8]-R[8]C[-8] -> 30.625 | T417: =RC[-7]*RC[-2] -> -2.1692708333333326 | U417: =RC[-7]*RC[-3] -> -11.484375 | V417: =RC[-7]*RC[-4] -> 111.015625 | W417: =RC[-7]*RC[-5] -> 34.453125 | X417: =RC[-7]*RC[-6] -> 1404.921875 | Y417: =RC[-12]*RC[-12] -> 5.017361111111107E-3 | Z417: =RC[-12]*RC[-12] -> 0.140625 | AA417: =RC[-12]*RC[-12] -> 13.140625 | AB417: =RC[-12]*RC[-12] -> 1.265625 | AC417: =RC[-12]*RC[-12] -> 2104.515625 | AD417: =RC[-12]*RC[-12] -> 937.890625 | AE417: =RC[-11]/SQRT(RC[-6]*RC[-1]) -> -1.0000000000000002 | AF417: =RC[-11]/SQRT(RC[-6]*RC[-2]) -> -1 | AG417: =RC[-11]/SQRT(RC[-6]*RC[-3]) -> 1 | AH417: =RC[-11]/SQRT(RC[-6]*RC[-4]) -> 1 | AI417: =RC[-11]/SQRT(RC[-6]*RC[-5]) -> 1
A418: 31906 | B418: 北京 | C418: 185 | D418: 中度污染 | E418: 2.35 | F418: 9 | G418: 59 | H418: 5 | I418: 233 | J418: 174 | L418: 2013-06-08T17:00:00.000 | M418: =RC[-8]-R[7]C[-8] -> -0.13083333333333336 | N418: =RC[-8]-R[7]C[-8] -> 0.625 | O418: =RC[-8]-R[7]C[-8] -> 3.625 | P418: =RC[-8]-R[7]C[-8] -> 1.125 | Q418: =RC[-8]-R[7]C[-8] -> 60.875 | R418: =RC[-8]-R[7]C[-8] -> 18.625 | T418: =RC[-7]*RC[-2] -> -2.436770833333334 | U418: =RC[-7]*RC[-3] -> 11.640625 | V418: =RC[-7]*RC[-4] -> 67.515625 | W418: =RC[-7]*RC[-5] -> 20.953125 | X418: =RC[-7]*RC[-6] -> 1133.796875 | Y418: =RC[-12]*RC[-12] -> 1.7117361111111118E-2 | Z418: =RC[-12]*RC[-12] -> 0.390625 | AA418: =RC[-12]*RC[-12] -> 13.140625 | AB418: =RC[-12]*RC[-12] -> 1.265625 | AC418: =RC[-12]*RC[-12] -> 3705.765625 | AD418: =RC[-12]*RC[-12] -> 346.890625 | AE418: =RC[-11]/SQRT(RC[-6]*RC[-1]) -> -1.0000000000000002 | AF418: =RC[-11]/SQRT(RC[-6]*RC[-2]) -> 1 | AG418: =RC[-11]/SQRT(RC[-6]*RC[-3]) -> 1 | AH418: =RC[-11]/SQRT(RC[-6]*RC[-4]) -> 1 | AI418: =RC[-11]/SQRT(RC[-6]*RC[-5]) -> 1
A419: 31982 | B419: 北京 | C419: 187 | D419: 中度污染 | E419: 2.58 | F419: 7 | G419: 64 | H419: 4 | I419: 256 | J419: 184 | L419: 2013-06-08T18:00:00.000 | M419: =RC[-8]-R[6]C[-8] -> 9.9166666666666625E-2 | N419: =RC[-8]-R[6]C[-8] -> -1.375 | O419: =RC[-8]-R[6]C[-8] -> 8.625 | P419: =RC[-8]-R[6]C[-8] -> 0.125 | Q419: =RC[-8]-R[6]C[-8] -> 83.875 | R419: =RC[-8]-R[6]C[-8] -> 28.625 | T419: =RC[-7]*RC[-2] -> 2.8386458333333322 | U419: =RC[-7]*RC[-3] -> -39.359375 | V419: =RC[-7]*RC[-4] -> 246.890625 | W419: =RC[-7]*RC[-5] -> 3.578125 | X419: =RC[-7]*RC[-6] -> 2400.921875 | Y419: =RC[-12]*RC[-12] -> 9.8340277777777697E-3 | Z419: =RC[-12]*RC[-12] -> 1.890625 | AA419: =RC[-12]*RC[-12] -> 74.390625 | AB419: =RC[-12]*RC[-12] -> 1.5625E-2 | AC419: =RC[-12]*RC[-12] -> 7035.015625 | AD419: =RC[-12]*RC[-12] -> 819.390625 | AE419: =RC[-11]/SQRT(RC[-6]*RC[-1]) -> 1 | AF419: =RC[-11]/SQRT(RC[-6]*RC[-2]) -> -1 | AG419: =RC[-11]/SQRT(RC[-6]*RC[-3]) -> 1 | AH419: =RC[-11]/SQRT(RC[-6]*RC[-4]) -> 1 | AI419: =RC[-11]/SQRT(RC[-6]*RC[-5]) -> 1
A420: 32058 | B420: 北京 | C420: 189 | D420: 中度污染 | E420: 2.75 | F420: 7 | G420: 62 | H420: 3 | I420: 250 | J420: 184 | L420: 2013-06-08T19:00:00.000 | M420: =RC[-8]-R[5]C[-8] -> 0.26916666666666655 | N420: =RC[-8]-R[5]C[-8] -> -1.375 | O420: =RC[-8]-R[5]C[-8] -> 6.625 | P420: =RC[-8]-R[5]C[-8] -> -0.875 | Q420: =RC[-8]-R[5]C[-8] -> 77.875 | R420: =RC[-8]-R[5]C[-8] -> 28.625 | T420: =RC[-7]*RC[-2] -> 7.7048958333333299 | U420: =RC[-7]*RC[-3] -> -39.359375 | V420: =RC[-7]*RC[-4] -> 189.640625 | W420: =RC[-7]*RC[-5] -> -25.046875 | X420: =RC[-7]*RC[-6] -> 2229.171875 | Y420: =RC[-12]*RC[-12] -> 7.245069444444438E-2 | Z420: =RC[-12]*RC[-12] -> 1.890625 | AA420: =RC[-12]*RC[-12] -> 43.890625 | AB420: =RC[-12]*RC[-12] -> 0.765625 | AC420: =RC[-12]*RC[-12] -> 6064.515625 | AD420: =RC[-12]*RC[-12] -> 819.390625 | AE420: =RC[-11]/SQRT(RC[-6]*RC[-1]) -> 1 | AF420: =RC[-11]/SQRT(RC[-6]*RC[-2]) -> -1 | AG420: =RC[-11]/SQRT(RC[-6]*RC[-3]) -> 1 | AH420: =RC[-11]/SQRT(RC[-6]*RC[-4]) -> -1 | AI420: =RC[-11]/SQRT(RC[-6]*RC[-5]) -> 1
A421: 32134 | B421: 北京 | C421: 189 | D421: 中度污染 | E421: 2.73 | F421: 7 | G421: 57 | H421: 3 | I421: 214 | J421: 160 | L421: 2013-06-08T20:00:00.000 | M421: =RC[-8]-R[4]C[-8] -> 0.24916666666666654 | N421: =RC[-8]-R[4]C[-8] -> -1.375 | O421: =RC[-8]-R[4]C[-8] -> 1.625 | P421: =RC[-8]-R[4]C[-8] -> -0.875 | Q421: =RC[-8]-R[4]C[-8] -> 41.875 | R421: =RC[-8]-R[4]C[-8] -> 4.625 | T421: =RC[-7]*RC[-2] -> 1.1523958333333328 | U421: =RC[-7]*RC[-3] -> -6.359375 | V421: =RC[-7]*RC[-4] -> 7.515625 | W421: =RC[-7]*RC[-5] -> -4.046875 | X421: =RC[-7]*RC[-6] -> 193.671875 | Y421: =RC[-12]*RC[-12] -> 6.208402777777771E-2 | Z421: =RC[-12]*RC[-12] -> 1.890625 | AA421: =RC[-12]*RC[-12] -> 2.640625 | AB421: =RC[-12]*RC[-12] -> 0.765625 | AC421: =RC[-12]*RC[-12] -> 1753.515625 | AD421: =RC[-12]*RC[-12] -> 21.390625 | AE421: =RC[-11]/SQRT(RC[-6]*RC[-1]) -> 1.0000000000000002 | AF421: =RC[-11]/SQRT(RC[-6]*RC[-2]) -> -1 | AG421: =RC[-11]/SQRT(RC[-6]*RC[-3]) -> 1 | AH421: =RC[-11]/SQRT(RC[-6]*RC[-4]) -> -1 | AI421: =RC[-11]/SQRT(RC[-6]*RC[-5]) -> 1
A422: 32210 | B422: 北京 | C422: 190 | D422: 中度污染 | E422: 2.77 | F422: 6 | G422: 56 | H422: 3 | I422: 203 | J422: 159 | L422: 2013-06-08T21:00:00.000 | M422: =RC[-8]-R[3]C[-8] -> 0.28916666666666657 | N422: =RC[-8]-R[3]C[-8] -> -2.375 | O422: =RC[-8]-R[3]C[-8] -> 0.625 | P422: =RC[-8]-R[3]C[-8] -> -0.875 | Q422: =RC[-8]-R[3]C[-8] -> 30.875 | R422: =RC[-8]-R[3]C[-8] -> 3.625 | T422: =RC[-7]*RC[-2] -> 1.0482291666666663 | U422: =RC[-7]*RC[-3] -> -8.609375 | V422: =RC[-7]*RC[-4] -> 2.265625 | W422: =RC[-7]*RC[-5] -> -3.171875 | X422: =RC[-7]*RC[-6] -> 111.921875 | Y422: =RC[-12]*RC[-12] -> 8.3617361111111052E-2 | Z422: =RC[-12]*RC[-12] -> 5.640625 | AA422: =RC[-12]*RC[-12] -> 0.390625 | AB422: =RC[-12]*RC[-12] -> 0.765625 | AC422: =RC[-12]*RC[-12] -> 953.265625 | AD422: =RC[-12]*RC[-12] -> 13.140625 | AE422: =RC[-11]/SQRT(RC[-6]*RC[-1]) -> 1 | AF422: =RC[-11]/SQRT(RC[-6]*RC[-2]) -> -1 | AG422: =RC[-11]/SQRT(RC[-6]*RC[-3]) -> 1 | AH422: =RC[-11]/SQRT(RC[-6]*RC[-4]) -> -1 | AI422: =RC[-11]/SQRT(RC[-6]*RC[-5]) -> 1
A423: 32286 | B423: 北京 | C423: 191 | D423: 中度污染 | E423: 2.68 | F423: 6 | G423: 56 | H423: 4 | I423: 193 | J423: 152 | L423: 2013-06-08T22:00:00.000 | M423: =RC[-8]-R[2]C[-8] -> 0.19916666666666671 | N423: =RC[-8]-R[2]C[-8] -> -2.375 | O423: =RC[-8]-R[2]C[-8] -> 0.625 | P423: =RC[-8]-R[2]C[-8] -> 0.125 | Q423: =RC[-8]-R[2]C[-8] -> 20.875 | R423: =RC[-8]-R[2]C[-8] -> -3.375 | T423: =RC[-7]*RC[-2] -> -0.67218750000000016 | U423: =RC[-7]*RC[-3] -> 8.015625 | V423: =RC[-7]*RC[-4] -> -2.109375 | W423: =RC[-7]*RC[-5] -> -0.421875 | X423: =RC[-7]*RC[-6] -> -70.453125 | Y423: =RC[-12]*RC[-12] -> 3.9667361111111132E-2 | Z423: =RC[-12]*RC[-12] -> 5.640625 | AA423: =RC[-12]*RC[-12] -> 0.390625 | AB423: =RC[-12]*RC[-12] -> 1.5625E-2 | AC423: =RC[-12]*RC[-12] -> 435.765625 | AD423: =RC[-12]*RC[-12] -> 11.390625 | AE423: =RC[-11]/SQRT(RC[-6]*RC[-1]) -> -1 | AF423: =RC[-11]/SQRT(RC[-6]*RC[-2]) -> 1 | AG423: =RC[-11]/SQRT(RC[-6]*RC[-3]) -> -1 | AH423: =RC[-11]/SQRT(RC[-6]*RC[-4]) -> -1 | AI423: =RC[-11]/SQRT(RC[-6]*RC[-5]) -> -1
A424: 32362 | B424: 北京 | C424: 192 | D424: 中度污染 | E424: 2.57 | F424: 5 | G424: 55 | H424: 3 | I424: 196 | J424: 149 | L424: 2013-06-08T23:00:00.000 | M424: =RC[-8]-R[1]C[-8] -> 8.9166666666666394E-2 | N424: =RC[-8]-R[1]C[-8] -> -3.375 | O424: =RC[-8]-R[1]C[-8] -> -0.375 | P424: =RC[-8]-R[1]C[-8] -> -0.875 | Q424: =RC[-8]-R[1]C[-8] -> 23.875 | R424: =RC[-8]-R[1]C[-8] -> -6.375 | T424: =RC[-7]*RC[-2] -> -0.56843749999999826 | U424: =RC[-7]*RC[-3] -> 21.515625 | V424: =RC[-7]*RC[-4] -> 2.390625 | W424: =RC[-7]*RC[-5] -> 5.578125 | X424: =RC[-7]*RC[-6] -> -152.203125 | Y424: =RC[-12]*RC[-12] -> 7.9506944444443957E-3 | Z424: =RC[-12]*RC[-12] -> 11.390625 | AA424: =RC[-12]*RC[-12] -> 0.140625 | AB424: =RC[-12]*RC[-12] -> 0.765625 | AC424: =RC[-12]*RC[-12] -> 570.015625 | AD424: =RC[-12]*RC[-12] -> 40.640625 | AE424: =RC[-11]/SQRT(RC[-6]*RC[-1]) -> -1 | AF424: =RC[-11]/SQRT(RC[-6]*RC[-2]) -> 1 | AG424: =RC[-11]/SQRT(RC[-6]*RC[-3]) -> 1 | AH424: =RC[-11]/SQRT(RC[-6]*RC[-4]) -> 1 | AI424: =RC[-11]/SQRT(RC[-6]*RC[-5]) -> -1
E425: =AVERAGE(R[-24]C:R[-1]C) -> 2.4808333333333334 | F425: =AVERAGE(R[-24]C:R[-1]C) -> 8.375 | G425: =AVERAGE(R[-24]C:R[-1]C) -> 55.375 | H425: =AVERAGE(R[-24]C:R[-1]C) -> 3.875 | I425: =AVERAGE(R[-24]C:R[-1]C) -> 172.125 | J425: =AVERAGE(R[-24]C:R[-1]C) -> 155.375 | M425: =RC[-8]-RC[-8] -> 0 | N425: =RC[-8]-RC[-8] -> 0 | O425: =RC[-8]-RC[-8] -> 0 | P425: =RC[-8]-RC[-8] -> 0 | Q425: =RC[-8]-RC[-8] -> 0 | R425: =RC[-8]-RC[-8] -> 0 | T425: =SUM(R[-24]C:R[-1]C) -> 192.13250000000002 | U425: =SUM(R[-24]C:R[-1]C) -> 1457.625 | V425: =SUM(R[-24]C:R[-1]C) -> 4353.625 | W425: =SUM(R[-24]C:R[-1]C) -> 142.125 | X425: =SUM(R[-24]C:R[-1]C) -> 44258.875 | Y425: =SUM(R[-24]C:R[-1]C) -> 2.7609833333333347 | Z425: =SUM(R[-24]C:R[-1]C) -> 317.625 | AA425: =SUM(R[-24]C:R[-1]C) -> 1139.625 | AB425: =SUM(R[-24]C:R[-1]C) -> 12.625 | AC425: =SUM(R[-24]C:R[-1]C) -> 86068.625 | AD425: =SUM(R[-24]C:R[-1]C) -> 27603.625 | AE425: =RC[-11]/SQRT(RC[-6]*RC[-1]) -> 0.69596256787486832 | AF425: =RC[-11]/SQRT(RC[-6]*RC[-2]) -> 0.49227231255059661 | AG425: =RC[-11]/SQRT(RC[-6]*RC[-3]) -> 0.77622383642101522 | AH425: =RC[-11]/SQRT(RC[-6]*RC[-4]) -> 0.24075300962580407 | AI425: =RC[-11]/SQRT(RC[-6]*RC[-5]) -> 0.90801888003546227
A426: 32438 | B426: 北京 | C426: 192 | D426: 中度污染 | E426: 2.5 | F426: 6 | G426: 51 | H426: 3 | I426: 166 | J426: 133 | L426: 2013-06-09T00:00:00.000 | M426: =RC[-8]-R[24]C[-8] -> 1.5241666666666664 | N426: =RC[-8]-R[24]C[-8] -> 1.416666666666667 | O426: =RC[-8]-R[24]C[-8] -> 9.9166666666666643 | P426: =RC[-8]-R[24]C[-8] -> -18.125 | Q426: =RC[-8]-R[24]C[-8] -> 114.66666666666666 | R426: =RC[-8]-R[24]C[-8] -> 89.75 | T426: =RC[-7]*RC[-2] -> 136.79395833333331 | U426: =RC[-7]*RC[-3] -> 127.14583333333336 | V426: =RC[-7]*RC[-4] -> 890.02083333333314 | W426: =RC[-7]*RC[-5] -> -1626.71875 | X426: =RC[-7]*RC[-6] -> 10291.333333333332 | Y426: =RC[-12]*RC[-12] -> 2.3230840277777771 | Z426: =RC[-12]*RC[-12] -> 2.0069444444444451 | AA426: =RC[-12]*RC[-12] -> 98.340277777777729 | AB426: =RC[-12]*RC[-12] -> 328.515625 | AC426: =RC[-12]*RC[-12] -> 13148.444444444442 | AD426: =RC[-12]*RC[-12] -> 8055.0625 | AE426: =RC[-11]/SQRT(RC[-6]*RC[-1]) -> 1 | AF426: =RC[-11]/SQRT(RC[-6]*RC[-2]) -> 1 | AG426: =RC[-11]/SQRT(RC[-6]*RC[-3]) -> 1 | AH426: =RC[-11]/SQRT(RC[-6]*RC[-4]) -> -1 | AI426: =RC[-11]/SQRT(RC[-6]*RC[-5]) -> 1
A427: 32514 | B427: 北京 | C427: 192 | D427: 中度污染 | E427: 2.4700000000000002 | F427: 5 | G427: 49 | H427: 3 | I427: 153 | J427: 127 | L427: 2013-06-09T01:00:00.000 | M427: =RC[-8]-R[23]C[-8] -> 1.4941666666666666 | N427: =RC[-8]-R[23]C[-8] -> 0.41666666666666696 | O427: =RC[-8]-R[23]C[-8] -> 7.9166666666666643 | P427: =RC[-8]-R[23]C[-8] -> -18.125 | Q427: =RC[-8]-R[23]C[-8] -> 101.66666666666666 | R427: =RC[-8]-R[23]C[-8] -> 83.75 | T427: =RC[-7]*RC[-2] -> 125.13645833333334 | U427: =RC[-7]*RC[-3] -> 34.895833333333357 | V427: =RC[-7]*RC[-4] -> 663.02083333333314 | W427: =RC[-7]*RC[-5] -> -1517.96875 | X427: =RC[-7]*RC[-6] -> 8514.5833333333321 | Y427: =RC[-12]*RC[-12] -> 2.2325340277777777 | Z427: =RC[-12]*RC[-12] -> 0.17361111111111135 | AA427: =RC[-12]*RC[-12] -> 62.673611111111072 | AB427: =RC[-12]*RC[-12] -> 328.515625 | AC427: =RC[-12]*RC[-12] -> 10336.111111111109 | AD427: =RC[-12]*RC[-12] -> 7014.0625 | AE427: =RC[-11]/SQRT(RC[-6]*RC[-1]) -> 1 | AF427: =RC[-11]/SQRT(RC[-6]*RC[-2]) -> 1 | AG427: =RC[-11]/SQRT(RC[-6]*RC[-3]) -> 1 | AH427: =RC[-11]/SQRT(RC[-6]*RC[-4]) -> -1 | AI427: =RC[-11]/SQRT(RC[-6]*RC[-5]) -> 1
A428: 32590 | B428: 北京 | C428: 192 | D428: 中度污染 | E428: 2.23 | F428: 6 | G428: 44 | H428: 3 | I428: 157 | J428: 127 | L428: 2013-06-09T02:00:00.000 | M428: =RC[-8]-R[22]C[-8] -> 1.2541666666666664 | N428: =RC[-8]-R[22]C[-8] -> 1.416666666666667 | O428: =RC[-8]-R[22]C[-8] -> 2.9166666666666643 | P428: =RC[-8]-R[22]C[-8] -> -18.125 | Q428: =RC[-8]-R[22]C[-8] -> 105.66666666666666 | R428: =RC[-8]-R[22]C[-8] -> 83.75 | T428: =RC[-7]*RC[-2] -> 105.03645833333331 | U428: =RC[-7]*RC[-3] -> 118.64583333333336 | V428: =RC[-7]*RC[-4] -> 244.27083333333314 | W428: =RC[-7]*RC[-5] -> -1517.96875 | X428: =RC[-7]*RC[-6] -> 8849.5833333333321 | Y428: =RC[-12]*RC[-12] -> 1.5729340277777772 | Z428: =RC[-12]*RC[-12] -> 2.0069444444444451 | AA428: =RC[-12]*RC[-12] -> 8.5069444444444304 | AB428: =RC[-12]*RC[-12] -> 328.515625 | AC428: =RC[-12]*RC[-12] -> 11165.444444444442 | AD428: =RC[-12]*RC[-12] -> 7014.0625 | AE428: =RC[-11]/SQRT(RC[-6]*RC[-1]) -> 1 | AF428: =RC[-11]/SQRT(RC[-6]*RC[-2]) -> 1.0000000000000002 | AG428: =RC[-11]/SQRT(RC[-6]*RC[-3]) -> 1 | AH428: =RC[-11]/SQRT(RC[-6]*RC[-4]) -> -1 | AI428: =RC[-11]/SQRT(RC[-6]*RC[-5]) -> 1
A429: 32666 | B429: 北京 | C429: 191 | D429: 中度污染 | E429: 1.99 | F429: 6 | G429: 40 | H429: 7 | I429: 123 | J429: 114 | L429: 2013-06-09T03:00:00.000 | M429: =RC[-8]-R[21]C[-8] -> 1.0141666666666667 | N429: =RC[-8]-R[21]C[-8] -> 1.416666666666667 | O429: =RC[-8]-R[21]C[-8] -> -1.0833333333333357 | P429: =RC[-8]-R[21]C[-8] -> -14.125 | Q429: =RC[-8]-R[21]C[-8] -> 71.666666666666657 | R429: =RC[-8]-R[21]C[-8] -> 70.75 | T429: =RC[-7]*RC[-2] -> 71.752291666666665 | U429: =RC[-7]*RC[-3] -> 100.22916666666669 | V429: =RC[-7]*RC[-4] -> -76.645833333333499 | W429: =RC[-7]*RC[-5] -> -999.34375 | X429: =RC[-7]*RC[-6] -> 5070.4166666666661 | Y429: =RC[-12]*RC[-12] -> 1.0285340277777777 | Z429: =RC[-12]*RC[-12] -> 2.0069444444444451 | AA429: =RC[-12]*RC[-12] -> 1.1736111111111163 | AB429: =RC[-12]*RC[-12] -> 199.515625 | AC429: =RC[-12]*RC[-12] -> 5136.1111111111095 | AD429: =RC[-12]*RC[-12] -> 5005.5625 | AE429: =RC[-11]/SQRT(RC[-6]*RC[-1]) -> 1 | AF429: =RC[-11]/SQRT(RC[-6]*RC[-2]) -> 1 | AG429: =RC[-11]/SQRT(RC[-6]*RC[-3]) -> -1 | AH429: =RC[-11]/SQRT(RC[-6]*RC[-4]) -> -1 | AI429: =RC[-11]/SQRT(RC[-6]*RC[-5]) -> 1
A430: 32742 | B430: 北京 | C430: 191 | D430: 中度污染 | E430: 1.74 | F430: 6 | G430: 41 | H430: 4 | I430: 125 | J430: 113 | L430: 2013-06-09T04:00:00.000 | M430: =RC[-8]-R[20]C[-8] -> 0.76416666666666655 | N430: =RC[-8]-R[20]C[-8] -> 1.416666666666667 | O430: =RC[-8]-R[20]C[-8] -> -8.3333333333335702E-2 | P430: =RC[-8]-R[20]C[-8] -> -17.125 | Q430: =RC[-8]-R[20]C[-8] -> 73.666666666666657 | R430: =RC[-8]-R[20]C[-8] -> 69.75 | T430: =RC[-7]*RC[-2] -> 53.300624999999989 | U430: =RC[-7]*RC[-3] -> 98.812500000000014 | V430: =RC[-7]*RC[-4] -> -5.8125000000001652 | W430: =RC[-7]*RC[-5] -> -1194.46875 | X430: =RC[-7]*RC[-6] -> 5138.2499999999991 | Y430: =RC[-12]*RC[-12] -> 0.58395069444444425 | Z430: =RC[-12]*RC[-12] -> 2.0069444444444451 | AA430: =RC[-12]*RC[-12] -> 6.9444444444448396E-3 | AB430: =RC[-12]*RC[-12] -> 293.265625 | AC430: =RC[-12]*RC[-12] -> 5426.7777777777765 | AD430: =RC[-12]*RC[-12] -> 4865.0625 | AE430: =RC[-11]/SQRT(RC[-6]*RC[-1]) -> 1 | AF430: =RC[-11]/SQRT(RC[-6]*RC[-2]) -> 1 | AG430: =RC[-11]/SQRT(RC[-6]*RC[-3]) -> -1 | AH430: =RC[-11]/SQRT(RC[-6]*RC[-4]) -> -1 | AI430: =RC[-11]/SQRT(RC[-6]*RC[-5]) -> 1
A431: 32818 | B431: 北京 | C431: 190 | D431: 中度污染 | E431: 1.84 | F431: 7 | G431: 44 | H431: 5 | I431: 114 | J431: 98 | L431: 2013-06-09T05:00:00.000 | M431: =RC[-8]-R[19]C[-8] -> 0.86416666666666664 | N431: =RC[-8]-R[19]C[-8] -> 2.416666666666667 | O431: =RC[-8]-R[19]C[-8] -> 2.9166666666666643 | P431: =RC[-8]-R[19]C[-8] -> -16.125 | Q431: =RC[-8]-R[19]C[-8] -> 62.666666666666664 | R431: =RC[-8]-R[19]C[-8] -> 54.75 | T431: =RC[-7]*RC[-2] -> 47.313124999999999 | U431: =RC[-7]*RC[-3] -> 132.31250000000003 | V431: =RC[-7]*RC[-4] -> 159.68749999999986 | W431: =RC[-7]*RC[-5] -> -882.84375 | X431: =RC[-7]*RC[-6] -> 3431 | Y431: =RC[-12]*RC[-12] -> 0.74678402777777775 | Z431: =RC[-12]*RC[-12] -> 5.8402777777777795 | AA431: =RC[-12]*RC[-12] -> 8.5069444444444304 | AB431: =RC[-12]*RC[-12] -> 260.015625 | AC431: =RC[-12]*RC[-12] -> 3927.1111111111109 | AD431: =RC[-12]*RC[-12] -> 2997.5625 | AE431: =RC[-11]/SQRT(RC[-6]*RC[-1]) -> 1 | AF431: =RC[-11]/SQRT(RC[-6]*RC[-2]) -> 1.0000000000000002 | AG431: =RC[-11]/SQRT(RC[-6]*RC[-3]) -> 1 | AH431: =RC[-11]/SQRT(RC[-6]*RC[-4]) -> -1 | AI431: =RC[-11]/SQRT(RC[-6]*RC[-5]) -> 1
A432: 32894 | B432: 北京 | C432: 190 | D432: 中度污染 | E432: 1.77 | F432: 7 | G432: 44 | H432: 5 | I432: 97 | J432: 96 | L432: 2013-06-09T06:00:00.000 | M432: =RC[-8]-R[18]C[-8] -> 0.79416666666666658 | N432: =RC[-8]-R[18]C[-8] -> 2.416666666666667 | O432: =RC[-8]-R[18]C[-8] -> 2.9166666666666643 | P432: =RC[-8]-R[18]C[-8] -> -16.125 | Q432: =RC[-8]-R[18]C[-8] -> 45.666666666666664 | R432: =RC[-8]-R[18]C[-8] -> 52.75 | T432: =RC[-7]*RC[-2] -> 41.892291666666665 | U432: =RC[-7]*RC[-3] -> 127.47916666666669 | V432: =RC[-7]*RC[-4] -> 153.85416666666654 | W432: =RC[-7]*RC[-5] -> -850.59375 | X432: =RC[-7]*RC[-6] -> 2408.9166666666665 | Y432: =RC[-12]*RC[-12] -> 0.63070069444444432 | Z432: =RC[-12]*RC[-12] -> 5.8402777777777795 | AA432: =RC[-12]*RC[-12] -> 8.5069444444444304 | AB432: =RC[-12]*RC[-12] -> 260.015625 | AC432: =RC[-12]*RC[-12] -> 2085.4444444444443 | AD432: =RC[-12]*RC[-12] -> 2782.5625 | AE432: =RC[-11]/SQRT(RC[-6]*RC[-1]) -> 1 | AF432: =RC[-11]/SQRT(RC[-6]*RC[-2]) -> 1 | AG432: =RC[-11]/SQRT(RC[-6]*RC[-3]) -> 1 | AH432: =RC[-11]/SQRT(RC[-6]*RC[-4]) -> -1 | AI432: =RC[-11]/SQRT(RC[-6]*RC[-5]) -> 1
A433: 32970 | B433: 北京 | C433: 187 | D433: 中度污染 | E433: 1.22 | F433: 7 | G433: 41 | H433: 11 | I433: 43 | J433: 67 | L433: 2013-06-09T07:00:00.000 | M433: =RC[-8]-R[17]C[-8] -> 0.24416666666666653 | N433: =RC[-8]-R[17]C[-8] -> 2.416666666666667 | O433: =RC[-8]-R[17]C[-8] -> -8.3333333333335702E-2 | P433: =RC[-8]-R[17]C[-8] -> -10.125 | Q433: =RC[-8]-R[17]C[-8] -> -8.3333333333333357 | R433: =RC[-8]-R[17]C[-8] -> 23.75 | T433: =RC[-7]*RC[-2] -> 5.7989583333333306 | U433: =RC[-7]*RC[-3] -> 57.395833333333343 | V433: =RC[-7]*RC[-4] -> -1.9791666666667229 | W433: =RC[-7]*RC[-5] -> -240.46875 | X433: =RC[-7]*RC[-6] -> -197.91666666666671 | Y433: =RC[-12]*RC[-12] -> 5.9617361111111045E-2 | Z433: =RC[-12]*RC[-12] -> 5.8402777777777795 | AA433: =RC[-12]*RC[-12] -> 6.9444444444448396E-3 | AB433: =RC[-12]*RC[-12] -> 102.515625 | AC433: =RC[-12]*RC[-12] -> 69.444444444444485 | AD433: =RC[-12]*RC[-12] -> 564.0625 | AE433: =RC[-11]/SQRT(RC[-6]*RC[-1]) -> 1.0000000000000002 | AF433: =RC[-11]/SQRT(RC[-6]*RC[-2]) -> 1 | AG433: =RC[-11]/SQRT(RC[-6]*RC[-3]) -> -1 | AH433: =RC[-11]/SQRT(RC[-6]*RC[-4]) -> -1 | AI433: =RC[-11]/SQRT(RC[-6]*RC[-5]) -> -1
A434: 33046 | B434: 北京 | C434: 183 | D434: 中度污染 | E434: 0.69 | F434: 7 | G434: 32 | H434: 27 | I434: 58 | J434: 29 | L434: 2013-06-09T08:00:00.000 | M434: =RC[-8]-R[16]C[-8] -> -0.28583333333333349 | N434: =RC[-8]-R[16]C[-8] -> 2.416666666666667 | O434: =RC[-8]-R[16]C[-8] -> -9.0833333333333357 | P434: =RC[-8]-R[16]C[-8] -> 5.875 | Q434: =RC[-8]-R[16]C[-8] -> 6.6666666666666643 | R434: =RC[-8]-R[16]C[-8] -> -14.25 | T434: =RC[-7]*RC[-2] -> 4.0731250000000019 | U434: =RC[-7]*RC[-3] -> -34.437500000000007 | V434: =RC[-7]*RC[-4] -> 129.43750000000003 | W434: =RC[-7]*RC[-5] -> -83.71875 | X434: =RC[-7]*RC[-6] -> -94.999999999999972 | Y434: =RC[-12]*RC[-12] -> 8.1700694444444541E-2 | Z434: =RC[-12]*RC[-12] -> 5.8402777777777795 | AA434: =RC[-12]*RC[-12] -> 82.506944444444485 | AB434: =RC[-12]*RC[-12] -> 34.515625 | AC434: =RC[-12]*RC[-12] -> 44.444444444444414 | AD434: =RC[-12]*RC[-12] -> 203.0625 | AE434: =RC[-11]/SQRT(RC[-6]*RC[-1]) -> 0.99999999999999978 | AF434: =RC[-11]/SQRT(RC[-6]*RC[-2]) -> -1.0000000000000002 | AG434: =RC[-11]/SQRT(RC[-6]*RC[-3]) -> 1 | AH434: =RC[-11]/SQRT(RC[-6]*RC[-4]) -> -1 | AI434: =RC[-11]/SQRT(RC[-6]*RC[-5]) -> -1
A435: 33122 | B435: 北京 | C435: 178 | D435: 中度污染 | E435: 0.47 | F435: 5 | G435: 28 | H435: 33 | I435: 8 | J435: 12 | L435: 2013-06-09T09:00:00.000 | M435: =RC[-8]-R[15]C[-8] -> -0.50583333333333347 | N435: =RC[-8]-R[15]C[-8] -> 0.41666666666666696 | O435: =RC[-8]-R[15]C[-8] -> -13.083333333333336 | P435: =RC[-8]-R[15]C[-8] -> 11.875 | Q435: =RC[-8]-R[15]C[-8] -> -43.333333333333336 | R435: =RC[-8]-R[15]C[-8] -> -31.25 | T435: =RC[-7]*RC[-2] -> 15.807291666666671 | U435: =RC[-7]*RC[-3] -> -13.020833333333343 | V435: =RC[-7]*RC[-4] -> 408.85416666666674 | W435: =RC[-7]*RC[-5] -> -371.09375 | X435: =RC[-7]*RC[-6] -> 1354.1666666666667 | Y435: =RC[-12]*RC[-12] -> 0.25586736111111125 | Z435: =RC[-12]*RC[-12] -> 0.17361111111111135 | AA435: =RC[-12]*RC[-12] -> 171.17361111111117 | AB435: =RC[-12]*RC[-12] -> 141.015625 | AC435: =RC[-12]*RC[-12] -> 1877.7777777777781 | AD435: =RC[-12]*RC[-12] -> 976.5625 | AE435: =RC[-11]/SQRT(RC[-6]*RC[-1]) -> 1 | AF435: =RC[-11]/SQRT(RC[-6]*RC[-2]) -> -1 | AG435: =RC[-11]/SQRT(RC[-6]*RC[-3]) -> 1 | AH435: =RC[-11]/SQRT(RC[-6]*RC[-4]) -> -1 | AI435: =RC[-11]/SQRT(RC[-6]*RC[-5]) -> 1
A436: 33198 | B436: 北京 | C436: 177 | D436: 中度污染 | E436: 0.44 | F436: 5 | G436: 29 | H436: 36 | I436: 11 | J436: 10 | L436: 2013-06-09T10:00:00.000 | M436: =RC[-8]-R[14]C[-8] -> -0.53583333333333338 | N436: =RC[-8]-R[14]C[-8] -> 0.41666666666666696 | O436: =RC[-8]-R[14]C[-8] -> -12.083333333333336 | P436: =RC[-8]-R[14]C[-8] -> 14.875 | Q436: =RC[-8]-R[14]C[-8] -> -40.333333333333336 | R436: =RC[-8]-R[14]C[-8] -> -33.25 | T436: =RC[-7]*RC[-2] -> 17.816458333333333 | U436: =RC[-7]*RC[-3] -> -13.854166666666677 | V436: =RC[-7]*RC[-4] -> 401.77083333333343 | W436: =RC[-7]*RC[-5] -> -494.59375 | X436: =RC[-7]*RC[-6] -> 1341.0833333333335 | Y436: =RC[-12]*RC[-12] -> 0.28711736111111119 | Z436: =RC[-12]*RC[-12] -> 0.17361111111111135 | AA436: =RC[-12]*RC[-12] -> 146.00694444444451 | AB436: =RC[-12]*RC[-12] -> 221.265625 | AC436: =RC[-12]*RC[-12] -> 1626.7777777777781 | AD436: =RC[-12]*RC[-12] -> 1105.5625 | AE436: =RC[-11]/SQRT(RC[-6]*RC[-1]) -> 0.99999999999999978 | AF436: =RC[-11]/SQRT(RC[-6]*RC[-2]) -> -1 | AG436: =RC[-11]/SQRT(RC[-6]*RC[-3]) -> 1 | AH436: =RC[-11]/SQRT(RC[-6]*RC[-4]) -> -1 | AI436: =RC[-11]/SQRT(RC[-6]*RC[-5]) -> 1
A437: 33274 | B437: 北京 | C437: 175 | D437: 中度污染 | E437: 0.41 | F437: 4 | G437: 31 | H437: 38 | I437: 13 | J437: 9 | L437: 2013-06-09T11:00:00.000 | M437: =RC[-8]-R[13]C[-8] -> -0.56583333333333341 | N437: =RC[-8]-R[13]C[-8] -> -0.58333333333333304 | O437: =RC[-8]-R[13]C[-8] -> -10.083333333333336 | P437: =RC[-8]-R[13]C[-8] -> 16.875 | Q437: =RC[-8]-R[13]C[-8] -> -38.333333333333336 | R437: =RC[-8]-R[13]C[-8] -> -34.25 | T437: =RC[-7]*RC[-2] -> 19.379791666666669 | U437: =RC[-7]*RC[-3] -> 19.979166666666657 | V437: =RC[-7]*RC[-4] -> 345.35416666666674 | W437: =RC[-7]*RC[-5] -> -577.96875 | X437: =RC[-7]*RC[-6] -> 1312.9166666666667 | Y437: =RC[-12]*RC[-12] -> 0.32016736111111121 | Z437: =RC[-12]*RC[-12] -> 0.34027777777777746 | AA437: =RC[-12]*RC[-12] -> 101.67361111111116 | AB437: =RC[-12]*RC[-12] -> 284.765625 | AC437: =RC[-12]*RC[-12] -> 1469.4444444444446 | AD437: =RC[-12]*RC[-12] -> 1173.0625 | AE437: =RC[-11]/SQRT(RC[-6]*RC[-1]) -> 1 | AF437: =RC[-11]/SQRT(RC[-6]*RC[-2]) -> 1 | AG437: =RC[-11]/SQRT(RC[-6]*RC[-3]) -> 1 | AH437: =RC[-11]/SQRT(RC[-6]*RC[-4]) -> -1 | AI437: =RC[-11]/SQRT(RC[-6]*RC[-5]) -> 1
A438: 33350 | B438: 北京 | C438: 165 | D438: 中度污染 | E438: 0.38 | F438: 4 | G438: 32 | H438: 41 | I438: 15 | J438: 8 | L438: 2013-06-09T12:00:00.000 | M438: =RC[-8]-R[12]C[-8] -> -0.59583333333333344 | N438: =RC[-8]-R[12]C[-8] -> -0.58333333333333304 | O438: =RC[-8]-R[12]C[-8] -> -9.0833333333333357 | P438: =RC[-8]-R[12]C[-8] -> 19.875 | Q438: =RC[-8]-R[12]C[-8] -> -36.333333333333336 | R438: =RC[-8]-R[12]C[-8] -> -35.25 | T438: =RC[-7]*RC[-2] -> 21.003125000000004 | U438: =RC[-7]*RC[-3] -> 20.562499999999989 | V438: =RC[-7]*RC[-4] -> 320.18750000000006 | W438: =RC[-7]*RC[-5] -> -700.59375 | X438: =RC[-7]*RC[-6] -> 1280.75 | Y438: =RC[-12]*RC[-12] -> 0.35501736111111121 | Z438: =RC[-12]*RC[-12] -> 0.34027777777777746 | AA438: =RC[-12]*RC[-12] -> 82.506944444444485 | AB438: =RC[-12]*RC[-12] -> 395.015625 | AC438: =RC[-12]*RC[-12] -> 1320.1111111111113 | AD438: =RC[-12]*RC[-12] -> 1242.5625 | AE438: =RC[-11]/SQRT(RC[-6]*RC[-1]) -> 1 | AF438: =RC[-11]/SQRT(RC[-6]*RC[-2]) -> 1 | AG438: =RC[-11]/SQRT(RC[-6]*RC[-3]) -> 0.99999999999999978 | AH438: =RC[-11]/SQRT(RC[-6]*RC[-4]) -> -1 | AI438: =RC[-11]/SQRT(RC[-6]*RC[-5]) -> 1
A439: 33426 | B439: 北京 | C439: 154 | D439: 中度污染 | E439: 0.38 | F439: 3 | G439: 32 | H439: 42 | I439: 7 | J439: 7 | L439: 2013-06-09T13:00:00.000 | M439: =RC[-8]-R[11]C[-8] -> -0.59583333333333344 | N439: =RC[-8]-R[11]C[-8] -> -1.583333333333333 | O439: =RC[-8]-R[11]C[-8] -> -9.0833333333333357 | P439: =RC[-8]-R[11]C[-8] -> 20.875 | Q439: =RC[-8]-R[11]C[-8] -> -44.333333333333336 | R439: =RC[-8]-R[11]C[-8] -> -36.25 | T439: =RC[-7]*RC[-2] -> 21.598958333333336 | U439: =RC[-7]*RC[-3] -> 57.395833333333321 | V439: =RC[-7]*RC[-4] -> 329.27083333333343 | W439: =RC[-7]*RC[-5] -> -756.71875 | X439: =RC[-7]*RC[-6] -> 1607.0833333333335 | Y439: =RC[-12]*RC[-12] -> 0.35501736111111121 | Z439: =RC[-12]*RC[-12] -> 2.5069444444444433 | AA439: =RC[-12]*RC[-12] -> 82.506944444444485 | AB439: =RC[-12]*RC[-12] -> 435.765625 | AC439: =RC[-12]*RC[-12] -> 1965.4444444444446 | AD439: =RC[-12]*RC[-12] -> 1314.0625 | AE439: =RC[-11]/SQRT(RC[-6]*RC[-1]) -> 1 | AF439: =RC[-11]/SQRT(RC[-6]*RC[-2]) -> 1 | AG439: =RC[-11]/SQRT(RC[-6]*RC[-3]) -> 1 | AH439: =RC[-11]/SQRT(RC[-6]*RC[-4]) -> -1 | AI439: =RC[-11]/SQRT(RC[-6]*RC[-5]) -> 1
A440: 33502 | B440: 北京 | C440: 143 | D440: 轻度污染 | E440: 0.36 | F440: 3 | G440: 34 | H440: 43 | I440: 8 | J440: 4 | L440: 2013-06-09T14:00:00.000 | M440: =RC[-8]-R[10]C[-8] -> -0.61583333333333345 | N440: =RC[-8]-R[10]C[-8] -> -1.583333333333333 | O440: =RC[-8]-R[10]C[-8] -> -7.0833333333333357 | P440: =RC[-8]-R[10]C[-8] -> 21.875 | Q440: =RC[-8]-R[10]C[-8] -> -43.333333333333336 | R440: =RC[-8]-R[10]C[-8] -> -39.25 | T440: =RC[-7]*RC[-2] -> 24.171458333333337 | U440: =RC[-7]*RC[-3] -> 62.145833333333321 | V440: =RC[-7]*RC[-4] -> 278.02083333333343 | W440: =RC[-7]*RC[-5] -> -858.59375 | X440: =RC[-7]*RC[-6] -> 1700.8333333333335 | Y440: =RC[-12]*RC[-12] -> 0.37925069444444459 | Z440: =RC[-12]*RC[-12] -> 2.5069444444444433 | AA440: =RC[-12]*RC[-12] -> 50.173611111111143 | AB440: =RC[-12]*RC[-12] -> 478.515625 | AC440: =RC[-12]*RC[-12] -> 1877.7777777777781 | AD440: =RC[-12]*RC[-12] -> 1540.5625 | AE440: =RC[-11]/SQRT(RC[-6]*RC[-1]) -> 1 | AF440: =RC[-11]/SQRT(RC[-6]*RC[-2]) -> 1.0000000000000002 | AG440: =RC[-11]/SQRT(RC[-6]*RC[-3]) -> 1 | AH440: =RC[-11]/SQRT(RC[-6]*RC[-4]) -> -1 | AI440: =RC[-11]/SQRT(RC[-6]*RC[-5]) -> 1
A441: 33578 | B441: 北京 | C441: 134 | D441: 轻度污染 | E441: 0.37 | F441: 3 | G441: 37 | H441: 39 | I441: 8 | J441: 6 | L441: 2013-06-09T15:00:00.000 | M441: =RC[-8]-R[9]C[-8] -> -0.60583333333333345 | N441: =RC[-8]-R[9]C[-8] -> -1.583333333333333 | O441: =RC[-8]-R[9]C[-8] -> -4.0833333333333357 | P441: =RC[-8]-R[9]C[-8] -> 17.875 | Q441: =RC[-8]-R[9]C[-8] -> -43.333333333333336 | R441: =RC[-8]-R[9]C[-8] -> -37.25 | T441: =RC[-7]*RC[-2] -> 22.567291666666669 | U441: =RC[-7]*RC[-3] -> 58.979166666666657 | V441: =RC[-7]*RC[-4] -> 152.10416666666674 | W441: =RC[-7]*RC[-5] -> -665.84375 | X441: =RC[-7]*RC[-6] -> 1614.1666666666667 | Y441: =RC[-12]*RC[-12] -> 0.36703402777777794 | Z441: =RC[-12]*RC[-12] -> 2.5069444444444433 | AA441: =RC[-12]*RC[-12] -> 16.673611111111132 | AB441: =RC[-12]*RC[-12] -> 319.515625 | AC441: =RC[-12]*RC[-12] -> 1877.7777777777781 | AD441: =RC[-12]*RC[-12] -> 1387.5625 | AE441: =RC[-11]/SQRT(RC[-6]*RC[-1]) -> 0.99999999999999989 | AF441: =RC[-11]/SQRT(RC[-6]*RC[-2]) -> 1 | AG441: =RC[-11]/SQRT(RC[-6]*RC[-3]) -> 0.99999999999999978 | AH441: =RC[-11]/SQRT(RC[-6]*RC[-4]) -> -1 | AI441: =RC[-11]/SQRT(RC[-6]*RC[-5]) -> 1
A442: 33654 | B442: 北京 | C442: 126 | D442: 轻度污染 | E442: 0.37 | F442: 3 | G442: 36 | H442: 40 | I442: 8 | J442: 6 | L442: 2013-06-09T16:00:00.000 | M442: =RC[-8]-R[8]C[-8] -> -0.60583333333333345 | N442: =RC[-8]-R[8]C[-8] -> -1.583333333333333 | O442: =RC[-8]-R[8]C[-8] -> -5.0833333333333357 | P442: =RC[-8]-R[8]C[-8] -> 18.875 | Q442: =RC[-8]-R[8]C[-8] -> -43.333333333333336 | R442: =RC[-8]-R[8]C[-8] -> -37.25 | T442: =RC[-7]*RC[-2] -> 22.567291666666669 | U442: =RC[-7]*RC[-3] -> 58.979166666666657 | V442: =RC[-7]*RC[-4] -> 189.35416666666674 | W442: =RC[-7]*RC[-5] -> -703.09375 | X442: =RC[-7]*RC[-6] -> 1614.1666666666667 | Y442: =RC[-12]*RC[-12] -> 0.36703402777777794 | Z442: =RC[-12]*RC[-12] -> 2.5069444444444433 | AA442: =RC[-12]*RC[-12] -> 25.840277777777803 | AB442: =RC[-12]*RC[-12] -> 356.265625 | AC442: =RC[-12]*RC[-12] -> 1877.7777777777781 | AD442: =RC[-12]*RC[-12] -> 1387.5625 | AE442: =RC[-11]/SQRT(RC[-6]*RC[-1]) -> 0.99999999999999989 | AF442: =RC[-11]/SQRT(RC[-6]*RC[-2]) -> 1 | AG442: =RC[-11]/SQRT(RC[-6]*RC[-3]) -> 1 | AH442: =RC[-11]/SQRT(RC[-6]*RC[-4]) -> -1 | AI442: =RC[-11]/SQRT(RC[-6]*RC[-5]) -> 1
A443: 33730 | B443: 北京 | C443: 118 | D443: 轻度污染 | E443: 0.4 | F443: 3 | G443: 37 | H443: 37 | I443: 8 | J443: 7 | L443: 2013-06-09T17:00:00.000 | M443: =RC[-8]-R[7]C[-8] -> -0.57583333333333342 | N443: =RC[-8]-R[7]C[-8] -> -1.583333333333333 | O443: =RC[-8]-R[7]C[-8] -> -4.0833333333333357 | P443: =RC[-8]-R[7]C[-8] -> 15.875 | Q443: =RC[-8]-R[7]C[-8] -> -43.333333333333336 | R443: =RC[-8]-R[7]C[-8] -> -36.25 | T443: =RC[-7]*RC[-2] -> 20.873958333333338 | U443: =RC[-7]*RC[-3] -> 57.395833333333321 | V443: =RC[-7]*RC[-4] -> 148.02083333333343 | W443: =RC[-7]*RC[-5] -> -575.46875 | X443: =RC[-7]*RC[-6] -> 1570.8333333333335 | Y443: =RC[-12]*RC[-12] -> 0.3315840277777779 | Z443: =RC[-12]*RC[-12] -> 2.5069444444444433 | AA443: =RC[-12]*RC[-12] -> 16.673611111111132 | AB443: =RC[-12]*RC[-12] -> 252.015625 | AC443: =RC[-12]*RC[-12] -> 1877.7777777777781 | AD443: =RC[-12]*RC[-12] -> 1314.0625 | AE443: =RC[-11]/SQRT(RC[-6]*RC[-1]) -> 1 | AF443: =RC[-11]/SQRT(RC[-6]*RC[-2]) -> 1 | AG443: =RC[-11]/SQRT(RC[-6]*RC[-3]) -> 1 | AH443: =RC[-11]/SQRT(RC[-6]*RC[-4]) -> -1 | AI443: =RC[-11]/SQRT(RC[-6]*RC[-5]) -> 1
A444: 33806 | B444: 北京 | C444: 109 | D444: 轻度污染 | E444: 0.46 | F444: 3 | G444: 44 | H444: 29 | I444: 10 | J444: 9 | L444: 2013-06-09T18:00:00.000 | M444: =RC[-8]-R[6]C[-8] -> -0.51583333333333337 | N444: =RC[-8]-R[6]C[-8] -> -1.583333333333333 | O444: =RC[-8]-R[6]C[-8] -> 2.9166666666666643 | P444: =RC[-8]-R[6]C[-8] -> 7.875 | Q444: =RC[-8]-R[6]C[-8] -> -41.333333333333336 | R444: =RC[-8]-R[6]C[-8] -> -34.25 | T444: =RC[-7]*RC[-2] -> 17.667291666666667 | U444: =RC[-7]*RC[-3] -> 54.229166666666657 | V444: =RC[-7]*RC[-4] -> -99.895833333333258 | W444: =RC[-7]*RC[-5] -> -269.71875 | X444: =RC[-7]*RC[-6] -> 1415.6666666666667 | Y444: =RC[-12]*RC[-12] -> 0.26608402777777779 | Z444: =RC[-12]*RC[-12] -> 2.5069444444444433 | AA444: =RC[-12]*RC[-12] -> 8.5069444444444304 | AB444: =RC[-12]*RC[-12] -> 62.015625 | AC444: =RC[-12]*RC[-12] -> 1708.4444444444446 | AD444: =RC[-12]*RC[-12] -> 1173.0625 | AE444: =RC[-11]/SQRT(RC[-6]*RC[-1]) -> 1 | AF444: =RC[-11]/SQRT(RC[-6]*RC[-2]) -> 1 | AG444: =RC[-11]/SQRT(RC[-6]*RC[-3]) -> -1 | AH444: =RC[-11]/SQRT(RC[-6]*RC[-4]) -> -1 | AI444: =RC[-11]/SQRT(RC[-6]*RC[-5]) -> 1
A445: 33882 | B445: 北京 | C445: 101 | D445: 良 | E445: 0.53 | F445: 3 | G445: 49 | H445: 22 | I445: 16 | J445: 7 | L445: 2013-06-09T19:00:00.000 | M445: =RC[-8]-R[5]C[-8] -> -0.44583333333333341 | N445: =RC[-8]-R[5]C[-8] -> -1.583333333333333 | O445: =RC[-8]-R[5]C[-8] -> 7.9166666666666643 | P445: =RC[-8]-R[5]C[-8] -> 0.875 | Q445: =RC[-8]-R[5]C[-8] -> -35.333333333333336 | R445: =RC[-8]-R[5]C[-8] -> -36.25 | T445: =RC[-7]*RC[-2] -> 16.161458333333336 | U445: =RC[-7]*RC[-3] -> 57.395833333333321 | V445: =RC[-7]*RC[-4] -> -286.97916666666657 | W445: =RC[-7]*RC[-5] -> -31.71875 | X445: =RC[-7]*RC[-6] -> 1280.8333333333335 | Y445: =RC[-12]*RC[-12] -> 0.19876736111111118 | Z445: =RC[-12]*RC[-12] -> 2.5069444444444433 | AA445: =RC[-12]*RC[-12] -> 62.673611111111072 | AB445: =RC[-12]*RC[-12] -> 0.765625 | AC445: =RC[-12]*RC[-12] -> 1248.4444444444446 | AD445: =RC[-12]*RC[-12] -> 1314.0625 | AE445: =RC[-11]/SQRT(RC[-6]*RC[-1]) -> 1 | AF445: =RC[-11]/SQRT(RC[-6]*RC[-2]) -> 1 | AG445: =RC[-11]/SQRT(RC[-6]*RC[-3]) -> -1 | AH445: =RC[-11]/SQRT(RC[-6]*RC[-4]) -> -1 | AI445: =RC[-11]/SQRT(RC[-6]*RC[-5]) -> 1
A446: 33958 | B446: 北京 | C446: 93 | D446: 良 | E446: 0.6 | F446: 3 | G446: 55 | H446: 12 | I446: 21 | J446: 12 | L446: 2013-06-09T20:00:00.000 | M446: =RC[-8]-R[4]C[-8] -> -0.37583333333333346 | N446: =RC[-8]-R[4]C[-8] -> -1.583333333333333 | O446: =RC[-8]-R[4]C[-8] -> 13.916666666666664 | P446: =RC[-8]-R[4]C[-8] -> -9.125 | Q446: =RC[-8]-R[4]C[-8] -> -30.333333333333336 | R446: =RC[-8]-R[4]C[-8] -> -31.25 | T446: =RC[-7]*RC[-2] -> 11.744791666666671 | U446: =RC[-7]*RC[-3] -> 49.479166666666657 | V446: =RC[-7]*RC[-4] -> -434.89583333333326 | W446: =RC[-7]*RC[-5] -> 285.15625 | X446: =RC[-7]*RC[-6] -> 947.91666666666674 | Y446: =RC[-12]*RC[-12] -> 0.14125069444444455 | Z446: =RC[-12]*RC[-12] -> 2.5069444444444433 | AA446: =RC[-12]*RC[-12] -> 193.67361111111106 | AB446: =RC[-12]*RC[-12] -> 83.265625 | AC446: =RC[-12]*RC[-12] -> 920.1111111111112 | AD446: =RC[-12]*RC[-12] -> 976.5625 | AE446: =RC[-11]/SQRT(RC[-6]*RC[-1]) -> 1 | AF446: =RC[-11]/SQRT(RC[-6]*RC[-2]) -> 1.0000000000000002 | AG446: =RC[-11]/SQRT(RC[-6]*RC[-3]) -> -1 | AH446: =RC[-11]/SQRT(RC[-6]*RC[-4]) -> 1 | AI446: =RC[-11]/SQRT(RC[-6]*RC[-5]) -> 1
A447: 34034 | B447: 北京 | C447: 86 | D447: 良 | E447: 0.61 | F447: 3 | G447: 51 | H447: 9 | I447: 23 | J447: 14 | L447: 2013-06-09T21:00:00.000 | M447: =RC[-8]-R[3]C[-8] -> -0.36583333333333345 | N447: =RC[-8]-R[3]C[-8] -> -1.583333333333333 | O447: =RC[-8]-R[3]C[-8] -> 9.9166666666666643 | P447: =RC[-8]-R[3]C[-8] -> -12.125 | Q447: =RC[-8]-R[3]C[-8] -> -28.333333333333336 | R447: =RC[-8]-R[3]C[-8] -> -29.25 | T447: =RC[-7]*RC[-2] -> 10.700625000000004 | U447: =RC[-7]*RC[-3] -> 46.312499999999993 | V447: =RC[-7]*RC[-4] -> -290.06249999999994 | W447: =RC[-7]*RC[-5] -> 354.65625 | X447: =RC[-7]*RC[-6] -> 828.75000000000011 | Y447: =RC[-12]*RC[-12] -> 0.13383402777777786 | Z447: =RC[-12]*RC[-12] -> 2.5069444444444433 | AA447: =RC[-12]*RC[-12] -> 98.340277777777729 | AB447: =RC[-12]*RC[-12] -> 147.015625 | AC447: =RC[-12]*RC[-12] -> 802.77777777777794 | AD447: =RC[-12]*RC[-12] -> 855.5625 | AE447: =RC[-11]/SQRT(RC[-6]*RC[-1]) -> 1 | AF447: =RC[-11]/SQRT(RC[-6]*RC[-2]) -> 1 | AG447: =RC[-11]/SQRT(RC[-6]*RC[-3]) -> -1 | AH447: =RC[-11]/SQRT(RC[-6]*RC[-4]) -> 1 | AI447: =RC[-11]/SQRT(RC[-6]*RC[-5]) -> 1
A448: 34110 | B448: 北京 | C448: 81 | D448: 良 | E448: 0.61 | F448: 4 | G448: 56 | H448: 9 | I448: 24 | J448: 14 | L448: 2013-06-09T22:00:00.000 | M448: =RC[-8]-R[2]C[-8] -> -0.36583333333333345 | N448: =RC[-8]-R[2]C[-8] -> -0.58333333333333304 | O448: =RC[-8]-R[2]C[-8] -> 14.916666666666664 | P448: =RC[-8]-R[2]C[-8] -> -12.125 | Q448: =RC[-8]-R[2]C[-8] -> -27.333333333333336 | R448: =RC[-8]-R[2]C[-8] -> -29.25 | T448: =RC[-7]*RC[-2] -> 10.700625000000004 | U448: =RC[-7]*RC[-3] -> 17.062499999999993 | V448: =RC[-7]*RC[-4] -> -436.31249999999994 | W448: =RC[-7]*RC[-5] -> 354.65625 | X448: =RC[-7]*RC[-6] -> 799.50000000000011 | Y448: =RC[-12]*RC[-12] -> 0.13383402777777786 | Z448: =RC[-12]*RC[-12] -> 0.34027777777777746 | AA448: =RC[-12]*RC[-12] -> 222.50694444444437 | AB448: =RC[-12]*RC[-12] -> 147.015625 | AC448: =RC[-12]*RC[-12] -> 747.1111111111112 | AD448: =RC[-12]*RC[-12] -> 855.5625 | AE448: =RC[-11]/SQRT(RC[-6]*RC[-1]) -> 1 | AF448: =RC[-11]/SQRT(RC[-6]*RC[-2]) -> 1 | AG448: =RC[-11]/SQRT(RC[-6]*RC[-3]) -> -1 | AH448: =RC[-11]/SQRT(RC[-6]*RC[-4]) -> 1 | AI448: =RC[-11]/SQRT(RC[-6]*RC[-5]) -> 1
A449: 34186 | B449: 北京 | C449: 75 | D449: 良 | E449: 0.57999999999999996 | F449: 4 | G449: 49 | H449: 9 | I449: 16 | J449: 9 | L449: 2013-06-09T23:00:00.000 | M449: =RC[-8]-R[1]C[-8] -> -0.39583333333333348 | N449: =RC[-8]-R[1]C[-8] -> -0.58333333333333304 | O449: =RC[-8]-R[1]C[-8] -> 7.9166666666666643 | P449: =RC[-8]-R[1]C[-8] -> -12.125 | Q449: =RC[-8]-R[1]C[-8] -> -35.333333333333336 | R449: =RC[-8]-R[1]C[-8] -> -34.25 | T449: =RC[-7]*RC[-2] -> 13.557291666666671 | U449: =RC[-7]*RC[-3] -> 19.979166666666657 | V449: =RC[-7]*RC[-4] -> -271.14583333333326 | W449: =RC[-7]*RC[-5] -> 415.28125 | X449: =RC[-7]*RC[-6] -> 1210.1666666666667 | Y449: =RC[-12]*RC[-12] -> 0.1566840277777779 | Z449: =RC[-12]*RC[-12] -> 0.34027777777777746 | AA449: =RC[-12]*RC[-12] -> 62.673611111111072 | AB449: =RC[-12]*RC[-12] -> 147.015625 | AC449: =RC[-12]*RC[-12] -> 1248.4444444444446 | AD449: =RC[-12]*RC[-12] -> 1173.0625 | AE449: =RC[-11]/SQRT(RC[-6]*RC[-1]) -> 0.99999999999999989 | AF449: =RC[-11]/SQRT(RC[-6]*RC[-2]) -> 1 | AG449: =RC[-11]/SQRT(RC[-6]*RC[-3]) -> -1 | AH449: =RC[-11]/SQRT(RC[-6]*RC[-4]) -> 1 | AI449: =RC[-11]/SQRT(RC[-6]*RC[-5]) -> 1
E450: =AVERAGE(R[-24]C:R[-1]C) -> 0.97583333333333344 | F450: =AVERAGE(R[-24]C:R[-1]C) -> 4.583333333333333 | G450: =AVERAGE(R[-24]C:R[-1]C) -> 41.083333333333336 | H450: =AVERAGE(R[-24]C:R[-1]C) -> 21.125 | I450: =AVERAGE(R[-24]C:R[-1]C) -> 51.333333333333336 | J450: =AVERAGE(R[-24]C:R[-1]C) -> 43.25 | M450: =RC[-8]-RC[-8] -> 0 | N450: =RC[-8]-RC[-8] -> 0 | O450: =RC[-8]-RC[-8] -> 0 | P450: =RC[-8]-RC[-8] -> 0 | Q450: =RC[-8]-RC[-8] -> 0 | R450: =RC[-8]-RC[-8] -> 0 | T450: =SUM(R[-24]C:R[-1]C) -> 857.41499999999985 | U450: =SUM(R[-24]C:R[-1]C) -> 1315.5000000000002 | V450: =SUM(R[-24]C:R[-1]C) -> 2909.5 | W450: =SUM(R[-24]C:R[-1]C) -> -13509.75 | X450: =SUM(R[-24]C:R[-1]C) -> 63289.999999999993 | Y450: =SUM(R[-24]C:R[-1]C) -> 13.308383333333335 | Z450: =SUM(R[-24]C:R[-1]C) -> 55.833333333333329 | AA450: =SUM(R[-24]C:R[-1]C) -> 1611.8333333333335 | AB450: =SUM(R[-24]C:R[-1]C) -> 5606.625 | AC450: =SUM(R[-24]C:R[-1]C) -> 73785.333333333314 | AD450: =SUM(R[-24]C:R[-1]C) -> 56290.5 | AE450: =RC[-11]/SQRT(RC[-6]*RC[-1]) -> 0.99062862465221158 | AF450: =RC[-11]/SQRT(RC[-6]*RC[-2]) -> 0.74203864028588751 | AG450: =RC[-11]/SQRT(RC[-6]*RC[-3]) -> 0.30545043075906592 | AH450: =RC[-11]/SQRT(RC[-6]*RC[-4]) -> -0.76046460423186135 | AI450: =RC[-11]/SQRT(RC[-6]*RC[-5]) -> 0.98204755955189404
A451: 34262 | B451: 北京 | C451: 68 | D451: 良 | E451: 0.65 | F451: 3 | G451: 46 | H451: 6 | I451: 20 | J451: 12 | L451: 2013-06-10T00:00:00.000 | M451: =RC[-8]-R[24]C[-8] -> 8.1666666666666554E-2 | N451: =RC[-8]-R[24]C[-8] -> -1.375 | O451: =RC[-8]-R[24]C[-8] -> 5 | P451: =RC[-8]-R[24]C[-8] -> -39.916666666666664 | Q451: =RC[-8]-R[24]C[-8] -> -10.25 | R451: =RC[-8]-R[24]C[-8] -> -8.25 | T451: =RC[-7]*RC[-2] -> -0.67374999999999907 | U451: =RC[-7]*RC[-3] -> 11.34375 | V451: =RC[-7]*RC[-4] -> -41.25 | W451: =RC[-7]*RC[-5] -> 329.3125 | X451: =RC[-7]*RC[-6] -> 84.5625 | Y451: =RC[-12]*RC[-12] -> 6.6694444444444258E-3 | Z451: =RC[-12]*RC[-12] -> 1.890625 | AA451: =RC[-12]*RC[-12] -> 25 | AB451: =RC[-12]*RC[-12] -> 1593.3402777777776 | AC451: =RC[-12]*RC[-12] -> 105.0625 | AD451: =RC[-12]*RC[-12] -> 68.0625 | AE451: =RC[-11]/SQRT(RC[-6]*RC[-1]) -> -1 | AF451: =RC[-11]/SQRT(RC[-6]*RC[-2]) -> 1 | AG451: =RC[-11]/SQRT(RC[-6]*RC[-3]) -> -1 | AH451: =RC[-11]/SQRT(RC[-6]*RC[-4]) -> 1 | AI451: =RC[-11]/SQRT(RC[-6]*RC[-5]) -> 1
A452: 34338 | B452: 北京 | C452: 63 | D452: 良 | E452: 0.8 | F452: 4 | G452: 49 | H452: 3 | I452: 21 | J452: 22 | L452: 2013-06-10T01:00:00.000 | M452: =RC[-8]-R[23]C[-8] -> 0.23166666666666658 | N452: =RC[-8]-R[23]C[-8] -> -0.375 | O452: =RC[-8]-R[23]C[-8] -> 8 | P452: =RC[-8]-R[23]C[-8] -> -42.916666666666664 | Q452: =RC[-8]-R[23]C[-8] -> -9.25 | R452: =RC[-8]-R[23]C[-8] -> 1.75 | T452: =RC[-7]*RC[-2] -> 0.40541666666666654 | U452: =RC[-7]*RC[-3] -> -0.65625 | V452: =RC[-7]*RC[-4] -> 14 | W452: =RC[-7]*RC[-5] -> -75.104166666666657 | X452: =RC[-7]*RC[-6] -> -16.1875 | Y452: =RC[-12]*RC[-12] -> 5.3669444444444402E-2 | Z452: =RC[-12]*RC[-12] -> 0.140625 | AA452: =RC[-12]*RC[-12] -> 64 | AB452: =RC[-12]*RC[-12] -> 1841.8402777777776 | AC452: =RC[-12]*RC[-12] -> 85.5625 | AD452: =RC[-12]*RC[-12] -> 3.0625 | AE452: =RC[-11]/SQRT(RC[-6]*RC[-1]) -> 1.0000000000000002 | AF452: =RC[-11]/SQRT(RC[-6]*RC[-2]) -> -1 | AG452: =RC[-11]/SQRT(RC[-6]*RC[-3]) -> 1 | AH452: =RC[-11]/SQRT(RC[-6]*RC[-4]) -> -0.99999999999999978 | AI452: =RC[-11]/SQRT(RC[-6]*RC[-5]) -> -1
A453: 34414 | B453: 北京 | C453: 57 | D453: 良 | E453: 0.78 | F453: 4 | G453: 44 | H453: 3 | I453: 20 | J453: 16 | L453: 2013-06-10T02:00:00.000 | M453: =RC[-8]-R[22]C[-8] -> 0.21166666666666656 | N453: =RC[-8]-R[22]C[-8] -> -0.375 | O453: =RC[-8]-R[22]C[-8] -> 3 | P453: =RC[-8]-R[22]C[-8] -> -42.916666666666664 | Q453: =RC[-8]-R[22]C[-8] -> -10.25 | R453: =RC[-8]-R[22]C[-8] -> -4.25 | T453: =RC[-7]*RC[-2] -> -0.89958333333333285 | U453: =RC[-7]*RC[-3] -> 1.59375 | V453: =RC[-7]*RC[-4] -> -12.75 | W453: =RC[-7]*RC[-5] -> 182.39583333333331 | X453: =RC[-7]*RC[-6] -> 43.5625 | Y453: =RC[-12]*RC[-12] -> 4.4802777777777733E-2 | Z453: =RC[-12]*RC[-12] -> 0.140625 | AA453: =RC[-12]*RC[-12] -> 9 | AB453: =RC[-12]*RC[-12] -> 1841.8402777777776 | AC453: =RC[-12]*RC[-12] -> 105.0625 | AD453: =RC[-12]*RC[-12] -> 18.0625 | AE453: =RC[-11]/SQRT(RC[-6]*RC[-1]) -> -1 | AF453: =RC[-11]/SQRT(RC[-6]*RC[-2]) -> 1 | AG453: =RC[-11]/SQRT(RC[-6]*RC[-3]) -> -1 | AH453: =RC[-11]/SQRT(RC[-6]*RC[-4]) -> 0.99999999999999989 | AI453: =RC[-11]/SQRT(RC[-6]*RC[-5]) -> 1
A454: 34490 | B454: 北京 | C454: 51 | D454: 良 | E454: 0.75 | F454: 4 | G454: 42 | H454: 3 | I454: 20 | J454: 14 | L454: 2013-06-10T03:00:00.000 | M454: =RC[-8]-R[21]C[-8] -> 0.18166666666666653 | N454: =RC[-8]-R[21]C[-8] -> -0.375 | O454: =RC[-8]-R[21]C[-8] -> 1 | P454: =RC[-8]-R[21]C[-8] -> -42.916666666666664 | Q454: =RC[-8]-R[21]C[-8] -> -10.25 | R454: =RC[-8]-R[21]C[-8] -> -6.25 | T454: =RC[-7]*RC[-2] -> -1.1354166666666659 | U454: =RC[-7]*RC[-3] -> 2.34375 | V454: =RC[-7]*RC[-4] -> -6.25 | W454: =RC[-7]*RC[-5] -> 268.22916666666663 | X454: =RC[-7]*RC[-6] -> 64.0625 | Y454: =RC[-12]*RC[-12] -> 3.3002777777777728E-2 | Z454: =RC[-12]*RC[-12] -> 0.140625 | AA454: =RC[-12]*RC[-12] -> 1 | AB454: =RC[-12]*RC[-12] -> 1841.8402777777776 | AC454: =RC[-12]*RC[-12] -> 105.0625 | AD454: =RC[-12]*RC[-12] -> 39.0625 | AE454: =RC[-11]/SQRT(RC[-6]*RC[-1]) -> -1 | AF454: =RC[-11]/SQRT(RC[-6]*RC[-2]) -> 1 | AG454: =RC[-11]/SQRT(RC[-6]*RC[-3]) -> -1 | AH454: =RC[-11]/SQRT(RC[-6]*RC[-4]) -> 1 | AI454: =RC[-11]/SQRT(RC[-6]*RC[-5]) -> 1
A455: 34566 | B455: 北京 | C455: 44 | D455: 优 | E455: 0.73 | F455: 3 | G455: 43 | H455: 3 | I455: 17 | J455: 16 | L455: 2013-06-10T04:00:00.000 | M455: =RC[-8]-R[20]C[-8] -> 0.16166666666666651 | N455: =RC[-8]-R[20]C[-8] -> -1.375 | O455: =RC[-8]-R[20]C[-8] -> 2 | P455: =RC[-8]-R[20]C[-8] -> -42.916666666666664 | Q455: =RC[-8]-R[20]C[-8] -> -13.25 | R455: =RC[-8]-R[20]C[-8] -> -4.25 | T455: =RC[-7]*RC[-2] -> -0.68708333333333271 | U455: =RC[-7]*RC[-3] -> 5.84375 | V455: =RC[-7]*RC[-4] -> -8.5 | W455: =RC[-7]*RC[-5] -> 182.39583333333331 | X455: =RC[-7]*RC[-6] -> 56.3125 | Y455: =RC[-12]*RC[-12] -> 2.6136111111111061E-2 | Z455: =RC[-12]*RC[-12] -> 1.890625 | AA455: =RC[-12]*RC[-12] -> 4 | AB455: =RC[-12]*RC[-12] -> 1841.8402777777776 | AC455: =RC[-12]*RC[-12] -> 175.5625 | AD455: =RC[-12]*RC[-12] -> 18.0625 | AE455: =RC[-11]/SQRT(RC[-6]*RC[-1]) -> -1 | AF455: =RC[-11]/SQRT(RC[-6]*RC[-2]) -> 1 | AG455: =RC[-11]/SQRT(RC[-6]*RC[-3]) -> -1 | AH455: =RC[-11]/SQRT(RC[-6]*RC[-4]) -> 0.99999999999999989 | AI455: =RC[-11]/SQRT(RC[-6]*RC[-5]) -> 1
A456: 34642 | B456: 北京 | C456: 37 | D456: 优 | E456: 0.77 | F456: 4 | G456: 40 | H456: 3 | I456: 16 | J456: 15 | L456: 2013-06-10T05:00:00.000 | M456: =RC[-8]-R[19]C[-8] -> 0.20166666666666655 | N456: =RC[-8]-R[19]C[-8] -> -0.375 | O456: =RC[-8]-R[19]C[-8] -> -1 | P456: =RC[-8]-R[19]C[-8] -> -42.916666666666664 | Q456: =RC[-8]-R[19]C[-8] -> -14.25 | R456: =RC[-8]-R[19]C[-8] -> -5.25 | T456: =RC[-7]*RC[-2] -> -1.0587499999999994 | U456: =RC[-7]*RC[-3] -> 1.96875 | V456: =RC[-7]*RC[-4] -> 5.25 | W456: =RC[-7]*RC[-5] -> 225.3125 | X456: =RC[-7]*RC[-6] -> 74.8125 | Y456: =RC[-12]*RC[-12] -> 4.0669444444444397E-2 | Z456: =RC[-12]*RC[-12] -> 0.140625 | AA456: =RC[-12]*RC[-12] -> 1 | AB456: =RC[-12]*RC[-12] -> 1841.8402777777776 | AC456: =RC[-12]*RC[-12] -> 203.0625 | AD456: =RC[-12]*RC[-12] -> 27.5625 | AE456: =RC[-11]/SQRT(RC[-6]*RC[-1]) -> -1 | AF456: =RC[-11]/SQRT(RC[-6]*RC[-2]) -> 1 | AG456: =RC[-11]/SQRT(RC[-6]*RC[-3]) -> 1 | AH456: =RC[-11]/SQRT(RC[-6]*RC[-4]) -> 1.0000000000000002 | AI456: =RC[-11]/SQRT(RC[-6]*RC[-5]) -> 1
A457: 34718 | B457: 北京 | C457: 27 | D457: 优 | E457: 0.73 | F457: 4 | G457: 34 | H457: 3 | I457: 17 | J457: 11 | L457: 2013-06-10T06:00:00.000 | M457: =RC[-8]-R[18]C[-8] -> 0.16166666666666651 | N457: =RC[-8]-R[18]C[-8] -> -0.375 | O457: =RC[-8]-R[18]C[-8] -> -7 | P457: =RC[-8]-R[18]C[-8] -> -42.916666666666664 | Q457: =RC[-8]-R[18]C[-8] -> -13.25 | R457: =RC[-8]-R[18]C[-8] -> -9.25 | T457: =RC[-7]*RC[-2] -> -1.4954166666666653 | U457: =RC[-7]*RC[-3] -> 3.46875 | V457: =RC[-7]*RC[-4] -> 64.75 | W457: =RC[-7]*RC[-5] -> 396.97916666666663 | X457: =RC[-7]*RC[-6] -> 122.5625 | Y457: =RC[-12]*RC[-12] -> 2.6136111111111061E-2 | Z457: =RC[-12]*RC[-12] -> 0.140625 | AA457: =RC[-12]*RC[-12] -> 49 | AB457: =RC[-12]*RC[-12] -> 1841.8402777777776 | AC457: =RC[-12]*RC[-12] -> 175.5625 | AD457: =RC[-12]*RC[-12] -> 85.5625 | AE457: =RC[-11]/SQRT(RC[-6]*RC[-1]) -> -1 | AF457: =RC[-11]/SQRT(RC[-6]*RC[-2]) -> 1 | AG457: =RC[-11]/SQRT(RC[-6]*RC[-3]) -> 1 | AH457: =RC[-11]/SQRT(RC[-6]*RC[-4]) -> 1 | AI457: =RC[-11]/SQRT(RC[-6]*RC[-5]) -> 1
A458: 34794 | B458: 北京 | C458: 25 | D458: 优 | E458: 0.78 | F458: 4 | G458: 33 | H458: 2 | I458: 20 | J458: 14 | L458: 2013-06-10T07:00:00.000 | M458: =RC[-8]-R[17]C[-8] -> 0.21166666666666656 | N458: =RC[-8]-R[17]C[-8] -> -0.375 | O458: =RC[-8]-R[17]C[-8] -> -8 | P458: =RC[-8]-R[17]C[-8] -> -43.916666666666664 | Q458: =RC[-8]-R[17]C[-8] -> -10.25 | R458: =RC[-8]-R[17]C[-8] -> -6.25 | T458: =RC[-7]*RC[-2] -> -1.3229166666666661 | U458: =RC[-7]*RC[-3] -> 2.34375 | V458: =RC[-7]*RC[-4] -> 50 | W458: =RC[-7]*RC[-5] -> 274.47916666666663 | X458: =RC[-7]*RC[-6] -> 64.0625 | Y458: =RC[-12]*RC[-12] -> 4.4802777777777733E-2 | Z458: =RC[-12]*RC[-12] -> 0.140625 | AA458: =RC[-12]*RC[-12] -> 64 | AB458: =RC[-12]*RC[-12] -> 1928.6736111111109 | AC458: =RC[-12]*RC[-12] -> 105.0625 | AD458: =RC[-12]*RC[-12] -> 39.0625 | AE458: =RC[-11]/SQRT(RC[-6]*RC[-1]) -> -1 | AF458: =RC[-11]/SQRT(RC[-6]*RC[-2]) -> 1 | AG458: =RC[-11]/SQRT(RC[-6]*RC[-3]) -> 1 | AH458: =RC[-11]/SQRT(RC[-6]*RC[-4]) -> 1 | AI458: =RC[-11]/SQRT(RC[-6]*RC[-5]) -> 1
A459: 34870 | B459: 北京 | C459: 21 | D459: 优 | E459: 0.88 | F459: 4 | G459: 41 | H459: 4 | I459: 31 | J459: 23 | L459: 2013-06-10T08:00:00.000 | M459: =RC[-8]-R[16]C[-8] -> 0.31166666666666654 | N459: =RC[-8]-R[16]C[-8] -> -0.375 | O459: =RC[-8]-R[16]C[-8] -> 0 | P459: =RC[-8]-R[16]C[-8] -> -41.916666666666664 | Q459: =RC[-8]-R[16]C[-8] -> 0.75 | R459: =RC[-8]-R[16]C[-8] -> 2.75 | T459: =RC[-7]*RC[-2] -> 0.85708333333333298 | U459: =RC[-7]*RC[-3] -> -1.03125 | V459: =RC[-7]*RC[-4] -> 0 | W459: =RC[-7]*RC[-5] -> -115.27083333333333 | X459: =RC[-7]*RC[-6] -> 2.0625 | Y459: =RC[-12]*RC[-12] -> 9.7136111111111034E-2 | Z459: =RC[-12]*RC[-12] -> 0.140625 | AA459: =RC[-12]*RC[-12] -> 0 | AB459: =RC[-12]*RC[-12] -> 1757.0069444444443 | AC459: =RC[-12]*RC[-12] -> 0.5625 | AD459: =RC[-12]*RC[-12] -> 7.5625 | AE459: =RC[-11]/SQRT(RC[-6]*RC[-1]) -> 1 | AF459: =RC[-11]/SQRT(RC[-6]*RC[-2]) -> -1 | AG459: =RC[-11]/SQRT(RC[-6]*RC[-3]) -> #DIV/0! | AH459: =RC[-11]/SQRT(RC[-6]*RC[-4]) -> -1 | AI459: =RC[-11]/SQRT(RC[-6]*RC[-5]) -> 1
A460: 34946 | B460: 北京 | C460: 24 | D460: 优 | E460: 0.81 | F460: 4 | G460: 48 | H460: 9 | I460: 29 | J460: 24 | L460: 2013-06-10T09:00:00.000 | M460: =RC[-8]-R[15]C[-8] -> 0.24166666666666659 | N460: =RC[-8]-R[15]C[-8] -> -0.375 | O460: =RC[-8]-R[15]C[-8] -> 7 | P460: =RC[-8]-R[15]C[-8] -> -36.916666666666664 | Q460: =RC[-8]-R[15]C[-8] -> -1.25 | R460: =RC[-8]-R[15]C[-8] -> 3.75 | T460: =RC[-7]*RC[-2] -> 0.90624999999999967 | U460: =RC[-7]*RC[-3] -> -1.40625 | V460: =RC[-7]*RC[-4] -> 26.25 | W460: =RC[-7]*RC[-5] -> -138.4375 | X460: =RC[-7]*RC[-6] -> -4.6875 | Y460: =RC[-12]*RC[-12] -> 5.8402777777777741E-2 | Z460: =RC[-12]*RC[-12] -> 0.140625 | AA460: =RC[-12]*RC[-12] -> 49 | AB460: =RC[-12]*RC[-12] -> 1362.8402777777776 | AC460: =RC[-12]*RC[-12] -> 1.5625 | AD460: =RC[-12]*RC[-12] -> 14.0625 | AE460: =RC[-11]/SQRT(RC[-6]*RC[-1]) -> 1 | AF460: =RC[-11]/SQRT(RC[-6]*RC[-2]) -> -1 | AG460: =RC[-11]/SQRT(RC[-6]*RC[-3]) -> 1 | AH460: =RC[-11]/SQRT(RC[-6]*RC[-4]) -> -1 | AI460: =RC[-11]/SQRT(RC[-6]*RC[-5]) -> -1
A461: 35022 | B461: 北京 | C461: 27 | D461: 优 | E461: 0.65 | F461: 5 | G461: 57 | H461: 28 | I461: 23 | J461: 24 | L461: 2013-06-10T10:00:00.000 | M461: =RC[-8]-R[14]C[-8] -> 8.1666666666666554E-2 | N461: =RC[-8]-R[14]C[-8] -> 0.625 | O461: =RC[-8]-R[14]C[-8] -> 16 | P461: =RC[-8]-R[14]C[-8] -> -17.916666666666664 | Q461: =RC[-8]-R[14]C[-8] -> -7.25 | R461: =RC[-8]-R[14]C[-8] -> 3.75 | T461: =RC[-7]*RC[-2] -> 0.30624999999999958 | U461: =RC[-7]*RC[-3] -> 2.34375 | V461: =RC[-7]*RC[-4] -> 60 | W461: =RC[-7]*RC[-5] -> -67.187499999999986 | X461: =RC[-7]*RC[-6] -> -27.1875 | Y461: =RC[-12]*RC[-12] -> 6.6694444444444258E-3 | Z461: =RC[-12]*RC[-12] -> 0.390625 | AA461: =RC[-12]*RC[-12] -> 256 | AB461: =RC[-12]*RC[-12] -> 321.00694444444434 | AC461: =RC[-12]*RC[-12] -> 52.5625 | AD461: =RC[-12]*RC[-12] -> 14.0625 | AE461: =RC[-11]/SQRT(RC[-6]*RC[-1]) -> 1 | AF461: =RC[-11]/SQRT(RC[-6]*RC[-2]) -> 1 | AG461: =RC[-11]/SQRT(RC[-6]*RC[-3]) -> 1 | AH461: =RC[-11]/SQRT(RC[-6]*RC[-4]) -> -1 | AI461: =RC[-11]/SQRT(RC[-6]*RC[-5]) -> -1
A462: 35098 | B462: 北京 | C462: 24 | D462: 优 | E462: 0.5 | F462: 7 | G462: 45 | H462: 61 | I462: 24 | J462: 22 | L462: 2013-06-10T11:00:00.000 | M462: =RC[-8]-R[13]C[-8] -> -6.8333333333333468E-2 | N462: =RC[-8]-R[13]C[-8] -> 2.625 | O462: =RC[-8]-R[13]C[-8] -> 4 | P462: =RC[-8]-R[13]C[-8] -> 15.083333333333336 | Q462: =RC[-8]-R[13]C[-8] -> -6.25 | R462: =RC[-8]-R[13]C[-8] -> 1.75 | T462: =RC[-7]*RC[-2] -> -0.11958333333333357 | U462: =RC[-7]*RC[-3] -> 4.59375 | V462: =RC[-7]*RC[-4] -> 7 | W462: =RC[-7]*RC[-5] -> 26.395833333333336 | X462: =RC[-7]*RC[-6] -> -10.9375 | Y462: =RC[-12]*RC[-12] -> 4.669444444444463E-3 | Z462: =RC[-12]*RC[-12] -> 6.890625 | AA462: =RC[-12]*RC[-12] -> 16 | AB462: =RC[-12]*RC[-12] -> 227.50694444444451 | AC462: =RC[-12]*RC[-12] -> 39.0625 | AD462: =RC[-12]*RC[-12] -> 3.0625 | AE462: =RC[-11]/SQRT(RC[-6]*RC[-1]) -> -1 | AF462: =RC[-11]/SQRT(RC[-6]*RC[-2]) -> 1 | AG462: =RC[-11]/SQRT(RC[-6]*RC[-3]) -> 1 | AH462: =RC[-11]/SQRT(RC[-6]*RC[-4]) -> 1 | AI462: =RC[-11]/SQRT(RC[-6]*RC[-5]) -> -1
A463: 35174 | B463: 北京 | C463: 26 | D463: 优 | E463: 0.44 | F463: 8 | G463: 38 | H463: 84 | I463: 25 | J463: 23 | L463: 2013-06-10T12:00:00.000 | M463: =RC[-8]-R[12]C[-8] -> -0.12833333333333347 | N463: =RC[-8]-R[12]C[-8] -> 3.625 | O463: =RC[-8]-R[12]C[-8] -> -3 | P463: =RC[-8]-R[12]C[-8] -> 38.083333333333336 | Q463: =RC[-8]-R[12]C[-8] -> -5.25 | R463: =RC[-8]-R[12]C[-8] -> 2.75 | T463: =RC[-7]*RC[-2] -> -0.35291666666666704 | U463: =RC[-7]*RC[-3] -> 9.96875 | V463: =RC[-7]*RC[-4] -> -8.25 | W463: =RC[-7]*RC[-5] -> 104.72916666666667 | X463: =RC[-7]*RC[-6] -> -14.4375 | Y463: =RC[-12]*RC[-12] -> 1.6469444444444477E-2 | Z463: =RC[-12]*RC[-12] -> 13.140625 | AA463: =RC[-12]*RC[-12] -> 9 | AB463: =RC[-12]*RC[-12] -> 1450.3402777777781 | AC463: =RC[-12]*RC[-12] -> 27.5625 | AD463: =RC[-12]*RC[-12] -> 7.5625 | AE463: =RC[-11]/SQRT(RC[-6]*RC[-1]) -> -1.0000000000000002 | AF463: =RC[-11]/SQRT(RC[-6]*RC[-2]) -> 1 | AG463: =RC[-11]/SQRT(RC[-6]*RC[-3]) -> -1 | AH463: =RC[-11]/SQRT(RC[-6]*RC[-4]) -> 0.99999999999999989 | AI463: =RC[-11]/SQRT(RC[-6]*RC[-5]) -> -1
A464: 35250 | B464: 北京 | C464: 27 | D464: 优 | E464: 0.42 | F464: 7 | G464: 29 | H464: 97 | I464: 23 | J464: 22 | L464: 2013-06-10T13:00:00.000 | M464: =RC[-8]-R[11]C[-8] -> -0.14833333333333348 | N464: =RC[-8]-R[11]C[-8] -> 2.625 | O464: =RC[-8]-R[11]C[-8] -> -12 | P464: =RC[-8]-R[11]C[-8] -> 51.083333333333336 | Q464: =RC[-8]-R[11]C[-8] -> -7.25 | R464: =RC[-8]-R[11]C[-8] -> 1.75 | T464: =RC[-7]*RC[-2] -> -0.25958333333333361 | U464: =RC[-7]*RC[-3] -> 4.59375 | V464: =RC[-7]*RC[-4] -> -21 | W464: =RC[-7]*RC[-5] -> 89.395833333333343 | X464: =RC[-7]*RC[-6] -> -12.6875 | Y464: =RC[-12]*RC[-12] -> 2.2002777777777822E-2 | Z464: =RC[-12]*RC[-12] -> 6.890625 | AA464: =RC[-12]*RC[-12] -> 144 | AB464: =RC[-12]*RC[-12] -> 2609.5069444444448 | AC464: =RC[-12]*RC[-12] -> 52.5625 | AD464: =RC[-12]*RC[-12] -> 3.0625 | AE464: =RC[-11]/SQRT(RC[-6]*RC[-1]) -> -1 | AF464: =RC[-11]/SQRT(RC[-6]*RC[-2]) -> 1 | AG464: =RC[-11]/SQRT(RC[-6]*RC[-3]) -> -1 | AH464: =RC[-11]/SQRT(RC[-6]*RC[-4]) -> 1 | AI464: =RC[-11]/SQRT(RC[-6]*RC[-5]) -> -1
A465: 35326 | B465: 北京 | C465: 29 | D465: 优 | E465: 0.37 | F465: 5 | G465: 27 | H465: 105 | I465: 18 | J465: 21 | L465: 2013-06-10T14:00:00.000 | M465: =RC[-8]-R[10]C[-8] -> -0.19833333333333347 | N465: =RC[-8]-R[10]C[-8] -> 0.625 | O465: =RC[-8]-R[10]C[-8] -> -14 | P465: =RC[-8]-R[10]C[-8] -> 59.083333333333336 | Q465: =RC[-8]-R[10]C[-8] -> -12.25 | R465: =RC[-8]-R[10]C[-8] -> 0.75 | T465: =RC[-7]*RC[-2] -> -0.1487500000000001 | U465: =RC[-7]*RC[-3] -> 0.46875 | V465: =RC[-7]*RC[-4] -> -10.5 | W465: =RC[-7]*RC[-5] -> 44.3125 | X465: =RC[-7]*RC[-6] -> -9.1875 | Y465: =RC[-12]*RC[-12] -> 3.9336111111111169E-2 | Z465: =RC[-12]*RC[-12] -> 0.390625 | AA465: =RC[-12]*RC[-12] -> 196 | AB465: =RC[-12]*RC[-12] -> 3490.8402777777783 | AC465: =RC[-12]*RC[-12] -> 150.0625 | AD465: =RC[-12]*RC[-12] -> 0.5625 | AE465: =RC[-11]/SQRT(RC[-6]*RC[-1]) -> -1 | AF465: =RC[-11]/SQRT(RC[-6]*RC[-2]) -> 1 | AG465: =RC[-11]/SQRT(RC[-6]*RC[-3]) -> -1 | AH465: =RC[-11]/SQRT(RC[-6]*RC[-4]) -> 1 | AI465: =RC[-11]/SQRT(RC[-6]*RC[-5]) -> -1
A466: 35402 | B466: 北京 | C466: 30 | D466: 优 | E466: 0.31 | F466: 4 | G466: 23 | H466: 104 | I466: 14 | J466: 15 | L466: 2013-06-10T15:00:00.000 | M466: =RC[-8]-R[9]C[-8] -> -0.25833333333333347 | N466: =RC[-8]-R[9]C[-8] -> -0.375 | O466: =RC[-8]-R[9]C[-8] -> -18 | P466: =RC[-8]-R[9]C[-8] -> 58.083333333333336 | Q466: =RC[-8]-R[9]C[-8] -> -16.25 | R466: =RC[-8]-R[9]C[-8] -> -5.25 | T466: =RC[-7]*RC[-2] -> 1.3562500000000006 | U466: =RC[-7]*RC[-3] -> 1.96875 | V466: =RC[-7]*RC[-4] -> 94.5 | W466: =RC[-7]*RC[-5] -> -304.9375 | X466: =RC[-7]*RC[-6] -> 85.3125 | Y466: =RC[-12]*RC[-12] -> 6.6736111111111177E-2 | Z466: =RC[-12]*RC[-12] -> 0.140625 | AA466: =RC[-12]*RC[-12] -> 324 | AB466: =RC[-12]*RC[-12] -> 3373.6736111111113 | AC466: =RC[-12]*RC[-12] -> 264.0625 | AD466: =RC[-12]*RC[-12] -> 27.5625 | AE466: =RC[-11]/SQRT(RC[-6]*RC[-1]) -> 1 | AF466: =RC[-11]/SQRT(RC[-6]*RC[-2]) -> 1 | AG466: =RC[-11]/SQRT(RC[-6]*RC[-3]) -> 1 | AH466: =RC[-11]/SQRT(RC[-6]*RC[-4]) -> -1 | AI466: =RC[-11]/SQRT(RC[-6]*RC[-5]) -> 1
A467: 35478 | B467: 北京 | C467: 32 | D467: 优 | E467: 0.31 | F467: 4 | G467: 23 | H467: 101 | I467: 13 | J467: 10 | L467: 2013-06-10T16:00:00.000 | M467: =RC[-8]-R[8]C[-8] -> -0.25833333333333347 | N467: =RC[-8]-R[8]C[-8] -> -0.375 | O467: =RC[-8]-R[8]C[-8] -> -18 | P467: =RC[-8]-R[8]C[-8] -> 55.083333333333336 | Q467: =RC[-8]-R[8]C[-8] -> -17.25 | R467: =RC[-8]-R[8]C[-8] -> -10.25 | T467: =RC[-7]*RC[-2] -> 2.647916666666668 | U467: =RC[-7]*RC[-3] -> 3.84375 | V467: =RC[-7]*RC[-4] -> 184.5 | W467: =RC[-7]*RC[-5] -> -564.60416666666674 | X467: =RC[-7]*RC[-6] -> 176.8125 | Y467: =RC[-12]*RC[-12] -> 6.6736111111111177E-2 | Z467: =RC[-12]*RC[-12] -> 0.140625 | AA467: =RC[-12]*RC[-12] -> 324 | AB467: =RC[-12]*RC[-12] -> 3034.1736111111113 | AC467: =RC[-12]*RC[-12] -> 297.5625 | AD467: =RC[-12]*RC[-12] -> 105.0625 | AE467: =RC[-11]/SQRT(RC[-6]*RC[-1]) -> 1 | AF467: =RC[-11]/SQRT(RC[-6]*RC[-2]) -> 1 | AG467: =RC[-11]/SQRT(RC[-6]*RC[-3]) -> 1 | AH467: =RC[-11]/SQRT(RC[-6]*RC[-4]) -> -1.0000000000000002 | AI467: =RC[-11]/SQRT(RC[-6]*RC[-5]) -> 1
A468: 35554 | B468: 北京 | C468: 36 | D468: 优 | E468: 0.31 | F468: 3 | G468: 28 | H468: 98 | I468: 18 | J468: 12 | L468: 2013-06-10T17:00:00.000 | M468: =RC[-8]-R[7]C[-8] -> -0.25833333333333347 | N468: =RC[-8]-R[7]C[-8] -> -1.375 | O468: =RC[-8]-R[7]C[-8] -> -13 | P468: =RC[-8]-R[7]C[-8] -> 52.083333333333336 | Q468: =RC[-8]-R[7]C[-8] -> -12.25 | R468: =RC[-8]-R[7]C[-8] -> -8.25 | T468: =RC[-7]*RC[-2] -> 2.131250000000001 | U468: =RC[-7]*RC[-3] -> 11.34375 | V468: =RC[-7]*RC[-4] -> 107.25 | W468: =RC[-7]*RC[-5] -> -429.6875 | X468: =RC[-7]*RC[-6] -> 101.0625 | Y468: =RC[-12]*RC[-12] -> 6.6736111111111177E-2 | Z468: =RC[-12]*RC[-12] -> 1.890625 | AA468: =RC[-12]*RC[-12] -> 169 | AB468: =RC[-12]*RC[-12] -> 2712.6736111111113 | AC468: =RC[-12]*RC[-12] -> 150.0625 | AD468: =RC[-12]*RC[-12] -> 68.0625 | AE468: =RC[-11]/SQRT(RC[-6]*RC[-1]) -> 1 | AF468: =RC[-11]/SQRT(RC[-6]*RC[-2]) -> 1 | AG468: =RC[-11]/SQRT(RC[-6]*RC[-3]) -> 1 | AH468: =RC[-11]/SQRT(RC[-6]*RC[-4]) -> -1 | AI468: =RC[-11]/SQRT(RC[-6]*RC[-5]) -> 1
A469: 35630 | B469: 北京 | C469: 40 | D469: 优 | E469: 0.35 | F469: 4 | G469: 36 | H469: 100 | I469: 68 | J469: 18 | L469: 2013-06-10T18:00:00.000 | M469: =RC[-8]-R[6]C[-8] -> -0.21833333333333349 | N469: =RC[-8]-R[6]C[-8] -> -0.375 | O469: =RC[-8]-R[6]C[-8] -> -5 | P469: =RC[-8]-R[6]C[-8] -> 54.083333333333336 | Q469: =RC[-8]-R[6]C[-8] -> 37.75 | R469: =RC[-8]-R[6]C[-8] -> -2.25 | T469: =RC[-7]*RC[-2] -> 0.49125000000000035 | U469: =RC[-7]*RC[-3] -> 0.84375 | V469: =RC[-7]*RC[-4] -> 11.25 | W469: =RC[-7]*RC[-5] -> -121.6875 | X469: =RC[-7]*RC[-6] -> -84.9375 | Y469: =RC[-12]*RC[-12] -> 4.7669444444444514E-2 | Z469: =RC[-12]*RC[-12] -> 0.140625 | AA469: =RC[-12]*RC[-12] -> 25 | AB469: =RC[-12]*RC[-12] -> 2925.0069444444448 | AC469: =RC[-12]*RC[-12] -> 1425.0625 | AD469: =RC[-12]*RC[-12] -> 5.0625 | AE469: =RC[-11]/SQRT(RC[-6]*RC[-1]) -> 1 | AF469: =RC[-11]/SQRT(RC[-6]*RC[-2]) -> 1 | AG469: =RC[-11]/SQRT(RC[-6]*RC[-3]) -> 1 | AH469: =RC[-11]/SQRT(RC[-6]*RC[-4]) -> -0.99999999999999989 | AI469: =RC[-11]/SQRT(RC[-6]*RC[-5]) -> -1
A470: 35706 | B470: 北京 | C470: 43 | D470: 优 | E470: 0.4 | F470: 4 | G470: 41 | H470: 90 | I470: 58 | J470: 24 | L470: 2013-06-10T19:00:00.000 | M470: =RC[-8]-R[5]C[-8] -> -0.16833333333333345 | N470: =RC[-8]-R[5]C[-8] -> -0.375 | O470: =RC[-8]-R[5]C[-8] -> 0 | P470: =RC[-8]-R[5]C[-8] -> 44.083333333333336 | Q470: =RC[-8]-R[5]C[-8] -> 27.75 | R470: =RC[-8]-R[5]C[-8] -> 3.75 | T470: =RC[-7]*RC[-2] -> -0.63125000000000042 | U470: =RC[-7]*RC[-3] -> -1.40625 | V470: =RC[-7]*RC[-4] -> 0 | W470: =RC[-7]*RC[-5] -> 165.3125 | X470: =RC[-7]*RC[-6] -> 104.0625 | Y470: =RC[-12]*RC[-12] -> 2.8336111111111149E-2 | Z470: =RC[-12]*RC[-12] -> 0.140625 | AA470: =RC[-12]*RC[-12] -> 0 | AB470: =RC[-12]*RC[-12] -> 1943.3402777777781 | AC470: =RC[-12]*RC[-12] -> 770.0625 | AD470: =RC[-12]*RC[-12] -> 14.0625 | AE470: =RC[-11]/SQRT(RC[-6]*RC[-1]) -> -1 | AF470: =RC[-11]/SQRT(RC[-6]*RC[-2]) -> -1 | AG470: =RC[-11]/SQRT(RC[-6]*RC[-3]) -> #DIV/0! | AH470: =RC[-11]/SQRT(RC[-6]*RC[-4]) -> 1 | AI470: =RC[-11]/SQRT(RC[-6]*RC[-5]) -> 1
A471: 35782 | B471: 北京 | C471: 43 | D471: 优 | E471: 0.4 | F471: 4 | G471: 45 | H471: 74 | I471: 59 | J471: 28 | L471: 2013-06-10T20:00:00.000 | M471: =RC[-8]-R[4]C[-8] -> -0.16833333333333345 | N471: =RC[-8]-R[4]C[-8] -> -0.375 | O471: =RC[-8]-R[4]C[-8] -> 4 | P471: =RC[-8]-R[4]C[-8] -> 28.083333333333336 | Q471: =RC[-8]-R[4]C[-8] -> 28.75 | R471: =RC[-8]-R[4]C[-8] -> 7.75 | T471: =RC[-7]*RC[-2] -> -1.3045833333333343 | U471: =RC[-7]*RC[-3] -> -2.90625 | V471: =RC[-7]*RC[-4] -> 31 | W471: =RC[-7]*RC[-5] -> 217.64583333333334 | X471: =RC[-7]*RC[-6] -> 222.8125 | Y471: =RC[-12]*RC[-12] -> 2.8336111111111149E-2 | Z471: =RC[-12]*RC[-12] -> 0.140625 | AA471: =RC[-12]*RC[-12] -> 16 | AB471: =RC[-12]*RC[-12] -> 788.6736111111112 | AC471: =RC[-12]*RC[-12] -> 826.5625 | AD471: =RC[-12]*RC[-12] -> 60.0625 | AE471: =RC[-11]/SQRT(RC[-6]*RC[-1]) -> -1.0000000000000002 | AF471: =RC[-11]/SQRT(RC[-6]*RC[-2]) -> -1 | AG471: =RC[-11]/SQRT(RC[-6]*RC[-3]) -> 1 | AH471: =RC[-11]/SQRT(RC[-6]*RC[-4]) -> 1 | AI471: =RC[-11]/SQRT(RC[-6]*RC[-5]) -> 1
A472: 35858 | B472: 北京 | C472: 42 | D472: 优 | E472: 0.46 | F472: 4 | G472: 55 | H472: 54 | I472: 62 | J472: 36 | L472: 2013-06-10T21:00:00.000 | M472: =RC[-8]-R[3]C[-8] -> -0.10833333333333345 | N472: =RC[-8]-R[3]C[-8] -> -0.375 | O472: =RC[-8]-R[3]C[-8] -> 14 | P472: =RC[-8]-R[3]C[-8] -> 8.0833333333333357 | Q472: =RC[-8]-R[3]C[-8] -> 31.75 | R472: =RC[-8]-R[3]C[-8] -> 15.75 | T472: =RC[-7]*RC[-2] -> -1.7062500000000018 | U472: =RC[-7]*RC[-3] -> -5.90625 | V472: =RC[-7]*RC[-4] -> 220.5 | W472: =RC[-7]*RC[-5] -> 127.31250000000004 | X472: =RC[-7]*RC[-6] -> 500.0625 | Y472: =RC[-12]*RC[-12] -> 1.1736111111111136E-2 | Z472: =RC[-12]*RC[-12] -> 0.140625 | AA472: =RC[-12]*RC[-12] -> 196 | AB472: =RC[-12]*RC[-12] -> 65.340277777777814 | AC472: =RC[-12]*RC[-12] -> 1008.0625 | AD472: =RC[-12]*RC[-12] -> 248.0625 | AE472: =RC[-11]/SQRT(RC[-6]*RC[-1]) -> -1 | AF472: =RC[-11]/SQRT(RC[-6]*RC[-2]) -> -1 | AG472: =RC[-11]/SQRT(RC[-6]*RC[-3]) -> 1 | AH472: =RC[-11]/SQRT(RC[-6]*RC[-4]) -> 1 | AI472: =RC[-11]/SQRT(RC[-6]*RC[-5]) -> 1
A473: 35934 | B473: 北京 | C473: 40 | D473: 优 | E473: 0.5 | F473: 4 | G473: 61 | H473: 39 | I473: 60 | J473: 33 | L473: 2013-06-10T22:00:00.000 | M473: =RC[-8]-R[2]C[-8] -> -6.8333333333333468E-2 | N473: =RC[-8]-R[2]C[-8] -> -0.375 | O473: =RC[-8]-R[2]C[-8] -> 20 | P473: =RC[-8]-R[2]C[-8] -> -6.9166666666666643 | Q473: =RC[-8]-R[2]C[-8] -> 29.75 | R473: =RC[-8]-R[2]C[-8] -> 12.75 | T473: =RC[-7]*RC[-2] -> -0.87125000000000175 | U473: =RC[-7]*RC[-3] -> -4.78125 | V473: =RC[-7]*RC[-4] -> 255 | W473: =RC[-7]*RC[-5] -> -88.187499999999972 | X473: =RC[-7]*RC[-6] -> 379.3125 | Y473: =RC[-12]*RC[-12] -> 4.669444444444463E-3 | Z473: =RC[-12]*RC[-12] -> 0.140625 | AA473: =RC[-12]*RC[-12] -> 400 | AB473: =RC[-12]*RC[-12] -> 47.840277777777743 | AC473: =RC[-12]*RC[-12] -> 885.0625 | AD473: =RC[-12]*RC[-12] -> 162.5625 | AE473: =RC[-11]/SQRT(RC[-6]*RC[-1]) -> -1 | AF473: =RC[-11]/SQRT(RC[-6]*RC[-2]) -> -1 | AG473: =RC[-11]/SQRT(RC[-6]*RC[-3]) -> 1 | AH473: =RC[-11]/SQRT(RC[-6]*RC[-4]) -> -1 | AI473: =RC[-11]/SQRT(RC[-6]*RC[-5]) -> 1
A474: 36010 | B474: 北京 | C474: 37 | D474: 优 | E474: 0.54 | F474: 4 | G474: 56 | H474: 28 | I474: 50 | J474: 31 | L474: 2013-06-10T23:00:00.000 | M474: =RC[-8]-R[1]C[-8] -> -2.8333333333333433E-2 | N474: =RC[-8]-R[1]C[-8] -> -0.375 | O474: =RC[-8]-R[1]C[-8] -> 15 | P474: =RC[-8]-R[1]C[-8] -> -17.916666666666664 | Q474: =RC[-8]-R[1]C[-8] -> 19.75 | R474: =RC[-8]-R[1]C[-8] -> 10.75 | T474: =RC[-7]*RC[-2] -> -0.30458333333333443 | U474: =RC[-7]*RC[-3] -> -4.03125 | V474: =RC[-7]*RC[-4] -> 161.25 | W474: =RC[-7]*RC[-5] -> -192.60416666666663 | X474: =RC[-7]*RC[-6] -> 212.3125 | Y474: =RC[-12]*RC[-12] -> 8.0277777777778344E-4 | Z474: =RC[-12]*RC[-12] -> 0.140625 | AA474: =RC[-12]*RC[-12] -> 225 | AB474: =RC[-12]*RC[-12] -> 321.00694444444434 | AC474: =RC[-12]*RC[-12] -> 390.0625 | AD474: =RC[-12]*RC[-12] -> 115.5625 | AE474: =RC[-11]/SQRT(RC[-6]*RC[-1]) -> -1 | AF474: =RC[-11]/SQRT(RC[-6]*RC[-2]) -> -1 | AG474: =RC[-11]/SQRT(RC[-6]*RC[-3]) -> 1 | AH474: =RC[-11]/SQRT(RC[-6]*RC[-4]) -> -0.99999999999999989 | AI474: =RC[-11]/SQRT(RC[-6]*RC[-5]) -> 1
E475: =AVERAGE(R[-24]C:R[-1]C) -> 0.56833333333333347 | F475: =AVERAGE(R[-24]C:R[-1]C) -> 4.375 | G475: =AVERAGE(R[-24]C:R[-1]C) -> 41 | H475: =AVERAGE(R[-24]C:R[-1]C) -> 45.916666666666664 | I475: =AVERAGE(R[-24]C:R[-1]C) -> 30.25 | J475: =AVERAGE(R[-24]C:R[-1]C) -> 20.25 | M475: =RC[-8]-RC[-8] -> 0 | N475: =RC[-8]-RC[-8] -> 0 | O475: =RC[-8]-RC[-8] -> 0 | P475: =RC[-8]-RC[-8] -> 0 | Q475: =RC[-8]-RC[-8] -> 0 | R475: =RC[-8]-RC[-8] -> 0 | T475: =SUM(R[-24]C:R[-1]C) -> -3.8699999999999992 | U475: =SUM(R[-24]C:R[-1]C) -> 46.75 | V475: =SUM(R[-24]C:R[-1]C) -> 1184 | W475: =SUM(R[-24]C:R[-1]C) -> 536.49999999999955 | X475: =SUM(R[-24]C:R[-1]C) -> 2113.5 | Y475: =SUM(R[-24]C:R[-1]C) -> 0.8423333333333336 | Z475: =SUM(R[-24]C:R[-1]C) -> 35.625 | AA475: =SUM(R[-24]C:R[-1]C) -> 2566 | AB475: =SUM(R[-24]C:R[-1]C) -> 41003.833333333343 | AC475: =SUM(R[-24]C:R[-1]C) -> 7400.5 | AD475: =SUM(R[-24]C:R[-1]C) -> 1154.5 | AE475: =RC[-11]/SQRT(RC[-6]*RC[-1]) -> -0.1241000632348009 | AF475: =RC[-11]/SQRT(RC[-6]*RC[-2]) -> 0.23051925644895424 | AG475: =RC[-11]/SQRT(RC[-6]*RC[-3]) -> 0.6879017396387378 | AH475: =RC[-11]/SQRT(RC[-6]*RC[-4]) -> 7.7975923661162169E-2 | AI475: =RC[-11]/SQRT(RC[-6]*RC[-5]) -> 0.72306069130767792
A476: 36086 | B476: 北京 | C476: 35 | D476: 优 | E476: 0.51 | F476: 4 | G476: 49 | H476: 22 | I476: 59 | J476: 30 | L476: 2013-06-11T00:00:00.000 | M476: =RC[-8]-R[24]C[-8] -> -6.5833333333333299E-2 | N476: =RC[-8]-R[24]C[-8] -> -1.208333333333333 | O476: =RC[-8]-R[24]C[-8] -> 3.5 | P476: =RC[-8]-R[24]C[-8] -> -46.958333333333329 | Q476: =RC[-8]-R[24]C[-8] -> -16.375 | R476: =RC[-8]-R[24]C[-8] -> -20.25 | T476: =RC[-7]*RC[-2] -> 1.3331249999999992 | U476: =RC[-7]*RC[-3] -> 24.468749999999993 | V476: =RC[-7]*RC[-4] -> -70.875 | W476: =RC[-7]*RC[-5] -> 950.90624999999989 | X476: =RC[-7]*RC[-6] -> 331.59375 | Y476: =RC[-12]*RC[-12] -> 4.3340277777777735E-3 | Z476: =RC[-12]*RC[-12] -> 1.4600694444444438 | AA476: =RC[-12]*RC[-12] -> 12.25 | AB476: =RC[-12]*RC[-12] -> 2205.0850694444439 | AC476: =RC[-12]*RC[-12] -> 268.140625 | AD476: =RC[-12]*RC[-12] -> 410.0625 | AE476: =RC[-11]/SQRT(RC[-6]*RC[-1]) -> 0.99999999999999978 | AF476: =RC[-11]/SQRT(RC[-6]*RC[-2]) -> 0.99999999999999989 | AG476: =RC[-11]/SQRT(RC[-6]*RC[-3]) -> -1 | AH476: =RC[-11]/SQRT(RC[-6]*RC[-4]) -> 1 | AI476: =RC[-11]/SQRT(RC[-6]*RC[-5]) -> 1
A477: 36162 | B477: 北京 | C477: 36 | D477: 优 | E477: 0.48 | F477: 4 | G477: 53 | H477: 17 | I477: 59 | J477: 30 | L477: 2013-06-11T01:00:00.000 | M477: =RC[-8]-R[23]C[-8] -> -9.5833333333333326E-2 | N477: =RC[-8]-R[23]C[-8] -> -1.208333333333333 | O477: =RC[-8]-R[23]C[-8] -> 7.5 | P477: =RC[-8]-R[23]C[-8] -> -51.958333333333329 | Q477: =RC[-8]-R[23]C[-8] -> -16.375 | R477: =RC[-8]-R[23]C[-8] -> -20.25 | T477: =RC[-7]*RC[-2] -> 1.9406249999999998 | U477: =RC[-7]*RC[-3] -> 24.468749999999993 | V477: =RC[-7]*RC[-4] -> -151.875 | W477: =RC[-7]*RC[-5] -> 1052.15625 | X477: =RC[-7]*RC[-6] -> 331.59375 | Y477: =RC[-12]*RC[-12] -> 9.1840277777777771E-3 | Z477: =RC[-12]*RC[-12] -> 1.4600694444444438 | AA477: =RC[-12]*RC[-12] -> 56.25 | AB477: =RC[-12]*RC[-12] -> 2699.6684027777774 | AC477: =RC[-12]*RC[-12] -> 268.140625 | AD477: =RC[-12]*RC[-12] -> 410.0625 | AE477: =RC[-11]/SQRT(RC[-6]*RC[-1]) -> 0.99999999999999989 | AF477: =RC[-11]/SQRT(RC[-6]*RC[-2]) -> 0.99999999999999989 | AG477: =RC[-11]/SQRT(RC[-6]*RC[-3]) -> -1 | AH477: =RC[-11]/SQRT(RC[-6]*RC[-4]) -> 1 | AI477: =RC[-11]/SQRT(RC[-6]*RC[-5]) -> 1
A478: 36238 | B478: 北京 | C478: 38 | D478: 优 | E478: 0.53 | F478: 4 | G478: 54 | H478: 14 | I478: 61 | J478: 32 | L478: 2013-06-11T02:00:00.000 | M478: =RC[-8]-R[22]C[-8] -> -4.5833333333333282E-2 | N478: =RC[-8]-R[22]C[-8] -> -1.208333333333333 | O478: =RC[-8]-R[22]C[-8] -> 8.5 | P478: =RC[-8]-R[22]C[-8] -> -54.958333333333329 | Q478: =RC[-8]-R[22]C[-8] -> -14.375 | R478: =RC[-8]-R[22]C[-8] -> -18.25 | T478: =RC[-7]*RC[-2] -> 0.83645833333333242 | U478: =RC[-7]*RC[-3] -> 22.052083333333329 | V478: =RC[-7]*RC[-4] -> -155.125 | W478: =RC[-7]*RC[-5] -> 1002.9895833333333 | X478: =RC[-7]*RC[-6] -> 262.34375 | Y478: =RC[-12]*RC[-12] -> 2.1006944444444398E-3 | Z478: =RC[-12]*RC[-12] -> 1.4600694444444438 | AA478: =RC[-12]*RC[-12] -> 72.25 | AB478: =RC[-12]*RC[-12] -> 3020.4184027777774 | AC478: =RC[-12]*RC[-12] -> 206.640625 | AD478: =RC[-12]*RC[-12] -> 333.0625 | AE478: =RC[-11]/SQRT(RC[-6]*RC[-1]) -> 1 | AF478: =RC[-11]/SQRT(RC[-6]*RC[-2]) -> 1 | AG478: =RC[-11]/SQRT(RC[-6]*RC[-3]) -> -1 | AH478: =RC[-11]/SQRT(RC[-6]*RC[-4]) -> 1 | AI478: =RC[-11]/SQRT(RC[-6]*RC[-5]) -> 1
A479: 36314 | B479: 北京 | C479: 39 | D479: 优 | E479: 0.55000000000000004 | F479: 4 | G479: 52 | H479: 10 | I479: 55 | J479: 38 | L479: 2013-06-11T03:00:00.000 | M479: =RC[-8]-R[21]C[-8] -> -2.5833333333333264E-2 | N479: =RC[-8]-R[21]C[-8] -> -1.208333333333333 | O479: =RC[-8]-R[21]C[-8] -> 6.5 | P479: =RC[-8]-R[21]C[-8] -> -58.958333333333329 | Q479: =RC[-8]-R[21]C[-8] -> -20.375 | R479: =RC[-8]-R[21]C[-8] -> -12.25 | T479: =RC[-7]*RC[-2] -> 0.31645833333333251 | U479: =RC[-7]*RC[-3] -> 14.80208333333333 | V479: =RC[-7]*RC[-4] -> -79.625 | W479: =RC[-7]*RC[-5] -> 722.23958333333326 | X479: =RC[-7]*RC[-6] -> 249.59375 | Y479: =RC[-12]*RC[-12] -> 6.6736111111110751E-4 | Z479: =RC[-12]*RC[-12] -> 1.4600694444444438 | AA479: =RC[-12]*RC[-12] -> 42.25 | AB479: =RC[-12]*RC[-12] -> 3476.0850694444439 | AC479: =RC[-12]*RC[-12] -> 415.140625 | AD479: =RC[-12]*RC[-12] -> 150.0625 | AE479: =RC[-11]/SQRT(RC[-6]*RC[-1]) -> 1.0000000000000002 | AF479: =RC[-11]/SQRT(RC[-6]*RC[-2]) -> 1 | AG479: =RC[-11]/SQRT(RC[-6]*RC[-3]) -> -1 | AH479: =RC[-11]/SQRT(RC[-6]*RC[-4]) -> 1 | AI479: =RC[-11]/SQRT(RC[-6]*RC[-5]) -> 1
A480: 36390 | B480: 北京 | C480: 40 | D480: 优 | E480: 0.57999999999999996 | F480: 5 | G480: 66 | H480: 6 | I480: 63 | J480: 40 | L480: 2013-06-11T04:00:00.000 | M480: =RC[-8]-R[20]C[-8] -> 4.1666666666666519E-3 | N480: =RC[-8]-R[20]C[-8] -> -0.20833333333333304 | O480: =RC[-8]-R[20]C[-8] -> 20.5 | P480: =RC[-8]-R[20]C[-8] -> -62.958333333333329 | Q480: =RC[-8]-R[20]C[-8] -> -12.375 | R480: =RC[-8]-R[20]C[-8] -> -10.25 | T480: =RC[-7]*RC[-2] -> -4.2708333333333182E-2 | U480: =RC[-7]*RC[-3] -> 2.1354166666666634 | V480: =RC[-7]*RC[-4] -> -210.125 | W480: =RC[-7]*RC[-5] -> 645.32291666666663 | X480: =RC[-7]*RC[-6] -> 126.84375 | Y480: =RC[-12]*RC[-12] -> 1.7361111111110989E-5 | Z480: =RC[-12]*RC[-12] -> 4.3402777777777651E-2 | AA480: =RC[-12]*RC[-12] -> 420.25 | AB480: =RC[-12]*RC[-12] -> 3963.7517361111104 | AC480: =RC[-12]*RC[-12] -> 153.140625 | AD480: =RC[-12]*RC[-12] -> 105.0625 | AE480: =RC[-11]/SQRT(RC[-6]*RC[-1]) -> -1 | AF480: =RC[-11]/SQRT(RC[-6]*RC[-2]) -> 1 | AG480: =RC[-11]/SQRT(RC[-6]*RC[-3]) -> -1 | AH480: =RC[-11]/SQRT(RC[-6]*RC[-4]) -> 1 | AI480: =RC[-11]/SQRT(RC[-6]*RC[-5]) -> 1
A481: 36466 | B481: 北京 | C481: 42 | D481: 优 | E481: 0.64 | F481: 4 | G481: 59 | H481: 7 | I481: 74 | J481: 42 | L481: 2013-06-11T05:00:00.000 | M481: =RC[-8]-R[19]C[-8] -> 6.4166666666666705E-2 | N481: =RC[-8]-R[19]C[-8] -> -1.208333333333333 | O481: =RC[-8]-R[19]C[-8] -> 13.5 | P481: =RC[-8]-R[19]C[-8] -> -61.958333333333329 | Q481: =RC[-8]-R[19]C[-8] -> -1.375 | R481: =RC[-8]-R[19]C[-8] -> -8.25 | T481: =RC[-7]*RC[-2] -> -0.52937500000000037 | U481: =RC[-7]*RC[-3] -> 9.9687499999999982 | V481: =RC[-7]*RC[-4] -> -111.375 | W481: =RC[-7]*RC[-5] -> 511.15624999999994 | X481: =RC[-7]*RC[-6] -> 11.34375 | Y481: =RC[-12]*RC[-12] -> 4.1173611111111159E-3 | Z481: =RC[-12]*RC[-12] -> 1.4600694444444438 | AA481: =RC[-12]*RC[-12] -> 182.25 | AB481: =RC[-12]*RC[-12] -> 3838.8350694444439 | AC481: =RC[-12]*RC[-12] -> 1.890625 | AD481: =RC[-12]*RC[-12] -> 68.0625 | AE481: =RC[-11]/SQRT(RC[-6]*RC[-1]) -> -1.0000000000000002 | AF481: =RC[-11]/SQRT(RC[-6]*RC[-2]) -> 1 | AG481: =RC[-11]/SQRT(RC[-6]*RC[-3]) -> -1 | AH481: =RC[-11]/SQRT(RC[-6]*RC[-4]) -> 1 | AI481: =RC[-11]/SQRT(RC[-6]*RC[-5]) -> 1
A482: 36542 | B482: 北京 | C482: 45 | D482: 优 | E482: 0.67 | F482: 5 | G482: 59 | H482: 5 | I482: 78 | J482: 52 | L482: 2013-06-11T06:00:00.000 | M482: =RC[-8]-R[18]C[-8] -> 9.4166666666666732E-2 | N482: =RC[-8]-R[18]C[-8] -> -0.20833333333333304 | O482: =RC[-8]-R[18]C[-8] -> 13.5 | P482: =RC[-8]-R[18]C[-8] -> -63.958333333333329 | Q482: =RC[-8]-R[18]C[-8] -> 2.625 | R482: =RC[-8]-R[18]C[-8] -> 1.75 | T482: =RC[-7]*RC[-2] -> 0.16479166666666678 | U482: =RC[-7]*RC[-3] -> -0.36458333333333282 | V482: =RC[-7]*RC[-4] -> 23.625 | W482: =RC[-7]*RC[-5] -> -111.92708333333333 | X482: =RC[-7]*RC[-6] -> 4.59375 | Y482: =RC[-12]*RC[-12] -> 8.8673611111111227E-3 | Z482: =RC[-12]*RC[-12] -> 4.3402777777777651E-2 | AA482: =RC[-12]*RC[-12] -> 182.25 | AB482: =RC[-12]*RC[-12] -> 4090.6684027777774 | AC482: =RC[-12]*RC[-12] -> 6.890625 | AD482: =RC[-12]*RC[-12] -> 3.0625 | AE482: =RC[-11]/SQRT(RC[-6]*RC[-1]) -> 1 | AF482: =RC[-11]/SQRT(RC[-6]*RC[-2]) -> -1 | AG482: =RC[-11]/SQRT(RC[-6]*RC[-3]) -> 1 | AH482: =RC[-11]/SQRT(RC[-6]*RC[-4]) -> -1 | AI482: =RC[-11]/SQRT(RC[-6]*RC[-5]) -> 1
A483: 36618 | B483: 北京 | C483: 47 | D483: 优 | E483: 0.63 | F483: 5 | G483: 52 | H483: 9 | I483: 82 | J483: 53 | L483: 2013-06-11T07:00:00.000 | M483: =RC[-8]-R[17]C[-8] -> 5.4166666666666696E-2 | N483: =RC[-8]-R[17]C[-8] -> -0.20833333333333304 | O483: =RC[-8]-R[17]C[-8] -> 6.5 | P483: =RC[-8]-R[17]C[-8] -> -59.958333333333329 | Q483: =RC[-8]-R[17]C[-8] -> 6.625 | R483: =RC[-8]-R[17]C[-8] -> 2.75 | T483: =RC[-7]*RC[-2] -> 0.14895833333333341 | U483: =RC[-7]*RC[-3] -> -0.57291666666666585 | V483: =RC[-7]*RC[-4] -> 17.875 | W483: =RC[-7]*RC[-5] -> -164.88541666666666 | X483: =RC[-7]*RC[-6] -> 18.21875 | Y483: =RC[-12]*RC[-12] -> 2.9340277777777811E-3 | Z483: =RC[-12]*RC[-12] -> 4.3402777777777651E-2 | AA483: =RC[-12]*RC[-12] -> 42.25 | AB483: =RC[-12]*RC[-12] -> 3595.0017361111104 | AC483: =RC[-12]*RC[-12] -> 43.890625 | AD483: =RC[-12]*RC[-12] -> 7.5625 | AE483: =RC[-11]/SQRT(RC[-6]*RC[-1]) -> 1 | AF483: =RC[-11]/SQRT(RC[-6]*RC[-2]) -> -1 | AG483: =RC[-11]/SQRT(RC[-6]*RC[-3]) -> 1 | AH483: =RC[-11]/SQRT(RC[-6]*RC[-4]) -> -1 | AI483: =RC[-11]/SQRT(RC[-6]*RC[-5]) -> 1
A484: 36694 | B484: 北京 | C484: 49 | D484: 优 | E484: 0.7 | F484: 6 | G484: 60 | H484: 13 | I484: 97 | J484: 58 | L484: 2013-06-11T08:00:00.000 | M484: =RC[-8]-R[16]C[-8] -> 0.12416666666666665 | N484: =RC[-8]-R[16]C[-8] -> 0.79166666666666696 | O484: =RC[-8]-R[16]C[-8] -> 14.5 | P484: =RC[-8]-R[16]C[-8] -> -55.958333333333329 | Q484: =RC[-8]-R[16]C[-8] -> 21.625 | R484: =RC[-8]-R[16]C[-8] -> 7.75 | T484: =RC[-7]*RC[-2] -> 0.96229166666666655 | U484: =RC[-7]*RC[-3] -> 6.1354166666666687 | V484: =RC[-7]*RC[-4] -> 112.375 | W484: =RC[-7]*RC[-5] -> -433.67708333333331 | X484: =RC[-7]*RC[-6] -> 167.59375 | Y484: =RC[-12]*RC[-12] -> 1.5417361111111106E-2 | Z484: =RC[-12]*RC[-12] -> 0.6267361111111116 | AA484: =RC[-12]*RC[-12] -> 210.25 | AB484: =RC[-12]*RC[-12] -> 3131.3350694444439 | AC484: =RC[-12]*RC[-12] -> 467.640625 | AD484: =RC[-12]*RC[-12] -> 60.0625 | AE484: =RC[-11]/SQRT(RC[-6]*RC[-1]) -> 1 | AF484: =RC[-11]/SQRT(RC[-6]*RC[-2]) -> 0.99999999999999989 | AG484: =RC[-11]/SQRT(RC[-6]*RC[-3]) -> 1 | AH484: =RC[-11]/SQRT(RC[-6]*RC[-4]) -> -1 | AI484: =RC[-11]/SQRT(RC[-6]*RC[-5]) -> 1
A485: 36770 | B485: 北京 | C485: 51 | D485: 良 | E485: 0.65 | F485: 8 | G485: 57 | H485: 33 | I485: 92 | J485: 62 | L485: 2013-06-11T09:00:00.000 | M485: =RC[-8]-R[15]C[-8] -> 7.4166666666666714E-2 | N485: =RC[-8]-R[15]C[-8] -> 2.791666666666667 | O485: =RC[-8]-R[15]C[-8] -> 11.5 | P485: =RC[-8]-R[15]C[-8] -> -35.958333333333329 | Q485: =RC[-8]-R[15]C[-8] -> 16.625 | R485: =RC[-8]-R[15]C[-8] -> 11.75 | T485: =RC[-7]*RC[-2] -> 0.87145833333333389 | U485: =RC[-7]*RC[-3] -> 32.802083333333336 | V485: =RC[-7]*RC[-4] -> 135.125 | W485: =RC[-7]*RC[-5] -> -422.51041666666663 | X485: =RC[-7]*RC[-6] -> 195.34375 | Y485: =RC[-12]*RC[-12] -> 5.5006944444444513E-3 | Z485: =RC[-12]*RC[-12] -> 7.7934027777777795 | AA485: =RC[-12]*RC[-12] -> 132.25 | AB485: =RC[-12]*RC[-12] -> 1293.0017361111109 | AC485: =RC[-12]*RC[-12] -> 276.390625 | AD485: =RC[-12]*RC[-12] -> 138.0625 | AE485: =RC[-11]/SQRT(RC[-6]*RC[-1]) -> 1 | AF485: =RC[-11]/SQRT(RC[-6]*RC[-2]) -> 1 | AG485: =RC[-11]/SQRT(RC[-6]*RC[-3]) -> 1 | AH485: =RC[-11]/SQRT(RC[-6]*RC[-4]) -> -1 | AI485: =RC[-11]/SQRT(RC[-6]*RC[-5]) -> 1
A486: 36846 | B486: 北京 | C486: 53 | D486: 良 | E486: 0.57999999999999996 | F486: 10 | G486: 49 | H486: 65 | I486: 87 | J486: 63 | L486: 2013-06-11T10:00:00.000 | M486: =RC[-8]-R[14]C[-8] -> 4.1666666666666519E-3 | N486: =RC[-8]-R[14]C[-8] -> 4.791666666666667 | O486: =RC[-8]-R[14]C[-8] -> 3.5 | P486: =RC[-8]-R[14]C[-8] -> -3.9583333333333286 | Q486: =RC[-8]-R[14]C[-8] -> 11.625 | R486: =RC[-8]-R[14]C[-8] -> 12.75 | T486: =RC[-7]*RC[-2] -> 5.3124999999999811E-2 | U486: =RC[-7]*RC[-3] -> 61.093750000000007 | V486: =RC[-7]*RC[-4] -> 44.625 | W486: =RC[-7]*RC[-5] -> -50.468749999999943 | X486: =RC[-7]*RC[-6] -> 148.21875 | Y486: =RC[-12]*RC[-12] -> 1.7361111111110989E-5 | Z486: =RC[-12]*RC[-12] -> 22.960069444444446 | AA486: =RC[-12]*RC[-12] -> 12.25 | AB486: =RC[-12]*RC[-12] -> 15.668402777777739 | AC486: =RC[-12]*RC[-12] -> 135.140625 | AD486: =RC[-12]*RC[-12] -> 162.5625 | AE486: =RC[-11]/SQRT(RC[-6]*RC[-1]) -> 1 | AF486: =RC[-11]/SQRT(RC[-6]*RC[-2]) -> 1 | AG486: =RC[-11]/SQRT(RC[-6]*RC[-3]) -> 1 | AH486: =RC[-11]/SQRT(RC[-6]*RC[-4]) -> -1.0000000000000002 | AI486: =RC[-11]/SQRT(RC[-6]*RC[-5]) -> 1
A487: 36922 | B487: 北京 | C487: 54 | D487: 良 | E487: 0.57999999999999996 | F487: 11 | G487: 51 | H487: 96 | I487: 95 | J487: 74 | L487: 2013-06-11T11:00:00.000 | M487: =RC[-8]-R[13]C[-8] -> 4.1666666666666519E-3 | N487: =RC[-8]-R[13]C[-8] -> 5.791666666666667 | O487: =RC[-8]-R[13]C[-8] -> 5.5 | P487: =RC[-8]-R[13]C[-8] -> 27.041666666666671 | Q487: =RC[-8]-R[13]C[-8] -> 19.625 | R487: =RC[-8]-R[13]C[-8] -> 23.75 | T487: =RC[-7]*RC[-2] -> 9.8958333333332982E-2 | U487: =RC[-7]*RC[-3] -> 137.55208333333334 | V487: =RC[-7]*RC[-4] -> 130.625 | W487: =RC[-7]*RC[-5] -> 642.23958333333348 | X487: =RC[-7]*RC[-6] -> 466.09375 | Y487: =RC[-12]*RC[-12] -> 1.7361111111110989E-5 | Z487: =RC[-12]*RC[-12] -> 33.543402777777779 | AA487: =RC[-12]*RC[-12] -> 30.25 | AB487: =RC[-12]*RC[-12] -> 731.25173611111131 | AC487: =RC[-12]*RC[-12] -> 385.140625 | AD487: =RC[-12]*RC[-12] -> 564.0625 | AE487: =RC[-11]/SQRT(RC[-6]*RC[-1]) -> 1 | AF487: =RC[-11]/SQRT(RC[-6]*RC[-2]) -> 1 | AG487: =RC[-11]/SQRT(RC[-6]*RC[-3]) -> 1 | AH487: =RC[-11]/SQRT(RC[-6]*RC[-4]) -> 1 | AI487: =RC[-11]/SQRT(RC[-6]*RC[-5]) -> 1
A488: 36998 | B488: 北京 | C488: 60 | D488: 良 | E488: 0.59 | F488: 8 | G488: 45 | H488: 122 | I488: 89 | J488: 60 | L488: 2013-06-11T12:00:00.000 | M488: =RC[-8]-R[12]C[-8] -> 1.4166666666666661E-2 | N488: =RC[-8]-R[12]C[-8] -> 2.791666666666667 | O488: =RC[-8]-R[12]C[-8] -> -0.5 | P488: =RC[-8]-R[12]C[-8] -> 53.041666666666671 | Q488: =RC[-8]-R[12]C[-8] -> 13.625 | R488: =RC[-8]-R[12]C[-8] -> 9.75 | T488: =RC[-7]*RC[-2] -> 0.13812499999999994 | U488: =RC[-7]*RC[-3] -> 27.218750000000004 | V488: =RC[-7]*RC[-4] -> -4.875 | W488: =RC[-7]*RC[-5] -> 517.15625 | X488: =RC[-7]*RC[-6] -> 132.84375 | Y488: =RC[-12]*RC[-12] -> 2.0069444444444429E-4 | Z488: =RC[-12]*RC[-12] -> 7.7934027777777795 | AA488: =RC[-12]*RC[-12] -> 0.25 | AB488: =RC[-12]*RC[-12] -> 2813.4184027777783 | AC488: =RC[-12]*RC[-12] -> 185.640625 | AD488: =RC[-12]*RC[-12] -> 95.0625 | AE488: =RC[-11]/SQRT(RC[-6]*RC[-1]) -> 1 | AF488: =RC[-11]/SQRT(RC[-6]*RC[-2]) -> 1 | AG488: =RC[-11]/SQRT(RC[-6]*RC[-3]) -> -1 | AH488: =RC[-11]/SQRT(RC[-6]*RC[-4]) -> 1 | AI488: =RC[-11]/SQRT(RC[-6]*RC[-5]) -> 1
A489: 37074 | B489: 北京 | C489: 65 | D489: 良 | E489: 0.65 | F489: 8 | G489: 47 | H489: 146 | I489: 110 | J489: 83 | L489: 2013-06-11T13:00:00.000 | M489: =RC[-8]-R[11]C[-8] -> 7.4166666666666714E-2 | N489: =RC[-8]-R[11]C[-8] -> 2.791666666666667 | O489: =RC[-8]-R[11]C[-8] -> 1.5 | P489: =RC[-8]-R[11]C[-8] -> 77.041666666666671 | Q489: =RC[-8]-R[11]C[-8] -> 34.625 | R489: =RC[-8]-R[11]C[-8] -> 32.75 | T489: =RC[-7]*RC[-2] -> 2.4289583333333349 | U489: =RC[-7]*RC[-3] -> 91.427083333333343 | V489: =RC[-7]*RC[-4] -> 49.125 | W489: =RC[-7]*RC[-5] -> 2523.1145833333335 | X489: =RC[-7]*RC[-6] -> 1133.96875 | Y489: =RC[-12]*RC[-12] -> 5.5006944444444513E-3 | Z489: =RC[-12]*RC[-12] -> 7.7934027777777795 | AA489: =RC[-12]*RC[-12] -> 2.25 | AB489: =RC[-12]*RC[-12] -> 5935.4184027777783 | AC489: =RC[-12]*RC[-12] -> 1198.890625 | AD489: =RC[-12]*RC[-12] -> 1072.5625 | AE489: =RC[-11]/SQRT(RC[-6]*RC[-1]) -> 1 | AF489: =RC[-11]/SQRT(RC[-6]*RC[-2]) -> 1 | AG489: =RC[-11]/SQRT(RC[-6]*RC[-3]) -> 1 | AH489: =RC[-11]/SQRT(RC[-6]*RC[-4]) -> 1 | AI489: =RC[-11]/SQRT(RC[-6]*RC[-5]) -> 1
A490: 37150 | B490: 北京 | C490: 72 | D490: 良 | E490: 0.6 | F490: 7 | G490: 34 | H490: 170 | I490: 111 | J490: 69 | L490: 2013-06-11T14:00:00.000 | M490: =RC[-8]-R[10]C[-8] -> 2.416666666666667E-2 | N490: =RC[-8]-R[10]C[-8] -> 1.791666666666667 | O490: =RC[-8]-R[10]C[-8] -> -11.5 | P490: =RC[-8]-R[10]C[-8] -> 101.04166666666667 | Q490: =RC[-8]-R[10]C[-8] -> 35.625 | R490: =RC[-8]-R[10]C[-8] -> 18.75 | T490: =RC[-7]*RC[-2] -> 0.45312500000000006 | U490: =RC[-7]*RC[-3] -> 33.593750000000007 | V490: =RC[-7]*RC[-4] -> -215.625 | W490: =RC[-7]*RC[-5] -> 1894.53125 | X490: =RC[-7]*RC[-6] -> 667.96875 | Y490: =RC[-12]*RC[-12] -> 5.8402777777777793E-4 | Z490: =RC[-12]*RC[-12] -> 3.2100694444444455 | AA490: =RC[-12]*RC[-12] -> 132.25 | AB490: =RC[-12]*RC[-12] -> 10209.418402777779 | AC490: =RC[-12]*RC[-12] -> 1269.140625 | AD490: =RC[-12]*RC[-12] -> 351.5625 | AE490: =RC[-11]/SQRT(RC[-6]*RC[-1]) -> 1 | AF490: =RC[-11]/SQRT(RC[-6]*RC[-2]) -> 1 | AG490: =RC[-11]/SQRT(RC[-6]*RC[-3]) -> -1 | AH490: =RC[-11]/SQRT(RC[-6]*RC[-4]) -> 0.99999999999999989 | AI490: =RC[-11]/SQRT(RC[-6]*RC[-5]) -> 1
A491: 37226 | B491: 北京 | C491: 76 | D491: 良 | E491: 0.53 | F491: 6 | G491: 25 | H491: 173 | I491: 104 | J491: 81 | L491: 2013-06-11T15:00:00.000 | M491: =RC[-8]-R[9]C[-8] -> -4.5833333333333282E-2 | N491: =RC[-8]-R[9]C[-8] -> 0.79166666666666696 | O491: =RC[-8]-R[9]C[-8] -> -20.5 | P491: =RC[-8]-R[9]C[-8] -> 104.04166666666667 | Q491: =RC[-8]-R[9]C[-8] -> 28.625 | R491: =RC[-8]-R[9]C[-8] -> 30.75 | T491: =RC[-7]*RC[-2] -> -1.4093749999999985 | U491: =RC[-7]*RC[-3] -> 24.343750000000011 | V491: =RC[-7]*RC[-4] -> -630.375 | W491: =RC[-7]*RC[-5] -> 3199.28125 | X491: =RC[-7]*RC[-6] -> 880.21875 | Y491: =RC[-12]*RC[-12] -> 2.1006944444444398E-3 | Z491: =RC[-12]*RC[-12] -> 0.6267361111111116 | AA491: =RC[-12]*RC[-12] -> 420.25 | AB491: =RC[-12]*RC[-12] -> 10824.668402777779 | AC491: =RC[-12]*RC[-12] -> 819.390625 | AD491: =RC[-12]*RC[-12] -> 945.5625 | AE491: =RC[-11]/SQRT(RC[-6]*RC[-1]) -> -1 | AF491: =RC[-11]/SQRT(RC[-6]*RC[-2]) -> 1 | AG491: =RC[-11]/SQRT(RC[-6]*RC[-3]) -> -1 | AH491: =RC[-11]/SQRT(RC[-6]*RC[-4]) -> 0.99999999999999989 | AI491: =RC[-11]/SQRT(RC[-6]*RC[-5]) -> 1
A492: 37302 | B492: 北京 | C492: 75 | D492: 良 | E492: 0.54 | F492: 4 | G492: 27 | H492: 134 | I492: 97 | J492: 79 | L492: 2013-06-11T16:00:00.000 | M492: =RC[-8]-R[8]C[-8] -> -3.5833333333333273E-2 | N492: =RC[-8]-R[8]C[-8] -> -1.208333333333333 | O492: =RC[-8]-R[8]C[-8] -> -18.5 | P492: =RC[-8]-R[8]C[-8] -> 65.041666666666671 | Q492: =RC[-8]-R[8]C[-8] -> 21.625 | R492: =RC[-8]-R[8]C[-8] -> 28.75 | T492: =RC[-7]*RC[-2] -> -1.0302083333333316 | U492: =RC[-7]*RC[-3] -> -34.739583333333321 | V492: =RC[-7]*RC[-4] -> -531.875 | W492: =RC[-7]*RC[-5] -> 1869.9479166666667 | X492: =RC[-7]*RC[-6] -> 621.71875 | Y492: =RC[-12]*RC[-12] -> 1.2840277777777735E-3 | Z492: =RC[-12]*RC[-12] -> 1.4600694444444438 | AA492: =RC[-12]*RC[-12] -> 342.25 | AB492: =RC[-12]*RC[-12] -> 4230.4184027777783 | AC492: =RC[-12]*RC[-12] -> 467.640625 | AD492: =RC[-12]*RC[-12] -> 826.5625 | AE492: =RC[-11]/SQRT(RC[-6]*RC[-1]) -> -1 | AF492: =RC[-11]/SQRT(RC[-6]*RC[-2]) -> -0.99999999999999978 | AG492: =RC[-11]/SQRT(RC[-6]*RC[-3]) -> -1 | AH492: =RC[-11]/SQRT(RC[-6]*RC[-4]) -> 1 | AI492: =RC[-11]/SQRT(RC[-6]*RC[-5]) -> 1
A493: 37378 | B493: 北京 | C493: 80 | D493: 良 | E493: 0.54 | F493: 3 | G493: 34 | H493: 124 | I493: 77 | J493: 63 | L493: 2013-06-11T17:00:00.000 | M493: =RC[-8]-R[7]C[-8] -> -3.5833333333333273E-2 | N493: =RC[-8]-R[7]C[-8] -> -2.208333333333333 | O493: =RC[-8]-R[7]C[-8] -> -11.5 | P493: =RC[-8]-R[7]C[-8] -> 55.041666666666671 | Q493: =RC[-8]-R[7]C[-8] -> 1.625 | R493: =RC[-8]-R[7]C[-8] -> 12.75 | T493: =RC[-7]*RC[-2] -> -0.45687499999999925 | U493: =RC[-7]*RC[-3] -> -28.156249999999996 | V493: =RC[-7]*RC[-4] -> -146.625 | W493: =RC[-7]*RC[-5] -> 701.78125000000011 | X493: =RC[-7]*RC[-6] -> 20.71875 | Y493: =RC[-12]*RC[-12] -> 1.2840277777777735E-3 | Z493: =RC[-12]*RC[-12] -> 4.8767361111111098 | AA493: =RC[-12]*RC[-12] -> 132.25 | AB493: =RC[-12]*RC[-12] -> 3029.5850694444448 | AC493: =RC[-12]*RC[-12] -> 2.640625 | AD493: =RC[-12]*RC[-12] -> 162.5625 | AE493: =RC[-11]/SQRT(RC[-6]*RC[-1]) -> -1.0000000000000002 | AF493: =RC[-11]/SQRT(RC[-6]*RC[-2]) -> -1 | AG493: =RC[-11]/SQRT(RC[-6]*RC[-3]) -> -1 | AH493: =RC[-11]/SQRT(RC[-6]*RC[-4]) -> 1.0000000000000002 | AI493: =RC[-11]/SQRT(RC[-6]*RC[-5]) -> 1
A494: 37454 | B494: 北京 | C494: 84 | D494: 良 | E494: 0.5 | F494: 3 | G494: 30 | H494: 110 | I494: 86 | J494: 40 | L494: 2013-06-11T18:00:00.000 | M494: =RC[-8]-R[6]C[-8] -> -7.5833333333333308E-2 | N494: =RC[-8]-R[6]C[-8] -> -2.208333333333333 | O494: =RC[-8]-R[6]C[-8] -> -15.5 | P494: =RC[-8]-R[6]C[-8] -> 41.041666666666671 | Q494: =RC[-8]-R[6]C[-8] -> 10.625 | R494: =RC[-8]-R[6]C[-8] -> -10.25 | T494: =RC[-7]*RC[-2] -> 0.77729166666666638 | U494: =RC[-7]*RC[-3] -> 22.635416666666664 | V494: =RC[-7]*RC[-4] -> 158.875 | W494: =RC[-7]*RC[-5] -> -420.67708333333337 | X494: =RC[-7]*RC[-6] -> -108.90625 | Y494: =RC[-12]*RC[-12] -> 5.7506944444444402E-3 | Z494: =RC[-12]*RC[-12] -> 4.8767361111111098 | AA494: =RC[-12]*RC[-12] -> 240.25 | AB494: =RC[-12]*RC[-12] -> 1684.4184027777781 | AC494: =RC[-12]*RC[-12] -> 112.890625 | AD494: =RC[-12]*RC[-12] -> 105.0625 | AE494: =RC[-11]/SQRT(RC[-6]*RC[-1]) -> 1 | AF494: =RC[-11]/SQRT(RC[-6]*RC[-2]) -> 1 | AG494: =RC[-11]/SQRT(RC[-6]*RC[-3]) -> 1 | AH494: =RC[-11]/SQRT(RC[-6]*RC[-4]) -> -1 | AI494: =RC[-11]/SQRT(RC[-6]*RC[-5]) -> -1
A495: 37530 | B495: 北京 | C495: 84 | D495: 良 | E495: 0.48 | F495: 4 | G495: 37 | H495: 86 | I495: 25 | J495: 26 | L495: 2013-06-11T19:00:00.000 | M495: =RC[-8]-R[5]C[-8] -> -9.5833333333333326E-2 | N495: =RC[-8]-R[5]C[-8] -> -1.208333333333333 | O495: =RC[-8]-R[5]C[-8] -> -8.5 | P495: =RC[-8]-R[5]C[-8] -> 17.041666666666671 | Q495: =RC[-8]-R[5]C[-8] -> -50.375 | R495: =RC[-8]-R[5]C[-8] -> -24.25 | T495: =RC[-7]*RC[-2] -> 2.3239583333333331 | U495: =RC[-7]*RC[-3] -> 29.302083333333325 | V495: =RC[-7]*RC[-4] -> 206.125 | W495: =RC[-7]*RC[-5] -> -413.2604166666668 | X495: =RC[-7]*RC[-6] -> 1221.59375 | Y495: =RC[-12]*RC[-12] -> 9.1840277777777771E-3 | Z495: =RC[-12]*RC[-12] -> 1.4600694444444438 | AA495: =RC[-12]*RC[-12] -> 72.25 | AB495: =RC[-12]*RC[-12] -> 290.41840277777794 | AC495: =RC[-12]*RC[-12] -> 2537.640625 | AD495: =RC[-12]*RC[-12] -> 588.0625 | AE495: =RC[-11]/SQRT(RC[-6]*RC[-1]) -> 1 | AF495: =RC[-11]/SQRT(RC[-6]*RC[-2]) -> 0.99999999999999989 | AG495: =RC[-11]/SQRT(RC[-6]*RC[-3]) -> 1 | AH495: =RC[-11]/SQRT(RC[-6]*RC[-4]) -> -1 | AI495: =RC[-11]/SQRT(RC[-6]*RC[-5]) -> 1
A496: 37606 | B496: 北京 | C496: 84 | D496: 良 | E496: 0.49 | F496: 3 | G496: 38 | H496: 82 | I496: 38 | J496: 20 | L496: 2013-06-11T20:00:00.000 | M496: =RC[-8]-R[4]C[-8] -> -8.5833333333333317E-2 | N496: =RC[-8]-R[4]C[-8] -> -2.208333333333333 | O496: =RC[-8]-R[4]C[-8] -> -7.5 | P496: =RC[-8]-R[4]C[-8] -> 13.041666666666671 | Q496: =RC[-8]-R[4]C[-8] -> -37.375 | R496: =RC[-8]-R[4]C[-8] -> -30.25 | T496: =RC[-7]*RC[-2] -> 2.5964583333333326 | U496: =RC[-7]*RC[-3] -> 66.802083333333329 | V496: =RC[-7]*RC[-4] -> 226.875 | W496: =RC[-7]*RC[-5] -> -394.5104166666668 | X496: =RC[-7]*RC[-6] -> 1130.59375 | Y496: =RC[-12]*RC[-12] -> 7.3673611111111084E-3 | Z496: =RC[-12]*RC[-12] -> 4.8767361111111098 | AA496: =RC[-12]*RC[-12] -> 56.25 | AB496: =RC[-12]*RC[-12] -> 170.08506944444457 | AC496: =RC[-12]*RC[-12] -> 1396.890625 | AD496: =RC[-12]*RC[-12] -> 915.0625 | AE496: =RC[-11]/SQRT(RC[-6]*RC[-1]) -> 0.99999999999999978 | AF496: =RC[-11]/SQRT(RC[-6]*RC[-2]) -> 1.0000000000000002 | AG496: =RC[-11]/SQRT(RC[-6]*RC[-3]) -> 1 | AH496: =RC[-11]/SQRT(RC[-6]*RC[-4]) -> -1 | AI496: =RC[-11]/SQRT(RC[-6]*RC[-5]) -> 1
A497: 37682 | B497: 北京 | C497: 81 | D497: 良 | E497: 0.61 | F497: 3 | G497: 41 | H497: 68 | I497: 54 | J497: 40 | L497: 2013-06-11T21:00:00.000 | M497: =RC[-8]-R[3]C[-8] -> 3.4166666666666679E-2 | N497: =RC[-8]-R[3]C[-8] -> -2.208333333333333 | O497: =RC[-8]-R[3]C[-8] -> -4.5 | P497: =RC[-8]-R[3]C[-8] -> -0.9583333333333286 | Q497: =RC[-8]-R[3]C[-8] -> -21.375 | R497: =RC[-8]-R[3]C[-8] -> -10.25 | T497: =RC[-7]*RC[-2] -> -0.35020833333333345 | U497: =RC[-7]*RC[-3] -> 22.635416666666664 | V497: =RC[-7]*RC[-4] -> 46.125 | W497: =RC[-7]*RC[-5] -> 9.8229166666666181 | X497: =RC[-7]*RC[-6] -> 219.09375 | Y497: =RC[-12]*RC[-12] -> 1.1673611111111119E-3 | Z497: =RC[-12]*RC[-12] -> 4.8767361111111098 | AA497: =RC[-12]*RC[-12] -> 20.25 | AB497: =RC[-12]*RC[-12] -> 0.91840277777776869 | AC497: =RC[-12]*RC[-12] -> 456.890625 | AD497: =RC[-12]*RC[-12] -> 105.0625 | AE497: =RC[-11]/SQRT(RC[-6]*RC[-1]) -> -1 | AF497: =RC[-11]/SQRT(RC[-6]*RC[-2]) -> 1 | AG497: =RC[-11]/SQRT(RC[-6]*RC[-3]) -> 1 | AH497: =RC[-11]/SQRT(RC[-6]*RC[-4]) -> 1 | AI497: =RC[-11]/SQRT(RC[-6]*RC[-5]) -> 1
A498: 37758 | B498: 北京 | C498: 77 | D498: 良 | E498: 0.66 | F498: 3 | G498: 45 | H498: 73 | I498: 65 | J498: 43 | L498: 2013-06-11T22:00:00.000 | M498: =RC[-8]-R[2]C[-8] -> 8.4166666666666723E-2 | N498: =RC[-8]-R[2]C[-8] -> -2.208333333333333 | O498: =RC[-8]-R[2]C[-8] -> -0.5 | P498: =RC[-8]-R[2]C[-8] -> 4.0416666666666714 | Q498: =RC[-8]-R[2]C[-8] -> -10.375 | R498: =RC[-8]-R[2]C[-8] -> -7.25 | T498: =RC[-7]*RC[-2] -> -0.61020833333333369 | U498: =RC[-7]*RC[-3] -> 16.010416666666664 | V498: =RC[-7]*RC[-4] -> 3.625 | W498: =RC[-7]*RC[-5] -> -29.302083333333368 | X498: =RC[-7]*RC[-6] -> 75.21875 | Y498: =RC[-12]*RC[-12] -> 7.0840277777777872E-3 | Z498: =RC[-12]*RC[-12] -> 4.8767361111111098 | AA498: =RC[-12]*RC[-12] -> 0.25 | AB498: =RC[-12]*RC[-12] -> 16.335069444444482 | AC498: =RC[-12]*RC[-12] -> 107.640625 | AD498: =RC[-12]*RC[-12] -> 52.5625 | AE498: =RC[-11]/SQRT(RC[-6]*RC[-1]) -> -1 | AF498: =RC[-11]/SQRT(RC[-6]*RC[-2]) -> 1 | AG498: =RC[-11]/SQRT(RC[-6]*RC[-3]) -> 1 | AH498: =RC[-11]/SQRT(RC[-6]*RC[-4]) -> -1 | AI498: =RC[-11]/SQRT(RC[-6]*RC[-5]) -> 1
A499: 37834 | B499: 北京 | C499: 73 | D499: 良 | E499: 0.53 | F499: 3 | G499: 28 | H499: 70 | I499: 51 | J499: 28 | L499: 2013-06-11T23:00:00.000 | M499: =RC[-8]-R[1]C[-8] -> -4.5833333333333282E-2 | N499: =RC[-8]-R[1]C[-8] -> -2.208333333333333 | O499: =RC[-8]-R[1]C[-8] -> -17.5 | P499: =RC[-8]-R[1]C[-8] -> 1.0416666666666714 | Q499: =RC[-8]-R[1]C[-8] -> -24.375 | R499: =RC[-8]-R[1]C[-8] -> -22.25 | T499: =RC[-7]*RC[-2] -> 1.0197916666666655 | U499: =RC[-7]*RC[-3] -> 49.135416666666657 | V499: =RC[-7]*RC[-4] -> 389.375 | W499: =RC[-7]*RC[-5] -> -23.177083333333439 | X499: =RC[-7]*RC[-6] -> 542.34375 | Y499: =RC[-12]*RC[-12] -> 2.1006944444444398E-3 | Z499: =RC[-12]*RC[-12] -> 4.8767361111111098 | AA499: =RC[-12]*RC[-12] -> 306.25 | AB499: =RC[-12]*RC[-12] -> 1.0850694444444544 | AC499: =RC[-12]*RC[-12] -> 594.140625 | AD499: =RC[-12]*RC[-12] -> 495.0625 | AE499: =RC[-11]/SQRT(RC[-6]*RC[-1]) -> 1 | AF499: =RC[-11]/SQRT(RC[-6]*RC[-2]) -> 0.99999999999999989 | AG499: =RC[-11]/SQRT(RC[-6]*RC[-3]) -> 1 | AH499: =RC[-11]/SQRT(RC[-6]*RC[-4]) -> -1 | AI499: =RC[-11]/SQRT(RC[-6]*RC[-5]) -> 1
E500: =AVERAGE(R[-24]C:R[-1]C) -> 0.57583333333333331 | F500: =AVERAGE(R[-24]C:R[-1]C) -> 5.208333333333333 | G500: =AVERAGE(R[-24]C:R[-1]C) -> 45.5 | H500: =AVERAGE(R[-24]C:R[-1]C) -> 68.958333333333329 | I500: =AVERAGE(R[-24]C:R[-1]C) -> 75.375 | J500: =AVERAGE(R[-24]C:R[-1]C) -> 50.25 | M500: =RC[-8]-RC[-8] -> 0 | N500: =RC[-8]-RC[-8] -> 0 | O500: =RC[-8]-RC[-8] -> 0 | P500: =RC[-8]-RC[-8] -> 0 | Q500: =RC[-8]-RC[-8] -> 0 | R500: =RC[-8]-RC[-8] -> 0 | T500: =SUM(R[-24]C:R[-1]C) -> 12.035 | U500: =SUM(R[-24]C:R[-1]C) -> 654.74999999999989 | V500: =SUM(R[-24]C:R[-1]C) -> -764 | W500: =SUM(R[-24]C:R[-1]C) -> 13778.249999999998 | X500: =SUM(R[-24]C:R[-1]C) -> 8850.75 | Y500: =SUM(R[-24]C:R[-1]C) -> 9.678333333333336E-2 | Z500: =SUM(R[-24]C:R[-1]C) -> 123.95833333333336 | AA500: =SUM(R[-24]C:R[-1]C) -> 3120 | AB500: =SUM(R[-24]C:R[-1]C) -> 71266.958333333328 | AC500: =SUM(R[-24]C:R[-1]C) -> 11777.625 | AD500: =SUM(R[-24]C:R[-1]C) -> 8126.5 | AE500: =RC[-11]/SQRT(RC[-6]*RC[-1]) -> 0.42913509896797791 | AF500: =RC[-11]/SQRT(RC[-6]*RC[-2]) -> 0.65235782046479285 | AG500: =RC[-11]/SQRT(RC[-6]*RC[-3]) -> -0.15172749639040276 | AH500: =RC[-11]/SQRT(RC[-6]*RC[-4]) -> 0.57252990868847153 | AI500: =RC[-11]/SQRT(RC[-6]*RC[-5]) -> 0.90468927698459523
A501: 37910 | B501: 北京 | C501: 71 | D501: 良 | E501: 0.46 | F501: 3 | G501: 28 | H501: 61 | I501: 26 | J501: 17 | L501: 2013-06-12T00:00:00.000 | M501: =RC[-8]-R[24]C[-8] -> -0.35333333333333344 | N501: =RC[-8]-R[24]C[-8] -> -9.9583333333333339 | O501: =RC[-8]-R[24]C[-8] -> -1.9166666666666679 | P501: =RC[-8]-R[24]C[-8] -> -51.625 | Q501: =RC[-8]-R[24]C[-8] -> -44.666666666666671 | R501: =RC[-8]-R[24]C[-8] -> -39.916666666666664 | T501: =RC[-7]*RC[-2] -> 14.103888888888893 | U501: =RC[-7]*RC[-3] -> 397.50347222222223 | V501: =RC[-7]*RC[-4] -> 76.506944444444485 | W501: =RC[-7]*RC[-5] -> 2060.6979166666665 | X501: =RC[-7]*RC[-6] -> 1782.9444444444446 | Y501: =RC[-12]*RC[-12] -> 0.12484444444444452 | Z501: =RC[-12]*RC[-12] -> 99.168402777777786 | AA501: =RC[-12]*RC[-12] -> 3.6736111111111156 | AB501: =RC[-12]*RC[-12] -> 2665.140625 | AC501: =RC[-12]*RC[-12] -> 1995.1111111111115 | AD501: =RC[-12]*RC[-12] -> 1593.3402777777776 | AE501: =RC[-11]/SQRT(RC[-6]*RC[-1]) -> 1 | AF501: =RC[-11]/SQRT(RC[-6]*RC[-2]) -> 1 | AG501: =RC[-11]/SQRT(RC[-6]*RC[-3]) -> 1 | AH501: =RC[-11]/SQRT(RC[-6]*RC[-4]) -> 1 | AI501: =RC[-11]/SQRT(RC[-6]*RC[-5]) -> 1
A502: 37986 | B502: 北京 | C502: 70 | D502: 良 | E502: 0.48 | F502: 3 | G502: 35 | H502: 50 | I502: 27 | J502: 18 | L502: 2013-06-12T01:00:00.000 | M502: =RC[-8]-R[23]C[-8] -> -0.33333333333333348 | N502: =RC[-8]-R[23]C[-8] -> -9.9583333333333339 | O502: =RC[-8]-R[23]C[-8] -> 5.0833333333333321 | P502: =RC[-8]-R[23]C[-8] -> -62.625 | Q502: =RC[-8]-R[23]C[-8] -> -43.666666666666671 | R502: =RC[-8]-R[23]C[-8] -> -38.916666666666664 | T502: =RC[-7]*RC[-2] -> 12.972222222222227 | U502: =RC[-7]*RC[-3] -> 387.54513888888891 | V502: =RC[-7]*RC[-4] -> -197.82638888888883 | W502: =RC[-7]*RC[-5] -> 2437.15625 | X502: =RC[-7]*RC[-6] -> 1699.3611111111111 | Y502: =RC[-12]*RC[-12] -> 0.11111111111111122 | Z502: =RC[-12]*RC[-12] -> 99.168402777777786 | AA502: =RC[-12]*RC[-12] -> 25.840277777777764 | AB502: =RC[-12]*RC[-12] -> 3921.890625 | AC502: =RC[-12]*RC[-12] -> 1906.7777777777783 | AD502: =RC[-12]*RC[-12] -> 1514.5069444444443 | AE502: =RC[-11]/SQRT(RC[-6]*RC[-1]) -> 0.99999999999999989 | AF502: =RC[-11]/SQRT(RC[-6]*RC[-2]) -> 1.0000000000000002 | AG502: =RC[-11]/SQRT(RC[-6]*RC[-3]) -> -1 | AH502: =RC[-11]/SQRT(RC[-6]*RC[-4]) -> 1 | AI502: =RC[-11]/SQRT(RC[-6]*RC[-5]) -> 0.99999999999999989
A503: 38062 | B503: 北京 | C503: 70 | D503: 良 | E503: 0.46 | F503: 3 | G503: 29 | H503: 49 | I503: 20 | J503: 17 | L503: 2013-06-12T02:00:00.000 | M503: =RC[-8]-R[22]C[-8] -> -0.35333333333333344 | N503: =RC[-8]-R[22]C[-8] -> -9.9583333333333339 | O503: =RC[-8]-R[22]C[-8] -> -0.91666666666666785 | P503: =RC[-8]-R[22]C[-8] -> -63.625 | Q503: =RC[-8]-R[22]C[-8] -> -50.666666666666671 | R503: =RC[-8]-R[22]C[-8] -> -39.916666666666664 | T503: =RC[-7]*RC[-2] -> 14.103888888888893 | U503: =RC[-7]*RC[-3] -> 397.50347222222223 | V503: =RC[-7]*RC[-4] -> 36.590277777777821 | W503: =RC[-7]*RC[-5] -> 2539.6979166666665 | X503: =RC[-7]*RC[-6] -> 2022.4444444444446 | Y503: =RC[-12]*RC[-12] -> 0.12484444444444452 | Z503: =RC[-12]*RC[-12] -> 99.168402777777786 | AA503: =RC[-12]*RC[-12] -> 0.8402777777777799 | AB503: =RC[-12]*RC[-12] -> 4048.140625 | AC503: =RC[-12]*RC[-12] -> 2567.1111111111118 | AD503: =RC[-12]*RC[-12] -> 1593.3402777777776 | AE503: =RC[-11]/SQRT(RC[-6]*RC[-1]) -> 1 | AF503: =RC[-11]/SQRT(RC[-6]*RC[-2]) -> 1 | AG503: =RC[-11]/SQRT(RC[-6]*RC[-3]) -> 1 | AH503: =RC[-11]/SQRT(RC[-6]*RC[-4]) -> 1 | AI503: =RC[-11]/SQRT(RC[-6]*RC[-5]) -> 1
A504: 38138 | B504: 北京 | C504: 69 | D504: 良 | E504: 0.46 | F504: 3 | G504: 30 | H504: 45 | I504: 28 | J504: 16 | L504: 2013-06-12T03:00:00.000 | M504: =RC[-8]-R[21]C[-8] -> -0.35333333333333344 | N504: =RC[-8]-R[21]C[-8] -> -9.9583333333333339 | O504: =RC[-8]-R[21]C[-8] -> 8.3333333333332149E-2 | P504: =RC[-8]-R[21]C[-8] -> -67.625 | Q504: =RC[-8]-R[21]C[-8] -> -42.666666666666671 | R504: =RC[-8]-R[21]C[-8] -> -40.916666666666664 | T504: =RC[-7]*RC[-2] -> 14.457222222222226 | U504: =RC[-7]*RC[-3] -> 407.46180555555554 | V504: =RC[-7]*RC[-4] -> -3.4097222222221735 | W504: =RC[-7]*RC[-5] -> 2766.989583333333 | X504: =RC[-7]*RC[-6] -> 1745.7777777777778 | Y504: =RC[-12]*RC[-12] -> 0.12484444444444452 | Z504: =RC[-12]*RC[-12] -> 99.168402777777786 | AA504: =RC[-12]*RC[-12] -> 6.9444444444442472E-3 | AB504: =RC[-12]*RC[-12] -> 4573.140625 | AC504: =RC[-12]*RC[-12] -> 1820.4444444444448 | AD504: =RC[-12]*RC[-12] -> 1674.1736111111109 | AE504: =RC[-11]/SQRT(RC[-6]*RC[-1]) -> 1 | AF504: =RC[-11]/SQRT(RC[-6]*RC[-2]) -> 1 | AG504: =RC[-11]/SQRT(RC[-6]*RC[-3]) -> -1 | AH504: =RC[-11]/SQRT(RC[-6]*RC[-4]) -> 1 | AI504: =RC[-11]/SQRT(RC[-6]*RC[-5]) -> 1
A505: 38214 | B505: 北京 | C505: 69 | D505: 良 | E505: 0.52 | F505: 3 | G505: 40 | H505: 35 | I505: 32 | J505: 24 | L505: 2013-06-12T04:00:00.000 | M505: =RC[-8]-R[20]C[-8] -> -0.29333333333333345 | N505: =RC[-8]-R[20]C[-8] -> -9.9583333333333339 | O505: =RC[-8]-R[20]C[-8] -> 10.083333333333332 | P505: =RC[-8]-R[20]C[-8] -> -77.625 | Q505: =RC[-8]-R[20]C[-8] -> -38.666666666666671 | R505: =RC[-8]-R[20]C[-8] -> -32.916666666666664 | T505: =RC[-7]*RC[-2] -> 9.6555555555555586 | U505: =RC[-7]*RC[-3] -> 327.79513888888886 | V505: =RC[-7]*RC[-4] -> -331.90972222222217 | W505: =RC[-7]*RC[-5] -> 2555.15625 | X505: =RC[-7]*RC[-6] -> 1272.7777777777778 | Y505: =RC[-12]*RC[-12] -> 8.6044444444444507E-2 | Z505: =RC[-12]*RC[-12] -> 99.168402777777786 | AA505: =RC[-12]*RC[-12] -> 101.67361111111109 | AB505: =RC[-12]*RC[-12] -> 6025.640625 | AC505: =RC[-12]*RC[-12] -> 1495.1111111111115 | AD505: =RC[-12]*RC[-12] -> 1083.5069444444443 | AE505: =RC[-11]/SQRT(RC[-6]*RC[-1]) -> 1 | AF505: =RC[-11]/SQRT(RC[-6]*RC[-2]) -> 0.99999999999999978 | AG505: =RC[-11]/SQRT(RC[-6]*RC[-3]) -> -1 | AH505: =RC[-11]/SQRT(RC[-6]*RC[-4]) -> 1 | AI505: =RC[-11]/SQRT(RC[-6]*RC[-5]) -> 1
A506: 38290 | B506: 北京 | C506: 68 | D506: 良 | E506: 0.69 | F506: 4 | G506: 35 | H506: 29 | I506: 42 | J506: 28 | L506: 2013-06-12T05:00:00.000 | M506: =RC[-8]-R[19]C[-8] -> -0.12333333333333352 | N506: =RC[-8]-R[19]C[-8] -> -8.9583333333333339 | O506: =RC[-8]-R[19]C[-8] -> 5.0833333333333321 | P506: =RC[-8]-R[19]C[-8] -> -83.625 | Q506: =RC[-8]-R[19]C[-8] -> -28.666666666666671 | R506: =RC[-8]-R[19]C[-8] -> -28.916666666666664 | T506: =RC[-7]*RC[-2] -> 3.5663888888888939 | U506: =RC[-7]*RC[-3] -> 259.04513888888886 | V506: =RC[-7]*RC[-4] -> -146.99305555555551 | W506: =RC[-7]*RC[-5] -> 2418.15625 | X506: =RC[-7]*RC[-6] -> 828.94444444444446 | Y506: =RC[-12]*RC[-12] -> 1.5211111111111156E-2 | Z506: =RC[-12]*RC[-12] -> 80.251736111111128 | AA506: =RC[-12]*RC[-12] -> 25.840277777777764 | AB506: =RC[-12]*RC[-12] -> 6993.140625 | AC506: =RC[-12]*RC[-12] -> 821.77777777777806 | AD506: =RC[-12]*RC[-12] -> 836.17361111111097 | AE506: =RC[-11]/SQRT(RC[-6]*RC[-1]) -> 1 | AF506: =RC[-11]/SQRT(RC[-6]*RC[-2]) -> 0.99999999999999978 | AG506: =RC[-11]/SQRT(RC[-6]*RC[-3]) -> -1 | AH506: =RC[-11]/SQRT(RC[-6]*RC[-4]) -> 1 | AI506: =RC[-11]/SQRT(RC[-6]*RC[-5]) -> 0.99999999999999989
A507: 38366 | B507: 北京 | C507: 69 | D507: 良 | E507: 0.8 | F507: 4 | G507: 35 | H507: 23 | I507: 53 | J507: 40 | L507: 2013-06-12T06:00:00.000 | M507: =RC[-8]-R[18]C[-8] -> -1.3333333333333419E-2 | N507: =RC[-8]-R[18]C[-8] -> -8.9583333333333339 | O507: =RC[-8]-R[18]C[-8] -> 5.0833333333333321 | P507: =RC[-8]-R[18]C[-8] -> -89.625 | Q507: =RC[-8]-R[18]C[-8] -> -17.666666666666671 | R507: =RC[-8]-R[18]C[-8] -> -16.916666666666664 | T507: =RC[-7]*RC[-2] -> 0.22555555555555698 | U507: =RC[-7]*RC[-3] -> 151.54513888888889 | V507: =RC[-7]*RC[-4] -> -85.993055555555529 | W507: =RC[-7]*RC[-5] -> 1516.1562499999998 | X507: =RC[-7]*RC[-6] -> 298.86111111111114 | Y507: =RC[-12]*RC[-12] -> 1.7777777777778006E-4 | Z507: =RC[-12]*RC[-12] -> 80.251736111111128 | AA507: =RC[-12]*RC[-12] -> 25.840277777777764 | AB507: =RC[-12]*RC[-12] -> 8032.640625 | AC507: =RC[-12]*RC[-12] -> 312.11111111111126 | AD507: =RC[-12]*RC[-12] -> 286.17361111111103 | AE507: =RC[-11]/SQRT(RC[-6]*RC[-1]) -> 1 | AF507: =RC[-11]/SQRT(RC[-6]*RC[-2]) -> 1 | AG507: =RC[-11]/SQRT(RC[-6]*RC[-3]) -> -1.0000000000000002 | AH507: =RC[-11]/SQRT(RC[-6]*RC[-4]) -> 1 | AI507: =RC[-11]/SQRT(RC[-6]*RC[-5]) -> 1
A508: 38442 | B508: 北京 | C508: 69 | D508: 良 | E508: 0.86 | F508: 6 | G508: 41 | H508: 22 | I508: 55 | J508: 43 | L508: 2013-06-12T07:00:00.000 | M508: =RC[-8]-R[17]C[-8] -> 4.6666666666666523E-2 | N508: =RC[-8]-R[17]C[-8] -> -6.9583333333333339 | O508: =RC[-8]-R[17]C[-8] -> 11.083333333333332 | P508: =RC[-8]-R[17]C[-8] -> -90.625 | Q508: =RC[-8]-R[17]C[-8] -> -15.666666666666671 | R508: =RC[-8]-R[17]C[-8] -> -13.916666666666664 | T508: =RC[-7]*RC[-2] -> -0.64944444444444238 | U508: =RC[-7]*RC[-3] -> 96.836805555555543 | V508: =RC[-7]*RC[-4] -> -154.24305555555551 | W508: =RC[-7]*RC[-5] -> 1261.1979166666665 | X508: =RC[-7]*RC[-6] -> 218.0277777777778 | Y508: =RC[-12]*RC[-12] -> 2.1777777777777642E-3 | Z508: =RC[-12]*RC[-12] -> 48.418402777777786 | AA508: =RC[-12]*RC[-12] -> 122.84027777777776 | AB508: =RC[-12]*RC[-12] -> 8212.890625 | AC508: =RC[-12]*RC[-12] -> 245.4444444444446 | AD508: =RC[-12]*RC[-12] -> 193.67361111111106 | AE508: =RC[-11]/SQRT(RC[-6]*RC[-1]) -> -1 | AF508: =RC[-11]/SQRT(RC[-6]*RC[-2]) -> 0.99999999999999989 | AG508: =RC[-11]/SQRT(RC[-6]*RC[-3]) -> -1 | AH508: =RC[-11]/SQRT(RC[-6]*RC[-4]) -> 1 | AI508: =RC[-11]/SQRT(RC[-6]*RC[-5]) -> 0.99999999999999989
A509: 38518 | B509: 北京 | C509: 68 | D509: 良 | E509: 0.87 | F509: 10 | G509: 43 | H509: 37 | I509: 60 | J509: 51 | L509: 2013-06-12T08:00:00.000 | M509: =RC[-8]-R[16]C[-8] -> 5.6666666666666532E-2 | N509: =RC[-8]-R[16]C[-8] -> -2.9583333333333339 | O509: =RC[-8]-R[16]C[-8] -> 13.083333333333332 | P509: =RC[-8]-R[16]C[-8] -> -75.625 | Q509: =RC[-8]-R[16]C[-8] -> -10.666666666666671 | R509: =RC[-8]-R[16]C[-8] -> -5.9166666666666643 | T509: =RC[-7]*RC[-2] -> -0.33527777777777684 | U509: =RC[-7]*RC[-3] -> 17.503472222222218 | V509: =RC[-7]*RC[-4] -> -77.409722222222186 | W509: =RC[-7]*RC[-5] -> 447.44791666666652 | X509: =RC[-7]*RC[-6] -> 63.111111111111114 | Y509: =RC[-12]*RC[-12] -> 3.211111111111096E-3 | Z509: =RC[-12]*RC[-12] -> 8.7517361111111143 | AA509: =RC[-12]*RC[-12] -> 171.17361111111109 | AB509: =RC[-12]*RC[-12] -> 5719.140625 | AC509: =RC[-12]*RC[-12] -> 113.77777777777789 | AD509: =RC[-12]*RC[-12] -> 35.006944444444414 | AE509: =RC[-11]/SQRT(RC[-6]*RC[-1]) -> -1 | AF509: =RC[-11]/SQRT(RC[-6]*RC[-2]) -> 1 | AG509: =RC[-11]/SQRT(RC[-6]*RC[-3]) -> -1 | AH509: =RC[-11]/SQRT(RC[-6]*RC[-4]) -> 1.0000000000000002 | AI509: =RC[-11]/SQRT(RC[-6]*RC[-5]) -> 1
A510: 38594 | B510: 北京 | C510: 64 | D510: 良 | E510: 0.83 | F510: 14 | G510: 33 | H510: 63 | I510: 57 | J510: 45 | L510: 2013-06-12T09:00:00.000 | M510: =RC[-8]-R[15]C[-8] -> 1.6666666666666496E-2 | N510: =RC[-8]-R[15]C[-8] -> 1.0416666666666661 | O510: =RC[-8]-R[15]C[-8] -> 3.0833333333333321 | P510: =RC[-8]-R[15]C[-8] -> -49.625 | Q510: =RC[-8]-R[15]C[-8] -> -13.666666666666671 | R510: =RC[-8]-R[15]C[-8] -> -11.916666666666664 | T510: =RC[-7]*RC[-2] -> -0.19861111111110905 | U510: =RC[-7]*RC[-3] -> -12.413194444444436 | V510: =RC[-7]*RC[-4] -> -36.743055555555536 | W510: =RC[-7]*RC[-5] -> 591.36458333333326 | X510: =RC[-7]*RC[-6] -> 162.86111111111114 | Y510: =RC[-12]*RC[-12] -> 2.7777777777777209E-4 | Z510: =RC[-12]*RC[-12] -> 1.0850694444444433 | AA510: =RC[-12]*RC[-12] -> 9.5069444444444375 | AB510: =RC[-12]*RC[-12] -> 2462.640625 | AC510: =RC[-12]*RC[-12] -> 186.77777777777791 | AD510: =RC[-12]*RC[-12] -> 142.0069444444444 | AE510: =RC[-11]/SQRT(RC[-6]*RC[-1]) -> -1 | AF510: =RC[-11]/SQRT(RC[-6]*RC[-2]) -> -1 | AG510: =RC[-11]/SQRT(RC[-6]*RC[-3]) -> -1 | AH510: =RC[-11]/SQRT(RC[-6]*RC[-4]) -> 1 | AI510: =RC[-11]/SQRT(RC[-6]*RC[-5]) -> 1
A511: 38670 | B511: 北京 | C511: 65 | D511: 良 | E511: 0.79 | F511: 17 | G511: 25 | H511: 93 | I511: 53 | J511: 41 | L511: 2013-06-12T10:00:00.000 | M511: =RC[-8]-R[14]C[-8] -> -2.3333333333333428E-2 | N511: =RC[-8]-R[14]C[-8] -> 4.0416666666666661 | O511: =RC[-8]-R[14]C[-8] -> -4.9166666666666679 | P511: =RC[-8]-R[14]C[-8] -> -19.625 | Q511: =RC[-8]-R[14]C[-8] -> -17.666666666666671 | R511: =RC[-8]-R[14]C[-8] -> -15.916666666666664 | T511: =RC[-7]*RC[-2] -> 0.37138888888889032 | U511: =RC[-7]*RC[-3] -> -64.329861111111086 | V511: =RC[-7]*RC[-4] -> 78.256944444444457 | W511: =RC[-7]*RC[-5] -> 312.36458333333331 | X511: =RC[-7]*RC[-6] -> 281.19444444444446 | Y511: =RC[-12]*RC[-12] -> 5.4444444444444885E-4 | Z511: =RC[-12]*RC[-12] -> 16.335069444444439 | AA511: =RC[-12]*RC[-12] -> 24.173611111111121 | AB511: =RC[-12]*RC[-12] -> 385.140625 | AC511: =RC[-12]*RC[-12] -> 312.11111111111126 | AD511: =RC[-12]*RC[-12] -> 253.34027777777771 | AE511: =RC[-11]/SQRT(RC[-6]*RC[-1]) -> 1 | AF511: =RC[-11]/SQRT(RC[-6]*RC[-2]) -> -0.99999999999999978 | AG511: =RC[-11]/SQRT(RC[-6]*RC[-3]) -> 1 | AH511: =RC[-11]/SQRT(RC[-6]*RC[-4]) -> 1 | AI511: =RC[-11]/SQRT(RC[-6]*RC[-5]) -> 1
A512: 38746 | B512: 北京 | C512: 59 | D512: 良 | E512: 0.76 | F512: 18 | G512: 22 | H512: 116 | I512: 64 | J512: 56 | L512: 2013-06-12T11:00:00.000 | M512: =RC[-8]-R[13]C[-8] -> -5.3333333333333455E-2 | N512: =RC[-8]-R[13]C[-8] -> 5.0416666666666661 | O512: =RC[-8]-R[13]C[-8] -> -7.9166666666666679 | P512: =RC[-8]-R[13]C[-8] -> 3.375 | Q512: =RC[-8]-R[13]C[-8] -> -6.6666666666666714 | R512: =RC[-8]-R[13]C[-8] -> -0.9166666666666643 | T512: =RC[-7]*RC[-2] -> 4.8888888888888871E-2 | U512: =RC[-7]*RC[-3] -> -4.6215277777777652 | V512: =RC[-7]*RC[-4] -> 7.2569444444444269 | W512: =RC[-7]*RC[-5] -> -3.093749999999992 | X512: =RC[-7]*RC[-6] -> 6.1111111111111001 | Y512: =RC[-12]*RC[-12] -> 2.8444444444444576E-3 | Z512: =RC[-12]*RC[-12] -> 25.418402777777771 | AA512: =RC[-12]*RC[-12] -> 62.673611111111128 | AB512: =RC[-12]*RC[-12] -> 11.390625 | AC512: =RC[-12]*RC[-12] -> 44.444444444444507 | AD512: =RC[-12]*RC[-12] -> 0.84027777777777346 | AE512: =RC[-11]/SQRT(RC[-6]*RC[-1]) -> 0.99999999999999989 | AF512: =RC[-11]/SQRT(RC[-6]*RC[-2]) -> -1 | AG512: =RC[-11]/SQRT(RC[-6]*RC[-3]) -> 1 | AH512: =RC[-11]/SQRT(RC[-6]*RC[-4]) -> -1 | AI512: =RC[-11]/SQRT(RC[-6]*RC[-5]) -> 1
A513: 38822 | B513: 北京 | C513: 59 | D513: 良 | E513: 0.75 | F513: 17 | G513: 20 | H513: 139 | I513: 73 | J513: 53 | L513: 2013-06-12T12:00:00.000 | M513: =RC[-8]-R[12]C[-8] -> -6.3333333333333464E-2 | N513: =RC[-8]-R[12]C[-8] -> 4.0416666666666661 | O513: =RC[-8]-R[12]C[-8] -> -9.9166666666666679 | P513: =RC[-8]-R[12]C[-8] -> 26.375 | Q513: =RC[-8]-R[12]C[-8] -> 2.3333333333333286 | R513: =RC[-8]-R[12]C[-8] -> -3.9166666666666643 | T513: =RC[-7]*RC[-2] -> 0.24805555555555592 | U513: =RC[-7]*RC[-3] -> -15.8298611111111 | V513: =RC[-7]*RC[-4] -> 38.840277777777757 | W513: =RC[-7]*RC[-5] -> -103.30208333333327 | X513: =RC[-7]*RC[-6] -> -9.1388888888888644 | Y513: =RC[-12]*RC[-12] -> 4.0111111111111276E-3 | Z513: =RC[-12]*RC[-12] -> 16.335069444444439 | AA513: =RC[-12]*RC[-12] -> 98.3402777777778 | AB513: =RC[-12]*RC[-12] -> 695.640625 | AC513: =RC[-12]*RC[-12] -> 5.4444444444444224 | AD513: =RC[-12]*RC[-12] -> 15.340277777777759 | AE513: =RC[-11]/SQRT(RC[-6]*RC[-1]) -> 1 | AF513: =RC[-11]/SQRT(RC[-6]*RC[-2]) -> -1 | AG513: =RC[-11]/SQRT(RC[-6]*RC[-3]) -> 1 | AH513: =RC[-11]/SQRT(RC[-6]*RC[-4]) -> -1 | AI513: =RC[-11]/SQRT(RC[-6]*RC[-5]) -> -1
A514: 38898 | B514: 北京 | C514: 59 | D514: 良 | E514: 0.71 | F514: 17 | G514: 20 | H514: 156 | I514: 74 | J514: 55 | L514: 2013-06-12T13:00:00.000 | M514: =RC[-8]-R[11]C[-8] -> -0.1033333333333335 | N514: =RC[-8]-R[11]C[-8] -> 4.0416666666666661 | O514: =RC[-8]-R[11]C[-8] -> -9.9166666666666679 | P514: =RC[-8]-R[11]C[-8] -> 43.375 | Q514: =RC[-8]-R[11]C[-8] -> 3.3333333333333286 | R514: =RC[-8]-R[11]C[-8] -> -1.9166666666666643 | T514: =RC[-7]*RC[-2] -> 0.19805555555555562 | U514: =RC[-7]*RC[-3] -> -7.746527777777767 | V514: =RC[-7]*RC[-4] -> 19.006944444444422 | W514: =RC[-7]*RC[-5] -> -83.135416666666558 | X514: =RC[-7]*RC[-6] -> -6.3888888888888715 | Y514: =RC[-12]*RC[-12] -> 1.0677777777777812E-2 | Z514: =RC[-12]*RC[-12] -> 16.335069444444439 | AA514: =RC[-12]*RC[-12] -> 98.3402777777778 | AB514: =RC[-12]*RC[-12] -> 1881.390625 | AC514: =RC[-12]*RC[-12] -> 11.111111111111079 | AD514: =RC[-12]*RC[-12] -> 3.6736111111111018 | AE514: =RC[-11]/SQRT(RC[-6]*RC[-1]) -> 1 | AF514: =RC[-11]/SQRT(RC[-6]*RC[-2]) -> -1 | AG514: =RC[-11]/SQRT(RC[-6]*RC[-3]) -> 1 | AH514: =RC[-11]/SQRT(RC[-6]*RC[-4]) -> -1 | AI514: =RC[-11]/SQRT(RC[-6]*RC[-5]) -> -1
A515: 38974 | B515: 北京 | C515: 66 | D515: 良 | E515: 0.76 | F515: 20 | G515: 20 | H515: 175 | I515: 68 | J515: 62 | L515: 2013-06-12T14:00:00.000 | M515: =RC[-8]-R[10]C[-8] -> -5.3333333333333455E-2 | N515: =RC[-8]-R[10]C[-8] -> 7.0416666666666661 | O515: =RC[-8]-R[10]C[-8] -> -9.9166666666666679 | P515: =RC[-8]-R[10]C[-8] -> 62.375 | Q515: =RC[-8]-R[10]C[-8] -> -2.6666666666666714 | R515: =RC[-8]-R[10]C[-8] -> 5.0833333333333357 | T515: =RC[-7]*RC[-2] -> -0.27111111111111186 | U515: =RC[-7]*RC[-3] -> 35.7951388888889 | V515: =RC[-7]*RC[-4] -> -50.40972222222225 | W515: =RC[-7]*RC[-5] -> 317.0729166666668 | X515: =RC[-7]*RC[-6] -> -13.555555555555586 | Y515: =RC[-12]*RC[-12] -> 2.8444444444444576E-3 | Z515: =RC[-12]*RC[-12] -> 49.585069444444436 | AA515: =RC[-12]*RC[-12] -> 98.3402777777778 | AB515: =RC[-12]*RC[-12] -> 3890.640625 | AC515: =RC[-12]*RC[-12] -> 7.1111111111111365 | AD515: =RC[-12]*RC[-12] -> 25.840277777777803 | AE515: =RC[-11]/SQRT(RC[-6]*RC[-1]) -> -1 | AF515: =RC[-11]/SQRT(RC[-6]*RC[-2]) -> 1 | AG515: =RC[-11]/SQRT(RC[-6]*RC[-3]) -> -1 | AH515: =RC[-11]/SQRT(RC[-6]*RC[-4]) -> 1 | AI515: =RC[-11]/SQRT(RC[-6]*RC[-5]) -> -1
A516: 39050 | B516: 北京 | C516: 87 | D516: 良 | E516: 0.96 | F516: 23 | G516: 19 | H516: 194 | I516: 79 | J516: 76 | L516: 2013-06-12T15:00:00.000 | M516: =RC[-8]-R[9]C[-8] -> 0.1466666666666665 | N516: =RC[-8]-R[9]C[-8] -> 10.041666666666666 | O516: =RC[-8]-R[9]C[-8] -> -10.916666666666668 | P516: =RC[-8]-R[9]C[-8] -> 81.375 | Q516: =RC[-8]-R[9]C[-8] -> 8.3333333333333286 | R516: =RC[-8]-R[9]C[-8] -> 19.083333333333336 | T516: =RC[-7]*RC[-2] -> 2.7988888888888859 | U516: =RC[-7]*RC[-3] -> 191.62847222222223 | V516: =RC[-7]*RC[-4] -> -208.32638888888894 | W516: =RC[-7]*RC[-5] -> 1552.9062500000002 | X516: =RC[-7]*RC[-6] -> 159.02777777777771 | Y516: =RC[-12]*RC[-12] -> 2.1511111111111061E-2 | Z516: =RC[-12]*RC[-12] -> 100.83506944444443 | AA516: =RC[-12]*RC[-12] -> 119.17361111111114 | AB516: =RC[-12]*RC[-12] -> 6621.890625 | AC516: =RC[-12]*RC[-12] -> 69.444444444444372 | AD516: =RC[-12]*RC[-12] -> 364.1736111111112 | AE516: =RC[-11]/SQRT(RC[-6]*RC[-1]) -> 1 | AF516: =RC[-11]/SQRT(RC[-6]*RC[-2]) -> 1 | AG516: =RC[-11]/SQRT(RC[-6]*RC[-3]) -> -1 | AH516: =RC[-11]/SQRT(RC[-6]*RC[-4]) -> 1 | AI516: =RC[-11]/SQRT(RC[-6]*RC[-5]) -> 1
A517: 39126 | B517: 北京 | C517: 99 | D517: 良 | E517: 1.23 | F517: 24 | G517: 19 | H517: 208 | I517: 87 | J517: 67 | L517: 2013-06-12T16:00:00.000 | M517: =RC[-8]-R[8]C[-8] -> 0.41666666666666652 | N517: =RC[-8]-R[8]C[-8] -> 11.041666666666666 | O517: =RC[-8]-R[8]C[-8] -> -10.916666666666668 | P517: =RC[-8]-R[8]C[-8] -> 95.375 | Q517: =RC[-8]-R[8]C[-8] -> 16.333333333333329 | R517: =RC[-8]-R[8]C[-8] -> 10.083333333333336 | T517: =RC[-7]*RC[-2] -> 4.2013888888888884 | U517: =RC[-7]*RC[-3] -> 111.33680555555557 | V517: =RC[-7]*RC[-4] -> -110.07638888888893 | W517: =RC[-7]*RC[-5] -> 961.69791666666686 | X517: =RC[-7]*RC[-6] -> 164.69444444444443 | Y517: =RC[-12]*RC[-12] -> 0.17361111111111099 | Z517: =RC[-12]*RC[-12] -> 121.91840277777777 | AA517: =RC[-12]*RC[-12] -> 119.17361111111114 | AB517: =RC[-12]*RC[-12] -> 9096.390625 | AC517: =RC[-12]*RC[-12] -> 266.7777777777776 | AD517: =RC[-12]*RC[-12] -> 101.67361111111116 | AE517: =RC[-11]/SQRT(RC[-6]*RC[-1]) -> 1 | AF517: =RC[-11]/SQRT(RC[-6]*RC[-2]) -> 0.99999999999999989 | AG517: =RC[-11]/SQRT(RC[-6]*RC[-3]) -> -1 | AH517: =RC[-11]/SQRT(RC[-6]*RC[-4]) -> 1 | AI517: =RC[-11]/SQRT(RC[-6]*RC[-5]) -> 1
A518: 39202 | B518: 北京 | C518: 103 | D518: 轻度污染 | E518: 1.06 | F518: 24 | G518: 21 | H518: 212 | I518: 102 | J518: 86 | L518: 2013-06-12T17:00:00.000 | M518: =RC[-8]-R[7]C[-8] -> 0.24666666666666659 | N518: =RC[-8]-R[7]C[-8] -> 11.041666666666666 | O518: =RC[-8]-R[7]C[-8] -> -8.9166666666666679 | P518: =RC[-8]-R[7]C[-8] -> 99.375 | Q518: =RC[-8]-R[7]C[-8] -> 31.333333333333329 | R518: =RC[-8]-R[7]C[-8] -> 29.083333333333336 | T518: =RC[-7]*RC[-2] -> 7.1738888888888876 | U518: =RC[-7]*RC[-3] -> 321.12847222222223 | V518: =RC[-7]*RC[-4] -> -259.32638888888897 | W518: =RC[-7]*RC[-5] -> 2890.1562500000005 | X518: =RC[-7]*RC[-6] -> 911.27777777777771 | Y518: =RC[-12]*RC[-12] -> 6.0844444444444409E-2 | Z518: =RC[-12]*RC[-12] -> 121.91840277777777 | AA518: =RC[-12]*RC[-12] -> 79.506944444444471 | AB518: =RC[-12]*RC[-12] -> 9875.390625 | AC518: =RC[-12]*RC[-12] -> 981.77777777777749 | AD518: =RC[-12]*RC[-12] -> 845.84027777777794 | AE518: =RC[-11]/SQRT(RC[-6]*RC[-1]) -> 1 | AF518: =RC[-11]/SQRT(RC[-6]*RC[-2]) -> 1 | AG518: =RC[-11]/SQRT(RC[-6]*RC[-3]) -> -1 | AH518: =RC[-11]/SQRT(RC[-6]*RC[-4]) -> 1 | AI518: =RC[-11]/SQRT(RC[-6]*RC[-5]) -> 1
A519: 39278 | B519: 北京 | C519: 110 | D519: 轻度污染 | E519: 1.05 | F519: 22 | G519: 25 | H519: 210 | I519: 110 | J519: 89 | L519: 2013-06-12T18:00:00.000 | M519: =RC[-8]-R[6]C[-8] -> 0.23666666666666658 | N519: =RC[-8]-R[6]C[-8] -> 9.0416666666666661 | O519: =RC[-8]-R[6]C[-8] -> -4.9166666666666679 | P519: =RC[-8]-R[6]C[-8] -> 97.375 | Q519: =RC[-8]-R[6]C[-8] -> 39.333333333333329 | R519: =RC[-8]-R[6]C[-8] -> 32.083333333333336 | T519: =RC[-7]*RC[-2] -> 7.5930555555555532 | U519: =RC[-7]*RC[-3] -> 290.08680555555554 | V519: =RC[-7]*RC[-4] -> -157.7430555555556 | W519: =RC[-7]*RC[-5] -> 3124.1145833333335 | X519: =RC[-7]*RC[-6] -> 1261.9444444444443 | Y519: =RC[-12]*RC[-12] -> 5.6011111111111067E-2 | Z519: =RC[-12]*RC[-12] -> 81.7517361111111 | AA519: =RC[-12]*RC[-12] -> 24.173611111111121 | AB519: =RC[-12]*RC[-12] -> 9481.890625 | AC519: =RC[-12]*RC[-12] -> 1547.1111111111106 | AD519: =RC[-12]*RC[-12] -> 1029.3402777777778 | AE519: =RC[-11]/SQRT(RC[-6]*RC[-1]) -> 1 | AF519: =RC[-11]/SQRT(RC[-6]*RC[-2]) -> 1 | AG519: =RC[-11]/SQRT(RC[-6]*RC[-3]) -> -1 | AH519: =RC[-11]/SQRT(RC[-6]*RC[-4]) -> 1 | AI519: =RC[-11]/SQRT(RC[-6]*RC[-5]) -> 1
A520: 39354 | B520: 北京 | C520: 119 | D520: 轻度污染 | E520: 1.02 | F520: 19 | G520: 27 | H520: 206 | I520: 105 | J520: 84 | L520: 2013-06-12T19:00:00.000 | M520: =RC[-8]-R[5]C[-8] -> 0.20666666666666655 | N520: =RC[-8]-R[5]C[-8] -> 6.0416666666666661 | O520: =RC[-8]-R[5]C[-8] -> -2.9166666666666679 | P520: =RC[-8]-R[5]C[-8] -> 93.375 | Q520: =RC[-8]-R[5]C[-8] -> 34.333333333333329 | R520: =RC[-8]-R[5]C[-8] -> 27.083333333333336 | T520: =RC[-7]*RC[-2] -> 5.5972222222222197 | U520: =RC[-7]*RC[-3] -> 163.62847222222223 | V520: =RC[-7]*RC[-4] -> -78.9930555555556 | W520: =RC[-7]*RC[-5] -> 2528.90625 | X520: =RC[-7]*RC[-6] -> 929.86111111111109 | Y520: =RC[-12]*RC[-12] -> 4.2711111111111068E-2 | Z520: =RC[-12]*RC[-12] -> 36.501736111111107 | AA520: =RC[-12]*RC[-12] -> 8.5069444444444517 | AB520: =RC[-12]*RC[-12] -> 8718.890625 | AC520: =RC[-12]*RC[-12] -> 1178.7777777777774 | AD520: =RC[-12]*RC[-12] -> 733.50694444444457 | AE520: =RC[-11]/SQRT(RC[-6]*RC[-1]) -> 1 | AF520: =RC[-11]/SQRT(RC[-6]*RC[-2]) -> 1 | AG520: =RC[-11]/SQRT(RC[-6]*RC[-3]) -> -1 | AH520: =RC[-11]/SQRT(RC[-6]*RC[-4]) -> 1 | AI520: =RC[-11]/SQRT(RC[-6]*RC[-5]) -> 1
A521: 39430 | B521: 北京 | C521: 125 | D521: 轻度污染 | E521: 1 | F521: 15 | G521: 34 | H521: 183 | I521: 119 | J521: 97 | L521: 2013-06-12T20:00:00.000 | M521: =RC[-8]-R[4]C[-8] -> 0.18666666666666654 | N521: =RC[-8]-R[4]C[-8] -> 2.0416666666666661 | O521: =RC[-8]-R[4]C[-8] -> 4.0833333333333321 | P521: =RC[-8]-R[4]C[-8] -> 70.375 | Q521: =RC[-8]-R[4]C[-8] -> 48.333333333333329 | R521: =RC[-8]-R[4]C[-8] -> 40.083333333333336 | T521: =RC[-7]*RC[-2] -> 7.4822222222222177 | U521: =RC[-7]*RC[-3] -> 81.836805555555543 | V521: =RC[-7]*RC[-4] -> 163.67361111111109 | W521: =RC[-7]*RC[-5] -> 2820.8645833333335 | X521: =RC[-7]*RC[-6] -> 1937.3611111111111 | Y521: =RC[-12]*RC[-12] -> 3.4844444444444393E-2 | Z521: =RC[-12]*RC[-12] -> 4.168402777777775 | AA521: =RC[-12]*RC[-12] -> 16.6736111111111 | AB521: =RC[-12]*RC[-12] -> 4952.640625 | AC521: =RC[-12]*RC[-12] -> 2336.1111111111109 | AD521: =RC[-12]*RC[-12] -> 1606.6736111111113 | AE521: =RC[-11]/SQRT(RC[-6]*RC[-1]) -> 1.0000000000000002 | AF521: =RC[-11]/SQRT(RC[-6]*RC[-2]) -> 1.0000000000000002 | AG521: =RC[-11]/SQRT(RC[-6]*RC[-3]) -> 1.0000000000000002 | AH521: =RC[-11]/SQRT(RC[-6]*RC[-4]) -> 1 | AI521: =RC[-11]/SQRT(RC[-6]*RC[-5]) -> 1
A522: 39506 | B522: 北京 | C522: 125 | D522: 轻度污染 | E522: 1.0900000000000001 | F522: 11 | G522: 35 | H522: 153 | I522: 127 | J522: 101 | L522: 2013-06-12T21:00:00.000 | M522: =RC[-8]-R[3]C[-8] -> 0.27666666666666662 | N522: =RC[-8]-R[3]C[-8] -> -1.9583333333333339 | O522: =RC[-8]-R[3]C[-8] -> 5.0833333333333321 | P522: =RC[-8]-R[3]C[-8] -> 40.375 | Q522: =RC[-8]-R[3]C[-8] -> 56.333333333333329 | R522: =RC[-8]-R[3]C[-8] -> 44.083333333333336 | T522: =RC[-7]*RC[-2] -> 12.196388888888887 | U522: =RC[-7]*RC[-3] -> -86.329861111111143 | V522: =RC[-7]*RC[-4] -> 224.09027777777774 | W522: =RC[-7]*RC[-5] -> 1779.8645833333335 | X522: =RC[-7]*RC[-6] -> 2483.3611111111109 | Y522: =RC[-12]*RC[-12] -> 7.6544444444444415E-2 | Z522: =RC[-12]*RC[-12] -> 3.8350694444444469 | AA522: =RC[-12]*RC[-12] -> 25.840277777777764 | AB522: =RC[-12]*RC[-12] -> 1630.140625 | AC522: =RC[-12]*RC[-12] -> 3173.4444444444439 | AD522: =RC[-12]*RC[-12] -> 1943.3402777777781 | AE522: =RC[-11]/SQRT(RC[-6]*RC[-1]) -> 0.99999999999999989 | AF522: =RC[-11]/SQRT(RC[-6]*RC[-2]) -> -1 | AG522: =RC[-11]/SQRT(RC[-6]*RC[-3]) -> 1 | AH522: =RC[-11]/SQRT(RC[-6]*RC[-4]) -> 1 | AI522: =RC[-11]/SQRT(RC[-6]*RC[-5]) -> 1
A523: 39582 | B523: 北京 | C523: 120 | D523: 轻度污染 | E523: 1.06 | F523: 14 | G523: 41 | H523: 124 | I523: 123 | J523: 99 | L523: 2013-06-12T22:00:00.000 | M523: =RC[-8]-R[2]C[-8] -> 0.24666666666666659 | N523: =RC[-8]-R[2]C[-8] -> 1.0416666666666661 | O523: =RC[-8]-R[2]C[-8] -> 11.083333333333332 | P523: =RC[-8]-R[2]C[-8] -> 11.375 | Q523: =RC[-8]-R[2]C[-8] -> 52.333333333333329 | R523: =RC[-8]-R[2]C[-8] -> 42.083333333333336 | T523: =RC[-7]*RC[-2] -> 10.380555555555553 | U523: =RC[-7]*RC[-3] -> 43.836805555555536 | V523: =RC[-7]*RC[-4] -> 466.42361111111109 | W523: =RC[-7]*RC[-5] -> 478.69791666666669 | X523: =RC[-7]*RC[-6] -> 2202.3611111111109 | Y523: =RC[-12]*RC[-12] -> 6.0844444444444409E-2 | Z523: =RC[-12]*RC[-12] -> 1.0850694444444433 | AA523: =RC[-12]*RC[-12] -> 122.84027777777776 | AB523: =RC[-12]*RC[-12] -> 129.390625 | AC523: =RC[-12]*RC[-12] -> 2738.7777777777774 | AD523: =RC[-12]*RC[-12] -> 1771.0069444444446 | AE523: =RC[-11]/SQRT(RC[-6]*RC[-1]) -> 1 | AF523: =RC[-11]/SQRT(RC[-6]*RC[-2]) -> 1 | AG523: =RC[-11]/SQRT(RC[-6]*RC[-3]) -> 1 | AH523: =RC[-11]/SQRT(RC[-6]*RC[-4]) -> 1 | AI523: =RC[-11]/SQRT(RC[-6]*RC[-5]) -> 1
A524: 39658 | B524: 北京 | C524: 113 | D524: 轻度污染 | E524: 0.85 | F524: 17 | G524: 41 | H524: 120 | I524: 112 | J524: 101 | L524: 2013-06-12T23:00:00.000 | M524: =RC[-8]-R[1]C[-8] -> 3.6666666666666514E-2 | N524: =RC[-8]-R[1]C[-8] -> 4.0416666666666661 | O524: =RC[-8]-R[1]C[-8] -> 11.083333333333332 | P524: =RC[-8]-R[1]C[-8] -> 7.375 | Q524: =RC[-8]-R[1]C[-8] -> 41.333333333333329 | R524: =RC[-8]-R[1]C[-8] -> 44.083333333333336 | T524: =RC[-7]*RC[-2] -> 1.6163888888888822 | U524: =RC[-7]*RC[-3] -> 178.17013888888889 | V524: =RC[-7]*RC[-4] -> 488.59027777777777 | W524: =RC[-7]*RC[-5] -> 325.11458333333337 | X524: =RC[-7]*RC[-6] -> 1822.1111111111111 | Y524: =RC[-12]*RC[-12] -> 1.3444444444444333E-3 | Z524: =RC[-12]*RC[-12] -> 16.335069444444439 | AA524: =RC[-12]*RC[-12] -> 122.84027777777776 | AB524: =RC[-12]*RC[-12] -> 54.390625 | AC524: =RC[-12]*RC[-12] -> 1708.4444444444441 | AD524: =RC[-12]*RC[-12] -> 1943.3402777777781 | AE524: =RC[-11]/SQRT(RC[-6]*RC[-1]) -> 1 | AF524: =RC[-11]/SQRT(RC[-6]*RC[-2]) -> 1 | AG524: =RC[-11]/SQRT(RC[-6]*RC[-3]) -> 1 | AH524: =RC[-11]/SQRT(RC[-6]*RC[-4]) -> 1 | AI524: =RC[-11]/SQRT(RC[-6]*RC[-5]) -> 1
E525: =AVERAGE(R[-24]C:R[-1]C) -> 0.81333333333333346 | F525: =AVERAGE(R[-24]C:R[-1]C) -> 12.958333333333334 | G525: =AVERAGE(R[-24]C:R[-1]C) -> 29.916666666666668 | H525: =AVERAGE(R[-24]C:R[-1]C) -> 112.625 | I525: =AVERAGE(R[-24]C:R[-1]C) -> 70.666666666666671 | J525: =AVERAGE(R[-24]C:R[-1]C) -> 56.916666666666664 | M525: =RC[-8]-RC[-8] -> 0 | N525: =RC[-8]-RC[-8] -> 0 | O525: =RC[-8]-RC[-8] -> 0 | P525: =RC[-8]-RC[-8] -> 0 | Q525: =RC[-8]-RC[-8] -> 0 | R525: =RC[-8]-RC[-8] -> 0 | T525: =SUM(R[-24]C:R[-1]C) -> 127.53666666666663 | U525: =SUM(R[-24]C:R[-1]C) -> 3668.9166666666656 | V525: =SUM(R[-24]C:R[-1]C) -> -300.1666666666668 | W525: =SUM(R[-24]C:R[-1]C) -> 35496.25 | X525: =SUM(R[-24]C:R[-1]C) -> 22225.333333333332 | Y525: =SUM(R[-24]C:R[-1]C) -> 1.1419333333333335 | Z525: =SUM(R[-24]C:R[-1]C) -> 1326.9583333333333 | AA525: =SUM(R[-24]C:R[-1]C) -> 1507.8333333333335 | AB525: =SUM(R[-24]C:R[-1]C) -> 110079.625 | AC525: =SUM(R[-24]C:R[-1]C) -> 25845.333333333339 | AD525: =SUM(R[-24]C:R[-1]C) -> 19589.833333333332 | AE525: =RC[-11]/SQRT(RC[-6]*RC[-1]) -> 0.85270599484424059 | AF525: =RC[-11]/SQRT(RC[-6]*RC[-2]) -> 0.71960443941114638 | AG525: =RC[-11]/SQRT(RC[-6]*RC[-3]) -> -5.5229412302791381E-2 | AH525: =RC[-11]/SQRT(RC[-6]*RC[-4]) -> 0.76438759988368621 | AI525: =RC[-11]/SQRT(RC[-6]*RC[-5]) -> 0.98773818562378224
A526: 39734 | B526: 北京 | C526: 102 | D526: 轻度污染 | E526: 0.72 | F526: 18 | G526: 33 | H526: 122 | I526: 100 | J526: 84 | L526: 2013-06-13T00:00:00.000 | M526: =RC[-8]-R[24]C[-8] -> -0.52416666666666667 | N526: =RC[-8]-R[24]C[-8] -> -12.041666666666668 | O526: =RC[-8]-R[24]C[-8] -> -9.375 | P526: =RC[-8]-R[24]C[-8] -> -12.875 | Q526: =RC[-8]-R[24]C[-8] -> -34.375 | R526: =RC[-8]-R[24]C[-8] -> -18.875 | T526: =RC[-7]*RC[-2] -> 9.8936458333333341 | U526: =RC[-7]*RC[-3] -> 227.28645833333334 | V526: =RC[-7]*RC[-4] -> 176.953125 | W526: =RC[-7]*RC[-5] -> 243.015625 | X526: =RC[-7]*RC[-6] -> 648.828125 | Y526: =RC[-12]*RC[-12] -> 0.27475069444444444 | Z526: =RC[-12]*RC[-12] -> 145.00173611111114 | AA526: =RC[-12]*RC[-12] -> 87.890625 | AB526: =RC[-12]*RC[-12] -> 165.765625 | AC526: =RC[-12]*RC[-12] -> 1181.640625 | AD526: =RC[-12]*RC[-12] -> 356.265625 | AE526: =RC[-11]/SQRT(RC[-6]*RC[-1]) -> 1.0000000000000002 | AF526: =RC[-11]/SQRT(RC[-6]*RC[-2]) -> 1 | AG526: =RC[-11]/SQRT(RC[-6]*RC[-3]) -> 1 | AH526: =RC[-11]/SQRT(RC[-6]*RC[-4]) -> 1 | AI526: =RC[-11]/SQRT(RC[-6]*RC[-5]) -> 1
A527: 39810 | B527: 北京 | C527: 92 | D527: 良 | E527: 0.66 | F527: 17 | G527: 33 | H527: 110 | I527: 101 | J527: 77 | L527: 2013-06-13T01:00:00.000 | M527: =RC[-8]-R[23]C[-8] -> -0.58416666666666661 | N527: =RC[-8]-R[23]C[-8] -> -13.041666666666668 | O527: =RC[-8]-R[23]C[-8] -> -9.375 | P527: =RC[-8]-R[23]C[-8] -> -24.875 | Q527: =RC[-8]-R[23]C[-8] -> -33.375 | R527: =RC[-8]-R[23]C[-8] -> -25.875 | T527: =RC[-7]*RC[-2] -> 15.115312499999998 | U527: =RC[-7]*RC[-3] -> 337.45312500000006 | V527: =RC[-7]*RC[-4] -> 242.578125 | W527: =RC[-7]*RC[-5] -> 643.640625 | X527: =RC[-7]*RC[-6] -> 863.578125 | Y527: =RC[-12]*RC[-12] -> 0.34125069444444439 | Z527: =RC[-12]*RC[-12] -> 170.08506944444449 | AA527: =RC[-12]*RC[-12] -> 87.890625 | AB527: =RC[-12]*RC[-12] -> 618.765625 | AC527: =RC[-12]*RC[-12] -> 1113.890625 | AD527: =RC[-12]*RC[-12] -> 669.515625 | AE527: =RC[-11]/SQRT(RC[-6]*RC[-1]) -> 1 | AF527: =RC[-11]/SQRT(RC[-6]*RC[-2]) -> 1 | AG527: =RC[-11]/SQRT(RC[-6]*RC[-3]) -> 1 | AH527: =RC[-11]/SQRT(RC[-6]*RC[-4]) -> 1 | AI527: =RC[-11]/SQRT(RC[-6]*RC[-5]) -> 1
A528: 39886 | B528: 北京 | C528: 87 | D528: 良 | E528: 0.6 | F528: 14 | G528: 35 | H528: 79 | I528: 95 | J528: 84 | L528: 2013-06-13T02:00:00.000 | M528: =RC[-8]-R[22]C[-8] -> -0.64416666666666667 | N528: =RC[-8]-R[22]C[-8] -> -16.041666666666668 | O528: =RC[-8]-R[22]C[-8] -> -7.375 | P528: =RC[-8]-R[22]C[-8] -> -55.875 | Q528: =RC[-8]-R[22]C[-8] -> -39.375 | R528: =RC[-8]-R[22]C[-8] -> -18.875 | T528: =RC[-7]*RC[-2] -> 12.158645833333333 | U528: =RC[-7]*RC[-3] -> 302.78645833333337 | V528: =RC[-7]*RC[-4] -> 139.203125 | W528: =RC[-7]*RC[-5] -> 1054.640625 | X528: =RC[-7]*RC[-6] -> 743.203125 | Y528: =RC[-12]*RC[-12] -> 0.41495069444444443 | Z528: =RC[-12]*RC[-12] -> 257.33506944444446 | AA528: =RC[-12]*RC[-12] -> 54.390625 | AB528: =RC[-12]*RC[-12] -> 3122.015625 | AC528: =RC[-12]*RC[-12] -> 1550.390625 | AD528: =RC[-12]*RC[-12] -> 356.265625 | AE528: =RC[-11]/SQRT(RC[-6]*RC[-1]) -> 1 | AF528: =RC[-11]/SQRT(RC[-6]*RC[-2]) -> 1.0000000000000002 | AG528: =RC[-11]/SQRT(RC[-6]*RC[-3]) -> 1 | AH528: =RC[-11]/SQRT(RC[-6]*RC[-4]) -> 1 | AI528: =RC[-11]/SQRT(RC[-6]*RC[-5]) -> 1
A529: 39962 | B529: 北京 | C529: 88 | D529: 良 | E529: 0.78 | F529: 13 | G529: 35 | H529: 77 | I529: 92 | J529: 84 | L529: 2013-06-13T03:00:00.000 | M529: =RC[-8]-R[21]C[-8] -> -0.46416666666666662 | N529: =RC[-8]-R[21]C[-8] -> -17.041666666666668 | O529: =RC[-8]-R[21]C[-8] -> -7.375 | P529: =RC[-8]-R[21]C[-8] -> -57.875 | Q529: =RC[-8]-R[21]C[-8] -> -42.375 | R529: =RC[-8]-R[21]C[-8] -> -18.875 | T529: =RC[-7]*RC[-2] -> 8.7611458333333321 | U529: =RC[-7]*RC[-3] -> 321.66145833333337 | V529: =RC[-7]*RC[-4] -> 139.203125 | W529: =RC[-7]*RC[-5] -> 1092.390625 | X529: =RC[-7]*RC[-6] -> 799.828125 | Y529: =RC[-12]*RC[-12] -> 0.2154506944444444 | Z529: =RC[-12]*RC[-12] -> 290.41840277777783 | AA529: =RC[-12]*RC[-12] -> 54.390625 | AB529: =RC[-12]*RC[-12] -> 3349.515625 | AC529: =RC[-12]*RC[-12] -> 1795.640625 | AD529: =RC[-12]*RC[-12] -> 356.265625 | AE529: =RC[-11]/SQRT(RC[-6]*RC[-1]) -> 1 | AF529: =RC[-11]/SQRT(RC[-6]*RC[-2]) -> 1 | AG529: =RC[-11]/SQRT(RC[-6]*RC[-3]) -> 1 | AH529: =RC[-11]/SQRT(RC[-6]*RC[-4]) -> 1 | AI529: =RC[-11]/SQRT(RC[-6]*RC[-5]) -> 1
A530: 40038 | B530: 北京 | C530: 90 | D530: 良 | E530: 0.7 | F530: 12 | G530: 45 | H530: 54 | I530: 97 | J530: 97 | L530: 2013-06-13T04:00:00.000 | M530: =RC[-8]-R[20]C[-8] -> -0.54416666666666669 | N530: =RC[-8]-R[20]C[-8] -> -18.041666666666668 | O530: =RC[-8]-R[20]C[-8] -> 2.625 | P530: =RC[-8]-R[20]C[-8] -> -80.875 | Q530: =RC[-8]-R[20]C[-8] -> -37.375 | R530: =RC[-8]-R[20]C[-8] -> -5.875 | T530: =RC[-7]*RC[-2] -> 3.1969791666666669 | U530: =RC[-7]*RC[-3] -> 105.99479166666667 | V530: =RC[-7]*RC[-4] -> -15.421875 | W530: =RC[-7]*RC[-5] -> 475.140625 | X530: =RC[-7]*RC[-6] -> 219.578125 | Y530: =RC[-12]*RC[-12] -> 0.29611736111111114 | Z530: =RC[-12]*RC[-12] -> 325.50173611111114 | AA530: =RC[-12]*RC[-12] -> 6.890625 | AB530: =RC[-12]*RC[-12] -> 6540.765625 | AC530: =RC[-12]*RC[-12] -> 1396.890625 | AD530: =RC[-12]*RC[-12] -> 34.515625 | AE530: =RC[-11]/SQRT(RC[-6]*RC[-1]) -> 1 | AF530: =RC[-11]/SQRT(RC[-6]*RC[-2]) -> 1 | AG530: =RC[-11]/SQRT(RC[-6]*RC[-3]) -> -1 | AH530: =RC[-11]/SQRT(RC[-6]*RC[-4]) -> 1 | AI530: =RC[-11]/SQRT(RC[-6]*RC[-5]) -> 1
A531: 40114 | B531: 北京 | C531: 92 | D531: 良 | E531: 0.89 | F531: 14 | G531: 30 | H531: 52 | I531: 90 | J531: 88 | L531: 2013-06-13T05:00:00.000 | M531: =RC[-8]-R[19]C[-8] -> -0.35416666666666663 | N531: =RC[-8]-R[19]C[-8] -> -16.041666666666668 | O531: =RC[-8]-R[19]C[-8] -> -12.375 | P531: =RC[-8]-R[19]C[-8] -> -82.875 | Q531: =RC[-8]-R[19]C[-8] -> -44.375 | R531: =RC[-8]-R[19]C[-8] -> -14.875 | T531: =RC[-7]*RC[-2] -> 5.2682291666666661 | U531: =RC[-7]*RC[-3] -> 238.61979166666669 | V531: =RC[-7]*RC[-4] -> 184.078125 | W531: =RC[-7]*RC[-5] -> 1232.765625 | X531: =RC[-7]*RC[-6] -> 660.078125 | Y531: =RC[-12]*RC[-12] -> 0.12543402777777776 | Z531: =RC[-12]*RC[-12] -> 257.33506944444446 | AA531: =RC[-12]*RC[-12] -> 153.140625 | AB531: =RC[-12]*RC[-12] -> 6868.265625 | AC531: =RC[-12]*RC[-12] -> 1969.140625 | AD531: =RC[-12]*RC[-12] -> 221.265625 | AE531: =RC[-11]/SQRT(RC[-6]*RC[-1]) -> 1 | AF531: =RC[-11]/SQRT(RC[-6]*RC[-2]) -> 1 | AG531: =RC[-11]/SQRT(RC[-6]*RC[-3]) -> 1 | AH531: =RC[-11]/SQRT(RC[-6]*RC[-4]) -> 1 | AI531: =RC[-11]/SQRT(RC[-6]*RC[-5]) -> 1
A532: 40190 | B532: 北京 | C532: 93 | D532: 良 | E532: 1.07 | F532: 18 | G532: 42 | H532: 45 | I532: 93 | J532: 89 | L532: 2013-06-13T06:00:00.000 | M532: =RC[-8]-R[18]C[-8] -> -0.17416666666666658 | N532: =RC[-8]-R[18]C[-8] -> -12.041666666666668 | O532: =RC[-8]-R[18]C[-8] -> -0.375 | P532: =RC[-8]-R[18]C[-8] -> -89.875 | Q532: =RC[-8]-R[18]C[-8] -> -41.375 | R532: =RC[-8]-R[18]C[-8] -> -13.875 | T532: =RC[-7]*RC[-2] -> 2.4165624999999986 | U532: =RC[-7]*RC[-3] -> 167.07812500000003 | V532: =RC[-7]*RC[-4] -> 5.203125 | W532: =RC[-7]*RC[-5] -> 1247.015625 | X532: =RC[-7]*RC[-6] -> 574.078125 | Y532: =RC[-12]*RC[-12] -> 3.0334027777777748E-2 | Z532: =RC[-12]*RC[-12] -> 145.00173611111114 | AA532: =RC[-12]*RC[-12] -> 0.140625 | AB532: =RC[-12]*RC[-12] -> 8077.515625 | AC532: =RC[-12]*RC[-12] -> 1711.890625 | AD532: =RC[-12]*RC[-12] -> 192.515625 | AE532: =RC[-11]/SQRT(RC[-6]*RC[-1]) -> 0.99999999999999978 | AF532: =RC[-11]/SQRT(RC[-6]*RC[-2]) -> 1 | AG532: =RC[-11]/SQRT(RC[-6]*RC[-3]) -> 1 | AH532: =RC[-11]/SQRT(RC[-6]*RC[-4]) -> 1 | AI532: =RC[-11]/SQRT(RC[-6]*RC[-5]) -> 1
A533: 40266 | B533: 北京 | C533: 96 | D533: 良 | E533: 1.27 | F533: 27 | G533: 48 | H533: 45 | I533: 112 | J533: 100 | L533: 2013-06-13T07:00:00.000 | M533: =RC[-8]-R[17]C[-8] -> 2.5833333333333375E-2 | N533: =RC[-8]-R[17]C[-8] -> -3.0416666666666679 | O533: =RC[-8]-R[17]C[-8] -> 5.625 | P533: =RC[-8]-R[17]C[-8] -> -89.875 | Q533: =RC[-8]-R[17]C[-8] -> -22.375 | R533: =RC[-8]-R[17]C[-8] -> -2.875 | T533: =RC[-7]*RC[-2] -> -7.4270833333333452E-2 | U533: =RC[-7]*RC[-3] -> 8.7447916666666696 | V533: =RC[-7]*RC[-4] -> -16.171875 | W533: =RC[-7]*RC[-5] -> 258.390625 | X533: =RC[-7]*RC[-6] -> 64.328125 | Y533: =RC[-12]*RC[-12] -> 6.6736111111111325E-4 | Z533: =RC[-12]*RC[-12] -> 9.2517361111111178 | AA533: =RC[-12]*RC[-12] -> 31.640625 | AB533: =RC[-12]*RC[-12] -> 8077.515625 | AC533: =RC[-12]*RC[-12] -> 500.640625 | AD533: =RC[-12]*RC[-12] -> 8.265625 | AE533: =RC[-11]/SQRT(RC[-6]*RC[-1]) -> -1 | AF533: =RC[-11]/SQRT(RC[-6]*RC[-2]) -> 1 | AG533: =RC[-11]/SQRT(RC[-6]*RC[-3]) -> -1 | AH533: =RC[-11]/SQRT(RC[-6]*RC[-4]) -> 1 | AI533: =RC[-11]/SQRT(RC[-6]*RC[-5]) -> 1
A534: 40342 | B534: 北京 | C534: 98 | D534: 良 | E534: 1.4 | F534: 41 | G534: 45 | H534: 59 | I534: 133 | J534: 99 | L534: 2013-06-13T08:00:00.000 | M534: =RC[-8]-R[16]C[-8] -> 0.15583333333333327 | N534: =RC[-8]-R[16]C[-8] -> 10.958333333333332 | O534: =RC[-8]-R[16]C[-8] -> 2.625 | P534: =RC[-8]-R[16]C[-8] -> -75.875 | Q534: =RC[-8]-R[16]C[-8] -> -1.375 | R534: =RC[-8]-R[16]C[-8] -> -3.875 | T534: =RC[-7]*RC[-2] -> -0.60385416666666636 | U534: =RC[-7]*RC[-3] -> -42.463541666666664 | V534: =RC[-7]*RC[-4] -> -10.171875 | W534: =RC[-7]*RC[-5] -> 294.015625 | X534: =RC[-7]*RC[-6] -> 5.328125 | Y534: =RC[-12]*RC[-12] -> 2.4284027777777759E-2 | Z534: =RC[-12]*RC[-12] -> 120.08506944444441 | AA534: =RC[-12]*RC[-12] -> 6.890625 | AB534: =RC[-12]*RC[-12] -> 5757.015625 | AC534: =RC[-12]*RC[-12] -> 1.890625 | AD534: =RC[-12]*RC[-12] -> 15.015625 | AE534: =RC[-11]/SQRT(RC[-6]*RC[-1]) -> -0.99999999999999978 | AF534: =RC[-11]/SQRT(RC[-6]*RC[-2]) -> -1 | AG534: =RC[-11]/SQRT(RC[-6]*RC[-3]) -> -1 | AH534: =RC[-11]/SQRT(RC[-6]*RC[-4]) -> 1 | AI534: =RC[-11]/SQRT(RC[-6]*RC[-5]) -> 1
A535: 40418 | B535: 北京 | C535: 100 | D535: 良 | E535: 1.57 | F535: 54 | G535: 43 | H535: 78 | I535: 136 | J535: 116 | L535: 2013-06-13T09:00:00.000 | M535: =RC[-8]-R[15]C[-8] -> 0.32583333333333342 | N535: =RC[-8]-R[15]C[-8] -> 23.958333333333332 | O535: =RC[-8]-R[15]C[-8] -> 0.625 | P535: =RC[-8]-R[15]C[-8] -> -56.875 | Q535: =RC[-8]-R[15]C[-8] -> 1.625 | R535: =RC[-8]-R[15]C[-8] -> 13.125 | T535: =RC[-7]*RC[-2] -> 4.2765625000000007 | U535: =RC[-7]*RC[-3] -> 314.453125 | V535: =RC[-7]*RC[-4] -> 8.203125 | W535: =RC[-7]*RC[-5] -> -746.484375 | X535: =RC[-7]*RC[-6] -> 21.328125 | Y535: =RC[-12]*RC[-12] -> 0.10616736111111116 | Z535: =RC[-12]*RC[-12] -> 574.00173611111109 | AA535: =RC[-12]*RC[-12] -> 0.390625 | AB535: =RC[-12]*RC[-12] -> 3234.765625 | AC535: =RC[-12]*RC[-12] -> 2.640625 | AD535: =RC[-12]*RC[-12] -> 172.265625 | AE535: =RC[-11]/SQRT(RC[-6]*RC[-1]) -> 1 | AF535: =RC[-11]/SQRT(RC[-6]*RC[-2]) -> 1 | AG535: =RC[-11]/SQRT(RC[-6]*RC[-3]) -> 1 | AH535: =RC[-11]/SQRT(RC[-6]*RC[-4]) -> -1 | AI535: =RC[-11]/SQRT(RC[-6]*RC[-5]) -> 1
A536: 40494 | B536: 北京 | C536: 104 | D536: 轻度污染 | E536: 1.7 | F536: 59 | G536: 42 | H536: 96 | I536: 141 | J536: 117 | L536: 2013-06-13T10:00:00.000 | M536: =RC[-8]-R[14]C[-8] -> 0.45583333333333331 | N536: =RC[-8]-R[14]C[-8] -> 28.958333333333332 | O536: =RC[-8]-R[14]C[-8] -> -0.375 | P536: =RC[-8]-R[14]C[-8] -> -38.875 | Q536: =RC[-8]-R[14]C[-8] -> 6.625 | R536: =RC[-8]-R[14]C[-8] -> 14.125 | T536: =RC[-7]*RC[-2] -> 6.4386458333333332 | U536: =RC[-7]*RC[-3] -> 409.03645833333331 | V536: =RC[-7]*RC[-4] -> -5.296875 | W536: =RC[-7]*RC[-5] -> -549.109375 | X536: =RC[-7]*RC[-6] -> 93.578125 | Y536: =RC[-12]*RC[-12] -> 0.20778402777777777 | Z536: =RC[-12]*RC[-12] -> 838.58506944444434 | AA536: =RC[-12]*RC[-12] -> 0.140625 | AB536: =RC[-12]*RC[-12] -> 1511.265625 | AC536: =RC[-12]*RC[-12] -> 43.890625 | AD536: =RC[-12]*RC[-12] -> 199.515625 | AE536: =RC[-11]/SQRT(RC[-6]*RC[-1]) -> 1 | AF536: =RC[-11]/SQRT(RC[-6]*RC[-2]) -> 1 | AG536: =RC[-11]/SQRT(RC[-6]*RC[-3]) -> -1 | AH536: =RC[-11]/SQRT(RC[-6]*RC[-4]) -> -1 | AI536: =RC[-11]/SQRT(RC[-6]*RC[-5]) -> 1
A537: 40570 | B537: 北京 | C537: 107 | D537: 轻度污染 | E537: 1.7 | F537: 61 | G537: 41 | H537: 118 | I537: 158 | J537: 111 | L537: 2013-06-13T11:00:00.000 | M537: =RC[-8]-R[13]C[-8] -> 0.45583333333333331 | N537: =RC[-8]-R[13]C[-8] -> 30.958333333333332 | O537: =RC[-8]-R[13]C[-8] -> -1.375 | P537: =RC[-8]-R[13]C[-8] -> -16.875 | Q537: =RC[-8]-R[13]C[-8] -> 23.625 | R537: =RC[-8]-R[13]C[-8] -> 8.125 | T537: =RC[-7]*RC[-2] -> 3.7036458333333333 | U537: =RC[-7]*RC[-3] -> 251.53645833333331 | V537: =RC[-7]*RC[-4] -> -11.171875 | W537: =RC[-7]*RC[-5] -> -137.109375 | X537: =RC[-7]*RC[-6] -> 191.953125 | Y537: =RC[-12]*RC[-12] -> 0.20778402777777777 | Z537: =RC[-12]*RC[-12] -> 958.41840277777771 | AA537: =RC[-12]*RC[-12] -> 1.890625 | AB537: =RC[-12]*RC[-12] -> 284.765625 | AC537: =RC[-12]*RC[-12] -> 558.140625 | AD537: =RC[-12]*RC[-12] -> 66.015625 | AE537: =RC[-11]/SQRT(RC[-6]*RC[-1]) -> 1 | AF537: =RC[-11]/SQRT(RC[-6]*RC[-2]) -> 0.99999999999999989 | AG537: =RC[-11]/SQRT(RC[-6]*RC[-3]) -> -1 | AH537: =RC[-11]/SQRT(RC[-6]*RC[-4]) -> -1 | AI537: =RC[-11]/SQRT(RC[-6]*RC[-5]) -> 1
A538: 40646 | B538: 北京 | C538: 111 | D538: 轻度污染 | E538: 1.85 | F538: 57 | G538: 42 | H538: 147 | I538: 170 | J538: 119 | L538: 2013-06-13T12:00:00.000 | M538: =RC[-8]-R[12]C[-8] -> 0.60583333333333345 | N538: =RC[-8]-R[12]C[-8] -> 26.958333333333332 | O538: =RC[-8]-R[12]C[-8] -> -0.375 | P538: =RC[-8]-R[12]C[-8] -> 12.125 | Q538: =RC[-8]-R[12]C[-8] -> 35.625 | R538: =RC[-8]-R[12]C[-8] -> 16.125 | T538: =RC[-7]*RC[-2] -> 9.7690625000000022 | U538: =RC[-7]*RC[-3] -> 434.703125 | V538: =RC[-7]*RC[-4] -> -6.046875 | W538: =RC[-7]*RC[-5] -> 195.515625 | X538: =RC[-7]*RC[-6] -> 574.453125 | Y538: =RC[-12]*RC[-12] -> 0.36703402777777794 | Z538: =RC[-12]*RC[-12] -> 726.75173611111109 | AA538: =RC[-12]*RC[-12] -> 0.140625 | AB538: =RC[-12]*RC[-12] -> 147.015625 | AC538: =RC[-12]*RC[-12] -> 1269.140625 | AD538: =RC[-12]*RC[-12] -> 260.015625 | AE538: =RC[-11]/SQRT(RC[-6]*RC[-1]) -> 1 | AF538: =RC[-11]/SQRT(RC[-6]*RC[-2]) -> 1 | AG538: =RC[-11]/SQRT(RC[-6]*RC[-3]) -> -1 | AH538: =RC[-11]/SQRT(RC[-6]*RC[-4]) -> 1 | AI538: =RC[-11]/SQRT(RC[-6]*RC[-5]) -> 1
A539: 40722 | B539: 北京 | C539: 116 | D539: 轻度污染 | E539: 1.93 | F539: 54 | G539: 45 | H539: 181 | I539: 197 | J539: 119 | L539: 2013-06-13T13:00:00.000 | M539: =RC[-8]-R[11]C[-8] -> 0.68583333333333329 | N539: =RC[-8]-R[11]C[-8] -> 23.958333333333332 | O539: =RC[-8]-R[11]C[-8] -> 2.625 | P539: =RC[-8]-R[11]C[-8] -> 46.125 | Q539: =RC[-8]-R[11]C[-8] -> 62.625 | R539: =RC[-8]-R[11]C[-8] -> 16.125 | T539: =RC[-7]*RC[-2] -> 11.0590625 | U539: =RC[-7]*RC[-3] -> 386.328125 | V539: =RC[-7]*RC[-4] -> 42.328125 | W539: =RC[-7]*RC[-5] -> 743.765625 | X539: =RC[-7]*RC[-6] -> 1009.828125 | Y539: =RC[-12]*RC[-12] -> 0.47036736111111105 | Z539: =RC[-12]*RC[-12] -> 574.00173611111109 | AA539: =RC[-12]*RC[-12] -> 6.890625 | AB539: =RC[-12]*RC[-12] -> 2127.515625 | AC539: =RC[-12]*RC[-12] -> 3921.890625 | AD539: =RC[-12]*RC[-12] -> 260.015625 | AE539: =RC[-11]/SQRT(RC[-6]*RC[-1]) -> 1 | AF539: =RC[-11]/SQRT(RC[-6]*RC[-2]) -> 1 | AG539: =RC[-11]/SQRT(RC[-6]*RC[-3]) -> 1 | AH539: =RC[-11]/SQRT(RC[-6]*RC[-4]) -> 1 | AI539: =RC[-11]/SQRT(RC[-6]*RC[-5]) -> 1
A540: 40798 | B540: 北京 | C540: 125 | D540: 轻度污染 | E540: 1.86 | F540: 50 | G540: 40 | H540: 236 | I540: 199 | J540: 135 | L540: 2013-06-13T14:00:00.000 | M540: =RC[-8]-R[10]C[-8] -> 0.61583333333333345 | N540: =RC[-8]-R[10]C[-8] -> 19.958333333333332 | O540: =RC[-8]-R[10]C[-8] -> -2.375 | P540: =RC[-8]-R[10]C[-8] -> 101.125 | Q540: =RC[-8]-R[10]C[-8] -> 64.625 | R540: =RC[-8]-R[10]C[-8] -> 32.125 | T540: =RC[-7]*RC[-2] -> 19.783645833333338 | U540: =RC[-7]*RC[-3] -> 641.16145833333326 | V540: =RC[-7]*RC[-4] -> -76.296875 | W540: =RC[-7]*RC[-5] -> 3248.640625 | X540: =RC[-7]*RC[-6] -> 2076.078125 | Y540: =RC[-12]*RC[-12] -> 0.37925069444444459 | Z540: =RC[-12]*RC[-12] -> 398.3350694444444 | AA540: =RC[-12]*RC[-12] -> 5.640625 | AB540: =RC[-12]*RC[-12] -> 10226.265625 | AC540: =RC[-12]*RC[-12] -> 4176.390625 | AD540: =RC[-12]*RC[-12] -> 1032.015625 | AE540: =RC[-11]/SQRT(RC[-6]*RC[-1]) -> 1 | AF540: =RC[-11]/SQRT(RC[-6]*RC[-2]) -> 1 | AG540: =RC[-11]/SQRT(RC[-6]*RC[-3]) -> -1 | AH540: =RC[-11]/SQRT(RC[-6]*RC[-4]) -> 1 | AI540: =RC[-11]/SQRT(RC[-6]*RC[-5]) -> 1
A541: 40874 | B541: 北京 | C541: 146 | D541: 轻度污染 | E541: 1.72 | F541: 41 | G541: 35 | H541: 253 | I541: 168 | J541: 132 | L541: 2013-06-13T15:00:00.000 | M541: =RC[-8]-R[9]C[-8] -> 0.47583333333333333 | N541: =RC[-8]-R[9]C[-8] -> 10.958333333333332 | O541: =RC[-8]-R[9]C[-8] -> -7.375 | P541: =RC[-8]-R[9]C[-8] -> 118.125 | Q541: =RC[-8]-R[9]C[-8] -> 33.625 | R541: =RC[-8]-R[9]C[-8] -> 29.125 | T541: =RC[-7]*RC[-2] -> 13.858645833333334 | U541: =RC[-7]*RC[-3] -> 319.16145833333331 | V541: =RC[-7]*RC[-4] -> -214.796875 | W541: =RC[-7]*RC[-5] -> 3440.390625 | X541: =RC[-7]*RC[-6] -> 979.328125 | Y541: =RC[-12]*RC[-12] -> 0.2264173611111111 | Z541: =RC[-12]*RC[-12] -> 120.08506944444441 | AA541: =RC[-12]*RC[-12] -> 54.390625 | AB541: =RC[-12]*RC[-12] -> 13953.515625 | AC541: =RC[-12]*RC[-12] -> 1130.640625 | AD541: =RC[-12]*RC[-12] -> 848.265625 | AE541: =RC[-11]/SQRT(RC[-6]*RC[-1]) -> 1.0000000000000002 | AF541: =RC[-11]/SQRT(RC[-6]*RC[-2]) -> 1 | AG541: =RC[-11]/SQRT(RC[-6]*RC[-3]) -> -1 | AH541: =RC[-11]/SQRT(RC[-6]*RC[-4]) -> 1 | AI541: =RC[-11]/SQRT(RC[-6]*RC[-5]) -> 1
A542: 40950 | B542: 北京 | C542: 145 | D542: 轻度污染 | E542: 1.51 | F542: 33 | G542: 32 | H542: 257 | I542: 141 | J542: 109 | L542: 2013-06-13T16:00:00.000 | M542: =RC[-8]-R[8]C[-8] -> 0.26583333333333337 | N542: =RC[-8]-R[8]C[-8] -> 2.9583333333333321 | O542: =RC[-8]-R[8]C[-8] -> -10.375 | P542: =RC[-8]-R[8]C[-8] -> 122.125 | Q542: =RC[-8]-R[8]C[-8] -> 6.625 | R542: =RC[-8]-R[8]C[-8] -> 6.125 | T542: =RC[-7]*RC[-2] -> 1.6282291666666668 | U542: =RC[-7]*RC[-3] -> 18.119791666666661 | V542: =RC[-7]*RC[-4] -> -63.546875 | W542: =RC[-7]*RC[-5] -> 748.015625 | X542: =RC[-7]*RC[-6] -> 40.578125 | Y542: =RC[-12]*RC[-12] -> 7.0667361111111132E-2 | Z542: =RC[-12]*RC[-12] -> 8.7517361111111036 | AA542: =RC[-12]*RC[-12] -> 107.640625 | AB542: =RC[-12]*RC[-12] -> 14914.515625 | AC542: =RC[-12]*RC[-12] -> 43.890625 | AD542: =RC[-12]*RC[-12] -> 37.515625 | AE542: =RC[-11]/SQRT(RC[-6]*RC[-1]) -> 1 | AF542: =RC[-11]/SQRT(RC[-6]*RC[-2]) -> 1.0000000000000002 | AG542: =RC[-11]/SQRT(RC[-6]*RC[-3]) -> -1 | AH542: =RC[-11]/SQRT(RC[-6]*RC[-4]) -> 1 | AI542: =RC[-11]/SQRT(RC[-6]*RC[-5]) -> 1
A543: 41026 | B543: 北京 | C543: 144 | D543: 轻度污染 | E543: 1.18 | F543: 26 | G543: 29 | H543: 236 | I543: 98 | J543: 88 | L543: 2013-06-13T17:00:00.000 | M543: =RC[-8]-R[7]C[-8] -> -6.4166666666666705E-2 | N543: =RC[-8]-R[7]C[-8] -> -4.0416666666666679 | O543: =RC[-8]-R[7]C[-8] -> -13.375 | P543: =RC[-8]-R[7]C[-8] -> 101.125 | Q543: =RC[-8]-R[7]C[-8] -> -36.375 | R543: =RC[-8]-R[7]C[-8] -> -14.875 | T543: =RC[-7]*RC[-2] -> 0.95447916666666721 | U543: =RC[-7]*RC[-3] -> 60.119791666666686 | V543: =RC[-7]*RC[-4] -> 198.953125 | W543: =RC[-7]*RC[-5] -> -1504.234375 | X543: =RC[-7]*RC[-6] -> 541.078125 | Y543: =RC[-12]*RC[-12] -> 4.1173611111111159E-3 | Z543: =RC[-12]*RC[-12] -> 16.335069444444454 | AA543: =RC[-12]*RC[-12] -> 178.890625 | AB543: =RC[-12]*RC[-12] -> 10226.265625 | AC543: =RC[-12]*RC[-12] -> 1323.140625 | AD543: =RC[-12]*RC[-12] -> 221.265625 | AE543: =RC[-11]/SQRT(RC[-6]*RC[-1]) -> 1 | AF543: =RC[-11]/SQRT(RC[-6]*RC[-2]) -> 1 | AG543: =RC[-11]/SQRT(RC[-6]*RC[-3]) -> 1 | AH543: =RC[-11]/SQRT(RC[-6]*RC[-4]) -> -1 | AI543: =RC[-11]/SQRT(RC[-6]*RC[-5]) -> 1
A544: 41102 | B544: 北京 | C544: 148 | D544: 轻度污染 | E544: 1.06 | F544: 24 | G544: 34 | H544: 230 | I544: 132 | J544: 90 | L544: 2013-06-13T18:00:00.000 | M544: =RC[-8]-R[6]C[-8] -> -0.18416666666666659 | N544: =RC[-8]-R[6]C[-8] -> -6.0416666666666679 | O544: =RC[-8]-R[6]C[-8] -> -8.375 | P544: =RC[-8]-R[6]C[-8] -> 95.125 | Q544: =RC[-8]-R[6]C[-8] -> -2.375 | R544: =RC[-8]-R[6]C[-8] -> -12.875 | T544: =RC[-7]*RC[-2] -> 2.3711458333333324 | U544: =RC[-7]*RC[-3] -> 77.786458333333343 | V544: =RC[-7]*RC[-4] -> 107.828125 | W544: =RC[-7]*RC[-5] -> -1224.734375 | X544: =RC[-7]*RC[-6] -> 30.578125 | Y544: =RC[-12]*RC[-12] -> 3.3917361111111086E-2 | Z544: =RC[-12]*RC[-12] -> 36.501736111111128 | AA544: =RC[-12]*RC[-12] -> 70.140625 | AB544: =RC[-12]*RC[-12] -> 9048.765625 | AC544: =RC[-12]*RC[-12] -> 5.640625 | AD544: =RC[-12]*RC[-12] -> 165.765625 | AE544: =RC[-11]/SQRT(RC[-6]*RC[-1]) -> 1 | AF544: =RC[-11]/SQRT(RC[-6]*RC[-2]) -> 0.99999999999999978 | AG544: =RC[-11]/SQRT(RC[-6]*RC[-3]) -> 1 | AH544: =RC[-11]/SQRT(RC[-6]*RC[-4]) -> -1 | AI544: =RC[-11]/SQRT(RC[-6]*RC[-5]) -> 1
A545: 41178 | B545: 北京 | C545: 158 | D545: 中度污染 | E545: 1.06 | F545: 23 | G545: 40 | H545: 222 | I545: 141 | J545: 97 | L545: 2013-06-13T19:00:00.000 | M545: =RC[-8]-R[5]C[-8] -> -0.18416666666666659 | N545: =RC[-8]-R[5]C[-8] -> -7.0416666666666679 | O545: =RC[-8]-R[5]C[-8] -> -2.375 | P545: =RC[-8]-R[5]C[-8] -> 87.125 | Q545: =RC[-8]-R[5]C[-8] -> 6.625 | R545: =RC[-8]-R[5]C[-8] -> -5.875 | T545: =RC[-7]*RC[-2] -> 1.0819791666666663 | U545: =RC[-7]*RC[-3] -> 41.369791666666671 | V545: =RC[-7]*RC[-4] -> 13.953125 | W545: =RC[-7]*RC[-5] -> -511.859375 | X545: =RC[-7]*RC[-6] -> -38.921875 | Y545: =RC[-12]*RC[-12] -> 3.3917361111111086E-2 | Z545: =RC[-12]*RC[-12] -> 49.585069444444464 | AA545: =RC[-12]*RC[-12] -> 5.640625 | AB545: =RC[-12]*RC[-12] -> 7590.765625 | AC545: =RC[-12]*RC[-12] -> 43.890625 | AD545: =RC[-12]*RC[-12] -> 34.515625 | AE545: =RC[-11]/SQRT(RC[-6]*RC[-1]) -> 1 | AF545: =RC[-11]/SQRT(RC[-6]*RC[-2]) -> 0.99999999999999978 | AG545: =RC[-11]/SQRT(RC[-6]*RC[-3]) -> 1 | AH545: =RC[-11]/SQRT(RC[-6]*RC[-4]) -> -1 | AI545: =RC[-11]/SQRT(RC[-6]*RC[-5]) -> -1
A546: 41254 | B546: 北京 | C546: 161 | D546: 中度污染 | E546: 1.19 | F546: 19 | G546: 57 | H546: 178 | I546: 175 | J546: 107 | L546: 2013-06-13T20:00:00.000 | M546: =RC[-8]-R[4]C[-8] -> -5.4166666666666696E-2 | N546: =RC[-8]-R[4]C[-8] -> -11.041666666666668 | O546: =RC[-8]-R[4]C[-8] -> 14.625 | P546: =RC[-8]-R[4]C[-8] -> 43.125 | Q546: =RC[-8]-R[4]C[-8] -> 40.625 | R546: =RC[-8]-R[4]C[-8] -> 4.125 | T546: =RC[-7]*RC[-2] -> -0.22343750000000012 | U546: =RC[-7]*RC[-3] -> -45.546875000000007 | V546: =RC[-7]*RC[-4] -> 60.328125 | W546: =RC[-7]*RC[-5] -> 177.890625 | X546: =RC[-7]*RC[-6] -> 167.578125 | Y546: =RC[-12]*RC[-12] -> 2.9340277777777811E-3 | Z546: =RC[-12]*RC[-12] -> 121.9184027777778 | AA546: =RC[-12]*RC[-12] -> 213.890625 | AB546: =RC[-12]*RC[-12] -> 1859.765625 | AC546: =RC[-12]*RC[-12] -> 1650.390625 | AD546: =RC[-12]*RC[-12] -> 17.015625 | AE546: =RC[-11]/SQRT(RC[-6]*RC[-1]) -> -1 | AF546: =RC[-11]/SQRT(RC[-6]*RC[-2]) -> -1 | AG546: =RC[-11]/SQRT(RC[-6]*RC[-3]) -> 1 | AH546: =RC[-11]/SQRT(RC[-6]*RC[-4]) -> 1 | AI546: =RC[-11]/SQRT(RC[-6]*RC[-5]) -> 1
A547: 41330 | B547: 北京 | C547: 157 | D547: 中度污染 | E547: 1.35 | F547: 15 | G547: 68 | H547: 124 | I547: 168 | J547: 121 | L547: 2013-06-13T21:00:00.000 | M547: =RC[-8]-R[3]C[-8] -> 0.10583333333333345 | N547: =RC[-8]-R[3]C[-8] -> -15.041666666666668 | O547: =RC[-8]-R[3]C[-8] -> 25.625 | P547: =RC[-8]-R[3]C[-8] -> -10.875 | Q547: =RC[-8]-R[3]C[-8] -> 33.625 | R547: =RC[-8]-R[3]C[-8] -> 18.125 | T547: =RC[-7]*RC[-2] -> 1.9182291666666687 | U547: =RC[-7]*RC[-3] -> -272.63020833333337 | V547: =RC[-7]*RC[-4] -> 464.453125 | W547: =RC[-7]*RC[-5] -> -197.109375 | X547: =RC[-7]*RC[-6] -> 609.453125 | Y547: =RC[-12]*RC[-12] -> 1.1200694444444468E-2 | Z547: =RC[-12]*RC[-12] -> 226.25173611111114 | AA547: =RC[-12]*RC[-12] -> 656.640625 | AB547: =RC[-12]*RC[-12] -> 118.265625 | AC547: =RC[-12]*RC[-12] -> 1130.640625 | AD547: =RC[-12]*RC[-12] -> 328.515625 | AE547: =RC[-11]/SQRT(RC[-6]*RC[-1]) -> 1 | AF547: =RC[-11]/SQRT(RC[-6]*RC[-2]) -> -1 | AG547: =RC[-11]/SQRT(RC[-6]*RC[-3]) -> 1 | AH547: =RC[-11]/SQRT(RC[-6]*RC[-4]) -> -1 | AI547: =RC[-11]/SQRT(RC[-6]*RC[-5]) -> 1
A548: 41406 | B548: 北京 | C548: 151 | D548: 轻度污染 | E548: 1.1200000000000001 | F548: 16 | G548: 63 | H548: 126 | I548: 146 | J548: 112 | L548: 2013-06-13T22:00:00.000 | M548: =RC[-8]-R[2]C[-8] -> -0.12416666666666654 | N548: =RC[-8]-R[2]C[-8] -> -14.041666666666668 | O548: =RC[-8]-R[2]C[-8] -> 20.625 | P548: =RC[-8]-R[2]C[-8] -> -8.875 | Q548: =RC[-8]-R[2]C[-8] -> 11.625 | R548: =RC[-8]-R[2]C[-8] -> 9.125 | T548: =RC[-7]*RC[-2] -> -1.1330208333333323 | U548: =RC[-7]*RC[-3] -> -128.13020833333334 | V548: =RC[-7]*RC[-4] -> 188.203125 | W548: =RC[-7]*RC[-5] -> -80.984375 | X548: =RC[-7]*RC[-6] -> 106.078125 | Y548: =RC[-12]*RC[-12] -> 1.541736111111108E-2 | Z548: =RC[-12]*RC[-12] -> 197.1684027777778 | AA548: =RC[-12]*RC[-12] -> 425.390625 | AB548: =RC[-12]*RC[-12] -> 78.765625 | AC548: =RC[-12]*RC[-12] -> 135.140625 | AD548: =RC[-12]*RC[-12] -> 83.265625 | AE548: =RC[-11]/SQRT(RC[-6]*RC[-1]) -> -1 | AF548: =RC[-11]/SQRT(RC[-6]*RC[-2]) -> -1 | AG548: =RC[-11]/SQRT(RC[-6]*RC[-3]) -> 1 | AH548: =RC[-11]/SQRT(RC[-6]*RC[-4]) -> -1 | AI548: =RC[-11]/SQRT(RC[-6]*RC[-5]) -> 1
A549: 41482 | B549: 北京 | C549: 147 | D549: 轻度污染 | E549: 0.97 | F549: 15 | G549: 60 | H549: 112 | I549: 142 | J549: 94 | L549: 2013-06-13T23:00:00.000 | M549: =RC[-8]-R[1]C[-8] -> -0.27416666666666667 | N549: =RC[-8]-R[1]C[-8] -> -15.041666666666668 | O549: =RC[-8]-R[1]C[-8] -> 17.625 | P549: =RC[-8]-R[1]C[-8] -> -22.875 | Q549: =RC[-8]-R[1]C[-8] -> 7.625 | R549: =RC[-8]-R[1]C[-8] -> -8.875 | T549: =RC[-7]*RC[-2] -> 2.4332291666666666 | U549: =RC[-7]*RC[-3] -> 133.49479166666669 | V549: =RC[-7]*RC[-4] -> -156.421875 | W549: =RC[-7]*RC[-5] -> 203.015625 | X549: =RC[-7]*RC[-6] -> -67.671875 | Y549: =RC[-12]*RC[-12] -> 7.5167361111111108E-2 | Z549: =RC[-12]*RC[-12] -> 226.25173611111114 | AA549: =RC[-12]*RC[-12] -> 310.640625 | AB549: =RC[-12]*RC[-12] -> 523.265625 | AC549: =RC[-12]*RC[-12] -> 58.140625 | AD549: =RC[-12]*RC[-12] -> 78.765625 | AE549: =RC[-11]/SQRT(RC[-6]*RC[-1]) -> 1 | AF549: =RC[-11]/SQRT(RC[-6]*RC[-2]) -> 1 | AG549: =RC[-11]/SQRT(RC[-6]*RC[-3]) -> -1 | AH549: =RC[-11]/SQRT(RC[-6]*RC[-4]) -> 1 | AI549: =RC[-11]/SQRT(RC[-6]*RC[-5]) -> -1
E550: =AVERAGE(R[-24]C:R[-1]C) -> 1.2441666666666666 | F550: =AVERAGE(R[-24]C:R[-1]C) -> 30.041666666666668 | G550: =AVERAGE(R[-24]C:R[-1]C) -> 42.375 | H550: =AVERAGE(R[-24]C:R[-1]C) -> 134.875 | I550: =AVERAGE(R[-24]C:R[-1]C) -> 134.375 | J550: =AVERAGE(R[-24]C:R[-1]C) -> 102.875 | M550: =RC[-8]-RC[-8] -> 0 | N550: =RC[-8]-RC[-8] -> 0 | O550: =RC[-8]-RC[-8] -> 0 | P550: =RC[-8]-RC[-8] -> 0 | Q550: =RC[-8]-RC[-8] -> 0 | R550: =RC[-8]-RC[-8] -> 0 | T550: =SUM(R[-24]C:R[-1]C) -> 134.05250000000004 | U550: =SUM(R[-24]C:R[-1]C) -> 4308.1250000000018 | V550: =SUM(R[-24]C:R[-1]C) -> 1396.125 | W550: =SUM(R[-24]C:R[-1]C) -> 10346.625 | X550: =SUM(R[-24]C:R[-1]C) -> 10914.125 | Y550: =SUM(R[-24]C:R[-1]C) -> 3.9353833333333328 | Z550: =SUM(R[-24]C:R[-1]C) -> 6792.958333333333 | AA550: =SUM(R[-24]C:R[-1]C) -> 2521.625 | AB550: =SUM(R[-24]C:R[-1]C) -> 118422.625 | AC550: =SUM(R[-24]C:R[-1]C) -> 26715.625 | AD550: =SUM(R[-24]C:R[-1]C) -> 6014.625 | AE550: =RC[-11]/SQRT(RC[-6]*RC[-1]) -> 0.87131886917368528 | AF550: =RC[-11]/SQRT(RC[-6]*RC[-2]) -> 0.673991691547561 | AG550: =RC[-11]/SQRT(RC[-6]*RC[-3]) -> 0.35849225349501279 | AH550: =RC[-11]/SQRT(RC[-6]*RC[-4]) -> 0.38768329644088112 | AI550: =RC[-11]/SQRT(RC[-6]*RC[-5]) -> 0.8609976706918705
A551: 41558 | B551: 北京 | C551: 141 | D551: 轻度污染 | E551: 1.01 | F551: 13 | G551: 62 | H551: 95 | I551: 156 | J551: 91 | L551: 2013-06-14T00:00:00.000 | M551: =RC[-8]-R[24]C[-8] -> -0.10083333333333333 | N551: =RC[-8]-R[24]C[-8] -> -13.375 | O551: =RC[-8]-R[24]C[-8] -> 12 | P551: =RC[-8]-R[24]C[-8] -> -58.291666666666657 | Q551: =RC[-8]-R[24]C[-8] -> -6.8333333333333428 | R551: =RC[-8]-R[24]C[-8] -> -21.291666666666671 | T551: =RC[-7]*RC[-2] -> 2.1469097222222224 | U551: =RC[-7]*RC[-3] -> 284.77604166666674 | V551: =RC[-7]*RC[-4] -> -255.50000000000006 | W551: =RC[-7]*RC[-5] -> 1241.1267361111111 | X551: =RC[-7]*RC[-6] -> 145.4930555555558 | Y551: =RC[-12]*RC[-12] -> 1.016736111111111E-2 | Z551: =RC[-12]*RC[-12] -> 178.890625 | AA551: =RC[-12]*RC[-12] -> 144 | AB551: =RC[-12]*RC[-12] -> 3397.9184027777765 | AC551: =RC[-12]*RC[-12] -> 46.694444444444571 | AD551: =RC[-12]*RC[-12] -> 453.33506944444463 | AE551: =RC[-11]/SQRT(RC[-6]*RC[-1]) -> 1 | AF551: =RC[-11]/SQRT(RC[-6]*RC[-2]) -> 1 | AG551: =RC[-11]/SQRT(RC[-6]*RC[-3]) -> -1 | AH551: =RC[-11]/SQRT(RC[-6]*RC[-4]) -> 1 | AI551: =RC[-11]/SQRT(RC[-6]*RC[-5]) -> 1
A552: 41634 | B552: 北京 | C552: 136 | D552: 轻度污染 | E552: 0.94 | F552: 14 | G552: 58 | H552: 85 | I552: 121 | J552: 90 | L552: 2013-06-14T01:00:00.000 | M552: =RC[-8]-R[23]C[-8] -> -0.17083333333333339 | N552: =RC[-8]-R[23]C[-8] -> -12.375 | O552: =RC[-8]-R[23]C[-8] -> 8 | P552: =RC[-8]-R[23]C[-8] -> -68.291666666666657 | Q552: =RC[-8]-R[23]C[-8] -> -41.833333333333343 | R552: =RC[-8]-R[23]C[-8] -> -22.291666666666671 | T552: =RC[-7]*RC[-2] -> 3.8081597222222245 | U552: =RC[-7]*RC[-3] -> 275.85937500000006 | V552: =RC[-7]*RC[-4] -> -178.33333333333337 | W552: =RC[-7]*RC[-5] -> 1522.3350694444446 | X552: =RC[-7]*RC[-6] -> 932.53472222222263 | Y552: =RC[-12]*RC[-12] -> 2.9184027777777798E-2 | Z552: =RC[-12]*RC[-12] -> 153.140625 | AA552: =RC[-12]*RC[-12] -> 64 | AB552: =RC[-12]*RC[-12] -> 4663.7517361111095 | AC552: =RC[-12]*RC[-12] -> 1750.0277777777785 | AD552: =RC[-12]*RC[-12] -> 496.918402777778 | AE552: =RC[-11]/SQRT(RC[-6]*RC[-1]) -> 1 | AF552: =RC[-11]/SQRT(RC[-6]*RC[-2]) -> 1 | AG552: =RC[-11]/SQRT(RC[-6]*RC[-3]) -> -1 | AH552: =RC[-11]/SQRT(RC[-6]*RC[-4]) -> 1 | AI552: =RC[-11]/SQRT(RC[-6]*RC[-5]) -> 1
A553: 41710 | B553: 北京 | C553: 135 | D553: 轻度污染 | E553: 0.84 | F553: 17 | G553: 59 | H553: 83 | I553: 123 | J553: 84 | L553: 2013-06-14T02:00:00.000 | M553: =RC[-8]-R[22]C[-8] -> -0.27083333333333337 | N553: =RC[-8]-R[22]C[-8] -> -9.375 | O553: =RC[-8]-R[22]C[-8] -> 9 | P553: =RC[-8]-R[22]C[-8] -> -70.291666666666657 | Q553: =RC[-8]-R[22]C[-8] -> -39.833333333333343 | R553: =RC[-8]-R[22]C[-8] -> -28.291666666666671 | T553: =RC[-7]*RC[-2] -> 7.6623263888888911 | U553: =RC[-7]*RC[-3] -> 265.23437500000006 | V553: =RC[-7]*RC[-4] -> -254.62500000000006 | W553: =RC[-7]*RC[-5] -> 1988.6684027777778 | X553: =RC[-7]*RC[-6] -> 1126.9513888888894 | Y553: =RC[-12]*RC[-12] -> 7.3350694444444461E-2 | Z553: =RC[-12]*RC[-12] -> 87.890625 | AA553: =RC[-12]*RC[-12] -> 81 | AB553: =RC[-12]*RC[-12] -> 4940.9184027777765 | AC553: =RC[-12]*RC[-12] -> 1586.6944444444453 | AD553: =RC[-12]*RC[-12] -> 800.41840277777806 | AE553: =RC[-11]/SQRT(RC[-6]*RC[-1]) -> 1 | AF553: =RC[-11]/SQRT(RC[-6]*RC[-2]) -> 1 | AG553: =RC[-11]/SQRT(RC[-6]*RC[-3]) -> -1 | AH553: =RC[-11]/SQRT(RC[-6]*RC[-4]) -> 1 | AI553: =RC[-11]/SQRT(RC[-6]*RC[-5]) -> 1
A554: 41786 | B554: 北京 | C554: 134 | D554: 轻度污染 | E554: 0.87 | F554: 19 | G554: 56 | H554: 76 | I554: 130 | J554: 83 | L554: 2013-06-14T03:00:00.000 | M554: =RC[-8]-R[21]C[-8] -> -0.24083333333333334 | N554: =RC[-8]-R[21]C[-8] -> -7.375 | O554: =RC[-8]-R[21]C[-8] -> 6 | P554: =RC[-8]-R[21]C[-8] -> -77.291666666666657 | Q554: =RC[-8]-R[21]C[-8] -> -32.833333333333343 | R554: =RC[-8]-R[21]C[-8] -> -29.291666666666671 | T554: =RC[-7]*RC[-2] -> 7.054409722222224 | U554: =RC[-7]*RC[-3] -> 216.02604166666671 | V554: =RC[-7]*RC[-4] -> -175.75000000000003 | W554: =RC[-7]*RC[-5] -> 2264.0017361111113 | X554: =RC[-7]*RC[-6] -> 961.743055555556 | Y554: =RC[-12]*RC[-12] -> 5.8000694444444452E-2 | Z554: =RC[-12]*RC[-12] -> 54.390625 | AA554: =RC[-12]*RC[-12] -> 36 | AB554: =RC[-12]*RC[-12] -> 5974.0017361111095 | AC554: =RC[-12]*RC[-12] -> 1078.0277777777785 | AD554: =RC[-12]*RC[-12] -> 858.00173611111143 | AE554: =RC[-11]/SQRT(RC[-6]*RC[-1]) -> 1 | AF554: =RC[-11]/SQRT(RC[-6]*RC[-2]) -> 1 | AG554: =RC[-11]/SQRT(RC[-6]*RC[-3]) -> -1 | AH554: =RC[-11]/SQRT(RC[-6]*RC[-4]) -> 1 | AI554: =RC[-11]/SQRT(RC[-6]*RC[-5]) -> 1
A555: 41862 | B555: 北京 | C555: 132 | D555: 轻度污染 | E555: 0.78 | F555: 21 | G555: 54 | H555: 74 | I555: 130 | J555: 83 | L555: 2013-06-14T04:00:00.000 | M555: =RC[-8]-R[20]C[-8] -> -0.33083333333333331 | N555: =RC[-8]-R[20]C[-8] -> -5.375 | O555: =RC[-8]-R[20]C[-8] -> 4 | P555: =RC[-8]-R[20]C[-8] -> -79.291666666666657 | Q555: =RC[-8]-R[20]C[-8] -> -32.833333333333343 | R555: =RC[-8]-R[20]C[-8] -> -29.291666666666671 | T555: =RC[-7]*RC[-2] -> 9.6906597222222235 | U555: =RC[-7]*RC[-3] -> 157.44270833333337 | V555: =RC[-7]*RC[-4] -> -117.16666666666669 | W555: =RC[-7]*RC[-5] -> 2322.5850694444443 | X555: =RC[-7]*RC[-6] -> 961.743055555556 | Y555: =RC[-12]*RC[-12] -> 0.10945069444444443 | Z555: =RC[-12]*RC[-12] -> 28.890625 | AA555: =RC[-12]*RC[-12] -> 16 | AB555: =RC[-12]*RC[-12] -> 6287.1684027777765 | AC555: =RC[-12]*RC[-12] -> 1078.0277777777785 | AD555: =RC[-12]*RC[-12] -> 858.00173611111143 | AE555: =RC[-11]/SQRT(RC[-6]*RC[-1]) -> 1 | AF555: =RC[-11]/SQRT(RC[-6]*RC[-2]) -> 1 | AG555: =RC[-11]/SQRT(RC[-6]*RC[-3]) -> -1 | AH555: =RC[-11]/SQRT(RC[-6]*RC[-4]) -> 1 | AI555: =RC[-11]/SQRT(RC[-6]*RC[-5]) -> 1
A556: 41938 | B556: 北京 | C556: 132 | D556: 轻度污染 | E556: 0.82 | F556: 25 | G556: 55 | H556: 72 | I556: 137 | J556: 90 | L556: 2013-06-14T05:00:00.000 | M556: =RC[-8]-R[19]C[-8] -> -0.29083333333333339 | N556: =RC[-8]-R[19]C[-8] -> -1.375 | O556: =RC[-8]-R[19]C[-8] -> 5 | P556: =RC[-8]-R[19]C[-8] -> -81.291666666666657 | Q556: =RC[-8]-R[19]C[-8] -> -25.833333333333343 | R556: =RC[-8]-R[19]C[-8] -> -22.291666666666671 | T556: =RC[-7]*RC[-2] -> 6.4831597222222248 | U556: =RC[-7]*RC[-3] -> 30.651041666666671 | V556: =RC[-7]*RC[-4] -> -111.45833333333336 | W556: =RC[-7]*RC[-5] -> 1812.1267361111113 | X556: =RC[-7]*RC[-6] -> 575.86805555555588 | Y556: =RC[-12]*RC[-12] -> 8.4584027777777807E-2 | Z556: =RC[-12]*RC[-12] -> 1.890625 | AA556: =RC[-12]*RC[-12] -> 25 | AB556: =RC[-12]*RC[-12] -> 6608.3350694444425 | AC556: =RC[-12]*RC[-12] -> 667.36111111111165 | AD556: =RC[-12]*RC[-12] -> 496.918402777778 | AE556: =RC[-11]/SQRT(RC[-6]*RC[-1]) -> 1 | AF556: =RC[-11]/SQRT(RC[-6]*RC[-2]) -> 0.99999999999999989 | AG556: =RC[-11]/SQRT(RC[-6]*RC[-3]) -> -1 | AH556: =RC[-11]/SQRT(RC[-6]*RC[-4]) -> 1 | AI556: =RC[-11]/SQRT(RC[-6]*RC[-5]) -> 1
A557: 42014 | B557: 北京 | C557: 131 | D557: 轻度污染 | E557: 0.87 | F557: 27 | G557: 61 | H557: 63 | I557: 153 | J557: 93 | L557: 2013-06-14T06:00:00.000 | M557: =RC[-8]-R[18]C[-8] -> -0.24083333333333334 | N557: =RC[-8]-R[18]C[-8] -> 0.625 | O557: =RC[-8]-R[18]C[-8] -> 11 | P557: =RC[-8]-R[18]C[-8] -> -90.291666666666657 | Q557: =RC[-8]-R[18]C[-8] -> -9.8333333333333428 | R557: =RC[-8]-R[18]C[-8] -> -19.291666666666671 | T557: =RC[-7]*RC[-2] -> 4.6460763888888899 | U557: =RC[-7]*RC[-3] -> -12.05729166666667 | V557: =RC[-7]*RC[-4] -> -212.20833333333337 | W557: =RC[-7]*RC[-5] -> 1741.8767361111113 | X557: =RC[-7]*RC[-6] -> 189.70138888888911 | Y557: =RC[-12]*RC[-12] -> 5.8000694444444452E-2 | Z557: =RC[-12]*RC[-12] -> 0.390625 | AA557: =RC[-12]*RC[-12] -> 121 | AB557: =RC[-12]*RC[-12] -> 8152.5850694444425 | AC557: =RC[-12]*RC[-12] -> 96.694444444444628 | AD557: =RC[-12]*RC[-12] -> 372.16840277777794 | AE557: =RC[-11]/SQRT(RC[-6]*RC[-1]) -> 1 | AF557: =RC[-11]/SQRT(RC[-6]*RC[-2]) -> -1 | AG557: =RC[-11]/SQRT(RC[-6]*RC[-3]) -> -1 | AH557: =RC[-11]/SQRT(RC[-6]*RC[-4]) -> 1 | AI557: =RC[-11]/SQRT(RC[-6]*RC[-5]) -> 1
A558: 42090 | B558: 北京 | C558: 131 | D558: 轻度污染 | E558: 0.95 | F558: 29 | G558: 61 | H558: 57 | I558: 170 | J558: 99 | L558: 2013-06-14T07:00:00.000 | M558: =RC[-8]-R[17]C[-8] -> -0.16083333333333338 | N558: =RC[-8]-R[17]C[-8] -> 2.625 | O558: =RC[-8]-R[17]C[-8] -> 11 | P558: =RC[-8]-R[17]C[-8] -> -96.291666666666657 | Q558: =RC[-8]-R[17]C[-8] -> 7.1666666666666572 | R558: =RC[-8]-R[17]C[-8] -> -13.291666666666671 | T558: =RC[-7]*RC[-2] -> 2.137743055555557 | U558: =RC[-7]*RC[-3] -> -34.890625000000014 | V558: =RC[-7]*RC[-4] -> -146.20833333333337 | W558: =RC[-7]*RC[-5] -> 1279.8767361111115 | X558: =RC[-7]*RC[-6] -> -95.256944444444358 | Y558: =RC[-12]*RC[-12] -> 2.5867361111111126E-2 | Z558: =RC[-12]*RC[-12] -> 6.890625 | AA558: =RC[-12]*RC[-12] -> 121 | AB558: =RC[-12]*RC[-12] -> 9272.0850694444434 | AC558: =RC[-12]*RC[-12] -> 51.361111111110972 | AD558: =RC[-12]*RC[-12] -> 176.66840277777791 | AE558: =RC[-11]/SQRT(RC[-6]*RC[-1]) -> 1 | AF558: =RC[-11]/SQRT(RC[-6]*RC[-2]) -> -1 | AG558: =RC[-11]/SQRT(RC[-6]*RC[-3]) -> -0.99999999999999978 | AH558: =RC[-11]/SQRT(RC[-6]*RC[-4]) -> 1 | AI558: =RC[-11]/SQRT(RC[-6]*RC[-5]) -> -1.0000000000000002
A559: 42166 | B559: 北京 | C559: 131 | D559: 轻度污染 | E559: 1.02 | F559: 33 | G559: 65 | H559: 62 | I559: 155 | J559: 104 | L559: 2013-06-14T08:00:00.000 | M559: =RC[-8]-R[16]C[-8] -> -9.0833333333333321E-2 | N559: =RC[-8]-R[16]C[-8] -> 6.625 | O559: =RC[-8]-R[16]C[-8] -> 15 | P559: =RC[-8]-R[16]C[-8] -> -91.291666666666657 | Q559: =RC[-8]-R[16]C[-8] -> -7.8333333333333428 | R559: =RC[-8]-R[16]C[-8] -> -8.2916666666666714 | T559: =RC[-7]*RC[-2] -> 0.75315972222222261 | U559: =RC[-7]*RC[-3] -> -54.9322916666667 | V559: =RC[-7]*RC[-4] -> -124.37500000000007 | W559: =RC[-7]*RC[-5] -> 756.9600694444448 | X559: =RC[-7]*RC[-6] -> 64.951388888888999 | Y559: =RC[-12]*RC[-12] -> 8.2506944444444424E-3 | Z559: =RC[-12]*RC[-12] -> 43.890625 | AA559: =RC[-12]*RC[-12] -> 225 | AB559: =RC[-12]*RC[-12] -> 8334.1684027777756 | AC559: =RC[-12]*RC[-12] -> 61.361111111111256 | AD559: =RC[-12]*RC[-12] -> 68.751736111111185 | AE559: =RC[-11]/SQRT(RC[-6]*RC[-1]) -> 1 | AF559: =RC[-11]/SQRT(RC[-6]*RC[-2]) -> -1 | AG559: =RC[-11]/SQRT(RC[-6]*RC[-3]) -> -1 | AH559: =RC[-11]/SQRT(RC[-6]*RC[-4]) -> 1 | AI559: =RC[-11]/SQRT(RC[-6]*RC[-5]) -> 1
A560: 42242 | B560: 北京 | C560: 131 | D560: 轻度污染 | E560: 1.04 | F560: 39 | G560: 59 | H560: 84 | I560: 183 | J560: 111 | L560: 2013-06-14T09:00:00.000 | M560: =RC[-8]-R[15]C[-8] -> -7.0833333333333304E-2 | N560: =RC[-8]-R[15]C[-8] -> 12.625 | O560: =RC[-8]-R[15]C[-8] -> 9 | P560: =RC[-8]-R[15]C[-8] -> -69.291666666666657 | Q560: =RC[-8]-R[15]C[-8] -> 20.166666666666657 | R560: =RC[-8]-R[15]C[-8] -> -1.2916666666666714 | T560: =RC[-7]*RC[-2] -> 9.1493055555555855E-2 | U560: =RC[-7]*RC[-3] -> -16.307291666666728 | V560: =RC[-7]*RC[-4] -> -11.625000000000043 | W560: =RC[-7]*RC[-5] -> 89.501736111111427 | X560: =RC[-7]*RC[-6] -> -26.048611111111196 | Y560: =RC[-12]*RC[-12] -> 5.017361111111107E-3 | Z560: =RC[-12]*RC[-12] -> 159.390625 | AA560: =RC[-12]*RC[-12] -> 81 | AB560: =RC[-12]*RC[-12] -> 4801.3350694444434 | AC560: =RC[-12]*RC[-12] -> 406.69444444444406 | AD560: =RC[-12]*RC[-12] -> 1.6684027777777901 | AE560: =RC[-11]/SQRT(RC[-6]*RC[-1]) -> 1 | AF560: =RC[-11]/SQRT(RC[-6]*RC[-2]) -> -1 | AG560: =RC[-11]/SQRT(RC[-6]*RC[-3]) -> -1 | AH560: =RC[-11]/SQRT(RC[-6]*RC[-4]) -> 1 | AI560: =RC[-11]/SQRT(RC[-6]*RC[-5]) -> -1
A561: 42318 | B561: 北京 | C561: 131 | D561: 轻度污染 | E561: 1.0900000000000001 | F561: 39 | G561: 53 | H561: 114 | I561: 189 | J561: 123 | L561: 2013-06-14T10:00:00.000 | M561: =RC[-8]-R[14]C[-8] -> -2.0833333333333259E-2 | N561: =RC[-8]-R[14]C[-8] -> 12.625 | O561: =RC[-8]-R[14]C[-8] -> 3 | P561: =RC[-8]-R[14]C[-8] -> -39.291666666666657 | Q561: =RC[-8]-R[14]C[-8] -> 26.166666666666657 | R561: =RC[-8]-R[14]C[-8] -> 10.708333333333329 | T561: =RC[-7]*RC[-2] -> -0.22309027777777687 | U561: =RC[-7]*RC[-3] -> 135.19270833333329 | V561: =RC[-7]*RC[-4] -> 32.124999999999986 | W561: =RC[-7]*RC[-5] -> -420.74826388888857 | X561: =RC[-7]*RC[-6] -> 280.20138888888869 | Y561: =RC[-12]*RC[-12] -> 4.3402777777777472E-4 | Z561: =RC[-12]*RC[-12] -> 159.390625 | AA561: =RC[-12]*RC[-12] -> 9 | AB561: =RC[-12]*RC[-12] -> 1543.8350694444437 | AC561: =RC[-12]*RC[-12] -> 684.694444444444 | AD561: =RC[-12]*RC[-12] -> 114.66840277777767 | AE561: =RC[-11]/SQRT(RC[-6]*RC[-1]) -> -0.99999999999999989 | AF561: =RC[-11]/SQRT(RC[-6]*RC[-2]) -> 1 | AG561: =RC[-11]/SQRT(RC[-6]*RC[-3]) -> 1 | AH561: =RC[-11]/SQRT(RC[-6]*RC[-4]) -> -1 | AI561: =RC[-11]/SQRT(RC[-6]*RC[-5]) -> 1
A562: 42394 | B562: 北京 | C562: 132 | D562: 轻度污染 | E562: 1.2 | F562: 38 | G562: 49 | H562: 154 | I562: 196 | J562: 138 | L562: 2013-06-14T11:00:00.000 | M562: =RC[-8]-R[13]C[-8] -> 8.9166666666666616E-2 | N562: =RC[-8]-R[13]C[-8] -> 11.625 | O562: =RC[-8]-R[13]C[-8] -> -1 | P562: =RC[-8]-R[13]C[-8] -> 0.70833333333334281 | Q562: =RC[-8]-R[13]C[-8] -> 33.166666666666657 | R562: =RC[-8]-R[13]C[-8] -> 25.708333333333329 | T562: =RC[-7]*RC[-2] -> 2.292326388888887 | U562: =RC[-7]*RC[-3] -> 298.85937499999994 | V562: =RC[-7]*RC[-4] -> -25.708333333333329 | W562: =RC[-7]*RC[-5] -> 18.210069444444684 | X562: =RC[-7]*RC[-6] -> 852.65972222222183 | Y562: =RC[-12]*RC[-12] -> 7.9506944444444356E-3 | Z562: =RC[-12]*RC[-12] -> 135.140625 | AA562: =RC[-12]*RC[-12] -> 1 | AB562: =RC[-12]*RC[-12] -> 0.50173611111112448 | AC562: =RC[-12]*RC[-12] -> 1100.0277777777771 | AD562: =RC[-12]*RC[-12] -> 660.91840277777749 | AE562: =RC[-11]/SQRT(RC[-6]*RC[-1]) -> 1 | AF562: =RC[-11]/SQRT(RC[-6]*RC[-2]) -> 1 | AG562: =RC[-11]/SQRT(RC[-6]*RC[-3]) -> -1 | AH562: =RC[-11]/SQRT(RC[-6]*RC[-4]) -> 1 | AI562: =RC[-11]/SQRT(RC[-6]*RC[-5]) -> 1.0000000000000002
A563: 42470 | B563: 北京 | C563: 136 | D563: 轻度污染 | E563: 1.32 | F563: 42 | G563: 42 | H563: 213 | I563: 204 | J563: 155 | L563: 2013-06-14T12:00:00.000 | M563: =RC[-8]-R[12]C[-8] -> 0.20916666666666672 | N563: =RC[-8]-R[12]C[-8] -> 15.625 | O563: =RC[-8]-R[12]C[-8] -> -8 | P563: =RC[-8]-R[12]C[-8] -> 59.708333333333343 | Q563: =RC[-8]-R[12]C[-8] -> 41.166666666666657 | R563: =RC[-8]-R[12]C[-8] -> 42.708333333333329 | T563: =RC[-7]*RC[-2] -> 8.9331597222222232 | U563: =RC[-7]*RC[-3] -> 667.31770833333326 | V563: =RC[-7]*RC[-4] -> -341.66666666666663 | W563: =RC[-7]*RC[-5] -> 2550.0434027777778 | X563: =RC[-7]*RC[-6] -> 1758.1597222222217 | Y563: =RC[-12]*RC[-12] -> 4.3750694444444467E-2 | Z563: =RC[-12]*RC[-12] -> 244.140625 | AA563: =RC[-12]*RC[-12] -> 64 | AB563: =RC[-12]*RC[-12] -> 3565.0850694444457 | AC563: =RC[-12]*RC[-12] -> 1694.6944444444437 | AD563: =RC[-12]*RC[-12] -> 1824.0017361111106 | AE563: =RC[-11]/SQRT(RC[-6]*RC[-1]) -> 1 | AF563: =RC[-11]/SQRT(RC[-6]*RC[-2]) -> 1 | AG563: =RC[-11]/SQRT(RC[-6]*RC[-3]) -> -1 | AH563: =RC[-11]/SQRT(RC[-6]*RC[-4]) -> 1 | AI563: =RC[-11]/SQRT(RC[-6]*RC[-5]) -> 1
A564: 42546 | B564: 北京 | C564: 141 | D564: 轻度污染 | E564: 1.43 | F564: 41 | G564: 33 | H564: 248 | I564: 182 | J564: 140 | L564: 2013-06-14T13:00:00.000 | M564: =RC[-8]-R[11]C[-8] -> 0.3191666666666666 | N564: =RC[-8]-R[11]C[-8] -> 14.625 | O564: =RC[-8]-R[11]C[-8] -> -17 | P564: =RC[-8]-R[11]C[-8] -> 94.708333333333343 | Q564: =RC[-8]-R[11]C[-8] -> 19.166666666666657 | R564: =RC[-8]-R[11]C[-8] -> 27.708333333333329 | T564: =RC[-7]*RC[-2] -> 8.8435763888888861 | U564: =RC[-7]*RC[-3] -> 405.23437499999994 | V564: =RC[-7]*RC[-4] -> -471.04166666666657 | W564: =RC[-7]*RC[-5] -> 2624.2100694444443 | X564: =RC[-7]*RC[-6] -> 531.07638888888857 | Y564: =RC[-12]*RC[-12] -> 0.10186736111111107 | Z564: =RC[-12]*RC[-12] -> 213.890625 | AA564: =RC[-12]*RC[-12] -> 289 | AB564: =RC[-12]*RC[-12] -> 8969.6684027777792 | AC564: =RC[-12]*RC[-12] -> 367.36111111111074 | AD564: =RC[-12]*RC[-12] -> 767.75173611111086 | AE564: =RC[-11]/SQRT(RC[-6]*RC[-1]) -> 1 | AF564: =RC[-11]/SQRT(RC[-6]*RC[-2]) -> 1 | AG564: =RC[-11]/SQRT(RC[-6]*RC[-3]) -> -1 | AH564: =RC[-11]/SQRT(RC[-6]*RC[-4]) -> 1 | AI564: =RC[-11]/SQRT(RC[-6]*RC[-5]) -> 1
A565: 42622 | B565: 北京 | C565: 144 | D565: 轻度污染 | E565: 1.21 | F565: 33 | G565: 27 | H565: 260 | I565: 166 | J565: 127 | L565: 2013-06-14T14:00:00.000 | M565: =RC[-8]-R[10]C[-8] -> 9.9166666666666625E-2 | N565: =RC[-8]-R[10]C[-8] -> 6.625 | O565: =RC[-8]-R[10]C[-8] -> -23 | P565: =RC[-8]-R[10]C[-8] -> 106.70833333333334 | Q565: =RC[-8]-R[10]C[-8] -> 3.1666666666666572 | R565: =RC[-8]-R[10]C[-8] -> 14.708333333333329 | T565: =RC[-7]*RC[-2] -> 1.4585763888888879 | U565: =RC[-7]*RC[-3] -> 97.4427083333333 | V565: =RC[-7]*RC[-4] -> -338.29166666666657 | W565: =RC[-7]*RC[-5] -> 1569.5017361111109 | X565: =RC[-7]*RC[-6] -> 46.576388888888737 | Y565: =RC[-12]*RC[-12] -> 9.8340277777777697E-3 | Z565: =RC[-12]*RC[-12] -> 43.890625 | AA565: =RC[-12]*RC[-12] -> 529 | AB565: =RC[-12]*RC[-12] -> 11386.668402777779 | AC565: =RC[-12]*RC[-12] -> 10.027777777777718 | AD565: =RC[-12]*RC[-12] -> 216.33506944444431 | AE565: =RC[-11]/SQRT(RC[-6]*RC[-1]) -> 1 | AF565: =RC[-11]/SQRT(RC[-6]*RC[-2]) -> 1 | AG565: =RC[-11]/SQRT(RC[-6]*RC[-3]) -> -1 | AH565: =RC[-11]/SQRT(RC[-6]*RC[-4]) -> 1 | AI565: =RC[-11]/SQRT(RC[-6]*RC[-5]) -> 1
A566: 42698 | B566: 北京 | C566: 143 | D566: 轻度污染 | E566: 1.1399999999999999 | F566: 26 | G566: 27 | H566: 256 | I566: 152 | J566: 113 | L566: 2013-06-14T15:00:00.000 | M566: =RC[-8]-R[9]C[-8] -> 2.9166666666666563E-2 | N566: =RC[-8]-R[9]C[-8] -> -0.375 | O566: =RC[-8]-R[9]C[-8] -> -23 | P566: =RC[-8]-R[9]C[-8] -> 102.70833333333334 | Q566: =RC[-8]-R[9]C[-8] -> -10.833333333333343 | R566: =RC[-8]-R[9]C[-8] -> 0.7083333333333286 | T566: =RC[-7]*RC[-2] -> 2.065972222222201E-2 | U566: =RC[-7]*RC[-3] -> -0.26562499999999822 | V566: =RC[-7]*RC[-4] -> -16.291666666666558 | W566: =RC[-7]*RC[-5] -> 72.751736111110631 | X566: =RC[-7]*RC[-6] -> -7.6736111111110663 | Y566: =RC[-12]*RC[-12] -> 8.5069444444443843E-4 | Z566: =RC[-12]*RC[-12] -> 0.140625 | AA566: =RC[-12]*RC[-12] -> 529 | AB566: =RC[-12]*RC[-12] -> 10549.001736111113 | AC566: =RC[-12]*RC[-12] -> 117.36111111111131 | AD566: =RC[-12]*RC[-12] -> 0.50173611111110439 | AE566: =RC[-11]/SQRT(RC[-6]*RC[-1]) -> 1 | AF566: =RC[-11]/SQRT(RC[-6]*RC[-2]) -> -1 | AG566: =RC[-11]/SQRT(RC[-6]*RC[-3]) -> -1 | AH566: =RC[-11]/SQRT(RC[-6]*RC[-4]) -> 1 | AI566: =RC[-11]/SQRT(RC[-6]*RC[-5]) -> -1
A567: 42774 | B567: 北京 | C567: 147 | D567: 轻度污染 | E567: 1.1299999999999999 | F567: 23 | G567: 29 | H567: 256 | I567: 165 | J567: 118 | L567: 2013-06-14T16:00:00.000 | M567: =RC[-8]-R[8]C[-8] -> 1.9166666666666554E-2 | N567: =RC[-8]-R[8]C[-8] -> -3.375 | O567: =RC[-8]-R[8]C[-8] -> -21 | P567: =RC[-8]-R[8]C[-8] -> 102.70833333333334 | Q567: =RC[-8]-R[8]C[-8] -> 2.1666666666666572 | R567: =RC[-8]-R[8]C[-8] -> 5.7083333333333286 | T567: =RC[-7]*RC[-2] -> 0.10940972222222149 | U567: =RC[-7]*RC[-3] -> -19.265624999999986 | V567: =RC[-7]*RC[-4] -> -119.8749999999999 | W567: =RC[-7]*RC[-5] -> 586.29340277777737 | X567: =RC[-7]*RC[-6] -> 12.368055555555491 | Y567: =RC[-12]*RC[-12] -> 3.6736111111110677E-4 | Z567: =RC[-12]*RC[-12] -> 11.390625 | AA567: =RC[-12]*RC[-12] -> 441 | AB567: =RC[-12]*RC[-12] -> 10549.001736111113 | AC567: =RC[-12]*RC[-12] -> 4.6944444444444038 | AD567: =RC[-12]*RC[-12] -> 32.585069444444393 | AE567: =RC[-11]/SQRT(RC[-6]*RC[-1]) -> 1 | AF567: =RC[-11]/SQRT(RC[-6]*RC[-2]) -> -1 | AG567: =RC[-11]/SQRT(RC[-6]*RC[-3]) -> -0.99999999999999989 | AH567: =RC[-11]/SQRT(RC[-6]*RC[-4]) -> 1 | AI567: =RC[-11]/SQRT(RC[-6]*RC[-5]) -> 1
A568: 42850 | B568: 北京 | C568: 159 | D568: 中度污染 | E568: 1.1399999999999999 | F568: 23 | G568: 31 | H568: 267 | I568: 183 | J568: 132 | L568: 2013-06-14T17:00:00.000 | M568: =RC[-8]-R[7]C[-8] -> 2.9166666666666563E-2 | N568: =RC[-8]-R[7]C[-8] -> -3.375 | O568: =RC[-8]-R[7]C[-8] -> -19 | P568: =RC[-8]-R[7]C[-8] -> 113.70833333333334 | Q568: =RC[-8]-R[7]C[-8] -> 20.166666666666657 | R568: =RC[-8]-R[7]C[-8] -> 19.708333333333329 | T568: =RC[-7]*RC[-2] -> 0.57482638888888671 | U568: =RC[-7]*RC[-3] -> -66.515624999999986 | V568: =RC[-7]*RC[-4] -> -374.45833333333326 | W568: =RC[-7]*RC[-5] -> 2241.0017361111109 | X568: =RC[-7]*RC[-6] -> 397.45138888888863 | Y568: =RC[-12]*RC[-12] -> 8.5069444444443843E-4 | Z568: =RC[-12]*RC[-12] -> 11.390625 | AA568: =RC[-12]*RC[-12] -> 361 | AB568: =RC[-12]*RC[-12] -> 12929.585069444447 | AC568: =RC[-12]*RC[-12] -> 406.69444444444406 | AD568: =RC[-12]*RC[-12] -> 388.4184027777776 | AE568: =RC[-11]/SQRT(RC[-6]*RC[-1]) -> 1 | AF568: =RC[-11]/SQRT(RC[-6]*RC[-2]) -> -1 | AG568: =RC[-11]/SQRT(RC[-6]*RC[-3]) -> -1 | AH568: =RC[-11]/SQRT(RC[-6]*RC[-4]) -> 1 | AI568: =RC[-11]/SQRT(RC[-6]*RC[-5]) -> 1
A569: 42926 | B569: 北京 | C569: 175 | D569: 中度污染 | E569: 1.26 | F569: 22 | G569: 41 | H569: 261 | I569: 174 | J569: 140 | L569: 2013-06-14T18:00:00.000 | M569: =RC[-8]-R[6]C[-8] -> 0.14916666666666667 | N569: =RC[-8]-R[6]C[-8] -> -4.375 | O569: =RC[-8]-R[6]C[-8] -> -9 | P569: =RC[-8]-R[6]C[-8] -> 107.70833333333334 | Q569: =RC[-8]-R[6]C[-8] -> 11.166666666666657 | R569: =RC[-8]-R[6]C[-8] -> 27.708333333333329 | T569: =RC[-7]*RC[-2] -> 4.1331597222222216 | U569: =RC[-7]*RC[-3] -> -121.22395833333331 | V569: =RC[-7]*RC[-4] -> -249.37499999999994 | W569: =RC[-7]*RC[-5] -> 2984.4184027777774 | X569: =RC[-7]*RC[-6] -> 309.40972222222189 | Y569: =RC[-12]*RC[-12] -> 2.2250694444444444E-2 | Z569: =RC[-12]*RC[-12] -> 19.140625 | AA569: =RC[-12]*RC[-12] -> 81 | AB569: =RC[-12]*RC[-12] -> 11601.085069444447 | AC569: =RC[-12]*RC[-12] -> 124.69444444444423 | AD569: =RC[-12]*RC[-12] -> 767.75173611111086 | AE569: =RC[-11]/SQRT(RC[-6]*RC[-1]) -> 1 | AF569: =RC[-11]/SQRT(RC[-6]*RC[-2]) -> -1 | AG569: =RC[-11]/SQRT(RC[-6]*RC[-3]) -> -1 | AH569: =RC[-11]/SQRT(RC[-6]*RC[-4]) -> 1 | AI569: =RC[-11]/SQRT(RC[-6]*RC[-5]) -> 1
A570: 43002 | B570: 北京 | C570: 185 | D570: 中度污染 | E570: 1.23 | F570: 18 | G570: 53 | H570: 230 | I570: 169 | J570: 112 | L570: 2013-06-14T19:00:00.000 | M570: =RC[-8]-R[5]C[-8] -> 0.11916666666666664 | N570: =RC[-8]-R[5]C[-8] -> -8.375 | O570: =RC[-8]-R[5]C[-8] -> 3 | P570: =RC[-8]-R[5]C[-8] -> 76.708333333333343 | Q570: =RC[-8]-R[5]C[-8] -> 6.1666666666666572 | R570: =RC[-8]-R[5]C[-8] -> -0.2916666666666714 | T570: =RC[-7]*RC[-2] -> -3.4756944444445E-2 | U570: =RC[-7]*RC[-3] -> 2.442708333333373 | V570: =RC[-7]*RC[-4] -> -0.87500000000001421 | W570: =RC[-7]*RC[-5] -> -22.373263888889255 | X570: =RC[-7]*RC[-6] -> -1.7986111111111376 | Y570: =RC[-12]*RC[-12] -> 1.4200694444444439E-2 | Z570: =RC[-12]*RC[-12] -> 70.140625 | AA570: =RC[-12]*RC[-12] -> 9 | AB570: =RC[-12]*RC[-12] -> 5884.1684027777792 | AC570: =RC[-12]*RC[-12] -> 38.027777777777658 | AD570: =RC[-12]*RC[-12] -> 8.5069444444447209E-2 | AE570: =RC[-11]/SQRT(RC[-6]*RC[-1]) -> -0.99999999999999978 | AF570: =RC[-11]/SQRT(RC[-6]*RC[-2]) -> 1 | AG570: =RC[-11]/SQRT(RC[-6]*RC[-3]) -> -1 | AH570: =RC[-11]/SQRT(RC[-6]*RC[-4]) -> -1 | AI570: =RC[-11]/SQRT(RC[-6]*RC[-5]) -> -1
A571: 43078 | B571: 北京 | C571: 182 | D571: 中度污染 | E571: 1.25 | F571: 15 | G571: 61 | H571: 192 | I571: 169 | J571: 125 | L571: 2013-06-14T20:00:00.000 | M571: =RC[-8]-R[4]C[-8] -> 0.13916666666666666 | N571: =RC[-8]-R[4]C[-8] -> -11.375 | O571: =RC[-8]-R[4]C[-8] -> 11 | P571: =RC[-8]-R[4]C[-8] -> 38.708333333333343 | Q571: =RC[-8]-R[4]C[-8] -> 6.1666666666666572 | R571: =RC[-8]-R[4]C[-8] -> 12.708333333333329 | T571: =RC[-7]*RC[-2] -> 1.7685763888888881 | U571: =RC[-7]*RC[-3] -> -144.5572916666666 | V571: =RC[-7]*RC[-4] -> 139.79166666666663 | W571: =RC[-7]*RC[-5] -> 491.91840277777771 | X571: =RC[-7]*RC[-6] -> 78.368055555555401 | Y571: =RC[-12]*RC[-12] -> 1.936736111111111E-2 | Z571: =RC[-12]*RC[-12] -> 129.390625 | AA571: =RC[-12]*RC[-12] -> 121 | AB571: =RC[-12]*RC[-12] -> 1498.3350694444453 | AC571: =RC[-12]*RC[-12] -> 38.027777777777658 | AD571: =RC[-12]*RC[-12] -> 161.501736111111 | AE571: =RC[-11]/SQRT(RC[-6]*RC[-1]) -> 1 | AF571: =RC[-11]/SQRT(RC[-6]*RC[-2]) -> -0.99999999999999978 | AG571: =RC[-11]/SQRT(RC[-6]*RC[-3]) -> 1 | AH571: =RC[-11]/SQRT(RC[-6]*RC[-4]) -> 0.99999999999999989 | AI571: =RC[-11]/SQRT(RC[-6]*RC[-5]) -> 1
A572: 43154 | B572: 北京 | C572: 174 | D572: 中度污染 | E572: 1.45 | F572: 19 | G572: 57 | H572: 170 | I572: 184 | J572: 124 | L572: 2013-06-14T21:00:00.000 | M572: =RC[-8]-R[3]C[-8] -> 0.33916666666666662 | N572: =RC[-8]-R[3]C[-8] -> -7.375 | O572: =RC[-8]-R[3]C[-8] -> 7 | P572: =RC[-8]-R[3]C[-8] -> 16.708333333333343 | Q572: =RC[-8]-R[3]C[-8] -> 21.166666666666657 | R572: =RC[-8]-R[3]C[-8] -> 11.708333333333329 | T572: =RC[-7]*RC[-2] -> 3.9710763888888865 | U572: =RC[-7]*RC[-3] -> -86.3489583333333 | V572: =RC[-7]*RC[-4] -> 81.9583333333333 | W572: =RC[-7]*RC[-5] -> 195.62673611111114 | X572: =RC[-7]*RC[-6] -> 247.82638888888869 | Y572: =RC[-12]*RC[-12] -> 0.11503402777777774 | Z572: =RC[-12]*RC[-12] -> 54.390625 | AA572: =RC[-12]*RC[-12] -> 49 | AB572: =RC[-12]*RC[-12] -> 279.16840277777811 | AC572: =RC[-12]*RC[-12] -> 448.02777777777737 | AD572: =RC[-12]*RC[-12] -> 137.08506944444434 | AE572: =RC[-11]/SQRT(RC[-6]*RC[-1]) -> 0.99999999999999989 | AF572: =RC[-11]/SQRT(RC[-6]*RC[-2]) -> -1 | AG572: =RC[-11]/SQRT(RC[-6]*RC[-3]) -> 1 | AH572: =RC[-11]/SQRT(RC[-6]*RC[-4]) -> 1 | AI572: =RC[-11]/SQRT(RC[-6]*RC[-5]) -> 1
A573: 43230 | B573: 北京 | C573: 160 | D573: 中度污染 | E573: 1.38 | F573: 27 | G573: 56 | H573: 167 | I573: 175 | J573: 112 | L573: 2013-06-14T22:00:00.000 | M573: =RC[-8]-R[2]C[-8] -> 0.26916666666666655 | N573: =RC[-8]-R[2]C[-8] -> 0.625 | O573: =RC[-8]-R[2]C[-8] -> 6 | P573: =RC[-8]-R[2]C[-8] -> 13.708333333333343 | Q573: =RC[-8]-R[2]C[-8] -> 12.166666666666657 | R573: =RC[-8]-R[2]C[-8] -> -0.2916666666666714 | T573: =RC[-7]*RC[-2] -> -7.8506944444445684E-2 | U573: =RC[-7]*RC[-3] -> -0.18229166666666963 | V573: =RC[-7]*RC[-4] -> -1.7500000000000284 | W573: =RC[-7]*RC[-5] -> -3.9982638888889568 | X573: =RC[-7]*RC[-6] -> -3.5486111111111658 | Y573: =RC[-12]*RC[-12] -> 7.245069444444438E-2 | Z573: =RC[-12]*RC[-12] -> 0.390625 | AA573: =RC[-12]*RC[-12] -> 36 | AB573: =RC[-12]*RC[-12] -> 187.91840277777803 | AC573: =RC[-12]*RC[-12] -> 148.02777777777754 | AD573: =RC[-12]*RC[-12] -> 8.5069444444447209E-2 | AE573: =RC[-11]/SQRT(RC[-6]*RC[-1]) -> -1 | AF573: =RC[-11]/SQRT(RC[-6]*RC[-2]) -> -1 | AG573: =RC[-11]/SQRT(RC[-6]*RC[-3]) -> -1 | AH573: =RC[-11]/SQRT(RC[-6]*RC[-4]) -> -1 | AI573: =RC[-11]/SQRT(RC[-6]*RC[-5]) -> -1
A574: 43306 | B574: 北京 | C574: 151 | D574: 轻度污染 | E574: 1.29 | F574: 30 | G574: 51 | H574: 140 | I574: 142 | J574: 108 | L574: 2013-06-14T23:00:00.000 | M574: =RC[-8]-R[1]C[-8] -> 0.1791666666666667 | N574: =RC[-8]-R[1]C[-8] -> 3.625 | O574: =RC[-8]-R[1]C[-8] -> 1 | P574: =RC[-8]-R[1]C[-8] -> -13.291666666666657 | Q574: =RC[-8]-R[1]C[-8] -> -20.833333333333343 | R574: =RC[-8]-R[1]C[-8] -> -4.2916666666666714 | T574: =RC[-7]*RC[-2] -> -0.76892361111111207 | U574: =RC[-7]*RC[-3] -> -15.557291666666684 | V574: =RC[-7]*RC[-4] -> -4.2916666666666714 | W574: =RC[-7]*RC[-5] -> 57.0434027777778 | X574: =RC[-7]*RC[-6] -> 89.409722222222356 | Y574: =RC[-12]*RC[-12] -> 3.2100694444444453E-2 | Z574: =RC[-12]*RC[-12] -> 13.140625 | AA574: =RC[-12]*RC[-12] -> 1 | AB574: =RC[-12]*RC[-12] -> 176.66840277777752 | AC574: =RC[-12]*RC[-12] -> 434.02777777777817 | AD574: =RC[-12]*RC[-12] -> 18.418402777777818 | AE574: =RC[-11]/SQRT(RC[-6]*RC[-1]) -> -1 | AF574: =RC[-11]/SQRT(RC[-6]*RC[-2]) -> -1 | AG574: =RC[-11]/SQRT(RC[-6]*RC[-3]) -> -1 | AH574: =RC[-11]/SQRT(RC[-6]*RC[-4]) -> 1.0000000000000002 | AI574: =RC[-11]/SQRT(RC[-6]*RC[-5]) -> 1
E575: =AVERAGE(R[-24]C:R[-1]C) -> 1.1108333333333333 | F575: =AVERAGE(R[-24]C:R[-1]C) -> 26.375 | G575: =AVERAGE(R[-24]C:R[-1]C) -> 50 | H575: =AVERAGE(R[-24]C:R[-1]C) -> 153.29166666666666 | I575: =AVERAGE(R[-24]C:R[-1]C) -> 162.83333333333334 | J575: =AVERAGE(R[-24]C:R[-1]C) -> 112.29166666666667 | M575: =RC[-8]-RC[-8] -> 0 | N575: =RC[-8]-RC[-8] -> 0 | O575: =RC[-8]-RC[-8] -> 0 | P575: =RC[-8]-RC[-8] -> 0 | Q575: =RC[-8]-RC[-8] -> 0 | R575: =RC[-8]-RC[-8] -> 0 | T575: =SUM(R[-24]C:R[-1]C) -> 75.474166666666676 | U575: =SUM(R[-24]C:R[-1]C) -> 2264.3750000000005 | V575: =SUM(R[-24]C:R[-1]C) -> -3276.9999999999995 | W575: =SUM(R[-24]C:R[-1]C) -> 27962.958333333328 | X575: =SUM(R[-24]C:R[-1]C) -> 9428.1666666666642 | Y575: =SUM(R[-24]C:R[-1]C) -> 0.90318333333333334 | Z575: =SUM(R[-24]C:R[-1]C) -> 1821.625 | AA575: =SUM(R[-24]C:R[-1]C) -> 3434 | AB575: =SUM(R[-24]C:R[-1]C) -> 141552.95833333334 | AC575: =SUM(R[-24]C:R[-1]C) -> 12439.333333333332 | AD575: =SUM(R[-24]C:R[-1]C) -> 9672.9583333333358 | AE575: =RC[-11]/SQRT(RC[-6]*RC[-1]) -> 0.80747802218472886 | AF575: =RC[-11]/SQRT(RC[-6]*RC[-2]) -> 0.5394351026907912 | AG575: =RC[-11]/SQRT(RC[-6]*RC[-3]) -> -0.56858662236971858 | AH575: =RC[-11]/SQRT(RC[-6]*RC[-4]) -> 0.75569053367068806 | AI575: =RC[-11]/SQRT(RC[-6]*RC[-5]) -> 0.85950625153428661
A576: 43382 | B576: 北京 | C576: 143 | D576: 轻度污染 | E576: 1.31 | F576: 30 | G576: 51 | H576: 112 | I576: 131 | J576: 94 | L576: 2013-06-15T00:00:00.000 | M576: =RC[-8]-R[24]C[-8] -> -0.23833333333333351 | N576: =RC[-8]-R[24]C[-8] -> -3.375 | O576: =RC[-8]-R[24]C[-8] -> -9.1666666666666643 | P576: =RC[-8]-R[24]C[-8] -> -18.25 | Q576: =RC[-8]-R[24]C[-8] -> -41.833333333333343 | R576: =RC[-8]-R[24]C[-8] -> -29.25 | T576: =RC[-7]*RC[-2] -> 6.9712500000000048 | U576: =RC[-7]*RC[-3] -> 98.71875 | V576: =RC[-7]*RC[-4] -> 268.12499999999994 | W576: =RC[-7]*RC[-5] -> 533.8125 | X576: =RC[-7]*RC[-6] -> 1223.6250000000002 | Y576: =RC[-12]*RC[-12] -> 5.6802777777777862E-2 | Z576: =RC[-12]*RC[-12] -> 11.390625 | AA576: =RC[-12]*RC[-12] -> 84.027777777777729 | AB576: =RC[-12]*RC[-12] -> 333.0625 | AC576: =RC[-12]*RC[-12] -> 1750.0277777777785 | AD576: =RC[-12]*RC[-12] -> 855.5625 | AE576: =RC[-11]/SQRT(RC[-6]*RC[-1]) -> 1 | AF576: =RC[-11]/SQRT(RC[-6]*RC[-2]) -> 1 | AG576: =RC[-11]/SQRT(RC[-6]*RC[-3]) -> 1 | AH576: =RC[-11]/SQRT(RC[-6]*RC[-4]) -> 1 | AI576: =RC[-11]/SQRT(RC[-6]*RC[-5]) -> 1
A577: 43458 | B577: 北京 | C577: 141 | D577: 轻度污染 | E577: 1.36 | F577: 30 | G577: 55 | H577: 91 | I577: 116 | J577: 83 | L577: 2013-06-15T01:00:00.000 | M577: =RC[-8]-R[23]C[-8] -> -0.18833333333333346 | N577: =RC[-8]-R[23]C[-8] -> -3.375 | O577: =RC[-8]-R[23]C[-8] -> -5.1666666666666643 | P577: =RC[-8]-R[23]C[-8] -> -39.25 | Q577: =RC[-8]-R[23]C[-8] -> -56.833333333333343 | R577: =RC[-8]-R[23]C[-8] -> -40.25 | T577: =RC[-7]*RC[-2] -> 7.5804166666666717 | U577: =RC[-7]*RC[-3] -> 135.84375 | V577: =RC[-7]*RC[-4] -> 207.95833333333323 | W577: =RC[-7]*RC[-5] -> 1579.8125 | X577: =RC[-7]*RC[-6] -> 2287.541666666667 | Y577: =RC[-12]*RC[-12] -> 3.5469444444444491E-2 | Z577: =RC[-12]*RC[-12] -> 11.390625 | AA577: =RC[-12]*RC[-12] -> 26.694444444444422 | AB577: =RC[-12]*RC[-12] -> 1540.5625 | AC577: =RC[-12]*RC[-12] -> 3230.0277777777787 | AD577: =RC[-12]*RC[-12] -> 1620.0625 | AE577: =RC[-11]/SQRT(RC[-6]*RC[-1]) -> 1 | AF577: =RC[-11]/SQRT(RC[-6]*RC[-2]) -> 1 | AG577: =RC[-11]/SQRT(RC[-6]*RC[-3]) -> 1 | AH577: =RC[-11]/SQRT(RC[-6]*RC[-4]) -> 1 | AI577: =RC[-11]/SQRT(RC[-6]*RC[-5]) -> 1
A578: 43534 | B578: 北京 | C578: 139 | D578: 轻度污染 | E578: 1.38 | F578: 29 | G578: 55 | H578: 71 | I578: 129 | J578: 82 | L578: 2013-06-15T02:00:00.000 | M578: =RC[-8]-R[22]C[-8] -> -0.16833333333333367 | N578: =RC[-8]-R[22]C[-8] -> -4.375 | O578: =RC[-8]-R[22]C[-8] -> -5.1666666666666643 | P578: =RC[-8]-R[22]C[-8] -> -59.25 | Q578: =RC[-8]-R[22]C[-8] -> -43.833333333333343 | R578: =RC[-8]-R[22]C[-8] -> -41.25 | T578: =RC[-7]*RC[-2] -> 6.9437500000000139 | U578: =RC[-7]*RC[-3] -> 180.46875 | V578: =RC[-7]*RC[-4] -> 213.12499999999991 | W578: =RC[-7]*RC[-5] -> 2444.0625 | X578: =RC[-7]*RC[-6] -> 1808.1250000000005 | Y578: =RC[-12]*RC[-12] -> 2.8336111111111225E-2 | Z578: =RC[-12]*RC[-12] -> 19.140625 | AA578: =RC[-12]*RC[-12] -> 26.694444444444422 | AB578: =RC[-12]*RC[-12] -> 3510.5625 | AC578: =RC[-12]*RC[-12] -> 1921.361111111112 | AD578: =RC[-12]*RC[-12] -> 1701.5625 | AE578: =RC[-11]/SQRT(RC[-6]*RC[-1]) -> 1 | AF578: =RC[-11]/SQRT(RC[-6]*RC[-2]) -> 1 | AG578: =RC[-11]/SQRT(RC[-6]*RC[-3]) -> 1 | AH578: =RC[-11]/SQRT(RC[-6]*RC[-4]) -> 1 | AI578: =RC[-11]/SQRT(RC[-6]*RC[-5]) -> 1
A579: 43610 | B579: 北京 | C579: 140 | D579: 轻度污染 | E579: 1.43 | F579: 24 | G579: 60 | H579: 38 | I579: 132 | J579: 83 | L579: 2013-06-15T03:00:00.000 | M579: =RC[-8]-R[21]C[-8] -> -0.11833333333333362 | N579: =RC[-8]-R[21]C[-8] -> -9.375 | O579: =RC[-8]-R[21]C[-8] -> -0.1666666666666643 | P579: =RC[-8]-R[21]C[-8] -> -92.25 | Q579: =RC[-8]-R[21]C[-8] -> -40.833333333333343 | R579: =RC[-8]-R[21]C[-8] -> -40.25 | T579: =RC[-7]*RC[-2] -> 4.762916666666678 | U579: =RC[-7]*RC[-3] -> 377.34375 | V579: =RC[-7]*RC[-4] -> 6.708333333333238 | W579: =RC[-7]*RC[-5] -> 3713.0625 | X579: =RC[-7]*RC[-6] -> 1643.541666666667 | Y579: =RC[-12]*RC[-12] -> 1.4002777777777847E-2 | Z579: =RC[-12]*RC[-12] -> 87.890625 | AA579: =RC[-12]*RC[-12] -> 2.7777777777776989E-2 | AB579: =RC[-12]*RC[-12] -> 8510.0625 | AC579: =RC[-12]*RC[-12] -> 1667.361111111112 | AD579: =RC[-12]*RC[-12] -> 1620.0625 | AE579: =RC[-11]/SQRT(RC[-6]*RC[-1]) -> 0.99999999999999978 | AF579: =RC[-11]/SQRT(RC[-6]*RC[-2]) -> 1 | AG579: =RC[-11]/SQRT(RC[-6]*RC[-3]) -> 1 | AH579: =RC[-11]/SQRT(RC[-6]*RC[-4]) -> 1 | AI579: =RC[-11]/SQRT(RC[-6]*RC[-5]) -> 0.99999999999999989
A580: 43686 | B580: 北京 | C580: 139 | D580: 轻度污染 | E580: 1.28 | F580: 22 | G580: 83 | H580: 28 | I580: 128 | J580: 84 | L580: 2013-06-15T04:00:00.000 | M580: =RC[-8]-R[20]C[-8] -> -0.26833333333333353 | N580: =RC[-8]-R[20]C[-8] -> -11.375 | O580: =RC[-8]-R[20]C[-8] -> 22.833333333333336 | P580: =RC[-8]-R[20]C[-8] -> -102.25 | Q580: =RC[-8]-R[20]C[-8] -> -44.833333333333343 | R580: =RC[-8]-R[20]C[-8] -> -39.25 | T580: =RC[-7]*RC[-2] -> 10.532083333333341 | U580: =RC[-7]*RC[-3] -> 446.46875 | V580: =RC[-7]*RC[-4] -> -896.20833333333337 | W580: =RC[-7]*RC[-5] -> 4013.3125 | X580: =RC[-7]*RC[-6] -> 1759.7083333333337 | Y580: =RC[-12]*RC[-12] -> 7.2002777777777888E-2 | Z580: =RC[-12]*RC[-12] -> 129.390625 | AA580: =RC[-12]*RC[-12] -> 521.3611111111112 | AB580: =RC[-12]*RC[-12] -> 10455.0625 | AC580: =RC[-12]*RC[-12] -> 2010.0277777777787 | AD580: =RC[-12]*RC[-12] -> 1540.5625 | AE580: =RC[-11]/SQRT(RC[-6]*RC[-1]) -> 1 | AF580: =RC[-11]/SQRT(RC[-6]*RC[-2]) -> 1 | AG580: =RC[-11]/SQRT(RC[-6]*RC[-3]) -> -1 | AH580: =RC[-11]/SQRT(RC[-6]*RC[-4]) -> 1 | AI580: =RC[-11]/SQRT(RC[-6]*RC[-5]) -> 1
A581: 43762 | B581: 北京 | C581: 139 | D581: 轻度污染 | E581: 1.22 | F581: 17 | G581: 78 | H581: 23 | I581: 124 | J581: 80 | L581: 2013-06-15T05:00:00.000 | M581: =RC[-8]-R[19]C[-8] -> -0.32833333333333359 | N581: =RC[-8]-R[19]C[-8] -> -16.375 | O581: =RC[-8]-R[19]C[-8] -> 17.833333333333336 | P581: =RC[-8]-R[19]C[-8] -> -107.25 | Q581: =RC[-8]-R[19]C[-8] -> -48.833333333333343 | R581: =RC[-8]-R[19]C[-8] -> -43.25 | T581: =RC[-7]*RC[-2] -> 14.200416666666678 | U581: =RC[-7]*RC[-3] -> 708.21875 | V581: =RC[-7]*RC[-4] -> -771.29166666666674 | W581: =RC[-7]*RC[-5] -> 4638.5625 | X581: =RC[-7]*RC[-6] -> 2112.041666666667 | Y581: =RC[-12]*RC[-12] -> 0.10780277777777794 | Z581: =RC[-12]*RC[-12] -> 268.140625 | AA581: =RC[-12]*RC[-12] -> 318.02777777777789 | AB581: =RC[-12]*RC[-12] -> 11502.5625 | AC581: =RC[-12]*RC[-12] -> 2384.6944444444453 | AD581: =RC[-12]*RC[-12] -> 1870.5625 | AE581: =RC[-11]/SQRT(RC[-6]*RC[-1]) -> 1.0000000000000002 | AF581: =RC[-11]/SQRT(RC[-6]*RC[-2]) -> 1 | AG581: =RC[-11]/SQRT(RC[-6]*RC[-3]) -> -1 | AH581: =RC[-11]/SQRT(RC[-6]*RC[-4]) -> 1 | AI581: =RC[-11]/SQRT(RC[-6]*RC[-5]) -> 1
A582: 43838 | B582: 北京 | C582: 138 | D582: 轻度污染 | E582: 1.1000000000000001 | F582: 15 | G582: 64 | H582: 25 | I582: 112 | J582: 73 | L582: 2013-06-15T06:00:00.000 | M582: =RC[-8]-R[18]C[-8] -> -0.44833333333333347 | N582: =RC[-8]-R[18]C[-8] -> -18.375 | O582: =RC[-8]-R[18]C[-8] -> 3.8333333333333357 | P582: =RC[-8]-R[18]C[-8] -> -105.25 | Q582: =RC[-8]-R[18]C[-8] -> -60.833333333333343 | R582: =RC[-8]-R[18]C[-8] -> -50.25 | T582: =RC[-7]*RC[-2] -> 22.528750000000006 | U582: =RC[-7]*RC[-3] -> 923.34375 | V582: =RC[-7]*RC[-4] -> -192.62500000000011 | W582: =RC[-7]*RC[-5] -> 5288.8125 | X582: =RC[-7]*RC[-6] -> 3056.8750000000005 | Y582: =RC[-12]*RC[-12] -> 0.20100277777777789 | Z582: =RC[-12]*RC[-12] -> 337.640625 | AA582: =RC[-12]*RC[-12] -> 14.694444444444462 | AB582: =RC[-12]*RC[-12] -> 11077.5625 | AC582: =RC[-12]*RC[-12] -> 3700.6944444444457 | AD582: =RC[-12]*RC[-12] -> 2525.0625 | AE582: =RC[-11]/SQRT(RC[-6]*RC[-1]) -> 1 | AF582: =RC[-11]/SQRT(RC[-6]*RC[-2]) -> 1 | AG582: =RC[-11]/SQRT(RC[-6]*RC[-3]) -> -1 | AH582: =RC[-11]/SQRT(RC[-6]*RC[-4]) -> 1 | AI582: =RC[-11]/SQRT(RC[-6]*RC[-5]) -> 1
A583: 43914 | B583: 北京 | C583: 137 | D583: 轻度污染 | E583: 1.1599999999999999 | F583: 19 | G583: 64 | H583: 23 | I583: 122 | J583: 75 | L583: 2013-06-15T07:00:00.000 | M583: =RC[-8]-R[17]C[-8] -> -0.38833333333333364 | N583: =RC[-8]-R[17]C[-8] -> -14.375 | O583: =RC[-8]-R[17]C[-8] -> 3.8333333333333357 | P583: =RC[-8]-R[17]C[-8] -> -107.25 | Q583: =RC[-8]-R[17]C[-8] -> -50.833333333333343 | R583: =RC[-8]-R[17]C[-8] -> -48.25 | T583: =RC[-7]*RC[-2] -> 18.737083333333349 | U583: =RC[-7]*RC[-3] -> 693.59375 | V583: =RC[-7]*RC[-4] -> -184.95833333333346 | W583: =RC[-7]*RC[-5] -> 5174.8125 | X583: =RC[-7]*RC[-6] -> 2452.7083333333339 | Y583: =RC[-12]*RC[-12] -> 0.15080277777777801 | Z583: =RC[-12]*RC[-12] -> 206.640625 | AA583: =RC[-12]*RC[-12] -> 14.694444444444462 | AB583: =RC[-12]*RC[-12] -> 11502.5625 | AC583: =RC[-12]*RC[-12] -> 2584.0277777777787 | AD583: =RC[-12]*RC[-12] -> 2328.0625 | AE583: =RC[-11]/SQRT(RC[-6]*RC[-1]) -> 1 | AF583: =RC[-11]/SQRT(RC[-6]*RC[-2]) -> 1 | AG583: =RC[-11]/SQRT(RC[-6]*RC[-3]) -> -1 | AH583: =RC[-11]/SQRT(RC[-6]*RC[-4]) -> 1 | AI583: =RC[-11]/SQRT(RC[-6]*RC[-5]) -> 1
A584: 43990 | B584: 北京 | C584: 135 | D584: 轻度污染 | E584: 1.2 | F584: 24 | G584: 62 | H584: 33 | I584: 130 | J584: 83 | L584: 2013-06-15T08:00:00.000 | M584: =RC[-8]-R[16]C[-8] -> -0.34833333333333361 | N584: =RC[-8]-R[16]C[-8] -> -9.375 | O584: =RC[-8]-R[16]C[-8] -> 1.8333333333333357 | P584: =RC[-8]-R[16]C[-8] -> -97.25 | Q584: =RC[-8]-R[16]C[-8] -> -42.833333333333343 | R584: =RC[-8]-R[16]C[-8] -> -40.25 | T584: =RC[-7]*RC[-2] -> 14.020416666666678 | U584: =RC[-7]*RC[-3] -> 377.34375 | V584: =RC[-7]*RC[-4] -> -73.791666666666757 | W584: =RC[-7]*RC[-5] -> 3914.3125 | X584: =RC[-7]*RC[-6] -> 1724.041666666667 | Y584: =RC[-12]*RC[-12] -> 0.1213361111111113 | Z584: =RC[-12]*RC[-12] -> 87.890625 | AA584: =RC[-12]*RC[-12] -> 3.3611111111111196 | AB584: =RC[-12]*RC[-12] -> 9457.5625 | AC584: =RC[-12]*RC[-12] -> 1834.6944444444453 | AD584: =RC[-12]*RC[-12] -> 1620.0625 | AE584: =RC[-11]/SQRT(RC[-6]*RC[-1]) -> 1 | AF584: =RC[-11]/SQRT(RC[-6]*RC[-2]) -> 1 | AG584: =RC[-11]/SQRT(RC[-6]*RC[-3]) -> -1 | AH584: =RC[-11]/SQRT(RC[-6]*RC[-4]) -> 1 | AI584: =RC[-11]/SQRT(RC[-6]*RC[-5]) -> 1
A585: 44066 | B585: 北京 | C585: 134 | D585: 轻度污染 | E585: 1.36 | F585: 32 | G585: 66 | H585: 42 | I585: 139 | J585: 91 | L585: 2013-06-15T09:00:00.000 | M585: =RC[-8]-R[15]C[-8] -> -0.18833333333333346 | N585: =RC[-8]-R[15]C[-8] -> -1.375 | O585: =RC[-8]-R[15]C[-8] -> 5.8333333333333357 | P585: =RC[-8]-R[15]C[-8] -> -88.25 | Q585: =RC[-8]-R[15]C[-8] -> -33.833333333333343 | R585: =RC[-8]-R[15]C[-8] -> -32.25 | T585: =RC[-7]*RC[-2] -> 6.073750000000004 | U585: =RC[-7]*RC[-3] -> 44.34375 | V585: =RC[-7]*RC[-4] -> -188.12500000000009 | W585: =RC[-7]*RC[-5] -> 2846.0625 | X585: =RC[-7]*RC[-6] -> 1091.1250000000002 | Y585: =RC[-12]*RC[-12] -> 3.5469444444444491E-2 | Z585: =RC[-12]*RC[-12] -> 1.890625 | AA585: =RC[-12]*RC[-12] -> 34.027777777777807 | AB585: =RC[-12]*RC[-12] -> 7788.0625 | AC585: =RC[-12]*RC[-12] -> 1144.694444444445 | AD585: =RC[-12]*RC[-12] -> 1040.0625 | AE585: =RC[-11]/SQRT(RC[-6]*RC[-1]) -> 1 | AF585: =RC[-11]/SQRT(RC[-6]*RC[-2]) -> 1 | AG585: =RC[-11]/SQRT(RC[-6]*RC[-3]) -> -1 | AH585: =RC[-11]/SQRT(RC[-6]*RC[-4]) -> 1 | AI585: =RC[-11]/SQRT(RC[-6]*RC[-5]) -> 1
A586: 44142 | B586: 北京 | C586: 133 | D586: 轻度污染 | E586: 1.44 | F586: 36 | G586: 61 | H586: 63 | I586: 146 | J586: 97 | L586: 2013-06-15T10:00:00.000 | M586: =RC[-8]-R[14]C[-8] -> -0.10833333333333361 | N586: =RC[-8]-R[14]C[-8] -> 2.625 | O586: =RC[-8]-R[14]C[-8] -> 0.8333333333333357 | P586: =RC[-8]-R[14]C[-8] -> -67.25 | Q586: =RC[-8]-R[14]C[-8] -> -26.833333333333343 | R586: =RC[-8]-R[14]C[-8] -> -26.25 | T586: =RC[-7]*RC[-2] -> 2.8437500000000075 | U586: =RC[-7]*RC[-3] -> -68.90625 | V586: =RC[-7]*RC[-4] -> -21.875000000000064 | W586: =RC[-7]*RC[-5] -> 1765.3125 | X586: =RC[-7]*RC[-6] -> 704.37500000000023 | Y586: =RC[-12]*RC[-12] -> 1.1736111111111173E-2 | Z586: =RC[-12]*RC[-12] -> 6.890625 | AA586: =RC[-12]*RC[-12] -> 0.69444444444444842 | AB586: =RC[-12]*RC[-12] -> 4522.5625 | AC586: =RC[-12]*RC[-12] -> 720.02777777777828 | AD586: =RC[-12]*RC[-12] -> 689.0625 | AE586: =RC[-11]/SQRT(RC[-6]*RC[-1]) -> 1 | AF586: =RC[-11]/SQRT(RC[-6]*RC[-2]) -> -1 | AG586: =RC[-11]/SQRT(RC[-6]*RC[-3]) -> -1 | AH586: =RC[-11]/SQRT(RC[-6]*RC[-4]) -> 1 | AI586: =RC[-11]/SQRT(RC[-6]*RC[-5]) -> 1
A587: 44218 | B587: 北京 | C587: 131 | D587: 轻度污染 | E587: 1.64 | F587: 41 | G587: 61 | H587: 90 | I587: 169 | J587: 111 | L587: 2013-06-15T11:00:00.000 | M587: =RC[-8]-R[13]C[-8] -> 9.1666666666666341E-2 | N587: =RC[-8]-R[13]C[-8] -> 7.625 | O587: =RC[-8]-R[13]C[-8] -> 0.8333333333333357 | P587: =RC[-8]-R[13]C[-8] -> -40.25 | Q587: =RC[-8]-R[13]C[-8] -> -3.8333333333333428 | R587: =RC[-8]-R[13]C[-8] -> -12.25 | T587: =RC[-7]*RC[-2] -> -1.1229166666666628 | U587: =RC[-7]*RC[-3] -> -93.40625 | V587: =RC[-7]*RC[-4] -> -10.208333333333362 | W587: =RC[-7]*RC[-5] -> 493.0625 | X587: =RC[-7]*RC[-6] -> 46.958333333333449 | Y587: =RC[-12]*RC[-12] -> 8.4027777777777174E-3 | Z587: =RC[-12]*RC[-12] -> 58.140625 | AA587: =RC[-12]*RC[-12] -> 0.69444444444444842 | AB587: =RC[-12]*RC[-12] -> 1620.0625 | AC587: =RC[-12]*RC[-12] -> 14.694444444444517 | AD587: =RC[-12]*RC[-12] -> 150.0625 | AE587: =RC[-11]/SQRT(RC[-6]*RC[-1]) -> -1.0000000000000002 | AF587: =RC[-11]/SQRT(RC[-6]*RC[-2]) -> -1 | AG587: =RC[-11]/SQRT(RC[-6]*RC[-3]) -> -1 | AH587: =RC[-11]/SQRT(RC[-6]*RC[-4]) -> 1 | AI587: =RC[-11]/SQRT(RC[-6]*RC[-5]) -> 1
A588: 44294 | B588: 北京 | C588: 131 | D588: 轻度污染 | E588: 1.78 | F588: 46 | G588: 56 | H588: 122 | I588: 179 | J588: 127 | L588: 2013-06-15T12:00:00.000 | M588: =RC[-8]-R[12]C[-8] -> 0.23166666666666647 | N588: =RC[-8]-R[12]C[-8] -> 12.625 | O588: =RC[-8]-R[12]C[-8] -> -4.1666666666666643 | P588: =RC[-8]-R[12]C[-8] -> -8.25 | Q588: =RC[-8]-R[12]C[-8] -> 6.1666666666666572 | R588: =RC[-8]-R[12]C[-8] -> 3.75 | T588: =RC[-7]*RC[-2] -> 0.86874999999999925 | U588: =RC[-7]*RC[-3] -> 47.34375 | V588: =RC[-7]*RC[-4] -> -15.624999999999991 | W588: =RC[-7]*RC[-5] -> -30.9375 | X588: =RC[-7]*RC[-6] -> 23.124999999999964 | Y588: =RC[-12]*RC[-12] -> 5.3669444444444353E-2 | Z588: =RC[-12]*RC[-12] -> 159.390625 | AA588: =RC[-12]*RC[-12] -> 17.361111111111093 | AB588: =RC[-12]*RC[-12] -> 68.0625 | AC588: =RC[-12]*RC[-12] -> 38.027777777777658 | AD588: =RC[-12]*RC[-12] -> 14.0625 | AE588: =RC[-11]/SQRT(RC[-6]*RC[-1]) -> 1 | AF588: =RC[-11]/SQRT(RC[-6]*RC[-2]) -> 1 | AG588: =RC[-11]/SQRT(RC[-6]*RC[-3]) -> -1 | AH588: =RC[-11]/SQRT(RC[-6]*RC[-4]) -> -1 | AI588: =RC[-11]/SQRT(RC[-6]*RC[-5]) -> 1
A589: 44370 | B589: 北京 | C589: 131 | D589: 轻度污染 | E589: 1.86 | F589: 49 | G589: 57 | H589: 152 | I589: 191 | J589: 137 | L589: 2013-06-15T13:00:00.000 | M589: =RC[-8]-R[11]C[-8] -> 0.31166666666666654 | N589: =RC[-8]-R[11]C[-8] -> 15.625 | O589: =RC[-8]-R[11]C[-8] -> -3.1666666666666643 | P589: =RC[-8]-R[11]C[-8] -> 21.75 | Q589: =RC[-8]-R[11]C[-8] -> 18.166666666666657 | R589: =RC[-8]-R[11]C[-8] -> 13.75 | T589: =RC[-7]*RC[-2] -> 4.2854166666666647 | U589: =RC[-7]*RC[-3] -> 214.84375 | V589: =RC[-7]*RC[-4] -> -43.541666666666636 | W589: =RC[-7]*RC[-5] -> 299.0625 | X589: =RC[-7]*RC[-6] -> 249.79166666666654 | Y589: =RC[-12]*RC[-12] -> 9.7136111111111034E-2 | Z589: =RC[-12]*RC[-12] -> 244.140625 | AA589: =RC[-12]*RC[-12] -> 10.027777777777763 | AB589: =RC[-12]*RC[-12] -> 473.0625 | AC589: =RC[-12]*RC[-12] -> 330.02777777777743 | AD589: =RC[-12]*RC[-12] -> 189.0625 | AE589: =RC[-11]/SQRT(RC[-6]*RC[-1]) -> 1 | AF589: =RC[-11]/SQRT(RC[-6]*RC[-2]) -> 1 | AG589: =RC[-11]/SQRT(RC[-6]*RC[-3]) -> -1 | AH589: =RC[-11]/SQRT(RC[-6]*RC[-4]) -> 1 | AI589: =RC[-11]/SQRT(RC[-6]*RC[-5]) -> 1
A590: 44446 | B590: 北京 | C590: 133 | D590: 轻度污染 | E590: 1.96 | F590: 50 | G590: 62 | H590: 192 | I590: 206 | J590: 149 | L590: 2013-06-15T14:00:00.000 | M590: =RC[-8]-R[10]C[-8] -> 0.4116666666666664 | N590: =RC[-8]-R[10]C[-8] -> 16.625 | O590: =RC[-8]-R[10]C[-8] -> 1.8333333333333357 | P590: =RC[-8]-R[10]C[-8] -> 61.75 | Q590: =RC[-8]-R[10]C[-8] -> 33.166666666666657 | R590: =RC[-8]-R[10]C[-8] -> 25.75 | T590: =RC[-7]*RC[-2] -> 10.600416666666661 | U590: =RC[-7]*RC[-3] -> 428.09375 | V590: =RC[-7]*RC[-4] -> 47.208333333333393 | W590: =RC[-7]*RC[-5] -> 1590.0625 | X590: =RC[-7]*RC[-6] -> 854.0416666666664 | Y590: =RC[-12]*RC[-12] -> 0.16946944444444423 | Z590: =RC[-12]*RC[-12] -> 276.390625 | AA590: =RC[-12]*RC[-12] -> 3.3611111111111196 | AB590: =RC[-12]*RC[-12] -> 3813.0625 | AC590: =RC[-12]*RC[-12] -> 1100.0277777777771 | AD590: =RC[-12]*RC[-12] -> 663.0625 | AE590: =RC[-11]/SQRT(RC[-6]*RC[-1]) -> 1 | AF590: =RC[-11]/SQRT(RC[-6]*RC[-2]) -> 1 | AG590: =RC[-11]/SQRT(RC[-6]*RC[-3]) -> 1 | AH590: =RC[-11]/SQRT(RC[-6]*RC[-4]) -> 1 | AI590: =RC[-11]/SQRT(RC[-6]*RC[-5]) -> 1
A591: 44522 | B591: 北京 | C591: 139 | D591: 轻度污染 | E591: 1.91 | F591: 56 | G591: 58 | H591: 239 | I591: 220 | J591: 155 | L591: 2013-06-15T15:00:00.000 | M591: =RC[-8]-R[9]C[-8] -> 0.36166666666666636 | N591: =RC[-8]-R[9]C[-8] -> 22.625 | O591: =RC[-8]-R[9]C[-8] -> -2.1666666666666643 | P591: =RC[-8]-R[9]C[-8] -> 108.75 | Q591: =RC[-8]-R[9]C[-8] -> 47.166666666666657 | R591: =RC[-8]-R[9]C[-8] -> 31.75 | T591: =RC[-7]*RC[-2] -> 11.482916666666657 | U591: =RC[-7]*RC[-3] -> 718.34375 | V591: =RC[-7]*RC[-4] -> -68.791666666666586 | W591: =RC[-7]*RC[-5] -> 3452.8125 | X591: =RC[-7]*RC[-6] -> 1497.5416666666663 | Y591: =RC[-12]*RC[-12] -> 0.13080277777777755 | Z591: =RC[-12]*RC[-12] -> 511.890625 | AA591: =RC[-12]*RC[-12] -> 4.694444444444434 | AB591: =RC[-12]*RC[-12] -> 11826.5625 | AC591: =RC[-12]*RC[-12] -> 2224.6944444444434 | AD591: =RC[-12]*RC[-12] -> 1008.0625 | AE591: =RC[-11]/SQRT(RC[-6]*RC[-1]) -> 1.0000000000000002 | AF591: =RC[-11]/SQRT(RC[-6]*RC[-2]) -> 1 | AG591: =RC[-11]/SQRT(RC[-6]*RC[-3]) -> -1 | AH591: =RC[-11]/SQRT(RC[-6]*RC[-4]) -> 1 | AI591: =RC[-11]/SQRT(RC[-6]*RC[-5]) -> 1
A592: 44598 | B592: 北京 | C592: 147 | D592: 轻度污染 | E592: 1.68 | F592: 47 | G592: 46 | H592: 271 | I592: 211 | J592: 157 | L592: 2013-06-15T16:00:00.000 | M592: =RC[-8]-R[8]C[-8] -> 0.13166666666666638 | N592: =RC[-8]-R[8]C[-8] -> 13.625 | O592: =RC[-8]-R[8]C[-8] -> -14.166666666666664 | P592: =RC[-8]-R[8]C[-8] -> 140.75 | Q592: =RC[-8]-R[8]C[-8] -> 38.166666666666657 | R592: =RC[-8]-R[8]C[-8] -> 33.75 | T592: =RC[-7]*RC[-2] -> 4.4437499999999899 | U592: =RC[-7]*RC[-3] -> 459.84375 | V592: =RC[-7]*RC[-4] -> -478.12499999999994 | W592: =RC[-7]*RC[-5] -> 4750.3125 | X592: =RC[-7]*RC[-6] -> 1288.1249999999998 | Y592: =RC[-12]*RC[-12] -> 1.7336111111111035E-2 | Z592: =RC[-12]*RC[-12] -> 185.640625 | AA592: =RC[-12]*RC[-12] -> 200.69444444444437 | AB592: =RC[-12]*RC[-12] -> 19810.5625 | AC592: =RC[-12]*RC[-12] -> 1456.6944444444437 | AD592: =RC[-12]*RC[-12] -> 1139.0625 | AE592: =RC[-11]/SQRT(RC[-6]*RC[-1]) -> 0.99999999999999978 | AF592: =RC[-11]/SQRT(RC[-6]*RC[-2]) -> 1 | AG592: =RC[-11]/SQRT(RC[-6]*RC[-3]) -> -1.0000000000000002 | AH592: =RC[-11]/SQRT(RC[-6]*RC[-4]) -> 1 | AI592: =RC[-11]/SQRT(RC[-6]*RC[-5]) -> 1.0000000000000002
A593: 44674 | B593: 北京 | C593: 146 | D593: 轻度污染 | E593: 1.52 | F593: 40 | G593: 42 | H593: 274 | I593: 204 | J593: 149 | L593: 2013-06-15T17:00:00.000 | M593: =RC[-8]-R[7]C[-8] -> -2.8333333333333544E-2 | N593: =RC[-8]-R[7]C[-8] -> 6.625 | O593: =RC[-8]-R[7]C[-8] -> -18.166666666666664 | P593: =RC[-8]-R[7]C[-8] -> 143.75 | Q593: =RC[-8]-R[7]C[-8] -> 31.166666666666657 | R593: =RC[-8]-R[7]C[-8] -> 25.75 | T593: =RC[-7]*RC[-2] -> -0.7295833333333388 | U593: =RC[-7]*RC[-3] -> 170.59375 | V593: =RC[-7]*RC[-4] -> -467.79166666666663 | W593: =RC[-7]*RC[-5] -> 3701.5625 | X593: =RC[-7]*RC[-6] -> 802.5416666666664 | Y593: =RC[-12]*RC[-12] -> 8.0277777777778973E-4 | Z593: =RC[-12]*RC[-12] -> 43.890625 | AA593: =RC[-12]*RC[-12] -> 330.02777777777771 | AB593: =RC[-12]*RC[-12] -> 20664.0625 | AC593: =RC[-12]*RC[-12] -> 971.36111111111052 | AD593: =RC[-12]*RC[-12] -> 663.0625 | AE593: =RC[-11]/SQRT(RC[-6]*RC[-1]) -> -1 | AF593: =RC[-11]/SQRT(RC[-6]*RC[-2]) -> 1 | AG593: =RC[-11]/SQRT(RC[-6]*RC[-3]) -> -1 | AH593: =RC[-11]/SQRT(RC[-6]*RC[-4]) -> 1 | AI593: =RC[-11]/SQRT(RC[-6]*RC[-5]) -> 1
A594: 44750 | B594: 北京 | C594: 152 | D594: 中度污染 | E594: 1.58 | F594: 35 | G594: 50 | H594: 267 | I594: 215 | J594: 154 | L594: 2013-06-15T18:00:00.000 | M594: =RC[-8]-R[6]C[-8] -> 3.166666666666651E-2 | N594: =RC[-8]-R[6]C[-8] -> 1.625 | O594: =RC[-8]-R[6]C[-8] -> -10.166666666666664 | P594: =RC[-8]-R[6]C[-8] -> 136.75 | Q594: =RC[-8]-R[6]C[-8] -> 42.166666666666657 | R594: =RC[-8]-R[6]C[-8] -> 30.75 | T594: =RC[-7]*RC[-2] -> 0.97374999999999523 | U594: =RC[-7]*RC[-3] -> 49.96875 | V594: =RC[-7]*RC[-4] -> -312.62499999999994 | W594: =RC[-7]*RC[-5] -> 4205.0625 | X594: =RC[-7]*RC[-6] -> 1296.6249999999998 | Y594: =RC[-12]*RC[-12] -> 1.0027777777777678E-3 | Z594: =RC[-12]*RC[-12] -> 2.640625 | AA594: =RC[-12]*RC[-12] -> 103.36111111111106 | AB594: =RC[-12]*RC[-12] -> 18700.5625 | AC594: =RC[-12]*RC[-12] -> 1778.0277777777769 | AD594: =RC[-12]*RC[-12] -> 945.5625 | AE594: =RC[-11]/SQRT(RC[-6]*RC[-1]) -> 1.0000000000000002 | AF594: =RC[-11]/SQRT(RC[-6]*RC[-2]) -> 1 | AG594: =RC[-11]/SQRT(RC[-6]*RC[-3]) -> -1 | AH594: =RC[-11]/SQRT(RC[-6]*RC[-4]) -> 1 | AI594: =RC[-11]/SQRT(RC[-6]*RC[-5]) -> 1
A595: 44826 | B595: 北京 | C595: 163 | D595: 中度污染 | E595: 1.7 | F595: 30 | G595: 58 | H595: 242 | I595: 228 | J595: 164 | L595: 2013-06-15T19:00:00.000 | M595: =RC[-8]-R[5]C[-8] -> 0.15166666666666639 | N595: =RC[-8]-R[5]C[-8] -> -3.375 | O595: =RC[-8]-R[5]C[-8] -> -2.1666666666666643 | P595: =RC[-8]-R[5]C[-8] -> 111.75 | Q595: =RC[-8]-R[5]C[-8] -> 55.166666666666657 | R595: =RC[-8]-R[5]C[-8] -> 40.75 | T595: =RC[-7]*RC[-2] -> 6.1804166666666553 | U595: =RC[-7]*RC[-3] -> -137.53125 | V595: =RC[-7]*RC[-4] -> -88.291666666666572 | W595: =RC[-7]*RC[-5] -> 4553.8125 | X595: =RC[-7]*RC[-6] -> 2248.0416666666661 | Y595: =RC[-12]*RC[-12] -> 2.3002777777777695E-2 | Z595: =RC[-12]*RC[-12] -> 11.390625 | AA595: =RC[-12]*RC[-12] -> 4.694444444444434 | AB595: =RC[-12]*RC[-12] -> 12488.0625 | AC595: =RC[-12]*RC[-12] -> 3043.3611111111099 | AD595: =RC[-12]*RC[-12] -> 1660.5625 | AE595: =RC[-11]/SQRT(RC[-6]*RC[-1]) -> 1 | AF595: =RC[-11]/SQRT(RC[-6]*RC[-2]) -> -1 | AG595: =RC[-11]/SQRT(RC[-6]*RC[-3]) -> -1 | AH595: =RC[-11]/SQRT(RC[-6]*RC[-4]) -> 1 | AI595: =RC[-11]/SQRT(RC[-6]*RC[-5]) -> 1
A596: 44902 | B596: 北京 | C596: 171 | D596: 中度污染 | E596: 1.79 | F596: 26 | G596: 58 | H596: 217 | I596: 249 | J596: 182 | L596: 2013-06-15T20:00:00.000 | M596: =RC[-8]-R[4]C[-8] -> 0.24166666666666647 | N596: =RC[-8]-R[4]C[-8] -> -7.375 | O596: =RC[-8]-R[4]C[-8] -> -2.1666666666666643 | P596: =RC[-8]-R[4]C[-8] -> 86.75 | Q596: =RC[-8]-R[4]C[-8] -> 76.166666666666657 | R596: =RC[-8]-R[4]C[-8] -> 58.75 | T596: =RC[-7]*RC[-2] -> 14.197916666666655 | U596: =RC[-7]*RC[-3] -> -433.28125 | V596: =RC[-7]*RC[-4] -> -127.29166666666653 | W596: =RC[-7]*RC[-5] -> 5096.5625 | X596: =RC[-7]*RC[-6] -> 4474.7916666666661 | Y596: =RC[-12]*RC[-12] -> 5.8402777777777685E-2 | Z596: =RC[-12]*RC[-12] -> 54.390625 | AA596: =RC[-12]*RC[-12] -> 4.694444444444434 | AB596: =RC[-12]*RC[-12] -> 7525.5625 | AC596: =RC[-12]*RC[-12] -> 5801.3611111111095 | AD596: =RC[-12]*RC[-12] -> 3451.5625 | AE596: =RC[-11]/SQRT(RC[-6]*RC[-1]) -> 1 | AF596: =RC[-11]/SQRT(RC[-6]*RC[-2]) -> -1 | AG596: =RC[-11]/SQRT(RC[-6]*RC[-3]) -> -1.0000000000000002 | AH596: =RC[-11]/SQRT(RC[-6]*RC[-4]) -> 1 | AI596: =RC[-11]/SQRT(RC[-6]*RC[-5]) -> 1
A597: 44978 | B597: 北京 | C597: 176 | D597: 中度污染 | E597: 2.02 | F597: 27 | G597: 70 | H597: 187 | I597: 274 | J597: 211 | L597: 2013-06-15T21:00:00.000 | M597: =RC[-8]-R[3]C[-8] -> 0.47166666666666646 | N597: =RC[-8]-R[3]C[-8] -> -6.375 | O597: =RC[-8]-R[3]C[-8] -> 9.8333333333333357 | P597: =RC[-8]-R[3]C[-8] -> 56.75 | Q597: =RC[-8]-R[3]C[-8] -> 101.16666666666666 | R597: =RC[-8]-R[3]C[-8] -> 87.75 | T597: =RC[-7]*RC[-2] -> 41.38874999999998 | U597: =RC[-7]*RC[-3] -> -559.40625 | V597: =RC[-7]*RC[-4] -> 862.87500000000023 | W597: =RC[-7]*RC[-5] -> 4979.8125 | X597: =RC[-7]*RC[-6] -> 8877.375 | Y597: =RC[-12]*RC[-12] -> 0.22246944444444425 | Z597: =RC[-12]*RC[-12] -> 40.640625 | AA597: =RC[-12]*RC[-12] -> 96.694444444444485 | AB597: =RC[-12]*RC[-12] -> 3220.5625 | AC597: =RC[-12]*RC[-12] -> 10234.694444444443 | AD597: =RC[-12]*RC[-12] -> 7700.0625 | AE597: =RC[-11]/SQRT(RC[-6]*RC[-1]) -> 1 | AF597: =RC[-11]/SQRT(RC[-6]*RC[-2]) -> -1 | AG597: =RC[-11]/SQRT(RC[-6]*RC[-3]) -> 1 | AH597: =RC[-11]/SQRT(RC[-6]*RC[-4]) -> 1 | AI597: =RC[-11]/SQRT(RC[-6]*RC[-5]) -> 1
A598: 45054 | B598: 北京 | C598: 176 | D598: 中度污染 | E598: 1.84 | F598: 35 | G598: 64 | H598: 167 | I598: 204 | J598: 183 | L598: 2013-06-15T22:00:00.000 | M598: =RC[-8]-R[2]C[-8] -> 0.29166666666666652 | N598: =RC[-8]-R[2]C[-8] -> 1.625 | O598: =RC[-8]-R[2]C[-8] -> 3.8333333333333357 | P598: =RC[-8]-R[2]C[-8] -> 36.75 | Q598: =RC[-8]-R[2]C[-8] -> 31.166666666666657 | R598: =RC[-8]-R[2]C[-8] -> 59.75 | T598: =RC[-7]*RC[-2] -> 17.427083333333325 | U598: =RC[-7]*RC[-3] -> 97.09375 | V598: =RC[-7]*RC[-4] -> 229.0416666666668 | W598: =RC[-7]*RC[-5] -> 2195.8125 | X598: =RC[-7]*RC[-6] -> 1862.2083333333328 | Y598: =RC[-12]*RC[-12] -> 8.5069444444444364E-2 | Z598: =RC[-12]*RC[-12] -> 2.640625 | AA598: =RC[-12]*RC[-12] -> 14.694444444444462 | AB598: =RC[-12]*RC[-12] -> 1350.5625 | AC598: =RC[-12]*RC[-12] -> 971.36111111111052 | AD598: =RC[-12]*RC[-12] -> 3570.0625 | AE598: =RC[-11]/SQRT(RC[-6]*RC[-1]) -> 1 | AF598: =RC[-11]/SQRT(RC[-6]*RC[-2]) -> 1 | AG598: =RC[-11]/SQRT(RC[-6]*RC[-3]) -> 1 | AH598: =RC[-11]/SQRT(RC[-6]*RC[-4]) -> 1 | AI598: =RC[-11]/SQRT(RC[-6]*RC[-5]) -> 1
A599: 45130 | B599: 北京 | C599: 171 | D599: 中度污染 | E599: 1.64 | F599: 41 | G599: 63 | H599: 157 | I599: 189 | J599: 154 | L599: 2013-06-15T23:00:00.000 | M599: =RC[-8]-R[1]C[-8] -> 9.1666666666666341E-2 | N599: =RC[-8]-R[1]C[-8] -> 7.625 | O599: =RC[-8]-R[1]C[-8] -> 2.8333333333333357 | P599: =RC[-8]-R[1]C[-8] -> 26.75 | Q599: =RC[-8]-R[1]C[-8] -> 16.166666666666657 | R599: =RC[-8]-R[1]C[-8] -> 30.75 | T599: =RC[-7]*RC[-2] -> 2.8187499999999899 | U599: =RC[-7]*RC[-3] -> 234.46875 | V599: =RC[-7]*RC[-4] -> 87.125000000000071 | W599: =RC[-7]*RC[-5] -> 822.5625 | X599: =RC[-7]*RC[-6] -> 497.12499999999972 | Y599: =RC[-12]*RC[-12] -> 8.4027777777777174E-3 | Z599: =RC[-12]*RC[-12] -> 58.140625 | AA599: =RC[-12]*RC[-12] -> 8.027777777777791 | AB599: =RC[-12]*RC[-12] -> 715.5625 | AC599: =RC[-12]*RC[-12] -> 261.3611111111108 | AD599: =RC[-12]*RC[-12] -> 945.5625 | AE599: =RC[-11]/SQRT(RC[-6]*RC[-1]) -> 1 | AF599: =RC[-11]/SQRT(RC[-6]*RC[-2]) -> 1 | AG599: =RC[-11]/SQRT(RC[-6]*RC[-3]) -> 1 | AH599: =RC[-11]/SQRT(RC[-6]*RC[-4]) -> 1 | AI599: =RC[-11]/SQRT(RC[-6]*RC[-5]) -> 1
E600: =AVERAGE(R[-24]C:R[-1]C) -> 1.5483333333333336 | F600: =AVERAGE(R[-24]C:R[-1]C) -> 33.375 | G600: =AVERAGE(R[-24]C:R[-1]C) -> 60.166666666666664 | H600: =AVERAGE(R[-24]C:R[-1]C) -> 130.25 | I600: =AVERAGE(R[-24]C:R[-1]C) -> 172.83333333333334 | J600: =AVERAGE(R[-24]C:R[-1]C) -> 123.25 | M600: =RC[-8]-RC[-8] -> 0 | N600: =RC[-8]-RC[-8] -> 0 | O600: =RC[-8]-RC[-8] -> 0 | P600: =RC[-8]-RC[-8] -> 0 | Q600: =RC[-8]-RC[-8] -> 0 | R600: =RC[-8]-RC[-8] -> 0 | T600: =SUM(R[-24]C:R[-1]C) -> 228.00999999999996 | U600: =SUM(R[-24]C:R[-1]C) -> 5113.75 | V600: =SUM(R[-24]C:R[-1]C) -> -2018.9999999999991 | W600: =SUM(R[-24]C:R[-1]C) -> 72021.5 | X600: =SUM(R[-24]C:R[-1]C) -> 43882.000000000007 | Y600: =SUM(R[-24]C:R[-1]C) -> 1.710733333333333 | Z600: =SUM(R[-24]C:R[-1]C) -> 2817.625 | AA600: =SUM(R[-24]C:R[-1]C) -> 1843.3333333333333 | AB600: =SUM(R[-24]C:R[-1]C) -> 182476.5 | AC600: =SUM(R[-24]C:R[-1]C) -> 51173.333333333336 | AD600: =SUM(R[-24]C:R[-1]C) -> 39510.5 | AE600: =RC[-11]/SQRT(RC[-6]*RC[-1]) -> 0.87701389252090445 | AF600: =RC[-11]/SQRT(RC[-6]*RC[-2]) -> 0.48466497245652929 | AG600: =RC[-11]/SQRT(RC[-6]*RC[-3]) -> -0.2365800492272272 | AH600: =RC[-11]/SQRT(RC[-6]*RC[-4]) -> 0.84820812495156916 | AI600: =RC[-11]/SQRT(RC[-6]*RC[-5]) -> 0.97590669357972293
A601: 45206 | B601: 北京 | C601: 167 | D601: 中度污染 | E601: 1.49 | F601: 43 | G601: 64 | H601: 134 | I601: 179 | J601: 152 | L601: 2013-06-16T00:00:00.000 | M601: =RC[-8]-R[24]C[-8] -> -0.44999999999999973 | N601: =RC[-8]-R[24]C[-8] -> 22.041666666666668 | O601: =RC[-8]-R[24]C[-8] -> 0.6666666666666643 | P601: =RC[-8]-R[24]C[-8] -> 80.916666666666657 | Q601: =RC[-8]-R[24]C[-8] -> -6.8333333333333428 | R601: =RC[-8]-R[24]C[-8] -> -12.958333333333343 | T601: =RC[-7]*RC[-2] -> 5.8312500000000007 | U601: =RC[-7]*RC[-3] -> -285.62326388888908 | V601: =RC[-7]*RC[-4] -> -8.6388888888888644 | W601: =RC[-7]*RC[-5] -> -1048.5451388888896 | X601: =RC[-7]*RC[-6] -> 88.548611111111299 | Y601: =RC[-12]*RC[-12] -> 0.20249999999999976 | Z601: =RC[-12]*RC[-12] -> 485.83506944444451 | AA601: =RC[-12]*RC[-12] -> 0.44444444444444131 | AB601: =RC[-12]*RC[-12] -> 6547.5069444444425 | AC601: =RC[-12]*RC[-12] -> 46.694444444444571 | AD601: =RC[-12]*RC[-12] -> 167.91840277777803 | AE601: =RC[-11]/SQRT(RC[-6]*RC[-1]) -> 1 | AF601: =RC[-11]/SQRT(RC[-6]*RC[-2]) -> -0.99999999999999978 | AG601: =RC[-11]/SQRT(RC[-6]*RC[-3]) -> -1 | AH601: =RC[-11]/SQRT(RC[-6]*RC[-4]) -> -1.0000000000000002 | AI601: =RC[-11]/SQRT(RC[-6]*RC[-5]) -> 1
A602: 45282 | B602: 北京 | C602: 167 | D602: 中度污染 | E602: 1.39 | F602: 36 | G602: 65 | H602: 118 | I602: 166 | J602: 144 | L602: 2013-06-16T01:00:00.000 | M602: =RC[-8]-R[23]C[-8] -> -0.54999999999999982 | N602: =RC[-8]-R[23]C[-8] -> 15.041666666666668 | O602: =RC[-8]-R[23]C[-8] -> 1.6666666666666643 | P602: =RC[-8]-R[23]C[-8] -> 64.916666666666657 | Q602: =RC[-8]-R[23]C[-8] -> -19.833333333333343 | R602: =RC[-8]-R[23]C[-8] -> -20.958333333333343 | T602: =RC[-7]*RC[-2] -> 11.527083333333335 | U602: =RC[-7]*RC[-3] -> -315.24826388888903 | V602: =RC[-7]*RC[-4] -> -34.930555555555522 | W602: =RC[-7]*RC[-5] -> -1360.5451388888894 | X602: =RC[-7]*RC[-6] -> 415.67361111111148 | Y602: =RC[-12]*RC[-12] -> 0.30249999999999982 | Z602: =RC[-12]*RC[-12] -> 226.25173611111114 | AA602: =RC[-12]*RC[-12] -> 2.7777777777777697 | AB602: =RC[-12]*RC[-12] -> 4214.1736111111095 | AC602: =RC[-12]*RC[-12] -> 393.36111111111148 | AD602: =RC[-12]*RC[-12] -> 439.25173611111148 | AE602: =RC[-11]/SQRT(RC[-6]*RC[-1]) -> 1 | AF602: =RC[-11]/SQRT(RC[-6]*RC[-2]) -> -1 | AG602: =RC[-11]/SQRT(RC[-6]*RC[-3]) -> -1 | AH602: =RC[-11]/SQRT(RC[-6]*RC[-4]) -> -1.0000000000000002 | AI602: =RC[-11]/SQRT(RC[-6]*RC[-5]) -> 1
A603: 45358 | B603: 北京 | C603: 166 | D603: 中度污染 | E603: 1.34 | F603: 32 | G603: 56 | H603: 104 | I603: 172 | J603: 136 | L603: 2013-06-16T02:00:00.000 | M603: =RC[-8]-R[22]C[-8] -> -0.59999999999999964 | N603: =RC[-8]-R[22]C[-8] -> 11.041666666666668 | O603: =RC[-8]-R[22]C[-8] -> -7.3333333333333357 | P603: =RC[-8]-R[22]C[-8] -> 50.916666666666664 | Q603: =RC[-8]-R[22]C[-8] -> -13.833333333333343 | R603: =RC[-8]-R[22]C[-8] -> -28.958333333333343 | T603: =RC[-7]*RC[-2] -> 17.374999999999996 | U603: =RC[-7]*RC[-3] -> -319.74826388888903 | V603: =RC[-7]*RC[-4] -> 212.36111111111126 | W603: =RC[-7]*RC[-5] -> -1474.4618055555559 | X603: =RC[-7]*RC[-6] -> 400.59027777777817 | Y603: =RC[-12]*RC[-12] -> 0.3599999999999996 | Z603: =RC[-12]*RC[-12] -> 121.9184027777778 | AA603: =RC[-12]*RC[-12] -> 53.777777777777814 | AB603: =RC[-12]*RC[-12] -> 2592.5069444444443 | AC603: =RC[-12]*RC[-12] -> 191.36111111111137 | AD603: =RC[-12]*RC[-12] -> 838.58506944444503 | AE603: =RC[-11]/SQRT(RC[-6]*RC[-1]) -> 1 | AF603: =RC[-11]/SQRT(RC[-6]*RC[-2]) -> -1 | AG603: =RC[-11]/SQRT(RC[-6]*RC[-3]) -> 1 | AH603: =RC[-11]/SQRT(RC[-6]*RC[-4]) -> -1 | AI603: =RC[-11]/SQRT(RC[-6]*RC[-5]) -> 1
A604: 45434 | B604: 北京 | C604: 166 | D604: 中度污染 | E604: 1.3 | F604: 28 | G604: 58 | H604: 99 | I604: 156 | J604: 133 | L604: 2013-06-16T03:00:00.000 | M604: =RC[-8]-R[21]C[-8] -> -0.63999999999999968 | N604: =RC[-8]-R[21]C[-8] -> 7.0416666666666679 | O604: =RC[-8]-R[21]C[-8] -> -5.3333333333333357 | P604: =RC[-8]-R[21]C[-8] -> 45.916666666666664 | Q604: =RC[-8]-R[21]C[-8] -> -29.833333333333343 | R604: =RC[-8]-R[21]C[-8] -> -31.958333333333343 | T604: =RC[-7]*RC[-2] -> 20.45333333333333 | U604: =RC[-7]*RC[-3] -> -225.03993055555566 | V604: =RC[-7]*RC[-4] -> 170.44444444444457 | W604: =RC[-7]*RC[-5] -> -1467.4201388888891 | X604: =RC[-7]*RC[-6] -> 953.42361111111165 | Y604: =RC[-12]*RC[-12] -> 0.40959999999999958 | Z604: =RC[-12]*RC[-12] -> 49.585069444444464 | AA604: =RC[-12]*RC[-12] -> 28.444444444444471 | AB604: =RC[-12]*RC[-12] -> 2108.3402777777774 | AC604: =RC[-12]*RC[-12] -> 890.0277777777784 | AD604: =RC[-12]*RC[-12] -> 1021.335069444445 | AE604: =RC[-11]/SQRT(RC[-6]*RC[-1]) -> 1 | AF604: =RC[-11]/SQRT(RC[-6]*RC[-2]) -> -1 | AG604: =RC[-11]/SQRT(RC[-6]*RC[-3]) -> 1 | AH604: =RC[-11]/SQRT(RC[-6]*RC[-4]) -> -1 | AI604: =RC[-11]/SQRT(RC[-6]*RC[-5]) -> 0.99999999999999989
A605: 45510 | B605: 北京 | C605: 167 | D605: 中度污染 | E605: 1.19 | F605: 22 | G605: 61 | H605: 73 | I605: 156 | J605: 133 | L605: 2013-06-16T04:00:00.000 | M605: =RC[-8]-R[20]C[-8] -> -0.74999999999999978 | N605: =RC[-8]-R[20]C[-8] -> 1.0416666666666679 | O605: =RC[-8]-R[20]C[-8] -> -2.3333333333333357 | P605: =RC[-8]-R[20]C[-8] -> 19.916666666666664 | Q605: =RC[-8]-R[20]C[-8] -> -29.833333333333343 | R605: =RC[-8]-R[20]C[-8] -> -31.958333333333343 | T605: =RC[-7]*RC[-2] -> 23.96875 | U605: =RC[-7]*RC[-3] -> -33.2899305555556 | V605: =RC[-7]*RC[-4] -> 74.569444444444542 | W605: =RC[-7]*RC[-5] -> -636.50347222222229 | X605: =RC[-7]*RC[-6] -> 953.42361111111165 | Y605: =RC[-12]*RC[-12] -> 0.56249999999999967 | Z605: =RC[-12]*RC[-12] -> 1.0850694444444469 | AA605: =RC[-12]*RC[-12] -> 5.4444444444444553 | AB605: =RC[-12]*RC[-12] -> 396.67361111111103 | AC605: =RC[-12]*RC[-12] -> 890.0277777777784 | AD605: =RC[-12]*RC[-12] -> 1021.335069444445 | AE605: =RC[-11]/SQRT(RC[-6]*RC[-1]) -> 1 | AF605: =RC[-11]/SQRT(RC[-6]*RC[-2]) -> -1 | AG605: =RC[-11]/SQRT(RC[-6]*RC[-3]) -> 1 | AH605: =RC[-11]/SQRT(RC[-6]*RC[-4]) -> -0.99999999999999978 | AI605: =RC[-11]/SQRT(RC[-6]*RC[-5]) -> 0.99999999999999989
A606: 45586 | B606: 北京 | C606: 169 | D606: 中度污染 | E606: 1.23 | F606: 22 | G606: 52 | H606: 67 | I606: 159 | J606: 129 | L606: 2013-06-16T05:00:00.000 | M606: =RC[-8]-R[19]C[-8] -> -0.70999999999999974 | N606: =RC[-8]-R[19]C[-8] -> 1.0416666666666679 | O606: =RC[-8]-R[19]C[-8] -> -11.333333333333336 | P606: =RC[-8]-R[19]C[-8] -> 13.916666666666664 | Q606: =RC[-8]-R[19]C[-8] -> -26.833333333333343 | R606: =RC[-8]-R[19]C[-8] -> -35.958333333333343 | T606: =RC[-7]*RC[-2] -> 25.530416666666664 | U606: =RC[-7]*RC[-3] -> -37.456597222222271 | V606: =RC[-7]*RC[-4] -> 407.52777777777794 | W606: =RC[-7]*RC[-5] -> -500.42013888888891 | X606: =RC[-7]*RC[-6] -> 964.88194444444503 | Y606: =RC[-12]*RC[-12] -> 0.50409999999999966 | Z606: =RC[-12]*RC[-12] -> 1.0850694444444469 | AA606: =RC[-12]*RC[-12] -> 128.44444444444449 | AB606: =RC[-12]*RC[-12] -> 193.67361111111106 | AC606: =RC[-12]*RC[-12] -> 720.02777777777828 | AD606: =RC[-12]*RC[-12] -> 1293.0017361111118 | AE606: =RC[-11]/SQRT(RC[-6]*RC[-1]) -> 1 | AF606: =RC[-11]/SQRT(RC[-6]*RC[-2]) -> -1 | AG606: =RC[-11]/SQRT(RC[-6]*RC[-3]) -> 1 | AH606: =RC[-11]/SQRT(RC[-6]*RC[-4]) -> -1 | AI606: =RC[-11]/SQRT(RC[-6]*RC[-5]) -> 1
A607: 45662 | B607: 北京 | C607: 173 | D607: 中度污染 | E607: 1.22 | F607: 21 | G607: 49 | H607: 68 | I607: 165 | J607: 135 | L607: 2013-06-16T06:00:00.000 | M607: =RC[-8]-R[18]C[-8] -> -0.71999999999999975 | N607: =RC[-8]-R[18]C[-8] -> 4.1666666666667851E-2 | O607: =RC[-8]-R[18]C[-8] -> -14.333333333333336 | P607: =RC[-8]-R[18]C[-8] -> 14.916666666666664 | Q607: =RC[-8]-R[18]C[-8] -> -20.833333333333343 | R607: =RC[-8]-R[18]C[-8] -> -29.958333333333343 | T607: =RC[-7]*RC[-2] -> 21.57 | U607: =RC[-7]*RC[-3] -> -1.2482638888889248 | V607: =RC[-7]*RC[-4] -> 429.402777777778 | W607: =RC[-7]*RC[-5] -> -446.87847222222229 | X607: =RC[-7]*RC[-6] -> 624.13194444444491 | Y607: =RC[-12]*RC[-12] -> 0.51839999999999964 | Z607: =RC[-12]*RC[-12] -> 1.7361111111112099E-3 | AA607: =RC[-12]*RC[-12] -> 205.44444444444451 | AB607: =RC[-12]*RC[-12] -> 222.50694444444437 | AC607: =RC[-12]*RC[-12] -> 434.02777777777817 | AD607: =RC[-12]*RC[-12] -> 897.50173611111165 | AE607: =RC[-11]/SQRT(RC[-6]*RC[-1]) -> 1 | AF607: =RC[-11]/SQRT(RC[-6]*RC[-2]) -> -1 | AG607: =RC[-11]/SQRT(RC[-6]*RC[-3]) -> 1 | AH607: =RC[-11]/SQRT(RC[-6]*RC[-4]) -> -1 | AI607: =RC[-11]/SQRT(RC[-6]*RC[-5]) -> 1
A608: 45738 | B608: 北京 | C608: 175 | D608: 中度污染 | E608: 1.35 | F608: 21 | G608: 58 | H608: 61 | I608: 170 | J608: 141 | L608: 2013-06-16T07:00:00.000 | M608: =RC[-8]-R[17]C[-8] -> -0.58999999999999964 | N608: =RC[-8]-R[17]C[-8] -> 4.1666666666667851E-2 | O608: =RC[-8]-R[17]C[-8] -> -5.3333333333333357 | P608: =RC[-8]-R[17]C[-8] -> 7.9166666666666643 | Q608: =RC[-8]-R[17]C[-8] -> -15.833333333333343 | R608: =RC[-8]-R[17]C[-8] -> -23.958333333333343 | T608: =RC[-7]*RC[-2] -> 14.135416666666664 | U608: =RC[-7]*RC[-3] -> -0.99826388888891771 | V608: =RC[-7]*RC[-4] -> 127.77777777777789 | W608: =RC[-7]*RC[-5] -> -189.67013888888891 | X608: =RC[-7]*RC[-6] -> 379.34027777777817 | Y608: =RC[-12]*RC[-12] -> 0.34809999999999958 | Z608: =RC[-12]*RC[-12] -> 1.7361111111112099E-3 | AA608: =RC[-12]*RC[-12] -> 28.444444444444471 | AB608: =RC[-12]*RC[-12] -> 62.673611111111072 | AC608: =RC[-12]*RC[-12] -> 250.69444444444474 | AD608: =RC[-12]*RC[-12] -> 574.00173611111154 | AE608: =RC[-11]/SQRT(RC[-6]*RC[-1]) -> 1 | AF608: =RC[-11]/SQRT(RC[-6]*RC[-2]) -> -1 | AG608: =RC[-11]/SQRT(RC[-6]*RC[-3]) -> 1 | AH608: =RC[-11]/SQRT(RC[-6]*RC[-4]) -> -1 | AI608: =RC[-11]/SQRT(RC[-6]*RC[-5]) -> 1
A609: 45814 | B609: 北京 | C609: 178 | D609: 中度污染 | E609: 1.5 | F609: 23 | G609: 60 | H609: 54 | I609: 183 | J609: 148 | L609: 2013-06-16T08:00:00.000 | M609: =RC[-8]-R[16]C[-8] -> -0.43999999999999972 | N609: =RC[-8]-R[16]C[-8] -> 2.0416666666666679 | O609: =RC[-8]-R[16]C[-8] -> -3.3333333333333357 | P609: =RC[-8]-R[16]C[-8] -> 0.9166666666666643 | Q609: =RC[-8]-R[16]C[-8] -> -2.8333333333333428 | R609: =RC[-8]-R[16]C[-8] -> -16.958333333333343 | T609: =RC[-7]*RC[-2] -> 7.461666666666666 | U609: =RC[-7]*RC[-3] -> -34.623263888888928 | V609: =RC[-7]*RC[-4] -> 56.52777777777785 | W609: =RC[-7]*RC[-5] -> -15.545138888888857 | X609: =RC[-7]*RC[-6] -> 48.048611111111299 | Y609: =RC[-12]*RC[-12] -> 0.19359999999999974 | Z609: =RC[-12]*RC[-12] -> 4.168402777777783 | AA609: =RC[-12]*RC[-12] -> 11.111111111111127 | AB609: =RC[-12]*RC[-12] -> 0.84027777777777346 | AC609: =RC[-12]*RC[-12] -> 8.0277777777778319 | AD609: =RC[-12]*RC[-12] -> 287.58506944444474 | AE609: =RC[-11]/SQRT(RC[-6]*RC[-1]) -> 1 | AF609: =RC[-11]/SQRT(RC[-6]*RC[-2]) -> -1 | AG609: =RC[-11]/SQRT(RC[-6]*RC[-3]) -> 1 | AH609: =RC[-11]/SQRT(RC[-6]*RC[-4]) -> -1 | AI609: =RC[-11]/SQRT(RC[-6]*RC[-5]) -> 1
A610: 45890 | B610: 北京 | C610: 181 | D610: 中度污染 | E610: 1.71 | F610: 26 | G610: 61 | H610: 53 | I610: 193 | J610: 156 | L610: 2013-06-16T09:00:00.000 | M610: =RC[-8]-R[15]C[-8] -> -0.22999999999999976 | N610: =RC[-8]-R[15]C[-8] -> 5.0416666666666679 | O610: =RC[-8]-R[15]C[-8] -> -2.3333333333333357 | P610: =RC[-8]-R[15]C[-8] -> -8.3333333333335702E-2 | Q610: =RC[-8]-R[15]C[-8] -> 7.1666666666666572 | R610: =RC[-8]-R[15]C[-8] -> -8.9583333333333428 | T610: =RC[-7]*RC[-2] -> 2.0604166666666668 | U610: =RC[-7]*RC[-3] -> -45.164930555555614 | V610: =RC[-7]*RC[-4] -> 20.902777777777821 | W610: =RC[-7]*RC[-5] -> 0.74652777777779977 | X610: =RC[-7]*RC[-6] -> -64.201388888888872 | Y610: =RC[-12]*RC[-12] -> 5.2899999999999892E-2 | Z610: =RC[-12]*RC[-12] -> 25.418402777777789 | AA610: =RC[-12]*RC[-12] -> 5.4444444444444553 | AB610: =RC[-12]*RC[-12] -> 6.9444444444448396E-3 | AC610: =RC[-12]*RC[-12] -> 51.361111111110972 | AD610: =RC[-12]*RC[-12] -> 80.251736111111285 | AE610: =RC[-11]/SQRT(RC[-6]*RC[-1]) -> 1 | AF610: =RC[-11]/SQRT(RC[-6]*RC[-2]) -> -1 | AG610: =RC[-11]/SQRT(RC[-6]*RC[-3]) -> 1 | AH610: =RC[-11]/SQRT(RC[-6]*RC[-4]) -> 0.99999999999999989 | AI610: =RC[-11]/SQRT(RC[-6]*RC[-5]) -> -1
A611: 45966 | B611: 北京 | C611: 184 | D611: 中度污染 | E611: 1.95 | F611: 27 | G611: 70 | H611: 41 | I611: 195 | J611: 160 | L611: 2013-06-16T10:00:00.000 | M611: =RC[-8]-R[14]C[-8] -> 1.0000000000000231E-2 | N611: =RC[-8]-R[14]C[-8] -> 6.0416666666666679 | O611: =RC[-8]-R[14]C[-8] -> 6.6666666666666643 | P611: =RC[-8]-R[14]C[-8] -> -12.083333333333336 | Q611: =RC[-8]-R[14]C[-8] -> 9.1666666666666572 | R611: =RC[-8]-R[14]C[-8] -> -4.9583333333333428 | T611: =RC[-7]*RC[-2] -> -4.9583333333334575E-2 | U611: =RC[-7]*RC[-3] -> -29.956597222222285 | V611: =RC[-7]*RC[-4] -> -33.055555555555607 | W611: =RC[-7]*RC[-5] -> 59.913194444444571 | X611: =RC[-7]*RC[-6] -> -45.451388888888928 | Y611: =RC[-12]*RC[-12] -> 1.0000000000000461E-4 | Z611: =RC[-12]*RC[-12] -> 36.501736111111128 | AA611: =RC[-12]*RC[-12] -> 44.444444444444414 | AB611: =RC[-12]*RC[-12] -> 146.00694444444451 | AC611: =RC[-12]*RC[-12] -> 84.027777777777601 | AD611: =RC[-12]*RC[-12] -> 24.585069444444539 | AE611: =RC[-11]/SQRT(RC[-6]*RC[-1]) -> -1 | AF611: =RC[-11]/SQRT(RC[-6]*RC[-2]) -> -1 | AG611: =RC[-11]/SQRT(RC[-6]*RC[-3]) -> -1 | AH611: =RC[-11]/SQRT(RC[-6]*RC[-4]) -> 1 | AI611: =RC[-11]/SQRT(RC[-6]*RC[-5]) -> -1
A612: 46042 | B612: 北京 | C612: 186 | D612: 中度污染 | E612: 2.15 | F612: 27 | G612: 74 | H612: 35 | I612: 206 | J612: 168 | L612: 2013-06-16T11:00:00.000 | M612: =RC[-8]-R[13]C[-8] -> 0.21000000000000019 | N612: =RC[-8]-R[13]C[-8] -> 6.0416666666666679 | O612: =RC[-8]-R[13]C[-8] -> 10.666666666666664 | P612: =RC[-8]-R[13]C[-8] -> -18.083333333333336 | Q612: =RC[-8]-R[13]C[-8] -> 20.166666666666657 | R612: =RC[-8]-R[13]C[-8] -> 3.0416666666666572 | T612: =RC[-7]*RC[-2] -> 0.6387499999999986 | U612: =RC[-7]*RC[-3] -> 18.376736111111057 | V612: =RC[-7]*RC[-4] -> 32.444444444444336 | W612: =RC[-7]*RC[-5] -> -55.003472222222058 | X612: =RC[-7]*RC[-6] -> 61.340277777777558 | Y612: =RC[-12]*RC[-12] -> 4.4100000000000077E-2 | Z612: =RC[-12]*RC[-12] -> 36.501736111111128 | AA612: =RC[-12]*RC[-12] -> 113.77777777777773 | AB612: =RC[-12]*RC[-12] -> 327.00694444444451 | AC612: =RC[-12]*RC[-12] -> 406.69444444444406 | AD612: =RC[-12]*RC[-12] -> 9.2517361111110539 | AE612: =RC[-11]/SQRT(RC[-6]*RC[-1]) -> 1 | AF612: =RC[-11]/SQRT(RC[-6]*RC[-2]) -> 1 | AG612: =RC[-11]/SQRT(RC[-6]*RC[-3]) -> 1 | AH612: =RC[-11]/SQRT(RC[-6]*RC[-4]) -> -1 | AI612: =RC[-11]/SQRT(RC[-6]*RC[-5]) -> 1
A613: 46118 | B613: 北京 | C613: 188 | D613: 中度污染 | E613: 2.36 | F613: 21 | G613: 75 | H613: 31 | I613: 203 | J613: 172 | L613: 2013-06-16T12:00:00.000 | M613: =RC[-8]-R[12]C[-8] -> 0.42000000000000015 | N613: =RC[-8]-R[12]C[-8] -> 4.1666666666667851E-2 | O613: =RC[-8]-R[12]C[-8] -> 11.666666666666664 | P613: =RC[-8]-R[12]C[-8] -> -22.083333333333336 | Q613: =RC[-8]-R[12]C[-8] -> 17.166666666666657 | R613: =RC[-8]-R[12]C[-8] -> 7.0416666666666572 | T613: =RC[-7]*RC[-2] -> 2.9574999999999969 | U613: =RC[-7]*RC[-3] -> 0.29340277777778573 | V613: =RC[-7]*RC[-4] -> 82.152777777777644 | W613: =RC[-7]*RC[-5] -> -155.50347222222203 | X613: =RC[-7]*RC[-6] -> 120.88194444444422 | Y613: =RC[-12]*RC[-12] -> 0.17640000000000014 | Z613: =RC[-12]*RC[-12] -> 1.7361111111112099E-3 | AA613: =RC[-12]*RC[-12] -> 136.11111111111106 | AB613: =RC[-12]*RC[-12] -> 487.6736111111112 | AC613: =RC[-12]*RC[-12] -> 294.69444444444412 | AD613: =RC[-12]*RC[-12] -> 49.585069444444308 | AE613: =RC[-11]/SQRT(RC[-6]*RC[-1]) -> 1 | AF613: =RC[-11]/SQRT(RC[-6]*RC[-2]) -> 1 | AG613: =RC[-11]/SQRT(RC[-6]*RC[-3]) -> 1 | AH613: =RC[-11]/SQRT(RC[-6]*RC[-4]) -> -1 | AI613: =RC[-11]/SQRT(RC[-6]*RC[-5]) -> 1
A614: 46194 | B614: 北京 | C614: 190 | D614: 中度污染 | E614: 2.44 | F614: 17 | G614: 75 | H614: 32 | I614: 208 | J614: 177 | L614: 2013-06-16T13:00:00.000 | M614: =RC[-8]-R[11]C[-8] -> 0.50000000000000022 | N614: =RC[-8]-R[11]C[-8] -> -3.9583333333333321 | O614: =RC[-8]-R[11]C[-8] -> 11.666666666666664 | P614: =RC[-8]-R[11]C[-8] -> -21.083333333333336 | Q614: =RC[-8]-R[11]C[-8] -> 22.166666666666657 | R614: =RC[-8]-R[11]C[-8] -> 12.041666666666657 | T614: =RC[-7]*RC[-2] -> 6.0208333333333313 | U614: =RC[-7]*RC[-3] -> -47.6649305555555 | V614: =RC[-7]*RC[-4] -> 140.48611111111097 | W614: =RC[-7]*RC[-5] -> -253.87847222222206 | X614: =RC[-7]*RC[-6] -> 266.9236111111108 | Y614: =RC[-12]*RC[-12] -> 0.25000000000000022 | Z614: =RC[-12]*RC[-12] -> 15.668402777777768 | AA614: =RC[-12]*RC[-12] -> 136.11111111111106 | AB614: =RC[-12]*RC[-12] -> 444.50694444444457 | AC614: =RC[-12]*RC[-12] -> 491.36111111111069 | AD614: =RC[-12]*RC[-12] -> 145.00173611111089 | AE614: =RC[-11]/SQRT(RC[-6]*RC[-1]) -> 1 | AF614: =RC[-11]/SQRT(RC[-6]*RC[-2]) -> -1 | AG614: =RC[-11]/SQRT(RC[-6]*RC[-3]) -> 1 | AH614: =RC[-11]/SQRT(RC[-6]*RC[-4]) -> -1 | AI614: =RC[-11]/SQRT(RC[-6]*RC[-5]) -> 1
A615: 46270 | B615: 北京 | C615: 190 | D615: 中度污染 | E615: 2.38 | F615: 11 | G615: 73 | H615: 31 | I615: 162 | J615: 170 | L615: 2013-06-16T14:00:00.000 | M615: =RC[-8]-R[10]C[-8] -> 0.44000000000000017 | N615: =RC[-8]-R[10]C[-8] -> -9.9583333333333321 | O615: =RC[-8]-R[10]C[-8] -> 9.6666666666666643 | P615: =RC[-8]-R[10]C[-8] -> -22.083333333333336 | Q615: =RC[-8]-R[10]C[-8] -> -23.833333333333343 | R615: =RC[-8]-R[10]C[-8] -> 5.0416666666666572 | T615: =RC[-7]*RC[-2] -> 2.2183333333333302 | U615: =RC[-7]*RC[-3] -> -50.206597222222122 | V615: =RC[-7]*RC[-4] -> 48.736111111111008 | W615: =RC[-7]*RC[-5] -> -111.33680555555536 | X615: =RC[-7]*RC[-6] -> -120.15972222222204 | Y615: =RC[-12]*RC[-12] -> 0.19360000000000016 | Z615: =RC[-12]*RC[-12] -> 99.168402777777757 | AA615: =RC[-12]*RC[-12] -> 93.4444444444444 | AB615: =RC[-12]*RC[-12] -> 487.6736111111112 | AC615: =RC[-12]*RC[-12] -> 568.02777777777828 | AD615: =RC[-12]*RC[-12] -> 25.418402777777683 | AE615: =RC[-11]/SQRT(RC[-6]*RC[-1]) -> 1 | AF615: =RC[-11]/SQRT(RC[-6]*RC[-2]) -> -1 | AG615: =RC[-11]/SQRT(RC[-6]*RC[-3]) -> 1 | AH615: =RC[-11]/SQRT(RC[-6]*RC[-4]) -> -1 | AI615: =RC[-11]/SQRT(RC[-6]*RC[-5]) -> -0.99999999999999989
A616: 46346 | B616: 北京 | C616: 191 | D616: 中度污染 | E616: 2.48 | F616: 12 | G616: 75 | H616: 30 | I616: 177 | J616: 179 | L616: 2013-06-16T15:00:00.000 | M616: =RC[-8]-R[9]C[-8] -> 0.54000000000000026 | N616: =RC[-8]-R[9]C[-8] -> -8.9583333333333321 | O616: =RC[-8]-R[9]C[-8] -> 11.666666666666664 | P616: =RC[-8]-R[9]C[-8] -> -23.083333333333336 | Q616: =RC[-8]-R[9]C[-8] -> -8.8333333333333428 | R616: =RC[-8]-R[9]C[-8] -> 14.041666666666657 | T616: =RC[-7]*RC[-2] -> 7.5824999999999987 | U616: =RC[-7]*RC[-3] -> -125.78993055555546 | V616: =RC[-7]*RC[-4] -> 163.81944444444429 | W616: =RC[-7]*RC[-5] -> -324.12847222222206 | X616: =RC[-7]*RC[-6] -> -124.03472222222227 | Y616: =RC[-12]*RC[-12] -> 0.2916000000000003 | Z616: =RC[-12]*RC[-12] -> 80.251736111111086 | AA616: =RC[-12]*RC[-12] -> 136.11111111111106 | AB616: =RC[-12]*RC[-12] -> 532.84027777777794 | AC616: =RC[-12]*RC[-12] -> 78.027777777777942 | AD616: =RC[-12]*RC[-12] -> 197.16840277777752 | AE616: =RC[-11]/SQRT(RC[-6]*RC[-1]) -> 0.99999999999999989 | AF616: =RC[-11]/SQRT(RC[-6]*RC[-2]) -> -1 | AG616: =RC[-11]/SQRT(RC[-6]*RC[-3]) -> 0.99999999999999978 | AH616: =RC[-11]/SQRT(RC[-6]*RC[-4]) -> -1 | AI616: =RC[-11]/SQRT(RC[-6]*RC[-5]) -> -1
A617: 46422 | B617: 北京 | C617: 192 | D617: 中度污染 | E617: 2.4300000000000002 | F617: 12 | G617: 73 | H617: 26 | I617: 191 | J617: 182 | L617: 2013-06-16T16:00:00.000 | M617: =RC[-8]-R[8]C[-8] -> 0.49000000000000044 | N617: =RC[-8]-R[8]C[-8] -> -8.9583333333333321 | O617: =RC[-8]-R[8]C[-8] -> 9.6666666666666643 | P617: =RC[-8]-R[8]C[-8] -> -27.083333333333336 | Q617: =RC[-8]-R[8]C[-8] -> 5.1666666666666572 | R617: =RC[-8]-R[8]C[-8] -> 17.041666666666657 | T617: =RC[-7]*RC[-2] -> 8.3504166666666695 | U617: =RC[-7]*RC[-3] -> -152.66493055555546 | V617: =RC[-7]*RC[-4] -> 164.73611111111097 | W617: =RC[-7]*RC[-5] -> -461.54513888888869 | X617: =RC[-7]*RC[-6] -> 88.048611111110901 | Y617: =RC[-12]*RC[-12] -> 0.24010000000000042 | Z617: =RC[-12]*RC[-12] -> 80.251736111111086 | AA617: =RC[-12]*RC[-12] -> 93.4444444444444 | AB617: =RC[-12]*RC[-12] -> 733.50694444444457 | AC617: =RC[-12]*RC[-12] -> 26.694444444444347 | AD617: =RC[-12]*RC[-12] -> 290.41840277777743 | AE617: =RC[-11]/SQRT(RC[-6]*RC[-1]) -> 1 | AF617: =RC[-11]/SQRT(RC[-6]*RC[-2]) -> -1.0000000000000002 | AG617: =RC[-11]/SQRT(RC[-6]*RC[-3]) -> 1 | AH617: =RC[-11]/SQRT(RC[-6]*RC[-4]) -> -1.0000000000000002 | AI617: =RC[-11]/SQRT(RC[-6]*RC[-5]) -> 1
A618: 46498 | B618: 北京 | C618: 193 | D618: 中度污染 | E618: 2.41 | F618: 13 | G618: 74 | H618: 26 | I618: 178 | J618: 178 | L618: 2013-06-16T17:00:00.000 | M618: =RC[-8]-R[7]C[-8] -> 0.47000000000000042 | N618: =RC[-8]-R[7]C[-8] -> -7.9583333333333321 | O618: =RC[-8]-R[7]C[-8] -> 10.666666666666664 | P618: =RC[-8]-R[7]C[-8] -> -27.083333333333336 | Q618: =RC[-8]-R[7]C[-8] -> -7.8333333333333428 | R618: =RC[-8]-R[7]C[-8] -> 13.041666666666657 | T618: =RC[-7]*RC[-2] -> 6.1295833333333345 | U618: =RC[-7]*RC[-3] -> -103.78993055555546 | V618: =RC[-7]*RC[-4] -> 139.11111111111097 | W618: =RC[-7]*RC[-5] -> -353.21180555555532 | X618: =RC[-7]*RC[-6] -> -102.15972222222227 | Y618: =RC[-12]*RC[-12] -> 0.2209000000000004 | Z618: =RC[-12]*RC[-12] -> 63.335069444444429 | AA618: =RC[-12]*RC[-12] -> 113.77777777777773 | AB618: =RC[-12]*RC[-12] -> 733.50694444444457 | AC618: =RC[-12]*RC[-12] -> 61.361111111111256 | AD618: =RC[-12]*RC[-12] -> 170.0850694444442 | AE618: =RC[-11]/SQRT(RC[-6]*RC[-1]) -> 1 | AF618: =RC[-11]/SQRT(RC[-6]*RC[-2]) -> -0.99999999999999989 | AG618: =RC[-11]/SQRT(RC[-6]*RC[-3]) -> 1 | AH618: =RC[-11]/SQRT(RC[-6]*RC[-4]) -> -1 | AI618: =RC[-11]/SQRT(RC[-6]*RC[-5]) -> -1
A619: 46574 | B619: 北京 | C619: 194 | D619: 中度污染 | E619: 2.4900000000000002 | F619: 15 | G619: 65 | H619: 35 | I619: 210 | J619: 194 | L619: 2013-06-16T18:00:00.000 | M619: =RC[-8]-R[6]C[-8] -> 0.55000000000000049 | N619: =RC[-8]-R[6]C[-8] -> -5.9583333333333321 | O619: =RC[-8]-R[6]C[-8] -> 1.6666666666666643 | P619: =RC[-8]-R[6]C[-8] -> -18.083333333333336 | Q619: =RC[-8]-R[6]C[-8] -> 24.166666666666657 | R619: =RC[-8]-R[6]C[-8] -> 29.041666666666657 | T619: =RC[-7]*RC[-2] -> 15.972916666666675 | U619: =RC[-7]*RC[-3] -> -173.03993055555546 | V619: =RC[-7]*RC[-4] -> 48.402777777777693 | W619: =RC[-7]*RC[-5] -> -525.1701388888888 | X619: =RC[-7]*RC[-6] -> 701.84027777777726 | Y619: =RC[-12]*RC[-12] -> 0.30250000000000055 | Z619: =RC[-12]*RC[-12] -> 35.5017361111111 | AA619: =RC[-12]*RC[-12] -> 2.7777777777777697 | AB619: =RC[-12]*RC[-12] -> 327.00694444444451 | AC619: =RC[-12]*RC[-12] -> 584.02777777777737 | AD619: =RC[-12]*RC[-12] -> 843.41840277777726 | AE619: =RC[-11]/SQRT(RC[-6]*RC[-1]) -> 1 | AF619: =RC[-11]/SQRT(RC[-6]*RC[-2]) -> -0.99999999999999989 | AG619: =RC[-11]/SQRT(RC[-6]*RC[-3]) -> 1 | AH619: =RC[-11]/SQRT(RC[-6]*RC[-4]) -> -1 | AI619: =RC[-11]/SQRT(RC[-6]*RC[-5]) -> 1
A620: 46650 | B620: 北京 | C620: 195 | D620: 中度污染 | E620: 2.5099999999999998 | F620: 17 | G620: 61 | H620: 33 | I620: 218 | J620: 196 | L620: 2013-06-16T19:00:00.000 | M620: =RC[-8]-R[5]C[-8] -> 0.57000000000000006 | N620: =RC[-8]-R[5]C[-8] -> -3.9583333333333321 | O620: =RC[-8]-R[5]C[-8] -> -2.3333333333333357 | P620: =RC[-8]-R[5]C[-8] -> -20.083333333333336 | Q620: =RC[-8]-R[5]C[-8] -> 32.166666666666657 | R620: =RC[-8]-R[5]C[-8] -> 31.041666666666657 | T620: =RC[-7]*RC[-2] -> 17.693749999999998 | U620: =RC[-7]*RC[-3] -> -122.87326388888881 | V620: =RC[-7]*RC[-4] -> -72.430555555555614 | W620: =RC[-7]*RC[-5] -> -623.4201388888888 | X620: =RC[-7]*RC[-6] -> 998.50694444444389 | Y620: =RC[-12]*RC[-12] -> 0.32490000000000008 | Z620: =RC[-12]*RC[-12] -> 15.668402777777768 | AA620: =RC[-12]*RC[-12] -> 5.4444444444444553 | AB620: =RC[-12]*RC[-12] -> 403.34027777777789 | AC620: =RC[-12]*RC[-12] -> 1034.6944444444439 | AD620: =RC[-12]*RC[-12] -> 963.58506944444389 | AE620: =RC[-11]/SQRT(RC[-6]*RC[-1]) -> 1 | AF620: =RC[-11]/SQRT(RC[-6]*RC[-2]) -> -1 | AG620: =RC[-11]/SQRT(RC[-6]*RC[-3]) -> -1 | AH620: =RC[-11]/SQRT(RC[-6]*RC[-4]) -> -1 | AI620: =RC[-11]/SQRT(RC[-6]*RC[-5]) -> 1
A621: 46726 | B621: 北京 | C621: 195 | D621: 中度污染 | E621: 2.5499999999999998 | F621: 17 | G621: 63 | H621: 26 | I621: 200 | J621: 196 | L621: 2013-06-16T20:00:00.000 | M621: =RC[-8]-R[4]C[-8] -> 0.6100000000000001 | N621: =RC[-8]-R[4]C[-8] -> -3.9583333333333321 | O621: =RC[-8]-R[4]C[-8] -> -0.3333333333333357 | P621: =RC[-8]-R[4]C[-8] -> -27.083333333333336 | Q621: =RC[-8]-R[4]C[-8] -> 14.166666666666657 | R621: =RC[-8]-R[4]C[-8] -> 31.041666666666657 | T621: =RC[-7]*RC[-2] -> 18.935416666666665 | U621: =RC[-7]*RC[-3] -> -122.87326388888881 | V621: =RC[-7]*RC[-4] -> -10.347222222222292 | W621: =RC[-7]*RC[-5] -> -840.71180555555543 | X621: =RC[-7]*RC[-6] -> 439.756944444444 | Y621: =RC[-12]*RC[-12] -> 0.3721000000000001 | Z621: =RC[-12]*RC[-12] -> 15.668402777777768 | AA621: =RC[-12]*RC[-12] -> 0.11111111111111269 | AB621: =RC[-12]*RC[-12] -> 733.50694444444457 | AC621: =RC[-12]*RC[-12] -> 200.69444444444417 | AD621: =RC[-12]*RC[-12] -> 963.58506944444389 | AE621: =RC[-11]/SQRT(RC[-6]*RC[-1]) -> 1 | AF621: =RC[-11]/SQRT(RC[-6]*RC[-2]) -> -1 | AG621: =RC[-11]/SQRT(RC[-6]*RC[-3]) -> -1 | AH621: =RC[-11]/SQRT(RC[-6]*RC[-4]) -> -1.0000000000000002 | AI621: =RC[-11]/SQRT(RC[-6]*RC[-5]) -> 0.99999999999999989
A622: 46802 | B622: 北京 | C622: 194 | D622: 中度污染 | E622: 2.4900000000000002 | F622: 16 | G622: 62 | H622: 28 | I622: 199 | J622: 196 | L622: 2013-06-16T21:00:00.000 | M622: =RC[-8]-R[3]C[-8] -> 0.55000000000000049 | N622: =RC[-8]-R[3]C[-8] -> -4.9583333333333321 | O622: =RC[-8]-R[3]C[-8] -> -1.3333333333333357 | P622: =RC[-8]-R[3]C[-8] -> -25.083333333333336 | Q622: =RC[-8]-R[3]C[-8] -> 13.166666666666657 | R622: =RC[-8]-R[3]C[-8] -> 31.041666666666657 | T622: =RC[-7]*RC[-2] -> 17.072916666666675 | U622: =RC[-7]*RC[-3] -> -153.91493055555546 | V622: =RC[-7]*RC[-4] -> -41.38888888888895 | W622: =RC[-7]*RC[-5] -> -778.62847222222206 | X622: =RC[-7]*RC[-6] -> 408.71527777777737 | Y622: =RC[-12]*RC[-12] -> 0.30250000000000055 | Z622: =RC[-12]*RC[-12] -> 24.585069444444432 | AA622: =RC[-12]*RC[-12] -> 1.7777777777777841 | AB622: =RC[-12]*RC[-12] -> 629.1736111111112 | AC622: =RC[-12]*RC[-12] -> 173.36111111111086 | AD622: =RC[-12]*RC[-12] -> 963.58506944444389 | AE622: =RC[-11]/SQRT(RC[-6]*RC[-1]) -> 0.99999999999999978 | AF622: =RC[-11]/SQRT(RC[-6]*RC[-2]) -> -1 | AG622: =RC[-11]/SQRT(RC[-6]*RC[-3]) -> -1 | AH622: =RC[-11]/SQRT(RC[-6]*RC[-4]) -> -1 | AI622: =RC[-11]/SQRT(RC[-6]*RC[-5]) -> 1
A623: 46878 | B623: 北京 | C623: 195 | D623: 中度污染 | E623: 2.21 | F623: 13 | G623: 55 | H623: 31 | I623: 205 | J623: 193 | L623: 2013-06-16T22:00:00.000 | M623: =RC[-8]-R[2]C[-8] -> 0.27000000000000024 | N623: =RC[-8]-R[2]C[-8] -> -7.9583333333333321 | O623: =RC[-8]-R[2]C[-8] -> -8.3333333333333357 | P623: =RC[-8]-R[2]C[-8] -> -22.083333333333336 | Q623: =RC[-8]-R[2]C[-8] -> 19.166666666666657 | R623: =RC[-8]-R[2]C[-8] -> 28.041666666666657 | T623: =RC[-7]*RC[-2] -> 7.5712500000000045 | U623: =RC[-7]*RC[-3] -> -223.16493055555546 | V623: =RC[-7]*RC[-4] -> -233.68055555555554 | W623: =RC[-7]*RC[-5] -> -619.25347222222206 | X623: =RC[-7]*RC[-6] -> 537.46527777777737 | Y623: =RC[-12]*RC[-12] -> 7.2900000000000131E-2 | Z623: =RC[-12]*RC[-12] -> 63.335069444444429 | AA623: =RC[-12]*RC[-12] -> 69.444444444444485 | AB623: =RC[-12]*RC[-12] -> 487.6736111111112 | AC623: =RC[-12]*RC[-12] -> 367.36111111111074 | AD623: =RC[-12]*RC[-12] -> 786.33506944444389 | AE623: =RC[-11]/SQRT(RC[-6]*RC[-1]) -> 1.0000000000000002 | AF623: =RC[-11]/SQRT(RC[-6]*RC[-2]) -> -1.0000000000000002 | AG623: =RC[-11]/SQRT(RC[-6]*RC[-3]) -> -1 | AH623: =RC[-11]/SQRT(RC[-6]*RC[-4]) -> -1 | AI623: =RC[-11]/SQRT(RC[-6]*RC[-5]) -> 1
A624: 46954 | B624: 北京 | C624: 195 | D624: 中度污染 | E624: 1.99 | F624: 11 | G624: 41 | H624: 38 | I624: 209 | J624: 191 | L624: 2013-06-16T23:00:00.000 | M624: =RC[-8]-R[1]C[-8] -> 5.0000000000000266E-2 | N624: =RC[-8]-R[1]C[-8] -> -9.9583333333333321 | O624: =RC[-8]-R[1]C[-8] -> -22.333333333333336 | P624: =RC[-8]-R[1]C[-8] -> -15.083333333333336 | Q624: =RC[-8]-R[1]C[-8] -> 23.166666666666657 | R624: =RC[-8]-R[1]C[-8] -> 26.041666666666657 | T624: =RC[-7]*RC[-2] -> 1.3020833333333397 | U624: =RC[-7]*RC[-3] -> -259.33159722222211 | V624: =RC[-7]*RC[-4] -> -581.59722222222206 | W624: =RC[-7]*RC[-5] -> -392.7951388888888 | X624: =RC[-7]*RC[-6] -> 603.29861111111063 | Y624: =RC[-12]*RC[-12] -> 2.5000000000000265E-3 | Z624: =RC[-12]*RC[-12] -> 99.168402777777757 | AA624: =RC[-12]*RC[-12] -> 498.77777777777789 | AB624: =RC[-12]*RC[-12] -> 227.50694444444451 | AC624: =RC[-12]*RC[-12] -> 536.694444444444 | AD624: =RC[-12]*RC[-12] -> 678.16840277777726 | AE624: =RC[-11]/SQRT(RC[-6]*RC[-1]) -> 1 | AF624: =RC[-11]/SQRT(RC[-6]*RC[-2]) -> -1.0000000000000002 | AG624: =RC[-11]/SQRT(RC[-6]*RC[-3]) -> -1 | AH624: =RC[-11]/SQRT(RC[-6]*RC[-4]) -> -1 | AI624: =RC[-11]/SQRT(RC[-6]*RC[-5]) -> 1
E625: =AVERAGE(R[-24]C:R[-1]C) -> 1.9399999999999997 | F625: =AVERAGE(R[-24]C:R[-1]C) -> 20.958333333333332 | G625: =AVERAGE(R[-24]C:R[-1]C) -> 63.333333333333336 | H625: =AVERAGE(R[-24]C:R[-1]C) -> 53.083333333333336 | I625: =AVERAGE(R[-24]C:R[-1]C) -> 185.83333333333334 | J625: =AVERAGE(R[-24]C:R[-1]C) -> 164.95833333333334 | M625: =RC[-8]-RC[-8] -> 0 | N625: =RC[-8]-RC[-8] -> 0 | O625: =RC[-8]-RC[-8] -> 0 | P625: =RC[-8]-RC[-8] -> 0 | Q625: =RC[-8]-RC[-8] -> 0 | R625: =RC[-8]-RC[-8] -> 0 | T625: =SUM(R[-24]C:R[-1]C) -> 262.31 | U625: =SUM(R[-24]C:R[-1]C) -> -2845.0416666666665 | V625: =SUM(R[-24]C:R[-1]C) -> 1303.333333333333 | W625: =SUM(R[-24]C:R[-1]C) -> -12573.916666666666 | X625: =SUM(R[-24]C:R[-1]C) -> 8598.8333333333339 | Y625: =SUM(R[-24]C:R[-1]C) -> 6.2484000000000002 | Z625: =SUM(R[-24]C:R[-1]C) -> 1580.9583333333333 | AA625: =SUM(R[-24]C:R[-1]C) -> 1915.3333333333335 | AB625: =SUM(R[-24]C:R[-1]C) -> 23039.833333333328 | AC625: =SUM(R[-24]C:R[-1]C) -> 8783.3333333333339 | AD625: =SUM(R[-24]C:R[-1]C) -> 12730.95833333333 | AE625: =RC[-11]/SQRT(RC[-6]*RC[-1]) -> 0.93003627319618232 | AF625: =RC[-11]/SQRT(RC[-6]*RC[-2]) -> -0.63415857711377255 | AG625: =RC[-11]/SQRT(RC[-6]*RC[-3]) -> 0.26393851617745562 | AH625: =RC[-11]/SQRT(RC[-6]*RC[-4]) -> -0.73417630320510185 | AI625: =RC[-11]/SQRT(RC[-6]*RC[-5]) -> 0.81316616637855277
A626: 47030 | B626: 北京 | C626: 196 | D626: 中度污染 | E626: 1.82 | F626: 10 | G626: 33 | H626: 43 | I626: 237 | J626: 171 | L626: 2013-06-17T00:00:00.000 | M626: =RC[-8]-R[24]C[-8] -> 0.91500000000000026 | N626: =RC[-8]-R[24]C[-8] -> 4.125 | O626: =RC[-8]-R[24]C[-8] -> -2.2083333333333357 | P626: =RC[-8]-R[24]C[-8] -> -45.083333333333329 | Q626: =RC[-8]-R[24]C[-8] -> 172.54166666666669 | R626: =RC[-8]-R[24]C[-8] -> 129.33333333333334 | T626: =RC[-7]*RC[-2] -> 118.34000000000005 | U626: =RC[-7]*RC[-3] -> 533.5 | V626: =RC[-7]*RC[-4] -> -285.61111111111143 | W626: =RC[-7]*RC[-5] -> -5830.7777777777774 | X626: =RC[-7]*RC[-6] -> 22315.388888888894 | Y626: =RC[-12]*RC[-12] -> 0.83722500000000044 | Z626: =RC[-12]*RC[-12] -> 17.015625 | AA626: =RC[-12]*RC[-12] -> 4.8767361111111214 | AB626: =RC[-12]*RC[-12] -> 2032.5069444444441 | AC626: =RC[-12]*RC[-12] -> 29770.626736111117 | AD626: =RC[-12]*RC[-12] -> 16727.111111111113 | AE626: =RC[-11]/SQRT(RC[-6]*RC[-1]) -> 1 | AF626: =RC[-11]/SQRT(RC[-6]*RC[-2]) -> 1 | AG626: =RC[-11]/SQRT(RC[-6]*RC[-3]) -> -1 | AH626: =RC[-11]/SQRT(RC[-6]*RC[-4]) -> -1 | AI626: =RC[-11]/SQRT(RC[-6]*RC[-5]) -> 1
A627: 47106 | B627: 北京 | C627: 195 | D627: 中度污染 | E627: 1.54 | F627: 8 | G627: 29 | H627: 52 | I627: 210 | J627: 127 | L627: 2013-06-17T01:00:00.000 | M627: =RC[-8]-R[23]C[-8] -> 0.63500000000000023 | N627: =RC[-8]-R[23]C[-8] -> 2.125 | O627: =RC[-8]-R[23]C[-8] -> -6.2083333333333357 | P627: =RC[-8]-R[23]C[-8] -> -36.083333333333329 | Q627: =RC[-8]-R[23]C[-8] -> 145.54166666666669 | R627: =RC[-8]-R[23]C[-8] -> 85.333333333333343 | T627: =RC[-7]*RC[-2] -> 54.186666666666696 | U627: =RC[-7]*RC[-3] -> 181.33333333333334 | V627: =RC[-7]*RC[-4] -> -529.77777777777806 | W627: =RC[-7]*RC[-5] -> -3079.1111111111109 | X627: =RC[-7]*RC[-6] -> 12419.555555555558 | Y627: =RC[-12]*RC[-12] -> 0.40322500000000028 | Z627: =RC[-12]*RC[-12] -> 4.515625 | AA627: =RC[-12]*RC[-12] -> 38.543402777777807 | AB627: =RC[-12]*RC[-12] -> 1302.0069444444441 | AC627: =RC[-12]*RC[-12] -> 21182.376736111117 | AD627: =RC[-12]*RC[-12] -> 7281.7777777777792 | AE627: =RC[-11]/SQRT(RC[-6]*RC[-1]) -> 1.0000000000000002 | AF627: =RC[-11]/SQRT(RC[-6]*RC[-2]) -> 1 | AG627: =RC[-11]/SQRT(RC[-6]*RC[-3]) -> -1 | AH627: =RC[-11]/SQRT(RC[-6]*RC[-4]) -> -0.99999999999999989 | AI627: =RC[-11]/SQRT(RC[-6]*RC[-5]) -> 1
A628: 47182 | B628: 北京 | C628: 193 | D628: 中度污染 | E628: 1.22 | F628: 6 | G628: 25 | H628: 47 | I628: 94 | J628: 69 | L628: 2013-06-17T02:00:00.000 | M628: =RC[-8]-R[22]C[-8] -> 0.31500000000000017 | N628: =RC[-8]-R[22]C[-8] -> 0.125 | O628: =RC[-8]-R[22]C[-8] -> -10.208333333333336 | P628: =RC[-8]-R[22]C[-8] -> -41.083333333333329 | Q628: =RC[-8]-R[22]C[-8] -> 29.541666666666671 | R628: =RC[-8]-R[22]C[-8] -> 27.333333333333336 | T628: =RC[-7]*RC[-2] -> 8.6100000000000048 | U628: =RC[-7]*RC[-3] -> 3.416666666666667 | V628: =RC[-7]*RC[-4] -> -279.02777777777789 | W628: =RC[-7]*RC[-5] -> -1122.9444444444443 | X628: =RC[-7]*RC[-6] -> 807.4722222222224 | Y628: =RC[-12]*RC[-12] -> 9.9225000000000105E-2 | Z628: =RC[-12]*RC[-12] -> 1.5625E-2 | AA628: =RC[-12]*RC[-12] -> 104.2100694444445 | AB628: =RC[-12]*RC[-12] -> 1687.8402777777774 | AC628: =RC[-12]*RC[-12] -> 872.71006944444468 | AD628: =RC[-12]*RC[-12] -> 747.1111111111112 | AE628: =RC[-11]/SQRT(RC[-6]*RC[-1]) -> 1 | AF628: =RC[-11]/SQRT(RC[-6]*RC[-2]) -> 1 | AG628: =RC[-11]/SQRT(RC[-6]*RC[-3]) -> -1 | AH628: =RC[-11]/SQRT(RC[-6]*RC[-4]) -> -1 | AI628: =RC[-11]/SQRT(RC[-6]*RC[-5]) -> 1
A629: 47258 | B629: 北京 | C629: 190 | D629: 中度污染 | E629: 1.17 | F629: 8 | G629: 22 | H629: 47 | I629: 14 | J629: 49 | L629: 2013-06-17T03:00:00.000 | M629: =RC[-8]-R[21]C[-8] -> 0.26500000000000012 | N629: =RC[-8]-R[21]C[-8] -> 2.125 | O629: =RC[-8]-R[21]C[-8] -> -13.208333333333336 | P629: =RC[-8]-R[21]C[-8] -> -41.083333333333329 | Q629: =RC[-8]-R[21]C[-8] -> -50.458333333333329 | R629: =RC[-8]-R[21]C[-8] -> 7.3333333333333357 | T629: =RC[-7]*RC[-2] -> 1.9433333333333349 | U629: =RC[-7]*RC[-3] -> 15.583333333333339 | V629: =RC[-7]*RC[-4] -> -96.861111111111157 | W629: =RC[-7]*RC[-5] -> -301.27777777777783 | X629: =RC[-7]*RC[-6] -> -370.02777777777789 | Y629: =RC[-12]*RC[-12] -> 7.0225000000000065E-2 | Z629: =RC[-12]*RC[-12] -> 4.515625 | AA629: =RC[-12]*RC[-12] -> 174.46006944444451 | AB629: =RC[-12]*RC[-12] -> 1687.8402777777774 | AC629: =RC[-12]*RC[-12] -> 2546.0434027777774 | AD629: =RC[-12]*RC[-12] -> 53.777777777777814 | AE629: =RC[-11]/SQRT(RC[-6]*RC[-1]) -> 1 | AF629: =RC[-11]/SQRT(RC[-6]*RC[-2]) -> 1 | AG629: =RC[-11]/SQRT(RC[-6]*RC[-3]) -> -1 | AH629: =RC[-11]/SQRT(RC[-6]*RC[-4]) -> -1 | AI629: =RC[-11]/SQRT(RC[-6]*RC[-5]) -> -1
A630: 47334 | B630: 北京 | C630: 186 | D630: 中度污染 | E630: 0.97 | F630: 6 | G630: 24 | H630: 42 | I630: 99 | J630: 43 | L630: 2013-06-17T04:00:00.000 | M630: =RC[-8]-R[20]C[-8] -> 6.5000000000000169E-2 | N630: =RC[-8]-R[20]C[-8] -> 0.125 | O630: =RC[-8]-R[20]C[-8] -> -11.208333333333336 | P630: =RC[-8]-R[20]C[-8] -> -46.083333333333329 | Q630: =RC[-8]-R[20]C[-8] -> 34.541666666666671 | R630: =RC[-8]-R[20]C[-8] -> 1.3333333333333357 | T630: =RC[-7]*RC[-2] -> 8.6666666666667044E-2 | U630: =RC[-7]*RC[-3] -> 0.16666666666666696 | V630: =RC[-7]*RC[-4] -> -14.944444444444475 | W630: =RC[-7]*RC[-5] -> -61.444444444444549 | X630: =RC[-7]*RC[-6] -> 46.055555555555642 | Y630: =RC[-12]*RC[-12] -> 4.2250000000000221E-3 | Z630: =RC[-12]*RC[-12] -> 1.5625E-2 | AA630: =RC[-12]*RC[-12] -> 125.62673611111117 | AB630: =RC[-12]*RC[-12] -> 2123.6736111111109 | AC630: =RC[-12]*RC[-12] -> 1193.1267361111115 | AD630: =RC[-12]*RC[-12] -> 1.7777777777777841 | AE630: =RC[-11]/SQRT(RC[-6]*RC[-1]) -> 1 | AF630: =RC[-11]/SQRT(RC[-6]*RC[-2]) -> 1 | AG630: =RC[-11]/SQRT(RC[-6]*RC[-3]) -> -1 | AH630: =RC[-11]/SQRT(RC[-6]*RC[-4]) -> -1 | AI630: =RC[-11]/SQRT(RC[-6]*RC[-5]) -> 1
A631: 47410 | B631: 北京 | C631: 182 | D631: 中度污染 | E631: 0.93 | F631: 5 | G631: 29 | H631: 40 | I631: 56 | J631: 38 | L631: 2013-06-17T05:00:00.000 | M631: =RC[-8]-R[19]C[-8] -> 2.5000000000000244E-2 | N631: =RC[-8]-R[19]C[-8] -> -0.875 | O631: =RC[-8]-R[19]C[-8] -> -6.2083333333333357 | P631: =RC[-8]-R[19]C[-8] -> -48.083333333333329 | Q631: =RC[-8]-R[19]C[-8] -> -8.4583333333333286 | R631: =RC[-8]-R[19]C[-8] -> -3.6666666666666643 | T631: =RC[-7]*RC[-2] -> -9.1666666666667507E-2 | U631: =RC[-7]*RC[-3] -> 3.2083333333333313 | V631: =RC[-7]*RC[-4] -> 22.763888888888882 | W631: =RC[-7]*RC[-5] -> 176.30555555555543 | X631: =RC[-7]*RC[-6] -> 31.01388888888885 | Y631: =RC[-12]*RC[-12] -> 6.2500000000001226E-4 | Z631: =RC[-12]*RC[-12] -> 0.765625 | AA631: =RC[-12]*RC[-12] -> 38.543402777777807 | AB631: =RC[-12]*RC[-12] -> 2312.0069444444439 | AC631: =RC[-12]*RC[-12] -> 71.5434027777777 | AD631: =RC[-12]*RC[-12] -> 13.444444444444427 | AE631: =RC[-11]/SQRT(RC[-6]*RC[-1]) -> -1 | AF631: =RC[-11]/SQRT(RC[-6]*RC[-2]) -> 1 | AG631: =RC[-11]/SQRT(RC[-6]*RC[-3]) -> 1 | AH631: =RC[-11]/SQRT(RC[-6]*RC[-4]) -> 1 | AI631: =RC[-11]/SQRT(RC[-6]*RC[-5]) -> 1
A632: 47486 | B632: 北京 | C632: 179 | D632: 中度污染 | E632: 0.98 | F632: 5 | G632: 32 | H632: 39 | I632: 42 | J632: 40 | L632: 2013-06-17T06:00:00.000 | M632: =RC[-8]-R[18]C[-8] -> 7.5000000000000178E-2 | N632: =RC[-8]-R[18]C[-8] -> -0.875 | O632: =RC[-8]-R[18]C[-8] -> -3.2083333333333357 | P632: =RC[-8]-R[18]C[-8] -> -49.083333333333329 | Q632: =RC[-8]-R[18]C[-8] -> -22.458333333333329 | R632: =RC[-8]-R[18]C[-8] -> -1.6666666666666643 | T632: =RC[-7]*RC[-2] -> -0.12500000000000011 | U632: =RC[-7]*RC[-3] -> 1.4583333333333313 | V632: =RC[-7]*RC[-4] -> 5.3472222222222188 | W632: =RC[-7]*RC[-5] -> 81.805555555555429 | X632: =RC[-7]*RC[-6] -> 37.430555555555493 | Y632: =RC[-12]*RC[-12] -> 5.6250000000000267E-3 | Z632: =RC[-12]*RC[-12] -> 0.765625 | AA632: =RC[-12]*RC[-12] -> 10.293402777777793 | AB632: =RC[-12]*RC[-12] -> 2409.1736111111109 | AC632: =RC[-12]*RC[-12] -> 504.37673611111092 | AD632: =RC[-12]*RC[-12] -> 2.7777777777777697 | AE632: =RC[-11]/SQRT(RC[-6]*RC[-1]) -> -1 | AF632: =RC[-11]/SQRT(RC[-6]*RC[-2]) -> 1 | AG632: =RC[-11]/SQRT(RC[-6]*RC[-3]) -> 1 | AH632: =RC[-11]/SQRT(RC[-6]*RC[-4]) -> 1 | AI632: =RC[-11]/SQRT(RC[-6]*RC[-5]) -> 1
A633: 47562 | B633: 北京 | C633: 175 | D633: 中度污染 | E633: 0.93 | F633: 4 | G633: 37 | H633: 39 | I633: 39 | J633: 27 | L633: 2013-06-17T07:00:00.000 | M633: =RC[-8]-R[17]C[-8] -> 2.5000000000000244E-2 | N633: =RC[-8]-R[17]C[-8] -> -1.875 | O633: =RC[-8]-R[17]C[-8] -> 1.7916666666666643 | P633: =RC[-8]-R[17]C[-8] -> -49.083333333333329 | Q633: =RC[-8]-R[17]C[-8] -> -25.458333333333329 | R633: =RC[-8]-R[17]C[-8] -> -14.666666666666664 | T633: =RC[-7]*RC[-2] -> -0.36666666666667019 | U633: =RC[-7]*RC[-3] -> 27.499999999999996 | V633: =RC[-7]*RC[-4] -> -26.277777777777739 | W633: =RC[-7]*RC[-5] -> 719.88888888888869 | X633: =RC[-7]*RC[-6] -> 373.38888888888874 | Y633: =RC[-12]*RC[-12] -> 6.2500000000001226E-4 | Z633: =RC[-12]*RC[-12] -> 3.515625 | AA633: =RC[-12]*RC[-12] -> 3.2100694444444358 | AB633: =RC[-12]*RC[-12] -> 2409.1736111111109 | AC633: =RC[-12]*RC[-12] -> 648.12673611111086 | AD633: =RC[-12]*RC[-12] -> 215.11111111111103 | AE633: =RC[-11]/SQRT(RC[-6]*RC[-1]) -> -1 | AF633: =RC[-11]/SQRT(RC[-6]*RC[-2]) -> 1.0000000000000002 | AG633: =RC[-11]/SQRT(RC[-6]*RC[-3]) -> -1.0000000000000002 | AH633: =RC[-11]/SQRT(RC[-6]*RC[-4]) -> 1 | AI633: =RC[-11]/SQRT(RC[-6]*RC[-5]) -> 1
A634: 47638 | B634: 北京 | C634: 168 | D634: 中度污染 | E634: 0.95 | F634: 6 | G634: 37 | H634: 42 | I634: 37 | J634: 16 | L634: 2013-06-17T08:00:00.000 | M634: =RC[-8]-R[16]C[-8] -> 4.5000000000000151E-2 | N634: =RC[-8]-R[16]C[-8] -> 0.125 | O634: =RC[-8]-R[16]C[-8] -> 1.7916666666666643 | P634: =RC[-8]-R[16]C[-8] -> -46.083333333333329 | Q634: =RC[-8]-R[16]C[-8] -> -27.458333333333329 | R634: =RC[-8]-R[16]C[-8] -> -25.666666666666664 | T634: =RC[-7]*RC[-2] -> -1.1550000000000038 | U634: =RC[-7]*RC[-3] -> -3.208333333333333 | V634: =RC[-7]*RC[-4] -> -45.986111111111043 | W634: =RC[-7]*RC[-5] -> 1182.8055555555554 | X634: =RC[-7]*RC[-6] -> 704.76388888888869 | Y634: =RC[-12]*RC[-12] -> 2.0250000000000138E-3 | Z634: =RC[-12]*RC[-12] -> 1.5625E-2 | AA634: =RC[-12]*RC[-12] -> 3.2100694444444358 | AB634: =RC[-12]*RC[-12] -> 2123.6736111111109 | AC634: =RC[-12]*RC[-12] -> 753.96006944444423 | AD634: =RC[-12]*RC[-12] -> 658.7777777777776 | AE634: =RC[-11]/SQRT(RC[-6]*RC[-1]) -> -1 | AF634: =RC[-11]/SQRT(RC[-6]*RC[-2]) -> -1 | AG634: =RC[-11]/SQRT(RC[-6]*RC[-3]) -> -1 | AH634: =RC[-11]/SQRT(RC[-6]*RC[-4]) -> 1.0000000000000002 | AI634: =RC[-11]/SQRT(RC[-6]*RC[-5]) -> 1
A635: 47714 | B635: 北京 | C635: 158 | D635: 中度污染 | E635: 0.87 | F635: 6 | G635: 34 | H635: 56 | I635: 24 | J635: 15 | L635: 2013-06-17T09:00:00.000 | M635: =RC[-8]-R[15]C[-8] -> -3.4999999999999809E-2 | N635: =RC[-8]-R[15]C[-8] -> 0.125 | O635: =RC[-8]-R[15]C[-8] -> -1.2083333333333357 | P635: =RC[-8]-R[15]C[-8] -> -32.083333333333329 | Q635: =RC[-8]-R[15]C[-8] -> -40.458333333333329 | R635: =RC[-8]-R[15]C[-8] -> -26.666666666666664 | T635: =RC[-7]*RC[-2] -> 0.93333333333332813 | U635: =RC[-7]*RC[-3] -> -3.333333333333333 | V635: =RC[-7]*RC[-4] -> 32.222222222222285 | W635: =RC[-7]*RC[-5] -> 855.55555555555532 | X635: =RC[-7]*RC[-6] -> 1078.8888888888887 | Y635: =RC[-12]*RC[-12] -> 1.2249999999999867E-3 | Z635: =RC[-12]*RC[-12] -> 1.5625E-2 | AA635: =RC[-12]*RC[-12] -> 1.4600694444444502 | AB635: =RC[-12]*RC[-12] -> 1029.3402777777774 | AC635: =RC[-12]*RC[-12] -> 1636.8767361111106 | AD635: =RC[-12]*RC[-12] -> 711.11111111111097 | AE635: =RC[-11]/SQRT(RC[-6]*RC[-1]) -> 0.99999999999999989 | AF635: =RC[-11]/SQRT(RC[-6]*RC[-2]) -> -1 | AG635: =RC[-11]/SQRT(RC[-6]*RC[-3]) -> 1 | AH635: =RC[-11]/SQRT(RC[-6]*RC[-4]) -> 1 | AI635: =RC[-11]/SQRT(RC[-6]*RC[-5]) -> 1
A636: 47790 | B636: 北京 | C636: 151 | D636: 轻度污染 | E636: 0.81 | F636: 6 | G636: 30 | H636: 72 | I636: 33 | J636: 13 | L636: 2013-06-17T10:00:00.000 | M636: =RC[-8]-R[14]C[-8] -> -9.4999999999999751E-2 | N636: =RC[-8]-R[14]C[-8] -> 0.125 | O636: =RC[-8]-R[14]C[-8] -> -5.2083333333333357 | P636: =RC[-8]-R[14]C[-8] -> -16.083333333333329 | Q636: =RC[-8]-R[14]C[-8] -> -31.458333333333329 | R636: =RC[-8]-R[14]C[-8] -> -28.666666666666664 | T636: =RC[-7]*RC[-2] -> 2.7233333333333261 | U636: =RC[-7]*RC[-3] -> -3.583333333333333 | V636: =RC[-7]*RC[-4] -> 149.3055555555556 | W636: =RC[-7]*RC[-5] -> 461.05555555555537 | X636: =RC[-7]*RC[-6] -> 901.80555555555532 | Y636: =RC[-12]*RC[-12] -> 9.0249999999999532E-3 | Z636: =RC[-12]*RC[-12] -> 1.5625E-2 | AA636: =RC[-12]*RC[-12] -> 27.126736111111136 | AB636: =RC[-12]*RC[-12] -> 258.67361111111097 | AC636: =RC[-12]*RC[-12] -> 989.62673611111086 | AD636: =RC[-12]*RC[-12] -> 821.7777777777776 | AE636: =RC[-11]/SQRT(RC[-6]*RC[-1]) -> 1 | AF636: =RC[-11]/SQRT(RC[-6]*RC[-2]) -> -1 | AG636: =RC[-11]/SQRT(RC[-6]*RC[-3]) -> 1 | AH636: =RC[-11]/SQRT(RC[-6]*RC[-4]) -> 1 | AI636: =RC[-11]/SQRT(RC[-6]*RC[-5]) -> 1
A637: 47866 | B637: 北京 | C637: 142 | D637: 轻度污染 | E637: 0.71 | F637: 5 | G637: 24 | H637: 88 | I637: 7 | J637: 11 | L637: 2013-06-17T11:00:00.000 | M637: =RC[-8]-R[13]C[-8] -> -0.19499999999999984 | N637: =RC[-8]-R[13]C[-8] -> -0.875 | O637: =RC[-8]-R[13]C[-8] -> -11.208333333333336 | P637: =RC[-8]-R[13]C[-8] -> -8.3333333333328596E-2 | Q637: =RC[-8]-R[13]C[-8] -> -57.458333333333329 | R637: =RC[-8]-R[13]C[-8] -> -30.666666666666664 | T637: =RC[-7]*RC[-2] -> 5.9799999999999942 | U637: =RC[-7]*RC[-3] -> 26.833333333333332 | V637: =RC[-7]*RC[-4] -> 343.72222222222229 | W637: =RC[-7]*RC[-5] -> 2.5555555555554101 | X637: =RC[-7]*RC[-6] -> 1762.0555555555552 | Y637: =RC[-12]*RC[-12] -> 3.8024999999999941E-2 | Z637: =RC[-12]*RC[-12] -> 0.765625 | AA637: =RC[-12]*RC[-12] -> 125.62673611111117 | AB637: =RC[-12]*RC[-12] -> 6.9444444444436548E-3 | AC637: =RC[-12]*RC[-12] -> 3301.4600694444439 | AD637: =RC[-12]*RC[-12] -> 940.44444444444434 | AE637: =RC[-11]/SQRT(RC[-6]*RC[-1]) -> 0.99999999999999989 | AF637: =RC[-11]/SQRT(RC[-6]*RC[-2]) -> 1 | AG637: =RC[-11]/SQRT(RC[-6]*RC[-3]) -> 1 | AH637: =RC[-11]/SQRT(RC[-6]*RC[-4]) -> 1 | AI637: =RC[-11]/SQRT(RC[-6]*RC[-5]) -> 0.99999999999999989
A638: 47942 | B638: 北京 | C638: 132 | D638: 轻度污染 | E638: 0.8 | F638: 5 | G638: 24 | H638: 97 | I638: 21 | J638: 13 | L638: 2013-06-17T12:00:00.000 | M638: =RC[-8]-R[12]C[-8] -> -0.10499999999999976 | N638: =RC[-8]-R[12]C[-8] -> -0.875 | O638: =RC[-8]-R[12]C[-8] -> -11.208333333333336 | P638: =RC[-8]-R[12]C[-8] -> 8.9166666666666714 | Q638: =RC[-8]-R[12]C[-8] -> -43.458333333333329 | R638: =RC[-8]-R[12]C[-8] -> -28.666666666666664 | T638: =RC[-7]*RC[-2] -> 3.0099999999999927 | U638: =RC[-7]*RC[-3] -> 25.083333333333332 | V638: =RC[-7]*RC[-4] -> 321.3055555555556 | W638: =RC[-7]*RC[-5] -> -255.61111111111123 | X638: =RC[-7]*RC[-6] -> 1245.8055555555554 | Y638: =RC[-12]*RC[-12] -> 1.102499999999995E-2 | Z638: =RC[-12]*RC[-12] -> 0.765625 | AA638: =RC[-12]*RC[-12] -> 125.62673611111117 | AB638: =RC[-12]*RC[-12] -> 79.506944444444528 | AC638: =RC[-12]*RC[-12] -> 1888.6267361111106 | AD638: =RC[-12]*RC[-12] -> 821.7777777777776 | AE638: =RC[-11]/SQRT(RC[-6]*RC[-1]) -> 0.99999999999999989 | AF638: =RC[-11]/SQRT(RC[-6]*RC[-2]) -> 1 | AG638: =RC[-11]/SQRT(RC[-6]*RC[-3]) -> 1 | AH638: =RC[-11]/SQRT(RC[-6]*RC[-4]) -> -1.0000000000000002 | AI638: =RC[-11]/SQRT(RC[-6]*RC[-5]) -> 1.0000000000000002
A639: 48018 | B639: 北京 | C639: 125 | D639: 轻度污染 | E639: 0.56999999999999995 | F639: 6 | G639: 24 | H639: 99 | I639: 28 | J639: 16 | L639: 2013-06-17T13:00:00.000 | M639: =RC[-8]-R[11]C[-8] -> -0.33499999999999985 | N639: =RC[-8]-R[11]C[-8] -> 0.125 | O639: =RC[-8]-R[11]C[-8] -> -11.208333333333336 | P639: =RC[-8]-R[11]C[-8] -> 10.916666666666671 | Q639: =RC[-8]-R[11]C[-8] -> -36.458333333333329 | R639: =RC[-8]-R[11]C[-8] -> -25.666666666666664 | T639: =RC[-7]*RC[-2] -> 8.5983333333333292 | U639: =RC[-7]*RC[-3] -> -3.208333333333333 | V639: =RC[-7]*RC[-4] -> 287.6805555555556 | W639: =RC[-7]*RC[-5] -> -280.19444444444451 | X639: =RC[-7]*RC[-6] -> 935.76388888888869 | Y639: =RC[-12]*RC[-12] -> 0.11222499999999991 | Z639: =RC[-12]*RC[-12] -> 1.5625E-2 | AA639: =RC[-12]*RC[-12] -> 125.62673611111117 | AB639: =RC[-12]*RC[-12] -> 119.17361111111121 | AC639: =RC[-12]*RC[-12] -> 1329.2100694444441 | AD639: =RC[-12]*RC[-12] -> 658.7777777777776 | AE639: =RC[-11]/SQRT(RC[-6]*RC[-1]) -> 1 | AF639: =RC[-11]/SQRT(RC[-6]*RC[-2]) -> -1 | AG639: =RC[-11]/SQRT(RC[-6]*RC[-3]) -> 1 | AH639: =RC[-11]/SQRT(RC[-6]*RC[-4]) -> -1 | AI639: =RC[-11]/SQRT(RC[-6]*RC[-5]) -> 1
A640: 48094 | B640: 北京 | C640: 119 | D640: 轻度污染 | E640: 0.62 | F640: 5 | G640: 24 | H640: 140 | I640: 22 | J640: 18 | L640: 2013-06-17T14:00:00.000 | M640: =RC[-8]-R[10]C[-8] -> -0.28499999999999981 | N640: =RC[-8]-R[10]C[-8] -> -0.875 | O640: =RC[-8]-R[10]C[-8] -> -11.208333333333336 | P640: =RC[-8]-R[10]C[-8] -> 51.916666666666671 | Q640: =RC[-8]-R[10]C[-8] -> -42.458333333333329 | R640: =RC[-8]-R[10]C[-8] -> -23.666666666666664 | T640: =RC[-7]*RC[-2] -> 6.7449999999999948 | U640: =RC[-7]*RC[-3] -> 20.708333333333332 | V640: =RC[-7]*RC[-4] -> 265.26388888888891 | W640: =RC[-7]*RC[-5] -> -1228.6944444444443 | X640: =RC[-7]*RC[-6] -> 1004.8472222222221 | Y640: =RC[-12]*RC[-12] -> 8.1224999999999895E-2 | Z640: =RC[-12]*RC[-12] -> 0.765625 | AA640: =RC[-12]*RC[-12] -> 125.62673611111117 | AB640: =RC[-12]*RC[-12] -> 2695.3402777777783 | AC640: =RC[-12]*RC[-12] -> 1802.7100694444441 | AD640: =RC[-12]*RC[-12] -> 560.11111111111097 | AE640: =RC[-11]/SQRT(RC[-6]*RC[-1]) -> 1 | AF640: =RC[-11]/SQRT(RC[-6]*RC[-2]) -> 1 | AG640: =RC[-11]/SQRT(RC[-6]*RC[-3]) -> 1 | AH640: =RC[-11]/SQRT(RC[-6]*RC[-4]) -> -1 | AI640: =RC[-11]/SQRT(RC[-6]*RC[-5]) -> 1.0000000000000002
A641: 48170 | B641: 北京 | C641: 114 | D641: 轻度污染 | E641: 0.59 | F641: 5 | G641: 22 | H641: 156 | I641: 28 | J641: 18 | L641: 2013-06-17T15:00:00.000 | M641: =RC[-8]-R[9]C[-8] -> -0.31499999999999984 | N641: =RC[-8]-R[9]C[-8] -> -0.875 | O641: =RC[-8]-R[9]C[-8] -> -13.208333333333336 | P641: =RC[-8]-R[9]C[-8] -> 67.916666666666671 | Q641: =RC[-8]-R[9]C[-8] -> -36.458333333333329 | R641: =RC[-8]-R[9]C[-8] -> -23.666666666666664 | T641: =RC[-7]*RC[-2] -> 7.4549999999999956 | U641: =RC[-7]*RC[-3] -> 20.708333333333332 | V641: =RC[-7]*RC[-4] -> 312.59722222222223 | W641: =RC[-7]*RC[-5] -> -1607.3611111111111 | X641: =RC[-7]*RC[-6] -> 862.84722222222206 | Y641: =RC[-12]*RC[-12] -> 9.9224999999999897E-2 | Z641: =RC[-12]*RC[-12] -> 0.765625 | AA641: =RC[-12]*RC[-12] -> 174.46006944444451 | AB641: =RC[-12]*RC[-12] -> 4612.6736111111113 | AC641: =RC[-12]*RC[-12] -> 1329.2100694444441 | AD641: =RC[-12]*RC[-12] -> 560.11111111111097 | AE641: =RC[-11]/SQRT(RC[-6]*RC[-1]) -> 1.0000000000000002 | AF641: =RC[-11]/SQRT(RC[-6]*RC[-2]) -> 1 | AG641: =RC[-11]/SQRT(RC[-6]*RC[-3]) -> 1 | AH641: =RC[-11]/SQRT(RC[-6]*RC[-4]) -> -1.0000000000000002 | AI641: =RC[-11]/SQRT(RC[-6]*RC[-5]) -> 1
A642: 48246 | B642: 北京 | C642: 110 | D642: 轻度污染 | E642: 0.64 | F642: 6 | G642: 30 | H642: 171 | I642: 38 | J642: 22 | L642: 2013-06-17T16:00:00.000 | M642: =RC[-8]-R[8]C[-8] -> -0.26499999999999979 | N642: =RC[-8]-R[8]C[-8] -> 0.125 | O642: =RC[-8]-R[8]C[-8] -> -5.2083333333333357 | P642: =RC[-8]-R[8]C[-8] -> 82.916666666666671 | Q642: =RC[-8]-R[8]C[-8] -> -26.458333333333329 | R642: =RC[-8]-R[8]C[-8] -> -19.666666666666664 | T642: =RC[-7]*RC[-2] -> 5.2116666666666616 | U642: =RC[-7]*RC[-3] -> -2.458333333333333 | V642: =RC[-7]*RC[-4] -> 102.43055555555559 | W642: =RC[-7]*RC[-5] -> -1630.6944444444443 | X642: =RC[-7]*RC[-6] -> 520.34722222222206 | Y642: =RC[-12]*RC[-12] -> 7.0224999999999885E-2 | Z642: =RC[-12]*RC[-12] -> 1.5625E-2 | AA642: =RC[-12]*RC[-12] -> 27.126736111111136 | AB642: =RC[-12]*RC[-12] -> 6875.1736111111122 | AC642: =RC[-12]*RC[-12] -> 700.04340277777749 | AD642: =RC[-12]*RC[-12] -> 386.77777777777766 | AE642: =RC[-11]/SQRT(RC[-6]*RC[-1]) -> 1 | AF642: =RC[-11]/SQRT(RC[-6]*RC[-2]) -> -1 | AG642: =RC[-11]/SQRT(RC[-6]*RC[-3]) -> 1 | AH642: =RC[-11]/SQRT(RC[-6]*RC[-4]) -> -1 | AI642: =RC[-11]/SQRT(RC[-6]*RC[-5]) -> 1
A643: 48322 | B643: 北京 | C643: 103 | D643: 轻度污染 | E643: 0.65 | F643: 6 | G643: 32 | H643: 175 | I643: 36 | J643: 25 | L643: 2013-06-17T17:00:00.000 | M643: =RC[-8]-R[7]C[-8] -> -0.25499999999999978 | N643: =RC[-8]-R[7]C[-8] -> 0.125 | O643: =RC[-8]-R[7]C[-8] -> -3.2083333333333357 | P643: =RC[-8]-R[7]C[-8] -> 86.916666666666671 | Q643: =RC[-8]-R[7]C[-8] -> -28.458333333333329 | R643: =RC[-8]-R[7]C[-8] -> -16.666666666666664 | T643: =RC[-7]*RC[-2] -> 4.2499999999999956 | U643: =RC[-7]*RC[-3] -> -2.083333333333333 | V643: =RC[-7]*RC[-4] -> 53.472222222222257 | W643: =RC[-7]*RC[-5] -> -1448.6111111111111 | X643: =RC[-7]*RC[-6] -> 474.30555555555543 | Y643: =RC[-12]*RC[-12] -> 6.5024999999999888E-2 | Z643: =RC[-12]*RC[-12] -> 1.5625E-2 | AA643: =RC[-12]*RC[-12] -> 10.293402777777793 | AB643: =RC[-12]*RC[-12] -> 7554.5069444444453 | AC643: =RC[-12]*RC[-12] -> 809.87673611111086 | AD643: =RC[-12]*RC[-12] -> 277.77777777777771 | AE643: =RC[-11]/SQRT(RC[-6]*RC[-1]) -> 1 | AF643: =RC[-11]/SQRT(RC[-6]*RC[-2]) -> -1 | AG643: =RC[-11]/SQRT(RC[-6]*RC[-3]) -> 1 | AH643: =RC[-11]/SQRT(RC[-6]*RC[-4]) -> -1 | AI643: =RC[-11]/SQRT(RC[-6]*RC[-5]) -> 1
A644: 48398 | B644: 北京 | C644: 96 | D644: 良 | E644: 0.65 | F644: 5 | G644: 38 | H644: 162 | I644: 52 | J644: 28 | L644: 2013-06-17T18:00:00.000 | M644: =RC[-8]-R[6]C[-8] -> -0.25499999999999978 | N644: =RC[-8]-R[6]C[-8] -> -0.875 | O644: =RC[-8]-R[6]C[-8] -> 2.7916666666666643 | P644: =RC[-8]-R[6]C[-8] -> 73.916666666666671 | Q644: =RC[-8]-R[6]C[-8] -> -12.458333333333329 | R644: =RC[-8]-R[6]C[-8] -> -13.666666666666664 | T644: =RC[-7]*RC[-2] -> 3.4849999999999963 | U644: =RC[-7]*RC[-3] -> 11.958333333333332 | V644: =RC[-7]*RC[-4] -> -38.152777777777736 | W644: =RC[-7]*RC[-5] -> -1010.1944444444443 | X644: =RC[-7]*RC[-6] -> 170.2638888888888 | Y644: =RC[-12]*RC[-12] -> 6.5024999999999888E-2 | Z644: =RC[-12]*RC[-12] -> 0.765625 | AA644: =RC[-12]*RC[-12] -> 7.7934027777777644 | AB644: =RC[-12]*RC[-12] -> 5463.6736111111122 | AC644: =RC[-12]*RC[-12] -> 155.21006944444431 | AD644: =RC[-12]*RC[-12] -> 186.77777777777771 | AE644: =RC[-11]/SQRT(RC[-6]*RC[-1]) -> 1 | AF644: =RC[-11]/SQRT(RC[-6]*RC[-2]) -> 1.0000000000000002 | AG644: =RC[-11]/SQRT(RC[-6]*RC[-3]) -> -1 | AH644: =RC[-11]/SQRT(RC[-6]*RC[-4]) -> -1 | AI644: =RC[-11]/SQRT(RC[-6]*RC[-5]) -> 1
A645: 48474 | B645: 北京 | C645: 94 | D645: 良 | E645: 0.71 | F645: 6 | G645: 46 | H645: 153 | I645: 81 | J645: 37 | L645: 2013-06-17T19:00:00.000 | M645: =RC[-8]-R[5]C[-8] -> -0.19499999999999984 | N645: =RC[-8]-R[5]C[-8] -> 0.125 | O645: =RC[-8]-R[5]C[-8] -> 10.791666666666664 | P645: =RC[-8]-R[5]C[-8] -> 64.916666666666671 | Q645: =RC[-8]-R[5]C[-8] -> 16.541666666666671 | R645: =RC[-8]-R[5]C[-8] -> -4.6666666666666643 | T645: =RC[-7]*RC[-2] -> 0.90999999999999881 | U645: =RC[-7]*RC[-3] -> -0.58333333333333304 | V645: =RC[-7]*RC[-4] -> -50.361111111111072 | W645: =RC[-7]*RC[-5] -> -302.94444444444429 | X645: =RC[-7]*RC[-6] -> -77.194444444444429 | Y645: =RC[-12]*RC[-12] -> 3.8024999999999941E-2 | Z645: =RC[-12]*RC[-12] -> 1.5625E-2 | AA645: =RC[-12]*RC[-12] -> 116.4600694444444 | AB645: =RC[-12]*RC[-12] -> 4214.1736111111113 | AC645: =RC[-12]*RC[-12] -> 273.62673611111126 | AD645: =RC[-12]*RC[-12] -> 21.777777777777757 | AE645: =RC[-11]/SQRT(RC[-6]*RC[-1]) -> 0.99999999999999989 | AF645: =RC[-11]/SQRT(RC[-6]*RC[-2]) -> -1 | AG645: =RC[-11]/SQRT(RC[-6]*RC[-3]) -> -0.99999999999999989 | AH645: =RC[-11]/SQRT(RC[-6]*RC[-4]) -> -1 | AI645: =RC[-11]/SQRT(RC[-6]*RC[-5]) -> -1
A646: 48550 | B646: 北京 | C646: 95 | D646: 良 | E646: 0.82 | F646: 6 | G646: 51 | H646: 132 | I646: 90 | J646: 46 | L646: 2013-06-17T20:00:00.000 | M646: =RC[-8]-R[4]C[-8] -> -8.4999999999999853E-2 | N646: =RC[-8]-R[4]C[-8] -> 0.125 | O646: =RC[-8]-R[4]C[-8] -> 15.791666666666664 | P646: =RC[-8]-R[4]C[-8] -> 43.916666666666671 | Q646: =RC[-8]-R[4]C[-8] -> 25.541666666666671 | R646: =RC[-8]-R[4]C[-8] -> 4.3333333333333357 | T646: =RC[-7]*RC[-2] -> -0.3683333333333329 | U646: =RC[-7]*RC[-3] -> 0.54166666666666696 | V646: =RC[-7]*RC[-4] -> 68.430555555555586 | W646: =RC[-7]*RC[-5] -> 190.30555555555569 | X646: =RC[-7]*RC[-6] -> 110.68055555555564 | Y646: =RC[-12]*RC[-12] -> 7.2249999999999754E-3 | Z646: =RC[-12]*RC[-12] -> 1.5625E-2 | AA646: =RC[-12]*RC[-12] -> 249.37673611111103 | AB646: =RC[-12]*RC[-12] -> 1928.6736111111115 | AC646: =RC[-12]*RC[-12] -> 652.37673611111131 | AD646: =RC[-12]*RC[-12] -> 18.7777777777778 | AE646: =RC[-11]/SQRT(RC[-6]*RC[-1]) -> -0.99999999999999989 | AF646: =RC[-11]/SQRT(RC[-6]*RC[-2]) -> 1 | AG646: =RC[-11]/SQRT(RC[-6]*RC[-3]) -> 1 | AH646: =RC[-11]/SQRT(RC[-6]*RC[-4]) -> 1 | AI646: =RC[-11]/SQRT(RC[-6]*RC[-5]) -> 1
A647: 48626 | B647: 北京 | C647: 93 | D647: 良 | E647: 0.86 | F647: 5 | G647: 59 | H647: 96 | I647: 85 | J647: 50 | L647: 2013-06-17T21:00:00.000 | M647: =RC[-8]-R[3]C[-8] -> -4.4999999999999818E-2 | N647: =RC[-8]-R[3]C[-8] -> -0.875 | O647: =RC[-8]-R[3]C[-8] -> 23.791666666666664 | P647: =RC[-8]-R[3]C[-8] -> 7.9166666666666714 | Q647: =RC[-8]-R[3]C[-8] -> 20.541666666666671 | R647: =RC[-8]-R[3]C[-8] -> 8.3333333333333357 | T647: =RC[-7]*RC[-2] -> -0.37499999999999861 | U647: =RC[-7]*RC[-3] -> -7.2916666666666687 | V647: =RC[-7]*RC[-4] -> 198.26388888888891 | W647: =RC[-7]*RC[-5] -> 65.972222222222285 | X647: =RC[-7]*RC[-6] -> 171.18055555555566 | Y647: =RC[-12]*RC[-12] -> 2.0249999999999834E-3 | Z647: =RC[-12]*RC[-12] -> 0.765625 | AA647: =RC[-12]*RC[-12] -> 566.04340277777771 | AB647: =RC[-12]*RC[-12] -> 62.673611111111185 | AC647: =RC[-12]*RC[-12] -> 421.96006944444463 | AD647: =RC[-12]*RC[-12] -> 69.444444444444485 | AE647: =RC[-11]/SQRT(RC[-6]*RC[-1]) -> -1.0000000000000002 | AF647: =RC[-11]/SQRT(RC[-6]*RC[-2]) -> -1 | AG647: =RC[-11]/SQRT(RC[-6]*RC[-3]) -> 0.99999999999999989 | AH647: =RC[-11]/SQRT(RC[-6]*RC[-4]) -> 1 | AI647: =RC[-11]/SQRT(RC[-6]*RC[-5]) -> 1.0000000000000002
A648: 48702 | B648: 北京 | C648: 86 | D648: 良 | E648: 0.96 | F648: 5 | G648: 68 | H648: 69 | I648: 87 | J648: 54 | L648: 2013-06-17T22:00:00.000 | M648: =RC[-8]-R[2]C[-8] -> 5.500000000000016E-2 | N648: =RC[-8]-R[2]C[-8] -> -0.875 | O648: =RC[-8]-R[2]C[-8] -> 32.791666666666664 | P648: =RC[-8]-R[2]C[-8] -> -19.083333333333329 | Q648: =RC[-8]-R[2]C[-8] -> 22.541666666666671 | R648: =RC[-8]-R[2]C[-8] -> 12.333333333333336 | T648: =RC[-7]*RC[-2] -> 0.67833333333333545 | U648: =RC[-7]*RC[-3] -> -10.791666666666668 | V648: =RC[-7]*RC[-4] -> 404.4305555555556 | W648: =RC[-7]*RC[-5] -> -235.36111111111109 | X648: =RC[-7]*RC[-6] -> 278.01388888888903 | Y648: =RC[-12]*RC[-12] -> 3.0250000000000177E-3 | Z648: =RC[-12]*RC[-12] -> 0.765625 | AA648: =RC[-12]*RC[-12] -> 1075.2934027777776 | AB648: =RC[-12]*RC[-12] -> 364.17361111111092 | AC648: =RC[-12]*RC[-12] -> 508.12673611111131 | AD648: =RC[-12]*RC[-12] -> 152.11111111111117 | AE648: =RC[-11]/SQRT(RC[-6]*RC[-1]) -> 1 | AF648: =RC[-11]/SQRT(RC[-6]*RC[-2]) -> -1 | AG648: =RC[-11]/SQRT(RC[-6]*RC[-3]) -> 1 | AH648: =RC[-11]/SQRT(RC[-6]*RC[-4]) -> -1 | AI648: =RC[-11]/SQRT(RC[-6]*RC[-5]) -> 1.0000000000000002
A649: 48778 | B649: 北京 | C649: 76 | D649: 良 | E649: 0.95 | F649: 6 | G649: 71 | H649: 57 | I649: 87 | J649: 54 | L649: 2013-06-17T23:00:00.000 | M649: =RC[-8]-R[1]C[-8] -> 4.5000000000000151E-2 | N649: =RC[-8]-R[1]C[-8] -> 0.125 | O649: =RC[-8]-R[1]C[-8] -> 35.791666666666664 | P649: =RC[-8]-R[1]C[-8] -> -31.083333333333329 | Q649: =RC[-8]-R[1]C[-8] -> 22.541666666666671 | R649: =RC[-8]-R[1]C[-8] -> 12.333333333333336 | T649: =RC[-7]*RC[-2] -> 0.55500000000000194 | U649: =RC[-7]*RC[-3] -> 1.541666666666667 | V649: =RC[-7]*RC[-4] -> 441.4305555555556 | W649: =RC[-7]*RC[-5] -> -383.36111111111114 | X649: =RC[-7]*RC[-6] -> 278.01388888888903 | Y649: =RC[-12]*RC[-12] -> 2.0250000000000138E-3 | Z649: =RC[-12]*RC[-12] -> 1.5625E-2 | AA649: =RC[-12]*RC[-12] -> 1281.0434027777776 | AB649: =RC[-12]*RC[-12] -> 966.17361111111086 | AC649: =RC[-12]*RC[-12] -> 508.12673611111131 | AD649: =RC[-12]*RC[-12] -> 152.11111111111117 | AE649: =RC[-11]/SQRT(RC[-6]*RC[-1]) -> 0.99999999999999978 | AF649: =RC[-11]/SQRT(RC[-6]*RC[-2]) -> 1 | AG649: =RC[-11]/SQRT(RC[-6]*RC[-3]) -> 1 | AH649: =RC[-11]/SQRT(RC[-6]*RC[-4]) -> -1 | AI649: =RC[-11]/SQRT(RC[-6]*RC[-5]) -> 1.0000000000000002
E650: =AVERAGE(R[-24]C:R[-1]C) -> 0.9049999999999998 | F650: =AVERAGE(R[-24]C:R[-1]C) -> 5.875 | G650: =AVERAGE(R[-24]C:R[-1]C) -> 35.208333333333336 | H650: =AVERAGE(R[-24]C:R[-1]C) -> 88.083333333333329 | I650: =AVERAGE(R[-24]C:R[-1]C) -> 64.458333333333329 | J650: =AVERAGE(R[-24]C:R[-1]C) -> 41.666666666666664 | M650: =RC[-8]-RC[-8] -> 0 | N650: =RC[-8]-RC[-8] -> 0 | O650: =RC[-8]-RC[-8] -> 0 | P650: =RC[-8]-RC[-8] -> 0 | Q650: =RC[-8]-RC[-8] -> 0 | R650: =RC[-8]-RC[-8] -> 0 | T650: =SUM(R[-24]C:R[-1]C) -> 231.22000000000006 | U650: =SUM(R[-24]C:R[-1]C) -> 837 | V650: =SUM(R[-24]C:R[-1]C) -> 1641.6666666666663 | W650: =SUM(R[-24]C:R[-1]C) -> -15042.333333333332 | X650: =SUM(R[-24]C:R[-1]C) -> 46082.666666666664 | Y650: =SUM(R[-24]C:R[-1]C) -> 2.0276000000000005 | Z650: =SUM(R[-24]C:R[-1]C) -> 36.625 | AA650: =SUM(R[-24]C:R[-1]C) -> 4541.958333333333 | AB650: =SUM(R[-24]C:R[-1]C) -> 54311.833333333321 | AC650: =SUM(R[-24]C:R[-1]C) -> 73849.958333333299 | AD650: =SUM(R[-24]C:R[-1]C) -> 32041.333333333321 | AE650: =RC[-11]/SQRT(RC[-6]*RC[-1]) -> 0.90714970891622126 | AF650: =RC[-11]/SQRT(RC[-6]*RC[-2]) -> 0.7726474067134933 | AG650: =RC[-11]/SQRT(RC[-6]*RC[-3]) -> 0.13608432929863767 | AH650: =RC[-11]/SQRT(RC[-6]*RC[-4]) -> -0.36058917653760525 | AI650: =RC[-11]/SQRT(RC[-6]*RC[-5]) -> 0.94734285758653802
A651: 48854 | B651: 北京 | C651: 65 | D651: 良 | E651: 0.93 | F651: 7 | G651: 74 | H651: 45 | I651: 75 | J651: 50 | L651: 2013-06-18T00:00:00.000 | M651: =RC[-8]-R[24]C[-8] -> 0.19041666666666668 | N651: =RC[-8]-R[24]C[-8] -> -0.875 | O651: =RC[-8]-R[24]C[-8] -> 15.583333333333336 | P651: =RC[-8]-R[24]C[-8] -> -46 | Q651: =RC[-8]-R[24]C[-8] -> -0.4583333333333286 | R651: =RC[-8]-R[24]C[-8] -> 8.5416666666666643 | T651: =RC[-7]*RC[-2] -> 1.6264756944444441 | U651: =RC[-7]*RC[-3] -> -7.4739583333333313 | V651: =RC[-7]*RC[-4] -> 133.10763888888889 | W651: =RC[-7]*RC[-5] -> -392.91666666666657 | X651: =RC[-7]*RC[-6] -> -3.9149305555555141 | Y651: =RC[-12]*RC[-12] -> 3.6258506944444449E-2 | Z651: =RC[-12]*RC[-12] -> 0.765625 | AA651: =RC[-12]*RC[-12] -> 242.84027777777786 | AB651: =RC[-12]*RC[-12] -> 2116 | AC651: =RC[-12]*RC[-12] -> 0.21006944444444009 | AD651: =RC[-12]*RC[-12] -> 72.9600694444444 | AE651: =RC[-11]/SQRT(RC[-6]*RC[-1]) -> 1 | AF651: =RC[-11]/SQRT(RC[-6]*RC[-2]) -> -1 | AG651: =RC[-11]/SQRT(RC[-6]*RC[-3]) -> 1 | AH651: =RC[-11]/SQRT(RC[-6]*RC[-4]) -> -1 | AI651: =RC[-11]/SQRT(RC[-6]*RC[-5]) -> -1.0000000000000002
A652: 48930 | B652: 北京 | C652: 58 | D652: 良 | E652: 0.93 | F652: 9 | G652: 85 | H652: 35 | I652: 66 | J652: 52 | L652: 2013-06-18T01:00:00.000 | M652: =RC[-8]-R[23]C[-8] -> 0.19041666666666668 | N652: =RC[-8]-R[23]C[-8] -> 1.125 | O652: =RC[-8]-R[23]C[-8] -> 26.583333333333336 | P652: =RC[-8]-R[23]C[-8] -> -56 | Q652: =RC[-8]-R[23]C[-8] -> -9.4583333333333286 | R652: =RC[-8]-R[23]C[-8] -> 10.541666666666664 | T652: =RC[-7]*RC[-2] -> 2.0073090277777776 | U652: =RC[-7]*RC[-3] -> 11.859374999999996 | V652: =RC[-7]*RC[-4] -> 280.23263888888886 | W652: =RC[-7]*RC[-5] -> -590.33333333333326 | X652: =RC[-7]*RC[-6] -> -99.706597222222143 | Y652: =RC[-12]*RC[-12] -> 3.6258506944444449E-2 | Z652: =RC[-12]*RC[-12] -> 1.265625 | AA652: =RC[-12]*RC[-12] -> 706.6736111111112 | AB652: =RC[-12]*RC[-12] -> 3136 | AC652: =RC[-12]*RC[-12] -> 89.460069444444358 | AD652: =RC[-12]*RC[-12] -> 111.12673611111106 | AE652: =RC[-11]/SQRT(RC[-6]*RC[-1]) -> 1.0000000000000002 | AF652: =RC[-11]/SQRT(RC[-6]*RC[-2]) -> 0.99999999999999989 | AG652: =RC[-11]/SQRT(RC[-6]*RC[-3]) -> 1 | AH652: =RC[-11]/SQRT(RC[-6]*RC[-4]) -> -1.0000000000000002 | AI652: =RC[-11]/SQRT(RC[-6]*RC[-5]) -> -1
A653: 49006 | B653: 北京 | C653: 56 | D653: 良 | E653: 0.88 | F653: 11 | G653: 85 | H653: 25 | I653: 67 | J653: 49 | L653: 2013-06-18T02:00:00.000 | M653: =RC[-8]-R[22]C[-8] -> 0.14041666666666663 | N653: =RC[-8]-R[22]C[-8] -> 3.125 | O653: =RC[-8]-R[22]C[-8] -> 26.583333333333336 | P653: =RC[-8]-R[22]C[-8] -> -66 | Q653: =RC[-8]-R[22]C[-8] -> -8.4583333333333286 | R653: =RC[-8]-R[22]C[-8] -> 7.5416666666666643 | T653: =RC[-7]*RC[-2] -> 1.0589756944444439 | U653: =RC[-7]*RC[-3] -> 23.567708333333325 | V653: =RC[-7]*RC[-4] -> 200.48263888888886 | W653: =RC[-7]*RC[-5] -> -497.74999999999983 | X653: =RC[-7]*RC[-6] -> -63.7899305555555 | Y653: =RC[-12]*RC[-12] -> 1.9716840277777769E-2 | Z653: =RC[-12]*RC[-12] -> 9.765625 | AA653: =RC[-12]*RC[-12] -> 706.6736111111112 | AB653: =RC[-12]*RC[-12] -> 4356 | AC653: =RC[-12]*RC[-12] -> 71.5434027777777 | AD653: =RC[-12]*RC[-12] -> 56.876736111111079 | AE653: =RC[-11]/SQRT(RC[-6]*RC[-1]) -> 1 | AF653: =RC[-11]/SQRT(RC[-6]*RC[-2]) -> 1 | AG653: =RC[-11]/SQRT(RC[-6]*RC[-3]) -> 1.0000000000000002 | AH653: =RC[-11]/SQRT(RC[-6]*RC[-4]) -> -1 | AI653: =RC[-11]/SQRT(RC[-6]*RC[-5]) -> -1
A654: 49082 | B654: 北京 | C654: 52 | D654: 良 | E654: 0.76 | F654: 7 | G654: 63 | H654: 21 | I654: 75 | J654: 44 | L654: 2013-06-18T03:00:00.000 | M654: =RC[-8]-R[21]C[-8] -> 2.0416666666666639E-2 | N654: =RC[-8]-R[21]C[-8] -> -0.875 | O654: =RC[-8]-R[21]C[-8] -> 4.5833333333333357 | P654: =RC[-8]-R[21]C[-8] -> -70 | Q654: =RC[-8]-R[21]C[-8] -> -0.4583333333333286 | R654: =RC[-8]-R[21]C[-8] -> 2.5416666666666643 | T654: =RC[-7]*RC[-2] -> 5.1892361111110993E-2 | U654: =RC[-7]*RC[-3] -> -2.2239583333333313 | V654: =RC[-7]*RC[-4] -> 11.64930555555555 | W654: =RC[-7]*RC[-5] -> -177.91666666666652 | X654: =RC[-7]*RC[-6] -> -1.1649305555555425 | Y654: =RC[-12]*RC[-12] -> 4.1684027777777661E-4 | Z654: =RC[-12]*RC[-12] -> 0.765625 | AA654: =RC[-12]*RC[-12] -> 21.006944444444468 | AB654: =RC[-12]*RC[-12] -> 4900 | AC654: =RC[-12]*RC[-12] -> 0.21006944444444009 | AD654: =RC[-12]*RC[-12] -> 6.4600694444444322 | AE654: =RC[-11]/SQRT(RC[-6]*RC[-1]) -> 1 | AF654: =RC[-11]/SQRT(RC[-6]*RC[-2]) -> -1 | AG654: =RC[-11]/SQRT(RC[-6]*RC[-3]) -> 0.99999999999999989 | AH654: =RC[-11]/SQRT(RC[-6]*RC[-4]) -> -1 | AI654: =RC[-11]/SQRT(RC[-6]*RC[-5]) -> -1
A655: 49158 | B655: 北京 | C655: 54 | D655: 良 | E655: 0.72 | F655: 6 | G655: 93 | H655: 18 | I655: 75 | J655: 38 | L655: 2013-06-18T04:00:00.000 | M655: =RC[-8]-R[20]C[-8] -> -1.9583333333333397E-2 | N655: =RC[-8]-R[20]C[-8] -> -1.875 | O655: =RC[-8]-R[20]C[-8] -> 34.583333333333336 | P655: =RC[-8]-R[20]C[-8] -> -73 | Q655: =RC[-8]-R[20]C[-8] -> -0.4583333333333286 | R655: =RC[-8]-R[20]C[-8] -> -3.4583333333333357 | T655: =RC[-7]*RC[-2] -> 6.7725694444444706E-2 | U655: =RC[-7]*RC[-3] -> 6.4843750000000044 | V655: =RC[-7]*RC[-4] -> -119.60069444444453 | W655: =RC[-7]*RC[-5] -> 252.45833333333351 | X655: =RC[-7]*RC[-6] -> 1.5850694444444291 | Y655: =RC[-12]*RC[-12] -> 3.8350694444444695E-4 | Z655: =RC[-12]*RC[-12] -> 3.515625 | AA655: =RC[-12]*RC[-12] -> 1196.0069444444446 | AB655: =RC[-12]*RC[-12] -> 5329 | AC655: =RC[-12]*RC[-12] -> 0.21006944444444009 | AD655: =RC[-12]*RC[-12] -> 11.960069444444461 | AE655: =RC[-11]/SQRT(RC[-6]*RC[-1]) -> 1 | AF655: =RC[-11]/SQRT(RC[-6]*RC[-2]) -> 1 | AG655: =RC[-11]/SQRT(RC[-6]*RC[-3]) -> -1 | AH655: =RC[-11]/SQRT(RC[-6]*RC[-4]) -> 1 | AI655: =RC[-11]/SQRT(RC[-6]*RC[-5]) -> 1
A656: 49234 | B656: 北京 | C656: 52 | D656: 良 | E656: 0.78 | F656: 6 | G656: 70 | H656: 15 | I656: 78 | J656: 42 | L656: 2013-06-18T05:00:00.000 | M656: =RC[-8]-R[19]C[-8] -> 4.0416666666666656E-2 | N656: =RC[-8]-R[19]C[-8] -> -1.875 | O656: =RC[-8]-R[19]C[-8] -> 11.583333333333336 | P656: =RC[-8]-R[19]C[-8] -> -76 | Q656: =RC[-8]-R[19]C[-8] -> 2.5416666666666714 | R656: =RC[-8]-R[19]C[-8] -> 0.5416666666666643 | T656: =RC[-7]*RC[-2] -> 2.1892361111111008E-2 | U656: =RC[-7]*RC[-3] -> -1.0156249999999956 | V656: =RC[-7]*RC[-4] -> 6.2743055555555296 | W656: =RC[-7]*RC[-5] -> -41.166666666666487 | X656: =RC[-7]*RC[-6] -> 1.3767361111111076 | Y656: =RC[-12]*RC[-12] -> 1.6335069444444435E-3 | Z656: =RC[-12]*RC[-12] -> 3.515625 | AA656: =RC[-12]*RC[-12] -> 134.17361111111117 | AB656: =RC[-12]*RC[-12] -> 5776 | AC656: =RC[-12]*RC[-12] -> 6.4600694444444686 | AD656: =RC[-12]*RC[-12] -> 0.29340277777777524 | AE656: =RC[-11]/SQRT(RC[-6]*RC[-1]) -> 0.99999999999999989 | AF656: =RC[-11]/SQRT(RC[-6]*RC[-2]) -> -1 | AG656: =RC[-11]/SQRT(RC[-6]*RC[-3]) -> 1 | AH656: =RC[-11]/SQRT(RC[-6]*RC[-4]) -> -1 | AI656: =RC[-11]/SQRT(RC[-6]*RC[-5]) -> 0.99999999999999989
A657: 49310 | B657: 北京 | C657: 53 | D657: 良 | E657: 0.82 | F657: 5 | G657: 61 | H657: 20 | I657: 73 | J657: 44 | L657: 2013-06-18T06:00:00.000 | M657: =RC[-8]-R[18]C[-8] -> 8.0416666666666581E-2 | N657: =RC[-8]-R[18]C[-8] -> -2.875 | O657: =RC[-8]-R[18]C[-8] -> 2.5833333333333357 | P657: =RC[-8]-R[18]C[-8] -> -71 | Q657: =RC[-8]-R[18]C[-8] -> -2.4583333333333286 | R657: =RC[-8]-R[18]C[-8] -> 2.5416666666666643 | T657: =RC[-7]*RC[-2] -> 0.2043923611111107 | U657: =RC[-7]*RC[-3] -> -7.3072916666666599 | V657: =RC[-7]*RC[-4] -> 6.5659722222222223 | W657: =RC[-7]*RC[-5] -> -180.45833333333317 | X657: =RC[-7]*RC[-6] -> -6.2482638888888706 | Y657: =RC[-12]*RC[-12] -> 6.4668402777777641E-3 | Z657: =RC[-12]*RC[-12] -> 8.265625 | AA657: =RC[-12]*RC[-12] -> 6.6736111111111232 | AB657: =RC[-12]*RC[-12] -> 5041 | AC657: =RC[-12]*RC[-12] -> 6.0434027777777546 | AD657: =RC[-12]*RC[-12] -> 6.4600694444444322 | AE657: =RC[-11]/SQRT(RC[-6]*RC[-1]) -> 1 | AF657: =RC[-11]/SQRT(RC[-6]*RC[-2]) -> -1 | AG657: =RC[-11]/SQRT(RC[-6]*RC[-3]) -> 1.0000000000000002 | AH657: =RC[-11]/SQRT(RC[-6]*RC[-4]) -> -1 | AI657: =RC[-11]/SQRT(RC[-6]*RC[-5]) -> -1
A658: 49386 | B658: 北京 | C658: 53 | D658: 良 | E658: 0.85 | F658: 8 | G658: 68 | H658: 21 | I658: 77 | J658: 49 | L658: 2013-06-18T07:00:00.000 | M658: =RC[-8]-R[17]C[-8] -> 0.11041666666666661 | N658: =RC[-8]-R[17]C[-8] -> 0.125 | O658: =RC[-8]-R[17]C[-8] -> 9.5833333333333357 | P658: =RC[-8]-R[17]C[-8] -> -70 | Q658: =RC[-8]-R[17]C[-8] -> 1.5416666666666714 | R658: =RC[-8]-R[17]C[-8] -> 7.5416666666666643 | T658: =RC[-7]*RC[-2] -> 0.83272569444444378 | U658: =RC[-7]*RC[-3] -> 0.94270833333333304 | V658: =RC[-7]*RC[-4] -> 72.274305555555557 | W658: =RC[-7]*RC[-5] -> -527.91666666666652 | X658: =RC[-7]*RC[-6] -> 11.626736111111143 | Y658: =RC[-12]*RC[-12] -> 1.2191840277777765E-2 | Z658: =RC[-12]*RC[-12] -> 1.5625E-2 | AA658: =RC[-12]*RC[-12] -> 91.840277777777828 | AB658: =RC[-12]*RC[-12] -> 4900 | AC658: =RC[-12]*RC[-12] -> 2.3767361111111258 | AD658: =RC[-12]*RC[-12] -> 56.876736111111079 | AE658: =RC[-11]/SQRT(RC[-6]*RC[-1]) -> 1 | AF658: =RC[-11]/SQRT(RC[-6]*RC[-2]) -> 1 | AG658: =RC[-11]/SQRT(RC[-6]*RC[-3]) -> 1 | AH658: =RC[-11]/SQRT(RC[-6]*RC[-4]) -> -1 | AI658: =RC[-11]/SQRT(RC[-6]*RC[-5]) -> 0.99999999999999989
A659: 49462 | B659: 北京 | C659: 53 | D659: 良 | E659: 0.72 | F659: 9 | G659: 56 | H659: 45 | I659: 70 | J659: 48 | L659: 2013-06-18T08:00:00.000 | M659: =RC[-8]-R[16]C[-8] -> -1.9583333333333397E-2 | N659: =RC[-8]-R[16]C[-8] -> 1.125 | O659: =RC[-8]-R[16]C[-8] -> -2.4166666666666643 | P659: =RC[-8]-R[16]C[-8] -> -46 | Q659: =RC[-8]-R[16]C[-8] -> -5.4583333333333286 | R659: =RC[-8]-R[16]C[-8] -> 6.5416666666666643 | T659: =RC[-7]*RC[-2] -> -0.12810763888888926 | U659: =RC[-7]*RC[-3] -> 7.3593749999999973 | V659: =RC[-7]*RC[-4] -> -15.809027777777757 | W659: =RC[-7]*RC[-5] -> -300.91666666666657 | X659: =RC[-7]*RC[-6] -> -35.706597222222179 | Y659: =RC[-12]*RC[-12] -> 3.8350694444444695E-4 | Z659: =RC[-12]*RC[-12] -> 1.265625 | AA659: =RC[-12]*RC[-12] -> 5.8402777777777661 | AB659: =RC[-12]*RC[-12] -> 2116 | AC659: =RC[-12]*RC[-12] -> 29.793402777777725 | AD659: =RC[-12]*RC[-12] -> 42.79340277777775 | AE659: =RC[-11]/SQRT(RC[-6]*RC[-1]) -> -1 | AF659: =RC[-11]/SQRT(RC[-6]*RC[-2]) -> 1 | AG659: =RC[-11]/SQRT(RC[-6]*RC[-3]) -> -1 | AH659: =RC[-11]/SQRT(RC[-6]*RC[-4]) -> -1 | AI659: =RC[-11]/SQRT(RC[-6]*RC[-5]) -> -1
A660: 49538 | B660: 北京 | C660: 58 | D660: 良 | E660: 0.74 | F660: 10 | G660: 65 | H660: 69 | I660: 73 | J660: 41 | L660: 2013-06-18T09:00:00.000 | M660: =RC[-8]-R[15]C[-8] -> 4.1666666666662078E-4 | N660: =RC[-8]-R[15]C[-8] -> 2.125 | O660: =RC[-8]-R[15]C[-8] -> 6.5833333333333357 | P660: =RC[-8]-R[15]C[-8] -> -22 | Q660: =RC[-8]-R[15]C[-8] -> -2.4583333333333286 | R660: =RC[-8]-R[15]C[-8] -> -0.4583333333333357 | T660: =RC[-7]*RC[-2] -> -1.9097222222220217E-4 | U660: =RC[-7]*RC[-3] -> -0.97395833333333837 | V660: =RC[-7]*RC[-4] -> -3.0173611111111276 | W660: =RC[-7]*RC[-5] -> 10.083333333333385 | X660: =RC[-7]*RC[-6] -> 1.1267361111111147 | Y660: =RC[-12]*RC[-12] -> 1.7361111111107287E-7 | Z660: =RC[-12]*RC[-12] -> 4.515625 | AA660: =RC[-12]*RC[-12] -> 43.340277777777807 | AB660: =RC[-12]*RC[-12] -> 484 | AC660: =RC[-12]*RC[-12] -> 6.0434027777777546 | AD660: =RC[-12]*RC[-12] -> 0.21006944444444661 | AE660: =RC[-11]/SQRT(RC[-6]*RC[-1]) -> -1 | AF660: =RC[-11]/SQRT(RC[-6]*RC[-2]) -> -1 | AG660: =RC[-11]/SQRT(RC[-6]*RC[-3]) -> -1 | AH660: =RC[-11]/SQRT(RC[-6]*RC[-4]) -> 1 | AI660: =RC[-11]/SQRT(RC[-6]*RC[-5]) -> 1
A661: 49614 | B661: 北京 | C661: 60 | D661: 良 | E661: 0.75 | F661: 10 | G661: 57 | H661: 99 | I661: 72 | J661: 48 | L661: 2013-06-18T10:00:00.000 | M661: =RC[-8]-R[14]C[-8] -> 1.041666666666663E-2 | N661: =RC[-8]-R[14]C[-8] -> 2.125 | O661: =RC[-8]-R[14]C[-8] -> -1.4166666666666643 | P661: =RC[-8]-R[14]C[-8] -> 8 | Q661: =RC[-8]-R[14]C[-8] -> -3.4583333333333286 | R661: =RC[-8]-R[14]C[-8] -> 6.5416666666666643 | T661: =RC[-7]*RC[-2] -> 6.8142361111110841E-2 | U661: =RC[-7]*RC[-3] -> 13.901041666666661 | V661: =RC[-7]*RC[-4] -> -9.267361111111093 | W661: =RC[-7]*RC[-5] -> 52.333333333333314 | X661: =RC[-7]*RC[-6] -> -22.62326388888885 | Y661: =RC[-12]*RC[-12] -> 1.0850694444444368E-4 | Z661: =RC[-12]*RC[-12] -> 4.515625 | AA661: =RC[-12]*RC[-12] -> 2.0069444444444375 | AB661: =RC[-12]*RC[-12] -> 64 | AC661: =RC[-12]*RC[-12] -> 11.960069444444411 | AD661: =RC[-12]*RC[-12] -> 42.79340277777775 | AE661: =RC[-11]/SQRT(RC[-6]*RC[-1]) -> 1 | AF661: =RC[-11]/SQRT(RC[-6]*RC[-2]) -> 0.99999999999999989 | AG661: =RC[-11]/SQRT(RC[-6]*RC[-3]) -> -1.0000000000000002 | AH661: =RC[-11]/SQRT(RC[-6]*RC[-4]) -> 1 | AI661: =RC[-11]/SQRT(RC[-6]*RC[-5]) -> -1
A662: 49690 | B662: 北京 | C662: 63 | D662: 良 | E662: 0.74 | F662: 8 | G662: 48 | H662: 127 | I662: 64 | J662: 42 | L662: 2013-06-18T11:00:00.000 | M662: =RC[-8]-R[13]C[-8] -> 4.1666666666662078E-4 | N662: =RC[-8]-R[13]C[-8] -> 0.125 | O662: =RC[-8]-R[13]C[-8] -> -10.416666666666664 | P662: =RC[-8]-R[13]C[-8] -> 36 | Q662: =RC[-8]-R[13]C[-8] -> -11.458333333333329 | R662: =RC[-8]-R[13]C[-8] -> 0.5416666666666643 | T662: =RC[-7]*RC[-2] -> 2.256944444444186E-4 | U662: =RC[-7]*RC[-3] -> 6.7708333333333037E-2 | V662: =RC[-7]*RC[-4] -> -5.642361111111085 | W662: =RC[-7]*RC[-5] -> 19.499999999999915 | X662: =RC[-7]*RC[-6] -> -6.2065972222221921 | Y662: =RC[-12]*RC[-12] -> 1.7361111111107287E-7 | Z662: =RC[-12]*RC[-12] -> 1.5625E-2 | AA662: =RC[-12]*RC[-12] -> 108.5069444444444 | AB662: =RC[-12]*RC[-12] -> 1296 | AC662: =RC[-12]*RC[-12] -> 131.29340277777766 | AD662: =RC[-12]*RC[-12] -> 0.29340277777777524 | AE662: =RC[-11]/SQRT(RC[-6]*RC[-1]) -> 1 | AF662: =RC[-11]/SQRT(RC[-6]*RC[-2]) -> 1 | AG662: =RC[-11]/SQRT(RC[-6]*RC[-3]) -> -0.99999999999999989 | AH662: =RC[-11]/SQRT(RC[-6]*RC[-4]) -> 1 | AI662: =RC[-11]/SQRT(RC[-6]*RC[-5]) -> -0.99999999999999989
A663: 49766 | B663: 北京 | C663: 65 | D663: 良 | E663: 0.62 | F663: 7 | G663: 34 | H663: 135 | I663: 47 | J663: 31 | L663: 2013-06-18T12:00:00.000 | M663: =RC[-8]-R[12]C[-8] -> -0.11958333333333337 | N663: =RC[-8]-R[12]C[-8] -> -0.875 | O663: =RC[-8]-R[12]C[-8] -> -24.416666666666664 | P663: =RC[-8]-R[12]C[-8] -> 44 | Q663: =RC[-8]-R[12]C[-8] -> -28.458333333333329 | R663: =RC[-8]-R[12]C[-8] -> -10.458333333333336 | T663: =RC[-7]*RC[-2] -> 1.2506423611111119 | U663: =RC[-7]*RC[-3] -> 9.1510416666666679 | V663: =RC[-7]*RC[-4] -> 255.35763888888891 | W663: =RC[-7]*RC[-5] -> -460.16666666666674 | X663: =RC[-7]*RC[-6] -> 297.62673611111114 | Y663: =RC[-12]*RC[-12] -> 1.4300173611111121E-2 | Z663: =RC[-12]*RC[-12] -> 0.765625 | AA663: =RC[-12]*RC[-12] -> 596.17361111111097 | AB663: =RC[-12]*RC[-12] -> 1936 | AC663: =RC[-12]*RC[-12] -> 809.87673611111086 | AD663: =RC[-12]*RC[-12] -> 109.37673611111116 | AE663: =RC[-11]/SQRT(RC[-6]*RC[-1]) -> 1.0000000000000002 | AF663: =RC[-11]/SQRT(RC[-6]*RC[-2]) -> 0.99999999999999978 | AG663: =RC[-11]/SQRT(RC[-6]*RC[-3]) -> 1 | AH663: =RC[-11]/SQRT(RC[-6]*RC[-4]) -> -0.99999999999999989 | AI663: =RC[-11]/SQRT(RC[-6]*RC[-5]) -> 1
A664: 49842 | B664: 北京 | C664: 67 | D664: 良 | E664: 0.63 | F664: 7 | G664: 36 | H664: 155 | I664: 49 | J664: 34 | L664: 2013-06-18T13:00:00.000 | M664: =RC[-8]-R[11]C[-8] -> -0.10958333333333337 | N664: =RC[-8]-R[11]C[-8] -> -0.875 | O664: =RC[-8]-R[11]C[-8] -> -22.416666666666664 | P664: =RC[-8]-R[11]C[-8] -> 64 | Q664: =RC[-8]-R[11]C[-8] -> -26.458333333333329 | R664: =RC[-8]-R[11]C[-8] -> -7.4583333333333357 | T664: =RC[-7]*RC[-2] -> 0.81730902777777825 | U664: =RC[-7]*RC[-3] -> 6.5260416666666687 | V664: =RC[-7]*RC[-4] -> 167.19097222222226 | W664: =RC[-7]*RC[-5] -> -477.33333333333348 | X664: =RC[-7]*RC[-6] -> 197.33506944444449 | Y664: =RC[-12]*RC[-12] -> 1.2008506944444452E-2 | Z664: =RC[-12]*RC[-12] -> 0.765625 | AA664: =RC[-12]*RC[-12] -> 502.50694444444434 | AB664: =RC[-12]*RC[-12] -> 4096 | AC664: =RC[-12]*RC[-12] -> 700.04340277777749 | AD664: =RC[-12]*RC[-12] -> 55.62673611111115 | AE664: =RC[-11]/SQRT(RC[-6]*RC[-1]) -> 0.99999999999999989 | AF664: =RC[-11]/SQRT(RC[-6]*RC[-2]) -> 1 | AG664: =RC[-11]/SQRT(RC[-6]*RC[-3]) -> 1 | AH664: =RC[-11]/SQRT(RC[-6]*RC[-4]) -> -1 | AI664: =RC[-11]/SQRT(RC[-6]*RC[-5]) -> 1
A665: 49918 | B665: 北京 | C665: 69 | D665: 良 | E665: 0.6 | F665: 7 | G665: 35 | H665: 159 | I665: 50 | J665: 31 | L665: 2013-06-18T14:00:00.000 | M665: =RC[-8]-R[10]C[-8] -> -0.13958333333333339 | N665: =RC[-8]-R[10]C[-8] -> -0.875 | O665: =RC[-8]-R[10]C[-8] -> -23.416666666666664 | P665: =RC[-8]-R[10]C[-8] -> 68 | Q665: =RC[-8]-R[10]C[-8] -> -25.458333333333329 | R665: =RC[-8]-R[10]C[-8] -> -10.458333333333336 | T665: =RC[-7]*RC[-2] -> 1.4598090277777787 | U665: =RC[-7]*RC[-3] -> 9.1510416666666679 | V665: =RC[-7]*RC[-4] -> 244.8993055555556 | W665: =RC[-7]*RC[-5] -> -711.16666666666686 | X665: =RC[-7]*RC[-6] -> 266.25173611111114 | Y665: =RC[-12]*RC[-12] -> 1.9483506944444461E-2 | Z665: =RC[-12]*RC[-12] -> 0.765625 | AA665: =RC[-12]*RC[-12] -> 548.34027777777771 | AB665: =RC[-12]*RC[-12] -> 4624 | AC665: =RC[-12]*RC[-12] -> 648.12673611111086 | AD665: =RC[-12]*RC[-12] -> 109.37673611111116 | AE665: =RC[-11]/SQRT(RC[-6]*RC[-1]) -> 1 | AF665: =RC[-11]/SQRT(RC[-6]*RC[-2]) -> 0.99999999999999978 | AG665: =RC[-11]/SQRT(RC[-6]*RC[-3]) -> 1 | AH665: =RC[-11]/SQRT(RC[-6]*RC[-4]) -> -1 | AI665: =RC[-11]/SQRT(RC[-6]*RC[-5]) -> 1
A666: 49994 | B666: 北京 | C666: 72 | D666: 良 | E666: 0.64 | F666: 7 | G666: 34 | H666: 163 | I666: 61 | J666: 35 | L666: 2013-06-18T15:00:00.000 | M666: =RC[-8]-R[9]C[-8] -> -9.9583333333333357E-2 | N666: =RC[-8]-R[9]C[-8] -> -0.875 | O666: =RC[-8]-R[9]C[-8] -> -24.416666666666664 | P666: =RC[-8]-R[9]C[-8] -> 72 | Q666: =RC[-8]-R[9]C[-8] -> -14.458333333333329 | R666: =RC[-8]-R[9]C[-8] -> -6.4583333333333357 | T666: =RC[-7]*RC[-2] -> 0.64314236111111145 | U666: =RC[-7]*RC[-3] -> 5.6510416666666687 | V666: =RC[-7]*RC[-4] -> 157.69097222222226 | W666: =RC[-7]*RC[-5] -> -465.00000000000017 | X666: =RC[-7]*RC[-6] -> 93.376736111111114 | Y666: =RC[-12]*RC[-12] -> 9.9168402777777831E-3 | Z666: =RC[-12]*RC[-12] -> 0.765625 | AA666: =RC[-12]*RC[-12] -> 596.17361111111097 | AB666: =RC[-12]*RC[-12] -> 5184 | AC666: =RC[-12]*RC[-12] -> 209.04340277777763 | AD666: =RC[-12]*RC[-12] -> 41.710069444444478 | AE666: =RC[-11]/SQRT(RC[-6]*RC[-1]) -> 0.99999999999999978 | AF666: =RC[-11]/SQRT(RC[-6]*RC[-2]) -> 1 | AG666: =RC[-11]/SQRT(RC[-6]*RC[-3]) -> 1 | AH666: =RC[-11]/SQRT(RC[-6]*RC[-4]) -> -1 | AI666: =RC[-11]/SQRT(RC[-6]*RC[-5]) -> 1
A667: 50070 | B667: 北京 | C667: 82 | D667: 良 | E667: 0.63 | F667: 8 | G667: 37 | H667: 165 | I667: 63 | J667: 32 | L667: 2013-06-18T16:00:00.000 | M667: =RC[-8]-R[8]C[-8] -> -0.10958333333333337 | N667: =RC[-8]-R[8]C[-8] -> 0.125 | O667: =RC[-8]-R[8]C[-8] -> -21.416666666666664 | P667: =RC[-8]-R[8]C[-8] -> 74 | Q667: =RC[-8]-R[8]C[-8] -> -12.458333333333329 | R667: =RC[-8]-R[8]C[-8] -> -9.4583333333333357 | T667: =RC[-7]*RC[-2] -> 1.0364756944444451 | U667: =RC[-7]*RC[-3] -> -1.182291666666667 | V667: =RC[-7]*RC[-4] -> 202.56597222222226 | W667: =RC[-7]*RC[-5] -> -699.91666666666686 | X667: =RC[-7]*RC[-6] -> 117.83506944444443 | Y667: =RC[-12]*RC[-12] -> 1.2008506944444452E-2 | Z667: =RC[-12]*RC[-12] -> 1.5625E-2 | AA667: =RC[-12]*RC[-12] -> 458.67361111111103 | AB667: =RC[-12]*RC[-12] -> 5476 | AC667: =RC[-12]*RC[-12] -> 155.21006944444431 | AD667: =RC[-12]*RC[-12] -> 89.460069444444485 | AE667: =RC[-11]/SQRT(RC[-6]*RC[-1]) -> 1 | AF667: =RC[-11]/SQRT(RC[-6]*RC[-2]) -> -1 | AG667: =RC[-11]/SQRT(RC[-6]*RC[-3]) -> 1 | AH667: =RC[-11]/SQRT(RC[-6]*RC[-4]) -> -1 | AI667: =RC[-11]/SQRT(RC[-6]*RC[-5]) -> 1
A668: 50146 | B668: 北京 | C668: 91 | D668: 良 | E668: 0.63 | F668: 8 | G668: 41 | H668: 169 | I668: 77 | J668: 34 | L668: 2013-06-18T17:00:00.000 | M668: =RC[-8]-R[7]C[-8] -> -0.10958333333333337 | N668: =RC[-8]-R[7]C[-8] -> 0.125 | O668: =RC[-8]-R[7]C[-8] -> -17.416666666666664 | P668: =RC[-8]-R[7]C[-8] -> 78 | Q668: =RC[-8]-R[7]C[-8] -> 1.5416666666666714 | R668: =RC[-8]-R[7]C[-8] -> -7.4583333333333357 | T668: =RC[-7]*RC[-2] -> 0.81730902777777825 | U668: =RC[-7]*RC[-3] -> -0.93229166666666696 | V668: =RC[-7]*RC[-4] -> 129.89930555555557 | W668: =RC[-7]*RC[-5] -> -581.75000000000023 | X668: =RC[-7]*RC[-6] -> -11.498263888888928 | Y668: =RC[-12]*RC[-12] -> 1.2008506944444452E-2 | Z668: =RC[-12]*RC[-12] -> 1.5625E-2 | AA668: =RC[-12]*RC[-12] -> 303.34027777777771 | AB668: =RC[-12]*RC[-12] -> 6084 | AC668: =RC[-12]*RC[-12] -> 2.3767361111111258 | AD668: =RC[-12]*RC[-12] -> 55.62673611111115 | AE668: =RC[-11]/SQRT(RC[-6]*RC[-1]) -> 0.99999999999999989 | AF668: =RC[-11]/SQRT(RC[-6]*RC[-2]) -> -1 | AG668: =RC[-11]/SQRT(RC[-6]*RC[-3]) -> 1 | AH668: =RC[-11]/SQRT(RC[-6]*RC[-4]) -> -1 | AI668: =RC[-11]/SQRT(RC[-6]*RC[-5]) -> -1
A669: 50222 | B669: 北京 | C669: 100 | D669: 良 | E669: 0.66 | F669: 8 | G669: 49 | H669: 166 | I669: 76 | J669: 36 | L669: 2013-06-18T18:00:00.000 | M669: =RC[-8]-R[6]C[-8] -> -7.9583333333333339E-2 | N669: =RC[-8]-R[6]C[-8] -> 0.125 | O669: =RC[-8]-R[6]C[-8] -> -9.4166666666666643 | P669: =RC[-8]-R[6]C[-8] -> 75 | Q669: =RC[-8]-R[6]C[-8] -> 0.5416666666666714 | R669: =RC[-8]-R[6]C[-8] -> -5.4583333333333357 | T669: =RC[-7]*RC[-2] -> 0.43439236111111135 | U669: =RC[-7]*RC[-3] -> -0.68229166666666696 | V669: =RC[-7]*RC[-4] -> 51.399305555555564 | W669: =RC[-7]*RC[-5] -> -409.37500000000017 | X669: =RC[-7]*RC[-6] -> -2.9565972222222494 | Y669: =RC[-12]*RC[-12] -> 6.3335069444444454E-3 | Z669: =RC[-12]*RC[-12] -> 1.5625E-2 | AA669: =RC[-12]*RC[-12] -> 88.673611111111072 | AB669: =RC[-12]*RC[-12] -> 5625 | AC669: =RC[-12]*RC[-12] -> 0.2934027777777829 | AD669: =RC[-12]*RC[-12] -> 29.793402777777803 | AE669: =RC[-11]/SQRT(RC[-6]*RC[-1]) -> 1 | AF669: =RC[-11]/SQRT(RC[-6]*RC[-2]) -> -1 | AG669: =RC[-11]/SQRT(RC[-6]*RC[-3]) -> 1 | AH669: =RC[-11]/SQRT(RC[-6]*RC[-4]) -> -1 | AI669: =RC[-11]/SQRT(RC[-6]*RC[-5]) -> -1
A670: 50298 | B670: 北京 | C670: 101 | D670: 轻度污染 | E670: 0.62 | F670: 8 | G670: 53 | H670: 145 | I670: 75 | J670: 34 | L670: 2013-06-18T19:00:00.000 | M670: =RC[-8]-R[5]C[-8] -> -0.11958333333333337 | N670: =RC[-8]-R[5]C[-8] -> 0.125 | O670: =RC[-8]-R[5]C[-8] -> -5.4166666666666643 | P670: =RC[-8]-R[5]C[-8] -> 54 | Q670: =RC[-8]-R[5]C[-8] -> -0.4583333333333286 | R670: =RC[-8]-R[5]C[-8] -> -7.4583333333333357 | T670: =RC[-7]*RC[-2] -> 0.8918923611111117 | U670: =RC[-7]*RC[-3] -> -0.93229166666666696 | V670: =RC[-7]*RC[-4] -> 40.39930555555555 | W670: =RC[-7]*RC[-5] -> -402.75000000000011 | X670: =RC[-7]*RC[-6] -> 3.4184027777777435 | Y670: =RC[-12]*RC[-12] -> 1.4300173611111121E-2 | Z670: =RC[-12]*RC[-12] -> 1.5625E-2 | AA670: =RC[-12]*RC[-12] -> 29.340277777777754 | AB670: =RC[-12]*RC[-12] -> 2916 | AC670: =RC[-12]*RC[-12] -> 0.21006944444444009 | AD670: =RC[-12]*RC[-12] -> 55.62673611111115 | AE670: =RC[-11]/SQRT(RC[-6]*RC[-1]) -> 1 | AF670: =RC[-11]/SQRT(RC[-6]*RC[-2]) -> -1 | AG670: =RC[-11]/SQRT(RC[-6]*RC[-3]) -> 1 | AH670: =RC[-11]/SQRT(RC[-6]*RC[-4]) -> -0.99999999999999989 | AI670: =RC[-11]/SQRT(RC[-6]*RC[-5]) -> 1
A671: 50374 | B671: 北京 | C671: 98 | D671: 良 | E671: 0.7 | F671: 7 | G671: 60 | H671: 125 | I671: 93 | J671: 36 | L671: 2013-06-18T20:00:00.000 | M671: =RC[-8]-R[4]C[-8] -> -3.9583333333333415E-2 | N671: =RC[-8]-R[4]C[-8] -> -0.875 | O671: =RC[-8]-R[4]C[-8] -> 1.5833333333333357 | P671: =RC[-8]-R[4]C[-8] -> 34 | Q671: =RC[-8]-R[4]C[-8] -> 17.541666666666671 | R671: =RC[-8]-R[4]C[-8] -> -5.4583333333333357 | T671: =RC[-7]*RC[-2] -> 0.21605902777777833 | U671: =RC[-7]*RC[-3] -> 4.7760416666666687 | V671: =RC[-7]*RC[-4] -> -8.6423611111111285 | W671: =RC[-7]*RC[-5] -> -185.58333333333343 | X671: =RC[-7]*RC[-6] -> -95.748263888888957 | Y671: =RC[-12]*RC[-12] -> 1.5668402777777842E-3 | Z671: =RC[-12]*RC[-12] -> 0.765625 | AA671: =RC[-12]*RC[-12] -> 2.5069444444444517 | AB671: =RC[-12]*RC[-12] -> 1156 | AC671: =RC[-12]*RC[-12] -> 307.71006944444463 | AD671: =RC[-12]*RC[-12] -> 29.793402777777803 | AE671: =RC[-11]/SQRT(RC[-6]*RC[-1]) -> 1 | AF671: =RC[-11]/SQRT(RC[-6]*RC[-2]) -> 1 | AG671: =RC[-11]/SQRT(RC[-6]*RC[-3]) -> -1.0000000000000002 | AH671: =RC[-11]/SQRT(RC[-6]*RC[-4]) -> -1.0000000000000002 | AI671: =RC[-11]/SQRT(RC[-6]*RC[-5]) -> -1
A672: 50450 | B672: 北京 | C672: 92 | D672: 良 | E672: 0.77 | F672: 8 | G672: 70 | H672: 103 | I672: 101 | J672: 44 | L672: 2013-06-18T21:00:00.000 | M672: =RC[-8]-R[3]C[-8] -> 3.0416666666666647E-2 | N672: =RC[-8]-R[3]C[-8] -> 0.125 | O672: =RC[-8]-R[3]C[-8] -> 11.583333333333336 | P672: =RC[-8]-R[3]C[-8] -> 12 | Q672: =RC[-8]-R[3]C[-8] -> 25.541666666666671 | R672: =RC[-8]-R[3]C[-8] -> 2.5416666666666643 | T672: =RC[-7]*RC[-2] -> 7.730902777777765E-2 | U672: =RC[-7]*RC[-3] -> 0.31770833333333304 | V672: =RC[-7]*RC[-4] -> 29.4409722222222 | W672: =RC[-7]*RC[-5] -> 30.499999999999972 | X672: =RC[-7]*RC[-6] -> 64.918402777777729 | Y672: =RC[-12]*RC[-12] -> 9.251736111111099E-4 | Z672: =RC[-12]*RC[-12] -> 1.5625E-2 | AA672: =RC[-12]*RC[-12] -> 134.17361111111117 | AB672: =RC[-12]*RC[-12] -> 144 | AC672: =RC[-12]*RC[-12] -> 652.37673611111131 | AD672: =RC[-12]*RC[-12] -> 6.4600694444444322 | AE672: =RC[-11]/SQRT(RC[-6]*RC[-1]) -> 1 | AF672: =RC[-11]/SQRT(RC[-6]*RC[-2]) -> 1 | AG672: =RC[-11]/SQRT(RC[-6]*RC[-3]) -> 1 | AH672: =RC[-11]/SQRT(RC[-6]*RC[-4]) -> 1 | AI672: =RC[-11]/SQRT(RC[-6]*RC[-5]) -> 1
A673: 50526 | B673: 北京 | C673: 84 | D673: 良 | E673: 0.79 | F673: 9 | G673: 54 | H673: 88 | I673: 107 | J673: 50 | L673: 2013-06-18T22:00:00.000 | M673: =RC[-8]-R[2]C[-8] -> 5.0416666666666665E-2 | N673: =RC[-8]-R[2]C[-8] -> 1.125 | O673: =RC[-8]-R[2]C[-8] -> -4.4166666666666643 | P673: =RC[-8]-R[2]C[-8] -> -3 | Q673: =RC[-8]-R[2]C[-8] -> 31.541666666666671 | R673: =RC[-8]-R[2]C[-8] -> 8.5416666666666643 | T673: =RC[-7]*RC[-2] -> 0.43064236111111098 | U673: =RC[-7]*RC[-3] -> 9.6093749999999964 | V673: =RC[-7]*RC[-4] -> -37.725694444444414 | W673: =RC[-7]*RC[-5] -> -25.624999999999993 | X673: =RC[-7]*RC[-6] -> 269.41840277777777 | Y673: =RC[-12]*RC[-12] -> 2.5418402777777774E-3 | Z673: =RC[-12]*RC[-12] -> 1.265625 | AA673: =RC[-12]*RC[-12] -> 19.506944444444425 | AB673: =RC[-12]*RC[-12] -> 9 | AC673: =RC[-12]*RC[-12] -> 994.87673611111143 | AD673: =RC[-12]*RC[-12] -> 72.9600694444444 | AE673: =RC[-11]/SQRT(RC[-6]*RC[-1]) -> 1.0000000000000002 | AF673: =RC[-11]/SQRT(RC[-6]*RC[-2]) -> 1 | AG673: =RC[-11]/SQRT(RC[-6]*RC[-3]) -> -1 | AH673: =RC[-11]/SQRT(RC[-6]*RC[-4]) -> -1 | AI673: =RC[-11]/SQRT(RC[-6]*RC[-5]) -> 1.0000000000000002
A674: 50602 | B674: 北京 | C674: 78 | D674: 良 | E674: 0.84 | F674: 9 | G674: 74 | H674: 71 | I674: 147 | J674: 51 | L674: 2013-06-18T23:00:00.000 | M674: =RC[-8]-R[1]C[-8] -> 0.1004166666666666 | N674: =RC[-8]-R[1]C[-8] -> 1.125 | O674: =RC[-8]-R[1]C[-8] -> 15.583333333333336 | P674: =RC[-8]-R[1]C[-8] -> -20 | Q674: =RC[-8]-R[1]C[-8] -> 71.541666666666671 | R674: =RC[-8]-R[1]C[-8] -> 9.5416666666666643 | T674: =RC[-7]*RC[-2] -> 0.95814236111111017 | U674: =RC[-7]*RC[-3] -> 10.734374999999996 | V674: =RC[-7]*RC[-4] -> 148.6909722222222 | W674: =RC[-7]*RC[-5] -> -190.83333333333329 | X674: =RC[-7]*RC[-6] -> 682.62673611111097 | Y674: =RC[-12]*RC[-12] -> 1.0083506944444431E-2 | Z674: =RC[-12]*RC[-12] -> 1.265625 | AA674: =RC[-12]*RC[-12] -> 242.84027777777786 | AB674: =RC[-12]*RC[-12] -> 400 | AC674: =RC[-12]*RC[-12] -> 5118.2100694444453 | AD674: =RC[-12]*RC[-12] -> 91.043402777777729 | AE674: =RC[-11]/SQRT(RC[-6]*RC[-1]) -> 0.99999999999999989 | AF674: =RC[-11]/SQRT(RC[-6]*RC[-2]) -> 0.99999999999999989 | AG674: =RC[-11]/SQRT(RC[-6]*RC[-3]) -> 1 | AH674: =RC[-11]/SQRT(RC[-6]*RC[-4]) -> -1 | AI674: =RC[-11]/SQRT(RC[-6]*RC[-5]) -> 1
E675: =AVERAGE(R[-24]C:R[-1]C) -> 0.73958333333333337 | F675: =AVERAGE(R[-24]C:R[-1]C) -> 7.875 | G675: =AVERAGE(R[-24]C:R[-1]C) -> 58.416666666666664 | H675: =AVERAGE(R[-24]C:R[-1]C) -> 91 | I675: =AVERAGE(R[-24]C:R[-1]C) -> 75.458333333333329 | J675: =AVERAGE(R[-24]C:R[-1]C) -> 41.458333333333336 | M675: =RC[-8]-RC[-8] -> 0 | N675: =RC[-8]-RC[-8] -> 0 | O675: =RC[-8]-RC[-8] -> 0 | P675: =RC[-8]-RC[-8] -> 0 | Q675: =RC[-8]-RC[-8] -> 0 | R675: =RC[-8]-RC[-8] -> 0 | T675: =SUM(R[-24]C:R[-1]C) -> 14.844583333333333 | U675: =SUM(R[-24]C:R[-1]C) -> 97.374999999999986 | V675: =SUM(R[-24]C:R[-1]C) -> 1938.4166666666667 | W675: =SUM(R[-24]C:R[-1]C) -> -6953.9999999999991 | X675: =SUM(R[-24]C:R[-1]C) -> 1658.9583333333335 | Y675: =SUM(R[-24]C:R[-1]C) -> 0.22929583333333337 | Z675: =SUM(R[-24]C:R[-1]C) -> 44.625 | AA675: =SUM(R[-24]C:R[-1]C) -> 6787.8333333333339 | AB675: =SUM(R[-24]C:R[-1]C) -> 77164 | AC675: =SUM(R[-24]C:R[-1]C) -> 9953.9583333333339 | AD675: =SUM(R[-24]C:R[-1]C) -> 1155.9583333333337 | AE675: =RC[-11]/SQRT(RC[-6]*RC[-1]) -> 0.91179843088533186 | AF675: =RC[-11]/SQRT(RC[-6]*RC[-2]) -> 0.42873334864502088 | AG675: =RC[-11]/SQRT(RC[-6]*RC[-3]) -> 0.69200695612262808 | AH675: =RC[-11]/SQRT(RC[-6]*RC[-4]) -> -0.73630242375240207 | AI675: =RC[-11]/SQRT(RC[-6]*RC[-5]) -> 0.48906488224710609
A676: 50678 | B676: 北京 | C676: 71 | D676: 良 | E676: 1.2 | F676: 18 | G676: 48 | H676: 75 | I676: 116 | J676: 62 | L676: 2013-06-19T00:00:00.000 | M676: =RC[-8]-R[23]C[-8] -> 0.28956521739130425 | N676: =RC[-8]-R[23]C[-8] -> 8.2608695652173907 | O676: =RC[-8]-R[23]C[-8] -> 13.478260869565219 | P676: =RC[-8]-R[23]C[-8] -> -35.043478260869563 | Q676: =RC[-8]-R[23]C[-8] -> 42.695652173913047 | R676: =RC[-8]-R[23]C[-8] -> 17.826086956521742 | T676: =RC[-7]*RC[-2] -> 5.1618147448015117 | U676: =RC[-7]*RC[-3] -> 147.25897920604916 | V676: =RC[-7]*RC[-4] -> 240.26465028355395 | W676: =RC[-7]*RC[-5] -> -624.68809073724015 | X676: =RC[-7]*RC[-6] -> 761.09640831758054 | Y676: =RC[-12]*RC[-12] -> 8.3848015122873293E-2 | Z676: =RC[-12]*RC[-12] -> 68.24196597353496 | AA676: =RC[-12]*RC[-12] -> 181.66351606805296 | AB676: =RC[-12]*RC[-12] -> 1228.0453686200376 | AC676: =RC[-12]*RC[-12] -> 1822.9187145557657 | AD676: =RC[-12]*RC[-12] -> 317.76937618147457 | AE676: =RC[-11]/SQRT(RC[-6]*RC[-1]) -> 1 | AF676: =RC[-11]/SQRT(RC[-6]*RC[-2]) -> 1 | AG676: =RC[-11]/SQRT(RC[-6]*RC[-3]) -> 1.0000000000000002 | AH676: =RC[-11]/SQRT(RC[-6]*RC[-4]) -> -1 | AI676: =RC[-11]/SQRT(RC[-6]*RC[-5]) -> 1.0000000000000002
A677: 50754 | B677: 北京 | C677: 67 | D677: 良 | E677: 1.25 | F677: 15 | G677: 38 | H677: 77 | I677: 107 | J677: 69 | L677: 2013-06-19T01:00:00.000 | M677: =RC[-8]-R[22]C[-8] -> 0.3395652173913043 | N677: =RC[-8]-R[22]C[-8] -> 5.2608695652173907 | O677: =RC[-8]-R[22]C[-8] -> 3.4782608695652186 | P677: =RC[-8]-R[22]C[-8] -> -33.043478260869563 | Q677: =RC[-8]-R[22]C[-8] -> 33.695652173913047 | R677: =RC[-8]-R[22]C[-8] -> 24.826086956521742 | T677: =RC[-7]*RC[-2] -> 8.4300756143667286 | U677: =RC[-7]*RC[-3] -> 130.60680529300566 | V677: =RC[-7]*RC[-4] -> 86.351606805293045 | W677: =RC[-7]*RC[-5] -> -820.34026465028353 | X677: =RC[-7]*RC[-6] -> 836.53119092627617 | Y677: =RC[-12]*RC[-12] -> 0.11530453686200375 | Z677: =RC[-12]*RC[-12] -> 27.676748582230616 | AA677: =RC[-12]*RC[-12] -> 12.098298676748591 | AB677: =RC[-12]*RC[-12] -> 1091.8714555765594 | AC677: =RC[-12]*RC[-12] -> 1135.396975425331 | AD677: =RC[-12]*RC[-12] -> 616.334593572779 | AE677: =RC[-11]/SQRT(RC[-6]*RC[-1]) -> 1 | AF677: =RC[-11]/SQRT(RC[-6]*RC[-2]) -> 1 | AG677: =RC[-11]/SQRT(RC[-6]*RC[-3]) -> 1 | AH677: =RC[-11]/SQRT(RC[-6]*RC[-4]) -> -0.99999999999999989 | AI677: =RC[-11]/SQRT(RC[-6]*RC[-5]) -> 1
A678: 50830 | B678: 北京 | C678: 67 | D678: 良 | E678: 1.19 | F678: 10 | G678: 31 | H678: 83 | I678: 95 | J678: 57 | L678: 2013-06-19T02:00:00.000 | M678: =RC[-8]-R[21]C[-8] -> 0.27956521739130424 | N678: =RC[-8]-R[21]C[-8] -> 0.26086956521739069 | O678: =RC[-8]-R[21]C[-8] -> -3.5217391304347814 | P678: =RC[-8]-R[21]C[-8] -> -27.043478260869563 | Q678: =RC[-8]-R[21]C[-8] -> 21.695652173913047 | R678: =RC[-8]-R[21]C[-8] -> 12.826086956521742 | T678: =RC[-7]*RC[-2] -> 3.5857277882797725 | U678: =RC[-7]*RC[-3] -> 3.3459357277882726 | V678: =RC[-7]*RC[-4] -> -45.170132325141772 | W678: =RC[-7]*RC[-5] -> -346.8620037807184 | X678: =RC[-7]*RC[-6] -> 278.27032136105868 | Y678: =RC[-12]*RC[-12] -> 7.8156710775047197E-2 | Z678: =RC[-12]*RC[-12] -> 6.8052930056710453E-2 | AA678: =RC[-12]*RC[-12] -> 12.40264650283553 | AB678: =RC[-12]*RC[-12] -> 731.3497164461246 | AC678: =RC[-12]*RC[-12] -> 470.70132325141788 | AD678: =RC[-12]*RC[-12] -> 164.50850661625716 | AE678: =RC[-11]/SQRT(RC[-6]*RC[-1]) -> 1 | AF678: =RC[-11]/SQRT(RC[-6]*RC[-2]) -> 1 | AG678: =RC[-11]/SQRT(RC[-6]*RC[-3]) -> -1 | AH678: =RC[-11]/SQRT(RC[-6]*RC[-4]) -> -1 | AI678: =RC[-11]/SQRT(RC[-6]*RC[-5]) -> 1
A679: 50906 | B679: 北京 | C679: 67 | D679: 良 | E679: 1.24 | F679: 9 | G679: 31 | H679: 72 | I679: 72 | J679: 53 | L679: 2013-06-19T03:00:00.000 | M679: =RC[-8]-R[20]C[-8] -> 0.32956521739130429 | N679: =RC[-8]-R[20]C[-8] -> -0.73913043478260931 | O679: =RC[-8]-R[20]C[-8] -> -3.5217391304347814 | P679: =RC[-8]-R[20]C[-8] -> -38.043478260869563 | Q679: =RC[-8]-R[20]C[-8] -> -1.3043478260869534 | R679: =RC[-8]-R[20]C[-8] -> 8.8260869565217419 | T679: =RC[-7]*RC[-2] -> 2.9087712665406431 | U679: =RC[-7]*RC[-3] -> -6.5236294896030325 | V679: =RC[-7]*RC[-4] -> -31.083175803402646 | W679: =RC[-7]*RC[-5] -> -335.77504725897927 | X679: =RC[-7]*RC[-6] -> -11.51228733459355 | Y679: =RC[-12]*RC[-12] -> 0.10861323251417765 | Z679: =RC[-12]*RC[-12] -> 0.54631379962192905 | AA679: =RC[-12]*RC[-12] -> 12.40264650283553 | AB679: =RC[-12]*RC[-12] -> 1447.3062381852551 | AC679: =RC[-12]*RC[-12] -> 1.7013232514177614 | AD679: =RC[-12]*RC[-12] -> 77.89981096408323 | AE679: =RC[-11]/SQRT(RC[-6]*RC[-1]) -> 1 | AF679: =RC[-11]/SQRT(RC[-6]*RC[-2]) -> -1 | AG679: =RC[-11]/SQRT(RC[-6]*RC[-3]) -> -1 | AH679: =RC[-11]/SQRT(RC[-6]*RC[-4]) -> -0.99999999999999978 | AI679: =RC[-11]/SQRT(RC[-6]*RC[-5]) -> -1
A680: 50982 | B680: 北京 | C680: 67 | D680: 良 | E680: 1.1499999999999999 | F680: 7 | G680: 33 | H680: 53 | I680: 68 | J680: 57 | L680: 2013-06-19T04:00:00.000 | M680: =RC[-8]-R[2089]C[-8] -> 1.1499999999999999 | N680: =RC[-8]-R[2089]C[-8] -> 7 | O680: =RC[-8]-R[2089]C[-8] -> 33 | P680: =RC[-8]-R[2089]C[-8] -> 53 | Q680: =RC[-8]-R[2089]C[-8] -> 68 | R680: =RC[-8]-R[2089]C[-8] -> 57 | T680: =RC[-7]*RC[-2] -> 65.55 | U680: =RC[-7]*RC[-3] -> 399 | V680: =RC[-7]*RC[-4] -> 1881 | W680: =RC[-7]*RC[-5] -> 3021 | X680: =RC[-7]*RC[-6] -> 3876 | Y680: =RC[-12]*RC[-12] -> 1.3224999999999998 | Z680: =RC[-12]*RC[-12] -> 49 | AA680: =RC[-12]*RC[-12] -> 1089 | AB680: =RC[-12]*RC[-12] -> 2809 | AC680: =RC[-12]*RC[-12] -> 4624 | AD680: =RC[-12]*RC[-12] -> 3249 | AE680: =RC[-11]/SQRT(RC[-6]*RC[-1]) -> 1 | AF680: =RC[-11]/SQRT(RC[-6]*RC[-2]) -> 1 | AG680: =RC[-11]/SQRT(RC[-6]*RC[-3]) -> 1 | AH680: =RC[-11]/SQRT(RC[-6]*RC[-4]) -> 1 | AI680: =RC[-11]/SQRT(RC[-6]*RC[-5]) -> 1
A681: 51058 | B681: 北京 | C681: 67 | D681: 良 | E681: 1.25 | F681: 7 | G681: 40 | H681: 41 | I681: 83 | J681: 64 | L681: 2013-06-19T05:00:00.000 | M681: =RC[-8]-R[18]C[-8] -> 0.3395652173913043 | N681: =RC[-8]-R[18]C[-8] -> -2.7391304347826093 | O681: =RC[-8]-R[18]C[-8] -> 5.4782608695652186 | P681: =RC[-8]-R[18]C[-8] -> -69.043478260869563 | Q681: =RC[-8]-R[18]C[-8] -> 9.6956521739130466 | R681: =RC[-8]-R[18]C[-8] -> 19.826086956521742 | T681: =RC[-7]*RC[-2] -> 6.7322495274102074 | U681: =RC[-7]*RC[-3] -> -54.306238185255218 | V681: =RC[-7]*RC[-4] -> 108.61247637051044 | W681: =RC[-7]*RC[-5] -> -1368.8620037807184 | X681: =RC[-7]*RC[-6] -> 192.22684310018911 | Y681: =RC[-12]*RC[-12] -> 0.11530453686200375 | Z681: =RC[-12]*RC[-12] -> 7.5028355387523664 | AA681: =RC[-12]*RC[-12] -> 30.011342155009466 | AB681: =RC[-12]*RC[-12] -> 4767.0018903591681 | AC681: =RC[-12]*RC[-12] -> 94.005671077504786 | AD681: =RC[-12]*RC[-12] -> 393.07372400756157 | AE681: =RC[-11]/SQRT(RC[-6]*RC[-1]) -> 1 | AF681: =RC[-11]/SQRT(RC[-6]*RC[-2]) -> -1 | AG681: =RC[-11]/SQRT(RC[-6]*RC[-3]) -> 1 | AH681: =RC[-11]/SQRT(RC[-6]*RC[-4]) -> -0.99999999999999989 | AI681: =RC[-11]/SQRT(RC[-6]*RC[-5]) -> 1
A682: 51134 | B682: 北京 | C682: 68 | D682: 良 | E682: 1.41 | F682: 8 | G682: 46 | H682: 34 | I682: 100 | J682: 69 | L682: 2013-06-19T06:00:00.000 | M682: =RC[-8]-R[17]C[-8] -> 0.49956521739130422 | N682: =RC[-8]-R[17]C[-8] -> -1.7391304347826093 | O682: =RC[-8]-R[17]C[-8] -> 11.478260869565219 | P682: =RC[-8]-R[17]C[-8] -> -76.043478260869563 | Q682: =RC[-8]-R[17]C[-8] -> 26.695652173913047 | R682: =RC[-8]-R[17]C[-8] -> 24.826086956521742 | T682: =RC[-7]*RC[-2] -> 12.402249527410206 | U682: =RC[-7]*RC[-3] -> -43.175803402646522 | V682: =RC[-7]*RC[-4] -> 284.96030245746698 | W682: =RC[-7]*RC[-5] -> -1887.8620037807184 | X682: =RC[-7]*RC[-6] -> 662.74858223062392 | Y682: =RC[-12]*RC[-12] -> 0.24956540642722105 | Z682: =RC[-12]*RC[-12] -> 3.0245746691871478 | AA682: =RC[-12]*RC[-12] -> 131.75047258979208 | AB682: =RC[-12]*RC[-12] -> 5782.6105860113421 | AC682: =RC[-12]*RC[-12] -> 712.65784499054837 | AD682: =RC[-12]*RC[-12] -> 616.334593572779 | AE682: =RC[-11]/SQRT(RC[-6]*RC[-1]) -> 1 | AF682: =RC[-11]/SQRT(RC[-6]*RC[-2]) -> -1 | AG682: =RC[-11]/SQRT(RC[-6]*RC[-3]) -> 1 | AH682: =RC[-11]/SQRT(RC[-6]*RC[-4]) -> -0.99999999999999989 | AI682: =RC[-11]/SQRT(RC[-6]*RC[-5]) -> 1
A683: 51210 | B683: 北京 | C683: 68 | D683: 良 | E683: 1.47 | F683: 16 | G683: 48 | H683: 39 | I683: 113 | J683: 81 | L683: 2013-06-19T07:00:00.000 | M683: =RC[-8]-R[16]C[-8] -> 0.55956521739130427 | N683: =RC[-8]-R[16]C[-8] -> 6.2608695652173907 | O683: =RC[-8]-R[16]C[-8] -> 13.478260869565219 | P683: =RC[-8]-R[16]C[-8] -> -71.043478260869563 | Q683: =RC[-8]-R[16]C[-8] -> 39.695652173913047 | R683: =RC[-8]-R[16]C[-8] -> 36.826086956521742 | T683: =RC[-7]*RC[-2] -> 20.606597353497165 | U683: =RC[-7]*RC[-3] -> 230.5633270321361 | V683: =RC[-7]*RC[-4] -> 496.3516068052931 | W683: =RC[-7]*RC[-5] -> -2616.2533081285446 | X683: =RC[-7]*RC[-6] -> 1461.8355387523632 | Y683: =RC[-12]*RC[-12] -> 0.31311323251417761 | Z683: =RC[-12]*RC[-12] -> 39.198487712665397 | AA683: =RC[-12]*RC[-12] -> 181.66351606805296 | AB683: =RC[-12]*RC[-12] -> 5047.1758034026461 | AC683: =RC[-12]*RC[-12] -> 1575.7448015122875 | AD683: =RC[-12]*RC[-12] -> 1356.1606805293009 | AE683: =RC[-11]/SQRT(RC[-6]*RC[-1]) -> 1 | AF683: =RC[-11]/SQRT(RC[-6]*RC[-2]) -> 1 | AG683: =RC[-11]/SQRT(RC[-6]*RC[-3]) -> 1 | AH683: =RC[-11]/SQRT(RC[-6]*RC[-4]) -> -1 | AI683: =RC[-11]/SQRT(RC[-6]*RC[-5]) -> 1
A684: 51286 | B684: 北京 | C684: 71 | D684: 良 | E684: 1.54 | F684: 17 | G684: 49 | H684: 57 | I684: 131 | J684: 93 | L684: 2013-06-19T08:00:00.000 | M684: =RC[-8]-R[15]C[-8] -> 0.62956521739130433 | N684: =RC[-8]-R[15]C[-8] -> 7.2608695652173907 | O684: =RC[-8]-R[15]C[-8] -> 14.478260869565219 | P684: =RC[-8]-R[15]C[-8] -> -53.043478260869563 | Q684: =RC[-8]-R[15]C[-8] -> 57.695652173913047 | R684: =RC[-8]-R[15]C[-8] -> 48.826086956521742 | T684: =RC[-7]*RC[-2] -> 30.739206049149338 | U684: =RC[-7]*RC[-3] -> 354.51984877126654 | V684: =RC[-7]*RC[-4] -> 706.91682419659742 | W684: =RC[-7]*RC[-5] -> -2589.9054820415881 | X684: =RC[-7]*RC[-6] -> 2817.0529300567109 | Y684: =RC[-12]*RC[-12] -> 0.39635236294896026 | Z684: =RC[-12]*RC[-12] -> 52.720226843100178 | AA684: =RC[-12]*RC[-12] -> 209.62003780718339 | AB684: =RC[-12]*RC[-12] -> 2813.6105860113421 | AC684: =RC[-12]*RC[-12] -> 3328.7882797731572 | AD684: =RC[-12]*RC[-12] -> 2383.9867674858224 | AE684: =RC[-11]/SQRT(RC[-6]*RC[-1]) -> 1.0000000000000002 | AF684: =RC[-11]/SQRT(RC[-6]*RC[-2]) -> 1 | AG684: =RC[-11]/SQRT(RC[-6]*RC[-3]) -> 1 | AH684: =RC[-11]/SQRT(RC[-6]*RC[-4]) -> -1 | AI684: =RC[-11]/SQRT(RC[-6]*RC[-5]) -> 1
A685: 51362 | B685: 北京 | C685: 72 | D685: 良 | E685: 1.29 | F685: 15 | G685: 47 | H685: 77 | I685: 97 | J685: 77 | L685: 2013-06-19T09:00:00.000 | M685: =RC[-8]-R[14]C[-8] -> 0.37956521739130433 | N685: =RC[-8]-R[14]C[-8] -> 5.2608695652173907 | O685: =RC[-8]-R[14]C[-8] -> 12.478260869565219 | P685: =RC[-8]-R[14]C[-8] -> -33.043478260869563 | Q685: =RC[-8]-R[14]C[-8] -> 23.695652173913047 | R685: =RC[-8]-R[14]C[-8] -> 32.826086956521742 | T685: =RC[-7]*RC[-2] -> 12.459640831758035 | U685: =RC[-7]*RC[-3] -> 172.69376181474479 | V685: =RC[-7]*RC[-4] -> 409.61247637051048 | W685: =RC[-7]*RC[-5] -> -1084.6880907372401 | X685: =RC[-7]*RC[-6] -> 777.83553875236316 | Y685: =RC[-12]*RC[-12] -> 0.14406975425330812 | Z685: =RC[-12]*RC[-12] -> 27.676748582230616 | AA685: =RC[-12]*RC[-12] -> 155.70699432892252 | AB685: =RC[-12]*RC[-12] -> 1091.8714555765594 | AC685: =RC[-12]*RC[-12] -> 561.48393194707012 | AD685: =RC[-12]*RC[-12] -> 1077.5519848771269 | AE685: =RC[-11]/SQRT(RC[-6]*RC[-1]) -> 1 | AF685: =RC[-11]/SQRT(RC[-6]*RC[-2]) -> 1 | AG685: =RC[-11]/SQRT(RC[-6]*RC[-3]) -> 1 | AH685: =RC[-11]/SQRT(RC[-6]*RC[-4]) -> -1 | AI685: =RC[-11]/SQRT(RC[-6]*RC[-5]) -> 1
A686: 51438 | B686: 北京 | C686: 71 | D686: 良 | E686: 0.88 | F686: 11 | G686: 38 | H686: 94 | I686: 63 | J686: 39 | L686: 2013-06-19T10:00:00.000 | M686: =RC[-8]-R[13]C[-8] -> -3.0434782608695699E-2 | N686: =RC[-8]-R[13]C[-8] -> 1.2608695652173907 | O686: =RC[-8]-R[13]C[-8] -> 3.4782608695652186 | P686: =RC[-8]-R[13]C[-8] -> -16.043478260869563 | Q686: =RC[-8]-R[13]C[-8] -> -10.304347826086953 | R686: =RC[-8]-R[13]C[-8] -> -5.1739130434782581 | T686: =RC[-7]*RC[-2] -> 0.15746691871455593 | U686: =RC[-7]*RC[-3] -> -6.5236294896030182 | V686: =RC[-7]*RC[-4] -> -17.996219281663514 | W686: =RC[-7]*RC[-5] -> 83.007561436672916 | X686: =RC[-7]*RC[-6] -> 53.313799621928119 | Y686: =RC[-12]*RC[-12] -> 9.2627599243856617E-4 | Z686: =RC[-12]*RC[-12] -> 1.5897920604914919 | AA686: =RC[-12]*RC[-12] -> 12.098298676748591 | AB686: =RC[-12]*RC[-12] -> 257.39319470699422 | AC686: =RC[-12]*RC[-12] -> 106.17958412098292 | AD686: =RC[-12]*RC[-12] -> 26.769376181474453 | AE686: =RC[-11]/SQRT(RC[-6]*RC[-1]) -> 1 | AF686: =RC[-11]/SQRT(RC[-6]*RC[-2]) -> -1 | AG686: =RC[-11]/SQRT(RC[-6]*RC[-3]) -> -1 | AH686: =RC[-11]/SQRT(RC[-6]*RC[-4]) -> 1.0000000000000002 | AI686: =RC[-11]/SQRT(RC[-6]*RC[-5]) -> 1
A687: 51514 | B687: 北京 | C687: 71 | D687: 良 | E687: 0.64 | F687: 10 | G687: 29 | H687: 115 | I687: 36 | J687: 26 | L687: 2013-06-19T11:00:00.000 | M687: =RC[-8]-R[12]C[-8] -> -0.27043478260869569 | N687: =RC[-8]-R[12]C[-8] -> 0.26086956521739069 | O687: =RC[-8]-R[12]C[-8] -> -5.5217391304347814 | P687: =RC[-8]-R[12]C[-8] -> 4.9565217391304373 | Q687: =RC[-8]-R[12]C[-8] -> -37.304347826086953 | R687: =RC[-8]-R[12]C[-8] -> -18.173913043478258 | T687: =RC[-7]*RC[-2] -> 4.9148582230623816 | U687: =RC[-7]*RC[-3] -> -4.7410207939508391 | V687: =RC[-7]*RC[-4] -> 100.35160680529297 | W687: =RC[-7]*RC[-5] -> -90.079395085066196 | X687: =RC[-7]*RC[-6] -> 677.96597353497145 | Y687: =RC[-12]*RC[-12] -> 7.3134971644612495E-2 | Z687: =RC[-12]*RC[-12] -> 6.8052930056710453E-2 | AA687: =RC[-12]*RC[-12] -> 30.489603024574656 | AB687: =RC[-12]*RC[-12] -> 24.567107750472616 | AC687: =RC[-12]*RC[-12] -> 1391.6143667296783 | AD687: =RC[-12]*RC[-12] -> 330.29111531190915 | AE687: =RC[-11]/SQRT(RC[-6]*RC[-1]) -> 1 | AF687: =RC[-11]/SQRT(RC[-6]*RC[-2]) -> -1.0000000000000002 | AG687: =RC[-11]/SQRT(RC[-6]*RC[-3]) -> 1 | AH687: =RC[-11]/SQRT(RC[-6]*RC[-4]) -> -1 | AI687: =RC[-11]/SQRT(RC[-6]*RC[-5]) -> 1
A688: 51590 | B688: 北京 | C688: 70 | D688: 良 | E688: 0.52 | F688: 18 | G688: 23 | H688: 125 | I688: 19 | J688: 16 | L688: 2013-06-19T12:00:00.000 | M688: =RC[-8]-R[11]C[-8] -> -0.39043478260869569 | N688: =RC[-8]-R[11]C[-8] -> 8.2608695652173907 | O688: =RC[-8]-R[11]C[-8] -> -11.521739130434781 | P688: =RC[-8]-R[11]C[-8] -> 14.956521739130437 | Q688: =RC[-8]-R[11]C[-8] -> -54.304347826086953 | R688: =RC[-8]-R[11]C[-8] -> -28.173913043478258 | T688: =RC[-7]*RC[-2] -> 11.000075614366729 | U688: =RC[-7]*RC[-3] -> -232.74102079395081 | V688: =RC[-7]*RC[-4] -> 324.61247637051031 | W688: =RC[-7]*RC[-5] -> -421.38374291115315 | X688: =RC[-7]*RC[-6] -> 1529.9659735349715 | Y688: =RC[-12]*RC[-12] -> 0.15243931947069947 | Z688: =RC[-12]*RC[-12] -> 68.24196597353496 | AA688: =RC[-12]*RC[-12] -> 132.75047258979203 | AB688: =RC[-12]*RC[-12] -> 223.69754253308136 | AC688: =RC[-12]*RC[-12] -> 2948.9621928166348 | AD688: =RC[-12]*RC[-12] -> 793.76937618147429 | AE688: =RC[-11]/SQRT(RC[-6]*RC[-1]) -> 0.99999999999999989 | AF688: =RC[-11]/SQRT(RC[-6]*RC[-2]) -> -1 | AG688: =RC[-11]/SQRT(RC[-6]*RC[-3]) -> 1 | AH688: =RC[-11]/SQRT(RC[-6]*RC[-4]) -> -1 | AI688: =RC[-11]/SQRT(RC[-6]*RC[-5]) -> 1
A689: 51666 | B689: 北京 | C689: 71 | D689: 良 | E689: 0.44 | F689: 7 | G689: 26 | H689: 146 | I689: 24 | J689: 16 | L689: 2013-06-19T13:00:00.000 | M689: =RC[-8]-R[10]C[-8] -> -0.4704347826086957 | N689: =RC[-8]-R[10]C[-8] -> -2.7391304347826093 | O689: =RC[-8]-R[10]C[-8] -> -8.5217391304347814 | P689: =RC[-8]-R[10]C[-8] -> 35.956521739130437 | Q689: =RC[-8]-R[10]C[-8] -> -49.304347826086953 | R689: =RC[-8]-R[10]C[-8] -> -28.173913043478258 | T689: =RC[-7]*RC[-2] -> 13.253988657844991 | U689: =RC[-7]*RC[-3] -> 77.172022684310022 | V689: =RC[-7]*RC[-4] -> 240.09073724007555 | W689: =RC[-7]*RC[-5] -> -1013.0359168241965 | X689: =RC[-7]*RC[-6] -> 1389.0964083175802 | Y689: =RC[-12]*RC[-12] -> 0.22130888468809079 | Z689: =RC[-12]*RC[-12] -> 7.5028355387523664 | AA689: =RC[-12]*RC[-12] -> 72.620037807183337 | AB689: =RC[-12]*RC[-12] -> 1292.8714555765598 | AC689: =RC[-12]*RC[-12] -> 2430.9187145557653 | AD689: =RC[-12]*RC[-12] -> 793.76937618147429 | AE689: =RC[-11]/SQRT(RC[-6]*RC[-1]) -> 1 | AF689: =RC[-11]/SQRT(RC[-6]*RC[-2]) -> 0.99999999999999978 | AG689: =RC[-11]/SQRT(RC[-6]*RC[-3]) -> 1 | AH689: =RC[-11]/SQRT(RC[-6]*RC[-4]) -> -1 | AI689: =RC[-11]/SQRT(RC[-6]*RC[-5]) -> 1.0000000000000002
A690: 51742 | B690: 北京 | C690: 70 | D690: 良 | E690: 0.45 | F690: 7 | G690: 17 | H690: 145 | I690: 15 | J690: 7 | L690: 2013-06-19T14:00:00.000 | M690: =RC[-8]-R[9]C[-8] -> -0.46043478260869569 | N690: =RC[-8]-R[9]C[-8] -> -2.7391304347826093 | O690: =RC[-8]-R[9]C[-8] -> -17.521739130434781 | P690: =RC[-8]-R[9]C[-8] -> 34.956521739130437 | Q690: =RC[-8]-R[9]C[-8] -> -58.304347826086953 | R690: =RC[-8]-R[9]C[-8] -> -37.173913043478258 | T690: =RC[-7]*RC[-2] -> 17.11616257088847 | U690: =RC[-7]*RC[-3] -> 101.82419659735351 | V690: =RC[-7]*RC[-4] -> 651.35160680529293 | W690: =RC[-7]*RC[-5] -> -1299.4706994328922 | X690: =RC[-7]*RC[-6] -> 2167.400756143667 | Y690: =RC[-12]*RC[-12] -> 0.21200018903591686 | Z690: =RC[-12]*RC[-12] -> 7.5028355387523664 | AA690: =RC[-12]*RC[-12] -> 307.0113421550094 | AB690: =RC[-12]*RC[-12] -> 1221.9584120982988 | AC690: =RC[-12]*RC[-12] -> 3399.3969754253303 | AD690: =RC[-12]*RC[-12] -> 1381.8998109640829 | AE690: =RC[-11]/SQRT(RC[-6]*RC[-1]) -> 1.0000000000000002 | AF690: =RC[-11]/SQRT(RC[-6]*RC[-2]) -> 1 | AG690: =RC[-11]/SQRT(RC[-6]*RC[-3]) -> 1 | AH690: =RC[-11]/SQRT(RC[-6]*RC[-4]) -> -1 | AI690: =RC[-11]/SQRT(RC[-6]*RC[-5]) -> 1
A691: 51818 | B691: 北京 | C691: 71 | D691: 良 | E691: 0.44 | F691: 7 | G691: 20 | H691: 150 | I691: 24 | J691: 14 | L691: 2013-06-19T15:00:00.000 | M691: =RC[-8]-R[8]C[-8] -> -0.4704347826086957 | N691: =RC[-8]-R[8]C[-8] -> -2.7391304347826093 | O691: =RC[-8]-R[8]C[-8] -> -14.521739130434781 | P691: =RC[-8]-R[8]C[-8] -> 39.956521739130437 | Q691: =RC[-8]-R[8]C[-8] -> -49.304347826086953 | R691: =RC[-8]-R[8]C[-8] -> -30.173913043478258 | T691: =RC[-7]*RC[-2] -> 14.194858223062383 | U691: =RC[-7]*RC[-3] -> 82.650283553875241 | V691: =RC[-7]*RC[-4] -> 438.17769376181468 | W691: =RC[-7]*RC[-5] -> -1205.6446124763704 | X691: =RC[-7]*RC[-6] -> 1487.705103969754 | Y691: =RC[-12]*RC[-12] -> 0.22130888468809079 | Z691: =RC[-12]*RC[-12] -> 7.5028355387523664 | AA691: =RC[-12]*RC[-12] -> 210.88090737240071 | AB691: =RC[-12]*RC[-12] -> 1596.5236294896033 | AC691: =RC[-12]*RC[-12] -> 2430.9187145557653 | AD691: =RC[-12]*RC[-12] -> 910.4650283553874 | AE691: =RC[-11]/SQRT(RC[-6]*RC[-1]) -> 1 | AF691: =RC[-11]/SQRT(RC[-6]*RC[-2]) -> 1 | AG691: =RC[-11]/SQRT(RC[-6]*RC[-3]) -> 1 | AH691: =RC[-11]/SQRT(RC[-6]*RC[-4]) -> -0.99999999999999978 | AI691: =RC[-11]/SQRT(RC[-6]*RC[-5]) -> 1
A692: 51894 | B692: 北京 | C692: 75 | D692: 良 | E692: 0.5 | F692: 7 | G692: 20 | H692: 161 | I692: 14 | J692: 12 | L692: 2013-06-19T16:00:00.000 | M692: =RC[-8]-R[7]C[-8] -> -0.4104347826086957 | N692: =RC[-8]-R[7]C[-8] -> -2.7391304347826093 | O692: =RC[-8]-R[7]C[-8] -> -14.521739130434781 | P692: =RC[-8]-R[7]C[-8] -> 50.956521739130437 | Q692: =RC[-8]-R[7]C[-8] -> -59.304347826086953 | R692: =RC[-8]-R[7]C[-8] -> -32.173913043478258 | T692: =RC[-7]*RC[-2] -> 13.205293005671077 | U692: =RC[-7]*RC[-3] -> 88.128544423440459 | V692: =RC[-7]*RC[-4] -> 467.22117202268424 | W692: =RC[-7]*RC[-5] -> -1639.4706994328922 | X692: =RC[-7]*RC[-6] -> 1908.0529300567105 | Y692: =RC[-12]*RC[-12] -> 0.16845671077504731 | Z692: =RC[-12]*RC[-12] -> 7.5028355387523664 | AA692: =RC[-12]*RC[-12] -> 210.88090737240071 | AB692: =RC[-12]*RC[-12] -> 2596.567107750473 | AC692: =RC[-12]*RC[-12] -> 3517.0056710775043 | AD692: =RC[-12]*RC[-12] -> 1035.1606805293004 | AE692: =RC[-11]/SQRT(RC[-6]*RC[-1]) -> 0.99999999999999989 | AF692: =RC[-11]/SQRT(RC[-6]*RC[-2]) -> 1 | AG692: =RC[-11]/SQRT(RC[-6]*RC[-3]) -> 1.0000000000000002 | AH692: =RC[-11]/SQRT(RC[-6]*RC[-4]) -> -0.99999999999999989 | AI692: =RC[-11]/SQRT(RC[-6]*RC[-5]) -> 1
A693: 51970 | B693: 北京 | C693: 82 | D693: 良 | E693: 0.46 | F693: 4 | G693: 18 | H693: 174 | I693: 39 | J693: 18 | L693: 2013-06-19T17:00:00.000 | M693: =RC[-8]-R[6]C[-8] -> -0.45043478260869568 | N693: =RC[-8]-R[6]C[-8] -> -5.7391304347826093 | O693: =RC[-8]-R[6]C[-8] -> -16.521739130434781 | P693: =RC[-8]-R[6]C[-8] -> 63.956521739130437 | Q693: =RC[-8]-R[6]C[-8] -> -34.304347826086953 | R693: =RC[-8]-R[6]C[-8] -> -26.173913043478258 | T693: =RC[-7]*RC[-2] -> 11.789640831758033 | U693: =RC[-7]*RC[-3] -> 150.21550094517957 | V693: =RC[-7]*RC[-4] -> 432.43856332703206 | W693: =RC[-7]*RC[-5] -> -1673.9924385633269 | X693: =RC[-7]*RC[-6] -> 897.87901701323233 | Y693: =RC[-12]*RC[-12] -> 0.20289149338374293 | Z693: =RC[-12]*RC[-12] -> 32.937618147448021 | AA693: =RC[-12]*RC[-12] -> 272.96786389413984 | AB693: =RC[-12]*RC[-12] -> 4090.4366729678641 | AC693: =RC[-12]*RC[-12] -> 1176.7882797731568 | AD693: =RC[-12]*RC[-12] -> 685.07372400756128 | AE693: =RC[-11]/SQRT(RC[-6]*RC[-1]) -> 1 | AF693: =RC[-11]/SQRT(RC[-6]*RC[-2]) -> 1 | AG693: =RC[-11]/SQRT(RC[-6]*RC[-3]) -> 1 | AH693: =RC[-11]/SQRT(RC[-6]*RC[-4]) -> -1 | AI693: =RC[-11]/SQRT(RC[-6]*RC[-5]) -> 1
A694: 52046 | B694: 北京 | C694: 94 | D694: 良 | E694: 0.6 | F694: 5 | G694: 23 | H694: 192 | I694: 73 | J694: 22 | L694: 2013-06-19T18:00:00.000 | M694: =RC[-8]-R[5]C[-8] -> -0.31043478260869573 | N694: =RC[-8]-R[5]C[-8] -> -4.7391304347826093 | O694: =RC[-8]-R[5]C[-8] -> -11.521739130434781 | P694: =RC[-8]-R[5]C[-8] -> 81.956521739130437 | Q694: =RC[-8]-R[5]C[-8] -> -0.30434782608695343 | R694: =RC[-8]-R[5]C[-8] -> -22.173913043478258 | T694: =RC[-7]*RC[-2] -> 6.8835538752362959 | U694: =RC[-7]*RC[-3] -> 105.08506616257088 | V694: =RC[-7]*RC[-4] -> 255.48204158790165 | W694: =RC[-7]*RC[-5] -> -1817.2967863894139 | X694: =RC[-7]*RC[-6] -> 6.7485822306237493 | Y694: =RC[-12]*RC[-12] -> 9.6369754253308168E-2 | Z694: =RC[-12]*RC[-12] -> 22.459357277882802 | AA694: =RC[-12]*RC[-12] -> 132.75047258979203 | AB694: =RC[-12]*RC[-12] -> 6716.87145557656 | AC694: =RC[-12]*RC[-12] -> 9.2627599243854455E-2 | AD694: =RC[-12]*RC[-12] -> 491.68241965973522 | AE694: =RC[-11]/SQRT(RC[-6]*RC[-1]) -> 1.0000000000000002 | AF694: =RC[-11]/SQRT(RC[-6]*RC[-2]) -> 1 | AG694: =RC[-11]/SQRT(RC[-6]*RC[-3]) -> 1 | AH694: =RC[-11]/SQRT(RC[-6]*RC[-4]) -> -1 | AI694: =RC[-11]/SQRT(RC[-6]*RC[-5]) -> 1
A695: 52122 | B695: 北京 | C695: 103 | D695: 轻度污染 | E695: 0.61 | F695: 6 | G695: 25 | H695: 205 | I695: 110 | J695: 32 | L695: 2013-06-19T19:00:00.000 | M695: =RC[-8]-R[4]C[-8] -> -0.30043478260869572 | N695: =RC[-8]-R[4]C[-8] -> -3.7391304347826093 | O695: =RC[-8]-R[4]C[-8] -> -9.5217391304347814 | P695: =RC[-8]-R[4]C[-8] -> 94.956521739130437 | Q695: =RC[-8]-R[4]C[-8] -> 36.695652173913047 | R695: =RC[-8]-R[4]C[-8] -> -12.173913043478258 | T695: =RC[-7]*RC[-2] -> 3.6574669187145559 | U695: =RC[-7]*RC[-3] -> 45.519848771266538 | V695: =RC[-7]*RC[-4] -> 115.91682419659732 | W695: =RC[-7]*RC[-5] -> -1155.9924385633267 | X695: =RC[-7]*RC[-6] -> -446.72967863894132 | Y695: =RC[-12]*RC[-12] -> 9.0261058601134259E-2 | Z695: =RC[-12]*RC[-12] -> 13.981096408317585 | AA695: =RC[-12]*RC[-12] -> 90.6635160680529 | AB695: =RC[-12]*RC[-12] -> 9016.741020793952 | AC695: =RC[-12]*RC[-12] -> 1346.5708884688092 | AD695: =RC[-12]*RC[-12] -> 148.20415879017006 | AE695: =RC[-11]/SQRT(RC[-6]*RC[-1]) -> 1 | AF695: =RC[-11]/SQRT(RC[-6]*RC[-2]) -> 1.0000000000000002 | AG695: =RC[-11]/SQRT(RC[-6]*RC[-3]) -> 1.0000000000000002 | AH695: =RC[-11]/SQRT(RC[-6]*RC[-4]) -> -0.99999999999999978 | AI695: =RC[-11]/SQRT(RC[-6]*RC[-5]) -> -1
A696: 52198 | B696: 北京 | C696: 106 | D696: 轻度污染 | E696: 0.72 | F696: 7 | G696: 36 | H696: 176 | I696: 93 | J696: 39 | L696: 2013-06-19T20:00:00.000 | M696: =RC[-8]-R[3]C[-8] -> -0.19043478260869573 | N696: =RC[-8]-R[3]C[-8] -> -2.7391304347826093 | O696: =RC[-8]-R[3]C[-8] -> 1.4782608695652186 | P696: =RC[-8]-R[3]C[-8] -> 65.956521739130437 | Q696: =RC[-8]-R[3]C[-8] -> 19.695652173913047 | R696: =RC[-8]-R[3]C[-8] -> -5.1739130434782581 | T696: =RC[-7]*RC[-2] -> 0.98529300567107736 | U696: =RC[-7]*RC[-3] -> 14.172022684310015 | V696: =RC[-7]*RC[-4] -> -7.6483931947069967 | W696: =RC[-7]*RC[-5] -> -341.25330812854423 | X696: =RC[-7]*RC[-6] -> -101.90359168241962 | Y696: =RC[-12]*RC[-12] -> 3.6265406427221203E-2 | Z696: =RC[-12]*RC[-12] -> 7.5028355387523664 | AA696: =RC[-12]*RC[-12] -> 2.1852551984877162 | AB696: =RC[-12]*RC[-12] -> 4350.262759924386 | AC696: =RC[-12]*RC[-12] -> 387.91871455576569 | AD696: =RC[-12]*RC[-12] -> 26.769376181474453 | AE696: =RC[-11]/SQRT(RC[-6]*RC[-1]) -> 1 | AF696: =RC[-11]/SQRT(RC[-6]*RC[-2]) -> 1 | AG696: =RC[-11]/SQRT(RC[-6]*RC[-3]) -> -1 | AH696: =RC[-11]/SQRT(RC[-6]*RC[-4]) -> -0.99999999999999978 | AI696: =RC[-11]/SQRT(RC[-6]*RC[-5]) -> -1
A697: 52274 | B697: 北京 | C697: 106 | D697: 轻度污染 | E697: 0.78 | F697: 7 | G697: 48 | H697: 144 | I697: 88 | J697: 43 | L697: 2013-06-19T21:00:00.000 | M697: =RC[-8]-R[2]C[-8] -> -0.13043478260869568 | N697: =RC[-8]-R[2]C[-8] -> -2.7391304347826093 | O697: =RC[-8]-R[2]C[-8] -> 13.478260869565219 | P697: =RC[-8]-R[2]C[-8] -> 33.956521739130437 | Q697: =RC[-8]-R[2]C[-8] -> 14.695652173913047 | R697: =RC[-8]-R[2]C[-8] -> -1.1739130434782581 | T697: =RC[-7]*RC[-2] -> 0.1531190926275989 | U697: =RC[-7]*RC[-3] -> 3.2155009451795773 | V697: =RC[-7]*RC[-4] -> -15.822306238185218 | W697: =RC[-7]*RC[-5] -> -39.862003780718247 | X697: =RC[-7]*RC[-6] -> -17.251417769376143 | Y697: =RC[-12]*RC[-12] -> 1.70132325141777E-2 | Z697: =RC[-12]*RC[-12] -> 7.5028355387523664 | AA697: =RC[-12]*RC[-12] -> 181.66351606805296 | AB697: =RC[-12]*RC[-12] -> 1153.0453686200381 | AC697: =RC[-12]*RC[-12] -> 215.96219281663525 | AD697: =RC[-12]*RC[-12] -> 1.3780718336483866 | AE697: =RC[-11]/SQRT(RC[-6]*RC[-1]) -> 1 | AF697: =RC[-11]/SQRT(RC[-6]*RC[-2]) -> 1.0000000000000002 | AG697: =RC[-11]/SQRT(RC[-6]*RC[-3]) -> -1 | AH697: =RC[-11]/SQRT(RC[-6]*RC[-4]) -> -1 | AI697: =RC[-11]/SQRT(RC[-6]*RC[-5]) -> -1
A698: 52350 | B698: 北京 | C698: 103 | D698: 轻度污染 | E698: 0.91 | F698: 6 | G698: 60 | H698: 96 | I698: 106 | J698: 50 | L698: 2013-06-19T22:00:00.000 | M698: =RC[-8]-R[1]C[-8] -> -4.3478260869567187E-4 | N698: =RC[-8]-R[1]C[-8] -> -3.7391304347826093 | O698: =RC[-8]-R[1]C[-8] -> 25.478260869565219 | P698: =RC[-8]-R[1]C[-8] -> -14.043478260869563 | Q698: =RC[-8]-R[1]C[-8] -> 32.695652173913047 | R698: =RC[-8]-R[1]C[-8] -> 5.8260869565217419 | T698: =RC[-7]*RC[-2] -> -2.5330812854443504E-3 | U698: =RC[-7]*RC[-3] -> -21.784499054820429 | V698: =RC[-7]*RC[-4] -> 148.43856332703223 | W698: =RC[-7]*RC[-5] -> -81.818525519848791 | X698: =RC[-7]*RC[-6] -> 190.48771266540655 | Y698: =RC[-12]*RC[-12] -> 1.8903591682421373E-7 | Z698: =RC[-12]*RC[-12] -> 13.981096408317585 | AA698: =RC[-12]*RC[-12] -> 649.14177693761826 | AB698: =RC[-12]*RC[-12] -> 197.219281663516 | AC698: =RC[-12]*RC[-12] -> 1069.005671077505 | AD698: =RC[-12]*RC[-12] -> 33.943289224952771 | AE698: =RC[-11]/SQRT(RC[-6]*RC[-1]) -> -1 | AF698: =RC[-11]/SQRT(RC[-6]*RC[-2]) -> -1 | AG698: =RC[-11]/SQRT(RC[-6]*RC[-3]) -> 1 | AH698: =RC[-11]/SQRT(RC[-6]*RC[-4]) -> -1 | AI698: =RC[-11]/SQRT(RC[-6]*RC[-5]) -> 1.0000000000000002
E699: =AVERAGE(R[-23]C:R[-1]C) -> 0.9104347826086957 | F699: =AVERAGE(R[-23]C:R[-1]C) -> 9.7391304347826093 | G699: =AVERAGE(R[-23]C:R[-1]C) -> 34.521739130434781 | H699: =AVERAGE(R[-23]C:R[-1]C) -> 110.04347826086956 | I699: =AVERAGE(R[-23]C:R[-1]C) -> 73.304347826086953 | J699: =AVERAGE(R[-23]C:R[-1]C) -> 44.173913043478258 | M699: =RC[-8]-RC[-8] -> 0 | N699: =RC[-8]-RC[-8] -> 0 | O699: =RC[-8]-RC[-8] -> 0 | P699: =RC[-8]-RC[-8] -> 0 | Q699: =RC[-8]-RC[-8] -> 0 | R699: =RC[-8]-RC[-8] -> 0 | T699: =SUM(R[-23]C:R[-1]C) -> 265.88557655954628 | U699: =SUM(R[-23]C:R[-1]C) -> 1736.1758034026466 | V699: =SUM(R[-23]C:R[-1]C) -> 7270.4310018903598 | W699: =SUM(R[-23]C:R[-1]C) -> -19350.529300567108 | X699: =SUM(R[-23]C:R[-1]C) -> 21394.816635160674 | Y699: =SUM(R[-23]C:R[-1]C) -> 4.41920415879017 | Z699: =SUM(R[-23]C:R[-1]C) -> 473.93194706994336 | AA699: =SUM(R[-23]C:R[-1]C) -> 4322.4234404536865 | AB699: =SUM(R[-23]C:R[-1]C) -> 59547.998109640837 | AC699: =SUM(R[-23]C:R[-1]C) -> 34748.733459357281 | AD699: =SUM(R[-23]C:R[-1]C) -> 16911.795841209831 | AE699: =RC[-11]/SQRT(RC[-6]*RC[-1]) -> 0.97258570597899319 | AF699: =RC[-11]/SQRT(RC[-6]*RC[-2]) -> 0.61325464058543067 | AG699: =RC[-11]/SQRT(RC[-6]*RC[-3]) -> 0.85035768076629581 | AH699: =RC[-11]/SQRT(RC[-6]*RC[-4]) -> -0.60976768134475368 | AI699: =RC[-11]/SQRT(RC[-6]*RC[-5]) -> 0.88255994926783587
A700: 52426 | B700: 北京 | C700: 78 | D700: 良 | E700: 0.91 | F700: 7 | G700: 69 | H700: 59 | I700: 112 | J700: 49 | L700: 2013-06-20T01:00:00.000 | M700: =RC[-8]-R[23]C[-8] -> -0.29391304347826075 | N700: =RC[-8]-R[23]C[-8] -> -8.0869565217391308 | O700: =RC[-8]-R[23]C[-8] -> 13.173913043478258 | P700: =RC[-8]-R[23]C[-8] -> -4.5652173913043512 | Q700: =RC[-8]-R[23]C[-8] -> 9 | R700: =RC[-8]-R[23]C[-8] -> -6 | T700: =RC[-7]*RC[-2] -> 1.7634782608695645 | U700: =RC[-7]*RC[-3] -> 48.521739130434781 | V700: =RC[-7]*RC[-4] -> -79.043478260869549 | W700: =RC[-7]*RC[-5] -> 27.391304347826107 | X700: =RC[-7]*RC[-6] -> -54 | Y700: =RC[-12]*RC[-12] -> 8.6384877126653992E-2 | Z700: =RC[-12]*RC[-12] -> 65.398865784499066 | AA700: =RC[-12]*RC[-12] -> 173.55198487712659 | AB700: =RC[-12]*RC[-12] -> 20.841209829867704 | AC700: =RC[-12]*RC[-12] -> 81 | AD700: =RC[-12]*RC[-12] -> 36 | AE700: =RC[-11]/SQRT(RC[-6]*RC[-1]) -> 1 | AF700: =RC[-11]/SQRT(RC[-6]*RC[-2]) -> 0.99999999999999989 | AG700: =RC[-11]/SQRT(RC[-6]*RC[-3]) -> -1 | AH700: =RC[-11]/SQRT(RC[-6]*RC[-4]) -> 1 | AI700: =RC[-11]/SQRT(RC[-6]*RC[-5]) -> -1
A701: 52502 | B701: 北京 | C701: 72 | D701: 良 | E701: 0.96 | F701: 6 | G701: 74 | H701: 43 | I701: 98 | J701: 55 | L701: 2013-06-20T02:00:00.000 | M701: =RC[-8]-R[22]C[-8] -> -0.24391304347826082 | N701: =RC[-8]-R[22]C[-8] -> -9.0869565217391308 | O701: =RC[-8]-R[22]C[-8] -> 18.173913043478258 | P701: =RC[-8]-R[22]C[-8] -> -20.565217391304351 | Q701: =RC[-8]-R[22]C[-8] -> -5 | R701: =RC[-8]-R[22]C[-8] -> 0 | T701: =RC[-7]*RC[-2] -> 0 | U701: =RC[-7]*RC[-3] -> 0 | V701: =RC[-7]*RC[-4] -> 0 | W701: =RC[-7]*RC[-5] -> 0 | X701: =RC[-7]*RC[-6] -> 0 | Y701: =RC[-12]*RC[-12] -> 5.9493572778827948E-2 | Z701: =RC[-12]*RC[-12] -> 82.572778827977316 | AA701: =RC[-12]*RC[-12] -> 330.29111531190915 | AB701: =RC[-12]*RC[-12] -> 422.92816635160693 | AC701: =RC[-12]*RC[-12] -> 25 | AD701: =RC[-12]*RC[-12] -> 0 | AE701: =RC[-11]/SQRT(RC[-6]*RC[-1]) -> #DIV/0! | AF701: =RC[-11]/SQRT(RC[-6]*RC[-2]) -> #DIV/0! | AG701: =RC[-11]/SQRT(RC[-6]*RC[-3]) -> #DIV/0! | AH701: =RC[-11]/SQRT(RC[-6]*RC[-4]) -> #DIV/0! | AI701: =RC[-11]/SQRT(RC[-6]*RC[-5]) -> #DIV/0!
A702: 52578 | B702: 北京 | C702: 70 | D702: 良 | E702: 0.93 | F702: 7 | G702: 55 | H702: 39 | I702: 99 | J702: 49 | L702: 2013-06-20T03:00:00.000 | M702: =RC[-8]-R[21]C[-8] -> -0.27391304347826073 | N702: =RC[-8]-R[21]C[-8] -> -8.0869565217391308 | O702: =RC[-8]-R[21]C[-8] -> -0.82608695652174191 | P702: =RC[-8]-R[21]C[-8] -> -24.565217391304351 | Q702: =RC[-8]-R[21]C[-8] -> -4 | R702: =RC[-8]-R[21]C[-8] -> -6 | T702: =RC[-7]*RC[-2] -> 1.6434782608695644 | U702: =RC[-7]*RC[-3] -> 48.521739130434781 | V702: =RC[-7]*RC[-4] -> 4.9565217391304515 | W702: =RC[-7]*RC[-5] -> 147.39130434782612 | X702: =RC[-7]*RC[-6] -> 24 | Y702: =RC[-12]*RC[-12] -> 7.502835538752356E-2 | Z702: =RC[-12]*RC[-12] -> 65.398865784499066 | AA702: =RC[-12]*RC[-12] -> 0.68241965973535434 | AB702: =RC[-12]*RC[-12] -> 603.4499054820418 | AC702: =RC[-12]*RC[-12] -> 16 | AD702: =RC[-12]*RC[-12] -> 36 | AE702: =RC[-11]/SQRT(RC[-6]*RC[-1]) -> 1 | AF702: =RC[-11]/SQRT(RC[-6]*RC[-2]) -> 0.99999999999999989 | AG702: =RC[-11]/SQRT(RC[-6]*RC[-3]) -> 1 | AH702: =RC[-11]/SQRT(RC[-6]*RC[-4]) -> 1 | AI702: =RC[-11]/SQRT(RC[-6]*RC[-5]) -> 1
A703: 52654 | B703: 北京 | C703: 69 | D703: 良 | E703: 0.91 | F703: 8 | G703: 71 | H703: 41 | I703: 98 | J703: 47 | L703: 2013-06-20T04:00:00.000 | M703: =RC[-8]-R[20]C[-8] -> -0.29391304347826075 | N703: =RC[-8]-R[20]C[-8] -> -7.0869565217391308 | O703: =RC[-8]-R[20]C[-8] -> 15.173913043478258 | P703: =RC[-8]-R[20]C[-8] -> -22.565217391304351 | Q703: =RC[-8]-R[20]C[-8] -> -5 | R703: =RC[-8]-R[20]C[-8] -> -8 | T703: =RC[-7]*RC[-2] -> 2.351304347826086 | U703: =RC[-7]*RC[-3] -> 56.695652173913047 | V703: =RC[-7]*RC[-4] -> -121.39130434782606 | W703: =RC[-7]*RC[-5] -> 180.52173913043481 | X703: =RC[-7]*RC[-6] -> 40 | Y703: =RC[-12]*RC[-12] -> 8.6384877126653992E-2 | Z703: =RC[-12]*RC[-12] -> 50.2249527410208 | AA703: =RC[-12]*RC[-12] -> 230.24763705103962 | AB703: =RC[-12]*RC[-12] -> 509.18903591682437 | AC703: =RC[-12]*RC[-12] -> 25 | AD703: =RC[-12]*RC[-12] -> 64 | AE703: =RC[-11]/SQRT(RC[-6]*RC[-1]) -> 1 | AF703: =RC[-11]/SQRT(RC[-6]*RC[-2]) -> 1 | AG703: =RC[-11]/SQRT(RC[-6]*RC[-3]) -> -1 | AH703: =RC[-11]/SQRT(RC[-6]*RC[-4]) -> 1 | AI703: =RC[-11]/SQRT(RC[-6]*RC[-5]) -> 1
A704: 52730 | B704: 北京 | C704: 69 | D704: 良 | E704: 1.1200000000000001 | F704: 11 | G704: 64 | H704: 32 | I704: 113 | J704: 69 | L704: 2013-06-20T05:00:00.000 | M704: =RC[-8]-R[2089]C[-8] -> 1.1200000000000001 | N704: =RC[-8]-R[2089]C[-8] -> 11 | O704: =RC[-8]-R[2089]C[-8] -> 64 | P704: =RC[-8]-R[2089]C[-8] -> 32 | Q704: =RC[-8]-R[2089]C[-8] -> 113 | R704: =RC[-8]-R[2089]C[-8] -> 69 | T704: =RC[-7]*RC[-2] -> 77.28 | U704: =RC[-7]*RC[-3] -> 759 | V704: =RC[-7]*RC[-4] -> 4416 | W704: =RC[-7]*RC[-5] -> 2208 | X704: =RC[-7]*RC[-6] -> 7797 | Y704: =RC[-12]*RC[-12] -> 1.2544000000000002 | Z704: =RC[-12]*RC[-12] -> 121 | AA704: =RC[-12]*RC[-12] -> 4096 | AB704: =RC[-12]*RC[-12] -> 1024 | AC704: =RC[-12]*RC[-12] -> 12769 | AD704: =RC[-12]*RC[-12] -> 4761 | AE704: =RC[-11]/SQRT(RC[-6]*RC[-1]) -> 1 | AF704: =RC[-11]/SQRT(RC[-6]*RC[-2]) -> 1 | AG704: =RC[-11]/SQRT(RC[-6]*RC[-3]) -> 1 | AH704: =RC[-11]/SQRT(RC[-6]*RC[-4]) -> 1 | AI704: =RC[-11]/SQRT(RC[-6]*RC[-5]) -> 1
A705: 52806 | B705: 北京 | C705: 68 | D705: 良 | E705: 1.27 | F705: 13 | G705: 68 | H705: 29 | I705: 140 | J705: 72 | L705: 2013-06-20T06:00:00.000 | M705: =RC[-8]-R[18]C[-8] -> 6.6086956521739237E-2 | N705: =RC[-8]-R[18]C[-8] -> -2.0869565217391308 | O705: =RC[-8]-R[18]C[-8] -> 12.173913043478258 | P705: =RC[-8]-R[18]C[-8] -> -34.565217391304351 | Q705: =RC[-8]-R[18]C[-8] -> 37 | R705: =RC[-8]-R[18]C[-8] -> 17 | T705: =RC[-7]*RC[-2] -> 1.123478260869567 | U705: =RC[-7]*RC[-3] -> -35.478260869565226 | V705: =RC[-7]*RC[-4] -> 206.95652173913038 | W705: =RC[-7]*RC[-5] -> -587.60869565217399 | X705: =RC[-7]*RC[-6] -> 629 | Y705: =RC[-12]*RC[-12] -> 4.3674858223062525E-3 | Z705: =RC[-12]*RC[-12] -> 4.3553875236294912 | AA705: =RC[-12]*RC[-12] -> 148.20415879017006 | AB705: =RC[-12]*RC[-12] -> 1194.7542533081287 | AC705: =RC[-12]*RC[-12] -> 1369 | AD705: =RC[-12]*RC[-12] -> 289 | AE705: =RC[-11]/SQRT(RC[-6]*RC[-1]) -> 1 | AF705: =RC[-11]/SQRT(RC[-6]*RC[-2]) -> -1 | AG705: =RC[-11]/SQRT(RC[-6]*RC[-3]) -> 1 | AH705: =RC[-11]/SQRT(RC[-6]*RC[-4]) -> -1.0000000000000002 | AI705: =RC[-11]/SQRT(RC[-6]*RC[-5]) -> 1
A706: 52882 | B706: 北京 | C706: 66 | D706: 良 | E706: 1.31 | F706: 13 | G706: 62 | H706: 29 | I706: 116 | J706: 66 | L706: 2013-06-20T07:00:00.000 | M706: =RC[-8]-R[17]C[-8] -> 0.10608695652173927 | N706: =RC[-8]-R[17]C[-8] -> -2.0869565217391308 | O706: =RC[-8]-R[17]C[-8] -> 6.1739130434782581 | P706: =RC[-8]-R[17]C[-8] -> -34.565217391304351 | Q706: =RC[-8]-R[17]C[-8] -> 13 | R706: =RC[-8]-R[17]C[-8] -> 11 | T706: =RC[-7]*RC[-2] -> 1.166956521739132 | U706: =RC[-7]*RC[-3] -> -22.956521739130437 | V706: =RC[-7]*RC[-4] -> 67.913043478260846 | W706: =RC[-7]*RC[-5] -> -380.21739130434787 | X706: =RC[-7]*RC[-6] -> 143 | Y706: =RC[-12]*RC[-12] -> 1.1254442344045398E-2 | Z706: =RC[-12]*RC[-12] -> 4.3553875236294912 | AA706: =RC[-12]*RC[-12] -> 38.117202268430965 | AB706: =RC[-12]*RC[-12] -> 1194.7542533081287 | AC706: =RC[-12]*RC[-12] -> 169 | AD706: =RC[-12]*RC[-12] -> 121 | AE706: =RC[-11]/SQRT(RC[-6]*RC[-1]) -> 1 | AF706: =RC[-11]/SQRT(RC[-6]*RC[-2]) -> -0.99999999999999989 | AG706: =RC[-11]/SQRT(RC[-6]*RC[-3]) -> 1.0000000000000002 | AH706: =RC[-11]/SQRT(RC[-6]*RC[-4]) -> -1.0000000000000002 | AI706: =RC[-11]/SQRT(RC[-6]*RC[-5]) -> 1
A707: 52958 | B707: 北京 | C707: 62 | D707: 良 | E707: 1.06 | F707: 12 | G707: 55 | H707: 31 | I707: 87 | J707: 49 | L707: 2013-06-20T08:00:00.000 | M707: =RC[-8]-R[16]C[-8] -> -0.14391304347826073 | N707: =RC[-8]-R[16]C[-8] -> -3.0869565217391308 | O707: =RC[-8]-R[16]C[-8] -> -0.82608695652174191 | P707: =RC[-8]-R[16]C[-8] -> -32.565217391304351 | Q707: =RC[-8]-R[16]C[-8] -> -16 | R707: =RC[-8]-R[16]C[-8] -> -6 | T707: =RC[-7]*RC[-2] -> 0.86347826086956436 | U707: =RC[-7]*RC[-3] -> 18.521739130434785 | V707: =RC[-7]*RC[-4] -> 4.9565217391304515 | W707: =RC[-7]*RC[-5] -> 195.39130434782612 | X707: =RC[-7]*RC[-6] -> 96 | Y707: =RC[-12]*RC[-12] -> 2.0710964083175763E-2 | Z707: =RC[-12]*RC[-12] -> 9.529300567107752 | AA707: =RC[-12]*RC[-12] -> 0.68241965973535434 | AB707: =RC[-12]*RC[-12] -> 1060.4933837429114 | AC707: =RC[-12]*RC[-12] -> 256 | AD707: =RC[-12]*RC[-12] -> 36 | AE707: =RC[-11]/SQRT(RC[-6]*RC[-1]) -> 1 | AF707: =RC[-11]/SQRT(RC[-6]*RC[-2]) -> 1 | AG707: =RC[-11]/SQRT(RC[-6]*RC[-3]) -> 1 | AH707: =RC[-11]/SQRT(RC[-6]*RC[-4]) -> 1.0000000000000002 | AI707: =RC[-11]/SQRT(RC[-6]*RC[-5]) -> 1
A708: 53034 | B708: 北京 | C708: 59 | D708: 良 | E708: 0.83 | F708: 9 | G708: 48 | H708: 38 | I708: 67 | J708: 34 | L708: 2013-06-20T09:00:00.000 | M708: =RC[-8]-R[15]C[-8] -> -0.37391304347826082 | N708: =RC[-8]-R[15]C[-8] -> -6.0869565217391308 | O708: =RC[-8]-R[15]C[-8] -> -7.8260869565217419 | P708: =RC[-8]-R[15]C[-8] -> -25.565217391304351 | Q708: =RC[-8]-R[15]C[-8] -> -36 | R708: =RC[-8]-R[15]C[-8] -> -21 | T708: =RC[-7]*RC[-2] -> 7.8521739130434769 | U708: =RC[-7]*RC[-3] -> 127.82608695652175 | V708: =RC[-7]*RC[-4] -> 164.34782608695659 | W708: =RC[-7]*RC[-5] -> 536.86956521739137 | X708: =RC[-7]*RC[-6] -> 756 | Y708: =RC[-12]*RC[-12] -> 0.13981096408317575 | Z708: =RC[-12]*RC[-12] -> 37.051039697542535 | AA708: =RC[-12]*RC[-12] -> 61.247637051039739 | AB708: =RC[-12]*RC[-12] -> 653.58034026465043 | AC708: =RC[-12]*RC[-12] -> 1296 | AD708: =RC[-12]*RC[-12] -> 441 | AE708: =RC[-11]/SQRT(RC[-6]*RC[-1]) -> 1 | AF708: =RC[-11]/SQRT(RC[-6]*RC[-2]) -> 1.0000000000000002 | AG708: =RC[-11]/SQRT(RC[-6]*RC[-3]) -> 1 | AH708: =RC[-11]/SQRT(RC[-6]*RC[-4]) -> 1 | AI708: =RC[-11]/SQRT(RC[-6]*RC[-5]) -> 1
A709: 53110 | B709: 北京 | C709: 60 | D709: 良 | E709: 0.91 | F709: 21 | G709: 59 | H709: 36 | I709: 84 | J709: 35 | L709: 2013-06-20T10:00:00.000 | M709: =RC[-8]-R[14]C[-8] -> -0.29391304347826075 | N709: =RC[-8]-R[14]C[-8] -> 5.9130434782608692 | O709: =RC[-8]-R[14]C[-8] -> 3.1739130434782581 | P709: =RC[-8]-R[14]C[-8] -> -27.565217391304351 | Q709: =RC[-8]-R[14]C[-8] -> -19 | R709: =RC[-8]-R[14]C[-8] -> -20 | T709: =RC[-7]*RC[-2] -> 5.8782608695652154 | U709: =RC[-7]*RC[-3] -> -118.26086956521738 | V709: =RC[-7]*RC[-4] -> -63.478260869565162 | W709: =RC[-7]*RC[-5] -> 551.304347826087 | X709: =RC[-7]*RC[-6] -> 380 | Y709: =RC[-12]*RC[-12] -> 8.6384877126653992E-2 | Z709: =RC[-12]*RC[-12] -> 34.964083175803395 | AA709: =RC[-12]*RC[-12] -> 10.073724007561419 | AB709: =RC[-12]*RC[-12] -> 759.84120982986781 | AC709: =RC[-12]*RC[-12] -> 361 | AD709: =RC[-12]*RC[-12] -> 400 | AE709: =RC[-11]/SQRT(RC[-6]*RC[-1]) -> 1.0000000000000002 | AF709: =RC[-11]/SQRT(RC[-6]*RC[-2]) -> -1 | AG709: =RC[-11]/SQRT(RC[-6]*RC[-3]) -> -1 | AH709: =RC[-11]/SQRT(RC[-6]*RC[-4]) -> 1 | AI709: =RC[-11]/SQRT(RC[-6]*RC[-5]) -> 1
A710: 53186 | B710: 北京 | C710: 59 | D710: 良 | E710: 0.89 | F710: 9 | G710: 36 | H710: 59 | I710: 65 | J710: 31 | L710: 2013-06-20T11:00:00.000 | M710: =RC[-8]-R[13]C[-8] -> -0.31391304347826077 | N710: =RC[-8]-R[13]C[-8] -> -6.0869565217391308 | O710: =RC[-8]-R[13]C[-8] -> -19.826086956521742 | P710: =RC[-8]-R[13]C[-8] -> -4.5652173913043512 | Q710: =RC[-8]-R[13]C[-8] -> -38 | R710: =RC[-8]-R[13]C[-8] -> -24 | T710: =RC[-7]*RC[-2] -> 7.5339130434782584 | U710: =RC[-7]*RC[-3] -> 146.08695652173913 | V710: =RC[-7]*RC[-4] -> 475.82608695652181 | W710: =RC[-7]*RC[-5] -> 109.56521739130443 | X710: =RC[-7]*RC[-6] -> 912 | Y710: =RC[-12]*RC[-12] -> 9.8541398865784433E-2 | Z710: =RC[-12]*RC[-12] -> 37.051039697542535 | AA710: =RC[-12]*RC[-12] -> 393.07372400756157 | AB710: =RC[-12]*RC[-12] -> 20.841209829867704 | AC710: =RC[-12]*RC[-12] -> 1444 | AD710: =RC[-12]*RC[-12] -> 576 | AE710: =RC[-11]/SQRT(RC[-6]*RC[-1]) -> 1 | AF710: =RC[-11]/SQRT(RC[-6]*RC[-2]) -> 1 | AG710: =RC[-11]/SQRT(RC[-6]*RC[-3]) -> 1 | AH710: =RC[-11]/SQRT(RC[-6]*RC[-4]) -> 1 | AI710: =RC[-11]/SQRT(RC[-6]*RC[-5]) -> 1
A711: 53262 | B711: 北京 | C711: 61 | D711: 良 | E711: 0.73 | F711: 10 | G711: 55 | H711: 81 | I711: 69 | J711: 35 | L711: 2013-06-20T12:00:00.000 | M711: =RC[-8]-R[12]C[-8] -> -0.4739130434782608 | N711: =RC[-8]-R[12]C[-8] -> -5.0869565217391308 | O711: =RC[-8]-R[12]C[-8] -> -0.82608695652174191 | P711: =RC[-8]-R[12]C[-8] -> 17.434782608695649 | Q711: =RC[-8]-R[12]C[-8] -> -34 | R711: =RC[-8]-R[12]C[-8] -> -20 | T711: =RC[-7]*RC[-2] -> 9.4782608695652151 | U711: =RC[-7]*RC[-3] -> 101.73913043478262 | V711: =RC[-7]*RC[-4] -> 16.521739130434838 | W711: =RC[-7]*RC[-5] -> -348.695652173913 | X711: =RC[-7]*RC[-6] -> 680 | Y711: =RC[-12]*RC[-12] -> 0.22459357277882791 | Z711: =RC[-12]*RC[-12] -> 25.877126654064277 | AA711: =RC[-12]*RC[-12] -> 0.68241965973535434 | AB711: =RC[-12]*RC[-12] -> 303.97164461247627 | AC711: =RC[-12]*RC[-12] -> 1156 | AD711: =RC[-12]*RC[-12] -> 400 | AE711: =RC[-11]/SQRT(RC[-6]*RC[-1]) -> 0.99999999999999978 | AF711: =RC[-11]/SQRT(RC[-6]*RC[-2]) -> 1 | AG711: =RC[-11]/SQRT(RC[-6]*RC[-3]) -> 1 | AH711: =RC[-11]/SQRT(RC[-6]*RC[-4]) -> -1 | AI711: =RC[-11]/SQRT(RC[-6]*RC[-5]) -> 1
A712: 53338 | B712: 北京 | C712: 63 | D712: 良 | E712: 0.85 | F712: 21 | G712: 45 | H712: 95 | I712: 59 | J712: 32 | L712: 2013-06-20T13:00:00.000 | M712: =RC[-8]-R[11]C[-8] -> -0.3539130434782608 | N712: =RC[-8]-R[11]C[-8] -> 5.9130434782608692 | O712: =RC[-8]-R[11]C[-8] -> -10.826086956521742 | P712: =RC[-8]-R[11]C[-8] -> 31.434782608695649 | Q712: =RC[-8]-R[11]C[-8] -> -44 | R712: =RC[-8]-R[11]C[-8] -> -23 | T712: =RC[-7]*RC[-2] -> 8.1399999999999988 | U712: =RC[-7]*RC[-3] -> -136 | V712: =RC[-7]*RC[-4] -> 249.00000000000006 | W712: =RC[-7]*RC[-5] -> -722.99999999999989 | X712: =RC[-7]*RC[-6] -> 1012 | Y712: =RC[-12]*RC[-12] -> 0.12525444234404531 | Z712: =RC[-12]*RC[-12] -> 34.964083175803395 | AA712: =RC[-12]*RC[-12] -> 117.2041587901702 | AB712: =RC[-12]*RC[-12] -> 988.14555765595446 | AC712: =RC[-12]*RC[-12] -> 1936 | AD712: =RC[-12]*RC[-12] -> 529 | AE712: =RC[-11]/SQRT(RC[-6]*RC[-1]) -> 1 | AF712: =RC[-11]/SQRT(RC[-6]*RC[-2]) -> -1 | AG712: =RC[-11]/SQRT(RC[-6]*RC[-3]) -> 0.99999999999999989 | AH712: =RC[-11]/SQRT(RC[-6]*RC[-4]) -> -1 | AI712: =RC[-11]/SQRT(RC[-6]*RC[-5]) -> 1
A713: 53414 | B713: 北京 | C713: 63 | D713: 良 | E713: 0.75 | F713: 8 | G713: 38 | H713: 93 | I713: 52 | J713: 32 | L713: 2013-06-20T14:00:00.000 | M713: =RC[-8]-R[10]C[-8] -> -0.45391304347826078 | N713: =RC[-8]-R[10]C[-8] -> -7.0869565217391308 | O713: =RC[-8]-R[10]C[-8] -> -17.826086956521742 | P713: =RC[-8]-R[10]C[-8] -> 29.434782608695649 | Q713: =RC[-8]-R[10]C[-8] -> -51 | R713: =RC[-8]-R[10]C[-8] -> -23 | T713: =RC[-7]*RC[-2] -> 10.439999999999998 | U713: =RC[-7]*RC[-3] -> 163 | V713: =RC[-7]*RC[-4] -> 410.00000000000006 | W713: =RC[-7]*RC[-5] -> -676.99999999999989 | X713: =RC[-7]*RC[-6] -> 1173 | Y713: =RC[-12]*RC[-12] -> 0.20603705103969747 | Z713: =RC[-12]*RC[-12] -> 50.2249527410208 | AA713: =RC[-12]*RC[-12] -> 317.76937618147457 | AB713: =RC[-12]*RC[-12] -> 866.40642722117184 | AC713: =RC[-12]*RC[-12] -> 2601 | AD713: =RC[-12]*RC[-12] -> 529 | AE713: =RC[-11]/SQRT(RC[-6]*RC[-1]) -> 1 | AF713: =RC[-11]/SQRT(RC[-6]*RC[-2]) -> 1 | AG713: =RC[-11]/SQRT(RC[-6]*RC[-3]) -> 1 | AH713: =RC[-11]/SQRT(RC[-6]*RC[-4]) -> -1 | AI713: =RC[-11]/SQRT(RC[-6]*RC[-5]) -> 1
A714: 53490 | B714: 北京 | C714: 65 | D714: 良 | E714: 0.82 | F714: 10 | G714: 36 | H714: 104 | I714: 61 | J714: 32 | L714: 2013-06-20T15:00:00.000 | M714: =RC[-8]-R[9]C[-8] -> -0.38391304347826083 | N714: =RC[-8]-R[9]C[-8] -> -5.0869565217391308 | O714: =RC[-8]-R[9]C[-8] -> -19.826086956521742 | P714: =RC[-8]-R[9]C[-8] -> 40.434782608695649 | Q714: =RC[-8]-R[9]C[-8] -> -42 | R714: =RC[-8]-R[9]C[-8] -> -23 | T714: =RC[-7]*RC[-2] -> 8.8299999999999983 | U714: =RC[-7]*RC[-3] -> 117.00000000000001 | V714: =RC[-7]*RC[-4] -> 456.00000000000006 | W714: =RC[-7]*RC[-5] -> -929.99999999999989 | X714: =RC[-7]*RC[-6] -> 966 | Y714: =RC[-12]*RC[-12] -> 0.14738922495274098 | Z714: =RC[-12]*RC[-12] -> 25.877126654064277 | AA714: =RC[-12]*RC[-12] -> 393.07372400756157 | AB714: =RC[-12]*RC[-12] -> 1634.971644612476 | AC714: =RC[-12]*RC[-12] -> 1764 | AD714: =RC[-12]*RC[-12] -> 529 | AE714: =RC[-11]/SQRT(RC[-6]*RC[-1]) -> 1 | AF714: =RC[-11]/SQRT(RC[-6]*RC[-2]) -> 1 | AG714: =RC[-11]/SQRT(RC[-6]*RC[-3]) -> 1 | AH714: =RC[-11]/SQRT(RC[-6]*RC[-4]) -> -1 | AI714: =RC[-11]/SQRT(RC[-6]*RC[-5]) -> 1
A715: 53566 | B715: 北京 | C715: 69 | D715: 良 | E715: 0.94 | F715: 12 | G715: 40 | H715: 120 | I715: 84 | J715: 45 | L715: 2013-06-20T16:00:00.000 | M715: =RC[-8]-R[8]C[-8] -> -0.26391304347826083 | N715: =RC[-8]-R[8]C[-8] -> -3.0869565217391308 | O715: =RC[-8]-R[8]C[-8] -> -15.826086956521742 | P715: =RC[-8]-R[8]C[-8] -> 56.434782608695649 | Q715: =RC[-8]-R[8]C[-8] -> -19 | R715: =RC[-8]-R[8]C[-8] -> -10 | T715: =RC[-7]*RC[-2] -> 2.6391304347826083 | U715: =RC[-7]*RC[-3] -> 30.869565217391308 | V715: =RC[-7]*RC[-4] -> 158.26086956521743 | W715: =RC[-7]*RC[-5] -> -564.3478260869565 | X715: =RC[-7]*RC[-6] -> 190 | Y715: =RC[-12]*RC[-12] -> 6.9650094517958394E-2 | Z715: =RC[-12]*RC[-12] -> 9.529300567107752 | AA715: =RC[-12]*RC[-12] -> 250.4650283553876 | AB715: =RC[-12]*RC[-12] -> 3184.8846880907367 | AC715: =RC[-12]*RC[-12] -> 361 | AD715: =RC[-12]*RC[-12] -> 100 | AE715: =RC[-11]/SQRT(RC[-6]*RC[-1]) -> 1 | AF715: =RC[-11]/SQRT(RC[-6]*RC[-2]) -> 1.0000000000000002 | AG715: =RC[-11]/SQRT(RC[-6]*RC[-3]) -> 1.0000000000000002 | AH715: =RC[-11]/SQRT(RC[-6]*RC[-4]) -> -1 | AI715: =RC[-11]/SQRT(RC[-6]*RC[-5]) -> 1
A716: 53642 | B716: 北京 | C716: 73 | D716: 良 | E716: 1.24 | F716: 18 | G716: 40 | H716: 129 | I716: 112 | J716: 54 | L716: 2013-06-20T17:00:00.000 | M716: =RC[-8]-R[7]C[-8] -> 3.6086956521739211E-2 | N716: =RC[-8]-R[7]C[-8] -> 2.9130434782608692 | O716: =RC[-8]-R[7]C[-8] -> -15.826086956521742 | P716: =RC[-8]-R[7]C[-8] -> 65.434782608695656 | Q716: =RC[-8]-R[7]C[-8] -> 9 | R716: =RC[-8]-R[7]C[-8] -> -1 | T716: =RC[-7]*RC[-2] -> -3.6086956521739211E-2 | U716: =RC[-7]*RC[-3] -> -2.9130434782608692 | V716: =RC[-7]*RC[-4] -> 15.826086956521742 | W716: =RC[-7]*RC[-5] -> -65.434782608695656 | X716: =RC[-7]*RC[-6] -> -9 | Y716: =RC[-12]*RC[-12] -> 1.3022684310018962E-3 | Z716: =RC[-12]*RC[-12] -> 8.4858223062381821 | AA716: =RC[-12]*RC[-12] -> 250.4650283553876 | AB716: =RC[-12]*RC[-12] -> 4281.7107750472596 | AC716: =RC[-12]*RC[-12] -> 81 | AD716: =RC[-12]*RC[-12] -> 1 | AE716: =RC[-11]/SQRT(RC[-6]*RC[-1]) -> -1 | AF716: =RC[-11]/SQRT(RC[-6]*RC[-2]) -> -1 | AG716: =RC[-11]/SQRT(RC[-6]*RC[-3]) -> 1 | AH716: =RC[-11]/SQRT(RC[-6]*RC[-4]) -> -1 | AI716: =RC[-11]/SQRT(RC[-6]*RC[-5]) -> -1
A717: 53718 | B717: 北京 | C717: 74 | D717: 良 | E717: 1.46 | F717: 20 | G717: 50 | H717: 110 | I717: 126 | J717: 46 | L717: 2013-06-20T18:00:00.000 | M717: =RC[-8]-R[6]C[-8] -> 0.25608695652173918 | N717: =RC[-8]-R[6]C[-8] -> 4.9130434782608692 | O717: =RC[-8]-R[6]C[-8] -> -5.8260869565217419 | P717: =RC[-8]-R[6]C[-8] -> 46.434782608695649 | Q717: =RC[-8]-R[6]C[-8] -> 23 | R717: =RC[-8]-R[6]C[-8] -> -9 | T717: =RC[-7]*RC[-2] -> -2.3047826086956524 | U717: =RC[-7]*RC[-3] -> -44.217391304347821 | V717: =RC[-7]*RC[-4] -> 52.434782608695677 | W717: =RC[-7]*RC[-5] -> -417.91304347826082 | X717: =RC[-7]*RC[-6] -> -207 | Y717: =RC[-12]*RC[-12] -> 6.5580529300567139E-2 | Z717: =RC[-12]*RC[-12] -> 24.137996219281661 | AA717: =RC[-12]*RC[-12] -> 33.943289224952771 | AB717: =RC[-12]*RC[-12] -> 2156.1890359168237 | AC717: =RC[-12]*RC[-12] -> 529 | AD717: =RC[-12]*RC[-12] -> 81 | AE717: =RC[-11]/SQRT(RC[-6]*RC[-1]) -> -0.99999999999999978 | AF717: =RC[-11]/SQRT(RC[-6]*RC[-2]) -> -1 | AG717: =RC[-11]/SQRT(RC[-6]*RC[-3]) -> 1 | AH717: =RC[-11]/SQRT(RC[-6]*RC[-4]) -> -1 | AI717: =RC[-11]/SQRT(RC[-6]*RC[-5]) -> -1
A718: 53794 | B718: 北京 | C718: 73 | D718: 良 | E718: 1.74 | F718: 22 | G718: 56 | H718: 89 | I718: 86 | J718: 44 | L718: 2013-06-20T19:00:00.000 | M718: =RC[-8]-R[5]C[-8] -> 0.53608695652173921 | N718: =RC[-8]-R[5]C[-8] -> 6.9130434782608692 | O718: =RC[-8]-R[5]C[-8] -> 0.17391304347825809 | P718: =RC[-8]-R[5]C[-8] -> 25.434782608695649 | Q718: =RC[-8]-R[5]C[-8] -> -17 | R718: =RC[-8]-R[5]C[-8] -> -11 | T718: =RC[-7]*RC[-2] -> -5.8969565217391313 | U718: =RC[-7]*RC[-3] -> -76.043478260869563 | V718: =RC[-7]*RC[-4] -> -1.913043478260839 | W718: =RC[-7]*RC[-5] -> -279.78260869565213 | X718: =RC[-7]*RC[-6] -> 187 | Y718: =RC[-12]*RC[-12] -> 0.28738922495274111 | Z718: =RC[-12]*RC[-12] -> 47.790170132325137 | AA718: =RC[-12]*RC[-12] -> 3.0245746691870488E-2 | AB718: =RC[-12]*RC[-12] -> 646.92816635160659 | AC718: =RC[-12]*RC[-12] -> 289 | AD718: =RC[-12]*RC[-12] -> 121 | AE718: =RC[-11]/SQRT(RC[-6]*RC[-1]) -> -1 | AF718: =RC[-11]/SQRT(RC[-6]*RC[-2]) -> -1 | AG718: =RC[-11]/SQRT(RC[-6]*RC[-3]) -> -1 | AH718: =RC[-11]/SQRT(RC[-6]*RC[-4]) -> -1 | AI718: =RC[-11]/SQRT(RC[-6]*RC[-5]) -> 1
A719: 53870 | B719: 北京 | C719: 73 | D719: 良 | E719: 1.93 | F719: 27 | G719: 57 | H719: 68 | I719: 112 | J719: 74 | L719: 2013-06-20T20:00:00.000 | M719: =RC[-8]-R[4]C[-8] -> 0.72608695652173916 | N719: =RC[-8]-R[4]C[-8] -> 11.913043478260869 | O719: =RC[-8]-R[4]C[-8] -> 1.1739130434782581 | P719: =RC[-8]-R[4]C[-8] -> 4.4347826086956488 | Q719: =RC[-8]-R[4]C[-8] -> 9 | R719: =RC[-8]-R[4]C[-8] -> 19 | T719: =RC[-7]*RC[-2] -> 13.795652173913044 | U719: =RC[-7]*RC[-3] -> 226.3478260869565 | V719: =RC[-7]*RC[-4] -> 22.304347826086904 | W719: =RC[-7]*RC[-5] -> 84.26086956521732 | X719: =RC[-7]*RC[-6] -> 171 | Y719: =RC[-12]*RC[-12] -> 0.52720226843100193 | Z719: =RC[-12]*RC[-12] -> 141.92060491493382 | AA719: =RC[-12]*RC[-12] -> 1.3780718336483866 | AB719: =RC[-12]*RC[-12] -> 19.667296786389382 | AC719: =RC[-12]*RC[-12] -> 81 | AD719: =RC[-12]*RC[-12] -> 361 | AE719: =RC[-11]/SQRT(RC[-6]*RC[-1]) -> 1 | AF719: =RC[-11]/SQRT(RC[-6]*RC[-2]) -> 1 | AG719: =RC[-11]/SQRT(RC[-6]*RC[-3]) -> 1 | AH719: =RC[-11]/SQRT(RC[-6]*RC[-4]) -> 1 | AI719: =RC[-11]/SQRT(RC[-6]*RC[-5]) -> 1
A720: 53946 | B720: 北京 | C720: 76 | D720: 良 | E720: 2.0499999999999998 | F720: 32 | G720: 72 | H720: 58 | I720: 192 | J720: 98 | L720: 2013-06-20T21:00:00.000 | M720: =RC[-8]-R[3]C[-8] -> 0.84608695652173904 | N720: =RC[-8]-R[3]C[-8] -> 16.913043478260867 | O720: =RC[-8]-R[3]C[-8] -> 16.173913043478258 | P720: =RC[-8]-R[3]C[-8] -> -5.5652173913043512 | Q720: =RC[-8]-R[3]C[-8] -> 89 | R720: =RC[-8]-R[3]C[-8] -> 43 | T720: =RC[-7]*RC[-2] -> 36.381739130434781 | U720: =RC[-7]*RC[-3] -> 727.26086956521726 | V720: =RC[-7]*RC[-4] -> 695.47826086956513 | W720: =RC[-7]*RC[-5] -> -239.30434782608711 | X720: =RC[-7]*RC[-6] -> 3827 | Y720: =RC[-12]*RC[-12] -> 0.71586313799621915 | Z720: =RC[-12]*RC[-12] -> 286.05103969754248 | AA720: =RC[-12]*RC[-12] -> 261.59546313799615 | AB720: =RC[-12]*RC[-12] -> 30.971644612476407 | AC720: =RC[-12]*RC[-12] -> 7921 | AD720: =RC[-12]*RC[-12] -> 1849 | AE720: =RC[-11]/SQRT(RC[-6]*RC[-1]) -> 1 | AF720: =RC[-11]/SQRT(RC[-6]*RC[-2]) -> 1 | AG720: =RC[-11]/SQRT(RC[-6]*RC[-3]) -> 1 | AH720: =RC[-11]/SQRT(RC[-6]*RC[-4]) -> -1 | AI720: =RC[-11]/SQRT(RC[-6]*RC[-5]) -> 1
A721: 54022 | B721: 北京 | C721: 80 | D721: 良 | E721: 2.2200000000000002 | F721: 29 | G721: 67 | H721: 44 | I721: 213 | J721: 120 | L721: 2013-06-20T22:00:00.000 | M721: =RC[-8]-R[2]C[-8] -> 1.0160869565217394 | N721: =RC[-8]-R[2]C[-8] -> 13.913043478260869 | O721: =RC[-8]-R[2]C[-8] -> 11.173913043478258 | P721: =RC[-8]-R[2]C[-8] -> -19.565217391304351 | Q721: =RC[-8]-R[2]C[-8] -> 110 | R721: =RC[-8]-R[2]C[-8] -> 65 | T721: =RC[-7]*RC[-2] -> 66.045652173913055 | U721: =RC[-7]*RC[-3] -> 904.3478260869565 | V721: =RC[-7]*RC[-4] -> 726.30434782608677 | W721: =RC[-7]*RC[-5] -> -1271.7391304347827 | X721: =RC[-7]*RC[-6] -> 7150 | Y721: =RC[-12]*RC[-12] -> 1.0324327032136111 | Z721: =RC[-12]*RC[-12] -> 193.57277882797732 | AA721: =RC[-12]*RC[-12] -> 124.85633270321355 | AB721: =RC[-12]*RC[-12] -> 382.79773156899824 | AC721: =RC[-12]*RC[-12] -> 12100 | AD721: =RC[-12]*RC[-12] -> 4225 | AE721: =RC[-11]/SQRT(RC[-6]*RC[-1]) -> 1 | AF721: =RC[-11]/SQRT(RC[-6]*RC[-2]) -> 1 | AG721: =RC[-11]/SQRT(RC[-6]*RC[-3]) -> 1 | AH721: =RC[-11]/SQRT(RC[-6]*RC[-4]) -> -0.99999999999999978 | AI721: =RC[-11]/SQRT(RC[-6]*RC[-5]) -> 1
A722: 54098 | B722: 北京 | C722: 82 | D722: 良 | E722: 1.86 | F722: 22 | G722: 67 | H722: 35 | I722: 124 | J722: 97 | L722: 2013-06-20T23:00:00.000 | M722: =RC[-8]-R[1]C[-8] -> 0.65608695652173932 | N722: =RC[-8]-R[1]C[-8] -> 6.9130434782608692 | O722: =RC[-8]-R[1]C[-8] -> 11.173913043478258 | P722: =RC[-8]-R[1]C[-8] -> -28.565217391304351 | Q722: =RC[-8]-R[1]C[-8] -> 21 | R722: =RC[-8]-R[1]C[-8] -> 42 | T722: =RC[-7]*RC[-2] -> 27.555652173913053 | U722: =RC[-7]*RC[-3] -> 290.3478260869565 | V722: =RC[-7]*RC[-4] -> 469.30434782608683 | W722: =RC[-7]*RC[-5] -> -1199.7391304347827 | X722: =RC[-7]*RC[-6] -> 882 | Y722: =RC[-12]*RC[-12] -> 0.43045009451795868 | Z722: =RC[-12]*RC[-12] -> 47.790170132325137 | AA722: =RC[-12]*RC[-12] -> 124.85633270321355 | AB722: =RC[-12]*RC[-12] -> 815.97164461247655 | AC722: =RC[-12]*RC[-12] -> 441 | AD722: =RC[-12]*RC[-12] -> 1764 | AE722: =RC[-11]/SQRT(RC[-6]*RC[-1]) -> 1 | AF722: =RC[-11]/SQRT(RC[-6]*RC[-2]) -> 1 | AG722: =RC[-11]/SQRT(RC[-6]*RC[-3]) -> 1 | AH722: =RC[-11]/SQRT(RC[-6]*RC[-4]) -> -1 | AI722: =RC[-11]/SQRT(RC[-6]*RC[-5]) -> 1
E723: =AVERAGE(R[-23]C:R[-1]C) -> 1.2039130434782608 | F723: =AVERAGE(R[-23]C:R[-1]C) -> 15.086956521739131 | G723: =AVERAGE(R[-23]C:R[-1]C) -> 55.826086956521742 | H723: =AVERAGE(R[-23]C:R[-1]C) -> 63.565217391304351 | I723: =AVERAGE(R[-23]C:R[-1]C) -> 103 | J723: =AVERAGE(R[-23]C:R[-1]C) -> 55 | M723: =RC[-8]-RC[-8] -> 0 | N723: =RC[-8]-RC[-8] -> 0 | O723: =RC[-8]-RC[-8] -> 0 | P723: =RC[-8]-RC[-8] -> 0 | Q723: =RC[-8]-RC[-8] -> 0 | R723: =RC[-8]-RC[-8] -> 0 | T723: =SUM(R[-23]C:R[-1]C) -> 282.52478260869566 | U723: =SUM(R[-23]C:R[-1]C) -> 3330.217391304348 | V723: =SUM(R[-23]C:R[-1]C) -> 8346.565217391304 | W723: =SUM(R[-23]C:R[-1]C) -> -3644.086956521739 | X723: =SUM(R[-23]C:R[-1]C) -> 26745 | Y723: =SUM(R[-23]C:R[-1]C) -> 5.7559064272211717 | Z723: =SUM(R[-23]C:R[-1]C) -> 1408.1228733459354 | AA723: =SUM(R[-23]C:R[-1]C) -> 7358.4914933837417 | AB723: =SUM(R[-23]C:R[-1]C) -> 22777.289224952739 | AC723: =SUM(R[-23]C:R[-1]C) -> 47071 | AD723: =SUM(R[-23]C:R[-1]C) -> 17249 | AE723: =RC[-11]/SQRT(RC[-6]*RC[-1]) -> 0.89663920827951915 | AF723: =RC[-11]/SQRT(RC[-6]*RC[-2]) -> 0.67572555991938721 | AG723: =RC[-11]/SQRT(RC[-6]*RC[-3]) -> 0.74085195967116935 | AH723: =RC[-11]/SQRT(RC[-6]*RC[-4]) -> -0.18384666341607864 | AI723: =RC[-11]/SQRT(RC[-6]*RC[-5]) -> 0.93860730247056645
A724: 54174 | B724: 北京 | C724: 82 | D724: 良 | E724: 1.45 | F724: 15 | G724: 56 | H724: 29 | I724: 107 | J724: 60 | L724: 2013-06-21T00:00:00.000 | M724: =RC[-8]-R[19]C[-8] -> 0.64999999999999991 | N724: =RC[-8]-R[19]C[-8] -> 9 | O724: =RC[-8]-R[19]C[-8] -> 14 | P724: =RC[-8]-R[19]C[-8] -> -62 | Q724: =RC[-8]-R[19]C[-8] -> 31 | R724: =RC[-8]-R[19]C[-8] -> 6 | T724: =RC[-7]*RC[-2] -> 3.8999999999999995 | U724: =RC[-7]*RC[-3] -> 54 | V724: =RC[-7]*RC[-4] -> 84 | W724: =RC[-7]*RC[-5] -> -372 | X724: =RC[-7]*RC[-6] -> 186 | Y724: =RC[-12]*RC[-12] -> 0.42249999999999988 | Z724: =RC[-12]*RC[-12] -> 81 | AA724: =RC[-12]*RC[-12] -> 196 | AB724: =RC[-12]*RC[-12] -> 3844 | AC724: =RC[-12]*RC[-12] -> 961 | AD724: =RC[-12]*RC[-12] -> 36 | AE724: =RC[-11]/SQRT(RC[-6]*RC[-1]) -> 1 | AF724: =RC[-11]/SQRT(RC[-6]*RC[-2]) -> 1 | AG724: =RC[-11]/SQRT(RC[-6]*RC[-3]) -> 1 | AH724: =RC[-11]/SQRT(RC[-6]*RC[-4]) -> -1 | AI724: =RC[-11]/SQRT(RC[-6]*RC[-5]) -> 1
A725: 54250 | B725: 北京 | C725: 81 | D725: 良 | E725: 1.38 | F725: 12 | G725: 53 | H725: 20 | I725: 89 | J725: 51 | L725: 2013-06-21T01:00:00.000 | M725: =RC[-8]-R[23]C[-8] -> 0.45125000000000004 | N725: =RC[-8]-R[23]C[-8] -> 2.625 | O725: =RC[-8]-R[23]C[-8] -> 10.541666666666664 | P725: =RC[-8]-R[23]C[-8] -> -50.333333333333329 | Q725: =RC[-8]-R[23]C[-8] -> 4.3333333333333286 | R725: =RC[-8]-R[23]C[-8] -> 5.6666666666666643 | T725: =RC[-7]*RC[-2] -> 2.5570833333333325 | U725: =RC[-7]*RC[-3] -> 14.874999999999993 | V725: =RC[-7]*RC[-4] -> 59.736111111111072 | W725: =RC[-7]*RC[-5] -> -285.22222222222206 | X725: =RC[-7]*RC[-6] -> 24.555555555555518 | Y725: =RC[-12]*RC[-12] -> 0.20362656250000002 | Z725: =RC[-12]*RC[-12] -> 6.890625 | AA725: =RC[-12]*RC[-12] -> 111.12673611111106 | AB725: =RC[-12]*RC[-12] -> 2533.4444444444439 | AC725: =RC[-12]*RC[-12] -> 18.777777777777736 | AD725: =RC[-12]*RC[-12] -> 32.111111111111086 | AE725: =RC[-11]/SQRT(RC[-6]*RC[-1]) -> 1 | AF725: =RC[-11]/SQRT(RC[-6]*RC[-2]) -> 0.99999999999999989 | AG725: =RC[-11]/SQRT(RC[-6]*RC[-3]) -> 1 | AH725: =RC[-11]/SQRT(RC[-6]*RC[-4]) -> -1 | AI725: =RC[-11]/SQRT(RC[-6]*RC[-5]) -> 1
A726: 54326 | B726: 北京 | C726: 81 | D726: 良 | E726: 1.41 | F726: 13 | G726: 58 | H726: 12 | I726: 95 | J726: 50 | L726: 2013-06-21T02:00:00.000 | M726: =RC[-8]-R[22]C[-8] -> 0.48125000000000007 | N726: =RC[-8]-R[22]C[-8] -> 3.625 | O726: =RC[-8]-R[22]C[-8] -> 15.541666666666664 | P726: =RC[-8]-R[22]C[-8] -> -58.333333333333329 | Q726: =RC[-8]-R[22]C[-8] -> 10.333333333333329 | R726: =RC[-8]-R[22]C[-8] -> 4.6666666666666643 | T726: =RC[-7]*RC[-2] -> 2.2458333333333327 | U726: =RC[-7]*RC[-3] -> 16.916666666666657 | V726: =RC[-7]*RC[-4] -> 72.527777777777729 | W726: =RC[-7]*RC[-5] -> -272.22222222222206 | X726: =RC[-7]*RC[-6] -> 48.222222222222179 | Y726: =RC[-12]*RC[-12] -> 0.23160156250000005 | Z726: =RC[-12]*RC[-12] -> 13.140625 | AA726: =RC[-12]*RC[-12] -> 241.54340277777771 | AB726: =RC[-12]*RC[-12] -> 3402.7777777777774 | AC726: =RC[-12]*RC[-12] -> 106.77777777777769 | AD726: =RC[-12]*RC[-12] -> 21.777777777777757 | AE726: =RC[-11]/SQRT(RC[-6]*RC[-1]) -> 1.0000000000000002 | AF726: =RC[-11]/SQRT(RC[-6]*RC[-2]) -> 0.99999999999999978 | AG726: =RC[-11]/SQRT(RC[-6]*RC[-3]) -> 1 | AH726: =RC[-11]/SQRT(RC[-6]*RC[-4]) -> -1 | AI726: =RC[-11]/SQRT(RC[-6]*RC[-5]) -> 1
A727: 54402 | B727: 北京 | C727: 81 | D727: 良 | E727: 1.49 | F727: 10 | G727: 59 | H727: 10 | I727: 102 | J727: 57 | L727: 2013-06-21T03:00:00.000 | M727: =RC[-8]-R[21]C[-8] -> 0.56125000000000014 | N727: =RC[-8]-R[21]C[-8] -> 0.625 | O727: =RC[-8]-R[21]C[-8] -> 16.541666666666664 | P727: =RC[-8]-R[21]C[-8] -> -60.333333333333329 | Q727: =RC[-8]-R[21]C[-8] -> 17.333333333333329 | R727: =RC[-8]-R[21]C[-8] -> 11.666666666666664 | T727: =RC[-7]*RC[-2] -> 6.5479166666666666 | U727: =RC[-7]*RC[-3] -> 7.2916666666666652 | V727: =RC[-7]*RC[-4] -> 192.98611111111106 | W727: =RC[-7]*RC[-5] -> -703.88888888888869 | X727: =RC[-7]*RC[-6] -> 202.22222222222211 | Y727: =RC[-12]*RC[-12] -> 0.31500156250000017 | Z727: =RC[-12]*RC[-12] -> 0.390625 | AA727: =RC[-12]*RC[-12] -> 273.62673611111103 | AB727: =RC[-12]*RC[-12] -> 3640.1111111111104 | AC727: =RC[-12]*RC[-12] -> 300.44444444444429 | AD727: =RC[-12]*RC[-12] -> 136.11111111111106 | AE727: =RC[-11]/SQRT(RC[-6]*RC[-1]) -> 0.99999999999999989 | AF727: =RC[-11]/SQRT(RC[-6]*RC[-2]) -> 1 | AG727: =RC[-11]/SQRT(RC[-6]*RC[-3]) -> 1 | AH727: =RC[-11]/SQRT(RC[-6]*RC[-4]) -> -1 | AI727: =RC[-11]/SQRT(RC[-6]*RC[-5]) -> 0.99999999999999989
A728: 54478 | B728: 北京 | C728: 82 | D728: 良 | E728: 1.35 | F728: 9 | G728: 54 | H728: 9 | I728: 113 | J728: 71 | L728: 2013-06-21T04:00:00.000 | M728: =RC[-8]-R[20]C[-8] -> 0.42125000000000024 | N728: =RC[-8]-R[20]C[-8] -> -0.375 | O728: =RC[-8]-R[20]C[-8] -> 11.541666666666664 | P728: =RC[-8]-R[20]C[-8] -> -61.333333333333329 | Q728: =RC[-8]-R[20]C[-8] -> 28.333333333333329 | R728: =RC[-8]-R[20]C[-8] -> 25.666666666666664 | T728: =RC[-7]*RC[-2] -> 10.812083333333339 | U728: =RC[-7]*RC[-3] -> -9.625 | V728: =RC[-7]*RC[-4] -> 296.23611111111103 | W728: =RC[-7]*RC[-5] -> -1574.2222222222219 | X728: =RC[-7]*RC[-6] -> 727.22222222222206 | Y728: =RC[-12]*RC[-12] -> 0.17745156250000019 | Z728: =RC[-12]*RC[-12] -> 0.140625 | AA728: =RC[-12]*RC[-12] -> 133.2100694444444 | AB728: =RC[-12]*RC[-12] -> 3761.7777777777774 | AC728: =RC[-12]*RC[-12] -> 802.77777777777749 | AD728: =RC[-12]*RC[-12] -> 658.7777777777776 | AE728: =RC[-11]/SQRT(RC[-6]*RC[-1]) -> 1.0000000000000002 | AF728: =RC[-11]/SQRT(RC[-6]*RC[-2]) -> -1.0000000000000002 | AG728: =RC[-11]/SQRT(RC[-6]*RC[-3]) -> 1 | AH728: =RC[-11]/SQRT(RC[-6]*RC[-4]) -> -1 | AI728: =RC[-11]/SQRT(RC[-6]*RC[-5]) -> 1
A729: 54554 | B729: 北京 | C729: 82 | D729: 良 | E729: 1.08 | F729: 8 | G729: 55 | H729: 9 | I729: 89 | J729: 57 | L729: 2013-06-21T05:00:00.000 | M729: =RC[-8]-R[19]C[-8] -> 0.15125000000000022 | N729: =RC[-8]-R[19]C[-8] -> -1.375 | O729: =RC[-8]-R[19]C[-8] -> 12.541666666666664 | P729: =RC[-8]-R[19]C[-8] -> -61.333333333333329 | Q729: =RC[-8]-R[19]C[-8] -> 4.3333333333333286 | R729: =RC[-8]-R[19]C[-8] -> 11.666666666666664 | T729: =RC[-7]*RC[-2] -> 1.7645833333333356 | U729: =RC[-7]*RC[-3] -> -16.041666666666664 | V729: =RC[-7]*RC[-4] -> 146.3194444444444 | W729: =RC[-7]*RC[-5] -> -715.55555555555532 | X729: =RC[-7]*RC[-6] -> 50.555555555555493 | Y729: =RC[-12]*RC[-12] -> 2.2876562500000065E-2 | Z729: =RC[-12]*RC[-12] -> 1.890625 | AA729: =RC[-12]*RC[-12] -> 157.29340277777771 | AB729: =RC[-12]*RC[-12] -> 3761.7777777777774 | AC729: =RC[-12]*RC[-12] -> 18.777777777777736 | AD729: =RC[-12]*RC[-12] -> 136.11111111111106 | AE729: =RC[-11]/SQRT(RC[-6]*RC[-1]) -> 1 | AF729: =RC[-11]/SQRT(RC[-6]*RC[-2]) -> -1 | AG729: =RC[-11]/SQRT(RC[-6]*RC[-3]) -> 1.0000000000000002 | AH729: =RC[-11]/SQRT(RC[-6]*RC[-4]) -> -1 | AI729: =RC[-11]/SQRT(RC[-6]*RC[-5]) -> 1.0000000000000002
A730: 54630 | B730: 北京 | C730: 80 | D730: 良 | E730: 0.95 | F730: 7 | G730: 48 | H730: 10 | I730: 81 | J730: 42 | L730: 2013-06-21T06:00:00.000 | M730: =RC[-8]-R[18]C[-8] -> 2.1250000000000102E-2 | N730: =RC[-8]-R[18]C[-8] -> -2.375 | O730: =RC[-8]-R[18]C[-8] -> 5.5416666666666643 | P730: =RC[-8]-R[18]C[-8] -> -60.333333333333329 | Q730: =RC[-8]-R[18]C[-8] -> -3.6666666666666714 | R730: =RC[-8]-R[18]C[-8] -> -3.3333333333333357 | T730: =RC[-7]*RC[-2] -> -7.083333333333372E-2 | U730: =RC[-7]*RC[-3] -> 7.9166666666666723 | V730: =RC[-7]*RC[-4] -> -18.472222222222229 | W730: =RC[-7]*RC[-5] -> 201.11111111111123 | X730: =RC[-7]*RC[-6] -> 12.222222222222246 | Y730: =RC[-12]*RC[-12] -> 4.5156250000000432E-4 | Z730: =RC[-12]*RC[-12] -> 5.640625 | AA730: =RC[-12]*RC[-12] -> 30.710069444444418 | AB730: =RC[-12]*RC[-12] -> 3640.1111111111104 | AC730: =RC[-12]*RC[-12] -> 13.444444444444478 | AD730: =RC[-12]*RC[-12] -> 11.111111111111127 | AE730: =RC[-11]/SQRT(RC[-6]*RC[-1]) -> -1 | AF730: =RC[-11]/SQRT(RC[-6]*RC[-2]) -> 1 | AG730: =RC[-11]/SQRT(RC[-6]*RC[-3]) -> -1 | AH730: =RC[-11]/SQRT(RC[-6]*RC[-4]) -> 1 | AI730: =RC[-11]/SQRT(RC[-6]*RC[-5]) -> 1
A731: 54706 | B731: 北京 | C731: 80 | D731: 良 | E731: 0.98 | F731: 8 | G731: 46 | H731: 14 | I731: 86 | J731: 44 | L731: 2013-06-21T07:00:00.000 | M731: =RC[-8]-R[17]C[-8] -> 5.1250000000000129E-2 | N731: =RC[-8]-R[17]C[-8] -> -1.375 | O731: =RC[-8]-R[17]C[-8] -> 3.5416666666666643 | P731: =RC[-8]-R[17]C[-8] -> -56.333333333333329 | Q731: =RC[-8]-R[17]C[-8] -> 1.3333333333333286 | R731: =RC[-8]-R[17]C[-8] -> -1.3333333333333357 | T731: =RC[-7]*RC[-2] -> -6.8333333333333621E-2 | U731: =RC[-7]*RC[-3] -> 1.8333333333333366 | V731: =RC[-7]*RC[-4] -> -4.7222222222222276 | W731: =RC[-7]*RC[-5] -> 75.111111111111242 | X731: =RC[-7]*RC[-6] -> -1.7777777777777746 | Y731: =RC[-12]*RC[-12] -> 2.626562500000013E-3 | Z731: =RC[-12]*RC[-12] -> 1.890625 | AA731: =RC[-12]*RC[-12] -> 12.543402777777761 | AB731: =RC[-12]*RC[-12] -> 3173.4444444444439 | AC731: =RC[-12]*RC[-12] -> 1.7777777777777652 | AD731: =RC[-12]*RC[-12] -> 1.7777777777777841 | AE731: =RC[-11]/SQRT(RC[-6]*RC[-1]) -> -1 | AF731: =RC[-11]/SQRT(RC[-6]*RC[-2]) -> 1 | AG731: =RC[-11]/SQRT(RC[-6]*RC[-3]) -> -1 | AH731: =RC[-11]/SQRT(RC[-6]*RC[-4]) -> 1 | AI731: =RC[-11]/SQRT(RC[-6]*RC[-5]) -> -0.99999999999999989
A732: 54782 | B732: 北京 | C732: 79 | D732: 良 | E732: 1.05 | F732: 10 | G732: 54 | H732: 21 | I732: 94 | J732: 41 | L732: 2013-06-21T08:00:00.000 | M732: =RC[-8]-R[16]C[-8] -> 0.12125000000000019 | N732: =RC[-8]-R[16]C[-8] -> 0.625 | O732: =RC[-8]-R[16]C[-8] -> 11.541666666666664 | P732: =RC[-8]-R[16]C[-8] -> -49.333333333333329 | Q732: =RC[-8]-R[16]C[-8] -> 9.3333333333333286 | R732: =RC[-8]-R[16]C[-8] -> -4.3333333333333357 | T732: =RC[-7]*RC[-2] -> -0.52541666666666775 | U732: =RC[-7]*RC[-3] -> -2.7083333333333348 | V732: =RC[-7]*RC[-4] -> -50.013888888888907 | W732: =RC[-7]*RC[-5] -> 213.77777777777789 | X732: =RC[-7]*RC[-6] -> -40.444444444444443 | Y732: =RC[-12]*RC[-12] -> 1.4701562500000046E-2 | Z732: =RC[-12]*RC[-12] -> 0.390625 | AA732: =RC[-12]*RC[-12] -> 133.2100694444444 | AB732: =RC[-12]*RC[-12] -> 2433.7777777777774 | AC732: =RC[-12]*RC[-12] -> 87.111111111111029 | AD732: =RC[-12]*RC[-12] -> 18.7777777777778 | AE732: =RC[-11]/SQRT(RC[-6]*RC[-1]) -> -1 | AF732: =RC[-11]/SQRT(RC[-6]*RC[-2]) -> -1 | AG732: =RC[-11]/SQRT(RC[-6]*RC[-3]) -> -1 | AH732: =RC[-11]/SQRT(RC[-6]*RC[-4]) -> 1 | AI732: =RC[-11]/SQRT(RC[-6]*RC[-5]) -> -0.99999999999999978
A733: 54858 | B733: 北京 | C733: 81 | D733: 良 | E733: 1.1000000000000001 | F733: 14 | G733: 58 | H733: 43 | I733: 108 | J733: 50 | L733: 2013-06-21T09:00:00.000 | M733: =RC[-8]-R[15]C[-8] -> 0.17125000000000024 | N733: =RC[-8]-R[15]C[-8] -> 4.625 | O733: =RC[-8]-R[15]C[-8] -> 15.541666666666664 | P733: =RC[-8]-R[15]C[-8] -> -27.333333333333329 | Q733: =RC[-8]-R[15]C[-8] -> 23.333333333333329 | R733: =RC[-8]-R[15]C[-8] -> 4.6666666666666643 | T733: =RC[-7]*RC[-2] -> 0.79916666666666736 | U733: =RC[-7]*RC[-3] -> 21.583333333333321 | V733: =RC[-7]*RC[-4] -> 72.527777777777729 | W733: =RC[-7]*RC[-5] -> -127.55555555555547 | X733: =RC[-7]*RC[-6] -> 108.88888888888881 | Y733: =RC[-12]*RC[-12] -> 2.932656250000008E-2 | Z733: =RC[-12]*RC[-12] -> 21.390625 | AA733: =RC[-12]*RC[-12] -> 241.54340277777771 | AB733: =RC[-12]*RC[-12] -> 747.11111111111086 | AC733: =RC[-12]*RC[-12] -> 544.44444444444423 | AD733: =RC[-12]*RC[-12] -> 21.777777777777757 | AE733: =RC[-11]/SQRT(RC[-6]*RC[-1]) -> 1 | AF733: =RC[-11]/SQRT(RC[-6]*RC[-2]) -> 1 | AG733: =RC[-11]/SQRT(RC[-6]*RC[-3]) -> 1 | AH733: =RC[-11]/SQRT(RC[-6]*RC[-4]) -> -1 | AI733: =RC[-11]/SQRT(RC[-6]*RC[-5]) -> 1
A734: 54934 | B734: 北京 | C734: 81 | D734: 良 | E734: 1.05 | F734: 16 | G734: 54 | H734: 70 | I734: 92 | J734: 53 | L734: 2013-06-21T10:00:00.000 | M734: =RC[-8]-R[14]C[-8] -> 0.12125000000000019 | N734: =RC[-8]-R[14]C[-8] -> 6.625 | O734: =RC[-8]-R[14]C[-8] -> 11.541666666666664 | P734: =RC[-8]-R[14]C[-8] -> -0.3333333333333286 | Q734: =RC[-8]-R[14]C[-8] -> 7.3333333333333286 | R734: =RC[-8]-R[14]C[-8] -> 7.6666666666666643 | T734: =RC[-7]*RC[-2] -> 0.92958333333333454 | U734: =RC[-7]*RC[-3] -> 50.79166666666665 | V734: =RC[-7]*RC[-4] -> 88.486111111111072 | W734: =RC[-7]*RC[-5] -> -2.5555555555555185 | X734: =RC[-7]*RC[-6] -> 56.222222222222172 | Y734: =RC[-12]*RC[-12] -> 1.4701562500000046E-2 | Z734: =RC[-12]*RC[-12] -> 43.890625 | AA734: =RC[-12]*RC[-12] -> 133.2100694444444 | AB734: =RC[-12]*RC[-12] -> 0.11111111111110795 | AC734: =RC[-12]*RC[-12] -> 53.777777777777708 | AD734: =RC[-12]*RC[-12] -> 58.777777777777743 | AE734: =RC[-11]/SQRT(RC[-6]*RC[-1]) -> 1 | AF734: =RC[-11]/SQRT(RC[-6]*RC[-2]) -> 0.99999999999999989 | AG734: =RC[-11]/SQRT(RC[-6]*RC[-3]) -> 1 | AH734: =RC[-11]/SQRT(RC[-6]*RC[-4]) -> -1 | AI734: =RC[-11]/SQRT(RC[-6]*RC[-5]) -> 1
A735: 55010 | B735: 北京 | C735: 81 | D735: 良 | E735: 0.93 | F735: 17 | G735: 44 | H735: 93 | I735: 73 | J735: 43 | L735: 2013-06-21T11:00:00.000 | M735: =RC[-8]-R[13]C[-8] -> 1.2500000000001954E-3 | N735: =RC[-8]-R[13]C[-8] -> 7.625 | O735: =RC[-8]-R[13]C[-8] -> 1.5416666666666643 | P735: =RC[-8]-R[13]C[-8] -> 22.666666666666671 | Q735: =RC[-8]-R[13]C[-8] -> -11.666666666666671 | R735: =RC[-8]-R[13]C[-8] -> -2.3333333333333357 | T735: =RC[-7]*RC[-2] -> -2.9166666666671256E-3 | U735: =RC[-7]*RC[-3] -> -17.791666666666686 | V735: =RC[-7]*RC[-4] -> -3.5972222222222205 | W735: =RC[-7]*RC[-5] -> -52.888888888888957 | X735: =RC[-7]*RC[-6] -> 27.222222222222261 | Y735: =RC[-12]*RC[-12] -> 1.5625000000004886E-6 | Z735: =RC[-12]*RC[-12] -> 58.140625 | AA735: =RC[-12]*RC[-12] -> 2.3767361111111036 | AB735: =RC[-12]*RC[-12] -> 513.77777777777794 | AC735: =RC[-12]*RC[-12] -> 136.11111111111123 | AD735: =RC[-12]*RC[-12] -> 5.4444444444444553 | AE735: =RC[-11]/SQRT(RC[-6]*RC[-1]) -> -1 | AF735: =RC[-11]/SQRT(RC[-6]*RC[-2]) -> -1 | AG735: =RC[-11]/SQRT(RC[-6]*RC[-3]) -> -1.0000000000000002 | AH735: =RC[-11]/SQRT(RC[-6]*RC[-4]) -> -1.0000000000000002 | AI735: =RC[-11]/SQRT(RC[-6]*RC[-5]) -> 1
A736: 55086 | B736: 北京 | C736: 82 | D736: 良 | E736: 0.74 | F736: 14 | G736: 35 | H736: 118 | I736: 72 | J736: 36 | L736: 2013-06-21T12:00:00.000 | M736: =RC[-8]-R[12]C[-8] -> -0.18874999999999986 | N736: =RC[-8]-R[12]C[-8] -> 4.625 | O736: =RC[-8]-R[12]C[-8] -> -7.4583333333333357 | P736: =RC[-8]-R[12]C[-8] -> 47.666666666666671 | Q736: =RC[-8]-R[12]C[-8] -> -12.666666666666671 | R736: =RC[-8]-R[12]C[-8] -> -9.3333333333333357 | T736: =RC[-7]*RC[-2] -> 1.7616666666666658 | U736: =RC[-7]*RC[-3] -> -43.166666666666679 | V736: =RC[-7]*RC[-4] -> 69.611111111111157 | W736: =RC[-7]*RC[-5] -> -444.88888888888903 | X736: =RC[-7]*RC[-6] -> 118.2222222222223 | Y736: =RC[-12]*RC[-12] -> 3.5626562499999945E-2 | Z736: =RC[-12]*RC[-12] -> 21.390625 | AA736: =RC[-12]*RC[-12] -> 55.62673611111115 | AB736: =RC[-12]*RC[-12] -> 2272.1111111111118 | AC736: =RC[-12]*RC[-12] -> 160.44444444444457 | AD736: =RC[-12]*RC[-12] -> 87.111111111111157 | AE736: =RC[-11]/SQRT(RC[-6]*RC[-1]) -> 1 | AF736: =RC[-11]/SQRT(RC[-6]*RC[-2]) -> -1 | AG736: =RC[-11]/SQRT(RC[-6]*RC[-3]) -> 1 | AH736: =RC[-11]/SQRT(RC[-6]*RC[-4]) -> -0.99999999999999989 | AI736: =RC[-11]/SQRT(RC[-6]*RC[-5]) -> 1
A737: 55162 | B737: 北京 | C737: 82 | D737: 良 | E737: 0.62 | F737: 11 | G737: 23 | H737: 151 | I737: 53 | J737: 31 | L737: 2013-06-21T13:00:00.000 | M737: =RC[-8]-R[11]C[-8] -> -0.30874999999999986 | N737: =RC[-8]-R[11]C[-8] -> 1.625 | O737: =RC[-8]-R[11]C[-8] -> -19.458333333333336 | P737: =RC[-8]-R[11]C[-8] -> 80.666666666666671 | Q737: =RC[-8]-R[11]C[-8] -> -31.666666666666671 | R737: =RC[-8]-R[11]C[-8] -> -14.333333333333336 | T737: =RC[-7]*RC[-2] -> 4.4254166666666652 | U737: =RC[-7]*RC[-3] -> -23.291666666666671 | V737: =RC[-7]*RC[-4] -> 278.90277777777789 | W737: =RC[-7]*RC[-5] -> -1156.2222222222224 | X737: =RC[-7]*RC[-6] -> 453.88888888888903 | Y737: =RC[-12]*RC[-12] -> 9.5326562499999906E-2 | Z737: =RC[-12]*RC[-12] -> 2.640625 | AA737: =RC[-12]*RC[-12] -> 378.6267361111112 | AB737: =RC[-12]*RC[-12] -> 6507.1111111111122 | AC737: =RC[-12]*RC[-12] -> 1002.7777777777781 | AD737: =RC[-12]*RC[-12] -> 205.44444444444451 | AE737: =RC[-11]/SQRT(RC[-6]*RC[-1]) -> 1 | AF737: =RC[-11]/SQRT(RC[-6]*RC[-2]) -> -1 | AG737: =RC[-11]/SQRT(RC[-6]*RC[-3]) -> 1.0000000000000002 | AH737: =RC[-11]/SQRT(RC[-6]*RC[-4]) -> -1 | AI737: =RC[-11]/SQRT(RC[-6]*RC[-5]) -> 1
A738: 55238 | B738: 北京 | C738: 82 | D738: 良 | E738: 0.6 | F738: 8 | G738: 22 | H738: 142 | I738: 59 | J738: 29 | L738: 2013-06-21T14:00:00.000 | M738: =RC[-8]-R[10]C[-8] -> -0.32874999999999988 | N738: =RC[-8]-R[10]C[-8] -> -1.375 | O738: =RC[-8]-R[10]C[-8] -> -20.458333333333336 | P738: =RC[-8]-R[10]C[-8] -> 71.666666666666671 | Q738: =RC[-8]-R[10]C[-8] -> -25.666666666666671 | R738: =RC[-8]-R[10]C[-8] -> -16.333333333333336 | T738: =RC[-7]*RC[-2] -> 5.369583333333332 | U738: =RC[-7]*RC[-3] -> 22.458333333333336 | V738: =RC[-7]*RC[-4] -> 334.15277777777789 | W738: =RC[-7]*RC[-5] -> -1170.5555555555559 | X738: =RC[-7]*RC[-6] -> 419.22222222222234 | Y738: =RC[-12]*RC[-12] -> 0.10807656249999992 | Z738: =RC[-12]*RC[-12] -> 1.890625 | AA738: =RC[-12]*RC[-12] -> 418.54340277777789 | AB738: =RC[-12]*RC[-12] -> 5136.1111111111122 | AC738: =RC[-12]*RC[-12] -> 658.77777777777806 | AD738: =RC[-12]*RC[-12] -> 266.77777777777783 | AE738: =RC[-11]/SQRT(RC[-6]*RC[-1]) -> 1 | AF738: =RC[-11]/SQRT(RC[-6]*RC[-2]) -> 1 | AG738: =RC[-11]/SQRT(RC[-6]*RC[-3]) -> 1.0000000000000002 | AH738: =RC[-11]/SQRT(RC[-6]*RC[-4]) -> -1 | AI738: =RC[-11]/SQRT(RC[-6]*RC[-5]) -> 1
A739: 55314 | B739: 北京 | C739: 83 | D739: 良 | E739: 0.63 | F739: 8 | G739: 22 | H739: 150 | I739: 87 | J739: 36 | L739: 2013-06-21T15:00:00.000 | M739: =RC[-8]-R[9]C[-8] -> -0.29874999999999985 | N739: =RC[-8]-R[9]C[-8] -> -1.375 | O739: =RC[-8]-R[9]C[-8] -> -20.458333333333336 | P739: =RC[-8]-R[9]C[-8] -> 79.666666666666671 | Q739: =RC[-8]-R[9]C[-8] -> 2.3333333333333286 | R739: =RC[-8]-R[9]C[-8] -> -9.3333333333333357 | T739: =RC[-7]*RC[-2] -> 2.7883333333333327 | U739: =RC[-7]*RC[-3] -> 12.833333333333336 | V739: =RC[-7]*RC[-4] -> 190.94444444444451 | W739: =RC[-7]*RC[-5] -> -743.55555555555577 | X739: =RC[-7]*RC[-6] -> -21.777777777777739 | Y739: =RC[-12]*RC[-12] -> 8.9251562499999909E-2 | Z739: =RC[-12]*RC[-12] -> 1.890625 | AA739: =RC[-12]*RC[-12] -> 418.54340277777789 | AB739: =RC[-12]*RC[-12] -> 6346.7777777777783 | AC739: =RC[-12]*RC[-12] -> 5.4444444444444224 | AD739: =RC[-12]*RC[-12] -> 87.111111111111157 | AE739: =RC[-11]/SQRT(RC[-6]*RC[-1]) -> 1 | AF739: =RC[-11]/SQRT(RC[-6]*RC[-2]) -> 0.99999999999999989 | AG739: =RC[-11]/SQRT(RC[-6]*RC[-3]) -> 1 | AH739: =RC[-11]/SQRT(RC[-6]*RC[-4]) -> -1 | AI739: =RC[-11]/SQRT(RC[-6]*RC[-5]) -> -1
A740: 55390 | B740: 北京 | C740: 83 | D740: 良 | E740: 0.66 | F740: 7 | G740: 25 | H740: 148 | I740: 93 | J740: 49 | L740: 2013-06-21T16:00:00.000 | M740: =RC[-8]-R[8]C[-8] -> -0.26874999999999982 | N740: =RC[-8]-R[8]C[-8] -> -2.375 | O740: =RC[-8]-R[8]C[-8] -> -17.458333333333336 | P740: =RC[-8]-R[8]C[-8] -> 77.666666666666671 | Q740: =RC[-8]-R[8]C[-8] -> 8.3333333333333286 | R740: =RC[-8]-R[8]C[-8] -> 3.6666666666666643 | T740: =RC[-7]*RC[-2] -> -0.98541666666666539 | U740: =RC[-7]*RC[-3] -> -8.7083333333333286 | V740: =RC[-7]*RC[-4] -> -64.013888888888857 | W740: =RC[-7]*RC[-5] -> 284.7777777777776 | X740: =RC[-7]*RC[-6] -> 30.555555555555518 | Y740: =RC[-12]*RC[-12] -> 7.2226562499999911E-2 | Z740: =RC[-12]*RC[-12] -> 5.640625 | AA740: =RC[-12]*RC[-12] -> 304.79340277777789 | AB740: =RC[-12]*RC[-12] -> 6032.1111111111122 | AC740: =RC[-12]*RC[-12] -> 69.444444444444372 | AD740: =RC[-12]*RC[-12] -> 13.444444444444427 | AE740: =RC[-11]/SQRT(RC[-6]*RC[-1]) -> -1 | AF740: =RC[-11]/SQRT(RC[-6]*RC[-2]) -> -1.0000000000000002 | AG740: =RC[-11]/SQRT(RC[-6]*RC[-3]) -> -1 | AH740: =RC[-11]/SQRT(RC[-6]*RC[-4]) -> 1 | AI740: =RC[-11]/SQRT(RC[-6]*RC[-5]) -> 1
A741: 55466 | B741: 北京 | C741: 84 | D741: 良 | E741: 0.68 | F741: 6 | G741: 30 | H741: 129 | I741: 114 | J741: 53 | L741: 2013-06-21T17:00:00.000 | M741: =RC[-8]-R[7]C[-8] -> -0.2487499999999998 | N741: =RC[-8]-R[7]C[-8] -> -3.375 | O741: =RC[-8]-R[7]C[-8] -> -12.458333333333336 | P741: =RC[-8]-R[7]C[-8] -> 58.666666666666671 | Q741: =RC[-8]-R[7]C[-8] -> 29.333333333333329 | R741: =RC[-8]-R[7]C[-8] -> 7.6666666666666643 | T741: =RC[-7]*RC[-2] -> -1.9070833333333312 | U741: =RC[-7]*RC[-3] -> -25.874999999999993 | V741: =RC[-7]*RC[-4] -> -95.513888888888872 | W741: =RC[-7]*RC[-5] -> 449.77777777777766 | X741: =RC[-7]*RC[-6] -> 224.88888888888877 | Y741: =RC[-12]*RC[-12] -> 6.1876562499999906E-2 | Z741: =RC[-12]*RC[-12] -> 11.390625 | AA741: =RC[-12]*RC[-12] -> 155.21006944444451 | AB741: =RC[-12]*RC[-12] -> 3441.7777777777783 | AC741: =RC[-12]*RC[-12] -> 860.44444444444412 | AD741: =RC[-12]*RC[-12] -> 58.777777777777743 | AE741: =RC[-11]/SQRT(RC[-6]*RC[-1]) -> -1 | AF741: =RC[-11]/SQRT(RC[-6]*RC[-2]) -> -1 | AG741: =RC[-11]/SQRT(RC[-6]*RC[-3]) -> -0.99999999999999989 | AH741: =RC[-11]/SQRT(RC[-6]*RC[-4]) -> 1 | AI741: =RC[-11]/SQRT(RC[-6]*RC[-5]) -> 1
A742: 55542 | B742: 北京 | C742: 87 | D742: 良 | E742: 0.75 | F742: 6 | G742: 35 | H742: 116 | I742: 93 | J742: 58 | L742: 2013-06-21T18:00:00.000 | M742: =RC[-8]-R[6]C[-8] -> -0.17874999999999985 | N742: =RC[-8]-R[6]C[-8] -> -3.375 | O742: =RC[-8]-R[6]C[-8] -> -7.4583333333333357 | P742: =RC[-8]-R[6]C[-8] -> 45.666666666666671 | Q742: =RC[-8]-R[6]C[-8] -> 8.3333333333333286 | R742: =RC[-8]-R[6]C[-8] -> 12.666666666666664 | T742: =RC[-7]*RC[-2] -> -2.2641666666666644 | U742: =RC[-7]*RC[-3] -> -42.749999999999993 | V742: =RC[-7]*RC[-4] -> -94.472222222222229 | W742: =RC[-7]*RC[-5] -> 578.44444444444434 | X742: =RC[-7]*RC[-6] -> 105.55555555555547 | Y742: =RC[-12]*RC[-12] -> 3.1951562499999947E-2 | Z742: =RC[-12]*RC[-12] -> 11.390625 | AA742: =RC[-12]*RC[-12] -> 55.62673611111115 | AB742: =RC[-12]*RC[-12] -> 2085.4444444444448 | AC742: =RC[-12]*RC[-12] -> 69.444444444444372 | AD742: =RC[-12]*RC[-12] -> 160.44444444444437 | AE742: =RC[-11]/SQRT(RC[-6]*RC[-1]) -> -1 | AF742: =RC[-11]/SQRT(RC[-6]*RC[-2]) -> -1 | AG742: =RC[-11]/SQRT(RC[-6]*RC[-3]) -> -1 | AH742: =RC[-11]/SQRT(RC[-6]*RC[-4]) -> 1 | AI742: =RC[-11]/SQRT(RC[-6]*RC[-5]) -> 1
A743: 55618 | B743: 北京 | C743: 88 | D743: 良 | E743: 0.8 | F743: 6 | G743: 42 | H743: 91 | I743: 76 | J743: 54 | L743: 2013-06-21T19:00:00.000 | M743: =RC[-8]-R[5]C[-8] -> -0.12874999999999981 | N743: =RC[-8]-R[5]C[-8] -> -3.375 | O743: =RC[-8]-R[5]C[-8] -> -0.4583333333333357 | P743: =RC[-8]-R[5]C[-8] -> 20.666666666666671 | Q743: =RC[-8]-R[5]C[-8] -> -8.6666666666666714 | R743: =RC[-8]-R[5]C[-8] -> 8.6666666666666643 | T743: =RC[-7]*RC[-2] -> -1.1158333333333315 | U743: =RC[-7]*RC[-3] -> -29.249999999999993 | V743: =RC[-7]*RC[-4] -> -3.9722222222222419 | W743: =RC[-7]*RC[-5] -> 179.11111111111111 | X743: =RC[-7]*RC[-6] -> -75.111111111111128 | Y743: =RC[-12]*RC[-12] -> 1.6576562499999951E-2 | Z743: =RC[-12]*RC[-12] -> 11.390625 | AA743: =RC[-12]*RC[-12] -> 0.21006944444444661 | AB743: =RC[-12]*RC[-12] -> 427.11111111111131 | AC743: =RC[-12]*RC[-12] -> 75.1111111111112 | AD743: =RC[-12]*RC[-12] -> 75.111111111111072 | AE743: =RC[-11]/SQRT(RC[-6]*RC[-1]) -> -1 | AF743: =RC[-11]/SQRT(RC[-6]*RC[-2]) -> -1 | AG743: =RC[-11]/SQRT(RC[-6]*RC[-3]) -> -1.0000000000000002 | AH743: =RC[-11]/SQRT(RC[-6]*RC[-4]) -> 1 | AI743: =RC[-11]/SQRT(RC[-6]*RC[-5]) -> -0.99999999999999978
A744: 55694 | B744: 北京 | C744: 86 | D744: 良 | E744: 0.74 | F744: 5 | G744: 40 | H744: 77 | I744: 63 | J744: 44 | L744: 2013-06-21T20:00:00.000 | M744: =RC[-8]-R[4]C[-8] -> -0.18874999999999986 | N744: =RC[-8]-R[4]C[-8] -> -4.375 | O744: =RC[-8]-R[4]C[-8] -> -2.4583333333333357 | P744: =RC[-8]-R[4]C[-8] -> 6.6666666666666714 | Q744: =RC[-8]-R[4]C[-8] -> -21.666666666666671 | R744: =RC[-8]-R[4]C[-8] -> -1.3333333333333357 | T744: =RC[-7]*RC[-2] -> 0.25166666666666693 | U744: =RC[-7]*RC[-3] -> 5.8333333333333437 | V744: =RC[-7]*RC[-4] -> 3.2777777777777866 | W744: =RC[-7]*RC[-5] -> -8.8888888888889106 | X744: =RC[-7]*RC[-6] -> 28.888888888888946 | Y744: =RC[-12]*RC[-12] -> 3.5626562499999945E-2 | Z744: =RC[-12]*RC[-12] -> 19.140625 | AA744: =RC[-12]*RC[-12] -> 6.0434027777777892 | AB744: =RC[-12]*RC[-12] -> 44.444444444444507 | AC744: =RC[-12]*RC[-12] -> 469.44444444444463 | AD744: =RC[-12]*RC[-12] -> 1.7777777777777841 | AE744: =RC[-11]/SQRT(RC[-6]*RC[-1]) -> 1 | AF744: =RC[-11]/SQRT(RC[-6]*RC[-2]) -> 1 | AG744: =RC[-11]/SQRT(RC[-6]*RC[-3]) -> 0.99999999999999989 | AH744: =RC[-11]/SQRT(RC[-6]*RC[-4]) -> -1 | AI744: =RC[-11]/SQRT(RC[-6]*RC[-5]) -> 1
A745: 55770 | B745: 北京 | C745: 81 | D745: 良 | E745: 0.65 | F745: 5 | G745: 37 | H745: 78 | I745: 76 | J745: 29 | L745: 2013-06-21T21:00:00.000 | M745: =RC[-8]-R[3]C[-8] -> -0.27874999999999983 | N745: =RC[-8]-R[3]C[-8] -> -4.375 | O745: =RC[-8]-R[3]C[-8] -> -5.4583333333333357 | P745: =RC[-8]-R[3]C[-8] -> 7.6666666666666714 | Q745: =RC[-8]-R[3]C[-8] -> -8.6666666666666714 | R745: =RC[-8]-R[3]C[-8] -> -16.333333333333336 | T745: =RC[-7]*RC[-2] -> 4.5529166666666647 | U745: =RC[-7]*RC[-3] -> 71.458333333333343 | V745: =RC[-7]*RC[-4] -> 89.152777777777828 | W745: =RC[-7]*RC[-5] -> -125.22222222222231 | X745: =RC[-7]*RC[-6] -> 141.55555555555566 | Y745: =RC[-12]*RC[-12] -> 7.7701562499999904E-2 | Z745: =RC[-12]*RC[-12] -> 19.140625 | AA745: =RC[-12]*RC[-12] -> 29.793402777777803 | AB745: =RC[-12]*RC[-12] -> 58.77777777777785 | AC745: =RC[-12]*RC[-12] -> 75.1111111111112 | AD745: =RC[-12]*RC[-12] -> 266.77777777777783 | AE745: =RC[-11]/SQRT(RC[-6]*RC[-1]) -> 1.0000000000000002 | AF745: =RC[-11]/SQRT(RC[-6]*RC[-2]) -> 1 | AG745: =RC[-11]/SQRT(RC[-6]*RC[-3]) -> 1 | AH745: =RC[-11]/SQRT(RC[-6]*RC[-4]) -> -1 | AI745: =RC[-11]/SQRT(RC[-6]*RC[-5]) -> 1
A746: 55846 | B746: 北京 | C746: 75 | D746: 良 | E746: 0.62 | F746: 5 | G746: 35 | H746: 75 | I746: 58 | J746: 24 | L746: 2013-06-21T22:00:00.000 | M746: =RC[-8]-R[2]C[-8] -> -0.30874999999999986 | N746: =RC[-8]-R[2]C[-8] -> -4.375 | O746: =RC[-8]-R[2]C[-8] -> -7.4583333333333357 | P746: =RC[-8]-R[2]C[-8] -> 4.6666666666666714 | Q746: =RC[-8]-R[2]C[-8] -> -26.666666666666671 | R746: =RC[-8]-R[2]C[-8] -> -21.333333333333336 | T746: =RC[-7]*RC[-2] -> 6.5866666666666642 | U746: =RC[-7]*RC[-3] -> 93.333333333333343 | V746: =RC[-7]*RC[-4] -> 159.11111111111117 | W746: =RC[-7]*RC[-5] -> -99.555555555555671 | X746: =RC[-7]*RC[-6] -> 568.88888888888903 | Y746: =RC[-12]*RC[-12] -> 9.5326562499999906E-2 | Z746: =RC[-12]*RC[-12] -> 19.140625 | AA746: =RC[-12]*RC[-12] -> 55.62673611111115 | AB746: =RC[-12]*RC[-12] -> 21.777777777777821 | AC746: =RC[-12]*RC[-12] -> 711.11111111111131 | AD746: =RC[-12]*RC[-12] -> 455.1111111111112 | AE746: =RC[-11]/SQRT(RC[-6]*RC[-1]) -> 1 | AF746: =RC[-11]/SQRT(RC[-6]*RC[-2]) -> 1 | AG746: =RC[-11]/SQRT(RC[-6]*RC[-3]) -> 1 | AH746: =RC[-11]/SQRT(RC[-6]*RC[-4]) -> -1 | AI746: =RC[-11]/SQRT(RC[-6]*RC[-5]) -> 1
A747: 55922 | B747: 北京 | C747: 71 | D747: 良 | E747: 0.57999999999999996 | F747: 5 | G747: 34 | H747: 73 | I747: 59 | J747: 26 | L747: 2013-06-21T23:00:00.000 | M747: =RC[-8]-R[1]C[-8] -> -0.34874999999999989 | N747: =RC[-8]-R[1]C[-8] -> -4.375 | O747: =RC[-8]-R[1]C[-8] -> -8.4583333333333357 | P747: =RC[-8]-R[1]C[-8] -> 2.6666666666666714 | Q747: =RC[-8]-R[1]C[-8] -> -25.666666666666671 | R747: =RC[-8]-R[1]C[-8] -> -19.333333333333336 | T747: =RC[-7]*RC[-2] -> 6.7424999999999988 | U747: =RC[-7]*RC[-3] -> 84.583333333333343 | V747: =RC[-7]*RC[-4] -> 163.52777777777786 | W747: =RC[-7]*RC[-5] -> -51.555555555555657 | X747: =RC[-7]*RC[-6] -> 496.2222222222224 | Y747: =RC[-12]*RC[-12] -> 0.12162656249999992 | Z747: =RC[-12]*RC[-12] -> 19.140625 | AA747: =RC[-12]*RC[-12] -> 71.543402777777814 | AB747: =RC[-12]*RC[-12] -> 7.1111111111111365 | AC747: =RC[-12]*RC[-12] -> 658.77777777777806 | AD747: =RC[-12]*RC[-12] -> 373.77777777777789 | AE747: =RC[-11]/SQRT(RC[-6]*RC[-1]) -> 1 | AF747: =RC[-11]/SQRT(RC[-6]*RC[-2]) -> 1 | AG747: =RC[-11]/SQRT(RC[-6]*RC[-3]) -> 1 | AH747: =RC[-11]/SQRT(RC[-6]*RC[-4]) -> -1 | AI747: =RC[-11]/SQRT(RC[-6]*RC[-5]) -> 1
E748: =AVERAGE(R[-24]C:R[-1]C) -> 0.92874999999999985 | F748: =AVERAGE(R[-24]C:R[-1]C) -> 9.375 | G748: =AVERAGE(R[-24]C:R[-1]C) -> 42.458333333333336 | H748: =AVERAGE(R[-24]C:R[-1]C) -> 70.333333333333329 | I748: =AVERAGE(R[-24]C:R[-1]C) -> 84.666666666666671 | J748: =AVERAGE(R[-24]C:R[-1]C) -> 45.333333333333336 | M748: =RC[-8]-RC[-8] -> 0 | N748: =RC[-8]-RC[-8] -> 0 | O748: =RC[-8]-RC[-8] -> 0 | P748: =RC[-8]-RC[-8] -> 0 | Q748: =RC[-8]-RC[-8] -> 0 | R748: =RC[-8]-RC[-8] -> 0 | T748: =SUM(R[-23]C:R[-1]C) -> 51.194999999999993 | U748: =SUM(R[-23]C:R[-1]C) -> 192.5 | V748: =SUM(R[-23]C:R[-1]C) -> 1882.7222222222224 | W748: =SUM(R[-23]C:R[-1]C) -> -5552.4444444444453 | X748: =SUM(R[-23]C:R[-1]C) -> 3706.1111111111113 | Y748: =SUM(R[-23]C:R[-1]C) -> 1.8535609374999999 | Z748: =SUM(R[-23]C:R[-1]C) -> 297.984375 | AA748: =SUM(R[-23]C:R[-1]C) -> 3420.5815972222222 | AB748: =SUM(R[-23]C:R[-1]C) -> 59988.888888888891 | AC748: =SUM(R[-23]C:R[-1]C) -> 6900.5555555555566 | AD748: =SUM(R[-23]C:R[-1]C) -> 3154.2222222222222 | AE748: =RC[-11]/SQRT(RC[-6]*RC[-1]) -> 0.66954222247481732 | AF748: =RC[-11]/SQRT(RC[-6]*RC[-2]) -> 0.19855820780094716 | AG748: =RC[-11]/SQRT(RC[-6]*RC[-3]) -> 0.57317881164161166 | AH748: =RC[-11]/SQRT(RC[-6]*RC[-4]) -> -0.40364787388708234 | AI748: =RC[-11]/SQRT(RC[-6]*RC[-5]) -> 0.79438358912321094
A749: 55998 | B749: 北京 | C749: 70 | D749: 良 | E749: 0.56999999999999995 | F749: 5 | G749: 31 | H749: 76 | I749: 62 | J749: 34 | L749: 2013-06-22T00:00:00.000 | M749: =RC[-8]-R[19]C[-8] -> -0.16000000000000003 | N749: =RC[-8]-R[19]C[-8] -> 2 | O749: =RC[-8]-R[19]C[-8] -> -17 | P749: =RC[-8]-R[19]C[-8] -> 49 | Q749: =RC[-8]-R[19]C[-8] -> 6 | R749: =RC[-8]-R[19]C[-8] -> -5 | T749: =RC[-7]*RC[-2] -> 0.80000000000000016 | U749: =RC[-7]*RC[-3] -> -10 | V749: =RC[-7]*RC[-4] -> 85 | W749: =RC[-7]*RC[-5] -> -245 | X749: =RC[-7]*RC[-6] -> -30 | Y749: =RC[-12]*RC[-12] -> 2.5600000000000012E-2 | Z749: =RC[-12]*RC[-12] -> 4 | AA749: =RC[-12]*RC[-12] -> 289 | AB749: =RC[-12]*RC[-12] -> 2401 | AC749: =RC[-12]*RC[-12] -> 36 | AD749: =RC[-12]*RC[-12] -> 25 | AE749: =RC[-11]/SQRT(RC[-6]*RC[-1]) -> 0.99999999999999989 | AF749: =RC[-11]/SQRT(RC[-6]*RC[-2]) -> -1 | AG749: =RC[-11]/SQRT(RC[-6]*RC[-3]) -> 1 | AH749: =RC[-11]/SQRT(RC[-6]*RC[-4]) -> -1 | AI749: =RC[-11]/SQRT(RC[-6]*RC[-5]) -> -1
A750: 56074 | B750: 北京 | C750: 69 | D750: 良 | E750: 0.56999999999999995 | F750: 5 | G750: 29 | H750: 79 | I750: 58 | J750: 35 | L750: 2013-06-22T01:00:00.000 | M750: =RC[-8]-R[23]C[-8] -> -0.13458333333333339 | N750: =RC[-8]-R[23]C[-8] -> 1.2916666666666665 | O750: =RC[-8]-R[23]C[-8] -> -7.125 | P750: =RC[-8]-R[23]C[-8] -> 39 | Q750: =RC[-8]-R[23]C[-8] -> -4 | R750: =RC[-8]-R[23]C[-8] -> -11.291666666666664 | T750: =RC[-7]*RC[-2] -> 1.5196701388888891 | U750: =RC[-7]*RC[-3] -> -14.585069444444439 | V750: =RC[-7]*RC[-4] -> 80.453124999999986 | W750: =RC[-7]*RC[-5] -> -440.37499999999989 | X750: =RC[-7]*RC[-6] -> 45.166666666666657 | Y750: =RC[-12]*RC[-12] -> 1.8112673611111126E-2 | Z750: =RC[-12]*RC[-12] -> 1.6684027777777775 | AA750: =RC[-12]*RC[-12] -> 50.765625 | AB750: =RC[-12]*RC[-12] -> 1521 | AC750: =RC[-12]*RC[-12] -> 16 | AD750: =RC[-12]*RC[-12] -> 127.50173611111106 | AE750: =RC[-11]/SQRT(RC[-6]*RC[-1]) -> 0.99999999999999989 | AF750: =RC[-11]/SQRT(RC[-6]*RC[-2]) -> -1 | AG750: =RC[-11]/SQRT(RC[-6]*RC[-3]) -> 1 | AH750: =RC[-11]/SQRT(RC[-6]*RC[-4]) -> -1 | AI750: =RC[-11]/SQRT(RC[-6]*RC[-5]) -> 1
A751: 56150 | B751: 北京 | C751: 68 | D751: 良 | E751: 0.56000000000000005 | F751: 5 | G751: 27 | H751: 70 | I751: 56 | J751: 34 | L751: 2013-06-22T02:00:00.000 | M751: =RC[-8]-R[22]C[-8] -> -0.14458333333333329 | N751: =RC[-8]-R[22]C[-8] -> 1.2916666666666665 | O751: =RC[-8]-R[22]C[-8] -> -9.125 | P751: =RC[-8]-R[22]C[-8] -> 30 | Q751: =RC[-8]-R[22]C[-8] -> -6 | R751: =RC[-8]-R[22]C[-8] -> -12.291666666666664 | T751: =RC[-7]*RC[-2] -> 1.7771701388888879 | U751: =RC[-7]*RC[-3] -> -15.876736111111105 | V751: =RC[-7]*RC[-4] -> 112.16145833333331 | W751: =RC[-7]*RC[-5] -> -368.74999999999994 | X751: =RC[-7]*RC[-6] -> 73.749999999999986 | Y751: =RC[-12]*RC[-12] -> 2.0904340277777763E-2 | Z751: =RC[-12]*RC[-12] -> 1.6684027777777775 | AA751: =RC[-12]*RC[-12] -> 83.265625 | AB751: =RC[-12]*RC[-12] -> 900 | AC751: =RC[-12]*RC[-12] -> 36 | AD751: =RC[-12]*RC[-12] -> 151.0850694444444 | AE751: =RC[-11]/SQRT(RC[-6]*RC[-1]) -> 0.99999999999999989 | AF751: =RC[-11]/SQRT(RC[-6]*RC[-2]) -> -0.99999999999999989 | AG751: =RC[-11]/SQRT(RC[-6]*RC[-3]) -> 1 | AH751: =RC[-11]/SQRT(RC[-6]*RC[-4]) -> -1 | AI751: =RC[-11]/SQRT(RC[-6]*RC[-5]) -> 1
A752: 56226 | B752: 北京 | C752: 66 | D752: 良 | E752: 0.52 | F752: 5 | G752: 28 | H752: 70 | I752: 50 | J752: 35 | L752: 2013-06-22T03:00:00.000 | M752: =RC[-8]-R[21]C[-8] -> -0.18458333333333332 | N752: =RC[-8]-R[21]C[-8] -> 1.2916666666666665 | O752: =RC[-8]-R[21]C[-8] -> -8.125 | P752: =RC[-8]-R[21]C[-8] -> 30 | Q752: =RC[-8]-R[21]C[-8] -> -12 | R752: =RC[-8]-R[21]C[-8] -> -11.291666666666664 | T752: =RC[-7]*RC[-2] -> 2.0842534722222217 | U752: =RC[-7]*RC[-3] -> -14.585069444444439 | V752: =RC[-7]*RC[-4] -> 91.744791666666643 | W752: =RC[-7]*RC[-5] -> -338.74999999999994 | X752: =RC[-7]*RC[-6] -> 135.49999999999997 | Y752: =RC[-12]*RC[-12] -> 3.407100694444444E-2 | Z752: =RC[-12]*RC[-12] -> 1.6684027777777775 | AA752: =RC[-12]*RC[-12] -> 66.015625 | AB752: =RC[-12]*RC[-12] -> 900 | AC752: =RC[-12]*RC[-12] -> 144 | AD752: =RC[-12]*RC[-12] -> 127.50173611111106 | AE752: =RC[-11]/SQRT(RC[-6]*RC[-1]) -> 1 | AF752: =RC[-11]/SQRT(RC[-6]*RC[-2]) -> -1 | AG752: =RC[-11]/SQRT(RC[-6]*RC[-3]) -> 0.99999999999999989 | AH752: =RC[-11]/SQRT(RC[-6]*RC[-4]) -> -1 | AI752: =RC[-11]/SQRT(RC[-6]*RC[-5]) -> 1
A753: 56302 | B753: 北京 | C753: 65 | D753: 良 | E753: 0.56999999999999995 | F753: 5 | G753: 32 | H753: 52 | I753: 60 | J753: 42 | L753: 2013-06-22T04:00:00.000 | M753: =RC[-8]-R[20]C[-8] -> -0.13458333333333339 | N753: =RC[-8]-R[20]C[-8] -> 1.2916666666666665 | O753: =RC[-8]-R[20]C[-8] -> -4.125 | P753: =RC[-8]-R[20]C[-8] -> 12 | Q753: =RC[-8]-R[20]C[-8] -> -2 | R753: =RC[-8]-R[20]C[-8] -> -4.2916666666666643 | T753: =RC[-7]*RC[-2] -> 0.57758680555555553 | U753: =RC[-7]*RC[-3] -> -5.5434027777777741 | V753: =RC[-7]*RC[-4] -> 17.703124999999989 | W753: =RC[-7]*RC[-5] -> -51.499999999999972 | X753: =RC[-7]*RC[-6] -> 8.5833333333333286 | Y753: =RC[-12]*RC[-12] -> 1.8112673611111126E-2 | Z753: =RC[-12]*RC[-12] -> 1.6684027777777775 | AA753: =RC[-12]*RC[-12] -> 17.015625 | AB753: =RC[-12]*RC[-12] -> 144 | AC753: =RC[-12]*RC[-12] -> 4 | AD753: =RC[-12]*RC[-12] -> 18.418402777777757 | AE753: =RC[-11]/SQRT(RC[-6]*RC[-1]) -> 1 | AF753: =RC[-11]/SQRT(RC[-6]*RC[-2]) -> -1 | AG753: =RC[-11]/SQRT(RC[-6]*RC[-3]) -> 1 | AH753: =RC[-11]/SQRT(RC[-6]*RC[-4]) -> -1 | AI753: =RC[-11]/SQRT(RC[-6]*RC[-5]) -> 1
A754: 56378 | B754: 北京 | C754: 64 | D754: 良 | E754: 0.59 | F754: 5 | G754: 31 | H754: 51 | I754: 81 | J754: 48 | L754: 2013-06-22T05:00:00.000 | M754: =RC[-8]-R[19]C[-8] -> -0.11458333333333337 | N754: =RC[-8]-R[19]C[-8] -> 1.2916666666666665 | O754: =RC[-8]-R[19]C[-8] -> -5.125 | P754: =RC[-8]-R[19]C[-8] -> 11 | Q754: =RC[-8]-R[19]C[-8] -> 19 | R754: =RC[-8]-R[19]C[-8] -> 1.7083333333333357 | T754: =RC[-7]*RC[-2] -> -0.19574652777777812 | U754: =RC[-7]*RC[-3] -> 2.206597222222225 | V754: =RC[-7]*RC[-4] -> -8.7552083333333464 | W754: =RC[-7]*RC[-5] -> 18.791666666666693 | X754: =RC[-7]*RC[-6] -> 32.458333333333378 | Y754: =RC[-12]*RC[-12] -> 1.3129340277777787E-2 | Z754: =RC[-12]*RC[-12] -> 1.6684027777777775 | AA754: =RC[-12]*RC[-12] -> 26.265625 | AB754: =RC[-12]*RC[-12] -> 121 | AC754: =RC[-12]*RC[-12] -> 361 | AD754: =RC[-12]*RC[-12] -> 2.9184027777777857 | AE754: =RC[-11]/SQRT(RC[-6]*RC[-1]) -> -1 | AF754: =RC[-11]/SQRT(RC[-6]*RC[-2]) -> 1 | AG754: =RC[-11]/SQRT(RC[-6]*RC[-3]) -> -1.0000000000000002 | AH754: =RC[-11]/SQRT(RC[-6]*RC[-4]) -> 1 | AI754: =RC[-11]/SQRT(RC[-6]*RC[-5]) -> 1
A755: 56454 | B755: 北京 | C755: 65 | D755: 良 | E755: 0.68 | F755: 5 | G755: 34 | H755: 44 | I755: 107 | J755: 72 | L755: 2013-06-22T06:00:00.000 | M755: =RC[-8]-R[18]C[-8] -> -2.458333333333329E-2 | N755: =RC[-8]-R[18]C[-8] -> 1.2916666666666665 | O755: =RC[-8]-R[18]C[-8] -> -2.125 | P755: =RC[-8]-R[18]C[-8] -> 4 | Q755: =RC[-8]-R[18]C[-8] -> 45 | R755: =RC[-8]-R[18]C[-8] -> 25.708333333333336 | T755: =RC[-7]*RC[-2] -> -0.63199652777777671 | U755: =RC[-7]*RC[-3] -> 33.206597222222221 | V755: =RC[-7]*RC[-4] -> -54.630208333333336 | W755: =RC[-7]*RC[-5] -> 102.83333333333334 | X755: =RC[-7]*RC[-6] -> 1156.875 | Y755: =RC[-12]*RC[-12] -> 6.0434027777777569E-4 | Z755: =RC[-12]*RC[-12] -> 1.6684027777777775 | AA755: =RC[-12]*RC[-12] -> 4.515625 | AB755: =RC[-12]*RC[-12] -> 16 | AC755: =RC[-12]*RC[-12] -> 2025 | AD755: =RC[-12]*RC[-12] -> 660.91840277777794 | AE755: =RC[-11]/SQRT(RC[-6]*RC[-1]) -> -1 | AF755: =RC[-11]/SQRT(RC[-6]*RC[-2]) -> 1 | AG755: =RC[-11]/SQRT(RC[-6]*RC[-3]) -> -0.99999999999999989 | AH755: =RC[-11]/SQRT(RC[-6]*RC[-4]) -> 1 | AI755: =RC[-11]/SQRT(RC[-6]*RC[-5]) -> 1
A756: 56530 | B756: 北京 | C756: 67 | D756: 良 | E756: 0.76 | F756: 4 | G756: 38 | H756: 28 | I756: 97 | J756: 85 | L756: 2013-06-22T07:00:00.000 | M756: =RC[-8]-R[17]C[-8] -> 5.541666666666667E-2 | N756: =RC[-8]-R[17]C[-8] -> 0.29166666666666652 | O756: =RC[-8]-R[17]C[-8] -> 1.875 | P756: =RC[-8]-R[17]C[-8] -> -12 | Q756: =RC[-8]-R[17]C[-8] -> 35 | R756: =RC[-8]-R[17]C[-8] -> 38.708333333333336 | T756: =RC[-7]*RC[-2] -> 2.1450868055555556 | U756: =RC[-7]*RC[-3] -> 11.28993055555555 | V756: =RC[-7]*RC[-4] -> 72.578125 | W756: =RC[-7]*RC[-5] -> -464.5 | X756: =RC[-7]*RC[-6] -> 1354.7916666666667 | Y756: =RC[-12]*RC[-12] -> 3.0710069444444448E-3 | Z756: =RC[-12]*RC[-12] -> 8.5069444444444364E-2 | AA756: =RC[-12]*RC[-12] -> 3.515625 | AB756: =RC[-12]*RC[-12] -> 144 | AC756: =RC[-12]*RC[-12] -> 1225 | AD756: =RC[-12]*RC[-12] -> 1498.3350694444446 | AE756: =RC[-11]/SQRT(RC[-6]*RC[-1]) -> 1 | AF756: =RC[-11]/SQRT(RC[-6]*RC[-2]) -> 1 | AG756: =RC[-11]/SQRT(RC[-6]*RC[-3]) -> 1 | AH756: =RC[-11]/SQRT(RC[-6]*RC[-4]) -> -0.99999999999999989 | AI756: =RC[-11]/SQRT(RC[-6]*RC[-5]) -> 1
A757: 56606 | B757: 北京 | C757: 68 | D757: 良 | E757: 0.84 | F757: 4 | G757: 47 | H757: 17 | I757: 85 | J757: 84 | L757: 2013-06-22T08:00:00.000 | M757: =RC[-8]-R[16]C[-8] -> 0.13541666666666663 | N757: =RC[-8]-R[16]C[-8] -> 0.29166666666666652 | O757: =RC[-8]-R[16]C[-8] -> 10.875 | P757: =RC[-8]-R[16]C[-8] -> -23 | Q757: =RC[-8]-R[16]C[-8] -> 23 | R757: =RC[-8]-R[16]C[-8] -> 37.708333333333336 | T757: =RC[-7]*RC[-2] -> 5.1063368055555545 | U757: =RC[-7]*RC[-3] -> 10.998263888888884 | V757: =RC[-7]*RC[-4] -> 410.078125 | W757: =RC[-7]*RC[-5] -> -867.29166666666674 | X757: =RC[-7]*RC[-6] -> 867.29166666666674 | Y757: =RC[-12]*RC[-12] -> 1.8337673611111101E-2 | Z757: =RC[-12]*RC[-12] -> 8.5069444444444364E-2 | AA757: =RC[-12]*RC[-12] -> 118.265625 | AB757: =RC[-12]*RC[-12] -> 529 | AC757: =RC[-12]*RC[-12] -> 529 | AD757: =RC[-12]*RC[-12] -> 1421.9184027777781 | AE757: =RC[-11]/SQRT(RC[-6]*RC[-1]) -> 1 | AF757: =RC[-11]/SQRT(RC[-6]*RC[-2]) -> 1 | AG757: =RC[-11]/SQRT(RC[-6]*RC[-3]) -> 0.99999999999999989 | AH757: =RC[-11]/SQRT(RC[-6]*RC[-4]) -> -1 | AI757: =RC[-11]/SQRT(RC[-6]*RC[-5]) -> 1
A758: 56682 | B758: 北京 | C758: 69 | D758: 良 | E758: 0.83 | F758: 3 | G758: 50 | H758: 14 | I758: 77 | J758: 68 | L758: 2013-06-22T09:00:00.000 | M758: =RC[-8]-R[15]C[-8] -> 0.12541666666666662 | N758: =RC[-8]-R[15]C[-8] -> -0.70833333333333348 | O758: =RC[-8]-R[15]C[-8] -> 13.875 | P758: =RC[-8]-R[15]C[-8] -> -26 | Q758: =RC[-8]-R[15]C[-8] -> 15 | R758: =RC[-8]-R[15]C[-8] -> 21.708333333333336 | T758: =RC[-7]*RC[-2] -> 2.7225868055555549 | U758: =RC[-7]*RC[-3] -> -15.376736111111116 | V758: =RC[-7]*RC[-4] -> 301.20312500000006 | W758: =RC[-7]*RC[-5] -> -564.41666666666674 | X758: =RC[-7]*RC[-6] -> 325.62500000000006 | Y758: =RC[-12]*RC[-12] -> 1.5729340277777767E-2 | Z758: =RC[-12]*RC[-12] -> 0.50173611111111127 | AA758: =RC[-12]*RC[-12] -> 192.515625 | AB758: =RC[-12]*RC[-12] -> 676 | AC758: =RC[-12]*RC[-12] -> 225 | AD758: =RC[-12]*RC[-12] -> 471.2517361111112 | AE758: =RC[-11]/SQRT(RC[-6]*RC[-1]) -> 1 | AF758: =RC[-11]/SQRT(RC[-6]*RC[-2]) -> -1 | AG758: =RC[-11]/SQRT(RC[-6]*RC[-3]) -> 1.0000000000000002 | AH758: =RC[-11]/SQRT(RC[-6]*RC[-4]) -> -1 | AI758: =RC[-11]/SQRT(RC[-6]*RC[-5]) -> 1.0000000000000002
A759: 56758 | B759: 北京 | C759: 68 | D759: 良 | E759: 0.82 | F759: 3 | G759: 47 | H759: 19 | I759: 66 | J759: 59 | L759: 2013-06-22T10:00:00.000 | M759: =RC[-8]-R[14]C[-8] -> 0.11541666666666661 | N759: =RC[-8]-R[14]C[-8] -> -0.70833333333333348 | O759: =RC[-8]-R[14]C[-8] -> 10.875 | P759: =RC[-8]-R[14]C[-8] -> -21 | Q759: =RC[-8]-R[14]C[-8] -> 4 | R759: =RC[-8]-R[14]C[-8] -> 12.708333333333336 | T759: =RC[-7]*RC[-2] -> 1.4667534722222217 | U759: =RC[-7]*RC[-3] -> -9.0017361111111143 | V759: =RC[-7]*RC[-4] -> 138.20312500000003 | W759: =RC[-7]*RC[-5] -> -266.87500000000006 | X759: =RC[-7]*RC[-6] -> 50.833333333333343 | Y759: =RC[-12]*RC[-12] -> 1.3321006944444432E-2 | Z759: =RC[-12]*RC[-12] -> 0.50173611111111127 | AA759: =RC[-12]*RC[-12] -> 118.265625 | AB759: =RC[-12]*RC[-12] -> 441 | AC759: =RC[-12]*RC[-12] -> 16 | AD759: =RC[-12]*RC[-12] -> 161.50173611111117 | AE759: =RC[-11]/SQRT(RC[-6]*RC[-1]) -> 1 | AF759: =RC[-11]/SQRT(RC[-6]*RC[-2]) -> -1 | AG759: =RC[-11]/SQRT(RC[-6]*RC[-3]) -> 1 | AH759: =RC[-11]/SQRT(RC[-6]*RC[-4]) -> -1 | AI759: =RC[-11]/SQRT(RC[-6]*RC[-5]) -> 1
A760: 56834 | B760: 北京 | C760: 68 | D760: 良 | E760: 0.82 | F760: 3 | G760: 43 | H760: 24 | I760: 56 | J760: 50 | L760: 2013-06-22T11:00:00.000 | M760: =RC[-8]-R[13]C[-8] -> 0.11541666666666661 | N760: =RC[-8]-R[13]C[-8] -> -0.70833333333333348 | O760: =RC[-8]-R[13]C[-8] -> 6.875 | P760: =RC[-8]-R[13]C[-8] -> -16 | Q760: =RC[-8]-R[13]C[-8] -> -6 | R760: =RC[-8]-R[13]C[-8] -> 3.7083333333333357 | T760: =RC[-7]*RC[-2] -> 0.42800347222222229 | U760: =RC[-7]*RC[-3] -> -2.6267361111111134 | V760: =RC[-7]*RC[-4] -> 25.494791666666682 | W760: =RC[-7]*RC[-5] -> -59.333333333333371 | X760: =RC[-7]*RC[-6] -> -22.250000000000014 | Y760: =RC[-12]*RC[-12] -> 1.3321006944444432E-2 | Z760: =RC[-12]*RC[-12] -> 0.50173611111111127 | AA760: =RC[-12]*RC[-12] -> 47.265625 | AB760: =RC[-12]*RC[-12] -> 256 | AC760: =RC[-12]*RC[-12] -> 36 | AD760: =RC[-12]*RC[-12] -> 13.751736111111128 | AE760: =RC[-11]/SQRT(RC[-6]*RC[-1]) -> 1 | AF760: =RC[-11]/SQRT(RC[-6]*RC[-2]) -> -1.0000000000000002 | AG760: =RC[-11]/SQRT(RC[-6]*RC[-3]) -> 1 | AH760: =RC[-11]/SQRT(RC[-6]*RC[-4]) -> -1 | AI760: =RC[-11]/SQRT(RC[-6]*RC[-5]) -> -1
A761: 56910 | B761: 北京 | C761: 69 | D761: 良 | E761: 0.74 | F761: 3 | G761: 35 | H761: 36 | I761: 71 | J761: 44 | L761: 2013-06-22T12:00:00.000 | M761: =RC[-8]-R[12]C[-8] -> 3.5416666666666652E-2 | N761: =RC[-8]-R[12]C[-8] -> -0.70833333333333348 | O761: =RC[-8]-R[12]C[-8] -> -1.125 | P761: =RC[-8]-R[12]C[-8] -> -4 | Q761: =RC[-8]-R[12]C[-8] -> 9 | R761: =RC[-8]-R[12]C[-8] -> -2.2916666666666643 | T761: =RC[-7]*RC[-2] -> -8.1163194444444323E-2 | U761: =RC[-7]*RC[-3] -> 1.6232638888888875 | V761: =RC[-7]*RC[-4] -> 2.5781249999999973 | W761: =RC[-7]*RC[-5] -> 9.1666666666666572 | X761: =RC[-7]*RC[-6] -> -20.624999999999979 | Y761: =RC[-12]*RC[-12] -> 1.2543402777777767E-3 | Z761: =RC[-12]*RC[-12] -> 0.50173611111111127 | AA761: =RC[-12]*RC[-12] -> 1.265625 | AB761: =RC[-12]*RC[-12] -> 16 | AC761: =RC[-12]*RC[-12] -> 81 | AD761: =RC[-12]*RC[-12] -> 5.2517361111111001 | AE761: =RC[-11]/SQRT(RC[-6]*RC[-1]) -> -1 | AF761: =RC[-11]/SQRT(RC[-6]*RC[-2]) -> 1 | AG761: =RC[-11]/SQRT(RC[-6]*RC[-3]) -> 1 | AH761: =RC[-11]/SQRT(RC[-6]*RC[-4]) -> 1 | AI761: =RC[-11]/SQRT(RC[-6]*RC[-5]) -> -1
A762: 56986 | B762: 北京 | C762: 69 | D762: 良 | E762: 0.7 | F762: 3 | G762: 27 | H762: 44 | I762: 45 | J762: 39 | L762: 2013-06-22T13:00:00.000 | M762: =RC[-8]-R[11]C[-8] -> -4.5833333333333837E-3 | N762: =RC[-8]-R[11]C[-8] -> -0.70833333333333348 | O762: =RC[-8]-R[11]C[-8] -> -9.125 | P762: =RC[-8]-R[11]C[-8] -> 4 | Q762: =RC[-8]-R[11]C[-8] -> -17 | R762: =RC[-8]-R[11]C[-8] -> -7.2916666666666643 | T762: =RC[-7]*RC[-2] -> 3.3420138888889242E-2 | U762: =RC[-7]*RC[-3] -> 5.1649305555555554 | V762: =RC[-7]*RC[-4] -> 66.536458333333314 | W762: =RC[-7]*RC[-5] -> -29.166666666666657 | X762: =RC[-7]*RC[-6] -> 123.95833333333329 | Y762: =RC[-12]*RC[-12] -> 2.1006944444444907E-5 | Z762: =RC[-12]*RC[-12] -> 0.50173611111111127 | AA762: =RC[-12]*RC[-12] -> 83.265625 | AB762: =RC[-12]*RC[-12] -> 16 | AC762: =RC[-12]*RC[-12] -> 289 | AD762: =RC[-12]*RC[-12] -> 53.168402777777743 | AE762: =RC[-11]/SQRT(RC[-6]*RC[-1]) -> 0.99999999999999978 | AF762: =RC[-11]/SQRT(RC[-6]*RC[-2]) -> 1.0000000000000002 | AG762: =RC[-11]/SQRT(RC[-6]*RC[-3]) -> 1 | AH762: =RC[-11]/SQRT(RC[-6]*RC[-4]) -> -1 | AI762: =RC[-11]/SQRT(RC[-6]*RC[-5]) -> 0.99999999999999989
A763: 57062 | B763: 北京 | C763: 70 | D763: 良 | E763: 0.66 | F763: 3 | G763: 26 | H763: 45 | I763: 54 | J763: 35 | L763: 2013-06-22T14:00:00.000 | M763: =RC[-8]-R[10]C[-8] -> -4.4583333333333308E-2 | N763: =RC[-8]-R[10]C[-8] -> -0.70833333333333348 | O763: =RC[-8]-R[10]C[-8] -> -10.125 | P763: =RC[-8]-R[10]C[-8] -> 5 | Q763: =RC[-8]-R[10]C[-8] -> -8 | R763: =RC[-8]-R[10]C[-8] -> -11.291666666666664 | T763: =RC[-7]*RC[-2] -> 0.50342013888888848 | U763: =RC[-7]*RC[-3] -> 7.9982638888888893 | V763: =RC[-7]*RC[-4] -> 114.32812499999997 | W763: =RC[-7]*RC[-5] -> -56.458333333333321 | X763: =RC[-7]*RC[-6] -> 90.333333333333314 | Y763: =RC[-12]*RC[-12] -> 1.9876736111111089E-3 | Z763: =RC[-12]*RC[-12] -> 0.50173611111111127 | AA763: =RC[-12]*RC[-12] -> 102.515625 | AB763: =RC[-12]*RC[-12] -> 25 | AC763: =RC[-12]*RC[-12] -> 64 | AD763: =RC[-12]*RC[-12] -> 127.50173611111106 | AE763: =RC[-11]/SQRT(RC[-6]*RC[-1]) -> 1 | AF763: =RC[-11]/SQRT(RC[-6]*RC[-2]) -> 1 | AG763: =RC[-11]/SQRT(RC[-6]*RC[-3]) -> 1 | AH763: =RC[-11]/SQRT(RC[-6]*RC[-4]) -> -1 | AI763: =RC[-11]/SQRT(RC[-6]*RC[-5]) -> 1
A764: 57138 | B764: 北京 | C764: 69 | D764: 良 | E764: 0.66 | F764: 3 | G764: 27 | H764: 45 | I764: 52 | J764: 32 | L764: 2013-06-22T15:00:00.000 | M764: =RC[-8]-R[9]C[-8] -> -4.4583333333333308E-2 | N764: =RC[-8]-R[9]C[-8] -> -0.70833333333333348 | O764: =RC[-8]-R[9]C[-8] -> -9.125 | P764: =RC[-8]-R[9]C[-8] -> 5 | Q764: =RC[-8]-R[9]C[-8] -> -10 | R764: =RC[-8]-R[9]C[-8] -> -14.291666666666664 | T764: =RC[-7]*RC[-2] -> 0.6371701388888884 | U764: =RC[-7]*RC[-3] -> 10.123263888888889 | V764: =RC[-7]*RC[-4] -> 130.41145833333331 | W764: =RC[-7]*RC[-5] -> -71.458333333333314 | X764: =RC[-7]*RC[-6] -> 142.91666666666663 | Y764: =RC[-12]*RC[-12] -> 1.9876736111111089E-3 | Z764: =RC[-12]*RC[-12] -> 0.50173611111111127 | AA764: =RC[-12]*RC[-12] -> 83.265625 | AB764: =RC[-12]*RC[-12] -> 25 | AC764: =RC[-12]*RC[-12] -> 100 | AD764: =RC[-12]*RC[-12] -> 204.25173611111106 | AE764: =RC[-11]/SQRT(RC[-6]*RC[-1]) -> 1 | AF764: =RC[-11]/SQRT(RC[-6]*RC[-2]) -> 1 | AG764: =RC[-11]/SQRT(RC[-6]*RC[-3]) -> 1 | AH764: =RC[-11]/SQRT(RC[-6]*RC[-4]) -> -0.99999999999999978 | AI764: =RC[-11]/SQRT(RC[-6]*RC[-5]) -> 0.99999999999999978
A765: 57214 | B765: 北京 | C765: 68 | D765: 良 | E765: 0.66 | F765: 3 | G765: 30 | H765: 41 | I765: 50 | J765: 34 | L765: 2013-06-22T16:00:00.000 | M765: =RC[-8]-R[8]C[-8] -> -4.4583333333333308E-2 | N765: =RC[-8]-R[8]C[-8] -> -0.70833333333333348 | O765: =RC[-8]-R[8]C[-8] -> -6.125 | P765: =RC[-8]-R[8]C[-8] -> 1 | Q765: =RC[-8]-R[8]C[-8] -> -12 | R765: =RC[-8]-R[8]C[-8] -> -12.291666666666664 | T765: =RC[-7]*RC[-2] -> 0.54800347222222179 | U765: =RC[-7]*RC[-3] -> 8.7065972222222232 | V765: =RC[-7]*RC[-4] -> 75.286458333333314 | W765: =RC[-7]*RC[-5] -> -12.291666666666664 | X765: =RC[-7]*RC[-6] -> 147.49999999999997 | Y765: =RC[-12]*RC[-12] -> 1.9876736111111089E-3 | Z765: =RC[-12]*RC[-12] -> 0.50173611111111127 | AA765: =RC[-12]*RC[-12] -> 37.515625 | AB765: =RC[-12]*RC[-12] -> 1 | AC765: =RC[-12]*RC[-12] -> 144 | AD765: =RC[-12]*RC[-12] -> 151.0850694444444 | AE765: =RC[-11]/SQRT(RC[-6]*RC[-1]) -> 1 | AF765: =RC[-11]/SQRT(RC[-6]*RC[-2]) -> 1 | AG765: =RC[-11]/SQRT(RC[-6]*RC[-3]) -> 0.99999999999999978 | AH765: =RC[-11]/SQRT(RC[-6]*RC[-4]) -> -1 | AI765: =RC[-11]/SQRT(RC[-6]*RC[-5]) -> 1
A766: 57290 | B766: 北京 | C766: 67 | D766: 良 | E766: 0.67 | F766: 3 | G766: 35 | H766: 40 | I766: 44 | J766: 40 | L766: 2013-06-22T17:00:00.000 | M766: =RC[-8]-R[7]C[-8] -> -3.4583333333333299E-2 | N766: =RC[-8]-R[7]C[-8] -> -0.70833333333333348 | O766: =RC[-8]-R[7]C[-8] -> -1.125 | P766: =RC[-8]-R[7]C[-8] -> 0 | Q766: =RC[-8]-R[7]C[-8] -> -18 | R766: =RC[-8]-R[7]C[-8] -> -6.2916666666666643 | T766: =RC[-7]*RC[-2] -> 0.21758680555555526 | U766: =RC[-7]*RC[-3] -> 4.4565972222222214 | V766: =RC[-7]*RC[-4] -> 7.0781249999999973 | W766: =RC[-7]*RC[-5] -> 0 | X766: =RC[-7]*RC[-6] -> 113.24999999999996 | Y766: =RC[-12]*RC[-12] -> 1.196006944444442E-3 | Z766: =RC[-12]*RC[-12] -> 0.50173611111111127 | AA766: =RC[-12]*RC[-12] -> 1.265625 | AB766: =RC[-12]*RC[-12] -> 0 | AC766: =RC[-12]*RC[-12] -> 324 | AD766: =RC[-12]*RC[-12] -> 39.585069444444414 | AE766: =RC[-11]/SQRT(RC[-6]*RC[-1]) -> 1.0000000000000002 | AF766: =RC[-11]/SQRT(RC[-6]*RC[-2]) -> 1 | AG766: =RC[-11]/SQRT(RC[-6]*RC[-3]) -> 1 | AH766: =RC[-11]/SQRT(RC[-6]*RC[-4]) -> #DIV/0! | AI766: =RC[-11]/SQRT(RC[-6]*RC[-5]) -> 1
A767: 57366 | B767: 北京 | C767: 66 | D767: 良 | E767: 0.69 | F767: 3 | G767: 40 | H767: 35 | I767: 49 | J767: 41 | L767: 2013-06-22T18:00:00.000 | M767: =RC[-8]-R[6]C[-8] -> -1.4583333333333393E-2 | N767: =RC[-8]-R[6]C[-8] -> -0.70833333333333348 | O767: =RC[-8]-R[6]C[-8] -> 3.875 | P767: =RC[-8]-R[6]C[-8] -> -5 | Q767: =RC[-8]-R[6]C[-8] -> -13 | R767: =RC[-8]-R[6]C[-8] -> -5.2916666666666643 | T767: =RC[-7]*RC[-2] -> 7.717013888888917E-2 | U767: =RC[-7]*RC[-3] -> 3.748263888888888 | V767: =RC[-7]*RC[-4] -> -20.505208333333325 | W767: =RC[-7]*RC[-5] -> 26.458333333333321 | X767: =RC[-7]*RC[-6] -> 68.791666666666629 | Y767: =RC[-12]*RC[-12] -> 2.1267361111111283E-4 | Z767: =RC[-12]*RC[-12] -> 0.50173611111111127 | AA767: =RC[-12]*RC[-12] -> 15.015625 | AB767: =RC[-12]*RC[-12] -> 25 | AC767: =RC[-12]*RC[-12] -> 169 | AD767: =RC[-12]*RC[-12] -> 28.001736111111086 | AE767: =RC[-11]/SQRT(RC[-6]*RC[-1]) -> 1 | AF767: =RC[-11]/SQRT(RC[-6]*RC[-2]) -> 1 | AG767: =RC[-11]/SQRT(RC[-6]*RC[-3]) -> -1 | AH767: =RC[-11]/SQRT(RC[-6]*RC[-4]) -> 1 | AI767: =RC[-11]/SQRT(RC[-6]*RC[-5]) -> 0.99999999999999978
A768: 57442 | B768: 北京 | C768: 65 | D768: 良 | E768: 0.73 | F768: 3 | G768: 48 | H768: 27 | I768: 56 | J768: 39 | L768: 2013-06-22T19:00:00.000 | M768: =RC[-8]-R[5]C[-8] -> 2.5416666666666643E-2 | N768: =RC[-8]-R[5]C[-8] -> -0.70833333333333348 | O768: =RC[-8]-R[5]C[-8] -> 11.875 | P768: =RC[-8]-R[5]C[-8] -> -13 | Q768: =RC[-8]-R[5]C[-8] -> -6 | R768: =RC[-8]-R[5]C[-8] -> -7.2916666666666643 | T768: =RC[-7]*RC[-2] -> -0.18532986111111088 | U768: =RC[-7]*RC[-3] -> 5.1649305555555554 | V768: =RC[-7]*RC[-4] -> -86.588541666666643 | W768: =RC[-7]*RC[-5] -> 94.791666666666629 | X768: =RC[-7]*RC[-6] -> 43.749999999999986 | Y768: =RC[-12]*RC[-12] -> 6.4600694444444319E-4 | Z768: =RC[-12]*RC[-12] -> 0.50173611111111127 | AA768: =RC[-12]*RC[-12] -> 141.015625 | AB768: =RC[-12]*RC[-12] -> 169 | AC768: =RC[-12]*RC[-12] -> 36 | AD768: =RC[-12]*RC[-12] -> 53.168402777777743 | AE768: =RC[-11]/SQRT(RC[-6]*RC[-1]) -> -1 | AF768: =RC[-11]/SQRT(RC[-6]*RC[-2]) -> 1.0000000000000002 | AG768: =RC[-11]/SQRT(RC[-6]*RC[-3]) -> -1 | AH768: =RC[-11]/SQRT(RC[-6]*RC[-4]) -> 1 | AI768: =RC[-11]/SQRT(RC[-6]*RC[-5]) -> 1
A769: 57518 | B769: 北京 | C769: 65 | D769: 良 | E769: 0.75 | F769: 3 | G769: 44 | H769: 29 | I769: 68 | J769: 40 | L769: 2013-06-22T20:00:00.000 | M769: =RC[-8]-R[4]C[-8] -> 4.5416666666666661E-2 | N769: =RC[-8]-R[4]C[-8] -> -0.70833333333333348 | O769: =RC[-8]-R[4]C[-8] -> 7.875 | P769: =RC[-8]-R[4]C[-8] -> -11 | Q769: =RC[-8]-R[4]C[-8] -> 6 | R769: =RC[-8]-R[4]C[-8] -> -6.2916666666666643 | T769: =RC[-7]*RC[-2] -> -0.28574652777777765 | U769: =RC[-7]*RC[-3] -> 4.4565972222222214 | V769: =RC[-7]*RC[-4] -> -49.546874999999979 | W769: =RC[-7]*RC[-5] -> 69.208333333333314 | X769: =RC[-7]*RC[-6] -> -37.749999999999986 | Y769: =RC[-12]*RC[-12] -> 2.0626736111111106E-3 | Z769: =RC[-12]*RC[-12] -> 0.50173611111111127 | AA769: =RC[-12]*RC[-12] -> 62.015625 | AB769: =RC[-12]*RC[-12] -> 121 | AC769: =RC[-12]*RC[-12] -> 36 | AD769: =RC[-12]*RC[-12] -> 39.585069444444414 | AE769: =RC[-11]/SQRT(RC[-6]*RC[-1]) -> -1 | AF769: =RC[-11]/SQRT(RC[-6]*RC[-2]) -> 1 | AG769: =RC[-11]/SQRT(RC[-6]*RC[-3]) -> -1 | AH769: =RC[-11]/SQRT(RC[-6]*RC[-4]) -> 1.0000000000000002 | AI769: =RC[-11]/SQRT(RC[-6]*RC[-5]) -> -1
A770: 57594 | B770: 北京 | C770: 66 | D770: 良 | E770: 0.74 | F770: 3 | G770: 39 | H770: 32 | I770: 69 | J770: 40 | L770: 2013-06-22T21:00:00.000 | M770: =RC[-8]-R[3]C[-8] -> 3.5416666666666652E-2 | N770: =RC[-8]-R[3]C[-8] -> -0.70833333333333348 | O770: =RC[-8]-R[3]C[-8] -> 2.875 | P770: =RC[-8]-R[3]C[-8] -> -8 | Q770: =RC[-8]-R[3]C[-8] -> 7 | R770: =RC[-8]-R[3]C[-8] -> -6.2916666666666643 | T770: =RC[-7]*RC[-2] -> -0.22282986111111094 | U770: =RC[-7]*RC[-3] -> 4.4565972222222214 | V770: =RC[-7]*RC[-4] -> -18.088541666666661 | W770: =RC[-7]*RC[-5] -> 50.333333333333314 | X770: =RC[-7]*RC[-6] -> -44.04166666666665 | Y770: =RC[-12]*RC[-12] -> 1.2543402777777767E-3 | Z770: =RC[-12]*RC[-12] -> 0.50173611111111127 | AA770: =RC[-12]*RC[-12] -> 8.265625 | AB770: =RC[-12]*RC[-12] -> 64 | AC770: =RC[-12]*RC[-12] -> 49 | AD770: =RC[-12]*RC[-12] -> 39.585069444444414 | AE770: =RC[-11]/SQRT(RC[-6]*RC[-1]) -> -1.0000000000000002 | AF770: =RC[-11]/SQRT(RC[-6]*RC[-2]) -> 1 | AG770: =RC[-11]/SQRT(RC[-6]*RC[-3]) -> -1 | AH770: =RC[-11]/SQRT(RC[-6]*RC[-4]) -> 1 | AI770: =RC[-11]/SQRT(RC[-6]*RC[-5]) -> -1
A771: 57670 | B771: 北京 | C771: 66 | D771: 良 | E771: 0.81 | F771: 3 | G771: 39 | H771: 24 | I771: 40 | J771: 42 | L771: 2013-06-22T22:00:00.000 | M771: =RC[-8]-R[2]C[-8] -> 0.10541666666666671 | N771: =RC[-8]-R[2]C[-8] -> -0.70833333333333348 | O771: =RC[-8]-R[2]C[-8] -> 2.875 | P771: =RC[-8]-R[2]C[-8] -> -16 | Q771: =RC[-8]-R[2]C[-8] -> -22 | R771: =RC[-8]-R[2]C[-8] -> -4.2916666666666643 | T771: =RC[-7]*RC[-2] -> -0.45241319444444439 | U771: =RC[-7]*RC[-3] -> 3.0399305555555545 | V771: =RC[-7]*RC[-4] -> -12.338541666666661 | W771: =RC[-7]*RC[-5] -> 68.666666666666629 | X771: =RC[-7]*RC[-6] -> 94.416666666666615 | Y771: =RC[-12]*RC[-12] -> 1.1112673611111122E-2 | Z771: =RC[-12]*RC[-12] -> 0.50173611111111127 | AA771: =RC[-12]*RC[-12] -> 8.265625 | AB771: =RC[-12]*RC[-12] -> 256 | AC771: =RC[-12]*RC[-12] -> 484 | AD771: =RC[-12]*RC[-12] -> 18.418402777777757 | AE771: =RC[-11]/SQRT(RC[-6]*RC[-1]) -> -0.99999999999999989 | AF771: =RC[-11]/SQRT(RC[-6]*RC[-2]) -> 1 | AG771: =RC[-11]/SQRT(RC[-6]*RC[-3]) -> -1 | AH771: =RC[-11]/SQRT(RC[-6]*RC[-4]) -> 1 | AI771: =RC[-11]/SQRT(RC[-6]*RC[-5]) -> 1
A772: 57746 | B772: 北京 | C772: 67 | D772: 良 | E772: 0.97 | F772: 4 | G772: 40 | H772: 18 | I772: 35 | J772: 39 | L772: 2013-06-22T23:00:00.000 | M772: =RC[-8]-R[1]C[-8] -> 0.26541666666666663 | N772: =RC[-8]-R[1]C[-8] -> 0.29166666666666652 | O772: =RC[-8]-R[1]C[-8] -> 3.875 | P772: =RC[-8]-R[1]C[-8] -> -22 | Q772: =RC[-8]-R[1]C[-8] -> -27 | R772: =RC[-8]-R[1]C[-8] -> -7.2916666666666643 | T772: =RC[-7]*RC[-2] -> -1.9353298611111103 | U772: =RC[-7]*RC[-3] -> -2.1267361111111094 | V772: =RC[-7]*RC[-4] -> -28.255208333333325 | W772: =RC[-7]*RC[-5] -> 160.41666666666663 | X772: =RC[-7]*RC[-6] -> 196.87499999999994 | Y772: =RC[-12]*RC[-12] -> 7.0446006944444431E-2 | Z772: =RC[-12]*RC[-12] -> 8.5069444444444364E-2 | AA772: =RC[-12]*RC[-12] -> 15.015625 | AB772: =RC[-12]*RC[-12] -> 484 | AC772: =RC[-12]*RC[-12] -> 729 | AD772: =RC[-12]*RC[-12] -> 53.168402777777743 | AE772: =RC[-11]/SQRT(RC[-6]*RC[-1]) -> -1 | AF772: =RC[-11]/SQRT(RC[-6]*RC[-2]) -> -1 | AG772: =RC[-11]/SQRT(RC[-6]*RC[-3]) -> -1 | AH772: =RC[-11]/SQRT(RC[-6]*RC[-4]) -> 1.0000000000000002 | AI772: =RC[-11]/SQRT(RC[-6]*RC[-5]) -> 1
E773: =AVERAGE(R[-24]C:R[-1]C) -> 0.70458333333333334 | F773: =AVERAGE(R[-24]C:R[-1]C) -> 3.7083333333333335 | G773: =AVERAGE(R[-24]C:R[-1]C) -> 36.125 | H773: =AVERAGE(R[-24]C:R[-1]C) -> 40 | I773: =AVERAGE(R[-24]C:R[-1]C) -> 62 | J773: =AVERAGE(R[-24]C:R[-1]C) -> 46.291666666666664 | M773: =RC[-8]-RC[-8] -> 0 | N773: =RC[-8]-RC[-8] -> 0 | O773: =RC[-8]-RC[-8] -> 0 | P773: =RC[-8]-RC[-8] -> 0 | Q773: =RC[-8]-RC[-8] -> 0 | R773: =RC[-8]-RC[-8] -> 0 | T773: =SUM(R[-24]C:R[-1]C) -> 16.653663194444444 | U773: =SUM(R[-24]C:R[-1]C) -> 26.918402777777779 | V773: =SUM(R[-24]C:R[-1]C) -> 1452.130208333333 | W773: =SUM(R[-24]C:R[-1]C) -> -3235.5 | X773: =SUM(R[-24]C:R[-1]C) -> 4918.0000000000009 | Y773: =SUM(R[-24]C:R[-1]C) -> 0.28848315972222222 | Z773: =SUM(R[-24]C:R[-1]C) -> 21.289930555555546 | AA773: =SUM(R[-24]C:R[-1]C) -> 1575.359375 | AB773: =SUM(R[-24]C:R[-1]C) -> 9251 | AC773: =SUM(R[-24]C:R[-1]C) -> 7158 | AD773: =SUM(R[-24]C:R[-1]C) -> 5492.8732638888887 | AE773: =RC[-11]/SQRT(RC[-6]*RC[-1]) -> 0.41835961506832858 | AF773: =RC[-11]/SQRT(RC[-6]*RC[-2]) -> 7.8715883693391941E-2 | AG773: =RC[-11]/SQRT(RC[-6]*RC[-3]) -> 0.49364637224899049 | AH773: =RC[-11]/SQRT(RC[-6]*RC[-4]) -> -0.45388650903980776 | AI773: =RC[-11]/SQRT(RC[-6]*RC[-5]) -> 0.78431927479008789
A774: 57822 | B774: 北京 | C774: 67 | D774: 良 | E774: 1.18 | F774: 4 | G774: 50 | H774: 10 | I774: 65 | J774: 47 | L774: 2013-06-23T00:00:00.000 | M774: =RC[-8]-R[19]C[-8] -> 0.47 | N774: =RC[-8]-R[19]C[-8] -> -1 | O774: =RC[-8]-R[19]C[-8] -> 26 | P774: =RC[-8]-R[19]C[-8] -> -191 | Q774: =RC[-8]-R[19]C[-8] -> -12 | R774: =RC[-8]-R[19]C[-8] -> 4 | T774: =RC[-7]*RC[-2] -> 1.88 | U774: =RC[-7]*RC[-3] -> -4 | V774: =RC[-7]*RC[-4] -> 104 | W774: =RC[-7]*RC[-5] -> -764 | X774: =RC[-7]*RC[-6] -> -48 | Y774: =RC[-12]*RC[-12] -> 0.22089999999999999 | Z774: =RC[-12]*RC[-12] -> 1 | AA774: =RC[-12]*RC[-12] -> 676 | AB774: =RC[-12]*RC[-12] -> 36481 | AC774: =RC[-12]*RC[-12] -> 144 | AD774: =RC[-12]*RC[-12] -> 16 | AE774: =RC[-11]/SQRT(RC[-6]*RC[-1]) -> 1 | AF774: =RC[-11]/SQRT(RC[-6]*RC[-2]) -> -1 | AG774: =RC[-11]/SQRT(RC[-6]*RC[-3]) -> 1 | AH774: =RC[-11]/SQRT(RC[-6]*RC[-4]) -> -1 | AI774: =RC[-11]/SQRT(RC[-6]*RC[-5]) -> -1
A775: 57898 | B775: 北京 | C775: 68 | D775: 良 | E775: 1.33 | F775: 7 | G775: 48 | H775: 16 | I775: 36 | J775: 48 | L775: 2013-06-23T01:00:00.000 | M775: =RC[-8]-R[23]C[-8] -> 0.40791666666666659 | N775: =RC[-8]-R[23]C[-8] -> 1.083333333333333 | O775: =RC[-8]-R[23]C[-8] -> 16.625 | P775: =RC[-8]-R[23]C[-8] -> -83.125 | Q775: =RC[-8]-R[23]C[-8] -> -16.791666666666664 | R775: =RC[-8]-R[23]C[-8] -> 0.3333333333333357 | T775: =RC[-7]*RC[-2] -> 0.13597222222222316 | U775: =RC[-7]*RC[-3] -> 0.3611111111111136 | V775: =RC[-7]*RC[-4] -> 5.541666666666706 | W775: =RC[-7]*RC[-5] -> -27.708333333333531 | X775: =RC[-7]*RC[-6] -> -5.5972222222222614 | Y775: =RC[-12]*RC[-12] -> 0.1663960069444444 | Z775: =RC[-12]*RC[-12] -> 1.1736111111111105 | AA775: =RC[-12]*RC[-12] -> 276.390625 | AB775: =RC[-12]*RC[-12] -> 6909.765625 | AC775: =RC[-12]*RC[-12] -> 281.96006944444434 | AD775: =RC[-12]*RC[-12] -> 0.11111111111111269 | AE775: =RC[-11]/SQRT(RC[-6]*RC[-1]) -> 1 | AF775: =RC[-11]/SQRT(RC[-6]*RC[-2]) -> 1.0000000000000002 | AG775: =RC[-11]/SQRT(RC[-6]*RC[-3]) -> 1 | AH775: =RC[-11]/SQRT(RC[-6]*RC[-4]) -> -1 | AI775: =RC[-11]/SQRT(RC[-6]*RC[-5]) -> -1
A776: 57974 | B776: 北京 | C776: 69 | D776: 良 | E776: 1.38 | F776: 7 | G776: 37 | H776: 24 | I776: 45 | J776: 49 | L776: 2013-06-23T02:00:00.000 | M776: =RC[-8]-R[22]C[-8] -> 0.45791666666666642 | N776: =RC[-8]-R[22]C[-8] -> 1.083333333333333 | O776: =RC[-8]-R[22]C[-8] -> 5.625 | P776: =RC[-8]-R[22]C[-8] -> -75.125 | Q776: =RC[-8]-R[22]C[-8] -> -7.7916666666666643 | R776: =RC[-8]-R[22]C[-8] -> 1.3333333333333357 | T776: =RC[-7]*RC[-2] -> 0.6105555555555563 | U776: =RC[-7]*RC[-3] -> 1.4444444444444466 | V776: =RC[-7]*RC[-4] -> 7.5000000000000133 | W776: =RC[-7]*RC[-5] -> -100.16666666666684 | X776: =RC[-7]*RC[-6] -> -10.388888888888903 | Y776: =RC[-12]*RC[-12] -> 0.20968767361111088 | Z776: =RC[-12]*RC[-12] -> 1.1736111111111105 | AA776: =RC[-12]*RC[-12] -> 31.640625 | AB776: =RC[-12]*RC[-12] -> 5643.765625 | AC776: =RC[-12]*RC[-12] -> 60.710069444444407 | AD776: =RC[-12]*RC[-12] -> 1.7777777777777841 | AE776: =RC[-11]/SQRT(RC[-6]*RC[-1]) -> 1 | AF776: =RC[-11]/SQRT(RC[-6]*RC[-2]) -> 1 | AG776: =RC[-11]/SQRT(RC[-6]*RC[-3]) -> 1 | AH776: =RC[-11]/SQRT(RC[-6]*RC[-4]) -> -0.99999999999999989 | AI776: =RC[-11]/SQRT(RC[-6]*RC[-5]) -> -1
A777: 58050 | B777: 北京 | C777: 69 | D777: 良 | E777: 1.33 | F777: 6 | G777: 33 | H777: 20 | I777: 24 | J777: 56 | L777: 2013-06-23T03:00:00.000 | M777: =RC[-8]-R[21]C[-8] -> 0.40791666666666659 | N777: =RC[-8]-R[21]C[-8] -> 8.3333333333333037E-2 | O777: =RC[-8]-R[21]C[-8] -> 1.625 | P777: =RC[-8]-R[21]C[-8] -> -79.125 | Q777: =RC[-8]-R[21]C[-8] -> -28.791666666666664 | R777: =RC[-8]-R[21]C[-8] -> 8.3333333333333357 | T777: =RC[-7]*RC[-2] -> 3.3993055555555558 | U777: =RC[-7]*RC[-3] -> 0.6944444444444422 | V777: =RC[-7]*RC[-4] -> 13.541666666666671 | W777: =RC[-7]*RC[-5] -> -659.37500000000023 | X777: =RC[-7]*RC[-6] -> -239.9305555555556 | Y777: =RC[-12]*RC[-12] -> 0.1663960069444444 | Z777: =RC[-12]*RC[-12] -> 6.9444444444443955E-3 | AA777: =RC[-12]*RC[-12] -> 2.640625 | AB777: =RC[-12]*RC[-12] -> 6260.765625 | AC777: =RC[-12]*RC[-12] -> 828.96006944444434 | AD777: =RC[-12]*RC[-12] -> 69.444444444444485 | AE777: =RC[-11]/SQRT(RC[-6]*RC[-1]) -> 0.99999999999999989 | AF777: =RC[-11]/SQRT(RC[-6]*RC[-2]) -> 1 | AG777: =RC[-11]/SQRT(RC[-6]*RC[-3]) -> 1 | AH777: =RC[-11]/SQRT(RC[-6]*RC[-4]) -> -1 | AI777: =RC[-11]/SQRT(RC[-6]*RC[-5]) -> -1
A778: 58126 | B778: 北京 | C778: 71 | D778: 良 | E778: 1.28 | F778: 6 | G778: 33 | H778: 19 | I778: 31 | J778: 60 | L778: 2013-06-23T04:00:00.000 | M778: =RC[-8]-R[20]C[-8] -> 0.35791666666666655 | N778: =RC[-8]-R[20]C[-8] -> 8.3333333333333037E-2 | O778: =RC[-8]-R[20]C[-8] -> 1.625 | P778: =RC[-8]-R[20]C[-8] -> -80.125 | Q778: =RC[-8]-R[20]C[-8] -> -21.791666666666664 | R778: =RC[-8]-R[20]C[-8] -> 12.333333333333336 | T778: =RC[-7]*RC[-2] -> 4.414305555555555 | U778: =RC[-7]*RC[-3] -> 1.0277777777777743 | V778: =RC[-7]*RC[-4] -> 20.041666666666671 | W778: =RC[-7]*RC[-5] -> -988.20833333333348 | X778: =RC[-7]*RC[-6] -> -268.76388888888891 | Y778: =RC[-12]*RC[-12] -> 0.1281043402777777 | Z778: =RC[-12]*RC[-12] -> 6.9444444444443955E-3 | AA778: =RC[-12]*RC[-12] -> 2.640625 | AB778: =RC[-12]*RC[-12] -> 6420.015625 | AC778: =RC[-12]*RC[-12] -> 474.87673611111103 | AD778: =RC[-12]*RC[-12] -> 152.11111111111117 | AE778: =RC[-11]/SQRT(RC[-6]*RC[-1]) -> 1 | AF778: =RC[-11]/SQRT(RC[-6]*RC[-2]) -> 1 | AG778: =RC[-11]/SQRT(RC[-6]*RC[-3]) -> 1 | AH778: =RC[-11]/SQRT(RC[-6]*RC[-4]) -> -1 | AI778: =RC[-11]/SQRT(RC[-6]*RC[-5]) -> -1
A779: 58202 | B779: 北京 | C779: 71 | D779: 良 | E779: 1.26 | F779: 5 | G779: 43 | H779: 10 | I779: 58 | J779: 61 | L779: 2013-06-23T05:00:00.000 | M779: =RC[-8]-R[19]C[-8] -> 0.33791666666666653 | N779: =RC[-8]-R[19]C[-8] -> -0.91666666666666696 | O779: =RC[-8]-R[19]C[-8] -> 11.625 | P779: =RC[-8]-R[19]C[-8] -> -89.125 | Q779: =RC[-8]-R[19]C[-8] -> 5.2083333333333357 | R779: =RC[-8]-R[19]C[-8] -> 13.333333333333336 | T779: =RC[-7]*RC[-2] -> 4.5055555555555546 | U779: =RC[-7]*RC[-3] -> -12.222222222222229 | V779: =RC[-7]*RC[-4] -> 155.00000000000003 | W779: =RC[-7]*RC[-5] -> -1188.3333333333335 | X779: =RC[-7]*RC[-6] -> 69.444444444444485 | Y779: =RC[-12]*RC[-12] -> 0.11418767361111103 | Z779: =RC[-12]*RC[-12] -> 0.84027777777777835 | AA779: =RC[-12]*RC[-12] -> 135.140625 | AB779: =RC[-12]*RC[-12] -> 7943.265625 | AC779: =RC[-12]*RC[-12] -> 27.126736111111136 | AD779: =RC[-12]*RC[-12] -> 177.77777777777783 | AE779: =RC[-11]/SQRT(RC[-6]*RC[-1]) -> 1 | AF779: =RC[-11]/SQRT(RC[-6]*RC[-2]) -> -1 | AG779: =RC[-11]/SQRT(RC[-6]*RC[-3]) -> 1 | AH779: =RC[-11]/SQRT(RC[-6]*RC[-4]) -> -1 | AI779: =RC[-11]/SQRT(RC[-6]*RC[-5]) -> 1
A780: 58278 | B780: 北京 | C780: 70 | D780: 良 | E780: 1.22 | F780: 5 | G780: 37 | H780: 14 | I780: 43 | J780: 59 | L780: 2013-06-23T06:00:00.000 | M780: =RC[-8]-R[18]C[-8] -> 0.2979166666666665 | N780: =RC[-8]-R[18]C[-8] -> -0.91666666666666696 | O780: =RC[-8]-R[18]C[-8] -> 5.625 | P780: =RC[-8]-R[18]C[-8] -> -85.125 | Q780: =RC[-8]-R[18]C[-8] -> -9.7916666666666643 | R780: =RC[-8]-R[18]C[-8] -> 11.333333333333336 | T780: =RC[-7]*RC[-2] -> 3.3763888888888878 | U780: =RC[-7]*RC[-3] -> -10.388888888888895 | V780: =RC[-7]*RC[-4] -> 63.750000000000014 | W780: =RC[-7]*RC[-5] -> -964.75000000000023 | X780: =RC[-7]*RC[-6] -> -110.97222222222221 | Y780: =RC[-12]*RC[-12] -> 8.8754340277777677E-2 | Z780: =RC[-12]*RC[-12] -> 0.84027777777777835 | AA780: =RC[-12]*RC[-12] -> 31.640625 | AB780: =RC[-12]*RC[-12] -> 7246.265625 | AC780: =RC[-12]*RC[-12] -> 95.876736111111072 | AD780: =RC[-12]*RC[-12] -> 128.44444444444449 | AE780: =RC[-11]/SQRT(RC[-6]*RC[-1]) -> 1 | AF780: =RC[-11]/SQRT(RC[-6]*RC[-2]) -> -1 | AG780: =RC[-11]/SQRT(RC[-6]*RC[-3]) -> 1 | AH780: =RC[-11]/SQRT(RC[-6]*RC[-4]) -> -1 | AI780: =RC[-11]/SQRT(RC[-6]*RC[-5]) -> -1
A781: 58354 | B781: 北京 | C781: 68 | D781: 良 | E781: 1.25 | F781: 7 | G781: 39 | H781: 16 | I781: 50 | J781: 60 | L781: 2013-06-23T07:00:00.000 | M781: =RC[-8]-R[17]C[-8] -> 0.32791666666666652 | N781: =RC[-8]-R[17]C[-8] -> 1.083333333333333 | O781: =RC[-8]-R[17]C[-8] -> 7.625 | P781: =RC[-8]-R[17]C[-8] -> -83.125 | Q781: =RC[-8]-R[17]C[-8] -> -2.7916666666666643 | R781: =RC[-8]-R[17]C[-8] -> 12.333333333333336 | T781: =RC[-7]*RC[-2] -> 4.0443055555555549 | U781: =RC[-7]*RC[-3] -> 13.361111111111111 | V781: =RC[-7]*RC[-4] -> 94.041666666666686 | W781: =RC[-7]*RC[-5] -> -1025.2083333333335 | X781: =RC[-7]*RC[-6] -> -34.430555555555536 | Y781: =RC[-12]*RC[-12] -> 0.10752934027777768 | Z781: =RC[-12]*RC[-12] -> 1.1736111111111105 | AA781: =RC[-12]*RC[-12] -> 58.140625 | AB781: =RC[-12]*RC[-12] -> 6909.765625 | AC781: =RC[-12]*RC[-12] -> 7.7934027777777644 | AD781: =RC[-12]*RC[-12] -> 152.11111111111117 | AE781: =RC[-11]/SQRT(RC[-6]*RC[-1]) -> 1 | AF781: =RC[-11]/SQRT(RC[-6]*RC[-2]) -> 1.0000000000000002 | AG781: =RC[-11]/SQRT(RC[-6]*RC[-3]) -> 1 | AH781: =RC[-11]/SQRT(RC[-6]*RC[-4]) -> -1 | AI781: =RC[-11]/SQRT(RC[-6]*RC[-5]) -> -1.0000000000000002
A782: 58430 | B782: 北京 | C782: 65 | D782: 良 | E782: 1.19 | F782: 9 | G782: 43 | H782: 31 | I782: 35 | J782: 64 | L782: 2013-06-23T08:00:00.000 | M782: =RC[-8]-R[16]C[-8] -> 0.26791666666666647 | N782: =RC[-8]-R[16]C[-8] -> 3.083333333333333 | O782: =RC[-8]-R[16]C[-8] -> 11.625 | P782: =RC[-8]-R[16]C[-8] -> -68.125 | Q782: =RC[-8]-R[16]C[-8] -> -17.791666666666664 | R782: =RC[-8]-R[16]C[-8] -> 16.333333333333336 | T782: =RC[-7]*RC[-2] -> 4.3759722222222193 | U782: =RC[-7]*RC[-3] -> 50.361111111111114 | V782: =RC[-7]*RC[-4] -> 189.87500000000003 | W782: =RC[-7]*RC[-5] -> -1112.7083333333335 | X782: =RC[-7]*RC[-6] -> -290.59722222222223 | Y782: =RC[-12]*RC[-12] -> 7.1779340277777673E-2 | Z782: =RC[-12]*RC[-12] -> 9.5069444444444429 | AA782: =RC[-12]*RC[-12] -> 135.140625 | AB782: =RC[-12]*RC[-12] -> 4641.015625 | AC782: =RC[-12]*RC[-12] -> 316.54340277777771 | AD782: =RC[-12]*RC[-12] -> 266.77777777777783 | AE782: =RC[-11]/SQRT(RC[-6]*RC[-1]) -> 1 | AF782: =RC[-11]/SQRT(RC[-6]*RC[-2]) -> 1 | AG782: =RC[-11]/SQRT(RC[-6]*RC[-3]) -> 1 | AH782: =RC[-11]/SQRT(RC[-6]*RC[-4]) -> -1 | AI782: =RC[-11]/SQRT(RC[-6]*RC[-5]) -> -1
A783: 58506 | B783: 北京 | C783: 64 | D783: 良 | E783: 0.85 | F783: 7 | G783: 36 | H783: 48 | I783: 49 | J783: 49 | L783: 2013-06-23T09:00:00.000 | M783: =RC[-8]-R[15]C[-8] -> -7.2083333333333499E-2 | N783: =RC[-8]-R[15]C[-8] -> 1.083333333333333 | O783: =RC[-8]-R[15]C[-8] -> 4.625 | P783: =RC[-8]-R[15]C[-8] -> -51.125 | Q783: =RC[-8]-R[15]C[-8] -> -3.7916666666666643 | R783: =RC[-8]-R[15]C[-8] -> 1.3333333333333357 | T783: =RC[-7]*RC[-2] -> -9.6111111111111508E-2 | U783: =RC[-7]*RC[-3] -> 1.4444444444444466 | V783: =RC[-7]*RC[-4] -> 6.1666666666666776 | W783: =RC[-7]*RC[-5] -> -68.166666666666785 | X783: =RC[-7]*RC[-6] -> -5.0555555555555616 | Y783: =RC[-12]*RC[-12] -> 5.1960069444444684E-3 | Z783: =RC[-12]*RC[-12] -> 1.1736111111111105 | AA783: =RC[-12]*RC[-12] -> 21.390625 | AB783: =RC[-12]*RC[-12] -> 2613.765625 | AC783: =RC[-12]*RC[-12] -> 14.376736111111093 | AD783: =RC[-12]*RC[-12] -> 1.7777777777777841 | AE783: =RC[-11]/SQRT(RC[-6]*RC[-1]) -> -1 | AF783: =RC[-11]/SQRT(RC[-6]*RC[-2]) -> 1 | AG783: =RC[-11]/SQRT(RC[-6]*RC[-3]) -> 1 | AH783: =RC[-11]/SQRT(RC[-6]*RC[-4]) -> -1 | AI783: =RC[-11]/SQRT(RC[-6]*RC[-5]) -> -1
A784: 58582 | B784: 北京 | C784: 64 | D784: 良 | E784: 0.73 | F784: 7 | G784: 33 | H784: 67 | I784: 33 | J784: 41 | L784: 2013-06-23T10:00:00.000 | M784: =RC[-8]-R[14]C[-8] -> -0.19208333333333349 | N784: =RC[-8]-R[14]C[-8] -> 1.083333333333333 | O784: =RC[-8]-R[14]C[-8] -> 1.625 | P784: =RC[-8]-R[14]C[-8] -> -32.125 | Q784: =RC[-8]-R[14]C[-8] -> -19.791666666666664 | R784: =RC[-8]-R[14]C[-8] -> -6.6666666666666643 | T784: =RC[-7]*RC[-2] -> 1.2805555555555561 | U784: =RC[-7]*RC[-3] -> -7.2222222222222179 | V784: =RC[-7]*RC[-4] -> -10.833333333333329 | W784: =RC[-7]*RC[-5] -> 214.1666666666666 | X784: =RC[-7]*RC[-6] -> 131.94444444444437 | Y784: =RC[-12]*RC[-12] -> 3.6896006944444504E-2 | Z784: =RC[-12]*RC[-12] -> 1.1736111111111105 | AA784: =RC[-12]*RC[-12] -> 2.640625 | AB784: =RC[-12]*RC[-12] -> 1032.015625 | AC784: =RC[-12]*RC[-12] -> 391.71006944444434 | AD784: =RC[-12]*RC[-12] -> 44.444444444444414 | AE784: =RC[-11]/SQRT(RC[-6]*RC[-1]) -> 1 | AF784: =RC[-11]/SQRT(RC[-6]*RC[-2]) -> -1 | AG784: =RC[-11]/SQRT(RC[-6]*RC[-3]) -> -0.99999999999999989 | AH784: =RC[-11]/SQRT(RC[-6]*RC[-4]) -> 1 | AI784: =RC[-11]/SQRT(RC[-6]*RC[-5]) -> 0.99999999999999978
A785: 58658 | B785: 北京 | C785: 63 | D785: 良 | E785: 0.71 | F785: 8 | G785: 28 | H785: 91 | I785: 47 | J785: 38 | L785: 2013-06-23T11:00:00.000 | M785: =RC[-8]-R[13]C[-8] -> -0.21208333333333351 | N785: =RC[-8]-R[13]C[-8] -> 2.083333333333333 | O785: =RC[-8]-R[13]C[-8] -> -3.375 | P785: =RC[-8]-R[13]C[-8] -> -8.125 | Q785: =RC[-8]-R[13]C[-8] -> -5.7916666666666643 | R785: =RC[-8]-R[13]C[-8] -> -9.6666666666666643 | T785: =RC[-7]*RC[-2] -> 2.0501388888888901 | U785: =RC[-7]*RC[-3] -> -20.138888888888882 | V785: =RC[-7]*RC[-4] -> 32.624999999999993 | W785: =RC[-7]*RC[-5] -> 78.541666666666643 | X785: =RC[-7]*RC[-6] -> 55.986111111111072 | Y785: =RC[-12]*RC[-12] -> 4.4979340277777856E-2 | Z785: =RC[-12]*RC[-12] -> 4.3402777777777768 | AA785: =RC[-12]*RC[-12] -> 11.390625 | AB785: =RC[-12]*RC[-12] -> 66.015625 | AC785: =RC[-12]*RC[-12] -> 33.54340277777775 | AD785: =RC[-12]*RC[-12] -> 93.4444444444444 | AE785: =RC[-11]/SQRT(RC[-6]*RC[-1]) -> 1 | AF785: =RC[-11]/SQRT(RC[-6]*RC[-2]) -> -1 | AG785: =RC[-11]/SQRT(RC[-6]*RC[-3]) -> 1 | AH785: =RC[-11]/SQRT(RC[-6]*RC[-4]) -> 1 | AI785: =RC[-11]/SQRT(RC[-6]*RC[-5]) -> 1
A786: 58734 | B786: 北京 | C786: 64 | D786: 良 | E786: 0.63 | F786: 8 | G786: 21 | H786: 117 | I786: 38 | J786: 32 | L786: 2013-06-23T12:00:00.000 | M786: =RC[-8]-R[12]C[-8] -> -0.29208333333333347 | N786: =RC[-8]-R[12]C[-8] -> 2.083333333333333 | O786: =RC[-8]-R[12]C[-8] -> -10.375 | P786: =RC[-8]-R[12]C[-8] -> 17.875 | Q786: =RC[-8]-R[12]C[-8] -> -14.791666666666664 | R786: =RC[-8]-R[12]C[-8] -> -15.666666666666664 | T786: =RC[-7]*RC[-2] -> 4.5759722222222239 | U786: =RC[-7]*RC[-3] -> -32.638888888888879 | V786: =RC[-7]*RC[-4] -> 162.54166666666663 | W786: =RC[-7]*RC[-5] -> -280.04166666666663 | X786: =RC[-7]*RC[-6] -> 231.73611111111103 | Y786: =RC[-12]*RC[-12] -> 8.5312673611111195E-2 | Z786: =RC[-12]*RC[-12] -> 4.3402777777777768 | AA786: =RC[-12]*RC[-12] -> 107.640625 | AB786: =RC[-12]*RC[-12] -> 319.515625 | AC786: =RC[-12]*RC[-12] -> 218.79340277777771 | AD786: =RC[-12]*RC[-12] -> 245.44444444444437 | AE786: =RC[-11]/SQRT(RC[-6]*RC[-1]) -> 1 | AF786: =RC[-11]/SQRT(RC[-6]*RC[-2]) -> -1 | AG786: =RC[-11]/SQRT(RC[-6]*RC[-3]) -> 0.99999999999999978 | AH786: =RC[-11]/SQRT(RC[-6]*RC[-4]) -> -1 | AI786: =RC[-11]/SQRT(RC[-6]*RC[-5]) -> 1
A787: 58810 | B787: 北京 | C787: 63 | D787: 良 | E787: 0.6 | F787: 7 | G787: 16 | H787: 143 | I787: 25 | J787: 30 | L787: 2013-06-23T13:00:00.000 | M787: =RC[-8]-R[11]C[-8] -> -0.3220833333333335 | N787: =RC[-8]-R[11]C[-8] -> 1.083333333333333 | O787: =RC[-8]-R[11]C[-8] -> -15.375 | P787: =RC[-8]-R[11]C[-8] -> 43.875 | Q787: =RC[-8]-R[11]C[-8] -> -27.791666666666664 | R787: =RC[-8]-R[11]C[-8] -> -17.666666666666664 | T787: =RC[-7]*RC[-2] -> 5.6901388888888906 | U787: =RC[-7]*RC[-3] -> -19.138888888888882 | V787: =RC[-7]*RC[-4] -> 271.62499999999994 | W787: =RC[-7]*RC[-5] -> -775.12499999999989 | X787: =RC[-7]*RC[-6] -> 490.98611111111103 | Y787: =RC[-12]*RC[-12] -> 0.10373767361111122 | Z787: =RC[-12]*RC[-12] -> 1.1736111111111105 | AA787: =RC[-12]*RC[-12] -> 236.390625 | AB787: =RC[-12]*RC[-12] -> 1925.015625 | AC787: =RC[-12]*RC[-12] -> 772.37673611111097 | AD787: =RC[-12]*RC[-12] -> 312.11111111111103 | AE787: =RC[-11]/SQRT(RC[-6]*RC[-1]) -> 0.99999999999999989 | AF787: =RC[-11]/SQRT(RC[-6]*RC[-2]) -> -1 | AG787: =RC[-11]/SQRT(RC[-6]*RC[-3]) -> 0.99999999999999978 | AH787: =RC[-11]/SQRT(RC[-6]*RC[-4]) -> -1 | AI787: =RC[-11]/SQRT(RC[-6]*RC[-5]) -> 1
A788: 58886 | B788: 北京 | C788: 75 | D788: 良 | E788: 0.61 | F788: 6 | G788: 15 | H788: 172 | I788: 28 | J788: 33 | L788: 2013-06-23T14:00:00.000 | M788: =RC[-8]-R[10]C[-8] -> -0.31208333333333349 | N788: =RC[-8]-R[10]C[-8] -> 8.3333333333333037E-2 | O788: =RC[-8]-R[10]C[-8] -> -16.375 | P788: =RC[-8]-R[10]C[-8] -> 72.875 | Q788: =RC[-8]-R[10]C[-8] -> -24.791666666666664 | R788: =RC[-8]-R[10]C[-8] -> -14.666666666666664 | T788: =RC[-7]*RC[-2] -> 4.5772222222222236 | U788: =RC[-7]*RC[-3] -> -1.2222222222222177 | V788: =RC[-7]*RC[-4] -> 240.16666666666663 | W788: =RC[-7]*RC[-5] -> -1068.8333333333333 | X788: =RC[-7]*RC[-6] -> 363.61111111111103 | Y788: =RC[-12]*RC[-12] -> 9.7396006944444544E-2 | Z788: =RC[-12]*RC[-12] -> 6.9444444444443955E-3 | AA788: =RC[-12]*RC[-12] -> 268.140625 | AB788: =RC[-12]*RC[-12] -> 5310.765625 | AC788: =RC[-12]*RC[-12] -> 614.62673611111097 | AD788: =RC[-12]*RC[-12] -> 215.11111111111103 | AE788: =RC[-11]/SQRT(RC[-6]*RC[-1]) -> 1 | AF788: =RC[-11]/SQRT(RC[-6]*RC[-2]) -> -1 | AG788: =RC[-11]/SQRT(RC[-6]*RC[-3]) -> 1 | AH788: =RC[-11]/SQRT(RC[-6]*RC[-4]) -> -1.0000000000000002 | AI788: =RC[-11]/SQRT(RC[-6]*RC[-5]) -> 1
A789: 58962 | B789: 北京 | C789: 86 | D789: 良 | E789: 0.61 | F789: 6 | G789: 16 | H789: 193 | I789: 49 | J789: 34 | L789: 2013-06-23T15:00:00.000 | M789: =RC[-8]-R[9]C[-8] -> -0.31208333333333349 | N789: =RC[-8]-R[9]C[-8] -> 8.3333333333333037E-2 | O789: =RC[-8]-R[9]C[-8] -> -15.375 | P789: =RC[-8]-R[9]C[-8] -> 93.875 | Q789: =RC[-8]-R[9]C[-8] -> -3.7916666666666643 | R789: =RC[-8]-R[9]C[-8] -> -13.666666666666664 | T789: =RC[-7]*RC[-2] -> 4.2651388888888899 | U789: =RC[-7]*RC[-3] -> -1.1388888888888846 | V789: =RC[-7]*RC[-4] -> 210.12499999999997 | W789: =RC[-7]*RC[-5] -> -1282.958333333333 | X789: =RC[-7]*RC[-6] -> 51.8194444444444 | Y789: =RC[-12]*RC[-12] -> 9.7396006944444544E-2 | Z789: =RC[-12]*RC[-12] -> 6.9444444444443955E-3 | AA789: =RC[-12]*RC[-12] -> 236.390625 | AB789: =RC[-12]*RC[-12] -> 8812.515625 | AC789: =RC[-12]*RC[-12] -> 14.376736111111093 | AD789: =RC[-12]*RC[-12] -> 186.77777777777771 | AE789: =RC[-11]/SQRT(RC[-6]*RC[-1]) -> 0.99999999999999978 | AF789: =RC[-11]/SQRT(RC[-6]*RC[-2]) -> -1 | AG789: =RC[-11]/SQRT(RC[-6]*RC[-3]) -> 1 | AH789: =RC[-11]/SQRT(RC[-6]*RC[-4]) -> -1 | AI789: =RC[-11]/SQRT(RC[-6]*RC[-5]) -> 0.99999999999999989
A790: 59038 | B790: 北京 | C790: 100 | D790: 良 | E790: 0.61 | F790: 5 | G790: 16 | H790: 212 | I790: 68 | J790: 38 | L790: 2013-06-23T16:00:00.000 | M790: =RC[-8]-R[8]C[-8] -> -0.31208333333333349 | N790: =RC[-8]-R[8]C[-8] -> -0.91666666666666696 | O790: =RC[-8]-R[8]C[-8] -> -15.375 | P790: =RC[-8]-R[8]C[-8] -> 112.875 | Q790: =RC[-8]-R[8]C[-8] -> 15.208333333333336 | R790: =RC[-8]-R[8]C[-8] -> -9.6666666666666643 | T790: =RC[-7]*RC[-2] -> 3.0168055555555564 | U790: =RC[-7]*RC[-3] -> 8.8611111111111125 | V790: =RC[-7]*RC[-4] -> 148.62499999999997 | W790: =RC[-7]*RC[-5] -> -1091.1249999999998 | X790: =RC[-7]*RC[-6] -> -147.01388888888889 | Y790: =RC[-12]*RC[-12] -> 9.7396006944444544E-2 | Z790: =RC[-12]*RC[-12] -> 0.84027777777777835 | AA790: =RC[-12]*RC[-12] -> 236.390625 | AB790: =RC[-12]*RC[-12] -> 12740.765625 | AC790: =RC[-12]*RC[-12] -> 231.29340277777786 | AD790: =RC[-12]*RC[-12] -> 93.4444444444444 | AE790: =RC[-11]/SQRT(RC[-6]*RC[-1]) -> 1 | AF790: =RC[-11]/SQRT(RC[-6]*RC[-2]) -> 1 | AG790: =RC[-11]/SQRT(RC[-6]*RC[-3]) -> 1 | AH790: =RC[-11]/SQRT(RC[-6]*RC[-4]) -> -1 | AI790: =RC[-11]/SQRT(RC[-6]*RC[-5]) -> -1
A791: 59114 | B791: 北京 | C791: 105 | D791: 轻度污染 | E791: 0.67 | F791: 6 | G791: 19 | H791: 227 | I791: 69 | J791: 47 | L791: 2013-06-23T17:00:00.000 | M791: =RC[-8]-R[7]C[-8] -> -0.25208333333333344 | N791: =RC[-8]-R[7]C[-8] -> 8.3333333333333037E-2 | O791: =RC[-8]-R[7]C[-8] -> -12.375 | P791: =RC[-8]-R[7]C[-8] -> 127.875 | Q791: =RC[-8]-R[7]C[-8] -> 16.208333333333336 | R791: =RC[-8]-R[7]C[-8] -> -0.6666666666666643 | T791: =RC[-7]*RC[-2] -> 0.16805555555555501 | U791: =RC[-7]*RC[-3] -> -5.5555555555555164E-2 | V791: =RC[-7]*RC[-4] -> 8.2499999999999716 | W791: =RC[-7]*RC[-5] -> -85.249999999999702 | X791: =RC[-7]*RC[-6] -> -10.805555555555518 | Y791: =RC[-12]*RC[-12] -> 6.3546006944444497E-2 | Z791: =RC[-12]*RC[-12] -> 6.9444444444443955E-3 | AA791: =RC[-12]*RC[-12] -> 153.140625 | AB791: =RC[-12]*RC[-12] -> 16352.015625 | AC791: =RC[-12]*RC[-12] -> 262.71006944444451 | AD791: =RC[-12]*RC[-12] -> 0.44444444444444131 | AE791: =RC[-11]/SQRT(RC[-6]*RC[-1]) -> 0.99999999999999989 | AF791: =RC[-11]/SQRT(RC[-6]*RC[-2]) -> -1 | AG791: =RC[-11]/SQRT(RC[-6]*RC[-3]) -> 1 | AH791: =RC[-11]/SQRT(RC[-6]*RC[-4]) -> -1 | AI791: =RC[-11]/SQRT(RC[-6]*RC[-5]) -> -1
A792: 59190 | B792: 北京 | C792: 113 | D792: 轻度污染 | E792: 0.68 | F792: 5 | G792: 20 | H792: 222 | I792: 62 | J792: 41 | L792: 2013-06-23T18:00:00.000 | M792: =RC[-8]-R[6]C[-8] -> -0.24208333333333343 | N792: =RC[-8]-R[6]C[-8] -> -0.91666666666666696 | O792: =RC[-8]-R[6]C[-8] -> -11.375 | P792: =RC[-8]-R[6]C[-8] -> 122.875 | Q792: =RC[-8]-R[6]C[-8] -> 9.2083333333333357 | R792: =RC[-8]-R[6]C[-8] -> -6.6666666666666643 | T792: =RC[-7]*RC[-2] -> 1.6138888888888889 | U792: =RC[-7]*RC[-3] -> 6.1111111111111107 | V792: =RC[-7]*RC[-4] -> 75.8333333333333 | W792: =RC[-7]*RC[-5] -> -819.1666666666664 | X792: =RC[-7]*RC[-6] -> -61.388888888888886 | Y792: =RC[-12]*RC[-12] -> 5.8604340277777826E-2 | Z792: =RC[-12]*RC[-12] -> 0.84027777777777835 | AA792: =RC[-12]*RC[-12] -> 129.390625 | AB792: =RC[-12]*RC[-12] -> 15098.265625 | AC792: =RC[-12]*RC[-12] -> 84.793402777777828 | AD792: =RC[-12]*RC[-12] -> 44.444444444444414 | AE792: =RC[-11]/SQRT(RC[-6]*RC[-1]) -> 0.99999999999999989 | AF792: =RC[-11]/SQRT(RC[-6]*RC[-2]) -> 1 | AG792: =RC[-11]/SQRT(RC[-6]*RC[-3]) -> 0.99999999999999978 | AH792: =RC[-11]/SQRT(RC[-6]*RC[-4]) -> -1 | AI792: =RC[-11]/SQRT(RC[-6]*RC[-5]) -> -1
A793: 59266 | B793: 北京 | C793: 122 | D793: 轻度污染 | E793: 0.71 | F793: 5 | G793: 24 | H793: 201 | I793: 77 | J793: 43 | L793: 2013-06-23T19:00:00.000 | M793: =RC[-8]-R[5]C[-8] -> -0.21208333333333351 | N793: =RC[-8]-R[5]C[-8] -> -0.91666666666666696 | O793: =RC[-8]-R[5]C[-8] -> -7.375 | P793: =RC[-8]-R[5]C[-8] -> 101.875 | Q793: =RC[-8]-R[5]C[-8] -> 24.208333333333336 | R793: =RC[-8]-R[5]C[-8] -> -4.6666666666666643 | T793: =RC[-7]*RC[-2] -> 0.9897222222222225 | U793: =RC[-7]*RC[-3] -> 4.2777777777777768 | V793: =RC[-7]*RC[-4] -> 34.41666666666665 | W793: =RC[-7]*RC[-5] -> -475.4166666666664 | X793: =RC[-7]*RC[-6] -> -112.97222222222217 | Y793: =RC[-12]*RC[-12] -> 4.4979340277777856E-2 | Z793: =RC[-12]*RC[-12] -> 0.84027777777777835 | AA793: =RC[-12]*RC[-12] -> 54.390625 | AB793: =RC[-12]*RC[-12] -> 10378.515625 | AC793: =RC[-12]*RC[-12] -> 586.04340277777794 | AD793: =RC[-12]*RC[-12] -> 21.777777777777757 | AE793: =RC[-11]/SQRT(RC[-6]*RC[-1]) -> 0.99999999999999989 | AF793: =RC[-11]/SQRT(RC[-6]*RC[-2]) -> 0.99999999999999978 | AG793: =RC[-11]/SQRT(RC[-6]*RC[-3]) -> 1 | AH793: =RC[-11]/SQRT(RC[-6]*RC[-4]) -> -0.99999999999999989 | AI793: =RC[-11]/SQRT(RC[-6]*RC[-5]) -> -0.99999999999999989
A794: 59342 | B794: 北京 | C794: 127 | D794: 轻度污染 | E794: 0.8 | F794: 4 | G794: 32 | H794: 161 | I794: 59 | J794: 44 | L794: 2013-06-23T20:00:00.000 | M794: =RC[-8]-R[4]C[-8] -> -0.12208333333333343 | N794: =RC[-8]-R[4]C[-8] -> -1.916666666666667 | O794: =RC[-8]-R[4]C[-8] -> 0.625 | P794: =RC[-8]-R[4]C[-8] -> 61.875 | Q794: =RC[-8]-R[4]C[-8] -> 6.2083333333333357 | R794: =RC[-8]-R[4]C[-8] -> -3.6666666666666643 | T794: =RC[-7]*RC[-2] -> 0.44763888888888897 | U794: =RC[-7]*RC[-3] -> 7.0277777777777741 | V794: =RC[-7]*RC[-4] -> -2.2916666666666652 | W794: =RC[-7]*RC[-5] -> -226.87499999999986 | X794: =RC[-7]*RC[-6] -> -22.763888888888882 | Y794: =RC[-12]*RC[-12] -> 1.4904340277777803E-2 | Z794: =RC[-12]*RC[-12] -> 3.673611111111112 | AA794: =RC[-12]*RC[-12] -> 0.390625 | AB794: =RC[-12]*RC[-12] -> 3828.515625 | AC794: =RC[-12]*RC[-12] -> 38.543402777777807 | AD794: =RC[-12]*RC[-12] -> 13.444444444444427 | AE794: =RC[-11]/SQRT(RC[-6]*RC[-1]) -> 1 | AF794: =RC[-11]/SQRT(RC[-6]*RC[-2]) -> 1 | AG794: =RC[-11]/SQRT(RC[-6]*RC[-3]) -> -1 | AH794: =RC[-11]/SQRT(RC[-6]*RC[-4]) -> -1 | AI794: =RC[-11]/SQRT(RC[-6]*RC[-5]) -> -1
A795: 59418 | B795: 北京 | C795: 126 | D795: 轻度污染 | E795: 0.83 | F795: 4 | G795: 36 | H795: 139 | I795: 86 | J795: 52 | L795: 2013-06-23T21:00:00.000 | M795: =RC[-8]-R[3]C[-8] -> -9.2083333333333517E-2 | N795: =RC[-8]-R[3]C[-8] -> -1.916666666666667 | O795: =RC[-8]-R[3]C[-8] -> 4.625 | P795: =RC[-8]-R[3]C[-8] -> 39.875 | Q795: =RC[-8]-R[3]C[-8] -> 33.208333333333336 | R795: =RC[-8]-R[3]C[-8] -> 4.3333333333333357 | T795: =RC[-7]*RC[-2] -> -0.39902777777777881 | U795: =RC[-7]*RC[-3] -> -8.3055555555555607 | V795: =RC[-7]*RC[-4] -> 20.041666666666679 | W795: =RC[-7]*RC[-5] -> 172.79166666666677 | X795: =RC[-7]*RC[-6] -> 143.90277777777786 | Y795: =RC[-12]*RC[-12] -> 8.4793402777778113E-3 | Z795: =RC[-12]*RC[-12] -> 3.673611111111112 | AA795: =RC[-12]*RC[-12] -> 21.390625 | AB795: =RC[-12]*RC[-12] -> 1590.015625 | AC795: =RC[-12]*RC[-12] -> 1102.7934027777778 | AD795: =RC[-12]*RC[-12] -> 18.7777777777778 | AE795: =RC[-11]/SQRT(RC[-6]*RC[-1]) -> -1 | AF795: =RC[-11]/SQRT(RC[-6]*RC[-2]) -> -1 | AG795: =RC[-11]/SQRT(RC[-6]*RC[-3]) -> 1 | AH795: =RC[-11]/SQRT(RC[-6]*RC[-4]) -> 1 | AI795: =RC[-11]/SQRT(RC[-6]*RC[-5]) -> 1
A796: 59494 | B796: 北京 | C796: 119 | D796: 轻度污染 | E796: 0.82 | F796: 4 | G796: 39 | H796: 117 | I796: 92 | J796: 54 | L796: 2013-06-23T22:00:00.000 | M796: =RC[-8]-R[2]C[-8] -> -0.10208333333333353 | N796: =RC[-8]-R[2]C[-8] -> -1.916666666666667 | O796: =RC[-8]-R[2]C[-8] -> 7.625 | P796: =RC[-8]-R[2]C[-8] -> 17.875 | Q796: =RC[-8]-R[2]C[-8] -> 39.208333333333336 | R796: =RC[-8]-R[2]C[-8] -> 6.3333333333333357 | T796: =RC[-7]*RC[-2] -> -0.64652777777777926 | U796: =RC[-7]*RC[-3] -> -12.138888888888895 | V796: =RC[-7]*RC[-4] -> 48.291666666666686 | W796: =RC[-7]*RC[-5] -> 113.20833333333337 | X796: =RC[-7]*RC[-6] -> 248.31944444444454 | Y796: =RC[-12]*RC[-12] -> 1.0421006944444484E-2 | Z796: =RC[-12]*RC[-12] -> 3.673611111111112 | AA796: =RC[-12]*RC[-12] -> 58.140625 | AB796: =RC[-12]*RC[-12] -> 319.515625 | AC796: =RC[-12]*RC[-12] -> 1537.2934027777781 | AD796: =RC[-12]*RC[-12] -> 40.111111111111143 | AE796: =RC[-11]/SQRT(RC[-6]*RC[-1]) -> -1 | AF796: =RC[-11]/SQRT(RC[-6]*RC[-2]) -> -1 | AG796: =RC[-11]/SQRT(RC[-6]*RC[-3]) -> 1 | AH796: =RC[-11]/SQRT(RC[-6]*RC[-4]) -> 1 | AI796: =RC[-11]/SQRT(RC[-6]*RC[-5]) -> 0.99999999999999989
A797: 59570 | B797: 北京 | C797: 111 | D797: 轻度污染 | E797: 0.85 | F797: 4 | G797: 39 | H797: 109 | I797: 98 | J797: 64 | L797: 2013-06-23T23:00:00.000 | M797: =RC[-8]-R[1]C[-8] -> -7.2083333333333499E-2 | N797: =RC[-8]-R[1]C[-8] -> -1.916666666666667 | O797: =RC[-8]-R[1]C[-8] -> 7.625 | P797: =RC[-8]-R[1]C[-8] -> 9.875 | Q797: =RC[-8]-R[1]C[-8] -> 45.208333333333336 | R797: =RC[-8]-R[1]C[-8] -> 16.333333333333336 | T797: =RC[-7]*RC[-2] -> -1.177361111111114 | U797: =RC[-7]*RC[-3] -> -31.305555555555564 | V797: =RC[-7]*RC[-4] -> 124.54166666666669 | W797: =RC[-7]*RC[-5] -> 161.29166666666669 | X797: =RC[-7]*RC[-6] -> 738.40277777777794 | Y797: =RC[-12]*RC[-12] -> 5.1960069444444684E-3 | Z797: =RC[-12]*RC[-12] -> 3.673611111111112 | AA797: =RC[-12]*RC[-12] -> 58.140625 | AB797: =RC[-12]*RC[-12] -> 97.515625 | AC797: =RC[-12]*RC[-12] -> 2043.7934027777781 | AD797: =RC[-12]*RC[-12] -> 266.77777777777783 | AE797: =RC[-11]/SQRT(RC[-6]*RC[-1]) -> -1 | AF797: =RC[-11]/SQRT(RC[-6]*RC[-2]) -> -1 | AG797: =RC[-11]/SQRT(RC[-6]*RC[-3]) -> 1 | AH797: =RC[-11]/SQRT(RC[-6]*RC[-4]) -> 1 | AI797: =RC[-11]/SQRT(RC[-6]*RC[-5]) -> 1
E798: =AVERAGE(R[-24]C:R[-1]C) -> 0.92208333333333348 | F798: =AVERAGE(R[-24]C:R[-1]C) -> 5.916666666666667 | G798: =AVERAGE(R[-24]C:R[-1]C) -> 31.375 | H798: =AVERAGE(R[-24]C:R[-1]C) -> 99.125 | I798: =AVERAGE(R[-24]C:R[-1]C) -> 52.791666666666664 | J798: =AVERAGE(R[-24]C:R[-1]C) -> 47.666666666666664 | M798: =RC[-8]-RC[-8] -> 0 | N798: =RC[-8]-RC[-8] -> 0 | O798: =RC[-8]-RC[-8] -> 0 | P798: =RC[-8]-RC[-8] -> 0 | Q798: =RC[-8]-RC[-8] -> 0 | R798: =RC[-8]-RC[-8] -> 0 | T798: =SUM(R[-24]C:R[-1]C) -> 53.098611111111111 | U798: =SUM(R[-24]C:R[-1]C) -> -64.944444444444429 | V798: =SUM(R[-24]C:R[-1]C) -> 2023.416666666667 | W798: =SUM(R[-24]C:R[-1]C) -> -12263.41666666667 | X798: =SUM(R[-24]C:R[-1]C) -> 1157.4722222222222 | Y798: =SUM(R[-24]C:R[-1]C) -> 2.0481748263888897 | Z798: =SUM(R[-24]C:R[-1]C) -> 45.159722222222229 | AA798: =SUM(R[-24]C:R[-1]C) -> 2944.734375 | AB798: =SUM(R[-24]C:R[-1]C) -> 168940.359375 | AC798: =SUM(R[-24]C:R[-1]C) -> 10184.914930555557 | AD798: =SUM(R[-24]C:R[-1]C) -> 2562.8888888888891 | AE798: =RC[-11]/SQRT(RC[-6]*RC[-1]) -> 0.73288318976875477 | AF798: =RC[-11]/SQRT(RC[-6]*RC[-2]) -> -0.19089804728528345 | AG798: =RC[-11]/SQRT(RC[-6]*RC[-3]) -> 0.73654175238707686 | AH798: =RC[-11]/SQRT(RC[-6]*RC[-4]) -> -0.58935895704489782 | AI798: =RC[-11]/SQRT(RC[-6]*RC[-5]) -> 0.22655152256513797
A799: 59646 | B799: 北京 | C799: 99 | D799: 良 | E799: 0.8 | F799: 4 | G799: 35 | H799: 103 | I799: 93 | J799: 66 | L799: 2013-06-24T00:00:00.000 | M799: =RC[-8]-R[19]C[-8] -> -0.59999999999999987 | N799: =RC[-8]-R[19]C[-8] -> -5 | O799: =RC[-8]-R[19]C[-8] -> -1 | P799: =RC[-8]-R[19]C[-8] -> -81 | Q799: =RC[-8]-R[19]C[-8] -> -105 | R799: =RC[-8]-R[19]C[-8] -> -78 | T799: =RC[-7]*RC[-2] -> 46.79999999999999 | U799: =RC[-7]*RC[-3] -> 390 | V799: =RC[-7]*RC[-4] -> 78 | W799: =RC[-7]*RC[-5] -> 6318 | X799: =RC[-7]*RC[-6] -> 8190 | Y799: =RC[-12]*RC[-12] -> 0.35999999999999982 | Z799: =RC[-12]*RC[-12] -> 25 | AA799: =RC[-12]*RC[-12] -> 1 | AB799: =RC[-12]*RC[-12] -> 6561 | AC799: =RC[-12]*RC[-12] -> 11025 | AD799: =RC[-12]*RC[-12] -> 6084 | AE799: =RC[-11]/SQRT(RC[-6]*RC[-1]) -> 1 | AF799: =RC[-11]/SQRT(RC[-6]*RC[-2]) -> 1 | AG799: =RC[-11]/SQRT(RC[-6]*RC[-3]) -> 1 | AH799: =RC[-11]/SQRT(RC[-6]*RC[-4]) -> 1 | AI799: =RC[-11]/SQRT(RC[-6]*RC[-5]) -> 1
A800: 59722 | B800: 北京 | C800: 86 | D800: 良 | E800: 0.79 | F800: 4 | G800: 33 | H800: 88 | I800: 75 | J800: 58 | L800: 2013-06-24T01:00:00.000 | M800: =RC[-8]-R[23]C[-8] -> -0.45958333333333345 | N800: =RC[-8]-R[23]C[-8] -> -2.5 | O800: =RC[-8]-R[23]C[-8] -> 1.125 | P800: =RC[-8]-R[23]C[-8] -> -28.541666666666671 | Q800: =RC[-8]-R[23]C[-8] -> -57.125 | R800: =RC[-8]-R[23]C[-8] -> -43.333333333333329 | T800: =RC[-7]*RC[-2] -> 19.915277777777781 | U800: =RC[-7]*RC[-3] -> 108.33333333333331 | V800: =RC[-7]*RC[-4] -> -48.749999999999993 | W800: =RC[-7]*RC[-5] -> 1236.8055555555557 | X800: =RC[-7]*RC[-6] -> 2475.4166666666665 | Y800: =RC[-12]*RC[-12] -> 0.2112168402777779 | Z800: =RC[-12]*RC[-12] -> 6.25 | AA800: =RC[-12]*RC[-12] -> 1.265625 | AB800: =RC[-12]*RC[-12] -> 814.62673611111143 | AC800: =RC[-12]*RC[-12] -> 3263.265625 | AD800: =RC[-12]*RC[-12] -> 1877.7777777777774 | AE800: =RC[-11]/SQRT(RC[-6]*RC[-1]) -> 1 | AF800: =RC[-11]/SQRT(RC[-6]*RC[-2]) -> 0.99999999999999989 | AG800: =RC[-11]/SQRT(RC[-6]*RC[-3]) -> -1 | AH800: =RC[-11]/SQRT(RC[-6]*RC[-4]) -> 1 | AI800: =RC[-11]/SQRT(RC[-6]*RC[-5]) -> 1
A801: 59798 | B801: 北京 | C801: 74 | D801: 良 | E801: 0.87 | F801: 4 | G801: 34 | H801: 74 | I801: 158 | J801: 37 | L801: 2013-06-24T02:00:00.000 | M801: =RC[-8]-R[22]C[-8] -> -0.37958333333333349 | N801: =RC[-8]-R[22]C[-8] -> -2.5 | O801: =RC[-8]-R[22]C[-8] -> 2.125 | P801: =RC[-8]-R[22]C[-8] -> -42.541666666666671 | Q801: =RC[-8]-R[22]C[-8] -> 25.875 | R801: =RC[-8]-R[22]C[-8] -> -64.333333333333329 | T801: =RC[-7]*RC[-2] -> 24.419861111111121 | U801: =RC[-7]*RC[-3] -> 160.83333333333331 | V801: =RC[-7]*RC[-4] -> -136.70833333333331 | W801: =RC[-7]*RC[-5] -> 2736.8472222222222 | X801: =RC[-7]*RC[-6] -> -1664.6249999999998 | Y801: =RC[-12]*RC[-12] -> 0.14408350694444458 | Z801: =RC[-12]*RC[-12] -> 6.25 | AA801: =RC[-12]*RC[-12] -> 4.515625 | AB801: =RC[-12]*RC[-12] -> 1809.7934027777783 | AC801: =RC[-12]*RC[-12] -> 669.515625 | AD801: =RC[-12]*RC[-12] -> 4138.7777777777774 | AE801: =RC[-11]/SQRT(RC[-6]*RC[-1]) -> 1 | AF801: =RC[-11]/SQRT(RC[-6]*RC[-2]) -> 1 | AG801: =RC[-11]/SQRT(RC[-6]*RC[-3]) -> -0.99999999999999978 | AH801: =RC[-11]/SQRT(RC[-6]*RC[-4]) -> 0.99999999999999989 | AI801: =RC[-11]/SQRT(RC[-6]*RC[-5]) -> -1
A802: 59874 | B802: 北京 | C802: 69 | D802: 良 | E802: 0.96 | F802: 4 | G802: 36 | H802: 69 | I802: 51 | J802: 36 | L802: 2013-06-24T03:00:00.000 | M802: =RC[-8]-R[21]C[-8] -> -0.28958333333333353 | N802: =RC[-8]-R[21]C[-8] -> -2.5 | O802: =RC[-8]-R[21]C[-8] -> 4.125 | P802: =RC[-8]-R[21]C[-8] -> -47.541666666666671 | Q802: =RC[-8]-R[21]C[-8] -> -81.125 | R802: =RC[-8]-R[21]C[-8] -> -65.333333333333329 | T802: =RC[-7]*RC[-2] -> 18.919444444444455 | U802: =RC[-7]*RC[-3] -> 163.33333333333331 | V802: =RC[-7]*RC[-4] -> -269.5 | W802: =RC[-7]*RC[-5] -> 3106.0555555555557 | X802: =RC[-7]*RC[-6] -> 5300.1666666666661 | Y802: =RC[-12]*RC[-12] -> 8.385850694444455E-2 | Z802: =RC[-12]*RC[-12] -> 6.25 | AA802: =RC[-12]*RC[-12] -> 17.015625 | AB802: =RC[-12]*RC[-12] -> 2260.2100694444448 | AC802: =RC[-12]*RC[-12] -> 6581.265625 | AD802: =RC[-12]*RC[-12] -> 4268.4444444444434 | AE802: =RC[-11]/SQRT(RC[-6]*RC[-1]) -> 1 | AF802: =RC[-11]/SQRT(RC[-6]*RC[-2]) -> 1 | AG802: =RC[-11]/SQRT(RC[-6]*RC[-3]) -> -1 | AH802: =RC[-11]/SQRT(RC[-6]*RC[-4]) -> 1.0000000000000002 | AI802: =RC[-11]/SQRT(RC[-6]*RC[-5]) -> 1
A803: 59950 | B803: 北京 | C803: 68 | D803: 良 | E803: 1.07 | F803: 4 | G803: 32 | H803: 59 | I803: 56 | J803: 40 | L803: 2013-06-24T04:00:00.000 | M803: =RC[-8]-R[20]C[-8] -> -0.17958333333333343 | N803: =RC[-8]-R[20]C[-8] -> -2.5 | O803: =RC[-8]-R[20]C[-8] -> 0.125 | P803: =RC[-8]-R[20]C[-8] -> -57.541666666666671 | Q803: =RC[-8]-R[20]C[-8] -> -76.125 | R803: =RC[-8]-R[20]C[-8] -> -61.333333333333329 | T803: =RC[-7]*RC[-2] -> 11.01444444444445 | U803: =RC[-7]*RC[-3] -> 153.33333333333331 | V803: =RC[-7]*RC[-4] -> -7.6666666666666661 | W803: =RC[-7]*RC[-5] -> 3529.2222222222222 | X803: =RC[-7]*RC[-6] -> 4669 | Y803: =RC[-12]*RC[-12] -> 3.2250173611111148E-2 | Z803: =RC[-12]*RC[-12] -> 6.25 | AA803: =RC[-12]*RC[-12] -> 1.5625E-2 | AB803: =RC[-12]*RC[-12] -> 3311.0434027777783 | AC803: =RC[-12]*RC[-12] -> 5795.015625 | AD803: =RC[-12]*RC[-12] -> 3761.7777777777774 | AE803: =RC[-11]/SQRT(RC[-6]*RC[-1]) -> 1 | AF803: =RC[-11]/SQRT(RC[-6]*RC[-2]) -> 1 | AG803: =RC[-11]/SQRT(RC[-6]*RC[-3]) -> -1 | AH803: =RC[-11]/SQRT(RC[-6]*RC[-4]) -> 1 | AI803: =RC[-11]/SQRT(RC[-6]*RC[-5]) -> 1
A804: 60026 | B804: 北京 | C804: 68 | D804: 良 | E804: 1.0900000000000001 | F804: 3 | G804: 36 | H804: 50 | I804: 69 | J804: 49 | L804: 2013-06-24T05:00:00.000 | M804: =RC[-8]-R[19]C[-8] -> -0.15958333333333341 | N804: =RC[-8]-R[19]C[-8] -> -3.5 | O804: =RC[-8]-R[19]C[-8] -> 4.125 | P804: =RC[-8]-R[19]C[-8] -> -66.541666666666671 | Q804: =RC[-8]-R[19]C[-8] -> -63.125 | R804: =RC[-8]-R[19]C[-8] -> -52.333333333333329 | T804: =RC[-7]*RC[-2] -> 8.3515277777777808 | U804: =RC[-7]*RC[-3] -> 183.16666666666666 | V804: =RC[-7]*RC[-4] -> -215.87499999999997 | W804: =RC[-7]*RC[-5] -> 3482.3472222222222 | X804: =RC[-7]*RC[-6] -> 3303.5416666666665 | Y804: =RC[-12]*RC[-12] -> 2.5466840277777802E-2 | Z804: =RC[-12]*RC[-12] -> 12.25 | AA804: =RC[-12]*RC[-12] -> 17.015625 | AB804: =RC[-12]*RC[-12] -> 4427.7934027777783 | AC804: =RC[-12]*RC[-12] -> 3984.765625 | AD804: =RC[-12]*RC[-12] -> 2738.7777777777774 | AE804: =RC[-11]/SQRT(RC[-6]*RC[-1]) -> 1 | AF804: =RC[-11]/SQRT(RC[-6]*RC[-2]) -> 1 | AG804: =RC[-11]/SQRT(RC[-6]*RC[-3]) -> -1 | AH804: =RC[-11]/SQRT(RC[-6]*RC[-4]) -> 1 | AI804: =RC[-11]/SQRT(RC[-6]*RC[-5]) -> 1
A805: 60102 | B805: 北京 | C805: 68 | D805: 良 | E805: 1.18 | F805: 4 | G805: 40 | H805: 39 | I805: 97 | J805: 57 | L805: 2013-06-24T06:00:00.000 | M805: =RC[-8]-R[18]C[-8] -> -6.9583333333333552E-2 | N805: =RC[-8]-R[18]C[-8] -> -2.5 | O805: =RC[-8]-R[18]C[-8] -> 8.125 | P805: =RC[-8]-R[18]C[-8] -> -77.541666666666671 | Q805: =RC[-8]-R[18]C[-8] -> -35.125 | R805: =RC[-8]-R[18]C[-8] -> -44.333333333333329 | T805: =RC[-7]*RC[-2] -> 3.0848611111111204 | U805: =RC[-7]*RC[-3] -> 110.83333333333331 | V805: =RC[-7]*RC[-4] -> -360.20833333333331 | W805: =RC[-7]*RC[-5] -> 3437.6805555555552 | X805: =RC[-7]*RC[-6] -> 1557.2083333333333 | Y805: =RC[-12]*RC[-12] -> 4.8418402777778086E-3 | Z805: =RC[-12]*RC[-12] -> 6.25 | AA805: =RC[-12]*RC[-12] -> 66.015625 | AB805: =RC[-12]*RC[-12] -> 6012.7100694444453 | AC805: =RC[-12]*RC[-12] -> 1233.765625 | AD805: =RC[-12]*RC[-12] -> 1965.4444444444441 | AE805: =RC[-11]/SQRT(RC[-6]*RC[-1]) -> 0.99999999999999989 | AF805: =RC[-11]/SQRT(RC[-6]*RC[-2]) -> 0.99999999999999989 | AG805: =RC[-11]/SQRT(RC[-6]*RC[-3]) -> -1 | AH805: =RC[-11]/SQRT(RC[-6]*RC[-4]) -> 1 | AI805: =RC[-11]/SQRT(RC[-6]*RC[-5]) -> 1
A806: 60178 | B806: 北京 | C806: 69 | D806: 良 | E806: 1.26 | F806: 5 | G806: 45 | H806: 41 | I806: 125 | J806: 77 | L806: 2013-06-24T07:00:00.000 | M806: =RC[-8]-R[17]C[-8] -> 1.0416666666666519E-2 | N806: =RC[-8]-R[17]C[-8] -> -1.5 | O806: =RC[-8]-R[17]C[-8] -> 13.125 | P806: =RC[-8]-R[17]C[-8] -> -75.541666666666671 | Q806: =RC[-8]-R[17]C[-8] -> -7.125 | R806: =RC[-8]-R[17]C[-8] -> -24.333333333333329 | T806: =RC[-7]*RC[-2] -> -0.25347222222221855 | U806: =RC[-7]*RC[-3] -> 36.499999999999993 | V806: =RC[-7]*RC[-4] -> -319.37499999999994 | W806: =RC[-7]*RC[-5] -> 1838.1805555555552 | X806: =RC[-7]*RC[-6] -> 173.37499999999997 | Y806: =RC[-12]*RC[-12] -> 1.0850694444444136E-4 | Z806: =RC[-12]*RC[-12] -> 2.25 | AA806: =RC[-12]*RC[-12] -> 172.265625 | AB806: =RC[-12]*RC[-12] -> 5706.5434027777783 | AC806: =RC[-12]*RC[-12] -> 50.765625 | AD806: =RC[-12]*RC[-12] -> 592.11111111111086 | AE806: =RC[-11]/SQRT(RC[-6]*RC[-1]) -> -1 | AF806: =RC[-11]/SQRT(RC[-6]*RC[-2]) -> 1 | AG806: =RC[-11]/SQRT(RC[-6]*RC[-3]) -> -1 | AH806: =RC[-11]/SQRT(RC[-6]*RC[-4]) -> 1 | AI806: =RC[-11]/SQRT(RC[-6]*RC[-5]) -> 1
A807: 60254 | B807: 北京 | C807: 73 | D807: 良 | E807: 1.66 | F807: 7 | G807: 43 | H807: 53 | I807: 208 | J807: 154 | L807: 2013-06-24T08:00:00.000 | M807: =RC[-8]-R[16]C[-8] -> 0.41041666666666643 | N807: =RC[-8]-R[16]C[-8] -> 0.5 | O807: =RC[-8]-R[16]C[-8] -> 11.125 | P807: =RC[-8]-R[16]C[-8] -> -63.541666666666671 | Q807: =RC[-8]-R[16]C[-8] -> 75.875 | R807: =RC[-8]-R[16]C[-8] -> 52.666666666666671 | T807: =RC[-7]*RC[-2] -> 21.615277777777766 | U807: =RC[-7]*RC[-3] -> 26.333333333333336 | V807: =RC[-7]*RC[-4] -> 585.91666666666674 | W807: =RC[-7]*RC[-5] -> -3346.5277777777783 | X807: =RC[-7]*RC[-6] -> 3996.0833333333335 | Y807: =RC[-12]*RC[-12] -> 0.16844184027777759 | Z807: =RC[-12]*RC[-12] -> 0.25 | AA807: =RC[-12]*RC[-12] -> 123.765625 | AB807: =RC[-12]*RC[-12] -> 4037.5434027777783 | AC807: =RC[-12]*RC[-12] -> 5757.015625 | AD807: =RC[-12]*RC[-12] -> 2773.7777777777783 | AE807: =RC[-11]/SQRT(RC[-6]*RC[-1]) -> 1 | AF807: =RC[-11]/SQRT(RC[-6]*RC[-2]) -> 1 | AG807: =RC[-11]/SQRT(RC[-6]*RC[-3]) -> 1 | AH807: =RC[-11]/SQRT(RC[-6]*RC[-4]) -> -1 | AI807: =RC[-11]/SQRT(RC[-6]*RC[-5]) -> 0.99999999999999989
A808: 60330 | B808: 北京 | C808: 79 | D808: 良 | E808: 1.73 | F808: 7 | G808: 50 | H808: 62 | I808: 224 | J808: 191 | L808: 2013-06-24T09:00:00.000 | M808: =RC[-8]-R[15]C[-8] -> 0.48041666666666649 | N808: =RC[-8]-R[15]C[-8] -> 0.5 | O808: =RC[-8]-R[15]C[-8] -> 18.125 | P808: =RC[-8]-R[15]C[-8] -> -54.541666666666671 | Q808: =RC[-8]-R[15]C[-8] -> 91.875 | R808: =RC[-8]-R[15]C[-8] -> 89.666666666666671 | T808: =RC[-7]*RC[-2] -> 43.077361111111095 | U808: =RC[-7]*RC[-3] -> 44.833333333333336 | V808: =RC[-7]*RC[-4] -> 1625.2083333333335 | W808: =RC[-7]*RC[-5] -> -4890.5694444444453 | X808: =RC[-7]*RC[-6] -> 8238.125 | Y808: =RC[-12]*RC[-12] -> 0.23080017361111094 | Z808: =RC[-12]*RC[-12] -> 0.25 | AA808: =RC[-12]*RC[-12] -> 328.515625 | AB808: =RC[-12]*RC[-12] -> 2974.7934027777783 | AC808: =RC[-12]*RC[-12] -> 8441.015625 | AD808: =RC[-12]*RC[-12] -> 8040.1111111111122 | AE808: =RC[-11]/SQRT(RC[-6]*RC[-1]) -> 1 | AF808: =RC[-11]/SQRT(RC[-6]*RC[-2]) -> 1 | AG808: =RC[-11]/SQRT(RC[-6]*RC[-3]) -> 1 | AH808: =RC[-11]/SQRT(RC[-6]*RC[-4]) -> -1 | AI808: =RC[-11]/SQRT(RC[-6]*RC[-5]) -> 1
A809: 60406 | B809: 北京 | C809: 85 | D809: 良 | E809: 1.62 | F809: 8 | G809: 42 | H809: 89 | I809: 198 | J809: 171 | L809: 2013-06-24T10:00:00.000 | M809: =RC[-8]-R[14]C[-8] -> 0.37041666666666662 | N809: =RC[-8]-R[14]C[-8] -> 1.5 | O809: =RC[-8]-R[14]C[-8] -> 10.125 | P809: =RC[-8]-R[14]C[-8] -> -27.541666666666671 | Q809: =RC[-8]-R[14]C[-8] -> 65.875 | R809: =RC[-8]-R[14]C[-8] -> 69.666666666666671 | T809: =RC[-7]*RC[-2] -> 25.805694444444441 | U809: =RC[-7]*RC[-3] -> 104.5 | V809: =RC[-7]*RC[-4] -> 705.375 | W809: =RC[-7]*RC[-5] -> -1918.7361111111115 | X809: =RC[-7]*RC[-6] -> 4589.291666666667 | Y809: =RC[-12]*RC[-12] -> 0.13720850694444442 | Z809: =RC[-12]*RC[-12] -> 2.25 | AA809: =RC[-12]*RC[-12] -> 102.515625 | AB809: =RC[-12]*RC[-12] -> 758.54340277777806 | AC809: =RC[-12]*RC[-12] -> 4339.515625 | AD809: =RC[-12]*RC[-12] -> 4853.4444444444453 | AE809: =RC[-11]/SQRT(RC[-6]*RC[-1]) -> 0.99999999999999989 | AF809: =RC[-11]/SQRT(RC[-6]*RC[-2]) -> 0.99999999999999989 | AG809: =RC[-11]/SQRT(RC[-6]*RC[-3]) -> 1 | AH809: =RC[-11]/SQRT(RC[-6]*RC[-4]) -> -1 | AI809: =RC[-11]/SQRT(RC[-6]*RC[-5]) -> 1
A810: 60482 | B810: 北京 | C810: 91 | D810: 良 | E810: 1.58 | F810: 8 | G810: 32 | H810: 123 | I810: 157 | J810: 166 | L810: 2013-06-24T11:00:00.000 | M810: =RC[-8]-R[13]C[-8] -> 0.33041666666666658 | N810: =RC[-8]-R[13]C[-8] -> 1.5 | O810: =RC[-8]-R[13]C[-8] -> 0.125 | P810: =RC[-8]-R[13]C[-8] -> 6.4583333333333286 | Q810: =RC[-8]-R[13]C[-8] -> 24.875 | R810: =RC[-8]-R[13]C[-8] -> 64.666666666666671 | T810: =RC[-7]*RC[-2] -> 21.366944444444439 | U810: =RC[-7]*RC[-3] -> 97 | V810: =RC[-7]*RC[-4] -> 8.0833333333333339 | W810: =RC[-7]*RC[-5] -> 417.63888888888863 | X810: =RC[-7]*RC[-6] -> 1608.5833333333335 | Y810: =RC[-12]*RC[-12] -> 0.10917517361111105 | Z810: =RC[-12]*RC[-12] -> 2.25 | AA810: =RC[-12]*RC[-12] -> 1.5625E-2 | AB810: =RC[-12]*RC[-12] -> 41.710069444444386 | AC810: =RC[-12]*RC[-12] -> 618.765625 | AD810: =RC[-12]*RC[-12] -> 4181.7777777777783 | AE810: =RC[-11]/SQRT(RC[-6]*RC[-1]) -> 1 | AF810: =RC[-11]/SQRT(RC[-6]*RC[-2]) -> 0.99999999999999989 | AG810: =RC[-11]/SQRT(RC[-6]*RC[-3]) -> 1 | AH810: =RC[-11]/SQRT(RC[-6]*RC[-4]) -> 1 | AI810: =RC[-11]/SQRT(RC[-6]*RC[-5]) -> 1
A811: 60558 | B811: 北京 | C811: 98 | D811: 良 | E811: 1.53 | F811: 9 | G811: 28 | H811: 160 | I811: 144 | J811: 158 | L811: 2013-06-24T12:00:00.000 | M811: =RC[-8]-R[12]C[-8] -> 0.28041666666666654 | N811: =RC[-8]-R[12]C[-8] -> 2.5 | O811: =RC[-8]-R[12]C[-8] -> -3.875 | P811: =RC[-8]-R[12]C[-8] -> 43.458333333333329 | Q811: =RC[-8]-R[12]C[-8] -> 11.875 | R811: =RC[-8]-R[12]C[-8] -> 56.666666666666671 | T811: =RC[-7]*RC[-2] -> 15.890277777777772 | U811: =RC[-7]*RC[-3] -> 141.66666666666669 | V811: =RC[-7]*RC[-4] -> -219.58333333333334 | W811: =RC[-7]*RC[-5] -> 2462.6388888888887 | X811: =RC[-7]*RC[-6] -> 672.91666666666674 | Y811: =RC[-12]*RC[-12] -> 7.8633506944444376E-2 | Z811: =RC[-12]*RC[-12] -> 6.25 | AA811: =RC[-12]*RC[-12] -> 15.015625 | AB811: =RC[-12]*RC[-12] -> 1888.6267361111106 | AC811: =RC[-12]*RC[-12] -> 141.015625 | AD811: =RC[-12]*RC[-12] -> 3211.1111111111118 | AE811: =RC[-11]/SQRT(RC[-6]*RC[-1]) -> 1 | AF811: =RC[-11]/SQRT(RC[-6]*RC[-2]) -> 1 | AG811: =RC[-11]/SQRT(RC[-6]*RC[-3]) -> -0.99999999999999989 | AH811: =RC[-11]/SQRT(RC[-6]*RC[-4]) -> 1 | AI811: =RC[-11]/SQRT(RC[-6]*RC[-5]) -> 1
A812: 60634 | B812: 北京 | C812: 104 | D812: 轻度污染 | E812: 1.51 | F812: 11 | G812: 21 | H812: 183 | I812: 183 | J812: 148 | L812: 2013-06-24T13:00:00.000 | M812: =RC[-8]-R[11]C[-8] -> 0.26041666666666652 | N812: =RC[-8]-R[11]C[-8] -> 4.5 | O812: =RC[-8]-R[11]C[-8] -> -10.875 | P812: =RC[-8]-R[11]C[-8] -> 66.458333333333329 | Q812: =RC[-8]-R[11]C[-8] -> 50.875 | R812: =RC[-8]-R[11]C[-8] -> 46.666666666666671 | T812: =RC[-7]*RC[-2] -> 12.152777777777771 | U812: =RC[-7]*RC[-3] -> 210.00000000000003 | V812: =RC[-7]*RC[-4] -> -507.50000000000006 | W812: =RC[-7]*RC[-5] -> 3101.3888888888891 | X812: =RC[-7]*RC[-6] -> 2374.166666666667 | Y812: =RC[-12]*RC[-12] -> 6.7816840277777707E-2 | Z812: =RC[-12]*RC[-12] -> 20.25 | AA812: =RC[-12]*RC[-12] -> 118.265625 | AB812: =RC[-12]*RC[-12] -> 4416.7100694444434 | AC812: =RC[-12]*RC[-12] -> 2588.265625 | AD812: =RC[-12]*RC[-12] -> 2177.7777777777783 | AE812: =RC[-11]/SQRT(RC[-6]*RC[-1]) -> 0.99999999999999989 | AF812: =RC[-11]/SQRT(RC[-6]*RC[-2]) -> 1 | AG812: =RC[-11]/SQRT(RC[-6]*RC[-3]) -> -1 | AH812: =RC[-11]/SQRT(RC[-6]*RC[-4]) -> 1 | AI812: =RC[-11]/SQRT(RC[-6]*RC[-5]) -> 1
A813: 60710 | B813: 北京 | C813: 113 | D813: 轻度污染 | E813: 1.39 | F813: 9 | G813: 18 | H813: 199 | I813: 159 | J813: 145 | L813: 2013-06-24T14:00:00.000 | M813: =RC[-8]-R[10]C[-8] -> 0.14041666666666641 | N813: =RC[-8]-R[10]C[-8] -> 2.5 | O813: =RC[-8]-R[10]C[-8] -> -13.875 | P813: =RC[-8]-R[10]C[-8] -> 82.458333333333329 | Q813: =RC[-8]-R[10]C[-8] -> 26.875 | R813: =RC[-8]-R[10]C[-8] -> 43.666666666666671 | T813: =RC[-7]*RC[-2] -> 6.1315277777777677 | U813: =RC[-7]*RC[-3] -> 109.16666666666669 | V813: =RC[-7]*RC[-4] -> -605.87500000000011 | W813: =RC[-7]*RC[-5] -> 3600.6805555555557 | X813: =RC[-7]*RC[-6] -> 1173.5416666666667 | Y813: =RC[-12]*RC[-12] -> 1.9716840277777706E-2 | Z813: =RC[-12]*RC[-12] -> 6.25 | AA813: =RC[-12]*RC[-12] -> 192.515625 | AB813: =RC[-12]*RC[-12] -> 6799.3767361111104 | AC813: =RC[-12]*RC[-12] -> 722.265625 | AD813: =RC[-12]*RC[-12] -> 1906.7777777777783 | AE813: =RC[-11]/SQRT(RC[-6]*RC[-1]) -> 1 | AF813: =RC[-11]/SQRT(RC[-6]*RC[-2]) -> 1 | AG813: =RC[-11]/SQRT(RC[-6]*RC[-3]) -> -1 | AH813: =RC[-11]/SQRT(RC[-6]*RC[-4]) -> 1 | AI813: =RC[-11]/SQRT(RC[-6]*RC[-5]) -> 1
A814: 60786 | B814: 北京 | C814: 118 | D814: 轻度污染 | E814: 1.53 | F814: 10 | G814: 23 | H814: 206 | I814: 195 | J814: 152 | L814: 2013-06-24T15:00:00.000 | M814: =RC[-8]-R[9]C[-8] -> 0.28041666666666654 | N814: =RC[-8]-R[9]C[-8] -> 3.5 | O814: =RC[-8]-R[9]C[-8] -> -8.875 | P814: =RC[-8]-R[9]C[-8] -> 89.458333333333329 | Q814: =RC[-8]-R[9]C[-8] -> 62.875 | R814: =RC[-8]-R[9]C[-8] -> 50.666666666666671 | T814: =RC[-7]*RC[-2] -> 14.207777777777773 | U814: =RC[-7]*RC[-3] -> 177.33333333333334 | V814: =RC[-7]*RC[-4] -> -449.66666666666669 | W814: =RC[-7]*RC[-5] -> 4532.5555555555557 | X814: =RC[-7]*RC[-6] -> 3185.666666666667 | Y814: =RC[-12]*RC[-12] -> 7.8633506944444376E-2 | Z814: =RC[-12]*RC[-12] -> 12.25 | AA814: =RC[-12]*RC[-12] -> 78.765625 | AB814: =RC[-12]*RC[-12] -> 8002.7934027777774 | AC814: =RC[-12]*RC[-12] -> 3953.265625 | AD814: =RC[-12]*RC[-12] -> 2567.1111111111118 | AE814: =RC[-11]/SQRT(RC[-6]*RC[-1]) -> 1 | AF814: =RC[-11]/SQRT(RC[-6]*RC[-2]) -> 0.99999999999999989 | AG814: =RC[-11]/SQRT(RC[-6]*RC[-3]) -> -1 | AH814: =RC[-11]/SQRT(RC[-6]*RC[-4]) -> 1 | AI814: =RC[-11]/SQRT(RC[-6]*RC[-5]) -> 1
A815: 60862 | B815: 北京 | C815: 125 | D815: 轻度污染 | E815: 1.5 | F815: 10 | G815: 22 | H815: 203 | I815: 218 | J815: 127 | L815: 2013-06-24T16:00:00.000 | M815: =RC[-8]-R[8]C[-8] -> 0.25041666666666651 | N815: =RC[-8]-R[8]C[-8] -> 3.5 | O815: =RC[-8]-R[8]C[-8] -> -9.875 | P815: =RC[-8]-R[8]C[-8] -> 86.458333333333329 | Q815: =RC[-8]-R[8]C[-8] -> 85.875 | R815: =RC[-8]-R[8]C[-8] -> 25.666666666666671 | T815: =RC[-7]*RC[-2] -> 6.4273611111111082 | U815: =RC[-7]*RC[-3] -> 89.833333333333343 | V815: =RC[-7]*RC[-4] -> -253.45833333333337 | W815: =RC[-7]*RC[-5] -> 2219.0972222222226 | X815: =RC[-7]*RC[-6] -> 2204.1250000000005 | Y815: =RC[-12]*RC[-12] -> 6.2708506944444367E-2 | Z815: =RC[-12]*RC[-12] -> 12.25 | AA815: =RC[-12]*RC[-12] -> 97.515625 | AB815: =RC[-12]*RC[-12] -> 7475.0434027777774 | AC815: =RC[-12]*RC[-12] -> 7374.515625 | AD815: =RC[-12]*RC[-12] -> 658.77777777777806 | AE815: =RC[-11]/SQRT(RC[-6]*RC[-1]) -> 1 | AF815: =RC[-11]/SQRT(RC[-6]*RC[-2]) -> 0.99999999999999989 | AG815: =RC[-11]/SQRT(RC[-6]*RC[-3]) -> -0.99999999999999989 | AH815: =RC[-11]/SQRT(RC[-6]*RC[-4]) -> 1 | AI815: =RC[-11]/SQRT(RC[-6]*RC[-5]) -> 1
A816: 60938 | B816: 北京 | C816: 132 | D816: 轻度污染 | E816: 1.53 | F816: 11 | G816: 24 | H816: 203 | I816: 194 | J816: 133 | L816: 2013-06-24T17:00:00.000 | M816: =RC[-8]-R[7]C[-8] -> 0.28041666666666654 | N816: =RC[-8]-R[7]C[-8] -> 4.5 | O816: =RC[-8]-R[7]C[-8] -> -7.875 | P816: =RC[-8]-R[7]C[-8] -> 86.458333333333329 | Q816: =RC[-8]-R[7]C[-8] -> 61.875 | R816: =RC[-8]-R[7]C[-8] -> 31.666666666666671 | T816: =RC[-7]*RC[-2] -> 8.8798611111111079 | U816: =RC[-7]*RC[-3] -> 142.50000000000003 | V816: =RC[-7]*RC[-4] -> -249.37500000000003 | W816: =RC[-7]*RC[-5] -> 2737.8472222222226 | X816: =RC[-7]*RC[-6] -> 1959.3750000000002 | Y816: =RC[-12]*RC[-12] -> 7.8633506944444376E-2 | Z816: =RC[-12]*RC[-12] -> 20.25 | AA816: =RC[-12]*RC[-12] -> 62.015625 | AB816: =RC[-12]*RC[-12] -> 7475.0434027777774 | AC816: =RC[-12]*RC[-12] -> 3828.515625 | AD816: =RC[-12]*RC[-12] -> 1002.7777777777781 | AE816: =RC[-11]/SQRT(RC[-6]*RC[-1]) -> 1 | AF816: =RC[-11]/SQRT(RC[-6]*RC[-2]) -> 1 | AG816: =RC[-11]/SQRT(RC[-6]*RC[-3]) -> -1 | AH816: =RC[-11]/SQRT(RC[-6]*RC[-4]) -> 1 | AI816: =RC[-11]/SQRT(RC[-6]*RC[-5]) -> 1
A817: 61014 | B817: 北京 | C817: 140 | D817: 轻度污染 | E817: 1.39 | F817: 11 | G817: 32 | H817: 199 | I817: 168 | J817: 127 | L817: 2013-06-24T18:00:00.000 | M817: =RC[-8]-R[6]C[-8] -> 0.14041666666666641 | N817: =RC[-8]-R[6]C[-8] -> 4.5 | O817: =RC[-8]-R[6]C[-8] -> 0.125 | P817: =RC[-8]-R[6]C[-8] -> 82.458333333333329 | Q817: =RC[-8]-R[6]C[-8] -> 35.875 | R817: =RC[-8]-R[6]C[-8] -> 25.666666666666671 | T817: =RC[-7]*RC[-2] -> 3.6040277777777718 | U817: =RC[-7]*RC[-3] -> 115.50000000000003 | V817: =RC[-7]*RC[-4] -> 3.2083333333333339 | W817: =RC[-7]*RC[-5] -> 2116.4305555555557 | X817: =RC[-7]*RC[-6] -> 920.79166666666686 | Y817: =RC[-12]*RC[-12] -> 1.9716840277777706E-2 | Z817: =RC[-12]*RC[-12] -> 20.25 | AA817: =RC[-12]*RC[-12] -> 1.5625E-2 | AB817: =RC[-12]*RC[-12] -> 6799.3767361111104 | AC817: =RC[-12]*RC[-12] -> 1287.015625 | AD817: =RC[-12]*RC[-12] -> 658.77777777777806 | AE817: =RC[-11]/SQRT(RC[-6]*RC[-1]) -> 0.99999999999999989 | AF817: =RC[-11]/SQRT(RC[-6]*RC[-2]) -> 1 | AG817: =RC[-11]/SQRT(RC[-6]*RC[-3]) -> 1 | AH817: =RC[-11]/SQRT(RC[-6]*RC[-4]) -> 1 | AI817: =RC[-11]/SQRT(RC[-6]*RC[-5]) -> 1
A818: 61090 | B818: 北京 | C818: 148 | D818: 轻度污染 | E818: 1.4 | F818: 9 | G818: 36 | H818: 184 | I818: 198 | J818: 144 | L818: 2013-06-24T19:00:00.000 | M818: =RC[-8]-R[5]C[-8] -> 0.15041666666666642 | N818: =RC[-8]-R[5]C[-8] -> 2.5 | O818: =RC[-8]-R[5]C[-8] -> 4.125 | P818: =RC[-8]-R[5]C[-8] -> 67.458333333333329 | Q818: =RC[-8]-R[5]C[-8] -> 65.875 | R818: =RC[-8]-R[5]C[-8] -> 42.666666666666671 | T818: =RC[-7]*RC[-2] -> 6.4177777777777676 | U818: =RC[-7]*RC[-3] -> 106.66666666666669 | V818: =RC[-7]*RC[-4] -> 176.00000000000003 | W818: =RC[-7]*RC[-5] -> 2878.2222222222222 | X818: =RC[-7]*RC[-6] -> 2810.666666666667 | Y818: =RC[-12]*RC[-12] -> 2.2625173611111039E-2 | Z818: =RC[-12]*RC[-12] -> 6.25 | AA818: =RC[-12]*RC[-12] -> 17.015625 | AB818: =RC[-12]*RC[-12] -> 4550.6267361111104 | AC818: =RC[-12]*RC[-12] -> 4339.515625 | AD818: =RC[-12]*RC[-12] -> 1820.4444444444448 | AE818: =RC[-11]/SQRT(RC[-6]*RC[-1]) -> 1 | AF818: =RC[-11]/SQRT(RC[-6]*RC[-2]) -> 1.0000000000000002 | AG818: =RC[-11]/SQRT(RC[-6]*RC[-3]) -> 1 | AH818: =RC[-11]/SQRT(RC[-6]*RC[-4]) -> 1 | AI818: =RC[-11]/SQRT(RC[-6]*RC[-5]) -> 1
A819: 61166 | B819: 北京 | C819: 147 | D819: 轻度污染 | E819: 1.1000000000000001 | F819: 5 | G819: 29 | H819: 136 | I819: 129 | J819: 99 | L819: 2013-06-24T20:00:00.000 | M819: =RC[-8]-R[4]C[-8] -> -0.1495833333333334 | N819: =RC[-8]-R[4]C[-8] -> -1.5 | O819: =RC[-8]-R[4]C[-8] -> -2.875 | P819: =RC[-8]-R[4]C[-8] -> 19.458333333333329 | Q819: =RC[-8]-R[4]C[-8] -> -3.125 | R819: =RC[-8]-R[4]C[-8] -> -2.3333333333333286 | T819: =RC[-7]*RC[-2] -> 0.34902777777777722 | U819: =RC[-7]*RC[-3] -> 3.4999999999999929 | V819: =RC[-7]*RC[-4] -> 6.7083333333333197 | W819: =RC[-7]*RC[-5] -> -45.402777777777672 | X819: =RC[-7]*RC[-6] -> 7.2916666666666519 | Y819: =RC[-12]*RC[-12] -> 2.2375173611111132E-2 | Z819: =RC[-12]*RC[-12] -> 2.25 | AA819: =RC[-12]*RC[-12] -> 8.265625 | AB819: =RC[-12]*RC[-12] -> 378.62673611111092 | AC819: =RC[-12]*RC[-12] -> 9.765625 | AD819: =RC[-12]*RC[-12] -> 5.4444444444444224 | AE819: =RC[-11]/SQRT(RC[-6]*RC[-1]) -> 1 | AF819: =RC[-11]/SQRT(RC[-6]*RC[-2]) -> 1 | AG819: =RC[-11]/SQRT(RC[-6]*RC[-3]) -> 1 | AH819: =RC[-11]/SQRT(RC[-6]*RC[-4]) -> -1 | AI819: =RC[-11]/SQRT(RC[-6]*RC[-5]) -> 1
A820: 61242 | B820: 北京 | C820: 143 | D820: 轻度污染 | E820: 0.82 | F820: 3 | G820: 21 | H820: 105 | I820: 6 | J820: 41 | L820: 2013-06-24T21:00:00.000 | M820: =RC[-8]-R[3]C[-8] -> -0.42958333333333354 | N820: =RC[-8]-R[3]C[-8] -> -3.5 | O820: =RC[-8]-R[3]C[-8] -> -10.875 | P820: =RC[-8]-R[3]C[-8] -> -11.541666666666671 | Q820: =RC[-8]-R[3]C[-8] -> -126.125 | R820: =RC[-8]-R[3]C[-8] -> -60.333333333333329 | T820: =RC[-7]*RC[-2] -> 25.918194444444456 | U820: =RC[-7]*RC[-3] -> 211.16666666666666 | V820: =RC[-7]*RC[-4] -> 656.125 | W820: =RC[-7]*RC[-5] -> 696.3472222222224 | X820: =RC[-7]*RC[-6] -> 7609.5416666666661 | Y820: =RC[-12]*RC[-12] -> 0.18454184027777795 | Z820: =RC[-12]*RC[-12] -> 12.25 | AA820: =RC[-12]*RC[-12] -> 118.265625 | AB820: =RC[-12]*RC[-12] -> 133.21006944444454 | AC820: =RC[-12]*RC[-12] -> 15907.515625 | AD820: =RC[-12]*RC[-12] -> 3640.1111111111104 | AE820: =RC[-11]/SQRT(RC[-6]*RC[-1]) -> 1.0000000000000002 | AF820: =RC[-11]/SQRT(RC[-6]*RC[-2]) -> 1 | AG820: =RC[-11]/SQRT(RC[-6]*RC[-3]) -> 1 | AH820: =RC[-11]/SQRT(RC[-6]*RC[-4]) -> 1 | AI820: =RC[-11]/SQRT(RC[-6]*RC[-5]) -> 1
A821: 61318 | B821: 北京 | C821: 139 | D821: 轻度污染 | E821: 0.8 | F821: 3 | G821: 23 | H821: 93 | I821: 36 | J821: 27 | L821: 2013-06-24T22:00:00.000 | M821: =RC[-8]-R[2]C[-8] -> -0.44958333333333345 | N821: =RC[-8]-R[2]C[-8] -> -3.5 | O821: =RC[-8]-R[2]C[-8] -> -8.875 | P821: =RC[-8]-R[2]C[-8] -> -23.541666666666671 | Q821: =RC[-8]-R[2]C[-8] -> -96.125 | R821: =RC[-8]-R[2]C[-8] -> -74.333333333333329 | T821: =RC[-7]*RC[-2] -> 33.419027777777785 | U821: =RC[-7]*RC[-3] -> 260.16666666666663 | V821: =RC[-7]*RC[-4] -> 659.70833333333326 | W821: =RC[-7]*RC[-5] -> 1749.9305555555559 | X821: =RC[-7]*RC[-6] -> 7145.2916666666661 | Y821: =RC[-12]*RC[-12] -> 0.20212517361111121 | Z821: =RC[-12]*RC[-12] -> 12.25 | AA821: =RC[-12]*RC[-12] -> 78.765625 | AB821: =RC[-12]*RC[-12] -> 554.21006944444468 | AC821: =RC[-12]*RC[-12] -> 9240.015625 | AD821: =RC[-12]*RC[-12] -> 5525.4444444444434 | AE821: =RC[-11]/SQRT(RC[-6]*RC[-1]) -> 1 | AF821: =RC[-11]/SQRT(RC[-6]*RC[-2]) -> 1 | AG821: =RC[-11]/SQRT(RC[-6]*RC[-3]) -> 1 | AH821: =RC[-11]/SQRT(RC[-6]*RC[-4]) -> 1 | AI821: =RC[-11]/SQRT(RC[-6]*RC[-5]) -> 1
A822: 61394 | B822: 北京 | C822: 137 | D822: 轻度污染 | E822: 0.88 | F822: 3 | G822: 30 | H822: 76 | I822: 30 | J822: 29 | L822: 2013-06-24T23:00:00.000 | M822: =RC[-8]-R[1]C[-8] -> -0.36958333333333349 | N822: =RC[-8]-R[1]C[-8] -> -3.5 | O822: =RC[-8]-R[1]C[-8] -> -1.875 | P822: =RC[-8]-R[1]C[-8] -> -40.541666666666671 | Q822: =RC[-8]-R[1]C[-8] -> -102.125 | R822: =RC[-8]-R[1]C[-8] -> -72.333333333333329 | T822: =RC[-7]*RC[-2] -> 26.733194444444454 | U822: =RC[-7]*RC[-3] -> 253.16666666666666 | V822: =RC[-7]*RC[-4] -> 135.625 | W822: =RC[-7]*RC[-5] -> 2932.5138888888891 | X822: =RC[-7]*RC[-6] -> 7387.0416666666661 | Y822: =RC[-12]*RC[-12] -> 0.1365918402777779 | Z822: =RC[-12]*RC[-12] -> 12.25 | AA822: =RC[-12]*RC[-12] -> 3.515625 | AB822: =RC[-12]*RC[-12] -> 1643.6267361111115 | AC822: =RC[-12]*RC[-12] -> 10429.515625 | AD822: =RC[-12]*RC[-12] -> 5232.1111111111104 | AE822: =RC[-11]/SQRT(RC[-6]*RC[-1]) -> 1 | AF822: =RC[-11]/SQRT(RC[-6]*RC[-2]) -> 1 | AG822: =RC[-11]/SQRT(RC[-6]*RC[-3]) -> 1 | AH822: =RC[-11]/SQRT(RC[-6]*RC[-4]) -> 1 | AI822: =RC[-11]/SQRT(RC[-6]*RC[-5]) -> 1
E823: =AVERAGE(R[-24]C:R[-1]C) -> 1.2495833333333335 | F823: =AVERAGE(R[-24]C:R[-1]C) -> 6.5 | G823: =AVERAGE(R[-24]C:R[-1]C) -> 31.875 | H823: =AVERAGE(R[-24]C:R[-1]C) -> 116.54166666666667 | I823: =AVERAGE(R[-24]C:R[-1]C) -> 132.125 | J823: =AVERAGE(R[-24]C:R[-1]C) -> 101.33333333333333 | M823: =RC[-8]-RC[-8] -> 0 | N823: =RC[-8]-RC[-8] -> 0 | O823: =RC[-8]-RC[-8] -> 0 | P823: =RC[-8]-RC[-8] -> 0 | Q823: =RC[-8]-RC[-8] -> 0 | R823: =RC[-8]-RC[-8] -> 0 | T823: =SUM(R[-24]C:R[-1]C) -> 404.24805555555554 | U823: =SUM(R[-24]C:R[-1]C) -> 3399.6666666666661 | V823: =SUM(R[-24]C:R[-1]C) -> 996.41666666666674 | W823: =SUM(R[-24]C:R[-1]C) -> 44929.194444444431 | X823: =SUM(R[-24]C:R[-1]C) -> 79886.583333333314 | Y823: =SUM(R[-24]C:R[-1]C) -> 2.4815706597222218 | Z823: =SUM(R[-24]C:R[-1]C) -> 218.75 | AA823: =SUM(R[-24]C:R[-1]C) -> 1623.859375 | AB823: =SUM(R[-24]C:R[-1]C) -> 88833.581597222219 | AC823: =SUM(R[-24]C:R[-1]C) -> 111580.859375 | AD823: =SUM(R[-24]C:R[-1]C) -> 73682.888888888891 | AE823: =RC[-11]/SQRT(RC[-6]*RC[-1]) -> 0.94536886335558945 | AF823: =RC[-11]/SQRT(RC[-6]*RC[-2]) -> 0.84679636241739298 | AG823: =RC[-11]/SQRT(RC[-6]*RC[-3]) -> 9.1092674293187514E-2 | AH823: =RC[-11]/SQRT(RC[-6]*RC[-4]) -> 0.55533714516094612 | AI823: =RC[-11]/SQRT(RC[-6]*RC[-5]) -> 0.88104009651991544
A824: 61470 | B824: 北京 | C824: 135 | D824: 轻度污染 | E824: 0.85 | F824: 3 | G824: 25 | H824: 70 | I824: 24 | J824: 31 | L824: 2013-06-25T00:00:00.000 | M824: =RC[-8]-R[19]C[-8] -> -2.31 | N824: =RC[-8]-R[19]C[-8] -> -4 | O824: =RC[-8]-R[19]C[-8] -> -40 | P824: =RC[-8]-R[19]C[-8] -> 52 | Q824: =RC[-8]-R[19]C[-8] -> -133 | R824: =RC[-8]-R[19]C[-8] -> -132 | T824: =RC[-7]*RC[-2] -> 304.92 | U824: =RC[-7]*RC[-3] -> 528 | V824: =RC[-7]*RC[-4] -> 5280 | W824: =RC[-7]*RC[-5] -> -6864 | X824: =RC[-7]*RC[-6] -> 17556 | Y824: =RC[-12]*RC[-12] -> 5.3361000000000001 | Z824: =RC[-12]*RC[-12] -> 16 | AA824: =RC[-12]*RC[-12] -> 1600 | AB824: =RC[-12]*RC[-12] -> 2704 | AC824: =RC[-12]*RC[-12] -> 17689 | AD824: =RC[-12]*RC[-12] -> 17424 | AE824: =RC[-11]/SQRT(RC[-6]*RC[-1]) -> 1 | AF824: =RC[-11]/SQRT(RC[-6]*RC[-2]) -> 1 | AG824: =RC[-11]/SQRT(RC[-6]*RC[-3]) -> 1 | AH824: =RC[-11]/SQRT(RC[-6]*RC[-4]) -> -1 | AI824: =RC[-11]/SQRT(RC[-6]*RC[-5]) -> 1
A825: 61546 | B825: 北京 | C825: 133 | D825: 轻度污染 | E825: 0.86 | F825: 3 | G825: 23 | H825: 67 | I825: 21 | J825: 43 | L825: 2013-06-25T01:00:00.000 | M825: =RC[-8]-R[23]C[-8] -> -1.05125 | N825: =RC[-8]-R[23]C[-8] -> -3.125 | O825: =RC[-8]-R[23]C[-8] -> -13.208333333333336 | P825: =RC[-8]-R[23]C[-8] -> 20.958333333333336 | Q825: =RC[-8]-R[23]C[-8] -> -67.75 | R825: =RC[-8]-R[23]C[-8] -> -65.458333333333329 | T825: =RC[-7]*RC[-2] -> 68.81307291666667 | U825: =RC[-7]*RC[-3] -> 204.55729166666666 | V825: =RC[-7]*RC[-4] -> 864.5954861111112 | W825: =RC[-7]*RC[-5] -> -1371.8975694444446 | X825: =RC[-7]*RC[-6] -> 4434.802083333333 | Y825: =RC[-12]*RC[-12] -> 1.1051265625 | Z825: =RC[-12]*RC[-12] -> 9.765625 | AA825: =RC[-12]*RC[-12] -> 174.46006944444451 | AB825: =RC[-12]*RC[-12] -> 439.2517361111112 | AC825: =RC[-12]*RC[-12] -> 4590.0625 | AD825: =RC[-12]*RC[-12] -> 4284.7934027777774 | AE825: =RC[-11]/SQRT(RC[-6]*RC[-1]) -> 1 | AF825: =RC[-11]/SQRT(RC[-6]*RC[-2]) -> 1 | AG825: =RC[-11]/SQRT(RC[-6]*RC[-3]) -> 1 | AH825: =RC[-11]/SQRT(RC[-6]*RC[-4]) -> -1 | AI825: =RC[-11]/SQRT(RC[-6]*RC[-5]) -> 1
A826: 61622 | B826: 北京 | C826: 132 | D826: 轻度污染 | E826: 0.87 | F826: 3 | G826: 19 | H826: 51 | I826: 28 | J826: 44 | L826: 2013-06-25T02:00:00.000 | M826: =RC[-8]-R[22]C[-8] -> -1.0412499999999998 | N826: =RC[-8]-R[22]C[-8] -> -3.125 | O826: =RC[-8]-R[22]C[-8] -> -17.208333333333336 | P826: =RC[-8]-R[22]C[-8] -> 4.9583333333333357 | Q826: =RC[-8]-R[22]C[-8] -> -60.75 | R826: =RC[-8]-R[22]C[-8] -> -64.458333333333329 | T826: =RC[-7]*RC[-2] -> 67.117239583333316 | U826: =RC[-7]*RC[-3] -> 201.43229166666666 | V826: =RC[-7]*RC[-4] -> 1109.2204861111111 | W826: =RC[-7]*RC[-5] -> -319.60590277777789 | X826: =RC[-7]*RC[-6] -> 3915.8437499999995 | Y826: =RC[-12]*RC[-12] -> 1.0842015624999997 | Z826: =RC[-12]*RC[-12] -> 9.765625 | AA826: =RC[-12]*RC[-12] -> 296.1267361111112 | AB826: =RC[-12]*RC[-12] -> 24.585069444444468 | AC826: =RC[-12]*RC[-12] -> 3690.5625 | AD826: =RC[-12]*RC[-12] -> 4154.8767361111104 | AE826: =RC[-11]/SQRT(RC[-6]*RC[-1]) -> 1 | AF826: =RC[-11]/SQRT(RC[-6]*RC[-2]) -> 1 | AG826: =RC[-11]/SQRT(RC[-6]*RC[-3]) -> 1 | AH826: =RC[-11]/SQRT(RC[-6]*RC[-4]) -> -1 | AI826: =RC[-11]/SQRT(RC[-6]*RC[-5]) -> 1
A827: 61698 | B827: 北京 | C827: 132 | D827: 轻度污染 | E827: 0.93 | F827: 3 | G827: 22 | H827: 44 | I827: 53 | J827: 50 | L827: 2013-06-25T03:00:00.000 | M827: =RC[-8]-R[21]C[-8] -> -0.98124999999999984 | N827: =RC[-8]-R[21]C[-8] -> -3.125 | O827: =RC[-8]-R[21]C[-8] -> -14.208333333333336 | P827: =RC[-8]-R[21]C[-8] -> -2.0416666666666643 | Q827: =RC[-8]-R[21]C[-8] -> -35.75 | R827: =RC[-8]-R[21]C[-8] -> -58.458333333333329 | T827: =RC[-7]*RC[-2] -> 57.36223958333332 | U827: =RC[-7]*RC[-3] -> 182.68229166666666 | V827: =RC[-7]*RC[-4] -> 830.5954861111112 | W827: =RC[-7]*RC[-5] -> 119.3524305555554 | X827: =RC[-7]*RC[-6] -> 2089.8854166666665 | Y827: =RC[-12]*RC[-12] -> 0.9628515624999997 | Z827: =RC[-12]*RC[-12] -> 9.765625 | AA827: =RC[-12]*RC[-12] -> 201.87673611111117 | AB827: =RC[-12]*RC[-12] -> 4.1684027777777679 | AC827: =RC[-12]*RC[-12] -> 1278.0625 | AD827: =RC[-12]*RC[-12] -> 3417.3767361111104 | AE827: =RC[-11]/SQRT(RC[-6]*RC[-1]) -> 1 | AF827: =RC[-11]/SQRT(RC[-6]*RC[-2]) -> 1 | AG827: =RC[-11]/SQRT(RC[-6]*RC[-3]) -> 1.0000000000000002 | AH827: =RC[-11]/SQRT(RC[-6]*RC[-4]) -> 1 | AI827: =RC[-11]/SQRT(RC[-6]*RC[-5]) -> 1
A828: 61774 | B828: 北京 | C828: 132 | D828: 轻度污染 | E828: 0.85 | F828: 3 | G828: 22 | H828: 48 | I828: 37 | J828: 57 | L828: 2013-06-25T04:00:00.000 | M828: =RC[-8]-R[20]C[-8] -> -1.0612499999999998 | N828: =RC[-8]-R[20]C[-8] -> -3.125 | O828: =RC[-8]-R[20]C[-8] -> -14.208333333333336 | P828: =RC[-8]-R[20]C[-8] -> 1.9583333333333357 | Q828: =RC[-8]-R[20]C[-8] -> -51.75 | R828: =RC[-8]-R[20]C[-8] -> -51.458333333333329 | T828: =RC[-7]*RC[-2] -> 54.610156249999982 | U828: =RC[-7]*RC[-3] -> 160.80729166666666 | V828: =RC[-7]*RC[-4] -> 731.13715277777783 | W828: =RC[-7]*RC[-5] -> -100.77256944444456 | X828: =RC[-7]*RC[-6] -> 2662.9687499999995 | Y828: =RC[-12]*RC[-12] -> 1.1262515624999996 | Z828: =RC[-12]*RC[-12] -> 9.765625 | AA828: =RC[-12]*RC[-12] -> 201.87673611111117 | AB828: =RC[-12]*RC[-12] -> 3.8350694444444535 | AC828: =RC[-12]*RC[-12] -> 2678.0625 | AD828: =RC[-12]*RC[-12] -> 2647.9600694444439 | AE828: =RC[-11]/SQRT(RC[-6]*RC[-1]) -> 1 | AF828: =RC[-11]/SQRT(RC[-6]*RC[-2]) -> 1 | AG828: =RC[-11]/SQRT(RC[-6]*RC[-3]) -> 1 | AH828: =RC[-11]/SQRT(RC[-6]*RC[-4]) -> -1 | AI828: =RC[-11]/SQRT(RC[-6]*RC[-5]) -> 1
A829: 61850 | B829: 北京 | C829: 132 | D829: 轻度污染 | E829: 0.95 | F829: 3 | G829: 20 | H829: 55 | I829: 21 | J829: 58 | L829: 2013-06-25T05:00:00.000 | M829: =RC[-8]-R[19]C[-8] -> -0.96124999999999994 | N829: =RC[-8]-R[19]C[-8] -> -3.125 | O829: =RC[-8]-R[19]C[-8] -> -16.208333333333336 | P829: =RC[-8]-R[19]C[-8] -> 8.9583333333333357 | Q829: =RC[-8]-R[19]C[-8] -> -67.75 | R829: =RC[-8]-R[19]C[-8] -> -50.458333333333329 | T829: =RC[-7]*RC[-2] -> 48.50307291666666 | U829: =RC[-7]*RC[-3] -> 157.68229166666666 | V829: =RC[-7]*RC[-4] -> 817.8454861111112 | W829: =RC[-7]*RC[-5] -> -452.02256944444451 | X829: =RC[-7]*RC[-6] -> 3418.552083333333 | Y829: =RC[-12]*RC[-12] -> 0.92400156249999987 | Z829: =RC[-12]*RC[-12] -> 9.765625 | AA829: =RC[-12]*RC[-12] -> 262.71006944444451 | AB829: =RC[-12]*RC[-12] -> 80.251736111111157 | AC829: =RC[-12]*RC[-12] -> 4590.0625 | AD829: =RC[-12]*RC[-12] -> 2546.0434027777774 | AE829: =RC[-11]/SQRT(RC[-6]*RC[-1]) -> 1 | AF829: =RC[-11]/SQRT(RC[-6]*RC[-2]) -> 1 | AG829: =RC[-11]/SQRT(RC[-6]*RC[-3]) -> 1 | AH829: =RC[-11]/SQRT(RC[-6]*RC[-4]) -> -1 | AI829: =RC[-11]/SQRT(RC[-6]*RC[-5]) -> 1
A830: 61926 | B830: 北京 | C830: 132 | D830: 轻度污染 | E830: 1.04 | F830: 3 | G830: 20 | H830: 59 | I830: 20 | J830: 61 | L830: 2013-06-25T06:00:00.000 | M830: =RC[-8]-R[18]C[-8] -> -0.87124999999999986 | N830: =RC[-8]-R[18]C[-8] -> -3.125 | O830: =RC[-8]-R[18]C[-8] -> -16.208333333333336 | P830: =RC[-8]-R[18]C[-8] -> 12.958333333333336 | Q830: =RC[-8]-R[18]C[-8] -> -68.75 | R830: =RC[-8]-R[18]C[-8] -> -47.458333333333329 | T830: =RC[-7]*RC[-2] -> 41.348072916666659 | U830: =RC[-7]*RC[-3] -> 148.30729166666666 | V830: =RC[-7]*RC[-4] -> 769.2204861111112 | W830: =RC[-7]*RC[-5] -> -614.98090277777783 | X830: =RC[-7]*RC[-6] -> 3262.7604166666665 | Y830: =RC[-12]*RC[-12] -> 0.75907656249999977 | Z830: =RC[-12]*RC[-12] -> 9.765625 | AA830: =RC[-12]*RC[-12] -> 262.71006944444451 | AB830: =RC[-12]*RC[-12] -> 167.91840277777783 | AC830: =RC[-12]*RC[-12] -> 4726.5625 | AD830: =RC[-12]*RC[-12] -> 2252.2934027777774 | AE830: =RC[-11]/SQRT(RC[-6]*RC[-1]) -> 1 | AF830: =RC[-11]/SQRT(RC[-6]*RC[-2]) -> 1 | AG830: =RC[-11]/SQRT(RC[-6]*RC[-3]) -> 1.0000000000000002 | AH830: =RC[-11]/SQRT(RC[-6]*RC[-4]) -> -1 | AI830: =RC[-11]/SQRT(RC[-6]*RC[-5]) -> 1
A831: 62002 | B831: 北京 | C831: 131 | D831: 轻度污染 | E831: 1.08 | F831: 3 | G831: 24 | H831: 51 | I831: 43 | J831: 64 | L831: 2013-06-25T07:00:00.000 | M831: =RC[-8]-R[17]C[-8] -> -0.83124999999999982 | N831: =RC[-8]-R[17]C[-8] -> -3.125 | O831: =RC[-8]-R[17]C[-8] -> -12.208333333333336 | P831: =RC[-8]-R[17]C[-8] -> 4.9583333333333357 | Q831: =RC[-8]-R[17]C[-8] -> -45.75 | R831: =RC[-8]-R[17]C[-8] -> -44.458333333333329 | T831: =RC[-7]*RC[-2] -> 36.95598958333332 | U831: =RC[-7]*RC[-3] -> 138.93229166666666 | V831: =RC[-7]*RC[-4] -> 542.76215277777783 | W831: =RC[-7]*RC[-5] -> -220.4392361111112 | X831: =RC[-7]*RC[-6] -> 2033.9687499999998 | Y831: =RC[-12]*RC[-12] -> 0.69097656249999972 | Z831: =RC[-12]*RC[-12] -> 9.765625 | AA831: =RC[-12]*RC[-12] -> 149.04340277777783 | AB831: =RC[-12]*RC[-12] -> 24.585069444444468 | AC831: =RC[-12]*RC[-12] -> 2093.0625 | AD831: =RC[-12]*RC[-12] -> 1976.5434027777774 | AE831: =RC[-11]/SQRT(RC[-6]*RC[-1]) -> 1 | AF831: =RC[-11]/SQRT(RC[-6]*RC[-2]) -> 1 | AG831: =RC[-11]/SQRT(RC[-6]*RC[-3]) -> 1 | AH831: =RC[-11]/SQRT(RC[-6]*RC[-4]) -> -1 | AI831: =RC[-11]/SQRT(RC[-6]*RC[-5]) -> 1
A832: 62078 | B832: 北京 | C832: 127 | D832: 轻度污染 | E832: 1.18 | F832: 3 | G832: 26 | H832: 52 | I832: 51 | J832: 81 | L832: 2013-06-25T08:00:00.000 | M832: =RC[-8]-R[16]C[-8] -> -0.73124999999999996 | N832: =RC[-8]-R[16]C[-8] -> -3.125 | O832: =RC[-8]-R[16]C[-8] -> -10.208333333333336 | P832: =RC[-8]-R[16]C[-8] -> 5.9583333333333357 | Q832: =RC[-8]-R[16]C[-8] -> -37.75 | R832: =RC[-8]-R[16]C[-8] -> -27.458333333333329 | T832: =RC[-7]*RC[-2] -> 20.078906249999996 | U832: =RC[-7]*RC[-3] -> 85.807291666666657 | V832: =RC[-7]*RC[-4] -> 280.30381944444446 | W832: =RC[-7]*RC[-5] -> -163.60590277777783 | X832: =RC[-7]*RC[-6] -> 1036.5520833333333 | Y832: =RC[-12]*RC[-12] -> 0.53472656249999995 | Z832: =RC[-12]*RC[-12] -> 9.765625 | AA832: =RC[-12]*RC[-12] -> 104.2100694444445 | AB832: =RC[-12]*RC[-12] -> 35.501736111111143 | AC832: =RC[-12]*RC[-12] -> 1425.0625 | AD832: =RC[-12]*RC[-12] -> 753.96006944444423 | AE832: =RC[-11]/SQRT(RC[-6]*RC[-1]) -> 1 | AF832: =RC[-11]/SQRT(RC[-6]*RC[-2]) -> 1 | AG832: =RC[-11]/SQRT(RC[-6]*RC[-3]) -> 1 | AH832: =RC[-11]/SQRT(RC[-6]*RC[-4]) -> -1 | AI832: =RC[-11]/SQRT(RC[-6]*RC[-5]) -> 1
A833: 62154 | B833: 北京 | C833: 122 | D833: 轻度污染 | E833: 1.34 | F833: 4 | G833: 31 | H833: 51 | I833: 84 | J833: 90 | L833: 2013-06-25T09:00:00.000 | M833: =RC[-8]-R[15]C[-8] -> -0.57124999999999981 | N833: =RC[-8]-R[15]C[-8] -> -2.125 | O833: =RC[-8]-R[15]C[-8] -> -5.2083333333333357 | P833: =RC[-8]-R[15]C[-8] -> 4.9583333333333357 | Q833: =RC[-8]-R[15]C[-8] -> -4.75 | R833: =RC[-8]-R[15]C[-8] -> -18.458333333333329 | T833: =RC[-7]*RC[-2] -> 10.54432291666666 | U833: =RC[-7]*RC[-3] -> 39.223958333333321 | V833: =RC[-7]*RC[-4] -> 96.1371527777778 | W833: =RC[-7]*RC[-5] -> -91.522569444444471 | X833: =RC[-7]*RC[-6] -> 87.677083333333314 | Y833: =RC[-12]*RC[-12] -> 0.32632656249999981 | Z833: =RC[-12]*RC[-12] -> 4.515625 | AA833: =RC[-12]*RC[-12] -> 27.126736111111136 | AB833: =RC[-12]*RC[-12] -> 24.585069444444468 | AC833: =RC[-12]*RC[-12] -> 22.5625 | AD833: =RC[-12]*RC[-12] -> 340.71006944444429 | AE833: =RC[-11]/SQRT(RC[-6]*RC[-1]) -> 0.99999999999999978 | AF833: =RC[-11]/SQRT(RC[-6]*RC[-2]) -> 1 | AG833: =RC[-11]/SQRT(RC[-6]*RC[-3]) -> 1 | AH833: =RC[-11]/SQRT(RC[-6]*RC[-4]) -> -1 | AI833: =RC[-11]/SQRT(RC[-6]*RC[-5]) -> 1
A834: 62230 | B834: 北京 | C834: 119 | D834: 轻度污染 | E834: 1.54 | F834: 4 | G834: 33 | H834: 51 | I834: 85 | J834: 102 | L834: 2013-06-25T10:00:00.000 | M834: =RC[-8]-R[14]C[-8] -> -0.37124999999999986 | N834: =RC[-8]-R[14]C[-8] -> -2.125 | O834: =RC[-8]-R[14]C[-8] -> -3.2083333333333357 | P834: =RC[-8]-R[14]C[-8] -> 4.9583333333333357 | Q834: =RC[-8]-R[14]C[-8] -> -3.75 | R834: =RC[-8]-R[14]C[-8] -> -6.4583333333333286 | T834: =RC[-7]*RC[-2] -> 2.3976562499999972 | U834: =RC[-7]*RC[-3] -> 13.723958333333323 | V834: =RC[-7]*RC[-4] -> 20.720486111111111 | W834: =RC[-7]*RC[-5] -> -32.022569444444436 | X834: =RC[-7]*RC[-6] -> 24.218749999999982 | Y834: =RC[-12]*RC[-12] -> 0.13782656249999989 | Z834: =RC[-12]*RC[-12] -> 4.515625 | AA834: =RC[-12]*RC[-12] -> 10.293402777777793 | AB834: =RC[-12]*RC[-12] -> 24.585069444444468 | AC834: =RC[-12]*RC[-12] -> 14.0625 | AD834: =RC[-12]*RC[-12] -> 41.710069444444386 | AE834: =RC[-11]/SQRT(RC[-6]*RC[-1]) -> 0.99999999999999978 | AF834: =RC[-11]/SQRT(RC[-6]*RC[-2]) -> 1 | AG834: =RC[-11]/SQRT(RC[-6]*RC[-3]) -> 1 | AH834: =RC[-11]/SQRT(RC[-6]*RC[-4]) -> -1 | AI834: =RC[-11]/SQRT(RC[-6]*RC[-5]) -> 1
A835: 62306 | B835: 北京 | C835: 118 | D835: 轻度污染 | E835: 1.67 | F835: 5 | G835: 34 | H835: 49 | I835: 144 | J835: 132 | L835: 2013-06-25T11:00:00.000 | M835: =RC[-8]-R[13]C[-8] -> -0.24124999999999996 | N835: =RC[-8]-R[13]C[-8] -> -1.125 | O835: =RC[-8]-R[13]C[-8] -> -2.2083333333333357 | P835: =RC[-8]-R[13]C[-8] -> 2.9583333333333357 | Q835: =RC[-8]-R[13]C[-8] -> 55.25 | R835: =RC[-8]-R[13]C[-8] -> 23.541666666666671 | T835: =RC[-7]*RC[-2] -> -5.6794270833333336 | U835: =RC[-7]*RC[-3] -> -26.484375000000007 | V835: =RC[-7]*RC[-4] -> -51.987847222222285 | W835: =RC[-7]*RC[-5] -> 69.644097222222285 | X835: =RC[-7]*RC[-6] -> 1300.6770833333335 | Y835: =RC[-12]*RC[-12] -> 5.8201562499999984E-2 | Z835: =RC[-12]*RC[-12] -> 1.265625 | AA835: =RC[-12]*RC[-12] -> 4.8767361111111214 | AB835: =RC[-12]*RC[-12] -> 8.7517361111111249 | AC835: =RC[-12]*RC[-12] -> 3052.5625 | AD835: =RC[-12]*RC[-12] -> 554.21006944444468 | AE835: =RC[-11]/SQRT(RC[-6]*RC[-1]) -> -0.99999999999999989 | AF835: =RC[-11]/SQRT(RC[-6]*RC[-2]) -> -1 | AG835: =RC[-11]/SQRT(RC[-6]*RC[-3]) -> -1 | AH835: =RC[-11]/SQRT(RC[-6]*RC[-4]) -> 0.99999999999999978 | AI835: =RC[-11]/SQRT(RC[-6]*RC[-5]) -> 0.99999999999999978
A836: 62382 | B836: 北京 | C836: 116 | D836: 轻度污染 | E836: 2.04 | F836: 8 | G836: 33 | H836: 54 | I836: 146 | J836: 148 | L836: 2013-06-25T12:00:00.000 | M836: =RC[-8]-R[12]C[-8] -> 0.12875000000000014 | N836: =RC[-8]-R[12]C[-8] -> 1.875 | O836: =RC[-8]-R[12]C[-8] -> -3.2083333333333357 | P836: =RC[-8]-R[12]C[-8] -> 7.9583333333333357 | Q836: =RC[-8]-R[12]C[-8] -> 57.25 | R836: =RC[-8]-R[12]C[-8] -> 39.541666666666671 | T836: =RC[-7]*RC[-2] -> 5.0909895833333394 | U836: =RC[-7]*RC[-3] -> 74.140625000000014 | V836: =RC[-7]*RC[-4] -> -126.86284722222233 | W836: =RC[-7]*RC[-5] -> 314.68576388888903 | X836: =RC[-7]*RC[-6] -> 2263.760416666667 | Y836: =RC[-12]*RC[-12] -> 1.6576562500000037E-2 | Z836: =RC[-12]*RC[-12] -> 3.515625 | AA836: =RC[-12]*RC[-12] -> 10.293402777777793 | AB836: =RC[-12]*RC[-12] -> 63.335069444444485 | AC836: =RC[-12]*RC[-12] -> 3277.5625 | AD836: =RC[-12]*RC[-12] -> 1563.5434027777781 | AE836: =RC[-11]/SQRT(RC[-6]*RC[-1]) -> 1 | AF836: =RC[-11]/SQRT(RC[-6]*RC[-2]) -> 1.0000000000000002 | AG836: =RC[-11]/SQRT(RC[-6]*RC[-3]) -> -1 | AH836: =RC[-11]/SQRT(RC[-6]*RC[-4]) -> 1 | AI836: =RC[-11]/SQRT(RC[-6]*RC[-5]) -> 1
A837: 62458 | B837: 北京 | C837: 115 | D837: 轻度污染 | E837: 2.29 | F837: 10 | G837: 33 | H837: 59 | I837: 163 | J837: 141 | L837: 2013-06-25T13:00:00.000 | M837: =RC[-8]-R[11]C[-8] -> 0.37875000000000014 | N837: =RC[-8]-R[11]C[-8] -> 3.875 | O837: =RC[-8]-R[11]C[-8] -> -3.2083333333333357 | P837: =RC[-8]-R[11]C[-8] -> 12.958333333333336 | Q837: =RC[-8]-R[11]C[-8] -> 74.25 | R837: =RC[-8]-R[11]C[-8] -> 32.541666666666671 | T837: =RC[-7]*RC[-2] -> 12.325156250000006 | U837: =RC[-7]*RC[-3] -> 126.09895833333336 | V837: =RC[-7]*RC[-4] -> -104.40451388888899 | W837: =RC[-7]*RC[-5] -> 421.68576388888903 | X837: =RC[-7]*RC[-6] -> 2416.2187500000005 | Y837: =RC[-12]*RC[-12] -> 0.1434515625000001 | Z837: =RC[-12]*RC[-12] -> 15.015625 | AA837: =RC[-12]*RC[-12] -> 10.293402777777793 | AB837: =RC[-12]*RC[-12] -> 167.91840277777783 | AC837: =RC[-12]*RC[-12] -> 5513.0625 | AD837: =RC[-12]*RC[-12] -> 1058.9600694444448 | AE837: =RC[-11]/SQRT(RC[-6]*RC[-1]) -> 1 | AF837: =RC[-11]/SQRT(RC[-6]*RC[-2]) -> 1 | AG837: =RC[-11]/SQRT(RC[-6]*RC[-3]) -> -1 | AH837: =RC[-11]/SQRT(RC[-6]*RC[-4]) -> 1 | AI837: =RC[-11]/SQRT(RC[-6]*RC[-5]) -> 1
A838: 62534 | B838: 北京 | C838: 115 | D838: 轻度污染 | E838: 2.4300000000000002 | F838: 11 | G838: 36 | H838: 60 | I838: 137 | J838: 146 | L838: 2013-06-25T14:00:00.000 | M838: =RC[-8]-R[10]C[-8] -> 0.51875000000000027 | N838: =RC[-8]-R[10]C[-8] -> 4.875 | O838: =RC[-8]-R[10]C[-8] -> -0.2083333333333357 | P838: =RC[-8]-R[10]C[-8] -> 13.958333333333336 | Q838: =RC[-8]-R[10]C[-8] -> 48.25 | R838: =RC[-8]-R[10]C[-8] -> 37.541666666666671 | T838: =RC[-7]*RC[-2] -> 19.474739583333346 | U838: =RC[-7]*RC[-3] -> 183.01562500000003 | V838: =RC[-7]*RC[-4] -> -7.8211805555556451 | W838: =RC[-7]*RC[-5] -> 524.0190972222224 | X838: =RC[-7]*RC[-6] -> 1811.385416666667 | Y838: =RC[-12]*RC[-12] -> 0.26910156250000028 | Z838: =RC[-12]*RC[-12] -> 23.765625 | AA838: =RC[-12]*RC[-12] -> 4.3402777777778762E-2 | AB838: =RC[-12]*RC[-12] -> 194.83506944444451 | AC838: =RC[-12]*RC[-12] -> 2328.0625 | AD838: =RC[-12]*RC[-12] -> 1409.3767361111115 | AE838: =RC[-11]/SQRT(RC[-6]*RC[-1]) -> 1 | AF838: =RC[-11]/SQRT(RC[-6]*RC[-2]) -> 1 | AG838: =RC[-11]/SQRT(RC[-6]*RC[-3]) -> -0.99999999999999989 | AH838: =RC[-11]/SQRT(RC[-6]*RC[-4]) -> 1 | AI838: =RC[-11]/SQRT(RC[-6]*RC[-5]) -> 1
A839: 62610 | B839: 北京 | C839: 116 | D839: 轻度污染 | E839: 2.64 | F839: 12 | G839: 42 | H839: 61 | I839: 173 | J839: 154 | L839: 2013-06-25T15:00:00.000 | M839: =RC[-8]-R[9]C[-8] -> 0.72875000000000023 | N839: =RC[-8]-R[9]C[-8] -> 5.875 | O839: =RC[-8]-R[9]C[-8] -> 5.7916666666666643 | P839: =RC[-8]-R[9]C[-8] -> 14.958333333333336 | Q839: =RC[-8]-R[9]C[-8] -> 84.25 | R839: =RC[-8]-R[9]C[-8] -> 45.541666666666671 | T839: =RC[-7]*RC[-2] -> 33.18848958333335 | U839: =RC[-7]*RC[-3] -> 267.55729166666669 | V839: =RC[-7]*RC[-4] -> 263.76215277777771 | W839: =RC[-7]*RC[-5] -> 681.22743055555577 | X839: =RC[-7]*RC[-6] -> 3836.885416666667 | Y839: =RC[-12]*RC[-12] -> 0.53107656250000035 | Z839: =RC[-12]*RC[-12] -> 34.515625 | AA839: =RC[-12]*RC[-12] -> 33.54340277777775 | AB839: =RC[-12]*RC[-12] -> 223.75173611111117 | AC839: =RC[-12]*RC[-12] -> 7098.0625 | AD839: =RC[-12]*RC[-12] -> 2074.0434027777783 | AE839: =RC[-11]/SQRT(RC[-6]*RC[-1]) -> 1 | AF839: =RC[-11]/SQRT(RC[-6]*RC[-2]) -> 1 | AG839: =RC[-11]/SQRT(RC[-6]*RC[-3]) -> 1 | AH839: =RC[-11]/SQRT(RC[-6]*RC[-4]) -> 1 | AI839: =RC[-11]/SQRT(RC[-6]*RC[-5]) -> 1
A840: 62686 | B840: 北京 | C840: 115 | D840: 轻度污染 | E840: 2.93 | F840: 14 | G840: 48 | H840: 58 | I840: 171 | J840: 156 | L840: 2013-06-25T16:00:00.000 | M840: =RC[-8]-R[8]C[-8] -> 1.0187500000000003 | N840: =RC[-8]-R[8]C[-8] -> 7.875 | O840: =RC[-8]-R[8]C[-8] -> 11.791666666666664 | P840: =RC[-8]-R[8]C[-8] -> 11.958333333333336 | Q840: =RC[-8]-R[8]C[-8] -> 82.25 | R840: =RC[-8]-R[8]C[-8] -> 47.541666666666671 | T840: =RC[-7]*RC[-2] -> 48.433072916666681 | U840: =RC[-7]*RC[-3] -> 374.39062500000006 | V840: =RC[-7]*RC[-4] -> 560.59548611111109 | W840: =RC[-7]*RC[-5] -> 568.5190972222224 | X840: =RC[-7]*RC[-6] -> 3910.3020833333339 | Y840: =RC[-12]*RC[-12] -> 1.0378515625000004 | Z840: =RC[-12]*RC[-12] -> 62.015625 | AA840: =RC[-12]*RC[-12] -> 139.04340277777771 | AB840: =RC[-12]*RC[-12] -> 143.00173611111117 | AC840: =RC[-12]*RC[-12] -> 6765.0625 | AD840: =RC[-12]*RC[-12] -> 2260.2100694444448 | AE840: =RC[-11]/SQRT(RC[-6]*RC[-1]) -> 1 | AF840: =RC[-11]/SQRT(RC[-6]*RC[-2]) -> 1 | AG840: =RC[-11]/SQRT(RC[-6]*RC[-3]) -> 1.0000000000000002 | AH840: =RC[-11]/SQRT(RC[-6]*RC[-4]) -> 1 | AI840: =RC[-11]/SQRT(RC[-6]*RC[-5]) -> 1
A841: 62762 | B841: 北京 | C841: 116 | D841: 轻度污染 | E841: 3.06 | F841: 12 | G841: 49 | H841: 46 | I841: 184 | J841: 158 | L841: 2013-06-25T17:00:00.000 | M841: =RC[-8]-R[7]C[-8] -> 1.1487500000000002 | N841: =RC[-8]-R[7]C[-8] -> 5.875 | O841: =RC[-8]-R[7]C[-8] -> 12.791666666666664 | P841: =RC[-8]-R[7]C[-8] -> -4.1666666666664298E-2 | Q841: =RC[-8]-R[7]C[-8] -> 95.25 | R841: =RC[-8]-R[7]C[-8] -> 49.541666666666671 | T841: =RC[-7]*RC[-2] -> 56.910989583333347 | U841: =RC[-7]*RC[-3] -> 291.05729166666669 | V841: =RC[-7]*RC[-4] -> 633.72048611111109 | W841: =RC[-7]*RC[-5] -> -2.0642361111109939 | X841: =RC[-7]*RC[-6] -> 4718.84375 | Y841: =RC[-12]*RC[-12] -> 1.3196265625000003 | Z841: =RC[-12]*RC[-12] -> 34.515625 | AA841: =RC[-12]*RC[-12] -> 163.62673611111106 | AB841: =RC[-12]*RC[-12] -> 1.7361111111109137E-3 | AC841: =RC[-12]*RC[-12] -> 9072.5625 | AD841: =RC[-12]*RC[-12] -> 2454.3767361111118 | AE841: =RC[-11]/SQRT(RC[-6]*RC[-1]) -> 1 | AF841: =RC[-11]/SQRT(RC[-6]*RC[-2]) -> 1 | AG841: =RC[-11]/SQRT(RC[-6]*RC[-3]) -> 1 | AH841: =RC[-11]/SQRT(RC[-6]*RC[-4]) -> -1 | AI841: =RC[-11]/SQRT(RC[-6]*RC[-5]) -> 0.99999999999999978
A842: 62838 | B842: 北京 | C842: 116 | D842: 轻度污染 | E842: 3.25 | F842: 9 | G842: 54 | H842: 26 | I842: 199 | J842: 173 | L842: 2013-06-25T18:00:00.000 | M842: =RC[-8]-R[6]C[-8] -> 1.3387500000000001 | N842: =RC[-8]-R[6]C[-8] -> 2.875 | O842: =RC[-8]-R[6]C[-8] -> 17.791666666666664 | P842: =RC[-8]-R[6]C[-8] -> -20.041666666666664 | Q842: =RC[-8]-R[6]C[-8] -> 110.25 | R842: =RC[-8]-R[6]C[-8] -> 64.541666666666671 | T842: =RC[-7]*RC[-2] -> 86.405156250000019 | U842: =RC[-7]*RC[-3] -> 185.55729166666669 | V842: =RC[-7]*RC[-4] -> 1148.3038194444443 | W842: =RC[-7]*RC[-5] -> -1293.5225694444443 | X842: =RC[-7]*RC[-6] -> 7115.7187500000009 | Y842: =RC[-12]*RC[-12] -> 1.7922515625000004 | Z842: =RC[-12]*RC[-12] -> 8.265625 | AA842: =RC[-12]*RC[-12] -> 316.54340277777771 | AB842: =RC[-12]*RC[-12] -> 401.66840277777766 | AC842: =RC[-12]*RC[-12] -> 12155.0625 | AD842: =RC[-12]*RC[-12] -> 4165.6267361111113 | AE842: =RC[-11]/SQRT(RC[-6]*RC[-1]) -> 1 | AF842: =RC[-11]/SQRT(RC[-6]*RC[-2]) -> 1 | AG842: =RC[-11]/SQRT(RC[-6]*RC[-3]) -> 1 | AH842: =RC[-11]/SQRT(RC[-6]*RC[-4]) -> -1 | AI842: =RC[-11]/SQRT(RC[-6]*RC[-5]) -> 1.0000000000000002
A843: 62914 | B843: 北京 | C843: 117 | D843: 轻度污染 | E843: 3.16 | F843: 7 | G843: 65 | H843: 18 | I843: 157 | J843: 163 | L843: 2013-06-25T19:00:00.000 | M843: =RC[-8]-R[5]C[-8] -> 1.2487500000000002 | N843: =RC[-8]-R[5]C[-8] -> 0.875 | O843: =RC[-8]-R[5]C[-8] -> 28.791666666666664 | P843: =RC[-8]-R[5]C[-8] -> -28.041666666666664 | Q843: =RC[-8]-R[5]C[-8] -> 68.25 | R843: =RC[-8]-R[5]C[-8] -> 54.541666666666671 | T843: =RC[-7]*RC[-2] -> 68.108906250000018 | U843: =RC[-7]*RC[-3] -> 47.723958333333336 | V843: =RC[-7]*RC[-4] -> 1570.3454861111111 | W843: =RC[-7]*RC[-5] -> -1529.4392361111111 | X843: =RC[-7]*RC[-6] -> 3722.4687500000005 | Y843: =RC[-12]*RC[-12] -> 1.5593765625000007 | Z843: =RC[-12]*RC[-12] -> 0.765625 | AA843: =RC[-12]*RC[-12] -> 828.96006944444434 | AB843: =RC[-12]*RC[-12] -> 786.33506944444434 | AC843: =RC[-12]*RC[-12] -> 4658.0625 | AD843: =RC[-12]*RC[-12] -> 2974.7934027777783 | AE843: =RC[-11]/SQRT(RC[-6]*RC[-1]) -> 1 | AF843: =RC[-11]/SQRT(RC[-6]*RC[-2]) -> 1 | AG843: =RC[-11]/SQRT(RC[-6]*RC[-3]) -> 0.99999999999999989 | AH843: =RC[-11]/SQRT(RC[-6]*RC[-4]) -> -1 | AI843: =RC[-11]/SQRT(RC[-6]*RC[-5]) -> 1
A844: 62990 | B844: 北京 | C844: 119 | D844: 轻度污染 | E844: 2.66 | F844: 6 | G844: 55 | H844: 25 | I844: 100 | J844: 147 | L844: 2013-06-25T20:00:00.000 | M844: =RC[-8]-R[4]C[-8] -> 0.74875000000000025 | N844: =RC[-8]-R[4]C[-8] -> -0.125 | O844: =RC[-8]-R[4]C[-8] -> 18.791666666666664 | P844: =RC[-8]-R[4]C[-8] -> -21.041666666666664 | Q844: =RC[-8]-R[4]C[-8] -> 11.25 | R844: =RC[-8]-R[4]C[-8] -> 38.541666666666671 | T844: =RC[-7]*RC[-2] -> 28.858072916666679 | U844: =RC[-7]*RC[-3] -> -4.8177083333333339 | V844: =RC[-7]*RC[-4] -> 724.26215277777783 | W844: =RC[-7]*RC[-5] -> -810.98090277777783 | X844: =RC[-7]*RC[-6] -> 433.59375000000006 | Y844: =RC[-12]*RC[-12] -> 0.56062656250000042 | Z844: =RC[-12]*RC[-12] -> 1.5625E-2 | AA844: =RC[-12]*RC[-12] -> 353.12673611111103 | AB844: =RC[-12]*RC[-12] -> 442.75173611111103 | AC844: =RC[-12]*RC[-12] -> 126.5625 | AD844: =RC[-12]*RC[-12] -> 1485.4600694444448 | AE844: =RC[-11]/SQRT(RC[-6]*RC[-1]) -> 0.99999999999999989 | AF844: =RC[-11]/SQRT(RC[-6]*RC[-2]) -> -1 | AG844: =RC[-11]/SQRT(RC[-6]*RC[-3]) -> 1.0000000000000002 | AH844: =RC[-11]/SQRT(RC[-6]*RC[-4]) -> -1 | AI844: =RC[-11]/SQRT(RC[-6]*RC[-5]) -> 1
A845: 63066 | B845: 北京 | C845: 125 | D845: 轻度污染 | E845: 2.91 | F845: 6 | G845: 54 | H845: 20 | I845: 49 | J845: 141 | L845: 2013-06-25T21:00:00.000 | M845: =RC[-8]-R[3]C[-8] -> 0.99875000000000025 | N845: =RC[-8]-R[3]C[-8] -> -0.125 | O845: =RC[-8]-R[3]C[-8] -> 17.791666666666664 | P845: =RC[-8]-R[3]C[-8] -> -26.041666666666664 | Q845: =RC[-8]-R[3]C[-8] -> -39.75 | R845: =RC[-8]-R[3]C[-8] -> 32.541666666666671 | T845: =RC[-7]*RC[-2] -> 32.500989583333343 | U845: =RC[-7]*RC[-3] -> -4.0677083333333339 | V845: =RC[-7]*RC[-4] -> 578.97048611111109 | W845: =RC[-7]*RC[-5] -> -847.4392361111112 | X845: =RC[-7]*RC[-6] -> -1293.5312500000002 | Y845: =RC[-12]*RC[-12] -> 0.99750156250000055 | Z845: =RC[-12]*RC[-12] -> 1.5625E-2 | AA845: =RC[-12]*RC[-12] -> 316.54340277777771 | AB845: =RC[-12]*RC[-12] -> 678.1684027777776 | AC845: =RC[-12]*RC[-12] -> 1580.0625 | AD845: =RC[-12]*RC[-12] -> 1058.9600694444448 | AE845: =RC[-11]/SQRT(RC[-6]*RC[-1]) -> 0.99999999999999978 | AF845: =RC[-11]/SQRT(RC[-6]*RC[-2]) -> -1 | AG845: =RC[-11]/SQRT(RC[-6]*RC[-3]) -> 0.99999999999999978 | AH845: =RC[-11]/SQRT(RC[-6]*RC[-4]) -> -1 | AI845: =RC[-11]/SQRT(RC[-6]*RC[-5]) -> -1
A846: 63142 | B846: 北京 | C846: 131 | D846: 轻度污染 | E846: 2.73 | F846: 6 | G846: 51 | H846: 16 | I846: 6 | J846: 137 | L846: 2013-06-25T22:00:00.000 | M846: =RC[-8]-R[2]C[-8] -> 0.81875000000000009 | N846: =RC[-8]-R[2]C[-8] -> -0.125 | O846: =RC[-8]-R[2]C[-8] -> 14.791666666666664 | P846: =RC[-8]-R[2]C[-8] -> -30.041666666666664 | Q846: =RC[-8]-R[2]C[-8] -> -82.75 | R846: =RC[-8]-R[2]C[-8] -> 28.541666666666671 | T846: =RC[-7]*RC[-2] -> 23.368489583333339 | U846: =RC[-7]*RC[-3] -> -3.5677083333333339 | V846: =RC[-7]*RC[-4] -> 422.17881944444446 | W846: =RC[-7]*RC[-5] -> -857.4392361111112 | X846: =RC[-7]*RC[-6] -> -2361.822916666667 | Y846: =RC[-12]*RC[-12] -> 0.67035156250000016 | Z846: =RC[-12]*RC[-12] -> 1.5625E-2 | AA846: =RC[-12]*RC[-12] -> 218.79340277777771 | AB846: =RC[-12]*RC[-12] -> 902.50173611111097 | AC846: =RC[-12]*RC[-12] -> 6847.5625 | AD846: =RC[-12]*RC[-12] -> 814.62673611111143 | AE846: =RC[-11]/SQRT(RC[-6]*RC[-1]) -> 1 | AF846: =RC[-11]/SQRT(RC[-6]*RC[-2]) -> -1 | AG846: =RC[-11]/SQRT(RC[-6]*RC[-3]) -> 1 | AH846: =RC[-11]/SQRT(RC[-6]*RC[-4]) -> -1 | AI846: =RC[-11]/SQRT(RC[-6]*RC[-5]) -> -1
A847: 63218 | B847: 北京 | C847: 136 | D847: 轻度污染 | E847: 2.61 | F847: 6 | G847: 50 | H847: 14 | I847: 34 | J847: 126 | L847: 2013-06-25T23:00:00.000 | M847: =RC[-8]-R[1]C[-8] -> 0.69874999999999998 | N847: =RC[-8]-R[1]C[-8] -> -0.125 | O847: =RC[-8]-R[1]C[-8] -> 13.791666666666664 | P847: =RC[-8]-R[1]C[-8] -> -32.041666666666664 | Q847: =RC[-8]-R[1]C[-8] -> -54.75 | R847: =RC[-8]-R[1]C[-8] -> 17.541666666666671 | T847: =RC[-7]*RC[-2] -> 12.257239583333336 | U847: =RC[-7]*RC[-3] -> -2.1927083333333339 | V847: =RC[-7]*RC[-4] -> 241.92881944444446 | W847: =RC[-7]*RC[-5] -> -562.0642361111112 | X847: =RC[-7]*RC[-6] -> -960.40625000000023 | Y847: =RC[-12]*RC[-12] -> 0.48825156249999996 | Z847: =RC[-12]*RC[-12] -> 1.5625E-2 | AA847: =RC[-12]*RC[-12] -> 190.21006944444437 | AB847: =RC[-12]*RC[-12] -> 1026.6684027777776 | AC847: =RC[-12]*RC[-12] -> 2997.5625 | AD847: =RC[-12]*RC[-12] -> 307.71006944444463 | AE847: =RC[-11]/SQRT(RC[-6]*RC[-1]) -> 0.99999999999999989 | AF847: =RC[-11]/SQRT(RC[-6]*RC[-2]) -> -1 | AG847: =RC[-11]/SQRT(RC[-6]*RC[-3]) -> 1 | AH847: =RC[-11]/SQRT(RC[-6]*RC[-4]) -> -1 | AI847: =RC[-11]/SQRT(RC[-6]*RC[-5]) -> -0.99999999999999989
E848: =AVERAGE(R[-24]C:R[-1]C) -> 1.9112499999999999 | F848: =AVERAGE(R[-24]C:R[-1]C) -> 6.125 | G848: =AVERAGE(R[-24]C:R[-1]C) -> 36.208333333333336 | H848: =AVERAGE(R[-24]C:R[-1]C) -> 46.041666666666664 | I848: =AVERAGE(R[-24]C:R[-1]C) -> 88.75 | J848: =AVERAGE(R[-24]C:R[-1]C) -> 108.45833333333333 | M848: =RC[-8]-RC[-8] -> 0 | N848: =RC[-8]-RC[-8] -> 0 | O848: =RC[-8]-RC[-8] -> 0 | P848: =RC[-8]-RC[-8] -> 0 | Q848: =RC[-8]-RC[-8] -> 0 | R848: =RC[-8]-RC[-8] -> 0 | T848: =SUM(R[-24]C:R[-1]C) -> 1133.89359375 | U848: =SUM(R[-24]C:R[-1]C) -> 3369.5677083333326 | V848: =SUM(R[-24]C:R[-1]C) -> 17195.529513888891 | W848: =SUM(R[-24]C:R[-1]C) -> -13434.685763888892 | X848: =SUM(R[-24]C:R[-1]C) -> 67437.322916666672 | Y848: =SUM(R[-24]C:R[-1]C) -> 22.4317109375 | Z848: =SUM(R[-24]C:R[-1]C) -> 286.859375 | AA848: =SUM(R[-24]C:R[-1]C) -> 5876.3315972222217 | AB848: =SUM(R[-24]C:R[-1]C) -> 8572.9565972222226 | AC848: =SUM(R[-24]C:R[-1]C) -> 108268.9375 | AD848: =SUM(R[-24]C:R[-1]C) -> 62022.164930555569 | AE848: =RC[-11]/SQRT(RC[-6]*RC[-1]) -> 0.96131925437110621 | AF848: =RC[-11]/SQRT(RC[-6]*RC[-2]) -> 0.79885177193737111 | AG848: =RC[-11]/SQRT(RC[-6]*RC[-3]) -> 0.90071821560754806 | AH848: =RC[-11]/SQRT(RC[-6]*RC[-4]) -> -0.58262449499408253 | AI848: =RC[-11]/SQRT(RC[-6]*RC[-5]) -> 0.82295279283155898
A849: 63294 | B849: 北京 | C849: 142 | D849: 轻度污染 | E849: 2.56 | F849: 5 | G849: 43 | H849: 16 | I849: 131 | J849: 132 | L849: 2013-06-26T00:00:00.000 | M849: =RC[-8]-R[19]C[-8] -> 0.65473684210526306 | N849: =RC[-8]-R[19]C[-8] -> 0.26315789473684248 | O849: =RC[-8]-R[19]C[-8] -> 4.8421052631578974 | P849: =RC[-8]-R[19]C[-8] -> -59.315789473684205 | Q849: =RC[-8]-R[19]C[-8] -> 3.7368421052631646 | R849: =RC[-8]-R[19]C[-8] -> -21.421052631578959 | T849: =RC[-7]*RC[-2] -> -14.025152354570643 | U849: =RC[-7]*RC[-3] -> -5.6371191135734184 | V849: =RC[-7]*RC[-4] -> -103.72299168975081 | W849: =RC[-7]*RC[-5] -> 1270.6066481994467 | X849: =RC[-7]*RC[-6] -> -80.047091412742574 | Y849: =RC[-12]*RC[-12] -> 0.42868033240997216 | Z849: =RC[-12]*RC[-12] -> 6.9252077562327069E-2 | AA849: =RC[-12]*RC[-12] -> 23.44598337950141 | AB849: =RC[-12]*RC[-12] -> 3518.362880886426 | AC849: =RC[-12]*RC[-12] -> 13.96398891966764 | AD849: =RC[-12]*RC[-12] -> 458.86149584487583 | AE849: =RC[-11]/SQRT(RC[-6]*RC[-1]) -> -1.0000000000000002 | AF849: =RC[-11]/SQRT(RC[-6]*RC[-2]) -> -1 | AG849: =RC[-11]/SQRT(RC[-6]*RC[-3]) -> -1.0000000000000002 | AH849: =RC[-11]/SQRT(RC[-6]*RC[-4]) -> 1.0000000000000002 | AI849: =RC[-11]/SQRT(RC[-6]*RC[-5]) -> -1
A850: 63370 | B850: 北京 | C850: 148 | D850: 轻度污染 | E850: 2.5299999999999998 | F850: 5 | G850: 42 | H850: 13 | I850: 78 | J850: 147 | L850: 2013-06-26T01:00:00.000 | M850: =RC[-8]-R[18]C[-8] -> 0.62473684210526281 | N850: =RC[-8]-R[18]C[-8] -> 0.26315789473684248 | O850: =RC[-8]-R[18]C[-8] -> 3.8421052631578974 | P850: =RC[-8]-R[18]C[-8] -> -62.315789473684205 | Q850: =RC[-8]-R[18]C[-8] -> -49.263157894736835 | R850: =RC[-8]-R[18]C[-8] -> -6.4210526315789593 | T850: =RC[-7]*RC[-2] -> -4.0114681440443265 | U850: =RC[-7]*RC[-3] -> -1.6897506925207813 | V850: =RC[-7]*RC[-4] -> -24.670360110803387 | W850: =RC[-7]*RC[-5] -> 400.13296398892038 | X850: =RC[-7]*RC[-6] -> 316.32132963988977 | Y850: =RC[-12]*RC[-12] -> 0.39029612188365609 | Z850: =RC[-12]*RC[-12] -> 6.9252077562327069E-2 | AA850: =RC[-12]*RC[-12] -> 14.761772853185615 | AB850: =RC[-12]*RC[-12] -> 3883.2576177285314 | AC850: =RC[-12]*RC[-12] -> 2426.8587257617723 | AD850: =RC[-12]*RC[-12] -> 41.229916897507081 | AE850: =RC[-11]/SQRT(RC[-6]*RC[-1]) -> -1 | AF850: =RC[-11]/SQRT(RC[-6]*RC[-2]) -> -1 | AG850: =RC[-11]/SQRT(RC[-6]*RC[-3]) -> -1 | AH850: =RC[-11]/SQRT(RC[-6]*RC[-4]) -> 1 | AI850: =RC[-11]/SQRT(RC[-6]*RC[-5]) -> 1
A851: 63446 | B851: 北京 | C851: 153 | D851: 中度污染 | E851: 2.42 | F851: 4 | G851: 42 | H851: 10 | I851: 58 | J851: 146 | L851: 2013-06-26T02:00:00.000 | M851: =RC[-8]-R[17]C[-8] -> 0.51473684210526294 | N851: =RC[-8]-R[17]C[-8] -> -0.73684210526315752 | O851: =RC[-8]-R[17]C[-8] -> 3.8421052631578974 | P851: =RC[-8]-R[17]C[-8] -> -65.315789473684205 | Q851: =RC[-8]-R[17]C[-8] -> -69.263157894736835 | R851: =RC[-8]-R[17]C[-8] -> -7.4210526315789593 | T851: =RC[-7]*RC[-2] -> -3.8198891966759048 | U851: =RC[-7]*RC[-3] -> 5.4681440443213356 | V851: =RC[-7]*RC[-4] -> -28.512465373961284 | W851: =RC[-7]*RC[-5] -> 484.71191135734148 | X851: =RC[-7]*RC[-6] -> 514.00554016620572 | Y851: =RC[-12]*RC[-12] -> 0.26495401662049839 | Z851: =RC[-12]*RC[-12] -> 0.54293628808864214 | AA851: =RC[-12]*RC[-12] -> 14.761772853185615 | AB851: =RC[-12]*RC[-12] -> 4266.1523545706368 | AC851: =RC[-12]*RC[-12] -> 4797.3850415512452 | AD851: =RC[-12]*RC[-12] -> 55.072022160665 | AE851: =RC[-11]/SQRT(RC[-6]*RC[-1]) -> -1 | AF851: =RC[-11]/SQRT(RC[-6]*RC[-2]) -> 0.99999999999999989 | AG851: =RC[-11]/SQRT(RC[-6]*RC[-3]) -> -1 | AH851: =RC[-11]/SQRT(RC[-6]*RC[-4]) -> 1 | AI851: =RC[-11]/SQRT(RC[-6]*RC[-5]) -> 1
A852: 63522 | B852: 北京 | C852: 158 | D852: 中度污染 | E852: 2.23 | F852: 4 | G852: 39 | H852: 11 | I852: 64 | J852: 134 | L852: 2013-06-26T03:00:00.000 | M852: =RC[-8]-R[16]C[-8] -> 0.32473684210526299 | N852: =RC[-8]-R[16]C[-8] -> -0.73684210526315752 | O852: =RC[-8]-R[16]C[-8] -> 0.84210526315789735 | P852: =RC[-8]-R[16]C[-8] -> -64.315789473684205 | Q852: =RC[-8]-R[16]C[-8] -> -63.263157894736835 | R852: =RC[-8]-R[16]C[-8] -> -19.421052631578959 | T852: =RC[-7]*RC[-2] -> -6.3067313019390587 | U852: =RC[-7]*RC[-3] -> 14.310249307479227 | V852: =RC[-7]*RC[-4] -> -16.354570637119174 | W852: =RC[-7]*RC[-5] -> 1249.0803324099729 | X852: =RC[-7]*RC[-6] -> 1228.637119113574 | Y852: =RC[-12]*RC[-12] -> 0.10545401662049851 | Z852: =RC[-12]*RC[-12] -> 0.54293628808864214 | AA852: =RC[-12]*RC[-12] -> 0.70914127423823159 | AB852: =RC[-12]*RC[-12] -> 4136.5207756232676 | AC852: =RC[-12]*RC[-12] -> 4002.2271468144036 | AD852: =RC[-12]*RC[-12] -> 377.17728531856 | AE852: =RC[-11]/SQRT(RC[-6]*RC[-1]) -> -1 | AF852: =RC[-11]/SQRT(RC[-6]*RC[-2]) -> 1.0000000000000002 | AG852: =RC[-11]/SQRT(RC[-6]*RC[-3]) -> -1 | AH852: =RC[-11]/SQRT(RC[-6]*RC[-4]) -> 1 | AI852: =RC[-11]/SQRT(RC[-6]*RC[-5]) -> 1
A853: 63598 | B853: 北京 | C853: 162 | D853: 中度污染 | E853: 2.19 | F853: 4 | G853: 42 | H853: 7 | I853: 70 | J853: 135 | L853: 2013-06-26T04:00:00.000 | M853: =RC[-8]-R[15]C[-8] -> 0.28473684210526296 | N853: =RC[-8]-R[15]C[-8] -> -0.73684210526315752 | O853: =RC[-8]-R[15]C[-8] -> 3.8421052631578974 | P853: =RC[-8]-R[15]C[-8] -> -68.315789473684205 | Q853: =RC[-8]-R[15]C[-8] -> -57.263157894736835 | R853: =RC[-8]-R[15]C[-8] -> -18.421052631578959 | T853: =RC[-7]*RC[-2] -> -5.2451523545706369 | U853: =RC[-7]*RC[-3] -> 13.573407202216069 | V853: =RC[-7]*RC[-4] -> -70.775623268698155 | W853: =RC[-7]*RC[-5] -> 1258.4487534626046 | X853: =RC[-7]*RC[-6] -> 1054.8476454293634 | Y853: =RC[-12]*RC[-12] -> 8.1075069252077442E-2 | Z853: =RC[-12]*RC[-12] -> 0.54293628808864214 | AA853: =RC[-12]*RC[-12] -> 14.761772853185615 | AB853: =RC[-12]*RC[-12] -> 4667.0470914127418 | AC853: =RC[-12]*RC[-12] -> 3279.0692520775615 | AD853: =RC[-12]*RC[-12] -> 339.33518005540208 | AE853: =RC[-11]/SQRT(RC[-6]*RC[-1]) -> -1 | AF853: =RC[-11]/SQRT(RC[-6]*RC[-2]) -> 1 | AG853: =RC[-11]/SQRT(RC[-6]*RC[-3]) -> -1 | AH853: =RC[-11]/SQRT(RC[-6]*RC[-4]) -> 1 | AI853: =RC[-11]/SQRT(RC[-6]*RC[-5]) -> 1
A854: 63674 | B854: 北京 | C854: 165 | D854: 中度污染 | E854: 2.15 | F854: 4 | G854: 40 | H854: 5 | I854: 41 | J854: 122 | L854: 2013-06-26T05:00:00.000 | M854: =RC[-8]-R[14]C[-8] -> 0.24473684210526292 | N854: =RC[-8]-R[14]C[-8] -> -0.73684210526315752 | O854: =RC[-8]-R[14]C[-8] -> 1.8421052631578974 | P854: =RC[-8]-R[14]C[-8] -> -70.315789473684205 | Q854: =RC[-8]-R[14]C[-8] -> -86.263157894736835 | R854: =RC[-8]-R[14]C[-8] -> -31.421052631578959 | T854: =RC[-7]*RC[-2] -> -7.689889196675896 | U854: =RC[-7]*RC[-3] -> 23.152354570637115 | V854: =RC[-7]*RC[-4] -> -57.880886426592902 | W854: =RC[-7]*RC[-5] -> 2209.3961218836571 | X854: =RC[-7]*RC[-6] -> 2710.479224376732 | Y854: =RC[-12]*RC[-12] -> 5.9896121883656395E-2 | Z854: =RC[-12]*RC[-12] -> 0.54293628808864214 | AA854: =RC[-12]*RC[-12] -> 3.3933518005540262 | AB854: =RC[-12]*RC[-12] -> 4944.3102493074784 | AC854: =RC[-12]*RC[-12] -> 7441.3324099722977 | AD854: =RC[-12]*RC[-12] -> 987.28254847645508 | AE854: =RC[-11]/SQRT(RC[-6]*RC[-1]) -> -1 | AF854: =RC[-11]/SQRT(RC[-6]*RC[-2]) -> 0.99999999999999989 | AG854: =RC[-11]/SQRT(RC[-6]*RC[-3]) -> -1 | AH854: =RC[-11]/SQRT(RC[-6]*RC[-4]) -> 1 | AI854: =RC[-11]/SQRT(RC[-6]*RC[-5]) -> 1
A855: 63750 | B855: 北京 | C855: 168 | D855: 中度污染 | E855: 2.17 | F855: 4 | G855: 39 | H855: 4 | I855: 60 | J855: 125 | L855: 2013-06-26T06:00:00.000 | M855: =RC[-8]-R[13]C[-8] -> 0.26473684210526294 | N855: =RC[-8]-R[13]C[-8] -> -0.73684210526315752 | O855: =RC[-8]-R[13]C[-8] -> 0.84210526315789735 | P855: =RC[-8]-R[13]C[-8] -> -71.315789473684205 | Q855: =RC[-8]-R[13]C[-8] -> -67.263157894736835 | R855: =RC[-8]-R[13]C[-8] -> -28.421052631578959 | T855: =RC[-7]*RC[-2] -> -7.5240997229916866 | U855: =RC[-7]*RC[-3] -> 20.941828254847643 | V855: =RC[-7]*RC[-4] -> -23.93351800554025 | W855: =RC[-7]*RC[-5] -> 2026.8698060941836 | X855: =RC[-7]*RC[-6] -> 1911.6897506925213 | Y855: =RC[-12]*RC[-12] -> 7.0085595567866921E-2 | Z855: =RC[-12]*RC[-12] -> 0.54293628808864214 | AA855: =RC[-12]*RC[-12] -> 0.70914127423823159 | AB855: =RC[-12]*RC[-12] -> 5085.9418282548468 | AC855: =RC[-12]*RC[-12] -> 4524.3324099722986 | AD855: =RC[-12]*RC[-12] -> 807.75623268698132 | AE855: =RC[-11]/SQRT(RC[-6]*RC[-1]) -> -1 | AF855: =RC[-11]/SQRT(RC[-6]*RC[-2]) -> 0.99999999999999978 | AG855: =RC[-11]/SQRT(RC[-6]*RC[-3]) -> -0.99999999999999989 | AH855: =RC[-11]/SQRT(RC[-6]*RC[-4]) -> 1 | AI855: =RC[-11]/SQRT(RC[-6]*RC[-5]) -> 0.99999999999999989
A856: 63826 | B856: 北京 | C856: 171 | D856: 中度污染 | E856: 2.14 | F856: 4 | G856: 42 | H856: 6 | I856: 48 | J856: 140 | L856: 2013-06-26T07:00:00.000 | M856: =RC[-8]-R[12]C[-8] -> 0.23473684210526313 | N856: =RC[-8]-R[12]C[-8] -> -0.73684210526315752 | O856: =RC[-8]-R[12]C[-8] -> 3.8421052631578974 | P856: =RC[-8]-R[12]C[-8] -> -69.315789473684205 | Q856: =RC[-8]-R[12]C[-8] -> -79.263157894736835 | R856: =RC[-8]-R[12]C[-8] -> -13.421052631578959 | T856: =RC[-7]*RC[-2] -> -3.1504155124653765 | U856: =RC[-7]*RC[-3] -> 9.8891966759002816 | V856: =RC[-7]*RC[-4] -> -51.565096952908668 | W856: =RC[-7]*RC[-5] -> 930.29085872576252 | X856: =RC[-7]*RC[-6] -> 1063.7950138504164 | Y856: =RC[-12]*RC[-12] -> 5.5101385041551237E-2 | Z856: =RC[-12]*RC[-12] -> 0.54293628808864214 | AA856: =RC[-12]*RC[-12] -> 14.761772853185615 | AB856: =RC[-12]*RC[-12] -> 4804.6786703601101 | AC856: =RC[-12]*RC[-12] -> 6282.6481994459828 | AD856: =RC[-12]*RC[-12] -> 180.12465373961251 | AE856: =RC[-11]/SQRT(RC[-6]*RC[-1]) -> -1 | AF856: =RC[-11]/SQRT(RC[-6]*RC[-2]) -> 1 | AG856: =RC[-11]/SQRT(RC[-6]*RC[-3]) -> -1 | AH856: =RC[-11]/SQRT(RC[-6]*RC[-4]) -> 1 | AI856: =RC[-11]/SQRT(RC[-6]*RC[-5]) -> 1
A857: 63902 | B857: 北京 | C857: 175 | D857: 中度污染 | E857: 2.09 | F857: 4 | G857: 44 | H857: 11 | I857: 96 | J857: 153 | L857: 2013-06-26T08:00:00.000 | M857: =RC[-8]-R[11]C[-8] -> 0.18473684210526287 | N857: =RC[-8]-R[11]C[-8] -> -0.73684210526315752 | O857: =RC[-8]-R[11]C[-8] -> 5.8421052631578974 | P857: =RC[-8]-R[11]C[-8] -> -64.315789473684205 | Q857: =RC[-8]-R[11]C[-8] -> -31.263157894736835 | R857: =RC[-8]-R[11]C[-8] -> -0.42105263157895934 | T857: =RC[-7]*RC[-2] -> -7.7783933518007622E-2 | U857: =RC[-7]*RC[-3] -> 0.31024930747923302 | V857: =RC[-7]*RC[-4] -> -2.4598337950139215 | W857: =RC[-7]*RC[-5] -> 27.080332409973067 | X857: =RC[-7]*RC[-6] -> 13.163434903047463 | Y857: =RC[-12]*RC[-12] -> 3.4127700831024822E-2 | Z857: =RC[-12]*RC[-12] -> 0.54293628808864214 | AA857: =RC[-12]*RC[-12] -> 34.130193905817208 | AB857: =RC[-12]*RC[-12] -> 4136.5207756232676 | AC857: =RC[-12]*RC[-12] -> 977.3850415512461 | AD857: =RC[-12]*RC[-12] -> 0.17728531855956686 | AE857: =RC[-11]/SQRT(RC[-6]*RC[-1]) -> -1 | AF857: =RC[-11]/SQRT(RC[-6]*RC[-2]) -> 0.99999999999999978 | AG857: =RC[-11]/SQRT(RC[-6]*RC[-3]) -> -1 | AH857: =RC[-11]/SQRT(RC[-6]*RC[-4]) -> 1.0000000000000002 | AI857: =RC[-11]/SQRT(RC[-6]*RC[-5]) -> 1.0000000000000002
A858: 63978 | B858: 北京 | C858: 188 | D858: 中度污染 | E858: 2.0099999999999998 | F858: 5 | G858: 41 | H858: 24 | I858: 154 | J858: 165 | L858: 2013-06-26T09:00:00.000 | M858: =RC[-8]-R[10]C[-8] -> 0.1047368421052628 | N858: =RC[-8]-R[10]C[-8] -> 0.26315789473684248 | O858: =RC[-8]-R[10]C[-8] -> 2.8421052631578974 | P858: =RC[-8]-R[10]C[-8] -> -51.315789473684205 | Q858: =RC[-8]-R[10]C[-8] -> 26.736842105263165 | R858: =RC[-8]-R[10]C[-8] -> 11.578947368421041 | T858: =RC[-7]*RC[-2] -> 1.2127423822714627 | U858: =RC[-7]*RC[-3] -> 3.0470914127423834 | V858: =RC[-7]*RC[-4] -> 32.908587257617725 | W858: =RC[-7]*RC[-5] -> -594.18282548476384 | X858: =RC[-7]*RC[-6] -> 309.58448753462579 | Y858: =RC[-12]*RC[-12] -> 1.0969806094182749E-2 | Z858: =RC[-12]*RC[-12] -> 6.9252077562327069E-2 | AA858: =RC[-12]*RC[-12] -> 8.0775623268698205 | AB858: =RC[-12]*RC[-12] -> 2633.3102493074789 | AC858: =RC[-12]*RC[-12] -> 714.85872576177326 | AD858: =RC[-12]*RC[-12] -> 134.07202216066455 | AE858: =RC[-11]/SQRT(RC[-6]*RC[-1]) -> 1 | AF858: =RC[-11]/SQRT(RC[-6]*RC[-2]) -> 1 | AG858: =RC[-11]/SQRT(RC[-6]*RC[-3]) -> 1 | AH858: =RC[-11]/SQRT(RC[-6]*RC[-4]) -> -1 | AI858: =RC[-11]/SQRT(RC[-6]*RC[-5]) -> 1
A859: 64054 | B859: 北京 | C859: 192 | D859: 中度污染 | E859: 1.92 | F859: 5 | G859: 34 | H859: 58 | I859: 185 | J859: 181 | L859: 2013-06-26T10:00:00.000 | M859: =RC[-8]-R[9]C[-8] -> 1.4736842105262937E-2 | N859: =RC[-8]-R[9]C[-8] -> 0.26315789473684248 | O859: =RC[-8]-R[9]C[-8] -> -4.1578947368421026 | P859: =RC[-8]-R[9]C[-8] -> -17.315789473684205 | Q859: =RC[-8]-R[9]C[-8] -> 57.736842105263165 | R859: =RC[-8]-R[9]C[-8] -> 27.578947368421041 | T859: =RC[-7]*RC[-2] -> 0.40642659279777765 | U859: =RC[-7]*RC[-3] -> 7.257617728531863 | V859: =RC[-7]*RC[-4] -> -114.6703601108032 | W859: =RC[-7]*RC[-5] -> -477.5512465373958 | X859: =RC[-7]*RC[-6] -> 1592.3213296398887 | Y859: =RC[-12]*RC[-12] -> 2.1717451523545057E-4 | Z859: =RC[-12]*RC[-12] -> 6.9252077562327069E-2 | AA859: =RC[-12]*RC[-12] -> 17.288088642659257 | AB859: =RC[-12]*RC[-12] -> 299.83656509695271 | AC859: =RC[-12]*RC[-12] -> 3333.5429362880895 | AD859: =RC[-12]*RC[-12] -> 760.59833795013787 | AE859: =RC[-11]/SQRT(RC[-6]*RC[-1]) -> 0.99999999999999989 | AF859: =RC[-11]/SQRT(RC[-6]*RC[-2]) -> 1 | AG859: =RC[-11]/SQRT(RC[-6]*RC[-3]) -> -1 | AH859: =RC[-11]/SQRT(RC[-6]*RC[-4]) -> -1.0000000000000002 | AI859: =RC[-11]/SQRT(RC[-6]*RC[-5]) -> 1
A860: 64130 | B860: 北京 | C860: 194 | D860: 中度污染 | E860: 1.87 | F860: 5 | G860: 31 | H860: 94 | I860: 174 | J860: 186 | L860: 2013-06-26T11:00:00.000 | M860: =RC[-8]-R[8]C[-8] -> -3.5263157894736885E-2 | N860: =RC[-8]-R[8]C[-8] -> 0.26315789473684248 | O860: =RC[-8]-R[8]C[-8] -> -7.1578947368421026 | P860: =RC[-8]-R[8]C[-8] -> 18.684210526315795 | Q860: =RC[-8]-R[8]C[-8] -> 46.736842105263165 | R860: =RC[-8]-R[8]C[-8] -> 32.578947368421041 | T860: =RC[-7]*RC[-2] -> -1.1488365650969539 | U860: =RC[-7]*RC[-3] -> 8.5734072022160763 | V860: =RC[-7]*RC[-4] -> -233.19667590027683 | W860: =RC[-7]*RC[-5] -> 608.71191135734068 | X860: =RC[-7]*RC[-6] -> 1522.6371191135731 | Y860: =RC[-12]*RC[-12] -> 1.2434903047091443E-3 | Z860: =RC[-12]*RC[-12] -> 6.9252077562327069E-2 | AA860: =RC[-12]*RC[-12] -> 51.235457063711877 | AB860: =RC[-12]*RC[-12] -> 349.09972299168993 | AC860: =RC[-12]*RC[-12] -> 2184.3324099723 | AD860: =RC[-12]*RC[-12] -> 1061.3878116343483 | AE860: =RC[-11]/SQRT(RC[-6]*RC[-1]) -> -1 | AF860: =RC[-11]/SQRT(RC[-6]*RC[-2]) -> 1 | AG860: =RC[-11]/SQRT(RC[-6]*RC[-3]) -> -1 | AH860: =RC[-11]/SQRT(RC[-6]*RC[-4]) -> 1 | AI860: =RC[-11]/SQRT(RC[-6]*RC[-5]) -> 1
A861: 64206 | B861: 北京 | C861: 197 | D861: 中度污染 | E861: 1.83 | F861: 5 | G861: 34 | H861: 130 | I861: 187 | J861: 189 | L861: 2013-06-26T12:00:00.000 | M861: =RC[-8]-R[7]C[-8] -> -7.5263157894736921E-2 | N861: =RC[-8]-R[7]C[-8] -> 0.26315789473684248 | O861: =RC[-8]-R[7]C[-8] -> -4.1578947368421026 | P861: =RC[-8]-R[7]C[-8] -> 54.684210526315795 | Q861: =RC[-8]-R[7]C[-8] -> 59.736842105263165 | R861: =RC[-8]-R[7]C[-8] -> 35.578947368421041 | T861: =RC[-7]*RC[-2] -> -2.6777839335180076 | U861: =RC[-7]*RC[-3] -> 9.3628808864266038 | V861: =RC[-7]*RC[-4] -> -147.93351800554004 | W861: =RC[-7]*RC[-5] -> 1945.6066481994455 | X861: =RC[-7]*RC[-6] -> 2125.373961218836 | Y861: =RC[-12]*RC[-12] -> 5.6645429362881007E-3 | Z861: =RC[-12]*RC[-12] -> 6.9252077562327069E-2 | AA861: =RC[-12]*RC[-12] -> 17.288088642659257 | AB861: =RC[-12]*RC[-12] -> 2990.3628808864273 | AC861: =RC[-12]*RC[-12] -> 3568.490304709142 | AD861: =RC[-12]*RC[-12] -> 1265.8614958448745 | AE861: =RC[-11]/SQRT(RC[-6]*RC[-1]) -> -1 | AF861: =RC[-11]/SQRT(RC[-6]*RC[-2]) -> 1 | AG861: =RC[-11]/SQRT(RC[-6]*RC[-3]) -> -1.0000000000000002 | AH861: =RC[-11]/SQRT(RC[-6]*RC[-4]) -> 1 | AI861: =RC[-11]/SQRT(RC[-6]*RC[-5]) -> 1
A862: 64282 | B862: 北京 | C862: 199 | D862: 中度污染 | E862: 1.81 | F862: 5 | G862: 34 | H862: 177 | I862: 194 | J862: 198 | L862: 2013-06-26T13:00:00.000 | M862: =RC[-8]-R[6]C[-8] -> -9.5263157894736938E-2 | N862: =RC[-8]-R[6]C[-8] -> 0.26315789473684248 | O862: =RC[-8]-R[6]C[-8] -> -4.1578947368421026 | P862: =RC[-8]-R[6]C[-8] -> 101.68421052631579 | Q862: =RC[-8]-R[6]C[-8] -> 66.736842105263165 | R862: =RC[-8]-R[6]C[-8] -> 44.578947368421041 | T862: =RC[-7]*RC[-2] -> -4.2467313019390609 | U862: =RC[-7]*RC[-3] -> 11.731301939058186 | V862: =RC[-7]*RC[-4] -> -185.35457063711894 | W862: =RC[-7]*RC[-5] -> 4532.9750692520765 | X862: =RC[-7]*RC[-6] -> 2975.0581717451519 | Y862: =RC[-12]*RC[-12] -> 9.0750692520775809E-3 | Z862: =RC[-12]*RC[-12] -> 6.9252077562327069E-2 | AA862: =RC[-12]*RC[-12] -> 17.288088642659257 | AB862: =RC[-12]*RC[-12] -> 10339.678670360112 | AC862: =RC[-12]*RC[-12] -> 4453.8060941828262 | AD862: =RC[-12]*RC[-12] -> 1987.2825484764533 | AE862: =RC[-11]/SQRT(RC[-6]*RC[-1]) -> -0.99999999999999978 | AF862: =RC[-11]/SQRT(RC[-6]*RC[-2]) -> 1.0000000000000002 | AG862: =RC[-11]/SQRT(RC[-6]*RC[-3]) -> -0.99999999999999989 | AH862: =RC[-11]/SQRT(RC[-6]*RC[-4]) -> 1 | AI862: =RC[-11]/SQRT(RC[-6]*RC[-5]) -> 1
A863: 64358 | B863: 北京 | C863: 201 | D863: 重度污染 | E863: 1.66 | F863: 5 | G863: 29 | H863: 236 | I863: 217 | J863: 200 | L863: 2013-06-26T14:00:00.000 | M863: =RC[-8]-R[5]C[-8] -> -0.24526315789473707 | N863: =RC[-8]-R[5]C[-8] -> 0.26315789473684248 | O863: =RC[-8]-R[5]C[-8] -> -9.1578947368421026 | P863: =RC[-8]-R[5]C[-8] -> 160.68421052631578 | Q863: =RC[-8]-R[5]C[-8] -> 89.736842105263165 | R863: =RC[-8]-R[5]C[-8] -> 46.578947368421041 | T863: =RC[-7]*RC[-2] -> -11.424099722991697 | U863: =RC[-7]*RC[-3] -> 12.257617728531871 | V863: =RC[-7]*RC[-4] -> -426.56509695290833 | W863: =RC[-7]*RC[-5] -> 7484.5013850415489 | X863: =RC[-7]*RC[-6] -> 4179.8476454293623 | Y863: =RC[-12]*RC[-12] -> 6.0154016620498726E-2 | Z863: =RC[-12]*RC[-12] -> 6.9252077562327069E-2 | AA863: =RC[-12]*RC[-12] -> 83.867036011080287 | AB863: =RC[-12]*RC[-12] -> 25819.41551246537 | AC863: =RC[-12]*RC[-12] -> 8052.7008310249321 | AD863: =RC[-12]*RC[-12] -> 2169.5983379501372 | AE863: =RC[-11]/SQRT(RC[-6]*RC[-1]) -> -1 | AF863: =RC[-11]/SQRT(RC[-6]*RC[-2]) -> 1 | AG863: =RC[-11]/SQRT(RC[-6]*RC[-3]) -> -1 | AH863: =RC[-11]/SQRT(RC[-6]*RC[-4]) -> 1 | AI863: =RC[-11]/SQRT(RC[-6]*RC[-5]) -> 1.0000000000000002
A864: 64434 | B864: 北京 | C864: 202 | D864: 重度污染 | E864: 1.39 | F864: 5 | G864: 29 | H864: 251 | I864: 194 | J864: 176 | L864: 2013-06-26T15:00:00.000 | M864: =RC[-8]-R[4]C[-8] -> -0.51526315789473709 | N864: =RC[-8]-R[4]C[-8] -> 0.26315789473684248 | O864: =RC[-8]-R[4]C[-8] -> -9.1578947368421026 | P864: =RC[-8]-R[4]C[-8] -> 175.68421052631578 | Q864: =RC[-8]-R[4]C[-8] -> 66.736842105263165 | R864: =RC[-8]-R[4]C[-8] -> 22.578947368421041 | T864: =RC[-7]*RC[-2] -> -11.634099722991689 | U864: =RC[-7]*RC[-3] -> 5.9418282548476506 | V864: =RC[-7]*RC[-4] -> -206.7756232686979 | W864: =RC[-7]*RC[-5] -> 3966.7645429362856 | X864: =RC[-7]*RC[-6] -> 1506.8476454293623 | Y864: =RC[-12]*RC[-12] -> 0.26549612188365679 | Z864: =RC[-12]*RC[-12] -> 6.9252077562327069E-2 | AA864: =RC[-12]*RC[-12] -> 83.867036011080287 | AB864: =RC[-12]*RC[-12] -> 30864.941828254843 | AC864: =RC[-12]*RC[-12] -> 4453.8060941828262 | AD864: =RC[-12]*RC[-12] -> 509.80886426592741 | AE864: =RC[-11]/SQRT(RC[-6]*RC[-1]) -> -1 | AF864: =RC[-11]/SQRT(RC[-6]*RC[-2]) -> 1 | AG864: =RC[-11]/SQRT(RC[-6]*RC[-3]) -> -1 | AH864: =RC[-11]/SQRT(RC[-6]*RC[-4]) -> 1 | AI864: =RC[-11]/SQRT(RC[-6]*RC[-5]) -> 1
A865: 64510 | B865: 北京 | C865: 191 | D865: 中度污染 | E865: 0.98 | F865: 5 | G865: 40 | H865: 141 | I865: 137 | J865: 113 | L865: 2013-06-26T21:00:00.000 | M865: =RC[-8]-R[3]C[-8] -> -0.92526315789473701 | N865: =RC[-8]-R[3]C[-8] -> 0.26315789473684248 | O865: =RC[-8]-R[3]C[-8] -> 1.8421052631578974 | P865: =RC[-8]-R[3]C[-8] -> 65.684210526315795 | Q865: =RC[-8]-R[3]C[-8] -> 9.7368421052631646 | R865: =RC[-8]-R[3]C[-8] -> -40.421052631578959 | T865: =RC[-7]*RC[-2] -> 37.400110803324118 | U865: =RC[-7]*RC[-3] -> -10.637119113573425 | V865: =RC[-7]*RC[-4] -> -74.459833795013978 | W865: =RC[-7]*RC[-5] -> -2655.0249307479235 | X865: =RC[-7]*RC[-6] -> -393.57340720221646 | Y865: =RC[-12]*RC[-12] -> 0.85611191135734099 | Z865: =RC[-12]*RC[-12] -> 6.9252077562327069E-2 | AA865: =RC[-12]*RC[-12] -> 3.3933518005540262 | AB865: =RC[-12]*RC[-12] -> 4314.4155124653744 | AC865: =RC[-12]*RC[-12] -> 94.806094182825618 | AD865: =RC[-12]*RC[-12] -> 1633.8614958448763 | AE865: =RC[-11]/SQRT(RC[-6]*RC[-1]) -> 1 | AF865: =RC[-11]/SQRT(RC[-6]*RC[-2]) -> -0.99999999999999978 | AG865: =RC[-11]/SQRT(RC[-6]*RC[-3]) -> -1 | AH865: =RC[-11]/SQRT(RC[-6]*RC[-4]) -> -1 | AI865: =RC[-11]/SQRT(RC[-6]*RC[-5]) -> -1
A866: 64586 | B866: 北京 | C866: 190 | D866: 中度污染 | E866: 1.0900000000000001 | F866: 6 | G866: 42 | H866: 130 | I866: 155 | J866: 120 | L866: 2013-06-26T22:00:00.000 | M866: =RC[-8]-R[2]C[-8] -> -0.81526315789473691 | N866: =RC[-8]-R[2]C[-8] -> 1.2631578947368425 | O866: =RC[-8]-R[2]C[-8] -> 3.8421052631578974 | P866: =RC[-8]-R[2]C[-8] -> 54.684210526315795 | Q866: =RC[-8]-R[2]C[-8] -> 27.736842105263165 | R866: =RC[-8]-R[2]C[-8] -> -33.421052631578959 | T866: =RC[-7]*RC[-2] -> 27.246952908587268 | U866: =RC[-7]*RC[-3] -> -42.216066481994488 | V866: =RC[-7]*RC[-4] -> -128.40720221606662 | W866: =RC[-7]*RC[-5] -> -1827.6038781163443 | X866: =RC[-7]*RC[-6] -> -926.99445983379553 | Y866: =RC[-12]*RC[-12] -> 0.66465401662049872 | Z866: =RC[-12]*RC[-12] -> 1.5955678670360121 | AA866: =RC[-12]*RC[-12] -> 14.761772853185615 | AB866: =RC[-12]*RC[-12] -> 2990.3628808864273 | AC866: =RC[-12]*RC[-12] -> 769.3324099722995 | AD866: =RC[-12]*RC[-12] -> 1116.9667590027709 | AE866: =RC[-11]/SQRT(RC[-6]*RC[-1]) -> 0.99999999999999989 | AF866: =RC[-11]/SQRT(RC[-6]*RC[-2]) -> -1 | AG866: =RC[-11]/SQRT(RC[-6]*RC[-3]) -> -1 | AH866: =RC[-11]/SQRT(RC[-6]*RC[-4]) -> -0.99999999999999989 | AI866: =RC[-11]/SQRT(RC[-6]*RC[-5]) -> -1
A867: 64662 | B867: 北京 | C867: 189 | D867: 中度污染 | E867: 1.1599999999999999 | F867: 6 | G867: 38 | H867: 107 | I867: 175 | J867: 153 | L867: 2013-06-26T23:00:00.000 | M867: =RC[-8]-R[1]C[-8] -> -0.74526315789473707 | N867: =RC[-8]-R[1]C[-8] -> 1.2631578947368425 | O867: =RC[-8]-R[1]C[-8] -> -0.15789473684210265 | P867: =RC[-8]-R[1]C[-8] -> 31.684210526315795 | Q867: =RC[-8]-R[1]C[-8] -> 47.736842105263165 | R867: =RC[-8]-R[1]C[-8] -> -0.42105263157895934 | T867: =RC[-7]*RC[-2] -> 0.31379501385042452 | U867: =RC[-7]*RC[-3] -> -0.5318559556786856 | V867: =RC[-7]*RC[-4] -> 6.6481994459834576E-2 | W867: =RC[-7]*RC[-5] -> -13.340720221607029 | X867: =RC[-7]*RC[-6] -> -20.099722991690324 | Y867: =RC[-12]*RC[-12] -> 0.55541717451523576 | Z867: =RC[-12]*RC[-12] -> 1.5955678670360121 | AA867: =RC[-12]*RC[-12] -> 2.4930747922436845E-2 | AB867: =RC[-12]*RC[-12] -> 1003.8891966759006 | AC867: =RC[-12]*RC[-12] -> 2278.8060941828262 | AD867: =RC[-12]*RC[-12] -> 0.17728531855956686 | AE867: =RC[-11]/SQRT(RC[-6]*RC[-1]) -> 1 | AF867: =RC[-11]/SQRT(RC[-6]*RC[-2]) -> -1 | AG867: =RC[-11]/SQRT(RC[-6]*RC[-3]) -> 1 | AH867: =RC[-11]/SQRT(RC[-6]*RC[-4]) -> -1 | AI867: =RC[-11]/SQRT(RC[-6]*RC[-5]) -> -1
E868: =AVERAGE(R[-19]C:R[-1]C) -> 1.905263157894737 | F868: =AVERAGE(R[-19]C:R[-1]C) -> 4.7368421052631575 | G868: =AVERAGE(R[-19]C:R[-1]C) -> 38.157894736842103 | H868: =AVERAGE(R[-19]C:R[-1]C) -> 75.315789473684205 | I868: =AVERAGE(R[-19]C:R[-1]C) -> 127.26315789473684 | J868: =AVERAGE(R[-19]C:R[-1]C) -> 153.42105263157896 | M868: =RC[-8]-RC[-8] -> 0 | N868: =RC[-8]-RC[-8] -> 0 | O868: =RC[-8]-RC[-8] -> 0 | P868: =RC[-8]-RC[-8] -> 0 | Q868: =RC[-8]-RC[-8] -> 0 | R868: =RC[-8]-RC[-8] -> 0 | T868: =SUM(R[-19]C:R[-1]C) -> -16.402105263157893 | U868: =SUM(R[-19]C:R[-1]C) -> 85.105263157894768 | V868: =SUM(R[-19]C:R[-1]C) -> -1864.2631578947369 | W868: =SUM(R[-19]C:R[-1]C) -> 22827.473684210523 | X868: =SUM(R[-19]C:R[-1]C) -> 21603.894736842107 | Y868: =SUM(R[-19]C:R[-1]C) -> 3.9186736842105261 | Z868: =SUM(R[-19]C:R[-1]C) -> 7.6842105263157876 | AA868: =SUM(R[-19]C:R[-1]C) -> 418.5263157894737 | AB868: =SUM(R[-19]C:R[-1]C) -> 121048.10526315789 | AC868: =SUM(R[-19]C:R[-1]C) -> 63649.68421052632 | AD868: =SUM(R[-19]C:R[-1]C) -> 13886.631578947368 | AE868: =RC[-11]/SQRT(RC[-6]*RC[-1]) -> -7.0312345862857215E-2 | AF868: =RC[-11]/SQRT(RC[-6]*RC[-2]) -> 0.26053035710861405 | AG868: =RC[-11]/SQRT(RC[-6]*RC[-3]) -> -0.77329886903344847 | AH868: =RC[-11]/SQRT(RC[-6]*RC[-4]) -> 0.55677585826801912 | AI868: =RC[-11]/SQRT(RC[-6]*RC[-5]) -> 0.72666705190836511
A869: 64738 | B869: 北京 | C869: 189 | D869: 中度污染 | E869: 1.07 | F869: 6 | G869: 36 | H869: 91 | I869: 140 | J869: 147 | L869: 2013-06-27T00:00:00.000 | M869: =RC[-8]-R[24]C[-8] -> 0.15333333333333321 | N869: =RC[-8]-R[24]C[-8] -> -2.4166666666666661 | O869: =RC[-8]-R[24]C[-8] -> -3.9166666666666643 | P869: =RC[-8]-R[24]C[-8] -> -23.333333333333329 | Q869: =RC[-8]-R[24]C[-8] -> 46.458333333333329 | R869: =RC[-8]-R[24]C[-8] -> 59.166666666666671 | T869: =RC[-7]*RC[-2] -> 9.0722222222222157 | U869: =RC[-7]*RC[-3] -> -142.98611111111109 | V869: =RC[-7]*RC[-4] -> -231.736111111111 | W869: =RC[-7]*RC[-5] -> -1380.5555555555554 | X869: =RC[-7]*RC[-6] -> 2748.7847222222222 | Y869: =RC[-12]*RC[-12] -> 2.3511111111111073E-2 | Z869: =RC[-12]*RC[-12] -> 5.840277777777775 | AA869: =RC[-12]*RC[-12] -> 15.340277777777759 | AB869: =RC[-12]*RC[-12] -> 544.44444444444423 | AC869: =RC[-12]*RC[-12] -> 2158.3767361111109 | AD869: =RC[-12]*RC[-12] -> 3500.6944444444448 | AE869: =RC[-11]/SQRT(RC[-6]*RC[-1]) -> 1 | AF869: =RC[-11]/SQRT(RC[-6]*RC[-2]) -> -1 | AG869: =RC[-11]/SQRT(RC[-6]*RC[-3]) -> -1 | AH869: =RC[-11]/SQRT(RC[-6]*RC[-4]) -> -1 | AI869: =RC[-11]/SQRT(RC[-6]*RC[-5]) -> 1
A870: 64814 | B870: 北京 | C870: 189 | D870: 中度污染 | E870: 1.02 | F870: 7 | G870: 36 | H870: 78 | I870: 73 | J870: 141 | L870: 2013-06-27T01:00:00.000 | M870: =RC[-8]-R[23]C[-8] -> 0.10333333333333317 | N870: =RC[-8]-R[23]C[-8] -> -1.4166666666666661 | O870: =RC[-8]-R[23]C[-8] -> -3.9166666666666643 | P870: =RC[-8]-R[23]C[-8] -> -36.333333333333329 | Q870: =RC[-8]-R[23]C[-8] -> -20.541666666666671 | R870: =RC[-8]-R[23]C[-8] -> 53.166666666666671 | T870: =RC[-7]*RC[-2] -> 5.4938888888888808 | U870: =RC[-7]*RC[-3] -> -75.319444444444414 | V870: =RC[-7]*RC[-4] -> -208.236111111111 | W870: =RC[-7]*RC[-5] -> -1931.7222222222222 | X870: =RC[-7]*RC[-6] -> -1092.1319444444448 | Y870: =RC[-12]*RC[-12] -> 1.0677777777777743E-2 | Z870: =RC[-12]*RC[-12] -> 2.0069444444444429 | AA870: =RC[-12]*RC[-12] -> 15.340277777777759 | AB870: =RC[-12]*RC[-12] -> 1320.1111111111109 | AC870: =RC[-12]*RC[-12] -> 421.96006944444463 | AD870: =RC[-12]*RC[-12] -> 2826.6944444444448 | AE870: =RC[-11]/SQRT(RC[-6]*RC[-1]) -> 1.0000000000000002 | AF870: =RC[-11]/SQRT(RC[-6]*RC[-2]) -> -0.99999999999999978 | AG870: =RC[-11]/SQRT(RC[-6]*RC[-3]) -> -1 | AH870: =RC[-11]/SQRT(RC[-6]*RC[-4]) -> -1 | AI870: =RC[-11]/SQRT(RC[-6]*RC[-5]) -> -1
A871: 64890 | B871: 北京 | C871: 188 | D871: 中度污染 | E871: 0.9 | F871: 5 | G871: 40 | H871: 62 | I871: 63 | J871: 121 | L871: 2013-06-27T02:00:00.000 | M871: =RC[-8]-R[22]C[-8] -> -1.6666666666666829E-2 | N871: =RC[-8]-R[22]C[-8] -> -3.4166666666666661 | O871: =RC[-8]-R[22]C[-8] -> 8.3333333333335702E-2 | P871: =RC[-8]-R[22]C[-8] -> -52.333333333333329 | Q871: =RC[-8]-R[22]C[-8] -> -30.541666666666671 | R871: =RC[-8]-R[22]C[-8] -> 33.166666666666671 | T871: =RC[-7]*RC[-2] -> -0.55277777777778325 | U871: =RC[-7]*RC[-3] -> -113.31944444444444 | V871: =RC[-7]*RC[-4] -> 2.7638888888889679 | W871: =RC[-7]*RC[-5] -> -1735.7222222222224 | X871: =RC[-7]*RC[-6] -> -1012.9652777777781 | Y871: =RC[-12]*RC[-12] -> 2.777777777777832E-4 | Z871: =RC[-12]*RC[-12] -> 11.673611111111107 | AA871: =RC[-12]*RC[-12] -> 6.9444444444448396E-3 | AB871: =RC[-12]*RC[-12] -> 2738.7777777777774 | AC871: =RC[-12]*RC[-12] -> 932.79340277777806 | AD871: =RC[-12]*RC[-12] -> 1100.0277777777781 | AE871: =RC[-11]/SQRT(RC[-6]*RC[-1]) -> -1 | AF871: =RC[-11]/SQRT(RC[-6]*RC[-2]) -> -1 | AG871: =RC[-11]/SQRT(RC[-6]*RC[-3]) -> 1 | AH871: =RC[-11]/SQRT(RC[-6]*RC[-4]) -> -1 | AI871: =RC[-11]/SQRT(RC[-6]*RC[-5]) -> -1
A872: 64966 | B872: 北京 | C872: 187 | D872: 中度污染 | E872: 0.76 | F872: 5 | G872: 40 | H872: 56 | I872: 14 | J872: 110 | L872: 2013-06-27T03:00:00.000 | M872: =RC[-8]-R[21]C[-8] -> -0.15666666666666684 | N872: =RC[-8]-R[21]C[-8] -> -3.4166666666666661 | O872: =RC[-8]-R[21]C[-8] -> 8.3333333333335702E-2 | P872: =RC[-8]-R[21]C[-8] -> -58.333333333333329 | Q872: =RC[-8]-R[21]C[-8] -> -79.541666666666671 | R872: =RC[-8]-R[21]C[-8] -> 22.166666666666671 | T872: =RC[-7]*RC[-2] -> -3.4727777777777824 | U872: =RC[-7]*RC[-3] -> -75.736111111111114 | V872: =RC[-7]*RC[-4] -> 1.8472222222222752 | W872: =RC[-7]*RC[-5] -> -1293.0555555555557 | X872: =RC[-7]*RC[-6] -> -1763.1736111111115 | Y872: =RC[-12]*RC[-12] -> 2.4544444444444501E-2 | Z872: =RC[-12]*RC[-12] -> 11.673611111111107 | AA872: =RC[-12]*RC[-12] -> 6.9444444444448396E-3 | AB872: =RC[-12]*RC[-12] -> 3402.7777777777774 | AC872: =RC[-12]*RC[-12] -> 6326.8767361111122 | AD872: =RC[-12]*RC[-12] -> 491.36111111111131 | AE872: =RC[-11]/SQRT(RC[-6]*RC[-1]) -> -1 | AF872: =RC[-11]/SQRT(RC[-6]*RC[-2]) -> -1 | AG872: =RC[-11]/SQRT(RC[-6]*RC[-3]) -> 1 | AH872: =RC[-11]/SQRT(RC[-6]*RC[-4]) -> -0.99999999999999978 | AI872: =RC[-11]/SQRT(RC[-6]*RC[-5]) -> -1
A873: 65042 | B873: 北京 | C873: 185 | D873: 中度污染 | E873: 0.72 | F873: 4 | G873: 43 | H873: 44 | I873: 36 | J873: 93 | L873: 2013-06-27T04:00:00.000 | M873: =RC[-8]-R[20]C[-8] -> -0.19666666666666688 | N873: =RC[-8]-R[20]C[-8] -> -4.4166666666666661 | O873: =RC[-8]-R[20]C[-8] -> 3.0833333333333357 | P873: =RC[-8]-R[20]C[-8] -> -70.333333333333329 | Q873: =RC[-8]-R[20]C[-8] -> -57.541666666666671 | R873: =RC[-8]-R[20]C[-8] -> 5.1666666666666714 | T873: =RC[-7]*RC[-2] -> -1.0161111111111132 | U873: =RC[-7]*RC[-3] -> -22.819444444444461 | V873: =RC[-7]*RC[-4] -> 15.930555555555582 | W873: =RC[-7]*RC[-5] -> -363.3888888888892 | X873: =RC[-7]*RC[-6] -> -297.29861111111143 | Y873: =RC[-12]*RC[-12] -> 3.8677777777777859E-2 | Z873: =RC[-12]*RC[-12] -> 19.506944444444439 | AA873: =RC[-12]*RC[-12] -> 9.5069444444444589 | AB873: =RC[-12]*RC[-12] -> 4946.7777777777774 | AC873: =RC[-12]*RC[-12] -> 3311.0434027777783 | AD873: =RC[-12]*RC[-12] -> 26.694444444444493 | AE873: =RC[-11]/SQRT(RC[-6]*RC[-1]) -> -1 | AF873: =RC[-11]/SQRT(RC[-6]*RC[-2]) -> -1 | AG873: =RC[-11]/SQRT(RC[-6]*RC[-3]) -> 1 | AH873: =RC[-11]/SQRT(RC[-6]*RC[-4]) -> -1 | AI873: =RC[-11]/SQRT(RC[-6]*RC[-5]) -> -1.0000000000000002
A874: 65118 | B874: 北京 | C874: 183 | D874: 中度污染 | E874: 0.7 | F874: 4 | G874: 50 | H874: 41 | I874: 51 | J874: 83 | L874: 2013-06-27T05:00:00.000 | M874: =RC[-8]-R[19]C[-8] -> -0.2166666666666669 | N874: =RC[-8]-R[19]C[-8] -> -4.4166666666666661 | O874: =RC[-8]-R[19]C[-8] -> 10.083333333333336 | P874: =RC[-8]-R[19]C[-8] -> -73.333333333333329 | Q874: =RC[-8]-R[19]C[-8] -> -42.541666666666671 | R874: =RC[-8]-R[19]C[-8] -> -4.8333333333333286 | T874: =RC[-7]*RC[-2] -> 1.0472222222222223 | U874: =RC[-7]*RC[-3] -> 21.3472222222222 | V874: =RC[-7]*RC[-4] -> -48.736111111111072 | W874: =RC[-7]*RC[-5] -> 354.44444444444406 | X874: =RC[-7]*RC[-6] -> 205.61805555555537 | Y874: =RC[-12]*RC[-12] -> 4.6944444444444546E-2 | Z874: =RC[-12]*RC[-12] -> 19.506944444444439 | AA874: =RC[-12]*RC[-12] -> 101.67361111111116 | AB874: =RC[-12]*RC[-12] -> 5377.7777777777774 | AC874: =RC[-12]*RC[-12] -> 1809.7934027777783 | AD874: =RC[-12]*RC[-12] -> 23.361111111111065 | AE874: =RC[-11]/SQRT(RC[-6]*RC[-1]) -> 1 | AF874: =RC[-11]/SQRT(RC[-6]*RC[-2]) -> 1 | AG874: =RC[-11]/SQRT(RC[-6]*RC[-3]) -> -1 | AH874: =RC[-11]/SQRT(RC[-6]*RC[-4]) -> 1 | AI874: =RC[-11]/SQRT(RC[-6]*RC[-5]) -> 1
A875: 65194 | B875: 北京 | C875: 180 | D875: 中度污染 | E875: 0.66 | F875: 5 | G875: 41 | H875: 43 | I875: 54 | J875: 71 | L875: 2013-06-27T06:00:00.000 | M875: =RC[-8]-R[18]C[-8] -> -0.25666666666666682 | N875: =RC[-8]-R[18]C[-8] -> -3.4166666666666661 | O875: =RC[-8]-R[18]C[-8] -> 1.0833333333333357 | P875: =RC[-8]-R[18]C[-8] -> -71.333333333333329 | Q875: =RC[-8]-R[18]C[-8] -> -39.541666666666671 | R875: =RC[-8]-R[18]C[-8] -> -16.833333333333329 | T875: =RC[-7]*RC[-2] -> 4.3205555555555568 | U875: =RC[-7]*RC[-3] -> 57.513888888888864 | V875: =RC[-7]*RC[-4] -> -18.236111111111146 | W875: =RC[-7]*RC[-5] -> 1200.7777777777774 | X875: =RC[-7]*RC[-6] -> 665.61805555555543 | Y875: =RC[-12]*RC[-12] -> 6.5877777777777854E-2 | Z875: =RC[-12]*RC[-12] -> 11.673611111111107 | AA875: =RC[-12]*RC[-12] -> 1.1736111111111163 | AB875: =RC[-12]*RC[-12] -> 5088.4444444444434 | AC875: =RC[-12]*RC[-12] -> 1563.5434027777781 | AD875: =RC[-12]*RC[-12] -> 283.36111111111097 | AE875: =RC[-11]/SQRT(RC[-6]*RC[-1]) -> 1 | AF875: =RC[-11]/SQRT(RC[-6]*RC[-2]) -> 1 | AG875: =RC[-11]/SQRT(RC[-6]*RC[-3]) -> -1 | AH875: =RC[-11]/SQRT(RC[-6]*RC[-4]) -> 1 | AI875: =RC[-11]/SQRT(RC[-6]*RC[-5]) -> 1
A876: 65270 | B876: 北京 | C876: 177 | D876: 中度污染 | E876: 0.78 | F876: 6 | G876: 47 | H876: 36 | I876: 95 | J876: 75 | L876: 2013-06-27T07:00:00.000 | M876: =RC[-8]-R[17]C[-8] -> -0.13666666666666683 | N876: =RC[-8]-R[17]C[-8] -> -2.4166666666666661 | O876: =RC[-8]-R[17]C[-8] -> 7.0833333333333357 | P876: =RC[-8]-R[17]C[-8] -> -78.333333333333329 | Q876: =RC[-8]-R[17]C[-8] -> 1.4583333333333286 | R876: =RC[-8]-R[17]C[-8] -> -12.833333333333329 | T876: =RC[-7]*RC[-2] -> 1.7538888888888904 | U876: =RC[-7]*RC[-3] -> 31.013888888888872 | V876: =RC[-7]*RC[-4] -> -90.902777777777771 | W876: =RC[-7]*RC[-5] -> 1005.2777777777774 | X876: =RC[-7]*RC[-6] -> -18.715277777777711 | Y876: =RC[-12]*RC[-12] -> 1.8677777777777821E-2 | Z876: =RC[-12]*RC[-12] -> 5.840277777777775 | AA876: =RC[-12]*RC[-12] -> 50.173611111111143 | AB876: =RC[-12]*RC[-12] -> 6136.1111111111104 | AC876: =RC[-12]*RC[-12] -> 2.1267361111110974 | AD876: =RC[-12]*RC[-12] -> 164.69444444444431 | AE876: =RC[-11]/SQRT(RC[-6]*RC[-1]) -> 1.0000000000000002 | AF876: =RC[-11]/SQRT(RC[-6]*RC[-2]) -> 1.0000000000000002 | AG876: =RC[-11]/SQRT(RC[-6]*RC[-3]) -> -1 | AH876: =RC[-11]/SQRT(RC[-6]*RC[-4]) -> 1 | AI876: =RC[-11]/SQRT(RC[-6]*RC[-5]) -> -1
A877: 65346 | B877: 北京 | C877: 174 | D877: 中度污染 | E877: 1.1399999999999999 | F877: 9 | G877: 50 | H877: 39 | I877: 136 | J877: 105 | L877: 2013-06-27T08:00:00.000 | M877: =RC[-8]-R[16]C[-8] -> 0.22333333333333305 | N877: =RC[-8]-R[16]C[-8] -> 0.58333333333333393 | O877: =RC[-8]-R[16]C[-8] -> 10.083333333333336 | P877: =RC[-8]-R[16]C[-8] -> -75.333333333333329 | Q877: =RC[-8]-R[16]C[-8] -> 42.458333333333329 | R877: =RC[-8]-R[16]C[-8] -> 17.166666666666671 | T877: =RC[-7]*RC[-2] -> 3.8338888888888851 | U877: =RC[-7]*RC[-3] -> 10.013888888888902 | V877: =RC[-7]*RC[-4] -> 173.09722222222231 | W877: =RC[-7]*RC[-5] -> -1293.2222222222224 | X877: =RC[-7]*RC[-6] -> 728.86805555555566 | Y877: =RC[-12]*RC[-12] -> 4.9877777777777653E-2 | Z877: =RC[-12]*RC[-12] -> 0.34027777777777846 | AA877: =RC[-12]*RC[-12] -> 101.67361111111116 | AB877: =RC[-12]*RC[-12] -> 5675.1111111111104 | AC877: =RC[-12]*RC[-12] -> 1802.7100694444441 | AD877: =RC[-12]*RC[-12] -> 294.69444444444463 | AE877: =RC[-11]/SQRT(RC[-6]*RC[-1]) -> 1 | AF877: =RC[-11]/SQRT(RC[-6]*RC[-2]) -> 1 | AG877: =RC[-11]/SQRT(RC[-6]*RC[-3]) -> 1 | AH877: =RC[-11]/SQRT(RC[-6]*RC[-4]) -> -0.99999999999999978 | AI877: =RC[-11]/SQRT(RC[-6]*RC[-5]) -> 1
A878: 65422 | B878: 北京 | C878: 173 | D878: 中度污染 | E878: 1.62 | F878: 19 | G878: 52 | H878: 57 | I878: 190 | J878: 148 | L878: 2013-06-27T09:00:00.000 | M878: =RC[-8]-R[15]C[-8] -> 0.70333333333333325 | N878: =RC[-8]-R[15]C[-8] -> 10.583333333333334 | O878: =RC[-8]-R[15]C[-8] -> 12.083333333333336 | P878: =RC[-8]-R[15]C[-8] -> -57.333333333333329 | Q878: =RC[-8]-R[15]C[-8] -> 96.458333333333329 | R878: =RC[-8]-R[15]C[-8] -> 60.166666666666671 | T878: =RC[-7]*RC[-2] -> 42.31722222222222 | U878: =RC[-7]*RC[-3] -> 636.76388888888903 | V878: =RC[-7]*RC[-4] -> 727.01388888888914 | W878: =RC[-7]*RC[-5] -> -3449.5555555555557 | X878: =RC[-7]*RC[-6] -> 5803.5763888888887 | Y878: =RC[-12]*RC[-12] -> 0.49467777777777766 | Z878: =RC[-12]*RC[-12] -> 112.00694444444446 | AA878: =RC[-12]*RC[-12] -> 146.00694444444451 | AB878: =RC[-12]*RC[-12] -> 3287.1111111111104 | AC878: =RC[-12]*RC[-12] -> 9304.2100694444434 | AD878: =RC[-12]*RC[-12] -> 3620.0277777777783 | AE878: =RC[-11]/SQRT(RC[-6]*RC[-1]) -> 1 | AF878: =RC[-11]/SQRT(RC[-6]*RC[-2]) -> 1 | AG878: =RC[-11]/SQRT(RC[-6]*RC[-3]) -> 1 | AH878: =RC[-11]/SQRT(RC[-6]*RC[-4]) -> -1.0000000000000002 | AI878: =RC[-11]/SQRT(RC[-6]*RC[-5]) -> 1
A879: 65498 | B879: 北京 | C879: 173 | D879: 中度污染 | E879: 1.73 | F879: 24 | G879: 45 | H879: 97 | I879: 109 | J879: 169 | L879: 2013-06-27T10:00:00.000 | M879: =RC[-8]-R[14]C[-8] -> 0.81333333333333313 | N879: =RC[-8]-R[14]C[-8] -> 15.583333333333334 | O879: =RC[-8]-R[14]C[-8] -> 5.0833333333333357 | P879: =RC[-8]-R[14]C[-8] -> -17.333333333333329 | Q879: =RC[-8]-R[14]C[-8] -> 15.458333333333329 | R879: =RC[-8]-R[14]C[-8] -> 81.166666666666671 | T879: =RC[-7]*RC[-2] -> 66.015555555555537 | U879: =RC[-7]*RC[-3] -> 1264.8472222222224 | V879: =RC[-7]*RC[-4] -> 412.59722222222246 | W879: =RC[-7]*RC[-5] -> -1406.8888888888887 | X879: =RC[-7]*RC[-6] -> 1254.7013888888887 | Y879: =RC[-12]*RC[-12] -> 0.66151111111111083 | Z879: =RC[-12]*RC[-12] -> 242.8402777777778 | AA879: =RC[-12]*RC[-12] -> 25.840277777777803 | AB879: =RC[-12]*RC[-12] -> 300.44444444444429 | AC879: =RC[-12]*RC[-12] -> 238.96006944444429 | AD879: =RC[-12]*RC[-12] -> 6588.0277777777783 | AE879: =RC[-11]/SQRT(RC[-6]*RC[-1]) -> 0.99999999999999978 | AF879: =RC[-11]/SQRT(RC[-6]*RC[-2]) -> 1 | AG879: =RC[-11]/SQRT(RC[-6]*RC[-3]) -> 1 | AH879: =RC[-11]/SQRT(RC[-6]*RC[-4]) -> -1.0000000000000002 | AI879: =RC[-11]/SQRT(RC[-6]*RC[-5]) -> 1.0000000000000002
A880: 65574 | B880: 北京 | C880: 169 | D880: 中度污染 | E880: 1.1599999999999999 | F880: 16 | G880: 34 | H880: 124 | I880: 101 | J880: 120 | L880: 2013-06-27T11:00:00.000 | M880: =RC[-8]-R[13]C[-8] -> 0.24333333333333307 | N880: =RC[-8]-R[13]C[-8] -> 7.5833333333333339 | O880: =RC[-8]-R[13]C[-8] -> -5.9166666666666643 | P880: =RC[-8]-R[13]C[-8] -> 9.6666666666666714 | Q880: =RC[-8]-R[13]C[-8] -> 7.4583333333333286 | R880: =RC[-8]-R[13]C[-8] -> 32.166666666666671 | T880: =RC[-7]*RC[-2] -> 7.8272222222222148 | U880: =RC[-7]*RC[-3] -> 243.9305555555556 | V880: =RC[-7]*RC[-4] -> -190.3194444444444 | W880: =RC[-7]*RC[-5] -> 310.94444444444463 | X880: =RC[-7]*RC[-6] -> 239.90972222222211 | Y880: =RC[-12]*RC[-12] -> 5.9211111111110985E-2 | Z880: =RC[-12]*RC[-12] -> 57.50694444444445 | AA880: =RC[-12]*RC[-12] -> 35.006944444444414 | AB880: =RC[-12]*RC[-12] -> 93.444444444444542 | AC880: =RC[-12]*RC[-12] -> 55.626736111111043 | AD880: =RC[-12]*RC[-12] -> 1034.6944444444448 | AE880: =RC[-11]/SQRT(RC[-6]*RC[-1]) -> 0.99999999999999989 | AF880: =RC[-11]/SQRT(RC[-6]*RC[-2]) -> 1 | AG880: =RC[-11]/SQRT(RC[-6]*RC[-3]) -> -1 | AH880: =RC[-11]/SQRT(RC[-6]*RC[-4]) -> 0.99999999999999978 | AI880: =RC[-11]/SQRT(RC[-6]*RC[-5]) -> 1
A881: 65650 | B881: 北京 | C881: 162 | D881: 中度污染 | E881: 0.67 | F881: 7 | G881: 23 | H881: 141 | I881: 93 | J881: 54 | L881: 2013-06-27T12:00:00.000 | M881: =RC[-8]-R[12]C[-8] -> -0.24666666666666681 | N881: =RC[-8]-R[12]C[-8] -> -1.4166666666666661 | O881: =RC[-8]-R[12]C[-8] -> -16.916666666666664 | P881: =RC[-8]-R[12]C[-8] -> 26.666666666666671 | Q881: =RC[-8]-R[12]C[-8] -> -0.5416666666666714 | R881: =RC[-8]-R[12]C[-8] -> -33.833333333333329 | T881: =RC[-7]*RC[-2] -> 8.3455555555555598 | U881: =RC[-7]*RC[-3] -> 47.930555555555529 | V881: =RC[-7]*RC[-4] -> 572.34722222222206 | W881: =RC[-7]*RC[-5] -> -902.22222222222229 | X881: =RC[-7]*RC[-6] -> 18.326388888889046 | Y881: =RC[-12]*RC[-12] -> 6.0844444444444513E-2 | Z881: =RC[-12]*RC[-12] -> 2.0069444444444429 | AA881: =RC[-12]*RC[-12] -> 286.17361111111103 | AB881: =RC[-12]*RC[-12] -> 711.11111111111131 | AC881: =RC[-12]*RC[-12] -> 0.2934027777777829 | AD881: =RC[-12]*RC[-12] -> 1144.6944444444441 | AE881: =RC[-11]/SQRT(RC[-6]*RC[-1]) -> 1 | AF881: =RC[-11]/SQRT(RC[-6]*RC[-2]) -> 1 | AG881: =RC[-11]/SQRT(RC[-6]*RC[-3]) -> 1 | AH881: =RC[-11]/SQRT(RC[-6]*RC[-4]) -> -1.0000000000000002 | AI881: =RC[-11]/SQRT(RC[-6]*RC[-5]) -> 1
A882: 65726 | B882: 北京 | C882: 153 | D882: 中度污染 | E882: 0.54 | F882: 7 | G882: 19 | H882: 161 | I882: 46 | J882: 42 | L882: 2013-06-27T13:00:00.000 | M882: =RC[-8]-R[11]C[-8] -> -0.37666666666666682 | N882: =RC[-8]-R[11]C[-8] -> -1.4166666666666661 | O882: =RC[-8]-R[11]C[-8] -> -20.916666666666664 | P882: =RC[-8]-R[11]C[-8] -> 46.666666666666671 | Q882: =RC[-8]-R[11]C[-8] -> -47.541666666666671 | R882: =RC[-8]-R[11]C[-8] -> -45.833333333333329 | T882: =RC[-7]*RC[-2] -> 17.263888888888893 | U882: =RC[-7]*RC[-3] -> 64.930555555555529 | V882: =RC[-7]*RC[-4] -> 958.68055555555532 | W882: =RC[-7]*RC[-5] -> -2138.8888888888887 | X882: =RC[-7]*RC[-6] -> 2178.9930555555557 | Y882: =RC[-12]*RC[-12] -> 0.14187777777777788 | Z882: =RC[-12]*RC[-12] -> 2.0069444444444429 | AA882: =RC[-12]*RC[-12] -> 437.50694444444434 | AB882: =RC[-12]*RC[-12] -> 2177.7777777777783 | AC882: =RC[-12]*RC[-12] -> 2260.2100694444448 | AD882: =RC[-12]*RC[-12] -> 2100.6944444444439 | AE882: =RC[-11]/SQRT(RC[-6]*RC[-1]) -> 1 | AF882: =RC[-11]/SQRT(RC[-6]*RC[-2]) -> 1.0000000000000002 | AG882: =RC[-11]/SQRT(RC[-6]*RC[-3]) -> 1 | AH882: =RC[-11]/SQRT(RC[-6]*RC[-4]) -> -1 | AI882: =RC[-11]/SQRT(RC[-6]*RC[-5]) -> 1.0000000000000002
A883: 65802 | B883: 北京 | C883: 142 | D883: 轻度污染 | E883: 0.52 | F883: 6 | G883: 18 | H883: 184 | I883: 61 | J883: 36 | L883: 2013-06-27T14:00:00.000 | M883: =RC[-8]-R[10]C[-8] -> -0.39666666666666683 | N883: =RC[-8]-R[10]C[-8] -> -2.4166666666666661 | O883: =RC[-8]-R[10]C[-8] -> -21.916666666666664 | P883: =RC[-8]-R[10]C[-8] -> 69.666666666666671 | Q883: =RC[-8]-R[10]C[-8] -> -32.541666666666671 | R883: =RC[-8]-R[10]C[-8] -> -51.833333333333329 | T883: =RC[-7]*RC[-2] -> 20.560555555555563 | U883: =RC[-7]*RC[-3] -> 125.26388888888884 | V883: =RC[-7]*RC[-4] -> 1136.0138888888887 | W883: =RC[-7]*RC[-5] -> -3611.0555555555557 | X883: =RC[-7]*RC[-6] -> 1686.7430555555557 | Y883: =RC[-12]*RC[-12] -> 0.15734444444444456 | Z883: =RC[-12]*RC[-12] -> 5.840277777777775 | AA883: =RC[-12]*RC[-12] -> 480.34027777777766 | AB883: =RC[-12]*RC[-12] -> 4853.4444444444453 | AC883: =RC[-12]*RC[-12] -> 1058.9600694444448 | AD883: =RC[-12]*RC[-12] -> 2686.6944444444439 | AE883: =RC[-11]/SQRT(RC[-6]*RC[-1]) -> 1.0000000000000002 | AF883: =RC[-11]/SQRT(RC[-6]*RC[-2]) -> 1 | AG883: =RC[-11]/SQRT(RC[-6]*RC[-3]) -> 1 | AH883: =RC[-11]/SQRT(RC[-6]*RC[-4]) -> -1 | AI883: =RC[-11]/SQRT(RC[-6]*RC[-5]) -> 1
A884: 65878 | B884: 北京 | C884: 136 | D884: 轻度污染 | E884: 0.56000000000000005 | F884: 7 | G884: 20 | H884: 203 | I884: 59 | J884: 39 | L884: 2013-06-27T15:00:00.000 | M884: =RC[-8]-R[9]C[-8] -> -0.3566666666666668 | N884: =RC[-8]-R[9]C[-8] -> -1.4166666666666661 | O884: =RC[-8]-R[9]C[-8] -> -19.916666666666664 | P884: =RC[-8]-R[9]C[-8] -> 88.666666666666671 | Q884: =RC[-8]-R[9]C[-8] -> -34.541666666666671 | R884: =RC[-8]-R[9]C[-8] -> -48.833333333333329 | T884: =RC[-7]*RC[-2] -> 17.417222222222225 | U884: =RC[-7]*RC[-3] -> 69.180555555555515 | V884: =RC[-7]*RC[-4] -> 972.59722222222206 | W884: =RC[-7]*RC[-5] -> -4329.8888888888887 | X884: =RC[-7]*RC[-6] -> 1686.7847222222224 | Y884: =RC[-12]*RC[-12] -> 0.12721111111111119 | Z884: =RC[-12]*RC[-12] -> 2.0069444444444429 | AA884: =RC[-12]*RC[-12] -> 396.67361111111103 | AB884: =RC[-12]*RC[-12] -> 7861.7777777777783 | AC884: =RC[-12]*RC[-12] -> 1193.1267361111115 | AD884: =RC[-12]*RC[-12] -> 2384.6944444444439 | AE884: =RC[-11]/SQRT(RC[-6]*RC[-1]) -> 1 | AF884: =RC[-11]/SQRT(RC[-6]*RC[-2]) -> 1 | AG884: =RC[-11]/SQRT(RC[-6]*RC[-3]) -> 1 | AH884: =RC[-11]/SQRT(RC[-6]*RC[-4]) -> -1 | AI884: =RC[-11]/SQRT(RC[-6]*RC[-5]) -> 1
A885: 65954 | B885: 北京 | C885: 132 | D885: 轻度污染 | E885: 0.59 | F885: 7 | G885: 29 | H885: 220 | I885: 79 | J885: 46 | L885: 2013-06-27T16:00:00.000 | M885: =RC[-8]-R[8]C[-8] -> -0.32666666666666688 | N885: =RC[-8]-R[8]C[-8] -> -1.4166666666666661 | O885: =RC[-8]-R[8]C[-8] -> -10.916666666666664 | P885: =RC[-8]-R[8]C[-8] -> 105.66666666666667 | Q885: =RC[-8]-R[8]C[-8] -> -14.541666666666671 | R885: =RC[-8]-R[8]C[-8] -> -41.833333333333329 | T885: =RC[-7]*RC[-2] -> 13.665555555555564 | U885: =RC[-7]*RC[-3] -> 59.263888888888857 | V885: =RC[-7]*RC[-4] -> 456.68055555555543 | W885: =RC[-7]*RC[-5] -> -4420.3888888888887 | X885: =RC[-7]*RC[-6] -> 608.32638888888903 | Y885: =RC[-12]*RC[-12] -> 0.10671111111111126 | Z885: =RC[-12]*RC[-12] -> 2.0069444444444429 | AA885: =RC[-12]*RC[-12] -> 119.17361111111106 | AB885: =RC[-12]*RC[-12] -> 11165.444444444445 | AC885: =RC[-12]*RC[-12] -> 211.46006944444457 | AD885: =RC[-12]*RC[-12] -> 1750.0277777777774 | AE885: =RC[-11]/SQRT(RC[-6]*RC[-1]) -> 1 | AF885: =RC[-11]/SQRT(RC[-6]*RC[-2]) -> 1 | AG885: =RC[-11]/SQRT(RC[-6]*RC[-3]) -> 1 | AH885: =RC[-11]/SQRT(RC[-6]*RC[-4]) -> -1 | AI885: =RC[-11]/SQRT(RC[-6]*RC[-5]) -> 1
A886: 66030 | B886: 北京 | C886: 129 | D886: 轻度污染 | E886: 0.64 | F886: 7 | G886: 27 | H886: 228 | I886: 73 | J886: 48 | L886: 2013-06-27T17:00:00.000 | M886: =RC[-8]-R[7]C[-8] -> -0.27666666666666684 | N886: =RC[-8]-R[7]C[-8] -> -1.4166666666666661 | O886: =RC[-8]-R[7]C[-8] -> -12.916666666666664 | P886: =RC[-8]-R[7]C[-8] -> 113.66666666666667 | Q886: =RC[-8]-R[7]C[-8] -> -20.541666666666671 | R886: =RC[-8]-R[7]C[-8] -> -39.833333333333329 | T886: =RC[-7]*RC[-2] -> 11.020555555555561 | U886: =RC[-7]*RC[-3] -> 56.430555555555529 | V886: =RC[-7]*RC[-4] -> 514.51388888888869 | W886: =RC[-7]*RC[-5] -> -4527.7222222222217 | X886: =RC[-7]*RC[-6] -> 818.24305555555566 | Y886: =RC[-12]*RC[-12] -> 7.654444444444454E-2 | Z886: =RC[-12]*RC[-12] -> 2.0069444444444429 | AA886: =RC[-12]*RC[-12] -> 166.84027777777771 | AB886: =RC[-12]*RC[-12] -> 12920.111111111111 | AC886: =RC[-12]*RC[-12] -> 421.96006944444463 | AD886: =RC[-12]*RC[-12] -> 1586.6944444444441 | AE886: =RC[-11]/SQRT(RC[-6]*RC[-1]) -> 1 | AF886: =RC[-11]/SQRT(RC[-6]*RC[-2]) -> 1 | AG886: =RC[-11]/SQRT(RC[-6]*RC[-3]) -> 1 | AH886: =RC[-11]/SQRT(RC[-6]*RC[-4]) -> -1 | AI886: =RC[-11]/SQRT(RC[-6]*RC[-5]) -> 1
A887: 66106 | B887: 北京 | C887: 129 | D887: 轻度污染 | E887: 0.78 | F887: 8 | G887: 34 | H887: 226 | I887: 108 | J887: 57 | L887: 2013-06-27T18:00:00.000 | M887: =RC[-8]-R[6]C[-8] -> -0.13666666666666683 | N887: =RC[-8]-R[6]C[-8] -> -0.41666666666666607 | O887: =RC[-8]-R[6]C[-8] -> -5.9166666666666643 | P887: =RC[-8]-R[6]C[-8] -> 111.66666666666667 | Q887: =RC[-8]-R[6]C[-8] -> 14.458333333333329 | R887: =RC[-8]-R[6]C[-8] -> -30.833333333333329 | T887: =RC[-7]*RC[-2] -> 4.213888888888893 | U887: =RC[-7]*RC[-3] -> 12.847222222222202 | V887: =RC[-7]*RC[-4] -> 182.43055555555546 | W887: =RC[-7]*RC[-5] -> -3443.0555555555552 | X887: =RC[-7]*RC[-6] -> -445.79861111111092 | Y887: =RC[-12]*RC[-12] -> 1.8677777777777821E-2 | Z887: =RC[-12]*RC[-12] -> 0.17361111111111061 | AA887: =RC[-12]*RC[-12] -> 35.006944444444414 | AB887: =RC[-12]*RC[-12] -> 12469.444444444445 | AC887: =RC[-12]*RC[-12] -> 209.04340277777763 | AD887: =RC[-12]*RC[-12] -> 950.69444444444412 | AE887: =RC[-11]/SQRT(RC[-6]*RC[-1]) -> 1 | AF887: =RC[-11]/SQRT(RC[-6]*RC[-2]) -> 1 | AG887: =RC[-11]/SQRT(RC[-6]*RC[-3]) -> 1 | AH887: =RC[-11]/SQRT(RC[-6]*RC[-4]) -> -1 | AI887: =RC[-11]/SQRT(RC[-6]*RC[-5]) -> -1.0000000000000002
A888: 66182 | B888: 北京 | C888: 134 | D888: 轻度污染 | E888: 0.91 | F888: 9 | G888: 40 | H888: 193 | I888: 139 | J888: 74 | L888: 2013-06-27T19:00:00.000 | M888: =RC[-8]-R[5]C[-8] -> -6.6666666666668206E-3 | N888: =RC[-8]-R[5]C[-8] -> 0.58333333333333393 | O888: =RC[-8]-R[5]C[-8] -> 8.3333333333335702E-2 | P888: =RC[-8]-R[5]C[-8] -> 78.666666666666671 | Q888: =RC[-8]-R[5]C[-8] -> 45.458333333333329 | R888: =RC[-8]-R[5]C[-8] -> -13.833333333333329 | T888: =RC[-7]*RC[-2] -> 9.2222222222224315E-2 | U888: =RC[-7]*RC[-3] -> -8.06944444444445 | V888: =RC[-7]*RC[-4] -> -1.1527777777778101 | W888: =RC[-7]*RC[-5] -> -1088.2222222222219 | X888: =RC[-7]*RC[-6] -> -628.84027777777749 | Y888: =RC[-12]*RC[-12] -> 4.44444444444465E-5 | Z888: =RC[-12]*RC[-12] -> 0.34027777777777846 | AA888: =RC[-12]*RC[-12] -> 6.9444444444448396E-3 | AB888: =RC[-12]*RC[-12] -> 6188.4444444444453 | AC888: =RC[-12]*RC[-12] -> 2066.4600694444439 | AD888: =RC[-12]*RC[-12] -> 191.36111111111097 | AE888: =RC[-11]/SQRT(RC[-6]*RC[-1]) -> 1 | AF888: =RC[-11]/SQRT(RC[-6]*RC[-2]) -> -1 | AG888: =RC[-11]/SQRT(RC[-6]*RC[-3]) -> -1 | AH888: =RC[-11]/SQRT(RC[-6]*RC[-4]) -> -1 | AI888: =RC[-11]/SQRT(RC[-6]*RC[-5]) -> -1
A889: 66258 | B889: 北京 | C889: 136 | D889: 轻度污染 | E889: 0.98 | F889: 10 | G889: 44 | H889: 160 | I889: 114 | J889: 71 | L889: 2013-06-27T20:00:00.000 | M889: =RC[-8]-R[4]C[-8] -> 6.3333333333333131E-2 | N889: =RC[-8]-R[4]C[-8] -> 1.5833333333333339 | O889: =RC[-8]-R[4]C[-8] -> 4.0833333333333357 | P889: =RC[-8]-R[4]C[-8] -> 45.666666666666671 | Q889: =RC[-8]-R[4]C[-8] -> 20.458333333333329 | R889: =RC[-8]-R[4]C[-8] -> -16.833333333333329 | T889: =RC[-7]*RC[-2] -> -1.0661111111111075 | U889: =RC[-7]*RC[-3] -> -26.652777777777779 | V889: =RC[-7]*RC[-4] -> -68.736111111111128 | W889: =RC[-7]*RC[-5] -> -768.72222222222206 | X889: =RC[-7]*RC[-6] -> -344.38194444444429 | Y889: =RC[-12]*RC[-12] -> 4.0111111111110851E-3 | Z889: =RC[-12]*RC[-12] -> 2.5069444444444464 | AA889: =RC[-12]*RC[-12] -> 16.673611111111132 | AB889: =RC[-12]*RC[-12] -> 2085.4444444444448 | AC889: =RC[-12]*RC[-12] -> 418.5434027777776 | AD889: =RC[-12]*RC[-12] -> 283.36111111111097 | AE889: =RC[-11]/SQRT(RC[-6]*RC[-1]) -> -1 | AF889: =RC[-11]/SQRT(RC[-6]*RC[-2]) -> -0.99999999999999989 | AG889: =RC[-11]/SQRT(RC[-6]*RC[-3]) -> -0.99999999999999978 | AH889: =RC[-11]/SQRT(RC[-6]*RC[-4]) -> -0.99999999999999989 | AI889: =RC[-11]/SQRT(RC[-6]*RC[-5]) -> -1
A890: 66334 | B890: 北京 | C890: 133 | D890: 轻度污染 | E890: 1.1000000000000001 | F890: 8 | G890: 56 | H890: 113 | I890: 135 | J890: 79 | L890: 2013-06-27T21:00:00.000 | M890: =RC[-8]-R[3]C[-8] -> 0.18333333333333324 | N890: =RC[-8]-R[3]C[-8] -> -0.41666666666666607 | O890: =RC[-8]-R[3]C[-8] -> 16.083333333333336 | P890: =RC[-8]-R[3]C[-8] -> -1.3333333333333286 | Q890: =RC[-8]-R[3]C[-8] -> 41.458333333333329 | R890: =RC[-8]-R[3]C[-8] -> -8.8333333333333286 | T890: =RC[-7]*RC[-2] -> -1.6194444444444427 | U890: =RC[-7]*RC[-3] -> 3.6805555555555483 | V890: =RC[-7]*RC[-4] -> -142.0694444444444 | W890: =RC[-7]*RC[-5] -> 11.777777777777729 | X890: =RC[-7]*RC[-6] -> -366.21527777777754 | Y890: =RC[-12]*RC[-12] -> 3.3611111111111078E-2 | Z890: =RC[-12]*RC[-12] -> 0.17361111111111061 | AA890: =RC[-12]*RC[-12] -> 258.6736111111112 | AB890: =RC[-12]*RC[-12] -> 1.7777777777777652 | AC890: =RC[-12]*RC[-12] -> 1718.7934027777774 | AD890: =RC[-12]*RC[-12] -> 78.0277777777777 | AE890: =RC[-11]/SQRT(RC[-6]*RC[-1]) -> -0.99999999999999989 | AF890: =RC[-11]/SQRT(RC[-6]*RC[-2]) -> 1 | AG890: =RC[-11]/SQRT(RC[-6]*RC[-3]) -> -1 | AH890: =RC[-11]/SQRT(RC[-6]*RC[-4]) -> 0.99999999999999989 | AI890: =RC[-11]/SQRT(RC[-6]*RC[-5]) -> -1
A891: 66410 | B891: 北京 | C891: 128 | D891: 轻度污染 | E891: 1.22 | F891: 8 | G891: 66 | H891: 85 | I891: 144 | J891: 87 | L891: 2013-06-27T22:00:00.000 | M891: =RC[-8]-R[2]C[-8] -> 0.30333333333333312 | N891: =RC[-8]-R[2]C[-8] -> -0.41666666666666607 | O891: =RC[-8]-R[2]C[-8] -> 26.083333333333336 | P891: =RC[-8]-R[2]C[-8] -> -29.333333333333329 | Q891: =RC[-8]-R[2]C[-8] -> 50.458333333333329 | R891: =RC[-8]-R[2]C[-8] -> -0.8333333333333286 | T891: =RC[-7]*RC[-2] -> -0.25277777777777616 | U891: =RC[-7]*RC[-3] -> 0.34722222222221977 | V891: =RC[-7]*RC[-4] -> -21.73611111111099 | W891: =RC[-7]*RC[-5] -> 24.444444444444301 | X891: =RC[-7]*RC[-6] -> -42.048611111110866 | Y891: =RC[-12]*RC[-12] -> 9.2011111111110988E-2 | Z891: =RC[-12]*RC[-12] -> 0.17361111111111061 | AA891: =RC[-12]*RC[-12] -> 680.34027777777794 | AB891: =RC[-12]*RC[-12] -> 860.44444444444412 | AC891: =RC[-12]*RC[-12] -> 2546.0434027777774 | AD891: =RC[-12]*RC[-12] -> 0.69444444444443654 | AE891: =RC[-11]/SQRT(RC[-6]*RC[-1]) -> -1 | AF891: =RC[-11]/SQRT(RC[-6]*RC[-2]) -> 1.0000000000000002 | AG891: =RC[-11]/SQRT(RC[-6]*RC[-3]) -> -1 | AH891: =RC[-11]/SQRT(RC[-6]*RC[-4]) -> 1 | AI891: =RC[-11]/SQRT(RC[-6]*RC[-5]) -> -1
A892: 66486 | B892: 北京 | C892: 122 | D892: 轻度污染 | E892: 1.23 | F892: 8 | G892: 68 | H892: 62 | I892: 132 | J892: 92 | L892: 2013-06-27T23:00:00.000 | M892: =RC[-8]-R[1]C[-8] -> 0.31333333333333313 | N892: =RC[-8]-R[1]C[-8] -> -0.41666666666666607 | O892: =RC[-8]-R[1]C[-8] -> 28.083333333333336 | P892: =RC[-8]-R[1]C[-8] -> -52.333333333333329 | Q892: =RC[-8]-R[1]C[-8] -> 38.458333333333329 | R892: =RC[-8]-R[1]C[-8] -> 4.1666666666666714 | T892: =RC[-7]*RC[-2] -> 1.3055555555555562 | U892: =RC[-7]*RC[-3] -> -1.7361111111111107 | V892: =RC[-7]*RC[-4] -> 117.01388888888903 | W892: =RC[-7]*RC[-5] -> -218.05555555555577 | X892: =RC[-7]*RC[-6] -> 160.24305555555571 | Y892: =RC[-12]*RC[-12] -> 9.8177777777777656E-2 | Z892: =RC[-12]*RC[-12] -> 0.17361111111111061 | AA892: =RC[-12]*RC[-12] -> 788.6736111111112 | AB892: =RC[-12]*RC[-12] -> 2738.7777777777774 | AC892: =RC[-12]*RC[-12] -> 1479.0434027777774 | AD892: =RC[-12]*RC[-12] -> 17.36111111111115 | AE892: =RC[-11]/SQRT(RC[-6]*RC[-1]) -> 1 | AF892: =RC[-11]/SQRT(RC[-6]*RC[-2]) -> -1.0000000000000002 | AG892: =RC[-11]/SQRT(RC[-6]*RC[-3]) -> 1 | AH892: =RC[-11]/SQRT(RC[-6]*RC[-4]) -> -1 | AI892: =RC[-11]/SQRT(RC[-6]*RC[-5]) -> 1
E893: =AVERAGE(R[-24]C:R[-1]C) -> 0.91666666666666685 | F893: =AVERAGE(R[-24]C:R[-1]C) -> 8.4166666666666661 | G893: =AVERAGE(R[-24]C:R[-1]C) -> 39.916666666666664 | H893: =AVERAGE(R[-24]C:R[-1]C) -> 114.33333333333333 | I893: =AVERAGE(R[-24]C:R[-1]C) -> 93.541666666666671 | J893: =AVERAGE(R[-24]C:R[-1]C) -> 87.833333333333329 | M893: =RC[-8]-RC[-8] -> 0 | N893: =RC[-8]-RC[-8] -> 0 | O893: =RC[-8]-RC[-8] -> 0 | P893: =RC[-8]-RC[-8] -> 0 | Q893: =RC[-8]-RC[-8] -> 0 | R893: =RC[-8]-RC[-8] -> 0 | T893: =SUM(R[-24]C:R[-1]C) -> 227.58666666666667 | U893: =SUM(R[-24]C:R[-1]C) -> 2238.6666666666665 | V893: =SUM(R[-24]C:R[-1]C) -> 5221.666666666667 | W893: =SUM(R[-24]C:R[-1]C) -> -35394.666666666664 | X893: =SUM(R[-24]C:R[-1]C) -> 12793.166666666668 | Y893: =SUM(R[-24]C:R[-1]C) -> 2.4115333333333333 | Z893: =SUM(R[-24]C:R[-1]C) -> 519.83333333333337 | AA893: =SUM(R[-24]C:R[-1]C) -> 4167.833333333333 | AB893: =SUM(R[-24]C:R[-1]C) -> 102945.33333333331 | AC893: =SUM(R[-24]C:R[-1]C) -> 41511.958333333343 | AD893: =SUM(R[-24]C:R[-1]C) -> 33129.333333333343 | AE893: =RC[-11]/SQRT(RC[-6]*RC[-1]) -> 0.80518158184830591 | AF893: =RC[-11]/SQRT(RC[-6]*RC[-2]) -> 0.53944978241444042 | AG893: =RC[-11]/SQRT(RC[-6]*RC[-3]) -> 0.44437295999311099 | AH893: =RC[-11]/SQRT(RC[-6]*RC[-4]) -> -0.60607747865230066 | AI893: =RC[-11]/SQRT(RC[-6]*RC[-5]) -> 0.34497299456359765
A894: 66562 | B894: 北京 | C894: 117 | D894: 轻度污染 | E894: 1.27 | F894: 9 | G894: 83 | H894: 43 | I894: 158 | J894: 85 | L894: 2013-06-28T00:00:00.000 | M894: =RC[-8]-R[24]C[-8] -> -1.0641666666666674 | N894: =RC[-8]-R[24]C[-8] -> -5.2083333333333339 | O894: =RC[-8]-R[24]C[-8] -> 32.333333333333336 | P894: =RC[-8]-R[24]C[-8] -> -23.208333333333329 | Q894: =RC[-8]-R[24]C[-8] -> -125.58333333333331 | R894: =RC[-8]-R[24]C[-8] -> -201.375 | T894: =RC[-7]*RC[-2] -> 214.29656250000014 | U894: =RC[-7]*RC[-3] -> 1048.8281250000002 | V894: =RC[-7]*RC[-4] -> -6511.1250000000009 | W894: =RC[-7]*RC[-5] -> 4673.5781249999991 | X894: =RC[-7]*RC[-6] -> 25289.343749999996 | Y894: =RC[-12]*RC[-12] -> 1.1324506944444459 | Z894: =RC[-12]*RC[-12] -> 27.126736111111118 | AA894: =RC[-12]*RC[-12] -> 1045.4444444444446 | AB894: =RC[-12]*RC[-12] -> 538.62673611111086 | AC894: =RC[-12]*RC[-12] -> 15771.173611111106 | AD894: =RC[-12]*RC[-12] -> 40551.890625 | AE894: =RC[-11]/SQRT(RC[-6]*RC[-1]) -> 1 | AF894: =RC[-11]/SQRT(RC[-6]*RC[-2]) -> 1.0000000000000002 | AG894: =RC[-11]/SQRT(RC[-6]*RC[-3]) -> -1 | AH894: =RC[-11]/SQRT(RC[-6]*RC[-4]) -> 1 | AI894: =RC[-11]/SQRT(RC[-6]*RC[-5]) -> 1
A895: 66638 | B895: 北京 | C895: 115 | D895: 轻度污染 | E895: 1.27 | F895: 10 | G895: 71 | H895: 47 | I895: 250 | J895: 123 | L895: 2013-06-28T01:00:00.000 | M895: =RC[-8]-R[23]C[-8] -> -1.0641666666666674 | N895: =RC[-8]-R[23]C[-8] -> -4.2083333333333339 | O895: =RC[-8]-R[23]C[-8] -> 20.333333333333336 | P895: =RC[-8]-R[23]C[-8] -> -19.208333333333329 | Q895: =RC[-8]-R[23]C[-8] -> -33.583333333333314 | R895: =RC[-8]-R[23]C[-8] -> -163.375 | T895: =RC[-7]*RC[-2] -> 173.85822916666677 | U895: =RC[-7]*RC[-3] -> 687.53645833333348 | V895: =RC[-7]*RC[-4] -> -3321.9583333333339 | W895: =RC[-7]*RC[-5] -> 3138.1614583333326 | X895: =RC[-7]*RC[-6] -> 5486.6770833333303 | Y895: =RC[-12]*RC[-12] -> 1.1324506944444459 | Z895: =RC[-12]*RC[-12] -> 17.71006944444445 | AA895: =RC[-12]*RC[-12] -> 413.44444444444451 | AB895: =RC[-12]*RC[-12] -> 368.96006944444429 | AC895: =RC[-12]*RC[-12] -> 1127.8402777777765 | AD895: =RC[-12]*RC[-12] -> 26691.390625 | AE895: =RC[-11]/SQRT(RC[-6]*RC[-1]) -> 1 | AF895: =RC[-11]/SQRT(RC[-6]*RC[-2]) -> 1 | AG895: =RC[-11]/SQRT(RC[-6]*RC[-3]) -> -1.0000000000000002 | AH895: =RC[-11]/SQRT(RC[-6]*RC[-4]) -> 1 | AI895: =RC[-11]/SQRT(RC[-6]*RC[-5]) -> 1
A896: 66714 | B896: 北京 | C896: 117 | D896: 轻度污染 | E896: 1.44 | F896: 10 | G896: 52 | H896: 53 | I896: 223 | J896: 196 | L896: 2013-06-28T02:00:00.000 | M896: =RC[-8]-R[22]C[-8] -> -0.89416666666666744 | N896: =RC[-8]-R[22]C[-8] -> -4.2083333333333339 | O896: =RC[-8]-R[22]C[-8] -> 1.3333333333333357 | P896: =RC[-8]-R[22]C[-8] -> -13.208333333333329 | Q896: =RC[-8]-R[22]C[-8] -> -60.583333333333314 | R896: =RC[-8]-R[22]C[-8] -> -90.375 | T896: =RC[-7]*RC[-2] -> 80.810312500000066 | U896: =RC[-7]*RC[-3] -> 380.32812500000006 | V896: =RC[-7]*RC[-4] -> -120.50000000000021 | W896: =RC[-7]*RC[-5] -> 1193.7031249999995 | X896: =RC[-7]*RC[-6] -> 5475.2187499999982 | Y896: =RC[-12]*RC[-12] -> 0.79953402777777915 | Z896: =RC[-12]*RC[-12] -> 17.71006944444445 | AA896: =RC[-12]*RC[-12] -> 1.7777777777777841 | AB896: =RC[-12]*RC[-12] -> 174.46006944444431 | AC896: =RC[-12]*RC[-12] -> 3670.3402777777756 | AD896: =RC[-12]*RC[-12] -> 8167.640625 | AE896: =RC[-11]/SQRT(RC[-6]*RC[-1]) -> 1 | AF896: =RC[-11]/SQRT(RC[-6]*RC[-2]) -> 1 | AG896: =RC[-11]/SQRT(RC[-6]*RC[-3]) -> -1 | AH896: =RC[-11]/SQRT(RC[-6]*RC[-4]) -> 1 | AI896: =RC[-11]/SQRT(RC[-6]*RC[-5]) -> 1
A897: 66790 | B897: 北京 | C897: 121 | D897: 轻度污染 | E897: 1.42 | F897: 9 | G897: 38 | H897: 57 | I897: 195 | J897: 220 | L897: 2013-06-28T03:00:00.000 | M897: =RC[-8]-R[21]C[-8] -> -0.91416666666666746 | N897: =RC[-8]-R[21]C[-8] -> -5.2083333333333339 | O897: =RC[-8]-R[21]C[-8] -> -12.666666666666664 | P897: =RC[-8]-R[21]C[-8] -> -9.2083333333333286 | Q897: =RC[-8]-R[21]C[-8] -> -88.583333333333314 | R897: =RC[-8]-R[21]C[-8] -> -66.375 | T897: =RC[-7]*RC[-2] -> 60.677812500000051 | U897: =RC[-7]*RC[-3] -> 345.70312500000006 | V897: =RC[-7]*RC[-4] -> 840.74999999999989 | W897: =RC[-7]*RC[-5] -> 611.20312499999966 | X897: =RC[-7]*RC[-6] -> 5879.7187499999991 | Y897: =RC[-12]*RC[-12] -> 0.83570069444444595 | Z897: =RC[-12]*RC[-12] -> 27.126736111111118 | AA897: =RC[-12]*RC[-12] -> 160.44444444444437 | AB897: =RC[-12]*RC[-12] -> 84.793402777777686 | AC897: =RC[-12]*RC[-12] -> 7847.0069444444407 | AD897: =RC[-12]*RC[-12] -> 4405.640625 | AE897: =RC[-11]/SQRT(RC[-6]*RC[-1]) -> 1 | AF897: =RC[-11]/SQRT(RC[-6]*RC[-2]) -> 1 | AG897: =RC[-11]/SQRT(RC[-6]*RC[-3]) -> 1.0000000000000002 | AH897: =RC[-11]/SQRT(RC[-6]*RC[-4]) -> 1 | AI897: =RC[-11]/SQRT(RC[-6]*RC[-5]) -> 1
A898: 66866 | B898: 北京 | C898: 129 | D898: 轻度污染 | E898: 1.26 | F898: 10 | G898: 35 | H898: 63 | I898: 139 | J898: 240 | L898: 2013-06-28T04:00:00.000 | M898: =RC[-8]-R[20]C[-8] -> -1.0741666666666674 | N898: =RC[-8]-R[20]C[-8] -> -4.2083333333333339 | O898: =RC[-8]-R[20]C[-8] -> -15.666666666666664 | P898: =RC[-8]-R[20]C[-8] -> -3.2083333333333286 | Q898: =RC[-8]-R[20]C[-8] -> -144.58333333333331 | R898: =RC[-8]-R[20]C[-8] -> -46.375 | T898: =RC[-7]*RC[-2] -> 49.8144791666667 | U898: =RC[-7]*RC[-3] -> 195.16145833333337 | V898: =RC[-7]*RC[-4] -> 726.54166666666652 | W898: =RC[-7]*RC[-5] -> 148.78645833333312 | X898: =RC[-7]*RC[-6] -> 6705.0520833333321 | Y898: =RC[-12]*RC[-12] -> 1.1538340277777792 | Z898: =RC[-12]*RC[-12] -> 17.71006944444445 | AA898: =RC[-12]*RC[-12] -> 245.44444444444437 | AB898: =RC[-12]*RC[-12] -> 10.293402777777747 | AC898: =RC[-12]*RC[-12] -> 20904.340277777774 | AD898: =RC[-12]*RC[-12] -> 2150.640625 | AE898: =RC[-11]/SQRT(RC[-6]*RC[-1]) -> 1 | AF898: =RC[-11]/SQRT(RC[-6]*RC[-2]) -> 1 | AG898: =RC[-11]/SQRT(RC[-6]*RC[-3]) -> 1 | AH898: =RC[-11]/SQRT(RC[-6]*RC[-4]) -> 1 | AI898: =RC[-11]/SQRT(RC[-6]*RC[-5]) -> 0.99999999999999989
A899: 66942 | B899: 北京 | C899: 141 | D899: 轻度污染 | E899: 1.39 | F899: 10 | G899: 36 | H899: 50 | I899: 216 | J899: 255 | L899: 2013-06-28T05:00:00.000 | M899: =RC[-8]-R[19]C[-8] -> -0.94416666666666749 | N899: =RC[-8]-R[19]C[-8] -> -4.2083333333333339 | O899: =RC[-8]-R[19]C[-8] -> -14.666666666666664 | P899: =RC[-8]-R[19]C[-8] -> -16.208333333333329 | Q899: =RC[-8]-R[19]C[-8] -> -67.583333333333314 | R899: =RC[-8]-R[19]C[-8] -> -31.375 | T899: =RC[-7]*RC[-2] -> 29.623229166666693 | U899: =RC[-7]*RC[-3] -> 132.03645833333334 | V899: =RC[-7]*RC[-4] -> 460.16666666666657 | W899: =RC[-7]*RC[-5] -> 508.5364583333332 | X899: =RC[-7]*RC[-6] -> 2120.4270833333326 | Y899: =RC[-12]*RC[-12] -> 0.89145069444444602 | Z899: =RC[-12]*RC[-12] -> 17.71006944444445 | AA899: =RC[-12]*RC[-12] -> 215.11111111111103 | AB899: =RC[-12]*RC[-12] -> 262.71006944444429 | AC899: =RC[-12]*RC[-12] -> 4567.5069444444416 | AD899: =RC[-12]*RC[-12] -> 984.390625 | AE899: =RC[-11]/SQRT(RC[-6]*RC[-1]) -> 1 | AF899: =RC[-11]/SQRT(RC[-6]*RC[-2]) -> 1 | AG899: =RC[-11]/SQRT(RC[-6]*RC[-3]) -> 1 | AH899: =RC[-11]/SQRT(RC[-6]*RC[-4]) -> 1 | AI899: =RC[-11]/SQRT(RC[-6]*RC[-5]) -> 1
A900: 67018 | B900: 北京 | C900: 152 | D900: 中度污染 | E900: 1.87 | F900: 14 | G900: 40 | H900: 41 | I900: 248 | J900: 265 | L900: 2013-06-28T06:00:00.000 | M900: =RC[-8]-R[18]C[-8] -> -0.46416666666666728 | N900: =RC[-8]-R[18]C[-8] -> -0.20833333333333393 | O900: =RC[-8]-R[18]C[-8] -> -10.666666666666664 | P900: =RC[-8]-R[18]C[-8] -> -25.208333333333329 | Q900: =RC[-8]-R[18]C[-8] -> -35.583333333333314 | R900: =RC[-8]-R[18]C[-8] -> -21.375 | T900: =RC[-7]*RC[-2] -> 9.9215625000000127 | U900: =RC[-7]*RC[-3] -> 4.4531250000000124 | V900: =RC[-7]*RC[-4] -> 227.99999999999994 | W900: =RC[-7]*RC[-5] -> 538.82812499999989 | X900: =RC[-7]*RC[-6] -> 760.59374999999955 | Y900: =RC[-12]*RC[-12] -> 0.21545069444444501 | Z900: =RC[-12]*RC[-12] -> 4.3402777777778026E-2 | AA900: =RC[-12]*RC[-12] -> 113.77777777777773 | AB900: =RC[-12]*RC[-12] -> 635.46006944444423 | AC900: =RC[-12]*RC[-12] -> 1266.1736111111097 | AD900: =RC[-12]*RC[-12] -> 456.890625 | AE900: =RC[-11]/SQRT(RC[-6]*RC[-1]) -> 1 | AF900: =RC[-11]/SQRT(RC[-6]*RC[-2]) -> 1 | AG900: =RC[-11]/SQRT(RC[-6]*RC[-3]) -> 1 | AH900: =RC[-11]/SQRT(RC[-6]*RC[-4]) -> 1 | AI900: =RC[-11]/SQRT(RC[-6]*RC[-5]) -> 0.99999999999999989
A901: 67094 | B901: 北京 | C901: 163 | D901: 中度污染 | E901: 2.58 | F901: 19 | G901: 51 | H901: 29 | I901: 134 | J901: 265 | L901: 2013-06-28T07:00:00.000 | M901: =RC[-8]-R[17]C[-8] -> 0.24583333333333268 | N901: =RC[-8]-R[17]C[-8] -> 4.7916666666666661 | O901: =RC[-8]-R[17]C[-8] -> 0.3333333333333357 | P901: =RC[-8]-R[17]C[-8] -> -37.208333333333329 | Q901: =RC[-8]-R[17]C[-8] -> -149.58333333333331 | R901: =RC[-8]-R[17]C[-8] -> -21.375 | T901: =RC[-7]*RC[-2] -> -5.254687499999986 | U901: =RC[-7]*RC[-3] -> -102.42187499999999 | V901: =RC[-7]*RC[-4] -> -7.1250000000000506 | W901: =RC[-7]*RC[-5] -> 795.32812499999989 | X901: =RC[-7]*RC[-6] -> 3197.3437499999995 | Y901: =RC[-12]*RC[-12] -> 6.0434027777777455E-2 | Z901: =RC[-12]*RC[-12] -> 22.960069444444439 | AA901: =RC[-12]*RC[-12] -> 0.11111111111111269 | AB901: =RC[-12]*RC[-12] -> 1384.4600694444441 | AC901: =RC[-12]*RC[-12] -> 22375.173611111106 | AD901: =RC[-12]*RC[-12] -> 456.890625 | AE901: =RC[-11]/SQRT(RC[-6]*RC[-1]) -> -1 | AF901: =RC[-11]/SQRT(RC[-6]*RC[-2]) -> -1 | AG901: =RC[-11]/SQRT(RC[-6]*RC[-3]) -> -1 | AH901: =RC[-11]/SQRT(RC[-6]*RC[-4]) -> 1 | AI901: =RC[-11]/SQRT(RC[-6]*RC[-5]) -> 1
A902: 67170 | B902: 北京 | C902: 172 | D902: 中度污染 | E902: 2.79 | F902: 19 | G902: 53 | H902: 29 | I902: 158 | J902: 271 | L902: 2013-06-28T08:00:00.000 | M902: =RC[-8]-R[16]C[-8] -> 0.45583333333333265 | N902: =RC[-8]-R[16]C[-8] -> 4.7916666666666661 | O902: =RC[-8]-R[16]C[-8] -> 2.3333333333333357 | P902: =RC[-8]-R[16]C[-8] -> -37.208333333333329 | Q902: =RC[-8]-R[16]C[-8] -> -125.58333333333331 | R902: =RC[-8]-R[16]C[-8] -> -15.375 | T902: =RC[-7]*RC[-2] -> -7.0084374999999897 | U902: =RC[-7]*RC[-3] -> -73.671874999999986 | V902: =RC[-7]*RC[-4] -> -35.875000000000036 | W902: =RC[-7]*RC[-5] -> 572.07812499999989 | X902: =RC[-7]*RC[-6] -> 1930.8437499999998 | Y902: =RC[-12]*RC[-12] -> 0.20778402777777716 | Z902: =RC[-12]*RC[-12] -> 22.960069444444439 | AA902: =RC[-12]*RC[-12] -> 5.4444444444444553 | AB902: =RC[-12]*RC[-12] -> 1384.4600694444441 | AC902: =RC[-12]*RC[-12] -> 15771.173611111106 | AD902: =RC[-12]*RC[-12] -> 236.390625 | AE902: =RC[-11]/SQRT(RC[-6]*RC[-1]) -> -1 | AF902: =RC[-11]/SQRT(RC[-6]*RC[-2]) -> -0.99999999999999978 | AG902: =RC[-11]/SQRT(RC[-6]*RC[-3]) -> -1 | AH902: =RC[-11]/SQRT(RC[-6]*RC[-4]) -> 0.99999999999999978 | AI902: =RC[-11]/SQRT(RC[-6]*RC[-5]) -> 1.0000000000000002
A903: 67246 | B903: 北京 | C903: 179 | D903: 中度污染 | E903: 2.81 | F903: 18 | G903: 50 | H903: 35 | I903: 194 | J903: 272 | L903: 2013-06-28T09:00:00.000 | M903: =RC[-8]-R[15]C[-8] -> 0.47583333333333266 | N903: =RC[-8]-R[15]C[-8] -> 3.7916666666666661 | O903: =RC[-8]-R[15]C[-8] -> -0.6666666666666643 | P903: =RC[-8]-R[15]C[-8] -> -31.208333333333329 | Q903: =RC[-8]-R[15]C[-8] -> -89.583333333333314 | R903: =RC[-8]-R[15]C[-8] -> -14.375 | T903: =RC[-7]*RC[-2] -> -6.8401041666666567 | U903: =RC[-7]*RC[-3] -> -54.505208333333321 | V903: =RC[-7]*RC[-4] -> 9.5833333333333002 | W903: =RC[-7]*RC[-5] -> 448.61979166666657 | X903: =RC[-7]*RC[-6] -> 1287.7604166666663 | Y903: =RC[-12]*RC[-12] -> 0.22641736111111047 | Z903: =RC[-12]*RC[-12] -> 14.376736111111107 | AA903: =RC[-12]*RC[-12] -> 0.44444444444444131 | AB903: =RC[-12]*RC[-12] -> 973.96006944444412 | AC903: =RC[-12]*RC[-12] -> 8025.1736111111077 | AD903: =RC[-12]*RC[-12] -> 206.640625 | AE903: =RC[-11]/SQRT(RC[-6]*RC[-1]) -> -1 | AF903: =RC[-11]/SQRT(RC[-6]*RC[-2]) -> -1 | AG903: =RC[-11]/SQRT(RC[-6]*RC[-3]) -> 1 | AH903: =RC[-11]/SQRT(RC[-6]*RC[-4]) -> 0.99999999999999989 | AI903: =RC[-11]/SQRT(RC[-6]*RC[-5]) -> 0.99999999999999978
A904: 67322 | B904: 北京 | C904: 184 | D904: 中度污染 | E904: 2.84 | F904: 19 | G904: 49 | H904: 40 | I904: 234 | J904: 267 | L904: 2013-06-28T10:00:00.000 | M904: =RC[-8]-R[14]C[-8] -> 0.50583333333333247 | N904: =RC[-8]-R[14]C[-8] -> 4.7916666666666661 | O904: =RC[-8]-R[14]C[-8] -> -1.6666666666666643 | P904: =RC[-8]-R[14]C[-8] -> -26.208333333333329 | Q904: =RC[-8]-R[14]C[-8] -> -49.583333333333314 | R904: =RC[-8]-R[14]C[-8] -> -19.375 | T904: =RC[-7]*RC[-2] -> -9.8005208333333158 | U904: =RC[-7]*RC[-3] -> -92.838541666666657 | V904: =RC[-7]*RC[-4] -> 32.291666666666622 | W904: =RC[-7]*RC[-5] -> 507.78645833333326 | X904: =RC[-7]*RC[-6] -> 960.67708333333292 | Y904: =RC[-12]*RC[-12] -> 0.25586736111111025 | Z904: =RC[-12]*RC[-12] -> 22.960069444444439 | AA904: =RC[-12]*RC[-12] -> 2.7777777777777697 | AB904: =RC[-12]*RC[-12] -> 686.87673611111086 | AC904: =RC[-12]*RC[-12] -> 2458.5069444444425 | AD904: =RC[-12]*RC[-12] -> 375.390625 | AE904: =RC[-11]/SQRT(RC[-6]*RC[-1]) -> -0.99999999999999978 | AF904: =RC[-11]/SQRT(RC[-6]*RC[-2]) -> -1 | AG904: =RC[-11]/SQRT(RC[-6]*RC[-3]) -> 1 | AH904: =RC[-11]/SQRT(RC[-6]*RC[-4]) -> 1 | AI904: =RC[-11]/SQRT(RC[-6]*RC[-5]) -> 1
A905: 67398 | B905: 北京 | C905: 191 | D905: 中度污染 | E905: 2.94 | F905: 20 | G905: 51 | H905: 42 | I905: 261 | J905: 272 | L905: 2013-06-28T11:00:00.000 | M905: =RC[-8]-R[13]C[-8] -> 0.60583333333333256 | N905: =RC[-8]-R[13]C[-8] -> 5.7916666666666661 | O905: =RC[-8]-R[13]C[-8] -> 0.3333333333333357 | P905: =RC[-8]-R[13]C[-8] -> -24.208333333333329 | Q905: =RC[-8]-R[13]C[-8] -> -22.583333333333314 | R905: =RC[-8]-R[13]C[-8] -> -14.375 | T905: =RC[-7]*RC[-2] -> -8.7088541666666561 | U905: =RC[-7]*RC[-3] -> -83.255208333333329 | V905: =RC[-7]*RC[-4] -> -4.7916666666667007 | W905: =RC[-7]*RC[-5] -> 347.99479166666657 | X905: =RC[-7]*RC[-6] -> 324.6354166666664 | Y905: =RC[-12]*RC[-12] -> 0.36703402777777683 | Z905: =RC[-12]*RC[-12] -> 33.543402777777771 | AA905: =RC[-12]*RC[-12] -> 0.11111111111111269 | AB905: =RC[-12]*RC[-12] -> 586.0434027777776 | AC905: =RC[-12]*RC[-12] -> 510.0069444444436 | AD905: =RC[-12]*RC[-12] -> 206.640625 | AE905: =RC[-11]/SQRT(RC[-6]*RC[-1]) -> -1 | AF905: =RC[-11]/SQRT(RC[-6]*RC[-2]) -> -1 | AG905: =RC[-11]/SQRT(RC[-6]*RC[-3]) -> -1 | AH905: =RC[-11]/SQRT(RC[-6]*RC[-4]) -> 0.99999999999999989 | AI905: =RC[-11]/SQRT(RC[-6]*RC[-5]) -> 1
A906: 67474 | B906: 北京 | C906: 201 | D906: 重度污染 | E906: 2.99 | F906: 20 | G906: 51 | H906: 50 | I906: 332 | J906: 282 | L906: 2013-06-28T12:00:00.000 | M906: =RC[-8]-R[12]C[-8] -> 0.65583333333333282 | N906: =RC[-8]-R[12]C[-8] -> 5.7916666666666661 | O906: =RC[-8]-R[12]C[-8] -> 0.3333333333333357 | P906: =RC[-8]-R[12]C[-8] -> -16.208333333333329 | Q906: =RC[-8]-R[12]C[-8] -> 48.416666666666686 | R906: =RC[-8]-R[12]C[-8] -> -4.375 | T906: =RC[-7]*RC[-2] -> -2.869270833333331 | U906: =RC[-7]*RC[-3] -> -25.338541666666664 | V906: =RC[-7]*RC[-4] -> -1.4583333333333437 | W906: =RC[-7]*RC[-5] -> 70.911458333333314 | X906: =RC[-7]*RC[-6] -> -211.82291666666674 | Y906: =RC[-12]*RC[-12] -> 0.43011736111111043 | Z906: =RC[-12]*RC[-12] -> 33.543402777777771 | AA906: =RC[-12]*RC[-12] -> 0.11111111111111269 | AB906: =RC[-12]*RC[-12] -> 262.71006944444429 | AC906: =RC[-12]*RC[-12] -> 2344.1736111111131 | AD906: =RC[-12]*RC[-12] -> 19.140625 | AE906: =RC[-11]/SQRT(RC[-6]*RC[-1]) -> -1 | AF906: =RC[-11]/SQRT(RC[-6]*RC[-2]) -> -1 | AG906: =RC[-11]/SQRT(RC[-6]*RC[-3]) -> -1 | AH906: =RC[-11]/SQRT(RC[-6]*RC[-4]) -> 1 | AI906: =RC[-11]/SQRT(RC[-6]*RC[-5]) -> -0.99999999999999989
A907: 67550 | B907: 北京 | C907: 212 | D907: 重度污染 | E907: 2.85 | F907: 20 | G907: 48 | H907: 72 | I907: 338 | J907: 281 | L907: 2013-06-28T13:00:00.000 | M907: =RC[-8]-R[11]C[-8] -> 0.5158333333333327 | N907: =RC[-8]-R[11]C[-8] -> 5.7916666666666661 | O907: =RC[-8]-R[11]C[-8] -> -2.6666666666666643 | P907: =RC[-8]-R[11]C[-8] -> 5.7916666666666714 | Q907: =RC[-8]-R[11]C[-8] -> 54.416666666666686 | R907: =RC[-8]-R[11]C[-8] -> -5.375 | T907: =RC[-7]*RC[-2] -> -2.7726041666666634 | U907: =RC[-7]*RC[-3] -> -31.130208333333329 | V907: =RC[-7]*RC[-4] -> 14.333333333333321 | W907: =RC[-7]*RC[-5] -> -31.130208333333357 | X907: =RC[-7]*RC[-6] -> -292.48958333333343 | Y907: =RC[-12]*RC[-12] -> 0.26608402777777712 | Z907: =RC[-12]*RC[-12] -> 33.543402777777771 | AA907: =RC[-12]*RC[-12] -> 7.1111111111110983 | AB907: =RC[-12]*RC[-12] -> 33.543402777777835 | AC907: =RC[-12]*RC[-12] -> 2961.1736111111131 | AD907: =RC[-12]*RC[-12] -> 28.890625 | AE907: =RC[-11]/SQRT(RC[-6]*RC[-1]) -> -1 | AF907: =RC[-11]/SQRT(RC[-6]*RC[-2]) -> -0.99999999999999989 | AG907: =RC[-11]/SQRT(RC[-6]*RC[-3]) -> 1 | AH907: =RC[-11]/SQRT(RC[-6]*RC[-4]) -> -0.99999999999999989 | AI907: =RC[-11]/SQRT(RC[-6]*RC[-5]) -> -1
A908: 67626 | B908: 北京 | C908: 229 | D908: 重度污染 | E908: 2.57 | F908: 17 | G908: 45 | H908: 100 | I908: 333 | J908: 281 | L908: 2013-06-28T14:00:00.000 | M908: =RC[-8]-R[10]C[-8] -> 0.23583333333333245 | N908: =RC[-8]-R[10]C[-8] -> 2.7916666666666661 | O908: =RC[-8]-R[10]C[-8] -> -5.6666666666666643 | P908: =RC[-8]-R[10]C[-8] -> 33.791666666666671 | Q908: =RC[-8]-R[10]C[-8] -> 49.416666666666686 | R908: =RC[-8]-R[10]C[-8] -> -5.375 | T908: =RC[-7]*RC[-2] -> -1.267604166666662 | U908: =RC[-7]*RC[-3] -> -15.00520833333333 | V908: =RC[-7]*RC[-4] -> 30.458333333333321 | W908: =RC[-7]*RC[-5] -> -181.63020833333337 | X908: =RC[-7]*RC[-6] -> -265.61458333333343 | Y908: =RC[-12]*RC[-12] -> 5.5617361111110694E-2 | Z908: =RC[-12]*RC[-12] -> 7.7934027777777741 | AA908: =RC[-12]*RC[-12] -> 32.111111111111086 | AB908: =RC[-12]*RC[-12] -> 1141.8767361111115 | AC908: =RC[-12]*RC[-12] -> 2442.0069444444462 | AD908: =RC[-12]*RC[-12] -> 28.890625 | AE908: =RC[-11]/SQRT(RC[-6]*RC[-1]) -> -1 | AF908: =RC[-11]/SQRT(RC[-6]*RC[-2]) -> -1 | AG908: =RC[-11]/SQRT(RC[-6]*RC[-3]) -> 1 | AH908: =RC[-11]/SQRT(RC[-6]*RC[-4]) -> -1 | AI908: =RC[-11]/SQRT(RC[-6]*RC[-5]) -> -1
A909: 67702 | B909: 北京 | C909: 241 | D909: 重度污染 | E909: 2.67 | F909: 13 | G909: 47 | H909: 99 | I909: 398 | J909: 342 | L909: 2013-06-28T15:00:00.000 | M909: =RC[-8]-R[9]C[-8] -> 0.33583333333333254 | N909: =RC[-8]-R[9]C[-8] -> -1.2083333333333339 | O909: =RC[-8]-R[9]C[-8] -> -3.6666666666666643 | P909: =RC[-8]-R[9]C[-8] -> 32.791666666666671 | Q909: =RC[-8]-R[9]C[-8] -> 114.41666666666669 | R909: =RC[-8]-R[9]C[-8] -> 55.625 | T909: =RC[-7]*RC[-2] -> 18.680729166666623 | U909: =RC[-7]*RC[-3] -> -67.2135416666667 | V909: =RC[-7]*RC[-4] -> -203.9583333333332 | W909: =RC[-7]*RC[-5] -> 1824.0364583333335 | X909: =RC[-7]*RC[-6] -> 6364.4270833333339 | Y909: =RC[-12]*RC[-12] -> 0.11278402777777724 | Z909: =RC[-12]*RC[-12] -> 1.460069444444446 | AA909: =RC[-12]*RC[-12] -> 13.444444444444427 | AB909: =RC[-12]*RC[-12] -> 1075.2934027777781 | AC909: =RC[-12]*RC[-12] -> 13091.173611111115 | AD909: =RC[-12]*RC[-12] -> 3094.140625 | AE909: =RC[-11]/SQRT(RC[-6]*RC[-1]) -> 1 | AF909: =RC[-11]/SQRT(RC[-6]*RC[-2]) -> -1 | AG909: =RC[-11]/SQRT(RC[-6]*RC[-3]) -> -1 | AH909: =RC[-11]/SQRT(RC[-6]*RC[-4]) -> 0.99999999999999989 | AI909: =RC[-11]/SQRT(RC[-6]*RC[-5]) -> 1
A910: 67778 | B910: 北京 | C910: 257 | D910: 重度污染 | E910: 2.84 | F910: 14 | G910: 50 | H910: 106 | I910: 475 | J910: 405 | L910: 2013-06-28T16:00:00.000 | M910: =RC[-8]-R[8]C[-8] -> 0.50583333333333247 | N910: =RC[-8]-R[8]C[-8] -> -0.20833333333333393 | O910: =RC[-8]-R[8]C[-8] -> -0.6666666666666643 | P910: =RC[-8]-R[8]C[-8] -> 39.791666666666671 | Q910: =RC[-8]-R[8]C[-8] -> 191.41666666666669 | R910: =RC[-8]-R[8]C[-8] -> 118.625 | T910: =RC[-7]*RC[-2] -> 60.004479166666563 | U910: =RC[-7]*RC[-3] -> -24.713541666666735 | V910: =RC[-7]*RC[-4] -> -79.083333333333059 | W910: =RC[-7]*RC[-5] -> 4720.2864583333339 | X910: =RC[-7]*RC[-6] -> 22706.802083333336 | Y910: =RC[-12]*RC[-12] -> 0.25586736111111025 | Z910: =RC[-12]*RC[-12] -> 4.3402777777778026E-2 | AA910: =RC[-12]*RC[-12] -> 0.44444444444444131 | AB910: =RC[-12]*RC[-12] -> 1583.3767361111115 | AC910: =RC[-12]*RC[-12] -> 36640.340277777788 | AD910: =RC[-12]*RC[-12] -> 14071.890625 | AE910: =RC[-11]/SQRT(RC[-6]*RC[-1]) -> 1 | AF910: =RC[-11]/SQRT(RC[-6]*RC[-2]) -> -0.99999999999999989 | AG910: =RC[-11]/SQRT(RC[-6]*RC[-3]) -> -1 | AH910: =RC[-11]/SQRT(RC[-6]*RC[-4]) -> 1 | AI910: =RC[-11]/SQRT(RC[-6]*RC[-5]) -> 1
A911: 67854 | B911: 北京 | C911: 273 | D911: 重度污染 | E911: 2.95 | F911: 15 | G911: 53 | H911: 113 | I911: 453 | J911: 446 | L911: 2013-06-28T17:00:00.000 | M911: =RC[-8]-R[7]C[-8] -> 0.61583333333333279 | N911: =RC[-8]-R[7]C[-8] -> 0.79166666666666607 | O911: =RC[-8]-R[7]C[-8] -> 2.3333333333333357 | P911: =RC[-8]-R[7]C[-8] -> 46.791666666666671 | Q911: =RC[-8]-R[7]C[-8] -> 169.41666666666669 | R911: =RC[-8]-R[7]C[-8] -> 159.625 | T911: =RC[-7]*RC[-2] -> 98.30239583333325 | U911: =RC[-7]*RC[-3] -> 126.36979166666657 | V911: =RC[-7]*RC[-4] -> 372.45833333333371 | W911: =RC[-7]*RC[-5] -> 7469.119791666667 | X911: =RC[-7]*RC[-6] -> 27043.135416666668 | Y911: =RC[-12]*RC[-12] -> 0.37925069444444376 | Z911: =RC[-12]*RC[-12] -> 0.62673611111111016 | AA911: =RC[-12]*RC[-12] -> 5.4444444444444553 | AB911: =RC[-12]*RC[-12] -> 2189.4600694444448 | AC911: =RC[-12]*RC[-12] -> 28702.006944444453 | AD911: =RC[-12]*RC[-12] -> 25480.140625 | AE911: =RC[-11]/SQRT(RC[-6]*RC[-1]) -> 1 | AF911: =RC[-11]/SQRT(RC[-6]*RC[-2]) -> 1 | AG911: =RC[-11]/SQRT(RC[-6]*RC[-3]) -> 1 | AH911: =RC[-11]/SQRT(RC[-6]*RC[-4]) -> 1 | AI911: =RC[-11]/SQRT(RC[-6]*RC[-5]) -> 0.99999999999999989
A912: 67930 | B912: 北京 | C912: 288 | D912: 重度污染 | E912: 3.16 | F912: 15 | G912: 56 | H912: 101 | I912: 458 | J912: 453 | L912: 2013-06-28T18:00:00.000 | M912: =RC[-8]-R[6]C[-8] -> 0.82583333333333275 | N912: =RC[-8]-R[6]C[-8] -> 0.79166666666666607 | O912: =RC[-8]-R[6]C[-8] -> 5.3333333333333357 | P912: =RC[-8]-R[6]C[-8] -> 34.791666666666671 | Q912: =RC[-8]-R[6]C[-8] -> 174.41666666666669 | R912: =RC[-8]-R[6]C[-8] -> 166.625 | T912: =RC[-7]*RC[-2] -> 137.60447916666658 | U912: =RC[-7]*RC[-3] -> 131.91145833333323 | V912: =RC[-7]*RC[-4] -> 888.66666666666708 | W912: =RC[-7]*RC[-5] -> 5797.1614583333339 | X912: =RC[-7]*RC[-6] -> 29062.177083333336 | Y912: =RC[-12]*RC[-12] -> 0.68200069444444344 | Z912: =RC[-12]*RC[-12] -> 0.62673611111111016 | AA912: =RC[-12]*RC[-12] -> 28.444444444444471 | AB912: =RC[-12]*RC[-12] -> 1210.4600694444448 | AC912: =RC[-12]*RC[-12] -> 30421.173611111117 | AD912: =RC[-12]*RC[-12] -> 27763.890625 | AE912: =RC[-11]/SQRT(RC[-6]*RC[-1]) -> 1 | AF912: =RC[-11]/SQRT(RC[-6]*RC[-2]) -> 1 | AG912: =RC[-11]/SQRT(RC[-6]*RC[-3]) -> 1 | AH912: =RC[-11]/SQRT(RC[-6]*RC[-4]) -> 1 | AI912: =RC[-11]/SQRT(RC[-6]*RC[-5]) -> 1
A913: 68006 | B913: 北京 | C913: 304 | D913: 严重污染 | E913: 3.2 | F913: 13 | G913: 64 | H913: 84 | I913: 505 | J913: 464 | L913: 2013-06-28T19:00:00.000 | M913: =RC[-8]-R[5]C[-8] -> 0.86583333333333279 | N913: =RC[-8]-R[5]C[-8] -> -1.2083333333333339 | O913: =RC[-8]-R[5]C[-8] -> 13.333333333333336 | P913: =RC[-8]-R[5]C[-8] -> 17.791666666666671 | Q913: =RC[-8]-R[5]C[-8] -> 221.41666666666669 | R913: =RC[-8]-R[5]C[-8] -> 177.625 | T913: =RC[-7]*RC[-2] -> 153.79364583333324 | U913: =RC[-7]*RC[-3] -> -214.63020833333343 | V913: =RC[-7]*RC[-4] -> 2368.3333333333339 | W913: =RC[-7]*RC[-5] -> 3160.2447916666674 | X913: =RC[-7]*RC[-6] -> 39329.135416666672 | Y913: =RC[-12]*RC[-12] -> 0.74966736111111021 | Z913: =RC[-12]*RC[-12] -> 1.460069444444446 | AA913: =RC[-12]*RC[-12] -> 177.77777777777783 | AB913: =RC[-12]*RC[-12] -> 316.54340277777794 | AC913: =RC[-12]*RC[-12] -> 49025.340277777788 | AD913: =RC[-12]*RC[-12] -> 31550.640625 | AE913: =RC[-11]/SQRT(RC[-6]*RC[-1]) -> 1 | AF913: =RC[-11]/SQRT(RC[-6]*RC[-2]) -> -0.99999999999999989 | AG913: =RC[-11]/SQRT(RC[-6]*RC[-3]) -> 1.0000000000000002 | AH913: =RC[-11]/SQRT(RC[-6]*RC[-4]) -> 1 | AI913: =RC[-11]/SQRT(RC[-6]*RC[-5]) -> 1
A914: 68082 | B914: 北京 | C914: 319 | D914: 严重污染 | E914: 3.18 | F914: 14 | G914: 63 | H914: 69 | I914: 383 | J914: 461 | L914: 2013-06-28T20:00:00.000 | M914: =RC[-8]-R[4]C[-8] -> 0.84583333333333277 | N914: =RC[-8]-R[4]C[-8] -> -0.20833333333333393 | O914: =RC[-8]-R[4]C[-8] -> 12.333333333333336 | P914: =RC[-8]-R[4]C[-8] -> 2.7916666666666714 | Q914: =RC[-8]-R[4]C[-8] -> 99.416666666666686 | R914: =RC[-8]-R[4]C[-8] -> 174.625 | T914: =RC[-7]*RC[-2] -> 147.70364583333324 | U914: =RC[-7]*RC[-3] -> -36.380208333333435 | V914: =RC[-7]*RC[-4] -> 2153.7083333333339 | W914: =RC[-7]*RC[-5] -> 487.49479166666748 | X914: =RC[-7]*RC[-6] -> 17360.635416666672 | Y914: =RC[-12]*RC[-12] -> 0.71543402777777687 | Z914: =RC[-12]*RC[-12] -> 4.3402777777778026E-2 | AA914: =RC[-12]*RC[-12] -> 152.11111111111117 | AB914: =RC[-12]*RC[-12] -> 7.7934027777778043 | AC914: =RC[-12]*RC[-12] -> 9883.673611111115 | AD914: =RC[-12]*RC[-12] -> 30493.890625 | AE914: =RC[-11]/SQRT(RC[-6]*RC[-1]) -> 1 | AF914: =RC[-11]/SQRT(RC[-6]*RC[-2]) -> -1 | AG914: =RC[-11]/SQRT(RC[-6]*RC[-3]) -> 1.0000000000000002 | AH914: =RC[-11]/SQRT(RC[-6]*RC[-4]) -> 1 | AI914: =RC[-11]/SQRT(RC[-6]*RC[-5]) -> 1.0000000000000002
A915: 68158 | B915: 北京 | C915: 333 | D915: 严重污染 | E915: 3.1 | F915: 16 | G915: 62 | H915: 56 | I915: 391 | J915: 433 | L915: 2013-06-28T21:00:00.000 | M915: =RC[-8]-R[3]C[-8] -> 0.7658333333333327 | N915: =RC[-8]-R[3]C[-8] -> 1.7916666666666661 | O915: =RC[-8]-R[3]C[-8] -> 11.333333333333336 | P915: =RC[-8]-R[3]C[-8] -> -10.208333333333329 | Q915: =RC[-8]-R[3]C[-8] -> 107.41666666666669 | R915: =RC[-8]-R[3]C[-8] -> 146.625 | T915: =RC[-7]*RC[-2] -> 112.29031249999991 | U915: =RC[-7]*RC[-3] -> 262.70312499999989 | V915: =RC[-7]*RC[-4] -> 1661.7500000000005 | W915: =RC[-7]*RC[-5] -> -1496.7968749999993 | X915: =RC[-7]*RC[-6] -> 15749.968750000004 | Y915: =RC[-12]*RC[-12] -> 0.58650069444444353 | Z915: =RC[-12]*RC[-12] -> 3.2100694444444424 | AA915: =RC[-12]*RC[-12] -> 128.44444444444449 | AB915: =RC[-12]*RC[-12] -> 104.21006944444434 | AC915: =RC[-12]*RC[-12] -> 11538.340277777781 | AD915: =RC[-12]*RC[-12] -> 21498.890625 | AE915: =RC[-11]/SQRT(RC[-6]*RC[-1]) -> 1 | AF915: =RC[-11]/SQRT(RC[-6]*RC[-2]) -> 0.99999999999999978 | AG915: =RC[-11]/SQRT(RC[-6]*RC[-3]) -> 1.0000000000000002 | AH915: =RC[-11]/SQRT(RC[-6]*RC[-4]) -> -1 | AI915: =RC[-11]/SQRT(RC[-6]*RC[-5]) -> 1.0000000000000002
A916: 68234 | B916: 北京 | C916: 342 | D916: 严重污染 | E916: 1.92 | F916: 13 | G916: 44 | H916: 91 | I916: 230 | J916: 265 | L916: 2013-06-28T22:00:00.000 | M916: =RC[-8]-R[2]C[-8] -> -0.41416666666666746 | N916: =RC[-8]-R[2]C[-8] -> -1.2083333333333339 | O916: =RC[-8]-R[2]C[-8] -> -6.6666666666666643 | P916: =RC[-8]-R[2]C[-8] -> 24.791666666666671 | Q916: =RC[-8]-R[2]C[-8] -> -53.583333333333314 | R916: =RC[-8]-R[2]C[-8] -> -21.375 | T916: =RC[-7]*RC[-2] -> 8.8528125000000166 | U916: =RC[-7]*RC[-3] -> 25.828125000000014 | V916: =RC[-7]*RC[-4] -> 142.49999999999994 | W916: =RC[-7]*RC[-5] -> -529.92187500000011 | X916: =RC[-7]*RC[-6] -> 1145.3437499999995 | Y916: =RC[-12]*RC[-12] -> 0.17153402777777843 | Z916: =RC[-12]*RC[-12] -> 1.460069444444446 | AA916: =RC[-12]*RC[-12] -> 44.444444444444414 | AB916: =RC[-12]*RC[-12] -> 614.62673611111131 | AC916: =RC[-12]*RC[-12] -> 2871.173611111109 | AD916: =RC[-12]*RC[-12] -> 456.890625 | AE916: =RC[-11]/SQRT(RC[-6]*RC[-1]) -> 1 | AF916: =RC[-11]/SQRT(RC[-6]*RC[-2]) -> 1 | AG916: =RC[-11]/SQRT(RC[-6]*RC[-3]) -> 1 | AH916: =RC[-11]/SQRT(RC[-6]*RC[-4]) -> -1 | AI916: =RC[-11]/SQRT(RC[-6]*RC[-5]) -> 1
A917: 68310 | B917: 北京 | C917: 339 | D917: 严重污染 | E917: 0.71 | F917: 4 | G917: 24 | H917: 119 | I917: 100 | J917: 29 | L917: 2013-06-28T23:00:00.000 | M917: =RC[-8]-R[1]C[-8] -> -1.6241666666666674 | N917: =RC[-8]-R[1]C[-8] -> -10.208333333333334 | O917: =RC[-8]-R[1]C[-8] -> -26.666666666666664 | P917: =RC[-8]-R[1]C[-8] -> 52.791666666666671 | Q917: =RC[-8]-R[1]C[-8] -> -183.58333333333331 | R917: =RC[-8]-R[1]C[-8] -> -257.375 | T917: =RC[-7]*RC[-2] -> 418.01989583333352 | U917: =RC[-7]*RC[-3] -> 2627.369791666667 | V917: =RC[-7]*RC[-4] -> 6863.333333333333 | W917: =RC[-7]*RC[-5] -> -13587.255208333334 | X917: =RC[-7]*RC[-6] -> 47249.760416666664 | Y917: =RC[-12]*RC[-12] -> 2.6379173611111137 | Z917: =RC[-12]*RC[-12] -> 104.21006944444446 | AA917: =RC[-12]*RC[-12] -> 711.11111111111097 | AB917: =RC[-12]*RC[-12] -> 2786.9600694444448 | AC917: =RC[-12]*RC[-12] -> 33702.840277777774 | AD917: =RC[-12]*RC[-12] -> 66241.890625 | AE917: =RC[-11]/SQRT(RC[-6]*RC[-1]) -> 1 | AF917: =RC[-11]/SQRT(RC[-6]*RC[-2]) -> 1 | AG917: =RC[-11]/SQRT(RC[-6]*RC[-3]) -> 1.0000000000000002 | AH917: =RC[-11]/SQRT(RC[-6]*RC[-4]) -> -1 | AI917: =RC[-11]/SQRT(RC[-6]*RC[-5]) -> 1
E918: =AVERAGE(R[-24]C:R[-1]C) -> 2.3341666666666674 | F918: =AVERAGE(R[-24]C:R[-1]C) -> 14.208333333333334 | G918: =AVERAGE(R[-24]C:R[-1]C) -> 50.666666666666664 | H918: =AVERAGE(R[-24]C:R[-1]C) -> 66.208333333333329 | I918: =AVERAGE(R[-24]C:R[-1]C) -> 283.58333333333331 | J918: =AVERAGE(R[-24]C:R[-1]C) -> 286.375 | M918: =RC[-8]-RC[-8] -> 0 | N918: =RC[-8]-RC[-8] -> 0 | O918: =RC[-8]-RC[-8] -> 0 | P918: =RC[-8]-RC[-8] -> 0 | Q918: =RC[-8]-RC[-8] -> 0 | R918: =RC[-8]-RC[-8] -> 0 | T918: =SUM(R[-24]C:R[-1]C) -> 1729.7325000000003 | U918: =SUM(R[-24]C:R[-1]C) -> 5147.125 | V918: =SUM(R[-24]C:R[-1]C) -> 6506.9999999999991 | W918: =SUM(R[-24]C:R[-1]C) -> 21187.124999999993 | X918: =SUM(R[-24]C:R[-1]C) -> 264659.75000000006 | Y918: =SUM(R[-24]C:R[-1]C) -> 14.321183333333337 | Z918: =SUM(R[-24]C:R[-1]C) -> 429.95833333333331 | AA918: =SUM(R[-24]C:R[-1]C) -> 3505.333333333333 | AB918: =SUM(R[-24]C:R[-1]C) -> 18417.958333333332 | AC918: =SUM(R[-24]C:R[-1]C) -> 327917.83333333337 | AD918: =SUM(R[-24]C:R[-1]C) -> 305619.625 | AE918: =RC[-11]/SQRT(RC[-6]*RC[-1]) -> 0.82679696548188075 | AF918: =RC[-11]/SQRT(RC[-6]*RC[-2]) -> 0.44901506336457564 | AG918: =RC[-11]/SQRT(RC[-6]*RC[-3]) -> 0.19880418669088259 | AH918: =RC[-11]/SQRT(RC[-6]*RC[-4]) -> 0.28239738220433364 | AI918: =RC[-11]/SQRT(RC[-6]*RC[-5]) -> 0.83601633026303579
A919: 68386 | B919: 北京 | C919: 326 | D919: 严重污染 | E919: 0.59 | F919: 3 | G919: 25 | H919: 107 | I919: 6 | J919: 23 | L919: 2013-06-29T00:00:00.000 | M919: =RC[-8]-R[24]C[-8] -> -0.92791666666666661 | N919: =RC[-8]-R[24]C[-8] -> -2.75 | O919: =RC[-8]-R[24]C[-8] -> -18.083333333333336 | P919: =RC[-8]-R[24]C[-8] -> 57.083333333333336 | Q919: =RC[-8]-R[24]C[-8] -> -95.125 | R919: =RC[-8]-R[24]C[-8] -> -72.666666666666671 | T919: =RC[-7]*RC[-2] -> 67.42861111111111 | U919: =RC[-7]*RC[-3] -> 199.83333333333334 | V919: =RC[-7]*RC[-4] -> 1314.0555555555559 | W919: =RC[-7]*RC[-5] -> -4148.0555555555557 | X919: =RC[-7]*RC[-6] -> 6912.416666666667 | Y919: =RC[-12]*RC[-12] -> 0.86102934027777767 | Z919: =RC[-12]*RC[-12] -> 7.5625 | AA919: =RC[-12]*RC[-12] -> 327.00694444444451 | AB919: =RC[-12]*RC[-12] -> 3258.5069444444448 | AC919: =RC[-12]*RC[-12] -> 9048.765625 | AD919: =RC[-12]*RC[-12] -> 5280.4444444444453 | AE919: =RC[-11]/SQRT(RC[-6]*RC[-1]) -> 1 | AF919: =RC[-11]/SQRT(RC[-6]*RC[-2]) -> 1 | AG919: =RC[-11]/SQRT(RC[-6]*RC[-3]) -> 1 | AH919: =RC[-11]/SQRT(RC[-6]*RC[-4]) -> -0.99999999999999978 | AI919: =RC[-11]/SQRT(RC[-6]*RC[-5]) -> 1
A920: 68462 | B920: 北京 | C920: 318 | D920: 严重污染 | E920: 0.61 | F920: 3 | G920: 30 | H920: 85 | I920: 6 | J920: 25 | L920: 2013-06-29T01:00:00.000 | M920: =RC[-8]-R[23]C[-8] -> -0.90791666666666659 | N920: =RC[-8]-R[23]C[-8] -> -2.75 | O920: =RC[-8]-R[23]C[-8] -> -13.083333333333336 | P920: =RC[-8]-R[23]C[-8] -> 35.083333333333336 | Q920: =RC[-8]-R[23]C[-8] -> -95.125 | R920: =RC[-8]-R[23]C[-8] -> -70.666666666666671 | T920: =RC[-7]*RC[-2] -> 64.159444444444446 | U920: =RC[-7]*RC[-3] -> 194.33333333333334 | V920: =RC[-7]*RC[-4] -> 924.55555555555577 | W920: =RC[-7]*RC[-5] -> -2479.2222222222226 | X920: =RC[-7]*RC[-6] -> 6722.166666666667 | Y920: =RC[-12]*RC[-12] -> 0.82431267361111094 | Z920: =RC[-12]*RC[-12] -> 7.5625 | AA920: =RC[-12]*RC[-12] -> 171.17361111111117 | AB920: =RC[-12]*RC[-12] -> 1230.8402777777781 | AC920: =RC[-12]*RC[-12] -> 9048.765625 | AD920: =RC[-12]*RC[-12] -> 4993.7777777777783 | AE920: =RC[-11]/SQRT(RC[-6]*RC[-1]) -> 1 | AF920: =RC[-11]/SQRT(RC[-6]*RC[-2]) -> 1 | AG920: =RC[-11]/SQRT(RC[-6]*RC[-3]) -> 1 | AH920: =RC[-11]/SQRT(RC[-6]*RC[-4]) -> -1 | AI920: =RC[-11]/SQRT(RC[-6]*RC[-5]) -> 1
A921: 68538 | B921: 北京 | C921: 318 | D921: 严重污染 | E921: 0.59 | F921: 3 | G921: 32 | H921: 69 | I921: 6 | J921: 29 | L921: 2013-06-29T02:00:00.000 | M921: =RC[-8]-R[22]C[-8] -> -0.92791666666666661 | N921: =RC[-8]-R[22]C[-8] -> -2.75 | O921: =RC[-8]-R[22]C[-8] -> -11.083333333333336 | P921: =RC[-8]-R[22]C[-8] -> 19.083333333333336 | Q921: =RC[-8]-R[22]C[-8] -> -95.125 | R921: =RC[-8]-R[22]C[-8] -> -66.666666666666671 | T921: =RC[-7]*RC[-2] -> 61.861111111111114 | U921: =RC[-7]*RC[-3] -> 183.33333333333334 | V921: =RC[-7]*RC[-4] -> 738.88888888888914 | W921: =RC[-7]*RC[-5] -> -1272.2222222222224 | X921: =RC[-7]*RC[-6] -> 6341.666666666667 | Y921: =RC[-12]*RC[-12] -> 0.86102934027777767 | Z921: =RC[-12]*RC[-12] -> 7.5625 | AA921: =RC[-12]*RC[-12] -> 122.84027777777783 | AB921: =RC[-12]*RC[-12] -> 364.1736111111112 | AC921: =RC[-12]*RC[-12] -> 9048.765625 | AD921: =RC[-12]*RC[-12] -> 4444.4444444444453 | AE921: =RC[-11]/SQRT(RC[-6]*RC[-1]) -> 1 | AF921: =RC[-11]/SQRT(RC[-6]*RC[-2]) -> 1 | AG921: =RC[-11]/SQRT(RC[-6]*RC[-3]) -> 1 | AH921: =RC[-11]/SQRT(RC[-6]*RC[-4]) -> -0.99999999999999978 | AI921: =RC[-11]/SQRT(RC[-6]*RC[-5]) -> 1
A922: 68614 | B922: 北京 | C922: 315 | D922: 严重污染 | E922: 0.64 | F922: 3 | G922: 31 | H922: 69 | I922: 6 | J922: 43 | L922: 2013-06-29T03:00:00.000 | M922: =RC[-8]-R[21]C[-8] -> -0.87791666666666657 | N922: =RC[-8]-R[21]C[-8] -> -2.75 | O922: =RC[-8]-R[21]C[-8] -> -12.083333333333336 | P922: =RC[-8]-R[21]C[-8] -> 19.083333333333336 | Q922: =RC[-8]-R[21]C[-8] -> -95.125 | R922: =RC[-8]-R[21]C[-8] -> -52.666666666666671 | T922: =RC[-7]*RC[-2] -> 46.236944444444447 | U922: =RC[-7]*RC[-3] -> 144.83333333333334 | V922: =RC[-7]*RC[-4] -> 636.38888888888903 | W922: =RC[-7]*RC[-5] -> -1005.0555555555558 | X922: =RC[-7]*RC[-6] -> 5009.916666666667 | Y922: =RC[-12]*RC[-12] -> 0.7707376736111109 | Z922: =RC[-12]*RC[-12] -> 7.5625 | AA922: =RC[-12]*RC[-12] -> 146.00694444444451 | AB922: =RC[-12]*RC[-12] -> 364.1736111111112 | AC922: =RC[-12]*RC[-12] -> 9048.765625 | AD922: =RC[-12]*RC[-12] -> 2773.7777777777783 | AE922: =RC[-11]/SQRT(RC[-6]*RC[-1]) -> 1.0000000000000002 | AF922: =RC[-11]/SQRT(RC[-6]*RC[-2]) -> 1 | AG922: =RC[-11]/SQRT(RC[-6]*RC[-3]) -> 0.99999999999999978 | AH922: =RC[-11]/SQRT(RC[-6]*RC[-4]) -> -1 | AI922: =RC[-11]/SQRT(RC[-6]*RC[-5]) -> 1
A923: 68690 | B923: 北京 | C923: 311 | D923: 严重污染 | E923: 0.62 | F923: 3 | G923: 30 | H923: 59 | I923: 6 | J923: 49 | L923: 2013-06-29T04:00:00.000 | M923: =RC[-8]-R[20]C[-8] -> -0.89791666666666659 | N923: =RC[-8]-R[20]C[-8] -> -2.75 | O923: =RC[-8]-R[20]C[-8] -> -13.083333333333336 | P923: =RC[-8]-R[20]C[-8] -> 9.0833333333333357 | Q923: =RC[-8]-R[20]C[-8] -> -95.125 | R923: =RC[-8]-R[20]C[-8] -> -46.666666666666671 | T923: =RC[-7]*RC[-2] -> 41.902777777777779 | U923: =RC[-7]*RC[-3] -> 128.33333333333334 | V923: =RC[-7]*RC[-4] -> 610.55555555555577 | W923: =RC[-7]*RC[-5] -> -423.88888888888903 | X923: =RC[-7]*RC[-6] -> 4439.166666666667 | Y923: =RC[-12]*RC[-12] -> 0.80625434027777765 | Z923: =RC[-12]*RC[-12] -> 7.5625 | AA923: =RC[-12]*RC[-12] -> 171.17361111111117 | AB923: =RC[-12]*RC[-12] -> 82.506944444444485 | AC923: =RC[-12]*RC[-12] -> 9048.765625 | AD923: =RC[-12]*RC[-12] -> 2177.7777777777783 | AE923: =RC[-11]/SQRT(RC[-6]*RC[-1]) -> 1 | AF923: =RC[-11]/SQRT(RC[-6]*RC[-2]) -> 1 | AG923: =RC[-11]/SQRT(RC[-6]*RC[-3]) -> 1 | AH923: =RC[-11]/SQRT(RC[-6]*RC[-4]) -> -1 | AI923: =RC[-11]/SQRT(RC[-6]*RC[-5]) -> 1
A924: 68766 | B924: 北京 | C924: 306 | D924: 严重污染 | E924: 0.69 | F924: 3 | G924: 23 | H924: 57 | I924: 6 | J924: 50 | L924: 2013-06-29T05:00:00.000 | M924: =RC[-8]-R[19]C[-8] -> -0.82791666666666663 | N924: =RC[-8]-R[19]C[-8] -> -2.75 | O924: =RC[-8]-R[19]C[-8] -> -20.083333333333336 | P924: =RC[-8]-R[19]C[-8] -> 7.0833333333333357 | Q924: =RC[-8]-R[19]C[-8] -> -95.125 | R924: =RC[-8]-R[19]C[-8] -> -45.666666666666671 | T924: =RC[-7]*RC[-2] -> 37.808194444444446 | U924: =RC[-7]*RC[-3] -> 125.58333333333334 | V924: =RC[-7]*RC[-4] -> 917.13888888888914 | W924: =RC[-7]*RC[-5] -> -323.47222222222234 | X924: =RC[-7]*RC[-6] -> 4344.041666666667 | Y924: =RC[-12]*RC[-12] -> 0.68544600694444435 | Z924: =RC[-12]*RC[-12] -> 7.5625 | AA924: =RC[-12]*RC[-12] -> 403.34027777777789 | AB924: =RC[-12]*RC[-12] -> 50.173611111111143 | AC924: =RC[-12]*RC[-12] -> 9048.765625 | AD924: =RC[-12]*RC[-12] -> 2085.4444444444448 | AE924: =RC[-11]/SQRT(RC[-6]*RC[-1]) -> 1 | AF924: =RC[-11]/SQRT(RC[-6]*RC[-2]) -> 1 | AG924: =RC[-11]/SQRT(RC[-6]*RC[-3]) -> 1 | AH924: =RC[-11]/SQRT(RC[-6]*RC[-4]) -> -1 | AI924: =RC[-11]/SQRT(RC[-6]*RC[-5]) -> 1
A925: 68842 | B925: 北京 | C925: 300 | D925: 重度污染 | E925: 0.7 | F925: 3 | G925: 22 | H925: 59 | I925: 36 | J925: 51 | L925: 2013-06-29T06:00:00.000 | M925: =RC[-8]-R[18]C[-8] -> -0.81791666666666663 | N925: =RC[-8]-R[18]C[-8] -> -2.75 | O925: =RC[-8]-R[18]C[-8] -> -21.083333333333336 | P925: =RC[-8]-R[18]C[-8] -> 9.0833333333333357 | Q925: =RC[-8]-R[18]C[-8] -> -65.125 | R925: =RC[-8]-R[18]C[-8] -> -44.666666666666671 | T925: =RC[-7]*RC[-2] -> 36.533611111111114 | U925: =RC[-7]*RC[-3] -> 122.83333333333334 | V925: =RC[-7]*RC[-4] -> 941.7222222222224 | W925: =RC[-7]*RC[-5] -> -405.7222222222224 | X925: =RC[-7]*RC[-6] -> 2908.916666666667 | Y925: =RC[-12]*RC[-12] -> 0.668987673611111 | Z925: =RC[-12]*RC[-12] -> 7.5625 | AA925: =RC[-12]*RC[-12] -> 444.50694444444457 | AB925: =RC[-12]*RC[-12] -> 82.506944444444485 | AC925: =RC[-12]*RC[-12] -> 4241.265625 | AD925: =RC[-12]*RC[-12] -> 1995.1111111111115 | AE925: =RC[-11]/SQRT(RC[-6]*RC[-1]) -> 1 | AF925: =RC[-11]/SQRT(RC[-6]*RC[-2]) -> 1 | AG925: =RC[-11]/SQRT(RC[-6]*RC[-3]) -> 1 | AH925: =RC[-11]/SQRT(RC[-6]*RC[-4]) -> -1 | AI925: =RC[-11]/SQRT(RC[-6]*RC[-5]) -> 1
A926: 68918 | B926: 北京 | C926: 295 | D926: 重度污染 | E926: 0.76 | F926: 4 | G926: 26 | H926: 56 | I926: 15 | J926: 54 | L926: 2013-06-29T07:00:00.000 | M926: =RC[-8]-R[17]C[-8] -> -0.75791666666666657 | N926: =RC[-8]-R[17]C[-8] -> -1.75 | O926: =RC[-8]-R[17]C[-8] -> -17.083333333333336 | P926: =RC[-8]-R[17]C[-8] -> 6.0833333333333357 | Q926: =RC[-8]-R[17]C[-8] -> -86.125 | R926: =RC[-8]-R[17]C[-8] -> -41.666666666666671 | T926: =RC[-7]*RC[-2] -> 31.579861111111111 | U926: =RC[-7]*RC[-3] -> 72.916666666666671 | V926: =RC[-7]*RC[-4] -> 711.80555555555577 | W926: =RC[-7]*RC[-5] -> -253.47222222222234 | X926: =RC[-7]*RC[-6] -> 3588.541666666667 | Y926: =RC[-12]*RC[-12] -> 0.57443767361111098 | Z926: =RC[-12]*RC[-12] -> 3.0625 | AA926: =RC[-12]*RC[-12] -> 291.84027777777789 | AB926: =RC[-12]*RC[-12] -> 37.006944444444471 | AC926: =RC[-12]*RC[-12] -> 7417.515625 | AD926: =RC[-12]*RC[-12] -> 1736.1111111111115 | AE926: =RC[-11]/SQRT(RC[-6]*RC[-1]) -> 1 | AF926: =RC[-11]/SQRT(RC[-6]*RC[-2]) -> 1 | AG926: =RC[-11]/SQRT(RC[-6]*RC[-3]) -> 1 | AH926: =RC[-11]/SQRT(RC[-6]*RC[-4]) -> -1 | AI926: =RC[-11]/SQRT(RC[-6]*RC[-5]) -> 0.99999999999999989
A927: 68994 | B927: 北京 | C927: 290 | D927: 重度污染 | E927: 0.88 | F927: 4 | G927: 31 | H927: 56 | I927: 42 | J927: 54 | L927: 2013-06-29T08:00:00.000 | M927: =RC[-8]-R[16]C[-8] -> -0.63791666666666658 | N927: =RC[-8]-R[16]C[-8] -> -1.75 | O927: =RC[-8]-R[16]C[-8] -> -12.083333333333336 | P927: =RC[-8]-R[16]C[-8] -> 6.0833333333333357 | Q927: =RC[-8]-R[16]C[-8] -> -59.125 | R927: =RC[-8]-R[16]C[-8] -> -41.666666666666671 | T927: =RC[-7]*RC[-2] -> 26.579861111111111 | U927: =RC[-7]*RC[-3] -> 72.916666666666671 | V927: =RC[-7]*RC[-4] -> 503.4722222222224 | W927: =RC[-7]*RC[-5] -> -253.47222222222234 | X927: =RC[-7]*RC[-6] -> 2463.541666666667 | Y927: =RC[-12]*RC[-12] -> 0.40693767361111099 | Z927: =RC[-12]*RC[-12] -> 3.0625 | AA927: =RC[-12]*RC[-12] -> 146.00694444444451 | AB927: =RC[-12]*RC[-12] -> 37.006944444444471 | AC927: =RC[-12]*RC[-12] -> 3495.765625 | AD927: =RC[-12]*RC[-12] -> 1736.1111111111115 | AE927: =RC[-11]/SQRT(RC[-6]*RC[-1]) -> 1 | AF927: =RC[-11]/SQRT(RC[-6]*RC[-2]) -> 1 | AG927: =RC[-11]/SQRT(RC[-6]*RC[-3]) -> 1 | AH927: =RC[-11]/SQRT(RC[-6]*RC[-4]) -> -1 | AI927: =RC[-11]/SQRT(RC[-6]*RC[-5]) -> 1
A928: 69070 | B928: 北京 | C928: 286 | D928: 重度污染 | E928: 0.97 | F928: 4 | G928: 35 | H928: 58 | I928: 54 | J928: 62 | L928: 2013-06-29T09:00:00.000 | M928: =RC[-8]-R[15]C[-8] -> -0.54791666666666661 | N928: =RC[-8]-R[15]C[-8] -> -1.75 | O928: =RC[-8]-R[15]C[-8] -> -8.0833333333333357 | P928: =RC[-8]-R[15]C[-8] -> 8.0833333333333357 | Q928: =RC[-8]-R[15]C[-8] -> -47.125 | R928: =RC[-8]-R[15]C[-8] -> -33.666666666666671 | T928: =RC[-7]*RC[-2] -> 18.446527777777778 | U928: =RC[-7]*RC[-3] -> 58.916666666666671 | V928: =RC[-7]*RC[-4] -> 272.13888888888903 | W928: =RC[-7]*RC[-5] -> -272.13888888888903 | X928: =RC[-7]*RC[-6] -> 1586.541666666667 | Y928: =RC[-12]*RC[-12] -> 0.30021267361111104 | Z928: =RC[-12]*RC[-12] -> 3.0625 | AA928: =RC[-12]*RC[-12] -> 65.340277777777814 | AB928: =RC[-12]*RC[-12] -> 65.340277777777814 | AC928: =RC[-12]*RC[-12] -> 2220.765625 | AD928: =RC[-12]*RC[-12] -> 1133.4444444444448 | AE928: =RC[-11]/SQRT(RC[-6]*RC[-1]) -> 1 | AF928: =RC[-11]/SQRT(RC[-6]*RC[-2]) -> 0.99999999999999989 | AG928: =RC[-11]/SQRT(RC[-6]*RC[-3]) -> 1 | AH928: =RC[-11]/SQRT(RC[-6]*RC[-4]) -> -1 | AI928: =RC[-11]/SQRT(RC[-6]*RC[-5]) -> 1
A929: 69146 | B929: 北京 | C929: 283 | D929: 重度污染 | E929: 1.19 | F929: 5 | G929: 40 | H929: 53 | I929: 66 | J929: 70 | L929: 2013-06-29T10:00:00.000 | M929: =RC[-8]-R[14]C[-8] -> -0.32791666666666663 | N929: =RC[-8]-R[14]C[-8] -> -0.75 | O929: =RC[-8]-R[14]C[-8] -> -3.0833333333333357 | P929: =RC[-8]-R[14]C[-8] -> 3.0833333333333357 | Q929: =RC[-8]-R[14]C[-8] -> -35.125 | R929: =RC[-8]-R[14]C[-8] -> -25.666666666666671 | T929: =RC[-7]*RC[-2] -> 8.4165277777777785 | U929: =RC[-7]*RC[-3] -> 19.250000000000004 | V929: =RC[-7]*RC[-4] -> 79.138888888888971 | W929: =RC[-7]*RC[-5] -> -79.138888888888971 | X929: =RC[-7]*RC[-6] -> 901.54166666666686 | Y929: =RC[-12]*RC[-12] -> 0.10752934027777776 | Z929: =RC[-12]*RC[-12] -> 0.5625 | AA929: =RC[-12]*RC[-12] -> 9.5069444444444589 | AB929: =RC[-12]*RC[-12] -> 9.5069444444444589 | AC929: =RC[-12]*RC[-12] -> 1233.765625 | AD929: =RC[-12]*RC[-12] -> 658.77777777777806 | AE929: =RC[-11]/SQRT(RC[-6]*RC[-1]) -> 1 | AF929: =RC[-11]/SQRT(RC[-6]*RC[-2]) -> 1 | AG929: =RC[-11]/SQRT(RC[-6]*RC[-3]) -> 1.0000000000000002 | AH929: =RC[-11]/SQRT(RC[-6]*RC[-4]) -> -1.0000000000000002 | AI929: =RC[-11]/SQRT(RC[-6]*RC[-5]) -> 1
A930: 69222 | B930: 北京 | C930: 260 | D930: 重度污染 | E930: 1.48 | F930: 6 | G930: 42 | H930: 48 | I930: 92 | J930: 87 | L930: 2013-06-29T11:00:00.000 | M930: =RC[-8]-R[13]C[-8] -> -3.7916666666666599E-2 | N930: =RC[-8]-R[13]C[-8] -> 0.25 | O930: =RC[-8]-R[13]C[-8] -> -1.0833333333333357 | P930: =RC[-8]-R[13]C[-8] -> -1.9166666666666643 | Q930: =RC[-8]-R[13]C[-8] -> -9.125 | R930: =RC[-8]-R[13]C[-8] -> -8.6666666666666714 | T930: =RC[-7]*RC[-2] -> 0.32861111111111069 | U930: =RC[-7]*RC[-3] -> -2.1666666666666679 | V930: =RC[-7]*RC[-4] -> 9.3888888888889142 | W930: =RC[-7]*RC[-5] -> 16.6111111111111 | X930: =RC[-7]*RC[-6] -> 79.083333333333371 | Y930: =RC[-12]*RC[-12] -> 1.4376736111111059E-3 | Z930: =RC[-12]*RC[-12] -> 6.25E-2 | AA930: =RC[-12]*RC[-12] -> 1.1736111111111163 | AB930: =RC[-12]*RC[-12] -> 3.6736111111111018 | AC930: =RC[-12]*RC[-12] -> 83.265625 | AD930: =RC[-12]*RC[-12] -> 75.1111111111112 | AE930: =RC[-11]/SQRT(RC[-6]*RC[-1]) -> 1 | AF930: =RC[-11]/SQRT(RC[-6]*RC[-2]) -> -1 | AG930: =RC[-11]/SQRT(RC[-6]*RC[-3]) -> 1 | AH930: =RC[-11]/SQRT(RC[-6]*RC[-4]) -> 1 | AI930: =RC[-11]/SQRT(RC[-6]*RC[-5]) -> 0.99999999999999978
A931: 69298 | B931: 北京 | C931: 237 | D931: 重度污染 | E931: 1.71 | F931: 6 | G931: 44 | H931: 41 | I931: 136 | J931: 104 | L931: 2013-06-29T12:00:00.000 | M931: =RC[-8]-R[12]C[-8] -> 0.19208333333333338 | N931: =RC[-8]-R[12]C[-8] -> 0.25 | O931: =RC[-8]-R[12]C[-8] -> 0.9166666666666643 | P931: =RC[-8]-R[12]C[-8] -> -8.9166666666666643 | Q931: =RC[-8]-R[12]C[-8] -> 34.875 | R931: =RC[-8]-R[12]C[-8] -> 8.3333333333333286 | T931: =RC[-7]*RC[-2] -> 1.600694444444444 | U931: =RC[-7]*RC[-3] -> 2.0833333333333321 | V931: =RC[-7]*RC[-4] -> 7.6388888888888644 | W931: =RC[-7]*RC[-5] -> -74.3055555555555 | X931: =RC[-7]*RC[-6] -> 290.62499999999983 | Y931: =RC[-12]*RC[-12] -> 3.6896006944444462E-2 | Z931: =RC[-12]*RC[-12] -> 6.25E-2 | AA931: =RC[-12]*RC[-12] -> 0.84027777777777346 | AB931: =RC[-12]*RC[-12] -> 79.5069444444444 | AC931: =RC[-12]*RC[-12] -> 1216.265625 | AD931: =RC[-12]*RC[-12] -> 69.444444444444372 | AE931: =RC[-11]/SQRT(RC[-6]*RC[-1]) -> 1 | AF931: =RC[-11]/SQRT(RC[-6]*RC[-2]) -> 1 | AG931: =RC[-11]/SQRT(RC[-6]*RC[-3]) -> 0.99999999999999989 | AH931: =RC[-11]/SQRT(RC[-6]*RC[-4]) -> -1 | AI931: =RC[-11]/SQRT(RC[-6]*RC[-5]) -> 1
A932: 69374 | B932: 北京 | C932: 220 | D932: 重度污染 | E932: 1.94 | F932: 7 | G932: 44 | H932: 41 | I932: 141 | J932: 120 | L932: 2013-06-29T13:00:00.000 | M932: =RC[-8]-R[11]C[-8] -> 0.42208333333333337 | N932: =RC[-8]-R[11]C[-8] -> 1.25 | O932: =RC[-8]-R[11]C[-8] -> 0.9166666666666643 | P932: =RC[-8]-R[11]C[-8] -> -8.9166666666666643 | Q932: =RC[-8]-R[11]C[-8] -> 39.875 | R932: =RC[-8]-R[11]C[-8] -> 24.333333333333329 | T932: =RC[-7]*RC[-2] -> 10.270694444444443 | U932: =RC[-7]*RC[-3] -> 30.416666666666661 | V932: =RC[-7]*RC[-4] -> 22.305555555555493 | W932: =RC[-7]*RC[-5] -> -216.97222222222211 | X932: =RC[-7]*RC[-6] -> 970.29166666666652 | Y932: =RC[-12]*RC[-12] -> 0.1781543402777778 | Z932: =RC[-12]*RC[-12] -> 1.5625 | AA932: =RC[-12]*RC[-12] -> 0.84027777777777346 | AB932: =RC[-12]*RC[-12] -> 79.5069444444444 | AC932: =RC[-12]*RC[-12] -> 1590.015625 | AD932: =RC[-12]*RC[-12] -> 592.11111111111086 | AE932: =RC[-11]/SQRT(RC[-6]*RC[-1]) -> 1 | AF932: =RC[-11]/SQRT(RC[-6]*RC[-2]) -> 1 | AG932: =RC[-11]/SQRT(RC[-6]*RC[-3]) -> 1 | AH932: =RC[-11]/SQRT(RC[-6]*RC[-4]) -> -1 | AI932: =RC[-11]/SQRT(RC[-6]*RC[-5]) -> 1
A933: 69450 | B933: 北京 | C933: 211 | D933: 重度污染 | E933: 2.16 | F933: 8 | G933: 48 | H933: 40 | I933: 155 | J933: 128 | L933: 2013-06-29T14:00:00.000 | M933: =RC[-8]-R[10]C[-8] -> 0.64208333333333356 | N933: =RC[-8]-R[10]C[-8] -> 2.25 | O933: =RC[-8]-R[10]C[-8] -> 4.9166666666666643 | P933: =RC[-8]-R[10]C[-8] -> -9.9166666666666643 | Q933: =RC[-8]-R[10]C[-8] -> 53.875 | R933: =RC[-8]-R[10]C[-8] -> 32.333333333333329 | T933: =RC[-7]*RC[-2] -> 20.76069444444445 | U933: =RC[-7]*RC[-3] -> 72.749999999999986 | V933: =RC[-7]*RC[-4] -> 158.97222222222211 | W933: =RC[-7]*RC[-5] -> -320.63888888888874 | X933: =RC[-7]*RC[-6] -> 1741.958333333333 | Y933: =RC[-12]*RC[-12] -> 0.41227100694444474 | Z933: =RC[-12]*RC[-12] -> 5.0625 | AA933: =RC[-12]*RC[-12] -> 24.173611111111089 | AB933: =RC[-12]*RC[-12] -> 98.340277777777729 | AC933: =RC[-12]*RC[-12] -> 2902.515625 | AD933: =RC[-12]*RC[-12] -> 1045.4444444444441 | AE933: =RC[-11]/SQRT(RC[-6]*RC[-1]) -> 1 | AF933: =RC[-11]/SQRT(RC[-6]*RC[-2]) -> 1 | AG933: =RC[-11]/SQRT(RC[-6]*RC[-3]) -> 0.99999999999999978 | AH933: =RC[-11]/SQRT(RC[-6]*RC[-4]) -> -1 | AI933: =RC[-11]/SQRT(RC[-6]*RC[-5]) -> 1
A934: 69526 | B934: 北京 | C934: 204 | D934: 重度污染 | E934: 2.3199999999999998 | F934: 8 | G934: 50 | H934: 41 | I934: 195 | J934: 143 | L934: 2013-06-29T15:00:00.000 | M934: =RC[-8]-R[9]C[-8] -> 0.80208333333333326 | N934: =RC[-8]-R[9]C[-8] -> 2.25 | O934: =RC[-8]-R[9]C[-8] -> 6.9166666666666643 | P934: =RC[-8]-R[9]C[-8] -> -8.9166666666666643 | Q934: =RC[-8]-R[9]C[-8] -> 93.875 | R934: =RC[-8]-R[9]C[-8] -> 47.333333333333329 | T934: =RC[-7]*RC[-2] -> 37.965277777777771 | U934: =RC[-7]*RC[-3] -> 106.49999999999999 | V934: =RC[-7]*RC[-4] -> 327.38888888888874 | W934: =RC[-7]*RC[-5] -> -422.05555555555543 | X934: =RC[-7]*RC[-6] -> 4443.4166666666661 | Y934: =RC[-12]*RC[-12] -> 0.64333767361111094 | Z934: =RC[-12]*RC[-12] -> 5.0625 | AA934: =RC[-12]*RC[-12] -> 47.840277777777743 | AB934: =RC[-12]*RC[-12] -> 79.5069444444444 | AC934: =RC[-12]*RC[-12] -> 8812.515625 | AD934: =RC[-12]*RC[-12] -> 2240.4444444444439 | AE934: =RC[-11]/SQRT(RC[-6]*RC[-1]) -> 1.0000000000000002 | AF934: =RC[-11]/SQRT(RC[-6]*RC[-2]) -> 1 | AG934: =RC[-11]/SQRT(RC[-6]*RC[-3]) -> 1 | AH934: =RC[-11]/SQRT(RC[-6]*RC[-4]) -> -1.0000000000000002 | AI934: =RC[-11]/SQRT(RC[-6]*RC[-5]) -> 1
A935: 69602 | B935: 北京 | C935: 193 | D935: 中度污染 | E935: 2.37 | F935: 9 | G935: 50 | H935: 50 | I935: 187 | J935: 150 | L935: 2013-06-29T16:00:00.000 | M935: =RC[-8]-R[8]C[-8] -> 0.85208333333333353 | N935: =RC[-8]-R[8]C[-8] -> 3.25 | O935: =RC[-8]-R[8]C[-8] -> 6.9166666666666643 | P935: =RC[-8]-R[8]C[-8] -> 8.3333333333335702E-2 | Q935: =RC[-8]-R[8]C[-8] -> 85.875 | R935: =RC[-8]-R[8]C[-8] -> 54.333333333333329 | T935: =RC[-7]*RC[-2] -> 46.296527777777783 | U935: =RC[-7]*RC[-3] -> 176.58333333333331 | V935: =RC[-7]*RC[-4] -> 375.80555555555537 | W935: =RC[-7]*RC[-5] -> 4.5277777777779065 | X935: =RC[-7]*RC[-6] -> 4665.875 | Y935: =RC[-12]*RC[-12] -> 0.72604600694444477 | Z935: =RC[-12]*RC[-12] -> 10.5625 | AA935: =RC[-12]*RC[-12] -> 47.840277777777743 | AB935: =RC[-12]*RC[-12] -> 6.9444444444448396E-3 | AC935: =RC[-12]*RC[-12] -> 7374.515625 | AD935: =RC[-12]*RC[-12] -> 2952.1111111111104 | AE935: =RC[-11]/SQRT(RC[-6]*RC[-1]) -> 1 | AF935: =RC[-11]/SQRT(RC[-6]*RC[-2]) -> 1 | AG935: =RC[-11]/SQRT(RC[-6]*RC[-3]) -> 1 | AH935: =RC[-11]/SQRT(RC[-6]*RC[-4]) -> 1 | AI935: =RC[-11]/SQRT(RC[-6]*RC[-5]) -> 1
A936: 69678 | B936: 北京 | C936: 183 | D936: 中度污染 | E936: 2.42 | F936: 9 | G936: 52 | H936: 51 | I936: 195 | J936: 148 | L936: 2013-06-29T17:00:00.000 | M936: =RC[-8]-R[7]C[-8] -> 0.90208333333333335 | N936: =RC[-8]-R[7]C[-8] -> 3.25 | O936: =RC[-8]-R[7]C[-8] -> 8.9166666666666643 | P936: =RC[-8]-R[7]C[-8] -> 1.0833333333333357 | Q936: =RC[-8]-R[7]C[-8] -> 93.875 | R936: =RC[-8]-R[7]C[-8] -> 52.333333333333329 | T936: =RC[-7]*RC[-2] -> 47.209027777777777 | U936: =RC[-7]*RC[-3] -> 170.08333333333331 | V936: =RC[-7]*RC[-4] -> 466.63888888888874 | W936: =RC[-7]*RC[-5] -> 56.694444444444564 | X936: =RC[-7]*RC[-6] -> 4912.7916666666661 | Y936: =RC[-12]*RC[-12] -> 0.81375434027777782 | Z936: =RC[-12]*RC[-12] -> 10.5625 | AA936: =RC[-12]*RC[-12] -> 79.5069444444444 | AB936: =RC[-12]*RC[-12] -> 1.1736111111111163 | AC936: =RC[-12]*RC[-12] -> 8812.515625 | AD936: =RC[-12]*RC[-12] -> 2738.7777777777774 | AE936: =RC[-11]/SQRT(RC[-6]*RC[-1]) -> 1 | AF936: =RC[-11]/SQRT(RC[-6]*RC[-2]) -> 1 | AG936: =RC[-11]/SQRT(RC[-6]*RC[-3]) -> 1.0000000000000002 | AH936: =RC[-11]/SQRT(RC[-6]*RC[-4]) -> 1 | AI936: =RC[-11]/SQRT(RC[-6]*RC[-5]) -> 1
A937: 69754 | B937: 北京 | C937: 172 | D937: 中度污染 | E937: 2.33 | F937: 9 | G937: 57 | H937: 49 | I937: 196 | J937: 146 | L937: 2013-06-29T18:00:00.000 | M937: =RC[-8]-R[6]C[-8] -> 0.81208333333333349 | N937: =RC[-8]-R[6]C[-8] -> 3.25 | O937: =RC[-8]-R[6]C[-8] -> 13.916666666666664 | P937: =RC[-8]-R[6]C[-8] -> -0.9166666666666643 | Q937: =RC[-8]-R[6]C[-8] -> 94.875 | R937: =RC[-8]-R[6]C[-8] -> 50.333333333333329 | T937: =RC[-7]*RC[-2] -> 40.874861111111116 | U937: =RC[-7]*RC[-3] -> 163.58333333333331 | V937: =RC[-7]*RC[-4] -> 700.47222222222206 | W937: =RC[-7]*RC[-5] -> -46.138888888888765 | X937: =RC[-7]*RC[-6] -> 4775.375 | Y937: =RC[-12]*RC[-12] -> 0.65947934027777799 | Z937: =RC[-12]*RC[-12] -> 10.5625 | AA937: =RC[-12]*RC[-12] -> 193.67361111111106 | AB937: =RC[-12]*RC[-12] -> 0.84027777777777346 | AC937: =RC[-12]*RC[-12] -> 9001.265625 | AD937: =RC[-12]*RC[-12] -> 2533.4444444444439 | AE937: =RC[-11]/SQRT(RC[-6]*RC[-1]) -> 1 | AF937: =RC[-11]/SQRT(RC[-6]*RC[-2]) -> 1 | AG937: =RC[-11]/SQRT(RC[-6]*RC[-3]) -> 1 | AH937: =RC[-11]/SQRT(RC[-6]*RC[-4]) -> -1 | AI937: =RC[-11]/SQRT(RC[-6]*RC[-5]) -> 1
A938: 69830 | B938: 北京 | C938: 156 | D938: 中度污染 | E938: 2.2400000000000002 | F938: 9 | G938: 62 | H938: 42 | I938: 174 | J938: 142 | L938: 2013-06-29T19:00:00.000 | M938: =RC[-8]-R[5]C[-8] -> 0.72208333333333363 | N938: =RC[-8]-R[5]C[-8] -> 3.25 | O938: =RC[-8]-R[5]C[-8] -> 18.916666666666664 | P938: =RC[-8]-R[5]C[-8] -> -7.9166666666666643 | Q938: =RC[-8]-R[5]C[-8] -> 72.875 | R938: =RC[-8]-R[5]C[-8] -> 46.333333333333329 | T938: =RC[-7]*RC[-2] -> 33.456527777777787 | U938: =RC[-7]*RC[-3] -> 150.58333333333331 | V938: =RC[-7]*RC[-4] -> 876.47222222222206 | W938: =RC[-7]*RC[-5] -> -366.80555555555543 | X938: =RC[-7]*RC[-6] -> 3376.5416666666665 | Y938: =RC[-12]*RC[-12] -> 0.52140434027777816 | Z938: =RC[-12]*RC[-12] -> 10.5625 | AA938: =RC[-12]*RC[-12] -> 357.84027777777771 | AB938: =RC[-12]*RC[-12] -> 62.673611111111072 | AC938: =RC[-12]*RC[-12] -> 5310.765625 | AD938: =RC[-12]*RC[-12] -> 2146.7777777777774 | AE938: =RC[-11]/SQRT(RC[-6]*RC[-1]) -> 1 | AF938: =RC[-11]/SQRT(RC[-6]*RC[-2]) -> 1 | AG938: =RC[-11]/SQRT(RC[-6]*RC[-3]) -> 1 | AH938: =RC[-11]/SQRT(RC[-6]*RC[-4]) -> -1.0000000000000002 | AI938: =RC[-11]/SQRT(RC[-6]*RC[-5]) -> 1.0000000000000002
A939: 69906 | B939: 北京 | C939: 140 | D939: 轻度污染 | E939: 2.2400000000000002 | F939: 8 | G939: 66 | H939: 29 | I939: 175 | J939: 146 | L939: 2013-06-29T20:00:00.000 | M939: =RC[-8]-R[4]C[-8] -> 0.72208333333333363 | N939: =RC[-8]-R[4]C[-8] -> 2.25 | O939: =RC[-8]-R[4]C[-8] -> 22.916666666666664 | P939: =RC[-8]-R[4]C[-8] -> -20.916666666666664 | Q939: =RC[-8]-R[4]C[-8] -> 73.875 | R939: =RC[-8]-R[4]C[-8] -> 50.333333333333329 | T939: =RC[-7]*RC[-2] -> 36.344861111111122 | U939: =RC[-7]*RC[-3] -> 113.24999999999999 | V939: =RC[-7]*RC[-4] -> 1153.4722222222219 | W939: =RC[-7]*RC[-5] -> -1052.8055555555554 | X939: =RC[-7]*RC[-6] -> 3718.3749999999995 | Y939: =RC[-12]*RC[-12] -> 0.52140434027777816 | Z939: =RC[-12]*RC[-12] -> 5.0625 | AA939: =RC[-12]*RC[-12] -> 525.17361111111097 | AB939: =RC[-12]*RC[-12] -> 437.50694444444434 | AC939: =RC[-12]*RC[-12] -> 5457.515625 | AD939: =RC[-12]*RC[-12] -> 2533.4444444444439 | AE939: =RC[-11]/SQRT(RC[-6]*RC[-1]) -> 1 | AF939: =RC[-11]/SQRT(RC[-6]*RC[-2]) -> 1 | AG939: =RC[-11]/SQRT(RC[-6]*RC[-3]) -> 1 | AH939: =RC[-11]/SQRT(RC[-6]*RC[-4]) -> -1 | AI939: =RC[-11]/SQRT(RC[-6]*RC[-5]) -> 1
A940: 69982 | B940: 北京 | C940: 126 | D940: 轻度污染 | E940: 2.29 | F940: 7 | G940: 70 | H940: 18 | I940: 177 | J940: 150 | L940: 2013-06-29T21:00:00.000 | M940: =RC[-8]-R[3]C[-8] -> 0.77208333333333345 | N940: =RC[-8]-R[3]C[-8] -> 1.25 | O940: =RC[-8]-R[3]C[-8] -> 26.916666666666664 | P940: =RC[-8]-R[3]C[-8] -> -31.916666666666664 | Q940: =RC[-8]-R[3]C[-8] -> 75.875 | R940: =RC[-8]-R[3]C[-8] -> 54.333333333333329 | T940: =RC[-7]*RC[-2] -> 41.949861111111112 | U940: =RC[-7]*RC[-3] -> 67.916666666666657 | V940: =RC[-7]*RC[-4] -> 1462.4722222222219 | W940: =RC[-7]*RC[-5] -> -1734.1388888888887 | X940: =RC[-7]*RC[-6] -> 4122.5416666666661 | Y940: =RC[-12]*RC[-12] -> 0.59611267361111131 | Z940: =RC[-12]*RC[-12] -> 1.5625 | AA940: =RC[-12]*RC[-12] -> 724.50694444444434 | AB940: =RC[-12]*RC[-12] -> 1018.673611111111 | AC940: =RC[-12]*RC[-12] -> 5757.015625 | AD940: =RC[-12]*RC[-12] -> 2952.1111111111104 | AE940: =RC[-11]/SQRT(RC[-6]*RC[-1]) -> 1 | AF940: =RC[-11]/SQRT(RC[-6]*RC[-2]) -> 1 | AG940: =RC[-11]/SQRT(RC[-6]*RC[-3]) -> 1 | AH940: =RC[-11]/SQRT(RC[-6]*RC[-4]) -> -1 | AI940: =RC[-11]/SQRT(RC[-6]*RC[-5]) -> 1
A941: 70058 | B941: 北京 | C941: 121 | D941: 轻度污染 | E941: 2.2999999999999998 | F941: 7 | G941: 57 | H941: 13 | I941: 180 | J941: 158 | L941: 2013-06-29T22:00:00.000 | M941: =RC[-8]-R[2]C[-8] -> 0.78208333333333324 | N941: =RC[-8]-R[2]C[-8] -> 1.25 | O941: =RC[-8]-R[2]C[-8] -> 13.916666666666664 | P941: =RC[-8]-R[2]C[-8] -> -36.916666666666664 | Q941: =RC[-8]-R[2]C[-8] -> 78.875 | R941: =RC[-8]-R[2]C[-8] -> 62.333333333333329 | T941: =RC[-7]*RC[-2] -> 48.749861111111102 | U941: =RC[-7]*RC[-3] -> 77.916666666666657 | V941: =RC[-7]*RC[-4] -> 867.47222222222206 | W941: =RC[-7]*RC[-5] -> -2301.1388888888887 | X941: =RC[-7]*RC[-6] -> 4916.5416666666661 | Y941: =RC[-12]*RC[-12] -> 0.61165434027777765 | Z941: =RC[-12]*RC[-12] -> 1.5625 | AA941: =RC[-12]*RC[-12] -> 193.67361111111106 | AB941: =RC[-12]*RC[-12] -> 1362.8402777777776 | AC941: =RC[-12]*RC[-12] -> 6221.265625 | AD941: =RC[-12]*RC[-12] -> 3885.4444444444439 | AE941: =RC[-11]/SQRT(RC[-6]*RC[-1]) -> 1 | AF941: =RC[-11]/SQRT(RC[-6]*RC[-2]) -> 1 | AG941: =RC[-11]/SQRT(RC[-6]*RC[-3]) -> 1 | AH941: =RC[-11]/SQRT(RC[-6]*RC[-4]) -> -1 | AI941: =RC[-11]/SQRT(RC[-6]*RC[-5]) -> 1
A942: 70134 | B942: 北京 | C942: 127 | D942: 轻度污染 | E942: 2.39 | F942: 7 | G942: 67 | H942: 7 | I942: 175 | J942: 164 | L942: 2013-06-29T23:00:00.000 | M942: =RC[-8]-R[1]C[-8] -> 0.87208333333333354 | N942: =RC[-8]-R[1]C[-8] -> 1.25 | O942: =RC[-8]-R[1]C[-8] -> 23.916666666666664 | P942: =RC[-8]-R[1]C[-8] -> -42.916666666666664 | Q942: =RC[-8]-R[1]C[-8] -> 73.875 | R942: =RC[-8]-R[1]C[-8] -> 68.333333333333329 | T942: =RC[-7]*RC[-2] -> 59.592361111111124 | U942: =RC[-7]*RC[-3] -> 85.416666666666657 | V942: =RC[-7]*RC[-4] -> 1634.3055555555552 | W942: =RC[-7]*RC[-5] -> -2932.6388888888887 | X942: =RC[-7]*RC[-6] -> 5048.125 | Y942: =RC[-12]*RC[-12] -> 0.76052934027777819 | Z942: =RC[-12]*RC[-12] -> 1.5625 | AA942: =RC[-12]*RC[-12] -> 572.00694444444434 | AB942: =RC[-12]*RC[-12] -> 1841.8402777777776 | AC942: =RC[-12]*RC[-12] -> 5457.515625 | AD942: =RC[-12]*RC[-12] -> 4669.4444444444434 | AE942: =RC[-11]/SQRT(RC[-6]*RC[-1]) -> 1.0000000000000002 | AF942: =RC[-11]/SQRT(RC[-6]*RC[-2]) -> 1 | AG942: =RC[-11]/SQRT(RC[-6]*RC[-3]) -> 1 | AH942: =RC[-11]/SQRT(RC[-6]*RC[-4]) -> -1.0000000000000002 | AI942: =RC[-11]/SQRT(RC[-6]*RC[-5]) -> 1
E943: =AVERAGE(R[-24]C:R[-1]C) -> 1.5179166666666666 | F943: =AVERAGE(R[-24]C:R[-1]C) -> 5.75 | G943: =AVERAGE(R[-24]C:R[-1]C) -> 43.083333333333336 | H943: =AVERAGE(R[-24]C:R[-1]C) -> 49.916666666666664 | I943: =AVERAGE(R[-24]C:R[-1]C) -> 101.125 | J943: =AVERAGE(R[-24]C:R[-1]C) -> 95.666666666666671 | M943: =RC[-8]-RC[-8] -> 0 | N943: =RC[-8]-RC[-8] -> 0 | O943: =RC[-8]-RC[-8] -> 0 | P943: =RC[-8]-RC[-8] -> 0 | Q943: =RC[-8]-RC[-8] -> 0 | R943: =RC[-8]-RC[-8] -> 0 | T943: =SUM(R[-24]C:R[-1]C) -> 866.35333333333324 | U943: =SUM(R[-24]C:R[-1]C) -> 2537.9999999999995 | V943: =SUM(R[-24]C:R[-1]C) -> 15712.66666666667 | W943: =SUM(R[-24]C:R[-1]C) -> -20305.666666666664 | X943: =SUM(R[-24]C:R[-1]C) -> 88280 | Y943: =SUM(R[-24]C:R[-1]C) -> 13.349395833333336 | Z943: =SUM(R[-24]C:R[-1]C) -> 126.5 | AA943: =SUM(R[-24]C:R[-1]C) -> 5067.8333333333339 | AB943: =SUM(R[-24]C:R[-1]C) -> 10647.833333333332 | AC943: =SUM(R[-24]C:R[-1]C) -> 140898.625 | AD943: =SUM(R[-24]C:R[-1]C) -> 57449.333333333336 | AE943: =RC[-11]/SQRT(RC[-6]*RC[-1]) -> 0.98928573910393858 | AF943: =RC[-11]/SQRT(RC[-6]*RC[-2]) -> 0.94146430428555572 | AG943: =RC[-11]/SQRT(RC[-6]*RC[-3]) -> 0.92086557693744631 | AH943: =RC[-11]/SQRT(RC[-6]*RC[-4]) -> -0.82100184602746773 | AI943: =RC[-11]/SQRT(RC[-6]*RC[-5]) -> 0.98122013240726447
A944: 70210 | B944: 北京 | C944: 135 | D944: 轻度污染 | E944: 2.39 | F944: 7 | G944: 60 | H944: 9 | I944: 174 | J944: 164 | L944: 2013-06-30T00:00:00.000 | M944: =RC[-8]-R[14]C[-8] -> -0.33499999999999908 | N944: =RC[-8]-R[14]C[-8] -> -3.2857142857142865 | O944: =RC[-8]-R[14]C[-8] -> 5.0714285714285694 | P944: =RC[-8]-R[14]C[-8] -> -10.714285714285715 | Q944: =RC[-8]-R[14]C[-8] -> -33.571428571428584 | R944: =RC[-8]-R[14]C[-8] -> -39 | T944: =RC[-7]*RC[-2] -> 13.064999999999964 | U944: =RC[-7]*RC[-3] -> 128.14285714285717 | V944: =RC[-7]*RC[-4] -> -197.78571428571422 | W944: =RC[-7]*RC[-5] -> 417.85714285714289 | X944: =RC[-7]*RC[-6] -> 1309.2857142857147 | Y944: =RC[-12]*RC[-12] -> 0.11222499999999938 | Z944: =RC[-12]*RC[-12] -> 10.795918367346944 | AA944: =RC[-12]*RC[-12] -> 25.719387755102019 | AB944: =RC[-12]*RC[-12] -> 114.79591836734696 | AC944: =RC[-12]*RC[-12] -> 1127.0408163265315 | AD944: =RC[-12]*RC[-12] -> 1521 | AE944: =RC[-11]/SQRT(RC[-6]*RC[-1]) -> 1 | AF944: =RC[-11]/SQRT(RC[-6]*RC[-2]) -> 0.99999999999999978 | AG944: =RC[-11]/SQRT(RC[-6]*RC[-3]) -> -1.0000000000000002 | AH944: =RC[-11]/SQRT(RC[-6]*RC[-4]) -> 1 | AI944: =RC[-11]/SQRT(RC[-6]*RC[-5]) -> 0.99999999999999978
A945: 70286 | B945: 北京 | C945: 143 | D945: 轻度污染 | E945: 2.39 | F945: 8 | G945: 57 | H945: 7 | I945: 162 | J945: 166 | L945: 2013-06-30T01:00:00.000 | M945: =RC[-8]-R[13]C[-8] -> -0.33499999999999908 | N945: =RC[-8]-R[13]C[-8] -> -2.2857142857142865 | O945: =RC[-8]-R[13]C[-8] -> 2.0714285714285694 | P945: =RC[-8]-R[13]C[-8] -> -12.714285714285715 | Q945: =RC[-8]-R[13]C[-8] -> -45.571428571428584 | R945: =RC[-8]-R[13]C[-8] -> -37 | T945: =RC[-7]*RC[-2] -> 12.394999999999966 | U945: =RC[-7]*RC[-3] -> 84.571428571428598 | V945: =RC[-7]*RC[-4] -> -76.642857142857068 | W945: =RC[-7]*RC[-5] -> 470.42857142857144 | X945: =RC[-7]*RC[-6] -> 1686.1428571428576 | Y945: =RC[-12]*RC[-12] -> 0.11222499999999938 | Z945: =RC[-12]*RC[-12] -> 5.2244897959183705 | AA945: =RC[-12]*RC[-12] -> 4.2908163265306039 | AB945: =RC[-12]*RC[-12] -> 161.65306122448982 | AC945: =RC[-12]*RC[-12] -> 2076.7551020408173 | AD945: =RC[-12]*RC[-12] -> 1369 | AE945: =RC[-11]/SQRT(RC[-6]*RC[-1]) -> 1 | AF945: =RC[-11]/SQRT(RC[-6]*RC[-2]) -> 1 | AG945: =RC[-11]/SQRT(RC[-6]*RC[-3]) -> -1 | AH945: =RC[-11]/SQRT(RC[-6]*RC[-4]) -> 1 | AI945: =RC[-11]/SQRT(RC[-6]*RC[-5]) -> 1
A946: 70362 | B946: 北京 | C946: 150 | D946: 轻度污染 | E946: 2.4900000000000002 | F946: 6 | G946: 57 | H946: 4 | I946: 148 | J946: 168 | L946: 2013-06-30T02:00:00.000 | M946: =RC[-8]-R[12]C[-8] -> -0.23499999999999899 | N946: =RC[-8]-R[12]C[-8] -> -4.2857142857142865 | O946: =RC[-8]-R[12]C[-8] -> 2.0714285714285694 | P946: =RC[-8]-R[12]C[-8] -> -15.714285714285715 | Q946: =RC[-8]-R[12]C[-8] -> -59.571428571428584 | R946: =RC[-8]-R[12]C[-8] -> -35 | T946: =RC[-7]*RC[-2] -> 8.2249999999999641 | U946: =RC[-7]*RC[-3] -> 150.00000000000003 | V946: =RC[-7]*RC[-4] -> -72.499999999999929 | W946: =RC[-7]*RC[-5] -> 550 | X946: =RC[-7]*RC[-6] -> 2085.0000000000005 | Y946: =RC[-12]*RC[-12] -> 5.5224999999999524E-2 | Z946: =RC[-12]*RC[-12] -> 18.367346938775515 | AA946: =RC[-12]*RC[-12] -> 4.2908163265306039 | AB946: =RC[-12]*RC[-12] -> 246.93877551020412 | AC946: =RC[-12]*RC[-12] -> 3548.7551020408177 | AD946: =RC[-12]*RC[-12] -> 1225 | AE946: =RC[-11]/SQRT(RC[-6]*RC[-1]) -> 1 | AF946: =RC[-11]/SQRT(RC[-6]*RC[-2]) -> 1 | AG946: =RC[-11]/SQRT(RC[-6]*RC[-3]) -> -1 | AH946: =RC[-11]/SQRT(RC[-6]*RC[-4]) -> 1 | AI946: =RC[-11]/SQRT(RC[-6]*RC[-5]) -> 1
A947: 70438 | B947: 北京 | C947: 157 | D947: 中度污染 | E947: 2.59 | F947: 8 | G947: 54 | H947: 6 | I947: 146 | J947: 166 | L947: 2013-06-30T03:00:00.000 | M947: =RC[-8]-R[11]C[-8] -> -0.13499999999999934 | N947: =RC[-8]-R[11]C[-8] -> -2.2857142857142865 | O947: =RC[-8]-R[11]C[-8] -> -0.9285714285714306 | P947: =RC[-8]-R[11]C[-8] -> -13.714285714285715 | Q947: =RC[-8]-R[11]C[-8] -> -61.571428571428584 | R947: =RC[-8]-R[11]C[-8] -> -37 | T947: =RC[-7]*RC[-2] -> 4.9949999999999761 | U947: =RC[-7]*RC[-3] -> 84.571428571428598 | V947: =RC[-7]*RC[-4] -> 34.357142857142932 | W947: =RC[-7]*RC[-5] -> 507.42857142857144 | X947: =RC[-7]*RC[-6] -> 2278.1428571428578 | Y947: =RC[-12]*RC[-12] -> 1.8224999999999821E-2 | Z947: =RC[-12]*RC[-12] -> 5.2244897959183705 | AA947: =RC[-12]*RC[-12] -> 0.86224489795918746 | AB947: =RC[-12]*RC[-12] -> 188.08163265306126 | AC947: =RC[-12]*RC[-12] -> 3791.040816326532 | AD947: =RC[-12]*RC[-12] -> 1369 | AE947: =RC[-11]/SQRT(RC[-6]*RC[-1]) -> 1.0000000000000002 | AF947: =RC[-11]/SQRT(RC[-6]*RC[-2]) -> 1 | AG947: =RC[-11]/SQRT(RC[-6]*RC[-3]) -> 1 | AH947: =RC[-11]/SQRT(RC[-6]*RC[-4]) -> 1 | AI947: =RC[-11]/SQRT(RC[-6]*RC[-5]) -> 1.0000000000000002
A948: 70514 | B948: 北京 | C948: 163 | D948: 中度污染 | E948: 2.69 | F948: 9 | G948: 54 | H948: 6 | I948: 170 | J948: 168 | L948: 2013-06-30T04:00:00.000 | M948: =RC[-8]-R[10]C[-8] -> -3.4999999999999254E-2 | N948: =RC[-8]-R[10]C[-8] -> -1.2857142857142865 | O948: =RC[-8]-R[10]C[-8] -> -0.9285714285714306 | P948: =RC[-8]-R[10]C[-8] -> -13.714285714285715 | Q948: =RC[-8]-R[10]C[-8] -> -37.571428571428584 | R948: =RC[-8]-R[10]C[-8] -> -35 | T948: =RC[-7]*RC[-2] -> 1.2249999999999739 | U948: =RC[-7]*RC[-3] -> 45.000000000000028 | V948: =RC[-7]*RC[-4] -> 32.500000000000071 | W948: =RC[-7]*RC[-5] -> 480.00000000000006 | X948: =RC[-7]*RC[-6] -> 1315.0000000000005 | Y948: =RC[-12]*RC[-12] -> 1.2249999999999477E-3 | Z948: =RC[-12]*RC[-12] -> 1.653061224489798 | AA948: =RC[-12]*RC[-12] -> 0.86224489795918746 | AB948: =RC[-12]*RC[-12] -> 188.08163265306126 | AC948: =RC[-12]*RC[-12] -> 1411.6122448979602 | AD948: =RC[-12]*RC[-12] -> 1225 | AE948: =RC[-11]/SQRT(RC[-6]*RC[-1]) -> 1 | AF948: =RC[-11]/SQRT(RC[-6]*RC[-2]) -> 1 | AG948: =RC[-11]/SQRT(RC[-6]*RC[-3]) -> 1 | AH948: =RC[-11]/SQRT(RC[-6]*RC[-4]) -> 1 | AI948: =RC[-11]/SQRT(RC[-6]*RC[-5]) -> 1
A949: 70590 | B949: 北京 | C949: 170 | D949: 中度污染 | E949: 2.83 | F949: 13 | G949: 49 | H949: 5 | I949: 180 | J949: 168 | L949: 2013-06-30T05:00:00.000 | M949: =RC[-8]-R[9]C[-8] -> 0.10500000000000087 | N949: =RC[-8]-R[9]C[-8] -> 2.7142857142857135 | O949: =RC[-8]-R[9]C[-8] -> -5.9285714285714306 | P949: =RC[-8]-R[9]C[-8] -> -14.714285714285715 | Q949: =RC[-8]-R[9]C[-8] -> -27.571428571428584 | R949: =RC[-8]-R[9]C[-8] -> -35 | T949: =RC[-7]*RC[-2] -> -3.6750000000000305 | U949: =RC[-7]*RC[-3] -> -94.999999999999972 | V949: =RC[-7]*RC[-4] -> 207.50000000000006 | W949: =RC[-7]*RC[-5] -> 515 | X949: =RC[-7]*RC[-6] -> 965.00000000000045 | Y949: =RC[-12]*RC[-12] -> 1.1025000000000182E-2 | Z949: =RC[-12]*RC[-12] -> 7.3673469387755057 | AA949: =RC[-12]*RC[-12] -> 35.147959183673493 | AB949: =RC[-12]*RC[-12] -> 216.51020408163268 | AC949: =RC[-12]*RC[-12] -> 760.1836734693884 | AD949: =RC[-12]*RC[-12] -> 1225 | AE949: =RC[-11]/SQRT(RC[-6]*RC[-1]) -> -1 | AF949: =RC[-11]/SQRT(RC[-6]*RC[-2]) -> -1 | AG949: =RC[-11]/SQRT(RC[-6]*RC[-3]) -> 1 | AH949: =RC[-11]/SQRT(RC[-6]*RC[-4]) -> 1 | AI949: =RC[-11]/SQRT(RC[-6]*RC[-5]) -> 1
A950: 70666 | B950: 北京 | C950: 176 | D950: 中度污染 | E950: 2.92 | F950: 13 | G950: 51 | H950: 3 | I950: 150 | J950: 172 | L950: 2013-06-30T06:00:00.000 | M950: =RC[-8]-R[8]C[-8] -> 0.19500000000000073 | N950: =RC[-8]-R[8]C[-8] -> 2.7142857142857135 | O950: =RC[-8]-R[8]C[-8] -> -3.9285714285714306 | P950: =RC[-8]-R[8]C[-8] -> -16.714285714285715 | Q950: =RC[-8]-R[8]C[-8] -> -57.571428571428584 | R950: =RC[-8]-R[8]C[-8] -> -31 | T950: =RC[-7]*RC[-2] -> -6.045000000000023 | U950: =RC[-7]*RC[-3] -> -84.142857142857125 | V950: =RC[-7]*RC[-4] -> 121.78571428571435 | W950: =RC[-7]*RC[-5] -> 518.14285714285722 | X950: =RC[-7]*RC[-6] -> 1784.714285714286 | Y950: =RC[-12]*RC[-12] -> 3.8025000000000281E-2 | Z950: =RC[-12]*RC[-12] -> 7.3673469387755057 | AA950: =RC[-12]*RC[-12] -> 15.43367346938777 | AB950: =RC[-12]*RC[-12] -> 279.36734693877554 | AC950: =RC[-12]*RC[-12] -> 3314.4693877551035 | AD950: =RC[-12]*RC[-12] -> 961 | AE950: =RC[-11]/SQRT(RC[-6]*RC[-1]) -> -1.0000000000000002 | AF950: =RC[-11]/SQRT(RC[-6]*RC[-2]) -> -1.0000000000000002 | AG950: =RC[-11]/SQRT(RC[-6]*RC[-3]) -> 1 | AH950: =RC[-11]/SQRT(RC[-6]*RC[-4]) -> 1 | AI950: =RC[-11]/SQRT(RC[-6]*RC[-5]) -> 0.99999999999999989
A951: 70742 | B951: 北京 | C951: 183 | D951: 中度污染 | E951: 3.06 | F951: 14 | G951: 51 | H951: 5 | I951: 170 | J951: 185 | L951: 2013-06-30T07:00:00.000 | M951: =RC[-8]-R[7]C[-8] -> 0.33500000000000085 | N951: =RC[-8]-R[7]C[-8] -> 3.7142857142857135 | O951: =RC[-8]-R[7]C[-8] -> -3.9285714285714306 | P951: =RC[-8]-R[7]C[-8] -> -14.714285714285715 | Q951: =RC[-8]-R[7]C[-8] -> -37.571428571428584 | R951: =RC[-8]-R[7]C[-8] -> -18 | T951: =RC[-7]*RC[-2] -> -6.0300000000000153 | U951: =RC[-7]*RC[-3] -> -66.857142857142847 | V951: =RC[-7]*RC[-4] -> 70.714285714285751 | W951: =RC[-7]*RC[-5] -> 264.85714285714289 | X951: =RC[-7]*RC[-6] -> 676.28571428571445 | Y951: =RC[-12]*RC[-12] -> 0.11222500000000057 | Z951: =RC[-12]*RC[-12] -> 13.795918367346934 | AA951: =RC[-12]*RC[-12] -> 15.43367346938777 | AB951: =RC[-12]*RC[-12] -> 216.51020408163268 | AC951: =RC[-12]*RC[-12] -> 1411.6122448979602 | AD951: =RC[-12]*RC[-12] -> 324 | AE951: =RC[-11]/SQRT(RC[-6]*RC[-1]) -> -1 | AF951: =RC[-11]/SQRT(RC[-6]*RC[-2]) -> -1 | AG951: =RC[-11]/SQRT(RC[-6]*RC[-3]) -> 1 | AH951: =RC[-11]/SQRT(RC[-6]*RC[-4]) -> 1 | AI951: =RC[-11]/SQRT(RC[-6]*RC[-5]) -> 0.99999999999999978
A952: 70818 | B952: 北京 | C952: 192 | D952: 中度污染 | E952: 3.14 | F952: 12 | G952: 56 | H952: 4 | I952: 213 | J952: 217 | L952: 2013-06-30T08:00:00.000 | M952: =RC[-8]-R[6]C[-8] -> 0.41500000000000092 | N952: =RC[-8]-R[6]C[-8] -> 1.7142857142857135 | O952: =RC[-8]-R[6]C[-8] -> 1.0714285714285694 | P952: =RC[-8]-R[6]C[-8] -> -15.714285714285715 | Q952: =RC[-8]-R[6]C[-8] -> 5.4285714285714164 | R952: =RC[-8]-R[6]C[-8] -> 14 | T952: =RC[-7]*RC[-2] -> 5.8100000000000129 | U952: =RC[-7]*RC[-3] -> 23.999999999999989 | V952: =RC[-7]*RC[-4] -> 14.999999999999972 | W952: =RC[-7]*RC[-5] -> -220 | X952: =RC[-7]*RC[-6] -> 75.999999999999829 | Y952: =RC[-12]*RC[-12] -> 0.17222500000000077 | Z952: =RC[-12]*RC[-12] -> 2.9387755102040791 | AA952: =RC[-12]*RC[-12] -> 1.1479591836734651 | AB952: =RC[-12]*RC[-12] -> 246.93877551020412 | AC952: =RC[-12]*RC[-12] -> 29.469387755101909 | AD952: =RC[-12]*RC[-12] -> 196 | AE952: =RC[-11]/SQRT(RC[-6]*RC[-1]) -> 1 | AF952: =RC[-11]/SQRT(RC[-6]*RC[-2]) -> 1 | AG952: =RC[-11]/SQRT(RC[-6]*RC[-3]) -> 1 | AH952: =RC[-11]/SQRT(RC[-6]*RC[-4]) -> -0.99999999999999989 | AI952: =RC[-11]/SQRT(RC[-6]*RC[-5]) -> 1
A953: 70894 | B953: 北京 | C953: 200 | D953: 中度污染 | E953: 3.21 | F953: 12 | G953: 62 | H953: 7 | I953: 242 | J953: 246 | L953: 2013-06-30T09:00:00.000 | M953: =RC[-8]-R[5]C[-8] -> 0.48500000000000076 | N953: =RC[-8]-R[5]C[-8] -> 1.7142857142857135 | O953: =RC[-8]-R[5]C[-8] -> 7.0714285714285694 | P953: =RC[-8]-R[5]C[-8] -> -12.714285714285715 | Q953: =RC[-8]-R[5]C[-8] -> 34.428571428571416 | R953: =RC[-8]-R[5]C[-8] -> 43 | T953: =RC[-7]*RC[-2] -> 20.855000000000032 | U953: =RC[-7]*RC[-3] -> 73.71428571428568 | V953: =RC[-7]*RC[-4] -> 304.0714285714285 | W953: =RC[-7]*RC[-5] -> -546.71428571428578 | X953: =RC[-7]*RC[-6] -> 1480.4285714285709 | Y953: =RC[-12]*RC[-12] -> 0.23522500000000074 | Z953: =RC[-12]*RC[-12] -> 2.9387755102040791 | AA953: =RC[-12]*RC[-12] -> 50.005102040816297 | AB953: =RC[-12]*RC[-12] -> 161.65306122448982 | AC953: =RC[-12]*RC[-12] -> 1185.3265306122441 | AD953: =RC[-12]*RC[-12] -> 1849 | AE953: =RC[-11]/SQRT(RC[-6]*RC[-1]) -> 1 | AF953: =RC[-11]/SQRT(RC[-6]*RC[-2]) -> 1 | AG953: =RC[-11]/SQRT(RC[-6]*RC[-3]) -> 1 | AH953: =RC[-11]/SQRT(RC[-6]*RC[-4]) -> -1 | AI953: =RC[-11]/SQRT(RC[-6]*RC[-5]) -> 1
A954: 70970 | B954: 北京 | C954: 208 | D954: 重度污染 | E954: 3.32 | F954: 11 | G954: 66 | H954: 12 | I954: 310 | J954: 282 | L954: 2013-06-30T10:00:00.000 | M954: =RC[-8]-R[4]C[-8] -> 0.59500000000000064 | N954: =RC[-8]-R[4]C[-8] -> 0.71428571428571352 | O954: =RC[-8]-R[4]C[-8] -> 11.071428571428569 | P954: =RC[-8]-R[4]C[-8] -> -7.7142857142857153 | Q954: =RC[-8]-R[4]C[-8] -> 102.42857142857142 | R954: =RC[-8]-R[4]C[-8] -> 79 | T954: =RC[-7]*RC[-2] -> 47.005000000000052 | U954: =RC[-7]*RC[-3] -> 56.428571428571367 | V954: =RC[-7]*RC[-4] -> 874.642857142857 | W954: =RC[-7]*RC[-5] -> -609.42857142857156 | X954: =RC[-7]*RC[-6] -> 8091.8571428571422 | Y954: =RC[-12]*RC[-12] -> 0.35402500000000076 | Z954: =RC[-12]*RC[-12] -> 0.51020408163265196 | AA954: =RC[-12]*RC[-12] -> 122.57653061224485 | AB954: =RC[-12]*RC[-12] -> 59.510204081632672 | AC954: =RC[-12]*RC[-12] -> 10491.612244897957 | AD954: =RC[-12]*RC[-12] -> 6241 | AE954: =RC[-11]/SQRT(RC[-6]*RC[-1]) -> 1 | AF954: =RC[-11]/SQRT(RC[-6]*RC[-2]) -> 1 | AG954: =RC[-11]/SQRT(RC[-6]*RC[-3]) -> 1 | AH954: =RC[-11]/SQRT(RC[-6]*RC[-4]) -> -1 | AI954: =RC[-11]/SQRT(RC[-6]*RC[-5]) -> 1
A955: 71046 | B955: 北京 | C955: 216 | D955: 重度污染 | E955: 2.78 | F955: 12 | G955: 61 | H955: 44 | I955: 286 | J955: 269 | L955: 2013-06-30T11:00:00.000 | M955: =RC[-8]-R[3]C[-8] -> 5.5000000000000604E-2 | N955: =RC[-8]-R[3]C[-8] -> 1.7142857142857135 | O955: =RC[-8]-R[3]C[-8] -> 6.0714285714285694 | P955: =RC[-8]-R[3]C[-8] -> 24.285714285714285 | Q955: =RC[-8]-R[3]C[-8] -> 78.428571428571416 | R955: =RC[-8]-R[3]C[-8] -> 66 | T955: =RC[-7]*RC[-2] -> 3.6300000000000399 | U955: =RC[-7]*RC[-3] -> 113.1428571428571 | V955: =RC[-7]*RC[-4] -> 400.71428571428555 | W955: =RC[-7]*RC[-5] -> 1602.8571428571429 | X955: =RC[-7]*RC[-6] -> 5176.2857142857138 | Y955: =RC[-12]*RC[-12] -> 3.0250000000000663E-3 | Z955: =RC[-12]*RC[-12] -> 2.9387755102040791 | AA955: =RC[-12]*RC[-12] -> 36.862244897959158 | AB955: =RC[-12]*RC[-12] -> 589.79591836734687 | AC955: =RC[-12]*RC[-12] -> 6151.0408163265283 | AD955: =RC[-12]*RC[-12] -> 4356 | AE955: =RC[-11]/SQRT(RC[-6]*RC[-1]) -> 1 | AF955: =RC[-11]/SQRT(RC[-6]*RC[-2]) -> 1 | AG955: =RC[-11]/SQRT(RC[-6]*RC[-3]) -> 1 | AH955: =RC[-11]/SQRT(RC[-6]*RC[-4]) -> 1.0000000000000002 | AI955: =RC[-11]/SQRT(RC[-6]*RC[-5]) -> 1.0000000000000002
A956: 71122 | B956: 北京 | C956: 222 | D956: 重度污染 | E956: 2.33 | F956: 10 | G956: 49 | H956: 74 | I956: 274 | J956: 241 | L956: 2013-06-30T12:00:00.000 | M956: =RC[-8]-R[2]C[-8] -> -0.39499999999999913 | N956: =RC[-8]-R[2]C[-8] -> -0.28571428571428648 | O956: =RC[-8]-R[2]C[-8] -> -5.9285714285714306 | P956: =RC[-8]-R[2]C[-8] -> 54.285714285714285 | Q956: =RC[-8]-R[2]C[-8] -> 66.428571428571416 | R956: =RC[-8]-R[2]C[-8] -> 38 | T956: =RC[-7]*RC[-2] -> -15.009999999999966 | U956: =RC[-7]*RC[-3] -> -10.857142857142886 | V956: =RC[-7]*RC[-4] -> -225.28571428571436 | W956: =RC[-7]*RC[-5] -> 2062.8571428571427 | X956: =RC[-7]*RC[-6] -> 2524.2857142857138 | Y956: =RC[-12]*RC[-12] -> 0.1560249999999993 | Z956: =RC[-12]*RC[-12] -> 8.1632653061224927E-2 | AA956: =RC[-12]*RC[-12] -> 35.147959183673493 | AB956: =RC[-12]*RC[-12] -> 2946.9387755102039 | AC956: =RC[-12]*RC[-12] -> 4412.7551020408146 | AD956: =RC[-12]*RC[-12] -> 1444 | AE956: =RC[-11]/SQRT(RC[-6]*RC[-1]) -> -1 | AF956: =RC[-11]/SQRT(RC[-6]*RC[-2]) -> -1 | AG956: =RC[-11]/SQRT(RC[-6]*RC[-3]) -> -1 | AH956: =RC[-11]/SQRT(RC[-6]*RC[-4]) -> 1 | AI956: =RC[-11]/SQRT(RC[-6]*RC[-5]) -> 1
A957: 71198 | B957: 北京 | C957: 228 | D957: 重度污染 | E957: 2.0099999999999998 | F957: 9 | G957: 42 | H957: 90 | I957: 281 | J957: 230 | L957: 2013-06-30T13:00:00.000 | M957: =RC[-8]-R[1]C[-8] -> -0.71499999999999941 | N957: =RC[-8]-R[1]C[-8] -> -1.2857142857142865 | O957: =RC[-8]-R[1]C[-8] -> -12.928571428571431 | P957: =RC[-8]-R[1]C[-8] -> 70.285714285714278 | Q957: =RC[-8]-R[1]C[-8] -> 73.428571428571416 | R957: =RC[-8]-R[1]C[-8] -> 27 | T957: =RC[-7]*RC[-2] -> -19.304999999999986 | U957: =RC[-7]*RC[-3] -> -34.714285714285737 | V957: =RC[-7]*RC[-4] -> -349.07142857142861 | W957: =RC[-7]*RC[-5] -> 1897.7142857142856 | X957: =RC[-7]*RC[-6] -> 1982.5714285714282 | Y957: =RC[-12]*RC[-12] -> 0.51122499999999915 | Z957: =RC[-12]*RC[-12] -> 1.653061224489798 | AA957: =RC[-12]*RC[-12] -> 167.14795918367352 | AB957: =RC[-12]*RC[-12] -> 4940.0816326530603 | AC957: =RC[-12]*RC[-12] -> 5391.7551020408146 | AD957: =RC[-12]*RC[-12] -> 729 | AE957: =RC[-11]/SQRT(RC[-6]*RC[-1]) -> -1.0000000000000002 | AF957: =RC[-11]/SQRT(RC[-6]*RC[-2]) -> -1 | AG957: =RC[-11]/SQRT(RC[-6]*RC[-3]) -> -1 | AH957: =RC[-11]/SQRT(RC[-6]*RC[-4]) -> 1 | AI957: =RC[-11]/SQRT(RC[-6]*RC[-5]) -> 1
E958: =AVERAGE(R[-14]C:R[-1]C) -> 2.7249999999999992 | F958: =AVERAGE(R[-14]C:R[-1]C) -> 10.285714285714286 | G958: =AVERAGE(R[-14]C:R[-1]C) -> 54.928571428571431 | H958: =AVERAGE(R[-14]C:R[-1]C) -> 19.714285714285715 | I958: =AVERAGE(R[-14]C:R[-1]C) -> 207.57142857142858 | J958: =AVERAGE(R[-14]C:R[-1]C) -> 203 | T958: =SUM(R[-14]C:R[-1]C) -> 67.139999999999958 | U958: =SUM(R[-14]C:R[-1]C) -> 468.00000000000006 | V958: =SUM(R[-14]C:R[-1]C) -> 1139.9999999999998 | W958: =SUM(R[-14]C:R[-1]C) -> 7910.9999999999991 | X958: =SUM(R[-14]C:R[-1]C) -> 31431 | Y958: =SUM(R[-14]C:R[-1]C) -> 1.8921499999999996 | Z958: =SUM(R[-14]C:R[-1]C) -> 80.857142857142861 | AA958: =SUM(R[-14]C:R[-1]C) -> 514.92857142857144 | AB958: =SUM(R[-14]C:R[-1]C) -> 10556.857142857141 | AC958: =SUM(R[-14]C:R[-1]C) -> 45103.428571428572 | AD958: =SUM(R[-14]C:R[-1]C) -> 24034 | AE958: =RC[-11]/SQRT(RC[-6]*RC[-1]) -> 0.31484045216995532 | AF958: =RC[-11]/SQRT(RC[-6]*RC[-2]) -> 0.33571722843321683 | AG958: =RC[-11]/SQRT(RC[-6]*RC[-3]) -> 0.32405470244248891 | AH958: =RC[-11]/SQRT(RC[-6]*RC[-4]) -> 0.49665067924328976 | AI958: =RC[-11]/SQRT(RC[-6]*RC[-5]) -> 0.9546416802975487

Sheet: Sheet2
A1: id | B1: cityNameCh | C1: AQI | D1: Quality | E1: CO | F1: SO2 | G1: NO2 | H1: O3 | I1: PM10 | J1: PM2p5 | K1: primary_pollutant | L1: time_point | M1: co | N1: so2 | O1: no2 | P1: o3 | Q1: pm10 | R1: pm2.5 | S1: co* | T1: so2* | U1: no2* | V1: o3* | W1: pm10* | X1: pm2.5*2 | Y1: co*2 | Z1: so2*2 | AA1: no2*2 | AB1: o3*2 | AC1: pm10*2 | AE1: SQRTco | AF1: SQRTso2 | AG1: SQRTno2 | AH1: SQRTo3 | AI1: SQRTpm10
A2: 66562 | B2: 北京 | C2: 117 | D2: 轻度污染 | E2: 1.27 | F2: 9 | G2: 83 | H2: 43 | I2: 158 | J2: 85 | L2: 2013-06-28T00:00:00.000 | M2: =RC[-8]-R[24]C[-8] -> -1.0641666666666674 | N2: =RC[-8]-R[24]C[-8] -> -5.2083333333333339 | O2: =RC[-8]-R[24]C[-8] -> 32.333333333333336 | P2: =RC[-8]-R[24]C[-8] -> -23.208333333333329 | Q2: =RC[-8]-R[24]C[-8] -> -111.83333333333331 | R2: =RC[-8]-R[24]C[-8] -> -201.375 | S2: =RC[-6]*RC[-1] -> 214.29656250000014 | T2: =RC[-6]*RC[-2] -> 1048.8281250000002 | U2: =RC[-6]*RC[-3] -> -6511.1250000000009 | V2: =RC[-6]*RC[-4] -> 4673.5781249999991 | W2: =RC[-6]*RC[-5] -> 22520.437499999996 | X2: =RC[-6]*RC[-6] -> 40551.890625 | Y2: =RC[-12]*RC[-12] -> 1.1324506944444459 | Z2: =RC[-12]*RC[-12] -> 27.126736111111118 | AA2: =RC[-12]*RC[-12] -> 1045.4444444444446 | AB2: =RC[-12]*RC[-12] -> 538.62673611111086 | AC2: =RC[-12]*RC[-12] -> 12506.69444444444 | AE2: =SQRT(SUM(RC[-6]:R[23]C[-6])*SUM(RC[-7]:R[23]C[-7])) -> 2092.0885927440036 | AF2: =SQRT(SUM(RC[-6]:R[23]C[-6])*SUM(RC[-8]:R[23]C[-8])) -> 11463.14549322996 | AG2: =SQRT(SUM(RC[-6]:R[23]C[-6])*SUM(RC[-9]:R[23]C[-9])) -> 32730.699027569412 | AH2: =SQRT(SUM(RC[-6]:R[23]C[-6])*SUM(RC[-10]:R[23]C[-10])) -> 75025.925646398784 | AI2: =SQRT(SUM(RC[-6]:R[23]C[-6])*SUM(RC[-11]:R[23]C[-11])) -> 369877.27546624612
A3: 66638 | B3: 北京 | C3: 115 | D3: 轻度污染 | E3: 1.27 | F3: 10 | G3: 71 | H3: 47 | I3: 250 | J3: 123 | L3: 2013-06-28T01:00:00.000 | M3: =RC[-8]-R[23]C[-8] -> -1.0641666666666674 | N3: =RC[-8]-R[23]C[-8] -> -4.2083333333333339 | O3: =RC[-8]-R[23]C[-8] -> 20.333333333333336 | P3: =RC[-8]-R[23]C[-8] -> -19.208333333333329 | Q3: =RC[-8]-R[23]C[-8] -> -19.833333333333314 | R3: =RC[-8]-R[23]C[-8] -> -163.375 | S3: =RC[-6]*RC[-1] -> 173.85822916666677 | T3: =RC[-6]*RC[-2] -> 687.53645833333348 | U3: =RC[-6]*RC[-3] -> -3321.9583333333339 | V3: =RC[-6]*RC[-4] -> 3138.1614583333326 | W3: =RC[-6]*RC[-5] -> 3240.2708333333303 | X3: =RC[-6]*RC[-6] -> 26691.390625 | Y3: =RC[-12]*RC[-12] -> 1.1324506944444459 | Z3: =RC[-12]*RC[-12] -> 17.71006944444445 | AA3: =RC[-12]*RC[-12] -> 413.44444444444451 | AB3: =RC[-12]*RC[-12] -> 368.96006944444429 | AC3: =RC[-12]*RC[-12] -> 393.36111111111035
A4: 66714 | B4: 北京 | C4: 117 | D4: 轻度污染 | E4: 1.44 | F4: 10 | G4: 52 | H4: 53 | I4: 223 | J4: 196 | L4: 2013-06-28T02:00:00.000 | M4: =RC[-8]-R[22]C[-8] -> -0.89416666666666744 | N4: =RC[-8]-R[22]C[-8] -> -4.2083333333333339 | O4: =RC[-8]-R[22]C[-8] -> 1.3333333333333357 | P4: =RC[-8]-R[22]C[-8] -> -13.208333333333329 | Q4: =RC[-8]-R[22]C[-8] -> -46.833333333333314 | R4: =RC[-8]-R[22]C[-8] -> -90.375 | S4: =RC[-6]*RC[-1] -> 80.810312500000066 | T4: =RC[-6]*RC[-2] -> 380.32812500000006 | U4: =RC[-6]*RC[-3] -> -120.50000000000021 | V4: =RC[-6]*RC[-4] -> 1193.7031249999995 | W4: =RC[-6]*RC[-5] -> 4232.5624999999982 | X4: =RC[-6]*RC[-6] -> 8167.640625 | Y4: =RC[-12]*RC[-12] -> 0.79953402777777915 | Z4: =RC[-12]*RC[-12] -> 17.71006944444445 | AA4: =RC[-12]*RC[-12] -> 1.7777777777777841 | AB4: =RC[-12]*RC[-12] -> 174.46006944444431 | AC4: =RC[-12]*RC[-12] -> 2193.3611111111095
A5: 66790 | B5: 北京 | C5: 121 | D5: 轻度污染 | E5: 1.42 | F5: 9 | G5: 38 | H5: 57 | I5: 195 | J5: 220 | L5: 2013-06-28T03:00:00.000 | M5: =RC[-8]-R[21]C[-8] -> -0.91416666666666746 | N5: =RC[-8]-R[21]C[-8] -> -5.2083333333333339 | O5: =RC[-8]-R[21]C[-8] -> -12.666666666666664 | P5: =RC[-8]-R[21]C[-8] -> -9.2083333333333286 | Q5: =RC[-8]-R[21]C[-8] -> -74.833333333333314 | R5: =RC[-8]-R[21]C[-8] -> -66.375 | S5: =RC[-6]*RC[-1] -> 60.677812500000051 | T5: =RC[-6]*RC[-2] -> 345.70312500000006 | U5: =RC[-6]*RC[-3] -> 840.74999999999989 | V5: =RC[-6]*RC[-4] -> 611.20312499999966 | W5: =RC[-6]*RC[-5] -> 4967.0624999999991 | X5: =RC[-6]*RC[-6] -> 4405.640625 | Y5: =RC[-12]*RC[-12] -> 0.83570069444444595 | Z5: =RC[-12]*RC[-12] -> 27.126736111111118 | AA5: =RC[-12]*RC[-12] -> 160.44444444444437 | AB5: =RC[-12]*RC[-12] -> 84.793402777777686 | AC5: =RC[-12]*RC[-12] -> 5600.0277777777746 | AE5: =R[21]C[-12]/R[-3]C -> 0.82679696548188075 | AF5: =R[21]C[-12]/R[-3]C -> 0.44901506336457564 | AG5: =R[21]C[-12]/R[-3]C -> 0.19880418669088259 | AH5: =R[21]C[-12]/R[-3]C -> 0.28239738220433364 | AI5: =R[21]C[-12]/R[-3]C -> 0.79840941736078463
A6: 66866 | B6: 北京 | C6: 129 | D6: 轻度污染 | E6: 1.26 | F6: 10 | G6: 35 | H6: 63 | I6: 139 | J6: 240 | L6: 2013-06-28T04:00:00.000 | M6: =RC[-8]-R[20]C[-8] -> -1.0741666666666674 | N6: =RC[-8]-R[20]C[-8] -> -4.2083333333333339 | O6: =RC[-8]-R[20]C[-8] -> -15.666666666666664 | P6: =RC[-8]-R[20]C[-8] -> -3.2083333333333286 | Q6: =RC[-8]-R[20]C[-8] -> -130.83333333333331 | R6: =RC[-8]-R[20]C[-8] -> -46.375 | S6: =RC[-6]*RC[-1] -> 49.8144791666667 | T6: =RC[-6]*RC[-2] -> 195.16145833333337 | U6: =RC[-6]*RC[-3] -> 726.54166666666652 | V6: =RC[-6]*RC[-4] -> 148.78645833333312 | W6: =RC[-6]*RC[-5] -> 6067.3958333333321 | X6: =RC[-6]*RC[-6] -> 2150.640625 | Y6: =RC[-12]*RC[-12] -> 1.1538340277777792 | Z6: =RC[-12]*RC[-12] -> 17.71006944444445 | AA6: =RC[-12]*RC[-12] -> 245.44444444444437 | AB6: =RC[-12]*RC[-12] -> 10.293402777777747 | AC6: =RC[-12]*RC[-12] -> 17117.361111111106
A7: 66942 | B7: 北京 | C7: 141 | D7: 轻度污染 | E7: 1.39 | F7: 10 | G7: 36 | H7: 50 | I7: 216 | J7: 255 | L7: 2013-06-28T05:00:00.000 | M7: =RC[-8]-R[19]C[-8] -> -0.94416666666666749 | N7: =RC[-8]-R[19]C[-8] -> -4.2083333333333339 | O7: =RC[-8]-R[19]C[-8] -> -14.666666666666664 | P7: =RC[-8]-R[19]C[-8] -> -16.208333333333329 | Q7: =RC[-8]-R[19]C[-8] -> -53.833333333333314 | R7: =RC[-8]-R[19]C[-8] -> -31.375 | S7: =RC[-6]*RC[-1] -> 29.623229166666693 | T7: =RC[-6]*RC[-2] -> 132.03645833333334 | U7: =RC[-6]*RC[-3] -> 460.16666666666657 | V7: =RC[-6]*RC[-4] -> 508.5364583333332 | W7: =RC[-6]*RC[-5] -> 1689.0208333333328 | X7: =RC[-6]*RC[-6] -> 984.390625 | Y7: =RC[-12]*RC[-12] -> 0.89145069444444602 | Z7: =RC[-12]*RC[-12] -> 17.71006944444445 | AA7: =RC[-12]*RC[-12] -> 215.11111111111103 | AB7: =RC[-12]*RC[-12] -> 262.71006944444429 | AC7: =RC[-12]*RC[-12] -> 2898.0277777777756
A8: 67018 | B8: 北京 | C8: 152 | D8: 中度污染 | E8: 1.87 | F8: 14 | G8: 40 | H8: 41 | I8: 248 | J8: 265 | L8: 2013-06-28T06:00:00.000 | M8: =RC[-8]-R[18]C[-8] -> -0.46416666666666728 | N8: =RC[-8]-R[18]C[-8] -> -0.20833333333333393 | O8: =RC[-8]-R[18]C[-8] -> -10.666666666666664 | P8: =RC[-8]-R[18]C[-8] -> -25.208333333333329 | Q8: =RC[-8]-R[18]C[-8] -> -21.833333333333314 | R8: =RC[-8]-R[18]C[-8] -> -21.375 | S8: =RC[-6]*RC[-1] -> 9.9215625000000127 | T8: =RC[-6]*RC[-2] -> 4.4531250000000124 | U8: =RC[-6]*RC[-3] -> 227.99999999999994 | V8: =RC[-6]*RC[-4] -> 538.82812499999989 | W8: =RC[-6]*RC[-5] -> 466.6874999999996 | X8: =RC[-6]*RC[-6] -> 456.890625 | Y8: =RC[-12]*RC[-12] -> 0.21545069444444501 | Z8: =RC[-12]*RC[-12] -> 4.3402777777778026E-2 | AA8: =RC[-12]*RC[-12] -> 113.77777777777773 | AB8: =RC[-12]*RC[-12] -> 635.46006944444423 | AC8: =RC[-12]*RC[-12] -> 476.6944444444436
A9: 67094 | B9: 北京 | C9: 163 | D9: 中度污染 | E9: 2.58 | F9: 19 | G9: 51 | H9: 29 | I9: 134 | J9: 265 | L9: 2013-06-28T07:00:00.000 | M9: =RC[-8]-R[17]C[-8] -> 0.24583333333333268 | N9: =RC[-8]-R[17]C[-8] -> 4.7916666666666661 | O9: =RC[-8]-R[17]C[-8] -> 0.3333333333333357 | P9: =RC[-8]-R[17]C[-8] -> -37.208333333333329 | Q9: =RC[-8]-R[17]C[-8] -> -135.83333333333331 | R9: =RC[-8]-R[17]C[-8] -> -21.375 | S9: =RC[-6]*RC[-1] -> -5.254687499999986 | T9: =RC[-6]*RC[-2] -> -102.42187499999999 | U9: =RC[-6]*RC[-3] -> -7.1250000000000506 | V9: =RC[-6]*RC[-4] -> 795.32812499999989 | W9: =RC[-6]*RC[-5] -> 2903.4374999999995 | X9: =RC[-6]*RC[-6] -> 456.890625 | Y9: =RC[-12]*RC[-12] -> 6.0434027777777455E-2 | Z9: =RC[-12]*RC[-12] -> 22.960069444444439 | AA9: =RC[-12]*RC[-12] -> 0.11111111111111269 | AB9: =RC[-12]*RC[-12] -> 1384.4600694444441 | AC9: =RC[-12]*RC[-12] -> 18450.694444444438
A10: 67170 | B10: 北京 | C10: 172 | D10: 中度污染 | E10: 2.79 | F10: 19 | G10: 53 | H10: 29 | I10: 158 | J10: 271 | L10: 2013-06-28T08:00:00.000 | M10: =RC[-8]-R[16]C[-8] -> 0.45583333333333265 | N10: =RC[-8]-R[16]C[-8] -> 4.7916666666666661 | O10: =RC[-8]-R[16]C[-8] -> 2.3333333333333357 | P10: =RC[-8]-R[16]C[-8] -> -37.208333333333329 | Q10: =RC[-8]-R[16]C[-8] -> -111.83333333333331 | R10: =RC[-8]-R[16]C[-8] -> -15.375 | S10: =RC[-6]*RC[-1] -> -7.0084374999999897 | T10: =RC[-6]*RC[-2] -> -73.671874999999986 | U10: =RC[-6]*RC[-3] -> -35.875000000000036 | V10: =RC[-6]*RC[-4] -> 572.07812499999989 | W10: =RC[-6]*RC[-5] -> 1719.4374999999998 | X10: =RC[-6]*RC[-6] -> 236.390625 | Y10: =RC[-12]*RC[-12] -> 0.20778402777777716 | Z10: =RC[-12]*RC[-12] -> 22.960069444444439 | AA10: =RC[-12]*RC[-12] -> 5.4444444444444553 | AB10: =RC[-12]*RC[-12] -> 1384.4600694444441 | AC10: =RC[-12]*RC[-12] -> 12506.69444444444
A11: 67246 | B11: 北京 | C11: 179 | D11: 中度污染 | E11: 2.81 | F11: 18 | G11: 50 | H11: 35 | I11: 194 | J11: 272 | L11: 2013-06-28T09:00:00.000 | M11: =RC[-8]-R[15]C[-8] -> 0.47583333333333266 | N11: =RC[-8]-R[15]C[-8] -> 3.7916666666666661 | O11: =RC[-8]-R[15]C[-8] -> -0.6666666666666643 | P11: =RC[-8]-R[15]C[-8] -> -31.208333333333329 | Q11: =RC[-8]-R[15]C[-8] -> -75.833333333333314 | R11: =RC[-8]-R[15]C[-8] -> -14.375 | S11: =RC[-6]*RC[-1] -> -6.8401041666666567 | T11: =RC[-6]*RC[-2] -> -54.505208333333321 | U11: =RC[-6]*RC[-3] -> 9.5833333333333002 | V11: =RC[-6]*RC[-4] -> 448.61979166666657 | W11: =RC[-6]*RC[-5] -> 1090.1041666666663 | X11: =RC[-6]*RC[-6] -> 206.640625 | Y11: =RC[-12]*RC[-12] -> 0.22641736111111047 | Z11: =RC[-12]*RC[-12] -> 14.376736111111107 | AA11: =RC[-12]*RC[-12] -> 0.44444444444444131 | AB11: =RC[-12]*RC[-12] -> 973.96006944444412 | AC11: =RC[-12]*RC[-12] -> 5750.6944444444416
A12: 67322 | B12: 北京 | C12: 184 | D12: 中度污染 | E12: 2.84 | F12: 19 | G12: 49 | H12: 40 | I12: 234 | J12: 267 | L12: 2013-06-28T10:00:00.000 | M12: =RC[-8]-R[14]C[-8] -> 0.50583333333333247 | N12: =RC[-8]-R[14]C[-8] -> 4.7916666666666661 | O12: =RC[-8]-R[14]C[-8] -> -1.6666666666666643 | P12: =RC[-8]-R[14]C[-8] -> -26.208333333333329 | Q12: =RC[-8]-R[14]C[-8] -> -35.833333333333314 | R12: =RC[-8]-R[14]C[-8] -> -19.375 | S12: =RC[-6]*RC[-1] -> -9.8005208333333158 | T12: =RC[-6]*RC[-2] -> -92.838541666666657 | U12: =RC[-6]*RC[-3] -> 32.291666666666622 | V12: =RC[-6]*RC[-4] -> 507.78645833333326 | W12: =RC[-6]*RC[-5] -> 694.27083333333292 | X12: =RC[-6]*RC[-6] -> 375.390625 | Y12: =RC[-12]*RC[-12] -> 0.25586736111111025 | Z12: =RC[-12]*RC[-12] -> 22.960069444444439 | AA12: =RC[-12]*RC[-12] -> 2.7777777777777697 | AB12: =RC[-12]*RC[-12] -> 686.87673611111086 | AC12: =RC[-12]*RC[-12] -> 1284.0277777777765
A13: 67398 | B13: 北京 | C13: 191 | D13: 中度污染 | E13: 2.94 | F13: 20 | G13: 51 | H13: 42 | I13: 261 | J13: 272 | L13: 2013-06-28T11:00:00.000 | M13: =RC[-8]-R[13]C[-8] -> 0.60583333333333256 | N13: =RC[-8]-R[13]C[-8] -> 5.7916666666666661 | O13: =RC[-8]-R[13]C[-8] -> 0.3333333333333357 | P13: =RC[-8]-R[13]C[-8] -> -24.208333333333329 | Q13: =RC[-8]-R[13]C[-8] -> -8.8333333333333144 | R13: =RC[-8]-R[13]C[-8] -> -14.375 | S13: =RC[-6]*RC[-1] -> -8.7088541666666561 | T13: =RC[-6]*RC[-2] -> -83.255208333333329 | U13: =RC[-6]*RC[-3] -> -4.7916666666667007 | V13: =RC[-6]*RC[-4] -> 347.99479166666657 | W13: =RC[-6]*RC[-5] -> 126.9791666666664 | X13: =RC[-6]*RC[-6] -> 206.640625 | Y13: =RC[-12]*RC[-12] -> 0.36703402777777683 | Z13: =RC[-12]*RC[-12] -> 33.543402777777771 | AA13: =RC[-12]*RC[-12] -> 0.11111111111111269 | AB13: =RC[-12]*RC[-12] -> 586.0434027777776 | AC13: =RC[-12]*RC[-12] -> 78.027777777777445
A14: 67474 | B14: 北京 | C14: 201 | D14: 重度污染 | E14: 2.99 | F14: 20 | G14: 51 | H14: 50 | I14: 332 | J14: 282 | L14: 2013-06-28T12:00:00.000 | M14: =RC[-8]-R[12]C[-8] -> 0.65583333333333282 | N14: =RC[-8]-R[12]C[-8] -> 5.7916666666666661 | O14: =RC[-8]-R[12]C[-8] -> 0.3333333333333357 | P14: =RC[-8]-R[12]C[-8] -> -16.208333333333329 | Q14: =RC[-8]-R[12]C[-8] -> 62.166666666666686 | R14: =RC[-8]-R[12]C[-8] -> -4.375 | S14: =RC[-6]*RC[-1] -> -2.869270833333331 | T14: =RC[-6]*RC[-2] -> -25.338541666666664 | U14: =RC[-6]*RC[-3] -> -1.4583333333333437 | V14: =RC[-6]*RC[-4] -> 70.911458333333314 | W14: =RC[-6]*RC[-5] -> -271.97916666666674 | X14: =RC[-6]*RC[-6] -> 19.140625 | Y14: =RC[-12]*RC[-12] -> 0.43011736111111043 | Z14: =RC[-12]*RC[-12] -> 33.543402777777771 | AA14: =RC[-12]*RC[-12] -> 0.11111111111111269 | AB14: =RC[-12]*RC[-12] -> 262.71006944444429 | AC14: =RC[-12]*RC[-12] -> 3864.6944444444466
A15: 67550 | B15: 北京 | C15: 212 | D15: 重度污染 | E15: 2.85 | F15: 20 | G15: 48 | H15: 72 | I15: 338 | J15: 281 | L15: 2013-06-28T13:00:00.000 | M15: =RC[-8]-R[11]C[-8] -> 0.5158333333333327 | N15: =RC[-8]-R[11]C[-8] -> 5.7916666666666661 | O15: =RC[-8]-R[11]C[-8] -> -2.6666666666666643 | P15: =RC[-8]-R[11]C[-8] -> 5.7916666666666714 | Q15: =RC[-8]-R[11]C[-8] -> 68.166666666666686 | R15: =RC[-8]-R[11]C[-8] -> -5.375 | S15: =RC[-6]*RC[-1] -> -2.7726041666666634 | T15: =RC[-6]*RC[-2] -> -31.130208333333329 | U15: =RC[-6]*RC[-3] -> 14.333333333333321 | V15: =RC[-6]*RC[-4] -> -31.130208333333357 | W15: =RC[-6]*RC[-5] -> -366.39583333333343 | X15: =RC[-6]*RC[-6] -> 28.890625 | Y15: =RC[-12]*RC[-12] -> 0.26608402777777712 | Z15: =RC[-12]*RC[-12] -> 33.543402777777771 | AA15: =RC[-12]*RC[-12] -> 7.1111111111110983 | AB15: =RC[-12]*RC[-12] -> 33.543402777777835 | AC15: =RC[-12]*RC[-12] -> 4646.6944444444471
A16: 67626 | B16: 北京 | C16: 229 | D16: 重度污染 | E16: 2.57 | F16: 17 | G16: 45 | H16: 100 | I16: 333 | J16: 281 | L16: 2013-06-28T14:00:00.000 | M16: =RC[-8]-R[10]C[-8] -> 0.23583333333333245 | N16: =RC[-8]-R[10]C[-8] -> 2.7916666666666661 | O16: =RC[-8]-R[10]C[-8] -> -5.6666666666666643 | P16: =RC[-8]-R[10]C[-8] -> 33.791666666666671 | Q16: =RC[-8]-R[10]C[-8] -> 63.166666666666686 | R16: =RC[-8]-R[10]C[-8] -> -5.375 | S16: =RC[-6]*RC[-1] -> -1.267604166666662 | T16: =RC[-6]*RC[-2] -> -15.00520833333333 | U16: =RC[-6]*RC[-3] -> 30.458333333333321 | V16: =RC[-6]*RC[-4] -> -181.63020833333337 | W16: =RC[-6]*RC[-5] -> -339.52083333333343 | X16: =RC[-6]*RC[-6] -> 28.890625 | Y16: =RC[-12]*RC[-12] -> 5.5617361111110694E-2 | Z16: =RC[-12]*RC[-12] -> 7.7934027777777741 | AA16: =RC[-12]*RC[-12] -> 32.111111111111086 | AB16: =RC[-12]*RC[-12] -> 1141.8767361111115 | AC16: =RC[-12]*RC[-12] -> 3990.0277777777801
A17: 67702 | B17: 北京 | C17: 241 | D17: 重度污染 | E17: 2.67 | F17: 13 | G17: 47 | H17: 99 | I17: 398 | J17: 342 | L17: 2013-06-28T15:00:00.000 | M17: =RC[-8]-R[9]C[-8] -> 0.33583333333333254 | N17: =RC[-8]-R[9]C[-8] -> -1.2083333333333339 | O17: =RC[-8]-R[9]C[-8] -> -3.6666666666666643 | P17: =RC[-8]-R[9]C[-8] -> 32.791666666666671 | Q17: =RC[-8]-R[9]C[-8] -> 128.16666666666669 | R17: =RC[-8]-R[9]C[-8] -> 55.625 | S17: =RC[-6]*RC[-1] -> 18.680729166666623 | T17: =RC[-6]*RC[-2] -> -67.2135416666667 | U17: =RC[-6]*RC[-3] -> -203.9583333333332 | V17: =RC[-6]*RC[-4] -> 1824.0364583333335 | W17: =RC[-6]*RC[-5] -> 7129.2708333333339 | X17: =RC[-6]*RC[-6] -> 3094.140625 | Y17: =RC[-12]*RC[-12] -> 0.11278402777777724 | Z17: =RC[-12]*RC[-12] -> 1.460069444444446 | AA17: =RC[-12]*RC[-12] -> 13.444444444444427 | AB17: =RC[-12]*RC[-12] -> 1075.2934027777781 | AC17: =RC[-12]*RC[-12] -> 16426.694444444449
A18: 67778 | B18: 北京 | C18: 257 | D18: 重度污染 | E18: 2.84 | F18: 14 | G18: 50 | H18: 106 | I18: 475 | J18: 405 | L18: 2013-06-28T16:00:00.000 | M18: =RC[-8]-R[8]C[-8] -> 0.50583333333333247 | N18: =RC[-8]-R[8]C[-8] -> -0.20833333333333393 | O18: =RC[-8]-R[8]C[-8] -> -0.6666666666666643 | P18: =RC[-8]-R[8]C[-8] -> 39.791666666666671 | Q18: =RC[-8]-R[8]C[-8] -> 205.16666666666669 | R18: =RC[-8]-R[8]C[-8] -> 118.625 | S18: =RC[-6]*RC[-1] -> 60.004479166666563 | T18: =RC[-6]*RC[-2] -> -24.713541666666735 | U18: =RC[-6]*RC[-3] -> -79.083333333333059 | V18: =RC[-6]*RC[-4] -> 4720.2864583333339 | W18: =RC[-6]*RC[-5] -> 24337.895833333336 | X18: =RC[-6]*RC[-6] -> 14071.890625 | Y18: =RC[-12]*RC[-12] -> 0.25586736111111025 | Z18: =RC[-12]*RC[-12] -> 4.3402777777778026E-2 | AA18: =RC[-12]*RC[-12] -> 0.44444444444444131 | AB18: =RC[-12]*RC[-12] -> 1583.3767361111115 | AC18: =RC[-12]*RC[-12] -> 42093.361111111117
A19: 67854 | B19: 北京 | C19: 273 | D19: 重度污染 | E19: 2.95 | F19: 15 | G19: 53 | H19: 113 | I19: 453 | J19: 446 | L19: 2013-06-28T17:00:00.000 | M19: =RC[-8]-R[7]C[-8] -> 0.61583333333333279 | N19: =RC[-8]-R[7]C[-8] -> 0.79166666666666607 | O19: =RC[-8]-R[7]C[-8] -> 2.3333333333333357 | P19: =RC[-8]-R[7]C[-8] -> 46.791666666666671 | Q19: =RC[-8]-R[7]C[-8] -> 183.16666666666669 | R19: =RC[-8]-R[7]C[-8] -> 159.625 | S19: =RC[-6]*RC[-1] -> 98.30239583333325 | T19: =RC[-6]*RC[-2] -> 126.36979166666657 | U19: =RC[-6]*RC[-3] -> 372.45833333333371 | V19: =RC[-6]*RC[-4] -> 7469.119791666667 | W19: =RC[-6]*RC[-5] -> 29237.979166666668 | X19: =RC[-6]*RC[-6] -> 25480.140625 | Y19: =RC[-12]*RC[-12] -> 0.37925069444444376 | Z19: =RC[-12]*RC[-12] -> 0.62673611111111016 | AA19: =RC[-12]*RC[-12] -> 5.4444444444444553 | AB19: =RC[-12]*RC[-12] -> 2189.4600694444448 | AC19: =RC[-12]*RC[-12] -> 33550.027777777788
A20: 67930 | B20: 北京 | C20: 288 | D20: 重度污染 | E20: 3.16 | F20: 15 | G20: 56 | H20: 101 | I20: 458 | J20: 453 | L20: 2013-06-28T18:00:00.000 | M20: =RC[-8]-R[6]C[-8] -> 0.82583333333333275 | N20: =RC[-8]-R[6]C[-8] -> 0.79166666666666607 | O20: =RC[-8]-R[6]C[-8] -> 5.3333333333333357 | P20: =RC[-8]-R[6]C[-8] -> 34.791666666666671 | Q20: =RC[-8]-R[6]C[-8] -> 188.16666666666669 | R20: =RC[-8]-R[6]C[-8] -> 166.625 | S20: =RC[-6]*RC[-1] -> 137.60447916666658 | T20: =RC[-6]*RC[-2] -> 131.91145833333323 | U20: =RC[-6]*RC[-3] -> 888.66666666666708 | V20: =RC[-6]*RC[-4] -> 5797.1614583333339 | W20: =RC[-6]*RC[-5] -> 31353.270833333336 | X20: =RC[-6]*RC[-6] -> 27763.890625 | Y20: =RC[-12]*RC[-12] -> 0.68200069444444344 | Z20: =RC[-12]*RC[-12] -> 0.62673611111111016 | AA20: =RC[-12]*RC[-12] -> 28.444444444444471 | AB20: =RC[-12]*RC[-12] -> 1210.4600694444448 | AC20: =RC[-12]*RC[-12] -> 35406.694444444453
A21: 68006 | B21: 北京 | C21: 304 | D21: 严重污染 | E21: 3.2 | F21: 13 | G21: 64 | H21: 84 | I21: 505 | J21: 464 | L21: 2013-06-28T19:00:00.000 | M21: =RC[-8]-R[5]C[-8] -> 0.86583333333333279 | N21: =RC[-8]-R[5]C[-8] -> -1.2083333333333339 | O21: =RC[-8]-R[5]C[-8] -> 13.333333333333336 | P21: =RC[-8]-R[5]C[-8] -> 17.791666666666671 | Q21: =RC[-8]-R[5]C[-8] -> 235.16666666666669 | R21: =RC[-8]-R[5]C[-8] -> 177.625 | S21: =RC[-6]*RC[-1] -> 153.79364583333324 | T21: =RC[-6]*RC[-2] -> -214.63020833333343 | U21: =RC[-6]*RC[-3] -> 2368.3333333333339 | V21: =RC[-6]*RC[-4] -> 3160.2447916666674 | W21: =RC[-6]*RC[-5] -> 41771.479166666672 | X21: =RC[-6]*RC[-6] -> 31550.640625 | Y21: =RC[-12]*RC[-12] -> 0.74966736111111021 | Z21: =RC[-12]*RC[-12] -> 1.460069444444446 | AA21: =RC[-12]*RC[-12] -> 177.77777777777783 | AB21: =RC[-12]*RC[-12] -> 316.54340277777794 | AC21: =RC[-12]*RC[-12] -> 55303.361111111117
A22: 68082 | B22: 北京 | C22: 319 | D22: 严重污染 | E22: 3.18 | F22: 14 | G22: 63 | H22: 69 | I22: 383 | J22: 461 | L22: 2013-06-28T20:00:00.000 | M22: =RC[-8]-R[4]C[-8] -> 0.84583333333333277 | N22: =RC[-8]-R[4]C[-8] -> -0.20833333333333393 | O22: =RC[-8]-R[4]C[-8] -> 12.333333333333336 | P22: =RC[-8]-R[4]C[-8] -> 2.7916666666666714 | Q22: =RC[-8]-R[4]C[-8] -> 113.16666666666669 | R22: =RC[-8]-R[4]C[-8] -> 174.625 | S22: =RC[-6]*RC[-1] -> 147.70364583333324 | T22: =RC[-6]*RC[-2] -> -36.380208333333435 | U22: =RC[-6]*RC[-3] -> 2153.7083333333339 | V22: =RC[-6]*RC[-4] -> 487.49479166666748 | W22: =RC[-6]*RC[-5] -> 19761.729166666672 | X22: =RC[-6]*RC[-6] -> 30493.890625 | Y22: =RC[-12]*RC[-12] -> 0.71543402777777687 | Z22: =RC[-12]*RC[-12] -> 4.3402777777778026E-2 | AA22: =RC[-12]*RC[-12] -> 152.11111111111117 | AB22: =RC[-12]*RC[-12] -> 7.7934027777778043 | AC22: =RC[-12]*RC[-12] -> 12806.694444444449
A23: 68158 | B23: 北京 | C23: 333 | D23: 严重污染 | E23: 3.1 | F23: 16 | G23: 62 | H23: 56 | I23: 391 | J23: 433 | L23: 2013-06-28T21:00:00.000 | M23: =RC[-8]-R[3]C[-8] -> 0.7658333333333327 | N23: =RC[-8]-R[3]C[-8] -> 1.7916666666666661 | O23: =RC[-8]-R[3]C[-8] -> 11.333333333333336 | P23: =RC[-8]-R[3]C[-8] -> -10.208333333333329 | Q23: =RC[-8]-R[3]C[-8] -> 121.16666666666669 | R23: =RC[-8]-R[3]C[-8] -> 146.625 | S23: =RC[-6]*RC[-1] -> 112.29031249999991 | T23: =RC[-6]*RC[-2] -> 262.70312499999989 | U23: =RC[-6]*RC[-3] -> 1661.7500000000005 | V23: =RC[-6]*RC[-4] -> -1496.7968749999993 | W23: =RC[-6]*RC[-5] -> 17766.062500000004 | X23: =RC[-6]*RC[-6] -> 21498.890625 | Y23: =RC[-12]*RC[-12] -> 0.58650069444444353 | Z23: =RC[-12]*RC[-12] -> 3.2100694444444424 | AA23: =RC[-12]*RC[-12] -> 128.44444444444449 | AB23: =RC[-12]*RC[-12] -> 104.21006944444434 | AC23: =RC[-12]*RC[-12] -> 14681.361111111115
A24: 68234 | B24: 北京 | C24: 342 | D24: 严重污染 | E24: 1.92 | F24: 13 | G24: 44 | H24: 91 | I24: 0 | J24: 265 | L24: 2013-06-28T22:00:00.000 | M24: =RC[-8]-R[2]C[-8] -> -0.41416666666666746 | N24: =RC[-8]-R[2]C[-8] -> -1.2083333333333339 | O24: =RC[-8]-R[2]C[-8] -> -6.6666666666666643 | P24: =RC[-8]-R[2]C[-8] -> 24.791666666666671 | Q24: =RC[-8]-R[2]C[-8] -> -269.83333333333331 | R24: =RC[-8]-R[2]C[-8] -> -21.375 | S24: =RC[-6]*RC[-1] -> 8.8528125000000166 | T24: =RC[-6]*RC[-2] -> 25.828125000000014 | U24: =RC[-6]*RC[-3] -> 142.49999999999994 | V24: =RC[-6]*RC[-4] -> -529.92187500000011 | W24: =RC[-6]*RC[-5] -> 5767.6875 | X24: =RC[-6]*RC[-6] -> 456.890625 | Y24: =RC[-12]*RC[-12] -> 0.17153402777777843 | Z24: =RC[-12]*RC[-12] -> 1.460069444444446 | AA24: =RC[-12]*RC[-12] -> 44.444444444444414 | AB24: =RC[-12]*RC[-12] -> 614.62673611111131 | AC24: =RC[-12]*RC[-12] -> 72810.027777777766
A25: 68310 | B25: 北京 | C25: 339 | D25: 严重污染 | E25: 0.71 | F25: 4 | G25: 24 | H25: 119 | I25: 0 | J25: 29 | L25: 2013-06-28T23:00:00.000 | M25: =RC[-8]-R[1]C[-8] -> -1.6241666666666674 | N25: =RC[-8]-R[1]C[-8] -> -10.208333333333334 | O25: =RC[-8]-R[1]C[-8] -> -26.666666666666664 | P25: =RC[-8]-R[1]C[-8] -> 52.791666666666671 | Q25: =RC[-8]-R[1]C[-8] -> -269.83333333333331 | R25: =RC[-8]-R[1]C[-8] -> -257.375 | S25: =RC[-6]*RC[-1] -> 418.01989583333352 | T25: =RC[-6]*RC[-2] -> 2627.369791666667 | U25: =RC[-6]*RC[-3] -> 6863.333333333333 | V25: =RC[-6]*RC[-4] -> -13587.255208333334 | W25: =RC[-6]*RC[-5] -> 69448.354166666657 | X25: =RC[-6]*RC[-6] -> 66241.890625 | Y25: =RC[-12]*RC[-12] -> 2.6379173611111137 | Z25: =RC[-12]*RC[-12] -> 104.21006944444446 | AA25: =RC[-12]*RC[-12] -> 711.11111111111097 | AB25: =RC[-12]*RC[-12] -> 2786.9600694444448 | AC25: =RC[-12]*RC[-12] -> 72810.027777777766
E26: =SUM(R[-24]C:R[-1]C)/24 -> 2.3341666666666674 | F26: =SUM(R[-24]C:R[-1]C)/24 -> 14.208333333333334 | G26: =SUM(R[-24]C:R[-1]C)/24 -> 50.666666666666664 | H26: =SUM(R[-24]C:R[-1]C)/24 -> 66.208333333333329 | I26: =SUM(R[-24]C:R[-1]C)/24 -> 269.83333333333331 | J26: =SUM(R[-24]C:R[-1]C)/24 -> 286.375 | M26: =RC[-8]-RC[-8] -> 0 | N26: =RC[-8]-RC[-8] -> 0 | O26: =RC[-8]-RC[-8] -> 0 | P26: =RC[-8]-RC[-8] -> 0 | Q26: =RC[-8]-RC[-8] -> 0 | R26: =RC[-8]-RC[-8] -> 0 | S26: =SUM(R[-24]C:R[-1]C) -> 1729.7325000000003 | T26: =SUM(R[-24]C:R[-1]C) -> 5147.125 | U26: =SUM(R[-24]C:R[-1]C) -> 6506.9999999999991 | V26: =SUM(R[-24]C:R[-1]C) -> 21187.124999999993 | W26: =SUM(R[-24]C:R[-1]C) -> 295313.5 | X26: =RC[-6]*RC[-6] -> 0 | Y26: =RC[-12]*RC[-12] -> 0 | Z26: =RC[-12]*RC[-12] -> 0 | AA26: =RC[-12]*RC[-12] -> 0 | AB26: =RC[-12]*RC[-12] -> 0 | AC26: =RC[-12]*RC[-12] -> 0
A27: 68386 | B27: 北京 | C27: 326 | D27: 严重污染 | E27: 0.59 | F27: 3 | G27: 25 | H27: 107 | I27: 6 | J27: 23 | L27: 2013-06-29T00:00:00.000 | M27: =RC[-8]-R[24]C[-8] -> -0.92791666666666661 | N27: =RC[-8]-R[24]C[-8] -> -2.75 | O27: =RC[-8]-R[24]C[-8] -> -18.083333333333336 | P27: =RC[-8]-R[24]C[-8] -> 57.083333333333336 | Q27: =RC[-8]-R[24]C[-8] -> -92.375 | R27: =RC[-8]-R[24]C[-8] -> -72.666666666666671 | S27: =RC[-6]*RC[-1] -> 67.42861111111111 | T27: =RC[-6]*RC[-2] -> 199.83333333333334 | U27: =RC[-6]*RC[-3] -> 1314.0555555555559 | V27: =RC[-6]*RC[-4] -> -4148.0555555555557 | W27: =RC[-6]*RC[-5] -> 6712.5833333333339 | X27: =RC[-6]*RC[-6] -> 5280.4444444444453 | Y27: =RC[-12]*RC[-12] -> 0.86102934027777767 | Z27: =RC[-12]*RC[-12] -> 7.5625 | AA27: =RC[-12]*RC[-12] -> 327.00694444444451 | AB27: =RC[-12]*RC[-12] -> 3258.5069444444448 | AC27: =RC[-12]*RC[-12] -> 8533.140625 | AE27: =SQRT(SUM(RC[-6]:R[23]C[-6])*SUM(RC[-7]:R[23]C[-7])) -> 875.73619945036978 | AF27: =SQRT(SUM(RC[-6]:R[23]C[-6])*SUM(RC[-8]:R[23]C[-8])) -> 2695.8005613670066 | AG27: =SQRT(SUM(RC[-6]:R[23]C[-6])*SUM(RC[-9]:R[23]C[-9])) -> 17062.931941622592 | AH27: =SQRT(SUM(RC[-6]:R[23]C[-6])*SUM(RC[-10]:R[23]C[-10])) -> 24732.790510665076 | AI27: =SQRT(SUM(RC[-6]:R[23]C[-6])*SUM(RC[-11]:R[23]C[-11])) -> 93162.808232863681
A28: 68462 | B28: 北京 | C28: 318 | D28: 严重污染 | E28: 0.61 | F28: 3 | G28: 30 | H28: 85 | I28: 0 | J28: 25 | L28: 2013-06-29T01:00:00.000 | M28: =RC[-8]-R[23]C[-8] -> -0.90791666666666659 | N28: =RC[-8]-R[23]C[-8] -> -2.75 | O28: =RC[-8]-R[23]C[-8] -> -13.083333333333336 | P28: =RC[-8]-R[23]C[-8] -> 35.083333333333336 | Q28: =RC[-8]-R[23]C[-8] -> -98.375 | R28: =RC[-8]-R[23]C[-8] -> -70.666666666666671 | S28: =RC[-6]*RC[-1] -> 64.159444444444446 | T28: =RC[-6]*RC[-2] -> 194.33333333333334 | U28: =RC[-6]*RC[-3] -> 924.55555555555577 | V28: =RC[-6]*RC[-4] -> -2479.2222222222226 | W28: =RC[-6]*RC[-5] -> 6951.8333333333339 | X28: =RC[-6]*RC[-6] -> 4993.7777777777783 | Y28: =RC[-12]*RC[-12] -> 0.82431267361111094 | Z28: =RC[-12]*RC[-12] -> 7.5625 | AA28: =RC[-12]*RC[-12] -> 171.17361111111117 | AB28: =RC[-12]*RC[-12] -> 1230.8402777777781 | AC28: =RC[-12]*RC[-12] -> 9677.640625
A29: 68538 | B29: 北京 | C29: 318 | D29: 严重污染 | E29: 0.59 | F29: 3 | G29: 32 | H29: 69 | I29: 6 | J29: 29 | L29: 2013-06-29T02:00:00.000 | M29: =RC[-8]-R[22]C[-8] -> -0.92791666666666661 | N29: =RC[-8]-R[22]C[-8] -> -2.75 | O29: =RC[-8]-R[22]C[-8] -> -11.083333333333336 | P29: =RC[-8]-R[22]C[-8] -> 19.083333333333336 | Q29: =RC[-8]-R[22]C[-8] -> -92.375 | R29: =RC[-8]-R[22]C[-8] -> -66.666666666666671 | S29: =RC[-6]*RC[-1] -> 61.861111111111114 | T29: =RC[-6]*RC[-2] -> 183.33333333333334 | U29: =RC[-6]*RC[-3] -> 738.88888888888914 | V29: =RC[-6]*RC[-4] -> -1272.2222222222224 | W29: =RC[-6]*RC[-5] -> 6158.3333333333339 | X29: =RC[-6]*RC[-6] -> 4444.4444444444453 | Y29: =RC[-12]*RC[-12] -> 0.86102934027777767 | Z29: =RC[-12]*RC[-12] -> 7.5625 | AA29: =RC[-12]*RC[-12] -> 122.84027777777783 | AB29: =RC[-12]*RC[-12] -> 364.1736111111112 | AC29: =RC[-12]*RC[-12] -> 8533.140625 | AE29: =R[22]C[-12]/R[-2]C -> 0.98928573910393858 | AF29: =R[22]C[-12]/R[-2]C -> 0.94146430428555572 | AG29: =R[22]C[-12]/R[-2]C -> 0.92086557693744631 | AH29: =R[22]C[-12]/R[-2]C -> -0.82100184602746773 | AI29: =R[22]C[-12]/R[-2]C -> 0.97465932728259175
A30: 68614 | B30: 北京 | C30: 315 | D30: 严重污染 | E30: 0.64 | F30: 3 | G30: 31 | H30: 69 | I30: 6 | J30: 43 | L30: 2013-06-29T03:00:00.000 | M30: =RC[-8]-R[21]C[-8] -> -0.87791666666666657 | N30: =RC[-8]-R[21]C[-8] -> -2.75 | O30: =RC[-8]-R[21]C[-8] -> -12.083333333333336 | P30: =RC[-8]-R[21]C[-8] -> 19.083333333333336 | Q30: =RC[-8]-R[21]C[-8] -> -92.375 | R30: =RC[-8]-R[21]C[-8] -> -52.666666666666671 | S30: =RC[-6]*RC[-1] -> 46.236944444444447 | T30: =RC[-6]*RC[-2] -> 144.83333333333334 | U30: =RC[-6]*RC[-3] -> 636.38888888888903 | V30: =RC[-6]*RC[-4] -> -1005.0555555555558 | W30: =RC[-6]*RC[-5] -> 4865.0833333333339 | X30: =RC[-6]*RC[-6] -> 2773.7777777777783 | Y30: =RC[-12]*RC[-12] -> 0.7707376736111109 | Z30: =RC[-12]*RC[-12] -> 7.5625 | AA30: =RC[-12]*RC[-12] -> 146.00694444444451 | AB30: =RC[-12]*RC[-12] -> 364.1736111111112 | AC30: =RC[-12]*RC[-12] -> 8533.140625
A31: 68690 | B31: 北京 | C31: 311 | D31: 严重污染 | E31: 0.62 | F31: 3 | G31: 30 | H31: 59 | I31: 0 | J31: 49 | L31: 2013-06-29T04:00:00.000 | M31: =RC[-8]-R[20]C[-8] -> -0.89791666666666659 | N31: =RC[-8]-R[20]C[-8] -> -2.75 | O31: =RC[-8]-R[20]C[-8] -> -13.083333333333336 | P31: =RC[-8]-R[20]C[-8] -> 9.0833333333333357 | Q31: =RC[-8]-R[20]C[-8] -> -98.375 | R31: =RC[-8]-R[20]C[-8] -> -46.666666666666671 | S31: =RC[-6]*RC[-1] -> 41.902777777777779 | T31: =RC[-6]*RC[-2] -> 128.33333333333334 | U31: =RC[-6]*RC[-3] -> 610.55555555555577 | V31: =RC[-6]*RC[-4] -> -423.88888888888903 | W31: =RC[-6]*RC[-5] -> 4590.8333333333339 | X31: =RC[-6]*RC[-6] -> 2177.7777777777783 | Y31: =RC[-12]*RC[-12] -> 0.80625434027777765 | Z31: =RC[-12]*RC[-12] -> 7.5625 | AA31: =RC[-12]*RC[-12] -> 171.17361111111117 | AB31: =RC[-12]*RC[-12] -> 82.506944444444485 | AC31: =RC[-12]*RC[-12] -> 9677.640625
A32: 68766 | B32: 北京 | C32: 306 | D32: 严重污染 | E32: 0.69 | F32: 3 | G32: 23 | H32: 57 | I32: 6 | J32: 50 | L32: 2013-06-29T05:00:00.000 | M32: =RC[-8]-R[19]C[-8] -> -0.82791666666666663 | N32: =RC[-8]-R[19]C[-8] -> -2.75 | O32: =RC[-8]-R[19]C[-8] -> -20.083333333333336 | P32: =RC[-8]-R[19]C[-8] -> 7.0833333333333357 | Q32: =RC[-8]-R[19]C[-8] -> -92.375 | R32: =RC[-8]-R[19]C[-8] -> -45.666666666666671 | S32: =RC[-6]*RC[-1] -> 37.808194444444446 | T32: =RC[-6]*RC[-2] -> 125.58333333333334 | U32: =RC[-6]*RC[-3] -> 917.13888888888914 | V32: =RC[-6]*RC[-4] -> -323.47222222222234 | W32: =RC[-6]*RC[-5] -> 4218.4583333333339 | X32: =RC[-6]*RC[-6] -> 2085.4444444444448 | Y32: =RC[-12]*RC[-12] -> 0.68544600694444435 | Z32: =RC[-12]*RC[-12] -> 7.5625 | AA32: =RC[-12]*RC[-12] -> 403.34027777777789 | AB32: =RC[-12]*RC[-12] -> 50.173611111111143 | AC32: =RC[-12]*RC[-12] -> 8533.140625
A33: 68842 | B33: 北京 | C33: 300 | D33: 重度污染 | E33: 0.7 | F33: 3 | G33: 22 | H33: 59 | I33: 36 | J33: 51 | L33: 2013-06-29T06:00:00.000 | M33: =RC[-8]-R[18]C[-8] -> -0.81791666666666663 | N33: =RC[-8]-R[18]C[-8] -> -2.75 | O33: =RC[-8]-R[18]C[-8] -> -21.083333333333336 | P33: =RC[-8]-R[18]C[-8] -> 9.0833333333333357 | Q33: =RC[-8]-R[18]C[-8] -> -62.375 | R33: =RC[-8]-R[18]C[-8] -> -44.666666666666671 | S33: =RC[-6]*RC[-1] -> 36.533611111111114 | T33: =RC[-6]*RC[-2] -> 122.83333333333334 | U33: =RC[-6]*RC[-3] -> 941.7222222222224 | V33: =RC[-6]*RC[-4] -> -405.7222222222224 | W33: =RC[-6]*RC[-5] -> 2786.0833333333335 | X33: =RC[-6]*RC[-6] -> 1995.1111111111115 | Y33: =RC[-12]*RC[-12] -> 0.668987673611111 | Z33: =RC[-12]*RC[-12] -> 7.5625 | AA33: =RC[-12]*RC[-12] -> 444.50694444444457 | AB33: =RC[-12]*RC[-12] -> 82.506944444444485 | AC33: =RC[-12]*RC[-12] -> 3890.640625
A34: 68918 | B34: 北京 | C34: 295 | D34: 重度污染 | E34: 0.76 | F34: 4 | G34: 26 | H34: 56 | I34: 15 | J34: 54 | L34: 2013-06-29T07:00:00.000 | M34: =RC[-8]-R[17]C[-8] -> -0.75791666666666657 | N34: =RC[-8]-R[17]C[-8] -> -1.75 | O34: =RC[-8]-R[17]C[-8] -> -17.083333333333336 | P34: =RC[-8]-R[17]C[-8] -> 6.0833333333333357 | Q34: =RC[-8]-R[17]C[-8] -> -83.375 | R34: =RC[-8]-R[17]C[-8] -> -41.666666666666671 | S34: =RC[-6]*RC[-1] -> 31.579861111111111 | T34: =RC[-6]*RC[-2] -> 72.916666666666671 | U34: =RC[-6]*RC[-3] -> 711.80555555555577 | V34: =RC[-6]*RC[-4] -> -253.47222222222234 | W34: =RC[-6]*RC[-5] -> 3473.9583333333339 | X34: =RC[-6]*RC[-6] -> 1736.1111111111115 | Y34: =RC[-12]*RC[-12] -> 0.57443767361111098 | Z34: =RC[-12]*RC[-12] -> 3.0625 | AA34: =RC[-12]*RC[-12] -> 291.84027777777789 | AB34: =RC[-12]*RC[-12] -> 37.006944444444471 | AC34: =RC[-12]*RC[-12] -> 6951.390625
A35: 68994 | B35: 北京 | C35: 290 | D35: 重度污染 | E35: 0.88 | F35: 4 | G35: 31 | H35: 56 | I35: 42 | J35: 54 | L35: 2013-06-29T08:00:00.000 | M35: =RC[-8]-R[16]C[-8] -> -0.63791666666666658 | N35: =RC[-8]-R[16]C[-8] -> -1.75 | O35: =RC[-8]-R[16]C[-8] -> -12.083333333333336 | P35: =RC[-8]-R[16]C[-8] -> 6.0833333333333357 | Q35: =RC[-8]-R[16]C[-8] -> -56.375 | R35: =RC[-8]-R[16]C[-8] -> -41.666666666666671 | S35: =RC[-6]*RC[-1] -> 26.579861111111111 | T35: =RC[-6]*RC[-2] -> 72.916666666666671 | U35: =RC[-6]*RC[-3] -> 503.4722222222224 | V35: =RC[-6]*RC[-4] -> -253.47222222222234 | W35: =RC[-6]*RC[-5] -> 2348.9583333333335 | X35: =RC[-6]*RC[-6] -> 1736.1111111111115 | Y35: =RC[-12]*RC[-12] -> 0.40693767361111099 | Z35: =RC[-12]*RC[-12] -> 3.0625 | AA35: =RC[-12]*RC[-12] -> 146.00694444444451 | AB35: =RC[-12]*RC[-12] -> 37.006944444444471 | AC35: =RC[-12]*RC[-12] -> 3178.140625
A36: 69070 | B36: 北京 | C36: 286 | D36: 重度污染 | E36: 0.97 | F36: 4 | G36: 35 | H36: 58 | I36: 0 | J36: 62 | L36: 2013-06-29T09:00:00.000 | M36: =RC[-8]-R[15]C[-8] -> -0.54791666666666661 | N36: =RC[-8]-R[15]C[-8] -> -1.75 | O36: =RC[-8]-R[15]C[-8] -> -8.0833333333333357 | P36: =RC[-8]-R[15]C[-8] -> 8.0833333333333357 | Q36: =RC[-8]-R[15]C[-8] -> -98.375 | R36: =RC[-8]-R[15]C[-8] -> -33.666666666666671 | S36: =RC[-6]*RC[-1] -> 18.446527777777778 | T36: =RC[-6]*RC[-2] -> 58.916666666666671 | U36: =RC[-6]*RC[-3] -> 272.13888888888903 | V36: =RC[-6]*RC[-4] -> -272.13888888888903 | W36: =RC[-6]*RC[-5] -> 3311.9583333333339 | X36: =RC[-6]*RC[-6] -> 1133.4444444444448 | Y36: =RC[-12]*RC[-12] -> 0.30021267361111104 | Z36: =RC[-12]*RC[-12] -> 3.0625 | AA36: =RC[-12]*RC[-12] -> 65.340277777777814 | AB36: =RC[-12]*RC[-12] -> 65.340277777777814 | AC36: =RC[-12]*RC[-12] -> 9677.640625
A37: 69146 | B37: 北京 | C37: 283 | D37: 重度污染 | E37: 1.19 | F37: 5 | G37: 40 | H37: 53 | I37: 66 | J37: 70 | L37: 2013-06-29T10:00:00.000 | M37: =RC[-8]-R[14]C[-8] -> -0.32791666666666663 | N37: =RC[-8]-R[14]C[-8] -> -0.75 | O37: =RC[-8]-R[14]C[-8] -> -3.0833333333333357 | P37: =RC[-8]-R[14]C[-8] -> 3.0833333333333357 | Q37: =RC[-8]-R[14]C[-8] -> -32.375 | R37: =RC[-8]-R[14]C[-8] -> -25.666666666666671 | S37: =RC[-6]*RC[-1] -> 8.4165277777777785 | T37: =RC[-6]*RC[-2] -> 19.250000000000004 | U37: =RC[-6]*RC[-3] -> 79.138888888888971 | V37: =RC[-6]*RC[-4] -> -79.138888888888971 | W37: =RC[-6]*RC[-5] -> 830.95833333333348 | X37: =RC[-6]*RC[-6] -> 658.77777777777806 | Y37: =RC[-12]*RC[-12] -> 0.10752934027777776 | Z37: =RC[-12]*RC[-12] -> 0.5625 | AA37: =RC[-12]*RC[-12] -> 9.5069444444444589 | AB37: =RC[-12]*RC[-12] -> 9.5069444444444589 | AC37: =RC[-12]*RC[-12] -> 1048.140625
A38: 69222 | B38: 北京 | C38: 260 | D38: 重度污染 | E38: 1.48 | F38: 6 | G38: 42 | H38: 48 | I38: 92 | J38: 87 | L38: 2013-06-29T11:00:00.000 | M38: =RC[-8]-R[13]C[-8] -> -3.7916666666666599E-2 | N38: =RC[-8]-R[13]C[-8] -> 0.25 | O38: =RC[-8]-R[13]C[-8] -> -1.0833333333333357 | P38: =RC[-8]-R[13]C[-8] -> -1.9166666666666643 | Q38: =RC[-8]-R[13]C[-8] -> -6.375 | R38: =RC[-8]-R[13]C[-8] -> -8.6666666666666714 | S38: =RC[-6]*RC[-1] -> 0.32861111111111069 | T38: =RC[-6]*RC[-2] -> -2.1666666666666679 | U38: =RC[-6]*RC[-3] -> 9.3888888888889142 | V38: =RC[-6]*RC[-4] -> 16.6111111111111 | W38: =RC[-6]*RC[-5] -> 55.250000000000028 | X38: =RC[-6]*RC[-6] -> 75.1111111111112 | Y38: =RC[-12]*RC[-12] -> 1.4376736111111059E-3 | Z38: =RC[-12]*RC[-12] -> 6.25E-2 | AA38: =RC[-12]*RC[-12] -> 1.1736111111111163 | AB38: =RC[-12]*RC[-12] -> 3.6736111111111018 | AC38: =RC[-12]*RC[-12] -> 40.640625
A39: 69298 | B39: 北京 | C39: 237 | D39: 重度污染 | E39: 1.71 | F39: 6 | G39: 44 | H39: 41 | I39: 136 | J39: 104 | L39: 2013-06-29T12:00:00.000 | M39: =RC[-8]-R[12]C[-8] -> 0.19208333333333338 | N39: =RC[-8]-R[12]C[-8] -> 0.25 | O39: =RC[-8]-R[12]C[-8] -> 0.9166666666666643 | P39: =RC[-8]-R[12]C[-8] -> -8.9166666666666643 | Q39: =RC[-8]-R[12]C[-8] -> 37.625 | R39: =RC[-8]-R[12]C[-8] -> 8.3333333333333286 | S39: =RC[-6]*RC[-1] -> 1.600694444444444 | T39: =RC[-6]*RC[-2] -> 2.0833333333333321 | U39: =RC[-6]*RC[-3] -> 7.6388888888888644 | V39: =RC[-6]*RC[-4] -> -74.3055555555555 | W39: =RC[-6]*RC[-5] -> 313.54166666666652 | X39: =RC[-6]*RC[-6] -> 69.444444444444372 | Y39: =RC[-12]*RC[-12] -> 3.6896006944444462E-2 | Z39: =RC[-12]*RC[-12] -> 6.25E-2 | AA39: =RC[-12]*RC[-12] -> 0.84027777777777346 | AB39: =RC[-12]*RC[-12] -> 79.5069444444444 | AC39: =RC[-12]*RC[-12] -> 1415.640625
A40: 69374 | B40: 北京 | C40: 220 | D40: 重度污染 | E40: 1.94 | F40: 7 | G40: 44 | H40: 41 | I40: 141 | J40: 120 | L40: 2013-06-29T13:00:00.000 | M40: =RC[-8]-R[11]C[-8] -> 0.42208333333333337 | N40: =RC[-8]-R[11]C[-8] -> 1.25 | O40: =RC[-8]-R[11]C[-8] -> 0.9166666666666643 | P40: =RC[-8]-R[11]C[-8] -> -8.9166666666666643 | Q40: =RC[-8]-R[11]C[-8] -> 42.625 | R40: =RC[-8]-R[11]C[-8] -> 24.333333333333329 | S40: =RC[-6]*RC[-1] -> 10.270694444444443 | T40: =RC[-6]*RC[-2] -> 30.416666666666661 | U40: =RC[-6]*RC[-3] -> 22.305555555555493 | V40: =RC[-6]*RC[-4] -> -216.97222222222211 | W40: =RC[-6]*RC[-5] -> 1037.208333333333 | X40: =RC[-6]*RC[-6] -> 592.11111111111086 | Y40: =RC[-12]*RC[-12] -> 0.1781543402777778 | Z40: =RC[-12]*RC[-12] -> 1.5625 | AA40: =RC[-12]*RC[-12] -> 0.84027777777777346 | AB40: =RC[-12]*RC[-12] -> 79.5069444444444 | AC40: =RC[-12]*RC[-12] -> 1816.890625
A41: 69450 | B41: 北京 | C41: 211 | D41: 重度污染 | E41: 2.16 | F41: 8 | G41: 48 | H41: 40 | I41: 155 | J41: 128 | L41: 2013-06-29T14:00:00.000 | M41: =RC[-8]-R[10]C[-8] -> 0.64208333333333356 | N41: =RC[-8]-R[10]C[-8] -> 2.25 | O41: =RC[-8]-R[10]C[-8] -> 4.9166666666666643 | P41: =RC[-8]-R[10]C[-8] -> -9.9166666666666643 | Q41: =RC[-8]-R[10]C[-8] -> 56.625 | R41: =RC[-8]-R[10]C[-8] -> 32.333333333333329 | S41: =RC[-6]*RC[-1] -> 20.76069444444445 | T41: =RC[-6]*RC[-2] -> 72.749999999999986 | U41: =RC[-6]*RC[-3] -> 158.97222222222211 | V41: =RC[-6]*RC[-4] -> -320.63888888888874 | W41: =RC[-6]*RC[-5] -> 1830.8749999999998 | X41: =RC[-6]*RC[-6] -> 1045.4444444444441 | Y41: =RC[-12]*RC[-12] -> 0.41227100694444474 | Z41: =RC[-12]*RC[-12] -> 5.0625 | AA41: =RC[-12]*RC[-12] -> 24.173611111111089 | AB41: =RC[-12]*RC[-12] -> 98.340277777777729 | AC41: =RC[-12]*RC[-12] -> 3206.390625
A42: 69526 | B42: 北京 | C42: 204 | D42: 重度污染 | E42: 2.3199999999999998 | F42: 8 | G42: 50 | H42: 41 | I42: 195 | J42: 143 | L42: 2013-06-29T15:00:00.000 | M42: =RC[-8]-R[9]C[-8] -> 0.80208333333333326 | N42: =RC[-8]-R[9]C[-8] -> 2.25 | O42: =RC[-8]-R[9]C[-8] -> 6.9166666666666643 | P42: =RC[-8]-R[9]C[-8] -> -8.9166666666666643 | Q42: =RC[-8]-R[9]C[-8] -> 96.625 | R42: =RC[-8]-R[9]C[-8] -> 47.333333333333329 | S42: =RC[-6]*RC[-1] -> 37.965277777777771 | T42: =RC[-6]*RC[-2] -> 106.49999999999999 | U42: =RC[-6]*RC[-3] -> 327.38888888888874 | V42: =RC[-6]*RC[-4] -> -422.05555555555543 | W42: =RC[-6]*RC[-5] -> 4573.583333333333 | X42: =RC[-6]*RC[-6] -> 2240.4444444444439 | Y42: =RC[-12]*RC[-12] -> 0.64333767361111094 | Z42: =RC[-12]*RC[-12] -> 5.0625 | AA42: =RC[-12]*RC[-12] -> 47.840277777777743 | AB42: =RC[-12]*RC[-12] -> 79.5069444444444 | AC42: =RC[-12]*RC[-12] -> 9336.390625
A43: 69602 | B43: 北京 | C43: 193 | D43: 中度污染 | E43: 2.37 | F43: 9 | G43: 50 | H43: 50 | I43: 187 | J43: 150 | L43: 2013-06-29T16:00:00.000 | M43: =RC[-8]-R[8]C[-8] -> 0.85208333333333353 | N43: =RC[-8]-R[8]C[-8] -> 3.25 | O43: =RC[-8]-R[8]C[-8] -> 6.9166666666666643 | P43: =RC[-8]-R[8]C[-8] -> 8.3333333333335702E-2 | Q43: =RC[-8]-R[8]C[-8] -> 88.625 | R43: =RC[-8]-R[8]C[-8] -> 54.333333333333329 | S43: =RC[-6]*RC[-1] -> 46.296527777777783 | T43: =RC[-6]*RC[-2] -> 176.58333333333331 | U43: =RC[-6]*RC[-3] -> 375.80555555555537 | V43: =RC[-6]*RC[-4] -> 4.5277777777779065 | W43: =RC[-6]*RC[-5] -> 4815.2916666666661 | X43: =RC[-6]*RC[-6] -> 2952.1111111111104 | Y43: =RC[-12]*RC[-12] -> 0.72604600694444477 | Z43: =RC[-12]*RC[-12] -> 10.5625 | AA43: =RC[-12]*RC[-12] -> 47.840277777777743 | AB43: =RC[-12]*RC[-12] -> 6.9444444444448396E-3 | AC43: =RC[-12]*RC[-12] -> 7854.390625
A44: 69678 | B44: 北京 | C44: 183 | D44: 中度污染 | E44: 2.42 | F44: 9 | G44: 52 | H44: 51 | I44: 195 | J44: 148 | L44: 2013-06-29T17:00:00.000 | M44: =RC[-8]-R[7]C[-8] -> 0.90208333333333335 | N44: =RC[-8]-R[7]C[-8] -> 3.25 | O44: =RC[-8]-R[7]C[-8] -> 8.9166666666666643 | P44: =RC[-8]-R[7]C[-8] -> 1.0833333333333357 | Q44: =RC[-8]-R[7]C[-8] -> 96.625 | R44: =RC[-8]-R[7]C[-8] -> 52.333333333333329 | S44: =RC[-6]*RC[-1] -> 47.209027777777777 | T44: =RC[-6]*RC[-2] -> 170.08333333333331 | U44: =RC[-6]*RC[-3] -> 466.63888888888874 | V44: =RC[-6]*RC[-4] -> 56.694444444444564 | W44: =RC[-6]*RC[-5] -> 5056.708333333333 | X44: =RC[-6]*RC[-6] -> 2738.7777777777774 | Y44: =RC[-12]*RC[-12] -> 0.81375434027777782 | Z44: =RC[-12]*RC[-12] -> 10.5625 | AA44: =RC[-12]*RC[-12] -> 79.5069444444444 | AB44: =RC[-12]*RC[-12] -> 1.1736111111111163 | AC44: =RC[-12]*RC[-12] -> 9336.390625
A45: 69754 | B45: 北京 | C45: 172 | D45: 中度污染 | E45: 2.33 | F45: 9 | G45: 57 | H45: 49 | I45: 196 | J45: 146 | L45: 2013-06-29T18:00:00.000 | M45: =RC[-8]-R[6]C[-8] -> 0.81208333333333349 | N45: =RC[-8]-R[6]C[-8] -> 3.25 | O45: =RC[-8]-R[6]C[-8] -> 13.916666666666664 | P45: =RC[-8]-R[6]C[-8] -> -0.9166666666666643 | Q45: =RC[-8]-R[6]C[-8] -> 97.625 | R45: =RC[-8]-R[6]C[-8] -> 50.333333333333329 | S45: =RC[-6]*RC[-1] -> 40.874861111111116 | T45: =RC[-6]*RC[-2] -> 163.58333333333331 | U45: =RC[-6]*RC[-3] -> 700.47222222222206 | V45: =RC[-6]*RC[-4] -> -46.138888888888765 | W45: =RC[-6]*RC[-5] -> 4913.7916666666661 | X45: =RC[-6]*RC[-6] -> 2533.4444444444439 | Y45: =RC[-12]*RC[-12] -> 0.65947934027777799 | Z45: =RC[-12]*RC[-12] -> 10.5625 | AA45: =RC[-12]*RC[-12] -> 193.67361111111106 | AB45: =RC[-12]*RC[-12] -> 0.84027777777777346 | AC45: =RC[-12]*RC[-12] -> 9530.640625
A46: 69830 | B46: 北京 | C46: 156 | D46: 中度污染 | E46: 2.2400000000000002 | F46: 9 | G46: 62 | H46: 42 | I46: 174 | J46: 142 | L46: 2013-06-29T19:00:00.000 | M46: =RC[-8]-R[5]C[-8] -> 0.72208333333333363 | N46: =RC[-8]-R[5]C[-8] -> 3.25 | O46: =RC[-8]-R[5]C[-8] -> 18.916666666666664 | P46: =RC[-8]-R[5]C[-8] -> -7.9166666666666643 | Q46: =RC[-8]-R[5]C[-8] -> 75.625 | R46: =RC[-8]-R[5]C[-8] -> 46.333333333333329 | S46: =RC[-6]*RC[-1] -> 33.456527777777787 | T46: =RC[-6]*RC[-2] -> 150.58333333333331 | U46: =RC[-6]*RC[-3] -> 876.47222222222206 | V46: =RC[-6]*RC[-4] -> -366.80555555555543 | W46: =RC[-6]*RC[-5] -> 3503.958333333333 | X46: =RC[-6]*RC[-6] -> 2146.7777777777774 | Y46: =RC[-12]*RC[-12] -> 0.52140434027777816 | Z46: =RC[-12]*RC[-12] -> 10.5625 | AA46: =RC[-12]*RC[-12] -> 357.84027777777771 | AB46: =RC[-12]*RC[-12] -> 62.673611111111072 | AC46: =RC[-12]*RC[-12] -> 5719.140625
A47: 69906 | B47: 北京 | C47: 140 | D47: 轻度污染 | E47: 2.2400000000000002 | F47: 8 | G47: 66 | H47: 29 | I47: 175 | J47: 146 | L47: 2013-06-29T20:00:00.000 | M47: =RC[-8]-R[4]C[-8] -> 0.72208333333333363 | N47: =RC[-8]-R[4]C[-8] -> 2.25 | O47: =RC[-8]-R[4]C[-8] -> 22.916666666666664 | P47: =RC[-8]-R[4]C[-8] -> -20.916666666666664 | Q47: =RC[-8]-R[4]C[-8] -> 76.625 | R47: =RC[-8]-R[4]C[-8] -> 50.333333333333329 | S47: =RC[-6]*RC[-1] -> 36.344861111111122 | T47: =RC[-6]*RC[-2] -> 113.24999999999999 | U47: =RC[-6]*RC[-3] -> 1153.4722222222219 | V47: =RC[-6]*RC[-4] -> -1052.8055555555554 | W47: =RC[-6]*RC[-5] -> 3856.7916666666665 | X47: =RC[-6]*RC[-6] -> 2533.4444444444439 | Y47: =RC[-12]*RC[-12] -> 0.52140434027777816 | Z47: =RC[-12]*RC[-12] -> 5.0625 | AA47: =RC[-12]*RC[-12] -> 525.17361111111097 | AB47: =RC[-12]*RC[-12] -> 437.50694444444434 | AC47: =RC[-12]*RC[-12] -> 5871.390625
A48: 69982 | B48: 北京 | C48: 126 | D48: 轻度污染 | E48: 2.29 | F48: 7 | G48: 70 | H48: 18 | I48: 177 | J48: 150 | L48: 2013-06-29T21:00:00.000 | M48: =RC[-8]-R[3]C[-8] -> 0.77208333333333345 | N48: =RC[-8]-R[3]C[-8] -> 1.25 | O48: =RC[-8]-R[3]C[-8] -> 26.916666666666664 | P48: =RC[-8]-R[3]C[-8] -> -31.916666666666664 | Q48: =RC[-8]-R[3]C[-8] -> 78.625 | R48: =RC[-8]-R[3]C[-8] -> 54.333333333333329 | S48: =RC[-6]*RC[-1] -> 41.949861111111112 | T48: =RC[-6]*RC[-2] -> 67.916666666666657 | U48: =RC[-6]*RC[-3] -> 1462.4722222222219 | V48: =RC[-6]*RC[-4] -> -1734.1388888888887 | W48: =RC[-6]*RC[-5] -> 4271.958333333333 | X48: =RC[-6]*RC[-6] -> 2952.1111111111104 | Y48: =RC[-12]*RC[-12] -> 0.59611267361111131 | Z48: =RC[-12]*RC[-12] -> 1.5625 | AA48: =RC[-12]*RC[-12] -> 724.50694444444434 | AB48: =RC[-12]*RC[-12] -> 1018.673611111111 | AC48: =RC[-12]*RC[-12] -> 6181.890625
A49: 70058 | B49: 北京 | C49: 121 | D49: 轻度污染 | E49: 2.2999999999999998 | F49: 7 | G49: 57 | H49: 13 | I49: 180 | J49: 158 | L49: 2013-06-29T22:00:00.000 | M49: =RC[-8]-R[2]C[-8] -> 0.78208333333333324 | N49: =RC[-8]-R[2]C[-8] -> 1.25 | O49: =RC[-8]-R[2]C[-8] -> 13.916666666666664 | P49: =RC[-8]-R[2]C[-8] -> -36.916666666666664 | Q49: =RC[-8]-R[2]C[-8] -> 81.625 | R49: =RC[-8]-R[2]C[-8] -> 62.333333333333329 | S49: =RC[-6]*RC[-1] -> 48.749861111111102 | T49: =RC[-6]*RC[-2] -> 77.916666666666657 | U49: =RC[-6]*RC[-3] -> 867.47222222222206 | V49: =RC[-6]*RC[-4] -> -2301.1388888888887 | W49: =RC[-6]*RC[-5] -> 5087.958333333333 | X49: =RC[-6]*RC[-6] -> 3885.4444444444439 | Y49: =RC[-12]*RC[-12] -> 0.61165434027777765 | Z49: =RC[-12]*RC[-12] -> 1.5625 | AA49: =RC[-12]*RC[-12] -> 193.67361111111106 | AB49: =RC[-12]*RC[-12] -> 1362.8402777777776 | AC49: =RC[-12]*RC[-12] -> 6662.640625
A50: 70134 | B50: 北京 | C50: 127 | D50: 轻度污染 | E50: 2.39 | F50: 7 | G50: 67 | H50: 7 | I50: 175 | J50: 164 | L50: 2013-06-29T23:00:00.000 | M50: =RC[-8]-R[1]C[-8] -> 0.87208333333333354 | N50: =RC[-8]-R[1]C[-8] -> 1.25 | O50: =RC[-8]-R[1]C[-8] -> 23.916666666666664 | P50: =RC[-8]-R[1]C[-8] -> -42.916666666666664 | Q50: =RC[-8]-R[1]C[-8] -> 76.625 | R50: =RC[-8]-R[1]C[-8] -> 68.333333333333329 | S50: =RC[-6]*RC[-1] -> 59.592361111111124 | T50: =RC[-6]*RC[-2] -> 85.416666666666657 | U50: =RC[-6]*RC[-3] -> 1634.3055555555552 | V50: =RC[-6]*RC[-4] -> -2932.6388888888887 | W50: =RC[-6]*RC[-5] -> 5236.0416666666661 | X50: =RC[-6]*RC[-6] -> 4669.4444444444434 | Y50: =RC[-12]*RC[-12] -> 0.76052934027777819 | Z50: =RC[-12]*RC[-12] -> 1.5625 | AA50: =RC[-12]*RC[-12] -> 572.00694444444434 | AB50: =RC[-12]*RC[-12] -> 1841.8402777777776 | AC50: =RC[-12]*RC[-12] -> 5871.390625
E51: =SUM(R[-24]C:R[-1]C)/24 -> 1.5179166666666666 | F51: =SUM(R[-24]C:R[-1]C)/24 -> 5.75 | G51: =SUM(R[-24]C:R[-1]C)/24 -> 43.083333333333336 | H51: =SUM(R[-24]C:R[-1]C)/24 -> 49.916666666666664 | I51: =SUM(R[-24]C:R[-1]C)/24 -> 98.375 | J51: =SUM(R[-24]C:R[-1]C)/24 -> 95.666666666666671 | M51: =RC[-8]-RC[-8] -> 0 | N51: =RC[-8]-RC[-8] -> 0 | O51: =RC[-8]-RC[-8] -> 0 | P51: =RC[-8]-RC[-8] -> 0 | Q51: =RC[-8]-RC[-8] -> 0 | R51: =RC[-8]-RC[-8] -> 0 | S51: =SUM(R[-24]C:R[-1]C) -> 866.35333333333324 | T51: =SUM(R[-24]C:R[-1]C) -> 2537.9999999999995 | U51: =SUM(R[-24]C:R[-1]C) -> 15712.66666666667 | V51: =SUM(R[-24]C:R[-1]C) -> -20305.666666666664 | W51: =SUM(R[-24]C:R[-1]C) -> 90802.000000000015 | X51: =RC[-6]*RC[-6] -> 0 | Y51: =RC[-12]*RC[-12] -> 0 | Z51: =RC[-12]*RC[-12] -> 0 | AA51: =RC[-12]*RC[-12] -> 0 | AB51: =RC[-12]*RC[-12] -> 0 | AC51: =RC[-12]*RC[-12] -> 0
A52: 70210 | B52: 北京 | C52: 135 | D52: 轻度污染 | E52: 2.39 | F52: 7 | G52: 60 | H52: 9 | I52: 174 | J52: 164 | L52: 2013-06-30T00:00:00.000 | M52: =RC[-8]-R[14]C[-8] -> -0.33499999999999908 | N52: =RC[-8]-R[14]C[-8] -> -3.2857142857142865 | O52: =RC[-8]-R[14]C[-8] -> 5.0714285714285694 | P52: =RC[-8]-R[14]C[-8] -> -10.714285714285715 | Q52: =RC[-8]-R[14]C[-8] -> -33.571428571428584 | R52: =RC[-8]-R[14]C[-8] -> -39 | S52: =RC[-6]*RC[-1] -> 13.064999999999964 | T52: =RC[-6]*RC[-2] -> 128.14285714285717 | U52: =RC[-6]*RC[-3] -> -197.78571428571422 | V52: =RC[-6]*RC[-4] -> 417.85714285714289 | W52: =RC[-6]*RC[-5] -> 1309.2857142857147 | X52: =RC[-6]*RC[-6] -> 1521 | Y52: =RC[-12]*RC[-12] -> 0.11222499999999938 | Z52: =RC[-12]*RC[-12] -> 10.795918367346944 | AA52: =RC[-12]*RC[-12] -> 25.719387755102019 | AB52: =RC[-12]*RC[-12] -> 114.79591836734696 | AC52: =RC[-12]*RC[-12] -> 1127.0408163265315 | AE52: =SQRT(SUM(RC[-6]:R[13]C[-6])*SUM(RC[-7]:R[13]C[-7])) -> 213.25086893140667 | AF52: =SQRT(SUM(RC[-6]:R[13]C[-6])*SUM(RC[-8]:R[13]C[-8])) -> 1394.0303337548189 | AG52: =SQRT(SUM(RC[-6]:R[13]C[-6])*SUM(RC[-9]:R[13]C[-9])) -> 3517.9245707823648 | AH52: =SQRT(SUM(RC[-6]:R[13]C[-6])*SUM(RC[-10]:R[13]C[-10])) -> 15928.700655465547 | AI52: =SQRT(SUM(RC[-6]:R[13]C[-6])*SUM(RC[-11]:R[13]C[-11])) -> 32924.395245557884
A53: 70286 | B53: 北京 | C53: 143 | D53: 轻度污染 | E53: 2.39 | F53: 8 | G53: 57 | H53: 7 | I53: 162 | J53: 166 | L53: 2013-06-30T01:00:00.000 | M53: =RC[-8]-R[13]C[-8] -> -0.33499999999999908 | N53: =RC[-8]-R[13]C[-8] -> -2.2857142857142865 | O53: =RC[-8]-R[13]C[-8] -> 2.0714285714285694 | P53: =RC[-8]-R[13]C[-8] -> -12.714285714285715 | Q53: =RC[-8]-R[13]C[-8] -> -45.571428571428584 | R53: =RC[-8]-R[13]C[-8] -> -37 | S53: =RC[-6]*RC[-1] -> 12.394999999999966 | T53: =RC[-6]*RC[-2] -> 84.571428571428598 | U53: =RC[-6]*RC[-3] -> -76.642857142857068 | V53: =RC[-6]*RC[-4] -> 470.42857142857144 | W53: =RC[-6]*RC[-5] -> 1686.1428571428576 | X53: =RC[-6]*RC[-6] -> 1369 | Y53: =RC[-12]*RC[-12] -> 0.11222499999999938 | Z53: =RC[-12]*RC[-12] -> 5.2244897959183705 | AA53: =RC[-12]*RC[-12] -> 4.2908163265306039 | AB53: =RC[-12]*RC[-12] -> 161.65306122448982 | AC53: =RC[-12]*RC[-12] -> 2076.7551020408173
A54: 70362 | B54: 北京 | C54: 150 | D54: 轻度污染 | E54: 2.4900000000000002 | F54: 6 | G54: 57 | H54: 4 | I54: 148 | J54: 168 | L54: 2013-06-30T02:00:00.000 | M54: =RC[-8]-R[12]C[-8] -> -0.23499999999999899 | N54: =RC[-8]-R[12]C[-8] -> -4.2857142857142865 | O54: =RC[-8]-R[12]C[-8] -> 2.0714285714285694 | P54: =RC[-8]-R[12]C[-8] -> -15.714285714285715 | Q54: =RC[-8]-R[12]C[-8] -> -59.571428571428584 | R54: =RC[-8]-R[12]C[-8] -> -35 | S54: =RC[-6]*RC[-1] -> 8.2249999999999641 | T54: =RC[-6]*RC[-2] -> 150.00000000000003 | U54: =RC[-6]*RC[-3] -> -72.499999999999929 | V54: =RC[-6]*RC[-4] -> 550 | W54: =RC[-6]*RC[-5] -> 2085.0000000000005 | X54: =RC[-6]*RC[-6] -> 1225 | Y54: =RC[-12]*RC[-12] -> 5.5224999999999524E-2 | Z54: =RC[-12]*RC[-12] -> 18.367346938775515 | AA54: =RC[-12]*RC[-12] -> 4.2908163265306039 | AB54: =RC[-12]*RC[-12] -> 246.93877551020412 | AC54: =RC[-12]*RC[-12] -> 3548.7551020408177 | AE54: =R[12]C[-12]/R[-2]C -> 0.31484045216995532 | AF54: =R[12]C[-12]/R[-2]C -> 0.33571722843321683 | AG54: =R[12]C[-12]/R[-2]C -> 0.32405470244248891 | AH54: =R[12]C[-12]/R[-2]C -> 0.49665067924328976 | AI54: =R[12]C[-12]/R[-2]C -> 0.9546416802975487
A55: 70438 | B55: 北京 | C55: 157 | D55: 中度污染 | E55: 2.59 | F55: 8 | G55: 54 | H55: 6 | I55: 146 | J55: 166 | L55: 2013-06-30T03:00:00.000 | M55: =RC[-8]-R[11]C[-8] -> -0.13499999999999934 | N55: =RC[-8]-R[11]C[-8] -> -2.2857142857142865 | O55: =RC[-8]-R[11]C[-8] -> -0.9285714285714306 | P55: =RC[-8]-R[11]C[-8] -> -13.714285714285715 | Q55: =RC[-8]-R[11]C[-8] -> -61.571428571428584 | R55: =RC[-8]-R[11]C[-8] -> -37 | S55: =RC[-6]*RC[-1] -> 4.9949999999999761 | T55: =RC[-6]*RC[-2] -> 84.571428571428598 | U55: =RC[-6]*RC[-3] -> 34.357142857142932 | V55: =RC[-6]*RC[-4] -> 507.42857142857144 | W55: =RC[-6]*RC[-5] -> 2278.1428571428578 | X55: =RC[-6]*RC[-6] -> 1369 | Y55: =RC[-12]*RC[-12] -> 1.8224999999999821E-2 | Z55: =RC[-12]*RC[-12] -> 5.2244897959183705 | AA55: =RC[-12]*RC[-12] -> 0.86224489795918746 | AB55: =RC[-12]*RC[-12] -> 188.08163265306126 | AC55: =RC[-12]*RC[-12] -> 3791.040816326532
A56: 70514 | B56: 北京 | C56: 163 | D56: 中度污染 | E56: 2.69 | F56: 9 | G56: 54 | H56: 6 | I56: 170 | J56: 168 | L56: 2013-06-30T04:00:00.000 | M56: =RC[-8]-R[10]C[-8] -> -3.4999999999999254E-2 | N56: =RC[-8]-R[10]C[-8] -> -1.2857142857142865 | O56: =RC[-8]-R[10]C[-8] -> -0.9285714285714306 | P56: =RC[-8]-R[10]C[-8] -> -13.714285714285715 | Q56: =RC[-8]-R[10]C[-8] -> -37.571428571428584 | R56: =RC[-8]-R[10]C[-8] -> -35 | S56: =RC[-6]*RC[-1] -> 1.2249999999999739 | T56: =RC[-6]*RC[-2] -> 45.000000000000028 | U56: =RC[-6]*RC[-3] -> 32.500000000000071 | V56: =RC[-6]*RC[-4] -> 480.00000000000006 | W56: =RC[-6]*RC[-5] -> 1315.0000000000005 | X56: =RC[-6]*RC[-6] -> 1225 | Y56: =RC[-12]*RC[-12] -> 1.2249999999999477E-3 | Z56: =RC[-12]*RC[-12] -> 1.653061224489798 | AA56: =RC[-12]*RC[-12] -> 0.86224489795918746 | AB56: =RC[-12]*RC[-12] -> 188.08163265306126 | AC56: =RC[-12]*RC[-12] -> 1411.6122448979602
A57: 70590 | B57: 北京 | C57: 170 | D57: 中度污染 | E57: 2.83 | F57: 13 | G57: 49 | H57: 5 | I57: 180 | J57: 168 | L57: 2013-06-30T05:00:00.000 | M57: =RC[-8]-R[9]C[-8] -> 0.10500000000000087 | N57: =RC[-8]-R[9]C[-8] -> 2.7142857142857135 | O57: =RC[-8]-R[9]C[-8] -> -5.9285714285714306 | P57: =RC[-8]-R[9]C[-8] -> -14.714285714285715 | Q57: =RC[-8]-R[9]C[-8] -> -27.571428571428584 | R57: =RC[-8]-R[9]C[-8] -> -35 | S57: =RC[-6]*RC[-1] -> -3.6750000000000305 | T57: =RC[-6]*RC[-2] -> -94.999999999999972 | U57: =RC[-6]*RC[-3] -> 207.50000000000006 | V57: =RC[-6]*RC[-4] -> 515 | W57: =RC[-6]*RC[-5] -> 965.00000000000045 | X57: =RC[-6]*RC[-6] -> 1225 | Y57: =RC[-12]*RC[-12] -> 1.1025000000000182E-2 | Z57: =RC[-12]*RC[-12] -> 7.3673469387755057 | AA57: =RC[-12]*RC[-12] -> 35.147959183673493 | AB57: =RC[-12]*RC[-12] -> 216.51020408163268 | AC57: =RC[-12]*RC[-12] -> 760.1836734693884
A58: 70666 | B58: 北京 | C58: 176 | D58: 中度污染 | E58: 2.92 | F58: 13 | G58: 51 | H58: 3 | I58: 150 | J58: 172 | L58: 2013-06-30T06:00:00.000 | M58: =RC[-8]-R[8]C[-8] -> 0.19500000000000073 | N58: =RC[-8]-R[8]C[-8] -> 2.7142857142857135 | O58: =RC[-8]-R[8]C[-8] -> -3.9285714285714306 | P58: =RC[-8]-R[8]C[-8] -> -16.714285714285715 | Q58: =RC[-8]-R[8]C[-8] -> -57.571428571428584 | R58: =RC[-8]-R[8]C[-8] -> -31 | S58: =RC[-6]*RC[-1] -> -6.045000000000023 | T58: =RC[-6]*RC[-2] -> -84.142857142857125 | U58: =RC[-6]*RC[-3] -> 121.78571428571435 | V58: =RC[-6]*RC[-4] -> 518.14285714285722 | W58: =RC[-6]*RC[-5] -> 1784.714285714286 | X58: =RC[-6]*RC[-6] -> 961 | Y58: =RC[-12]*RC[-12] -> 3.8025000000000281E-2 | Z58: =RC[-12]*RC[-12] -> 7.3673469387755057 | AA58: =RC[-12]*RC[-12] -> 15.43367346938777 | AB58: =RC[-12]*RC[-12] -> 279.36734693877554 | AC58: =RC[-12]*RC[-12] -> 3314.4693877551035
A59: 70742 | B59: 北京 | C59: 183 | D59: 中度污染 | E59: 3.06 | F59: 14 | G59: 51 | H59: 5 | I59: 170 | J59: 185 | L59: 2013-06-30T07:00:00.000 | M59: =RC[-8]-R[7]C[-8] -> 0.33500000000000085 | N59: =RC[-8]-R[7]C[-8] -> 3.7142857142857135 | O59: =RC[-8]-R[7]C[-8] -> -3.9285714285714306 | P59: =RC[-8]-R[7]C[-8] -> -14.714285714285715 | Q59: =RC[-8]-R[7]C[-8] -> -37.571428571428584 | R59: =RC[-8]-R[7]C[-8] -> -18 | S59: =RC[-6]*RC[-1] -> -6.0300000000000153 | T59: =RC[-6]*RC[-2] -> -66.857142857142847 | U59: =RC[-6]*RC[-3] -> 70.714285714285751 | V59: =RC[-6]*RC[-4] -> 264.85714285714289 | W59: =RC[-6]*RC[-5] -> 676.28571428571445 | X59: =RC[-6]*RC[-6] -> 324 | Y59: =RC[-12]*RC[-12] -> 0.11222500000000057 | Z59: =RC[-12]*RC[-12] -> 13.795918367346934 | AA59: =RC[-12]*RC[-12] -> 15.43367346938777 | AB59: =RC[-12]*RC[-12] -> 216.51020408163268 | AC59: =RC[-12]*RC[-12] -> 1411.6122448979602
A60: 70818 | B60: 北京 | C60: 192 | D60: 中度污染 | E60: 3.14 | F60: 12 | G60: 56 | H60: 4 | I60: 213 | J60: 217 | L60: 2013-06-30T08:00:00.000 | M60: =RC[-8]-R[6]C[-8] -> 0.41500000000000092 | N60: =RC[-8]-R[6]C[-8] -> 1.7142857142857135 | O60: =RC[-8]-R[6]C[-8] -> 1.0714285714285694 | P60: =RC[-8]-R[6]C[-8] -> -15.714285714285715 | Q60: =RC[-8]-R[6]C[-8] -> 5.4285714285714164 | R60: =RC[-8]-R[6]C[-8] -> 14 | S60: =RC[-6]*RC[-1] -> 5.8100000000000129 | T60: =RC[-6]*RC[-2] -> 23.999999999999989 | U60: =RC[-6]*RC[-3] -> 14.999999999999972 | V60: =RC[-6]*RC[-4] -> -220 | W60: =RC[-6]*RC[-5] -> 75.999999999999829 | X60: =RC[-6]*RC[-6] -> 196 | Y60: =RC[-12]*RC[-12] -> 0.17222500000000077 | Z60: =RC[-12]*RC[-12] -> 2.9387755102040791 | AA60: =RC[-12]*RC[-12] -> 1.1479591836734651 | AB60: =RC[-12]*RC[-12] -> 246.93877551020412 | AC60: =RC[-12]*RC[-12] -> 29.469387755101909
A61: 70894 | B61: 北京 | C61: 200 | D61: 中度污染 | E61: 3.21 | F61: 12 | G61: 62 | H61: 7 | I61: 242 | J61: 246 | L61: 2013-06-30T09:00:00.000 | M61: =RC[-8]-R[5]C[-8] -> 0.48500000000000076 | N61: =RC[-8]-R[5]C[-8] -> 1.7142857142857135 | O61: =RC[-8]-R[5]C[-8] -> 7.0714285714285694 | P61: =RC[-8]-R[5]C[-8] -> -12.714285714285715 | Q61: =RC[-8]-R[5]C[-8] -> 34.428571428571416 | R61: =RC[-8]-R[5]C[-8] -> 43 | S61: =RC[-6]*RC[-1] -> 20.855000000000032 | T61: =RC[-6]*RC[-2] -> 73.71428571428568 | U61: =RC[-6]*RC[-3] -> 304.0714285714285 | V61: =RC[-6]*RC[-4] -> -546.71428571428578 | W61: =RC[-6]*RC[-5] -> 1480.4285714285709 | X61: =RC[-6]*RC[-6] -> 1849 | Y61: =RC[-12]*RC[-12] -> 0.23522500000000074 | Z61: =RC[-12]*RC[-12] -> 2.9387755102040791 | AA61: =RC[-12]*RC[-12] -> 50.005102040816297 | AB61: =RC[-12]*RC[-12] -> 161.65306122448982 | AC61: =RC[-12]*RC[-12] -> 1185.3265306122441
A62: 70970 | B62: 北京 | C62: 208 | D62: 重度污染 | E62: 3.32 | F62: 11 | G62: 66 | H62: 12 | I62: 310 | J62: 282 | L62: 2013-06-30T10:00:00.000 | M62: =RC[-8]-R[4]C[-8] -> 0.59500000000000064 | N62: =RC[-8]-R[4]C[-8] -> 0.71428571428571352 | O62: =RC[-8]-R[4]C[-8] -> 11.071428571428569 | P62: =RC[-8]-R[4]C[-8] -> -7.7142857142857153 | Q62: =RC[-8]-R[4]C[-8] -> 102.42857142857142 | R62: =RC[-8]-R[4]C[-8] -> 79 | S62: =RC[-6]*RC[-1] -> 47.005000000000052 | T62: =RC[-6]*RC[-2] -> 56.428571428571367 | U62: =RC[-6]*RC[-3] -> 874.642857142857 | V62: =RC[-6]*RC[-4] -> -609.42857142857156 | W62: =RC[-6]*RC[-5] -> 8091.8571428571422 | X62: =RC[-6]*RC[-6] -> 6241 | Y62: =RC[-12]*RC[-12] -> 0.35402500000000076 | Z62: =RC[-12]*RC[-12] -> 0.51020408163265196 | AA62: =RC[-12]*RC[-12] -> 122.57653061224485 | AB62: =RC[-12]*RC[-12] -> 59.510204081632672 | AC62: =RC[-12]*RC[-12] -> 10491.612244897957
A63: 71046 | B63: 北京 | C63: 216 | D63: 重度污染 | E63: 2.78 | F63: 12 | G63: 61 | H63: 44 | I63: 286 | J63: 269 | L63: 2013-06-30T11:00:00.000 | M63: =RC[-8]-R[3]C[-8] -> 5.5000000000000604E-2 | N63: =RC[-8]-R[3]C[-8] -> 1.7142857142857135 | O63: =RC[-8]-R[3]C[-8] -> 6.0714285714285694 | P63: =RC[-8]-R[3]C[-8] -> 24.285714285714285 | Q63: =RC[-8]-R[3]C[-8] -> 78.428571428571416 | R63: =RC[-8]-R[3]C[-8] -> 66 | S63: =RC[-6]*RC[-1] -> 3.6300000000000399 | T63: =RC[-6]*RC[-2] -> 113.1428571428571 | U63: =RC[-6]*RC[-3] -> 400.71428571428555 | V63: =RC[-6]*RC[-4] -> 1602.8571428571429 | W63: =RC[-6]*RC[-5] -> 5176.2857142857138 | X63: =RC[-6]*RC[-6] -> 4356 | Y63: =RC[-12]*RC[-12] -> 3.0250000000000663E-3 | Z63: =RC[-12]*RC[-12] -> 2.9387755102040791 | AA63: =RC[-12]*RC[-12] -> 36.862244897959158 | AB63: =RC[-12]*RC[-12] -> 589.79591836734687 | AC63: =RC[-12]*RC[-12] -> 6151.0408163265283
A64: 71122 | B64: 北京 | C64: 222 | D64: 重度污染 | E64: 2.33 | F64: 10 | G64: 49 | H64: 74 | I64: 274 | J64: 241 | L64: 2013-06-30T12:00:00.000 | M64: =RC[-8]-R[2]C[-8] -> -0.39499999999999913 | N64: =RC[-8]-R[2]C[-8] -> -0.28571428571428648 | O64: =RC[-8]-R[2]C[-8] -> -5.9285714285714306 | P64: =RC[-8]-R[2]C[-8] -> 54.285714285714285 | Q64: =RC[-8]-R[2]C[-8] -> 66.428571428571416 | R64: =RC[-8]-R[2]C[-8] -> 38 | S64: =RC[-6]*RC[-1] -> -15.009999999999966 | T64: =RC[-6]*RC[-2] -> -10.857142857142886 | U64: =RC[-6]*RC[-3] -> -225.28571428571436 | V64: =RC[-6]*RC[-4] -> 2062.8571428571427 | W64: =RC[-6]*RC[-5] -> 2524.2857142857138 | X64: =RC[-6]*RC[-6] -> 1444 | Y64: =RC[-12]*RC[-12] -> 0.1560249999999993 | Z64: =RC[-12]*RC[-12] -> 8.1632653061224927E-2 | AA64: =RC[-12]*RC[-12] -> 35.147959183673493 | AB64: =RC[-12]*RC[-12] -> 2946.9387755102039 | AC64: =RC[-12]*RC[-12] -> 4412.7551020408146
A65: 71198 | B65: 北京 | C65: 228 | D65: 重度污染 | E65: 2.0099999999999998 | F65: 9 | G65: 42 | H65: 90 | I65: 281 | J65: 230 | L65: 2013-06-30T13:00:00.000 | M65: =RC[-8]-R[1]C[-8] -> -0.71499999999999941 | N65: =RC[-8]-R[1]C[-8] -> -1.2857142857142865 | O65: =RC[-8]-R[1]C[-8] -> -12.928571428571431 | P65: =RC[-8]-R[1]C[-8] -> 70.285714285714278 | Q65: =RC[-8]-R[1]C[-8] -> 73.428571428571416 | R65: =RC[-8]-R[1]C[-8] -> 27 | S65: =RC[-6]*RC[-1] -> -19.304999999999986 | T65: =RC[-6]*RC[-2] -> -34.714285714285737 | U65: =RC[-6]*RC[-3] -> -349.07142857142861 | V65: =RC[-6]*RC[-4] -> 1897.7142857142856 | W65: =RC[-6]*RC[-5] -> 1982.5714285714282 | X65: =RC[-6]*RC[-6] -> 729 | Y65: =RC[-12]*RC[-12] -> 0.51122499999999915 | Z65: =RC[-12]*RC[-12] -> 1.653061224489798 | AA65: =RC[-12]*RC[-12] -> 167.14795918367352 | AB65: =RC[-12]*RC[-12] -> 4940.0816326530603 | AC65: =RC[-12]*RC[-12] -> 5391.7551020408146
E66: =SUM(R[-14]C:R[-1]C)/14 -> 2.7249999999999992 | F66: =SUM(R[-14]C:R[-1]C)/14 -> 10.285714285714286 | G66: =SUM(R[-14]C:R[-1]C)/14 -> 54.928571428571431 | H66: =SUM(R[-14]C:R[-1]C)/14 -> 19.714285714285715 | I66: =SUM(R[-14]C:R[-1]C)/14 -> 207.57142857142858 | J66: =SUM(R[-14]C:R[-1]C)/14 -> 203 | S66: =SUM(R[-14]C:R[-1]C) -> 67.139999999999958 | T66: =SUM(R[-14]C:R[-1]C) -> 468.00000000000006 | U66: =SUM(R[-14]C:R[-1]C) -> 1139.9999999999998 | V66: =SUM(R[-14]C:R[-1]C) -> 7910.9999999999991 | W66: =SUM(R[-14]C:R[-1]C) -> 31431